{
  "case_id": 43641,
  "fetched_at": "2025-10-22T00:37:48.354477",
  "case_data": {
    "attorney_orgs": [],
    "available_documents": [],
    "case_defendants": [],
    "case_ongoing": "Yes",
    "case_status": "In Process (Public)",
    "case_types": [
      "Election/Voting Rights"
    ],
    "cause_other": "",
    "causes": [],
    "class_action_granted": null,
    "class_action_sought": null,
    "closing_year": null,
    "constitutional_clause": [],
    "content_of_injunction": [],
    "court": "District of Arizona",
    "custom_issues": [],
    "defendant_payment": "",
    "defendant_type": [],
    "docket_status": "Complete as of retrieval date",
    "facility_type": [],
    "filing_date": "2022-03-31",
    "filing_year": 2022,
    "id": 43641,
    "injunction_duration": "",
    "issues": [],
    "last_checked_date": null,
    "main_docket": {
      "id": 56562,
      "docket_entries": [
        {
          "row_number": 1382,
          "id": 9262920,
          "entry_number": "721",
          "date_filed": "2024-05-02T00:00:00-04:00",
          "attachments": null,
          "url": "https://www.courtlistener.com/docket/63203919/721/mi-familia-vota-v-fontes/",
          "recap_pdf_url": "https://www.courtlistener.com/recap/gov.uscourts.azd.1292039/gov.uscourts.azd.1292039.721.0.pdf",
          "pacer_doc_id": "025027666886",
          "description": "MOTION to Intervene by Republican Party of Arizona. (Attachments: # 1 Proposed Order)(Gould, Andrew) (Entered: 05/02/2024)"
        },
        {
          "row_number": 1418,
          "id": 9262938,
          "entry_number": "738",
          "date_filed": "2024-05-31T00:00:00-04:00",
          "attachments": null,
          "url": "https://www.courtlistener.com/docket/63203919/738/mi-familia-vota-v-fontes/",
          "recap_pdf_url": "https://www.courtlistener.com/recap/gov.uscourts.azd.1292039/gov.uscourts.azd.1292039.738.0.pdf",
          "pacer_doc_id": "025027794179",
          "description": "RESPONSE in Opposition re: 730 MOTION to Stay Partial Stay of Injunction Pending Appeal Certain Non-US Plaintiffs' Opposition to Intervenor-Defendants' Motion to Partially Stay the Injunction Pending Appeal filed by Arizona Democratic Party, Democratic National Committee. (Samuels, Bruce) (Entered: 05/31/2024)"
        },
        {
          "row_number": 1417,
          "id": 9262939,
          "entry_number": "737",
          "date_filed": "2024-05-31T00:00:00-04:00",
          "attachments": null,
          "url": "https://www.courtlistener.com/docket/63203919/737/mi-familia-vota-v-fontes/",
          "recap_pdf_url": "https://www.courtlistener.com/recap/gov.uscourts.azd.1292039/gov.uscourts.azd.1292039.737.0.pdf",
          "pacer_doc_id": "025027790907",
          "description": "RESPONSE in Opposition re: 730 MOTION to Stay Partial Stay of Injunction Pending Appeal filed by United States of America. (Turner, Margaret) (Entered: 05/31/2024)"
        },
        {
          "row_number": 1428,
          "id": 9262940,
          "entry_number": "742",
          "date_filed": "2024-06-03T00:00:00-04:00",
          "attachments": null,
          "url": "https://www.courtlistener.com/docket/63203919/742/mi-familia-vota-v-fontes/",
          "recap_pdf_url": "https://www.courtlistener.com/recap/gov.uscourts.azd.1292039/gov.uscourts.azd.1292039.742.0.pdf",
          "pacer_doc_id": "025027802335",
          "description": "REPRESENTATION STATEMENT by Republican National Committee re: 723 Notice of Appeal. (Basile, Thomas) (Entered: 06/03/2024)"
        },
        {
          "row_number": 1421,
          "id": 9262943,
          "entry_number": "739",
          "date_filed": "2024-06-03T00:00:00-04:00",
          "attachments": null,
          "url": "https://www.courtlistener.com/docket/63203919/739/mi-familia-vota-v-fontes/",
          "recap_pdf_url": "https://www.courtlistener.com/recap/gov.uscourts.azd.1292039/gov.uscourts.azd.1292039.739.0.pdf",
          "pacer_doc_id": "025027801851",
          "description": "NOTICE OF APPEAL to 9th Circuit Court of Appeals re: 720 Judgment,,,,,, by Arizona, State of, Kris Mayes. Filing fee received: $ 605.00, receipt number AAZDC-23110225. (Whitaker, Joshua) (Entered: 06/03/2024)"
        },
        {
          "row_number": 1430,
          "id": 9262944,
          "entry_number": "743",
          "date_filed": "2024-06-05T00:00:00-04:00",
          "attachments": null,
          "url": "https://www.courtlistener.com/docket/63203919/743/mi-familia-vota-v-fontes/",
          "recap_pdf_url": "https://www.courtlistener.com/recap/gov.uscourts.azd.1292039/gov.uscourts.azd.1292039.743.0.pdf",
          "pacer_doc_id": "025027815561",
          "description": "REPLY to Response to Motion re: 726 MOTION to Vacate in Part Pursuant to Federal Rule of Civil Procedure 60 filed by Chicanos Por La Causa, Chicanos Por La Causa Action Fund, Poder Latinx. (Sherman, Jonathan) (Entered: 06/05/2024)"
        },
        {
          "row_number": 1433,
          "id": 9262947,
          "entry_number": "744",
          "date_filed": "2024-06-06T00:00:00-04:00",
          "attachments": null,
          "url": "https://www.courtlistener.com/docket/63203919/744/mi-familia-vota-v-fontes/",
          "recap_pdf_url": "https://www.courtlistener.com/recap/gov.uscourts.azd.1292039/gov.uscourts.azd.1292039.744.0.pdf",
          "pacer_doc_id": "025027817635",
          "description": "NOTICE re: Waiver of Reply by Warren Petersen, Republican National Committee, Ben Toma re: 730 MOTION to Stay Partial Stay of Injunction Pending Appeal . (Basile, Thomas) (Entered: 06/06/2024)"
        },
        {
          "row_number": 1440,
          "id": 9262948,
          "entry_number": "748",
          "date_filed": "2024-06-10T00:00:00-04:00",
          "attachments": null,
          "url": "https://www.courtlistener.com/docket/63203919/748/mi-familia-vota-v-fontes/",
          "recap_pdf_url": "https://www.courtlistener.com/recap/gov.uscourts.azd.1292039/gov.uscourts.azd.1292039.748.0.pdf",
          "pacer_doc_id": "025027830887",
          "description": "Additional Attachments to Main Document re: 745 Reply to Response to Motion by Movant Republican Party of Arizona. (Gould, Andrew) (Entered: 06/10/2024)"
        },
        {
          "row_number": 1439,
          "id": 9262949,
          "entry_number": "747",
          "date_filed": "2024-06-10T00:00:00-04:00",
          "attachments": null,
          "url": "https://www.courtlistener.com/docket/63203919/747/mi-familia-vota-v-fontes/",
          "recap_pdf_url": "https://www.courtlistener.com/recap/gov.uscourts.azd.1292039/gov.uscourts.azd.1292039.747.0.pdf",
          "pacer_doc_id": "025027830300",
          "description": "Additional Attachments to Main Document re: 745 Reply to Response to Motion by Movant Republican Party of Arizona. (Gould, Andrew) (Entered: 06/10/2024)"
        },
        {
          "row_number": 1462,
          "id": 9262960,
          "entry_number": "758",
          "date_filed": "2024-07-11T00:00:00-04:00",
          "attachments": null,
          "url": "https://www.courtlistener.com/docket/63203919/758/mi-familia-vota-v-fontes/",
          "recap_pdf_url": null,
          "pacer_doc_id": "025027966023",
          "description": "NOTICE of Attorney Withdrawal Jennifer J. Yun filed by Jennifer J Yun. (Yun, Jennifer) (Entered: 07/11/2024)"
        },
        {
          "row_number": 1468,
          "id": 9262962,
          "entry_number": "760",
          "date_filed": "2024-07-18T00:00:00-04:00",
          "attachments": null,
          "url": "https://www.courtlistener.com/docket/63203919/760/mi-familia-vota-v-fontes/",
          "recap_pdf_url": "https://www.courtlistener.com/recap/gov.uscourts.azd.1292039/gov.uscourts.azd.1292039.760.0.pdf",
          "pacer_doc_id": "025028082462",
          "description": "ORDER of USCA - The motion to partially stay the district court's judgment is granted in part and denied in part re: 24-3188 as to 723 Notice of Appeal, 24-3559 as to 739 Notice of Appeal, 24-4029 as to 754 Notice of Cross Appeal. (DXD) (Entered: 08/06/2024)"
        },
        {
          "row_number": 586,
          "id": 3567989,
          "entry_number": "363",
          "date_filed": "2023-04-26T00:00:00-04:00",
          "attachments": [],
          "url": "https://www.courtlistener.com/docket/63203919/363/mi-familia-vota-v-fontes/",
          "recap_pdf_url": "https://www.courtlistener.com/recap/gov.uscourts.azd.1292039/gov.uscourts.azd.1292039.363.0.pdf",
          "pacer_doc_id": "025026266562",
          "description": "ORDER granting Speaker of the House Ben Toma and Senate President Warren Petersen's Motion to Intervene as Defendants (Doc. 348 ). Signed by Senior Judge Susan R Bolton on 4/29/23. (DXD) (Entered: 04/26/2023)"
        },
        {
          "row_number": 1133,
          "id": 10262005,
          "entry_number": "609",
          "date_filed": "2023-10-31T00:00:00-04:00",
          "attachments": null,
          "url": "https://www.courtlistener.com/docket/10638792/609/mi-familia-vota-v-fontes/",
          "recap_pdf_url": null,
          "pacer_doc_id": "025026955387",
          "description": "JOINT PRETRIAL ORDER approved and signed by Senior Judge Susan R. Bolton on 10/31/2023. See attached Order for complete details.(ESG) (Entered: 10/31/2023)"
        },
        {
          "row_number": 1137,
          "id": 10262006,
          "entry_number": "610",
          "date_filed": "2023-10-31T00:00:00-04:00",
          "attachments": null,
          "url": "https://www.courtlistener.com/docket/10638792/610/mi-familia-vota-v-fontes/",
          "recap_pdf_url": null,
          "pacer_doc_id": "025026955413",
          "description": "SUPPLEMENT TO THE JOINT PRETRIAL ORDER approved and signed by Senior Judge Susan R. Bolton on 10/31/2023. See attached pdf for complete details.(ESG) (Entered: 10/31/2023)"
        },
        {
          "row_number": 1139,
          "id": 10262007,
          "entry_number": "611",
          "date_filed": "2023-10-31T00:00:00-04:00",
          "attachments": null,
          "url": "https://www.courtlistener.com/docket/10638792/611/mi-familia-vota-v-fontes/",
          "recap_pdf_url": null,
          "pacer_doc_id": "025026956570",
          "description": "RESPONSE in Opposition re: 557 MOTION for Entry of Judgment under Rule 54(b) filed by United States of America. (Jhaveri, Sejal) (Entered: 10/31/2023)"
        },
        {
          "row_number": 1123,
          "id": 10262000,
          "entry_number": "604",
          "date_filed": "2023-10-26T00:00:00-04:00",
          "attachments": null,
          "url": "https://www.courtlistener.com/docket/10638792/604/mi-familia-vota-v-fontes/",
          "recap_pdf_url": null,
          "pacer_doc_id": "025026943909",
          "description": "NOTICE of Appearance by Evan Omi on behalf of Arizona Asian American Native Hawaiian And Pacific Islander For Equity Coalition. (Omi, Evan) (Entered: 10/26/2023)"
        },
        {
          "row_number": 1125,
          "id": 10262001,
          "entry_number": "605",
          "date_filed": "2023-10-27T00:00:00-04:00",
          "attachments": null,
          "url": "https://www.courtlistener.com/docket/10638792/605/mi-familia-vota-v-fontes/",
          "recap_pdf_url": null,
          "pacer_doc_id": "025026944795",
          "description": "TRANSCRIPT REQUEST by United States of America for proceedings held on 10/24/2023, Judge Susan R Bolton hearing judge(s). (Jhaveri, Sejal) (Entered: 10/27/2023)"
        },
        {
          "row_number": 1127,
          "id": 10262002,
          "entry_number": "606",
          "date_filed": "2023-10-27T00:00:00-04:00",
          "attachments": null,
          "url": "https://www.courtlistener.com/docket/10638792/606/mi-familia-vota-v-fontes/",
          "recap_pdf_url": null,
          "pacer_doc_id": "025026948126",
          "description": "TRANSCRIPT REQUEST by Promise Arizona, Southwest Voter Registration Education Project for proceedings held on 10/24/2023, Judge Susan R Bolton hearing judge(s). (Cervantes, Erika) (Entered: 10/27/2023)"
        },
        {
          "row_number": 1129,
          "id": 10262003,
          "entry_number": "607",
          "date_filed": "2023-10-30T00:00:00-04:00",
          "attachments": null,
          "url": "https://www.courtlistener.com/docket/10638792/607/mi-familia-vota-v-fontes/",
          "recap_pdf_url": null,
          "pacer_doc_id": "025026953522",
          "description": "SUPPLEMENT Supplement to Proposed Joint Pretrial Order re: 571 Notice of Filing - Proposed Pretrial Order, by Consol Plaintiffs ADRC Action, Arizona Coalition for Change, Arizona Students' Association, Gila River Indian Community, Inter Tribal Council of Arizona Incorporated, League of United Latin American Citizens Arizona, Living United for Change in Arizona, San Carlos Apache Tribe. (Lang, Danielle) (Entered: 10/30/2023)"
        },
        {
          "row_number": 31,
          "id": 10261508,
          "entry_number": "112",
          "date_filed": "2022-09-09T00:00:00-04:00",
          "attachments": null,
          "url": "https://www.courtlistener.com/docket/10638792/112/mi-familia-vota-v-fontes/",
          "recap_pdf_url": null,
          "pacer_doc_id": "025025378589",
          "description": "Corporate Disclosure Statement by Arizona Coalition for Change. (Fenske, Daniel) (Entered: 09/09/2022)"
        },
        {
          "row_number": 263,
          "id": 10261613,
          "entry_number": "217",
          "date_filed": "2023-01-12T00:00:00-05:00",
          "attachments": null,
          "url": "https://www.courtlistener.com/docket/10638792/217/mi-familia-vota-v-fontes/",
          "recap_pdf_url": null,
          "pacer_doc_id": "025025859881",
          "description": "ORDER: On January 11, 2023, Defendant Cochise County Recorder filed a Request for an Extension of Time to Respond to Plaintiffs' First Request for Production of Documents and First Set of Interrogatories (Doc. 213 ). IT IS ORDERED that the Request for an Extension of Time to Respond to Plaintiffs' First Request for Production of Documents and First Set of Interrogatories. will be denied within three days of the date of this Order if counsel does not comply with the ECF Administrative Policies and Procedures Manual, Section II(G), specifically, subparagraph 1b. Signed by Senior Judge Susan R Bolton on 1/12/23. (MAW) (Entered: 01/12/2023)"
        },
        {
          "row_number": 373,
          "id": 10261663,
          "entry_number": "267",
          "date_filed": "2023-02-09T00:00:00-05:00",
          "attachments": null,
          "url": "https://www.courtlistener.com/docket/10638792/267/mi-familia-vota-v-fontes/",
          "recap_pdf_url": null,
          "pacer_doc_id": "025025967388",
          "description": "RESPONSE to Motion re: 197 MOTION to Dismiss for Lack of Jurisdiction MOTION to Dismiss for Failure to State a Claim [RESPONSE BY PLAINTIFFS TOHONO OODHAM NATION, GILA RIVER INDIAN COMMUNITY, KEANU STEVENS, ALANNA SIQUIEROS, AND LADONNA JACKET TO DEFENDANTS ATTORNEY GENERAL MARK BRNOVICH AND STATE OF ARIZONAS MOTION TO DISMISS UNDER RULES 12(B)(1) AND (B)(6)] filed by Gila River Indian Community, LaDonna Jacket, Alanna Siquieros, Keanu Stevens, Tohono O'odham Nation. (Attachments: # 1 Exhibit A)(Rosenbaum, David) (Entered: 02/09/2023)"
        },
        {
          "row_number": 567,
          "id": 10261750,
          "entry_number": "354",
          "date_filed": "2023-04-18T00:00:00-04:00",
          "attachments": null,
          "url": "https://www.courtlistener.com/docket/10638792/354/mi-familia-vota-v-fontes/",
          "recap_pdf_url": null,
          "pacer_doc_id": "025026239306",
          "description": "RESPONSE to Motion re: 348 MOTION to Intervene Speaker of the House Ben Toma and Senate President Warren Petersen's Motion to Intervene as Defendants filed by ADRC Action, Arizona Asian American Native Hawaiian And Pacific Islander For Equity Coalition, Arizona Coalition for Change, Arizona Democratic Party, Arizona Students' Association, Chicanos Por La Causa, Chicanos Por La Causa Action Fund, Democratic National Committee, Gila River Indian Community, Inter Tribal Council of Arizona Incorporated, LaDonna Jacket, Voto Latino, League of United Latin American Citizens Arizona, Living United for Change in Arizona, Mi Familia Vota, Poder Latinx, Promise Arizona, San Carlos Apache Tribe, Alanna Siquieros, Keanu Stevens, Tohono O'odham Nation. (Barton, James) (Entered: 04/18/2023)"
        },
        {
          "row_number": 1443,
          "id": 10262145,
          "entry_number": "749",
          "date_filed": "2024-06-18T00:00:00-04:00",
          "attachments": null,
          "url": "https://www.courtlistener.com/docket/10638792/749/mi-familia-vota-v-fontes/",
          "recap_pdf_url": null,
          "pacer_doc_id": null,
          "description": "ORDER: On May 9, 2024, the Court issued an Order directing the parties to remove the exhibits admitted and depositions presented during the bench trial in this matter from Judge Boltons chambers within 30 days (by June 10, 2024), or the Clerk may destroy or otherwise dispose of those exhibits. As of this date, Plaintiffs' counsel have failed to do so. Therefore, IT IS ORDERED Plaintiffs' counsel shall pick up their exhibits by Thursday, July 18, 2024, or said exhibits shall be destroyed by the Clerk of the Court. Counsel shall immediately email chambers mailbox at bolton_chambers@azd.uscourts.gov to make arrangements with staff to retrieve their exhibits and depositions. Ordered by Senior Judge Susan R. Bolton on 6/18/2024. This is a TEXT ENTRY ONLY. There is no PDF document associated with this entry. (KMB) (Entered: 06/18/2024)"
        },
        {
          "row_number": 1446,
          "id": 10262146,
          "entry_number": "750",
          "date_filed": "2024-06-25T00:00:00-04:00",
          "attachments": null,
          "url": "https://www.courtlistener.com/docket/10638792/750/mi-familia-vota-v-fontes/",
          "recap_pdf_url": null,
          "pacer_doc_id": "025027895096",
          "description": "ORDER denying 726 Plaintiffs Chicanos Por La Causa, Chicanos Por La Causa Action Fund, and Poder Latinx's Rule 60(b) Motion to Partially Vacate the Final Judgment. See attached PDF for complete details. Signed by Senior Judge Susan R. Bolton on 6/25/2024. (KMB) (Entered: 06/25/2024)"
        },
        {
          "row_number": 1563,
          "id": 3567567,
          "entry_number": null,
          "date_filed": "2021-09-29T00:00:00-04:00",
          "attachments": [],
          "url": "https://www.courtlistener.com",
          "recap_pdf_url": null,
          "pacer_doc_id": null,
          "description": "Remark: Pro hac vice motion(s) granted for Joseph Posimato on behalf of Intervenor Democratic Party Committees. This is a TEXT ENTRY ONLY. There is no PDF document associated with this entry. (BAS)"
        },
        {
          "row_number": 136,
          "id": 3567766,
          "entry_number": "160",
          "date_filed": "2022-10-27T00:00:00-04:00",
          "attachments": [],
          "url": "https://www.courtlistener.com/docket/63203919/160/mi-familia-vota-v-fontes/",
          "recap_pdf_url": "https://www.courtlistener.com/recap/gov.uscourts.azd.1292039/gov.uscourts.azd.1292039.160.0.pdf",
          "pacer_doc_id": "025025127348",
          "description": "ORDER: Defendant, the Republican National Committee's Motion to Intervene (Doc. 101 ), is denied as moot. Signed by Senior Judge Susan R Bolton on 10/27/2022. (CLM) (Entered: 10/27/2022)"
        },
        {
          "row_number": 180,
          "id": 3567791,
          "entry_number": "180",
          "date_filed": "2022-11-23T00:00:00-05:00",
          "attachments": [],
          "url": "https://www.courtlistener.com/docket/63203919/180/mi-familia-vota-v-fontes/",
          "recap_pdf_url": "https://www.courtlistener.com/recap/gov.uscourts.azd.1292039/gov.uscourts.azd.1292039.180.0.pdf",
          "pacer_doc_id": "025025499536",
          "description": "REPLY to Response to Motion re: 127 MOTION to Dismiss for Failure to State a Claim MOTION to Dismiss for Lack of Jurisdiction filed by Arizona, State of, Arizona, State of, Mark Brnovich, Mark Brnovich. (Ensign, Drew) (Entered: 11/23/2022)"
        },
        {
          "row_number": 1622,
          "id": 3567924,
          "entry_number": null,
          "date_filed": "2023-02-15T00:00:00-05:00",
          "attachments": [],
          "url": "https://www.courtlistener.com",
          "recap_pdf_url": null,
          "pacer_doc_id": null,
          "description": "Notice of Deficiency (Text Only)"
        },
        {
          "row_number": 646,
          "id": 3568018,
          "entry_number": "390",
          "date_filed": "2023-06-05T00:00:00-04:00",
          "attachments": [],
          "url": "https://www.courtlistener.com/docket/63203919/390/mi-familia-vota-v-fontes/",
          "recap_pdf_url": "https://www.courtlistener.com/recap/gov.uscourts.azd.1292039/gov.uscourts.azd.1292039.390.0.pdf",
          "pacer_doc_id": "025026422461",
          "description": "*Cross MOTION for Summary Judgment, RESPONSE to Motion re: 364 MOTION for Partial Summary Judgment filed by Gila River Indian Community, LaDonna Jacket, Alanna Siquieros, Keanu Stevens, Tohono O'odham Nation. (Rosenbaum, David) *Modified to add motion on 6/6/2023 (REK). (Entered: 06/05/2023)"
        },
        {
          "row_number": 648,
          "id": 3568019,
          "entry_number": "391",
          "date_filed": "2023-06-05T00:00:00-04:00",
          "attachments": [
            {
              "pdf_url": "https://www.courtlistener.com/recap/gov.uscourts.azd.1292039/gov.uscourts.azd.1292039.391.1.pdf",
              "recap_id": 352088193,
              "pacer_url": "https://ecf.azd.uscourts.gov/doc1/025026422500?caseid=1292039",
              "description": "Memorandum",
              "attachment_number": 1
            },
            {
              "pdf_url": "https://www.courtlistener.com/recap/gov.uscourts.azd.1292039/gov.uscourts.azd.1292039.391.2.pdf",
              "recap_id": 352088194,
              "pacer_url": "https://ecf.azd.uscourts.gov/doc1/025026422501?caseid=1292039",
              "description": "Rule 56(d) Declaration",
              "attachment_number": 2
            }
          ],
          "url": "https://www.courtlistener.com/docket/63203919/391/mi-familia-vota-v-fontes/",
          "recap_pdf_url": null,
          "pacer_doc_id": "025026422499",
          "description": "*MOTION for Partial Summary Judgment, RESPONSE to Motion re: 364 MOTION for Partial Summary Judgment, 367 MOTION for Partial Summary Judgment, 369 Joinder by United States of America. (Attachments: # 1 Memorandum, # 2 Rule 56(d) Declaration)(Brailey, Emily) *Modified to add response on 6/6/2023 (REK). (Entered: 06/05/2023)"
        },
        {
          "row_number": 658,
          "id": 3568024,
          "entry_number": "396",
          "date_filed": "2023-06-05T00:00:00-04:00",
          "attachments": [],
          "url": "https://www.courtlistener.com/docket/63203919/396/mi-familia-vota-v-fontes/",
          "recap_pdf_url": "https://www.courtlistener.com/recap/gov.uscourts.azd.1292039/gov.uscourts.azd.1292039.396.0.pdf",
          "pacer_doc_id": "025026422565",
          "description": "*Cross MOTION for Partial Summary Judgment, RESPONSE to Motion re: 364 MOTION for Partial Summary Judgment filed by Arizona Asian American Native Hawaiian And Pacific Islander For Equity Coalition. (Makker, Amit) *Modified to add motion on 6/6/2023 (REK). (Entered: 06/05/2023)"
        },
        {
          "row_number": 792,
          "id": 3568088,
          "entry_number": "456",
          "date_filed": "2023-07-12T00:00:00-04:00",
          "attachments": [],
          "url": "https://www.courtlistener.com/docket/63203919/456/mi-familia-vota-v-fontes/",
          "recap_pdf_url": null,
          "pacer_doc_id": "025026559404",
          "description": "NOTICE of Appearance by Scott Day Freeman on behalf of Arizona Free Enterprise Club. (Freeman, Scott) (Entered: 07/12/2023)"
        },
        {
          "row_number": 870,
          "id": 3568128,
          "entry_number": "491",
          "date_filed": "2023-07-28T00:00:00-04:00",
          "attachments": [],
          "url": "https://www.courtlistener.com/docket/63203919/491/mi-familia-vota-v-fontes/",
          "recap_pdf_url": null,
          "pacer_doc_id": "025026622868",
          "description": "NOTICE of Service of Discovery filed by ADRC Action, Arizona Coalition for Change, Arizona Students' Association, League of United Latin American Citizens Arizona, Living United for Change in Arizona, San Carlos Apache Tribe. (Ferguson, Robert) (Entered: 07/28/2023)"
        },
        {
          "row_number": 1038,
          "id": 3568212,
          "entry_number": "567",
          "date_filed": "2023-10-16T00:00:00-04:00",
          "attachments": [
            {
              "recap_id": 375470799,
              "pacer_url": "https://ecf.azd.uscourts.gov/doc1/025026904361?caseid=1292039",
              "description": "Exhibit 1",
              "attachment_number": 1
            },
            {
              "recap_id": 375470800,
              "pacer_url": "https://ecf.azd.uscourts.gov/doc1/025026904362?caseid=1292039",
              "description": "Exhibit 2",
              "attachment_number": 2
            },
            {
              "recap_id": 375470801,
              "pacer_url": "https://ecf.azd.uscourts.gov/doc1/025026904363?caseid=1292039",
              "description": "Exhibit 3",
              "attachment_number": 3
            },
            {
              "recap_id": 375470802,
              "pacer_url": "https://ecf.azd.uscourts.gov/doc1/025026904364?caseid=1292039",
              "description": "Exhibit 4",
              "attachment_number": 4
            },
            {
              "recap_id": 375470803,
              "pacer_url": "https://ecf.azd.uscourts.gov/doc1/025026904365?caseid=1292039",
              "description": "Exhibit 5",
              "attachment_number": 5
            },
            {
              "recap_id": 375470804,
              "pacer_url": "https://ecf.azd.uscourts.gov/doc1/025026904366?caseid=1292039",
              "description": "Exhibit 6",
              "attachment_number": 6
            }
          ],
          "url": "https://www.courtlistener.com/docket/63203919/567/mi-familia-vota-v-fontes/",
          "recap_pdf_url": "https://www.courtlistener.com/recap/gov.uscourts.azd.1292039/gov.uscourts.azd.1292039.567.0.pdf",
          "pacer_doc_id": "025026904360",
          "description": "MOTION in Limine re: to Exclude Witnesses and Materials not Timely Disclosed by Chicanos Por La Causa, Chicanos Por La Causa Action Fund, Poder Latinx. (Attachments: # 1 Exhibit 1, # 2 Exhibit 2, # 3 Exhibit 3, # 4 Exhibit 4, # 5 Exhibit 5, # 6 Exhibit 6)(Freedman, John) (Entered: 10/16/2023)"
        },
        {
          "row_number": 1250,
          "id": 3739500,
          "entry_number": "662",
          "date_filed": "2023-11-13T00:00:00-05:00",
          "attachments": [],
          "url": "https://www.courtlistener.com/docket/63203919/662/mi-familia-vota-v-fontes/",
          "recap_pdf_url": null,
          "pacer_doc_id": "025027024814",
          "description": "NOTICE OF FILING OF OFFICIAL AMENDED TRANSCRIPT of BENCH TRIAL - DAY 2 (AM SESSION) (Pages 288 through 398) proceedings held on 11/07/2023 before Judge SUSAN R. BOLTON. [Court Reporter: Elva Cruz-Lauer, RMR, CRR, Telephone number (602) 322-7245]. Amended as to page 293 and page 350 re: Exhibit 266. The ordering party receives the transcript directly from the Court Reporter. Therefore, transcripts should not be viewed through Pacer. A non-ordering party may view a transcript at the court's public terminal or purchased through the Court Reporter/Transcriber by filing a Transcript Order Form on the docket before the deadline for Release of Transcript Restriction. After that date it may be obtained through Pacer. Redaction Request due 12/8/2023. Redacted Transcript Deadline set for 12/18/2023. Release of Transcript Restriction set for 2/15/2024. (RAP) (Entered: 11/17/2023)"
        },
        {
          "row_number": 1376,
          "id": 9262919,
          "entry_number": "719",
          "date_filed": "2024-04-30T00:00:00-04:00",
          "attachments": null,
          "url": "https://www.courtlistener.com/docket/63203919/719/mi-familia-vota-v-fontes/",
          "recap_pdf_url": null,
          "pacer_doc_id": "025027654989",
          "description": "STATUS REPORT and Proposed Judgment by Voto Latino, Mi Familia Vota. (Attachments: # 1 Proposed Judgment)(Dodge, Christopher) (Entered: 04/30/2024)"
        },
        {
          "row_number": 1454,
          "id": 9262954,
          "entry_number": "754",
          "date_filed": "2024-06-28T00:00:00-04:00",
          "attachments": null,
          "url": "https://www.courtlistener.com/docket/63203919/754/mi-familia-vota-v-fontes/",
          "recap_pdf_url": "https://www.courtlistener.com/recap/gov.uscourts.azd.1292039/gov.uscourts.azd.1292039.754.0.pdf",
          "pacer_doc_id": "025027917456",
          "description": "NOTICE OF CROSS APPEAL to 9th Circuit Court of Appeals re: 709 Order, 720 Judgment by Promise Arizona, Southwest Voter Registration Education Project. Filing fee $605.00, receipt number AAZDC-23197873. (Attachments: # 1 Attachment Representation Statement) (Herrera, Ernest) (Entered: 06/28/2024)"
        },
        {
          "row_number": 29,
          "id": 10261507,
          "entry_number": "111",
          "date_filed": "2022-09-08T00:00:00-04:00",
          "attachments": null,
          "url": "https://www.courtlistener.com/docket/10638792/111/mi-familia-vota-v-fontes/",
          "recap_pdf_url": null,
          "pacer_doc_id": "025025373202",
          "description": "Corporate Disclosure Statement by Republican National Committee. (McGlone, James) (Entered: 09/08/2022)"
        },
        {
          "row_number": 37,
          "id": 10261511,
          "entry_number": "115",
          "date_filed": "2022-09-13T00:00:00-04:00",
          "attachments": null,
          "url": "https://www.courtlistener.com/docket/10638792/115/mi-familia-vota-v-fontes/",
          "recap_pdf_url": null,
          "pacer_doc_id": "025025389345",
          "description": "Corporate Disclosure Statement by Chicanos Por La Causa. (Adelman, Daniel) (Entered: 09/13/2022)"
        },
        {
          "row_number": 107,
          "id": 10261543,
          "entry_number": "147",
          "date_filed": "2022-10-07T00:00:00-04:00",
          "attachments": null,
          "url": "https://www.courtlistener.com/docket/10638792/147/mi-familia-vota-v-fontes/",
          "recap_pdf_url": null,
          "pacer_doc_id": "025025495996",
          "description": "Corporate Disclosure Statement by Immigration Reform Law Institute. (D'Andrea, Gina) (Entered: 10/07/2022)"
        },
        {
          "row_number": 169,
          "id": 10261571,
          "entry_number": "175",
          "date_filed": "2022-11-18T00:00:00-05:00",
          "attachments": null,
          "url": "https://www.courtlistener.com/docket/10638792/175/mi-familia-vota-v-fontes/",
          "recap_pdf_url": null,
          "pacer_doc_id": null,
          "description": "MINUTE ORDER: The Court has received inquiries from the public who wish to listen to the 12/15/2022 hearing. Members of the public or of the media seeking access are directed to email AZD-PIO@azd.uscourts.gov to obtain dialing instructions. Pursuant to Local Rule 43.1, participants are reminded that audiotaping court proceedings is prohibited. This is a TEXT ENTRY ONLY. There is no PDF document associated with this entry. (MAW) (Entered: 11/18/2022)"
        },
        {
          "row_number": 199,
          "id": 10261585,
          "entry_number": "189",
          "date_filed": "2022-12-19T00:00:00-05:00",
          "attachments": null,
          "url": "https://www.courtlistener.com/docket/10638792/189/mi-familia-vota-v-fontes/",
          "recap_pdf_url": null,
          "pacer_doc_id": "025025780648",
          "description": "Defendant Secretary of State Katie Hobbs' ANSWER to 169 Amended Complaint, of Poder Latinx and CPLC's Second Amended Complaint by Katie Hobbs.(Gaona, David) (Entered: 12/19/2022)"
        },
        {
          "row_number": 205,
          "id": 10261587,
          "entry_number": "191",
          "date_filed": "2022-12-21T00:00:00-05:00",
          "attachments": null,
          "url": "https://www.courtlistener.com/docket/10638792/191/mi-familia-vota-v-fontes/",
          "recap_pdf_url": null,
          "pacer_doc_id": "025025792765",
          "description": "TRANSCRIPT REQUEST by Promise Arizona, Southwest Voter Registration Education Project for proceedings held on 12/15/2022, Judge Susan R Bolton hearing judge(s). (Herrera, Ernest) (Entered: 12/21/2022)"
        },
        {
          "row_number": 249,
          "id": 10261606,
          "entry_number": "210",
          "date_filed": "2023-01-05T00:00:00-05:00",
          "attachments": null,
          "url": "https://www.courtlistener.com/docket/10638792/210/mi-familia-vota-v-fontes/",
          "recap_pdf_url": null,
          "pacer_doc_id": "025025834451",
          "description": "NOTICE OF ATTORNEY'S CHANGE OF ADDRESS/FIRM NAME by Jillian Laura Andrews. (Andrews, Jillian) (Entered: 01/05/2023)"
        },
        {
          "row_number": 265,
          "id": 10261614,
          "entry_number": "218",
          "date_filed": "2023-01-13T00:00:00-05:00",
          "attachments": null,
          "url": "https://www.courtlistener.com/docket/10638792/218/mi-familia-vota-v-fontes/",
          "recap_pdf_url": null,
          "pacer_doc_id": "025025862561",
          "description": "REQUEST re: Defendant Arizona County Recorders' First Request for an Extension of Time to Respond to Plaintiff's First Request for Production of Documents and First Set of Interrogatories by Defendant David W Stevens. (Attachments: # 1 Proposed Order Proposed Order Granting Def. First Extension)(Correa, Paul) (Entered: 01/13/2023)"
        },
        {
          "row_number": 279,
          "id": 10261620,
          "entry_number": "224",
          "date_filed": "2023-01-17T00:00:00-05:00",
          "attachments": null,
          "url": "https://www.courtlistener.com/docket/10638792/224/mi-familia-vota-v-fontes/",
          "recap_pdf_url": null,
          "pacer_doc_id": "025025870106",
          "description": "ORDER pursuant to 222 Stipulation: IT IS HEREBY ORDERED that the deadline for Plaintiffs to respond to Defendant Arizona Attorney General's Motion to Dismiss Under Rules 12(B)(1) and (B)(6) is extended to February 9, 2023. Signed by Senior Judge Susan R Bolton on 1/17/23. (MAW) (Entered: 01/17/2023)"
        },
        {
          "row_number": 289,
          "id": 10261625,
          "entry_number": "229",
          "date_filed": "2023-01-18T00:00:00-05:00",
          "attachments": null,
          "url": "https://www.courtlistener.com/docket/10638792/229/mi-familia-vota-v-fontes/",
          "recap_pdf_url": null,
          "pacer_doc_id": "025025879317",
          "description": "NOTICE of Service of Discovery filed by Stephen Richer. (O'Connor, Jack) (Entered: 01/18/2023)"
        },
        {
          "row_number": 323,
          "id": 10261640,
          "entry_number": "244",
          "date_filed": "2023-01-24T00:00:00-05:00",
          "attachments": null,
          "url": "https://www.courtlistener.com/docket/10638792/244/mi-familia-vota-v-fontes/",
          "recap_pdf_url": null,
          "pacer_doc_id": "025025898091",
          "description": "NOTICE re: Assurances by Dana Lewis Pinal County Recorder. (Mitchell, Jim) (Entered: 01/24/2023)"
        },
        {
          "row_number": 325,
          "id": 10261641,
          "entry_number": "245",
          "date_filed": "2023-01-24T00:00:00-05:00",
          "attachments": null,
          "url": "https://www.courtlistener.com/docket/10638792/245/mi-familia-vota-v-fontes/",
          "recap_pdf_url": null,
          "pacer_doc_id": "025025899005",
          "description": "NOTICE re: Notice of Written Assurance by Gabriella Cazares-Kelly . (Jurkowitz, Daniel) (Entered: 01/24/2023)"
        },
        {
          "row_number": 329,
          "id": 10261643,
          "entry_number": "247",
          "date_filed": "2023-01-24T00:00:00-05:00",
          "attachments": null,
          "url": "https://www.courtlistener.com/docket/10638792/247/mi-familia-vota-v-fontes/",
          "recap_pdf_url": null,
          "pacer_doc_id": "025025900178",
          "description": "NOTICE re: Notice of Written Assurance by Stephen Richer . (O'Connor, Jack) (Entered: 01/24/2023)"
        },
        {
          "row_number": 355,
          "id": 10261655,
          "entry_number": "259",
          "date_filed": "2023-02-01T00:00:00-05:00",
          "attachments": null,
          "url": "https://www.courtlistener.com/docket/10638792/259/mi-familia-vota-v-fontes/",
          "recap_pdf_url": null,
          "pacer_doc_id": "025025933524",
          "description": "NOTICE of Service of Discovery filed by Adrian Fontes. (Gaona, David) (Entered: 02/01/2023)"
        },
        {
          "row_number": 389,
          "id": 10261670,
          "entry_number": "274",
          "date_filed": "2023-02-10T00:00:00-05:00",
          "attachments": null,
          "url": "https://www.courtlistener.com/docket/10638792/274/mi-familia-vota-v-fontes/",
          "recap_pdf_url": null,
          "pacer_doc_id": "025025973154",
          "description": "NOTICE of Service of Discovery filed by Gila River Indian Community, LaDonna Jacket, Alanna Siquieros, Keanu Stevens, Tohono O'odham Nation. (Messer, Joshua) (Entered: 02/10/2023)"
        },
        {
          "row_number": 403,
          "id": 10261676,
          "entry_number": "280",
          "date_filed": "2023-02-10T00:00:00-05:00",
          "attachments": null,
          "url": "https://www.courtlistener.com/docket/10638792/280/mi-familia-vota-v-fontes/",
          "recap_pdf_url": null,
          "pacer_doc_id": "025025974188",
          "description": "NOTICE of Service of Discovery re: Service of Plaintiff's Initial Rule 26(a)(1) Disclosures by Chicanos Por La Causa, Chicanos Por La Causa Action Fund, Poder Latinx . (Karpatkin, Jeremy) Modified from Notice Other to Notice of Service of Discovery on 2/13/2023 (CLM). (Entered: 02/10/2023)"
        },
        {
          "row_number": 413,
          "id": 10261681,
          "entry_number": "285",
          "date_filed": "2023-02-13T00:00:00-05:00",
          "attachments": null,
          "url": "https://www.courtlistener.com/docket/10638792/285/mi-familia-vota-v-fontes/",
          "recap_pdf_url": null,
          "pacer_doc_id": "025025977344",
          "description": "NOTICE of Service of Discovery filed by Kristi Blair. (Esplin, Ryan) (Entered: 02/13/2023)"
        },
        {
          "row_number": 415,
          "id": 10261682,
          "entry_number": "286",
          "date_filed": "2023-02-13T00:00:00-05:00",
          "attachments": null,
          "url": "https://www.courtlistener.com/docket/10638792/286/mi-familia-vota-v-fontes/",
          "recap_pdf_url": null,
          "pacer_doc_id": "025025977375",
          "description": "NOTICE of Service of Discovery filed by Kristi Blair. (Esplin, Ryan) (Entered: 02/13/2023)"
        },
        {
          "row_number": 417,
          "id": 10261683,
          "entry_number": "287",
          "date_filed": "2023-02-13T00:00:00-05:00",
          "attachments": null,
          "url": "https://www.courtlistener.com/docket/10638792/287/mi-familia-vota-v-fontes/",
          "recap_pdf_url": null,
          "pacer_doc_id": "025025977766",
          "description": "NOTICE of Service of Discovery filed by Richard Garcia. (Mitchell, Jason) (Entered: 02/13/2023)"
        },
        {
          "row_number": 459,
          "id": 10261701,
          "entry_number": "305",
          "date_filed": "2023-02-16T00:00:00-05:00",
          "attachments": null,
          "url": "https://www.courtlistener.com/docket/10638792/305/mi-familia-vota-v-fontes/",
          "recap_pdf_url": null,
          "pacer_doc_id": "025025994538",
          "description": "NOTICE of Appearance by Joshua Michael Whitaker on behalf of Arizona, State of, Kris Mayes. (Whitaker, Joshua) *Modified filers on 3/9/2023 (DXD). (Entered: 02/16/2023)"
        },
        {
          "row_number": 573,
          "id": 10261753,
          "entry_number": "357",
          "date_filed": "2023-04-21T00:00:00-04:00",
          "attachments": null,
          "url": "https://www.courtlistener.com/docket/10638792/357/mi-familia-vota-v-fontes/",
          "recap_pdf_url": null,
          "pacer_doc_id": "025026251923",
          "description": "NOTICE of Attorney Withdrawal of John M. Geise filed by John Michael Geise. (Geise, John) (Entered: 04/21/2023)"
        },
        {
          "row_number": 603,
          "id": 10261766,
          "entry_number": "370",
          "date_filed": "2023-05-16T00:00:00-04:00",
          "attachments": null,
          "url": "https://www.courtlistener.com/docket/10638792/370/mi-familia-vota-v-fontes/",
          "recap_pdf_url": null,
          "pacer_doc_id": "025026343688",
          "description": "NOTICE re: Automatic Substitution of Public Entity by John S Halikowski . (Ward, Emily) (Entered: 05/16/2023)"
        },
        {
          "row_number": 635,
          "id": 10261781,
          "entry_number": "385",
          "date_filed": "2023-05-31T00:00:00-04:00",
          "attachments": null,
          "url": "https://www.courtlistener.com/docket/10638792/385/mi-familia-vota-v-fontes/",
          "recap_pdf_url": null,
          "pacer_doc_id": "025026403593",
          "description": "NOTICE of Attorney Withdrawal Robert J. Makar filed by Joshua Michael Whitaker. (Whitaker, Joshua) (Entered: 05/31/2023)"
        },
        {
          "row_number": 637,
          "id": 10261782,
          "entry_number": "386",
          "date_filed": "2023-06-01T00:00:00-04:00",
          "attachments": null,
          "url": "https://www.courtlistener.com/docket/10638792/386/mi-familia-vota-v-fontes/",
          "recap_pdf_url": null,
          "pacer_doc_id": "025026405027",
          "description": "NOTICE of Service of Discovery filed by ADRC Action, Arizona Coalition for Change, Arizona Students' Association, Inter Tribal Council of Arizona Incorporated, League of United Latin American Citizens Arizona, Living United for Change in Arizona, San Carlos Apache Tribe. (Lang, Danielle) (Entered: 06/01/2023)"
        },
        {
          "row_number": 643,
          "id": 10261785,
          "entry_number": "389",
          "date_filed": "2023-06-05T00:00:00-04:00",
          "attachments": null,
          "url": "https://www.courtlistener.com/docket/10638792/389/mi-familia-vota-v-fontes/",
          "recap_pdf_url": null,
          "pacer_doc_id": "025026422453",
          "description": "STATEMENT OF FACTS re: 365 Statement of Facts, 368 Statement of Facts Rule 56.1 Controverting Statement of Facts by Consol Plaintiffs Arizona Asian American Native Hawaiian And Pacific Islander For Equity Coalition, Arizona Coalition for Change, Arizona Democratic Party, Arizona Students' Association, Chicanos Por La Causa, Chicanos Por La Causa Action Fund, Democratic National Committee, Gila River Indian Community, Inter Tribal Council of Arizona Incorporated, LaDonna Jacket, League of United Latin American Citizens Arizona, Living United for Change in Arizona, Promise Arizona, San Carlos Apache Tribe, Alanna Siquieros, Southwest Voter Registration Education Project, Keanu Stevens, Tohono O'odham Nation, Plaintiffs Voto Latino, Mi Familia Vota. (Attachments: # 1 Affidavit Declaration of Hayden Johnson, # 2 Exhibit Index and Exhibits 31-39 to Declaration of Hayden Johnson)(Lang, Danielle) (Entered: 06/05/2023)"
        },
        {
          "row_number": 651,
          "id": 10261788,
          "entry_number": "392",
          "date_filed": "2023-06-05T00:00:00-04:00",
          "attachments": null,
          "url": "https://www.courtlistener.com/docket/10638792/392/mi-familia-vota-v-fontes/",
          "recap_pdf_url": null,
          "pacer_doc_id": "025026422504",
          "description": "*STATEMENT OF FACTS re: 391 MOTION for Partial Summary Judgment, RESPONSE to Motion re: 364 MOTION for Partial Summary Judgment, 367 MOTION for Partial Summary Judgment, 369 Joinder by Consol Plaintiff United States of America. (Brailey, Emily) *Modified text on 6/6/2023 (REK). (Entered: 06/05/2023)"
        },
        {
          "row_number": 723,
          "id": 10261820,
          "entry_number": "424",
          "date_filed": "2023-06-30T00:00:00-04:00",
          "attachments": null,
          "url": "https://www.courtlistener.com/docket/10638792/424/mi-familia-vota-v-fontes/",
          "recap_pdf_url": null,
          "pacer_doc_id": "025026518350",
          "description": "NOTICE of Service of Discovery filed by Gabriella Cazares-Kelly. (Jurkowitz, Daniel) (Entered: 06/30/2023)"
        },
        {
          "row_number": 731,
          "id": 10261824,
          "entry_number": "428",
          "date_filed": "2023-06-30T00:00:00-04:00",
          "attachments": null,
          "url": "https://www.courtlistener.com/docket/10638792/428/mi-familia-vota-v-fontes/",
          "recap_pdf_url": null,
          "pacer_doc_id": "025026520947",
          "description": "NOTICE of Service of Discovery filed by Stephen Richer. (O'Connor, Jack) (Entered: 06/30/2023)"
        },
        {
          "row_number": 739,
          "id": 10261827,
          "entry_number": "431",
          "date_filed": "2023-06-30T00:00:00-04:00",
          "attachments": null,
          "url": "https://www.courtlistener.com/docket/10638792/431/mi-familia-vota-v-fontes/",
          "recap_pdf_url": null,
          "pacer_doc_id": "025026521700",
          "description": "NOTICE of Service of Discovery filed by Kristi Blair. (Davis, William) (Entered: 06/30/2023)"
        },
        {
          "row_number": 741,
          "id": 10261828,
          "entry_number": "432",
          "date_filed": "2023-06-30T00:00:00-04:00",
          "attachments": null,
          "url": "https://www.courtlistener.com/docket/10638792/432/mi-familia-vota-v-fontes/",
          "recap_pdf_url": null,
          "pacer_doc_id": "025026521889",
          "description": "NOTICE of Service of Discovery filed by Richard Garcia. (Mitchell, Jason) (Entered: 06/30/2023)"
        },
        {
          "row_number": 785,
          "id": 10261848,
          "entry_number": "452",
          "date_filed": "2023-07-11T00:00:00-04:00",
          "attachments": null,
          "url": "https://www.courtlistener.com/docket/10638792/452/mi-familia-vota-v-fontes/",
          "recap_pdf_url": null,
          "pacer_doc_id": "025026553189",
          "description": "ORDER granting 423 Motion to Amend the Case Management Order. The deadline for fact-witness depositions is extended to August 4, 2023. IT IS FURTHER ORDERED that the Court's Case Management Order (Doc. 338 ) remains the same in all other respects [see attached Order for details]. Signed by Senior Judge Susan R Bolton on 7/11/23. (MAW) (Entered: 07/11/2023)"
        },
        {
          "row_number": 949,
          "id": 10261922,
          "entry_number": "526",
          "date_filed": "2023-08-24T00:00:00-04:00",
          "attachments": null,
          "url": "https://www.courtlistener.com/docket/10638792/526/mi-familia-vota-v-fontes/",
          "recap_pdf_url": null,
          "pacer_doc_id": "025026722353",
          "description": "NOTICE of Service of Discovery filed by Voto Latino, Mi Familia Vota. (Arellano, Daniel) (Entered: 08/24/2023)"
        },
        {
          "row_number": 983,
          "id": 10261937,
          "entry_number": "541",
          "date_filed": "2023-09-14T00:00:00-04:00",
          "attachments": null,
          "url": "https://www.courtlistener.com/docket/10638792/541/mi-familia-vota-v-fontes/",
          "recap_pdf_url": null,
          "pacer_doc_id": "025026798515",
          "description": "NOTICE of Service of Discovery filed by Voto Latino, Mi Familia Vota. (Arellano, Daniel) (Entered: 09/14/2023)"
        },
        {
          "row_number": 1019,
          "id": 10261954,
          "entry_number": "558",
          "date_filed": "2023-10-10T00:00:00-04:00",
          "attachments": null,
          "url": "https://www.courtlistener.com/docket/10638792/558/mi-familia-vota-v-fontes/",
          "recap_pdf_url": null,
          "pacer_doc_id": "025026885184",
          "description": "MOTION for Leave to File Excess Pages for Unopposed State and RNC Motion to Exceed Page Length Limit for Trial Memoranda by Arizona, State of, Kris Mayes, Jennifer Toth. (Attachments: # 1 Proposed Order Granting Unopposed State and RNC Motion to Exceed Page Length Limit for Trial Memoranda)(Whitaker, Joshua) (Entered: 10/10/2023)"
        },
        {
          "row_number": 1037,
          "id": 10261962,
          "entry_number": "566",
          "date_filed": "2023-10-16T00:00:00-04:00",
          "attachments": null,
          "url": "https://www.courtlistener.com/docket/10638792/566/mi-familia-vota-v-fontes/",
          "recap_pdf_url": null,
          "pacer_doc_id": "025026904247",
          "description": "MOTION in Limine re: Bar Intervenor-Defendants from Adducing Evidence at Trial re Legislature's Intent Consolidated Non-U.S. Plaintiffs' Motion in Limine as to Intervening Legislator Defendants by Arizona Democratic Party, Democratic National Committee. (Attachments: # 1 Proposed Order)(Samuels, Bruce) (Entered: 10/16/2023)"
        },
        {
          "row_number": 1043,
          "id": 10261965,
          "entry_number": "569",
          "date_filed": "2023-10-16T00:00:00-04:00",
          "attachments": null,
          "url": "https://www.courtlistener.com/docket/10638792/569/mi-familia-vota-v-fontes/",
          "recap_pdf_url": null,
          "pacer_doc_id": "025026904439",
          "description": "MOTION in Limine re: Evidence of State Interest by Voto Latino, Mi Familia Vota. (Attachments: # 1 Exhibit A, # 2 Exhibit B, # 3 Exhibit C, # 4 Exhibit D, # 5 Exhibit E, # 6 Exhibit F, # 7 Exhibit G, # 8 Exhibit H, # 9 Exhibit I, # 10 Exhibit J, # 11 Exhibit K, # 12 Exhibit L, # 13 Proposed Order)(Dodge, Christopher) (Entered: 10/16/2023)"
        },
        {
          "row_number": 1051,
          "id": 10261968,
          "entry_number": "572",
          "date_filed": "2023-10-17T00:00:00-04:00",
          "attachments": null,
          "url": "https://www.courtlistener.com/docket/10638792/572/mi-familia-vota-v-fontes/",
          "recap_pdf_url": null,
          "pacer_doc_id": "025026908561",
          "description": "NOTICE of Appearance by Scott Kanchuger on behalf of Arizona Asian American Native Hawaiian And Pacific Islander For Equity Coalition. (Kanchuger, Scott) (Entered: 10/17/2023)"
        },
        {
          "row_number": 1151,
          "id": 10262013,
          "entry_number": "617",
          "date_filed": "2023-11-03T00:00:00-04:00",
          "attachments": null,
          "url": "https://www.courtlistener.com/docket/10638792/617/mi-familia-vota-v-fontes/",
          "recap_pdf_url": null,
          "pacer_doc_id": "025026974679",
          "description": "NOTICE re: Amended Witness List by ADRC Action, Arizona Asian American Native Hawaiian And Pacific Islander For Equity Coalition, Arizona Coalition for Change, Arizona Democratic Party, Arizona Students' Association, Chicanos Por La Causa, Chicanos Por La Causa Action Fund, Democratic National Committee, Gila River Indian Community, Inter Tribal Council of Arizona Incorporated, LaDonna Jacket, Voto Latino, League of United Latin American Citizens Arizona, Living United for Change in Arizona, Mi Familia Vota, Poder Latinx, Promise Arizona, San Carlos Apache Tribe, Alanna Siquieros, Southwest Voter Registration Education Project, Keanu Stevens, Tohono O'odham Nation, United States of America re: 571 Notice of Filing - Proposed Pretrial Order, . (Attachments: # 1 Exhibit 1)(Freedman, John) (Entered: 11/03/2023)"
        },
        {
          "row_number": 1215,
          "id": 10262042,
          "entry_number": "646",
          "date_filed": "2023-11-07T00:00:00-05:00",
          "attachments": null,
          "url": "https://www.courtlistener.com/docket/10638792/646/mi-familia-vota-v-fontes/",
          "recap_pdf_url": null,
          "pacer_doc_id": "025027023001",
          "description": "NOTICE OF FILING OF OFFICIAL TRANSCRIPT of BENCH TRIAL - DAY 1 (AM SESSION) (Pages 1-124) proceedings held on 11/06/2023 before Judge SUSAN R. BOLTON. [Court Reporter: Teri Veres, RMR, CRR, Telephone number (602) 322-7251]. The ordering party receives the transcript directly from the Court Reporter. Therefore, transcripts should not be viewed through Pacer. A non-ordering party may view a transcript at the court's public terminal or purchased through the Court Reporter/Transcriber by filing a Transcript Order Form on the docket before the deadline for Release of Transcript Restriction. After that date it may be obtained through Pacer. Redaction Request due 12/8/2023. Redacted Transcript Deadline set for 12/18/2023. Release of Transcript Restriction set for 2/15/2024. (RAP) (Entered: 11/17/2023)"
        },
        {
          "row_number": 1337,
          "id": 10262096,
          "entry_number": "700",
          "date_filed": "2024-01-04T00:00:00-05:00",
          "attachments": null,
          "url": "https://www.courtlistener.com/docket/10638792/700/mi-familia-vota-v-fontes/",
          "recap_pdf_url": null,
          "pacer_doc_id": "025027187963",
          "description": "TRANSCRIPT REQUEST by Voto Latino, Mi Familia Vota for proceedings held on 12/19/2023, Judge Susan R Bolton hearing judge(s). (Dodge, Christopher) (Entered: 01/04/2024)"
        },
        {
          "row_number": 1345,
          "id": 10262100,
          "entry_number": "704",
          "date_filed": "2024-02-03T00:00:00-05:00",
          "attachments": null,
          "url": "https://www.courtlistener.com/docket/10638792/704/mi-familia-vota-v-fontes/",
          "recap_pdf_url": null,
          "pacer_doc_id": "025027306516",
          "description": "NOTICE OF FILING OF OFFICIAL TRANSCRIPT of CLOSING ARGUMENTS proceedings held on 12/19/2023 before Judge SUSAN R. BOLTON. [Court Reporter: Teri Veres, RMR, CRR, Telephone number (602) 322-7251]. The ordering party receives the transcript directly from the Court Reporter. Therefore, transcripts should not be viewed through Pacer. A non-ordering party may view a transcript at the court's public terminal or purchased through the Court Reporter/Transcriber by filing a Transcript Order Form on the docket before the deadline for Release of Transcript Restriction. After that date it may be obtained through Pacer. Redaction Request due 2/27/2024. Redacted Transcript Deadline set for 3/8/2024. Release of Transcript Restriction set for 5/6/2024. (RAP) (Entered: 02/06/2024)"
        },
        {
          "row_number": 1441,
          "id": 10262144,
          "entry_number": "748",
          "date_filed": "2024-06-10T00:00:00-04:00",
          "attachments": null,
          "url": "https://www.courtlistener.com/docket/10638792/748/mi-familia-vota-v-fontes/",
          "recap_pdf_url": null,
          "pacer_doc_id": "025027830887",
          "description": "Additional Attachments to Main Document re: 745 Reply to Response to Motion by Movant Republican Party of Arizona. (Gould, Andrew) (Entered: 06/10/2024)"
        },
        {
          "row_number": 1450,
          "id": 10262148,
          "entry_number": "752",
          "date_filed": "2024-06-28T00:00:00-04:00",
          "attachments": null,
          "url": "https://www.courtlistener.com/docket/10638792/752/mi-familia-vota-v-fontes/",
          "recap_pdf_url": null,
          "pacer_doc_id": "025027913315",
          "description": "ORDER denying 730 Defendants Senate President Warren Petersen, House of Representatives Speaker Ben Toma, and the Republican National Committee's Motion for a Partial Stay of Injunction Pending Appeal. IT IS FURTHER ORDERED denying 721 the Arizona Republican Party's Motion to Intervene. See attached Order for complete details. Signed by Senior Judge Susan R. Bolton on 6/28/2024. (KMB) (Entered: 06/28/2024)"
        },
        {
          "row_number": 1475,
          "id": 10262159,
          "entry_number": "763",
          "date_filed": "2025-02-03T00:00:00-05:00",
          "attachments": null,
          "url": "https://www.courtlistener.com/docket/10638792/763/mi-familia-vota-v-fontes/",
          "recap_pdf_url": null,
          "pacer_doc_id": "025028903398",
          "description": "NOTICE re: Removal and Substitution by Suzanne Sainz . (Attachments: # 1 Proposed Order)(Estes-Werther, Christina) (Entered: 02/03/2025)"
        },
        {
          "row_number": 1501,
          "id": 10262171,
          "entry_number": "776",
          "date_filed": "2025-05-09T00:00:00-04:00",
          "attachments": null,
          "url": "https://www.courtlistener.com/docket/10638792/776/mi-familia-vota-v-fontes/",
          "recap_pdf_url": null,
          "pacer_doc_id": "025029314810",
          "description": "NOTICE of Appearance by John A Russ, IV on behalf of United States of America. (Russ, John) (Entered: 05/09/2025)"
        },
        {
          "row_number": 1560,
          "id": 3567564,
          "entry_number": null,
          "date_filed": "2021-08-20T00:00:00-04:00",
          "attachments": [],
          "url": "https://www.courtlistener.com",
          "recap_pdf_url": null,
          "pacer_doc_id": null,
          "description": "Remark: Pro hac vice motion(s) granted for John C Bonifaz on behalf of Plaintiff Mi Familia Vota. This is a TEXT ENTRY ONLY. There is no PDF document associated with this entry. (BAS)"
        },
        {
          "row_number": 1504,
          "id": 10097126,
          "entry_number": "778",
          "date_filed": "2025-05-27T00:00:00-04:00",
          "attachments": null,
          "url": "https://www.courtlistener.com/docket/63203919/778/mi-familia-vota-v-fontes/",
          "recap_pdf_url": "https://www.courtlistener.com/recap/gov.uscourts.azd.1292039/gov.uscourts.azd.1292039.778.0_2.pdf",
          "pacer_doc_id": "025029387577",
          "description": "ORDER re: 771 the United States' Motion for Indicative Ruling on Motion for Relief from Final Judgment. See attached Order for complete details. Signed by Senior Judge Susan R. Bolton on 5/27/2025. (KMB) (Entered: 05/27/2025)"
        },
        {
          "row_number": 338,
          "id": 3567868,
          "entry_number": "251",
          "date_filed": "2023-01-27T00:00:00-05:00",
          "attachments": [],
          "url": "https://www.courtlistener.com/docket/63203919/251/mi-familia-vota-v-fontes/",
          "recap_pdf_url": null,
          "pacer_doc_id": "025025916641",
          "description": "NOTICE of Service of Discovery filed by Suzanne Sainz. (Estes-Werther, Christina) (Entered: 01/27/2023)"
        },
        {
          "row_number": 340,
          "id": 3567869,
          "entry_number": "252",
          "date_filed": "2023-01-27T00:00:00-05:00",
          "attachments": [],
          "url": "https://www.courtlistener.com/docket/63203919/252/mi-familia-vota-v-fontes/",
          "recap_pdf_url": null,
          "pacer_doc_id": "025025917068",
          "description": "NOTICE of Service of Discovery filed by Richard Colwell. (Kerekes, William) (Entered: 01/27/2023)"
        },
        {
          "row_number": 342,
          "id": 3567870,
          "entry_number": "253",
          "date_filed": "2023-01-27T00:00:00-05:00",
          "attachments": [],
          "url": "https://www.courtlistener.com/docket/63203919/253/mi-familia-vota-v-fontes/",
          "recap_pdf_url": null,
          "pacer_doc_id": "025025917097",
          "description": "NOTICE of Service of Discovery filed by David W Stevens. (Correa, Paul) (Entered: 01/27/2023)"
        },
        {
          "row_number": 344,
          "id": 3567871,
          "entry_number": "254",
          "date_filed": "2023-01-27T00:00:00-05:00",
          "attachments": [],
          "url": "https://www.courtlistener.com/docket/63203919/254/mi-familia-vota-v-fontes/",
          "recap_pdf_url": null,
          "pacer_doc_id": "025025917129",
          "description": "NOTICE of Service of Discovery filed by Richard Garcia. (Mitchell, Jason) Modified to correct filers on 2/17/2023 (CLM). (Entered: 01/27/2023)"
        },
        {
          "row_number": 346,
          "id": 3567872,
          "entry_number": "255",
          "date_filed": "2023-01-30T00:00:00-05:00",
          "attachments": [],
          "url": "https://www.courtlistener.com/docket/63203919/255/mi-familia-vota-v-fontes/",
          "recap_pdf_url": null,
          "pacer_doc_id": "025025920037",
          "description": "EX PARTE MOTION to Withdraw as Attorney with Client Consent by Chicanos Por La Causa, Chicanos Por La Causa Action Fund, Poder Latinx. (Attachments: # 1 Proposed Order)(Aguilera, Cecilia) (Entered: 01/30/2023)"
        },
        {
          "row_number": 348,
          "id": 3567873,
          "entry_number": "256",
          "date_filed": "2023-01-31T00:00:00-05:00",
          "attachments": [],
          "url": "https://www.courtlistener.com/docket/63203919/256/mi-familia-vota-v-fontes/",
          "recap_pdf_url": null,
          "pacer_doc_id": "025025923920",
          "description": "ORDER granting 255 Motion to Withdraw as Attorney. Attorney Cecilia Aguilera is relieved of any further responsibilities in connection with this action. Jon Sherman and Michelle Kanter Cohen of Fair Elections Center shall continue as counsel of record for Plaintiffs. Signed by Senior Judge Susan R Bolton on 1/31/2023. (CLM) (Entered: 01/31/2023)"
        },
        {
          "row_number": 350,
          "id": 3567874,
          "entry_number": "257",
          "date_filed": "2023-01-31T00:00:00-05:00",
          "attachments": [],
          "url": "https://www.courtlistener.com/docket/63203919/257/mi-familia-vota-v-fontes/",
          "recap_pdf_url": null,
          "pacer_doc_id": "025025927410",
          "description": "NOTICE of Attorney Withdrawal for John H. Steinbach filed by Amit Makker. (Makker, Amit) (Entered: 01/31/2023)"
        },
        {
          "row_number": 352,
          "id": 3567875,
          "entry_number": "258",
          "date_filed": "2023-01-31T00:00:00-05:00",
          "attachments": [],
          "url": "https://www.courtlistener.com/docket/63203919/258/mi-familia-vota-v-fontes/",
          "recap_pdf_url": null,
          "pacer_doc_id": "025025928461",
          "description": "NOTICE re: Automatic Substitution of Public Entity by Mark Brnovich . (Ward, Emily) (Entered: 01/31/2023)"
        },
        {
          "row_number": 354,
          "id": 3567876,
          "entry_number": "259",
          "date_filed": "2023-02-01T00:00:00-05:00",
          "attachments": [],
          "url": "https://www.courtlistener.com/docket/63203919/259/mi-familia-vota-v-fontes/",
          "recap_pdf_url": null,
          "pacer_doc_id": "025025933524",
          "description": "NOTICE of Service of Discovery filed by Adrian Fontes. (Gaona, David) (Entered: 02/01/2023)"
        },
        {
          "row_number": 358,
          "id": 3567877,
          "entry_number": "260",
          "date_filed": "2023-02-02T00:00:00-05:00",
          "attachments": [],
          "url": "https://www.courtlistener.com/docket/63203919/260/mi-familia-vota-v-fontes/",
          "recap_pdf_url": null,
          "pacer_doc_id": "025025937310",
          "description": "NOTICE of Service of Discovery filed by Richard Colwell. (Kerekes, William) (Entered: 02/02/2023)"
        },
        {
          "row_number": 362,
          "id": 3567879,
          "entry_number": "262",
          "date_filed": "2023-02-02T00:00:00-05:00",
          "attachments": [],
          "url": "https://www.courtlistener.com/docket/63203919/262/mi-familia-vota-v-fontes/",
          "recap_pdf_url": null,
          "pacer_doc_id": "025025939868",
          "description": "Joint MOTION for Extension of Time to File Rule 26(f) Report and Notice of Stipulation for Extension of Time to File Initial Disclosures by United States of America. (Attachments: # 1 Proposed Order)(Bender, Laura) (Entered: 02/02/2023)"
        },
        {
          "row_number": 364,
          "id": 3567880,
          "entry_number": "263",
          "date_filed": "2023-02-03T00:00:00-05:00",
          "attachments": [],
          "url": "https://www.courtlistener.com/docket/63203919/263/mi-familia-vota-v-fontes/",
          "recap_pdf_url": null,
          "pacer_doc_id": "025025944821",
          "description": "NOTICE of Service of Discovery filed by Michelle Burchill. (Gordon, Michael) (Entered: 02/03/2023)"
        },
        {
          "row_number": 366,
          "id": 3567881,
          "entry_number": "264",
          "date_filed": "2023-02-06T00:00:00-05:00",
          "attachments": [],
          "url": "https://www.courtlistener.com/docket/63203919/264/mi-familia-vota-v-fontes/",
          "recap_pdf_url": null,
          "pacer_doc_id": "025025947669",
          "description": "ORDER granting 262 Motion for Extension of Time. IT IS ORDERED that the parties may file their joint Rule 26(f) report and provide their initial disclosures by February 10, 2023. Signed by Senior Judge Susan R Bolton on 2/6/23. (MAW) (Entered: 02/06/2023)"
        },
        {
          "row_number": 368,
          "id": 3567882,
          "entry_number": "265",
          "date_filed": "2023-02-06T00:00:00-05:00",
          "attachments": [],
          "url": "https://www.courtlistener.com/docket/63203919/265/mi-familia-vota-v-fontes/",
          "recap_pdf_url": null,
          "pacer_doc_id": "025025949109",
          "description": "NOTICE of Service of Discovery filed by Larry Noble. (Robertson, Celeste) (Entered: 02/06/2023)"
        },
        {
          "row_number": 372,
          "id": 3567884,
          "entry_number": "267",
          "date_filed": "2023-02-09T00:00:00-05:00",
          "attachments": [
            {
              "recap_id": 225153616,
              "pacer_url": "https://ecf.azd.uscourts.gov/doc1/025025967389?caseid=1292039",
              "description": "Exhibit A",
              "attachment_number": 1
            }
          ],
          "url": "https://www.courtlistener.com/docket/63203919/267/mi-familia-vota-v-fontes/",
          "recap_pdf_url": "https://www.courtlistener.com/recap/gov.uscourts.azd.1292039/gov.uscourts.azd.1292039.267.0.pdf",
          "pacer_doc_id": "025025967388",
          "description": "RESPONSE to Motion re: 197 MOTION to Dismiss for Lack of Jurisdiction MOTION to Dismiss for Failure to State a Claim [RESPONSE BY PLAINTIFFS TOHONO OODHAM NATION, GILA RIVER INDIAN COMMUNITY, KEANU STEVENS, ALANNA SIQUIEROS, AND LADONNA JACKET TO DEFENDANTS ATTORNEY GENERAL MARK BRNOVICH AND STATE OF ARIZONAS MOTION TO DISMISS UNDER RULES 12(B)(1) AND (B)(6)] filed by Gila River Indian Community, LaDonna Jacket, Alanna Siquieros, Keanu Stevens, Tohono O'odham Nation. (Attachments: # 1 Exhibit A)(Rosenbaum, David) (Entered: 02/09/2023)"
        },
        {
          "row_number": 1618,
          "id": 3567885,
          "entry_number": null,
          "date_filed": "2023-02-10T00:00:00-05:00",
          "attachments": [],
          "url": "https://www.courtlistener.com",
          "recap_pdf_url": null,
          "pacer_doc_id": null,
          "description": "Remark: Pro hac vice motion(s) granted for Christopher D Dodge on behalf of Plaintiffs Voto Latino, Mi Familia Vota. This is a TEXT ENTRY ONLY. There is no PDF document associated with this entry. (BAS)"
        },
        {
          "row_number": 374,
          "id": 3567886,
          "entry_number": "268",
          "date_filed": "2023-02-10T00:00:00-05:00",
          "attachments": [],
          "url": "https://www.courtlistener.com/docket/63203919/268/mi-familia-vota-v-fontes/",
          "recap_pdf_url": null,
          "pacer_doc_id": "025025970495",
          "description": "NOTICE of Service of Discovery filed by Adrian Fontes. (Gaona, David) (Entered: 02/10/2023)"
        },
        {
          "row_number": 376,
          "id": 3567887,
          "entry_number": "269",
          "date_filed": "2023-02-10T00:00:00-05:00",
          "attachments": [],
          "url": "https://www.courtlistener.com/docket/63203919/269/mi-familia-vota-v-fontes/",
          "recap_pdf_url": null,
          "pacer_doc_id": "025025970693",
          "description": "NOTICE of Service of Discovery filed by Patty Hansen. (Winkeler, Rose) (Entered: 02/10/2023)"
        },
        {
          "row_number": 380,
          "id": 3567888,
          "entry_number": "270",
          "date_filed": "2023-02-10T00:00:00-05:00",
          "attachments": [],
          "url": "https://www.courtlistener.com/docket/63203919/270/mi-familia-vota-v-fontes/",
          "recap_pdf_url": null,
          "pacer_doc_id": "025025970699",
          "description": "NOTICE of Service of Discovery filed by Patty Hansen. (Winkeler, Rose) (Entered: 02/10/2023)"
        },
        {
          "row_number": 382,
          "id": 3567889,
          "entry_number": "271",
          "date_filed": "2023-02-10T00:00:00-05:00",
          "attachments": [],
          "url": "https://www.courtlistener.com/docket/63203919/271/mi-familia-vota-v-fontes/",
          "recap_pdf_url": null,
          "pacer_doc_id": "025025972082",
          "description": "NOTICE of Service of Discovery filed by Michelle Burchill. (Gordon, Michael) (Entered: 02/10/2023)"
        },
        {
          "row_number": 384,
          "id": 3567890,
          "entry_number": "272",
          "date_filed": "2023-02-10T00:00:00-05:00",
          "attachments": [],
          "url": "https://www.courtlistener.com/docket/63203919/272/mi-familia-vota-v-fontes/",
          "recap_pdf_url": null,
          "pacer_doc_id": "025025972887",
          "description": "NOTICE of Service of Discovery filed by United States of America. (Bender, Laura) (Entered: 02/10/2023)"
        },
        {
          "row_number": 388,
          "id": 3567892,
          "entry_number": "274",
          "date_filed": "2023-02-10T00:00:00-05:00",
          "attachments": [],
          "url": "https://www.courtlistener.com/docket/63203919/274/mi-familia-vota-v-fontes/",
          "recap_pdf_url": null,
          "pacer_doc_id": "025025973154",
          "description": "NOTICE of Service of Discovery filed by Gila River Indian Community, LaDonna Jacket, Alanna Siquieros, Keanu Stevens, Tohono O'odham Nation. (Messer, Joshua) (Entered: 02/10/2023)"
        },
        {
          "row_number": 392,
          "id": 3567894,
          "entry_number": "276",
          "date_filed": "2023-02-10T00:00:00-05:00",
          "attachments": [],
          "url": "https://www.courtlistener.com/docket/63203919/276/mi-familia-vota-v-fontes/",
          "recap_pdf_url": null,
          "pacer_doc_id": "025025973412",
          "description": "NOTICE of Service of Discovery filed by Arizona, State of, Mark Brnovich. (Ward, Emily) (Entered: 02/10/2023)"
        },
        {
          "row_number": 394,
          "id": 3567895,
          "entry_number": "277",
          "date_filed": "2023-02-10T00:00:00-05:00",
          "attachments": [],
          "url": "https://www.courtlistener.com/docket/63203919/277/mi-familia-vota-v-fontes/",
          "recap_pdf_url": null,
          "pacer_doc_id": "025025973567",
          "description": "NOTICE of Service of Discovery filed by Kristi Blair. (Esplin, Ryan) (Entered: 02/10/2023)"
        },
        {
          "row_number": 398,
          "id": 3567897,
          "entry_number": "279",
          "date_filed": "2023-02-10T00:00:00-05:00",
          "attachments": [],
          "url": "https://www.courtlistener.com/docket/63203919/279/mi-familia-vota-v-fontes/",
          "recap_pdf_url": null,
          "pacer_doc_id": "025025973962",
          "description": "NOTICE of Service of Discovery filed by Voto Latino, Mi Familia Vota. (Arellano, Daniel) (Entered: 02/10/2023)"
        },
        {
          "row_number": 406,
          "id": 3567900,
          "entry_number": "282",
          "date_filed": "2023-02-10T00:00:00-05:00",
          "attachments": [],
          "url": "https://www.courtlistener.com/docket/63203919/282/mi-familia-vota-v-fontes/",
          "recap_pdf_url": null,
          "pacer_doc_id": "025025974502",
          "description": "NOTICE of Service of Discovery filed by Promise Arizona, Southwest Voter Registration Education Project. (Herrera, Ernest) (Entered: 02/10/2023)"
        },
        {
          "row_number": 408,
          "id": 3567901,
          "entry_number": "283",
          "date_filed": "2023-02-10T00:00:00-05:00",
          "attachments": [],
          "url": "https://www.courtlistener.com/docket/63203919/283/mi-familia-vota-v-fontes/",
          "recap_pdf_url": null,
          "pacer_doc_id": "025025974534",
          "description": "NOTICE of Service of Discovery filed by Republican National Committee. (Basile, Thomas) (Entered: 02/10/2023)"
        },
        {
          "row_number": 410,
          "id": 3567902,
          "entry_number": "284",
          "date_filed": "2023-02-10T00:00:00-05:00",
          "attachments": [],
          "url": "https://www.courtlistener.com/docket/63203919/284/mi-familia-vota-v-fontes/",
          "recap_pdf_url": null,
          "pacer_doc_id": null,
          "description": "NOTICE TO FILER OF DEFICIENCY re: 278 Notice of Service of Discovery. Document not in compliance with LRCiv 5.5(g) - Documents signed by an attorney shall be filed using that attorney's ECF log-in and password and shall not be filed using a log-in and password belonging to another attorney. Document signed by attorney James E. Barton, II but submitted using the log-in and password belonging to attorney Jacqueline Soto. Please correct future filings. This is a TEXT ENTRY ONLY. There is no PDF document associated with this entry. (CLM) (Entered: 02/13/2023)"
        },
        {
          "row_number": 1620,
          "id": 3567903,
          "entry_number": null,
          "date_filed": "2023-02-10T00:00:00-05:00",
          "attachments": [],
          "url": "https://www.courtlistener.com",
          "recap_pdf_url": null,
          "pacer_doc_id": null,
          "description": "Remark re Pro Hac Vice Motion"
        },
        {
          "row_number": 416,
          "id": 3567906,
          "entry_number": "287",
          "date_filed": "2023-02-13T00:00:00-05:00",
          "attachments": [],
          "url": "https://www.courtlistener.com/docket/63203919/287/mi-familia-vota-v-fontes/",
          "recap_pdf_url": null,
          "pacer_doc_id": "025025977766",
          "description": "NOTICE of Service of Discovery filed by Richard Garcia. (Mitchell, Jason) (Entered: 02/13/2023)"
        },
        {
          "row_number": 420,
          "id": 3567908,
          "entry_number": "289",
          "date_filed": "2023-02-13T00:00:00-05:00",
          "attachments": [],
          "url": "https://www.courtlistener.com/docket/63203919/289/mi-familia-vota-v-fontes/",
          "recap_pdf_url": null,
          "pacer_doc_id": "025025978996",
          "description": "NOTICE of Service of Discovery filed by Gabriella Cazares-Kelly. (Jurkowitz, Daniel) (Entered: 02/13/2023)"
        },
        {
          "row_number": 424,
          "id": 3567909,
          "entry_number": "290",
          "date_filed": "2023-02-13T00:00:00-05:00",
          "attachments": [],
          "url": "https://www.courtlistener.com/docket/63203919/290/mi-familia-vota-v-fontes/",
          "recap_pdf_url": null,
          "pacer_doc_id": "025025979025",
          "description": "NOTICE of Service of Discovery filed by Gabriella Cazares-Kelly. (Jurkowitz, Daniel) (Entered: 02/13/2023)"
        },
        {
          "row_number": 426,
          "id": 3567910,
          "entry_number": "291",
          "date_filed": "2023-02-13T00:00:00-05:00",
          "attachments": [],
          "url": "https://www.courtlistener.com/docket/63203919/291/mi-familia-vota-v-fontes/",
          "recap_pdf_url": null,
          "pacer_doc_id": "025025979516",
          "description": "RESPONSE TO PLAINTIFF'S FIRST REQUEST FOR PRODUCTION OF DOCUMENTS by Defendant Sharie Milheiro. (Adams, Scott) (Entered: 02/13/2023)"
        },
        {
          "row_number": 428,
          "id": 3567911,
          "entry_number": "292",
          "date_filed": "2023-02-13T00:00:00-05:00",
          "attachments": [],
          "url": "https://www.courtlistener.com/docket/63203919/292/mi-familia-vota-v-fontes/",
          "recap_pdf_url": null,
          "pacer_doc_id": "025025979545",
          "description": "RESPONSE TO PLAINTIFF'S FIRST SET OF INTERROGATORIES by Defendant Sharie Milheiro. (Adams, Scott) (Entered: 02/13/2023)"
        },
        {
          "row_number": 430,
          "id": 3567912,
          "entry_number": "293",
          "date_filed": "2023-02-13T00:00:00-05:00",
          "attachments": [],
          "url": "https://www.courtlistener.com/docket/63203919/293/mi-familia-vota-v-fontes/",
          "recap_pdf_url": null,
          "pacer_doc_id": "025025979592",
          "description": "NOTICE of Service of Discovery filed by Wendy John. (Roof, Jean) (Entered: 02/13/2023)"
        },
        {
          "row_number": 1621,
          "id": 3567913,
          "entry_number": null,
          "date_filed": "2023-02-13T00:00:00-05:00",
          "attachments": [],
          "url": "https://www.courtlistener.com",
          "recap_pdf_url": null,
          "pacer_doc_id": null,
          "description": "Notice of Deficiency (Text Only)"
        },
        {
          "row_number": 432,
          "id": 3567914,
          "entry_number": "294",
          "date_filed": "2023-02-14T00:00:00-05:00",
          "attachments": [],
          "url": "https://www.courtlistener.com/docket/63203919/294/mi-familia-vota-v-fontes/",
          "recap_pdf_url": null,
          "pacer_doc_id": "025025983554",
          "description": "NOTICE of Service of Discovery filed by Stephen Richer. (O'Connor, Jack) (Entered: 02/14/2023)"
        },
        {
          "row_number": 434,
          "id": 3567915,
          "entry_number": "295",
          "date_filed": "2023-02-15T00:00:00-05:00",
          "attachments": [],
          "url": "https://www.courtlistener.com/docket/63203919/295/mi-familia-vota-v-fontes/",
          "recap_pdf_url": null,
          "pacer_doc_id": "025025986133",
          "description": "SUPPLEMENT PC Supplemental Notice of Appearance by Defendant Dana Lewis. (Cameron, Craig) (Entered: 02/15/2023)"
        },
        {
          "row_number": 436,
          "id": 3567916,
          "entry_number": "296",
          "date_filed": "2023-02-15T00:00:00-05:00",
          "attachments": [],
          "url": "https://www.courtlistener.com/docket/63203919/296/mi-familia-vota-v-fontes/",
          "recap_pdf_url": null,
          "pacer_doc_id": "025025986161",
          "description": "ORDER: Pursuant to Rule 16 of the Federal Rules of Civil Procedure, a Case Management Conference is set for March 16, 2023 at 11:00 a.m. in Courtroom 502, Sandra Day O'Connor U.S. Courthouse, 401 W. Washington St., Phoenix, Arizona 85003. The Rule 16 Scheduling Conference will be conducted in person and/or via Zoom. Counsel shall advise the Court by email at bolton_chambers@azd.uscourts.gov no later than 12:00 p.m., March 15, 2023 if they will be appearing via Zoom or appearing in person. This Court's staff will provide counsel with the Zoom link for said hearing [see attached Order for details]. Signed by Senior Judge Susan R Bolton on 2/15/23. (MAW) (Entered: 02/15/2023)"
        },
        {
          "row_number": 438,
          "id": 3567917,
          "entry_number": "297",
          "date_filed": "2023-02-15T00:00:00-05:00",
          "attachments": [],
          "url": "https://www.courtlistener.com/docket/63203919/297/mi-familia-vota-v-fontes/",
          "recap_pdf_url": null,
          "pacer_doc_id": "025025986177",
          "description": "RESPONSE to RFPs by Defendant Dana Lewis. (Cameron, Craig) (Entered: 02/15/2023)"
        },
        {
          "row_number": 442,
          "id": 3567919,
          "entry_number": "299",
          "date_filed": "2023-02-15T00:00:00-05:00",
          "attachments": [],
          "url": "https://www.courtlistener.com/docket/63203919/299/mi-familia-vota-v-fontes/",
          "recap_pdf_url": null,
          "pacer_doc_id": "025025986209",
          "description": "STATEMENT of Initial Rule 2 Disclosure by Defendant Dana Lewis. (Cameron, Craig) (Entered: 02/15/2023)"
        },
        {
          "row_number": 448,
          "id": 3567920,
          "entry_number": "300",
          "date_filed": "2023-02-15T00:00:00-05:00",
          "attachments": [],
          "url": "https://www.courtlistener.com/docket/63203919/300/mi-familia-vota-v-fontes/",
          "recap_pdf_url": null,
          "pacer_doc_id": "025025987435",
          "description": "EX PARTE MOTION to Substitute Attorney by Adrian Fontes. (Attachments: # 1 Proposed Order)(Morgan, Craig) (Entered: 02/15/2023)"
        },
        {
          "row_number": 450,
          "id": 3567921,
          "entry_number": "301",
          "date_filed": "2023-02-15T00:00:00-05:00",
          "attachments": [],
          "url": "https://www.courtlistener.com/docket/63203919/301/mi-familia-vota-v-fontes/",
          "recap_pdf_url": null,
          "pacer_doc_id": "025025987968",
          "description": "ORDER granting 300 Motion to Substitute Attorney. Added attorney Craig Alan Morgan,Shayna Gabrielle Stuart,Jake Tyler Rapp for Adrian Fontes. Attorney Christine Bass and David Andrew Gaona terminated for Adrian Fontes. Signed by Senior Judge Susan R Bolton on 2/15/2023. (CLM) (Entered: 02/15/2023)"
        },
        {
          "row_number": 452,
          "id": 3567922,
          "entry_number": "302",
          "date_filed": "2023-02-15T00:00:00-05:00",
          "attachments": [],
          "url": "https://www.courtlistener.com/docket/63203919/302/mi-familia-vota-v-fontes/",
          "recap_pdf_url": null,
          "pacer_doc_id": "025025988715",
          "description": "NOTICE of Service of Discovery filed by Mark Brnovich. (Ward, Emily) (Entered: 02/15/2023)"
        },
        {
          "row_number": 454,
          "id": 3567923,
          "entry_number": "303",
          "date_filed": "2023-02-15T00:00:00-05:00",
          "attachments": [],
          "url": "https://www.courtlistener.com/docket/63203919/303/mi-familia-vota-v-fontes/",
          "recap_pdf_url": null,
          "pacer_doc_id": null,
          "description": "NOTICE TO FILER OF DEFICIENCY re: 299 Statement, 298 Response, 297 Response, and 295 Supplement. Documents not in compliance with LRCiv 5.5(g) - Documents signed by an attorney shall be filed using that attorney's ECF log-in and password and shall not be filed using a log-in and password belonging to another attorney. Document 295 signed by attorneys Chris Keller, James Mitchell, and Scott M. Johnson, but submitted using the log-in and password belonging to attorney Craig Cameron. Documents 297, 298, and 299 signed by attorney James Mitchell but submitted using the log-in and password belonging to attorney Craig Cameron. Please correct future filings. This is a TEXT ENTRY ONLY. There is no PDF document associated with this entry. (CLM) (Entered: 02/15/2023)"
        },
        {
          "row_number": 458,
          "id": 3567926,
          "entry_number": "305",
          "date_filed": "2023-02-16T00:00:00-05:00",
          "attachments": [],
          "url": "https://www.courtlistener.com/docket/63203919/305/mi-familia-vota-v-fontes/",
          "recap_pdf_url": null,
          "pacer_doc_id": "025025994538",
          "description": "NOTICE of Appearance by Joshua Michael Whitaker on behalf of Arizona, State of, Kris Mayes. (Whitaker, Joshua) *Modified filers on 3/9/2023 (DXD). (Entered: 02/16/2023)"
        },
        {
          "row_number": 460,
          "id": 3567927,
          "entry_number": "306",
          "date_filed": "2023-02-23T00:00:00-05:00",
          "attachments": [],
          "url": "https://www.courtlistener.com/docket/63203919/306/mi-familia-vota-v-fontes/",
          "recap_pdf_url": null,
          "pacer_doc_id": "025026014894",
          "description": "STIPULATION to Extend Defendants Mayes and State of Arizona's Deadline to File Reply in Support of Motion to Dismiss (Doc. 197) by Arizona, State of, Kris Mayes. (Attachments: # 1 Proposed Order)(Ward, Emily) (Entered: 02/23/2023)"
        },
        {
          "row_number": 462,
          "id": 3567928,
          "entry_number": "307",
          "date_filed": "2023-02-23T00:00:00-05:00",
          "attachments": [],
          "url": "https://www.courtlistener.com/docket/63203919/307/mi-familia-vota-v-fontes/",
          "recap_pdf_url": null,
          "pacer_doc_id": "025026015542",
          "description": "ORDER pursuant to 306 Stipulation: IT IS HEREBY ORDERED that the State's deadline to file its reply in support of its motion to dismiss (Doc. 197 ) is extended by two weeks from its current deadline of February 24, 2023, through and including March 10, 2023. Signed by Senior Judge Susan R Bolton on 2/23/23. (MAW) (Entered: 02/23/2023)"
        },
        {
          "row_number": 466,
          "id": 3567930,
          "entry_number": "309",
          "date_filed": "2023-02-27T00:00:00-05:00",
          "attachments": [
            {
              "recap_id": 243863231,
              "pacer_url": "https://ecf.azd.uscourts.gov/doc1/025026028160?caseid=1292039",
              "description": "Exhibit Exhibit 1",
              "attachment_number": 1
            },
            {
              "recap_id": 243863366,
              "pacer_url": "https://ecf.azd.uscourts.gov/doc1/025026028161?caseid=1292039",
              "description": "Proposed Order",
              "attachment_number": 2
            }
          ],
          "url": "https://www.courtlistener.com/docket/63203919/309/mi-familia-vota-v-fontes/",
          "recap_pdf_url": "https://www.courtlistener.com/recap/gov.uscourts.azd.1292039/gov.uscourts.azd.1292039.309.0.pdf",
          "pacer_doc_id": "025026028159",
          "description": "First MOTION for Extension of Time to File Answer by Republican National Committee. (Attachments: # 1 Exhibit Exhibit 1, # 2 Proposed Order)(Basile, Thomas) (Entered: 02/27/2023)"
        },
        {
          "row_number": 470,
          "id": 3567931,
          "entry_number": "310",
          "date_filed": "2023-02-27T00:00:00-05:00",
          "attachments": [],
          "url": "https://www.courtlistener.com/docket/63203919/310/mi-familia-vota-v-fontes/",
          "recap_pdf_url": null,
          "pacer_doc_id": "025026028232",
          "description": "ORDER granting 308 Motion for Extension of Time to Answer. IT IS HEREBY ORDERED that the States deadline to file its answers to the complaints in Case Nos. CV-22-00509-PHX-SRB, CV-22-00519-PHX-SRB, CV-22-01003-PHX-SRB, CV-22-01124-PHX-SRB, CV-22-01369-PHX-SRB, CV-22-01381-PHX-SRB, and CV-22-01602-PHX-SRB is extended by two weeks from its current deadline of March 2, 2023, through and including March 17, 2023. Signed by Senior Judge Susan R Bolton on 2/27/23. (MAW) (Entered: 02/27/2023)"
        },
        {
          "row_number": 472,
          "id": 3567932,
          "entry_number": "311",
          "date_filed": "2023-02-27T00:00:00-05:00",
          "attachments": [],
          "url": "https://www.courtlistener.com/docket/63203919/311/mi-familia-vota-v-fontes/",
          "recap_pdf_url": "https://www.courtlistener.com/recap/gov.uscourts.azd.1292039/gov.uscourts.azd.1292039.311.0.pdf",
          "pacer_doc_id": "025026029005",
          "description": "ORDER granting 309 Motion for Extension of Time to Answer. IT IS HEREBY ORDERED that the deadline for the Intervenor Defendant to answer the complaints in Case Nos. CV-22-00509-PHX-SRB, CV-22-00519-PHX-SRB, CV-22-01003-PHX-SRB, CV-22-01124-PHX-SRB, CV-22-01369-PHX-SRB, CV-22-01381-PHX-SRB, and CV-22-01602-PHX-SRB is extended through and including March 17, 2023. Signed by Senior Judge Susan R Bolton on 2/27/23. (MAW) (Entered: 02/27/2023)"
        },
        {
          "row_number": 1623,
          "id": 3567934,
          "entry_number": null,
          "date_filed": "2023-03-03T00:00:00-05:00",
          "attachments": [],
          "url": "https://www.courtlistener.com",
          "recap_pdf_url": null,
          "pacer_doc_id": null,
          "description": "Remark: Pro hac vice motion(s) granted for Beauregard William Patterson on behalf of Consol Plaintiffs Chicanos Por La Causa, Chicanos Por La Causa Action Fund, Poder Latinx. This is a TEXT ENTRY ONLY. There is no PDF document associated with this entry. (BAS)"
        },
        {
          "row_number": 476,
          "id": 3567936,
          "entry_number": "313",
          "date_filed": "2023-03-08T00:00:00-05:00",
          "attachments": [],
          "url": "https://www.courtlistener.com/docket/63203919/313/mi-familia-vota-v-fontes/",
          "recap_pdf_url": null,
          "pacer_doc_id": "025026071596",
          "description": "NOTICE of Attorney Substitution by Hayleigh Susan Crawford. (Crawford, Hayleigh) (Entered: 03/08/2023)"
        },
        {
          "row_number": 1556,
          "id": 3567560,
          "entry_number": null,
          "date_filed": "2021-08-18T00:00:00-04:00",
          "attachments": [],
          "url": "https://www.courtlistener.com",
          "recap_pdf_url": null,
          "pacer_doc_id": null,
          "description": "Remark: Pro hac vice motion(s) granted for Courtney Hostetler on behalf of Plaintiffs Arizona Coalition for Change, League of Conservation Voters Incorporated, Living United for Change in Arizona, Mi Familia Vota. This is a TEXT ENTRY ONLY. There is no PDF document associated with this entry. (BAS)"
        },
        {
          "row_number": 1557,
          "id": 3567561,
          "entry_number": null,
          "date_filed": "2021-08-18T00:00:00-04:00",
          "attachments": [],
          "url": "https://www.courtlistener.com",
          "recap_pdf_url": null,
          "pacer_doc_id": null,
          "description": "Remark: Pro hac vice motion(s) granted for Lee H Rubin, Daniel T Fenske on behalf of Plaintiffs Arizona Coalition for Change, League of Conservation Voters Incorporated, Living United for Change in Arizona, Mi Familia Vota. This is a TEXT ENTRY ONLY. There is no PDF document associated with this entry. (BAS)"
        },
        {
          "row_number": 1559,
          "id": 3567563,
          "entry_number": null,
          "date_filed": "2021-08-19T00:00:00-04:00",
          "attachments": [],
          "url": "https://www.courtlistener.com",
          "recap_pdf_url": null,
          "pacer_doc_id": null,
          "description": "Remark: Pro hac vice motion(s) granted for John C Bonifaz on behalf of Plaintiffs Arizona Coalition for Change, League of Conservation Voters Incorporated, Living United for Change in Arizona. This is a TEXT ENTRY ONLY. There is no PDF document associated with this entry. (BAS)"
        },
        {
          "row_number": 1561,
          "id": 3567565,
          "entry_number": null,
          "date_filed": "2021-08-25T00:00:00-04:00",
          "attachments": [],
          "url": "https://www.courtlistener.com",
          "recap_pdf_url": null,
          "pacer_doc_id": null,
          "description": "Remark: Pro hac vice motion(s) granted for Ben Clements on behalf of Plaintiffs Arizona Coalition for Change, League of Conservation Voters Incorporated, Living United for Change in Arizona, Mi Familia Vota. This is a TEXT ENTRY ONLY. There is no PDF document associated with this entry. (BAS)"
        },
        {
          "row_number": 1562,
          "id": 3567566,
          "entry_number": null,
          "date_filed": "2021-09-24T00:00:00-04:00",
          "attachments": [],
          "url": "https://www.courtlistener.com",
          "recap_pdf_url": null,
          "pacer_doc_id": null,
          "description": "Remark: Pro hac vice motion(s) granted for John Michael Geise on behalf of Intervenor Democratic Party Committees. This is a TEXT ENTRY ONLY. There is no PDF document associated with this entry. (BAS)"
        },
        {
          "row_number": 1564,
          "id": 3567568,
          "entry_number": null,
          "date_filed": "2021-09-29T00:00:00-04:00",
          "attachments": [],
          "url": "https://www.courtlistener.com",
          "recap_pdf_url": null,
          "pacer_doc_id": null,
          "description": "Remark: Pro hac vice motion(s) granted for Elisabeth C Frost on behalf of Intervenor Democratic Party Committees. This is a TEXT ENTRY ONLY. There is no PDF document associated with this entry. (BAS)"
        },
        {
          "row_number": 1565,
          "id": 3567569,
          "entry_number": null,
          "date_filed": "2021-09-29T00:00:00-04:00",
          "attachments": [],
          "url": "https://www.courtlistener.com",
          "recap_pdf_url": null,
          "pacer_doc_id": null,
          "description": "Remark: Pro hac vice motion(s) granted for Tyler L Bishop on behalf of Intervenor Democratic Party Committees. This is a TEXT ENTRY ONLY. There is no PDF document associated with this entry. (BAS)"
        },
        {
          "row_number": 1566,
          "id": 3567570,
          "entry_number": null,
          "date_filed": "2021-10-12T00:00:00-04:00",
          "attachments": [],
          "url": "https://www.courtlistener.com",
          "recap_pdf_url": null,
          "pacer_doc_id": null,
          "description": "Remark: Pro hac vice motion(s) granted for Tyler R Green, Daniel Joseph Shapiro on behalf of Intervenor Defendants National Republican Senatorial Committee, Republican National Committee. This is a TEXT ENTRY ONLY. There is no PDF document associated with this entry. (BAS)"
        },
        {
          "row_number": 1567,
          "id": 3567571,
          "entry_number": null,
          "date_filed": "2021-10-18T00:00:00-04:00",
          "attachments": [],
          "url": "https://www.courtlistener.com",
          "recap_pdf_url": null,
          "pacer_doc_id": null,
          "description": "Remark: Pro hac vice motion(s) granted for Ben Stafford on behalf of Intervenor Democratic Party Committees. This is a TEXT ENTRY ONLY. There is no PDF document associated with this entry. (BAS)"
        },
        {
          "row_number": 1569,
          "id": 3567573,
          "entry_number": null,
          "date_filed": "2022-01-20T00:00:00-05:00",
          "attachments": [],
          "url": "https://www.courtlistener.com",
          "recap_pdf_url": null,
          "pacer_doc_id": null,
          "description": "Remark: Pro hac vice motion(s) granted for Judd E Stone, II on behalf of Amicus Texas, State of. This is a TEXT ENTRY ONLY. There is no PDF document associated with this entry. (BAS)"
        },
        {
          "row_number": 444,
          "id": 3567576,
          "entry_number": "3",
          "date_filed": "2022-03-31T00:00:00-04:00",
          "attachments": [],
          "url": "https://www.courtlistener.com/docket/63203919/3/mi-familia-vota-v-fontes/",
          "recap_pdf_url": null,
          "pacer_doc_id": "025024687738",
          "description": "NOTICE TO PARTY RE: CORPORATE DISCLOSURE STATEMENT: Pursuant to FRCiv 7.1 and LRCiv 7.1.1 the attached Corporate Disclosure Statement form must be filed by all nongovernmental corporate parties with their first appearance. A supplemental statement must be filed upon any change in the information. In addition, if not already filed, the Corporate Disclosure Statement should be filed within 14 days. Corporate Disclosure Statement Deadline set as to Mi Familia Vota. (MCO) (Entered: 03/31/2022)"
        },
        {
          "row_number": 666,
          "id": 3567577,
          "entry_number": "4",
          "date_filed": "2022-03-31T00:00:00-04:00",
          "attachments": [],
          "url": "https://www.courtlistener.com/docket/63203919/4/mi-familia-vota-v-fontes/",
          "recap_pdf_url": null,
          "pacer_doc_id": "025024691073",
          "description": "NOTICE of Appearance by Drew Curtis Ensign on behalf of Mark Brnovich. (Ensign, Drew) (Entered: 03/31/2022)"
        },
        {
          "row_number": 888,
          "id": 3567578,
          "entry_number": "5",
          "date_filed": "2022-03-31T00:00:00-04:00",
          "attachments": [
            {
              "pdf_url": "https://www.courtlistener.com/recap/gov.uscourts.azd.1292039/gov.uscourts.azd.1292039.5.1.pdf",
              "recap_id": 197073964,
              "pacer_url": "https://ecf.azd.uscourts.gov/doc1/025024691202?caseid=1292039",
              "description": "Exhibit Transfer Motion",
              "attachment_number": 1
            }
          ],
          "url": "https://www.courtlistener.com/docket/63203919/5/mi-familia-vota-v-fontes/",
          "recap_pdf_url": "https://www.courtlistener.com/recap/gov.uscourts.azd.1292039/gov.uscourts.azd.1292039.5.0.pdf",
          "pacer_doc_id": "025024691201",
          "description": "NOTICE re: Motion to Transfer This Action by Mark Brnovich . (Attachments: # 1 Exhibit Transfer Motion)(Ensign, Drew) (Entered: 03/31/2022)"
        },
        {
          "row_number": 1332,
          "id": 3567579,
          "entry_number": "7",
          "date_filed": "2022-03-31T00:00:00-04:00",
          "attachments": [
            {
              "recap_id": 197351447,
              "pacer_url": "https://ecf.azd.uscourts.gov/doc1/025024702586?caseid=1292039",
              "description": "Proposed Order",
              "attachment_number": 1
            }
          ],
          "url": "https://www.courtlistener.com/docket/63203919/7/mi-familia-vota-v-fontes/",
          "recap_pdf_url": "https://www.courtlistener.com/recap/gov.uscourts.azd.1292039/gov.uscourts.azd.1292039.7.0.pdf",
          "pacer_doc_id": "025024702585",
          "description": "MOTION to Transfer Related Case by Mark Brnovich. **Doc. 129 in CV-21-01423-PHX-DWL is being re-docketed using the correct event for statistical purposes.** (Attachments: # 1 Proposed Order) (Associated Cases: CV-21-01423-PHX-DWL, CV-22-00509-PHX-SMB) (DXD) (Entered: 04/04/2022)"
        },
        {
          "row_number": 1512,
          "id": 3567581,
          "entry_number": "8",
          "date_filed": "2022-04-05T00:00:00-04:00",
          "attachments": [
            {
              "recap_id": 197463039,
