{
  "case_id": 496,
  "fetched_at": "2025-10-22T00:05:38.115803",
  "case_data": {
    "attorney_orgs": [
      "U.S. Dept. of Justice Civil Rights Division"
    ],
    "available_documents": [
      "Trial Court Docket",
      "Complaint (any)",
      "Injunctive (or Injunctive-like) Relief",
      "Any published opinion",
      "Findings Letter/Report"
    ],
    "case_defendants": [
      {
        "defendant_level": null,
        "institution": "",
        "institution_alt_state": null,
        "institution_city": "Rio Piedras",
        "institution_county": null,
        "name": "Center for Integral Services",
        "defendant_level_other": "",
        "is_active": true
      }
    ],
    "case_ongoing": "Yes",
    "case_status": "Coding Complete",
    "case_types": [
      "Intellectual Disability (Facility)"
    ],
    "cause_other": "",
    "causes": [
      "Civil Rights of Institutionalized Persons Act (CRIPA), 42 U.S.C. ยง 1997 et seq."
    ],
    "class_action_granted": "Not sought",
    "class_action_sought": "No",
    "closing_year": null,
    "constitutional_clause": [],
    "content_of_injunction": [
      {
        "value": "Preliminary relief request withdrawn/mooted"
      }
    ],
    "court": "District of Puerto Rico",
    "custom_issues": [],
    "defendant_payment": "",
    "defendant_type": [
      {
        "value": "Jurisdiction-wide"
      }
    ],
    "docket_status": "Incomplete",
    "facility_type": [
      {
        "value": "Government-run"
      }
    ],
    "filing_date": "1999-04-21",
    "filing_year": 1999,
    "id": 496,
    "injunction_duration": "",
    "issues": [
      "General/Misc.: Food service / nutrition / hydration",
      "Jails, Prisons, Detention Centers, and Other Institutions: Habilitation (training/treatment)",
      "General/Misc.: Individualized planning",
      "Disability and Disability Rights: Integrated setting",
      "General/Misc.: Neglect by staff",
      "Medical/Mental Health Care: Medical care, general",
      "Medical/Mental Health Care: Medication, administration of",
      "Medical/Mental Health Care: Mental health care, general",
      "General/Misc.: Totality of conditions",
      "Disability and Disability Rights: Developmental disability without intellectual disability",
      "Disability and Disability Rights: Intellectual/developmental disability, unspecified"
    ],
    "last_checked_date": "2019-03-21T00:00:00-04:00",
    "main_docket": {
      "id": 42569,
      "docket_entries": [
        {
          "row_number": 3274,
          "id": 8975625,
          "entry_number": null,
          "date_filed": "2016-04-18T00:00:00-04:00",
          "attachments": null,
          "url": "https://www.courtlistener.com",
          "recap_pdf_url": null,
          "pacer_doc_id": null,
          "description": "Order"
        },
        {
          "row_number": 3168,
          "id": 8974594,
          "entry_number": null,
          "date_filed": "2006-11-06T00:00:00-05:00",
          "attachments": null,
          "url": "https://www.courtlistener.com",
          "recap_pdf_url": null,
          "pacer_doc_id": null,
          "description": "Certificate of Funds deposited : Funds Available. $99,857.70 (Including Interest Less Reg Fees) (cm, )"
        },
        {
          "row_number": 2610,
          "id": 8974595,
          "entry_number": "550",
          "date_filed": "2006-11-07T00:00:00-05:00",
          "attachments": null,
          "url": "https://www.courtlistener.com/docket/6672519/550/united-states-v-commonwealth-of-pr/",
          "recap_pdf_url": null,
          "pacer_doc_id": "1590491654",
          "description": "ORDER granting 546 Motion submitting invoice for services rendered by the JCC for the month of September 2006. Signed by Judge Jay A Garcia-Gregory on 11/6/2006. (cm, ) (Entered: 11/07/2006)"
        },
        {
          "row_number": 2618,
          "id": 8974603,
          "entry_number": "558",
          "date_filed": "2006-11-21T00:00:00-05:00",
          "attachments": null,
          "url": "https://www.courtlistener.com/docket/6672519/558/united-states-v-commonwealth-of-pr/",
          "recap_pdf_url": null,
          "pacer_doc_id": null,
          "description": "ORDER noted and approved 557 INFORMATIVE motion. All future requests for disbursements to Dr. McGee shall note the new payee's name. The Clerk of Court shall handle note . Signed by Judge Gustavo A. Gelpi on 11/21/06. (sm, ) (Entered: 11/21/2006)"
        },
        {
          "row_number": 2622,
          "id": 8974607,
          "entry_number": "561",
          "date_filed": "2006-12-12T00:00:00-05:00",
          "attachments": null,
          "url": "https://www.courtlistener.com/docket/6672519/561/united-states-v-commonwealth-of-pr/",
          "recap_pdf_url": null,
          "pacer_doc_id": null,
          "description": "ORDER noted 560 INFORMATIVE motion . The Court APPROVES the parties' proposed itinerary for 1/10/07. Signed by Judge Gustavo A. Gelpi on 12/12/06. (Gelpi, Gustavo) (Entered: 12/12/2006)"
        },
        {
          "row_number": 2623,
          "id": 8974608,
          "entry_number": "562",
          "date_filed": "2006-12-12T00:00:00-05:00",
          "attachments": null,
          "url": "https://www.courtlistener.com/docket/6672519/562/united-states-v-commonwealth-of-pr/",
          "recap_pdf_url": null,
          "pacer_doc_id": null,
          "description": "ORDER, Set Hearings Status Conference set for 1/11/2007 09:30 AM in GAG's Courtroom before Judge Gustavo A. Gelpi. . Signed by Judge Gustavo A. Gelpi on 12/12/06. (Gelpi, Gustavo) (Entered: 12/12/2006)"
        },
        {
          "row_number": 2625,
          "id": 8974610,
          "entry_number": "564",
          "date_filed": "2006-12-14T00:00:00-05:00",
          "attachments": null,
          "url": "https://www.courtlistener.com/docket/6672519/564/united-states-v-commonwealth-of-pr/",
          "recap_pdf_url": null,
          "pacer_doc_id": null,
          "description": "ORDER noted 563 INFORMATIVE motion . Signed by Judge Gustavo A. Gelpi on 12/14/06. (Gelpi, Gustavo) (Entered: 12/14/2006)"
        },
        {
          "row_number": 2626,
          "id": 8974611,
          "entry_number": "565",
          "date_filed": "2007-01-08T00:00:00-05:00",
          "attachments": null,
          "url": "https://www.courtlistener.com/docket/6672519/565/united-states-v-commonwealth-of-pr/",
          "recap_pdf_url": null,
          "pacer_doc_id": "1590519994",
          "description": "MOTION submitting invoice for services rendered by the JCC for the month of November 2006 filed by John J. McGee (Attachments: # 1 Invoices)(ft, ) (Entered: 01/09/2007)"
        },
        {
          "row_number": 2627,
          "id": 8974612,
          "entry_number": "566",
          "date_filed": "2007-01-08T00:00:00-05:00",
          "attachments": null,
          "url": "https://www.courtlistener.com/docket/6672519/566/united-states-v-commonwealth-of-pr/",
          "recap_pdf_url": null,
          "pacer_doc_id": "15901318983",
          "description": "MOTION submitting invoice for services rendered by the JCC for the month of December 2006 filed by John J. McGee (Attachments: # 1 Invoices)(ft, ) (Entered: 01/09/2007)"
        },
        {
          "row_number": 2628,
          "id": 8974613,
          "entry_number": "567",
          "date_filed": "2007-01-11T00:00:00-05:00",
          "attachments": null,
          "url": "https://www.courtlistener.com/docket/6672519/567/united-states-v-commonwealth-of-pr/",
          "recap_pdf_url": null,
          "pacer_doc_id": null,
          "description": "ORDER approving and granting 565 Motion for Disbursement of Funds, approving and granting 566 Motion for Disbursement of Funds . Signed by Judge Gustavo A. Gelpi on 1/11/07. (Gelpi, Gustavo) (Entered: 01/11/2007)"
        },
        {
          "row_number": 2635,
          "id": 8974621,
          "entry_number": "575",
          "date_filed": "2007-02-14T00:00:00-05:00",
          "attachments": null,
          "url": "https://www.courtlistener.com/docket/6672519/575/united-states-v-commonwealth-of-pr/",
          "recap_pdf_url": null,
          "pacer_doc_id": "1590562522",
          "description": "INFORMATIVE Motion regarding MRP filed byMichelle Davila-Montalvo on behalf of The Commonwealth of Puerto Rico, Pedro J. Rossello-Gonzalez, Carmen Feliciano-de-Melecio, Jose De-Leon (Davila-Montalvo, Michelle) (Entered: 02/14/2007)"
        },
        {
          "row_number": 2636,
          "id": 8974622,
          "entry_number": "576",
          "date_filed": "2007-02-15T00:00:00-05:00",
          "attachments": null,
          "url": "https://www.courtlistener.com/docket/6672519/576/united-states-v-commonwealth-of-pr/",
          "recap_pdf_url": null,
          "pacer_doc_id": null,
          "description": "ORDER noted 575 INFORMATIVE motion . Signed by Judge Gustavo A. Gelpi on 2/15/07. (sm, ) (Entered: 02/15/2007)"
        },
        {
          "row_number": 2638,
          "id": 8974624,
          "entry_number": "578",
          "date_filed": "2007-02-28T00:00:00-05:00",
          "attachments": null,
          "url": "https://www.courtlistener.com/docket/6672519/578/united-states-v-commonwealth-of-pr/",
          "recap_pdf_url": null,
          "pacer_doc_id": "15901335852",
          "description": "MOTION Submitting invoice for services rendered by the JCC for the month of January 2007 filed by John J. McGee (Attachments: # 1 Invoice)(jms, ) (Entered: 02/28/2007)"
        },
        {
          "row_number": 2641,
          "id": 8974625,
          "entry_number": "580",
          "date_filed": "2007-03-09T00:00:00-05:00",
          "attachments": null,
          "url": "https://www.courtlistener.com/docket/6672519/580/united-states-v-commonwealth-of-pr/",
          "recap_pdf_url": null,
          "pacer_doc_id": "15901351083",
          "description": "Minute Entry for proceedings held before Judge Gustavo A. Gelpi : On-site inspection and Further Status Conference held on 3/9/2007. (Court Reporter none.) (cr, ) (Entered: 03/12/2007)"
        },
        {
          "row_number": 2639,
          "id": 8974627,
          "entry_number": "579",
          "date_filed": "2007-03-12T00:00:00-04:00",
          "attachments": null,
          "url": "https://www.courtlistener.com/docket/6672519/579/united-states-v-commonwealth-of-pr/",
          "recap_pdf_url": null,
          "pacer_doc_id": null,
          "description": "ORDER granting and approving 578 Motion submitting . Signed by Judge Gustavo A. Gelpi on 3/12/07. (cr, ) (Entered: 03/12/2007)"
        },
        {
          "row_number": 2646,
          "id": 8974631,
          "entry_number": "585",
          "date_filed": "2007-03-14T00:00:00-04:00",
          "attachments": null,
          "url": "https://www.courtlistener.com/docket/6672519/585/united-states-v-commonwealth-of-pr/",
          "recap_pdf_url": null,
          "pacer_doc_id": null,
          "description": "ORDER granting 582 Motion for Leave to File Spanish language documents. A translation shall be filed within thirty (30) days . Signed by Judge Gustavo A. Gelpi on 3/14/07. (sm, ) (Entered: 03/14/2007)"
        },
        {
          "row_number": 2648,
          "id": 8974633,
          "entry_number": "587",
          "date_filed": "2007-03-15T00:00:00-04:00",
          "attachments": null,
          "url": "https://www.courtlistener.com/docket/6672519/587/united-states-v-commonwealth-of-pr/",
          "recap_pdf_url": null,
          "pacer_doc_id": null,
          "description": "ORDER granting as requested 586 Motion for extension of time . Signed by Judge Gustavo A. Gelpi on 3/15/07. (sm, ) (Entered: 03/15/2007)"
        },
        {
          "row_number": 0,
          "id": 8973981,
          "entry_number": "1",
          "date_filed": "1999-04-21T00:00:00-04:00",
          "attachments": [],
          "url": "https://www.courtlistener.com/docket/6672519/1/united-states-v-commonwealth-of-pr/",
          "recap_pdf_url": null,
          "pacer_doc_id": "15904920172",
          "description": "COMPLAINT w/attachment (ct) . Modified on 2/24/2015 to add pdf (ni). (Entered: 04/27/1999)"
        },
        {
          "row_number": 590,
          "id": 8973982,
          "entry_number": "2",
          "date_filed": "1999-04-30T00:00:00-04:00",
          "attachments": [],
          "url": "https://www.courtlistener.com/docket/6672519/2/united-states-v-commonwealth-of-pr/",
          "recap_pdf_url": null,
          "pacer_doc_id": null,
          "description": "INTERIM SETTLEMENT AGREEMENT by USA, Commonwealth of PR, Pedro Rosello, Carmen Feliciano-Vda.-de-Me, Jose De-Leon (mr) (Entered: 05/04/1999)"
        },
        {
          "row_number": 3104,
          "id": 8973983,
          "entry_number": null,
          "date_filed": "1999-04-30T00:00:00-04:00",
          "attachments": [],
          "url": "https://www.courtlistener.com",
          "recap_pdf_url": null,
          "pacer_doc_id": null,
          "description": "ENDORSED ORDER granting [2-1] interim stlmt agreement ( signed by Judge Juan M. Perez-Gimenez ) (mr)"
        },
        {
          "row_number": 1560,
          "id": 8973984,
          "entry_number": "3",
          "date_filed": "1999-04-30T00:00:00-04:00",
          "attachments": [],
          "url": "https://www.courtlistener.com/docket/6672519/3/united-states-v-commonwealth-of-pr/",
          "recap_pdf_url": null,
          "pacer_doc_id": null,
          "description": "JUDGMENT dismissing the case, etc., as stated herein ( signed by Judge Juan M. Perez-Gimenez ) (mr) (Entered: 05/04/1999)"
        },
        {
          "row_number": 3105,
          "id": 8973985,
          "entry_number": null,
          "date_filed": "1999-04-30T00:00:00-04:00",
          "attachments": [],
          "url": "https://www.courtlistener.com",
          "recap_pdf_url": null,
          "pacer_doc_id": null,
          "description": "Case closed (mr)"
        },
        {
          "row_number": 2442,
          "id": 8973986,
          "entry_number": "4",
          "date_filed": "1999-07-30T00:00:00-04:00",
          "attachments": [],
          "url": "https://www.courtlistener.com/docket/6672519/4/united-states-v-commonwealth-of-pr/",
          "recap_pdf_url": null,
          "pacer_doc_id": null,
          "description": "MOTION by Commonwealth of PR, Pedro Rosello, Carmen Feliciano-Vda.-de-Me, Jose De-Leon to Extend Time until 8/22/99 to file with pltf their draft community-based system plan in accordance with the stlmt agreement (mr) (Entered: 08/02/1999)"
        },
        {
          "row_number": 3106,
          "id": 8973987,
          "entry_number": null,
          "date_filed": "1999-08-17T00:00:00-04:00",
          "attachments": [],
          "url": "https://www.courtlistener.com",
          "recap_pdf_url": null,
          "pacer_doc_id": null,
          "description": "ENDORSED ORDER granting [4-1] motion to Extend Time until 8/22/99 to file with pltf their draft community-based system plan in accordance with the stlmt agreement, set Motion Filing deadline to 8/23/99 ( signed by Judge Juan M. Perez-Gimenez ) (mr)"
        },
        {
          "row_number": 2553,
          "id": 8973988,
          "entry_number": "5",
          "date_filed": "1999-10-01T00:00:00-04:00",
          "attachments": [],
          "url": "https://www.courtlistener.com/docket/6672519/5/united-states-v-commonwealth-of-pr/",
          "recap_pdf_url": null,
          "pacer_doc_id": null,
          "description": "NOTICE of Attorney Appearance for Commonwealth of PR, Pedro Rosello, Carmen Feliciano-Vda.-de-Me, Jose De-Leon by Esther Crespin-Credi (ct) (Entered: 10/04/1999)"
        },
        {
          "row_number": 2662,
          "id": 8973989,
          "entry_number": "6",
          "date_filed": "1999-11-03T00:00:00-05:00",
          "attachments": [],
          "url": "https://www.courtlistener.com/docket/6672519/6/united-states-v-commonwealth-of-pr/",
          "recap_pdf_url": null,
          "pacer_doc_id": null,
          "description": "MOTION by Commonwealth of PR, Pedro Rosello, Carmen Feliciano-Vda.-de-Me, Jose De-Leon to Extend Time for a period of 60 days to submit stlmt agreement (mr) (Entered: 11/04/1999)"
        },
        {
          "row_number": 2882,
          "id": 8973991,
          "entry_number": "8",
          "date_filed": "2000-03-01T00:00:00-05:00",
          "attachments": [],
          "url": "https://www.courtlistener.com/docket/6672519/8/united-states-v-commonwealth-of-pr/",
          "recap_pdf_url": null,
          "pacer_doc_id": null,
          "description": "MOTION by Commonwealth of PR, Pedro Rosello, Carmen Feliciano-Vda.-de-Me, Jose De-Leon to Extend Time for 30 days to submit settlement agreement (ct) (Entered: 03/02/2000)"
        },
        {
          "row_number": 2993,
          "id": 8973992,
          "entry_number": "9",
          "date_filed": "2000-03-17T00:00:00-05:00",
          "attachments": [],
          "url": "https://www.courtlistener.com/docket/6672519/9/united-states-v-commonwealth-of-pr/",
          "recap_pdf_url": null,
          "pacer_doc_id": "1590104233",
          "description": "ORDER granting [7-1] motion to Extend Time until 3/1/00 to reach a stlmt agreement Set Advise Court of Settlement deadline to 3/1/00 ( signed by Judge Juan M. Perez-Gimenez ) (ct) (Entered: 03/17/2000)"
        },
        {
          "row_number": 1,
          "id": 8973993,
          "entry_number": "10",
          "date_filed": "2000-03-17T00:00:00-05:00",
          "attachments": [],
          "url": "https://www.courtlistener.com/docket/6672519/10/united-states-v-commonwealth-of-pr/",
          "recap_pdf_url": null,
          "pacer_doc_id": "1590860555",
          "description": "ORDER granting [8-1] motion to Extend Time for 30 days to submit settlement agreement Set Advise Court of Settlement deadline to 4/1/00 ( signed by Judge Juan M. Perez-Gimenez ) (ct) (Entered: 03/17/2000)"
        },
        {
          "row_number": 112,
          "id": 8973994,
          "entry_number": "11",
          "date_filed": "2000-03-30T00:00:00-05:00",
          "attachments": [],
          "url": "https://www.courtlistener.com/docket/6672519/11/united-states-v-commonwealth-of-pr/",
          "recap_pdf_url": null,
          "pacer_doc_id": "1590104235",
          "description": "MINUTES of Setting: setting conference for the approval of the final settlement agreement for 2:00 4/4/00 before Judge Juan M. Perez-Gimenez (Clerk) (ct) (Entered: 03/30/2000)"
        },
        {
          "row_number": 223,
          "id": 8973995,
          "entry_number": "12",
          "date_filed": "2000-03-31T00:00:00-05:00",
          "attachments": [],
          "url": "https://www.courtlistener.com/docket/6672519/12/united-states-v-commonwealth-of-pr/",
          "recap_pdf_url": null,
          "pacer_doc_id": null,
          "description": "JOINT MOTION by USA, Commonwealth of PR, Pedro Rosello, Carmen Feliciano-Vda.-de-Me, Jose De-Leon to Extend Time until 4/4/00 to submit settlement documents (ct) (Entered: 04/03/2000)"
        },
        {
          "row_number": 3108,
          "id": 8973997,
          "entry_number": null,
          "date_filed": "2000-04-04T00:00:00-04:00",
          "attachments": [],
          "url": "https://www.courtlistener.com",
          "recap_pdf_url": null,
          "pacer_doc_id": null,
          "description": "Settlement Conference held before Judge Juan M. Perez-Gimenez (il)"
        },
        {
          "row_number": 334,
          "id": 8973998,
          "entry_number": "13",
          "date_filed": "2000-04-04T00:00:00-04:00",
          "attachments": [],
          "url": "https://www.courtlistener.com/docket/6672519/13/united-states-v-commonwealth-of-pr/",
          "recap_pdf_url": null,
          "pacer_doc_id": null,
          "description": "Minute entry: Stlmt cnf held. Pltfs req the appointment of an independent monitor, which pts agree that Dr. John McGee be appointed. Pts should submit by 4/14/00 a joint mot on the participation of Dr. McGee. If no agreement is reached within 30 days, the Court will start scheduling hearings for July. set Advise Court of Settlement deadline to 5/4/00 ( Judge Juan M. Perez-Gimenez ) (il) (Entered: 04/07/2000)"
        },
        {
          "row_number": 3109,
          "id": 8973999,
          "entry_number": null,
          "date_filed": "2000-04-07T00:00:00-04:00",
          "attachments": [],
          "url": "https://www.courtlistener.com",
          "recap_pdf_url": null,
          "pacer_doc_id": null,
          "description": "ENDORSED ORDER granting [12-1] joint motion to Extend Time until 4/4/00 to submit settlement documents ( signed by Judge Juan M. Perez-Gimenez ) (il)"
        },
        {
          "row_number": 445,
          "id": 8974000,
          "entry_number": "14",
          "date_filed": "2000-04-12T00:00:00-04:00",
          "attachments": [],
          "url": "https://www.courtlistener.com/docket/6672519/14/united-states-v-commonwealth-of-pr/",
          "recap_pdf_url": null,
          "pacer_doc_id": null,
          "description": "MOTION SUBMITTING findings and expert reports w/attachment by USA (ct) (Entered: 04/13/2000)"
        },
        {
          "row_number": 535,
          "id": 8974001,
          "entry_number": "15",
          "date_filed": "2000-04-14T00:00:00-04:00",
          "attachments": [],
          "url": "https://www.courtlistener.com/docket/6672519/15/united-states-v-commonwealth-of-pr/",
          "recap_pdf_url": null,
          "pacer_doc_id": null,
          "description": "SUPPLEMENTAL INTERIM SETTLEMENT AGREEMENT by USA, Commonwealth of PR, Pedro Rosello, Carmen Feliciano-Vda.-de-Me, Jose De-Leon (il) (Entered: 04/17/2000)"
        },
        {
          "row_number": 546,
          "id": 8974002,
          "entry_number": "16",
          "date_filed": "2000-04-27T00:00:00-04:00",
          "attachments": [],
          "url": "https://www.courtlistener.com/docket/6672519/16/united-states-v-commonwealth-of-pr/",
          "recap_pdf_url": null,
          "pacer_doc_id": null,
          "description": "NOTICE of Attorney Appearance for Commonwealth of PR, Pedro Rosello, Carmen Feliciano-Vda.-de-Me, Jose De-Leon by Charles S. Fax, Barron L. Stroud (ct) (Entered: 04/28/2000)"
        },
        {
          "row_number": 557,
          "id": 8974003,
          "entry_number": "17",
          "date_filed": "2000-04-27T00:00:00-04:00",
          "attachments": [],
          "url": "https://www.courtlistener.com/docket/6672519/17/united-states-v-commonwealth-of-pr/",
          "recap_pdf_url": null,
          "pacer_doc_id": null,
          "description": "MOTION by Commonwealth of PR, Pedro Rosello, Carmen Feliciano-Vda.-de-Me, Jose De-Leon for Charles Fax and Barron L. Stroud to Appear Pro Hac Vice Filing Fee $ PENDING (ct) (Entered: 04/28/2000)"
        },
        {
          "row_number": 568,
          "id": 8974004,
          "entry_number": "18",
          "date_filed": "2000-04-28T00:00:00-04:00",
          "attachments": [],
          "url": "https://www.courtlistener.com/docket/6672519/18/united-states-v-commonwealth-of-pr/",
          "recap_pdf_url": null,
          "pacer_doc_id": null,
          "description": "JOINT MOTION by USA, Commonwealth of PR, Pedro Rosello, Carmen Feliciano-Vda.-de-Me, Jose De-Leon to Extend Time until 5/12/00 to submit Dr. McGee's proposed budget (ct) (Entered: 05/01/2000)"
        },
        {
          "row_number": 579,
          "id": 8974005,
          "entry_number": "19",
          "date_filed": "2000-05-11T00:00:00-04:00",
          "attachments": [],
          "url": "https://www.courtlistener.com/docket/6672519/19/united-states-v-commonwealth-of-pr/",
          "recap_pdf_url": null,
          "pacer_doc_id": null,
          "description": "ORDER [14-1] miscellaneous Noted. ( signed by Judge Juan M. Perez-Gimenez ) (ct) (Entered: 05/12/2000)"
        },
        {
          "row_number": 591,
          "id": 8974006,
          "entry_number": "20",
          "date_filed": "2000-05-12T00:00:00-04:00",
          "attachments": [],
          "url": "https://www.courtlistener.com/docket/6672519/20/united-states-v-commonwealth-of-pr/",
          "recap_pdf_url": null,
          "pacer_doc_id": null,
          "description": "MOTION SUBMITTING summary of proposed budget w/attachment by John J. McGee (ct) (Entered: 05/15/2000)"
        },
        {
          "row_number": 602,
          "id": 8974007,
          "entry_number": "21",
          "date_filed": "2000-05-17T00:00:00-04:00",
          "attachments": [],
          "url": "https://www.courtlistener.com/docket/6672519/21/united-states-v-commonwealth-of-pr/",
          "recap_pdf_url": null,
          "pacer_doc_id": null,
          "description": "JOINT SUBMISSION by USA, Commonwealth of PR, Pedro Rosello, Carmen Feliciano-Vda.-de-Me, Jose De-Leon in support of [20-1] proposed budget by John J. McGee (ct) (Entered: 05/18/2000)"
        },
        {
          "row_number": 672,
          "id": 8974008,
          "entry_number": "22",
          "date_filed": "2000-07-11T00:00:00-04:00",
          "attachments": [],
          "url": "https://www.courtlistener.com/docket/6672519/22/united-states-v-commonwealth-of-pr/",
          "recap_pdf_url": null,
          "pacer_doc_id": null,
          "description": "INFORMATIVE MOTION reg. communication with McGee about appt as joint compliance coordinator by defts and to request order accepting the SISA as partial order and jdmt (ni) (Entered: 07/12/2000)"
        },
        {
          "row_number": 783,
          "id": 8974009,
          "entry_number": "23",
          "date_filed": "2000-07-13T00:00:00-04:00",
          "attachments": [],
          "url": "https://www.courtlistener.com/docket/6672519/23/united-states-v-commonwealth-of-pr/",
          "recap_pdf_url": null,
          "pacer_doc_id": "1590860556",
          "description": "ORDER [16-1] appear/appearance notice Noted. granting [17-1] motion for Charles Fax and Barron L. Stroud to Appear Pro Hac Vice Filing Fee $ PENDING mooting [18-1] joint motion to Extend Time until 5/12/00 to submit Dr. McGee's proposed budget ( signed by Judge Juan M. Perez-Gimenez ) (ni) (Entered: 07/13/2000)"
        },
        {
          "row_number": 894,
          "id": 8974010,
          "entry_number": "24",
          "date_filed": "2000-07-13T00:00:00-04:00",
          "attachments": [],
          "url": "https://www.courtlistener.com/docket/6672519/24/united-states-v-commonwealth-of-pr/",
          "recap_pdf_url": null,
          "pacer_doc_id": "1590104236",
          "description": "ORDER approving [20-1] miscellaneous ( signed by Judge Juan M. Perez-Gimenez ) (ni) (Entered: 07/13/2000)"
        },
        {
          "row_number": 1005,
          "id": 8974011,
          "entry_number": "25",
          "date_filed": "2000-07-13T00:00:00-04:00",
          "attachments": [],
          "url": "https://www.courtlistener.com/docket/6672519/25/united-states-v-commonwealth-of-pr/",
          "recap_pdf_url": null,
          "pacer_doc_id": null,
          "description": "ORDER [21-1] support response Noted. ( signed by Judge Juan M. Perez-Gimenez ) (ni) (Entered: 07/13/2000)"
        },
        {
          "row_number": 1116,
          "id": 8974012,
          "entry_number": "26",
          "date_filed": "2000-07-20T00:00:00-04:00",
          "attachments": [],
          "url": "https://www.courtlistener.com/docket/6672519/26/united-states-v-commonwealth-of-pr/",
          "recap_pdf_url": null,
          "pacer_doc_id": "1590860573",
          "description": "Minute entry: vacating [3-1] judgment order ( Judge Juan M. Perez-Gimenez ) (ct) (Entered: 07/21/2000)"
        },
        {
          "row_number": 3110,
          "id": 8974013,
          "entry_number": null,
          "date_filed": "2000-07-20T00:00:00-04:00",
          "attachments": [],
          "url": "https://www.courtlistener.com",
          "recap_pdf_url": null,
          "pacer_doc_id": null,
          "description": "Case reopened (ni)"
        },
        {
          "row_number": 1227,
          "id": 8974014,
          "entry_number": "27",
          "date_filed": "2000-07-21T00:00:00-04:00",
          "attachments": [],
          "url": "https://www.courtlistener.com/docket/6672519/27/united-states-v-commonwealth-of-pr/",
          "recap_pdf_url": null,
          "pacer_doc_id": "1590104238",
          "description": "ORDER approving [15-1] supplemental interim settlement agreement ( signed by Judge Juan M. Perez-Gimenez ) (ct) (Entered: 07/21/2000)"
        },
        {
          "row_number": 1338,
          "id": 8974015,
          "entry_number": "28",
          "date_filed": "2000-07-21T00:00:00-04:00",
          "attachments": [],
          "url": "https://www.courtlistener.com/docket/6672519/28/united-states-v-commonwealth-of-pr/",
          "recap_pdf_url": null,
          "pacer_doc_id": "1590860574",
          "description": "INTERIM PARTIAL JUDGMENT making the interim settlement agreement part of this judgment, etc. ( signed by Judge Juan M. Perez-Gimenez ) (ct) (Entered: 07/21/2000)"
        },
        {
          "row_number": 1449,
          "id": 8974016,
          "entry_number": "29",
          "date_filed": "2000-07-28T00:00:00-04:00",
          "attachments": [],
          "url": "https://www.courtlistener.com/docket/6672519/29/united-states-v-commonwealth-of-pr/",
          "recap_pdf_url": null,
          "pacer_doc_id": null,
          "description": "MOTION SUBMITTING first quarterly advance for payment of services of the joint compliance coordinator in compliance with the suppl. interim stlmt agreement, w/attachment by Commonwealth of PR (ni) (Entered: 08/01/2000)"
        },
        {
          "row_number": 1561,
          "id": 8974017,
          "entry_number": "30",
          "date_filed": "2000-07-28T00:00:00-04:00",
          "attachments": [],
          "url": "https://www.courtlistener.com/docket/6672519/30/united-states-v-commonwealth-of-pr/",
          "recap_pdf_url": null,
          "pacer_doc_id": null,
          "description": "MOTION SUBMITTING invoice for services rendered by the joint compliance coordinator, w/attachment by Commonwealth of PR (ni) (Entered: 08/01/2000)"
        },
        {
          "row_number": 1672,
          "id": 8974018,
          "entry_number": "31",
          "date_filed": "2000-09-01T00:00:00-04:00",
          "attachments": [],
          "url": "https://www.courtlistener.com/docket/6672519/31/united-states-v-commonwealth-of-pr/",
          "recap_pdf_url": null,
          "pacer_doc_id": "1590104239",
          "description": "ORDER granting [30-1] miscellaneous and authorizing the payment of $8,582.94 to John McGee for services rendered. ( signed by Judge Juan M. Perez-Gimenez ) (ct) (Entered: 09/01/2000)"
        },
        {
          "row_number": 1783,
          "id": 8974019,
          "entry_number": "32",
          "date_filed": "2000-09-01T00:00:00-04:00",
          "attachments": [],
          "url": "https://www.courtlistener.com/docket/6672519/32/united-states-v-commonwealth-of-pr/",
          "recap_pdf_url": null,
          "pacer_doc_id": "1590860575",
          "description": "ORDER accepting the $73,336.25 deposited by dfts and directing the Clerk to deposit said amount and to use it for payment of the services provided by John McGee. ( signed by Judge Juan M. Perez-Gimenez ) (ct) (Entered: 09/01/2000)"
        },
        {
          "row_number": 2334,
          "id": 8974020,
          "entry_number": "37",
          "date_filed": "2000-09-19T00:00:00-04:00",
          "attachments": [],
          "url": "https://www.courtlistener.com/docket/6672519/37/united-states-v-commonwealth-of-pr/",
          "recap_pdf_url": null,
          "pacer_doc_id": null,
          "description": "CHECK # 2309799 in the amount of $ 8,582.94 payable to John J. McGee issued (il) (Entered: 10/11/2000)"
        },
        {
          "row_number": 2005,
          "id": 8974021,
          "entry_number": "34",
          "date_filed": "2000-09-20T00:00:00-04:00",
          "attachments": [],
          "url": "https://www.courtlistener.com/docket/6672519/34/united-states-v-commonwealth-of-pr/",
          "recap_pdf_url": null,
          "pacer_doc_id": null,
          "description": "MOTION by Commonwealth of PR for Dennise N. Longo de Morgan to Withdraw as Attorney (ni) (Entered: 09/21/2000)"
        },
        {
          "row_number": 1894,
          "id": 8974022,
          "entry_number": "33",
          "date_filed": "2000-09-21T00:00:00-04:00",
          "attachments": [],
          "url": "https://www.courtlistener.com/docket/6672519/33/united-states-v-commonwealth-of-pr/",
          "recap_pdf_url": null,
          "pacer_doc_id": "1590104250",
          "description": "MEMORANDUM of the Clerk reassigning the case to Judge Garcia-Gregory (ft) (Entered: 09/21/2000)"
        },
        {
          "row_number": 3111,
          "id": 8974023,
          "entry_number": null,
          "date_filed": "2000-09-21T00:00:00-04:00",
          "attachments": [],
          "url": "https://www.courtlistener.com",
          "recap_pdf_url": null,
          "pacer_doc_id": null,
          "description": "CASE reassigned to Judge Jay A. Garcia-Gregory (ft)"
        },
        {
          "row_number": 2116,
          "id": 8974024,
          "entry_number": "35",
          "date_filed": "2000-10-03T00:00:00-04:00",
          "attachments": [],
          "url": "https://www.courtlistener.com/docket/6672519/35/united-states-v-commonwealth-of-pr/",
          "recap_pdf_url": null,
          "pacer_doc_id": "1590860576",
          "description": "ORDER granting [34-1] motion for Dennise N. Longo de Morgan to Withdraw as Attorney (Terminated attorney Dennisse N. Longo-De-Morgan for Commonwealth of PR ( signed by Judge Jay A. Garcia-Gregory ) (il) (Entered: 10/03/2000)"
        },
        {
          "row_number": 2227,
          "id": 8974025,
          "entry_number": "36",
          "date_filed": "2000-10-03T00:00:00-04:00",
          "attachments": [],
          "url": "https://www.courtlistener.com/docket/6672519/36/united-states-v-commonwealth-of-pr/",
          "recap_pdf_url": null,
          "pacer_doc_id": null,
          "description": "MOTION SUBMITTING invoices for services rendered by the joint compliance coordinator w/attachment by Commonwealth of PR, Pedro J. Rossello-Gonzalez, Carmen Feliciano-Vda.-de-Me, Jose De-Leon (il) (Entered: 10/04/2000)"
        },
        {
          "row_number": 2400,
          "id": 8974026,
          "entry_number": "38",
          "date_filed": "2000-10-13T00:00:00-04:00",
          "attachments": [],
          "url": "https://www.courtlistener.com/docket/6672519/38/united-states-v-commonwealth-of-pr/",
          "recap_pdf_url": null,
          "pacer_doc_id": null,
          "description": "Informative Motion by Commonwealth of PR, Pedro J. Rossello-Gonzalez, Carmen Feliciano-Vda.-de-Me, Jose De-Leon re: atty change of address. (il) (Entered: 10/17/2000)"
        },
        {
          "row_number": 2431,
          "id": 8974027,
          "entry_number": "39",
          "date_filed": "2000-11-03T00:00:00-05:00",
          "attachments": [],
          "url": "https://www.courtlistener.com/docket/6672519/39/united-states-v-commonwealth-of-pr/",
          "recap_pdf_url": null,
          "pacer_doc_id": null,
          "description": "MOTION SUBMITTING second quarterly advance for payment of services of the joint compliance coordinator, check # 422868 in the amt of $76,837.25 receipt #112933 w/attachment by Commonwealth of PR, Pedro J. Rossello-Gonzalez, Carmen Feliciano-Vda.-de-Me, Jose De-Leon (il) (Entered: 11/13/2000)"
        },
        {
          "row_number": 2443,
          "id": 8974028,
          "entry_number": "40",
          "date_filed": "2000-11-03T00:00:00-05:00",
          "attachments": [],
          "url": "https://www.courtlistener.com/docket/6672519/40/united-states-v-commonwealth-of-pr/",
          "recap_pdf_url": null,
          "pacer_doc_id": null,
          "description": "MOTION SUBMITTING invoices for services rendered by the joint compliance coordinatorin the amt of $76,837.25 w/attachment by Commonwealth of PR, Pedro J. Rossello-Gonzalez, Carmen Feliciano-Vda.-de-Me, Jose De-Leon (il) (Entered: 11/13/2000)"
        },
        {
          "row_number": 2454,
          "id": 8974029,
          "entry_number": "41",
          "date_filed": "2000-11-08T00:00:00-05:00",
          "attachments": [],
          "url": "https://www.courtlistener.com/docket/6672519/41/united-states-v-commonwealth-of-pr/",
          "recap_pdf_url": null,
          "pacer_doc_id": null,
          "description": "ORDER [38-1] informative motion Noted. ( signed by Judge Jay A. Garcia-Gregory ) (il) (Entered: 11/13/2000)"
        },
        {
          "row_number": 2465,
          "id": 8974030,
          "entry_number": "42",
          "date_filed": "2000-11-29T00:00:00-05:00",
          "attachments": [],
          "url": "https://www.courtlistener.com/docket/6672519/42/united-states-v-commonwealth-of-pr/",
          "recap_pdf_url": null,
          "pacer_doc_id": "1590104251",
          "description": "ORDER granting [39-1] miscellaneous. The Clerk shall deposit the amt of $76,837.25 filed by defts in the Registry of the Court to be used for payment of services provided by John J. McGee, as Joint Compliance Coordinator in this case. ( signed by Judge Jay A. Garcia-Gregory ) (il) (Entered: 11/29/2000)"
        },
        {
          "row_number": 2476,
          "id": 8974031,
          "entry_number": "43",
          "date_filed": "2000-11-29T00:00:00-05:00",
          "attachments": [],
          "url": "https://www.courtlistener.com/docket/6672519/43/united-states-v-commonwealth-of-pr/",
          "recap_pdf_url": null,
          "pacer_doc_id": "1590860577",
          "description": "ORDER granting [40-1] miscellaneous. The Court will approve the invoices and direct the Clerk of the Court to issue a check in the amt of $31,156.66 from the funds deposited in the Registry of the Court by the Government of Puerto Rico for payment of Dr. McGee and his consultant,Mr. Provencal's invoices. ( signed by Judge Jay A. Garcia-Gregory ) (il) (Entered: 11/29/2000)"
        },
        {
          "row_number": 2487,
          "id": 8974032,
          "entry_number": "44",
          "date_filed": "2000-12-12T00:00:00-05:00",
          "attachments": [],
          "url": "https://www.courtlistener.com/docket/6672519/44/united-states-v-commonwealth-of-pr/",
          "recap_pdf_url": null,
          "pacer_doc_id": "1590104271",
          "description": "AMENDED ORDER The Clerk of the Court is ordered to issue the following checks from the funds deposited in the Registry of the Court by the Government of Puerto Rico: John J. McGee, Ph.D. $22,830.61, Gerald Provencal $6,346.45 and MORC, Inc. in the amt of $1,979.60, etc., as stated herein. ( signed by Judge Jay A. Garcia-Gregory ) (il) (Entered: 12/12/2000)"
        },
        {
          "row_number": 2498,
          "id": 8974033,
          "entry_number": "45",
          "date_filed": "2000-12-13T00:00:00-05:00",
          "attachments": [],
          "url": "https://www.courtlistener.com/docket/6672519/45/united-states-v-commonwealth-of-pr/",
          "recap_pdf_url": null,
          "pacer_doc_id": null,
          "description": "CHECK # 2309984 in the amount of $ 6,346.45 payable to Gerald Provencal issued (il) (Entered: 01/17/2001)"
        },
        {
          "row_number": 2520,
          "id": 8974035,
          "entry_number": "47",
          "date_filed": "2000-12-13T00:00:00-05:00",
          "attachments": [],
          "url": "https://www.courtlistener.com/docket/6672519/47/united-states-v-commonwealth-of-pr/",
          "recap_pdf_url": null,
          "pacer_doc_id": null,
          "description": "CHECK # 2309983 in the amount of $ 23,830.61 payable to John M. McGee issued (il) (Entered: 01/17/2001)"
        },
        {
          "row_number": 2531,
          "id": 8974036,
          "entry_number": "48",
          "date_filed": "2001-01-29T00:00:00-05:00",
          "attachments": [],
          "url": "https://www.courtlistener.com/docket/6672519/48/united-states-v-commonwealth-of-pr/",
          "recap_pdf_url": null,
          "pacer_doc_id": null,
          "description": "MOTION SUBMITTING invoices for services rendered by the Joint Compliance Coordinator w/attachment by Commonwealth of PR, Pedro J. Rossello-Gonzalez, Carmen Feliciano-Vda.-de-Me, Jose De-Leon (il) (Entered: 01/30/2001)"
        },
        {
          "row_number": 2542,
          "id": 8974037,
          "entry_number": "49",
          "date_filed": "2001-01-31T00:00:00-05:00",
          "attachments": [],
          "url": "https://www.courtlistener.com/docket/6672519/49/united-states-v-commonwealth-of-pr/",
          "recap_pdf_url": null,
          "pacer_doc_id": null,
          "description": "MOTION SUBMITTING supplement reports regarding facilities w/attachment by John J. McGee (il) (Entered: 02/01/2001)"
        },
        {
          "row_number": 2554,
          "id": 8974038,
          "entry_number": "50",
          "date_filed": "2001-02-06T00:00:00-05:00",
          "attachments": [],
          "url": "https://www.courtlistener.com/docket/6672519/50/united-states-v-commonwealth-of-pr/",
          "recap_pdf_url": null,
          "pacer_doc_id": null,
          "description": "MOTION by defts to Extend Time until 2/26/01 to complete questionnaire Response due 2/20/01 . (il) (Entered: 02/07/2001)"
        },
        {
          "row_number": 2565,
          "id": 8974039,
          "entry_number": "51",
          "date_filed": "2001-02-12T00:00:00-05:00",
          "attachments": [],
          "url": "https://www.courtlistener.com/docket/6672519/51/united-states-v-commonwealth-of-pr/",
          "recap_pdf_url": null,
          "pacer_doc_id": "1590860578",
          "description": "ORDER granting [50-1] motion to Extend Time until 2/26/01 to complete questionnaire set Motion Filing deadline to 2/26/01 ( signed by Judge Jay A. Garcia-Gregory ) (ft) (Entered: 02/12/2001)"
        },
        {
          "row_number": 2576,
          "id": 8974040,
          "entry_number": "52",
          "date_filed": "2001-02-15T00:00:00-05:00",
          "attachments": [],
          "url": "https://www.courtlistener.com/docket/6672519/52/united-states-v-commonwealth-of-pr/",
          "recap_pdf_url": null,
          "pacer_doc_id": "1590104272",
          "description": "ORDER granting [48-1] miscellaneous. The Clerk of the Court is ordered to issue a check in the amt of $25,477.25 payable to John J. McGee, Ph.D., for services rendered from Oct 16th thru Dec. 14,2000, etc., as stated herein. ( signed by Judge Jay A. Garcia-Gregory ) (il) (Entered: 02/15/2001)"
        },
        {
          "row_number": 2587,
          "id": 8974041,
          "entry_number": "53",
          "date_filed": "2001-02-22T00:00:00-05:00",
          "attachments": [],
          "url": "https://www.courtlistener.com/docket/6672519/53/united-states-v-commonwealth-of-pr/",
          "recap_pdf_url": null,
          "pacer_doc_id": null,
          "description": "MOTION by Commonwealth of PR, Pedro J. Rossello-Gonzalez, Carmen Feliciano-Vda.-de-Me, Jose De-Leon for Charles S. Fax to Withdraw as Attorney Response due 3/7/01 . (il) (Entered: 02/23/2001)"
        },
        {
          "row_number": 2620,
          "id": 8974044,
          "entry_number": "56",
          "date_filed": "2001-02-26T00:00:00-05:00",
          "attachments": [],
          "url": "https://www.courtlistener.com/docket/6672519/56/united-states-v-commonwealth-of-pr/",
          "recap_pdf_url": null,
          "pacer_doc_id": null,
          "description": "MOTION with Memorandum in Support by USA to request the Court adopt remedial order based on Dr. McGee's R&R . Response due 3/12/01 . (il) (Entered: 02/27/2001)"
        },
        {
          "row_number": 3112,
          "id": 8974045,
          "entry_number": null,
          "date_filed": "2001-02-26T00:00:00-05:00",
          "attachments": [],
          "url": "https://www.courtlistener.com",
          "recap_pdf_url": null,
          "pacer_doc_id": null,
          "description": "Status Conference held before Judge Jay A. Garcia-Gregory (ft)"
        },
        {
          "row_number": 3113,
          "id": 8974046,
          "entry_number": null,
          "date_filed": "2001-02-26T00:00:00-05:00",
          "attachments": [],
          "url": "https://www.courtlistener.com",
          "recap_pdf_url": null,
          "pacer_doc_id": null,
          "description": "Status Conference held before Judge Jay A. Garcia-Gregory (il)"
        },
        {
          "row_number": 2629,
          "id": 8974047,
          "entry_number": "57",
          "date_filed": "2001-02-26T00:00:00-05:00",
          "attachments": [],
          "url": "https://www.courtlistener.com/docket/6672519/57/united-states-v-commonwealth-of-pr/",
          "recap_pdf_url": null,
          "pacer_doc_id": "1590860579",
          "description": "Minute entry: S/C held. Pts are granted until 4/6/01 to submit the Community Service Plan. Several S/C are set. The Court will set an ocular inspection at a later time. set Notice of Compliance deadline to 4/6/01, set Status Conference for 4:00 5/11/01 before Judge Jay A. Garcia-Gregory, set Status Conference for 4:00 8/3/01 before Judge Jay A. Garcia-Gregory, set Status Conference for 4:00 10/19/01 before Judge Jay A. Garcia-Gregory, and set Status Conference for 4:00 12/14/01 before Judge Jay A. Garcia-Gregory ( Judge Jay A. Garcia-Gregory ) (il) (Entered: 03/02/2001)"
        },
        {
          "row_number": 2640,
          "id": 8974048,
          "entry_number": "58",
          "date_filed": "2001-03-20T00:00:00-05:00",
          "attachments": [],
          "url": "https://www.courtlistener.com/docket/6672519/58/united-states-v-commonwealth-of-pr/",
          "recap_pdf_url": null,
          "pacer_doc_id": null,
          "description": "MOTION SUBMITTING John J. McGee invoices for svcs rendered by w/attachment by the dfts. (ft) (Entered: 03/22/2001)"
        },
        {
          "row_number": 2651,
          "id": 8974049,
          "entry_number": "59",
          "date_filed": "2001-03-27T00:00:00-05:00",
          "attachments": [],
          "url": "https://www.courtlistener.com/docket/6672519/59/united-states-v-commonwealth-of-pr/",
          "recap_pdf_url": null,
          "pacer_doc_id": null,
          "description": "NOTICE of Attorney Appearance for Commonwealth of PR, Pedro J. Rossello-Gonzalez, Carmen Feliciano-Vda.-de-Me, Jose De-Leon by Carlos Del-Valle-Cruz (ft) (Entered: 03/29/2001)"
        },
        {
          "row_number": 2663,
          "id": 8974050,
          "entry_number": "60",
          "date_filed": "2001-03-28T00:00:00-05:00",
          "attachments": [],
          "url": "https://www.courtlistener.com/docket/6672519/60/united-states-v-commonwealth-of-pr/",
          "recap_pdf_url": null,
          "pacer_doc_id": null,
          "description": "MOTION by Commonwealth of PR, Pedro J. Rossello-Gonzalez, Carmen Feliciano-Vda.-de-Me, Jose De-Leon to Accept Spanish Language Documents (ft) (Entered: 03/29/2001)"
        },
        {
          "row_number": 2674,
          "id": 8974051,
          "entry_number": "61",
          "date_filed": "2001-04-05T00:00:00-04:00",
          "attachments": [],
          "url": "https://www.courtlistener.com/docket/6672519/61/united-states-v-commonwealth-of-pr/",
          "recap_pdf_url": null,
          "pacer_doc_id": null,
          "description": "MOTION by Commonwealth of PR, Pedro J. Rossello-Gonzalez, Carmen Feliciano-Vda.-de-Me, Jose De-Leon to Extend Time until 4/13/01 to file dft's Community Based Svc Plan (ft) (Entered: 04/06/2001)"
        },
        {
          "row_number": 2685,
          "id": 8974052,
          "entry_number": "62",
          "date_filed": "2001-04-09T00:00:00-04:00",
          "attachments": [],
          "url": "https://www.courtlistener.com/docket/6672519/62/united-states-v-commonwealth-of-pr/",
          "recap_pdf_url": null,
          "pacer_doc_id": "1590104277",
          "description": "ORDER granting [53-1] motion for Charles S. Fax to Withdraw as Attorney ( signed by Judge Jay A. Garcia-Gregory ) (ft) (Entered: 04/09/2001)"
        },
        {
          "row_number": 2696,
          "id": 8974053,
          "entry_number": "63",
          "date_filed": "2001-04-09T00:00:00-04:00",
          "attachments": [],
          "url": "https://www.courtlistener.com/docket/6672519/63/united-states-v-commonwealth-of-pr/",
          "recap_pdf_url": null,
          "pacer_doc_id": "1590860580",
          "description": "ORDER granting [54-1] miscellaneous. The Ct orders the payment of svcs rendered by John McGee during the month of Jan. 2001 in the amount of $20,369.70. ( signed by Judge Jay A. Garcia-Gregory ) (ft) (Entered: 04/09/2001)"
        },
        {
          "row_number": 2707,
          "id": 8974054,
          "entry_number": "64",
          "date_filed": "2001-04-11T00:00:00-04:00",
          "attachments": [],
          "url": "https://www.courtlistener.com/docket/6672519/64/united-states-v-commonwealth-of-pr/",
          "recap_pdf_url": null,
          "pacer_doc_id": null,
          "description": "MOTION by Commonwealth of PR, Pedro J. Rossello-Gonzalez, Carmen Feliciano-Vda.-de-Me, Jose De-Leon to Extend Time until 4/19/01 to file proposed community service plan (ct) (Entered: 04/16/2001)"
        },
        {
          "row_number": 2718,
          "id": 8974055,
          "entry_number": "65",
          "date_filed": "2001-04-16T00:00:00-04:00",
          "attachments": [],
          "url": "https://www.courtlistener.com/docket/6672519/65/united-states-v-commonwealth-of-pr/",
          "recap_pdf_url": null,
          "pacer_doc_id": "1590104278",
          "description": "ORDER [60-1] motion to Accept Spanish Language Documents Noted. Dfts shall file translations of the docs. w/in 60 days. Set Notice of Compliance deadline to 6/18/01 ( signed by Judge Jay A. Garcia-Gregory ) (ct) (Entered: 04/16/2001)"
        },
        {
          "row_number": 2738,
          "id": 8974057,
          "entry_number": "67",
          "date_filed": "2001-04-20T00:00:00-04:00",
          "attachments": [],
          "url": "https://www.courtlistener.com/docket/6672519/67/united-states-v-commonwealth-of-pr/",
          "recap_pdf_url": null,
          "pacer_doc_id": null,
          "description": "ORDER [59-1] appear/appearance notice Noted. mooting [61-1] motion to Extend Time until 4/13/01 to file dft's Community Based Svc Plan ( signed by Judge Jay A. Garcia-Gregory ) (ft) (Entered: 04/20/2001)"
        },
        {
          "row_number": 2749,
          "id": 8974058,
          "entry_number": "68",
          "date_filed": "2001-04-20T00:00:00-04:00",
          "attachments": [],
          "url": "https://www.courtlistener.com/docket/6672519/68/united-states-v-commonwealth-of-pr/",
          "recap_pdf_url": null,
          "pacer_doc_id": "1590860581",
          "description": "ORDER granting [64-1] motion to Extend Time until 4/19/01 to file proposed community service plan ( signed by Judge Jay A. Garcia-Gregory ) (ft) (Entered: 04/20/2001)"
        },
        {
          "row_number": 2772,
          "id": 8974060,
          "entry_number": "70",
          "date_filed": "2001-04-25T00:00:00-04:00",
          "attachments": [],
          "url": "https://www.courtlistener.com/docket/6672519/70/united-states-v-commonwealth-of-pr/",
          "recap_pdf_url": null,
          "pacer_doc_id": null,
          "description": "MOTION SUBMITTING amended community based-svc plan of the mental retardation program. w/attachment by Commonwealth of PR, Pedro J. Rossello-Gonzalez, Carmen Feliciano-Vda.-de-Me, Jose De-Leon (ft) (Entered: 04/26/2001)"
        },
        {
          "row_number": 3114,
          "id": 8974061,
          "entry_number": null,
          "date_filed": "2001-04-27T00:00:00-04:00",
          "attachments": [],
          "url": "https://www.courtlistener.com",
          "recap_pdf_url": null,
          "pacer_doc_id": null,
          "description": "CERTIFICATION of funds deposited on: 7/28/01 and 11/13/00, amt: $73,336.75. Acc #4005646680, plus int and reg fees. (ft)"
        },
        {
          "row_number": 2783,
          "id": 8974062,
          "entry_number": "71",
          "date_filed": "2001-05-02T00:00:00-04:00",
          "attachments": [],
          "url": "https://www.courtlistener.com/docket/6672519/71/united-states-v-commonwealth-of-pr/",
          "recap_pdf_url": null,
          "pacer_doc_id": null,
          "description": "MOTION by Commonwealth of PR, Pedro J. Rossello-Gonzalez, Carmen Feliciano-Vda.-de-Me, Jose De-Leon for setting of S/C (ft) (Entered: 05/04/2001)"
        },
        {
          "row_number": 2794,
          "id": 8974063,
          "entry_number": "72",
          "date_filed": "2001-05-07T00:00:00-04:00",
          "attachments": [],
          "url": "https://www.courtlistener.com/docket/6672519/72/united-states-v-commonwealth-of-pr/",
          "recap_pdf_url": null,
          "pacer_doc_id": "1590104279",
          "description": "ORDER granting [58-1] miscellaneous ( signed by Judge Jay A. Garcia-Gregory ) (ft) (Entered: 05/07/2001)"
        },
        {
          "row_number": 2805,
          "id": 8974064,
          "entry_number": "73",
          "date_filed": "2001-05-08T00:00:00-04:00",
          "attachments": [],
          "url": "https://www.courtlistener.com/docket/6672519/73/united-states-v-commonwealth-of-pr/",
          "recap_pdf_url": null,
          "pacer_doc_id": "1590860582",
          "description": "ORDER granting [71-1] motion for setting of S/C resetting Status Conference for 3:30 6/14/01 before Judge Jay A. Garcia-Gregory ( signed by Judge Jay A. Garcia-Gregory ) (ft) (Entered: 05/08/2001)"
        },
        {
          "row_number": 2816,
          "id": 8974065,
          "entry_number": "74",
          "date_filed": "2001-05-16T00:00:00-04:00",
          "attachments": [],
          "url": "https://www.courtlistener.com/docket/6672519/74/united-states-v-commonwealth-of-pr/",
          "recap_pdf_url": null,
          "pacer_doc_id": null,
          "description": "CHECK # 2522803 in the amount of $ 20,369.70 payable to John McGee issued (ft) (Entered: 05/16/2001)"
        },
        {
          "row_number": 2827,
          "id": 8974066,
          "entry_number": "75",
          "date_filed": "2001-05-30T00:00:00-04:00",
          "attachments": [],
          "url": "https://www.courtlistener.com/docket/6672519/75/united-states-v-commonwealth-of-pr/",
          "recap_pdf_url": null,
          "pacer_doc_id": null,
          "description": "Informative Motion by Commonwealth of PR re: appointment of Anabelle Rodriguez as the Governor's Personal Representative . (ft) (Entered: 06/01/2001)"
        },
        {
          "row_number": 2838,
          "id": 8974067,
          "entry_number": "76",
          "date_filed": "2001-06-04T00:00:00-04:00",
          "attachments": [],
          "url": "https://www.courtlistener.com/docket/6672519/76/united-states-v-commonwealth-of-pr/",
          "recap_pdf_url": null,
          "pacer_doc_id": null,
          "description": "MOTION by Commonwealth of PR, Pedro J. Rossello-Gonzalez, Carmen Feliciano-Vda.-de-Me, Jose De-Leon to Extend Time 7/24/01 to file cert translations of docs attached to inf mot (ft) (Entered: 06/06/2001)"
        },
        {
          "row_number": 2849,
          "id": 8974068,
          "entry_number": "77",
          "date_filed": "2001-06-07T00:00:00-04:00",
          "attachments": [],
          "url": "https://www.courtlistener.com/docket/6672519/77/united-states-v-commonwealth-of-pr/",
          "recap_pdf_url": null,
          "pacer_doc_id": null,
          "description": "ORDER [75-1] informative motion Noted. ( signed by Judge Jay A. Garcia-Gregory ) (ft) (Entered: 06/07/2001)"
        },
        {
          "row_number": 3115,
          "id": 8974069,
          "entry_number": null,
          "date_filed": "2001-06-15T00:00:00-04:00",
          "attachments": [],
          "url": "https://www.courtlistener.com",
          "recap_pdf_url": null,
          "pacer_doc_id": null,
          "description": "Status Conference held before Judge Jay A. Garcia-Gregory (re)"
        },
        {
          "row_number": 2860,
          "id": 8974070,
          "entry_number": "78",
          "date_filed": "2001-06-15T00:00:00-04:00",
          "attachments": [],
          "url": "https://www.courtlistener.com/docket/6672519/78/united-states-v-commonwealth-of-pr/",
          "recap_pdf_url": null,
          "pacer_doc_id": "1590104280",
          "description": "Minute entry: Further status conf. held. Defts. are to file the final version of the community plan by 8/3/01 setting Motion Filing deadline to 8/3/01, and by 9/6 01 the report of the institutions, [setting Status Report deadline to 9/6/01, setting further Status Conference for 3:00 9/6/01 before Judge Jay A. Garcia-Gregory ( Judge Jay A. Garcia-Gregory ) (re) (Entered: 06/22/2001)"
        },
        {
          "row_number": 2883,
          "id": 8974072,
          "entry_number": "80",
          "date_filed": "2001-06-27T00:00:00-04:00",
          "attachments": [],
          "url": "https://www.courtlistener.com/docket/6672519/80/united-states-v-commonwealth-of-pr/",
          "recap_pdf_url": null,
          "pacer_doc_id": null,
          "description": "MOTION by all dfts requesting clarification of minutes of proceedings dated 6/15/01 (ft) (Entered: 06/29/2001)"
        },
        {
          "row_number": 2894,
          "id": 8974073,
          "entry_number": "81",
          "date_filed": "2001-07-03T00:00:00-04:00",
          "attachments": [],
          "url": "https://www.courtlistener.com/docket/6672519/81/united-states-v-commonwealth-of-pr/",
          "recap_pdf_url": null,
          "pacer_doc_id": null,
          "description": "RESPONSE by USA in opposition to [80-1] motion requesting clarification of minutes of proceedings dated 6/15/01 by Jose De-Leon, Carmen Feliciano-Vda.-de-Me, Pedro J. Rossello-Gonzalez, Commonwealth of PR (np) (Entered: 07/05/2001)"
        },
        {
          "row_number": 2905,
          "id": 8974074,
          "entry_number": "82",
          "date_filed": "2001-07-31T00:00:00-04:00",
          "attachments": [],
          "url": "https://www.courtlistener.com/docket/6672519/82/united-states-v-commonwealth-of-pr/",
          "recap_pdf_url": null,
          "pacer_doc_id": "1590104281",
          "description": "ORDER granting [80-1] motion requesting clarification of minutes of proceedings dated 6/15/01. The minutes will reflect that dfts rep that they intend to commence making community placements by July, 2002. terminating [81-1] opposition response ( signed by Judge Jay A. ) (ft) (Entered: 07/31/2001)"
        },
        {
          "row_number": 2916,
          "id": 8974075,
          "entry_number": "83",
          "date_filed": "2001-08-03T00:00:00-04:00",
          "attachments": [],
          "url": "https://www.courtlistener.com/docket/6672519/83/united-states-v-commonwealth-of-pr/",
          "recap_pdf_url": null,
          "pacer_doc_id": null,
          "description": "MOTION by Commonwealth of PR, Pedro J. Rossello-Gonzalez, Carmen Feliciano-Vda.-de-Me, Jose De-Leon to Extend Time until 9/6/01 to file dfts' Community Based Service Plan (ft) (Entered: 08/07/2001)"
        },
        {
          "row_number": 2927,
          "id": 8974076,
          "entry_number": "84",
          "date_filed": "2001-08-14T00:00:00-04:00",
          "attachments": [],
          "url": "https://www.courtlistener.com/docket/6672519/84/united-states-v-commonwealth-of-pr/",
          "recap_pdf_url": null,
          "pacer_doc_id": "1590860584",
          "description": "ORDER granting [83-1] motion to Extend Time until 9/6/01 to file dfts' Community Based Service Plan. Dft are granted until 9/5/01 to file the Comm. Based Svc Plan. set Notice of Compliance deadline to 9/5/01 ( signed by Judge Jay A. Garcia-Gregory ) (ft) (Entered: 08/14/2001)"
        },
        {
          "row_number": 2938,
          "id": 8974077,
          "entry_number": "85",
          "date_filed": "2001-09-06T00:00:00-04:00",
          "attachments": [],
          "url": "https://www.courtlistener.com/docket/6672519/85/united-states-v-commonwealth-of-pr/",
          "recap_pdf_url": null,
          "pacer_doc_id": null,
          "description": "MOTION by Commonwealth of PR, Pedro J. Rossello-Gonzalez, Carmen Feliciano-Vda.-de-Me, Jose De-Leon to Extend Time until 9/12/01 to file the Report of the Institutions (ft) (Entered: 09/07/2001)"
        },
        {
          "row_number": 2949,
          "id": 8974078,
          "entry_number": "86",
          "date_filed": "2001-09-06T00:00:00-04:00",
          "attachments": [],
          "url": "https://www.courtlistener.com/docket/6672519/86/united-states-v-commonwealth-of-pr/",
          "recap_pdf_url": null,
          "pacer_doc_id": null,
          "description": "Informative Motion by All Defendants re: filing of the Community Based Service Plan. (ft) (Entered: 09/07/2001)"
        },
        {
          "row_number": 2960,
          "id": 8974079,
          "entry_number": "87",
          "date_filed": "2001-09-06T00:00:00-04:00",
          "attachments": [],
          "url": "https://www.courtlistener.com/docket/6672519/87/united-states-v-commonwealth-of-pr/",
          "recap_pdf_url": null,
          "pacer_doc_id": null,
          "description": "MOTION SUBMITTING The Community Based Service Plan of the Mental Retardation Program by Commonwealth of PR (ft) (Entered: 09/07/2001)"
        },
        {
          "row_number": 3116,
          "id": 8974080,
          "entry_number": null,
          "date_filed": "2001-09-06T00:00:00-04:00",
          "attachments": [],
          "url": "https://www.courtlistener.com",
          "recap_pdf_url": null,
          "pacer_doc_id": null,
          "description": "Status Conference held before Judge Jay A. Garcia-Gregory (su)"
        },
        {
          "row_number": 3038,
          "id": 8974087,
          "entry_number": "94",
          "date_filed": "2001-09-19T00:00:00-04:00",
          "attachments": null,
          "url": "https://www.courtlistener.com/docket/6672519/94/united-states-v-commonwealth-of-pr/",
          "recap_pdf_url": null,
          "pacer_doc_id": null,
          "description": "MOTION SUBMITTING invoice for svcs rendered for the month of June 2001. w/attachment by John J. McGee (ft) (Entered: 09/21/2001)"
        },
        {
          "row_number": 3049,
          "id": 8974088,
          "entry_number": "95",
          "date_filed": "2001-09-19T00:00:00-04:00",
          "attachments": null,
          "url": "https://www.courtlistener.com/docket/6672519/95/united-states-v-commonwealth-of-pr/",
          "recap_pdf_url": null,
          "pacer_doc_id": null,
          "description": "MOTION SUBMITTING invoice for svcs rendered for the month of July 2001. w/attachment by John J. McGee (ft) (Entered: 09/21/2001)"
        },
        {
          "row_number": 3060,
          "id": 8974089,
          "entry_number": "96",
          "date_filed": "2001-09-19T00:00:00-04:00",
          "attachments": null,
          "url": "https://www.courtlistener.com/docket/6672519/96/united-states-v-commonwealth-of-pr/",
          "recap_pdf_url": null,
          "pacer_doc_id": null,
          "description": "MOTION SUBMITTING invoice for svcs rendered for the month of August 2001. w/attachment by John J. McGee (ft) (Entered: 09/21/2001)"
        },
        {
          "row_number": 3071,
          "id": 8974090,
          "entry_number": "97",
          "date_filed": "2001-09-19T00:00:00-04:00",
          "attachments": null,
          "url": "https://www.courtlistener.com/docket/6672519/97/united-states-v-commonwealth-of-pr/",
          "recap_pdf_url": null,
          "pacer_doc_id": null,
          "description": "MOTION SUBMITTING invoice for svcs rendered by consultant for the joint compliance coordinator. w/attachment by John J. McGee (ft) (Entered: 09/21/2001)"
        },
        {
          "row_number": 3117,
          "id": 8974091,
          "entry_number": null,
          "date_filed": "2001-09-24T00:00:00-04:00",
          "attachments": null,
          "url": "https://www.courtlistener.com",
          "recap_pdf_url": null,
          "pacer_doc_id": null,
          "description": "CERTIFICATION of funds deposited on: 11/13/00, amt: $150,174.00. Remaining Balance $37,550.55 less $358.96 of registry fee. Acct #4005646680. (ft)"
        },
        {
          "row_number": 3093,
          "id": 8974093,
          "entry_number": "99",
          "date_filed": "2001-09-25T00:00:00-04:00",
          "attachments": null,
          "url": "https://www.courtlistener.com/docket/6672519/99/united-states-v-commonwealth-of-pr/",
          "recap_pdf_url": null,
          "pacer_doc_id": null,
          "description": "MEMORANDUM by USA in support of [87-1] miscellaneous by Commonwealth of PR (ft) (Entered: 09/27/2001)"
        },
        {
          "row_number": 2,
          "id": 8974094,
          "entry_number": "100",
          "date_filed": "2001-09-28T00:00:00-04:00",
          "attachments": null,
          "url": "https://www.courtlistener.com/docket/6672519/100/united-states-v-commonwealth-of-pr/",
          "recap_pdf_url": null,
          "pacer_doc_id": null,
          "description": "MOTION by Commonwealth of PR, Pedro J. Rossello-Gonzalez, Carmen Feliciano-Vda.-de-Me, Jose De-Leon to Extend Time until 10/11/01 to respond to Dr. McGee's invoices (ft) (Entered: 10/03/2001)"
        },
        {
          "row_number": 13,
          "id": 8974095,
          "entry_number": "101",
          "date_filed": "2001-10-01T00:00:00-04:00",
          "attachments": null,
          "url": "https://www.courtlistener.com/docket/6672519/101/united-states-v-commonwealth-of-pr/",
          "recap_pdf_url": null,
          "pacer_doc_id": null,
          "description": "MOTION SUBMITTING an alternative proposed order w/attachment by Commonwealth of PR, Pedro J. Rossello-Gonzalez, Carmen Feliciano-Vda.-de-Me, Jose De-Leon (ft) (Entered: 10/03/2001)"
        },
        {
          "row_number": 24,
          "id": 8974096,
          "entry_number": "102",
          "date_filed": "2001-10-04T00:00:00-04:00",
          "attachments": null,
          "url": "https://www.courtlistener.com/docket/6672519/102/united-states-v-commonwealth-of-pr/",
          "recap_pdf_url": null,
          "pacer_doc_id": "1590104283",
          "description": "ORDER for dfts and Dr. McGee to inform by 10/9/01 whether the DOJ has received and review the invoices. set Notice of Compliance deadline to 10/9/01, Dfts will also deposit in Ct by 10/15/01 a sum sufficient to cover the disbursement of the invoices submitted. set Notice of Compliance deadline to 10/15/01 ( signed by Judge Jay A. Garcia-Gregory ) (ft) (Entered: 10/04/2001)"
        },
        {
          "row_number": 35,
          "id": 8974097,
          "entry_number": "103",
          "date_filed": "2001-10-05T00:00:00-04:00",
          "attachments": null,
          "url": "https://www.courtlistener.com/docket/6672519/103/united-states-v-commonwealth-of-pr/",
          "recap_pdf_url": null,
          "pacer_doc_id": null,
          "description": "MOTION SUBMITTING monies regarding JCC invoices in the amount of $259,465.00, Receipt #121120 by Commonwealth of PR (ft) (Entered: 10/09/2001)"
        },
        {
          "row_number": 46,
          "id": 8974098,
          "entry_number": "104",
          "date_filed": "2001-10-09T00:00:00-04:00",
          "attachments": null,
          "url": "https://www.courtlistener.com/docket/6672519/104/united-states-v-commonwealth-of-pr/",
          "recap_pdf_url": null,
          "pacer_doc_id": "1590860586",
          "description": "ORDER adopting [87-1] the Community Based Service Plan for the Commonwealth of PR ( signed by Judge Jay A. Garcia-Gregory ) (ft) (Entered: 10/09/2001)"
        },
        {
          "row_number": 146,
          "id": 8974108,
          "entry_number": "113",
          "date_filed": "2001-10-31T00:00:00-05:00",
          "attachments": null,
          "url": "https://www.courtlistener.com/docket/6672519/113/united-states-v-commonwealth-of-pr/",
          "recap_pdf_url": null,
          "pacer_doc_id": null,
          "description": "RESPONSE by USA to various motions of dfts w/regard to payment issues related to invoices submitted by the JCC. (ft) (Entered: 10/31/2001)"
        },
        {
          "row_number": 157,
          "id": 8974109,
          "entry_number": "114",
          "date_filed": "2001-10-31T00:00:00-05:00",
          "attachments": null,
          "url": "https://www.courtlistener.com/docket/6672519/114/united-states-v-commonwealth-of-pr/",
          "recap_pdf_url": null,
          "pacer_doc_id": null,
          "description": "MOTION SUBMITTING invoice for svcs rendered in Sept. 2001 w/attachment by John J. McGee (ft) (Entered: 11/01/2001)"
        },
        {
          "row_number": 168,
          "id": 8974110,
          "entry_number": "115",
          "date_filed": "2001-11-01T00:00:00-05:00",
          "attachments": null,
          "url": "https://www.courtlistener.com/docket/6672519/115/united-states-v-commonwealth-of-pr/",
          "recap_pdf_url": null,
          "pacer_doc_id": null,
          "description": "MOTION by Commonwealth of PR to allow 3 days from the filing of JCC's Operating Budget for 2001-2002 to reply to the JCC's invoice for October 2001 (ft) (Entered: 11/02/2001)"
        },
        {
          "row_number": 235,
          "id": 8974118,
          "entry_number": "121",
          "date_filed": "2001-12-05T00:00:00-05:00",
          "attachments": null,
          "url": "https://www.courtlistener.com/docket/6672519/121/united-states-v-commonwealth-of-pr/",
          "recap_pdf_url": null,
          "pacer_doc_id": null,
          "description": "Informative Motion by USA re: submission w/regards to the proposed budget of the JCC. (ft) (Entered: 12/06/2001)"
        },
        {
          "row_number": 246,
          "id": 8974119,
          "entry_number": "122",
          "date_filed": "2001-12-07T00:00:00-05:00",
          "attachments": null,
          "url": "https://www.courtlistener.com/docket/6672519/122/united-states-v-commonwealth-of-pr/",
          "recap_pdf_url": null,
          "pacer_doc_id": null,
          "description": "MOTION SUBMITTING translations of docs attached to verified inf mot and req for leave to file docs in Spanish filed on 3/28/01. w/attachment by all defendants (ft) (Entered: 12/11/2001)"
        },
        {
          "row_number": 268,
          "id": 8974121,
          "entry_number": "124",
          "date_filed": "2001-12-11T00:00:00-05:00",
          "attachments": null,
          "url": "https://www.courtlistener.com/docket/6672519/124/united-states-v-commonwealth-of-pr/",
          "recap_pdf_url": null,
          "pacer_doc_id": null,
          "description": "ORDER [119-1] informative motion Noted. ( signed by Judge Jay A. Garcia-Gregory ) (ft) (Entered: 12/11/2001)"
        },
        {
          "row_number": 279,
          "id": 8974122,
          "entry_number": "125",
          "date_filed": "2001-12-17T00:00:00-05:00",
          "attachments": null,
          "url": "https://www.courtlistener.com/docket/6672519/125/united-states-v-commonwealth-of-pr/",
          "recap_pdf_url": null,
          "pacer_doc_id": null,
          "description": "MOTION SUBMITTING Proposed FY 2001-2002 Budget w/attachment by John J. McGee (ft) (Entered: 12/18/2001)"
        },
        {
          "row_number": 323,
          "id": 8974127,
          "entry_number": "129",
          "date_filed": "2001-12-26T00:00:00-05:00",
          "attachments": null,
          "url": "https://www.courtlistener.com/docket/6672519/129/united-states-v-commonwealth-of-pr/",
          "recap_pdf_url": null,
          "pacer_doc_id": null,
          "description": "ORDER mooting [112-1] motion to allow 3 days from the filing of the JCC's operating budget for fiscal year 2001-2001 to object and to reply to USA response to various mots w/regard to JCC payment issues ( signed by Judge Jay A. Garcia-Gregory ) (ft) (Entered: 12/26/2001)"
        },
        {
          "row_number": 368,
          "id": 8974132,
          "entry_number": "133",
          "date_filed": "2002-01-08T00:00:00-05:00",
          "attachments": null,
          "url": "https://www.courtlistener.com/docket/6672519/133/united-states-v-commonwealth-of-pr/",
          "recap_pdf_url": null,
          "pacer_doc_id": null,
          "description": "Partial RESPONSE by Commonwealth of PR in opposition to [132-1] miscellaneous by John J. McGee (ft) (Entered: 01/09/2002)"
        },
        {
          "row_number": 379,
          "id": 8974133,
          "entry_number": "134",
          "date_filed": "2002-01-16T00:00:00-05:00",
          "attachments": null,
          "url": "https://www.courtlistener.com/docket/6672519/134/united-states-v-commonwealth-of-pr/",
          "recap_pdf_url": null,
          "pacer_doc_id": null,
          "description": "MOTION SUBMITTING Report of the Aguadilla Facility w/attachment by Commonwealth of PR, Pedro J. Rossello-Gonzalez, Carmen Feliciano-Vda.-de-Me, Jose De-Leon (ft) (Entered: 01/17/2002)"
        },
        {
          "row_number": 412,
          "id": 8974137,
          "entry_number": "137",
          "date_filed": "2002-01-24T00:00:00-05:00",
          "attachments": null,
          "url": "https://www.courtlistener.com/docket/6672519/137/united-states-v-commonwealth-of-pr/",
          "recap_pdf_url": null,
          "pacer_doc_id": "1590104288",
          "description": "ORDER granting [131-1] mot submitting invoices, granting [132-1] mot submitting invoices, granting [130-1] mot sumitting invoices. The Commonwealth is ordered to make a deposit for the payment of future invoices in accordance w/the Suppl Interim Stlmt Agreement. ( signed by Judge Jay A. Garcia-Gregory ) (ft) (Entered: 01/24/2002)"
        },
        {
          "row_number": 479,
          "id": 8974143,
          "entry_number": "143",
          "date_filed": "2002-03-04T00:00:00-05:00",
          "attachments": null,
          "url": "https://www.courtlistener.com/docket/6672519/143/united-states-v-commonwealth-of-pr/",
          "recap_pdf_url": null,
          "pacer_doc_id": null,
          "description": "MOTION SUBMITTING Invoice for svc rendered by JCC for the month of January 2002. w/attachment by John J. McGee (ft) (Entered: 03/06/2002)"
        },
        {
          "row_number": 490,
          "id": 8974144,
          "entry_number": "144",
          "date_filed": "2002-03-05T00:00:00-05:00",
          "attachments": null,
          "url": "https://www.courtlistener.com/docket/6672519/144/united-states-v-commonwealth-of-pr/",
          "recap_pdf_url": null,
          "pacer_doc_id": null,
          "description": "CHECK # 2523767 in the amount of $ 55,646.36 payable to John McGee issued (ft) (Entered: 03/07/2002)"
        },
        {
          "row_number": 501,
          "id": 8974145,
          "entry_number": "145",
          "date_filed": "2002-03-05T00:00:00-05:00",
          "attachments": null,
          "url": "https://www.courtlistener.com/docket/6672519/145/united-states-v-commonwealth-of-pr/",
          "recap_pdf_url": null,
          "pacer_doc_id": null,
          "description": "CHECK # 2523822 in the amount of $ 18,770.82 payable to John McGee issued (ft) (Entered: 03/07/2002)"
        },
        {
          "row_number": 512,
          "id": 8974146,
          "entry_number": "146",
          "date_filed": "2002-03-08T00:00:00-05:00",
          "attachments": null,
          "url": "https://www.courtlistener.com/docket/6672519/146/united-states-v-commonwealth-of-pr/",
          "recap_pdf_url": null,
          "pacer_doc_id": "1590104290",
          "description": "ORDER mooting [142-1] motion for setting of a S/C resetting Status Conference for 3:30 4/11/02 before Judge Jay A. Garcia-Gregory ( signed by Judge Jay A. Garcia-Gregory ) (ft) (Entered: 03/08/2002)"
        },
        {
          "row_number": 533,
          "id": 8974148,
          "entry_number": "148",
          "date_filed": "2002-03-08T00:00:00-05:00",
          "attachments": null,
          "url": "https://www.courtlistener.com/docket/6672519/148/united-states-v-commonwealth-of-pr/",
          "recap_pdf_url": null,
          "pacer_doc_id": null,
          "description": "MOTION SUBMITTING invoice for svcs rendered by JCC for the month of February 2002. w/attachment by John J. McGee (ft) (Entered: 03/12/2002)"
        },
        {
          "row_number": 523,
          "id": 8974149,
          "entry_number": "147",
          "date_filed": "2002-03-12T00:00:00-05:00",
          "attachments": null,
          "url": "https://www.courtlistener.com/docket/6672519/147/united-states-v-commonwealth-of-pr/",
          "recap_pdf_url": null,
          "pacer_doc_id": null,
          "description": "CHECK # 2522856 in the amount of $ 30,626.48 payable to John J. McGee issued on 5/8/01. (ft) (Entered: 03/12/2002)"
        },
        {
          "row_number": 3125,
          "id": 8974150,
          "entry_number": null,
          "date_filed": "2002-03-13T00:00:00-05:00",
          "attachments": null,
          "url": "https://www.courtlistener.com",
          "recap_pdf_url": null,
          "pacer_doc_id": null,
          "description": "CERTIFICATION of funds deposited on: 10/5/01, amt: $73,336.75 original balance; Acct #4005646680. (ft)"
        },
        {
          "row_number": 534,
          "id": 8974151,
          "entry_number": "149",
          "date_filed": "2002-03-18T00:00:00-05:00",
          "attachments": null,
          "url": "https://www.courtlistener.com/docket/6672519/149/united-states-v-commonwealth-of-pr/",
          "recap_pdf_url": null,
          "pacer_doc_id": "1590860593",
          "description": "ORDER granting and approving [143-1] miscellaneous. the Clerk shall disburse to JCC, Dr. John McGee the amount of $17,539.50 from the funds deposited in the Ct by the Gov. of PR. ( signed by Judge Jay A. Garcia-Gregory ) (ft) Modified on 03/19/2002 (Entered: 03/19/2002)"
        },
        {
          "row_number": 537,
          "id": 8974153,
          "entry_number": "151",
          "date_filed": "2002-04-11T00:00:00-04:00",
          "attachments": null,
          "url": "https://www.courtlistener.com/docket/6672519/151/united-states-v-commonwealth-of-pr/",
          "recap_pdf_url": null,
          "pacer_doc_id": null,
          "description": "MOTION SUBMITTING invoice for svcs rendered by Gerald Provencal for JCC during January 2002. w/attachment by John J. McGee (ft) (Entered: 04/12/2002)"
        },
        {
          "row_number": 538,
          "id": 8974154,
          "entry_number": "152",
          "date_filed": "2002-04-11T00:00:00-04:00",
          "attachments": null,
          "url": "https://www.courtlistener.com/docket/6672519/152/united-states-v-commonwealth-of-pr/",
          "recap_pdf_url": null,
          "pacer_doc_id": null,
          "description": "MOTION SUBMITTING invoice for svcs rendered for the month of February 2002. w/attachment by John J. McGee (ft) (Entered: 04/12/2002)"
        },
        {
          "row_number": 539,
          "id": 8974155,
          "entry_number": "153",
          "date_filed": "2002-04-11T00:00:00-04:00",
          "attachments": null,
          "url": "https://www.courtlistener.com/docket/6672519/153/united-states-v-commonwealth-of-pr/",
          "recap_pdf_url": null,
          "pacer_doc_id": null,
          "description": "MOTION SUBMITTING invoice for svcs rendered for the month of March 2002. w/attachment by John J. McGee (ft) (Entered: 04/12/2002)"
        },
        {
          "row_number": 543,
          "id": 8974161,
          "entry_number": "157",
          "date_filed": "2002-04-18T00:00:00-04:00",
          "attachments": null,
          "url": "https://www.courtlistener.com/docket/6672519/157/united-states-v-commonwealth-of-pr/",
          "recap_pdf_url": null,
          "pacer_doc_id": null,
          "description": "RESPONSE by Commonwealth of PR in opposition to [151-1] invoices for consultant Gerald Provencal by John J. McGee (ft) (Entered: 04/22/2002)"
        },
        {
          "row_number": 544,
          "id": 8974162,
          "entry_number": "158",
          "date_filed": "2002-04-22T00:00:00-04:00",
          "attachments": null,
          "url": "https://www.courtlistener.com/docket/6672519/158/united-states-v-commonwealth-of-pr/",
          "recap_pdf_url": null,
          "pacer_doc_id": null,
          "description": "MOTION by USA to Seal the list of individuals covered pursuant to the Community Based Svc Plan (ft) (Entered: 04/23/2002)"
        },
        {
          "row_number": 3129,
          "id": 8974171,
          "entry_number": null,
          "date_filed": "2002-05-08T00:00:00-04:00",
          "attachments": null,
          "url": "https://www.courtlistener.com",
          "recap_pdf_url": null,
          "pacer_doc_id": null,
          "description": "CERTIFICATION of funds deposited on: 10/5/01, Balance $ 61,986.49. Acct. #4005646680 (ft)"
        },
        {
          "row_number": 556,
          "id": 8974175,
          "entry_number": "169",
          "date_filed": "2002-06-03T00:00:00-04:00",
          "attachments": null,
          "url": "https://www.courtlistener.com/docket/6672519/169/united-states-v-commonwealth-of-pr/",
          "recap_pdf_url": null,
          "pacer_doc_id": null,
          "description": "MOTION SUBMITTING invoice for services rendered by the Joint Compliance for the Month of May, 2002 w/attachment by John J. McGee (re) (Entered: 06/05/2002)"
        },
        {
          "row_number": 3130,
          "id": 8974179,
          "entry_number": null,
          "date_filed": "2002-06-07T00:00:00-04:00",
          "attachments": null,
          "url": "https://www.courtlistener.com",
          "recap_pdf_url": null,
          "pacer_doc_id": null,
          "description": "Status Conference held before Judge Jay A. Garcia-Gregory (ja)"
        },
        {
          "row_number": 562,
          "id": 8974180,
          "entry_number": "174",
          "date_filed": "2002-06-07T00:00:00-04:00",
          "attachments": null,
          "url": "https://www.courtlistener.com/docket/6672519/174/united-states-v-commonwealth-of-pr/",
          "recap_pdf_url": null,
          "pacer_doc_id": "1590104294",
          "description": "Minute entry: Case called for further S/C. Parties to submit a budget proposal by 6/14/02 set Status Report deadline to 6/14/02, set Status Conference for 3:30 9/6/02 before Judge Jay A. Garcia-Gregory ( Judge Jay A. Garcia-Gregory ) (ja) (Entered: 06/17/2002)"
        },
        {
          "row_number": 561,
          "id": 8974181,
          "entry_number": "173",
          "date_filed": "2002-06-13T00:00:00-04:00",
          "attachments": null,
          "url": "https://www.courtlistener.com/docket/6672519/173/united-states-v-commonwealth-of-pr/",
          "recap_pdf_url": null,
          "pacer_doc_id": null,
          "description": "MOTION by Commonwealth of PR, Pedro J. Rossello-Gonzalez, Carmen Feliciano-Vda.-de-Me, Jose De-Leon to Extend Time until 6/22/02 to file position (sr) Modified on 06/17/2002 (Entered: 06/14/2002)"
        },
        {
          "row_number": 563,
          "id": 8974182,
          "entry_number": "175",
          "date_filed": "2002-06-17T00:00:00-04:00",
          "attachments": null,
          "url": "https://www.courtlistener.com/docket/6672519/175/united-states-v-commonwealth-of-pr/",
          "recap_pdf_url": null,
          "pacer_doc_id": null,
          "description": "MOTION SUBMITTING budget proposal w/attachment by John J. McGee (ja) (Entered: 06/17/2002)"
        },
        {
          "row_number": 565,
          "id": 8974184,
          "entry_number": "177",
          "date_filed": "2002-06-19T00:00:00-04:00",
          "attachments": null,
          "url": "https://www.courtlistener.com/docket/6672519/177/united-states-v-commonwealth-of-pr/",
          "recap_pdf_url": null,
          "pacer_doc_id": null,
          "description": "Informative Motion by John J. McGee re: to Budget of JCC. (sr) (Entered: 06/20/2002)"
        },
        {
          "row_number": 566,
          "id": 8974185,
          "entry_number": "178",
          "date_filed": "2002-06-21T00:00:00-04:00",
          "attachments": null,
          "url": "https://www.courtlistener.com/docket/6672519/178/united-states-v-commonwealth-of-pr/",
          "recap_pdf_url": null,
          "pacer_doc_id": null,
          "description": "MOTION SUBMITTING docs presented during status cnf w/attachment by Commonwealth of PR (yr) (Entered: 06/24/2002)"
        },
        {
          "row_number": 569,
          "id": 8974187,
          "entry_number": "180",
          "date_filed": "2002-07-01T00:00:00-04:00",
          "attachments": null,
          "url": "https://www.courtlistener.com/docket/6672519/180/united-states-v-commonwealth-of-pr/",
          "recap_pdf_url": null,
          "pacer_doc_id": null,
          "description": "RESPONSE w/attach, by Commonwealth of PR, Pedro J. Rossello-Gonzalez, Carmen Feliciano-Vda.-de-Me, Jose De-Leon endorsing to [175-1] miscellaneous by John J. McGee (sr) Modified on 07/02/2002 (Entered: 07/02/2002)"
        },
        {
          "row_number": 570,
          "id": 8974188,
          "entry_number": "181",
          "date_filed": "2002-07-08T00:00:00-04:00",
          "attachments": null,
          "url": "https://www.courtlistener.com/docket/6672519/181/united-states-v-commonwealth-of-pr/",
          "recap_pdf_url": null,
          "pacer_doc_id": null,
          "description": "MOTION SUBMITTING proposed 2002-2003 budget of Joint Compliance Coordinator w/attachment by USA (sr) (Entered: 07/10/2002)"
        },
        {
          "row_number": 580,
          "id": 8974197,
          "entry_number": "190",
          "date_filed": "2002-08-01T00:00:00-04:00",
          "attachments": null,
          "url": "https://www.courtlistener.com/docket/6672519/190/united-states-v-commonwealth-of-pr/",
          "recap_pdf_url": null,
          "pacer_doc_id": null,
          "description": "MOTION SUBMITTING Annual Budget for FY 2002-03 w/attachment by John J. McGee (sr) (Entered: 08/05/2002)"
        },
        {
          "row_number": 581,
          "id": 8974198,
          "entry_number": "191",
          "date_filed": "2002-08-01T00:00:00-04:00",
          "attachments": null,
          "url": "https://www.courtlistener.com/docket/6672519/191/united-states-v-commonwealth-of-pr/",
          "recap_pdf_url": null,
          "pacer_doc_id": null,
          "description": "MOTION SUBMITTING invoice for services rendered by John R. Williams, consultant to the JCC, during the 6/3-9/02 w/attachment by John J. McGee (sr) (Entered: 08/05/2002)"
        },
        {
          "row_number": 583,
          "id": 8974200,
          "entry_number": "193",
          "date_filed": "2002-08-09T00:00:00-04:00",
          "attachments": null,
          "url": "https://www.courtlistener.com/docket/6672519/193/united-states-v-commonwealth-of-pr/",
          "recap_pdf_url": null,
          "pacer_doc_id": null,
          "description": "Informative Motion by John J. McGee re: status of revised Budget for JCC and update on deft's req. for Municipal Patent and Certificate of Negative Income. (sr) (Entered: 08/12/2002)"
        },
        {
          "row_number": 584,
          "id": 8974201,
          "entry_number": "194",
          "date_filed": "2002-08-12T00:00:00-04:00",
          "attachments": null,
          "url": "https://www.courtlistener.com/docket/6672519/194/united-states-v-commonwealth-of-pr/",
          "recap_pdf_url": null,
          "pacer_doc_id": null,
          "description": "MOTION by Commonwealth of PR for Reconsideration of [187-1] order Response due 8/26/02 . (sr) (Entered: 08/13/2002)"
        },
        {
          "row_number": 586,
          "id": 8974203,
          "entry_number": "196",
          "date_filed": "2002-08-19T00:00:00-04:00",
          "attachments": null,
          "url": "https://www.courtlistener.com/docket/6672519/196/united-states-v-commonwealth-of-pr/",
          "recap_pdf_url": null,
          "pacer_doc_id": null,
          "description": "MOTION by USA to request order to hold upcoming S/C as already agreed by the pts (ft) (Entered: 08/20/2002)"
        },
        {
          "row_number": 587,
          "id": 8974204,
          "entry_number": "197",
          "date_filed": "2002-08-19T00:00:00-04:00",
          "attachments": null,
          "url": "https://www.courtlistener.com/docket/6672519/197/united-states-v-commonwealth-of-pr/",
          "recap_pdf_url": null,
          "pacer_doc_id": "1590860601",
          "description": "MINUTES of Setting: resetting Status Conference for 5:00 9/5/02 before Judge Jay A. Garcia-Gregory (Clerk) (ft) (Entered: 08/20/2002)"
        },
        {
          "row_number": 588,
          "id": 8974205,
          "entry_number": "198",
          "date_filed": "2002-08-20T00:00:00-04:00",
          "attachments": null,
          "url": "https://www.courtlistener.com/docket/6672519/198/united-states-v-commonwealth-of-pr/",
          "recap_pdf_url": null,
          "pacer_doc_id": null,
          "description": "RESPONSE by Commonwealth of PR to [196-1] motion to request order to hold upcoming S/C as already agreed by the pts by USA (ft) (Entered: 08/22/2002)"
        },
        {
          "row_number": 589,
          "id": 8974206,
          "entry_number": "199",
          "date_filed": "2002-08-28T00:00:00-04:00",
          "attachments": null,
          "url": "https://www.courtlistener.com/docket/6672519/199/united-states-v-commonwealth-of-pr/",
          "recap_pdf_url": null,
          "pacer_doc_id": "1590104297",
          "description": "ORDER approving [190-1] proposed budget for the years 2002-2003. ( signed by Judge Jay A. Garcia-Gregory ) (ft) (Entered: 08/28/2002)"
        },
        {
          "row_number": 592,
          "id": 8974207,
          "entry_number": "200",
          "date_filed": "2002-08-28T00:00:00-04:00",
          "attachments": null,
          "url": "https://www.courtlistener.com/docket/6672519/200/united-states-v-commonwealth-of-pr/",
          "recap_pdf_url": null,
          "pacer_doc_id": "1590860602",
          "description": "ORDER re: dkts #188,189,191,192 and 195 informing that the invoices are pending for payment and instructing the Commonwealth to deposit a sum sufficient to cover the disbursment of the invoices submitted. ( signed by Judge Jay A. Garcia-Gregory ) (ft) (Entered: 08/28/2002)"
        },
        {
          "row_number": 593,
          "id": 8974208,
          "entry_number": "201",
          "date_filed": "2002-08-29T00:00:00-04:00",
          "attachments": null,
          "url": "https://www.courtlistener.com/docket/6672519/201/united-states-v-commonwealth-of-pr/",
          "recap_pdf_url": null,
          "pacer_doc_id": null,
          "description": "CHECK # 2548820 in the amount of $ 12,197.30 payable to John J. McGee issued (ft) (Entered: 08/29/2002)"
        },
        {
          "row_number": 598,
          "id": 8974214,
          "entry_number": "206",
          "date_filed": "2002-09-24T00:00:00-04:00",
          "attachments": null,
          "url": "https://www.courtlistener.com/docket/6672519/206/united-states-v-commonwealth-of-pr/",
          "recap_pdf_url": null,
          "pacer_doc_id": null,
          "description": "MOTION SUBMITTING JCC budget for FY 2002-2003 in the amount of $290,357.00 Receipt #130211 by Commonwealth of PR (ft) (Entered: 09/26/2002)"
        },
        {
          "row_number": 604,
          "id": 8974219,
          "entry_number": "211",
          "date_filed": "2002-09-30T00:00:00-04:00",
          "attachments": null,
          "url": "https://www.courtlistener.com/docket/6672519/211/united-states-v-commonwealth-of-pr/",
          "recap_pdf_url": null,
          "pacer_doc_id": "1590860605",
          "description": "ORDER granting nunc pro tunc [195-1] corrected invoice by joint compliance coordinator for the month of July 2002, etc. as stated herein ( signed by Judge Jay A. Garcia-Gregory ) (yr) (Entered: 09/30/2002)"
        },
        {
          "row_number": 605,
          "id": 8974220,
          "entry_number": "212",
          "date_filed": "2002-10-04T00:00:00-04:00",
          "attachments": null,
          "url": "https://www.courtlistener.com/docket/6672519/212/united-states-v-commonwealth-of-pr/",
          "recap_pdf_url": null,
          "pacer_doc_id": null,
          "description": "Informative Motion by John J. McGee re: clarification of agreement related to the JCC budget for FY 2002-2003 and financial stmts. (ft) (Entered: 10/07/2002)"
        },
        {
          "row_number": 608,
          "id": 8974222,
          "entry_number": "214",
          "date_filed": "2002-10-04T00:00:00-04:00",
          "attachments": null,
          "url": "https://www.courtlistener.com/docket/6672519/214/united-states-v-commonwealth-of-pr/",
          "recap_pdf_url": null,
          "pacer_doc_id": null,
          "description": "MOTION SUBMITTING invoice for svcs rendered by A.J Deliz during August-September 2002. w/attachment by John J. McGee (ft) (Entered: 10/07/2002)"
        },
        {
          "row_number": 619,
          "id": 8974223,
          "entry_number": "215",
          "date_filed": "2002-10-07T00:00:00-04:00",
          "attachments": null,
          "url": "https://www.courtlistener.com/docket/6672519/215/united-states-v-commonwealth-of-pr/",
          "recap_pdf_url": null,
          "pacer_doc_id": "1590104301",
          "description": "ORDER granting [192-1] motion to request order for reimbursement of servives rendered by consultant Gerald Provencal for the JCC during the months of April and May/02. The Clerk of Ct shall issue a check to Gerald Provencal for $10,346.86 and to MORC, Inc. for $618.00. ( signed by Judge Carmen C. Cerezo for Judge Jay A. Garcia-Gregory ) (ft) (Entered: 10/07/2002)"
        },
        {
          "row_number": 630,
          "id": 8974225,
          "entry_number": "216",
          "date_filed": "2002-10-15T00:00:00-04:00",
          "attachments": null,
          "url": "https://www.courtlistener.com/docket/6672519/216/united-states-v-commonwealth-of-pr/",
          "recap_pdf_url": null,
          "pacer_doc_id": "1590860606",
          "description": "ORDER granting [203-1] miscellaneous. The Clerk shall issue a check payablr to John McGee in the amount of $17,948.26. ( signed by Judge Daniel R. Dominguez for Judge Jay A. Garcia ) (ft) (Entered: 10/15/2002)"
        },
        {
          "row_number": 3134,
          "id": 8974234,
          "entry_number": null,
          "date_filed": "2002-12-09T00:00:00-05:00",
          "attachments": null,
          "url": "https://www.courtlistener.com",
          "recap_pdf_url": null,
          "pacer_doc_id": null,
          "description": "CERTIFICATION of funds deposited, amt: $257,482.54. Acct. #4005646680. (ft)"
        },
        {
          "row_number": 3135,
          "id": 8974236,
          "entry_number": null,
          "date_filed": "2002-12-13T00:00:00-05:00",
          "attachments": null,
          "url": "https://www.courtlistener.com",
          "recap_pdf_url": null,
          "pacer_doc_id": null,
          "description": "Status Conference held before Judge Jay A. Garcia-Gregory (ft)"
        },
        {
          "row_number": 728,
          "id": 8974237,
          "entry_number": "225",
          "date_filed": "2002-12-16T00:00:00-05:00",
          "attachments": null,
          "url": "https://www.courtlistener.com/docket/6672519/225/united-states-v-commonwealth-of-pr/",
          "recap_pdf_url": null,
          "pacer_doc_id": "1590860607",
          "description": "ORDER granting [223-1] miscellaneous. The Clerk shall issue a check to the order of John McGee in the amount of $19,423.75 from the amounts deposited in the registry of the Gov. of PR. ( signed by Judge Jay A. Garcia-Gregory ) (ft) (Entered: 12/17/2002)"
        },
        {
          "row_number": 750,
          "id": 8974240,
          "entry_number": "227",
          "date_filed": "2002-12-26T00:00:00-05:00",
          "attachments": null,
          "url": "https://www.courtlistener.com/docket/6672519/227/united-states-v-commonwealth-of-pr/",
          "recap_pdf_url": null,
          "pacer_doc_id": null,
          "description": "MOTION SUBMITTING Report on Biological Homes w/attachment by Commonwealth of PR (cm) (Entered: 12/27/2002)"
        },
        {
          "row_number": 761,
          "id": 8974241,
          "entry_number": "228",
          "date_filed": "2003-01-02T00:00:00-05:00",
          "attachments": null,
          "url": "https://www.courtlistener.com/docket/6672519/228/united-states-v-commonwealth-of-pr/",
          "recap_pdf_url": null,
          "pacer_doc_id": "1590104303",
          "description": "ORDER granting [226-1] motion to Extend Time until 12/23/02 to comply w/ct. order ( signed by Judge Jay A. Garcia-Gregory ) (ft) (Entered: 01/02/2003)"
        },
        {
          "row_number": 784,
          "id": 8974243,
          "entry_number": "230",
          "date_filed": "2003-01-03T00:00:00-05:00",
          "attachments": null,
          "url": "https://www.courtlistener.com/docket/6672519/230/united-states-v-commonwealth-of-pr/",
          "recap_pdf_url": null,
          "pacer_doc_id": null,
          "description": "MOTION SUBMITTING invoice for svcs rendered in December 2002 by the JCC. w/attachment by John J. McGee (ft) (Entered: 01/09/2003)"
        },
        {
          "row_number": 3136,
          "id": 8974244,
          "entry_number": null,
          "date_filed": "2003-01-13T00:00:00-05:00",
          "attachments": null,
          "url": "https://www.courtlistener.com",
          "recap_pdf_url": null,
          "pacer_doc_id": null,
          "description": "CERTIFICATION of funds deposited, amt: $239,999.23. Acct. #4005646680. (ft)"
        },
        {
          "row_number": 850,
          "id": 8974250,
          "entry_number": "236",
          "date_filed": "2003-02-21T00:00:00-05:00",
          "attachments": null,
          "url": "https://www.courtlistener.com/docket/6672519/236/united-states-v-commonwealth-of-pr/",
          "recap_pdf_url": null,
          "pacer_doc_id": null,
          "description": "CHECK # 2553373 in the amount of $ 10,346.86 payable to Gerald Provencal issued (ft) (Entered: 02/21/2003)"
        },
        {
          "row_number": 861,
          "id": 8974251,
          "entry_number": "237",
          "date_filed": "2003-02-21T00:00:00-05:00",
          "attachments": null,
          "url": "https://www.courtlistener.com/docket/6672519/237/united-states-v-commonwealth-of-pr/",
          "recap_pdf_url": null,
          "pacer_doc_id": null,
          "description": "CHECK # 2553374 in the amount of $ 618.00 payable to Morc, Inc. issued (ft) (Entered: 02/21/2003)"
        },
        {
          "row_number": 872,
          "id": 8974252,
          "entry_number": "238",
          "date_filed": "2003-02-24T00:00:00-05:00",
          "attachments": null,
          "url": "https://www.courtlistener.com/docket/6672519/238/united-states-v-commonwealth-of-pr/",
          "recap_pdf_url": null,
          "pacer_doc_id": null,
          "description": "MOTION SUBMITTING invoice for svcs rendered in February 2003. w/attachment by John J. McGee (ft) (Entered: 02/27/2003)"
        },
        {
          "row_number": 883,
          "id": 8974253,
          "entry_number": "239",
          "date_filed": "2003-02-24T00:00:00-05:00",
          "attachments": null,
          "url": "https://www.courtlistener.com/docket/6672519/239/united-states-v-commonwealth-of-pr/",
          "recap_pdf_url": null,
          "pacer_doc_id": null,
          "description": "MOTION SUBMITTING invoice for svcs rendered in February 2003. w/attachment by John J. McGee (ft) (Entered: 02/27/2003)"
        },
        {
          "row_number": 3138,
          "id": 8974255,
          "entry_number": null,
          "date_filed": "2003-03-04T00:00:00-05:00",
          "attachments": null,
          "url": "https://www.courtlistener.com",
          "recap_pdf_url": null,
          "pacer_doc_id": null,
          "description": "CERTIFICATION of funds deposited, amt: $195,067.39., Acct. No. 4005646680. (ft)"
        },
        {
          "row_number": 906,
          "id": 8974256,
          "entry_number": "241",
          "date_filed": "2003-03-06T00:00:00-05:00",
          "attachments": null,
          "url": "https://www.courtlistener.com/docket/6672519/241/united-states-v-commonwealth-of-pr/",
          "recap_pdf_url": null,
          "pacer_doc_id": null,
          "description": "CHECK # 2553384 in the amount of $ 16,281.11 payable to John J. McGee issued (ft) (Entered: 03/06/2003)"
        },
        {
          "row_number": 939,
          "id": 8974259,
          "entry_number": "244",
          "date_filed": "2003-03-17T00:00:00-05:00",
          "attachments": null,
          "url": "https://www.courtlistener.com/docket/6672519/244/united-states-v-commonwealth-of-pr/",
          "recap_pdf_url": null,
          "pacer_doc_id": "1590860610",
          "description": "ORDER granting [239-1] miscellaneous; the Clerk shall issue check to the order of John J. McGee in the amt of $18,574.69, etc. ( signed by Judge Jay A. Garcia-Gregory ) (ja) (Entered: 03/17/2003)"
        },
        {
          "row_number": 950,
          "id": 8974260,
          "entry_number": "245",
          "date_filed": "2003-04-01T00:00:00-05:00",
          "attachments": null,
          "url": "https://www.courtlistener.com/docket/6672519/245/united-states-v-commonwealth-of-pr/",
          "recap_pdf_url": null,
          "pacer_doc_id": null,
          "description": "MOTION SUBMITTING invoice for svcs rendered by the JCC for the month of March 2003. w/attachment by John J. McGee (ft) (Entered: 04/03/2003)"
        },
        {
          "row_number": 961,
          "id": 8974262,
          "entry_number": "246",
          "date_filed": "2003-04-09T00:00:00-04:00",
          "attachments": null,
          "url": "https://www.courtlistener.com/docket/6672519/246/united-states-v-commonwealth-of-pr/",
          "recap_pdf_url": null,
          "pacer_doc_id": null,
          "description": "RESPONSE by Commonwealth of PR in opposition to [245-1] miscellaneous by John J. McGee (ft) (Entered: 04/10/2003)"
        },
        {
          "row_number": 1061,
          "id": 8974272,
          "entry_number": "255",
          "date_filed": "2003-04-24T00:00:00-04:00",
          "attachments": null,
          "url": "https://www.courtlistener.com/docket/6672519/255/united-states-v-commonwealth-of-pr/",
          "recap_pdf_url": null,
          "pacer_doc_id": "1590860611",
          "description": "ORDER resetting Status Conference for 3:00 6/13/03 before Judge Jay A. Garcia-Gregory ( signed by Judge Jay A. Garcia-Gregory ) (ft) (Entered: 04/24/2003)"
        },
        {
          "row_number": 1072,
          "id": 8974273,
          "entry_number": "256",
          "date_filed": "2003-04-24T00:00:00-04:00",
          "attachments": null,
          "url": "https://www.courtlistener.com/docket/6672519/256/united-states-v-commonwealth-of-pr/",
          "recap_pdf_url": null,
          "pacer_doc_id": null,
          "description": "MOTION SUBMITTING invoice for svcs rendered by Consultant Marge Brown for the JCC. w/attachment by John J. McGee (ft) (Entered: 04/24/2003)"
        },
        {
          "row_number": 1172,
          "id": 8974282,
          "entry_number": "265",
          "date_filed": "2003-05-05T00:00:00-04:00",
          "attachments": null,
          "url": "https://www.courtlistener.com/docket/6672519/265/united-states-v-commonwealth-of-pr/",
          "recap_pdf_url": null,
          "pacer_doc_id": null,
          "description": "RESPONSE by Commonwealth of PR, Pedro J. Rossello-Gonzalez, Carmen Feliciano-Vda.-de-Me, Jose De-Leon in opposition to [251-1] miscellaneous by John J. McGee (ft) (Entered: 05/07/2003)"
        },
        {
          "row_number": 1183,
          "id": 8974283,
          "entry_number": "266",
          "date_filed": "2003-05-05T00:00:00-04:00",
          "attachments": null,
          "url": "https://www.courtlistener.com/docket/6672519/266/united-states-v-commonwealth-of-pr/",
          "recap_pdf_url": null,
          "pacer_doc_id": null,
          "description": "RESPONSE by Commonwealth of PR, Pedro J. Rossello-Gonzalez, Carmen Feliciano-Vda.-de-Me, Jose De-Leon in opposition to [252-1] miscellaneous by John J. McGee (ft) (Entered: 05/07/2003)"
        },
        {
          "row_number": 3142,
          "id": 8974291,
          "entry_number": null,
          "date_filed": "2003-05-20T00:00:00-04:00",
          "attachments": null,
          "url": "https://www.courtlistener.com",
          "recap_pdf_url": null,
          "pacer_doc_id": null,
          "description": "CERTIFICATION of funds deposited, amt: $116,996.11. Acct. #4005646680. (ft)"
        },
        {
          "row_number": 1272,
          "id": 8974293,
          "entry_number": "274",
          "date_filed": "2003-05-21T00:00:00-04:00",
          "attachments": null,
          "url": "https://www.courtlistener.com/docket/6672519/274/united-states-v-commonwealth-of-pr/",
          "recap_pdf_url": null,
          "pacer_doc_id": null,
          "description": "Informative Motion by USA re: comments to submissions to the Ct from the JCC. (ft) (Entered: 05/22/2003)"
        },
        {
          "row_number": 1283,
          "id": 8974294,
          "entry_number": "275",
          "date_filed": "2003-05-21T00:00:00-04:00",
          "attachments": null,
          "url": "https://www.courtlistener.com/docket/6672519/275/united-states-v-commonwealth-of-pr/",
          "recap_pdf_url": null,
          "pacer_doc_id": null,
          "description": "MOTION by Commonwealth of PR, Pedro J. Rossello-Gonzalez, Carmen Feliciano-Vda.-de-Me, Jose De-Leon to Extend Time 6/3/03 to respond to JCC's submissions (ft) (Entered: 05/22/2003)"
        },
        {
          "row_number": 1339,
          "id": 8974299,
          "entry_number": "280",
          "date_filed": "2003-06-02T00:00:00-04:00",
          "attachments": null,
          "url": "https://www.courtlistener.com/docket/6672519/280/united-states-v-commonwealth-of-pr/",
          "recap_pdf_url": null,
          "pacer_doc_id": null,
          "description": "CHECK # 2843642 in the amount of $ 18,038.16 payable to John McGee issued (ft) (Entered: 06/04/2003)"
        },
        {
          "row_number": 1350,
          "id": 8974300,
          "entry_number": "281",
          "date_filed": "2003-06-02T00:00:00-04:00",
          "attachments": null,
          "url": "https://www.courtlistener.com/docket/6672519/281/united-states-v-commonwealth-of-pr/",
          "recap_pdf_url": null,
          "pacer_doc_id": null,
          "description": "CHECK # 2843640 in the amount of $ 2,590.92 payable to Center for Outcome Analysis c/o Ms. Marge Brown issued (ft) (Entered: 06/04/2003)"
        },
        {
          "row_number": 1361,
          "id": 8974301,
          "entry_number": "282",
          "date_filed": "2003-06-02T00:00:00-04:00",
          "attachments": null,
          "url": "https://www.courtlistener.com/docket/6672519/282/united-states-v-commonwealth-of-pr/",
          "recap_pdf_url": null,
          "pacer_doc_id": null,
          "description": "CHECK # 2843639 in the amount of $ 5,974.78 payable to Luke Tsai, M.D. issued (ft) (Entered: 06/04/2003)"
        },
        {
          "row_number": 1372,
          "id": 8974302,
          "entry_number": "283",
          "date_filed": "2003-06-02T00:00:00-04:00",
          "attachments": null,
          "url": "https://www.courtlistener.com/docket/6672519/283/united-states-v-commonwealth-of-pr/",
          "recap_pdf_url": null,
          "pacer_doc_id": null,
          "description": "RESPONSE by Commonwealth of PR in opposition to [272-1] Budget for FY 2003-2004 by John J. McGee (ft) (Entered: 06/04/2003)"
        },
        {
          "row_number": 1383,
          "id": 8974303,
          "entry_number": "284",
          "date_filed": "2003-06-02T00:00:00-04:00",
          "attachments": null,
          "url": "https://www.courtlistener.com/docket/6672519/284/united-states-v-commonwealth-of-pr/",
          "recap_pdf_url": null,
          "pacer_doc_id": null,
          "description": "MOTION by Commonwealth of PR requesting appointment of judicial accountant for audit of JCC operations (ft) (Entered: 06/04/2003)"
        },
        {
          "row_number": 1394,
          "id": 8974304,
          "entry_number": "285",
          "date_filed": "2003-06-09T00:00:00-04:00",
          "attachments": null,
          "url": "https://www.courtlistener.com/docket/6672519/285/united-states-v-commonwealth-of-pr/",
          "recap_pdf_url": null,
          "pacer_doc_id": null,
          "description": "RESPONSE by Commonwealth of PR and objections to [254-1] report by John J. McGee w/4 legal size envelopes and 3 binders attached. (ni) (Entered: 06/10/2003)"
        },
        {
          "row_number": 3143,
          "id": 8974306,
          "entry_number": null,
          "date_filed": "2003-06-13T00:00:00-04:00",
          "attachments": null,
          "url": "https://www.courtlistener.com",
          "recap_pdf_url": null,
          "pacer_doc_id": null,
          "description": "Status Conference held before Judge Jay A. Garcia-Gregory (ft)"
        },
        {
          "row_number": 1416,
          "id": 8974307,
          "entry_number": "287",
          "date_filed": "2003-06-13T00:00:00-04:00",
          "attachments": null,
          "url": "https://www.courtlistener.com/docket/6672519/287/united-states-v-commonwealth-of-pr/",
          "recap_pdf_url": null,
          "pacer_doc_id": "1590860613",
          "description": "Minute entry: Further S/C held. The issue of the April invoice and the audit of the JCC operations have been resolved. The issue of the budget is pending. Pts make a summary of all the progress made and the stepts that are being taken to correct the problems that are left, etc. set Status Conference for 2:00 9/12/03 before Judge Jay A. Garcia-Gregory ( Judge Jay A. Garcia-Gregory ) (ft) (Entered: 06/18/2003)"
        },
        {
          "row_number": 1450,
          "id": 8974310,
          "entry_number": "290",
          "date_filed": "2003-07-01T00:00:00-04:00",
          "attachments": null,
          "url": "https://www.courtlistener.com/docket/6672519/290/united-states-v-commonwealth-of-pr/",
          "recap_pdf_url": null,
          "pacer_doc_id": null,
          "description": "MOTION SUBMITTING invoice for svcs rendered by consultant Gerald Provencal during the period of April 9-12, 2003. w/attachment by John J. McGee (ft) (Entered: 07/03/2003)"
        },
        {
          "row_number": 3144,
          "id": 8974317,
          "entry_number": null,
          "date_filed": "2003-07-07T00:00:00-04:00",
          "attachments": null,
          "url": "https://www.courtlistener.com",
          "recap_pdf_url": null,
          "pacer_doc_id": null,
          "description": "CERTIFICATION of funds deposited on: 7/28/00, amt: $73,336.75. Acct. #4005646680. (ft)"
        },
        {
          "row_number": 1527,
          "id": 8974318,
          "entry_number": "297",
          "date_filed": "2003-07-07T00:00:00-04:00",
          "attachments": null,
          "url": "https://www.courtlistener.com/docket/6672519/297/united-states-v-commonwealth-of-pr/",
          "recap_pdf_url": null,
          "pacer_doc_id": null,
          "description": "MOTION by Commonwealth of PR requesting clarification of minutes of 6/13/03 (dkt #287) and order of 6/17/03 (dkt #288 (ft) (Entered: 07/09/2003)"
        },
        {
          "row_number": 1538,
          "id": 8974319,
          "entry_number": "298",
          "date_filed": "2003-07-15T00:00:00-04:00",
          "attachments": null,
          "url": "https://www.courtlistener.com/docket/6672519/298/united-states-v-commonwealth-of-pr/",
          "recap_pdf_url": null,
          "pacer_doc_id": null,
          "description": "RESPONSE by USA in opposition to [297-1] motion requesting clarification of minutes of 6/13/03 (dkt #287) and order of 6/17/03 (dkt #288 by Commonwealth of PR (ft) (Entered: 07/16/2003)"
        },
        {
          "row_number": 1549,
          "id": 8974320,
          "entry_number": "299",
          "date_filed": "2003-07-16T00:00:00-04:00",
          "attachments": null,
          "url": "https://www.courtlistener.com/docket/6672519/299/united-states-v-commonwealth-of-pr/",
          "recap_pdf_url": null,
          "pacer_doc_id": null,
          "description": "Letter MOTION by John J. McGee requesting status of payment process (ft) (Entered: 07/17/2003)"
        },
        {
          "row_number": 1761,
          "id": 8974342,
          "entry_number": "318",
          "date_filed": "2003-11-06T00:00:00-05:00",
          "attachments": null,
          "url": "https://www.courtlistener.com/docket/6672519/318/united-states-v-commonwealth-of-pr/",
          "recap_pdf_url": null,
          "pacer_doc_id": "1590104312",
          "description": "ORDER granting [317-1] motion to Extend Time until 11/17/03 to present their report re: the establishment of the Psychiatric Unit set Motion Filing deadline to 11/17/03 ( signed by Judge Jay A. Garcia-Gregory ) (ft) (Entered: 11/06/2003)"
        },
        {
          "row_number": 1772,
          "id": 8974343,
          "entry_number": "319",
          "date_filed": "2003-11-13T00:00:00-05:00",
          "attachments": null,
          "url": "https://www.courtlistener.com/docket/6672519/319/united-states-v-commonwealth-of-pr/",
          "recap_pdf_url": null,
          "pacer_doc_id": null,
          "description": "MOTION SUBMITTING invoice for services rendered by the JCC for the month of October 2003. w/attachment by John J. McGee (ft) (Entered: 11/14/2003)"
        },
        {
          "row_number": 3151,
          "id": 8974355,
          "entry_number": null,
          "date_filed": "2003-12-22T00:00:00-05:00",
          "attachments": null,
          "url": "https://www.courtlistener.com",
          "recap_pdf_url": null,
          "pacer_doc_id": null,
          "description": "CERTIFICATION of funds deposited on: various dates, amt: $273,110.20, including int. and reg. fees. (re)"
        },
        {
          "row_number": 1872,
          "id": 8974356,
          "entry_number": "328",
          "date_filed": "2004-01-07T00:00:00-05:00",
          "attachments": null,
          "url": "https://www.courtlistener.com/docket/6672519/328/united-states-v-commonwealth-of-pr/",
          "recap_pdf_url": null,
          "pacer_doc_id": null,
          "description": "MOTION SUBMITTING invoice for svcs rendered by JCC for the Month of December 2003. w/attachment by John J. McGee (ft) (Entered: 01/09/2004)"
        },
        {
          "row_number": 1883,
          "id": 8974357,
          "entry_number": "329",
          "date_filed": "2004-01-08T00:00:00-05:00",
          "attachments": null,
          "url": "https://www.courtlistener.com/docket/6672519/329/united-states-v-commonwealth-of-pr/",
          "recap_pdf_url": null,
          "pacer_doc_id": null,
          "description": "CHECK # 2924305 in the amount of $ 16,691.34 payable to John McGee issued (ft) (Entered: 01/09/2004)"
        },
        {
          "row_number": 3152,
          "id": 8974360,
          "entry_number": null,
          "date_filed": "2004-01-13T00:00:00-05:00",
          "attachments": null,
          "url": "https://www.courtlistener.com",
          "recap_pdf_url": null,
          "pacer_doc_id": null,
          "description": "CERTIFICATION of funds deposited on: 12/4/03, amt: $73,336.75 (original bal.). As of 11/30/03 $273,110.20. Acct #4005646680. (ft)"
        },
        {
          "row_number": 1928,
          "id": 8974361,
          "entry_number": "333",
          "date_filed": "2004-01-21T00:00:00-05:00",
          "attachments": null,
          "url": "https://www.courtlistener.com/docket/6672519/333/united-states-v-commonwealth-of-pr/",
          "recap_pdf_url": null,
          "pacer_doc_id": null,
          "description": "Check No. 2924498 Disbursed in amount of $2,340.15 payable to Gerald Provencal (ft, ) (Entered: 01/22/2004)"
        },
        {
          "row_number": 1917,
          "id": 8974362,
          "entry_number": "332",
          "date_filed": "2004-01-22T00:00:00-05:00",
          "attachments": null,
          "url": "https://www.courtlistener.com/docket/6672519/332/united-states-v-commonwealth-of-pr/",
          "recap_pdf_url": null,
          "pacer_doc_id": null,
          "description": "Check No.2924499 Disbursed in amount of $ 1,415.80 payable to M.O.R.C, Inc. (cm, ) (Entered: 01/22/2004)"
        },
        {
          "row_number": 2028,
          "id": 8974372,
          "entry_number": "342",
          "date_filed": "2004-03-29T00:00:00-05:00",
          "attachments": null,
          "url": "https://www.courtlistener.com/docket/6672519/342/united-states-v-commonwealth-of-pr/",
          "recap_pdf_url": null,
          "pacer_doc_id": "1590947844",
          "description": "MOTION to Intervene filed by Hector F. Oliveras-Delgado on behalf of Instituto Psicopedagogico (Oliveras-Delgado, Hector) (Entered: 03/29/2004)"
        },
        {
          "row_number": 2050,
          "id": 8974374,
          "entry_number": "344",
          "date_filed": "2004-03-31T00:00:00-05:00",
          "attachments": null,
          "url": "https://www.courtlistener.com/docket/6672519/344/united-states-v-commonwealth-of-pr/",
          "recap_pdf_url": null,
          "pacer_doc_id": "1590162564",
          "description": "MOTION Reimbursement of Services Rendered by Gerald Provencal filed by John J. McGee on behalf of John J. McGee (Attachments: # 1 Travel Expenses)(ct, ) (Entered: 04/06/2004)"
        },
        {
          "row_number": 2061,
          "id": 8974375,
          "entry_number": "345",
          "date_filed": "2004-04-08T00:00:00-04:00",
          "attachments": null,
          "url": "https://www.courtlistener.com/docket/6672519/345/united-states-v-commonwealth-of-pr/",
          "recap_pdf_url": null,
          "pacer_doc_id": "159051617",
          "description": "MOTION for Extension of Time to File Response/Reply as to 342 MOTION to Intervene filed by Instituto Psicopedagogico filed by Richard J. Farano on behalf of USA Suggestions in opposition/response due by 4/21/2004 (Related document(s) 342 ) (Farano, Richard) (Entered: 04/08/2004)"
        },
        {
          "row_number": 3154,
          "id": 8974377,
          "entry_number": null,
          "date_filed": "2004-04-12T00:00:00-04:00",
          "attachments": null,
          "url": "https://www.courtlistener.com",
          "recap_pdf_url": null,
          "pacer_doc_id": null,
          "description": "Reset Deadlines as to 342 MOTION to Intervene. Suggestions in opposition/response due by 6/14/2004. (See #346). (ft, )"
        },
        {
          "row_number": 2083,
          "id": 8974378,
          "entry_number": "347",
          "date_filed": "2004-04-19T00:00:00-04:00",
          "attachments": null,
          "url": "https://www.courtlistener.com/docket/6672519/347/united-states-v-commonwealth-of-pr/",
          "recap_pdf_url": null,
          "pacer_doc_id": "1590975797",
          "description": "ORDER granting 343 Motion submitting, granting 344 Motion for Miscellaneous Relief . Signed by Judge Jay A Garcia-Gregory on 4/19/04. (ac, ) (Entered: 04/19/2004)"
        },
        {
          "row_number": 2150,
          "id": 8974384,
          "entry_number": "353",
          "date_filed": "2004-05-03T00:00:00-04:00",
          "attachments": null,
          "url": "https://www.courtlistener.com/docket/6672519/353/united-states-v-commonwealth-of-pr/",
          "recap_pdf_url": null,
          "pacer_doc_id": "1590177354",
          "description": "MOTION for reimbursement of services rendered by Consultant Chang C. Kim for the JCC filed by John J. McGee w/attachs. (ft, ) (Entered: 05/04/2004)"
        },
        {
          "row_number": 2161,
          "id": 8974385,
          "entry_number": "354",
          "date_filed": "2004-05-03T00:00:00-04:00",
          "attachments": null,
          "url": "https://www.courtlistener.com/docket/6672519/354/united-states-v-commonwealth-of-pr/",
          "recap_pdf_url": null,
          "pacer_doc_id": "1590177326",
          "description": "MOTION for reimbursement of services rendered by Consultant Maurits Eijgendaal for the JCC filed by John J. McGee w/attachs. (ft, ) (Entered: 05/04/2004)"
        },
        {
          "row_number": 2194,
          "id": 8974388,
          "entry_number": "357",
          "date_filed": "2004-05-03T00:00:00-04:00",
          "attachments": null,
          "url": "https://www.courtlistener.com/docket/6672519/357/united-states-v-commonwealth-of-pr/",
          "recap_pdf_url": null,
          "pacer_doc_id": "1590177349",
          "description": "MOTION for reimbursement of services rendered by Consultant Maria Juliana Vila for the JCC filed by John J. McGee w/attachs. (ft, ) (Entered: 05/04/2004)"
        },
        {
          "row_number": 2216,
          "id": 8974390,
          "entry_number": "359",
          "date_filed": "2004-05-10T00:00:00-04:00",
          "attachments": null,
          "url": "https://www.courtlistener.com/docket/6672519/359/united-states-v-commonwealth-of-pr/",
          "recap_pdf_url": null,
          "pacer_doc_id": "1590218593",
          "description": "ORDER granting 350 Motion for Disbursement of Funds, granting 351 Motion for Disbursement of Funds, granting 352 Motion for Disbursement of Funds, granting 353 Motion for Disbursement of Funds, granting 354 Motion for Disbursement of Funds, granting 355 Motion for Disbursement of Funds, granting 356 Motion for Disbursement of Funds, granting 357 Motion for Disbursement of Funds . Signed by Judge Jay A Garcia-Gregory on 5/10/04. (ac, ) (Entered: 05/10/2004)"
        },
        {
          "row_number": 2228,
          "id": 8974391,
          "entry_number": "360",
          "date_filed": "2004-05-14T00:00:00-04:00",
          "attachments": null,
          "url": "https://www.courtlistener.com/docket/6672519/360/united-states-v-commonwealth-of-pr/",
          "recap_pdf_url": null,
          "pacer_doc_id": null,
          "description": "Check No.2967477 Disbursed in amount of $15,907.64 payable to John J. McGee, check no.2967478 $6,014.24 payable to Amanda McCrovitz, check no.2967479 $6,138.74 payable to Anne Moeller Eijgendaal, check no.2967480 $5,701.64 payable to Chang C. Kim, check no.2967481 $5,917.72 payable to Maurits Eijgendaal, check no.2967482 $3,902.90 payable to Anthony McCrovitz, check no. 2967483 $6,170.18 payable to Luke Y. Tsai, check no.2967484 $1,980.00 payable to Maria Juliana Vila on 5/10/04. (ne, ) (Entered: 05/14/2004)"
        },
        {
          "row_number": 2316,
          "id": 8974399,
          "entry_number": "368",
          "date_filed": "2004-06-21T00:00:00-04:00",
          "attachments": null,
          "url": "https://www.courtlistener.com/docket/6672519/368/united-states-v-commonwealth-of-pr/",
          "recap_pdf_url": null,
          "pacer_doc_id": "1590236525",
          "description": "RESPONSE in Opposition to Intervention of Instituto Psicopedagogico & Fundaci?n Modesto Gotay filed by all defendants (Del-Valle-Cruz, Carlos) Modified on 6/22/2004 to correct docket text and create relationship to dockets #342 and #362. (ft, ). (Entered: 06/21/2004)"
        },
        {
          "row_number": 2327,
          "id": 8974400,
          "entry_number": "369",
          "date_filed": "2004-06-22T00:00:00-04:00",
          "attachments": null,
          "url": "https://www.courtlistener.com/docket/6672519/369/united-states-v-commonwealth-of-pr/",
          "recap_pdf_url": null,
          "pacer_doc_id": "1590222537",
          "description": "First MOTION for Extension of Time to File Response/Reply as to 368 Memorandum in Opposition filed by The Commonwealth of Puerto Rico, Carmen Dra. Carmen Feliciano Vda. de Melecio, Jose De-Leon, Pedro J. Rossello-Gonzalez, 365 Memorandum in Opposition to Motion, filed by USA filed by Michelle Pirallo-Di Cristina on behalf of Instituto Psicopedagogico Suggestions in opposition/response due by 7/6/2004 (Related document(s) 368, 365 ) (Pirallo-Di Cristina, Michelle) (Entered: 06/22/2004)"
        },
        {
          "row_number": 3155,
          "id": 8974403,
          "entry_number": null,
          "date_filed": "2004-06-22T00:00:00-04:00",
          "attachments": null,
          "url": "https://www.courtlistener.com",
          "recap_pdf_url": null,
          "pacer_doc_id": null,
          "description": "Set/Reset Deadlines as to 342 MOTION to Intervene, 362 MOTION to Intervene Pursuant to Rule 24 (a) FRCiv Proc. Replies due by 7/21/2004. (See #370). (ft, )"
        },
        {
          "row_number": 2347,
          "id": 8974404,
          "entry_number": "372",
          "date_filed": "2004-06-23T00:00:00-04:00",
          "attachments": null,
          "url": "https://www.courtlistener.com/docket/6672519/372/united-states-v-commonwealth-of-pr/",
          "recap_pdf_url": null,
          "pacer_doc_id": null,
          "description": "ORDER granting 371 Motion for Extension of Time to File Response/Reply . Signed by Judge Jay A Garcia-Gregory on 6/23/04. (ac, ) (Entered: 06/23/2004)"
        },
        {
          "row_number": 2374,
          "id": 8974410,
          "entry_number": "376",
          "date_filed": "2004-07-19T00:00:00-04:00",
          "attachments": null,
          "url": "https://www.courtlistener.com/docket/6672519/376/united-states-v-commonwealth-of-pr/",
          "recap_pdf_url": null,
          "pacer_doc_id": null,
          "description": "ORDER approving 373 MOTION Submitting the Annual Budget for Office of the JCC for FY 2004-2005 filed by John J. McGee. Signed by Judge Jay A Garcia-Gregory on 7/19/04. (ac, ) (Entered: 07/19/2004)"
        },
        {
          "row_number": 2379,
          "id": 8974411,
          "entry_number": "377",
          "date_filed": "2004-07-22T00:00:00-04:00",
          "attachments": null,
          "url": "https://www.courtlistener.com/docket/6672519/377/united-states-v-commonwealth-of-pr/",
          "recap_pdf_url": null,
          "pacer_doc_id": "15901018955",
          "description": "Second MOTION for Extension of Time to File Response/Reply filed by Jose R. Cancio-Bigas on behalf of Fundacion Modesto Gotay Suggestions in opposition/response due by 8/4/2004 (Cancio-Bigas, Jose) (Entered: 07/22/2004)"
        },
        {
          "row_number": 2394,
          "id": 8974413,
          "entry_number": "379",
          "date_filed": "2004-07-23T00:00:00-04:00",
          "attachments": null,
          "url": "https://www.courtlistener.com/docket/6672519/379/united-states-v-commonwealth-of-pr/",
          "recap_pdf_url": null,
          "pacer_doc_id": "15901021400",
          "description": "REPLY to Response to Motion in Opposition to intervention filed by Instituto Psicopedagogico Re: 368 Memorandum in Opposition, filed by The Commonwealth of Puerto Rico, Carmen Dra. Carmen Feliciano Vda. de Melecio, Jose De-Leon, Pedro J. Rossello-Gonzalez, 365 Memorandum in Opposition to Motion, filed by USA (Pirallo-Di Cristina, Michelle) (Entered: 07/23/2004)"
        },
        {
          "row_number": 2425,
          "id": 8974419,
          "entry_number": "384",
          "date_filed": "2004-09-09T00:00:00-04:00",
          "attachments": null,
          "url": "https://www.courtlistener.com/docket/6672519/384/united-states-v-commonwealth-of-pr/",
          "recap_pdf_url": null,
          "pacer_doc_id": "1590169605",
          "description": "MOTION to Deposit Funds JCC Budget filed by Carlos Del-Valle-Cruz on behalf of The Commonwealth of Puerto Rico (Del-Valle-Cruz, Carlos) (Entered: 09/09/2004)"
        },
        {
          "row_number": 2441,
          "id": 8974435,
          "entry_number": "399",
          "date_filed": "2004-12-14T00:00:00-05:00",
          "attachments": null,
          "url": "https://www.courtlistener.com/docket/6672519/399/united-states-v-commonwealth-of-pr/",
          "recap_pdf_url": null,
          "pacer_doc_id": "15901035597",
          "description": "ORDER granting 397 Motion submitting invoice for services rendered by the JCC for the month of November 2004. Signed by Judge Jay A Garcia-Gregory on 12/13/04. (ft, ) (Entered: 12/14/2004)"
        },
        {
          "row_number": 2444,
          "id": 8974436,
          "entry_number": "400",
          "date_filed": "2004-12-14T00:00:00-05:00",
          "attachments": null,
          "url": "https://www.courtlistener.com/docket/6672519/400/united-states-v-commonwealth-of-pr/",
          "recap_pdf_url": null,
          "pacer_doc_id": null,
          "description": "ORDER noted 383 INFORMATIVE motion, noted 384 Motion to Deposit Funds, noted 398 Motion submitting. Signed by Judge Jay A Garcia-Gregory on 12/14/04. (ac, ) (Entered: 12/14/2004)"
        },
        {
          "row_number": 2445,
          "id": 8974437,
          "entry_number": "401",
          "date_filed": "2004-12-17T00:00:00-05:00",
          "attachments": null,
          "url": "https://www.courtlistener.com/docket/6672519/401/united-states-v-commonwealth-of-pr/",
          "recap_pdf_url": null,
          "pacer_doc_id": "1590291094",
          "description": "RESPONSE in Support filed by USA Re: 398 MOTION Submitting Work Plan filed by The Commonwealth of Puerto Rico,, Carmen Dra. Carmen Feliciano Vda. de Melecio,, Jose De-Leon,, Pedro J. Rossello-Gonzalez, (Farano, Richard) (Entered: 12/17/2004)"
        },
        {
          "row_number": 2446,
          "id": 8974438,
          "entry_number": "402",
          "date_filed": "2004-12-20T00:00:00-05:00",
          "attachments": null,
          "url": "https://www.courtlistener.com/docket/6672519/402/united-states-v-commonwealth-of-pr/",
          "recap_pdf_url": null,
          "pacer_doc_id": null,
          "description": "ORDER re 398 MOTION Submitting Work Plan filed by The Commonwealth of Puerto Rico,, Carmen Dra. Carmen Feliciano Vda. de Melecio,, Jose De-Leon,, Pedro J. Rossello-Gonzalez. The Court hereby adopts and endorses the work plan submitted by the parties. Signed by Judge Jay A Garcia-Gregory on 12/20/04. (ac, ) (Entered: 12/20/2004)"
        },
        {
          "row_number": 2447,
          "id": 8974439,
          "entry_number": "403",
          "date_filed": "2004-12-28T00:00:00-05:00",
          "attachments": null,
          "url": "https://www.courtlistener.com/docket/6672519/403/united-states-v-commonwealth-of-pr/",
          "recap_pdf_url": null,
          "pacer_doc_id": null,
          "description": "Minute: The Further Status Conference set for 1/14/05 IS NOW ADVANCED TO 1/11/2005 10:30 AM before Judge Jay A Garcia-Gregory. (ct, ) (Entered: 12/28/2004)"
        },
        {
          "row_number": 2448,
          "id": 8974440,
          "entry_number": "404",
          "date_filed": "2004-12-28T00:00:00-05:00",
          "attachments": null,
          "url": "https://www.courtlistener.com/docket/6672519/404/united-states-v-commonwealth-of-pr/",
          "recap_pdf_url": null,
          "pacer_doc_id": null,
          "description": "ORDER: Further Status Conference RESET for February 18, 2005 at 2:30 p.m. Signed by Judge Jay A Garcia-Gregory on 12/28/04. (ac, ) (Entered: 12/28/2004)"
        },
        {
          "row_number": 2468,
          "id": 8974458,
          "entry_number": "422",
          "date_filed": "2005-04-07T00:00:00-04:00",
          "attachments": null,
          "url": "https://www.courtlistener.com/docket/6672519/422/united-states-v-commonwealth-of-pr/",
          "recap_pdf_url": null,
          "pacer_doc_id": null,
          "description": "ORDER : Further Status Conference IS RESET for 4/22/2005 02:30 PM in JAG's Courtroom before Judge Jay A Garcia-Gregory. Signed by Judge Jay A Garcia-Gregory on 4/7/05. (ct, ) (Entered: 04/07/2005)"
        },
        {
          "row_number": 2470,
          "id": 8974460,
          "entry_number": "424",
          "date_filed": "2005-04-12T00:00:00-04:00",
          "attachments": null,
          "url": "https://www.courtlistener.com/docket/6672519/424/united-states-v-commonwealth-of-pr/",
          "recap_pdf_url": null,
          "pacer_doc_id": null,
          "description": "ORDER: The Status Conference set for 4/22/05 is continued sine die. Parties to inform the available dates for this hearing. Signed by Judge Jay A Garcia-Gregory on 4/12/05. (ct, ) (Entered: 04/12/2005)"
        },
        {
          "row_number": 2471,
          "id": 8974461,
          "entry_number": "425",
          "date_filed": "2005-04-13T00:00:00-04:00",
          "attachments": null,
          "url": "https://www.courtlistener.com/docket/6672519/425/united-states-v-commonwealth-of-pr/",
          "recap_pdf_url": null,
          "pacer_doc_id": null,
          "description": "ORDER: Further Status Conference IS RESET for 7/15/2005 02:00 PM in JAG's Courtroom before Judge Jay A Garcia-Gregory. Signed by Judge Jay A Garcia-Gregory on 4/13/05. (ct, ) (Entered: 04/13/2005)"
        },
        {
          "row_number": 2481,
          "id": 8974470,
          "entry_number": "434",
          "date_filed": "2005-07-01T00:00:00-04:00",
          "attachments": null,
          "url": "https://www.courtlistener.com/docket/6672519/434/united-states-v-commonwealth-of-pr/",
          "recap_pdf_url": null,
          "pacer_doc_id": "1590398050",
          "description": "MOTION for reisbursement of services rendered by cinsultant Maria Juliana Vila for the Joint Compliance Coordinator filed by John J. McGee (Attachments: # 1)(jg, ) (Entered: 07/05/2005)"
        },
        {
          "row_number": 2482,
          "id": 8974471,
          "entry_number": "435",
          "date_filed": "2005-07-06T00:00:00-04:00",
          "attachments": null,
          "url": "https://www.courtlistener.com/docket/6672519/435/united-states-v-commonwealth-of-pr/",
          "recap_pdf_url": null,
          "pacer_doc_id": "1590347997",
          "description": "MOTION for submitting invoices for services rendered by the Joint Compliance Coordinator for the month of June 2005 filed by John J. McGee. (Attachments: # 1 Invoice)(jg, ) (Entered: 07/06/2005)"
        },
        {
          "row_number": 2483,
          "id": 8974472,
          "entry_number": "436",
          "date_filed": "2005-07-06T00:00:00-04:00",
          "attachments": null,
          "url": "https://www.courtlistener.com/docket/6672519/436/united-states-v-commonwealth-of-pr/",
          "recap_pdf_url": null,
          "pacer_doc_id": "1590348238",
          "description": "MOTION to Withdraw Attorney as to Guillermo A. Gil-Bonar filed by Isabel Munoz-Acosta on behalf of USA (Munoz-Acosta, Isabel) Modified on 7/7/2005 wrong event (jg, ). (Entered: 07/06/2005)"
        },
        {
          "row_number": 2484,
          "id": 8974473,
          "entry_number": "437",
          "date_filed": "2005-07-07T00:00:00-04:00",
          "attachments": null,
          "url": "https://www.courtlistener.com/docket/6672519/437/united-states-v-commonwealth-of-pr/",
          "recap_pdf_url": null,
          "pacer_doc_id": null,
          "description": "ORDER granting 433 Motion relating to the budget. The Court approves the proposed budget. Signed by Judge Jay A Garcia-Gregory on 7/7/05. (ac, ) (Entered: 07/07/2005)"
        },
        {
          "row_number": 2486,
          "id": 8974475,
          "entry_number": "439",
          "date_filed": "2005-07-07T00:00:00-04:00",
          "attachments": null,
          "url": "https://www.courtlistener.com/docket/6672519/439/united-states-v-commonwealth-of-pr/",
          "recap_pdf_url": null,
          "pacer_doc_id": null,
          "description": "ORDER granting 434 Motion for Disbursement of Funds, granting 435 Motion for Disbursement of Funds . Signed by Judge Jay A Garcia-Gregory on 07/07/05. (jg, ) (Entered: 07/08/2005)"
        },
        {
          "row_number": 2488,
          "id": 8974476,
          "entry_number": "440",
          "date_filed": "2005-07-15T00:00:00-04:00",
          "attachments": null,
          "url": "https://www.courtlistener.com/docket/6672519/440/united-states-v-commonwealth-of-pr/",
          "recap_pdf_url": null,
          "pacer_doc_id": "1590335720",
          "description": "Minute Entry for proceedings held before Judge Jay A Garcia-Gregory : Further Status Conference held on 7/15/2005, Set Hearings. Further Status Conference set for 10/14/2005 02:00 PM in JAG's Courtroom before Judge Jay A Garcia-Gregory. (ct, ) (Entered: 07/19/2005)"
        },
        {
          "row_number": 2490,
          "id": 8974478,
          "entry_number": "442",
          "date_filed": "2005-08-03T00:00:00-04:00",
          "attachments": null,
          "url": "https://www.courtlistener.com/docket/6672519/442/united-states-v-commonwealth-of-pr/",
          "recap_pdf_url": null,
          "pacer_doc_id": "1590415096",
          "description": "MOTION for reimnursement of services rendered by consultant Maurits Eijgendaal for the Joint Complince Coordinator filed by John J. McGee. (Attachments: # 1 Invoice)(jg, ) (Entered: 08/04/2005)"
        },
        {
          "row_number": 2491,
          "id": 8974479,
          "entry_number": "443",
          "date_filed": "2005-08-03T00:00:00-04:00",
          "attachments": null,
          "url": "https://www.courtlistener.com/docket/6672519/443/united-states-v-commonwealth-of-pr/",
          "recap_pdf_url": null,
          "pacer_doc_id": "15901152232",
          "description": "MOTION for reimbursement of services rendered by consultant Anne Moeller Eijgendaal for the Joint Compliance Coordinator filed by John J. McGee (jg, ) Additional attachment(s) added on 8/4/2005 (jg, ). (Entered: 08/04/2005)"
        },
        {
          "row_number": 2494,
          "id": 8974482,
          "entry_number": "446",
          "date_filed": "2005-08-30T00:00:00-04:00",
          "attachments": null,
          "url": "https://www.courtlistener.com/docket/6672519/446/united-states-v-commonwealth-of-pr/",
          "recap_pdf_url": null,
          "pacer_doc_id": "1590362246",
          "description": "NOTICE of Appearance by Harry Brugman-Mercado on behalf of all defendants (Brugman-Mercado, Harry) (Entered: 08/30/2005)"
        },
        {
          "row_number": 2495,
          "id": 8974483,
          "entry_number": "447",
          "date_filed": "2005-09-06T00:00:00-04:00",
          "attachments": null,
          "url": "https://www.courtlistener.com/docket/6672519/447/united-states-v-commonwealth-of-pr/",
          "recap_pdf_url": null,
          "pacer_doc_id": "1590344698",
          "description": "MOTION informing the Honorable Court of minor changes in the July 2005 JCC Invoice re: # 441 MOTION for submitting invoice for services rendered by the Joint Compliance Coordinator for the month of July 2005 filed by John J. McGee. (jg, ) (Entered: 09/07/2005)"
        },
        {
          "row_number": 2497,
          "id": 8974485,
          "entry_number": "449",
          "date_filed": "2005-09-06T00:00:00-04:00",
          "attachments": null,
          "url": "https://www.courtlistener.com/docket/6672519/449/united-states-v-commonwealth-of-pr/",
          "recap_pdf_url": null,
          "pacer_doc_id": "1590345130",
          "description": "MOTION for submitting invoice for services rendered by the Joint Compliance Coordinator for the month of August 2005 filed by John J. McGee. (Attachments: # 1 Exhibit)(jg, ) (Entered: 09/07/2005)"
        },
        {
          "row_number": 2499,
          "id": 8974486,
          "entry_number": "450",
          "date_filed": "2005-09-07T00:00:00-04:00",
          "attachments": null,
          "url": "https://www.courtlistener.com/docket/6672519/450/united-states-v-commonwealth-of-pr/",
          "recap_pdf_url": null,
          "pacer_doc_id": "1590348294",
          "description": "ORDER granting 441 Motion for submitting invoice for services rendered by the Joint Compliance Coordinator for the month of July, granting 442 Motion for reimnursement of services rendered by consultant Maurits Eijgendaal for the Joint Complince Coordinator, granting 443 Motion for reimbursement of services rendered by consultant Anne Moeller Eijgendaal for the Joint Compliance Coordinator, granting 447 Motion informing the Honorable Court of minor changes in the July 2005 JCC Invoice . Signed by Judge Jay A Garcia-Gregory on 09/07/05. (jg, ) (Entered: 09/07/2005)"
        },
        {
          "row_number": 2501,
          "id": 8974488,
          "entry_number": "452",
          "date_filed": "2005-09-14T00:00:00-04:00",
          "attachments": null,
          "url": "https://www.courtlistener.com/docket/6672519/452/united-states-v-commonwealth-of-pr/",
          "recap_pdf_url": null,
          "pacer_doc_id": "15901117163",
          "description": "Second MOTION to Intervene and MOTION for Hearing filed byMichelle Pirallo-Di Cristina on behalf of Instituto Psicopedagogico (Pirallo-Di Cristina, Michelle) Modified on 9/16/2005 add docket text (jg, ). (Entered: 09/14/2005)"
        },
        {
          "row_number": 2502,
          "id": 8974489,
          "entry_number": "453",
          "date_filed": "2005-09-20T00:00:00-04:00",
          "attachments": null,
          "url": "https://www.courtlistener.com/docket/6672519/453/united-states-v-commonwealth-of-pr/",
          "recap_pdf_url": null,
          "pacer_doc_id": "15901146788",
          "description": "RESPONSE in Opposition to Motion filed by John J. McGee Re: 452 Second MOTION to Intervene filed by Instituto Psicopedagogico, (np, ) (Entered: 09/21/2005)"
        },
        {
          "row_number": 2503,
          "id": 8974490,
          "entry_number": "454",
          "date_filed": "2005-09-28T00:00:00-04:00",
          "attachments": null,
          "url": "https://www.courtlistener.com/docket/6672519/454/united-states-v-commonwealth-of-pr/",
          "recap_pdf_url": null,
          "pacer_doc_id": "1590359620",
          "description": "RESPONSE in Opposition to Motion filed by USA Re: 452 Second MOTION to Intervene filed by Instituto Psicopedagogico, (Farano, Richard) Modified on 10/4/2005 wrong event (jg, ). (Entered: 09/28/2005)"
        },
        {
          "row_number": 2504,
          "id": 8974491,
          "entry_number": "455",
          "date_filed": "2005-09-28T00:00:00-04:00",
          "attachments": null,
          "url": "https://www.courtlistener.com/docket/6672519/455/united-states-v-commonwealth-of-pr/",
          "recap_pdf_url": null,
          "pacer_doc_id": "15901091296",
          "description": "RESPONSE in Opposition to Motion filed by all defendants Re: 452 Second MOTION to Intervene filed by Instituto Psicopedagogico, (Attachments: # 1 Exhibit Contract Between Commonwealth and Instituto)(Brugman-Mercado, Harry) Modified on 10/4/2005 wrong event (jg, ). (Entered: 09/28/2005)"
        },
        {
          "row_number": 2505,
          "id": 8974492,
          "entry_number": "456",
          "date_filed": "2005-10-04T00:00:00-04:00",
          "attachments": null,
          "url": "https://www.courtlistener.com/docket/6672519/456/united-states-v-commonwealth-of-pr/",
          "recap_pdf_url": null,
          "pacer_doc_id": "15901151039",
          "description": "MOTION for submitting invoice for services rendered by the Joint Compliance Coordinator for the month of September 2005. filed by John J. McGee. (jg, ) Additional attachment(s) added on 10/5/2005 (jg, ). (Entered: 10/05/2005)"
        },
        {
          "row_number": 3160,
          "id": 8974493,
          "entry_number": null,
          "date_filed": "2005-10-05T00:00:00-04:00",
          "attachments": null,
          "url": "https://www.courtlistener.com",
          "recap_pdf_url": null,
          "pacer_doc_id": null,
          "description": "NOTICE of Docket Text Modification by Deputy Clerk re: 456 MOTION for Disbursement of Funds. *** Additional attachment(s) added *** (jg, )"
        },
        {
          "row_number": 2507,
          "id": 8974495,
          "entry_number": "458",
          "date_filed": "2005-10-12T00:00:00-04:00",
          "attachments": null,
          "url": "https://www.courtlistener.com/docket/6672519/458/united-states-v-commonwealth-of-pr/",
          "recap_pdf_url": null,
          "pacer_doc_id": "1590445436",
          "description": "ORDER granting 456 Motion for Disbursement of Funds . Signed by Judge Jay A Garcia-Gregory on 10/12/05. (jg, ) (Entered: 10/13/2005)"
        },
        {
          "row_number": 3161,
          "id": 8974497,
          "entry_number": null,
          "date_filed": "2005-10-31T00:00:00-05:00",
          "attachments": null,
          "url": "https://www.courtlistener.com",
          "recap_pdf_url": null,
          "pacer_doc_id": null,
          "description": "DEPOSIT of Funds from Commanwealth of PR in the amount of $276,250.00, receipt no.159223. Deposited ((NEXT WORKING DAY))in an Interest Bearing Account in compliance with L.R.67. **FUNDS WILL BE AVAILABLE FOR DISBURSEMENT WITHIN 5 WORKING DAYS** (ne, )"
        },
        {
          "row_number": 2508,
          "id": 8974498,
          "entry_number": "459",
          "date_filed": "2005-10-31T00:00:00-05:00",
          "attachments": null,
          "url": "https://www.courtlistener.com/docket/6672519/459/united-states-v-commonwealth-of-pr/",
          "recap_pdf_url": null,
          "pacer_doc_id": "15901153843",
          "description": "MOTION to Deposit Funds 2005-06 JCC's Budget filed byHarry Brugman-Mercado on behalf of all defendants (Brugman-Mercado, Harry) (Entered: 10/31/2005)"
        },
        {
          "row_number": 2512,
          "id": 8974500,
          "entry_number": "462",
          "date_filed": "2005-11-08T00:00:00-05:00",
          "attachments": null,
          "url": "https://www.courtlistener.com/docket/6672519/462/united-states-v-commonwealth-of-pr/",
          "recap_pdf_url": null,
          "pacer_doc_id": "15901186058",
          "description": "MOTION for submitting invoice for services rendered by Maria Juliana Vila for the office of the Joint Compliance Coordinator in the months of May though October 2005 filed by John J. McGee. (Attachments: # 1)(jg, ) (Entered: 11/09/2005)"
        },
        {
          "row_number": 2513,
          "id": 8974501,
          "entry_number": "463",
          "date_filed": "2005-11-08T00:00:00-05:00",
          "attachments": null,
          "url": "https://www.courtlistener.com/docket/6672519/463/united-states-v-commonwealth-of-pr/",
          "recap_pdf_url": null,
          "pacer_doc_id": "1590448772",
          "description": "MOTION for submitting invoice for services rendered by the Joint Compliance Coordinator for the month October 2005 filed by John J. McGee. (Attachments: # 1)(jg, ) (Entered: 11/09/2005)"
        },
        {
          "row_number": 2522,
          "id": 8974509,
          "entry_number": "471",
          "date_filed": "2005-12-16T00:00:00-05:00",
          "attachments": null,
          "url": "https://www.courtlistener.com/docket/6672519/471/united-states-v-commonwealth-of-pr/",
          "recap_pdf_url": null,
          "pacer_doc_id": "1590395070",
          "description": "Minute Entry for proceedings held before Judge Jay A Garcia-Gregory : Further Status Conference held on 12/16/2005.Further Status Conference set for 3/10/2006 02:00 PM before Judge Jay A Garcia-Gregory. (ct, ) Additional attachment(s) added on 12/16/2005 (np, ). (Entered: 12/16/2005)"
        },
        {
          "row_number": 2524,
          "id": 8974511,
          "entry_number": "473",
          "date_filed": "2005-12-22T00:00:00-05:00",
          "attachments": null,
          "url": "https://www.courtlistener.com/docket/6672519/473/united-states-v-commonwealth-of-pr/",
          "recap_pdf_url": null,
          "pacer_doc_id": "15901106611",
          "description": "ORDER granting 469 Motion submitting invoice for the month of Oct 2005, granting 470 Motion submitting invoice for the month of Nov 2005. Signed by Judge Jay A Garcia-Gregory on 12/22/05. (np, ) Modified on 12/22/2005 s/c: B. Stroud (np, ). (Entered: 12/22/2005)"
        },
        {
          "row_number": 2527,
          "id": 8974514,
          "entry_number": "476",
          "date_filed": "2006-01-31T00:00:00-05:00",
          "attachments": null,
          "url": "https://www.courtlistener.com/docket/6672519/476/united-states-v-commonwealth-of-pr/",
          "recap_pdf_url": null,
          "pacer_doc_id": "1590717638",
          "description": "INFORMATIVE Motion regarding MRP Fiscal Situation filed byHarry Brugman-Mercado on behalf of all defendants (Attachments: # 1 Exhibit I- Projected Deficit# 2 Exhibit II- Proposed Budget 2006-07)(Brugman-Mercado, Harry) (Entered: 01/31/2006)"
        },
        {
          "row_number": 2528,
          "id": 8974515,
          "entry_number": "477",
          "date_filed": "2006-02-02T00:00:00-05:00",
          "attachments": null,
          "url": "https://www.courtlistener.com/docket/6672519/477/united-states-v-commonwealth-of-pr/",
          "recap_pdf_url": null,
          "pacer_doc_id": "15901498406",
          "description": "MOTION submitting invoice for the month of Jan 2006 filed by John J. McGee (np, ) (Entered: 02/02/2006)"
        },
        {
          "row_number": 2529,
          "id": 8974516,
          "entry_number": "478",
          "date_filed": "2006-02-09T00:00:00-05:00",
          "attachments": null,
          "url": "https://www.courtlistener.com/docket/6672519/478/united-states-v-commonwealth-of-pr/",
          "recap_pdf_url": null,
          "pacer_doc_id": "15901495503",
          "description": "ORDER granting 477 Motion for Disbursement of Funds . Signed by Judge Jay A Garcia-Gregory on 2/8/2006. (cm, ) (Entered: 02/09/2006)"
        },
        {
          "row_number": 2556,
          "id": 8974542,
          "entry_number": "501",
          "date_filed": "2006-05-10T00:00:00-04:00",
          "attachments": null,
          "url": "https://www.courtlistener.com/docket/6672519/501/united-states-v-commonwealth-of-pr/",
          "recap_pdf_url": null,
          "pacer_doc_id": "1590734028",
          "description": "MOTION to Substitute Legal Representation Attorney Taraneh K. Ferdman filed byTaraneh K. Ferdman on behalf of The Commonwealth of Puerto Rico (Ferdman, Taraneh) (Entered: 05/10/2006)"
        },
        {
          "row_number": 2558,
          "id": 8974543,
          "entry_number": "503",
          "date_filed": "2006-05-10T00:00:00-04:00",
          "attachments": null,
          "url": "https://www.courtlistener.com/docket/6672519/503/united-states-v-commonwealth-of-pr/",
          "recap_pdf_url": null,
          "pacer_doc_id": "1590734454",
          "description": "NOTICE of Appearance by Maria Judith Surillo on behalf of all defendants (Surillo, Maria) (Entered: 05/10/2006)"
        },
        {
          "row_number": 2596,
          "id": 8974580,
          "entry_number": "538",
          "date_filed": "2006-09-12T00:00:00-04:00",
          "attachments": null,
          "url": "https://www.courtlistener.com/docket/6672519/538/united-states-v-commonwealth-of-pr/",
          "recap_pdf_url": null,
          "pacer_doc_id": "15901263541",
          "description": "**FILED IN ERROR, SEE NEW ENTRY OF INVOICE****NOTICE of Docket Text Modification by Deputy Clerk re: 537 MOTION Submitting Invoice for services rendered inbetween June 2005 and April 2006. Attachments have been added to the above motion. (cm, ) Modified on 9/15/2006 (cm, ). (Entered: 09/14/2006)"
        },
        {
          "row_number": 2597,
          "id": 8974581,
          "entry_number": "539",
          "date_filed": "2006-09-12T00:00:00-04:00",
          "attachments": null,
          "url": "https://www.courtlistener.com/docket/6672519/539/united-states-v-commonwealth-of-pr/",
          "recap_pdf_url": null,
          "pacer_doc_id": "15901263786",
          "description": "MOTION Submitting Invoice for services rendered by Consultants Anne Eijgendaal and Maurits Eijgendaal for service rendered in April 2006 filed by John J. McGee (Attachments: # 1 INVOICE)(cm, ) (Entered: 09/14/2006)"
        },
        {
          "row_number": 3166,
          "id": 8974582,
          "entry_number": null,
          "date_filed": "2006-09-14T00:00:00-04:00",
          "attachments": null,
          "url": "https://www.courtlistener.com",
          "recap_pdf_url": null,
          "pacer_doc_id": null,
          "description": "Certificate of Funds deposited : FUNDS AVAILABLE. $141,962.27 (INCLUDING INTEREST LESS REG FEES)ACCT# 400-5646680Freddie E. GonzalezFinancial Specialist (cm, )"
        },
        {
          "row_number": 2599,
          "id": 8974583,
          "entry_number": "540",
          "date_filed": "2006-09-15T00:00:00-04:00",
          "attachments": null,
          "url": "https://www.courtlistener.com/docket/6672519/540/united-states-v-commonwealth-of-pr/",
          "recap_pdf_url": null,
          "pacer_doc_id": "1590480322",
          "description": "INFORMATIVE Motion regarding Fiscal Situation of MRP filed byEduardo A. Vera-Ramirez on behalf of The Commonwealth of Puerto Rico, Pedro J. Rossello-Gonzalez, Carmen Feliciano-de-Melecio, Jose De-Leon (Attachments: # 1 Exhibit A) Status Report)(Vera-Ramirez, Eduardo) (Entered: 09/15/2006)"
        },
        {
          "row_number": 2600,
          "id": 8974584,
          "entry_number": "541",
          "date_filed": "2006-09-15T00:00:00-04:00",
          "attachments": null,
          "url": "https://www.courtlistener.com/docket/6672519/541/united-states-v-commonwealth-of-pr/",
          "recap_pdf_url": null,
          "pacer_doc_id": "15901264505",
          "description": "MOTION Re-Submitting Invoice of Consultant Ms. Marge brown for services rendered in between June 2005 and April 2006, filed by John J. McGee (Attachments: # 1 Corrected Invoice)(cm, ) (Entered: 09/15/2006)"
        },
        {
          "row_number": 2649,
          "id": 8974634,
          "entry_number": "588",
          "date_filed": "2007-03-23T00:00:00-04:00",
          "attachments": null,
          "url": "https://www.courtlistener.com/docket/6672519/588/united-states-v-commonwealth-of-pr/",
          "recap_pdf_url": null,
          "pacer_doc_id": "15901368196",
          "description": "Joint INFORMATIVE Motion regarding Proposed Date for Status Conference filed byMichelle Davila-Montalvo on behalf of The Commonwealth of Puerto Rico, Pedro J. Rossello-Gonzalez, Carmen Feliciano-de-Melecio, Jose De-Leon (Davila-Montalvo, Michelle) (Entered: 03/23/2007)"
        },
        {
          "row_number": 2652,
          "id": 8974636,
          "entry_number": "590",
          "date_filed": "2007-03-26T00:00:00-04:00",
          "attachments": null,
          "url": "https://www.courtlistener.com/docket/6672519/590/united-states-v-commonwealth-of-pr/",
          "recap_pdf_url": null,
          "pacer_doc_id": null,
          "description": "ENDORSED ORDER re 589 Letter from Instituto Psicopedagogico de Puerto Rico. Letter to be made a part of the record and translated. Parties to inform by 5/1/07 of their position to this matter. Signed by Judge Gustavo A. Gelpi on 3/26/07. (cr, ) Modified on 4/2/2007 to add docket text. (ni, ). (Entered: 03/26/2007)"
        },
        {
          "row_number": 2653,
          "id": 8974637,
          "entry_number": "591",
          "date_filed": "2007-03-26T00:00:00-04:00",
          "attachments": null,
          "url": "https://www.courtlistener.com/docket/6672519/591/united-states-v-commonwealth-of-pr/",
          "recap_pdf_url": null,
          "pacer_doc_id": "15901369785",
          "description": "ORDER re 588 INFORMATIVE motion . Signed by Judge Gustavo A. Gelpi on 3/26/07. (sm, ) (Entered: 03/26/2007)"
        },
        {
          "row_number": 2656,
          "id": 8974640,
          "entry_number": "594",
          "date_filed": "2007-03-29T00:00:00-04:00",
          "attachments": null,
          "url": "https://www.courtlistener.com/docket/6672519/594/united-states-v-commonwealth-of-pr/",
          "recap_pdf_url": null,
          "pacer_doc_id": null,
          "description": "ORDER noted 593 Motion submitting . Signed by Judge Gustavo A. Gelpi on 3/29/07. (sm, ) (Entered: 03/29/2007)"
        },
        {
          "row_number": 2657,
          "id": 8974641,
          "entry_number": "595",
          "date_filed": "2007-03-29T00:00:00-04:00",
          "attachments": null,
          "url": "https://www.courtlistener.com/docket/6672519/595/united-states-v-commonwealth-of-pr/",
          "recap_pdf_url": null,
          "pacer_doc_id": "15901351831",
          "description": "INFORMATIVE Motion filed byMichelle Davila-Montalvo on behalf of The Commonwealth of Puerto Rico, Pedro J. Rossello-Gonzalez, Carmen Feliciano-de-Melecio, Jose De-Leon (Davila-Montalvo, Michelle) (Entered: 03/29/2007)"
        },
        {
          "row_number": 2658,
          "id": 8974642,
          "entry_number": "596",
          "date_filed": "2007-03-29T00:00:00-04:00",
          "attachments": null,
          "url": "https://www.courtlistener.com/docket/6672519/596/united-states-v-commonwealth-of-pr/",
          "recap_pdf_url": null,
          "pacer_doc_id": null,
          "description": "ORDER noted and approved 595 INFORMATIVE motion . Signed by Judge Gustavo A. Gelpi on 3/29/07. (sm, ) (Entered: 03/29/2007)"
        },
        {
          "row_number": 2667,
          "id": 8974649,
          "entry_number": "603",
          "date_filed": "2007-04-13T00:00:00-04:00",
          "attachments": null,
          "url": "https://www.courtlistener.com/docket/6672519/603/united-states-v-commonwealth-of-pr/",
          "recap_pdf_url": null,
          "pacer_doc_id": "15901363478",
          "description": "INFORMATIVE Motion regarding Compliance with Order filed byMichelle Davila-Montalvo on behalf of The Commonwealth of Puerto Rico, Pedro J. Rossello-Gonzalez, Carmen Feliciano-de-Melecio, Jose De-Leon (Attachments: # 1 Motion in Compliance with Order to Deposit)(Davila-Montalvo, Michelle) (Entered: 04/13/2007)"
        },
        {
          "row_number": 2670,
          "id": 8974652,
          "entry_number": "606",
          "date_filed": "2007-04-18T00:00:00-04:00",
          "attachments": null,
          "url": "https://www.courtlistener.com/docket/6672519/606/united-states-v-commonwealth-of-pr/",
          "recap_pdf_url": null,
          "pacer_doc_id": null,
          "description": "ORDER granting and approving 601 Motion submitting, granting and approving 602 Motion submitting. DEFENDANT SHALL WITHIN TEN (10) DAYS DEPOSIT THE AFOREMENTIONED SUMS. . Signed by Judge Gustavo A. Gelpi on 4/18/07. (sm, ) (Entered: 04/18/2007)"
        },
        {
          "row_number": 2671,
          "id": 8974653,
          "entry_number": "607",
          "date_filed": "2007-04-18T00:00:00-04:00",
          "attachments": null,
          "url": "https://www.courtlistener.com/docket/6672519/607/united-states-v-commonwealth-of-pr/",
          "recap_pdf_url": null,
          "pacer_doc_id": "1590559666",
          "description": "INFORMATIVE Motion regarding Clarification of Order filed byMichelle Davila-Montalvo on behalf of The Commonwealth of Puerto Rico, Pedro J. Rossello-Gonzalez, Carmen Feliciano-de-Melecio, Jose De-Leon (Davila-Montalvo, Michelle) (Entered: 04/18/2007)"
        },
        {
          "row_number": 2672,
          "id": 8974654,
          "entry_number": "608",
          "date_filed": "2007-04-18T00:00:00-04:00",
          "attachments": null,
          "url": "https://www.courtlistener.com/docket/6672519/608/united-states-v-commonwealth-of-pr/",
          "recap_pdf_url": null,
          "pacer_doc_id": null,
          "description": "ORDER noted 607 INFORMATIVE motion . Signed by Judge Gustavo A. Gelpi on 4/18/07. (sm, ) (Entered: 04/18/2007)"
        },
        {
          "row_number": 2677,
          "id": 8974658,
          "entry_number": "612",
          "date_filed": "2007-05-15T00:00:00-04:00",
          "attachments": null,
          "url": "https://www.courtlistener.com/docket/6672519/612/united-states-v-commonwealth-of-pr/",
          "recap_pdf_url": null,
          "pacer_doc_id": "15901373398",
          "description": "INFORMATIVE Motion regarding MRP filed byMichelle Davila-Montalvo on behalf of The Commonwealth of Puerto Rico, Pedro J. Rossello-Gonzalez, Carmen Feliciano-de-Melecio, Jose De-Leon (Davila-Montalvo, Michelle) (Entered: 05/15/2007)"
        },
        {
          "row_number": 2678,
          "id": 8974659,
          "entry_number": "613",
          "date_filed": "2007-05-15T00:00:00-04:00",
          "attachments": null,
          "url": "https://www.courtlistener.com/docket/6672519/613/united-states-v-commonwealth-of-pr/",
          "recap_pdf_url": null,
          "pacer_doc_id": null,
          "description": "ORDER noted 612 INFORMATIVE motion . Signed by Judge Gustavo A. Gelpi on 5/15/07. (sm, ) (Entered: 05/15/2007)"
        },
        {
          "row_number": 2682,
          "id": 8974662,
          "entry_number": "617",
          "date_filed": "2007-05-25T00:00:00-04:00",
          "attachments": null,
          "url": "https://www.courtlistener.com/docket/6672519/617/united-states-v-commonwealth-of-pr/",
          "recap_pdf_url": null,
          "pacer_doc_id": "1590325401",
          "description": "Minutes of Proceedings and Order for On-Site Inspection held before Judge Gustavo A. Gelpi on 5/25/2007. (Court Reporter none.) (cr, ) (Entered: 05/29/2007)"
        },
        {
          "row_number": 2684,
          "id": 8974665,
          "entry_number": "619",
          "date_filed": "2007-05-30T00:00:00-04:00",
          "attachments": null,
          "url": "https://www.courtlistener.com/docket/6672519/619/united-states-v-commonwealth-of-pr/",
          "recap_pdf_url": null,
          "pacer_doc_id": null,
          "description": "ORDER noted 618 INFORMATIVE motion . Signed by Judge Gustavo A. Gelpi on 5/30/07. (sm, ) (Entered: 05/30/2007)"
        },
        {
          "row_number": 2686,
          "id": 8974666,
          "entry_number": "620",
          "date_filed": "2007-06-06T00:00:00-04:00",
          "attachments": null,
          "url": "https://www.courtlistener.com/docket/6672519/620/united-states-v-commonwealth-of-pr/",
          "recap_pdf_url": null,
          "pacer_doc_id": "1590579831",
          "description": "INFORMATIVE Motion regarding MRP filed byMichelle Davila-Montalvo on behalf of The Commonwealth of Puerto Rico, Pedro J. Rossello-Gonzalez, Carmen Feliciano-de-Melecio, Jose De-Leon (Davila-Montalvo, Michelle) (Entered: 06/06/2007)"
        },
        {
          "row_number": 2687,
          "id": 8974667,
          "entry_number": "621",
          "date_filed": "2007-06-06T00:00:00-04:00",
          "attachments": null,
          "url": "https://www.courtlistener.com/docket/6672519/621/united-states-v-commonwealth-of-pr/",
          "recap_pdf_url": null,
          "pacer_doc_id": null,
          "description": "ORDER noted 620 INFORMATIVE motion . Signed by Judge Gustavo A. Gelpi on 6/6/07. (sm, ) (Entered: 06/06/2007)"
        },
        {
          "row_number": 2693,
          "id": 8974673,
          "entry_number": "627",
          "date_filed": "2007-06-28T00:00:00-04:00",
          "attachments": null,
          "url": "https://www.courtlistener.com/docket/6672519/627/united-states-v-commonwealth-of-pr/",
          "recap_pdf_url": null,
          "pacer_doc_id": null,
          "description": "REPORT I re: visit to the Instituto Sico-Pedagogico, filed by John J. McGee w/Binder attached. (ft, ) (Entered: 06/28/2007)"
        },
        {
          "row_number": 2698,
          "id": 8974677,
          "entry_number": "631",
          "date_filed": "2007-07-10T00:00:00-04:00",
          "attachments": null,
          "url": "https://www.courtlistener.com/docket/6672519/631/united-states-v-commonwealth-of-pr/",
          "recap_pdf_url": null,
          "pacer_doc_id": "1590626266",
          "description": "MOTION Submitting Invoice for services rendered by Consultant Maurits Eijgendaal filed by John J. McGee (cm, ) (Entered: 07/12/2007)"
        },
        {
          "row_number": 2699,
          "id": 8974678,
          "entry_number": "632",
          "date_filed": "2007-07-10T00:00:00-04:00",
          "attachments": null,
          "url": "https://www.courtlistener.com/docket/6672519/632/united-states-v-commonwealth-of-pr/",
          "recap_pdf_url": null,
          "pacer_doc_id": "15901403756",
          "description": "***WITHDRAWN, SEE DKT 638 *** MOTION Submitting Invoice for services rendered by Consultant Maria Juliana Vila in the JCC in 2006-2007 filed by John J. McGee (cm, ) Additional attachment(s) added on 7/12/2007 (cm, ). Modified on 7/17/2007 (jms, ). (Entered: 07/12/2007)"
        },
        {
          "row_number": 2700,
          "id": 8974679,
          "entry_number": "633",
          "date_filed": "2007-07-10T00:00:00-04:00",
          "attachments": null,
          "url": "https://www.courtlistener.com/docket/6672519/633/united-states-v-commonwealth-of-pr/",
          "recap_pdf_url": null,
          "pacer_doc_id": "1590626680",
          "description": "MOTION Submitting Invoice for Services Rendered by Consultant Gerald Provencal, MSW filed by John J. McGee (cm, ) (Entered: 07/12/2007)"
        },
        {
          "row_number": 2701,
          "id": 8974680,
          "entry_number": "634",
          "date_filed": "2007-07-10T00:00:00-04:00",
          "attachments": null,
          "url": "https://www.courtlistener.com/docket/6672519/634/united-states-v-commonwealth-of-pr/",
          "recap_pdf_url": null,
          "pacer_doc_id": "15901403607",
          "description": "MOTION Submitting Invoice for Services Rendered by Consultant Gerald Provencal, MSW filed by John J. McGee (cm, ) (Entered: 07/12/2007)"
        },
        {
          "row_number": 2702,
          "id": 8974681,
          "entry_number": "635",
          "date_filed": "2007-07-10T00:00:00-04:00",
          "attachments": null,
          "url": "https://www.courtlistener.com/docket/6672519/635/united-states-v-commonwealth-of-pr/",
          "recap_pdf_url": null,
          "pacer_doc_id": "15901403392",
          "description": "***WITHDRAWN, SEE DKT 638 *** MOTION Submitting Invoice for Services Rendered by Consultant Anne Eijgendaal filed by John J. McGee (cm, ) Modified on 7/17/2007 (jms, ). (Entered: 07/12/2007)"
        },
        {
          "row_number": 3172,
          "id": 8974682,
          "entry_number": null,
          "date_filed": "2007-07-10T00:00:00-04:00",
          "attachments": null,
          "url": "https://www.courtlistener.com",
          "recap_pdf_url": null,
          "pacer_doc_id": null,
          "description": "NOTICE of Docket Text Modification by Deputy Clerk re: 632 MOTION Submitting Invoice for services rendered by Consultant Maria Juliana Vila in the JCC in 2006-2007. PDF has been added. (cm, )"
        },
        {
          "row_number": 2708,
          "id": 8974687,
          "entry_number": "640",
          "date_filed": "2007-07-17T00:00:00-04:00",
          "attachments": null,
          "url": "https://www.courtlistener.com/docket/6672519/640/united-states-v-commonwealth-of-pr/",
          "recap_pdf_url": null,
          "pacer_doc_id": "15901389067",
          "description": "MOTION to Withdraw Documents re: 635 MOTION Submitting Invoice for Services Rendered by Consultant Anne Eijgendaal, 630 MOTION Submitting Invoice for services rendered by the JCC for the month of June 2007, 632 MOTION Submitting Invoice for services rendered by Consultant Maria Juliana Vila in the JCC in 2006-2007 filed by John J. McGee (Related document(s) 635, 630, 632 ) (jms, ) (Entered: 07/18/2007)"
        },
        {
          "row_number": 2709,
          "id": 8974688,
          "entry_number": "641",
          "date_filed": "2007-07-18T00:00:00-04:00",
          "attachments": null,
          "url": "https://www.courtlistener.com/docket/6672519/641/united-states-v-commonwealth-of-pr/",
          "recap_pdf_url": null,
          "pacer_doc_id": null,
          "description": "ORDER granting 640 MOTION to Withdraw. SEE Order (Docket No. 638) . Signed by Judge Gustavo A. Gelpi on 7/18/07. (sm, ) (Entered: 07/18/2007)"
        },
        {
          "row_number": 2710,
          "id": 8974689,
          "entry_number": "642",
          "date_filed": "2007-07-19T00:00:00-04:00",
          "attachments": null,
          "url": "https://www.courtlistener.com/docket/6672519/642/united-states-v-commonwealth-of-pr/",
          "recap_pdf_url": null,
          "pacer_doc_id": "1590643911",
          "description": "ORDER for Defendants to Deposit Funds with the Clerk of Court. Signed by Judge Gustavo A. Gelpi on 7/19/07. (cr, ) (Entered: 07/19/2007)"
        },
        {
          "row_number": 2711,
          "id": 8974690,
          "entry_number": "643",
          "date_filed": "2007-08-01T00:00:00-04:00",
          "attachments": null,
          "url": "https://www.courtlistener.com/docket/6672519/643/united-states-v-commonwealth-of-pr/",
          "recap_pdf_url": null,
          "pacer_doc_id": "1590637542",
          "description": "MOTION for extension of time until August 11, 2007 to Deposit Funds filed byMichelle Davila-Montalvo on behalf of The Commonwealth of Puerto Rico, Pedro J. Rossello-Gonzalez, Carmen Feliciano-de-Melecio, Jose De-Leon Suggestions in opposition/response due by 8/14/2007 (Davila-Montalvo, Michelle) (Entered: 08/01/2007)"
        },
        {
          "row_number": 3173,
          "id": 8974692,
          "entry_number": null,
          "date_filed": "2007-08-02T00:00:00-04:00",
          "attachments": null,
          "url": "https://www.courtlistener.com",
          "recap_pdf_url": null,
          "pacer_doc_id": null,
          "description": "Deposit of funds from Eileen Landron in the amount of $80,000.00, receipt number 170745. Deposited ((NEXT WORKING DAY))in an Interest Bearing Account in compliance with L.R.67. **FUNDS WILL BE AVAILABLE FOR DISBURSEMENT WITHIN 5 WORKING DAYS** (jap, )"
        },
        {
          "row_number": 2713,
          "id": 8974693,
          "entry_number": "645",
          "date_filed": "2007-08-02T00:00:00-04:00",
          "attachments": null,
          "url": "https://www.courtlistener.com/docket/6672519/645/united-states-v-commonwealth-of-pr/",
          "recap_pdf_url": null,
          "pacer_doc_id": "1590638091",
          "description": "Motion In Compliance with 642 Order filed byMichelle Davila-Montalvo on behalf of The Commonwealth of Puerto Rico, Pedro J. Rossello-Gonzalez, Carmen Feliciano-de-Melecio, Jose De-Leon (Davila-Montalvo, Michelle) Modified on 8/3/2007 to create link(jms, ). (Entered: 08/02/2007)"
        },
        {
          "row_number": 2714,
          "id": 8974694,
          "entry_number": "646",
          "date_filed": "2007-08-02T00:00:00-04:00",
          "attachments": null,
          "url": "https://www.courtlistener.com/docket/6672519/646/united-states-v-commonwealth-of-pr/",
          "recap_pdf_url": null,
          "pacer_doc_id": null,
          "description": "ORDER noted 645 Motion In Compliance . Signed by Judge Gustavo A. Gelpi on 8/2/07. (sm, ) (Entered: 08/02/2007)"
        },
        {
          "row_number": 2715,
          "id": 8974695,
          "entry_number": "647",
          "date_filed": "2007-08-15T00:00:00-04:00",
          "attachments": null,
          "url": "https://www.courtlistener.com/docket/6672519/647/united-states-v-commonwealth-of-pr/",
          "recap_pdf_url": null,
          "pacer_doc_id": "15901420485",
          "description": "INFORMATIVE Motion regarding Mental Retardation Program filed byMichelle Davila-Montalvo on behalf of The Commonwealth of Puerto Rico, Pedro J. Rossello-Gonzalez, Carmen Feliciano-de-Melecio, Jose De-Leon (Davila-Montalvo, Michelle) (Entered: 08/15/2007)"
        },
        {
          "row_number": 2716,
          "id": 8974696,
          "entry_number": "648",
          "date_filed": "2007-08-15T00:00:00-04:00",
          "attachments": null,
          "url": "https://www.courtlistener.com/docket/6672519/648/united-states-v-commonwealth-of-pr/",
          "recap_pdf_url": null,
          "pacer_doc_id": "1590640984",
          "description": "MOTION to Amend/Correct Re: 647 INFORMATIVE Motion regarding Mental Retardation Program filed by The Commonwealth of Puerto Rico,, Jose De-Leon,, Pedro J. Rossello-Gonzalez,, Carmen Feliciano-de-Melecio, filed byMichelle Davila-Montalvo on behalf of The Commonwealth of Puerto Rico, Pedro J. Rossello-Gonzalez, Carmen Feliciano-de-Melecio, Jose De-Leon Suggestions in opposition/response due by 8/28/2007 (Related document(s) 647 ) (Davila-Montalvo, Michelle) (Entered: 08/15/2007)"
        },
        {
          "row_number": 2717,
          "id": 8974697,
          "entry_number": "649",
          "date_filed": "2007-08-15T00:00:00-04:00",
          "attachments": null,
          "url": "https://www.courtlistener.com/docket/6672519/649/united-states-v-commonwealth-of-pr/",
          "recap_pdf_url": null,
          "pacer_doc_id": null,
          "description": "ORDER noted 648 Motion to Amend/Correct . Signed by Judge Gustavo A. Gelpi on 8/15/07. (sm, ) (Entered: 08/15/2007)"
        },
        {
          "row_number": 2720,
          "id": 8974699,
          "entry_number": "651",
          "date_filed": "2007-08-24T00:00:00-04:00",
          "attachments": null,
          "url": "https://www.courtlistener.com/docket/6672519/651/united-states-v-commonwealth-of-pr/",
          "recap_pdf_url": null,
          "pacer_doc_id": "15901431397",
          "description": "Letter from Asoc. de Padres Inst. Psicipedagogico de PR (cm, ) (Entered: 08/29/2007)"
        },
        {
          "row_number": 3174,
          "id": 8974700,
          "entry_number": null,
          "date_filed": "2007-08-24T00:00:00-04:00",
          "attachments": null,
          "url": "https://www.courtlistener.com",
          "recap_pdf_url": null,
          "pacer_doc_id": null,
          "description": "ENDORSED ORDER noted. The Court will discuss this matter with dr. McGee and the parties. The Court also notes that an association cannot appear before it is represented by its members, re 651 Letter. Signed by Judge Gustavo A. Gelpi on 8/22/2007. (cm, )"
        },
        {
          "row_number": 2722,
          "id": 8974702,
          "entry_number": "653",
          "date_filed": "2007-09-17T00:00:00-04:00",
          "attachments": null,
          "url": "https://www.courtlistener.com/docket/6672519/653/united-states-v-commonwealth-of-pr/",
          "recap_pdf_url": null,
          "pacer_doc_id": "1590664103",
          "description": "INFORMATIVE Motion regarding MRP filed byMichelle Davila-Montalvo on behalf of The Commonwealth of Puerto Rico, Pedro J. Rossello-Gonzalez, Carmen Feliciano-de-Melecio, Jose De-Leon (Davila-Montalvo, Michelle) (Entered: 09/17/2007)"
        },
        {
          "row_number": 2723,
          "id": 8974703,
          "entry_number": "654",
          "date_filed": "2007-09-17T00:00:00-04:00",
          "attachments": null,
          "url": "https://www.courtlistener.com/docket/6672519/654/united-states-v-commonwealth-of-pr/",
          "recap_pdf_url": null,
          "pacer_doc_id": null,
          "description": "ORDER noted 653 INFORMATIVE motion . Signed by Judge Gustavo A. Gelpi on 9/17/07. (sm, ) (Entered: 09/17/2007)"
        },
        {
          "row_number": 2724,
          "id": 8974704,
          "entry_number": "655",
          "date_filed": "2007-09-27T00:00:00-04:00",
          "attachments": null,
          "url": "https://www.courtlistener.com/docket/6672519/655/united-states-v-commonwealth-of-pr/",
          "recap_pdf_url": null,
          "pacer_doc_id": "15901378008",
          "description": "MOTION Submitting Invoice for the month of August 2007 filed by John J. McGee (Attachments: # 1 Invoice)(cm, ) (Entered: 10/01/2007)"
        },
        {
          "row_number": 2725,
          "id": 8974705,
          "entry_number": "656",
          "date_filed": "2007-10-02T00:00:00-04:00",
          "attachments": null,
          "url": "https://www.courtlistener.com/docket/6672519/656/united-states-v-commonwealth-of-pr/",
          "recap_pdf_url": null,
          "pacer_doc_id": null,
          "description": "ORDER. Status Conference RESET for 10/26/2007 05:00 PM in Courtroom 5 before Judge Gustavo A. Gelpi. Signed by Judge Gustavo A. Gelpi on 10/2/07. (cr, ) (Entered: 10/02/2007)"
        },
        {
          "row_number": 2731,
          "id": 8974710,
          "entry_number": "663",
          "date_filed": "2007-11-05T00:00:00-05:00",
          "attachments": null,
          "url": "https://www.courtlistener.com/docket/6672519/663/united-states-v-commonwealth-of-pr/",
          "recap_pdf_url": null,
          "pacer_doc_id": "15901465463",
          "description": "Invitation to the 4th Rafael Madera 2007 Awards Ceremony.(cm) (Entered: 11/05/2007)"
        },
        {
          "row_number": 2732,
          "id": 8974711,
          "entry_number": "664",
          "date_filed": "2007-11-15T00:00:00-05:00",
          "attachments": null,
          "url": "https://www.courtlistener.com/docket/6672519/664/united-states-v-commonwealth-of-pr/",
          "recap_pdf_url": null,
          "pacer_doc_id": "1590689259",
          "description": "INFORMATIVE Motion regarding Mental Retardation Program filed byMichelle Davila-Montalvo on behalf of The Commonwealth of Puerto Rico, Pedro J. Rossello-Gonzalez, Carmen Feliciano-de-Melecio, Jose De-Leon (Davila-Montalvo, Michelle) (Entered: 11/15/2007)"
        },
        {
          "row_number": 2733,
          "id": 8974712,
          "entry_number": "665",
          "date_filed": "2007-11-16T00:00:00-05:00",
          "attachments": null,
          "url": "https://www.courtlistener.com/docket/6672519/665/united-states-v-commonwealth-of-pr/",
          "recap_pdf_url": null,
          "pacer_doc_id": null,
          "description": "ORDER noted 664 INFORMATIVE motion. Signed by Judge Gustavo A. Gelpi on 11/16/2007. (MH) (Entered: 11/16/2007)"
        },
        {
          "row_number": 2740,
          "id": 8974718,
          "entry_number": "671",
          "date_filed": "2007-11-29T00:00:00-05:00",
          "attachments": null,
          "url": "https://www.courtlistener.com/docket/6672519/671/united-states-v-commonwealth-of-pr/",
          "recap_pdf_url": null,
          "pacer_doc_id": null,
          "description": "ORDER granting 668 Motion submitting . Signed by Judge Gustavo A. Gelpi on 11/29/07. (sm) (Entered: 11/29/2007)"
        },
        {
          "row_number": 2761,
          "id": 8974737,
          "entry_number": "690",
          "date_filed": "2008-02-19T00:00:00-05:00",
          "attachments": null,
          "url": "https://www.courtlistener.com/docket/6672519/690/united-states-v-commonwealth-of-pr/",
          "recap_pdf_url": null,
          "pacer_doc_id": null,
          "description": "ORDER granting 684 Motion submitting (. Signed by Judge Gustavo A. Gelpi on 2/19/08.) (sm) (Entered: 02/19/2008)"
        },
        {
          "row_number": 2762,
          "id": 8974738,
          "entry_number": "691",
          "date_filed": "2008-03-13T00:00:00-04:00",
          "attachments": null,
          "url": "https://www.courtlistener.com/docket/6672519/691/united-states-v-commonwealth-of-pr/",
          "recap_pdf_url": null,
          "pacer_doc_id": "15901583330",
          "description": "INFORMATIVE Motion regarding MRP filed byMichelle Davila-Montalvo on behalf of The Commonwealth of Puerto Rico, Pedro J. Rossello-Gonzalez, Carmen Feliciano-de-Melecio, Jose De-Leon (Davila-Montalvo, Michelle) (Entered: 03/13/2008)"
        },
        {
          "row_number": 2763,
          "id": 8974739,
          "entry_number": "692",
          "date_filed": "2008-03-17T00:00:00-04:00",
          "attachments": null,
          "url": "https://www.courtlistener.com/docket/6672519/692/united-states-v-commonwealth-of-pr/",
          "recap_pdf_url": null,
          "pacer_doc_id": null,
          "description": "ORDER noting 691 INFORMATIVE motion. Signed by Judge Gustavo A. Gelpi on 03/17/2008. (MR) (Entered: 03/17/2008)"
        },
        {
          "row_number": 2764,
          "id": 8974740,
          "entry_number": "693",
          "date_filed": "2008-04-11T00:00:00-04:00",
          "attachments": null,
          "url": "https://www.courtlistener.com/docket/6672519/693/united-states-v-commonwealth-of-pr/",
          "recap_pdf_url": null,
          "pacer_doc_id": null,
          "description": "ORDER. Further Status Conference RESET for 4/17/2008 04:00 PM in Courtroom 5 before Judge Gustavo A. Gelpi.Signed by Judge Gustavo A. Gelpi on 4/11/08.(cr) (Entered: 04/11/2008)"
        },
        {
          "row_number": 2773,
          "id": 8974747,
          "entry_number": "700",
          "date_filed": "2008-04-18T00:00:00-04:00",
          "attachments": null,
          "url": "https://www.courtlistener.com/docket/6672519/700/united-states-v-commonwealth-of-pr/",
          "recap_pdf_url": null,
          "pacer_doc_id": "15901628398",
          "description": "STATUS CONFERENCE REPORT (Binder) by The Commonwealth of Puerto Rico. (cr) (Entered: 04/21/2008)"
        },
        {
          "row_number": 2774,
          "id": 8974748,
          "entry_number": "701",
          "date_filed": "2008-04-21T00:00:00-04:00",
          "attachments": null,
          "url": "https://www.courtlistener.com/docket/6672519/701/united-states-v-commonwealth-of-pr/",
          "recap_pdf_url": null,
          "pacer_doc_id": "15901628597",
          "description": "Minutes of Proceedings and Order for further on-site inspections held on 4/21/2008 by Judge Gustavo A. Gelpi, accompanied by counsel and representatives of the parties and Dr. McGee, the Court's Monitor. Signed by Judge Gustavo A. Gelpi on 4/21/08 (sm) (Entered: 04/21/2008)"
        },
        {
          "row_number": 2780,
          "id": 8974754,
          "entry_number": "707",
          "date_filed": "2008-05-14T00:00:00-04:00",
          "attachments": null,
          "url": "https://www.courtlistener.com/docket/6672519/707/united-states-v-commonwealth-of-pr/",
          "recap_pdf_url": null,
          "pacer_doc_id": "15901656393",
          "description": "INFORMATIVE Motion regarding MRP filed by Michelle Davila-Montalvo on behalf of The Commonwealth of Puerto Rico, Pedro J. Rossello-Gonzalez, Carmen Feliciano-de-Melecio, Jose De-Leon (Davila-Montalvo, Michelle) (Entered: 05/14/2008)"
        },
        {
          "row_number": 2781,
          "id": 8974755,
          "entry_number": "708",
          "date_filed": "2008-05-14T00:00:00-04:00",
          "attachments": null,
          "url": "https://www.courtlistener.com/docket/6672519/708/united-states-v-commonwealth-of-pr/",
          "recap_pdf_url": null,
          "pacer_doc_id": null,
          "description": "ORDER noting 707 INFORMATIVE motion. Signed by Judge Gustavo A. Gelpi on 05/14/2008. (MR) (Entered: 05/14/2008)"
        },
        {
          "row_number": 2792,
          "id": 8974765,
          "entry_number": "718",
          "date_filed": "2008-06-05T00:00:00-04:00",
          "attachments": null,
          "url": "https://www.courtlistener.com/docket/6672519/718/united-states-v-commonwealth-of-pr/",
          "recap_pdf_url": null,
          "pacer_doc_id": "15901684534",
          "description": "INFORMATIVE Motion filed by Michelle Davila-Montalvo on behalf of The Commonwealth of Puerto Rico, Pedro J. Rossello-Gonzalez, Carmen Feliciano-de-Melecio, Jose De-Leon (Davila-Montalvo, Michelle) (Entered: 06/05/2008)"
        },
        {
          "row_number": 2793,
          "id": 8974766,
          "entry_number": "719",
          "date_filed": "2008-06-05T00:00:00-04:00",
          "attachments": null,
          "url": "https://www.courtlistener.com/docket/6672519/719/united-states-v-commonwealth-of-pr/",
          "recap_pdf_url": null,
          "pacer_doc_id": null,
          "description": "ORDER noted 718 INFORMATIVE motion The extended deadline to deposit funds is 6/11/2008. (. Signed by Judge Gustavo A. Gelpi on 6/5/08.) (sm) (Entered: 06/05/2008)"
        },
        {
          "row_number": 2799,
          "id": 8974772,
          "entry_number": "724",
          "date_filed": "2008-06-11T00:00:00-04:00",
          "attachments": null,
          "url": "https://www.courtlistener.com/docket/6672519/724/united-states-v-commonwealth-of-pr/",
          "recap_pdf_url": null,
          "pacer_doc_id": "15901691736",
          "description": "Minute Entry for proceedings held before Judge Gustavo A. Gelpi on 6/11/2008 during visit to Dorado/Vega Baja Institutions. Signed by Judge Gustavo A. Gelpi on 6/11/08. (sm) (Entered: 06/11/2008)"
        },
        {
          "row_number": 2808,
          "id": 8974781,
          "entry_number": "732",
          "date_filed": "2008-06-23T00:00:00-04:00",
          "attachments": null,
          "url": "https://www.courtlistener.com/docket/6672519/732/united-states-v-commonwealth-of-pr/",
          "recap_pdf_url": null,
          "pacer_doc_id": "15901707785",
          "description": "INFORMATIVE Motion regarding budget for FY 2008-2009 filed by John J. McGee. (dv) (Entered: 06/24/2008)"
        },
        {
          "row_number": 2809,
          "id": 8974782,
          "entry_number": "733",
          "date_filed": "2008-06-24T00:00:00-04:00",
          "attachments": null,
          "url": "https://www.courtlistener.com/docket/6672519/733/united-states-v-commonwealth-of-pr/",
          "recap_pdf_url": null,
          "pacer_doc_id": null,
          "description": "ORDER noted 732 INFORMATIVE motion (. Signed by Judge Gustavo A. Gelpi on 6/24/08.) (sm) (Entered: 06/24/2008)"
        },
        {
          "row_number": 2810,
          "id": 8974783,
          "entry_number": "734",
          "date_filed": "2008-06-25T00:00:00-04:00",
          "attachments": null,
          "url": "https://www.courtlistener.com/docket/6672519/734/united-states-v-commonwealth-of-pr/",
          "recap_pdf_url": null,
          "pacer_doc_id": "15901710546",
          "description": "NOTICE of Appearance by Arlene R. Perez-Borrero on behalf of all defendants (Perez-Borrero, Arlene) (Entered: 06/25/2008)"
        },
        {
          "row_number": 2811,
          "id": 8974784,
          "entry_number": "735",
          "date_filed": "2008-07-14T00:00:00-04:00",
          "attachments": null,
          "url": "https://www.courtlistener.com/docket/6672519/735/united-states-v-commonwealth-of-pr/",
          "recap_pdf_url": null,
          "pacer_doc_id": "15901730434",
          "description": "INFORMATIVE Motion filed by Eileen Landron-Guardiola on behalf of all defendants (Landron-Guardiola, Eileen) (Entered: 07/14/2008)"
        },
        {
          "row_number": 2817,
          "id": 8974789,
          "entry_number": "740",
          "date_filed": "2008-08-12T00:00:00-04:00",
          "attachments": null,
          "url": "https://www.courtlistener.com/docket/6672519/740/united-states-v-commonwealth-of-pr/",
          "recap_pdf_url": null,
          "pacer_doc_id": null,
          "description": "ORDER granting 738 Motion submitting invoice for services rendered by Dr. John J. McGee in June 2008. Signed by Judge Gustavo A. Gelpi on 08/12/2008. (MR) (Entered: 08/12/2008)"
        },
        {
          "row_number": 2818,
          "id": 8974790,
          "entry_number": "741",
          "date_filed": "2008-08-15T00:00:00-04:00",
          "attachments": null,
          "url": "https://www.courtlistener.com/docket/6672519/741/united-states-v-commonwealth-of-pr/",
          "recap_pdf_url": null,
          "pacer_doc_id": "15901768180",
          "description": "INFORMATIVE Motion regarding Mental Retardation Program filed by Arlene R. Perez-Borrero on behalf of The Commonwealth of Puerto Rico (Perez-Borrero, Arlene) (Entered: 08/15/2008)"
        },
        {
          "row_number": 2822,
          "id": 8974794,
          "entry_number": "745",
          "date_filed": "2008-08-26T00:00:00-04:00",
          "attachments": null,
          "url": "https://www.courtlistener.com/docket/6672519/745/united-states-v-commonwealth-of-pr/",
          "recap_pdf_url": null,
          "pacer_doc_id": null,
          "description": "ORDER granting as requested 744 Motion for extension of time (. Signed by Judge Gustavo A. Gelpi on 8/26/08.) (sm) (Entered: 08/26/2008)"
        },
        {
          "row_number": 2823,
          "id": 8974795,
          "entry_number": "746",
          "date_filed": "2008-09-05T00:00:00-04:00",
          "attachments": null,
          "url": "https://www.courtlistener.com/docket/6672519/746/united-states-v-commonwealth-of-pr/",
          "recap_pdf_url": null,
          "pacer_doc_id": "15901793079",
          "description": "Motion In Compliance, MOTION to Deposit Funds filed by Arlene R. Perez-Borrero on behalf of The Commonwealth of Puerto Rico, Pedro J. Rossello-Gonzalez, Carmen Feliciano-de-Melecio, Jose De-Leon (Attachments: # 1 Exhibit Attachment A)(Perez-Borrero, Arlene) (Entered: 09/05/2008)"
        },
        {
          "row_number": 2824,
          "id": 8974796,
          "entry_number": "747",
          "date_filed": "2008-09-05T00:00:00-04:00",
          "attachments": null,
          "url": "https://www.courtlistener.com/docket/6672519/747/united-states-v-commonwealth-of-pr/",
          "recap_pdf_url": null,
          "pacer_doc_id": null,
          "description": "ORDER noting 746 Motion In Compliance and noting 746 Motion to Deposit Funds. Signed by Judge Gustavo A. Gelpi on 09/05/2008. (MR) (Entered: 09/05/2008)"
        },
        {
          "row_number": 3177,
          "id": 8974797,
          "entry_number": null,
          "date_filed": "2008-09-05T00:00:00-04:00",
          "attachments": null,
          "url": "https://www.courtlistener.com",
          "recap_pdf_url": null,
          "pacer_doc_id": null,
          "description": "DEPOSIT of Funds in the amount of $27,306.14, receipt number 178043 Re: Dkt.746. Deposited ((NEXT WORKING DAY))in an Interest Bearing Account in compliance with L.R.67. **FUNDS WILL BE AVAILABLE FOR DISBURSEMENT WITHIN 7 WORKING DAYS** (ne)"
        },
        {
          "row_number": 2825,
          "id": 8974798,
          "entry_number": "748",
          "date_filed": "2008-09-09T00:00:00-04:00",
          "attachments": null,
          "url": "https://www.courtlistener.com/docket/6672519/748/united-states-v-commonwealth-of-pr/",
          "recap_pdf_url": null,
          "pacer_doc_id": null,
          "description": "ORDER. Status Conference set for 9/25/2008 05:00 PM in Courtroom 5 before Judge Gustavo A. Gelpi. Signed by Judge Gustavo A. Gelpi on 9/9/08.(cr) (Entered: 09/09/2008)"
        },
        {
          "row_number": 2826,
          "id": 8974799,
          "entry_number": "749",
          "date_filed": "2008-09-11T00:00:00-04:00",
          "attachments": null,
          "url": "https://www.courtlistener.com/docket/6672519/749/united-states-v-commonwealth-of-pr/",
          "recap_pdf_url": null,
          "pacer_doc_id": null,
          "description": "ORDER: The Secretary of Health shall deposit $5,000.00 to cover Administrative and Registry Fees before September 30, 2008 (. Signed by Judge Gustavo A. Gelpi on 9/11/08.)(sm) (Entered: 09/11/2008)"
        },
        {
          "row_number": 2834,
          "id": 8974806,
          "entry_number": "756",
          "date_filed": "2008-10-09T00:00:00-04:00",
          "attachments": null,
          "url": "https://www.courtlistener.com/docket/6672519/756/united-states-v-commonwealth-of-pr/",
          "recap_pdf_url": null,
          "pacer_doc_id": "15901835306",
          "description": "**CASE PARTICIPANTS** Motion In Compliance filed by Arlene R. Perez-Borrero on behalf of The Commonwealth of Puerto Rico, Pedro J. Rossello-Gonzalez, Carmen Feliciano-de-Melecio, Jose De-Leon (Attachments: # 1 Exhibit Exhibit 1, # 2 Exhibit Exhibit 2, # 3 Exhibit Exhibit 3, # 4 Exhibit Exhibit 4, # 5 Exhibit Exhibit 5)(Perez-Borrero, Arlene) (Entered: 10/09/2008)"
        },
        {
          "row_number": 2835,
          "id": 8974807,
          "entry_number": "757",
          "date_filed": "2008-10-09T00:00:00-04:00",
          "attachments": null,
          "url": "https://www.courtlistener.com/docket/6672519/757/united-states-v-commonwealth-of-pr/",
          "recap_pdf_url": null,
          "pacer_doc_id": "15901835352",
          "description": "MOTION for Leave to File Spanish language documents filed by Arlene R. Perez-Borrero on behalf of The Commonwealth of Puerto Rico, Pedro J. Rossello-Gonzalez, Carmen Feliciano-de-Melecio, Jose De-Leon (Perez-Borrero, Arlene) (Entered: 10/09/2008)"
        },
        {
          "row_number": 2845,
          "id": 8974816,
          "entry_number": "766",
          "date_filed": "2008-10-23T00:00:00-04:00",
          "attachments": null,
          "url": "https://www.courtlistener.com/docket/6672519/766/united-states-v-commonwealth-of-pr/",
          "recap_pdf_url": null,
          "pacer_doc_id": null,
          "description": "ORDER re 760 MOTION Submitting Invoice for the month of July 2008 filed by John J. McGee, 761 MOTION Submitting Invoice for the month of August 2008 filed by John J. McGee, and 762 MOTION Submitting Invoice for the month of September 2008 filed by John J. McGee: Dr. McGee shall promptly resubmit his invoices. Parties have three (3) days to object. Signed by Judge Gustavo A. Gelpi on 10/23/2008. (CSL) (Entered: 10/23/2008)"
        },
        {
          "row_number": 2847,
          "id": 8974818,
          "entry_number": "768",
          "date_filed": "2008-10-23T00:00:00-04:00",
          "attachments": null,
          "url": "https://www.courtlistener.com/docket/6672519/768/united-states-v-commonwealth-of-pr/",
          "recap_pdf_url": null,
          "pacer_doc_id": "15901851042",
          "description": "ORDER instructing Dr. McGee to take emergency measures regarding Ms. Jeannie Castillo. Signed by Judge Gustavo A. Gelpi on 10/23/2008. (Attachments: # 1 Appendix)(RS) (Entered: 10/23/2008)"
        },
        {
          "row_number": 2848,
          "id": 8974819,
          "entry_number": "769",
          "date_filed": "2008-10-24T00:00:00-04:00",
          "attachments": null,
          "url": "https://www.courtlistener.com/docket/6672519/769/united-states-v-commonwealth-of-pr/",
          "recap_pdf_url": null,
          "pacer_doc_id": "15901852108",
          "description": "INFORMATIVE Motion regarding regarding plan for termination filed by Arlene R. Perez-Borrero on behalf of The Commonwealth of Puerto Rico, Pedro J. Rossello-Gonzalez, Carmen Feliciano-de-Melecio, Jose De-Leon (Attachments: # 1 Exhibit Exhibit 1)(Perez-Borrero, Arlene) Modified on 10/27/2008 as to title (dv). (Entered: 10/24/2008)"
        },
        {
          "row_number": 2852,
          "id": 8974822,
          "entry_number": "772",
          "date_filed": "2008-10-24T00:00:00-04:00",
          "attachments": null,
          "url": "https://www.courtlistener.com/docket/6672519/772/united-states-v-commonwealth-of-pr/",
          "recap_pdf_url": null,
          "pacer_doc_id": "15901852172",
          "description": "**CASE PARTICIPANTS** INFORMATIVE Motion regarding Ms. Jeannie Castillo filed by John J. McGee (dv) (Entered: 10/24/2008)"
        },
        {
          "row_number": 2853,
          "id": 8974823,
          "entry_number": "773",
          "date_filed": "2008-10-27T00:00:00-04:00",
          "attachments": null,
          "url": "https://www.courtlistener.com/docket/6672519/773/united-states-v-commonwealth-of-pr/",
          "recap_pdf_url": null,
          "pacer_doc_id": null,
          "description": "ORDER noted 769 INFORMATIVE motion Signed by Judge Gustavo A. Gelpi on 10/27/08. (sm) (Entered: 10/27/2008)"
        },
        {
          "row_number": 2854,
          "id": 8974824,
          "entry_number": "774",
          "date_filed": "2008-10-27T00:00:00-04:00",
          "attachments": null,
          "url": "https://www.courtlistener.com/docket/6672519/774/united-states-v-commonwealth-of-pr/",
          "recap_pdf_url": null,
          "pacer_doc_id": null,
          "description": "ORDER noted 771 INFORMATIVE motion Signed by Judge Gustavo A. Gelpi on 10/27/08. (sm) (Entered: 10/27/2008)"
        },
        {
          "row_number": 2855,
          "id": 8974825,
          "entry_number": "775",
          "date_filed": "2008-10-27T00:00:00-04:00",
          "attachments": null,
          "url": "https://www.courtlistener.com/docket/6672519/775/united-states-v-commonwealth-of-pr/",
          "recap_pdf_url": null,
          "pacer_doc_id": null,
          "description": "ORDER noted 772 INFORMATIVE motion Signed by Judge Gustavo A. Gelpi on 10/27/08. (sm) (Entered: 10/27/2008)"
        },
        {
          "row_number": 2861,
          "id": 8974830,
          "entry_number": "780",
          "date_filed": "2008-11-03T00:00:00-05:00",
          "attachments": null,
          "url": "https://www.courtlistener.com/docket/6672519/780/united-states-v-commonwealth-of-pr/",
          "recap_pdf_url": null,
          "pacer_doc_id": null,
          "description": "ORDER noted 776 INFORMATIVE Motion regarding JCC Status Report and Defendants' Informative Motion, 777 INFORMATIVE Motion regarding Participant JC and 778 INFORMATIVE Motion regarding a participant (JC) in the Mental Retardation Program filed by John J. McGee, These motions shall be discussed at the next status conference.Signed by Judge Gustavo A. Gelpi on 11/3/08.(sm) (Entered: 11/03/2008)"
        },
        {
          "row_number": 2863,
          "id": 8974832,
          "entry_number": "782",
          "date_filed": "2008-11-07T00:00:00-05:00",
          "attachments": null,
          "url": "https://www.courtlistener.com/docket/6672519/782/united-states-v-commonwealth-of-pr/",
          "recap_pdf_url": null,
          "pacer_doc_id": "15901869246",
          "description": "MOTION for Leave to File Spanish language documents filed by Arlene R. Perez-Borrero on behalf of The Commonwealth of Puerto Rico (Perez-Borrero, Arlene) (Entered: 11/07/2008)"
        },
        {
          "row_number": 2867,
          "id": 8974836,
          "entry_number": "786",
          "date_filed": "2008-11-12T00:00:00-05:00",
          "attachments": null,
          "url": "https://www.courtlistener.com/docket/6672519/786/united-states-v-commonwealth-of-pr/",
          "recap_pdf_url": null,
          "pacer_doc_id": null,
          "description": "ORDER denying without prejudice 781 Motion to Set Aside ; Motion for Hearing; Motion for Miscellaneous Relief. Ms JC is currently being provided housing and subsistence free of cost, as per arrangements made by Dr. Mc GEE. Signed by Judge Gustavo A. Gelpi on 11/12/08. (sm) (Entered: 11/12/2008)"
        },
        {
          "row_number": 2868,
          "id": 8974837,
          "entry_number": "787",
          "date_filed": "2008-11-17T00:00:00-05:00",
          "attachments": null,
          "url": "https://www.courtlistener.com/docket/6672519/787/united-states-v-commonwealth-of-pr/",
          "recap_pdf_url": null,
          "pacer_doc_id": "15901879753",
          "description": "INFORMATIVE Motion regarding Mental Retardation Program filed by Arlene R. Perez-Borrero on behalf of The Commonwealth of Puerto Rico, Pedro J. Rossello-Gonzalez, Carmen Feliciano-de-Melecio (Perez-Borrero, Arlene) Modified on 11/18/2008 to correct title (dv). (Entered: 11/17/2008)"
        },
        {
          "row_number": 2872,
          "id": 8974840,
          "entry_number": "790",
          "date_filed": "2008-12-05T00:00:00-05:00",
          "attachments": null,
          "url": "https://www.courtlistener.com/docket/6672519/790/united-states-v-commonwealth-of-pr/",
          "recap_pdf_url": null,
          "pacer_doc_id": "15901899820",
          "description": "MOTION requesting Order Pursuant to SISA filed by Eileen Landron-Guardiola on behalf of The Commonwealth of Puerto Rico (Landron-Guardiola, Eileen) (Entered: 12/05/2008)"
        },
        {
          "row_number": 2873,
          "id": 8974841,
          "entry_number": "791",
          "date_filed": "2008-12-05T00:00:00-05:00",
          "attachments": null,
          "url": "https://www.courtlistener.com/docket/6672519/791/united-states-v-commonwealth-of-pr/",
          "recap_pdf_url": null,
          "pacer_doc_id": null,
          "description": "ORDER noting 790 Motion requesting Order. This matter can be discussed at the 12/08/08 status conference. Signed by Judge Gustavo A. Gelpi on 12/05/08. (CSL) (Entered: 12/05/2008)"
        },
        {
          "row_number": 2874,
          "id": 8974842,
          "entry_number": "792",
          "date_filed": "2008-12-08T00:00:00-05:00",
          "attachments": null,
          "url": "https://www.courtlistener.com/docket/6672519/792/united-states-v-commonwealth-of-pr/",
          "recap_pdf_url": null,
          "pacer_doc_id": "15901905281",
          "description": "Minute Entry for proceedings held before Judge Gustavo A. Gelpi: Further Status Conference held on 12/8/2008, Set Hearings. Further Status Conference set for 2/5/2009 02:00 PM in Courtroom 5 before Judge Gustavo A. Gelpi. (Court Reporter Yvette Richardson.) (cr) (Entered: 12/10/2008)"
        },
        {
          "row_number": 2875,
          "id": 8974843,
          "entry_number": "793",
          "date_filed": "2008-12-08T00:00:00-05:00",
          "attachments": null,
          "url": "https://www.courtlistener.com/docket/6672519/793/united-states-v-commonwealth-of-pr/",
          "recap_pdf_url": null,
          "pacer_doc_id": "15901905287",
          "description": "STATUS REPORT BINDER by The Commonwealth of Puerto Rico. (cr) (Entered: 12/10/2008)"
        },
        {
          "row_number": 2876,
          "id": 8974844,
          "entry_number": "794",
          "date_filed": "2008-12-10T00:00:00-05:00",
          "attachments": null,
          "url": "https://www.courtlistener.com/docket/6672519/794/united-states-v-commonwealth-of-pr/",
          "recap_pdf_url": null,
          "pacer_doc_id": "15901906473",
          "description": "TRANSITION ORDER: This order shall be immediately provided to the Secretary of Health, Dr. John V. Rullan who shall in turn provide copy of the same to the members of the incoming Administration's Transition Committee.Signed by Judge Gustavo A. Gelpi on 12/10/08.(sm) (Entered: 12/10/2008)"
        },
        {
          "row_number": 2877,
          "id": 8974845,
          "entry_number": "795",
          "date_filed": "2008-12-17T00:00:00-05:00",
          "attachments": null,
          "url": "https://www.courtlistener.com/docket/6672519/795/united-states-v-commonwealth-of-pr/",
          "recap_pdf_url": null,
          "pacer_doc_id": "15901915716",
          "description": "INFORMATIVE Motion regarding Mental Retardation Program filed by Arlene R. Perez-Borrero on behalf of The Commonwealth of Puerto Rico, Pedro J. Rossello-Gonzalez, Carmen Feliciano-de-Melecio, Jose De-Leon (Perez-Borrero, Arlene) (Entered: 12/17/2008)"
        },
        {
          "row_number": 2878,
          "id": 8974846,
          "entry_number": "796",
          "date_filed": "2008-12-17T00:00:00-05:00",
          "attachments": null,
          "url": "https://www.courtlistener.com/docket/6672519/796/united-states-v-commonwealth-of-pr/",
          "recap_pdf_url": null,
          "pacer_doc_id": null,
          "description": "ORDER noting 795 INFORMATIVE motion. Signed by Judge Gustavo A. Gelpi on 12/17/08. (CSL) (Entered: 12/17/2008)"
        },
        {
          "row_number": 2879,
          "id": 8974847,
          "entry_number": "797",
          "date_filed": "2008-12-17T00:00:00-05:00",
          "attachments": null,
          "url": "https://www.courtlistener.com/docket/6672519/797/united-states-v-commonwealth-of-pr/",
          "recap_pdf_url": null,
          "pacer_doc_id": "15901916044",
          "description": "Motion In Compliance with order at Docket 794 filed by Arlene R. Perez-Borrero on behalf of The Commonwealth of Puerto Rico, Pedro J. Rossello-Gonzalez, Carmen Feliciano-de-Melecio, Jose De-Leon (Perez-Borrero, Arlene) (Entered: 12/17/2008)"
        },
        {
          "row_number": 2880,
          "id": 8974848,
          "entry_number": "798",
          "date_filed": "2008-12-17T00:00:00-05:00",
          "attachments": null,
          "url": "https://www.courtlistener.com/docket/6672519/798/united-states-v-commonwealth-of-pr/",
          "recap_pdf_url": null,
          "pacer_doc_id": null,
          "description": "ORDER noting 797 Motion In Compliance. Signed by Judge Gustavo A. Gelpi on 12/17/08. (CSL) (Entered: 12/17/2008)"
        },
        {
          "row_number": 2881,
          "id": 8974849,
          "entry_number": "799",
          "date_filed": "2009-01-09T00:00:00-05:00",
          "attachments": null,
          "url": "https://www.courtlistener.com/docket/6672519/799/united-states-v-commonwealth-of-pr/",
          "recap_pdf_url": null,
          "pacer_doc_id": "15901932610",
          "description": "ORDER re: status conference. Signed by Judge Gustavo A. Gelpi on 1/9/09. (CSL) (Entered: 01/09/2009)"
        },
        {
          "row_number": 2884,
          "id": 8974850,
          "entry_number": "800",
          "date_filed": "2009-01-09T00:00:00-05:00",
          "attachments": null,
          "url": "https://www.courtlistener.com/docket/6672519/800/united-states-v-commonwealth-of-pr/",
          "recap_pdf_url": null,
          "pacer_doc_id": null,
          "description": "ORDER: Defendants' counsel of record shall promptly notify the order issued today (Docket No. 799) to the new official capacity defendants and their representatives. Signed by Judge Gustavo A. Gelpi on 1/9/09. (CSL) (Entered: 01/09/2009)"
        },
        {
          "row_number": 2886,
          "id": 8974852,
          "entry_number": "802",
          "date_filed": "2009-01-21T00:00:00-05:00",
          "attachments": null,
          "url": "https://www.courtlistener.com/docket/6672519/802/united-states-v-commonwealth-of-pr/",
          "recap_pdf_url": null,
          "pacer_doc_id": null,
          "description": "ORDER granting 801 Motion to Withdraw. Signed by Judge Gustavo A. Gelpi on 1/21/09. (CSL) (Entered: 01/21/2009)"
        },
        {
          "row_number": 2887,
          "id": 8974853,
          "entry_number": "803",
          "date_filed": "2009-01-26T00:00:00-05:00",
          "attachments": null,
          "url": "https://www.courtlistener.com/docket/6672519/803/united-states-v-commonwealth-of-pr/",
          "recap_pdf_url": null,
          "pacer_doc_id": "15901949814",
          "description": "ORDER to all parties. Signed by Judge Gustavo A. Gelpi on 1/26/09.(cr) (Entered: 01/26/2009)"
        },
        {
          "row_number": 2891,
          "id": 8974857,
          "entry_number": "807",
          "date_filed": "2009-01-30T00:00:00-05:00",
          "attachments": null,
          "url": "https://www.courtlistener.com/docket/6672519/807/united-states-v-commonwealth-of-pr/",
          "recap_pdf_url": null,
          "pacer_doc_id": "15901957497",
          "description": "NOTICE of Appearance by Sheila J. Torres-Delgado on behalf of all defendants (Torres-Delgado, Sheila) (Entered: 01/30/2009)"
        },
        {
          "row_number": 2892,
          "id": 8974858,
          "entry_number": "808",
          "date_filed": "2009-01-30T00:00:00-05:00",
          "attachments": null,
          "url": "https://www.courtlistener.com/docket/6672519/808/united-states-v-commonwealth-of-pr/",
          "recap_pdf_url": null,
          "pacer_doc_id": "15901957580",
          "description": "NOTICE of Appearance by Eliezer Alberto Aldarondo-Lopez on behalf of all defendants (Aldarondo-Lopez, Eliezer) (Entered: 01/30/2009)"
        },
        {
          "row_number": 2900,
          "id": 8974865,
          "entry_number": "815",
          "date_filed": "2009-02-24T00:00:00-05:00",
          "attachments": null,
          "url": "https://www.courtlistener.com/docket/6672519/815/united-states-v-commonwealth-of-pr/",
          "recap_pdf_url": null,
          "pacer_doc_id": "15901992268",
          "description": "MOTION Re-Submitting Invoice for the month of September 2008, filed by John J. McGee, re: Dkt 766 ORDER. (Attachments: # 1 Exhibit Invoice)(er) (Entered: 02/26/2009)"
        },
        {
          "row_number": 2901,
          "id": 8974866,
          "entry_number": "816",
          "date_filed": "2009-02-24T00:00:00-05:00",
          "attachments": null,
          "url": "https://www.courtlistener.com/docket/6672519/816/united-states-v-commonwealth-of-pr/",
          "recap_pdf_url": null,
          "pacer_doc_id": "15901992287",
          "description": "MOTION Submitting Invoice for the month of October 2008 filed by John J. McGee. (Attachments: # 1 Exhibit Invoice)(er) (Entered: 02/26/2009)"
        },
        {
          "row_number": 2904,
          "id": 8974869,
          "entry_number": "819",
          "date_filed": "2009-02-24T00:00:00-05:00",
          "attachments": null,
          "url": "https://www.courtlistener.com/docket/6672519/819/united-states-v-commonwealth-of-pr/",
          "recap_pdf_url": null,
          "pacer_doc_id": "15901992312",
          "description": "MOTION Submitting Invoice for the month of January 2009 filed by John J. McGee (Attachments: # 1 Exhibit Invoice)(er) (Entered: 02/26/2009)"
        },
        {
          "row_number": 2906,
          "id": 8974870,
          "entry_number": "820",
          "date_filed": "2009-02-26T00:00:00-05:00",
          "attachments": null,
          "url": "https://www.courtlistener.com/docket/6672519/820/united-states-v-commonwealth-of-pr/",
          "recap_pdf_url": null,
          "pacer_doc_id": "15901992490",
          "description": "INFORMATIVE Motion regarding Dr. John McGee's Invoices, MOTION for extension of time fifteen (15) days from the date the invoices are resubmitted by Dr. McGee. Commonwealth's comments and/or objections, if any (Suggestions in opposition/response due by 3/16/2009) filed by Sheila J. Torres-Delgado on behalf of The Commonwealth of Puerto Rico, Pedro J. Rossello-Gonzalez, Carmen Feliciano-de-Melecio, Jose De-Leon (Torres-Delgado, Sheila) Modified on 3/3/2009 repetitive text (er). (Entered: 02/26/2009)"
        },
        {
          "row_number": 2908,
          "id": 8974872,
          "entry_number": "822",
          "date_filed": "2009-03-02T00:00:00-05:00",
          "attachments": null,
          "url": "https://www.courtlistener.com/docket/6672519/822/united-states-v-commonwealth-of-pr/",
          "recap_pdf_url": null,
          "pacer_doc_id": "15901995628",
          "description": "Motion In Compliance with Court's Order at Docket Document No. 812 filed by Sheila J. Torres-Delgado on behalf of The Commonwealth of Puerto Rico, Pedro J. Rossello-Gonzalez, Carmen Feliciano-de-Melecio, Jose De-Leon (Attachments: # 1 Exhibit 1)(Torres-Delgado, Sheila) (Entered: 03/02/2009)"
        },
        {
          "row_number": 2909,
          "id": 8974873,
          "entry_number": "823",
          "date_filed": "2009-03-02T00:00:00-05:00",
          "attachments": null,
          "url": "https://www.courtlistener.com/docket/6672519/823/united-states-v-commonwealth-of-pr/",
          "recap_pdf_url": null,
          "pacer_doc_id": "15901995635",
          "description": "MOTION for Leave to File Spanish language documents filed by Sheila J. Torres-Delgado on behalf of The Commonwealth of Puerto Rico, Pedro J. Rossello-Gonzalez, Carmen Feliciano-de-Melecio, Jose De-Leon (Torres-Delgado, Sheila) (Entered: 03/02/2009)"
        },
        {
          "row_number": 2914,
          "id": 8974878,
          "entry_number": "828",
          "date_filed": "2009-03-03T00:00:00-05:00",
          "attachments": null,
          "url": "https://www.courtlistener.com/docket/6672519/828/united-states-v-commonwealth-of-pr/",
          "recap_pdf_url": null,
          "pacer_doc_id": "15901999524",
          "description": "MOTION Submitting Re-calculated Invoice for Services Rendered for the month of September 2008 filed by John J. McGee re: 821 Order on Informative Motion, Order on Motion for extension of time. (Related document(s) 821 ) (er) (Entered: 03/05/2009)"
        },
        {
          "row_number": 2915,
          "id": 8974879,
          "entry_number": "829",
          "date_filed": "2009-03-03T00:00:00-05:00",
          "attachments": null,
          "url": "https://www.courtlistener.com/docket/6672519/829/united-states-v-commonwealth-of-pr/",
          "recap_pdf_url": null,
          "pacer_doc_id": "15901999527",
          "description": "MOTION Submitting Re-calculated Invoice for Services Rendered for the month of October 2008 filed by John J. McGee re: 821 Order on Informative Motion, Order on Motion for extension of time. (Related document(s) 821 ) (er) (Entered: 03/05/2009)"
        },
        {
          "row_number": 2917,
          "id": 8974880,
          "entry_number": "830",
          "date_filed": "2009-03-03T00:00:00-05:00",
          "attachments": null,
          "url": "https://www.courtlistener.com/docket/6672519/830/united-states-v-commonwealth-of-pr/",
          "recap_pdf_url": null,
          "pacer_doc_id": "15901999530",
          "description": "MOTION Submitting Re-calculated Invoice for Services Rendered for the month of November 2008 filed by John J. McGee re: 821 Order on Informative Motion, Order on Motion for extension of time. (Related document(s) 821 ) (er) (Entered: 03/05/2009)"
        },
        {
          "row_number": 2918,
          "id": 8974881,
          "entry_number": "831",
          "date_filed": "2009-03-03T00:00:00-05:00",
          "attachments": null,
          "url": "https://www.courtlistener.com/docket/6672519/831/united-states-v-commonwealth-of-pr/",
          "recap_pdf_url": null,
          "pacer_doc_id": "15901999533",
          "description": "MOTION Submitting Re-calculated Invoice for Services Rendered for the month of December 2008 filed by John J. McGee re: 821 Order on Informative Motion, Order on Motion for extension of time. (Related document(s) 821 ) (er) (Entered: 03/05/2009)"
        },
        {
          "row_number": 2919,
          "id": 8974882,
          "entry_number": "832",
          "date_filed": "2009-03-03T00:00:00-05:00",
          "attachments": null,
          "url": "https://www.courtlistener.com/docket/6672519/832/united-states-v-commonwealth-of-pr/",
          "recap_pdf_url": null,
          "pacer_doc_id": "15901999536",
          "description": "MOTION Re-submitting Invoice for Services Rendered for the month of January 2009 filed by John J. McGee re: 821 Order on Informative Motion, Order on Motion for extension of time. (Related document(s) 821 ) (er) (Entered: 03/05/2009)"
        },
        {
          "row_number": 2920,
          "id": 8974883,
          "entry_number": "833",
          "date_filed": "2009-03-05T00:00:00-05:00",
          "attachments": null,
          "url": "https://www.courtlistener.com/docket/6672519/833/united-states-v-commonwealth-of-pr/",
          "recap_pdf_url": null,
          "pacer_doc_id": null,
          "description": "ORDER noted 826 Motion submitting Re-calculated Invoice for Services Rendered for the month of July 2008 Signed by Judge Gustavo A. Gelpi on 3/5/09. (sm) Modified on 3/6/2009 to add title(er). (Entered: 03/05/2009)"
        },
        {
          "row_number": 2923,
          "id": 8974886,
          "entry_number": "836",
          "date_filed": "2009-03-05T00:00:00-05:00",
          "attachments": null,
          "url": "https://www.courtlistener.com/docket/6672519/836/united-states-v-commonwealth-of-pr/",
          "recap_pdf_url": null,
          "pacer_doc_id": null,
          "description": "ORDER noted 829 Motion submitting Re-calculated Invoice for Services Rendered for the month of October 2008 Signed by Judge Gustavo A. Gelpi on 3/5/09. (sm) Modified on 3/6/2009 as to tile(er). (Entered: 03/05/2009)"
        },
        {
          "row_number": 2924,
          "id": 8974887,
          "entry_number": "837",
          "date_filed": "2009-03-05T00:00:00-05:00",
          "attachments": null,
          "url": "https://www.courtlistener.com/docket/6672519/837/united-states-v-commonwealth-of-pr/",
          "recap_pdf_url": null,
          "pacer_doc_id": "15901999697",
          "description": "MOTION Submitting Certified Translation of Executive Order OE-2009-008 Appended to Motion in Compliance with Court's Order at Docket Document No. 812 (Docket Document No. 822) re: 822 Motion In Compliance with Court's Order at Docket Document No. 812 filed by Pedro J. Rossello-Gonzalez, Jose De-Leon, The Commonwealth of Puerto Rico, Carmen Feliciano-de-Melecio, (Attachments: # 1 Exhibit 1, # 2 Exhibit 2)(Related document(s) 822, (Torres-Delgado, Sheila) Modified on 3/9/2009 as to link (er). (Entered: 03/05/2009)"
        },
        {
          "row_number": 2925,
          "id": 8974888,
          "entry_number": "838",
          "date_filed": "2009-03-05T00:00:00-05:00",
          "attachments": null,
          "url": "https://www.courtlistener.com/docket/6672519/838/united-states-v-commonwealth-of-pr/",
          "recap_pdf_url": null,
          "pacer_doc_id": null,
          "description": "ORDER noted 830 Motion submitting Re-calculated Invoice for Services Rendered for the month of November 2008 Signed by Judge Gustavo A. Gelpi on 3/5/09. (sm) Modified on 3/6/2009 as to title (er). (Entered: 03/05/2009)"
        },
        {
          "row_number": 2926,
          "id": 8974889,
          "entry_number": "839",
          "date_filed": "2009-03-05T00:00:00-05:00",
          "attachments": null,
          "url": "https://www.courtlistener.com/docket/6672519/839/united-states-v-commonwealth-of-pr/",
          "recap_pdf_url": null,
          "pacer_doc_id": null,
          "description": "ORDER noted 832 Motion Re-submitting Invoice for Services Rendered for the month of January 2009. Signed by Judge Gustavo A. Gelpi on 3/5/09. (sm) Modified on 3/6/2009 as to title (er). (Entered: 03/05/2009)"
        },
        {
          "row_number": 2929,
          "id": 8974891,
          "entry_number": "841",
          "date_filed": "2009-03-09T00:00:00-04:00",
          "attachments": null,
          "url": "https://www.courtlistener.com/docket/6672519/841/united-states-v-commonwealth-of-pr/",
          "recap_pdf_url": null,
          "pacer_doc_id": null,
          "description": "ORDER noting 831 Motion submitting Re-calculated Invoice for Services Rendered for the month of December 2008. Signed by Judge Gustavo A. Gelpi on 3/09/09. (CSL) Modified on 3/10/2009 as to title(er). (Entered: 03/09/2009)"
        },
        {
          "row_number": 2930,
          "id": 8974892,
          "entry_number": "842",
          "date_filed": "2009-03-13T00:00:00-04:00",
          "attachments": null,
          "url": "https://www.courtlistener.com/docket/6672519/842/united-states-v-commonwealth-of-pr/",
          "recap_pdf_url": null,
          "pacer_doc_id": "15902011202",
          "description": "MOTION for extension of time until March 24, 2009 to Submit the Commonwealth's Comments and/or Objections to the JCC's Invoice for the Month of February 2009 filed by Sheila J. Torres-Delgado on behalf of The Commonwealth of Puerto Rico, Pedro J. Rossello-Gonzalez, Carmen Feliciano-de-Melecio, Jose De-Leon Suggestions in opposition/response due by 3/30/2009 (Torres-Delgado, Sheila) (Entered: 03/13/2009)"
        },
        {
          "row_number": 2934,
          "id": 8974896,
          "entry_number": "846",
          "date_filed": "2009-03-17T00:00:00-04:00",
          "attachments": null,
          "url": "https://www.courtlistener.com/docket/6672519/846/united-states-v-commonwealth-of-pr/",
          "recap_pdf_url": null,
          "pacer_doc_id": null,
          "description": "ORDER noted 844 INFORMATIVE motion regarding the Mental Retardation Program. Signed by Judge Gustavo A. Gelpi on 99-1435. (sm) Modified on as to title 3/18/2009 (er). (Entered: 03/17/2009)"
        },
        {
          "row_number": 2935,
          "id": 8974897,
          "entry_number": "847",
          "date_filed": "2009-03-24T00:00:00-04:00",
          "attachments": null,
          "url": "https://www.courtlistener.com/docket/6672519/847/united-states-v-commonwealth-of-pr/",
          "recap_pdf_url": null,
          "pacer_doc_id": "15902023522",
          "description": "MOTION for extension of time until April 8, 2009 to present Commonwealth's comments and/or objections regarding JCC's invoices for the months of July 2008 to February 2009 filed by Sheila J. Torres-Delgado on behalf of The Commonwealth of Puerto Rico, Pedro J. Rossello-Gonzalez, Carmen Feliciano-de-Melecio, Jose De-Leon Suggestions in opposition/response due by 4/13/2009 (Torres-Delgado, Sheila) (Entered: 03/24/2009)"
        },
        {
          "row_number": 2937,
          "id": 8974899,
          "entry_number": "849",
          "date_filed": "2009-03-25T00:00:00-04:00",
          "attachments": null,
          "url": "https://www.courtlistener.com/docket/6672519/849/united-states-v-commonwealth-of-pr/",
          "recap_pdf_url": null,
          "pacer_doc_id": "15902024864",
          "description": "ORDER. Further Status Conference RESET for 5/5/2009 09:00 AM in Courtroom 5 before Judge Gustavo A. Gelpi. Signed by Judge Gustavo A. Gelpi on 3/25/09.(cr) (Entered: 03/25/2009)"
        },
        {
          "row_number": 2940,
          "id": 8974900,
          "entry_number": "851",
          "date_filed": "2009-03-27T00:00:00-04:00",
          "attachments": null,
          "url": "https://www.courtlistener.com/docket/6672519/851/united-states-v-commonwealth-of-pr/",
          "recap_pdf_url": null,
          "pacer_doc_id": "15902033751",
          "description": "NOTICE to Counsel filed in Misc. 09-59, re: Measures to address the congestion of the civil docket. Signed by all Judges on 3/27/09.(er) (Entered: 03/31/2009)"
        },
        {
          "row_number": 2943,
          "id": 8974904,
          "entry_number": "854",
          "date_filed": "2009-04-21T00:00:00-04:00",
          "attachments": null,
          "url": "https://www.courtlistener.com/docket/6672519/854/united-states-v-commonwealth-of-pr/",
          "recap_pdf_url": null,
          "pacer_doc_id": null,
          "description": "ORDER noted 853 INFORMATIVE motion regarding the Mental Retardation Program Signed by Judge Gustavo A. Gelpi on 4/21/09. (sm) Modified on 4/22/2009 as to title(er). (Entered: 04/21/2009)"
        },
        {
          "row_number": 2944,
          "id": 8974905,
          "entry_number": "855",
          "date_filed": "2009-04-21T00:00:00-04:00",
          "attachments": null,
          "url": "https://www.courtlistener.com/docket/6672519/855/united-states-v-commonwealth-of-pr/",
          "recap_pdf_url": null,
          "pacer_doc_id": "15902059362",
          "description": "ORDER approving Dr. McGee's Invoices. The Commonwealth shall deposit $116,327.34 with the Clerk of Court within fifteen (15) days.Signed by Judge Gustavo A. Gelpi on 4/21/09.(sm) (Entered: 04/21/2009)"
        },
        {
          "row_number": 2946,
          "id": 8974907,
          "entry_number": "857",
          "date_filed": "2009-04-21T00:00:00-04:00",
          "attachments": null,
          "url": "https://www.courtlistener.com/docket/6672519/857/united-states-v-commonwealth-of-pr/",
          "recap_pdf_url": null,
          "pacer_doc_id": null,
          "description": "ORDER granting 814 Motion Re-Submitting Invoice for the month of August 2008, See Docket No. 855. Signed by Judge Gustavo A. Gelpi on 4/21/09. (sm) Modified on 4/22/2009 as to title (er). (Entered: 04/21/2009)"
        },
        {
          "row_number": 2947,
          "id": 8974908,
          "entry_number": "858",
          "date_filed": "2009-04-21T00:00:00-04:00",
          "attachments": null,
          "url": "https://www.courtlistener.com/docket/6672519/858/united-states-v-commonwealth-of-pr/",
          "recap_pdf_url": null,
          "pacer_doc_id": null,
          "description": "ORDER granting 815 Motion Re-Submitting Invoice for the month of September 2008, See Docket No. 855. Signed by Judge Gustavo A. Gelpi on 4/21/09. (sm) Modified on 4/22/2009 as to title (er). (Entered: 04/21/2009)"
        },
        {
          "row_number": 2948,
          "id": 8974909,
          "entry_number": "859",
          "date_filed": "2009-04-21T00:00:00-04:00",
          "attachments": null,
          "url": "https://www.courtlistener.com/docket/6672519/859/united-states-v-commonwealth-of-pr/",
          "recap_pdf_url": null,
          "pacer_doc_id": null,
          "description": "ORDER granting 816 Motion Submitting Invoice for the month of October 2008, See Docket No. 855. Signed by Judge Gustavo A. Gelpi on 4/21/09. (sm) Modified on 4/22/2009 as to title (er). (Entered: 04/21/2009)"
        },
        {
          "row_number": 2950,
          "id": 8974910,
          "entry_number": "860",
          "date_filed": "2009-04-21T00:00:00-04:00",
          "attachments": null,
          "url": "https://www.courtlistener.com/docket/6672519/860/united-states-v-commonwealth-of-pr/",
          "recap_pdf_url": null,
          "pacer_doc_id": null,
          "description": "ORDER granting 817 Motion Submitting Invoice for the month of November 2008, See Docket No. 855. Signed by Judge Gustavo A. Gelpi on 4/21/09. (sm) Modified on 4/22/2009 as to title(er). (Entered: 04/21/2009)"
        },
        {
          "row_number": 2958,
          "id": 8974918,
          "entry_number": "868",
          "date_filed": "2009-06-15T00:00:00-04:00",
          "attachments": null,
          "url": "https://www.courtlistener.com/docket/6672519/868/united-states-v-commonwealth-of-pr/",
          "recap_pdf_url": null,
          "pacer_doc_id": "15902125194",
          "description": "INFORMATIVE Motion regarding The Mental Retardation Program filed by Sheila J. Torres-Delgado on behalf of The Commonwealth of Puerto Rico, Pedro J. Rossello-Gonzalez, Carmen Feliciano-de-Melecio, Jose De-Leon (Torres-Delgado, Sheila) (Entered: 06/15/2009)"
        },
        {
          "row_number": 2959,
          "id": 8974919,
          "entry_number": "869",
          "date_filed": "2009-06-15T00:00:00-04:00",
          "attachments": null,
          "url": "https://www.courtlistener.com/docket/6672519/869/united-states-v-commonwealth-of-pr/",
          "recap_pdf_url": null,
          "pacer_doc_id": null,
          "description": "ORDER noted 868 INFORMATIVE motion regarding The Mental Retardation Program. Signed by Judge Gustavo A. Gelpi on 6/15/09. (sm) Modified on 6/16/2009 as title(er). (Entered: 06/15/2009)"
        },
        {
          "row_number": 2962,
          "id": 8974921,
          "entry_number": "871",
          "date_filed": "2009-06-19T00:00:00-04:00",
          "attachments": null,
          "url": "https://www.courtlistener.com/docket/6672519/871/united-states-v-commonwealth-of-pr/",
          "recap_pdf_url": null,
          "pacer_doc_id": "15902133558",
          "description": "Letter of Thanks from Nelsa Lugo-Ostolaza, re: 866 Status Conference. (er) (Entered: 06/22/2009)"
        },
        {
          "row_number": 2973,
          "id": 8974931,
          "entry_number": "881",
          "date_filed": "2009-08-13T00:00:00-04:00",
          "attachments": null,
          "url": "https://www.courtlistener.com/docket/6672519/881/united-states-v-commonwealth-of-pr/",
          "recap_pdf_url": null,
          "pacer_doc_id": null,
          "description": "ORDER. Further Status Conference set for 8/14/2009 10:00 AM in Courtroom 5 before Judge Gustavo A. Gelpi. Signed by Judge Gustavo A. Gelpi on 8/13/09.(cr) (Entered: 08/13/2009)"
        },
        {
          "row_number": 2974,
          "id": 8974932,
          "entry_number": "882",
          "date_filed": "2009-08-14T00:00:00-04:00",
          "attachments": null,
          "url": "https://www.courtlistener.com/docket/6672519/882/united-states-v-commonwealth-of-pr/",
          "recap_pdf_url": null,
          "pacer_doc_id": "15902195922",
          "description": "STATUS REPORT BINDER by The Commonwealth of Puerto Rico dated 8/14/09. (cr) (Entered: 08/14/2009)"
        },
        {
          "row_number": 2983,
          "id": 8974941,
          "entry_number": "890",
          "date_filed": "2009-09-16T00:00:00-04:00",
          "attachments": null,
          "url": "https://www.courtlistener.com/docket/6672519/890/united-states-v-commonwealth-of-pr/",
          "recap_pdf_url": null,
          "pacer_doc_id": "15902236742",
          "description": "INFORMATIVE Motion regarding the Mental Retardation Program filed by Sheila J. Torres-Delgado on behalf of The Commonwealth of Puerto Rico, Department of Justice-Commonwealth of P.R., Carmen Feliciano-de-Melecio, Jose De-Leon. (Torres-Delgado, Sheila) Modified on 9/17/2009 to add filers (er). (Entered: 09/16/2009)"
        },
        {
          "row_number": 2984,
          "id": 8974942,
          "entry_number": "891",
          "date_filed": "2009-09-16T00:00:00-04:00",
          "attachments": null,
          "url": "https://www.courtlistener.com/docket/6672519/891/united-states-v-commonwealth-of-pr/",
          "recap_pdf_url": null,
          "pacer_doc_id": null,
          "description": "ORDER noted 890 INFORMATIVE motion regarding the Mental Retardation Program Signed by Judge Gustavo A. Gelpi on 9/16/09. (sm) Modified on 9/17/2009 as title(er). (Entered: 09/16/2009)"
        },
        {
          "row_number": 2986,
          "id": 8974944,
          "entry_number": "893",
          "date_filed": "2009-09-29T00:00:00-04:00",
          "attachments": null,
          "url": "https://www.courtlistener.com/docket/6672519/893/united-states-v-commonwealth-of-pr/",
          "recap_pdf_url": null,
          "pacer_doc_id": "15902252573",
          "description": "MOTION Submitting Invoice for Services Rendered by the Joint Compliance Coordinator for the Month of July 2009 filed by Dr. John J. McGee. (Attachments: # 1 Invoice, # 2 Attachment to Invoice and Transmittal letter)(er) (Entered: 09/30/2009)"
        },
        {
          "row_number": 2987,
          "id": 8974945,
          "entry_number": "894",
          "date_filed": "2009-09-29T00:00:00-04:00",
          "attachments": null,
          "url": "https://www.courtlistener.com/docket/6672519/894/united-states-v-commonwealth-of-pr/",
          "recap_pdf_url": null,
          "pacer_doc_id": "15902252589",
          "description": "MOTION Submitting Invoice for Services Rendered by the Joint Compliance Coordinator for the month of August 2009 filed by Dr. John J. McGee. (Attachments: # 1 Invoice, # 2 Attachment to Invoice, # 3 Transmittal Letter)(er) (Entered: 09/30/2009)"
        },
        {
          "row_number": 2990,
          "id": 8974948,
          "entry_number": "897",
          "date_filed": "2009-10-02T00:00:00-04:00",
          "attachments": null,
          "url": "https://www.courtlistener.com/docket/6672519/897/united-states-v-commonwealth-of-pr/",
          "recap_pdf_url": null,
          "pacer_doc_id": null,
          "description": "ORDER granting as requested 896 Motion for Extension of until October 15, 2009 to File Response/Reply, Signed by Judge Gustavo A. Gelpi on 10/2/09. (sm) Modified on 10/2/2009 as to title of link (er). (Entered: 10/02/2009)"
        },
        {
          "row_number": 2991,
          "id": 8974949,
          "entry_number": "898",
          "date_filed": "2009-10-02T00:00:00-04:00",
          "attachments": null,
          "url": "https://www.courtlistener.com/docket/6672519/898/united-states-v-commonwealth-of-pr/",
          "recap_pdf_url": null,
          "pacer_doc_id": null,
          "description": "ORDER granting 895 Motion for extension of time until October 31, 2009 to Deposit Funds. This extension is final. Signed by Judge Gustavo A. Gelpi on 10/2/09. (sm) Modified on 10/2/2009 to add title of link (er). (Entered: 10/02/2009)"
        },
        {
          "row_number": 2996,
          "id": 8974952,
          "entry_number": "901",
          "date_filed": "2009-10-19T00:00:00-04:00",
          "attachments": null,
          "url": "https://www.courtlistener.com/docket/6672519/901/united-states-v-commonwealth-of-pr/",
          "recap_pdf_url": null,
          "pacer_doc_id": null,
          "description": "ORDER noted and approved 894 Motion submitting Invoice for Services Rendered by the Joint Compliance Coordinator for the month of August 2009. Signed by Judge Gustavo A. Gelpi on 10/19/09. (sm) Modified on 10/20/2009 as title of link (er). (Entered: 10/19/2009)"
        },
        {
          "row_number": 2997,
          "id": 8974953,
          "entry_number": "902",
          "date_filed": "2009-10-19T00:00:00-04:00",
          "attachments": null,
          "url": "https://www.courtlistener.com/docket/6672519/902/united-states-v-commonwealth-of-pr/",
          "recap_pdf_url": null,
          "pacer_doc_id": "15902277517",
          "description": "MOTION for Reconsideration of Order, re 901 Order on Motion Submitting, 900 Order on Motion Submitting filed by Sheila J. Torres-Delgado on behalf of The Commonwealth of Puerto Rico, Pedro J. Rossello-Gonzalez, Carmen Feliciano-de-Melecio, Jose De-Leon Suggestions in opposition/response due by 11/4/2009 (Related document(s) 901, 900 ) (Torres-Delgado, Sheila) (Entered: 10/19/2009)"
        },
        {
          "row_number": 3002,
          "id": 8974959,
          "entry_number": "907",
          "date_filed": "2009-10-22T00:00:00-04:00",
          "attachments": null,
          "url": "https://www.courtlistener.com/docket/6672519/907/united-states-v-commonwealth-of-pr/",
          "recap_pdf_url": null,
          "pacer_doc_id": "15902283416",
          "description": "**CASE PARTICIPANTS** MOTION to Clarify Previous Motion filed by Wandymar Burgos-Vargas on behalf of Department of Justice - Commonwealth of P.R. (Burgos-Vargas, Wandymar) Modified on 10/23/2009 as title of Motion(er). (Entered: 10/22/2009)"
        },
        {
          "row_number": 3003,
          "id": 8974960,
          "entry_number": "908",
          "date_filed": "2009-10-22T00:00:00-04:00",
          "attachments": null,
          "url": "https://www.courtlistener.com/docket/6672519/908/united-states-v-commonwealth-of-pr/",
          "recap_pdf_url": null,
          "pacer_doc_id": null,
          "description": "ORDER noted 907 Motion to clarify Previous Motion. Signed by Judge Gustavo A. Gelpi on 10/22/09. (sm) Modified on 10/23/2009 as title of Motion(er). (Entered: 10/22/2009)"
        },
        {
          "row_number": 3006,
          "id": 8974962,
          "entry_number": "910",
          "date_filed": "2009-10-26T00:00:00-04:00",
          "attachments": null,
          "url": "https://www.courtlistener.com/docket/6672519/910/united-states-v-commonwealth-of-pr/",
          "recap_pdf_url": null,
          "pacer_doc_id": null,
          "description": "ORDER noted 909 MOTION Stating Commonwealth's Position Regarding the JCC's Proposed Budget for Fiscal Year 2009-2010. Signed by Judge Gustavo A. Gelpi on 10/26/09. (sm) Modified on 10/27/2009 as title of link (er). (Entered: 10/26/2009)"
        },
        {
          "row_number": 3007,
          "id": 8974963,
          "entry_number": "911",
          "date_filed": "2009-10-26T00:00:00-04:00",
          "attachments": null,
          "url": "https://www.courtlistener.com/docket/6672519/911/united-states-v-commonwealth-of-pr/",
          "recap_pdf_url": null,
          "pacer_doc_id": null,
          "description": "ORDER amending 910 Order on MOTION Stating Commonwealth's Position Regarding the JCC's Proposed Budget for Fiscal Year 2009-2010, as follows: NOTED. Counsel or the US and Dr. McGee shall review and consider this matter which shall be discussed during next status conference. Dr. McGee's pending invoices are approved. Signed by Judge Gustavo A. Gelpi on 10/26/09.(sm) Modified on 10/27/2009 to add title of link (er). (Entered: 10/26/2009)"
        },
        {
          "row_number": 3011,
          "id": 8974967,
          "entry_number": "915",
          "date_filed": "2009-12-01T00:00:00-05:00",
          "attachments": null,
          "url": "https://www.courtlistener.com/docket/6672519/915/united-states-v-commonwealth-of-pr/",
          "recap_pdf_url": null,
          "pacer_doc_id": null,
          "description": "ORDER noting and approving 913 INFORMATIVE motion regarding Proposed Joint Compliance Coordinator Budget: FY 2009-2010. Signed by Judge Gustavo A. Gelpi on 12/1/09. (CSL) (Entered: 12/01/2009)"
        },
        {
          "row_number": 3012,
          "id": 8974968,
          "entry_number": "916",
          "date_filed": "2009-12-07T00:00:00-05:00",
          "attachments": null,
          "url": "https://www.courtlistener.com/docket/6672519/916/united-states-v-commonwealth-of-pr/",
          "recap_pdf_url": null,
          "pacer_doc_id": "15902340359",
          "description": "MOTION Submitting Invoice for Services Rendered by the Joint Compliance Coordinator for the month of March 2009 filed by Dr. John J. McGee. (Attachments: # 1 Exhibit Letter to Commonwealth of Puerto Rico)(er) (Entered: 12/08/2009)"
        },
        {
          "row_number": 3033,
          "id": 8974986,
          "entry_number": "935",
          "date_filed": "2010-01-11T00:00:00-05:00",
          "attachments": null,
          "url": "https://www.courtlistener.com/docket/6672519/935/united-states-v-commonwealth-of-pr/",
          "recap_pdf_url": null,
          "pacer_doc_id": "15902378816",
          "description": "MOTION Submitting Invoice for Services Rendered by the Joint Compliance Coordinator for the month of December 2009 filed by John J. McGee. (Attachments: # 1 Exhibit)(er) (Entered: 01/12/2010)"
        },
        {
          "row_number": 3034,
          "id": 8974987,
          "entry_number": "936",
          "date_filed": "2010-01-11T00:00:00-05:00",
          "attachments": null,
          "url": "https://www.courtlistener.com/docket/6672519/936/united-states-v-commonwealth-of-pr/",
          "recap_pdf_url": null,
          "pacer_doc_id": "15902378892",
          "description": "INFORMATIVE Motion 929 INFORMATIVE Motion regarding Request for Joint Compliance Coordinator Report filed by Sheila J. Torres-Delgado on behalf of The Commonwealth of Puerto Rico, MOTION for extension of time to present a formal report to the parties( Suggestions in opposition/response due by 1/27/2010) filed by John J. McGee. (er) (Entered: 01/12/2010)"
        },
        {
          "row_number": 3035,
          "id": 8974989,
          "entry_number": "937",
          "date_filed": "2010-01-12T00:00:00-05:00",
          "attachments": null,
          "url": "https://www.courtlistener.com/docket/6672519/937/united-states-v-commonwealth-of-pr/",
          "recap_pdf_url": null,
          "pacer_doc_id": null,
          "description": "ORDER noted and approved 936 INFORMATIVE Motion and Motion for extension of time Signed by Judge Gustavo A. Gelpi on 1/12/10. (sm) (Entered: 01/12/2010)"
        },
        {
          "row_number": 3036,
          "id": 8974990,
          "entry_number": "938",
          "date_filed": "2010-01-13T00:00:00-05:00",
          "attachments": null,
          "url": "https://www.courtlistener.com/docket/6672519/938/united-states-v-commonwealth-of-pr/",
          "recap_pdf_url": null,
          "pacer_doc_id": "15902379853",
          "description": "MOTION for extension of time until February 2, 2010 to submit Commonwealth's comments and/or objections, if any, to JCC's invoice for the month of December 2009 filed by Sheila J. Torres-Delgado on behalf of Department of Justice - Commonwealth of P.R., The Commonwealth of Puerto Rico, Pedro J. Rossello-Gonzalez, Carmen Feliciano-de-Melecio, Jose De-Leon Suggestions in opposition/response due by 1/29/2010 (Torres-Delgado, Sheila) (Entered: 01/13/2010)"
        },
        {
          "row_number": 3041,
          "id": 8974994,
          "entry_number": "942",
          "date_filed": "2010-01-22T00:00:00-05:00",
          "attachments": null,
          "url": "https://www.courtlistener.com/docket/6672519/942/united-states-v-commonwealth-of-pr/",
          "recap_pdf_url": null,
          "pacer_doc_id": "15902393584",
          "description": "MOTION for Reconsideration re 937 Order on Informative Motion, Order on Motion for extension of time filed by Sheila J. Torres-Delgado on behalf of Department of Justice - Commonwealth of P.R., The Commonwealth of Puerto Rico, Pedro J. Rossello-Gonzalez, Carmen Feliciano-de-Melecio, Jose De-Leon Suggestions in opposition/response due by 2/8/2010 (Related document(s) 937 ) (Torres-Delgado, Sheila) (Entered: 01/22/2010)"
        },
        {
          "row_number": 3042,
          "id": 8974995,
          "entry_number": "943",
          "date_filed": "2010-01-25T00:00:00-05:00",
          "attachments": null,
          "url": "https://www.courtlistener.com/docket/6672519/943/united-states-v-commonwealth-of-pr/",
          "recap_pdf_url": null,
          "pacer_doc_id": null,
          "description": "ORDER denying without prejudice 942 Motion for Reconsideration. The parties shall confer with Dr. Mc Gee to determine whether he can submit a 2009 report, which may later be amended with any findings following the programatic review. Signed by Judge Gustavo A. Gelpi on 1/25/10. (sm) (Entered: 01/25/2010)"
        },
        {
          "row_number": 3044,
          "id": 8974997,
          "entry_number": "945",
          "date_filed": "2010-02-01T00:00:00-05:00",
          "attachments": null,
          "url": "https://www.courtlistener.com/docket/6672519/945/united-states-v-commonwealth-of-pr/",
          "recap_pdf_url": null,
          "pacer_doc_id": null,
          "description": "ORDER noted and approved 934 Motion submitting Modified Invoice for Services Rendered by the Joint Compliance Coordinator for the month of June 2009 r Signed by Judge Gustavo A. Gelpi on 2/1/10. (sm) Modified on 2/2/2010 as to title of link (er). (Entered: 02/01/2010)"
        },
        {
          "row_number": 3045,
          "id": 8974998,
          "entry_number": "946",
          "date_filed": "2010-02-04T00:00:00-05:00",
          "attachments": null,
          "url": "https://www.courtlistener.com/docket/6672519/946/united-states-v-commonwealth-of-pr/",
          "recap_pdf_url": null,
          "pacer_doc_id": null,
          "description": "ORDER noted and approved 935 Motion submitting Invoice for Services Rendered by the Joint Compliance Coordinator for the month of December 2009. Signed by Judge Gustavo A. Gelpi on 2/410. (sm) Modified on 2/5/2010 as title of link (er). (Entered: 02/04/2010)"
        },
        {
          "row_number": 3046,
          "id": 8974999,
          "entry_number": "947",
          "date_filed": "2010-02-10T00:00:00-05:00",
          "attachments": null,
          "url": "https://www.courtlistener.com/docket/6672519/947/united-states-v-commonwealth-of-pr/",
          "recap_pdf_url": null,
          "pacer_doc_id": "15902416234",
          "description": "ORDER for defendants to deposit funds with the Clerk of Court. Signed by Judge Gustavo A. Gelpi on 2/10/010.(cr) (Entered: 02/10/2010)"
        },
        {
          "row_number": 3050,
          "id": 8975002,
          "entry_number": "950",
          "date_filed": "2010-02-16T00:00:00-05:00",
          "attachments": null,
          "url": "https://www.courtlistener.com/docket/6672519/950/united-states-v-commonwealth-of-pr/",
          "recap_pdf_url": null,
          "pacer_doc_id": "15902422215",
          "description": "INFORMATIVE Motion regarding Mental Retardation Program filed by Sheila J. Torres-Delgado on behalf of Department of Justice - Commonwealth of P.R., The Commonwealth of Puerto Rico, Pedro J. Rossello-Gonzalez, Carmen Feliciano-de-Melecio, Jose De-Leon (Torres-Delgado, Sheila) (Entered: 02/16/2010)"
        },
        {
          "row_number": 3051,
          "id": 8975003,
          "entry_number": "951",
          "date_filed": "2010-02-16T00:00:00-05:00",
          "attachments": null,
          "url": "https://www.courtlistener.com/docket/6672519/951/united-states-v-commonwealth-of-pr/",
          "recap_pdf_url": null,
          "pacer_doc_id": null,
          "description": "ORDER noted 950 INFORMATIVE motion regarding Mental Retardation Program Signed by Judge Gustavo A. Gelpi on 2/16/10. (sm) Modified on 2/17/2010 as title of link (er). (Entered: 02/16/2010)"
        },
        {
          "row_number": 3052,
          "id": 8975004,
          "entry_number": "952",
          "date_filed": "2010-02-22T00:00:00-05:00",
          "attachments": null,
          "url": "https://www.courtlistener.com/docket/6672519/952/united-states-v-commonwealth-of-pr/",
          "recap_pdf_url": null,
          "pacer_doc_id": null,
          "description": "ORDER. Further Status Conference RESET for 2/25/2010 05:00 PM in Courtroom 5 before Judge Gustavo A. Gelpi. Signed by Judge Gustavo A. Gelpi on 2/22/10.(cr) (Entered: 02/22/2010)"
        },
        {
          "row_number": 3054,
          "id": 8975005,
          "entry_number": "954",
          "date_filed": "2010-02-25T00:00:00-05:00",
          "attachments": null,
          "url": "https://www.courtlistener.com/docket/6672519/954/united-states-v-commonwealth-of-pr/",
          "recap_pdf_url": null,
          "pacer_doc_id": "15902440269",
          "description": "Minute Entry for proceedings held before Judge Gustavo A. Gelpi: Further Status Conference held on 2/25/2010. Further Status Conference set for 5/3/2010 05:00 PM in Courtroom 5 before Judge Gustavo A. Gelpi. (Court Reporter Yvette Richardson.) (cr) (Entered: 03/01/2010)"
        },
        {
          "row_number": 3053,
          "id": 8975006,
          "entry_number": "953",
          "date_filed": "2010-02-26T00:00:00-05:00",
          "attachments": null,
          "url": "https://www.courtlistener.com/docket/6672519/953/united-states-v-commonwealth-of-pr/",
          "recap_pdf_url": null,
          "pacer_doc_id": "15902437497",
          "description": "STATUS REPORT (BINDER) by The Commonwealth of Puerto Rico dated February 22-26, 2010. (cr) (Entered: 02/26/2010)"
        },
        {
          "row_number": 3180,
          "id": 8975009,
          "entry_number": null,
          "date_filed": "2010-03-03T00:00:00-05:00",
          "attachments": null,
          "url": "https://www.courtlistener.com",
          "recap_pdf_url": null,
          "pacer_doc_id": null,
          "description": "DEPOSIT of Funds in the amount of $ SEALED, receipt number 187368. (RE:dkt.956). Deposited ((NEXT WORKING DAY)) in an Interest Bearing Account in compliance with L.R.67. **FUNDS WILL BE AVAILABLE FOR DISBURSEMENT WITHIN 7 WORKING DAYS**. (jla)"
        },
        {
          "row_number": 3057,
          "id": 8975010,
          "entry_number": "957",
          "date_filed": "2010-03-03T00:00:00-05:00",
          "attachments": null,
          "url": "https://www.courtlistener.com/docket/6672519/957/united-states-v-commonwealth-of-pr/",
          "recap_pdf_url": null,
          "pacer_doc_id": "15902443794",
          "description": "**CASE PARTICIPANTS** INFORMATIVE Motion regarding compliance with order regarding participants JSCF filed by Eliezer Aldarondo-Ortiz on behalf of The Commonwealth of Puerto Rico (Aldarondo-Ortiz, Eliezer) (Entered: 03/03/2010)"
        },
        {
          "row_number": 3061,
          "id": 8975013,
          "entry_number": "960",
          "date_filed": "2010-03-08T00:00:00-05:00",
          "attachments": null,
          "url": "https://www.courtlistener.com/docket/6672519/960/united-states-v-commonwealth-of-pr/",
          "recap_pdf_url": null,
          "pacer_doc_id": "15902451529",
          "description": "TRANSCRIPT REQUEST by Nilsa Lugo for proceedings of Status Conference held on 2/25/2010 before Judge Gustavo A. Gelpi. (er) (Entered: 03/09/2010)"
        },
        {
          "row_number": 3062,
          "id": 8975014,
          "entry_number": "961",
          "date_filed": "2010-03-16T00:00:00-04:00",
          "attachments": null,
          "url": "https://www.courtlistener.com/docket/6672519/961/united-states-v-commonwealth-of-pr/",
          "recap_pdf_url": null,
          "pacer_doc_id": "15902459509",
          "description": "INFORMATIVE Motion regarding the Mental Retardation Program filed by Sheila J. Torres-Delgado on behalf of Department of Justice - Commonwealth of P.R., The Commonwealth of Puerto Rico, Pedro J. Rossello-Gonzalez, Carmen Feliciano-de-Melecio, Jose De-Leon (Torres-Delgado, Sheila) (Entered: 03/16/2010)"
        },
        {
          "row_number": 3063,
          "id": 8975015,
          "entry_number": "962",
          "date_filed": "2010-03-16T00:00:00-04:00",
          "attachments": null,
          "url": "https://www.courtlistener.com/docket/6672519/962/united-states-v-commonwealth-of-pr/",
          "recap_pdf_url": null,
          "pacer_doc_id": null,
          "description": "ORDER noting 961 INFORMATIVE motion regarding the Mental Retardation Program. Signed by Judge Gustavo A. Gelpi on 3/16/10. (CSL) Modified on 3/17/2010 as title of link (er). (Entered: 03/16/2010)"
        },
        {
          "row_number": 3076,
          "id": 8975027,
          "entry_number": "974",
          "date_filed": "2010-06-14T00:00:00-04:00",
          "attachments": null,
          "url": "https://www.courtlistener.com/docket/6672519/974/united-states-v-commonwealth-of-pr/",
          "recap_pdf_url": null,
          "pacer_doc_id": null,
          "description": "ORDER granting 973 Motion requesting Order Dr Mc Gee's July-December 2009 unopposed invoices shall be paid by the Commonwealth on or before July 1, 2010. Such payment is long overdue. Signed by Judge Gustavo A. Gelpi on 6/14/10. (sm) (Entered: 06/14/2010)"
        },
        {
          "row_number": 3078,
          "id": 8975029,
          "entry_number": "976",
          "date_filed": "2010-06-14T00:00:00-04:00",
          "attachments": null,
          "url": "https://www.courtlistener.com/docket/6672519/976/united-states-v-commonwealth-of-pr/",
          "recap_pdf_url": null,
          "pacer_doc_id": null,
          "description": "ORDER noted 975 Motion for Reconsideration. The Commonwealth has deposited the payment sums due; the clerk of court shall issue corresponding payments. Signed by Judge Gustavo A. Gelpi on 6/14/10. (sm) (Entered: 06/14/2010)"
        },
        {
          "row_number": 3091,
          "id": 8975041,
          "entry_number": "988",
          "date_filed": "2010-07-16T00:00:00-04:00",
          "attachments": null,
          "url": "https://www.courtlistener.com/docket/6672519/988/united-states-v-commonwealth-of-pr/",
          "recap_pdf_url": null,
          "pacer_doc_id": "15902618249",
          "description": "MOTION Submitting Invoice for Services Rendered by the Joint Compliance Coordinator Month of May 2010 filed by Dr. John J. McGee. (er) (Entered: 07/19/2010)"
        },
        {
          "row_number": 3092,
          "id": 8975042,
          "entry_number": "989",
          "date_filed": "2010-07-16T00:00:00-04:00",
          "attachments": null,
          "url": "https://www.courtlistener.com/docket/6672519/989/united-states-v-commonwealth-of-pr/",
          "recap_pdf_url": null,
          "pacer_doc_id": "15902618254",
          "description": "MOTION Submitting Invoice for Services Rendered by the Joint Compliance Coordinator Month of June 2010 filed by Dr. John J. McGee. (er) (Entered: 07/19/2010)"
        },
        {
          "row_number": 3095,
          "id": 8975044,
          "entry_number": "991",
          "date_filed": "2010-07-20T00:00:00-04:00",
          "attachments": null,
          "url": "https://www.courtlistener.com/docket/6672519/991/united-states-v-commonwealth-of-pr/",
          "recap_pdf_url": null,
          "pacer_doc_id": "15902620119",
          "description": "MOTION for extension of time until August 20, 2010 to Submit Commonwealth's Comments and/or Objections to JCC's Proposed Budget for FY 2010-11 and his invoices for January to June 2010 filed by Sheila J. Torres-Delgado on behalf of Jose De-Leon, Department of Justice - Commonwealth of P.R., Carmen Feliciano-de-Melecio, Pedro J. Rossello-Gonzalez, The Commonwealth of Puerto Rico Suggestions in opposition/response due by 8/5/2010 (Torres-Delgado, Sheila) (Entered: 07/20/2010)"
        },
        {
          "row_number": 3099,
          "id": 8975048,
          "entry_number": "995",
          "date_filed": "2010-07-21T00:00:00-04:00",
          "attachments": null,
          "url": "https://www.courtlistener.com/docket/6672519/995/united-states-v-commonwealth-of-pr/",
          "recap_pdf_url": null,
          "pacer_doc_id": null,
          "description": "ORDER noting 986 Motion submitting Invoice for Services Rendered by the Joint Compliance Coordinator Month of March 2010 . Signed by Judge Gustavo A. Gelpi on 7/21/10. (CSL) Modified on 7/22/2010 as title of link (er). (Entered: 07/21/2010)"
        },
        {
          "row_number": 3100,
          "id": 8975049,
          "entry_number": "996",
          "date_filed": "2010-07-21T00:00:00-04:00",
          "attachments": null,
          "url": "https://www.courtlistener.com/docket/6672519/996/united-states-v-commonwealth-of-pr/",
          "recap_pdf_url": null,
          "pacer_doc_id": null,
          "description": "ORDER noting 987 Motion submitting Invoice for Services Rendered by the Joint Compliance Coordinator Month of April 2010 . Signed by Judge Gustavo A. Gelpi on 7/21/10. (CSL) Modified on 7/22/2010 as title of link (er). (Entered: 07/21/2010)"
        },
        {
          "row_number": 3102,
          "id": 8975051,
          "entry_number": "998",
          "date_filed": "2010-07-21T00:00:00-04:00",
          "attachments": null,
          "url": "https://www.courtlistener.com/docket/6672519/998/united-states-v-commonwealth-of-pr/",
          "recap_pdf_url": null,
          "pacer_doc_id": null,
          "description": "ORDER noting 989 Motion submitting Invoice for Services Rendered by the Joint Compliance Coordinator Month of June 2010 Signed by Judge Gustavo A. Gelpi on 7/21/10. (CSL) Modified on 7/22/2010 as title of link (er). (Entered: 07/21/2010)"
        },
        {
          "row_number": 3103,
          "id": 8975052,
          "entry_number": "999",
          "date_filed": "2010-07-21T00:00:00-04:00",
          "attachments": null,
          "url": "https://www.courtlistener.com/docket/6672519/999/united-states-v-commonwealth-of-pr/",
          "recap_pdf_url": null,
          "pacer_doc_id": null,
          "description": "ORDER noting 990 INFORMATIVE Motion regarding the Mental Retardation Program. Signed by Judge Gustavo A. Gelpi on 7/21/10. (CSL) Modified on 7/22/2010 as title of link (er). (Entered: 07/21/2010)"
        },
        {
          "row_number": 3,
          "id": 8975053,
          "entry_number": "1000",
          "date_filed": "2010-07-21T00:00:00-04:00",
          "attachments": null,
          "url": "https://www.courtlistener.com/docket/6672519/1000/united-states-v-commonwealth-of-pr/",
          "recap_pdf_url": null,
          "pacer_doc_id": null,
          "description": "ORDER granting as requested 991 Motion for extension of time until August 20, 2010 to Submit Commonwealth's Comments and/or Objections to JCC's Proposed Budget for FY 2010-11 and his invoices for January to June 2010. The extension is final. Signed by Judge Gustavo A. Gelpi on 7/21/10. (CSL) Modified on 7/22/2010 as to title of link (er). (Entered: 07/21/2010)"
        },
        {
          "row_number": 4,
          "id": 8975054,
          "entry_number": "1001",
          "date_filed": "2010-07-29T00:00:00-04:00",
          "attachments": null,
          "url": "https://www.courtlistener.com/docket/6672519/1001/united-states-v-commonwealth-of-pr/",
          "recap_pdf_url": null,
          "pacer_doc_id": "15902636720",
          "description": "INFORMATIVE Motion from the Committee of Parents, Family and Friends regarding Commonwealth of Puerto Rico Retardation Program filed by Maria D. Londono. (er) (Entered: 08/02/2010)"
        },
        {
          "row_number": 5,
          "id": 8975055,
          "entry_number": "1002",
          "date_filed": "2010-08-02T00:00:00-04:00",
          "attachments": null,
          "url": "https://www.courtlistener.com/docket/6672519/1002/united-states-v-commonwealth-of-pr/",
          "recap_pdf_url": null,
          "pacer_doc_id": null,
          "description": "ORDER noted 1001 INFORMATIVE motion. Dr. McGee, the Court monitor, along with counsel for the parties shall evaluate and address this matter at the next status conference, which shall be scheduled for late August, 2010. The Court, however, assures the drafters of the instant letter that no action will be taken that places in jeopardy the constitutional rights of the program participants. Signed by Judge Gustavo A. Gelpi on 8/2/10. (cr) (Entered: 08/02/2010)"
        },
        {
          "row_number": 10,
          "id": 8975060,
          "entry_number": "1007",
          "date_filed": "2010-08-19T00:00:00-04:00",
          "attachments": null,
          "url": "https://www.courtlistener.com/docket/6672519/1007/united-states-v-commonwealth-of-pr/",
          "recap_pdf_url": null,
          "pacer_doc_id": "15902657883",
          "description": "**CASE PARTICIPANTS** MOTION to Deposit Funds filed by Wandymar Burgos-Vargas on behalf of Department of Justice - Commonwealth of P.R. (Burgos-Vargas, Wandymar) (Entered: 08/19/2010)"
        },
        {
          "row_number": 11,
          "id": 8975061,
          "entry_number": "1008",
          "date_filed": "2010-08-19T00:00:00-04:00",
          "attachments": null,
          "url": "https://www.courtlistener.com/docket/6672519/1008/united-states-v-commonwealth-of-pr/",
          "recap_pdf_url": null,
          "pacer_doc_id": null,
          "description": "ORDER granting 1007 Motion to Deposit Funds Signed by Judge Gustavo A. Gelpi on 10/19/10. (sm) (Entered: 08/19/2010)"
        },
        {
          "row_number": 16,
          "id": 8975065,
          "entry_number": "1012",
          "date_filed": "2010-08-20T00:00:00-04:00",
          "attachments": null,
          "url": "https://www.courtlistener.com/docket/6672519/1012/united-states-v-commonwealth-of-pr/",
          "recap_pdf_url": null,
          "pacer_doc_id": null,
          "description": "ORDER granting 1009 Motion to Strike Docket No. 1006 from the record. Signed by Judge Gustavo A. Gelpi on 8/20/10. (cr) (Entered: 08/20/2010)"
        },
        {
          "row_number": 17,
          "id": 8975067,
          "entry_number": "1013",
          "date_filed": "2010-08-20T00:00:00-04:00",
          "attachments": null,
          "url": "https://www.courtlistener.com/docket/6672519/1013/united-states-v-commonwealth-of-pr/",
          "recap_pdf_url": null,
          "pacer_doc_id": "15902661054",
          "description": "**CASE PARTICIPANTS** INFORMATIVE Motion regarding JCC's Invoices for the Months of January to June 2010 filed by Sheila J. Torres-Delgado on behalf of Jose De-Leon, Department of Justice - Commonwealth of P.R., Carmen Feliciano-de-Melecio, Pedro J. Rossello-Gonzalez, The Commonwealth of Puerto Rico (Torres-Delgado, Sheila) (Entered: 08/20/2010)"
        },
        {
          "row_number": 18,
          "id": 8975068,
          "entry_number": "1014",
          "date_filed": "2010-08-23T00:00:00-04:00",
          "attachments": null,
          "url": "https://www.courtlistener.com/docket/6672519/1014/united-states-v-commonwealth-of-pr/",
          "recap_pdf_url": null,
          "pacer_doc_id": null,
          "description": "ORDER amending Order 993 Order on Motion Submitting 984 to read: GRANTED AS REQUESTED, 20% to be withheld for tax purposes.Signed by Judge Gustavo A. Gelpi on 8/23/10.(sm) (Entered: 08/23/2010)"
        },
        {
          "row_number": 28,
          "id": 8975077,
          "entry_number": "1023",
          "date_filed": "2010-09-01T00:00:00-04:00",
          "attachments": null,
          "url": "https://www.courtlistener.com/docket/6672519/1023/united-states-v-commonwealth-of-pr/",
          "recap_pdf_url": null,
          "pacer_doc_id": "15902674056",
          "description": "Joint INFORMATIVE Motion regarding Resolution of Defendants' Motion for Reconsideration filed by Richard J. Farano on behalf of USA (Farano, Richard) Modified on 9/1/2010 to add joint (er). (Entered: 09/01/2010)"
        },
        {
          "row_number": 31,
          "id": 8975080,
          "entry_number": "1026",
          "date_filed": "2010-09-21T00:00:00-04:00",
          "attachments": null,
          "url": "https://www.courtlistener.com/docket/6672519/1026/united-states-v-commonwealth-of-pr/",
          "recap_pdf_url": null,
          "pacer_doc_id": "15902698774",
          "description": "INFORMATIVE Motion regarding the Mental Retardation Program filed by Sheila J. Torres-Delgado on behalf of The Commonwealth of Puerto Rico (Torres-Delgado, Sheila) (Entered: 09/21/2010)"
        },
        {
          "row_number": 32,
          "id": 8975081,
          "entry_number": "1027",
          "date_filed": "2010-09-21T00:00:00-04:00",
          "attachments": null,
          "url": "https://www.courtlistener.com/docket/6672519/1027/united-states-v-commonwealth-of-pr/",
          "recap_pdf_url": null,
          "pacer_doc_id": null,
          "description": "ORDER noted 1026 INFORMATIVE motion regarding the Mental Retardation Program. Signed by Judge Gustavo A. Gelpi on 9/21/10. (sm) Modified on 9/22/2010 as to title of link(er). (Entered: 09/21/2010)"
        },
        {
          "row_number": 3182,
          "id": 8975082,
          "entry_number": null,
          "date_filed": "2010-09-22T00:00:00-04:00",
          "attachments": null,
          "url": "https://www.courtlistener.com",
          "recap_pdf_url": null,
          "pacer_doc_id": null,
          "description": "DEPOSIT of Funds in the amount of $ SEALED, receipt number PRX100001442. (RE:DKT.1025) Deposited ((NEXT WORKING DAY)) in an Interest Bearing Account in compliance with L.R.67. **FUNDS WILL BE AVAILABLE FOR DISBURSEMENT WITHIN 7 WORKING DAYS**. (jla)"
        },
        {
          "row_number": 33,
          "id": 8975083,
          "entry_number": "1028",
          "date_filed": "2010-10-01T00:00:00-04:00",
          "attachments": null,
          "url": "https://www.courtlistener.com/docket/6672519/1028/united-states-v-commonwealth-of-pr/",
          "recap_pdf_url": null,
          "pacer_doc_id": "15902714275",
          "description": "INFORMATIVE Motion regarding Submittal of Work Plan filed by Sheila J. Torres-Delgado on behalf of Jose De-Leon, Department of Justice - Commonwealth of P.R., Carmen Feliciano-de-Melecio, Pedro J. Rossello-Gonzalez, The Commonwealth of Puerto Rico (Torres-Delgado, Sheila) (Entered: 10/01/2010)"
        },
        {
          "row_number": 34,
          "id": 8975084,
          "entry_number": "1029",
          "date_filed": "2010-10-01T00:00:00-04:00",
          "attachments": null,
          "url": "https://www.courtlistener.com/docket/6672519/1029/united-states-v-commonwealth-of-pr/",
          "recap_pdf_url": null,
          "pacer_doc_id": "15902715212",
          "description": "INFORMATIVE Motion regarding filing of Commonwealth's Work Plan filed by Sheila J. Torres-Delgado on behalf of Jose De-Leon, Department of Justice - Commonwealth of P.R., Carmen Feliciano-de-Melecio, Pedro J. Rossello-Gonzalez, The Commonwealth of Puerto Rico (Torres-Delgado, Sheila) (Entered: 10/01/2010)"
        },
        {
          "row_number": 36,
          "id": 8975085,
          "entry_number": "1030",
          "date_filed": "2010-10-04T00:00:00-04:00",
          "attachments": null,
          "url": "https://www.courtlistener.com/docket/6672519/1030/united-states-v-commonwealth-of-pr/",
          "recap_pdf_url": null,
          "pacer_doc_id": null,
          "description": "ORDER noted 1028 INFORMATIVE motion regarding Submittal of Work Plan. Signed by Judge Gustavo A. Gelpi on 10/4/10. (SAA) Modified on 10/4/2010 as title of link (er). (Entered: 10/04/2010)"
        },
        {
          "row_number": 40,
          "id": 8975089,
          "entry_number": "1034",
          "date_filed": "2010-10-08T00:00:00-04:00",
          "attachments": null,
          "url": "https://www.courtlistener.com/docket/6672519/1034/united-states-v-commonwealth-of-pr/",
          "recap_pdf_url": null,
          "pacer_doc_id": "15902723732",
          "description": "MOTION Submitting Invoice for Services Rendered by the Joint Compliance Coordinator for the month of August 2010 filed by PH.D. John J. McGee, pro se. (er) (Entered: 10/08/2010)"
        },
        {
          "row_number": 41,
          "id": 8975090,
          "entry_number": "1035",
          "date_filed": "2010-10-08T00:00:00-04:00",
          "attachments": null,
          "url": "https://www.courtlistener.com/docket/6672519/1035/united-states-v-commonwealth-of-pr/",
          "recap_pdf_url": null,
          "pacer_doc_id": "15902723739",
          "description": "MOTION Submitting Invoice for Services Rendered by the Joint Compliance Coordinator for the month of September 2010 filed by PH.D. John J. McGee, pro se. (er) (Entered: 10/08/2010)"
        },
        {
          "row_number": 50,
          "id": 8975098,
          "entry_number": "1043",
          "date_filed": "2010-10-19T00:00:00-04:00",
          "attachments": null,
          "url": "https://www.courtlistener.com/docket/6672519/1043/united-states-v-commonwealth-of-pr/",
          "recap_pdf_url": null,
          "pacer_doc_id": null,
          "description": "ORDER noted 1042 INFORMATIVE motion. The parties will investigate and address such allegations. Signed by Judge Gustavo A. Gelpi on 10/19/10. (sm) (Entered: 10/19/2010)"
        },
        {
          "row_number": 51,
          "id": 8975099,
          "entry_number": "1044",
          "date_filed": "2010-10-21T00:00:00-04:00",
          "attachments": null,
          "url": "https://www.courtlistener.com/docket/6672519/1044/united-states-v-commonwealth-of-pr/",
          "recap_pdf_url": null,
          "pacer_doc_id": null,
          "description": "ORDER noted 1025 Motion to Deposit Funds. Signed by Judge Gustavo A. Gelpi on 10/21/10. (cr) (Entered: 10/21/2010)"
        },
        {
          "row_number": 53,
          "id": 8975102,
          "entry_number": "1046",
          "date_filed": "2010-10-22T00:00:00-04:00",
          "attachments": null,
          "url": "https://www.courtlistener.com/docket/6672519/1046/united-states-v-commonwealth-of-pr/",
          "recap_pdf_url": null,
          "pacer_doc_id": null,
          "description": "ORDER re 1036 MOTION Submitting Invoice, 1035 MOTION Submitting filed by John J. McGee, 1034 MOTION Submitting Invoice filed by John J. McGee, 1033 MOTION Submitting Invoice for Services Rendered by the Joint Compliance Coordinator for the month of July 2010 filed by John J. McGee. Having no objection by the Commonwealth of Puerto Rico, the Court hereby APPROVES the aforementioned invoices for payment. Signed by Judge Gustavo A. Gelpi on 10/22/10.(cr) (Entered: 10/22/2010)"
        },
        {
          "row_number": 55,
          "id": 8975103,
          "entry_number": "1048",
          "date_filed": "2010-10-27T00:00:00-04:00",
          "attachments": null,
          "url": "https://www.courtlistener.com/docket/6672519/1048/united-states-v-commonwealth-of-pr/",
          "recap_pdf_url": null,
          "pacer_doc_id": null,
          "description": "ORDER noted 979 INFORMATIVE motion. This matter will be addressed at a future status conference. Signed by Judge Gustavo A. Gelpi on 10/27/10. (SAA) (Entered: 10/27/2010)"
        },
        {
          "row_number": 58,
          "id": 8975105,
          "entry_number": "1050",
          "date_filed": "2010-11-01T00:00:00-04:00",
          "attachments": null,
          "url": "https://www.courtlistener.com/docket/6672519/1050/united-states-v-commonwealth-of-pr/",
          "recap_pdf_url": null,
          "pacer_doc_id": "15902755181",
          "description": "RESPONSE to Motion filed by parents at Docket Document No. 1042 filed by All Defendants Re: 1042 INFORMATIVE Motion regarding facts ocurred after the last status conference filed by Maria D. Londono filed by All Defendants. (Torres-Delgado, Sheila) (Entered: 11/01/2010)"
        },
        {
          "row_number": 59,
          "id": 8975106,
          "entry_number": "1051",
          "date_filed": "2010-11-02T00:00:00-04:00",
          "attachments": null,
          "url": "https://www.courtlistener.com/docket/6672519/1051/united-states-v-commonwealth-of-pr/",
          "recap_pdf_url": null,
          "pacer_doc_id": null,
          "description": "ORDER noted 1050 Response to Motion, filed by Pedro J. Rossello-Gonzalez, Jose De-Leon, The Commonwealth of Puerto Rico, Carmen Feliciano-de-Melecio Signed by Judge Gustavo A. Gelpi on 11/2/10.(sm) (Entered: 11/02/2010)"
        },
        {
          "row_number": 60,
          "id": 8975107,
          "entry_number": "1052",
          "date_filed": "2010-11-08T00:00:00-05:00",
          "attachments": null,
          "url": "https://www.courtlistener.com/docket/6672519/1052/united-states-v-commonwealth-of-pr/",
          "recap_pdf_url": null,
          "pacer_doc_id": null,
          "description": "ORDER: The Clerk of Court shall issue payment to Dr Mc Gee, Court Monitor for all outstanding invoices. Payments shall not include any deductions. Dr. McGee is hereby ordered to comply with all local and federal tax obligations. Any previous order and/or portion thereof inconsistent with this order is hereby vacated. The court further notes that presently there are insufficient funds to cover for all pending and approved invoices. The court shall subsequently enter an appropriate order to said effect. Signed by Judge Gustavo A. Gelpi on 11/8/10.(sm) (Entered: 11/08/2010)"
        },
        {
          "row_number": 61,
          "id": 8975108,
          "entry_number": "1053",
          "date_filed": "2010-11-10T00:00:00-05:00",
          "attachments": null,
          "url": "https://www.courtlistener.com/docket/6672519/1053/united-states-v-commonwealth-of-pr/",
          "recap_pdf_url": null,
          "pacer_doc_id": "15902768107",
          "description": "Transcript of Further Status Conference held on 10/21/2010, before Judge Gustavo A. Gelpi. Court Reporter Vicki Eastvold, Telephone number 787-772-3478. NOTICE RE REDACTION OF TRANSCRIPTS: The parties have seven (7) calendar days to file with the Court a Notice of Intent to Request Redaction of this transcript. If no such Notice is filed, the transcript will be available electronically to the public without redaction after 90 calendar days. The policy is located at www.prd.uscourts.gov. Transcript may be viewed at the court public terminal or purchased through the Court Reporter before the deadline for Release of Transcript Restriction. After that date it may be obtained through PACER.. Redaction Request due 12/2/2010. Redacted Transcript Deadline set for 12/13/2010. Release of Transcript Restriction set for 2/8/2011. (Eastvold, Vicki) (Entered: 11/10/2010)"
        },
        {
          "row_number": 62,
          "id": 8975109,
          "entry_number": "1054",
          "date_filed": "2010-11-16T00:00:00-05:00",
          "attachments": null,
          "url": "https://www.courtlistener.com/docket/6672519/1054/united-states-v-commonwealth-of-pr/",
          "recap_pdf_url": null,
          "pacer_doc_id": "15902774886",
          "description": "INFORMATIVE Motion regarding Placement of Participants of the Mental Retardation Program filed by Sheila J. Torres-Delgado on behalf of All Defendants (Torres-Delgado, Sheila) Modified on 11/17/2010 to edit dkt (er). (Entered: 11/16/2010)"
        },
        {
          "row_number": 64,
          "id": 8975111,
          "entry_number": "1056",
          "date_filed": "2010-11-16T00:00:00-05:00",
          "attachments": null,
          "url": "https://www.courtlistener.com/docket/6672519/1056/united-states-v-commonwealth-of-pr/",
          "recap_pdf_url": null,
          "pacer_doc_id": "15902775496",
          "description": "**CASE PARTICIPANTS** MOTION to Deposit Funds filed by Wandymar Burgos-Vargas on behalf of Department of Justice - Commonwealth of P.R. (Attachments: # 1 Exhibit)(Burgos-Vargas, Wandymar) (Entered: 11/16/2010)"
        },
        {
          "row_number": 65,
          "id": 8975112,
          "entry_number": "1057",
          "date_filed": "2010-11-16T00:00:00-05:00",
          "attachments": null,
          "url": "https://www.courtlistener.com/docket/6672519/1057/united-states-v-commonwealth-of-pr/",
          "recap_pdf_url": null,
          "pacer_doc_id": null,
          "description": "ORDER noted 1056 Motion to Deposit Funds Signed by Judge Gustavo A. Gelpi on 11/16/10. (sm) (Entered: 11/16/2010)"
        },
        {
          "row_number": 67,
          "id": 8975114,
          "entry_number": "1059",
          "date_filed": "2010-11-16T00:00:00-05:00",
          "attachments": null,
          "url": "https://www.courtlistener.com/docket/6672519/1059/united-states-v-commonwealth-of-pr/",
          "recap_pdf_url": null,
          "pacer_doc_id": null,
          "description": "ORDER noted 1055 Motion to Amend/Correct Signed by Judge Gustavo A. Gelpi on 11/16/10. (sm) (Entered: 11/16/2010)"
        },
        {
          "row_number": 69,
          "id": 8975115,
          "entry_number": "1060",
          "date_filed": "2010-11-16T00:00:00-05:00",
          "attachments": null,
          "url": "https://www.courtlistener.com/docket/6672519/1060/united-states-v-commonwealth-of-pr/",
          "recap_pdf_url": null,
          "pacer_doc_id": "15902776622",
          "description": "Emergency MOTION requesting Order - Leave to Allow Certain Employees of the Mental Retardation Program to Receive Benefits Under Act 70 of 2010 filed by Sheila J. Torres-Delgado on behalf of All Defendants (Attachments: # 1 Exhibit 1a, # 2 Exhibit 1b)(Torres-Delgado, Sheila) (Entered: 11/16/2010)"
        },
        {
          "row_number": 72,
          "id": 8975119,
          "entry_number": "1063",
          "date_filed": "2010-11-29T00:00:00-05:00",
          "attachments": null,
          "url": "https://www.courtlistener.com/docket/6672519/1063/united-states-v-commonwealth-of-pr/",
          "recap_pdf_url": null,
          "pacer_doc_id": "15902787754",
          "description": "Certificate of Service filed by USA Re: 1060 Emergency MOTION requesting Order Leave to Allow Certain Employees of the Mental Retardation Program to Receive Benefits Under Act 70 of 2010 filed by Pedro J. Rossello-Gonzalez, Jose De-Leon, The Commonwealth of Puerto Rico, Carmen Feliciano-de-Melecio filed by USA. (Farano, Richard) Modified on 11/30/2010 to edit dkt (er). (Entered: 11/29/2010)"
        },
        {
          "row_number": 73,
          "id": 8975120,
          "entry_number": "1064",
          "date_filed": "2010-12-01T00:00:00-05:00",
          "attachments": null,
          "url": "https://www.courtlistener.com/docket/6672519/1064/united-states-v-commonwealth-of-pr/",
          "recap_pdf_url": null,
          "pacer_doc_id": "15902792536",
          "description": "RESPONSE to Motion Regarding the Commonwealth's Proposed Work Plan filed by USA Re: 1028 INFORMATIVE Motion regarding Submittal of Work Plan filed by Pedro J. Rossello-Gonzalez, Jose De-Leon, The Commonwealth of Puerto Rico, Department of Justice - Commonwealth of P.R., Carmen Feliciano-de-Melecio filed by USA. (Farano, Richard) (Entered: 12/01/2010)"
        },
        {
          "row_number": 75,
          "id": 8975122,
          "entry_number": "1066",
          "date_filed": "2010-12-10T00:00:00-05:00",
          "attachments": null,
          "url": "https://www.courtlistener.com/docket/6672519/1066/united-states-v-commonwealth-of-pr/",
          "recap_pdf_url": null,
          "pacer_doc_id": "15902805964",
          "description": "INFORMATIVE Motion regarding relocation to a school that does not have adequate facilities to incapcitated students filed by Asociacion de Padres del Centro de Desarrollo Habilitativo de Cayey, Bayamon, Ponce, Aibonito and others, pro se. (Attachments: # 1 Envelope)(er) (Entered: 12/13/2010)"
        },
        {
          "row_number": 76,
          "id": 8975123,
          "entry_number": "1067",
          "date_filed": "2010-12-13T00:00:00-05:00",
          "attachments": null,
          "url": "https://www.courtlistener.com/docket/6672519/1067/united-states-v-commonwealth-of-pr/",
          "recap_pdf_url": null,
          "pacer_doc_id": null,
          "description": "ORDER noted 1066 INFORMATIVE motion. Parties and Dr. McGee to review letter, and will be discussed to the extent it impacts agreements reached in this case. Signed by Judge Gustavo A. Gelpi on 12/13/10. (AH) (Entered: 12/13/2010)"
        },
        {
          "row_number": 77,
          "id": 8975125,
          "entry_number": "1068",
          "date_filed": "2010-12-16T00:00:00-05:00",
          "attachments": null,
          "url": "https://www.courtlistener.com/docket/6672519/1068/united-states-v-commonwealth-of-pr/",
          "recap_pdf_url": null,
          "pacer_doc_id": "15902811772",
          "description": "TIME SHEET of the Assistant to the JCC, Sylvia M. Fernandez-Colorado, Ph.D. for services rendered during the month of November 2010. (Suggestions in opposition/response due by 12/22/2010) (er) (Entered: 12/16/2010)"
        },
        {
          "row_number": 80,
          "id": 8975127,
          "entry_number": "1070",
          "date_filed": "2010-12-16T00:00:00-05:00",
          "attachments": null,
          "url": "https://www.courtlistener.com/docket/6672519/1070/united-states-v-commonwealth-of-pr/",
          "recap_pdf_url": null,
          "pacer_doc_id": "15902812110",
          "description": "STATUS REPORT Binder by The Commonwealth of Puerto Rico dated 12/16/10. (cr) (Entered: 12/16/2010)"
        },
        {
          "row_number": 81,
          "id": 8975128,
          "entry_number": "1071",
          "date_filed": "2010-12-16T00:00:00-05:00",
          "attachments": null,
          "url": "https://www.courtlistener.com/docket/6672519/1071/united-states-v-commonwealth-of-pr/",
          "recap_pdf_url": null,
          "pacer_doc_id": null,
          "description": "Minute Entry for proceedings held before Judge Gustavo A. Gelpi: Further Status Conference held on 12/16/2010. The Court Reporter shall file the transcript of this conference for the record and all counsel shall have access. The Commonwealth of Puerto Rico shall deposit with the Clerk of Court the amount of $50,000.00 by January 20, 2011. This amount will be use for payment of Dr. McGee's October, November and December 2010 invoices as well as Dr. Fernandez's November and December 2010 invoices. If there is any remaining funds they will be used to cover any January and February 2011 invoices. This deadline is final. No extensions will be granted. Further Status Conference set for 2/3/2011 09:00 AM in Courtroom 5 before Judge Gustavo A. Gelpi.(Court Reporter Vicki Eastvold.)Present: On behalf of plaintiff atty. Richard J. Farano. On behalf of defendants attorney Sheila Torres. Also present Court Monitor, Dr. John McGee and Dr. Sylvia M. Fernandez. (cr) (Entered: 12/16/2010)"
        },
        {
          "row_number": 83,
          "id": 8975129,
          "entry_number": "1073",
          "date_filed": "2010-12-17T00:00:00-05:00",
          "attachments": null,
          "url": "https://www.courtlistener.com/docket/6672519/1073/united-states-v-commonwealth-of-pr/",
          "recap_pdf_url": null,
          "pacer_doc_id": null,
          "description": "ORDER noted 1072 Motion requesting Order. Signed by Judge Gustavo A. Gelpi on 12/17/10. (cr) (Entered: 12/17/2010)"
        },
        {
          "row_number": 85,
          "id": 8975131,
          "entry_number": "1075",
          "date_filed": "2011-01-13T00:00:00-05:00",
          "attachments": null,
          "url": "https://www.courtlistener.com/docket/6672519/1075/united-states-v-commonwealth-of-pr/",
          "recap_pdf_url": null,
          "pacer_doc_id": "15902840271",
          "description": "MOTION to Deposit Funds filed by Wandymar Burgos-Vargas on behalf of Department of Justice - Commonwealth of P.R. (Burgos-Vargas, Wandymar) (Entered: 01/13/2011)"
        },
        {
          "row_number": 86,
          "id": 8975132,
          "entry_number": "1076",
          "date_filed": "2011-01-13T00:00:00-05:00",
          "attachments": null,
          "url": "https://www.courtlistener.com/docket/6672519/1076/united-states-v-commonwealth-of-pr/",
          "recap_pdf_url": null,
          "pacer_doc_id": null,
          "description": "ORDER noted 1075 Motion to Deposit Funds. Signed by Judge Gustavo A. Gelpi on 1/13/11. (AH) (Entered: 01/13/2011)"
        },
        {
          "row_number": 87,
          "id": 8975133,
          "entry_number": "1077",
          "date_filed": "2011-01-13T00:00:00-05:00",
          "attachments": null,
          "url": "https://www.courtlistener.com/docket/6672519/1077/united-states-v-commonwealth-of-pr/",
          "recap_pdf_url": null,
          "pacer_doc_id": "15902841133",
          "description": "***EX-PARTE*** INFORMATIVE Motion regarding Status Conference to be held February 3, 2011 filed by Sheila J. Torres-Delgado on behalf of Department of Justice - Commonwealth of P.R. (Torres-Delgado, Sheila) (Entered: 01/13/2011)"
        },
        {
          "row_number": 3184,
          "id": 8975134,
          "entry_number": null,
          "date_filed": "2011-01-14T00:00:00-05:00",
          "attachments": null,
          "url": "https://www.courtlistener.com",
          "recap_pdf_url": null,
          "pacer_doc_id": null,
          "description": "DEPOSIT of Funds in the amount of $ SEALED, receipt number PRX100003691. (RE: dkt.1075). Deposited ((NEXT WORKING DAY)) in an Interest Bearing Account in compliance with L.R.67. **FUNDS WILL BE AVAILABLE FOR DISBURSEMENT WITHIN 7 WORKING DAYS**. (jla)"
        },
        {
          "row_number": 88,
          "id": 8975135,
          "entry_number": "1078",
          "date_filed": "2011-01-14T00:00:00-05:00",
          "attachments": null,
          "url": "https://www.courtlistener.com/docket/6672519/1078/united-states-v-commonwealth-of-pr/",
          "recap_pdf_url": null,
          "pacer_doc_id": "15902842085",
          "description": "***EX PARTE***ORDER noted 1077 INFORMATIVE motion. Signed by Judge Gustavo A. Gelpi on 1/14/11. (cr) (Entered: 01/14/2011)"
        },
        {
          "row_number": 89,
          "id": 8975136,
          "entry_number": "1079",
          "date_filed": "2011-01-14T00:00:00-05:00",
          "attachments": null,
          "url": "https://www.courtlistener.com/docket/6672519/1079/united-states-v-commonwealth-of-pr/",
          "recap_pdf_url": null,
          "pacer_doc_id": null,
          "description": "ORDER : Dr Mc Gee has submitted his invoices for the months of October, November and December 2010, and Dr Fernandez has submitted hers for the month of December 2010 (her November 2010 one was approved). The Defendant shall on or before Thursday, January 20, 2011 at noon, inform of any objection(s) thereto. Signed by Judge Gustavo A. Gelpi on 1/14/11.(Gelpi, Gustavo) (Entered: 01/14/2011)"
        },
        {
          "row_number": 91,
          "id": 8975137,
          "entry_number": "1080",
          "date_filed": "2011-01-19T00:00:00-05:00",
          "attachments": null,
          "url": "https://www.courtlistener.com/docket/6672519/1080/united-states-v-commonwealth-of-pr/",
          "recap_pdf_url": null,
          "pacer_doc_id": "15902847524",
          "description": "INFORMATIVE Motion regarding the Mental Retardation Program filed by Sheila J. Torres-Delgado on behalf of Jose De-Leon, Department of Justice - Commonwealth of P.R., Carmen Feliciano-de-Melecio, Pedro J. Rossello-Gonzalez, The Commonwealth of Puerto Rico (Torres-Delgado, Sheila) (Entered: 01/19/2011)"
        },
        {
          "row_number": 93,
          "id": 8975139,
          "entry_number": "1082",
          "date_filed": "2011-01-21T00:00:00-05:00",
          "attachments": null,
          "url": "https://www.courtlistener.com/docket/6672519/1082/united-states-v-commonwealth-of-pr/",
          "recap_pdf_url": null,
          "pacer_doc_id": "15902850575",
          "description": "MOTION Submitting Invoice for Services Rendered by the Joint Compliance Coordinator Month of October 2010 filed by John J. McGee (cr) (Entered: 01/21/2011)"
        },
        {
          "row_number": 97,
          "id": 8975143,
          "entry_number": "1086",
          "date_filed": "2011-01-21T00:00:00-05:00",
          "attachments": null,
          "url": "https://www.courtlistener.com/docket/6672519/1086/united-states-v-commonwealth-of-pr/",
          "recap_pdf_url": null,
          "pacer_doc_id": null,
          "description": "ORDER granting 1082 Motion submitting Invoice of October 2010. Dr. McGee shall be responsible for complying with all tax obligations. Signed by Judge Gustavo A. Gelpi on 1/21/11. (cr) (Entered: 01/21/2011)"
        },
        {
          "row_number": 98,
          "id": 8975144,
          "entry_number": "1087",
          "date_filed": "2011-01-21T00:00:00-05:00",
          "attachments": null,
          "url": "https://www.courtlistener.com/docket/6672519/1087/united-states-v-commonwealth-of-pr/",
          "recap_pdf_url": null,
          "pacer_doc_id": null,
          "description": "ORDER granting 1083 Motion submitting Invoice of November 2010. Dr. McGee shall be responsible for complying with all tax obligations. Signed by Judge Gustavo A. Gelpi on 1/21/11. (cr) (Entered: 01/21/2011)"
        },
        {
          "row_number": 99,
          "id": 8975145,
          "entry_number": "1088",
          "date_filed": "2011-01-21T00:00:00-05:00",
          "attachments": null,
          "url": "https://www.courtlistener.com/docket/6672519/1088/united-states-v-commonwealth-of-pr/",
          "recap_pdf_url": null,
          "pacer_doc_id": null,
          "description": "ORDER granting 1084 Motion submitting Invoice of December 2010. Dr. McGee shall be responsible for complying with all tax obligations. Signed by Judge Gustavo A. Gelpi on 1/21/11. (cr) (Entered: 01/21/2011)"
        },
        {
          "row_number": 100,
          "id": 8975146,
          "entry_number": "1089",
          "date_filed": "2011-01-21T00:00:00-05:00",
          "attachments": null,
          "url": "https://www.courtlistener.com/docket/6672519/1089/united-states-v-commonwealth-of-pr/",
          "recap_pdf_url": null,
          "pacer_doc_id": null,
          "description": "ORDER granting 1085 Motion submitting Invoice of December 2010. Dr. Fernandez shall be responsible for complying with all tax obligations. Signed by Judge Gustavo A. Gelpi on 1/21/11. (cr) (Entered: 01/21/2011)"
        },
        {
          "row_number": 102,
          "id": 8975147,
          "entry_number": "1090",
          "date_filed": "2011-01-26T00:00:00-05:00",
          "attachments": null,
          "url": "https://www.courtlistener.com/docket/6672519/1090/united-states-v-commonwealth-of-pr/",
          "recap_pdf_url": null,
          "pacer_doc_id": "15902856714",
          "description": "**CASE PARTICIPANTS** MOTION Submitting Proposed Agenda filed by Sheila J. Torres-Delgado on behalf of Jose De-Leon, Department of Justice - Commonwealth of P.R., Carmen Feliciano-de-Melecio, Pedro J. Rossello-Gonzalez, The Commonwealth of Puerto Rico, USA (Attachments: # 1 Proposed Agenda)(Torres-Delgado, Sheila) (Entered: 01/26/2011)"
        },
        {
          "row_number": 103,
          "id": 8975148,
          "entry_number": "1091",
          "date_filed": "2011-01-26T00:00:00-05:00",
          "attachments": null,
          "url": "https://www.courtlistener.com/docket/6672519/1091/united-states-v-commonwealth-of-pr/",
          "recap_pdf_url": null,
          "pacer_doc_id": null,
          "description": "ORDER noted 1090 Motion submitting Proposed Agenda. Parties to discuss with Dr. McGee prior to meeting any additional suggested matters that should be included. Signed by Judge Gustavo A. Gelpi on 1/26/11. (AH) (Entered: 01/26/2011)"
        },
        {
          "row_number": 104,
          "id": 8975149,
          "entry_number": "1092",
          "date_filed": "2011-02-01T00:00:00-05:00",
          "attachments": null,
          "url": "https://www.courtlistener.com/docket/6672519/1092/united-states-v-commonwealth-of-pr/",
          "recap_pdf_url": null,
          "pacer_doc_id": "15902865421",
          "description": "INFORMATIVE Motion regarding the difficult situation of the program filed by Asociacion de Padres del Centro de Desarrollo Habilitativo de Cayey, Bayamon, Ponce, Aibonito and others, Pro se, pages 2-4 in the Spanish language. (er) (Entered: 02/01/2011)"
        },
        {
          "row_number": 105,
          "id": 8975150,
          "entry_number": "1093",
          "date_filed": "2011-02-01T00:00:00-05:00",
          "attachments": null,
          "url": "https://www.courtlistener.com/docket/6672519/1093/united-states-v-commonwealth-of-pr/",
          "recap_pdf_url": null,
          "pacer_doc_id": null,
          "description": "ORDER noted 1092 INFORMATIVE motion. The court monitor shall review. Signed by Judge Gustavo A. Gelpi on 2/1/11. (AH) (Entered: 02/01/2011)"
        },
        {
          "row_number": 106,
          "id": 8975151,
          "entry_number": "1094",
          "date_filed": "2011-02-03T00:00:00-05:00",
          "attachments": null,
          "url": "https://www.courtlistener.com/docket/6672519/1094/united-states-v-commonwealth-of-pr/",
          "recap_pdf_url": null,
          "pacer_doc_id": "15902879726",
          "description": "***SELECTED PARTIES***Minute Entry for proceedings held before Judge Gustavo A. Gelpi: Further Status Conference held on 2/3/2011. (cr) (Entered: 02/10/2011)"
        },
        {
          "row_number": 107,
          "id": 8975152,
          "entry_number": "1095",
          "date_filed": "2011-02-03T00:00:00-05:00",
          "attachments": null,
          "url": "https://www.courtlistener.com/docket/6672519/1095/united-states-v-commonwealth-of-pr/",
          "recap_pdf_url": null,
          "pacer_doc_id": "15902879757",
          "description": "MOTION Submitting Invoice for services rendered by the assistant to the Joint Compliance Coordinator, Sylvia Fernandez, Ph.D., for the Month of January 2011 filed by Joint Compliance Coordinator John J. McGee (cr) (Entered: 02/10/2011)"
        },
        {
          "row_number": 108,
          "id": 8975153,
          "entry_number": "1096",
          "date_filed": "2011-02-03T00:00:00-05:00",
          "attachments": null,
          "url": "https://www.courtlistener.com/docket/6672519/1096/united-states-v-commonwealth-of-pr/",
          "recap_pdf_url": null,
          "pacer_doc_id": "15902879765",
          "description": "STATUS REPORT BINDER filed by The Commonwealth of Puerto Rico on 2/3/11. (cr) (Entered: 02/10/2011)"
        },
        {
          "row_number": 109,
          "id": 8975154,
          "entry_number": "1097",
          "date_filed": "2011-02-11T00:00:00-05:00",
          "attachments": null,
          "url": "https://www.courtlistener.com/docket/6672519/1097/united-states-v-commonwealth-of-pr/",
          "recap_pdf_url": null,
          "pacer_doc_id": null,
          "description": "ORDER noted 1095 Motion submitting invoice for services rendered. Any objections to be lodged no later than Wednesday, February 16, 2011. Signed by Judge Gustavo A. Gelpi on 2/11/11. (AH) (Entered: 02/11/2011)"
        },
        {
          "row_number": 110,
          "id": 8975155,
          "entry_number": "1098",
          "date_filed": "2011-02-23T00:00:00-05:00",
          "attachments": null,
          "url": "https://www.courtlistener.com/docket/6672519/1098/united-states-v-commonwealth-of-pr/",
          "recap_pdf_url": null,
          "pacer_doc_id": null,
          "description": "ORDER GRANTING 1068 TIME SHEET of the Assistant to the JCC, Sylvia M. Fernandez-Colorado, Ph.D. for services rendered during the month of November 2010. Signed by Judge Gustavo A. Gelpi on 2/23/11.(cr) (Entered: 02/23/2011)"
        },
        {
          "row_number": 111,
          "id": 8975156,
          "entry_number": "1099",
          "date_filed": "2011-02-24T00:00:00-05:00",
          "attachments": null,
          "url": "https://www.courtlistener.com/docket/6672519/1099/united-states-v-commonwealth-of-pr/",
          "recap_pdf_url": null,
          "pacer_doc_id": null,
          "description": "ORDER. Status Conference set for 4/27/2011 04:30 PM in Courtroom 5 before Judge Gustavo A. Gelpi. Signed by Judge Gustavo A. Gelpi on 2/24/11.(cr) (Entered: 02/24/2011)"
        },
        {
          "row_number": 115,
          "id": 8975158,
          "entry_number": "1101",
          "date_filed": "2011-03-04T00:00:00-05:00",
          "attachments": null,
          "url": "https://www.courtlistener.com/docket/6672519/1101/united-states-v-commonwealth-of-pr/",
          "recap_pdf_url": null,
          "pacer_doc_id": "15902909074",
          "description": "MOTION to Deposit Funds filed by Wandymar Burgos-Vargas on behalf of Department of Justice - Commonwealth of P.R. (Burgos-Vargas, Wandymar) (Entered: 03/04/2011)"
        },
        {
          "row_number": 116,
          "id": 8975159,
          "entry_number": "1102",
          "date_filed": "2011-03-07T00:00:00-05:00",
          "attachments": null,
          "url": "https://www.courtlistener.com/docket/6672519/1102/united-states-v-commonwealth-of-pr/",
          "recap_pdf_url": null,
          "pacer_doc_id": null,
          "description": "ORDER granting 1101 Motion to Deposit Funds. Signed by Judge Gustavo A. Gelpi on 3/7/11. (SAA) (Entered: 03/07/2011)"
        },
        {
          "row_number": 117,
          "id": 8975161,
          "entry_number": "1103",
          "date_filed": "2011-03-08T00:00:00-05:00",
          "attachments": null,
          "url": "https://www.courtlistener.com/docket/6672519/1103/united-states-v-commonwealth-of-pr/",
          "recap_pdf_url": null,
          "pacer_doc_id": null,
          "description": "ORDER Noted and Approved 1100 Motion submitting invoice for Services rendered by the Joint Compliance Coordinador for the month of January 2011 filed by John J. McGee, Ph.D. Signed by Judge Gustavo A. Gelpi on 3/8/11. (cr) (Entered: 03/08/2011)"
        },
        {
          "row_number": 118,
          "id": 8975162,
          "entry_number": "1104",
          "date_filed": "2011-03-09T00:00:00-05:00",
          "attachments": null,
          "url": "https://www.courtlistener.com/docket/6672519/1104/united-states-v-commonwealth-of-pr/",
          "recap_pdf_url": null,
          "pacer_doc_id": null,
          "description": "ORDER granting 1095 MOTION Submitting Invoice filed by John J. McGee. Signed by Judge Gustavo A. Gelpi on 3/9/11.(cr) (Entered: 03/09/2011)"
        },
        {
          "row_number": 120,
          "id": 8975164,
          "entry_number": "1106",
          "date_filed": "2011-03-16T00:00:00-04:00",
          "attachments": null,
          "url": "https://www.courtlistener.com/docket/6672519/1106/united-states-v-commonwealth-of-pr/",
          "recap_pdf_url": null,
          "pacer_doc_id": null,
          "description": "ORDER noted 1105 INFORMATIVE motion regarding Mental Retardation Program. Signed by Judge Gustavo A. Gelpi on 3/16/11. (AH) (Entered: 03/16/2011)"
        },
        {
          "row_number": 121,
          "id": 8975165,
          "entry_number": "1107",
          "date_filed": "2011-03-29T00:00:00-04:00",
          "attachments": null,
          "url": "https://www.courtlistener.com/docket/6672519/1107/united-states-v-commonwealth-of-pr/",
          "recap_pdf_url": null,
          "pacer_doc_id": "15902942730",
          "description": "MOTION Submitting Invoice for services rendered by the assistant to the Joint Compliance Coordinator, Sylvia Fernandez, Ph.D., for the Month of February 2011 filed by Joint Compliance Coordinator John J. McGee. (cr) (Entered: 03/29/2011)"
        },
        {
          "row_number": 122,
          "id": 8975166,
          "entry_number": "1108",
          "date_filed": "2011-03-29T00:00:00-04:00",
          "attachments": null,
          "url": "https://www.courtlistener.com/docket/6672519/1108/united-states-v-commonwealth-of-pr/",
          "recap_pdf_url": null,
          "pacer_doc_id": null,
          "description": "ORDER granting 1107 MOTION Submitting Invoice for services rendered by the assistant to the Joint Compliance Coordinator, Sylvia Fernandez, Ph.D., for the Month of February 2011 filed by Joint Compliance Coordinator John J. McGee. Signed by Judge Gustavo A. Gelpi on 3/29/11.(cr) Modified on 3/30/2011 as to title of link (er). (Entered: 03/29/2011)"
        },
        {
          "row_number": 123,
          "id": 8975167,
          "entry_number": "1109",
          "date_filed": "2011-03-29T00:00:00-04:00",
          "attachments": null,
          "url": "https://www.courtlistener.com/docket/6672519/1109/united-states-v-commonwealth-of-pr/",
          "recap_pdf_url": null,
          "pacer_doc_id": null,
          "description": "ORDER terminating 1107 Motion submitting invoice. See docket 1108. Signed by Judge Gustavo A. Gelpi on 3/29/11. (cr) (Entered: 03/29/2011)"
        },
        {
          "row_number": 125,
          "id": 8975168,
          "entry_number": "1110",
          "date_filed": "2011-04-13T00:00:00-04:00",
          "attachments": null,
          "url": "https://www.courtlistener.com/docket/6672519/1110/united-states-v-commonwealth-of-pr/",
          "recap_pdf_url": null,
          "pacer_doc_id": "15902963903",
          "description": "INFORMATIVE Motion regarding Consolidation of Ponce and Juana Diaz Habilitative Development Centers filed by Sheila J. Torres-Delgado on behalf of Jose De-Leon, Department of Justice - Commonwealth of P.R., Carmen Feliciano-de-Melecio (Attachments: # 1 Exhibit Notice of Consolidation and Action Plan)(Torres-Delgado, Sheila) (Entered: 04/13/2011)"
        },
        {
          "row_number": 126,
          "id": 8975169,
          "entry_number": "1111",
          "date_filed": "2011-04-13T00:00:00-04:00",
          "attachments": null,
          "url": "https://www.courtlistener.com/docket/6672519/1111/united-states-v-commonwealth-of-pr/",
          "recap_pdf_url": null,
          "pacer_doc_id": "15902963916",
          "description": "MOTION for Leave to File Spanish language documents filed by Sheila J. Torres-Delgado on behalf of Jose De-Leon, Department of Justice - Commonwealth of P.R., Carmen Feliciano-de-Melecio (Torres-Delgado, Sheila) (Entered: 04/13/2011)"
        },
        {
          "row_number": 128,
          "id": 8975171,
          "entry_number": "1113",
          "date_filed": "2011-04-13T00:00:00-04:00",
          "attachments": null,
          "url": "https://www.courtlistener.com/docket/6672519/1113/united-states-v-commonwealth-of-pr/",
          "recap_pdf_url": null,
          "pacer_doc_id": null,
          "description": "ORDER granting 1111 Motion for Leave to File Spanish language documents. Translations to be filed within 30 days. Signed by Judge Gustavo A. Gelpi on 4/13/11. (AH) (Entered: 04/13/2011)"
        },
        {
          "row_number": 129,
          "id": 8975172,
          "entry_number": "1114",
          "date_filed": "2011-04-20T00:00:00-04:00",
          "attachments": null,
          "url": "https://www.courtlistener.com/docket/6672519/1114/united-states-v-commonwealth-of-pr/",
          "recap_pdf_url": null,
          "pacer_doc_id": "15902973805",
          "description": "MOTION requesting Order to investigate the death of a participant of the Mental Retardation Program filed by Concepcion Torres, Pro se, (pages 2-4 in the Spanish language). (er) (Entered: 04/21/2011)"
        },
        {
          "row_number": 130,
          "id": 8975173,
          "entry_number": "1115",
          "date_filed": "2011-04-25T00:00:00-04:00",
          "attachments": null,
          "url": "https://www.courtlistener.com/docket/6672519/1115/united-states-v-commonwealth-of-pr/",
          "recap_pdf_url": null,
          "pacer_doc_id": null,
          "description": "ORDER. Status Conference RESET for 4/27/2011 01:30 PM in Courtroom 5 before Judge Gustavo A. Gelpi. Signed by Judge Gustavo A. Gelpi on 4/25/11.(cr) (Entered: 04/25/2011)"
        },
        {
          "row_number": 132,
          "id": 8975175,
          "entry_number": "1117",
          "date_filed": "2011-04-27T00:00:00-04:00",
          "attachments": null,
          "url": "https://www.courtlistener.com/docket/6672519/1117/united-states-v-commonwealth-of-pr/",
          "recap_pdf_url": null,
          "pacer_doc_id": "15902980164",
          "description": "Minute Entry for proceedings held before Judge Gustavo A. Gelpi: Status Conference held on 4/27/2011. Further Status Conference set for 7/14/2011 09:00 AM in Courtroom 5 before Judge Gustavo A. Gelpi. (cr) (Entered: 04/27/2011)"
        },
        {
          "row_number": 133,
          "id": 8975176,
          "entry_number": "1118",
          "date_filed": "2011-04-27T00:00:00-04:00",
          "attachments": null,
          "url": "https://www.courtlistener.com/docket/6672519/1118/united-states-v-commonwealth-of-pr/",
          "recap_pdf_url": null,
          "pacer_doc_id": "15902980171",
          "description": "REPORT BINDER by The Commonwealth of Puerto Rico. (cr) (Entered: 04/27/2011)"
        },
        {
          "row_number": 134,
          "id": 8975177,
          "entry_number": "1119",
          "date_filed": "2011-05-04T00:00:00-04:00",
          "attachments": null,
          "url": "https://www.courtlistener.com/docket/6672519/1119/united-states-v-commonwealth-of-pr/",
          "recap_pdf_url": null,
          "pacer_doc_id": "15902988157",
          "description": "MOTION Submitting Invoice for Services Rendered by the Assistant to the Joint Compliance Coordinator, Dr. Sylvia Fernandez Month of April 2011 filed by Joint Compliance Coordinator John J. McGee. (cr) (Entered: 05/04/2011)"
        },
        {
          "row_number": 136,
          "id": 8975178,
          "entry_number": "1120",
          "date_filed": "2011-05-10T00:00:00-04:00",
          "attachments": null,
          "url": "https://www.courtlistener.com/docket/6672519/1120/united-states-v-commonwealth-of-pr/",
          "recap_pdf_url": null,
          "pacer_doc_id": null,
          "description": "ORDER granting 1119 Motion submitting Invoice for Services Rendered by the Assistant to the Joint Compliance Coordinator, Dr. Sylvia Fernandez Month of April 2011. Signed by Judge Gustavo A. Gelpi on 5/10/11. (cr) (Entered: 05/10/2011)"
        },
        {
          "row_number": 137,
          "id": 8975179,
          "entry_number": "1121",
          "date_filed": "2011-05-10T00:00:00-04:00",
          "attachments": null,
          "url": "https://www.courtlistener.com/docket/6672519/1121/united-states-v-commonwealth-of-pr/",
          "recap_pdf_url": null,
          "pacer_doc_id": "15902995531",
          "description": "MOTION Submitting Invoice for Services Rendered by the Assistant to the Joint Compliance Coordinator, Dr. Sylvia Fernandez Month of March 2011 filed by Joint Compliance Coordinator John J. McGee. (cr) (Entered: 05/10/2011)"
        },
        {
          "row_number": 138,
          "id": 8975180,
          "entry_number": "1122",
          "date_filed": "2011-05-10T00:00:00-04:00",
          "attachments": null,
          "url": "https://www.courtlistener.com/docket/6672519/1122/united-states-v-commonwealth-of-pr/",
          "recap_pdf_url": null,
          "pacer_doc_id": null,
          "description": "ORDER granting 1121 Motion submitting Invoice for Services Rendered by the Assistant to the Joint Compliance Coordinator, Dr. Sylvia Fernandez Month of March 2011 filed by Joint Compliance Coordinator John J. McGee. Signed by Judge Gustavo A. Gelpi on 5/10/11. (cr) (Entered: 05/10/2011)"
        },
        {
          "row_number": 140,
          "id": 8975182,
          "entry_number": "1124",
          "date_filed": "2011-05-10T00:00:00-04:00",
          "attachments": null,
          "url": "https://www.courtlistener.com/docket/6672519/1124/united-states-v-commonwealth-of-pr/",
          "recap_pdf_url": null,
          "pacer_doc_id": "15902996626",
          "description": "MOTION Submitting Invoice for Services rendered by the Joint Compliance Coordinador for the month of February 2011 filed by John J. McGee, Ph.D. (cr) (Entered: 05/10/2011)"
        },
        {
          "row_number": 141,
          "id": 8975183,
          "entry_number": "1125",
          "date_filed": "2011-05-10T00:00:00-04:00",
          "attachments": null,
          "url": "https://www.courtlistener.com/docket/6672519/1125/united-states-v-commonwealth-of-pr/",
          "recap_pdf_url": null,
          "pacer_doc_id": "15902996632",
          "description": "MOTION Submitting Invoice for Services rendered by the Joint Compliance Coordinador for the month of March 2011 filed by John J. McGee, Ph.D. (cr) (Entered: 05/10/2011)"
        },
        {
          "row_number": 143,
          "id": 8975185,
          "entry_number": "1127",
          "date_filed": "2011-05-11T00:00:00-04:00",
          "attachments": null,
          "url": "https://www.courtlistener.com/docket/6672519/1127/united-states-v-commonwealth-of-pr/",
          "recap_pdf_url": null,
          "pacer_doc_id": "15902997831",
          "description": "ORDER for defendants to deposit funds with the Clerk of Court. Signed by Judge Gustavo A. Gelpi on 5/11/11.(cr) (Entered: 05/11/2011)"
        },
        {
          "row_number": 144,
          "id": 8975186,
          "entry_number": "1128",
          "date_filed": "2011-05-17T00:00:00-04:00",
          "attachments": null,
          "url": "https://www.courtlistener.com/docket/6672519/1128/united-states-v-commonwealth-of-pr/",
          "recap_pdf_url": null,
          "pacer_doc_id": "15903005463",
          "description": "INFORMATIVE Motion regarding the Mental Retardation Program filed by Sheila J. Torres-Delgado on behalf of Jose De-Leon, Department of Justice - Commonwealth of P.R., Carmen Feliciano-de-Melecio, Pedro J. Rossello-Gonzalez, The Commonwealth of Puerto Rico (Torres-Delgado, Sheila) (Entered: 05/17/2011)"
        },
        {
          "row_number": 145,
          "id": 8975187,
          "entry_number": "1129",
          "date_filed": "2011-05-18T00:00:00-04:00",
          "attachments": null,
          "url": "https://www.courtlistener.com/docket/6672519/1129/united-states-v-commonwealth-of-pr/",
          "recap_pdf_url": null,
          "pacer_doc_id": null,
          "description": "ORDER noted 1128 INFORMATIVE motion. Signed by Judge Gustavo A. Gelpi on 5/18/11. (AH) (Entered: 05/18/2011)"
        },
        {
          "row_number": 147,
          "id": 8975188,
          "entry_number": "1130",
          "date_filed": "2011-05-19T00:00:00-04:00",
          "attachments": null,
          "url": "https://www.courtlistener.com/docket/6672519/1130/united-states-v-commonwealth-of-pr/",
          "recap_pdf_url": null,
          "pacer_doc_id": null,
          "description": "ORDER noted 1123 INFORMATIVE motion regarding Appointment of Physician to the Clinical Evaluation Unit. Signed by Judge Gustavo A. Gelpi on 5/19/11. (AH) (Entered: 05/19/2011)"
        },
        {
          "row_number": 148,
          "id": 8975189,
          "entry_number": "1131",
          "date_filed": "2011-05-24T00:00:00-04:00",
          "attachments": null,
          "url": "https://www.courtlistener.com/docket/6672519/1131/united-states-v-commonwealth-of-pr/",
          "recap_pdf_url": null,
          "pacer_doc_id": null,
          "description": "ORDER granting 1124 Motion submitting Invoice for Services rendered by the Joint Compliance Coordinador for the month of February 2011 filed by John J. McGee, Ph.D. Signed by Judge Gustavo A. Gelpi on 5/24/11. (cr) (Entered: 05/24/2011)"
        },
        {
          "row_number": 149,
          "id": 8975190,
          "entry_number": "1132",
          "date_filed": "2011-05-24T00:00:00-04:00",
          "attachments": null,
          "url": "https://www.courtlistener.com/docket/6672519/1132/united-states-v-commonwealth-of-pr/",
          "recap_pdf_url": null,
          "pacer_doc_id": null,
          "description": "ORDER granting 1125 Motion submitting Invoice for Services rendered by the Joint Compliance Coordinador for the month of March 2011 filed by John J. McGee, Ph.D. Signed by Judge Gustavo A. Gelpi on 5/24/11. (cr) (Entered: 05/24/2011)"
        },
        {
          "row_number": 152,
          "id": 8975193,
          "entry_number": "1135",
          "date_filed": "2011-05-31T00:00:00-04:00",
          "attachments": null,
          "url": "https://www.courtlistener.com/docket/6672519/1135/united-states-v-commonwealth-of-pr/",
          "recap_pdf_url": null,
          "pacer_doc_id": null,
          "description": "ORDER noted 1134 Motion to Deposit Funds. Signed by Judge Gustavo A. Gelpi on 5/31/11. (SAA) (Entered: 05/31/2011)"
        },
        {
          "row_number": 153,
          "id": 8975194,
          "entry_number": "1136",
          "date_filed": "2011-06-02T00:00:00-04:00",
          "attachments": null,
          "url": "https://www.courtlistener.com/docket/6672519/1136/united-states-v-commonwealth-of-pr/",
          "recap_pdf_url": null,
          "pacer_doc_id": "15903026328",
          "description": "***SELECTED PARTIES***NEUROPSYCHOLOGICAL EVALUATION REPORT re: Jeannie S. Castillo-Figueroa. Submitted by Maria T. Margarida-Julia, Psy.D.. (cr) (Entered: 06/02/2011)"
        },
        {
          "row_number": 155,
          "id": 8975196,
          "entry_number": "1138",
          "date_filed": "2011-06-02T00:00:00-04:00",
          "attachments": null,
          "url": "https://www.courtlistener.com/docket/6672519/1138/united-states-v-commonwealth-of-pr/",
          "recap_pdf_url": null,
          "pacer_doc_id": null,
          "description": "ORDER granting 1137 Motion submitting invoice for services rendered by Maria T. Margarida-Julia, Psy.D. Signed by Judge Gustavo A. Gelpi on 6/2/11. (cr) (Entered: 06/02/2011)"
        },
        {
          "row_number": 156,
          "id": 8975197,
          "entry_number": "1139",
          "date_filed": "2011-06-02T00:00:00-04:00",
          "attachments": null,
          "url": "https://www.courtlistener.com/docket/6672519/1139/united-states-v-commonwealth-of-pr/",
          "recap_pdf_url": null,
          "pacer_doc_id": "15903026498",
          "description": "***SELECTED PARTIES***ORDER for defendants to deposit funds with the Clerk of Court. Signed by Judge Gustavo A. Gelpi on 6/2/11.(cr) (Entered: 06/02/2011)"
        },
        {
          "row_number": 3186,
          "id": 8975198,
          "entry_number": null,
          "date_filed": "2011-06-02T00:00:00-04:00",
          "attachments": null,
          "url": "https://www.courtlistener.com",
          "recap_pdf_url": null,
          "pacer_doc_id": null,
          "description": "DEPOSIT of Funds in the amount of $ SEALED, receipt number PRX100006108. (RE:DKT.1134). Deposited ((NEXT WORKING DAY)) in an Interest Bearing Account in compliance with L.R.67. **FUNDS WILL BE AVAILABLE FOR DISBURSEMENT AFTER 6/13/2011** (jla)"
        },
        {
          "row_number": 159,
          "id": 8975200,
          "entry_number": "1141",
          "date_filed": "2011-06-06T00:00:00-04:00",
          "attachments": null,
          "url": "https://www.courtlistener.com/docket/6672519/1141/united-states-v-commonwealth-of-pr/",
          "recap_pdf_url": null,
          "pacer_doc_id": null,
          "description": "ORDER denying 1140 Motion for Reconsideration. Defendants shall comply with the order issued by the Court in docket (1139) due to insufficiency of funds. Signed by Judge Gustavo A. Gelpi on 6/6/11. (cr) (Entered: 06/06/2011)"
        },
        {
          "row_number": 160,
          "id": 8975201,
          "entry_number": "1142",
          "date_filed": "2011-06-07T00:00:00-04:00",
          "attachments": null,
          "url": "https://www.courtlistener.com/docket/6672519/1142/united-states-v-commonwealth-of-pr/",
          "recap_pdf_url": null,
          "pacer_doc_id": "15903032279",
          "description": "MOTION Submitting Invoice for Services Rendered by the Assistant to the Joint Compliance Coordinator, Dr. Sylvia Fernandez during the Month of May 2011 filed by Joint Compliance Coordinator John J. McGee. (cr) (Entered: 06/07/2011)"
        },
        {
          "row_number": 161,
          "id": 8975202,
          "entry_number": "1143",
          "date_filed": "2011-06-15T00:00:00-04:00",
          "attachments": null,
          "url": "https://www.courtlistener.com/docket/6672519/1143/united-states-v-commonwealth-of-pr/",
          "recap_pdf_url": null,
          "pacer_doc_id": "15903042225",
          "description": "MOTION to Deposit Funds filed by Wandymar Burgos-Vargas on behalf of Department of Justice - Commonwealth of P.R. (Burgos-Vargas, Wandymar) (Entered: 06/15/2011)"
        },
        {
          "row_number": 3187,
          "id": 8975204,
          "entry_number": null,
          "date_filed": "2011-06-16T00:00:00-04:00",
          "attachments": null,
          "url": "https://www.courtlistener.com",
          "recap_pdf_url": null,
          "pacer_doc_id": null,
          "description": "DEPOSIT of Funds in the amount of $ SEALED, receipt number PRX100006312. (RE:DKT.1143). Deposited ((NEXT WORKING DAY)) in an Interest Bearing Account in compliance with L.R.67. **FUNDS WILL BE AVAILABLE FOR DISBURSEMENT AFTER 6/27/2011** (jla)"
        },
        {
          "row_number": 163,
          "id": 8975205,
          "entry_number": "1145",
          "date_filed": "2011-06-16T00:00:00-04:00",
          "attachments": null,
          "url": "https://www.courtlistener.com/docket/6672519/1145/united-states-v-commonwealth-of-pr/",
          "recap_pdf_url": null,
          "pacer_doc_id": "15903044467",
          "description": "INFORMATIVE Motion regarding the Mental Retardation Program filed by Sheila J. Torres-Delgado on behalf of Jose De-Leon, Department of Justice - Commonwealth of P.R., Carmen Feliciano-de-Melecio, Pedro J. Rossello-Gonzalez, The Commonwealth of Puerto Rico (Torres-Delgado, Sheila) (Entered: 06/16/2011)"
        },
        {
          "row_number": 169,
          "id": 8975210,
          "entry_number": "1150",
          "date_filed": "2011-07-06T00:00:00-04:00",
          "attachments": null,
          "url": "https://www.courtlistener.com/docket/6672519/1150/united-states-v-commonwealth-of-pr/",
          "recap_pdf_url": null,
          "pacer_doc_id": null,
          "description": "ORDER noted 1149 Motion to Deposit Funds. Signed by Judge Gustavo A. Gelpi on 7/6/11. (AH) (Entered: 07/06/2011)"
        },
        {
          "row_number": 170,
          "id": 8975211,
          "entry_number": "1151",
          "date_filed": "2011-07-07T00:00:00-04:00",
          "attachments": null,
          "url": "https://www.courtlistener.com/docket/6672519/1151/united-states-v-commonwealth-of-pr/",
          "recap_pdf_url": null,
          "pacer_doc_id": "15903073639",
          "description": "MOTION Submitting Invoice for Services rendered by the Joint Compliance Coordinador for the month of May 2011 filed by John J. McGee, Ph.D. (cr) (Entered: 07/07/2011)"
        },
        {
          "row_number": 171,
          "id": 8975212,
          "entry_number": "1152",
          "date_filed": "2011-07-07T00:00:00-04:00",
          "attachments": null,
          "url": "https://www.courtlistener.com/docket/6672519/1152/united-states-v-commonwealth-of-pr/",
          "recap_pdf_url": null,
          "pacer_doc_id": "15903073648",
          "description": "MOTION Submitting Invoice for Services rendered by the Joint Compliance Coordinador for the month of June 2011 filed by John J. McGee, Ph.D. (cr) (Entered: 07/07/2011)"
        },
        {
          "row_number": 172,
          "id": 8975213,
          "entry_number": "1153",
          "date_filed": "2011-07-07T00:00:00-04:00",
          "attachments": null,
          "url": "https://www.courtlistener.com/docket/6672519/1153/united-states-v-commonwealth-of-pr/",
          "recap_pdf_url": null,
          "pacer_doc_id": "15903073657",
          "description": "MOTION Submitting Invoice for Services Rendered by the Assistant to the Joint Compliance Coordinator, Dr. Sylvia Fernandez during the Month of June 2011 filed by Joint Compliance Coordinator John J. McGee. (cr) (Entered: 07/07/2011)"
        },
        {
          "row_number": 3188,
          "id": 8975214,
          "entry_number": null,
          "date_filed": "2011-07-07T00:00:00-04:00",
          "attachments": null,
          "url": "https://www.courtlistener.com",
          "recap_pdf_url": null,
          "pacer_doc_id": null,
          "description": "DEPOSIT of Funds in the amount of $ SEALED, receipt number PRX100006600. (RE:DKT.1149) Deposited ((NEXT WORKING DAY)) in an Interest Bearing Account in compliance with L.R.67. **FUNDS WILL BE AVAILABLE AFTER 7/18/2011** (jla)"
        },
        {
          "row_number": 175,
          "id": 8975217,
          "entry_number": "1156",
          "date_filed": "2011-07-14T00:00:00-04:00",
          "attachments": null,
          "url": "https://www.courtlistener.com/docket/6672519/1156/united-states-v-commonwealth-of-pr/",
          "recap_pdf_url": null,
          "pacer_doc_id": "15903087667",
          "description": "STATUS REPORT BINDER by The Commonwealth of Puerto Rico. (cr) (Entered: 07/15/2011)"
        },
        {
          "row_number": 177,
          "id": 8975219,
          "entry_number": "1158",
          "date_filed": "2011-07-15T00:00:00-04:00",
          "attachments": null,
          "url": "https://www.courtlistener.com/docket/6672519/1158/united-states-v-commonwealth-of-pr/",
          "recap_pdf_url": null,
          "pacer_doc_id": null,
          "description": "ORDER granting 1152 Motion submitting Invoice for Services rendered by the Joint Compliance Coordinador for the month of June 2011 filed by John J. McGee, Ph.D. Signed by Judge Gustavo A. Gelpi on 7/15/11. (cr) (Entered: 07/15/2011)"
        },
        {
          "row_number": 178,
          "id": 8975220,
          "entry_number": "1159",
          "date_filed": "2011-07-15T00:00:00-04:00",
          "attachments": null,
          "url": "https://www.courtlistener.com/docket/6672519/1159/united-states-v-commonwealth-of-pr/",
          "recap_pdf_url": null,
          "pacer_doc_id": null,
          "description": "ORDER granting 1153 Motion submitting Invoice for Services Rendered by the Assistant to the Joint Compliance Coordinator, Dr. Sylvia Fernandez during the Month of June 2011 filed by Joint Compliance Coordinator John J. McGee. Signed by Judge Gustavo A. Gelpi on 7/15/11. (cr) (Entered: 07/15/2011)"
        },
        {
          "row_number": 180,
          "id": 8975221,
          "entry_number": "1160",
          "date_filed": "2011-08-25T00:00:00-04:00",
          "attachments": null,
          "url": "https://www.courtlistener.com/docket/6672519/1160/united-states-v-commonwealth-of-pr/",
          "recap_pdf_url": null,
          "pacer_doc_id": "15903140972",
          "description": "NOTICE of Appearance by Jose A. Figueroa-Santaella on behalf of Jose De-Leon, Department of Justice - Commonwealth of P.R., Carmen Feliciano-de-Melecio, Pedro J. Rossello-Gonzalez, The Commonwealth of Puerto Rico (Figueroa-Santaella, Jose) (Entered: 08/25/2011)"
        },
        {
          "row_number": 181,
          "id": 8975222,
          "entry_number": "1161",
          "date_filed": "2011-08-25T00:00:00-04:00",
          "attachments": null,
          "url": "https://www.courtlistener.com/docket/6672519/1161/united-states-v-commonwealth-of-pr/",
          "recap_pdf_url": null,
          "pacer_doc_id": "15903140978",
          "description": "MOTION for Brief Extension of Time until October 3, 2011 to submit the Compliance Action Plan filed by Jose A. Figueroa-Santaella on behalf of Jose De-Leon, Department of Justice - Commonwealth of P.R., Carmen Feliciano-de-Melecio, Pedro J. Rossello-Gonzalez, The Commonwealth of Puerto Rico (Figueroa-Santaella, Jose) Modified on 8/26/2011 as to event and to add text (er). (Entered: 08/25/2011)"
        },
        {
          "row_number": 184,
          "id": 8975225,
          "entry_number": "1164",
          "date_filed": "2011-08-29T00:00:00-04:00",
          "attachments": null,
          "url": "https://www.courtlistener.com/docket/6672519/1164/united-states-v-commonwealth-of-pr/",
          "recap_pdf_url": null,
          "pacer_doc_id": null,
          "description": "ORDER noted 1162 Motion requesting Order. The court monitor Dr.McGee shall discuss this matter with the parties. Signed by Judge Gustavo A. Gelpi on 8/29/11. (AH) (Entered: 08/29/2011)"
        },
        {
          "row_number": 185,
          "id": 8975226,
          "entry_number": "1165",
          "date_filed": "2011-08-30T00:00:00-04:00",
          "attachments": null,
          "url": "https://www.courtlistener.com/docket/6672519/1165/united-states-v-commonwealth-of-pr/",
          "recap_pdf_url": null,
          "pacer_doc_id": "15903145007",
          "description": "MOTION Submitting Invoice for Services rendered by the Joint Compliance Coordinador for the month of July 2011 filed by John J. McGee, Ph.D. (cr) (Entered: 08/30/2011)"
        },
        {
          "row_number": 188,
          "id": 8975229,
          "entry_number": "1168",
          "date_filed": "2011-09-01T00:00:00-04:00",
          "attachments": null,
          "url": "https://www.courtlistener.com/docket/6672519/1168/united-states-v-commonwealth-of-pr/",
          "recap_pdf_url": null,
          "pacer_doc_id": null,
          "description": "ORDER noted 1167 Motion requesting Order. Dr. McGee shall, as usual, meet with the concerned parents, discuss the matter with counsel for both sides, and ultimately make any necessary recommendation to the court. Signed by Judge Gustavo A. Gelpi on 9/1/11. (AH) (Entered: 09/01/2011)"
        },
        {
          "row_number": 191,
          "id": 8975231,
          "entry_number": "1170",
          "date_filed": "2011-09-12T00:00:00-04:00",
          "attachments": null,
          "url": "https://www.courtlistener.com/docket/6672519/1170/united-states-v-commonwealth-of-pr/",
          "recap_pdf_url": null,
          "pacer_doc_id": null,
          "description": "ORDER granting 1165 Motion submitting Invoice for Services rendered by the Joint Compliance Coordinador for the month of July 2011 filed by John J. McGee, Ph.D. Signed by Judge Gustavo A. Gelpi on 9/12/11. (cr) (Entered: 09/12/2011)"
        },
        {
          "row_number": 192,
          "id": 8975232,
          "entry_number": "1171",
          "date_filed": "2011-09-12T00:00:00-04:00",
          "attachments": null,
          "url": "https://www.courtlistener.com/docket/6672519/1171/united-states-v-commonwealth-of-pr/",
          "recap_pdf_url": null,
          "pacer_doc_id": null,
          "description": "ORDER granting 1166 Motion submitting Invoice for Services Rendered by the Assistant to the Joint Compliance Coordinator, Dr. Sylvia Fernandez during the Month of July 2011 filed by Joint Compliance Coordinator John J. McGee. Signed by Judge Gustavo A. Gelpi on 9/12/11. (cr) (Entered: 09/12/2011)"
        },
        {
          "row_number": 193,
          "id": 8975233,
          "entry_number": "1172",
          "date_filed": "2011-09-15T00:00:00-04:00",
          "attachments": null,
          "url": "https://www.courtlistener.com/docket/6672519/1172/united-states-v-commonwealth-of-pr/",
          "recap_pdf_url": null,
          "pacer_doc_id": "15903168155",
          "description": "AMENDED MOTION Submitting Revised Invoice for the Month of August 2011 re: 1169 MOTION Submitting filed by John J. McGee filed by Dr.Sylvia M. Fernandez-Colorado. (Related document(s) 1169 ) (er) (Entered: 09/15/2011)"
        },
        {
          "row_number": 198,
          "id": 8975238,
          "entry_number": "1177",
          "date_filed": "2011-09-30T00:00:00-04:00",
          "attachments": null,
          "url": "https://www.courtlistener.com/docket/6672519/1177/united-states-v-commonwealth-of-pr/",
          "recap_pdf_url": null,
          "pacer_doc_id": "15903187131",
          "description": "MOTION to Deposit Funds filed by Wandymar Burgos-Vargas on behalf of Department of Justice - Commonwealth of P.R. (Burgos-Vargas, Wandymar) (Entered: 09/30/2011)"
        },
        {
          "row_number": 3189,
          "id": 8975242,
          "entry_number": null,
          "date_filed": "2011-10-05T00:00:00-04:00",
          "attachments": null,
          "url": "https://www.courtlistener.com",
          "recap_pdf_url": null,
          "pacer_doc_id": null,
          "description": "DEPOSIT of Funds in the amount of $ SEALED, receipt number PRX100008672. (RE:DKT.1177) Deposited ((NEXT WORKING DAY)) in an Interest Bearing Account in compliance with L.R.67. **FUNDS WILL BE AVAILABLE AFTER 10/17/2011** (jla)"
        },
        {
          "row_number": 205,
          "id": 8975245,
          "entry_number": "1183",
          "date_filed": "2011-10-19T00:00:00-04:00",
          "attachments": null,
          "url": "https://www.courtlistener.com/docket/6672519/1183/united-states-v-commonwealth-of-pr/",
          "recap_pdf_url": null,
          "pacer_doc_id": "15903216411",
          "description": "Minute Entry for proceedings held before Judge Gustavo A. Gelpi:Status Conference held on 10/19/2011. Further Status Conference set for 1/18/2012 09:00 AM in Courtroom 5 before Judge Gustavo A. Gelpi. (cr) (Entered: 10/19/2011)"
        },
        {
          "row_number": 206,
          "id": 8975246,
          "entry_number": "1184",
          "date_filed": "2011-10-19T00:00:00-04:00",
          "attachments": null,
          "url": "https://www.courtlistener.com/docket/6672519/1184/united-states-v-commonwealth-of-pr/",
          "recap_pdf_url": null,
          "pacer_doc_id": "15903216414",
          "description": "STATUS REPORT BINDER by The Commonwealth of Puerto Rico. (cr) (Entered: 10/19/2011)"
        },
        {
          "row_number": 207,
          "id": 8975247,
          "entry_number": "1185",
          "date_filed": "2011-10-19T00:00:00-04:00",
          "attachments": null,
          "url": "https://www.courtlistener.com/docket/6672519/1185/united-states-v-commonwealth-of-pr/",
          "recap_pdf_url": null,
          "pacer_doc_id": "15903216518",
          "description": "ORDER ADOPTING JOINT COMPLIANCE ACTION PLAN. Signed by Judge Gustavo A. Gelpi on 10/19/11. (Attachments: # 1 Approved Joint Compliance Action Plan)(cr) (Entered: 10/19/2011)"
        },
        {
          "row_number": 209,
          "id": 8975249,
          "entry_number": "1187",
          "date_filed": "2011-11-01T00:00:00-04:00",
          "attachments": null,
          "url": "https://www.courtlistener.com/docket/6672519/1187/united-states-v-commonwealth-of-pr/",
          "recap_pdf_url": null,
          "pacer_doc_id": "15903237040",
          "description": "INFORMATIVE Motion regarding Joint Compliance Action Plan filed by Sheila J. Torres-Delgado on behalf of Jose De-Leon, Department of Justice - Commonwealth of P.R., Carmen Feliciano-de-Melecio, Pedro J. Rossello-Gonzalez, The Commonwealth of Puerto Rico (Torres-Delgado, Sheila) (Entered: 11/01/2011)"
        },
        {
          "row_number": 211,
          "id": 8975251,
          "entry_number": "1189",
          "date_filed": "2011-11-04T00:00:00-04:00",
          "attachments": null,
          "url": "https://www.courtlistener.com/docket/6672519/1189/united-states-v-commonwealth-of-pr/",
          "recap_pdf_url": null,
          "pacer_doc_id": "15903245216",
          "description": "MOTION Submitting Invoice for Services Rendered by the Joint Compliance Coordinador for the month of August 2011 filed by Ph.D John J. McGee. (er) (Entered: 11/07/2011)"
        },
        {
          "row_number": 214,
          "id": 8975253,
          "entry_number": "1191",
          "date_filed": "2011-11-04T00:00:00-04:00",
          "attachments": null,
          "url": "https://www.courtlistener.com/docket/6672519/1191/united-states-v-commonwealth-of-pr/",
          "recap_pdf_url": null,
          "pacer_doc_id": "15903245233",
          "description": "MOTION Submitting Invoice for Services Rendered by the Joint Compliance Coordinador for the Month of October 2011 filed by Ph.D John J. McGee. (er) (Entered: 11/07/2011)"
        },
        {
          "row_number": 215,
          "id": 8975254,
          "entry_number": "1192",
          "date_filed": "2011-11-08T00:00:00-05:00",
          "attachments": null,
          "url": "https://www.courtlistener.com/docket/6672519/1192/united-states-v-commonwealth-of-pr/",
          "recap_pdf_url": null,
          "pacer_doc_id": null,
          "description": "ORDER granting 1189 Motion Submitting Invoice for Services Rendered by the Joint Compliance Coordinador for the month of August 2011 filed by Ph.D John J. McGee. Signed by Judge Gustavo A. Gelpi on 11/8/11. (cr) (Entered: 11/08/2011)"
        },
        {
          "row_number": 221,
          "id": 8975260,
          "entry_number": "1198",
          "date_filed": "2011-11-18T00:00:00-05:00",
          "attachments": null,
          "url": "https://www.courtlistener.com/docket/6672519/1198/united-states-v-commonwealth-of-pr/",
          "recap_pdf_url": null,
          "pacer_doc_id": null,
          "description": "ORDER noted 1197 Motion submitting. The court monitor, and counsel for the parties shall take note and advise the court accordingly. Signed by Judge Gustavo A. Gelpi on 11/18/11. (cr) (Entered: 11/18/2011)"
        },
        {
          "row_number": 222,
          "id": 8975261,
          "entry_number": "1199",
          "date_filed": "2011-11-21T00:00:00-05:00",
          "attachments": null,
          "url": "https://www.courtlistener.com/docket/6672519/1199/united-states-v-commonwealth-of-pr/",
          "recap_pdf_url": null,
          "pacer_doc_id": "15903265198",
          "description": "MOTION Submitting Invoice for Services Rendered by the Assistant to the Joint Compliance Coordinator, Dr. Sylvia Fernandez during the Month of September 2011 filed by Joint Compliance Coordinator John J. McGee. (cr) (Entered: 11/21/2011)"
        },
        {
          "row_number": 226,
          "id": 8975263,
          "entry_number": "1201",
          "date_filed": "2011-11-28T00:00:00-05:00",
          "attachments": null,
          "url": "https://www.courtlistener.com/docket/6672519/1201/united-states-v-commonwealth-of-pr/",
          "recap_pdf_url": null,
          "pacer_doc_id": null,
          "description": "ORDER granting 1199 Motion submitting Invoice for Services Rendered by the Assistant to the Joint Compliance Coordinator, Dr. Sylvia Fernandez during the Month of September 2011 filed by Joint Compliance Coordinator John J. McGee. Signed by Judge Gustavo A. Gelpi on 11/28/11. (cr) (Entered: 11/28/2011)"
        },
        {
          "row_number": 227,
          "id": 8975264,
          "entry_number": "1202",
          "date_filed": "2011-11-28T00:00:00-05:00",
          "attachments": null,
          "url": "https://www.courtlistener.com/docket/6672519/1202/united-states-v-commonwealth-of-pr/",
          "recap_pdf_url": null,
          "pacer_doc_id": "15903271254",
          "description": "ORDER for defendants to deposit funds with the Clerk of Court. Signed by Judge Gustavo A. Gelpi on 11/28/11.(cr) (Entered: 11/28/2011)"
        },
        {
          "row_number": 230,
          "id": 8975267,
          "entry_number": "1205",
          "date_filed": "2011-12-23T00:00:00-05:00",
          "attachments": null,
          "url": "https://www.courtlistener.com/docket/6672519/1205/united-states-v-commonwealth-of-pr/",
          "recap_pdf_url": null,
          "pacer_doc_id": "15903312589",
          "description": "**CASE PARTICIPANTS** MOTION to Deposit Funds filed by Wandymar Burgos-Vargas on behalf of Department of Justice - Commonwealth of P.R. (Burgos-Vargas, Wandymar) (Entered: 12/23/2011)"
        },
        {
          "row_number": 231,
          "id": 8975268,
          "entry_number": "1206",
          "date_filed": "2011-12-27T00:00:00-05:00",
          "attachments": null,
          "url": "https://www.courtlistener.com/docket/6672519/1206/united-states-v-commonwealth-of-pr/",
          "recap_pdf_url": null,
          "pacer_doc_id": null,
          "description": "ORDER noted 1205 Motion to Deposit Funds. Signed by Judge Gustavo A. Gelpi on 12/27/11. (AH) (Entered: 12/27/2011)"
        },
        {
          "row_number": 232,
          "id": 8975270,
          "entry_number": "1207",
          "date_filed": "2012-01-12T00:00:00-05:00",
          "attachments": null,
          "url": "https://www.courtlistener.com/docket/6672519/1207/united-states-v-commonwealth-of-pr/",
          "recap_pdf_url": null,
          "pacer_doc_id": null,
          "description": "ORDER. Status Conference RESET for 1/19/2012 09:00 AM in Courtroom 5 before Judge Gustavo A. Gelpi. Signed by Judge Gustavo A. Gelpi on 1/12/12.(cr) (Entered: 01/12/2012)"
        },
        {
          "row_number": 233,
          "id": 8975271,
          "entry_number": "1208",
          "date_filed": "2012-01-17T00:00:00-05:00",
          "attachments": null,
          "url": "https://www.courtlistener.com/docket/6672519/1208/united-states-v-commonwealth-of-pr/",
          "recap_pdf_url": null,
          "pacer_doc_id": "15903334556",
          "description": "MOTION Submitting Invoice for Services Rendered by the Joint Compliance Coordinador for the Month of November 2011 filed by Ph.D John J. McGee. (cr) (Entered: 01/17/2012)"
        },
        {
          "row_number": 234,
          "id": 8975272,
          "entry_number": "1209",
          "date_filed": "2012-01-17T00:00:00-05:00",
          "attachments": null,
          "url": "https://www.courtlistener.com/docket/6672519/1209/united-states-v-commonwealth-of-pr/",
          "recap_pdf_url": null,
          "pacer_doc_id": "15903334561",
          "description": "MOTION Submitting Invoice for Services Rendered by the Joint Compliance Coordinador for the Month of December 2011 filed by Ph.D John J. McGee. (cr) (Entered: 01/17/2012)"
        },
        {
          "row_number": 238,
          "id": 8975273,
          "entry_number": "1212",
          "date_filed": "2012-01-19T00:00:00-05:00",
          "attachments": null,
          "url": "https://www.courtlistener.com/docket/6672519/1212/united-states-v-commonwealth-of-pr/",
          "recap_pdf_url": null,
          "pacer_doc_id": "15903340823",
          "description": "Minute Entry for proceedings held before Judge Gustavo A. Gelpi:Status Conference held on 1/19/2012, Set Hearings. Further Status Conference set for 4/25/2012 09:00 AM in Courtroom 5 before Judge Gustavo A. Gelpi. (cr) (Entered: 01/20/2012)"
        },
        {
          "row_number": 239,
          "id": 8975274,
          "entry_number": "1213",
          "date_filed": "2012-01-19T00:00:00-05:00",
          "attachments": null,
          "url": "https://www.courtlistener.com/docket/6672519/1213/united-states-v-commonwealth-of-pr/",
          "recap_pdf_url": null,
          "pacer_doc_id": "15903340830",
          "description": "REPORT Binder by The Commonwealth of Puerto Rico. (cr) (Entered: 01/20/2012)"
        },
        {
          "row_number": 237,
          "id": 8975276,
          "entry_number": "1211",
          "date_filed": "2012-01-20T00:00:00-05:00",
          "attachments": null,
          "url": "https://www.courtlistener.com/docket/6672519/1211/united-states-v-commonwealth-of-pr/",
          "recap_pdf_url": null,
          "pacer_doc_id": null,
          "description": "ORDER granting 1209 Submitting Invoice for Services Rendered by the Joint Compliance Coordinador for the Month of December 2011 filed by Ph.D John J. McGee. Signed by Judge Gustavo A. Gelpi on 1/20/12. (cr) (Entered: 01/20/2012)"
        },
        {
          "row_number": 249,
          "id": 8975285,
          "entry_number": "1222",
          "date_filed": "2012-02-21T00:00:00-05:00",
          "attachments": null,
          "url": "https://www.courtlistener.com/docket/6672519/1222/united-states-v-commonwealth-of-pr/",
          "recap_pdf_url": null,
          "pacer_doc_id": null,
          "description": "ORDER granting 1215 Motion submitting Invoice for Services Rendered by the Assistant Joint Compliance Coordinador for the Month of December 2011 filed by Ph.D John J. McGee. Signed by Judge Gustavo A. Gelpi on 2/21/12. (cr) (Entered: 02/21/2012)"
        },
        {
          "row_number": 250,
          "id": 8975286,
          "entry_number": "1223",
          "date_filed": "2012-02-21T00:00:00-05:00",
          "attachments": null,
          "url": "https://www.courtlistener.com/docket/6672519/1223/united-states-v-commonwealth-of-pr/",
          "recap_pdf_url": null,
          "pacer_doc_id": null,
          "description": "ORDER granting 1216 Motion submitting Invoice for Services Rendered by the Assistant Joint Compliance Coordinador for the Month of January 2012 filed by Ph.D John J. McGee. Signed by Judge Gustavo A. Gelpi on 2/21/12. (cr) (Entered: 02/21/2012)"
        },
        {
          "row_number": 252,
          "id": 8975288,
          "entry_number": "1225",
          "date_filed": "2012-02-21T00:00:00-05:00",
          "attachments": null,
          "url": "https://www.courtlistener.com/docket/6672519/1225/united-states-v-commonwealth-of-pr/",
          "recap_pdf_url": null,
          "pacer_doc_id": "15903387557",
          "description": "ORDER for defendants to deposit funds with the Clerk of Court. Signed by Judge Gustavo A. Gelpi on 2/21/12.(cr) (Entered: 02/21/2012)"
        },
        {
          "row_number": 253,
          "id": 8975289,
          "entry_number": "1226",
          "date_filed": "2012-02-21T00:00:00-05:00",
          "attachments": null,
          "url": "https://www.courtlistener.com/docket/6672519/1226/united-states-v-commonwealth-of-pr/",
          "recap_pdf_url": null,
          "pacer_doc_id": null,
          "description": "ORDER noted 1220 INFORMATIVE motion regarding the Mental Retardation Program. Signed by Judge Gustavo A. Gelpi on 2/21/12. (cr) (Entered: 02/21/2012)"
        },
        {
          "row_number": 256,
          "id": 8975292,
          "entry_number": "1229",
          "date_filed": "2012-04-19T00:00:00-04:00",
          "attachments": null,
          "url": "https://www.courtlistener.com/docket/6672519/1229/united-states-v-commonwealth-of-pr/",
          "recap_pdf_url": null,
          "pacer_doc_id": "15903478579",
          "description": "MOTION to Deposit Funds filed by Wandymar Burgos-Vargas on behalf of Department of Justice - Commonwealth of P.R. (Burgos-Vargas, Wandymar) (Entered: 04/19/2012)"
        },
        {
          "row_number": 258,
          "id": 8975293,
          "entry_number": "1230",
          "date_filed": "2012-04-19T00:00:00-04:00",
          "attachments": null,
          "url": "https://www.courtlistener.com/docket/6672519/1230/united-states-v-commonwealth-of-pr/",
          "recap_pdf_url": null,
          "pacer_doc_id": null,
          "description": "ORDER granting 1227 Motion submitting Invoice for Services Rendered by the Joint Compliance Coordinador for the month of February 2012 filed by Ph.D John J. McGee. Signed by Judge Gustavo A. Gelpi on 4/19/12. (cr) (Entered: 04/19/2012)"
        },
        {
          "row_number": 260,
          "id": 8975295,
          "entry_number": "1232",
          "date_filed": "2012-04-20T00:00:00-04:00",
          "attachments": null,
          "url": "https://www.courtlistener.com/docket/6672519/1232/united-states-v-commonwealth-of-pr/",
          "recap_pdf_url": null,
          "pacer_doc_id": null,
          "description": "ORDER granting 1229 Motion to Deposit Funds. Signed by Judge Gustavo A. Gelpi on 4/20/12. (cr) (Entered: 04/20/2012)"
        },
        {
          "row_number": 261,
          "id": 8975297,
          "entry_number": "1233",
          "date_filed": "2012-04-23T00:00:00-04:00",
          "attachments": null,
          "url": "https://www.courtlistener.com/docket/6672519/1233/united-states-v-commonwealth-of-pr/",
          "recap_pdf_url": null,
          "pacer_doc_id": null,
          "description": "ORDER. Status Conference RESET for 4/25/2012 09:00 AM in Old San Juan Courtroom before Judge Gustavo A. Gelpi. Signed by Judge Gustavo A. Gelpi on 4/23/12.(cr) (Entered: 04/23/2012)"
        },
        {
          "row_number": 266,
          "id": 8975302,
          "entry_number": "1238",
          "date_filed": "2012-06-07T00:00:00-04:00",
          "attachments": null,
          "url": "https://www.courtlistener.com/docket/6672519/1238/united-states-v-commonwealth-of-pr/",
          "recap_pdf_url": null,
          "pacer_doc_id": "15903556625",
          "description": "MOTION Submitting Invoice for Services Rendered by the Joint Compliance Coordinador for the month of May 2012 filed by John J. McGee, Ph.D. (cr) (Entered: 06/07/2012)"
        },
        {
          "row_number": 267,
          "id": 8975303,
          "entry_number": "1239",
          "date_filed": "2012-06-07T00:00:00-04:00",
          "attachments": null,
          "url": "https://www.courtlistener.com/docket/6672519/1239/united-states-v-commonwealth-of-pr/",
          "recap_pdf_url": null,
          "pacer_doc_id": "15903556877",
          "description": "MOTION Submitting Invoice for Services Rendered by the Assistant Joint Compliance Coordinador for the month of March 2012 filed by John J. McGee, PhD. (cr) (Entered: 06/07/2012)"
        },
        {
          "row_number": 273,
          "id": 8975308,
          "entry_number": "1244",
          "date_filed": "2012-06-11T00:00:00-04:00",
          "attachments": null,
          "url": "https://www.courtlistener.com/docket/6672519/1244/united-states-v-commonwealth-of-pr/",
          "recap_pdf_url": null,
          "pacer_doc_id": null,
          "description": "ORDER: Granting 1243 Motion for Leave to File Spanish language documents. Translations due by 6/29/2012. Signed by Judge Gustavo A. Gelpi on 6/11/2012. (TC) (Entered: 06/11/2012)"
        },
        {
          "row_number": 274,
          "id": 8975309,
          "entry_number": "1245",
          "date_filed": "2012-06-11T00:00:00-04:00",
          "attachments": null,
          "url": "https://www.courtlistener.com/docket/6672519/1245/united-states-v-commonwealth-of-pr/",
          "recap_pdf_url": null,
          "pacer_doc_id": "15903561927",
          "description": "**CASE PARTICIPANTS**ORDER: Noted 1242 Motion In Compliance. Signed by Judge Gustavo A. Gelpi on 6/11/2012. (TC) (Entered: 06/11/2012)"
        },
        {
          "row_number": 275,
          "id": 8975310,
          "entry_number": "1246",
          "date_filed": "2012-06-14T00:00:00-04:00",
          "attachments": null,
          "url": "https://www.courtlistener.com/docket/6672519/1246/united-states-v-commonwealth-of-pr/",
          "recap_pdf_url": null,
          "pacer_doc_id": "15903568108",
          "description": "RESPONSE to Motion filed by USA Re: 1242 Motion In Compliance with Order filed by Pedro J. Rossello-Gonzalez, Jose De-Leon, The Commonwealth of Puerto Rico, Department of Justice - Commonwealth of P.R., Carmen Feliciano-de-Melecio filed by USA. (Farano, Richard) (Entered: 06/14/2012)"
        },
        {
          "row_number": 277,
          "id": 8975312,
          "entry_number": "1248",
          "date_filed": "2012-06-18T00:00:00-04:00",
          "attachments": null,
          "url": "https://www.courtlistener.com/docket/6672519/1248/united-states-v-commonwealth-of-pr/",
          "recap_pdf_url": null,
          "pacer_doc_id": null,
          "description": "ORDER granting 1237 Motion Submitting Invoice for Services Rendered by the Joint Compliance Coordinador for the month of April 2012 filed by John J. McGee, Ph.D. Signed by Judge Gustavo A. Gelpi on 6/18/12. (cr) (Entered: 06/18/2012)"
        },
        {
          "row_number": 280,
          "id": 8975314,
          "entry_number": "1250",
          "date_filed": "2012-06-18T00:00:00-04:00",
          "attachments": null,
          "url": "https://www.courtlistener.com/docket/6672519/1250/united-states-v-commonwealth-of-pr/",
          "recap_pdf_url": null,
          "pacer_doc_id": null,
          "description": "ORDER granting 1239 Motion Submitting Invoice for Services Rendered by the Assistant Joint Compliance Coordinador for the month of March 2012 filed by John J. McGee, PhD. Signed by Judge Gustavo A. Gelpi on 6/18/12. (cr) (Entered: 06/18/2012)"
        },
        {
          "row_number": 285,
          "id": 8975319,
          "entry_number": "1255",
          "date_filed": "2012-06-22T00:00:00-04:00",
          "attachments": null,
          "url": "https://www.courtlistener.com/docket/6672519/1255/united-states-v-commonwealth-of-pr/",
          "recap_pdf_url": null,
          "pacer_doc_id": null,
          "description": "ORDER noted 1254 Motion submitting Certified English Translations. Signed by Judge Gustavo A. Gelpi on 6/22/12. (AH) (Entered: 06/22/2012)"
        },
        {
          "row_number": 286,
          "id": 8975320,
          "entry_number": "1256",
          "date_filed": "2012-07-05T00:00:00-04:00",
          "attachments": null,
          "url": "https://www.courtlistener.com/docket/6672519/1256/united-states-v-commonwealth-of-pr/",
          "recap_pdf_url": null,
          "pacer_doc_id": "15903597135",
          "description": "MOTION to Deposit Funds filed by Wandymar Burgos-Vargas on behalf of Department of Justice - Commonwealth of P.R. (Burgos-Vargas, Wandymar) (Entered: 07/05/2012)"
        },
        {
          "row_number": 294,
          "id": 8975328,
          "entry_number": "1263",
          "date_filed": "2012-08-29T00:00:00-04:00",
          "attachments": null,
          "url": "https://www.courtlistener.com/docket/6672519/1263/united-states-v-commonwealth-of-pr/",
          "recap_pdf_url": null,
          "pacer_doc_id": "15903673885",
          "description": "MOTION Submitting Invoice for Services Rendered by the Assistant Joint Compliance Coordinador for the month of June 2012 filed by John J. McGee, Ph.D. Suggestions in opposition/response due by 9/14/2012. (cr) (Entered: 08/29/2012)"
        },
        {
          "row_number": 295,
          "id": 8975329,
          "entry_number": "1264",
          "date_filed": "2012-08-29T00:00:00-04:00",
          "attachments": null,
          "url": "https://www.courtlistener.com/docket/6672519/1264/united-states-v-commonwealth-of-pr/",
          "recap_pdf_url": null,
          "pacer_doc_id": "15903673896",
          "description": "MOTION Submitting Invoice for Services Rendered by the Joint Compliance Coordinador for the month of July 2012 filed by John J. McGee, Ph.D. Suggestions in opposition/response due by 9/14/2012. (cr) (Entered: 08/29/2012)"
        },
        {
          "row_number": 296,
          "id": 8975330,
          "entry_number": "1265",
          "date_filed": "2012-08-29T00:00:00-04:00",
          "attachments": null,
          "url": "https://www.courtlistener.com/docket/6672519/1265/united-states-v-commonwealth-of-pr/",
          "recap_pdf_url": null,
          "pacer_doc_id": "15903673902",
          "description": "MOTION Submitting Invoice for Services Rendered by the Assistant Joint Compliance Coordinador for the month of July 2012 filed by John J. McGee, Ph.D. Suggestions in opposition/response due by 9/14/2012. (cr) (Entered: 08/29/2012)"
        },
        {
          "row_number": 297,
          "id": 8975331,
          "entry_number": "1266",
          "date_filed": "2012-09-04T00:00:00-04:00",
          "attachments": null,
          "url": "https://www.courtlistener.com/docket/6672519/1266/united-states-v-commonwealth-of-pr/",
          "recap_pdf_url": null,
          "pacer_doc_id": "15903680522",
          "description": "**CASE PARTICIPANTS**ORDER as to participant C. S.. Signed by Judge Gustavo A. Gelpi on 9/4/12.(cr) (Entered: 09/04/2012)"
        },
        {
          "row_number": 298,
          "id": 8975332,
          "entry_number": "1267",
          "date_filed": "2012-09-04T00:00:00-04:00",
          "attachments": null,
          "url": "https://www.courtlistener.com/docket/6672519/1267/united-states-v-commonwealth-of-pr/",
          "recap_pdf_url": null,
          "pacer_doc_id": "15903680530",
          "description": "**CASE PARTICIPANTS**SECOND ORDER as to participant C.S.. Signed by Judge Gustavo A. Gelpi on 9/4/12.(cr) (Entered: 09/04/2012)"
        },
        {
          "row_number": 305,
          "id": 8975338,
          "entry_number": "1273",
          "date_filed": "2012-09-05T00:00:00-04:00",
          "attachments": null,
          "url": "https://www.courtlistener.com/docket/6672519/1273/united-states-v-commonwealth-of-pr/",
          "recap_pdf_url": null,
          "pacer_doc_id": "15903682042",
          "description": "MOTION Submitting Invoice for Services Rendered by the Joint Compliance Coordinador for the month of August 2012 filed by John J. McGee, Ph.D. John J. McGee. Suggestions in opposition/response due by 9/21/2012 (cr) (Entered: 09/05/2012)"
        },
        {
          "row_number": 307,
          "id": 8975340,
          "entry_number": "1275",
          "date_filed": "2012-09-05T00:00:00-04:00",
          "attachments": null,
          "url": "https://www.courtlistener.com/docket/6672519/1275/united-states-v-commonwealth-of-pr/",
          "recap_pdf_url": null,
          "pacer_doc_id": null,
          "description": "ORDER granting 1273 MOTION Submitting Invoice for Services Rendered by the Joint Compliance Coordinador for the month of August 2012 filed by John J. McGee, Ph.D. Signed by Judge Gustavo A. Gelpi on 9/5/12. (cr) (Entered: 09/05/2012)"
        },
        {
          "row_number": 308,
          "id": 8975341,
          "entry_number": "1276",
          "date_filed": "2012-09-05T00:00:00-04:00",
          "attachments": null,
          "url": "https://www.courtlistener.com/docket/6672519/1276/united-states-v-commonwealth-of-pr/",
          "recap_pdf_url": null,
          "pacer_doc_id": null,
          "description": "ORDER granting 1274 MOTION Submitting Invoice for Services Rendered by the Assistant to the Joint Compliance Coordinador for the month of August 2012 filed by John J. McGee, Ph.D. Signed by Judge Gustavo A. Gelpi on 9/5/12. (cr) (Entered: 09/05/2012)"
        },
        {
          "row_number": 329,
          "id": 8975362,
          "entry_number": "1295",
          "date_filed": "2012-10-11T00:00:00-04:00",
          "attachments": null,
          "url": "https://www.courtlistener.com/docket/6672519/1295/united-states-v-commonwealth-of-pr/",
          "recap_pdf_url": null,
          "pacer_doc_id": "15903737236",
          "description": "RESPONSE in Opposition to Motion (Informative Motion by Ms. C.S.M.) filed by Jose De-Leon, Department of Justice - Commonwealth of P.R., Carmen Feliciano-de-Melecio, Pedro J. Rossello-Gonzalez, The Commonwealth of Puerto Rico Re: 1294 INFORMATIVE Motion filed by C.S. filed by Jose De-Leon, Department of Justice - Commonwealth of P.R., Carmen Feliciano-de-Melecio, Pedro J. Rossello-Gonzalez, The Commonwealth of Puerto Rico. (Figueroa-Santaella, Jose) (Entered: 10/11/2012)"
        },
        {
          "row_number": 331,
          "id": 8975364,
          "entry_number": "1297",
          "date_filed": "2012-10-12T00:00:00-04:00",
          "attachments": null,
          "url": "https://www.courtlistener.com/docket/6672519/1297/united-states-v-commonwealth-of-pr/",
          "recap_pdf_url": null,
          "pacer_doc_id": "15903738005",
          "description": "MOTION for Reconsideration re 1296 Order on Informative Motion filed by Jose A. Figueroa-Santaella on behalf of Jose De-Leon, Department of Justice - Commonwealth of P.R., Carmen Feliciano-de-Melecio, Pedro J. Rossello-Gonzalez, The Commonwealth of Puerto Rico Suggestions in opposition/response due by 10/29/2012 (Related document(s) 1296 ) (Figueroa-Santaella, Jose) (Entered: 10/12/2012)"
        },
        {
          "row_number": 332,
          "id": 8975365,
          "entry_number": "1298",
          "date_filed": "2012-10-15T00:00:00-04:00",
          "attachments": null,
          "url": "https://www.courtlistener.com/docket/6672519/1298/united-states-v-commonwealth-of-pr/",
          "recap_pdf_url": null,
          "pacer_doc_id": "15903740192",
          "description": "***SELECTED PARTIES***ORDER denying 1297 Motion for Reconsideration. Signed by Judge Gustavo A. Gelpi on 10/15/12. (cr) (Entered: 10/15/2012)"
        },
        {
          "row_number": 338,
          "id": 8975369,
          "entry_number": "1302",
          "date_filed": "2012-12-03T00:00:00-05:00",
          "attachments": null,
          "url": "https://www.courtlistener.com/docket/6672519/1302/united-states-v-commonwealth-of-pr/",
          "recap_pdf_url": null,
          "pacer_doc_id": "15903803490",
          "description": "***SELECTED PARTIES*** MOTION requesting Order filed by Miguel Oppenheimer on behalf of C.S., The Commonwealth of Puerto Rico, USA Suggestions in opposition/response due by 12/20/2012 (Oppenheimer, Miguel) (Entered: 12/03/2012)"
        },
        {
          "row_number": 339,
          "id": 8975370,
          "entry_number": "1303",
          "date_filed": "2012-12-03T00:00:00-05:00",
          "attachments": null,
          "url": "https://www.courtlistener.com/docket/6672519/1303/united-states-v-commonwealth-of-pr/",
          "recap_pdf_url": null,
          "pacer_doc_id": "15903804159",
          "description": "***SELECTED PARTIES***ORDER granting 1302 Motion requesting Order on behalf of C.S. Signed by Judge Gustavo A. Gelpi on 12/03/12. (cr) (Entered: 12/03/2012)"
        },
        {
          "row_number": 340,
          "id": 8975371,
          "entry_number": "1304",
          "date_filed": "2012-12-03T00:00:00-05:00",
          "attachments": null,
          "url": "https://www.courtlistener.com/docket/6672519/1304/united-states-v-commonwealth-of-pr/",
          "recap_pdf_url": null,
          "pacer_doc_id": "15903804871",
          "description": "***EX-PARTE*** MOTION to Set Aside Order re: 1303 ***SELECTED PARTIES***ORDER granting 1302 Motion requesting Order on behalf of C.S. Signed by Judge Gustavo A. Gelpi on 12/03/12. (cr) filed by Jose A. Figueroa-Santaella on behalf of Jose De-Leon, Department of Justice - Commonwealth of P.R., Carmen Feliciano-de-Melecio, Pedro J. Rossello-Gonzalez, The Commonwealth of Puerto Rico Suggestions in opposition/response due by 12/20/2012 (Related document(s) 1303 ) (Figueroa-Santaella, Jose) (Entered: 12/03/2012)"
        },
        {
          "row_number": 341,
          "id": 8975372,
          "entry_number": "1305",
          "date_filed": "2012-12-03T00:00:00-05:00",
          "attachments": null,
          "url": "https://www.courtlistener.com/docket/6672519/1305/united-states-v-commonwealth-of-pr/",
          "recap_pdf_url": null,
          "pacer_doc_id": null,
          "description": "ORDER: Denying 1304 Motion to Set Aside. The Department of Health will simply provide transportation to participant CS as ordered. Counsel for Defendant shall contact the Family Department, Dr. Fernandez, the JCC, or Attorney Oppenheimer, who represents CS in family court, if information is needed. Signed by Judge Gustavo A. Gelpi on 12/3/12. (CL) (Entered: 12/03/2012)"
        },
        {
          "row_number": 361,
          "id": 8975390,
          "entry_number": "1323",
          "date_filed": "2013-02-05T00:00:00-05:00",
          "attachments": null,
          "url": "https://www.courtlistener.com/docket/6672519/1323/united-states-v-commonwealth-of-pr/",
          "recap_pdf_url": null,
          "pacer_doc_id": "15903881809",
          "description": "Second NOTICE of Appearance by Carlos Del-Valle-Cruz on behalf of Department of Justice - Commonwealth of P.R. (Del-Valle-Cruz, Carlos) (Entered: 02/05/2013)"
        },
        {
          "row_number": 375,
          "id": 8975403,
          "entry_number": "1336",
          "date_filed": "2013-03-07T00:00:00-05:00",
          "attachments": null,
          "url": "https://www.courtlistener.com/docket/6672519/1336/united-states-v-commonwealth-of-pr/",
          "recap_pdf_url": null,
          "pacer_doc_id": "15903926874",
          "description": "***SELECTED PARTIES***SUPPLEMENTAL ORDER for The Commonwealth of P.R. to deposit funds with the Clerk of Court. Signed by Judge Gustavo A. Gelpi on 3/7/13.(cr) (Entered: 03/07/2013)"
        },
        {
          "row_number": 376,
          "id": 8975404,
          "entry_number": "1337",
          "date_filed": "2013-03-07T00:00:00-05:00",
          "attachments": null,
          "url": "https://www.courtlistener.com/docket/6672519/1337/united-states-v-commonwealth-of-pr/",
          "recap_pdf_url": null,
          "pacer_doc_id": "15903927861",
          "description": "NOTICE of Appearance by Arlene R. Perez-Borrero on behalf of All Defendants (Perez-Borrero, Arlene) (Entered: 03/07/2013)"
        },
        {
          "row_number": 377,
          "id": 8975405,
          "entry_number": "1338",
          "date_filed": "2013-03-14T00:00:00-04:00",
          "attachments": null,
          "url": "https://www.courtlistener.com/docket/6672519/1338/united-states-v-commonwealth-of-pr/",
          "recap_pdf_url": null,
          "pacer_doc_id": "15903937039",
          "description": "***SELECTED PARTIES******SHOW CAUSE HEARING VACATED PER ORDER DKT 1341 ***ORDER. Show Cause Hearing set for 3/20/2013 09:00 AM in Old San Juan Courtroom before Judge Gustavo A. Gelpi. Signed by Judge Gustavo A. Gelpi on 3/14/13.(cr) Modified on 3/21/2013 (er). (Entered: 03/14/2013)"
        },
        {
          "row_number": 378,
          "id": 8975406,
          "entry_number": "1339",
          "date_filed": "2013-03-19T00:00:00-04:00",
          "attachments": null,
          "url": "https://www.courtlistener.com/docket/6672519/1339/united-states-v-commonwealth-of-pr/",
          "recap_pdf_url": null,
          "pacer_doc_id": "15903943454",
          "description": "ORDER: Authorizing JCC to Lease Office Space. Signed by Judge Gustavo A. Gelpi on 3/19/2013.(TC) (Entered: 03/19/2013)"
        },
        {
          "row_number": 384,
          "id": 8975412,
          "entry_number": "1344",
          "date_filed": "2013-03-21T00:00:00-04:00",
          "attachments": null,
          "url": "https://www.courtlistener.com/docket/6672519/1344/united-states-v-commonwealth-of-pr/",
          "recap_pdf_url": null,
          "pacer_doc_id": null,
          "description": "ORDER: Granting 1343 Motion to Restrict. Signed by Judge Gustavo A. Gelpi on 3/21/2013. (TC) (Entered: 03/21/2013)"
        },
        {
          "row_number": 397,
          "id": 8975424,
          "entry_number": "1356",
          "date_filed": "2013-04-15T00:00:00-04:00",
          "attachments": null,
          "url": "https://www.courtlistener.com/docket/6672519/1356/united-states-v-commonwealth-of-pr/",
          "recap_pdf_url": null,
          "pacer_doc_id": "15903986636",
          "description": "MOTION requesting Order to help Ismael Nieves Rivera, Mental Health patient filed by Ana M. Nieves-Rivera, Pro se, in the Spanish language. Suggestions in opposition/response due by 5/2/2013 (er) (Entered: 04/18/2013)"
        },
        {
          "row_number": 404,
          "id": 8975431,
          "entry_number": "1362",
          "date_filed": "2013-04-22T00:00:00-04:00",
          "attachments": null,
          "url": "https://www.courtlistener.com/docket/6672519/1362/united-states-v-commonwealth-of-pr/",
          "recap_pdf_url": null,
          "pacer_doc_id": "15903991954",
          "description": "MOTION Submitting Invoice for Services Rendered by Assistant Joint Compliance Coordinator, Dr. Dimaris Garcia, for the month of March 2013, filed by Sylvia M. Fernandez-Colorado, PhD (su) Modified on 4/25/2013 to change event, docket text and remove restriction as per judge's instructions (ni). (Entered: 04/22/2013)"
        },
        {
          "row_number": 405,
          "id": 8975432,
          "entry_number": "1363",
          "date_filed": "2013-04-22T00:00:00-04:00",
          "attachments": null,
          "url": "https://www.courtlistener.com/docket/6672519/1363/united-states-v-commonwealth-of-pr/",
          "recap_pdf_url": null,
          "pacer_doc_id": "15903991964",
          "description": "MOTION Submitting Invoice for Services Rendered by Joint Compliance Coordinator for the month of March 2013 filed by Sylvia M. Fernandez-Colorado, PhD (su) Modified on 4/25/2013 to change event, docket text and remove restriction as per judge's instructions (ni). (Entered: 04/22/2013)"
        },
        {
          "row_number": 409,
          "id": 8975433,
          "entry_number": "1367",
          "date_filed": "2013-04-24T00:00:00-04:00",
          "attachments": null,
          "url": "https://www.courtlistener.com/docket/6672519/1367/united-states-v-commonwealth-of-pr/",
          "recap_pdf_url": null,
          "pacer_doc_id": "15903996820",
          "description": "Minute Entry for proceedings held before Judge Gustavo A. Gelpi:Status Conference held on 4/24/2013. Further Status Conference set for 5/28/2013 04:00 PM in Old San Juan Courtroom before Judge Gustavo A. Gelpi.(Court Reporter None.) (gsr) (Entered: 04/25/2013)"
        },
        {
          "row_number": 3197,
          "id": 8975437,
          "entry_number": null,
          "date_filed": "2013-04-25T00:00:00-04:00",
          "attachments": null,
          "url": "https://www.courtlistener.com",
          "recap_pdf_url": null,
          "pacer_doc_id": null,
          "description": "NOTICE of Docket Text Modification by Deputy Clerk re: 1363 MOTION Submitting, 1362 MOTION Submitting, 1364 MOTION Submitting. ***MODIFIED to change event \"to reflect it is a motion\" and to remove restriction as per judge's instructions. *** (ni)"
        },
        {
          "row_number": 410,
          "id": 8975438,
          "entry_number": "1368",
          "date_filed": "2013-04-30T00:00:00-04:00",
          "attachments": null,
          "url": "https://www.courtlistener.com/docket/6672519/1368/united-states-v-commonwealth-of-pr/",
          "recap_pdf_url": null,
          "pacer_doc_id": "15904003818",
          "description": "ORDER RE: 2013-14 BUDGET. Signed by Judge Gustavo A. Gelpi on 4/30/13.(cr) (Entered: 04/30/2013)"
        },
        {
          "row_number": 3198,
          "id": 8975448,
          "entry_number": null,
          "date_filed": "2013-05-23T00:00:00-04:00",
          "attachments": null,
          "url": "https://www.courtlistener.com",
          "recap_pdf_url": null,
          "pacer_doc_id": null,
          "description": "DEPOSIT of Funds in the amount of $ SEALED, receipt number PRX100019740. Deposited ((NEXT WORKING DAY)) in an Interest Bearing Account in compliance with L.R.67. Funds will be available for disbursement after 6/4/2013. (ga)"
        },
        {
          "row_number": 421,
          "id": 8975449,
          "entry_number": "1378",
          "date_filed": "2013-05-24T00:00:00-04:00",
          "attachments": null,
          "url": "https://www.courtlistener.com/docket/6672519/1378/united-states-v-commonwealth-of-pr/",
          "recap_pdf_url": null,
          "pacer_doc_id": null,
          "description": "ORDER: Granting 1377 Motion to Restrict. Signed by Judge Gustavo A. Gelpi on 5/24/13. (CL) (Entered: 05/24/2013)"
        },
        {
          "row_number": 428,
          "id": 8975455,
          "entry_number": "1384",
          "date_filed": "2013-06-20T00:00:00-04:00",
          "attachments": null,
          "url": "https://www.courtlistener.com/docket/6672519/1384/united-states-v-commonwealth-of-pr/",
          "recap_pdf_url": null,
          "pacer_doc_id": null,
          "description": "ORDER: Noted 1383 INFORMATIVE motion. Signed by Judge Gustavo A. Gelpi on 6/20/2013. (TC) (Entered: 06/20/2013)"
        },
        {
          "row_number": 432,
          "id": 8975459,
          "entry_number": "1388",
          "date_filed": "2013-06-20T00:00:00-04:00",
          "attachments": null,
          "url": "https://www.courtlistener.com/docket/6672519/1388/united-states-v-commonwealth-of-pr/",
          "recap_pdf_url": null,
          "pacer_doc_id": "15904076076",
          "description": "MOTION Submitting Invoice for Services Rendered by Assistant Joint Compliance Coordinator for the month of May 2013 filed by Sylvia M. Fernandez-Colorado, PhD. Suggestions in opposition/response due by 7/8/2013 (cr) (Entered: 06/20/2013)"
        },
        {
          "row_number": 438,
          "id": 8975464,
          "entry_number": "1393",
          "date_filed": "2013-06-20T00:00:00-04:00",
          "attachments": null,
          "url": "https://www.courtlistener.com/docket/6672519/1393/united-states-v-commonwealth-of-pr/",
          "recap_pdf_url": null,
          "pacer_doc_id": null,
          "description": "ORDER: Noted 1387 Motion submitting. Signed by Judge Gustavo A. Gelpi on 6/20/2013. (TC) (Entered: 06/20/2013)"
        },
        {
          "row_number": 439,
          "id": 8975465,
          "entry_number": "1394",
          "date_filed": "2013-06-20T00:00:00-04:00",
          "attachments": null,
          "url": "https://www.courtlistener.com/docket/6672519/1394/united-states-v-commonwealth-of-pr/",
          "recap_pdf_url": null,
          "pacer_doc_id": null,
          "description": "ORDER granting 1387 Motion submitting Invoice for Services Rendered by Assistant Joint Compliance Coordinator for the month of April 2013 filed by Sylvia M. Fernandez-Colorado, PhD. Signed by Judge Gustavo A. Gelpi on 6/20/13. (cr) (Entered: 06/20/2013)"
        },
        {
          "row_number": 444,
          "id": 8975470,
          "entry_number": "1399",
          "date_filed": "2013-06-28T00:00:00-04:00",
          "attachments": null,
          "url": "https://www.courtlistener.com/docket/6672519/1399/united-states-v-commonwealth-of-pr/",
          "recap_pdf_url": null,
          "pacer_doc_id": "15904090700",
          "description": "Motion In Compliance filed by Arlene R. Perez-Borrero on behalf of All Defendants Suggestions in opposition/response due by 7/15/2013 (Attachments: # 1 Exhibit)(Perez-Borrero, Arlene) (Entered: 06/28/2013)"
        },
        {
          "row_number": 3199,
          "id": 8975471,
          "entry_number": null,
          "date_filed": "2013-07-01T00:00:00-04:00",
          "attachments": null,
          "url": "https://www.courtlistener.com",
          "recap_pdf_url": null,
          "pacer_doc_id": null,
          "description": "DEPOSIT of Funds in the amount of $ SEALED, receipt number PRX100020315. (Re: Dkt 1399) Deposited ((NEXT WORKING DAY)) in an Interest Bearing Account in compliance with L.R.67. Funds will be available for disbursement after 7/15/2013. (ga)"
        },
        {
          "row_number": 455,
          "id": 8975480,
          "entry_number": "1408",
          "date_filed": "2013-08-20T00:00:00-04:00",
          "attachments": null,
          "url": "https://www.courtlistener.com/docket/6672519/1408/united-states-v-commonwealth-of-pr/",
          "recap_pdf_url": null,
          "pacer_doc_id": "15904158391",
          "description": "MOTION Submitting Invoice for Services Rendered by the Assistant Joint Compliance Coordinator for the month of July 2013 filed by Sylvia M. Fernandez-Colorado, PhD. Suggestions in opposition/response due by 9/6/2013 (cr) (Entered: 08/20/2013)"
        },
        {
          "row_number": 460,
          "id": 8975484,
          "entry_number": "1412",
          "date_filed": "2013-09-05T00:00:00-04:00",
          "attachments": null,
          "url": "https://www.courtlistener.com/docket/6672519/1412/united-states-v-commonwealth-of-pr/",
          "recap_pdf_url": null,
          "pacer_doc_id": "15904186328",
          "description": "Minute Entry for proceedings held before Judge Gustavo A. Gelpi:Status Conference held on 9/5/2013. Further Status Conference set for 11/4/2013 03:00 PM in Old San Juan Courtroom before Judge Gustavo A. Gelpi. (cr) (Entered: 09/05/2013)"
        },
        {
          "row_number": 461,
          "id": 8975485,
          "entry_number": "1413",
          "date_filed": "2013-09-05T00:00:00-04:00",
          "attachments": null,
          "url": "https://www.courtlistener.com/docket/6672519/1413/united-states-v-commonwealth-of-pr/",
          "recap_pdf_url": null,
          "pacer_doc_id": "15904186344",
          "description": "***SELECTED PARTIES***ORDER as to participant A.H. Signed by Judge Gustavo A. Gelpi on 9/5/13. (Attachments: # 1 Photograph, # 2 Photograph, # 3 Photograph, # 4 Photograph)(cr) (Entered: 09/05/2013)"
        },
        {
          "row_number": 466,
          "id": 8975491,
          "entry_number": "1418",
          "date_filed": "2013-09-23T00:00:00-04:00",
          "attachments": null,
          "url": "https://www.courtlistener.com/docket/6672519/1418/united-states-v-commonwealth-of-pr/",
          "recap_pdf_url": null,
          "pacer_doc_id": "15904212026",
          "description": "ORDER: The court enters the attached order to permit doctors to examine inmate Ismael Nieves Rivera. Signed by Judge Gustavo A. Gelpi on 9/23/13. (CL) (Entered: 09/23/2013)"
        },
        {
          "row_number": 467,
          "id": 8975492,
          "entry_number": "1419",
          "date_filed": "2013-09-24T00:00:00-04:00",
          "attachments": null,
          "url": "https://www.courtlistener.com/docket/6672519/1419/united-states-v-commonwealth-of-pr/",
          "recap_pdf_url": null,
          "pacer_doc_id": "15904214828",
          "description": "NOTICE of Appointment of Pro Bono Counsel, Attorney Manuel San-Juan-De Martino, re 1416 Order. S/C of sent to Counsel San-Juan-De Martino. (er) (Entered: 09/25/2013)"
        },
        {
          "row_number": 469,
          "id": 8975493,
          "entry_number": "1420",
          "date_filed": "2013-10-16T00:00:00-04:00",
          "attachments": null,
          "url": "https://www.courtlistener.com/docket/6672519/1420/united-states-v-commonwealth-of-pr/",
          "recap_pdf_url": null,
          "pacer_doc_id": "15904246550",
          "description": "MOTION Submitting Invoice for Services Rendered the month of September 2013 by the assistant to the Joint Compliance Coordinator-(2) filed by Sylvia M. Fernandez-Colorado Suggestions in opposition/response due by 11/1/2013 (al) Modified on 10/17/2013 to add month of services (er). (Entered: 10/16/2013)"
        },
        {
          "row_number": 470,
          "id": 8975494,
          "entry_number": "1421",
          "date_filed": "2013-10-16T00:00:00-04:00",
          "attachments": null,
          "url": "https://www.courtlistener.com/docket/6672519/1421/united-states-v-commonwealth-of-pr/",
          "recap_pdf_url": null,
          "pacer_doc_id": "15904246557",
          "description": "MOTION Submitting Invoice for September 2013 Services Rendered by The assistant to the Joint Compliance Coordinator filed by Sylvia M. Fernandez-Colorado Suggestions in opposition/response due by 11/1/2013 (al) (Entered: 10/16/2013)"
        },
        {
          "row_number": 3201,
          "id": 8975496,
          "entry_number": null,
          "date_filed": "2013-10-16T00:00:00-04:00",
          "attachments": null,
          "url": "https://www.courtlistener.com",
          "recap_pdf_url": null,
          "pacer_doc_id": null,
          "description": "NOTICE of Docket Text Modification by Deputy Clerk re: 1422 Motion Submitting Invoice for September 2013 Services Rendered by The Joint Compliance Coordinator filed by Sylvia M. Fernandez-Colorado.***FILED IN ERROR, DUPLICATED SAME AS DKT 1421 *** (er)"
        },
        {
          "row_number": 472,
          "id": 8975497,
          "entry_number": "1423",
          "date_filed": "2013-10-17T00:00:00-04:00",
          "attachments": null,
          "url": "https://www.courtlistener.com/docket/6672519/1423/united-states-v-commonwealth-of-pr/",
          "recap_pdf_url": null,
          "pacer_doc_id": null,
          "description": "***FILED IN ERROR***ORDER noted 1422 Motion submitting Invoice for September 2013 Services Rendered by The Joint Compliance Coordinator filed by Sylvia M. Fernandez-Colorado Suggestions in opposition/response due by 11/1/2013 Signed by Judge Gustavo A. Gelpi on 10/17/2013. (al) Modified on 10/17/2013 as to month of the services (er). Modified on 10/24/2013 (er). (Entered: 10/17/2013)"
        },
        {
          "row_number": 473,
          "id": 8975498,
          "entry_number": "1424",
          "date_filed": "2013-10-17T00:00:00-04:00",
          "attachments": null,
          "url": "https://www.courtlistener.com/docket/6672519/1424/united-states-v-commonwealth-of-pr/",
          "recap_pdf_url": null,
          "pacer_doc_id": null,
          "description": "ORDER noted 1421 Motion submitting Invoice for September 2013 Services Rendered by The assistant to the Joint Compliance Coordinator filed by Sylvia M. Fernandez-Colorado Suggestions in opposition/response due by 11/1/2013 Signed by Judge Gustavo A. Gelpi on 10/17/13. (al) (Entered: 10/17/2013)"
        },
        {
          "row_number": 476,
          "id": 8975502,
          "entry_number": "1427",
          "date_filed": "2013-10-28T00:00:00-04:00",
          "attachments": null,
          "url": "https://www.courtlistener.com/docket/6672519/1427/united-states-v-commonwealth-of-pr/",
          "recap_pdf_url": null,
          "pacer_doc_id": "15904264917",
          "description": "MOTION requesting Order to continue services at Modesto Gotay Fundacion filed by Parents, Relatives and Friends of Mentally Retarded Population-Fundacion Modesto Gotay, Pro se. Suggestions in opposition/response due by 11/15/2013 (Attachments: # 1 Appendix Signatures)(er) (Entered: 10/29/2013)"
        },
        {
          "row_number": 478,
          "id": 8975504,
          "entry_number": "1429",
          "date_filed": "2013-10-29T00:00:00-04:00",
          "attachments": null,
          "url": "https://www.courtlistener.com/docket/6672519/1429/united-states-v-commonwealth-of-pr/",
          "recap_pdf_url": null,
          "pacer_doc_id": null,
          "description": "ORDER noted 1428 . Noted. The parties and Joint Compliance Coordinator shall review and discuss. Signed by Judge Gustavo A. Gelpi on 10/29/2013. (MET) (Entered: 10/29/2013)"
        },
        {
          "row_number": 480,
          "id": 8975505,
          "entry_number": "1430",
          "date_filed": "2013-10-29T00:00:00-04:00",
          "attachments": null,
          "url": "https://www.courtlistener.com/docket/6672519/1430/united-states-v-commonwealth-of-pr/",
          "recap_pdf_url": null,
          "pacer_doc_id": null,
          "description": "ORDER: Noted 1427 . The parties and Joint Compliance Coordinator shall review and discuss. Signed by Judge Gustavo A. Gelpi on 10/29/2013. (MET) (Entered: 10/29/2013)"
        },
        {
          "row_number": 482,
          "id": 8975507,
          "entry_number": "1432",
          "date_filed": "2013-11-05T00:00:00-05:00",
          "attachments": null,
          "url": "https://www.courtlistener.com/docket/6672519/1432/united-states-v-commonwealth-of-pr/",
          "recap_pdf_url": null,
          "pacer_doc_id": null,
          "description": "ORDER : Only Counsel, the JCC and MRP Director shall attend. Status Conference is set for 11/18/2013 at 2:00 PM in Old San Juan Courtroom before Judge Gustavo A. Gelpi.Signed by Judge Gustavo A. Gelpi on 11/5/2013.(al) (Entered: 11/05/2013)"
        },
        {
          "row_number": 486,
          "id": 8975511,
          "entry_number": "1436",
          "date_filed": "2013-12-09T00:00:00-05:00",
          "attachments": null,
          "url": "https://www.courtlistener.com/docket/6672519/1436/united-states-v-commonwealth-of-pr/",
          "recap_pdf_url": null,
          "pacer_doc_id": null,
          "description": "ORDER re 1426 Order: Status Conference set for 12/12/2013 is hereby vacated and set aside. Signed by Judge Gustavo A. Gelpi on 12/9/13.(al) (Entered: 12/09/2013)"
        },
        {
          "row_number": 488,
          "id": 8975513,
          "entry_number": "1438",
          "date_filed": "2013-12-09T00:00:00-05:00",
          "attachments": null,
          "url": "https://www.courtlistener.com/docket/6672519/1438/united-states-v-commonwealth-of-pr/",
          "recap_pdf_url": null,
          "pacer_doc_id": "15904318048",
          "description": "MOTION Submitting Invoice for November 2013 Services Rendered by The assistant to the Joint Compliance Coordinator filed by Sylvia M. Fernandez-Colorado Suggestions in opposition/response due by 12/26/2013 (al) (Entered: 12/09/2013)"
        },
        {
          "row_number": 489,
          "id": 8975514,
          "entry_number": "1439",
          "date_filed": "2013-12-09T00:00:00-05:00",
          "attachments": null,
          "url": "https://www.courtlistener.com/docket/6672519/1439/united-states-v-commonwealth-of-pr/",
          "recap_pdf_url": null,
          "pacer_doc_id": "15904318059",
          "description": "MOTION Submitting Invoice for November 2013 Services Rendered by The Joint Compliance Coordinator filed by Sylvia M. Fernandez-Colorado Suggestions in opposition/response due by 12/26/2013 (al) (Entered: 12/09/2013)"
        },
        {
          "row_number": 493,
          "id": 8975517,
          "entry_number": "1442",
          "date_filed": "2013-12-09T00:00:00-05:00",
          "attachments": null,
          "url": "https://www.courtlistener.com/docket/6672519/1442/united-states-v-commonwealth-of-pr/",
          "recap_pdf_url": null,
          "pacer_doc_id": "15904318083",
          "description": "MOTION Submitting Invoice for November 2013 Services Rendered by The assistant to the Joint Compliance Coordinator-2 filed by Sylvia M. Fernandez-Colorado Suggestions in opposition/response due by 12/26/2013 (al) (Entered: 12/09/2013)"
        },
        {
          "row_number": 494,
          "id": 8975518,
          "entry_number": "1443",
          "date_filed": "2013-12-10T00:00:00-05:00",
          "attachments": null,
          "url": "https://www.courtlistener.com/docket/6672519/1443/united-states-v-commonwealth-of-pr/",
          "recap_pdf_url": null,
          "pacer_doc_id": null,
          "description": "ORDER NOTED re 1442 MOTION Invoice Submitting filed by Sylvia M. Fernandez-Colorado, 1439 MOTION Submitting Invoice filed by Sylvia M. Fernandez-Colorado, 1437 MOTION Submitting Invoices filed by Sylvia M. Fernandez-Colorado, 1441 MOTION Submitting Invoice filed by Sylvia M. Fernandez-Colorado, 1440 MOTION Submitting Invoice filed by Sylvia M. Fernandez-Colorado, 1438 MOTION Submitting Invoice filed by Sylvia M. Fernandez-Colorado The Health Department shall deposit funds to pay all invoices to JCC (amount due $41,290.00) on or before 12/20/2013. So Ordered.Signed by Judge Gustavo A. Gelpi on 12/10/13.(al) (Entered: 12/10/2013)"
        },
        {
          "row_number": 497,
          "id": 8975521,
          "entry_number": "1446",
          "date_filed": "2014-01-09T00:00:00-05:00",
          "attachments": null,
          "url": "https://www.courtlistener.com/docket/6672519/1446/united-states-v-commonwealth-of-pr/",
          "recap_pdf_url": null,
          "pacer_doc_id": "15904352020",
          "description": "MOTION Submitting Invoice for December 2013 Services Rendered by The Joint Compliance Coordinator filed by Sylvia M. Fernandez-Colorado Suggestions in opposition/response due by 1/27/2014 (al) (Entered: 01/09/2014)"
        },
        {
          "row_number": 498,
          "id": 8975522,
          "entry_number": "1447",
          "date_filed": "2014-01-09T00:00:00-05:00",
          "attachments": null,
          "url": "https://www.courtlistener.com/docket/6672519/1447/united-states-v-commonwealth-of-pr/",
          "recap_pdf_url": null,
          "pacer_doc_id": null,
          "description": "ORDER granting 1444 Motion submitting Signed by Judge Gustavo A. Gelpi on 1/9/14. (al) (Entered: 01/09/2014)"
        },
        {
          "row_number": 499,
          "id": 8975523,
          "entry_number": "1448",
          "date_filed": "2014-01-09T00:00:00-05:00",
          "attachments": null,
          "url": "https://www.courtlistener.com/docket/6672519/1448/united-states-v-commonwealth-of-pr/",
          "recap_pdf_url": null,
          "pacer_doc_id": null,
          "description": "ORDER granting 1445 Motion submitting Signed by Judge Gustavo A. Gelpi on 1/9/14. (al) (Entered: 01/09/2014)"
        },
        {
          "row_number": 500,
          "id": 8975524,
          "entry_number": "1449",
          "date_filed": "2014-01-09T00:00:00-05:00",
          "attachments": null,
          "url": "https://www.courtlistener.com/docket/6672519/1449/united-states-v-commonwealth-of-pr/",
          "recap_pdf_url": null,
          "pacer_doc_id": null,
          "description": "ORDER granting 1446 Motion submitting Signed by Judge Gustavo A. Gelpi on 1/9/14. (al) (Entered: 01/09/2014)"
        },
        {
          "row_number": 510,
          "id": 8975533,
          "entry_number": "1458",
          "date_filed": "2014-01-10T00:00:00-05:00",
          "attachments": null,
          "url": "https://www.courtlistener.com/docket/6672519/1458/united-states-v-commonwealth-of-pr/",
          "recap_pdf_url": null,
          "pacer_doc_id": null,
          "description": "ORDER: Noted 1438 Motion submitting. Signed by Judge Gustavo A. Gelpi on 1/10/2014. (GDM) (Entered: 01/10/2014)"
        },
        {
          "row_number": 514,
          "id": 8975536,
          "entry_number": "1461",
          "date_filed": "2014-01-10T00:00:00-05:00",
          "attachments": null,
          "url": "https://www.courtlistener.com/docket/6672519/1461/united-states-v-commonwealth-of-pr/",
          "recap_pdf_url": null,
          "pacer_doc_id": null,
          "description": "ORDER: Noted 1441 Motion submitting. Signed by Judge Gustavo A. Gelpi on 1/10/2014. (GDM) (Entered: 01/10/2014)"
        },
        {
          "row_number": 515,
          "id": 8975537,
          "entry_number": "1462",
          "date_filed": "2014-01-10T00:00:00-05:00",
          "attachments": null,
          "url": "https://www.courtlistener.com/docket/6672519/1462/united-states-v-commonwealth-of-pr/",
          "recap_pdf_url": null,
          "pacer_doc_id": null,
          "description": "ORDER: Noted 1442 Motion submitting. Signed by Judge Gustavo A. Gelpi on 1/10/2014. (GDM) (Entered: 01/10/2014)"
        },
        {
          "row_number": 521,
          "id": 8975543,
          "entry_number": "1468",
          "date_filed": "2014-01-27T00:00:00-05:00",
          "attachments": null,
          "url": "https://www.courtlistener.com/docket/6672519/1468/united-states-v-commonwealth-of-pr/",
          "recap_pdf_url": null,
          "pacer_doc_id": "15904374814",
          "description": "MOTION to Deposit Funds filed by Arlene R. Perez-Borrero on behalf of All Defendants Suggestions in opposition/response due by 2/13/2014 (Perez-Borrero, Arlene) (Entered: 01/27/2014)"
        },
        {
          "row_number": 3203,
          "id": 8975544,
          "entry_number": null,
          "date_filed": "2014-01-27T00:00:00-05:00",
          "attachments": null,
          "url": "https://www.courtlistener.com",
          "recap_pdf_url": null,
          "pacer_doc_id": null,
          "description": "DEPOSIT of Funds in the amount of $ 330,000.00, receipt number PRX100024370. (Re: Dkt 1468) Deposited ((NEXT WORKING DAY)) in an Interest Bearing Account in compliance with L.R.67. Funds will be available for disbursement after 2/7/2014. (jla)"
        },
        {
          "row_number": 522,
          "id": 8975545,
          "entry_number": "1469",
          "date_filed": "2014-01-27T00:00:00-05:00",
          "attachments": null,
          "url": "https://www.courtlistener.com/docket/6672519/1469/united-states-v-commonwealth-of-pr/",
          "recap_pdf_url": null,
          "pacer_doc_id": "15904375666",
          "description": "MINUTE OF PROCEEDINGS AND ORDER Signed by Judge Gustavo A. Gelpi on 1/27/2014.(MET) (Entered: 01/27/2014)"
        },
        {
          "row_number": 524,
          "id": 8975546,
          "entry_number": "1470",
          "date_filed": "2014-02-10T00:00:00-05:00",
          "attachments": null,
          "url": "https://www.courtlistener.com/docket/6672519/1470/united-states-v-commonwealth-of-pr/",
          "recap_pdf_url": null,
          "pacer_doc_id": "15904397176",
          "description": "ORDER: Regarding Budget for Fiscal Year 2014. Signed by Judge Gustavo A. Gelpi on 2/10/2014.(MET) (Entered: 02/10/2014)"
        },
        {
          "row_number": 526,
          "id": 8975548,
          "entry_number": "1472",
          "date_filed": "2014-03-03T00:00:00-05:00",
          "attachments": null,
          "url": "https://www.courtlistener.com/docket/6672519/1472/united-states-v-commonwealth-of-pr/",
          "recap_pdf_url": null,
          "pacer_doc_id": "15904428795",
          "description": "MOTION Submitting Invoice for January 2014 Services Rendered by The assistant to the Joint Compliance Coordinator-2 Re: Dr. Carmelo Rodriguez Perez filed by Sylvia M. Fernandez-Colorado Suggestions in opposition/response due by 3/20/2014 (al) Modified to add the name of physician on 3/25/2014 (su). (Entered: 03/03/2014)"
        },
        {
          "row_number": 527,
          "id": 8975549,
          "entry_number": "1473",
          "date_filed": "2014-03-03T00:00:00-05:00",
          "attachments": null,
          "url": "https://www.courtlistener.com/docket/6672519/1473/united-states-v-commonwealth-of-pr/",
          "recap_pdf_url": null,
          "pacer_doc_id": "15904428815",
          "description": "MOTION Submitting Invoice for January 2014 Services Rendered by The Joint Compliance Coordinator Re: Sylvia Fernandez Colorado filed by Sylvia M. Fernandez-Colorado. Suggestions in opposition/response due by 3/20/2014 (al) Modified to add the name of physician on 3/25/2014 (su). (Entered: 03/03/2014)"
        },
        {
          "row_number": 528,
          "id": 8975550,
          "entry_number": "1474",
          "date_filed": "2014-03-03T00:00:00-05:00",
          "attachments": null,
          "url": "https://www.courtlistener.com/docket/6672519/1474/united-states-v-commonwealth-of-pr/",
          "recap_pdf_url": null,
          "pacer_doc_id": "15904428840",
          "description": "MOTION Submitting Invoice for January 2014 Services Rendered by The assistant to the Joint Compliance Coordinator Re: Dr. Dimaris Garcia Mercado filed by Sylvia M. Fernandez-Colorado Suggestions in opposition/response due by 3/20/2014 (al) Modified to add the name of physician on 3/25/2014 (su). (Entered: 03/03/2014)"
        },
        {
          "row_number": 529,
          "id": 8975551,
          "entry_number": "1475",
          "date_filed": "2014-03-03T00:00:00-05:00",
          "attachments": null,
          "url": "https://www.courtlistener.com/docket/6672519/1475/united-states-v-commonwealth-of-pr/",
          "recap_pdf_url": null,
          "pacer_doc_id": null,
          "description": "ORDER granting 1472 Motion submitting Invoice Signed by Judge Gustavo A. Gelpi on 3/3/14. (al) (Entered: 03/03/2014)"
        },
        {
          "row_number": 3205,
          "id": 8975556,
          "entry_number": null,
          "date_filed": "2015-04-20T00:00:00-04:00",
          "attachments": null,
          "url": "https://www.courtlistener.com",
          "recap_pdf_url": null,
          "pacer_doc_id": null,
          "description": "Order on Motion Submitting"
        },
        {
          "row_number": 3206,
          "id": 8975557,
          "entry_number": null,
          "date_filed": "2015-04-20T00:00:00-04:00",
          "attachments": null,
          "url": "https://www.courtlistener.com",
          "recap_pdf_url": null,
          "pacer_doc_id": null,
          "description": "Order on Motion Submitting"
        },
        {
          "row_number": 3207,
          "id": 8975558,
          "entry_number": null,
          "date_filed": "2015-04-20T00:00:00-04:00",
          "attachments": null,
          "url": "https://www.courtlistener.com",
          "recap_pdf_url": null,
          "pacer_doc_id": null,
          "description": "Order on Motion Submitting"
        },
        {
          "row_number": 3208,
          "id": 8975559,
          "entry_number": null,
          "date_filed": "2015-05-27T00:00:00-04:00",
          "attachments": null,
          "url": "https://www.courtlistener.com",
          "recap_pdf_url": null,
          "pacer_doc_id": null,
          "description": "Order on Motion Submitting"
        },
        {
          "row_number": 3209,
          "id": 8975560,
          "entry_number": null,
          "date_filed": "2015-05-27T00:00:00-04:00",
          "attachments": null,
          "url": "https://www.courtlistener.com",
          "recap_pdf_url": null,
          "pacer_doc_id": null,
          "description": "Order on Motion Submitting"
        },
        {
          "row_number": 3218,
          "id": 8975569,
          "entry_number": null,
          "date_filed": "2015-08-10T00:00:00-04:00",
          "attachments": null,
          "url": "https://www.courtlistener.com",
          "recap_pdf_url": null,
          "pacer_doc_id": null,
          "description": "Order on Motion Submitting"
        },
        {
          "row_number": 3219,
          "id": 8975570,
          "entry_number": null,
          "date_filed": "2015-08-10T00:00:00-04:00",
          "attachments": null,
          "url": "https://www.courtlistener.com",
          "recap_pdf_url": null,
          "pacer_doc_id": null,
          "description": "Order on Motion Submitting"
        },
        {
          "row_number": 3233,
          "id": 8975584,
          "entry_number": null,
          "date_filed": "2015-10-28T00:00:00-04:00",
          "attachments": null,
          "url": "https://www.courtlistener.com",
          "recap_pdf_url": null,
          "pacer_doc_id": null,
          "description": "Order on Motion Submitting"
        },
        {
          "row_number": 3234,
          "id": 8975585,
          "entry_number": null,
          "date_filed": "2015-10-28T00:00:00-04:00",
          "attachments": null,
          "url": "https://www.courtlistener.com",
          "recap_pdf_url": null,
          "pacer_doc_id": null,
          "description": "Order on Motion Submitting"
        },
        {
          "row_number": 3249,
          "id": 8975600,
          "entry_number": null,
          "date_filed": "2016-01-27T00:00:00-05:00",
          "attachments": null,
          "url": "https://www.courtlistener.com",
          "recap_pdf_url": null,
          "pacer_doc_id": null,
          "description": "Order on Motion Submitting"
        },
        {
          "row_number": 3252,
          "id": 8975603,
          "entry_number": null,
          "date_filed": "2016-02-05T00:00:00-05:00",
          "attachments": null,
          "url": "https://www.courtlistener.com",
          "recap_pdf_url": null,
          "pacer_doc_id": null,
          "description": "Order on Motion In Compliance"
        },
        {
          "row_number": 3253,
          "id": 8975604,
          "entry_number": null,
          "date_filed": "2016-02-08T00:00:00-05:00",
          "attachments": null,
          "url": "https://www.courtlistener.com",
          "recap_pdf_url": null,
          "pacer_doc_id": null,
          "description": "Order"
        },
        {
          "row_number": 3254,
          "id": 8975605,
          "entry_number": null,
          "date_filed": "2016-02-12T00:00:00-05:00",
          "attachments": null,
          "url": "https://www.courtlistener.com",
          "recap_pdf_url": null,
          "pacer_doc_id": null,
          "description": "Order on Motion to Clarify"
        },
        {
          "row_number": 3255,
          "id": 8975606,
          "entry_number": null,
          "date_filed": "2016-02-12T00:00:00-05:00",
          "attachments": null,
          "url": "https://www.courtlistener.com",
          "recap_pdf_url": null,
          "pacer_doc_id": null,
          "description": "Order on Informative Motion"
        },
        {
          "row_number": 3256,
          "id": 8975607,
          "entry_number": null,
          "date_filed": "2016-02-17T00:00:00-05:00",
          "attachments": null,
          "url": "https://www.courtlistener.com",
          "recap_pdf_url": null,
          "pacer_doc_id": null,
          "description": "Order on Informative Motion"
        },
        {
          "row_number": 3257,
          "id": 8975608,
          "entry_number": null,
          "date_filed": "2016-03-09T00:00:00-05:00",
          "attachments": null,
          "url": "https://www.courtlistener.com",
          "recap_pdf_url": null,
          "pacer_doc_id": null,
          "description": "Order on Motion Submitting"
        },
        {
          "row_number": 3258,
          "id": 8975609,
          "entry_number": null,
          "date_filed": "2016-03-09T00:00:00-05:00",
          "attachments": null,
          "url": "https://www.courtlistener.com",
          "recap_pdf_url": null,
          "pacer_doc_id": null,
          "description": "Order on Motion Submitting"
        },
        {
          "row_number": 3259,
          "id": 8975610,
          "entry_number": null,
          "date_filed": "2016-03-09T00:00:00-05:00",
          "attachments": null,
          "url": "https://www.courtlistener.com",
          "recap_pdf_url": null,
          "pacer_doc_id": null,
          "description": "Order on Motion Submitting"
        },
        {
          "row_number": 3260,
          "id": 8975611,
          "entry_number": null,
          "date_filed": "2016-03-09T00:00:00-05:00",
          "attachments": null,
          "url": "https://www.courtlistener.com",
          "recap_pdf_url": null,
          "pacer_doc_id": null,
          "description": "Order on Motion Submitting"
        },
        {
          "row_number": 3261,
          "id": 8975612,
          "entry_number": null,
          "date_filed": "2016-03-09T00:00:00-05:00",
          "attachments": null,
          "url": "https://www.courtlistener.com",
          "recap_pdf_url": null,
          "pacer_doc_id": null,
          "description": "Order"
        },
        {
          "row_number": 3262,
          "id": 8975613,
          "entry_number": null,
          "date_filed": "2016-03-09T00:00:00-05:00",
          "attachments": null,
          "url": "https://www.courtlistener.com",
          "recap_pdf_url": null,
          "pacer_doc_id": null,
          "description": "Order on Motion to Restrict"
        },
        {
          "row_number": 3263,
          "id": 8975614,
          "entry_number": null,
          "date_filed": "2016-03-10T00:00:00-05:00",
          "attachments": null,
          "url": "https://www.courtlistener.com",
          "recap_pdf_url": null,
          "pacer_doc_id": null,
          "description": "Order"
        },
        {
          "row_number": 3264,
          "id": 8975615,
          "entry_number": null,
          "date_filed": "2016-03-10T00:00:00-05:00",
          "attachments": null,
          "url": "https://www.courtlistener.com",
          "recap_pdf_url": null,
          "pacer_doc_id": null,
          "description": "Order on Motion to Withdraw as Attorney"
        },
        {
          "row_number": 3265,
          "id": 8975616,
          "entry_number": null,
          "date_filed": "2016-03-23T00:00:00-04:00",
          "attachments": null,
          "url": "https://www.courtlistener.com",
          "recap_pdf_url": null,
          "pacer_doc_id": null,
          "description": "Order on Motion for Miscellaneous Relief"
        },
        {
          "row_number": 3266,
          "id": 8975617,
          "entry_number": null,
          "date_filed": "2016-04-09T00:00:00-04:00",
          "attachments": null,
          "url": "https://www.courtlistener.com",
          "recap_pdf_url": null,
          "pacer_doc_id": null,
          "description": "Order"
        },
        {
          "row_number": 3267,
          "id": 8975618,
          "entry_number": null,
          "date_filed": "2016-04-09T00:00:00-04:00",
          "attachments": null,
          "url": "https://www.courtlistener.com",
          "recap_pdf_url": null,
          "pacer_doc_id": null,
          "description": "Order on Motion to Restrict"
        },
        {
          "row_number": 3268,
          "id": 8975619,
          "entry_number": null,
          "date_filed": "2016-04-09T00:00:00-04:00",
          "attachments": null,
          "url": "https://www.courtlistener.com",
          "recap_pdf_url": null,
          "pacer_doc_id": null,
          "description": "Order on Informative Motion"
        },
        {
          "row_number": 3269,
          "id": 8975620,
          "entry_number": null,
          "date_filed": "2016-04-11T00:00:00-04:00",
          "attachments": null,
          "url": "https://www.courtlistener.com",
          "recap_pdf_url": null,
          "pacer_doc_id": null,
          "description": "Order on Motion Submitting"
        },
        {
          "row_number": 3270,
          "id": 8975621,
          "entry_number": null,
          "date_filed": "2016-04-11T00:00:00-04:00",
          "attachments": null,
          "url": "https://www.courtlistener.com",
          "recap_pdf_url": null,
          "pacer_doc_id": null,
          "description": "Order on Motion Submitting"
        },
        {
          "row_number": 3271,
          "id": 8975622,
          "entry_number": null,
          "date_filed": "2016-04-11T00:00:00-04:00",
          "attachments": null,
          "url": "https://www.courtlistener.com",
          "recap_pdf_url": null,
          "pacer_doc_id": null,
          "description": "Order on Motion Submitting"
        },
        {
          "row_number": 3272,
          "id": 8975623,
          "entry_number": null,
          "date_filed": "2016-04-11T00:00:00-04:00",
          "attachments": null,
          "url": "https://www.courtlistener.com",
          "recap_pdf_url": null,
          "pacer_doc_id": null,
          "description": "Order on Motion Submitting"
        },
        {
          "row_number": 3273,
          "id": 8975624,
          "entry_number": null,
          "date_filed": "2016-04-12T00:00:00-04:00",
          "attachments": null,
          "url": "https://www.courtlistener.com",
          "recap_pdf_url": null,
          "pacer_doc_id": null,
          "description": "Order on Motion Submitting"
        },
        {
          "row_number": 3275,
          "id": 8975626,
          "entry_number": null,
          "date_filed": "2016-04-18T00:00:00-04:00",
          "attachments": null,
          "url": "https://www.courtlistener.com",
          "recap_pdf_url": null,
          "pacer_doc_id": null,
          "description": "~Util - Terminate Motions AND Order"
        },
        {
          "row_number": 3276,
          "id": 8975627,
          "entry_number": null,
          "date_filed": "2016-04-18T00:00:00-04:00",
          "attachments": null,
          "url": "https://www.courtlistener.com",
          "recap_pdf_url": null,
          "pacer_doc_id": null,
          "description": "Order on Motion to Restrict"
        },
        {
          "row_number": 3277,
          "id": 8975628,
          "entry_number": null,
          "date_filed": "2016-04-22T00:00:00-04:00",
          "attachments": null,
          "url": "https://www.courtlistener.com",
          "recap_pdf_url": null,
          "pacer_doc_id": null,
          "description": "Order"
        },
        {
          "row_number": 3278,
          "id": 8975629,
          "entry_number": null,
          "date_filed": "2016-04-26T00:00:00-04:00",
          "attachments": null,
          "url": "https://www.courtlistener.com",
          "recap_pdf_url": null,
          "pacer_doc_id": null,
          "description": "Order on Informative Motion"
        },
        {
          "row_number": 3279,
          "id": 8975630,
          "entry_number": null,
          "date_filed": "2016-05-04T00:00:00-04:00",
          "attachments": null,
          "url": "https://www.courtlistener.com",
          "recap_pdf_url": null,
          "pacer_doc_id": null,
          "description": "Order on Motion for Extension of Time"
        },
        {
          "row_number": 3280,
          "id": 8975631,
          "entry_number": null,
          "date_filed": "2016-05-05T00:00:00-04:00",
          "attachments": null,
          "url": "https://www.courtlistener.com",
          "recap_pdf_url": null,
          "pacer_doc_id": null,
          "description": "Deposit of Funds"
        },
        {
          "row_number": 3282,
          "id": 8975633,
          "entry_number": null,
          "date_filed": "2016-05-13T00:00:00-04:00",
          "attachments": null,
          "url": "https://www.courtlistener.com",
          "recap_pdf_url": null,
          "pacer_doc_id": null,
          "description": "Order on Informative Motion"
        },
        {
          "row_number": 3283,
          "id": 8975634,
          "entry_number": null,
          "date_filed": "2016-05-16T00:00:00-04:00",
          "attachments": null,
          "url": "https://www.courtlistener.com",
          "recap_pdf_url": null,
          "pacer_doc_id": null,
          "description": "Order on Motion Submitting"
        },
        {
          "row_number": 3284,
          "id": 8975635,
          "entry_number": null,
          "date_filed": "2016-05-16T00:00:00-04:00",
          "attachments": null,
          "url": "https://www.courtlistener.com",
          "recap_pdf_url": null,
          "pacer_doc_id": null,
          "description": "Order on Motion Submitting"
        },
        {
          "row_number": 3285,
          "id": 8975636,
          "entry_number": null,
          "date_filed": "2016-05-16T00:00:00-04:00",
          "attachments": null,
          "url": "https://www.courtlistener.com",
          "recap_pdf_url": null,
          "pacer_doc_id": null,
          "description": "Order on Motion Submitting"
        },
        {
          "row_number": 3286,
          "id": 8975637,
          "entry_number": null,
          "date_filed": "2016-05-16T00:00:00-04:00",
          "attachments": null,
          "url": "https://www.courtlistener.com",
          "recap_pdf_url": null,
          "pacer_doc_id": null,
          "description": "Order on Motion Submitting"
        },
        {
          "row_number": 3287,
          "id": 8975638,
          "entry_number": null,
          "date_filed": "2016-05-16T00:00:00-04:00",
          "attachments": null,
          "url": "https://www.courtlistener.com",
          "recap_pdf_url": null,
          "pacer_doc_id": null,
          "description": "Order on Motion Submitting"
        },
        {
          "row_number": 3288,
          "id": 8975639,
          "entry_number": null,
          "date_filed": "2016-06-20T00:00:00-04:00",
          "attachments": null,
          "url": "https://www.courtlistener.com",
          "recap_pdf_url": null,
          "pacer_doc_id": null,
          "description": "Order on Motion Submitting"
        },
        {
          "row_number": 3289,
          "id": 8975640,
          "entry_number": null,
          "date_filed": "2016-06-20T00:00:00-04:00",
          "attachments": null,
          "url": "https://www.courtlistener.com",
          "recap_pdf_url": null,
          "pacer_doc_id": null,
          "description": "Order on Motion Submitting"
        },
        {
          "row_number": 3290,
          "id": 8975641,
          "entry_number": null,
          "date_filed": "2016-06-20T00:00:00-04:00",
          "attachments": null,
          "url": "https://www.courtlistener.com",
          "recap_pdf_url": null,
          "pacer_doc_id": null,
          "description": "Order on Motion Submitting"
        },
        {
          "row_number": 3291,
          "id": 8975642,
          "entry_number": null,
          "date_filed": "2016-06-20T00:00:00-04:00",
          "attachments": null,
          "url": "https://www.courtlistener.com",
          "recap_pdf_url": null,
          "pacer_doc_id": null,
          "description": "Order on Motion Submitting"
        },
        {
          "row_number": 3299,
          "id": 8975650,
          "entry_number": null,
          "date_filed": "2016-07-27T00:00:00-04:00",
          "attachments": null,
          "url": "https://www.courtlistener.com",
          "recap_pdf_url": null,
          "pacer_doc_id": null,
          "description": "Order on Motion Submitting"
        },
        {
          "row_number": 3305,
          "id": 8975656,
          "entry_number": null,
          "date_filed": "2016-08-04T00:00:00-04:00",
          "attachments": null,
          "url": "https://www.courtlistener.com",
          "recap_pdf_url": null,
          "pacer_doc_id": null,
          "description": "Order on Motion requesting Order"
        },
        {
          "row_number": 3314,
          "id": 8975665,
          "entry_number": null,
          "date_filed": "2016-09-09T00:00:00-04:00",
          "attachments": null,
          "url": "https://www.courtlistener.com",
          "recap_pdf_url": null,
          "pacer_doc_id": null,
          "description": "Order on Motion Submitting"
        },
        {
          "row_number": 3315,
          "id": 8975666,
          "entry_number": null,
          "date_filed": "2016-09-09T00:00:00-04:00",
          "attachments": null,
          "url": "https://www.courtlistener.com",
          "recap_pdf_url": null,
          "pacer_doc_id": null,
          "description": "Order on Motion Submitting"
        },
        {
          "row_number": 3319,
          "id": 8975670,
          "entry_number": null,
          "date_filed": "2016-10-31T00:00:00-04:00",
          "attachments": null,
          "url": "https://www.courtlistener.com",
          "recap_pdf_url": null,
          "pacer_doc_id": null,
          "description": "Order on Motion to Clarify"
        },
        {
          "row_number": 3320,
          "id": 8975671,
          "entry_number": null,
          "date_filed": "2016-11-10T00:00:00-05:00",
          "attachments": null,
          "url": "https://www.courtlistener.com",
          "recap_pdf_url": null,
          "pacer_doc_id": null,
          "description": "Order on Motion Submitting"
        },
        {
          "row_number": 3321,
          "id": 8975672,
          "entry_number": null,
          "date_filed": "2016-11-10T00:00:00-05:00",
          "attachments": null,
          "url": "https://www.courtlistener.com",
          "recap_pdf_url": null,
          "pacer_doc_id": null,
          "description": "Order on Motion Submitting"
        },
        {
          "row_number": 3322,
          "id": 8975673,
          "entry_number": null,
          "date_filed": "2016-11-10T00:00:00-05:00",
          "attachments": null,
          "url": "https://www.courtlistener.com",
          "recap_pdf_url": null,
          "pacer_doc_id": null,
          "description": "Order on Motion Submitting"
        },
        {
          "row_number": 3323,
          "id": 8975674,
          "entry_number": null,
          "date_filed": "2016-11-10T00:00:00-05:00",
          "attachments": null,
          "url": "https://www.courtlistener.com",
          "recap_pdf_url": null,
          "pacer_doc_id": null,
          "description": "Order on Motion Submitting"
        },
        {
          "row_number": 3324,
          "id": 8975675,
          "entry_number": null,
          "date_filed": "2016-11-10T00:00:00-05:00",
          "attachments": null,
          "url": "https://www.courtlistener.com",
          "recap_pdf_url": null,
          "pacer_doc_id": null,
          "description": "Order on Motion Submitting"
        },
        {
          "row_number": 3327,
          "id": 8975678,
          "entry_number": null,
          "date_filed": "2016-12-16T00:00:00-05:00",
          "attachments": null,
          "url": "https://www.courtlistener.com",
          "recap_pdf_url": null,
          "pacer_doc_id": null,
          "description": "~Util - Terminate Motions AND Order"
        },
        {
          "row_number": 3328,
          "id": 8975679,
          "entry_number": null,
          "date_filed": "2016-12-16T00:00:00-05:00",
          "attachments": null,
          "url": "https://www.courtlistener.com",
          "recap_pdf_url": null,
          "pacer_doc_id": null,
          "description": "Order"
        },
        {
          "row_number": 3329,
          "id": 8975680,
          "entry_number": null,
          "date_filed": "2016-12-19T00:00:00-05:00",
          "attachments": null,
          "url": "https://www.courtlistener.com",
          "recap_pdf_url": null,
          "pacer_doc_id": null,
          "description": "~Util - Set Hearings AND Order"
        },
        {
          "row_number": 3330,
          "id": 8975681,
          "entry_number": null,
          "date_filed": "2016-12-21T00:00:00-05:00",
          "attachments": null,
          "url": "https://www.courtlistener.com",
          "recap_pdf_url": null,
          "pacer_doc_id": null,
          "description": "Notice of Docket Text Modification"
        },
        {
          "row_number": 3331,
          "id": 8975682,
          "entry_number": null,
          "date_filed": "2016-12-22T00:00:00-05:00",
          "attachments": null,
          "url": "https://www.courtlistener.com",
          "recap_pdf_url": null,
          "pacer_doc_id": null,
          "description": "Order on Motion for Leave to File Spanish language documents"
        },
        {
          "row_number": 3332,
          "id": 8975683,
          "entry_number": null,
          "date_filed": "2016-12-22T00:00:00-05:00",
          "attachments": null,
          "url": "https://www.courtlistener.com",
          "recap_pdf_url": null,
          "pacer_doc_id": null,
          "description": "Order on Motion Submitting"
        },
        {
          "row_number": 3333,
          "id": 8975684,
          "entry_number": null,
          "date_filed": "2016-12-27T00:00:00-05:00",
          "attachments": null,
          "url": "https://www.courtlistener.com",
          "recap_pdf_url": null,
          "pacer_doc_id": null,
          "description": "Order on Motion Submitting"
        },
        {
          "row_number": 3334,
          "id": 8975685,
          "entry_number": null,
          "date_filed": "2016-12-27T00:00:00-05:00",
          "attachments": null,
          "url": "https://www.courtlistener.com",
          "recap_pdf_url": null,
          "pacer_doc_id": null,
          "description": "Order on Motion Submitting"
        },
        {
          "row_number": 3335,
          "id": 8975686,
          "entry_number": null,
          "date_filed": "2016-12-27T00:00:00-05:00",
          "attachments": null,
          "url": "https://www.courtlistener.com",
          "recap_pdf_url": null,
          "pacer_doc_id": null,
          "description": "Order on Motion Submitting"
        },
        {
          "row_number": 3336,
          "id": 8975687,
          "entry_number": null,
          "date_filed": "2016-12-27T00:00:00-05:00",
          "attachments": null,
          "url": "https://www.courtlistener.com",
          "recap_pdf_url": null,
          "pacer_doc_id": null,
          "description": "Order on Motion Submitting"
        },
        {
          "row_number": 3337,
          "id": 8975688,
          "entry_number": null,
          "date_filed": "2017-01-09T00:00:00-05:00",
          "attachments": null,
          "url": "https://www.courtlistener.com",
          "recap_pdf_url": null,
          "pacer_doc_id": null,
          "description": "Order on Motion Submitting"
        },
        {
          "row_number": 3338,
          "id": 8975689,
          "entry_number": null,
          "date_filed": "2017-01-17T00:00:00-05:00",
          "attachments": null,
          "url": "https://www.courtlistener.com",
          "recap_pdf_url": null,
          "pacer_doc_id": null,
          "description": "Order"
        },
        {
          "row_number": 3339,
          "id": 8975690,
          "entry_number": null,
          "date_filed": "2017-01-23T00:00:00-05:00",
          "attachments": null,
          "url": "https://www.courtlistener.com",
          "recap_pdf_url": null,
          "pacer_doc_id": null,
          "description": "Order on Motion for Extension of Time to File"
        },
        {
          "row_number": 3348,
          "id": 8975699,
          "entry_number": null,
          "date_filed": "2017-03-08T00:00:00-05:00",
          "attachments": null,
          "url": "https://www.courtlistener.com",
          "recap_pdf_url": null,
          "pacer_doc_id": null,
          "description": "Order on Motion Submitting"
        },
        {
          "row_number": 3349,
          "id": 8975700,
          "entry_number": null,
          "date_filed": "2017-03-08T00:00:00-05:00",
          "attachments": null,
          "url": "https://www.courtlistener.com",
          "recap_pdf_url": null,
          "pacer_doc_id": null,
          "description": "Order on Motion Submitting"
        },
        {
          "row_number": 3350,
          "id": 8975701,
          "entry_number": null,
          "date_filed": "2017-03-08T00:00:00-05:00",
          "attachments": null,
          "url": "https://www.courtlistener.com",
          "recap_pdf_url": null,
          "pacer_doc_id": null,
          "description": "Order on Motion Submitting"
        },
        {
          "row_number": 3352,
          "id": 8975703,
          "entry_number": null,
          "date_filed": "2017-03-08T00:00:00-05:00",
          "attachments": null,
          "url": "https://www.courtlistener.com",
          "recap_pdf_url": null,
          "pacer_doc_id": null,
          "description": "Order on Motion Submitting"
        },
        {
          "row_number": 3353,
          "id": 8975704,
          "entry_number": null,
          "date_filed": "2017-03-08T00:00:00-05:00",
          "attachments": null,
          "url": "https://www.courtlistener.com",
          "recap_pdf_url": null,
          "pacer_doc_id": null,
          "description": "Order on Motion Submitting"
        },
        {
          "row_number": 3355,
          "id": 8975706,
          "entry_number": null,
          "date_filed": "2017-03-21T00:00:00-04:00",
          "attachments": null,
          "url": "https://www.courtlistener.com",
          "recap_pdf_url": null,
          "pacer_doc_id": null,
          "description": "Notice of Docket Text Modification"
        },
        {
          "row_number": 3357,
          "id": 8975708,
          "entry_number": null,
          "date_filed": "2017-04-03T00:00:00-04:00",
          "attachments": null,
          "url": "https://www.courtlistener.com",
          "recap_pdf_url": null,
          "pacer_doc_id": null,
          "description": "Order on Informative Motion"
        },
        {
          "row_number": 3359,
          "id": 8975710,
          "entry_number": null,
          "date_filed": "2017-04-19T00:00:00-04:00",
          "attachments": null,
          "url": "https://www.courtlistener.com",
          "recap_pdf_url": null,
          "pacer_doc_id": null,
          "description": "Notice of Docket Text Modification"
        },
        {
          "row_number": 3360,
          "id": 8975711,
          "entry_number": null,
          "date_filed": "2017-04-19T00:00:00-04:00",
          "attachments": null,
          "url": "https://www.courtlistener.com",
          "recap_pdf_url": null,
          "pacer_doc_id": null,
          "description": "Order on Motion Submitting"
        },
        {
          "row_number": 3361,
          "id": 8975712,
          "entry_number": null,
          "date_filed": "2017-04-20T00:00:00-04:00",
          "attachments": null,
          "url": "https://www.courtlistener.com",
          "recap_pdf_url": null,
          "pacer_doc_id": null,
          "description": "Notice of Docket Text Modification"
        },
        {
          "row_number": 3363,
          "id": 8975714,
          "entry_number": null,
          "date_filed": "2017-05-05T00:00:00-04:00",
          "attachments": null,
          "url": "https://www.courtlistener.com",
          "recap_pdf_url": null,
          "pacer_doc_id": null,
          "description": "Order on Motion to Withdraw as Attorney"
        },
        {
          "row_number": 3364,
          "id": 8975715,
          "entry_number": null,
          "date_filed": "2017-05-16T00:00:00-04:00",
          "attachments": null,
          "url": "https://www.courtlistener.com",
          "recap_pdf_url": null,
          "pacer_doc_id": null,
          "description": "Order on Motion Submitting"
        },
        {
          "row_number": 3365,
          "id": 8975716,
          "entry_number": null,
          "date_filed": "2017-05-30T00:00:00-04:00",
          "attachments": null,
          "url": "https://www.courtlistener.com",
          "recap_pdf_url": null,
          "pacer_doc_id": null,
          "description": "Notice of Docket Text Modification"
        },
        {
          "row_number": 3369,
          "id": 8975720,
          "entry_number": null,
          "date_filed": "2017-06-15T00:00:00-04:00",
          "attachments": null,
          "url": "https://www.courtlistener.com",
          "recap_pdf_url": null,
          "pacer_doc_id": null,
          "description": "Order on Motion Submitting"
        },
        {
          "row_number": 3370,
          "id": 8975721,
          "entry_number": null,
          "date_filed": "2017-06-20T00:00:00-04:00",
          "attachments": null,
          "url": "https://www.courtlistener.com",
          "recap_pdf_url": null,
          "pacer_doc_id": null,
          "description": "Order"
        },
        {
          "row_number": 3371,
          "id": 8975722,
          "entry_number": null,
          "date_filed": "2017-06-23T00:00:00-04:00",
          "attachments": null,
          "url": "https://www.courtlistener.com",
          "recap_pdf_url": null,
          "pacer_doc_id": null,
          "description": "Order on Motion Submitting"
        },
        {
          "row_number": 3372,
          "id": 8975723,
          "entry_number": null,
          "date_filed": "2017-06-30T00:00:00-04:00",
          "attachments": null,
          "url": "https://www.courtlistener.com",
          "recap_pdf_url": null,
          "pacer_doc_id": null,
          "description": "Order on Motion requesting Order"
        },
        {
          "row_number": 3373,
          "id": 8975724,
          "entry_number": null,
          "date_filed": "2017-06-30T00:00:00-04:00",
          "attachments": null,
          "url": "https://www.courtlistener.com",
          "recap_pdf_url": null,
          "pacer_doc_id": null,
          "description": "Order on Motion to Restrict"
        },
        {
          "row_number": 3374,
          "id": 8975725,
          "entry_number": null,
          "date_filed": "2017-07-05T00:00:00-04:00",
          "attachments": null,
          "url": "https://www.courtlistener.com",
          "recap_pdf_url": null,
          "pacer_doc_id": null,
          "description": "Order"
        },
        {
          "row_number": 3375,
          "id": 8975726,
          "entry_number": null,
          "date_filed": "2017-07-06T00:00:00-04:00",
          "attachments": null,
          "url": "https://www.courtlistener.com",
          "recap_pdf_url": null,
          "pacer_doc_id": null,
          "description": "Order on Motion for Extension of Time"
        },
        {
          "row_number": 3378,
          "id": 8975729,
          "entry_number": null,
          "date_filed": "2017-07-12T00:00:00-04:00",
          "attachments": null,
          "url": "https://www.courtlistener.com",
          "recap_pdf_url": null,
          "pacer_doc_id": null,
          "description": "Order on Motion to Deposit Funds"
        },
        {
          "row_number": 3379,
          "id": 8975730,
          "entry_number": null,
          "date_filed": "2017-07-13T00:00:00-04:00",
          "attachments": null,
          "url": "https://www.courtlistener.com",
          "recap_pdf_url": null,
          "pacer_doc_id": null,
          "description": "Order on Motion Submitting"
        },
        {
          "row_number": 3387,
          "id": 8975738,
          "entry_number": null,
          "date_filed": "2017-08-10T00:00:00-04:00",
          "attachments": null,
          "url": "https://www.courtlistener.com",
          "recap_pdf_url": null,
          "pacer_doc_id": null,
          "description": "Order on Motion Submitting"
        },
        {
          "row_number": 3388,
          "id": 8975739,
          "entry_number": null,
          "date_filed": "2017-08-10T00:00:00-04:00",
          "attachments": null,
          "url": "https://www.courtlistener.com",
          "recap_pdf_url": null,
          "pacer_doc_id": null,
          "description": "Order on Motion Submitting"
        },
        {
          "row_number": 3389,
          "id": 8975740,
          "entry_number": null,
          "date_filed": "2017-08-10T00:00:00-04:00",
          "attachments": null,
          "url": "https://www.courtlistener.com",
          "recap_pdf_url": null,
          "pacer_doc_id": null,
          "description": "Order on Motion Submitting"
        },
        {
          "row_number": 3390,
          "id": 8975741,
          "entry_number": null,
          "date_filed": "2017-08-24T00:00:00-04:00",
          "attachments": null,
          "url": "https://www.courtlistener.com",
          "recap_pdf_url": null,
          "pacer_doc_id": null,
          "description": "Order on Motion for Extension of Time"
        },
        {
          "row_number": 3391,
          "id": 8975742,
          "entry_number": null,
          "date_filed": "2017-09-10T00:00:00-04:00",
          "attachments": null,
          "url": "https://www.courtlistener.com",
          "recap_pdf_url": null,
          "pacer_doc_id": null,
          "description": "Order"
        },
        {
          "row_number": 3392,
          "id": 8975743,
          "entry_number": null,
          "date_filed": "2017-09-15T00:00:00-04:00",
          "attachments": null,
          "url": "https://www.courtlistener.com",
          "recap_pdf_url": null,
          "pacer_doc_id": null,
          "description": "Order on Motion for Extension of Time"
        },
        {
          "row_number": 3395,
          "id": 8975746,
          "entry_number": null,
          "date_filed": "2017-09-29T00:00:00-04:00",
          "attachments": null,
          "url": "https://www.courtlistener.com",
          "recap_pdf_url": null,
          "pacer_doc_id": null,
          "description": "Order AND ~Util - Set Hearings"
        },
        {
          "row_number": 3396,
          "id": 8975747,
          "entry_number": null,
          "date_filed": "2017-10-10T00:00:00-04:00",
          "attachments": null,
          "url": "https://www.courtlistener.com",
          "recap_pdf_url": null,
          "pacer_doc_id": null,
          "description": "Order on Motion Submitting"
        },
        {
          "row_number": 3397,
          "id": 8975748,
          "entry_number": null,
          "date_filed": "2017-10-10T00:00:00-04:00",
          "attachments": null,
          "url": "https://www.courtlistener.com",
          "recap_pdf_url": null,
          "pacer_doc_id": null,
          "description": "Order on Motion Submitting"
        },
        {
          "row_number": 3398,
          "id": 8975749,
          "entry_number": null,
          "date_filed": "2017-10-10T00:00:00-04:00",
          "attachments": null,
          "url": "https://www.courtlistener.com",
          "recap_pdf_url": null,
          "pacer_doc_id": null,
          "description": "Order on Motion Submitting"
        },
        {
          "row_number": 3399,
          "id": 8975750,
          "entry_number": null,
          "date_filed": "2017-10-10T00:00:00-04:00",
          "attachments": null,
          "url": "https://www.courtlistener.com",
          "recap_pdf_url": null,
          "pacer_doc_id": null,
          "description": "Order on Motion Submitting"
        },
        {
          "row_number": 3403,
          "id": 8975754,
          "entry_number": null,
          "date_filed": "2017-10-12T00:00:00-04:00",
          "attachments": null,
          "url": "https://www.courtlistener.com",
          "recap_pdf_url": null,
          "pacer_doc_id": null,
          "description": "Order AND ~Util - Set Hearings"
        },
        {
          "row_number": 3406,
          "id": 8975759,
          "entry_number": null,
          "date_filed": "2017-10-31T00:00:00-04:00",
          "attachments": null,
          "url": "https://www.courtlistener.com",
          "recap_pdf_url": null,
          "pacer_doc_id": null,
          "description": "Order Referring Motion"
        },
        {
          "row_number": 610,
          "id": 8975760,
          "entry_number": "2141",
          "date_filed": "2017-10-31T00:00:00-04:00",
          "attachments": null,
          "url": "https://www.courtlistener.com/docket/6672519/2141/united-states-v-commonwealth-of-pr/",
          "recap_pdf_url": null,
          "pacer_doc_id": null,
          "description": "ORDER REFERRING MOTION: 2140 Joint Motion In Compliance is hereby referred to Magistrate Judge Marcos E. Lopez for disposition and/or any other necessary ruling. Signed by Judge Gustavo A. Gelpi on October 31, 2017. (DVL) (Entered: 10/31/2017)"
        },
        {
          "row_number": 611,
          "id": 8975761,
          "entry_number": "2142",
          "date_filed": "2017-11-15T00:00:00-05:00",
          "attachments": null,
          "url": "https://www.courtlistener.com/docket/6672519/2142/united-states-v-commonwealth-of-pr/",
          "recap_pdf_url": null,
          "pacer_doc_id": "15906497183",
          "description": "MOTION Submitting JCC Invoice for the Month of October 2017 as to Javier Aceves filed by Javier Aceves. (ram) (Entered: 11/15/2017)"
        },
        {
          "row_number": 3407,
          "id": 8975762,
          "entry_number": null,
          "date_filed": "2017-11-15T00:00:00-05:00",
          "attachments": null,
          "url": "https://www.courtlistener.com",
          "recap_pdf_url": null,
          "pacer_doc_id": null,
          "description": "Order on Motion Submitting"
        },
        {
          "row_number": 3408,
          "id": 8975763,
          "entry_number": null,
          "date_filed": "2017-11-15T00:00:00-05:00",
          "attachments": null,
          "url": "https://www.courtlistener.com",
          "recap_pdf_url": null,
          "pacer_doc_id": null,
          "description": "Order on Motion Submitting"
        },
        {
          "row_number": 3409,
          "id": 8975764,
          "entry_number": null,
          "date_filed": "2017-11-15T00:00:00-05:00",
          "attachments": null,
          "url": "https://www.courtlistener.com",
          "recap_pdf_url": null,
          "pacer_doc_id": null,
          "description": "Order on Motion Submitting"
        },
        {
          "row_number": 3410,
          "id": 8975765,
          "entry_number": null,
          "date_filed": "2017-11-15T00:00:00-05:00",
          "attachments": null,
          "url": "https://www.courtlistener.com",
          "recap_pdf_url": null,
          "pacer_doc_id": null,
          "description": "Order on Motion Submitting"
        },
        {
          "row_number": 612,
          "id": 8975766,
          "entry_number": "2143",
          "date_filed": "2017-11-15T00:00:00-05:00",
          "attachments": null,
          "url": "https://www.courtlistener.com/docket/6672519/2143/united-states-v-commonwealth-of-pr/",
          "recap_pdf_url": null,
          "pacer_doc_id": "15906497193",
          "description": "MOTION Submitting JCC Invoice for the Month of October 2017 as to Carmelo Rodriguez Perez filed by Javier Aceves. (ram) (Entered: 11/15/2017)"
        },
        {
          "row_number": 613,
          "id": 8975767,
          "entry_number": "2144",
          "date_filed": "2017-11-15T00:00:00-05:00",
          "attachments": null,
          "url": "https://www.courtlistener.com/docket/6672519/2144/united-states-v-commonwealth-of-pr/",
          "recap_pdf_url": null,
          "pacer_doc_id": "15906497198",
          "description": "MOTION Submitting JCC Invoice for the Month of October 2017 as to Dimaris Garcia filed by Javier Aceves. (ram) (Entered: 11/15/2017)"
        },
        {
          "row_number": 614,
          "id": 8975768,
          "entry_number": "2145",
          "date_filed": "2017-11-15T00:00:00-05:00",
          "attachments": null,
          "url": "https://www.courtlistener.com/docket/6672519/2145/united-states-v-commonwealth-of-pr/",
          "recap_pdf_url": null,
          "pacer_doc_id": "15906497204",
          "description": "MOTION Submitting JCC Invoice for the Month of October 2017 as to Castellanos Group filed by Javier Aceves. (ram) (Entered: 11/15/2017)"
        },
        {
          "row_number": 617,
          "id": 8975771,
          "entry_number": "2148",
          "date_filed": "2017-11-15T00:00:00-05:00",
          "attachments": null,
          "url": "https://www.courtlistener.com/docket/6672519/2148/united-states-v-commonwealth-of-pr/",
          "recap_pdf_url": null,
          "pacer_doc_id": null,
          "description": "ORDER granting 2144 Motion submitting Signed by Judge Gustavo A. Gelpi on 11/15/2017. (sc) (Entered: 11/15/2017)"
        },
        {
          "row_number": 618,
          "id": 8975772,
          "entry_number": "2149",
          "date_filed": "2017-11-15T00:00:00-05:00",
          "attachments": null,
          "url": "https://www.courtlistener.com/docket/6672519/2149/united-states-v-commonwealth-of-pr/",
          "recap_pdf_url": null,
          "pacer_doc_id": null,
          "description": "ORDER granting 2145 Motion submitting Signed by Judge Gustavo A. Gelpi on 11/15/2017. (sc) (Entered: 11/15/2017)"
        },
        {
          "row_number": 620,
          "id": 8975773,
          "entry_number": "2150",
          "date_filed": "2017-11-15T00:00:00-05:00",
          "attachments": null,
          "url": "https://www.courtlistener.com/docket/6672519/2150/united-states-v-commonwealth-of-pr/",
          "recap_pdf_url": null,
          "pacer_doc_id": "15906497402",
          "description": "**CASE PARTICIPANTS** MOTION for Disbursement of Funds filed by Alfredo Castellanos-Bayouth on behalf of Javier Aceves Responses due by 11/29/2017. NOTE: Pursuant to FRCP 6(a) an additional three days does not apply to service done electronically. (Castellanos-Bayouth, Alfredo) (Entered: 11/15/2017)"
        },
        {
          "row_number": 621,
          "id": 8975774,
          "entry_number": "2151",
          "date_filed": "2017-11-16T00:00:00-05:00",
          "attachments": null,
          "url": "https://www.courtlistener.com/docket/6672519/2151/united-states-v-commonwealth-of-pr/",
          "recap_pdf_url": null,
          "pacer_doc_id": "15906497762",
          "description": "ORDER: Appointing Dr. Alejandro del Carmen as Expert Advisor to the JCC. Signed by Judge Gustavo A. Gelpi on 11/16/17.(PJH) (Entered: 11/16/2017)"
        },
        {
          "row_number": 3411,
          "id": 8975775,
          "entry_number": null,
          "date_filed": "2017-11-16T00:00:00-05:00",
          "attachments": null,
          "url": "https://www.courtlistener.com",
          "recap_pdf_url": null,
          "pacer_doc_id": null,
          "description": "Order on Motion for Disbursement of Funds"
        },
        {
          "row_number": 3412,
          "id": 8975778,
          "entry_number": null,
          "date_filed": "2017-11-17T00:00:00-05:00",
          "attachments": null,
          "url": "https://www.courtlistener.com",
          "recap_pdf_url": null,
          "pacer_doc_id": null,
          "description": "Order on Motion In Compliance"
        },
        {
          "row_number": 624,
          "id": 8975779,
          "entry_number": "2154",
          "date_filed": "2017-12-13T00:00:00-05:00",
          "attachments": null,
          "url": "https://www.courtlistener.com/docket/6672519/2154/united-states-v-commonwealth-of-pr/",
          "recap_pdf_url": null,
          "pacer_doc_id": null,
          "description": "ORDER: A Public Hearing is set for Monday, March 5, 2018 and Tuesday, March 6, 2018 at 09:00 AM in Courtroom 10 in Hato Rey Courthouse before US Magistrate Judge Marcos E. Lopez. Agenda shall be issued in early 2018. Signed by US Magistrate Judge Marcos E. Lopez on 12/13/17.(ft) (Entered: 12/13/2017)"
        },
        {
          "row_number": 3413,
          "id": 8975780,
          "entry_number": null,
          "date_filed": "2017-12-13T00:00:00-05:00",
          "attachments": null,
          "url": "https://www.courtlistener.com",
          "recap_pdf_url": null,
          "pacer_doc_id": null,
          "description": "Order AND ~Util - Set Hearings"
        },
        {
          "row_number": 625,
          "id": 8975781,
          "entry_number": "2155",
          "date_filed": "2017-12-15T00:00:00-05:00",
          "attachments": null,
          "url": "https://www.courtlistener.com/docket/6672519/2155/united-states-v-commonwealth-of-pr/",
          "recap_pdf_url": null,
          "pacer_doc_id": "15906529349",
          "description": "MOTION Submitting JCC Invoice for the Month of November 2017 as to Javier Aceves filed by Javier Aceves. (ram) (Entered: 12/15/2017)"
        },
        {
          "row_number": 3414,
          "id": 8975782,
          "entry_number": null,
          "date_filed": "2017-12-15T00:00:00-05:00",
          "attachments": null,
          "url": "https://www.courtlistener.com",
          "recap_pdf_url": null,
          "pacer_doc_id": null,
          "description": "Order on Motion Submitting"
        },
        {
          "row_number": 626,
          "id": 8975785,
          "entry_number": "2156",
          "date_filed": "2017-12-15T00:00:00-05:00",
          "attachments": null,
          "url": "https://www.courtlistener.com/docket/6672519/2156/united-states-v-commonwealth-of-pr/",
          "recap_pdf_url": null,
          "pacer_doc_id": "15906529359",
          "description": "MOTION Submitting JCC Invoice for the Month of November 2017 as to Carmelo Rodriguez Perez filed by Javier Aceves. (ram) (Entered: 12/15/2017)"
        },
        {
          "row_number": 627,
          "id": 8975786,
          "entry_number": "2157",
          "date_filed": "2017-12-15T00:00:00-05:00",
          "attachments": null,
          "url": "https://www.courtlistener.com/docket/6672519/2157/united-states-v-commonwealth-of-pr/",
          "recap_pdf_url": null,
          "pacer_doc_id": "15906529390",
          "description": "MOTION Submitting JCC Invoice for the Month of November 2017 as to Dimaris Garcia filed by Javier Aceves. (ram) (Entered: 12/15/2017)"
        },
        {
          "row_number": 628,
          "id": 8975787,
          "entry_number": "2158",
          "date_filed": "2017-12-15T00:00:00-05:00",
          "attachments": null,
          "url": "https://www.courtlistener.com/docket/6672519/2158/united-states-v-commonwealth-of-pr/",
          "recap_pdf_url": null,
          "pacer_doc_id": null,
          "description": "ORDER granting 2155 Motion submitting. Signed by Judge Gustavo A. Gelpi on 12/15/2017. (sc) (Entered: 12/15/2017)"
        },
        {
          "row_number": 629,
          "id": 8975788,
          "entry_number": "2159",
          "date_filed": "2017-12-15T00:00:00-05:00",
          "attachments": null,
          "url": "https://www.courtlistener.com/docket/6672519/2159/united-states-v-commonwealth-of-pr/",
          "recap_pdf_url": null,
          "pacer_doc_id": null,
          "description": "ORDER granting 2156 Motion submitting Signed by Judge Gustavo A. Gelpi on 12/15/2017. (sc) (Entered: 12/15/2017)"
        },
        {
          "row_number": 631,
          "id": 8975789,
          "entry_number": "2160",
          "date_filed": "2017-12-15T00:00:00-05:00",
          "attachments": null,
          "url": "https://www.courtlistener.com/docket/6672519/2160/united-states-v-commonwealth-of-pr/",
          "recap_pdf_url": null,
          "pacer_doc_id": null,
          "description": "ORDER granting 2157 Motion submitting. Signed by Judge Gustavo A. Gelpi on 12/15/2017. (sc) (Entered: 12/15/2017)"
        },
        {
          "row_number": 632,
          "id": 8975790,
          "entry_number": "2161",
          "date_filed": "2017-12-20T00:00:00-05:00",
          "attachments": null,
          "url": "https://www.courtlistener.com/docket/6672519/2161/united-states-v-commonwealth-of-pr/",
          "recap_pdf_url": null,
          "pacer_doc_id": null,
          "description": "ORDER: The public hearing set for March 5-6, 2018 (Docket No. 2154 ), is hereby vacated. A new date in March shall be provided promptly. Signed by Judge Gustavo A. Gelpi on December 20, 2017. (DVL) (Entered: 12/20/2017)"
        },
        {
          "row_number": 3418,
          "id": 8975793,
          "entry_number": null,
          "date_filed": "2017-12-22T00:00:00-05:00",
          "attachments": null,
          "url": "https://www.courtlistener.com",
          "recap_pdf_url": null,
          "pacer_doc_id": null,
          "description": "Order AND ~Util - Set Hearings"
        },
        {
          "row_number": 634,
          "id": 8975796,
          "entry_number": "2165",
          "date_filed": "2018-01-12T00:00:00-05:00",
          "attachments": null,
          "url": "https://www.courtlistener.com/docket/6672519/2165/united-states-v-commonwealth-of-pr/",
          "recap_pdf_url": null,
          "pacer_doc_id": "15906559407",
          "description": "**CASE PARTICIPANTS** INFORMATIVE Motion filed by Lydia E. Marcano De Jesus, pro se (in the Spanish language). (ram) (Main Document 2165 replaced on 1/16/2018) (ram). (Entered: 01/16/2018)"
        },
        {
          "row_number": 3421,
          "id": 8975798,
          "entry_number": null,
          "date_filed": "2018-01-16T00:00:00-05:00",
          "attachments": null,
          "url": "https://www.courtlistener.com",
          "recap_pdf_url": null,
          "pacer_doc_id": null,
          "description": "Order on Informative Motion"
        },
        {
          "row_number": 3422,
          "id": 8975799,
          "entry_number": null,
          "date_filed": "2018-01-16T00:00:00-05:00",
          "attachments": null,
          "url": "https://www.courtlistener.com",
          "recap_pdf_url": null,
          "pacer_doc_id": null,
          "description": "Order on Motion Submitting"
        },
        {
          "row_number": 3423,
          "id": 8975800,
          "entry_number": null,
          "date_filed": "2018-01-16T00:00:00-05:00",
          "attachments": null,
          "url": "https://www.courtlistener.com",
          "recap_pdf_url": null,
          "pacer_doc_id": null,
          "description": "Order on Motion Submitting"
        },
        {
          "row_number": 636,
          "id": 8975803,
          "entry_number": "2167",
          "date_filed": "2018-01-16T00:00:00-05:00",
          "attachments": null,
          "url": "https://www.courtlistener.com/docket/6672519/2167/united-states-v-commonwealth-of-pr/",
          "recap_pdf_url": null,
          "pacer_doc_id": "15906560215",
          "description": "MOTION Submitting JCC Invoice for the Month of December 2017 as to Javier Aceves filed by Javier Aceves (ram) (Entered: 01/16/2018)"
        },
        {
          "row_number": 637,
          "id": 8975804,
          "entry_number": "2168",
          "date_filed": "2018-01-16T00:00:00-05:00",
          "attachments": null,
          "url": "https://www.courtlistener.com/docket/6672519/2168/united-states-v-commonwealth-of-pr/",
          "recap_pdf_url": null,
          "pacer_doc_id": "15906560226",
          "description": "MOTION Submitting JCC Invoice for the Month of December 2017 as to Carmelo Rodriguez Perez filed by Javier Aceves. (ram) (Entered: 01/16/2018)"
        },
        {
          "row_number": 640,
          "id": 8975806,
          "entry_number": "2170",
          "date_filed": "2018-01-16T00:00:00-05:00",
          "attachments": null,
          "url": "https://www.courtlistener.com/docket/6672519/2170/united-states-v-commonwealth-of-pr/",
          "recap_pdf_url": null,
          "pacer_doc_id": "15906560249",
          "description": "MOTION Submitting JCC Invoice for the Month of November 2017 as to Castellanos Group filed by Javier Aceves. (ram) (Entered: 01/16/2018)"
        },
        {
          "row_number": 641,
          "id": 8975807,
          "entry_number": "2171",
          "date_filed": "2018-01-16T00:00:00-05:00",
          "attachments": null,
          "url": "https://www.courtlistener.com/docket/6672519/2171/united-states-v-commonwealth-of-pr/",
          "recap_pdf_url": null,
          "pacer_doc_id": "15906560255",
          "description": "MOTION Submitting JCC Invoice for the Month of December 2017 as to Castellanos Group filed by Javier Aceves. (ram) (Entered: 01/16/2018)"
        },
        {
          "row_number": 646,
          "id": 8975812,
          "entry_number": "2176",
          "date_filed": "2018-01-16T00:00:00-05:00",
          "attachments": null,
          "url": "https://www.courtlistener.com/docket/6672519/2176/united-states-v-commonwealth-of-pr/",
          "recap_pdf_url": null,
          "pacer_doc_id": null,
          "description": "ORDER granting 2171 Motion submitting Signed by Judge Gustavo A. Gelpi on 1/16/2018. (sc) (Entered: 01/16/2018)"
        },
        {
          "row_number": 647,
          "id": 8975813,
          "entry_number": "2177",
          "date_filed": "2018-01-16T00:00:00-05:00",
          "attachments": null,
          "url": "https://www.courtlistener.com/docket/6672519/2177/united-states-v-commonwealth-of-pr/",
          "recap_pdf_url": null,
          "pacer_doc_id": "15906560868",
          "description": "MOTION to Restrict Document filed by Alfredo Castellanos-Bayouth on behalf of Javier Aceves Responses due by 1/30/2018. NOTE: Pursuant to FRCP 6(a) an additional three days does not apply to service done electronically. (Castellanos-Bayouth, Alfredo) (Entered: 01/16/2018)"
        },
        {
          "row_number": 3426,
          "id": 8975816,
          "entry_number": null,
          "date_filed": "2018-01-17T00:00:00-05:00",
          "attachments": null,
          "url": "https://www.courtlistener.com",
          "recap_pdf_url": null,
          "pacer_doc_id": null,
          "description": "Order on Informative Motion"
        },
        {
          "row_number": 3427,
          "id": 8975817,
          "entry_number": null,
          "date_filed": "2018-01-17T00:00:00-05:00",
          "attachments": null,
          "url": "https://www.courtlistener.com",
          "recap_pdf_url": null,
          "pacer_doc_id": null,
          "description": "Order on Motion to Restrict"
        },
        {
          "row_number": 651,
          "id": 8975818,
          "entry_number": "2180",
          "date_filed": "2018-01-17T00:00:00-05:00",
          "attachments": null,
          "url": "https://www.courtlistener.com/docket/6672519/2180/united-states-v-commonwealth-of-pr/",
          "recap_pdf_url": null,
          "pacer_doc_id": null,
          "description": "ORDER: Noted 2178 Informative Motion. The Commonwealth and U.S. DOJ shall meet immediately to discuss this matter and file a joint informative motion no later than Wednesday, January 24, 2018. No extensions will be allowed. This matter needs to be resolved immediately. It has not been an issue in nearly 20 years. Signed by Judge Gustavo A. Gelpi on January 17, 2018. (DVL) (Entered: 01/17/2018)"
        },
        {
          "row_number": 3431,
          "id": 8975828,
          "entry_number": null,
          "date_filed": "2018-01-24T00:00:00-05:00",
          "attachments": null,
          "url": "https://www.courtlistener.com",
          "recap_pdf_url": null,
          "pacer_doc_id": null,
          "description": "Order on Informative Motion"
        },
        {
          "row_number": 660,
          "id": 8975831,
          "entry_number": "2189",
          "date_filed": "2018-01-26T00:00:00-05:00",
          "attachments": null,
          "url": "https://www.courtlistener.com/docket/6672519/2189/united-states-v-commonwealth-of-pr/",
          "recap_pdf_url": null,
          "pacer_doc_id": "15906575008",
          "description": "**CASE PARTICIPANTS** INFORMATIVE Motion regarding New non-profit corporation filed by Alfredo Castellanos-Bayouth on behalf of Javier Aceves Responses due by 2/9/2018. NOTE: Pursuant to FRCP 6(a) an additional three days does not apply to service done electronically. (Castellanos-Bayouth, Alfredo) (Entered: 01/26/2018)"
        },
        {
          "row_number": 662,
          "id": 8975832,
          "entry_number": "2190",
          "date_filed": "2018-01-29T00:00:00-05:00",
          "attachments": null,
          "url": "https://www.courtlistener.com/docket/6672519/2190/united-states-v-commonwealth-of-pr/",
          "recap_pdf_url": null,
          "pacer_doc_id": null,
          "description": "ORDER: Granting 2188 Motion to Restrict. Signed by Judge Gustavo A. Gelpi on January 29, 2018. (DVL) (Entered: 01/29/2018)"
        },
        {
          "row_number": 3433,
          "id": 8975834,
          "entry_number": null,
          "date_filed": "2018-01-29T00:00:00-05:00",
          "attachments": null,
          "url": "https://www.courtlistener.com",
          "recap_pdf_url": null,
          "pacer_doc_id": null,
          "description": "Order on Motion to Restrict"
        },
        {
          "row_number": 663,
          "id": 8975835,
          "entry_number": "2191",
          "date_filed": "2018-01-29T00:00:00-05:00",
          "attachments": null,
          "url": "https://www.courtlistener.com/docket/6672519/2191/united-states-v-commonwealth-of-pr/",
          "recap_pdf_url": null,
          "pacer_doc_id": null,
          "description": "ORDER: Noted and approved 2189 Informative Motion. Signed by Judge Gustavo A. Gelpi on January 29, 2018. (DVL) (Entered: 01/29/2018)"
        },
        {
          "row_number": 664,
          "id": 8975836,
          "entry_number": "2192",
          "date_filed": "2018-02-01T00:00:00-05:00",
          "attachments": null,
          "url": "https://www.courtlistener.com/docket/6672519/2192/united-states-v-commonwealth-of-pr/",
          "recap_pdf_url": null,
          "pacer_doc_id": "15906583470",
          "description": "**CASE PARTICIPANTS**Joint INFORMATIVE Motion regarding JCC Informative Motion ECF 2178 filed by Richard J. Farano on behalf of USA Responses due by 2/15/2018. NOTE: Pursuant to FRCP 6(a) an additional three days does not apply to service done electronically. (Farano, Richard) (Entered: 02/01/2018)"
        },
        {
          "row_number": 665,
          "id": 8975838,
          "entry_number": "2193",
          "date_filed": "2018-02-01T00:00:00-05:00",
          "attachments": null,
          "url": "https://www.courtlistener.com/docket/6672519/2193/united-states-v-commonwealth-of-pr/",
          "recap_pdf_url": null,
          "pacer_doc_id": null,
          "description": "ORDER: Noted 2192 Informative Motion. Counsel for PRDJ and USDOJ are commended for their efforts on behalf of the DD population. Likewise to the JCC for bringing this matter to the Court's attention, as well as the Health Department personnel who have worked on this matter. Parties shall file joint informative update motions the first of every month, or the next available working day if a weekend or holiday, until the matter is finally resolved. Signed by Judge Gustavo A. Gelpi on February 1, 2018. (DVL) (Entered: 02/01/2018)"
        },
        {
          "row_number": 666,
          "id": 8975839,
          "entry_number": "2194",
          "date_filed": "2018-02-06T00:00:00-05:00",
          "attachments": null,
          "url": "https://www.courtlistener.com/docket/6672519/2194/united-states-v-commonwealth-of-pr/",
          "recap_pdf_url": null,
          "pacer_doc_id": "15906589001",
          "description": "MOTION Submitting Invoice filed by Alfredo Castellanos-Bayouth on behalf of Javier Aceves Responses due by 2/20/2018. NOTE: Pursuant to FRCP 6(a) an additional three days does not apply to service done electronically. (Attachments: # 1 Supplement, # 2 Supplement, # 3 Supplement, # 4 Supplement, # 5 Supplement, # 6 Supplement)(Castellanos-Bayouth, Alfredo). Added MOTION for Disbursement of Funds on 2/7/2018 (ram). (Entered: 02/06/2018)"
        },
        {
          "row_number": 667,
          "id": 8975840,
          "entry_number": "2195",
          "date_filed": "2018-02-07T00:00:00-05:00",
          "attachments": null,
          "url": "https://www.courtlistener.com/docket/6672519/2195/united-states-v-commonwealth-of-pr/",
          "recap_pdf_url": null,
          "pacer_doc_id": null,
          "description": "ORDER granting 2194 Motion submitting ; granting 2194 Motion for Disbursement of Funds. Signed by Judge Gustavo A. Gelpi on 2/7/2018. (sc) (Entered: 02/07/2018)"
        },
        {
          "row_number": 3435,
          "id": 8975841,
          "entry_number": null,
          "date_filed": "2018-02-07T00:00:00-05:00",
          "attachments": null,
          "url": "https://www.courtlistener.com",
          "recap_pdf_url": null,
          "pacer_doc_id": null,
          "description": "Order on Motion Submitting AND Order on Motion for Disbursement of Funds"
        },
        {
          "row_number": 668,
          "id": 8975842,
          "entry_number": "2196",
          "date_filed": "2018-02-09T00:00:00-05:00",
          "attachments": null,
          "url": "https://www.courtlistener.com/docket/6672519/2196/united-states-v-commonwealth-of-pr/",
          "recap_pdf_url": null,
          "pacer_doc_id": "15906594863",
          "description": "PRELIMINARY SCHEDULING ORDER FOR THE FIRST PUBLIC HEARING OF 2018. Signed by Judge Gustavo A. Gelpi on 2/7/2018.(sc) (Entered: 02/09/2018)"
        },
        {
          "row_number": 669,
          "id": 8975843,
          "entry_number": "2197",
          "date_filed": "2018-02-23T00:00:00-05:00",
          "attachments": null,
          "url": "https://www.courtlistener.com/docket/6672519/2197/united-states-v-commonwealth-of-pr/",
          "recap_pdf_url": null,
          "pacer_doc_id": "15906611917",
          "description": "ORDER: See attachment. Signed by Judge Gustavo A. Gelpi on 2/23/18.(PJH) (Entered: 02/23/2018)"
        },
        {
          "row_number": 670,
          "id": 8975844,
          "entry_number": "2198",
          "date_filed": "2018-02-23T00:00:00-05:00",
          "attachments": null,
          "url": "https://www.courtlistener.com/docket/6672519/2198/united-states-v-commonwealth-of-pr/",
          "recap_pdf_url": null,
          "pacer_doc_id": "15906613365",
          "description": "MOTION to Restrict Document filed by Alfredo Castellanos-Bayouth on behalf of Javier Aceves Responses due by 3/9/2018. NOTE: Pursuant to FRCP 6(a) an additional three days does not apply to service done electronically. (Castellanos-Bayouth, Alfredo) (Entered: 02/23/2018)"
        },
        {
          "row_number": 675,
          "id": 8975849,
          "entry_number": "2201",
          "date_filed": "2018-02-26T00:00:00-05:00",
          "attachments": null,
          "url": "https://www.courtlistener.com/docket/6672519/2201/united-states-v-commonwealth-of-pr/",
          "recap_pdf_url": null,
          "pacer_doc_id": null,
          "description": "ORDER: Noted 2199 Informative Motion. The parties shall meet immediately to discuss and file a restricted joint informative motion as to the matter, outlining their respective positions, on or before 3/6/2018. The deadline is final. The matter, if warranted (most likely) shall be addressed by the Court, on the dates of the public hearings, following the conclusion of either day's hearing. The parties are expected to come prepared and bring any necessary public officials. Signed by Judge Gustavo A. Gelpi on February 26, 2018. (DVL) (Entered: 02/26/2018)"
        },
        {
          "row_number": 677,
          "id": 8975851,
          "entry_number": "2203",
          "date_filed": "2018-02-28T00:00:00-05:00",
          "attachments": null,
          "url": "https://www.courtlistener.com/docket/6672519/2203/united-states-v-commonwealth-of-pr/",
          "recap_pdf_url": null,
          "pacer_doc_id": "15906618665",
          "description": "ORDER: See attachment. Signed by Judge Gustavo A. Gelpi on 2/28/18.(PJH) (Entered: 02/28/2018)"
        },
        {
          "row_number": 678,
          "id": 8975852,
          "entry_number": "2204",
          "date_filed": "2018-03-01T00:00:00-05:00",
          "attachments": null,
          "url": "https://www.courtlistener.com/docket/6672519/2204/united-states-v-commonwealth-of-pr/",
          "recap_pdf_url": null,
          "pacer_doc_id": "15906621557",
          "description": "**CASE PARTICIPANTS**Joint INFORMATIVE Motion regarding Restricted JCC Informative Motion ECF 2178 filed by Richard J. Farano on behalf of USA Responses due by 3/15/2018. NOTE: Pursuant to FRCP 6(a) an additional three days does not apply to service done electronically. (Farano, Richard) (Entered: 03/01/2018)"
        },
        {
          "row_number": 679,
          "id": 8975854,
          "entry_number": "2205",
          "date_filed": "2018-03-01T00:00:00-05:00",
          "attachments": null,
          "url": "https://www.courtlistener.com/docket/6672519/2205/united-states-v-commonwealth-of-pr/",
          "recap_pdf_url": null,
          "pacer_doc_id": null,
          "description": "ORDER: Noted 2204 Informative Motion. Parties shall continue to submit periodic informative motions as directed by the Court every 30 days. Signed by Judge Gustavo A. Gelpi on March 1, 2018. (DVL) (Entered: 03/01/2018)"
        },
        {
          "row_number": 683,
          "id": 8975860,
          "entry_number": "2209",
          "date_filed": "2018-03-05T00:00:00-05:00",
          "attachments": null,
          "url": "https://www.courtlistener.com/docket/6672519/2209/united-states-v-commonwealth-of-pr/",
          "recap_pdf_url": null,
          "pacer_doc_id": null,
          "description": "ORDER: Noted 2207 Informative Motion. Signed by Judge Gustavo A. Gelpi on March 5, 2018. (DVL) (Entered: 03/05/2018)"
        },
        {
          "row_number": 688,
          "id": 8975864,
          "entry_number": "2213",
          "date_filed": "2018-03-07T00:00:00-05:00",
          "attachments": null,
          "url": "https://www.courtlistener.com/docket/6672519/2213/united-states-v-commonwealth-of-pr/",
          "recap_pdf_url": null,
          "pacer_doc_id": "15906628275",
          "description": "FINAL SCHEDULING ORDER: View attachment. Signed by Judge Gustavo A. Gelpi on 3/7/18. (Attachments: # 1 Appendix, # 2 Appendix)(PJH) (Entered: 03/07/2018)"
        },
        {
          "row_number": 3441,
          "id": 8975865,
          "entry_number": null,
          "date_filed": "2018-03-07T00:00:00-05:00",
          "attachments": null,
          "url": "https://www.courtlistener.com",
          "recap_pdf_url": null,
          "pacer_doc_id": null,
          "description": "Order on Motion In Compliance"
        },
        {
          "row_number": 3442,
          "id": 8975866,
          "entry_number": null,
          "date_filed": "2018-03-07T00:00:00-05:00",
          "attachments": null,
          "url": "https://www.courtlistener.com",
          "recap_pdf_url": null,
          "pacer_doc_id": null,
          "description": "Order on Informative Motion"
        },
        {
          "row_number": 690,
          "id": 8975869,
          "entry_number": "2215",
          "date_filed": "2018-03-07T00:00:00-05:00",
          "attachments": null,
          "url": "https://www.courtlistener.com/docket/6672519/2215/united-states-v-commonwealth-of-pr/",
          "recap_pdf_url": null,
          "pacer_doc_id": null,
          "description": "ORDER: Noted 2211 Motion In Compliance. If an agreement is not signed by the public hearing, the Commonwealth shall file an informative status motion the 1st of every month, until signed. Signed by Judge Gustavo A. Gelpi on March 7, 2018. (DVL) (Entered: 03/07/2018)"
        },
        {
          "row_number": 693,
          "id": 8975872,
          "entry_number": "2218",
          "date_filed": "2018-03-08T00:00:00-05:00",
          "attachments": null,
          "url": "https://www.courtlistener.com/docket/6672519/2218/united-states-v-commonwealth-of-pr/",
          "recap_pdf_url": null,
          "pacer_doc_id": null,
          "description": "ORDER: Noted 2217 Motion In Compliance Signed by Judge Gustavo A. Gelpi on 3/8/18. (PJH) (Entered: 03/08/2018)"
        },
        {
          "row_number": 3444,
          "id": 8975873,
          "entry_number": null,
          "date_filed": "2018-03-08T00:00:00-05:00",
          "attachments": null,
          "url": "https://www.courtlistener.com",
          "recap_pdf_url": null,
          "pacer_doc_id": null,
          "description": "Order on Motion In Compliance"
        },
        {
          "row_number": 694,
          "id": 8975874,
          "entry_number": "2219",
          "date_filed": "2018-03-09T00:00:00-05:00",
          "attachments": null,
          "url": "https://www.courtlistener.com/docket/6672519/2219/united-states-v-commonwealth-of-pr/",
          "recap_pdf_url": null,
          "pacer_doc_id": "15906632348",
          "description": "ORDER. Signed by Judge Gustavo A. Gelpi on March 9, 2018. (DVL) (Entered: 03/09/2018)"
        },
        {
          "row_number": 696,
          "id": 8975875,
          "entry_number": "2220",
          "date_filed": "2018-03-09T00:00:00-05:00",
          "attachments": null,
          "url": "https://www.courtlistener.com/docket/6672519/2220/united-states-v-commonwealth-of-pr/",
          "recap_pdf_url": null,
          "pacer_doc_id": "15906633188",
          "description": "INFORMATIVE Motion regarding Public Hearings filed by Javier Burgos-Ruiz on behalf of The Commonwealth of Puerto Rico Responses due by 3/23/2018. NOTE: Pursuant to FRCP 6(a) an additional three days does not apply to service done electronically. (Burgos-Ruiz, Javier) (Entered: 03/09/2018)"
        },
        {
          "row_number": 697,
          "id": 8975876,
          "entry_number": "2221",
          "date_filed": "2018-03-09T00:00:00-05:00",
          "attachments": null,
          "url": "https://www.courtlistener.com/docket/6672519/2221/united-states-v-commonwealth-of-pr/",
          "recap_pdf_url": null,
          "pacer_doc_id": "15906633563",
          "description": "ORDER. Signed by Judge Gustavo A. Gelpi on 3/9/2018.(MET) (Entered: 03/09/2018)"
        },
        {
          "row_number": 700,
          "id": 8975879,
          "entry_number": "2224",
          "date_filed": "2018-03-12T00:00:00-04:00",
          "attachments": null,
          "url": "https://www.courtlistener.com/docket/6672519/2224/united-states-v-commonwealth-of-pr/",
          "recap_pdf_url": null,
          "pacer_doc_id": null,
          "description": "ORDER: Noted 2220 Informative Motion. Signed by Judge Gustavo A. Gelpi on March 12, 2018. (DVL) (Entered: 03/12/2018)"
        },
        {
          "row_number": 3445,
          "id": 8975880,
          "entry_number": null,
          "date_filed": "2018-03-12T00:00:00-04:00",
          "attachments": null,
          "url": "https://www.courtlistener.com",
          "recap_pdf_url": null,
          "pacer_doc_id": null,
          "description": "Order on Motion In Compliance"
        },
        {
          "row_number": 3446,
          "id": 8975881,
          "entry_number": null,
          "date_filed": "2018-03-12T00:00:00-04:00",
          "attachments": null,
          "url": "https://www.courtlistener.com",
          "recap_pdf_url": null,
          "pacer_doc_id": null,
          "description": "Order on Motion In Compliance"
        },
        {
          "row_number": 703,
          "id": 8975887,
          "entry_number": "2227",
          "date_filed": "2018-03-14T00:00:00-04:00",
          "attachments": null,
          "url": "https://www.courtlistener.com/docket/6672519/2227/united-states-v-commonwealth-of-pr/",
          "recap_pdf_url": null,
          "pacer_doc_id": "15906639606",
          "description": "ORDER. In Camera Hearing set for 3/22/2018 04:00 PM before Judge Gustavo A. Gelpi. Signed by Judge Gustavo A. Gelpi on March 14, 2018. (DVL) Modified on 3/14/2018 to edit docket entry (gmm). (Entered: 03/14/2018)"
        },
        {
          "row_number": 707,
          "id": 8975888,
          "entry_number": "2230",
          "date_filed": "2018-03-15T00:00:00-04:00",
          "attachments": null,
          "url": "https://www.courtlistener.com/docket/6672519/2230/united-states-v-commonwealth-of-pr/",
          "recap_pdf_url": null,
          "pacer_doc_id": "15906642618",
          "description": "MOTION to Participate by Phone in Upcoming Hearing re 2227 Order, Set Hearings filed by Richard J. Farano on behalf of USA Responses due by 3/29/2018. NOTE: Pursuant to FRCP 6(a) an additional three days does not apply to service done electronically. (Related document(s) 2227 ) (Farano, Richard) (Entered: 03/15/2018)"
        },
        {
          "row_number": 710,
          "id": 8975892,
          "entry_number": "2233",
          "date_filed": "2018-03-22T00:00:00-04:00",
          "attachments": null,
          "url": "https://www.courtlistener.com/docket/6672519/2233/united-states-v-commonwealth-of-pr/",
          "recap_pdf_url": null,
          "pacer_doc_id": "15906653193",
          "description": "MINUTE OF PROCEEDINGS AND ORDER. Signed by Judge Gustavo A. Gelpi on 3/22/2018. (Attachments: # 1 Appendix List of Attendees)(MET) (Entered: 03/22/2018)"
        },
        {
          "row_number": 711,
          "id": 8975893,
          "entry_number": "2234",
          "date_filed": "2018-03-23T00:00:00-04:00",
          "attachments": null,
          "url": "https://www.courtlistener.com/docket/6672519/2234/united-states-v-commonwealth-of-pr/",
          "recap_pdf_url": null,
          "pacer_doc_id": null,
          "description": "ORDER: Noted 2232 Motion In Compliance. Signed by Judge Gustavo A. Gelpi on 3/23/18. (PJH) (Entered: 03/23/2018)"
        },
        {
          "row_number": 712,
          "id": 8975895,
          "entry_number": "2235",
          "date_filed": "2018-03-24T00:00:00-04:00",
          "attachments": null,
          "url": "https://www.courtlistener.com/docket/6672519/2235/united-states-v-commonwealth-of-pr/",
          "recap_pdf_url": null,
          "pacer_doc_id": "15906655993",
          "description": "**CASE PARTICIPANTS** Motion In Compliance as to 2214 Order on Informative Motion,,, filed by Javier Burgos-Ruiz on behalf of The Commonwealth of Puerto Rico Responses due by 4/9/2018. NOTE: Pursuant to FRCP 6(a) an additional three days does not apply to service done electronically. (Attachments: # 1 Exhibit 1)(Related document(s) 2214 ) (Burgos-Ruiz, Javier) (Entered: 03/24/2018)"
        },
        {
          "row_number": 714,
          "id": 8975898,
          "entry_number": "2237",
          "date_filed": "2018-04-03T00:00:00-04:00",
          "attachments": null,
          "url": "https://www.courtlistener.com/docket/6672519/2237/united-states-v-commonwealth-of-pr/",
          "recap_pdf_url": null,
          "pacer_doc_id": "15906668552",
          "description": "ORDER: View attachment. Signed by Judge Gustavo A. Gelpi on 4/3/18.(PJH) (Entered: 04/03/2018)"
        },
        {
          "row_number": 716,
          "id": 8975900,
          "entry_number": "2239",
          "date_filed": "2018-04-03T00:00:00-04:00",
          "attachments": null,
          "url": "https://www.courtlistener.com/docket/6672519/2239/united-states-v-commonwealth-of-pr/",
          "recap_pdf_url": null,
          "pacer_doc_id": "15906670014",
          "description": "MOTION Submitting Invoice filed by Alfredo Castellanos-Bayouth on behalf of Javier Aceves Responses due by 4/17/2018. NOTE: Pursuant to FRCP 6(a) an additional three days does not apply to service done electronically. (Attachments: # 1 Supplement, # 2 Supplement, # 3 Supplement, # 4 Supplement, # 5 Supplement, # 6 Supplement, # 7 Supplement)(Castellanos-Bayouth, Alfredo) (Entered: 04/03/2018)"
        },
        {
          "row_number": 720,
          "id": 8975904,
          "entry_number": "2242",
          "date_filed": "2018-04-16T00:00:00-04:00",
          "attachments": null,
          "url": "https://www.courtlistener.com/docket/6672519/2242/united-states-v-commonwealth-of-pr/",
          "recap_pdf_url": null,
          "pacer_doc_id": "15906689258",
          "description": "**CASE PARTICIPANTS** INFORMATIVE Motion regarding Compliance with DE 2233 filed by Javier Burgos-Ruiz on behalf of The Commonwealth of Puerto Rico Responses due by 4/30/2018. NOTE: Pursuant to FRCP 6(a) an additional three days does not apply to service done electronically. (Burgos-Ruiz, Javier) (Entered: 04/16/2018)"
        },
        {
          "row_number": 721,
          "id": 8975905,
          "entry_number": "2243",
          "date_filed": "2018-04-17T00:00:00-04:00",
          "attachments": null,
          "url": "https://www.courtlistener.com/docket/6672519/2243/united-states-v-commonwealth-of-pr/",
          "recap_pdf_url": null,
          "pacer_doc_id": null,
          "description": "ORDER: Granting 2241 Motion to Restrict. Signed by Chief Judge Gustavo A. Gelpi on April 17, 2018. (DVL) (Entered: 04/17/2018)"
        },
        {
          "row_number": 3452,
          "id": 8975906,
          "entry_number": null,
          "date_filed": "2018-04-17T00:00:00-04:00",
          "attachments": null,
          "url": "https://www.courtlistener.com",
          "recap_pdf_url": null,
          "pacer_doc_id": null,
          "description": "Order on Informative Motion"
        },
        {
          "row_number": 3453,
          "id": 8975907,
          "entry_number": null,
          "date_filed": "2018-04-17T00:00:00-04:00",
          "attachments": null,
          "url": "https://www.courtlistener.com",
          "recap_pdf_url": null,
          "pacer_doc_id": null,
          "description": "Order on Motion to Restrict"
        },
        {
          "row_number": 723,
          "id": 8975909,
          "entry_number": "2245",
          "date_filed": "2018-04-25T00:00:00-04:00",
          "attachments": null,
          "url": "https://www.courtlistener.com/docket/6672519/2245/united-states-v-commonwealth-of-pr/",
          "recap_pdf_url": null,
          "pacer_doc_id": "15906705589",
          "description": "First INFORMATIVE Motion regarding Compliance with order filed by Javier Burgos-Ruiz on behalf of The Commonwealth of Puerto Rico Responses due by 5/9/2018. NOTE: Pursuant to FRCP 6(a) an additional three days does not apply to service done electronically. (Burgos-Ruiz, Javier) (Entered: 04/25/2018)"
        },
        {
          "row_number": 724,
          "id": 8975910,
          "entry_number": "2246",
          "date_filed": "2018-04-26T00:00:00-04:00",
          "attachments": null,
          "url": "https://www.courtlistener.com/docket/6672519/2246/united-states-v-commonwealth-of-pr/",
          "recap_pdf_url": null,
          "pacer_doc_id": null,
          "description": "ORDER: Noted 2245 Informative Motion. Signed by Judge Gustavo A. Gelpi on April 26, 2018. (DVL) (Entered: 04/26/2018)"
        },
        {
          "row_number": 726,
          "id": 8975912,
          "entry_number": "2248",
          "date_filed": "2018-05-03T00:00:00-04:00",
          "attachments": null,
          "url": "https://www.courtlistener.com/docket/6672519/2248/united-states-v-commonwealth-of-pr/",
          "recap_pdf_url": null,
          "pacer_doc_id": null,
          "description": "ORDER granting 2247 Motion submitting Signed by Judge Gustavo A. Gelpi on 5/3/2018. (sc) (Entered: 05/03/2018)"
        },
        {
          "row_number": 727,
          "id": 8975913,
          "entry_number": "2249",
          "date_filed": "2018-05-14T00:00:00-04:00",
          "attachments": null,
          "url": "https://www.courtlistener.com/docket/6672519/2249/united-states-v-commonwealth-of-pr/",
          "recap_pdf_url": null,
          "pacer_doc_id": "15906733693",
          "description": "MOTION to Restrict Document Second Informative Motion filed by Javier Burgos-Ruiz on behalf of The Commonwealth of Puerto Rico Responses due by 5/29/2018. NOTE: Pursuant to FRCP 6(a) an additional three days does not apply to service done electronically. (Burgos-Ruiz, Javier) (Entered: 05/14/2018)"
        },
        {
          "row_number": 732,
          "id": 8975917,
          "entry_number": "2253",
          "date_filed": "2018-05-16T00:00:00-04:00",
          "attachments": null,
          "url": "https://www.courtlistener.com/docket/6672519/2253/united-states-v-commonwealth-of-pr/",
          "recap_pdf_url": null,
          "pacer_doc_id": "15906736424",
          "description": "**CASE PARTICIPANTS**ORDER: The JCC and parties shall review the attached letter and make any necessary recommendations. Signed by Judge Gustavo A. Gelpi on 5/16/2018.(MET) (Entered: 05/16/2018)"
        },
        {
          "row_number": 733,
          "id": 8975918,
          "entry_number": "2254",
          "date_filed": "2018-05-25T00:00:00-04:00",
          "attachments": null,
          "url": "https://www.courtlistener.com/docket/6672519/2254/united-states-v-commonwealth-of-pr/",
          "recap_pdf_url": null,
          "pacer_doc_id": "15906751753",
          "description": "MOTION to Restrict Document filed by Javier Burgos-Ruiz on behalf of The Commonwealth of Puerto Rico Responses due by 6/8/2018. NOTE: Pursuant to FRCP 6(a) an additional three days does not apply to service done electronically. (Burgos-Ruiz, Javier) (Entered: 05/25/2018)"
        },
        {
          "row_number": 735,
          "id": 8975920,
          "entry_number": "2256",
          "date_filed": "2018-05-25T00:00:00-04:00",
          "attachments": null,
          "url": "https://www.courtlistener.com/docket/6672519/2256/united-states-v-commonwealth-of-pr/",
          "recap_pdf_url": null,
          "pacer_doc_id": null,
          "description": "ORDER: Granting 2254 Motion to Restrict. Signed by Judge Gustavo A. Gelpi on May 25, 2018. (DVL) (Entered: 05/25/2018)"
        },
        {
          "row_number": 744,
          "id": 8975928,
          "entry_number": "2264",
          "date_filed": "2018-06-21T00:00:00-04:00",
          "attachments": null,
          "url": "https://www.courtlistener.com/docket/6672519/2264/united-states-v-commonwealth-of-pr/",
          "recap_pdf_url": null,
          "pacer_doc_id": "15906791546",
          "description": "INFORMATIVE Motion regarding Court Order ECF No. 2262 filed by Richard J. Farano on behalf of USA Responses due by 7/5/2018. NOTE: Pursuant to FRCP 6(a) an additional three days does not apply to service done electronically. (Farano, Richard) (Entered: 06/21/2018)"
        },
        {
          "row_number": 745,
          "id": 8975929,
          "entry_number": "2265",
          "date_filed": "2018-06-22T00:00:00-04:00",
          "attachments": null,
          "url": "https://www.courtlistener.com/docket/6672519/2265/united-states-v-commonwealth-of-pr/",
          "recap_pdf_url": null,
          "pacer_doc_id": null,
          "description": "ORDER: Noted and approved 2264 Informative Motion. The meeting may be telephonic. Signed by Judge Gustavo A. Gelpi on June 22, 2018. (DVL) (Entered: 06/22/2018)"
        },
        {
          "row_number": 749,
          "id": 8975933,
          "entry_number": "2269",
          "date_filed": "2018-06-25T00:00:00-04:00",
          "attachments": null,
          "url": "https://www.courtlistener.com/docket/6672519/2269/united-states-v-commonwealth-of-pr/",
          "recap_pdf_url": null,
          "pacer_doc_id": "15906795136",
          "description": "**CASE PARTICIPANTS**Third INFORMATIVE Motion regarding MRC status filed by Javier Burgos-Ruiz on behalf of The Commonwealth of Puerto Rico Responses due by 7/9/2018. NOTE: Pursuant to FRCP 6(a) an additional three days does not apply to service done electronically. (Burgos-Ruiz, Javier) (Entered: 06/25/2018)"
        },
        {
          "row_number": 752,
          "id": 8975935,
          "entry_number": "2271",
          "date_filed": "2018-06-26T00:00:00-04:00",
          "attachments": null,
          "url": "https://www.courtlistener.com/docket/6672519/2271/united-states-v-commonwealth-of-pr/",
          "recap_pdf_url": null,
          "pacer_doc_id": null,
          "description": "ORDER: Noted 2269 Informative Motion. Signed by Judge Gustavo A. Gelpi on June 26, 2018. (DVL) (Entered: 06/26/2018)"
        },
        {
          "row_number": 753,
          "id": 8975936,
          "entry_number": "2272",
          "date_filed": "2018-06-29T00:00:00-04:00",
          "attachments": null,
          "url": "https://www.courtlistener.com/docket/6672519/2272/united-states-v-commonwealth-of-pr/",
          "recap_pdf_url": null,
          "pacer_doc_id": "15906802256",
          "description": "INFORMATIVE Motion regarding Service Providers Contract Renewals filed by Alfredo Castellanos-Bayouth on behalf of Javier Aceves Responses due by 7/13/2018. NOTE: Pursuant to FRCP 6(a) an additional three days does not apply to service done electronically. (Castellanos-Bayouth, Alfredo) (Entered: 06/29/2018)"
        },
        {
          "row_number": 756,
          "id": 8975939,
          "entry_number": "2275",
          "date_filed": "2018-07-02T00:00:00-04:00",
          "attachments": null,
          "url": "https://www.courtlistener.com/docket/6672519/2275/united-states-v-commonwealth-of-pr/",
          "recap_pdf_url": null,
          "pacer_doc_id": null,
          "description": "ORDER: Noted 2274 Informative Motion. The Court agrees with the USDOJ. For purposes of the parties' meeting to discuss the matter of maintaining providers' payments up to date, the Secretary of Health and Director of the Office of Management and Budget shall participate. This matter carries top priority, and as in the past should be resolved without Court intervention. PRDOJ shall communicate this order to the herein listed administration officials. Signed by Judge Gustavo A. Gelpi on July 2, 2018. (DVL) (Entered: 07/02/2018)"
        },
        {
          "row_number": 757,
          "id": 8975940,
          "entry_number": "2276",
          "date_filed": "2018-07-02T00:00:00-04:00",
          "attachments": null,
          "url": "https://www.courtlistener.com/docket/6672519/2276/united-states-v-commonwealth-of-pr/",
          "recap_pdf_url": null,
          "pacer_doc_id": "15906804519",
          "description": "MOTION Submitting Invoice filed by Alfredo Castellanos-Bayouth on behalf of Javier Aceves Responses due by 7/16/2018. NOTE: Pursuant to FRCP 6(a) an additional three days does not apply to service done electronically. (Attachments: # 1 Supplement, # 2 Supplement, # 3 Supplement, # 4 Supplement, # 5 Supplement, # 6 Supplement, # 7 Supplement, # 8 Supplement)(Castellanos-Bayouth, Alfredo) (Entered: 07/02/2018)"
        },
        {
          "row_number": 760,
          "id": 8975943,
          "entry_number": "2279",
          "date_filed": "2018-07-06T00:00:00-04:00",
          "attachments": null,
          "url": "https://www.courtlistener.com/docket/6672519/2279/united-states-v-commonwealth-of-pr/",
          "recap_pdf_url": null,
          "pacer_doc_id": "15906812461",
          "description": "MOTION for Reconsideration partial recon re 2273 Order on Informative Motion,, 2275 Order on Informative Motion,, filed by Javier Burgos-Ruiz on behalf of The Commonwealth of Puerto Rico Responses due by 7/20/2018. NOTE: Pursuant to FRCP 6(a) an additional three days does not apply to service done electronically. (Related document(s) 2273, 2275 ) (Burgos-Ruiz, Javier) (Entered: 07/06/2018)"
        },
        {
          "row_number": 763,
          "id": 8975945,
          "entry_number": "2281",
          "date_filed": "2018-07-09T00:00:00-04:00",
          "attachments": null,
          "url": "https://www.courtlistener.com/docket/6672519/2281/united-states-v-commonwealth-of-pr/",
          "recap_pdf_url": null,
          "pacer_doc_id": null,
          "description": "ORDER: Granting 2279 Motion for Reconsideration as follows: The status conference remains in effect and the Court will also take the opportunity to address any other matters of concern to which the parties and JCC bring attention. The Commonwealth Secretary of Health and Budget and Management Office Director are excused, however both shall be represented by a designee who has their trust and constant communication. The JCC shall propose a short agenda of matters to be discussed. So that no one loses his or her sleep, the Court informs all that this will be an informal, in camera conference to touch upon matters of importance and obtain updates on the same. Signed by Judge Gustavo A. Gelpi on July 9, 2018. (DVL) (Entered: 07/09/2018)"
        },
        {
          "row_number": 764,
          "id": 8975946,
          "entry_number": "2282",
          "date_filed": "2018-07-11T00:00:00-04:00",
          "attachments": null,
          "url": "https://www.courtlistener.com/docket/6672519/2282/united-states-v-commonwealth-of-pr/",
          "recap_pdf_url": null,
          "pacer_doc_id": "15906817790",
          "description": "INFORMATIVE Motion regarding Proposed Agenda for Upcoming Conference filed by Alfredo Castellanos-Bayouth on behalf of Javier Aceves Responses due by 7/25/2018. NOTE: Pursuant to FRCP 6(a) an additional three days does not apply to service done electronically. (Castellanos-Bayouth, Alfredo) (Entered: 07/11/2018)"
        },
        {
          "row_number": 765,
          "id": 8975947,
          "entry_number": "2283",
          "date_filed": "2018-07-12T00:00:00-04:00",
          "attachments": null,
          "url": "https://www.courtlistener.com/docket/6672519/2283/united-states-v-commonwealth-of-pr/",
          "recap_pdf_url": null,
          "pacer_doc_id": null,
          "description": "ORDER: Noted and Approved 2282 Informative Motion. Signed by Judge Gustavo A. Gelpi on July 12, 2018. (DVL) (Entered: 07/12/2018)"
        },
        {
          "row_number": 766,
          "id": 8975948,
          "entry_number": "2284",
          "date_filed": "2018-07-12T00:00:00-04:00",
          "attachments": null,
          "url": "https://www.courtlistener.com/docket/6672519/2284/united-states-v-commonwealth-of-pr/",
          "recap_pdf_url": null,
          "pacer_doc_id": null,
          "description": "Minute Entry for proceedings held before Judge Gustavo A. Gelpi:Status Conference held on 7/12/2018. Counsel of record were present. The Court is extremely pleased with the Health Department's diligence and commitment in addressing the agenda 2282 items. Further Status Conference shall be set at a date to be determined, possibly in October 2018. A Public Hearing shall also be scheduled in the last quarter of this year. Transcript will be made available upon request. (Court Reporter Evilys Carrion.) (sc) (Entered: 07/13/2018)"
        },
        {
          "row_number": 767,
          "id": 8975949,
          "entry_number": "2285",
          "date_filed": "2018-07-16T00:00:00-04:00",
          "attachments": null,
          "url": "https://www.courtlistener.com/docket/6672519/2285/united-states-v-commonwealth-of-pr/",
          "recap_pdf_url": null,
          "pacer_doc_id": "15906825162",
          "description": "Joint INFORMATIVE Motion regarding Court Order 2262 filed by Richard J. Farano on behalf of USA and The Commonwealth of Puerto Rico. Responses due by 7/30/2018. NOTE: Pursuant to FRCP 6(a) an additional three days does not apply to service done electronically. (Farano, Richard) Modified on 7/17/2018 to add filer (gmm). (Entered: 07/16/2018)"
        },
        {
          "row_number": 777,
          "id": 8975950,
          "entry_number": "2294",
          "date_filed": "2018-07-18T00:00:00-04:00",
          "attachments": null,
          "url": "https://www.courtlistener.com/docket/6672519/2294/united-states-v-commonwealth-of-pr/",
          "recap_pdf_url": null,
          "pacer_doc_id": null,
          "description": "***FILED IN ERROR Filed in wrong case.*** Minute Entry for proceedings held before Judge Gustavo A. Gelpi:In Chambers Conference held on 7/18/2018. Counsel of record were present. Transcripts to be made available upon request. (Court Reporter Evilys Carrion.) (sc) Modified on 8/6/2018 (gav). (Entered: 08/06/2018)"
        },
        {
          "row_number": 3454,
          "id": 8975951,
          "entry_number": null,
          "date_filed": "2018-07-18T00:00:00-04:00",
          "attachments": null,
          "url": "https://www.courtlistener.com",
          "recap_pdf_url": null,
          "pacer_doc_id": null,
          "description": "NOTICE of Docket Text Modification by Deputy Clerk re: 2294 In Chambers Conference,. ***FILED IN ERROR Filed in wrong case.*** (gav)"
        },
        {
          "row_number": 769,
          "id": 8975953,
          "entry_number": "2287",
          "date_filed": "2018-07-25T00:00:00-04:00",
          "attachments": null,
          "url": "https://www.courtlistener.com/docket/6672519/2287/united-states-v-commonwealth-of-pr/",
          "recap_pdf_url": null,
          "pacer_doc_id": "15906839884",
          "description": "**CASE PARTICIPANTS**Fourth INFORMATIVE Motion regarding MRC status filed by Javier Burgos-Ruiz on behalf of The Commonwealth of Puerto Rico Responses due by 8/8/2018. NOTE: Pursuant to FRCP 6(a) an additional three days does not apply to service done electronically. (Burgos-Ruiz, Javier) (Entered: 07/25/2018)"
        },
        {
          "row_number": 770,
          "id": 8975954,
          "entry_number": "2288",
          "date_filed": "2018-07-26T00:00:00-04:00",
          "attachments": null,
          "url": "https://www.courtlistener.com/docket/6672519/2288/united-states-v-commonwealth-of-pr/",
          "recap_pdf_url": null,
          "pacer_doc_id": null,
          "description": "ORDER: Granting 2286 Motion to Restrict. Signed by Judge Gustavo A. Gelpi on July 26, 2018. (DVL) (Entered: 07/26/2018)"
        },
        {
          "row_number": 773,
          "id": 8975956,
          "entry_number": "2290",
          "date_filed": "2018-07-31T00:00:00-04:00",
          "attachments": null,
          "url": "https://www.courtlistener.com/docket/6672519/2290/united-states-v-commonwealth-of-pr/",
          "recap_pdf_url": null,
          "pacer_doc_id": "15906848009",
          "description": "ORDER: Noted 2285 Informative Motion. Signed by Judge Gustavo A. Gelpi on July 31, 2018. (DVL) (Entered: 07/31/2018)"
        },
        {
          "row_number": 774,
          "id": 8975957,
          "entry_number": "2291",
          "date_filed": "2018-08-01T00:00:00-04:00",
          "attachments": null,
          "url": "https://www.courtlistener.com/docket/6672519/2291/united-states-v-commonwealth-of-pr/",
          "recap_pdf_url": null,
          "pacer_doc_id": "15906849669",
          "description": "MOTION to Deposit Funds filed by Susana I. Penagaricano-Brown on behalf of The Commonwealth of Puerto Rico Responses due by 8/15/2018. NOTE: Pursuant to FRCP 6(a) an additional three days does not apply to service done electronically. (Attachments: # 1 Exhibit Copy of check)(Penagaricano-Brown, Susana) (Entered: 08/01/2018)"
        },
        {
          "row_number": 3455,
          "id": 8975959,
          "entry_number": null,
          "date_filed": "2018-08-02T00:00:00-04:00",
          "attachments": null,
          "url": "https://www.courtlistener.com",
          "recap_pdf_url": null,
          "pacer_doc_id": null,
          "description": "DEPOSIT of Funds in the amount of $394,000.00, receipt number PRX100057116. (RE DKT 2291)To be deposited on the next working day in an interest bearing account in compliance with L.Cv.R.67. (arg)"
        },
        {
          "row_number": 776,
          "id": 8975960,
          "entry_number": "2293",
          "date_filed": "2018-08-06T00:00:00-04:00",
          "attachments": null,
          "url": "https://www.courtlistener.com/docket/6672519/2293/united-states-v-commonwealth-of-pr/",
          "recap_pdf_url": null,
          "pacer_doc_id": "15906857029",
          "description": "MOTION Submitting Invoice filed by Alfredo Castellanos-Bayouth on behalf of Javier Aceves Responses due by 8/20/2018. NOTE: Pursuant to FRCP 6(a) an additional three days does not apply to service done electronically. (Attachments: # 1 Supplement, # 2 Supplement, # 3 Supplement, # 4 Supplement, # 5 Supplement, # 6 Supplement, # 7 Supplement)(Castellanos-Bayouth, Alfredo) (Entered: 08/06/2018)"
        },
        {
          "row_number": 778,
          "id": 8975961,
          "entry_number": "2295",
          "date_filed": "2018-08-06T00:00:00-04:00",
          "attachments": null,
          "url": "https://www.courtlistener.com/docket/6672519/2295/united-states-v-commonwealth-of-pr/",
          "recap_pdf_url": null,
          "pacer_doc_id": "15906860630",
          "description": "Letter Motion filed by Marivette Gonzalez-Antonmarchi, Alberto Ortiz-Rivera, Pro Se. Responses due by 8/20/2018. NOTE: Pursuant to FRCP 6(a) an additional three days does not apply to service done electronically. (gmm) (Entered: 08/08/2018)"
        },
        {
          "row_number": 779,
          "id": 8975962,
          "entry_number": "2296",
          "date_filed": "2018-08-08T00:00:00-04:00",
          "attachments": null,
          "url": "https://www.courtlistener.com/docket/6672519/2296/united-states-v-commonwealth-of-pr/",
          "recap_pdf_url": null,
          "pacer_doc_id": null,
          "description": "ORDER: Noted 2295 Informative Motion. The JCC shall look into this matter. Signed by Judge Gustavo A. Gelpi on August 8, 2018. (DVL) (Entered: 08/08/2018)"
        },
        {
          "row_number": 780,
          "id": 8975963,
          "entry_number": "2297",
          "date_filed": "2018-08-13T00:00:00-04:00",
          "attachments": null,
          "url": "https://www.courtlistener.com/docket/6672519/2297/united-states-v-commonwealth-of-pr/",
          "recap_pdf_url": null,
          "pacer_doc_id": null,
          "description": "ORDER granting 2293 Motion submitting Signed by Judge Gustavo A. Gelpi on 8/13/2018. (sc) (Entered: 08/13/2018)"
        },
        {
          "row_number": 781,
          "id": 8975964,
          "entry_number": "2298",
          "date_filed": "2018-08-26T00:00:00-04:00",
          "attachments": null,
          "url": "https://www.courtlistener.com/docket/6672519/2298/united-states-v-commonwealth-of-pr/",
          "recap_pdf_url": null,
          "pacer_doc_id": "15906889780",
          "description": "MOTION to Restrict Document MRC status filed by Javier Burgos-Ruiz on behalf of The Commonwealth of Puerto Rico Responses due by 9/10/2018. NOTE: Pursuant to FRCP 6(a) an additional three days does not apply to service done electronically. (Burgos-Ruiz, Javier) (Entered: 08/26/2018)"
        },
        {
          "row_number": 786,
          "id": 8975967,
          "entry_number": "2301",
          "date_filed": "2018-08-27T00:00:00-04:00",
          "attachments": null,
          "url": "https://www.courtlistener.com/docket/6672519/2301/united-states-v-commonwealth-of-pr/",
          "recap_pdf_url": null,
          "pacer_doc_id": null,
          "description": "ORDER regarding 2299 INFORMATIVE motion: Noted. Signed by US Magistrate Judge Marcos E. Lopez on 8/27/18. (jhi) (Entered: 08/27/2018)"
        },
        {
          "row_number": 787,
          "id": 8975968,
          "entry_number": "2302",
          "date_filed": "2018-08-28T00:00:00-04:00",
          "attachments": null,
          "url": "https://www.courtlistener.com/docket/6672519/2302/united-states-v-commonwealth-of-pr/",
          "recap_pdf_url": null,
          "pacer_doc_id": "15906893500",
          "description": "MOTION to Withdraw Attorney as to Javier Burgos-Ruiz filed by Javier Burgos-Ruiz on behalf of The Commonwealth of Puerto Rico Responses due by 9/11/2018. NOTE: Pursuant to FRCP 6(a) an additional three days does not apply to service done electronically. (Burgos-Ruiz, Javier) (Entered: 08/28/2018)"
        },
        {
          "row_number": 788,
          "id": 8975969,
          "entry_number": "2303",
          "date_filed": "2018-08-29T00:00:00-04:00",
          "attachments": null,
          "url": "https://www.courtlistener.com/docket/6672519/2303/united-states-v-commonwealth-of-pr/",
          "recap_pdf_url": null,
          "pacer_doc_id": null,
          "description": "ORDER: Granting 2302 Motion to Withdraw as Attorney. Attorney Javier Burgos-Ruiz terminated. Signed by Judge Gustavo A. Gelpi on 08/29/2018. (LE) (Entered: 08/29/2018)"
        },
        {
          "row_number": 789,
          "id": 8975970,
          "entry_number": "2304",
          "date_filed": "2018-09-04T00:00:00-04:00",
          "attachments": null,
          "url": "https://www.courtlistener.com/docket/6672519/2304/united-states-v-commonwealth-of-pr/",
          "recap_pdf_url": null,
          "pacer_doc_id": "15906903779",
          "description": "MOTION Submitting Invoice filed by Alfredo Castellanos-Bayouth on behalf of Javier Aceves Responses due by 9/18/2018. NOTE: Pursuant to FRCP 6(a) an additional three days does not apply to service done electronically. (Attachments: # 1 Supplement, # 2 Supplement, # 3 Supplement, # 4 Supplement, # 5 Supplement, # 6 Supplement, # 7 Supplement)(Castellanos-Bayouth, Alfredo) (Entered: 09/04/2018)"
        },
        {
          "row_number": 792,
          "id": 8975973,
          "entry_number": "2307",
          "date_filed": "2018-09-10T00:00:00-04:00",
          "attachments": null,
          "url": "https://www.courtlistener.com/docket/6672519/2307/united-states-v-commonwealth-of-pr/",
          "recap_pdf_url": null,
          "pacer_doc_id": "15906913882",
          "description": "***STRICKEN AS PER 2309 ORDER*** INFORMATIVE Motion regarding Final Schedule for Bayamon Town Hall Meeting filed by Alfredo Castellanos-Bayouth on behalf of Javier Aceves Responses due by 9/24/2018. NOTE: Pursuant to FRCP 6(a) an additional three days does not apply to service done electronically. (Attachments: # 1 Exhibit)(Castellanos-Bayouth, Alfredo) Modified on 9/11/2018 (gmm). (Entered: 09/10/2018)"
        },
        {
          "row_number": 793,
          "id": 8975974,
          "entry_number": "2308",
          "date_filed": "2018-09-10T00:00:00-04:00",
          "attachments": null,
          "url": "https://www.courtlistener.com/docket/6672519/2308/united-states-v-commonwealth-of-pr/",
          "recap_pdf_url": null,
          "pacer_doc_id": "15906914266",
