{
  "case_id": 9824,
  "fetched_at": "2025-10-20T22:42:10.127130",
  "case_data": {
    "attorney_orgs": [],
    "available_documents": [
      "Trial Court Docket",
      "Any published opinion"
    ],
    "case_defendants": [
      {
        "defendant_level": null,
        "institution": "",
        "institution_alt_state": null,
        "institution_city": "Schenectady",
        "institution_county": null,
        "name": "City of Schenectady",
        "defendant_level_other": "",
        "is_active": true
      },
      {
        "defendant_level": null,
        "institution": "",
        "institution_alt_state": null,
        "institution_city": "Schenectady",
        "institution_county": null,
        "name": "City of Schenectady Police Department",
        "defendant_level_other": "",
        "is_active": true
      }
    ],
    "case_ongoing": "No",
    "case_status": "Coding Complete",
    "case_types": [
      "Jail Conditions"
    ],
    "cause_other": "",
    "causes": [
      "42 U.S.C. ยง 1983",
      "State law"
    ],
    "class_action_granted": "Not sought",
    "class_action_sought": "No",
    "closing_year": 2002,
    "constitutional_clause": [
      {
        "value": "Unreasonable search and seizure"
      }
    ],
    "content_of_injunction": [],
    "court": "Northern District of New York",
    "custom_issues": [],
    "defendant_payment": "",
    "defendant_type": [],
    "docket_status": "Complete as of retrieval date",
    "facility_type": [
      {
        "value": "Government-run"
      }
    ],
    "filing_date": "2000-05-30",
    "filing_year": 2000,
    "id": 9824,
    "injunction_duration": "",
    "issues": [
      "Jails, Prisons, Detention Centers, and Other Institutions: Strip search policy (facilities)",
      "Affected Sex/Gender(s): Male",
      "Affected Sex/Gender(s): Female"
    ],
    "last_checked_date": "2007-06-21T00:00:00-04:00",
    "main_docket": {
      "id": 33257,
      "docket_entries": [
        {
          "row_number": 49,
          "id": 1787240,
          "entry_number": "44",
          "date_filed": "2001-03-14T00:00:00-05:00",
          "attachments": [],
          "url": "nan",
          "recap_pdf_url": null,
          "pacer_doc_id": null,
          "description": "REPLY AFFIDAVIT by Kevin Luibrand for Elizabeth Gonzalez, Michael Fyvie to response to [38-1] motion for Partial Summary Judgment, and in opposition to [41- 1] cross motion for Summary Judgment (wjg) (Entered: 03/15/2001)"
        },
        {
          "row_number": 54,
          "id": 1787245,
          "entry_number": "48",
          "date_filed": "2001-04-03T00:00:00-04:00",
          "attachments": [],
          "url": "nan",
          "recap_pdf_url": null,
          "pacer_doc_id": null,
          "description": "MOTION by Elizabeth Gonzalez for Rule 11 Sanctions , Hearing set for 10:00 5/14/01 , Response Deadline 4/30/01 , Reply to Response Deadline 5/7/01 Motion returnable before Judge/Mag. Judge: McAvoy in Albany, NY [STRICKEN FROM THE RECORD AND RETURNED TO COUNSEL PER COURT'S (60-1) ORDER] (wjg) Modified on 05/16/2001 (Entered: 04/04/2001)"
        },
        {
          "row_number": 0,
          "id": 1787191,
          "entry_number": "39",
          "date_filed": "2000-05-30T00:00:00-04:00",
          "attachments": [],
          "url": "nan",
          "recap_pdf_url": null,
          "pacer_doc_id": null,
          "description": "COMPLAINT filed; FILING FEE $ 150.00 RECEIPT # 47562 ; Service deadline 7/29/00 for Jane Doe, for John Doe, for William Lachanski, for Marisela Mosher, for Michael Glasser, for Thomas X. Mattice, for Michael Siler, for Richard Barnett, for City of Schenectady (wbl) Modified on 03/15/2001 (Entered: 05/31/2000)"
        },
        {
          "row_number": 92,
          "id": 1787283,
          "entry_number": "81",
          "date_filed": "2001-07-31T00:00:00-04:00",
          "attachments": [],
          "url": "nan",
          "recap_pdf_url": null,
          "pacer_doc_id": null,
          "description": "MEMORANDUM OF LAW by Charles Frisbee in opposition to [70-1] motion for Summary Judgment/to dismiss and for severance of all claims by Plaintiff Frisbee from Gonzales and Fyvie, [75-1] motion for Partial Summary Judgment (wjg) (Entered: 07/31/2001)"
        },
        {
          "row_number": 97,
          "id": 1787288,
          "entry_number": "85",
          "date_filed": "2001-09-12T00:00:00-04:00",
          "attachments": [],
          "url": "nan",
          "recap_pdf_url": null,
          "pacer_doc_id": null,
          "description": "Minute entry: MOTION CALENDAR held 9/10/01 bef Judge McAvoy in Albany, NY: APP: None; CR: V. Theleman; LC/JC; CRD/mp. Pltfs' [70-1] motion for Summary Judgment/to dismiss and for severance of all claims by Plaintiff Frisbee from Gonzales & Fyvie; and, Defts' [75-1] motion for Partial Summary Judgment - TAKEN ON SUBMIT. (cml) (Entered: 09/12/2001)"
        },
        {
          "row_number": 68,
          "id": 1787259,
          "entry_number": null,
          "date_filed": "2001-05-14T00:00:00-04:00",
          "attachments": [],
          "url": "nan",
          "recap_pdf_url": null,
          "pacer_doc_id": null,
          "description": "Motion hearing re: Pltfs' [48-1] motion for Rule 11 Sanctions held (cml) (Entered: 05/15/2001)"
        },
        {
          "row_number": 71,
          "id": 1787262,
          "entry_number": null,
          "date_filed": "2001-06-20T00:00:00-04:00",
          "attachments": [],
          "url": "nan",
          "recap_pdf_url": null,
          "pacer_doc_id": null,
          "description": "Settlement conference held (wjg) (Entered: 06/25/2001)"
        },
        {
          "row_number": 100,
          "id": 1787291,
          "entry_number": "88",
          "date_filed": "2001-10-26T00:00:00-04:00",
          "attachments": null,
          "url": "nan",
          "recap_pdf_url": null,
          "pacer_doc_id": null,
          "description": "Letter of Atty Luibrand to the Court dd 10/24/01 confirming the trial date for Fyvie and for Gonzalez [copy forwarded to chambers/CML] (amt) (Entered: 10/26/2001)"
        },
        {
          "row_number": 101,
          "id": 1787292,
          "entry_number": "89",
          "date_filed": "2001-10-31T00:00:00-05:00",
          "attachments": null,
          "url": "nan",
          "recap_pdf_url": null,
          "pacer_doc_id": null,
          "description": "LETTER of Michael L. Koenig, Esq. dd 10-24-01 on behalf of Deft Michael Siler regarding trial date of 12-17-01 (pta) (Entered: 10/31/2001)"
        },
        {
          "row_number": 102,
          "id": 1787293,
          "entry_number": "90",
          "date_filed": "2001-11-09T00:00:00-05:00",
          "attachments": null,
          "url": "nan",
          "recap_pdf_url": null,
          "pacer_doc_id": null,
          "description": "LETTER of John M. Katko, AUSA dd 11-08-01 advising of potential scheduling conflict involving Deft Michael Siler as to the 12-17-01 Trial Date (pta) (Entered: 11/09/2001)"
        },
        {
          "row_number": 103,
          "id": 1787294,
          "entry_number": "91",
          "date_filed": "2001-11-15T00:00:00-05:00",
          "attachments": null,
          "url": "nan",
          "recap_pdf_url": null,
          "pacer_doc_id": null,
          "description": "LETTER of Kevin A. Luibrand, Esq. dd 11-12-01 regarding the trials scheduled for 12-03-01 and 12-17-01 (pta) (Entered: 11/15/2001)"
        },
        {
          "row_number": 104,
          "id": 1787295,
          "entry_number": "92",
          "date_filed": "2001-11-16T00:00:00-05:00",
          "attachments": null,
          "url": "nan",
          "recap_pdf_url": null,
          "pacer_doc_id": null,
          "description": "LETTER RESPONSE ofMichael L. Loenig, Esq. dd 11-14-01 to AUSA Katko's letter of 11-08-01 regarding adjournment of the 12-17-01 trail date (pta) (Entered: 11/16/2001)"
        },
        {
          "row_number": 105,
          "id": 1787296,
          "entry_number": "93",
          "date_filed": "2001-11-21T00:00:00-05:00",
          "attachments": null,
          "url": "nan",
          "recap_pdf_url": null,
          "pacer_doc_id": null,
          "description": "COURT Notice dtd 11/20/01 resetting Gonzalez/Fyvie Jury Trial for 9:30 AM on 12/17/01 in Binghamton , N.Y. The Frisbee jury trial is set for 9:30 AM on 2/04/02 in Binghamton, N.Y. (cml) (Entered: 11/21/2001)"
        },
        {
          "row_number": 106,
          "id": 1787297,
          "entry_number": "94",
          "date_filed": "2001-11-27T00:00:00-05:00",
          "attachments": null,
          "url": "nan",
          "recap_pdf_url": null,
          "pacer_doc_id": null,
          "description": "LETTER of Kevin A. Luibrand, Esq. dd 11-21-01 regarding trial schedule conflict (pta) (Entered: 11/27/2001)"
        },
        {
          "row_number": 107,
          "id": 1787298,
          "entry_number": "95",
          "date_filed": "2001-12-11T00:00:00-05:00",
          "attachments": null,
          "url": "nan",
          "recap_pdf_url": null,
          "pacer_doc_id": null,
          "description": "Voir Dire Attachment by Elizabeth Gonzalez, Michael Fyvie, Charles Frisbee (pta) (Entered: 12/11/2001)"
        },
        {
          "row_number": 108,
          "id": 1787299,
          "entry_number": "96",
          "date_filed": "2001-12-11T00:00:00-05:00",
          "attachments": null,
          "url": "nan",
          "recap_pdf_url": null,
          "pacer_doc_id": null,
          "description": "Witness list by Elizabeth Gonzalez, Michael Fyvie, Charles Frisbee (pta) (Entered: 12/11/2001)"
        },
        {
          "row_number": 109,
          "id": 1787300,
          "entry_number": "97",
          "date_filed": "2001-12-11T00:00:00-05:00",
          "attachments": null,
          "url": "nan",
          "recap_pdf_url": null,
          "pacer_doc_id": null,
          "description": "Exhibit list by Elizabeth Gonzalez, Michael Fyvie, Charles Frisbee (pta) (Entered: 12/11/2001)"
        },
        {
          "row_number": 110,
          "id": 1787301,
          "entry_number": "98",
          "date_filed": "2001-12-11T00:00:00-05:00",
          "attachments": null,
          "url": "nan",
          "recap_pdf_url": null,
          "pacer_doc_id": null,
          "description": "Voir dire questions by Elizabeth Gonzalez, Michael Fyvie, Charles Frisbee (pta) (Entered: 12/11/2001)"
        },
        {
          "row_number": 111,
          "id": 1787302,
          "entry_number": "99",
          "date_filed": "2001-12-11T00:00:00-05:00",
          "attachments": null,
          "url": "nan",
          "recap_pdf_url": null,
          "pacer_doc_id": null,
          "description": "TRIAL BRIEF by Elizabeth Gonzalez, Michael Fyvie, Charles Frisbee (pta) (Entered: 12/11/2001)"
        },
        {
          "row_number": 112,
          "id": 1787303,
          "entry_number": "100",
          "date_filed": "2001-12-11T00:00:00-05:00",
          "attachments": null,
          "url": "nan",
          "recap_pdf_url": null,
          "pacer_doc_id": null,
          "description": "Proposed Jury Charge/Jury instructions by Elizabeth Gonzalez, Michael Fyvie, Charles Frisbee (pta) (Entered: 12/11/2001)"
        },
        {
          "row_number": 113,
          "id": 1787304,
          "entry_number": "101",
          "date_filed": "2001-12-11T00:00:00-05:00",
          "attachments": null,
          "url": "nan",
          "recap_pdf_url": null,
          "pacer_doc_id": null,
          "description": "PLTF PROPOSED Special Verdict Sheet (pta) (Entered: 12/11/2001)"
        },
        {
          "row_number": 114,
          "id": 1787305,
          "entry_number": "102",
          "date_filed": "2002-01-16T00:00:00-05:00",
          "attachments": null,
          "url": "nan",
          "recap_pdf_url": null,
          "pacer_doc_id": null,
          "description": "COURT Notice dtd 1/16/02 resetting Gonzalez/Fyvie Jury Trial for 9:30 AM on 2/4/02 in Binghamton , N.Y. The Frisbee jury trial is set for 9:30 AM on 4/16/02 at 9:30 AM in Albany, N.Y. (cml) (Entered: 01/16/2002)"
        },
        {
          "row_number": 115,
          "id": 1787306,
          "entry_number": "103",
          "date_filed": "2002-01-23T00:00:00-05:00",
          "attachments": null,
          "url": "nan",
          "recap_pdf_url": null,
          "pacer_doc_id": null,
          "description": "Letter of Atty Luibrand to the court dd 1/21/02 advising the court to utilize trial papers previously submitted in December and that they are also submitting an amended trial brief, letter brief, and supplement Pltfs witness list and court ordered voirdire; pre-trial stip to follow (sfp) (Entered: 01/24/2002)"
        },
        {
          "row_number": 116,
          "id": 1787307,
          "entry_number": "105",
          "date_filed": "2002-01-23T00:00:00-05:00",
          "attachments": null,
          "url": "nan",
          "recap_pdf_url": null,
          "pacer_doc_id": null,
          "description": "Amended TRIAL BRIEF by Pltfs Elizabeth Gonzalez, Michael Fyvie, Charles Frisbee (sfp) (Entered: 01/24/2002)"
        },
        {
          "row_number": 117,
          "id": 1787308,
          "entry_number": "106",
          "date_filed": "2002-01-24T00:00:00-05:00",
          "attachments": null,
          "url": "nan",
          "recap_pdf_url": null,
          "pacer_doc_id": null,
          "description": "Voir Dire Attachment by City of Schenectady, Thomas X. Mattice, Michael Glasser, Marisela Mosher, William Lachanski, Eric Hesch (wjg) (Entered: 01/24/2002)"
        },
        {
          "row_number": 118,
          "id": 1787309,
          "entry_number": "107",
          "date_filed": "2002-01-24T00:00:00-05:00",
          "attachments": null,
          "url": "nan",
          "recap_pdf_url": null,
          "pacer_doc_id": null,
          "description": "Voir dire questions by City of Schenectady, Thomas X. Mattice, Michael Glasser, Marisela Mosher, William Lachanski, Eric Hesch (wjg) (Entered: 01/24/2002)"
        },
        {
          "row_number": 119,
          "id": 1787310,
          "entry_number": "108",
          "date_filed": "2002-01-24T00:00:00-05:00",
          "attachments": null,
          "url": "nan",
          "recap_pdf_url": null,
          "pacer_doc_id": null,
          "description": "Witness list by City of Schenectady, Thomas X. Mattice, Michael Glasser, Marisela Mosher, William Lachanski, Eric Hesch (wjg) (Entered: 01/24/2002)"
        },
        {
          "row_number": 120,
          "id": 1787311,
          "entry_number": "109",
          "date_filed": "2002-01-24T00:00:00-05:00",
          "attachments": null,
          "url": "nan",
          "recap_pdf_url": null,
          "pacer_doc_id": null,
          "description": "Exhibit list by City of Schenectady, Thomas X. Mattice, Michael Glasser, Marisela Mosher, William Lachanski, Eric Hesch (wjg) (Entered: 01/24/2002)"
        },
        {
          "row_number": 121,
          "id": 1787312,
          "entry_number": "110",
          "date_filed": "2002-01-24T00:00:00-05:00",
          "attachments": null,
          "url": "nan",
          "recap_pdf_url": null,
          "pacer_doc_id": null,
          "description": "TRIAL BRIEF by City of Schenectady, Thomas X. Mattice, Michael Glasser, Marisela Mosher, William Lachanski, Eric Hesch (wjg) (Entered: 01/24/2002)"
        },
        {
          "row_number": 122,
          "id": 1787313,
          "entry_number": "111",
          "date_filed": "2002-01-24T00:00:00-05:00",
          "attachments": null,
          "url": "nan",
          "recap_pdf_url": null,
          "pacer_doc_id": null,
          "description": "Proposed Jury instructions/Request to Charge by City of Schenectady, Thomas X. Mattice, Michael Glasser, Marisela Mosher, William Lachanski, Eric Hesch (wjg) (Entered: 01/24/2002)"
        },
        {
          "row_number": 123,
          "id": 1787314,
          "entry_number": "112",
          "date_filed": "2002-01-31T00:00:00-05:00",
          "attachments": null,
          "url": "nan",
          "recap_pdf_url": null,
          "pacer_doc_id": null,
          "description": "COURT NOTICE dtd 1/31/02 resetting Gonzalez/Fyvie Jury Trial for 9:30 AM on 4/16/02 in Albany , N.Y. The Frisbee jury trial is s/f 9:30 AM on 5/06/02 in Binghamton, N.Y. (cml) (Entered: 01/31/2002)"
        },
        {
          "row_number": 124,
          "id": 1787315,
          "entry_number": "113",
          "date_filed": "2002-02-19T00:00:00-05:00",
          "attachments": null,
          "url": "nan",
          "recap_pdf_url": null,
          "pacer_doc_id": null,
          "description": "LETTER REQUEST and ORDER, directing the deposition of Robert C. O'Neill on 2/26/02 at the law offices of Tobin & Dempf ( signed by Magistrate Judge Randolph F. Treece ) (wjg) (Entered: 02/19/2002)"
        },
        {
          "row_number": 125,
          "id": 1787316,
          "entry_number": "114",
          "date_filed": "2002-03-21T00:00:00-05:00",
          "attachments": null,
          "url": "nan",
          "recap_pdf_url": null,
          "pacer_doc_id": null,
          "description": "Letter of Atty Murphy to the court dd 3/19/02 requesting adjournment of 3/25/02 trial date (sfp) (Entered: 03/21/2002)"
        },
        {
          "row_number": 126,
          "id": 1787317,
          "entry_number": "115",
          "date_filed": "2002-04-12T00:00:00-04:00",
          "attachments": null,
          "url": "nan",
          "recap_pdf_url": null,
          "pacer_doc_id": null,
          "description": "Witness list (additions) by Elizabeth Gonzalez, Michael Fyvie, Charles Frisbee (wjg) (Entered: 04/15/2002)"
        },
        {
          "row_number": 127,
          "id": 1787318,
          "entry_number": null,
          "date_filed": "2002-04-16T00:00:00-04:00",
          "attachments": null,
          "url": "nan",
          "recap_pdf_url": null,
          "pacer_doc_id": null,
          "description": "Jury trial #1 re: Gonzalez/Fyvie pltfs begun in Albany, N.Y. (cml) (Entered: 04/17/2002)"
        },
        {
          "row_number": 128,
          "id": 1787319,
          "entry_number": "116",
          "date_filed": "2002-04-16T00:00:00-04:00",
          "attachments": null,
          "url": "nan",
          "recap_pdf_url": null,
          "pacer_doc_id": null,
          "description": "Minute entry: JURY TRIAL #1 w/ Gonzalez/Fyvie Pltfs commence 4/16/02 bef Judge McAvoy in Albany, NY: APP: Kevin Luibrand & Adrien Kerwin, Esqs. for Pltfs; Michael Murphy, Esq. for Defts Mattice, Glasser, Mosher, Lachanski, Hesch & City/Schenectady; CR: B. Buckley; LC/JC; CRD/mp. Evidentiary & procedural issues discussed in chambers. Jury selection conducted. Some potential jurors are interviewed in chambers re: knowledge of events & media coverage. Attys argue challenges/cause; cause is granted as to jurors 3, 6, 10 & 12. Jury sworn & given preliminary charge. Each side give opening stmts. PLTF WITNESS: William Grasso, Henry Kenyon, Robert O'Neill, Maria Elwell & Michael Fyvie. Court adjourns until 4/17/02 at 9:30 A.M. [9:00a - 5:00p] (cml) (Entered: 04/17/2002)"
        },
        {
          "row_number": 129,
          "id": 1787320,
          "entry_number": null,
          "date_filed": "2002-04-17T00:00:00-04:00",
          "attachments": null,
          "url": "nan",
          "recap_pdf_url": null,
          "pacer_doc_id": null,
          "description": "Jury trial #1 held (cml) (Entered: 04/18/2002)"
        },
        {
          "row_number": 130,
          "id": 1787321,
          "entry_number": "117",
          "date_filed": "2002-04-17T00:00:00-04:00",
          "attachments": null,
          "url": "nan",
          "recap_pdf_url": null,
          "pacer_doc_id": null,
          "description": "Minute entry: JURY TRIAL #1 held 4/17/02 bef Judge McAvoy in Albany, NY: APP: Same; CR: B. Buckley; LC/JC; CRD/mp. PLTF WITNESS: Michael Fyvie (cont), Thomas Fyvie & Elizabeth Gonzalez. Pltf reads stipulated facts into the record. Pltf rests. Jury stands aside. Defense makes Rule 50 motion - RESERVED on false arrest claim by pltf Fyvie against deft Glasser; DENIED as to dismissal of claim against deft City/Schenetady w/ leave to renew; DENIED as to all other motions. DEFENSE WITNESS: Eric Hesch, Peter Frisoni, Jr. & Rebecca D. Gaige. Court adjourns to 9:30 AM on 4/18/02. [9:30a - 3:45p] (cml) (Entered: 04/18/2002)"
        },
        {
          "row_number": 131,
          "id": 1787322,
          "entry_number": null,
          "date_filed": "2002-04-18T00:00:00-04:00",
          "attachments": null,
          "url": "nan",
          "recap_pdf_url": null,
          "pacer_doc_id": null,
          "description": "Jury trial #1 continues bef Judge McAvoy in Albany, NY (cml) (Entered: 04/19/2002)"
        },
        {
          "row_number": 132,
          "id": 1787323,
          "entry_number": "118",
          "date_filed": "2002-04-19T00:00:00-04:00",
          "attachments": null,
          "url": "nan",
          "recap_pdf_url": null,
          "pacer_doc_id": null,
          "description": "Minute entry: JURY TRIAL #1 (Gonzalez/Fyvie) held 4/18/02 bef Judge McAvoy in Albany, NY: APP: same; CR: B. Buckley; LC/JC; CRD/mp. DEFENSE WITNESS: Rebecca Gaige (con't), Thomas Mattice, William Lachanski, Marisela Mosher & Michael Glasser. Defense plays Exh 14 for jury. Defense rests. Motions renewed - same rulings. Jury present. PLTF REBUTTAL WITNESS: Nucgaek Seber & Elizabeth Gonzalez (recalled). DEFENSE SIR-REBUTTAL WITNESS: Eric Hesch (recalled). Evidence closed. Jury discharged until 9:30 AM on 4/19/02. Counsel meet w/ Court in chambers; charge conf held. [9:40a - 8:00p] (cml) (Entered: 04/19/2002)"
        },
        {
          "row_number": 133,
          "id": 1787324,
          "entry_number": null,
          "date_filed": "2002-04-19T00:00:00-04:00",
          "attachments": null,
          "url": "nan",
          "recap_pdf_url": null,
          "pacer_doc_id": null,
          "description": "Jury trial #1 held bef Judge McAvoy in Albany, NY (cml) (Entered: 04/22/2002)"
        },
        {
          "row_number": 134,
          "id": 1787325,
          "entry_number": "119",
          "date_filed": "2002-04-19T00:00:00-04:00",
          "attachments": null,
          "url": "nan",
          "recap_pdf_url": null,
          "pacer_doc_id": null,
          "description": "Minute entry: JURY TRIAL #1 (Gonzalez/Fyvie) held 4/19/02 bef Judge McAvoy in Albany, NY: APP: Same; CR: B. Buckley, LC/JC; CRD/mp. Charge conf resumes in chambers. In court; jury present, each side makes summation. Judge charges jury. Jury steps aside & commence deliberations. CE #1 is marked & discussed w/ counsel. Jury enters & Court complies w/ CE #1. Jury steps aside & continue deliberations. Court adjourns until 9:30 AM on 4/22/02. [9:00a - 4:15p] (cml) (Entered: 04/22/2002)"
        },
        {
          "row_number": 135,
          "id": 1787326,
          "entry_number": "120",
          "date_filed": "2002-04-22T00:00:00-04:00",
          "attachments": null,
          "url": "nan",
          "recap_pdf_url": null,
          "pacer_doc_id": null,
          "description": "Letter of Atty Stewart to the court dd 4/19/02 requesting the Court to issue an order to BOP directing they produce Mr. Barnett for the duration of the 5/6/02 trial against him by Mr. Frisbee or to postpone the trial (sfp) (Entered: 04/22/2002)"
        },
        {
          "row_number": 136,
          "id": 1787327,
          "entry_number": null,
          "date_filed": "2002-04-22T00:00:00-04:00",
          "attachments": null,
          "url": "nan",
          "recap_pdf_url": null,
          "pacer_doc_id": null,
          "description": "Jury trial #1 (Gonzalez/Fyvie) concluded (cml) (Entered: 04/22/2002)"
        },
        {
          "row_number": 137,
          "id": 1787328,
          "entry_number": "121",
          "date_filed": "2002-04-22T00:00:00-04:00",
          "attachments": null,
          "url": "nan",
          "recap_pdf_url": null,
          "pacer_doc_id": null,
          "description": "Minute entry: JURY TRIAL #1 (Gonzalez/Fyvie) concluded 4/22/02 bef Judge McAvoy in Albany, NY: APP: Same; CR: B. Buckley; LC/JC; CRD/mp. Jury deliberations resume. CE #2 marked & discussed w/ counsel. Jury verdict reached & verdict is found in favor of plaintiffs in accordance w/ the verdict form. Jury is permanently discharged w/ thanks of court. Parties advised post-trial rights. Court adjourns. [9:00a - 3:30p] (cml) (Entered: 04/22/2002)"
        },
        {
          "row_number": 138,
          "id": 1787329,
          "entry_number": "122",
          "date_filed": "2002-04-22T00:00:00-04:00",
          "attachments": null,
          "url": "nan",
          "recap_pdf_url": null,
          "pacer_doc_id": null,
          "description": "JURY VERDICT of Jury Trial #1 in favor of pltfs Elizabeth Gonzalez & Michael Fyvie (cml) (Entered: 04/22/2002)"
        },
        {
          "row_number": 139,
          "id": 1787330,
          "entry_number": null,
          "date_filed": "2002-04-22T00:00:00-04:00",
          "attachments": null,
          "url": "nan",
          "recap_pdf_url": null,
          "pacer_doc_id": null,
          "description": "DDL updated; setting Jury Trial #2 (Frisbee) for 9:30 AM on 5/6/02 bef Judge McAvoy in Binghamton , N.Y. per [112-1] scheduling notice (cml) (Entered: 04/22/2002)"
        },
        {
          "row_number": 140,
          "id": 1787331,
          "entry_number": "123",
          "date_filed": "2002-04-23T00:00:00-04:00",
          "attachments": null,
          "url": "nan",
          "recap_pdf_url": null,
          "pacer_doc_id": null,
          "description": "JUDGMENT for Elizabeth Gonzalez & Michael Fyvie against City of Schenectady, Marisela Mosher & William Lachanski Date Entered & Served: 4/23/02 (cml) (Entered: 04/23/2002)"
        },
        {
          "row_number": 141,
          "id": 1787332,
          "entry_number": "124",
          "date_filed": "2002-04-24T00:00:00-04:00",
          "attachments": null,
          "url": "nan",
          "recap_pdf_url": null,
          "pacer_doc_id": null,
          "description": "Letter of Atty Koenig to the court dd 4/22/02 requesting the court issue an order to BOP that directs them to produce Mr. Siler for the duration of the trial scheduled 5/6/02 or that the trial be stayed pending Mr. Stiler's release from federal incarceration (sfp) (Entered: 04/25/2002)"
        },
        {
          "row_number": 142,
          "id": 1787333,
          "entry_number": "125",
          "date_filed": "2002-04-25T00:00:00-04:00",
          "attachments": null,
          "url": "nan",
          "recap_pdf_url": null,
          "pacer_doc_id": null,
          "description": "Letter of Atty Koenig to the court dd 4/23/02 requesting the court that if the 5/6/02 trial gets adjourned to not reschedule it during 8/9/02-8/19/02 (sfp) (Entered: 04/25/2002)"
        },
        {
          "row_number": 143,
          "id": 1787334,
          "entry_number": "126",
          "date_filed": "2002-04-25T00:00:00-04:00",
          "attachments": null,
          "url": "nan",
          "recap_pdf_url": null,
          "pacer_doc_id": null,
          "description": "Trial Exhibit list by Elizabeth Gonzalez, Michael Fyvie (sfp) (Entered: 04/25/2002)"
        },
        {
          "row_number": 144,
          "id": 1787335,
          "entry_number": "127",
          "date_filed": "2002-04-25T00:00:00-04:00",
          "attachments": null,
          "url": "nan",
          "recap_pdf_url": null,
          "pacer_doc_id": null,
          "description": "Exhibit list by City of Schenectady, Marisela Mosher, William Lachanski (sfp) (Entered: 04/25/2002)"
        },
        {
          "row_number": 145,
          "id": 1787336,
          "entry_number": "128",
          "date_filed": "2002-04-26T00:00:00-04:00",
          "attachments": null,
          "url": "nan",
          "recap_pdf_url": null,
          "pacer_doc_id": null,
          "description": "COURT Notice dtd 4/26/02 resetting Frisbee Jury Trial for 1:00 PM on 9/3/02 in Albany , N.Y. (cml) (Entered: 04/26/2002)"
        },
        {
          "row_number": 146,
          "id": 1787337,
          "entry_number": "129",
          "date_filed": "2002-04-29T00:00:00-04:00",
          "attachments": null,
          "url": "nan",
          "recap_pdf_url": null,
          "pacer_doc_id": null,
          "description": "LETTER of Kevin A. Luibrand, Esq. dd 4-24-02 advising the Court of his unavailability during 8-11 thru 8-25-2002 (pta) (Entered: 04/29/2002)"
        },
        {
          "row_number": 147,
          "id": 1787338,
          "entry_number": "130",
          "date_filed": "2002-05-01T00:00:00-04:00",
          "attachments": null,
          "url": "nan",
          "recap_pdf_url": null,
          "pacer_doc_id": null,
          "description": "Jury note/CE #1 filed re: Gonzalez/Fyvie trial (cml) (Entered: 05/01/2002)"
        },
        {
          "row_number": 148,
          "id": 1787339,
          "entry_number": "131",
          "date_filed": "2002-05-01T00:00:00-04:00",
          "attachments": null,
          "url": "nan",
          "recap_pdf_url": null,
          "pacer_doc_id": null,
          "description": "Jury note/CE #2 filed re: Gonzalez/Fyvie trial (cml) (Entered: 05/01/2002)"
        },
        {
          "row_number": 149,
          "id": 1787340,
          "entry_number": "132",
          "date_filed": "2002-05-01T00:00:00-04:00",
          "attachments": null,
          "url": "nan",
          "recap_pdf_url": null,
          "pacer_doc_id": null,
          "description": "Jury note/CE #3 filed re: Gonzalez/Fyvie trial (cml) (Entered: 05/01/2002)"
        },
        {
          "row_number": 150,
          "id": 1787341,
          "entry_number": "133",
          "date_filed": "2002-05-03T00:00:00-04:00",
          "attachments": null,
          "url": "nan",
          "recap_pdf_url": null,
          "pacer_doc_id": null,
          "description": "MOTION by defendants for Judgement as a Matter of Law, pursuant to Rule 50a, for reduction of compensatory damages award to pltf, to set aside punitive damages award to pltf or, in the alternative, for a new trial. , Hearing set for 10:00 6/10/02 , Response Deadline 5/27/02 , Reply to Response Deadline 6/3/02 Motion returnable before Judge/Mag. Judge: McAvoy in Albany, NY (wjg) Modified on 05/06/2002 (Entered: 05/06/2002)"
        },
        {
          "row_number": 151,
          "id": 1787342,
          "entry_number": "133",
          "date_filed": "2002-05-03T00:00:00-04:00",
          "attachments": null,
          "url": "nan",
          "recap_pdf_url": null,
          "pacer_doc_id": null,
          "description": "AFFIDAVIT by Michael Murphy for defendants Re: support of [133-1] motion for Judgement as a Matter of Law, pursuant to Rule 50a, for reduction of compensatory damages award to pltf, to set aside punitive damages award to pltf or, in the alternative, for a new trial. (wjg) Modified on 05/06/2002 (Entered: 05/06/2002)"
        },
        {
          "row_number": 152,
          "id": 1787343,
          "entry_number": "134",
          "date_filed": "2002-05-03T00:00:00-04:00",
          "attachments": null,
          "url": "nan",
          "recap_pdf_url": null,
          "pacer_doc_id": null,
          "description": "MEMORANDUM OF LAW by defendants in support of [133-1] motion for Judgement as a Matter of Law, pursuant to Rule 50a, for reduction of compensatory damages award to pltf, to set aside punitive damages award to pltf or, in the alternative, for a new trial. (wjg) Modified on 05/06/2002 (Entered: 05/06/2002)"
        },
        {
          "row_number": 153,
          "id": 1787344,
          "entry_number": "135",
          "date_filed": "2002-05-14T00:00:00-04:00",
          "attachments": null,
          "url": "nan",
          "recap_pdf_url": null,
          "pacer_doc_id": null,
          "description": "NOTICE OF APPEAL by City of Schenectady, Thomas X. Mattice, Marisela Mosher, William Lachanski, Eric Hesch from the final judgment (jury verdict) entered 4/23/02. FILING FEE $ 105.00 RECEIPT # 62474 Appeal record due on 6/13/02 (wjg) (Entered: 05/15/2002)"
        },
        {
          "row_number": 154,
          "id": 1787345,
          "entry_number": null,
          "date_filed": "2002-05-17T00:00:00-04:00",
          "attachments": null,
          "url": "nan",
          "recap_pdf_url": null,
          "pacer_doc_id": null,
          "description": "Notice of appeal and certified copy of docket to USCA re: [135-1] appeal by Eric Hesch, William Lachanski, Marisela Mosher, Thomas X. Mattice, City of Schenectady (parties noticed). (wjg) (Entered: 07/15/2002)"
        },
        {
          "row_number": 155,
          "id": 1787346,
          "entry_number": "136",
          "date_filed": "2002-05-28T00:00:00-04:00",
          "attachments": null,
          "url": "nan",
          "recap_pdf_url": null,
          "pacer_doc_id": null,
          "description": "MEMORANDUM by Charles Frisbee in opposition to [133-1] motion for Judgement as a Matter of Law, pursuant to Rule 50 and 59 (pta) (Entered: 05/28/2002)"
        },
        {
          "row_number": 156,
          "id": 1787347,
          "entry_number": "137",
          "date_filed": "2002-05-28T00:00:00-04:00",
          "attachments": null,
          "url": "nan",
          "recap_pdf_url": null,
          "pacer_doc_id": null,
          "description": "AFFIDAVIT of Kevin A. Luibrand, Esq. on behalf of Charles Frisbee in opposition to Defts Re: [133-1] motion for Judgement as a Matter of Law, pursuant to Rule 50 and 59, for reduction of compensatory damages award to pltf, to set aside punitive damages award to pltf or, in the alternative, for a new trial; w/Exhibit A (pta) (Entered: 05/28/2002)"
        },
        {
          "row_number": 157,
          "id": 1787348,
          "entry_number": "138",
          "date_filed": "2002-06-03T00:00:00-04:00",
          "attachments": null,
          "url": "nan",
          "recap_pdf_url": null,
          "pacer_doc_id": null,
          "description": "Court NOTICE to counsel dd 6/3/02 advising that the pending motions for 6/10/02 will be on submit, no appearances necessary (sfp) (Entered: 06/03/2002)"
        },
        {
          "row_number": 158,
          "id": 1787349,
          "entry_number": "139",
          "date_filed": "2002-06-17T00:00:00-04:00",
          "attachments": null,
          "url": "nan",
          "recap_pdf_url": null,
          "pacer_doc_id": null,
          "description": "Minute entry: MOTION CALENDAR held 6/10/02 bef Judge McAvoy in Albany, NY: APP: None; CR: B. Buckley; LC/JC; CRD/mp. Defts [133-1] motion for Judgment as Matter/Law, reduction of compensatory damages award, set aside punitive damages award and/or for a new trial - TAKEN ON SUBMIT. (cml) (Entered: 06/18/2002)"
        },
        {
          "row_number": 159,
          "id": 1787350,
          "entry_number": "140",
          "date_filed": "2002-07-15T00:00:00-04:00",
          "attachments": null,
          "url": "nan",
          "recap_pdf_url": null,
          "pacer_doc_id": null,
          "description": "Court of Appeals Scheduling Order, re: [135-1] appeal by Eric Hesch, William Lachanski, Marisela Mosher, Thomas X. Mattice, City of Schenectady ; Index to Appeal record due on 8/6/02 (wjg) (Entered: 07/16/2002)"
        },
        {
          "row_number": 160,
          "id": 1787351,
          "entry_number": null,
          "date_filed": "2002-07-15T00:00:00-04:00",
          "attachments": null,
          "url": "nan",
          "recap_pdf_url": null,
          "pacer_doc_id": null,
          "description": "USCA Case Number Re: [135-1] appeal by Eric Hesch, William Lachanski, Marisela Mosher, Thomas X. Mattice, City of Schenectady USCA NUMBER: 02- 7614 (wjg) (Entered: 07/16/2002)"
        },
        {
          "row_number": 161,
          "id": 1787352,
          "entry_number": null,
          "date_filed": "2002-07-16T00:00:00-04:00",
          "attachments": null,
          "url": "nan",
          "recap_pdf_url": null,
          "pacer_doc_id": null,
          "description": "Certified and transmitted index to the record on appeal to U.S. Court of Appeals: [135-1] appeal by Eric Hesch, William Lachanski, Marisela Mosher, Thomas X. Mattice, City of Schenectady (wjg) (Entered: 07/16/2002)"
        },
        {
          "row_number": 162,
          "id": 1787353,
          "entry_number": "141",
          "date_filed": "2002-07-29T00:00:00-04:00",
          "attachments": null,
          "url": "nan",
          "recap_pdf_url": null,
          "pacer_doc_id": null,
          "description": "Letter of Atty Koenig to the court dd 7/26/02 requesting the court issue a writ to produce for Deft Siler to attend trial on 9/3/02 [forward to chambers/cml] (sfp) (Entered: 07/29/2002)"
        },
        {
          "row_number": 163,
          "id": 1787354,
          "entry_number": "142",
          "date_filed": "2002-07-30T00:00:00-04:00",
          "attachments": null,
          "url": "nan",
          "recap_pdf_url": null,
          "pacer_doc_id": null,
          "description": "Received certified copy of the Index to the Record on Appeal from the USCA with case No. 02/7614. (fce) (Entered: 07/31/2002)"
        },
        {
          "row_number": 164,
          "id": 1787355,
          "entry_number": "143",
          "date_filed": "2002-08-01T00:00:00-04:00",
          "attachments": null,
          "url": "nan",
          "recap_pdf_url": null,
          "pacer_doc_id": null,
          "description": "Copy of Letter of Atty Stewart dd 7/30/02 to the FCI Warden at Waseca, MN seeking furlough for Richard Barnett for trial on 9/3/02 (sfp) (Entered: 08/01/2002)"
        },
        {
          "row_number": 165,
          "id": 1787356,
          "entry_number": "144",
          "date_filed": "2002-08-08T00:00:00-04:00",
          "attachments": null,
          "url": "nan",
          "recap_pdf_url": null,
          "pacer_doc_id": null,
          "description": "ORDER/WRIT of Habeas Corpus ad Testificandum to USBOP / Warden of FCI Waseca to produce deft Richard Barnett #10357-052 for trial at 11:00 AM on 9/03/02 in Albany, NY (Signed by Judge Thomas J. McAvoy dtd 8/08/02) (cml) (Entered: 08/08/2002)"
        },
        {
          "row_number": 166,
          "id": 1787357,
          "entry_number": "145",
          "date_filed": "2002-08-08T00:00:00-04:00",
          "attachments": null,
          "url": "nan",
          "recap_pdf_url": null,
          "pacer_doc_id": null,
          "description": "ORDER/WRIT of Habeas Corpus ad Testificandum to USBOP / Warden FCI Beaumont (Low) to produce deft Michael Siler #10356-052 for trial at 11:00 AM on 9/03/02 in Albany, NY; (Signed by Judge Thomas J. McAvoy dtd 8/08/02) (cml) (Entered: 08/08/2002)"
        },
        {
          "row_number": 167,
          "id": 1787358,
          "entry_number": "146",
          "date_filed": "2002-08-19T00:00:00-04:00",
          "attachments": null,
          "url": "nan",
          "recap_pdf_url": null,
          "pacer_doc_id": null,
          "description": "JUDGMENT OF USCA (certified copy) Re: [135-1] appeal by Eric Hesch, William Lachanski, Marisela Mosher, Thomas X. Mattice, City of Schenectady Appeal is stayed pending decision of pending motions in the District Court. (tab) (Entered: 08/22/2002)"
        },
        {
          "row_number": 168,
          "id": 1787359,
          "entry_number": "147",
          "date_filed": "2002-08-26T00:00:00-04:00",
          "attachments": null,
          "url": "nan",
          "recap_pdf_url": null,
          "pacer_doc_id": null,
          "description": "Witness list by City of Schenectady, Michael Siler (wjg) (Entered: 08/26/2002)"
        },
        {
          "row_number": 169,
          "id": 1787360,
          "entry_number": "148",
          "date_filed": "2002-08-26T00:00:00-04:00",
          "attachments": null,
          "url": "nan",
          "recap_pdf_url": null,
          "pacer_doc_id": null,
          "description": "Voir Dire Attachment by City of Schenectady, Michael Siler (wjg) (Entered: 08/26/2002)"
        },
        {
          "row_number": 170,
          "id": 1787361,
          "entry_number": "149",
          "date_filed": "2002-08-26T00:00:00-04:00",
          "attachments": null,
          "url": "nan",
          "recap_pdf_url": null,
          "pacer_doc_id": null,
          "description": "Voir dire questions by City of Schenectady, Michael Siler (wjg) (Entered: 08/26/2002)"
        },
        {
          "row_number": 171,
          "id": 1787362,
          "entry_number": "150",
          "date_filed": "2002-08-26T00:00:00-04:00",
          "attachments": null,
          "url": "nan",
          "recap_pdf_url": null,
          "pacer_doc_id": null,
          "description": "Exhibit list by City of Schenectady, Michael Siler (wjg) (Entered: 08/26/2002)"
        },
        {
          "row_number": 172,
          "id": 1787363,
          "entry_number": null,
          "date_filed": "2002-08-26T00:00:00-04:00",
          "attachments": null,
          "url": "nan",
          "recap_pdf_url": null,
          "pacer_doc_id": null,
          "description": "Recv'd Deft Siler trial diskette [placed in JF] (pta) (Entered: 08/26/2002)"
        },
        {
          "row_number": 173,
          "id": 1787364,
          "entry_number": "152",
          "date_filed": "2002-08-26T00:00:00-04:00",
          "attachments": null,
          "url": "nan",
          "recap_pdf_url": null,
          "pacer_doc_id": null,
          "description": "Proposed Voir dire questions by Michael Siler (pta) (Entered: 08/26/2002)"
        },
        {
          "row_number": 174,
          "id": 1787365,
          "entry_number": "153",
          "date_filed": "2002-08-26T00:00:00-04:00",
          "attachments": null,
          "url": "nan",
          "recap_pdf_url": null,
          "pacer_doc_id": null,
          "description": "MOTION by Michael Siler in Limine to preclude testimony , Trial set for 9:30 9/3/02 Motion returnable before Judge/Mag. Judge: McAvoy (pta) (Entered: 08/26/2002)"
        },
        {
          "row_number": 175,
          "id": 1787366,
          "entry_number": "154",
          "date_filed": "2002-08-27T00:00:00-04:00",
          "attachments": null,
          "url": "nan",
          "recap_pdf_url": null,
          "pacer_doc_id": null,
          "description": "Court Ordered Voir Dire Attachment by Pltf Charles Frisbee (sfp) (Entered: 08/27/2002)"
        },
        {
          "row_number": 176,
          "id": 1787367,
          "entry_number": "155",
          "date_filed": "2002-08-27T00:00:00-04:00",
          "attachments": null,
          "url": "nan",
          "recap_pdf_url": null,
          "pacer_doc_id": null,
          "description": "Proposed Voir dire questions by Charles Frisbee (sfp) (Entered: 08/27/2002)"
        },
        {
          "row_number": 177,
          "id": 1787368,
          "entry_number": "156",
          "date_filed": "2002-08-27T00:00:00-04:00",
          "attachments": null,
          "url": "nan",
          "recap_pdf_url": null,
          "pacer_doc_id": null,
          "description": "Witness list by Charles Frisbee (sfp) (Entered: 08/27/2002)"
        },
        {
          "row_number": 178,
          "id": 1787369,
          "entry_number": "157",
          "date_filed": "2002-08-27T00:00:00-04:00",
          "attachments": null,
          "url": "nan",
          "recap_pdf_url": null,
          "pacer_doc_id": null,
          "description": "Proposed Exhibit list by Charles Frisbee (sfp) (Entered: 08/27/2002)"
        },
        {
          "row_number": 179,
          "id": 1787370,
          "entry_number": "158",
          "date_filed": "2002-08-27T00:00:00-04:00",
          "attachments": null,
          "url": "nan",
          "recap_pdf_url": null,
          "pacer_doc_id": null,
          "description": "MOTION by Charles Frisbee in Limine re: evidentiary issues , Trial set for 9:30 9/3/02 Motion returnable before Judge/Mag. Judge: McAvoy (sfp) (Entered: 08/27/2002)"
        },
        {
          "row_number": 180,
          "id": 1787371,
          "entry_number": "159",
          "date_filed": "2002-08-27T00:00:00-04:00",
          "attachments": null,
          "url": "nan",
          "recap_pdf_url": null,
          "pacer_doc_id": null,
          "description": "TRIAL BRIEF by Charles Frisbee (sfp) (Entered: 08/27/2002)"
        },
        {
          "row_number": 181,
          "id": 1787372,
          "entry_number": "160",
          "date_filed": "2002-08-27T00:00:00-04:00",
          "attachments": null,
          "url": "nan",
          "recap_pdf_url": null,
          "pacer_doc_id": null,
          "description": "Proposed Jury instructions [Request to Charge] by Charles Frisbee (sfp) (Entered: 08/27/2002)"
        },
        {
          "row_number": 182,
          "id": 1787373,
          "entry_number": "161",
          "date_filed": "2002-08-27T00:00:00-04:00",
          "attachments": null,
          "url": "nan",
          "recap_pdf_url": null,
          "pacer_doc_id": null,
          "description": "Voir dire questions [Proposed Special Verdict Sheet] by Charles Frisbee (sfp) (Entered: 08/27/2002)"
        },
        {
          "row_number": 183,
          "id": 1787374,
          "entry_number": "162",
          "date_filed": "2002-08-28T00:00:00-04:00",
          "attachments": null,
          "url": "nan",
          "recap_pdf_url": null,
          "pacer_doc_id": null,
          "description": "REQUEST and ORDER, denying Atty Murphy's request for adjournment of 9/3/02 trial date ( signed by Judge Thomas J. McAvoy 8/27/02 ) (sfp) (Entered: 08/28/2002)"
        },
        {
          "row_number": 184,
          "id": 1787375,
          "entry_number": "163",
          "date_filed": "2002-08-29T00:00:00-04:00",
          "attachments": null,
          "url": "nan",
          "recap_pdf_url": null,
          "pacer_doc_id": null,
          "description": "Letter of Atty Koenig to the court dd 8/27/02 stating he has no objection to Atty's Murphy & Luibrand's requests for adjournment of 9/3/02 trial (sfp) (Entered: 08/29/2002)"
        },
        {
          "row_number": 185,
          "id": 1787376,
          "entry_number": "164",
          "date_filed": "2002-08-30T00:00:00-04:00",
          "attachments": null,
          "url": "nan",
          "recap_pdf_url": null,
          "pacer_doc_id": null,
          "description": "STIPULATION/ORDER, to Dismiss/discontinue action as to deft Richard Barnett ( signed by Judge Thomas J. McAvoy on 9/3/02) (wjg) (Entered: 09/04/2002)"
        },
        {
          "row_number": 186,
          "id": 1787377,
          "entry_number": null,
          "date_filed": "2002-09-03T00:00:00-04:00",
          "attachments": null,
          "url": "nan",
          "recap_pdf_url": null,
          "pacer_doc_id": null,
          "description": "Bifurcated Jury trial re: Frisbee vs. Siler & City/Schenectady begins bef Judge McAvoy in Albany, NY (cml) (Entered: 09/04/2002)"
        },
        {
          "row_number": 187,
          "id": 1787378,
          "entry_number": "165",
          "date_filed": "2002-09-04T00:00:00-04:00",
          "attachments": null,
          "url": "nan",
          "recap_pdf_url": null,
          "pacer_doc_id": null,
          "description": "Minute entry: FRISBEE vs. SILER & CITY/SCHENECTADY JURY TRIAL commences 9/03/02 bef Judge McAvoy in Albany, NY: APP: Kevin Luibrand & Andrienne Kerwin, Esqs. for Pltf; Michael Koenig, Esq. for Deft Siler; Blair Todt, Esq. for Deft City/Schenectady; CR: T. Berical; LC/JC; CRD/mp. Pltf's [158-1] motion/limine & Deft Siler's [153-1] motion/limine are argued in chambers. Jury selection conducted; jury sworn & discharged until 9:30 AM on 9/04/02. Attys recess to chambers; settlement discussions go forward. Evidentiary issues discussed. Court adjourns. [12:15p - 6:30p] (cml) (Entered: 09/04/2002)"
        },
        {
          "row_number": 188,
          "id": 1787379,
          "entry_number": null,
          "date_filed": "2002-09-04T00:00:00-04:00",
          "attachments": null,
          "url": "nan",
          "recap_pdf_url": null,
          "pacer_doc_id": null,
          "description": "Bifurcated Jury trial re: Frisbee vs. Siler & City/Schenectady in Albany, NY is concluded (cml) (Entered: 09/04/2002)"
        },
        {
          "row_number": 189,
          "id": 1787380,
          "entry_number": "166",
          "date_filed": "2002-09-04T00:00:00-04:00",
          "attachments": null,
          "url": "nan",
          "recap_pdf_url": null,
          "pacer_doc_id": null,
          "description": "Minute entry: FRISBEE vs. SILER & CITY/SCHENECTADY JURY TRIAL concluded 9/04/02 bef Judge McAvoy in Albany, NY: APP: Same; CR: T. Berical; LC/JC; CRD/mp. Further settlement discussions continue in chambers. Settlement is reached & placed upon the record. Jury enters in open court & advised of settlement. Jury is permanently discharged w/ the thanks of the court. Court adjourns. [9:00a - 10:00a] (cml) (Entered: 09/04/2002)"
        },
        {
          "row_number": 190,
          "id": 1787381,
          "entry_number": "167",
          "date_filed": "2002-09-04T00:00:00-04:00",
          "attachments": null,
          "url": "nan",
          "recap_pdf_url": null,
          "pacer_doc_id": null,
          "description": "JUDGMENT dismissing action by reason of settlement as to parties pltf Frisbee and defts Siler & City/Schenectady only [30 days stated] Date Entered & Served: 9/04/02 (cml) (Entered: 09/04/2002)"
        },
        {
          "row_number": 191,
          "id": 1787382,
          "entry_number": null,
          "date_filed": "2002-09-04T00:00:00-04:00",
          "attachments": null,
          "url": "nan",
          "recap_pdf_url": null,
          "pacer_doc_id": null,
          "description": "Case closed (cml) (Entered: 09/04/2002)"
        },
        {
          "row_number": 192,
          "id": 1787383,
          "entry_number": "168",
          "date_filed": "2002-09-04T00:00:00-04:00",
          "attachments": null,
          "url": "nan",
          "recap_pdf_url": null,
          "pacer_doc_id": null,
          "description": "AFFIDAVIT/CERTIFICATE OF SERVICE of subpoena on Monica Dunkel on 8/30/02. (wjg) (Entered: 09/05/2002)"
        },
        {
          "row_number": 193,
          "id": 1787384,
          "entry_number": null,
          "date_filed": "2002-11-12T00:00:00-05:00",
          "attachments": null,
          "url": "nan",
          "recap_pdf_url": null,
          "pacer_doc_id": null,
          "description": "Motion(s) no longer referred: [133-1] motion for Judgement as a Matter of Law, pursuant to Rule 50a, for reduction of compensatory damages award to pltf, to set aside punitive damages award to pltf or, in the alternative, for a new trial. (wjg) (Entered: 11/12/2002)"
        },
        {
          "row_number": 194,
          "id": 1787385,
          "entry_number": "169",
          "date_filed": "2002-12-03T00:00:00-05:00",
          "attachments": null,
          "url": "nan",
          "recap_pdf_url": null,
          "pacer_doc_id": null,
          "description": "TRANSCRIPT filed for dates of 9/4/02 (settlement) (wjg) (Entered: 12/03/2002)"
        },
        {
          "row_number": 195,
          "id": 1787386,
          "entry_number": "170",
          "date_filed": "2002-12-27T00:00:00-05:00",
          "attachments": null,
          "url": "nan",
          "recap_pdf_url": null,
          "pacer_doc_id": null,
          "description": "TRANSCRIPT filed for dates of 4/16/02 (jury trial) (wjg) (Entered: 12/30/2002)"
        },
        {
          "row_number": 196,
          "id": 1787387,
          "entry_number": "171",
          "date_filed": "2002-12-27T00:00:00-05:00",
          "attachments": null,
          "url": "nan",
          "recap_pdf_url": null,
          "pacer_doc_id": null,
          "description": "TRANSCRIPT filed for dates of 4/17/02 (jury trial-cont.) (wjg) (Entered: 12/30/2002)"
        },
        {
          "row_number": 197,
          "id": 1787388,
          "entry_number": "172",
          "date_filed": "2002-12-27T00:00:00-05:00",
          "attachments": null,
          "url": "nan",
          "recap_pdf_url": null,
          "pacer_doc_id": null,
          "description": "TRANSCRIPT filed for dates of 4/18/02 (jury trial-cont.) (wjg) (Entered: 12/30/2002)"
        },
        {
          "row_number": 198,
          "id": 1787389,
          "entry_number": "173",
          "date_filed": "2002-12-27T00:00:00-05:00",
          "attachments": null,
          "url": "nan",
          "recap_pdf_url": null,
          "pacer_doc_id": null,
          "description": "TRANSCRIPT filed for dates of 4/19/02 (jury-trial-cont.) (wjg) (Entered: 12/30/2002)"
        },
        {
          "row_number": 199,
          "id": 1787390,
          "entry_number": "174",
          "date_filed": "2002-12-27T00:00:00-05:00",
          "attachments": null,
          "url": "nan",
          "recap_pdf_url": null,
          "pacer_doc_id": null,
          "description": "TRANSCRIPT filed for dates of 4/22/02 (jury trial-cont.) (wjg) (Entered: 12/30/2002)"
        },
        {
          "row_number": 200,
          "id": 1787391,
          "entry_number": "175",
          "date_filed": "2002-12-30T00:00:00-05:00",
          "attachments": null,
          "url": "nan",
          "recap_pdf_url": null,
          "pacer_doc_id": null,
          "description": "ORDER granting Defts' [133-1] motion for a new trial on the issue of Fyvie's actual damages unless Fyvie files and serves a written acceptance of remittitur of the award of actual damages on his strip search claim to $40,000.00 on or before 1/28/03; and denying the [133-1] motion in all other respects ( signed by Judge Thomas J. McAvoy ) Date Entered: 12/30/02 (amt) (Entered: 12/30/2002)"
        },
        {
          "row_number": 201,
          "id": 1787392,
          "entry_number": "176",
          "date_filed": "2003-01-13T00:00:00-05:00",
          "attachments": null,
          "url": "nan",
          "recap_pdf_url": null,
          "pacer_doc_id": null,
          "description": "Letter of Atty Luibrand to the court dd 1/3/03 stating Fyvie as accepted the remittitur of the compensatory damage award to him [copy forwarded to chambers/CML] (amt) (Entered: 01/13/2003)"
        },
        {
          "row_number": 202,
          "id": 1787393,
          "entry_number": "177",
          "date_filed": "2003-01-15T00:00:00-05:00",
          "attachments": null,
          "url": "nan",
          "recap_pdf_url": null,
          "pacer_doc_id": null,
          "description": "MOTION by Elizabeth Gonzalez, Michael Fyvie for Legal/ Attorney Fees , Hearing set for 10:00 2/28/03 , Response Deadline 2/14/03 , Reply to Response Deadline 2/21/03 Motion returnable before Judge/Mag. Judge: McAvoy in Binghamton, NY (on submit). (wjg) (Entered: 01/16/2003)"
        },
        {
          "row_number": 203,
          "id": 1787394,
          "entry_number": "177",
          "date_filed": "2003-01-15T00:00:00-05:00",
          "attachments": null,
          "url": "nan",
          "recap_pdf_url": null,
          "pacer_doc_id": null,
          "description": "AFFIDAVIT by Kevin Luibrand for Elizabeth Gonzalez, Michael Fyvie Re: support of [177-1] motion for Legal/ Attorney Fees (wjg) (Entered: 01/16/2003)"
        },
        {
          "row_number": 204,
          "id": 1787395,
          "entry_number": "178",
          "date_filed": "2003-01-15T00:00:00-05:00",
          "attachments": null,
          "url": "nan",
          "recap_pdf_url": null,
          "pacer_doc_id": null,
          "description": "AFFIDAVIT by Adrienne Kerwin for Elizabeth Gonzalez, Michael Fyvie Re: support of [177-1] motion for Legal/ Attorney Fees (wjg) (Entered: 01/16/2003)"
        },
        {
          "row_number": 205,
          "id": 1787396,
          "entry_number": "179",
          "date_filed": "2003-01-15T00:00:00-05:00",
          "attachments": null,
          "url": "nan",
          "recap_pdf_url": null,
          "pacer_doc_id": null,
          "description": "AFFIDAVIT by Elizabeth Gonzalez Re: support of [177-1] motion for Legal/ Attorney Fees (wjg) (Entered: 01/16/2003)"
        },
        {
          "row_number": 206,
          "id": 1787397,
          "entry_number": "180",
          "date_filed": "2003-01-15T00:00:00-05:00",
          "attachments": null,
          "url": "nan",
          "recap_pdf_url": null,
          "pacer_doc_id": null,
          "description": "AFFIDAVIT by Michael Fyvie Re: support of [177-1] motion for Legal/ Attorney Fees (wjg) (Entered: 01/16/2003)"
        },
        {
          "row_number": 207,
          "id": 1787398,
          "entry_number": "181",
          "date_filed": "2003-01-15T00:00:00-05:00",
          "attachments": null,
          "url": "nan",
          "recap_pdf_url": null,
          "pacer_doc_id": null,
          "description": "MEMORANDUM OF LAW by Elizabeth Gonzalez, Michael Fyvie in support of [177-1] motion for Legal/ Attorney Fees (wjg) (Entered: 01/16/2003)"
        },
        {
          "row_number": 208,
          "id": 1787399,
          "entry_number": "182",
          "date_filed": "2003-01-16T00:00:00-05:00",
          "attachments": null,
          "url": "nan",
          "recap_pdf_url": null,
          "pacer_doc_id": null,
          "description": "Clerk's Scheduling Notice re-setting [177-1] Motion for Legal/Atty fees from 2/10/03 to 2/28/03 @ 10:00am before USDJ McAvoy in Binghamton, NY (on submit); Opposition to be filed and served by 2/14/03. (wjg) (Entered: 01/16/2003)"
        },
        {
          "row_number": 209,
          "id": 1787400,
          "entry_number": "183",
          "date_filed": "2003-02-12T00:00:00-05:00",
          "attachments": null,
          "url": "nan",
          "recap_pdf_url": null,
          "pacer_doc_id": null,
          "description": "Court notice to counsel dd 2/12/03 advising that the pending motions for 2/28/03 are on submit basis, no appearances necessary (sfp) (Entered: 02/12/2003)"
        },
        {
          "row_number": 210,
          "id": 1787401,
          "entry_number": "184",
          "date_filed": "2003-02-18T00:00:00-05:00",
          "attachments": null,
          "url": "nan",
          "recap_pdf_url": null,
          "pacer_doc_id": null,
          "description": "Letter of Atty Decaire to the court dd 2/13/03 stating Defts will not be submitting any opposition to the motin for attorneys' fees (amt) (Entered: 02/18/2003)"
        },
        {
          "row_number": 211,
          "id": 1787402,
          "entry_number": null,
          "date_filed": "2003-02-28T00:00:00-05:00",
          "attachments": null,
          "url": "nan",
          "recap_pdf_url": null,
          "pacer_doc_id": null,
          "description": "Motion hearing re: Pltfs Gonzalez & Fyvie's [177-1] motion for Legal/Attorney Fees held (cml) (Entered: 03/03/2003)"
        },
        {
          "row_number": 212,
          "id": 1787403,
          "entry_number": "185",
          "date_filed": "2003-02-28T00:00:00-05:00",
          "attachments": null,
          "url": "nan",
          "recap_pdf_url": null,
          "pacer_doc_id": null,
          "description": "Minute entry: MOTION CALENDAR held 2/28/03 bef Judge McAvoy in Binghamton, NY: APP: None; CR: V. Theleman; LC/JC; CRD/cml. Pltfs Gonzalez & Fyvie's [177-1] motion for Legal/ Attorney fees - TAKEN ON SUBMIT. (cml) (Entered: 03/03/2003)"
        },
        {
          "row_number": 213,
          "id": 1787404,
          "entry_number": "186",
          "date_filed": "2003-04-07T00:00:00-04:00",
          "attachments": null,
          "url": "nan",
          "recap_pdf_url": null,
          "pacer_doc_id": null,
          "description": "ORDER/CIVIL JUDGMENT granting [177-1] motion for Legal/ Attorney Fees in the amount of $94,138.83. to plaintiffs ( signed by Judge Thomas J. McAvoy on 4/4/03) Date Entered: 4/7/03 (wjg) (Entered: 04/07/2003)"
        },
        {
          "row_number": 214,
          "id": 1787405,
          "entry_number": "187",
          "date_filed": "2003-05-19T00:00:00-04:00",
          "attachments": null,
          "url": "nan",
          "recap_pdf_url": null,
          "pacer_doc_id": null,
          "description": "SATISFACTION OF JUDGMENT signed by Michael Fyvie on 5/10/03 (amt) (Entered: 05/19/2003)"
        },
        {
          "row_number": 215,
          "id": 1787406,
          "entry_number": "188",
          "date_filed": "2003-05-19T00:00:00-04:00",
          "attachments": null,
          "url": "nan",
          "recap_pdf_url": null,
          "pacer_doc_id": null,
          "description": "SATISFACTION OF JUDGMENT signed by Pltfs Gonzalez and Fyvie on 5/10/03 (amt) (Entered: 05/19/2003)"
        },
        {
          "row_number": 216,
          "id": 1787407,
          "entry_number": "189",
          "date_filed": "2003-05-19T00:00:00-04:00",
          "attachments": null,
          "url": "nan",
          "recap_pdf_url": null,
          "pacer_doc_id": null,
          "description": "SATISFACTION OF JUDGMENT signed by Pltf Gonzalez on 5/7/03 (amt) Modified on 05/19/2003 (Entered: 05/19/2003)"
        },
        {
          "row_number": 217,
          "id": 1787408,
          "entry_number": "190",
          "date_filed": "2003-08-12T00:00:00-04:00",
          "attachments": null,
          "url": "nan",
          "recap_pdf_url": null,
          "pacer_doc_id": null,
          "description": "Supplemental Proposed Jury instructions/request to charge by Michael Siler, City of Schenectady (wjg) (Entered: 08/12/2003)"
        },
        {
          "row_number": 218,
          "id": 1787409,
          "entry_number": "191",
          "date_filed": "2005-01-05T00:00:00-05:00",
          "attachments": null,
          "url": "nan",
          "recap_pdf_url": null,
          "pacer_doc_id": null,
          "description": "MANDATE of USCA on Stipulation withdrawing appeal. (wjg, ) (Entered: 01/07/2005)"
        },
        {
          "row_number": 219,
          "id": 1787410,
          "entry_number": "192",
          "date_filed": "2006-10-10T00:00:00-04:00",
          "attachments": null,
          "url": "nan",
          "recap_pdf_url": null,
          "pacer_doc_id": null,
          "description": "ORDER ; that the parties show cause w/in 30 days why the case/or documents cannot be unsealed for storage. Signed by Judge Thomas J. McAvoy on 10/10/06. (pta ) (Entered: 10/10/2006)"
        },
        {
          "row_number": 220,
          "id": 1787411,
          "entry_number": null,
          "date_filed": "2006-10-10T00:00:00-04:00",
          "attachments": null,
          "url": "nan",
          "recap_pdf_url": null,
          "pacer_doc_id": null,
          "description": "Clerk served Order 192 upon non NEF parties by regular mail (pta ) (Entered: 10/10/2006)"
        },
        {
          "row_number": 21,
          "id": 1787212,
          "entry_number": "19",
          "date_filed": "2000-12-04T00:00:00-05:00",
          "attachments": [],
          "url": "nan",
          "recap_pdf_url": null,
          "pacer_doc_id": null,
          "description": "AMENDED COMPLAINT by Elizabeth Gonzalez, Michael Fyvie, Charles Frisbee , Service deadline 2/2/01 for Jane Doe, for John Doe, for William Lachanski, for Marisela Mosher, for Michael Glasser, for Thomas X. Mattice, for Michael Siler, for Richard Barnett, for City of Schenectady , amends [1-1] complaint (wjg) Modified on 12/04/2000 (Entered: 11/28/2000)"
        },
        {
          "row_number": 55,
          "id": 1787246,
          "entry_number": null,
          "date_filed": "2001-04-03T00:00:00-04:00",
          "attachments": [],
          "url": "nan",
          "recap_pdf_url": null,
          "pacer_doc_id": null,
          "description": "Motion(s) no longer referred: [48-1] motion for Rule 11 Sanctions (wjg) (Entered: 04/04/2001)"
        },
        {
          "row_number": 32,
          "id": 1787223,
          "entry_number": "28",
          "date_filed": "2001-01-03T00:00:00-05:00",
          "attachments": [],
          "url": "nan",
          "recap_pdf_url": null,
          "pacer_doc_id": null,
          "description": "SEALED AFFIDAVIT (sealed per [24-1] Order) (wjg) (Entered: 01/04/2001)"
        },
        {
          "row_number": 61,
          "id": 1787252,
          "entry_number": "54",
          "date_filed": "2001-04-19T00:00:00-04:00",
          "attachments": [],
          "url": "nan",
          "recap_pdf_url": null,
          "pacer_doc_id": null,
          "description": "Court NOTICE to counsel dd 4/19/01 advising that the pending motions will be on submit basis; no appearances necessary; MDO already issued. (sfp) (Entered: 04/20/2001)"
        },
        {
          "row_number": 85,
          "id": 1787276,
          "entry_number": "73",
          "date_filed": "2001-07-31T00:00:00-04:00",
          "attachments": [],
          "url": "nan",
          "recap_pdf_url": null,
          "pacer_doc_id": null,
          "description": "AFFIDAVIT by Daniel Stewart for Richard Barnett Re: support of [70-1] motion for Summary Judgment/to dismiss and for severance of all claims by Plaintiff Frisbee from Gonzales and Fyvie (wjg) (Entered: 07/31/2001)"
        },
        {
          "row_number": 10,
          "id": 1787201,
          "entry_number": null,
          "date_filed": "2000-10-11T00:00:00-04:00",
          "attachments": [],
          "url": "nan",
          "recap_pdf_url": null,
          "pacer_doc_id": null,
          "description": "Returned defts' answer to amended complaint with crossclaim to Atty. Cardamone with Document rejection Notice; no amended complaint filed at this time; such complaint must be filed first before answer/crossclaim can be filed (rejection notice placed in file, with copies to all counsel). (wjg) (Entered: 10/11/2000)"
        },
        {
          "row_number": 29,
          "id": 1787220,
          "entry_number": "25",
          "date_filed": "2001-01-03T00:00:00-05:00",
          "attachments": [],
          "url": "nan",
          "recap_pdf_url": null,
          "pacer_doc_id": null,
          "description": "SEALED AFFIDAVIT (sealed per [24-1] Order) (wjg) (Entered: 01/04/2001)"
        },
        {
          "row_number": 27,
          "id": 1787218,
          "entry_number": "23",
          "date_filed": "2000-12-20T00:00:00-05:00",
          "attachments": [],
          "url": "nan",
          "recap_pdf_url": null,
          "pacer_doc_id": null,
          "description": "NOTICE of attorney appearance for Richard Barnett by William J. Dreyer (wjg) (Entered: 12/21/2000)"
        },
        {
          "row_number": 24,
          "id": 1787215,
          "entry_number": "20",
          "date_filed": "2000-12-07T00:00:00-05:00",
          "attachments": [],
          "url": "nan",
          "recap_pdf_url": null,
          "pacer_doc_id": null,
          "description": "CROSSCLAIM by City of Schenectady, Thomas Mattice, Michael Glasser, Marisela Mosher, William Lachanski, John Doe, Jane Doe, Eric Hesch against Richard Barnett, Michael Siler (wjg) (Entered: 12/07/2000)"
        },
        {
          "row_number": 34,
          "id": 1787225,
          "entry_number": "30",
          "date_filed": "2001-01-05T00:00:00-05:00",
          "attachments": [],
          "url": "nan",
          "recap_pdf_url": null,
          "pacer_doc_id": null,
          "description": "ANSWER by Michael Siler (Attorney Michael Koenig) to amended complaint (wjg) (Entered: 01/05/2001)"
        },
        {
          "row_number": 26,
          "id": 1787217,
          "entry_number": "22",
          "date_filed": "2000-12-11T00:00:00-05:00",
          "attachments": [],
          "url": "nan",
          "recap_pdf_url": null,
          "pacer_doc_id": null,
          "description": "ORDER, Motion Hearing set for 9:00 1/12/01 concerning the representation of Barnett and Siler; defts Barnett and Siler shall personally attend the hearing ( signed by Magistrate Judge David R. Homer )[served to all parties and to William Dreyer, Esq.] (wjg) (Entered: 12/12/2000)"
        },
        {
          "row_number": 59,
          "id": 1787250,
          "entry_number": "51",
          "date_filed": "2001-04-05T00:00:00-04:00",
          "attachments": [],
          "url": "nan",
          "recap_pdf_url": null,
          "pacer_doc_id": null,
          "description": "ORDER denying Defts' [41-1] cross motion for Summary Judgment in its entirety, granting Pltf Fyvie's motion [38-1] motion for Partial Summary Judgment as to his claim against City/Schenectady in violation of his 4th Amendment; and denying Pltf Gonzalez's motion for summary judgment in its entirety ( signed by Judge Thomas J. McAvoy ) Date Entered: 4/5/01 (amt) (Entered: 04/05/2001)"
        },
        {
          "row_number": 91,
          "id": 1787282,
          "entry_number": "80",
          "date_filed": "2001-07-31T00:00:00-04:00",
          "attachments": [],
          "url": "nan",
          "recap_pdf_url": null,
          "pacer_doc_id": null,
          "description": "Statement of Material Facts in response/opposition to [75-1] motion for Partial Summary Judgment filed by Charles Frisbee (wjg) (Entered: 07/31/2001)"
        },
        {
          "row_number": 87,
          "id": 1787278,
          "entry_number": "75",
          "date_filed": "2001-07-31T00:00:00-04:00",
          "attachments": [],
          "url": "nan",
          "recap_pdf_url": null,
          "pacer_doc_id": null,
          "description": "AFFIDAVIT by Michael Murphy for City of Schenectady Re: support of [75-1] motion for Partial Summary Judgment (wjg) (Entered: 07/31/2001)"
        },
        {
          "row_number": 5,
          "id": 1787196,
          "entry_number": "4",
          "date_filed": "2000-07-17T00:00:00-04:00",
          "attachments": [],
          "url": "nan",
          "recap_pdf_url": null,
          "pacer_doc_id": null,
          "description": "ANSWER to Complaint by Richard Barnett, Michael Siler (Attorney Michael Louis Koenig), (wjg) (Entered: 07/18/2000)"
        },
        {
          "row_number": 19,
          "id": 1787210,
          "entry_number": "16",
          "date_filed": "2000-11-28T00:00:00-05:00",
          "attachments": [],
          "url": "nan",
          "recap_pdf_url": null,
          "pacer_doc_id": null,
          "description": "LETTER REQUEST by Kevin Luibrand dd 11/10/00 and ORDER, for Leave to File and serve an amended complaint ( signed by Magistrate Judge David R. Homer ) (wjg) (Entered: 11/28/2000)"
        },
        {
          "row_number": 84,
          "id": 1787275,
          "entry_number": "72",
          "date_filed": "2001-07-31T00:00:00-04:00",
          "attachments": [],
          "url": "nan",
          "recap_pdf_url": null,
          "pacer_doc_id": null,
          "description": "AFFIDAVIT by Richard Barnett Re: support of [70-1] motion for Summary Judgment/to dismiss and for severance of all claims by Plaintiff Frisbee from Gonzales and Fyvie (wjg) (Entered: 07/31/2001)"
        },
        {
          "row_number": 88,
          "id": 1787279,
          "entry_number": "76",
          "date_filed": "2001-07-31T00:00:00-04:00",
          "attachments": [],
          "url": "nan",
          "recap_pdf_url": null,
          "pacer_doc_id": null,
          "description": "Statement of Material Facts in Support of [75-1] motion for Partial Summary Judgment filed by City of Schenectady (wjg) (Entered: 07/31/2001)"
        },
        {
          "row_number": 73,
          "id": 1787264,
          "entry_number": "64",
          "date_filed": "2001-06-27T00:00:00-04:00",
          "attachments": [],
          "url": "nan",
          "recap_pdf_url": null,
          "pacer_doc_id": null,
          "description": "LETTER of Michael Murphy dd 6/27/01 on behalf of City of Schenectady pursuant to Local Rule 7.1(b) regarding Motion: for partial summary judgment Date Served upon counsel: 6/27/01 (wjg) (Entered: 06/27/2001)"
        },
        {
          "row_number": 52,
          "id": 1787243,
          "entry_number": "47",
          "date_filed": "2001-03-27T00:00:00-05:00",
          "attachments": [],
          "url": "nan",
          "recap_pdf_url": null,
          "pacer_doc_id": null,
          "description": "NOTICE of attorney appearance for City of Schenectady, Richard Barnett, Michael Siler, Thomas X. Mattice, Michael Glasser, Marisela Mosher, William Lachanski, Eric Hesch by Michael J. Murphy (tab) (Entered: 03/27/2001)"
        },
        {
          "row_number": 53,
          "id": 1787244,
          "entry_number": "52",
          "date_filed": "2001-03-29T00:00:00-05:00",
          "attachments": [],
          "url": "nan",
          "recap_pdf_url": null,
          "pacer_doc_id": null,
          "description": "AFFIDAVIT(s) of Rebecca Gage and Diane UpDyke on behalf of Jane Doe(s) in opposition to Re: [41-1] cross motion for Summary Judgment (pta) (Entered: 04/09/2001)"
        },
        {
          "row_number": 93,
          "id": 1787284,
          "entry_number": "82",
          "date_filed": "2001-07-31T00:00:00-04:00",
          "attachments": [],
          "url": "nan",
          "recap_pdf_url": null,
          "pacer_doc_id": null,
          "description": "REPLY AFFIDAVIT by Daniel Stewart for Richard Barnett to response to [70-1] motion for Summary Judgment/to dismiss and for severance of all claims by Plaintiff Frisbee from Gonzales and Fyvie (wjg) (Entered: 07/31/2001)"
        },
        {
          "row_number": 43,
          "id": 1787234,
          "entry_number": "38",
          "date_filed": "2001-03-14T00:00:00-05:00",
          "attachments": [],
          "url": "nan",
          "recap_pdf_url": null,
          "pacer_doc_id": null,
          "description": "AFFIDAVIT by Kevin Luibrand for Elizabeth Gonzalez, Michael Fyvie Re: support of [38-1] motion for Partial Summary Judgment (wjg) (Entered: 03/15/2001)"
        },
        {
          "row_number": 96,
          "id": 1787287,
          "entry_number": null,
          "date_filed": "2001-09-10T00:00:00-04:00",
          "attachments": [],
          "url": "nan",
          "recap_pdf_url": null,
          "pacer_doc_id": null,
          "description": "Motion hearing re: Pltfs' [70-1] motion for Summary Judgment/to dismiss and for severance of all claims by each pltf; and, Defts' [75-1] motion for Partial Summary Judgment held (cml) (Entered: 09/12/2001)"
        },
        {
          "row_number": 20,
          "id": 1787211,
          "entry_number": "17",
          "date_filed": "2000-11-28T00:00:00-05:00",
          "attachments": [],
          "url": "nan",
          "recap_pdf_url": null,
          "pacer_doc_id": null,
          "description": "LETTER to MJ Homer from Michael Koenig dd 11/13/00 consenting to filing of proposed amended complaint. (wjg) (Entered: 11/28/2000)"
        },
        {
          "row_number": 7,
          "id": 1787198,
          "entry_number": "6",
          "date_filed": "2000-09-29T00:00:00-04:00",
          "attachments": [],
          "url": "nan",
          "recap_pdf_url": null,
          "pacer_doc_id": null,
          "description": "Proposed Joint Civil Case Management Plan Submitted. (fce) (Entered: 09/29/2000)"
        },
        {
          "row_number": 31,
          "id": 1787222,
          "entry_number": "27",
          "date_filed": "2001-01-03T00:00:00-05:00",
          "attachments": [],
          "url": "nan",
          "recap_pdf_url": null,
          "pacer_doc_id": null,
          "description": "SEALED AFFIDAVIT (sealed per [24-1] Order) (wjg) (Entered: 01/04/2001)"
        },
        {
          "row_number": 50,
          "id": 1787241,
          "entry_number": "45",
          "date_filed": "2001-03-14T00:00:00-05:00",
          "attachments": [],
          "url": "nan",
          "recap_pdf_url": null,
          "pacer_doc_id": null,
          "description": "REPLY MEMORANDUM OF LAW by Elizabeth Gonzalez, Michael Fyvie in further support of [38-1] motion for Partial Summary Judgment, and in opposition to [41-1] cross motion for Summary Judgment (wjg) (Entered: 03/15/2001)"
        },
        {
          "row_number": 86,
          "id": 1787277,
          "entry_number": "74",
          "date_filed": "2001-07-31T00:00:00-04:00",
          "attachments": [],
          "url": "nan",
          "recap_pdf_url": null,
          "pacer_doc_id": null,
          "description": "MEMORANDUM OF LAW by Richard Barnett in support of [70-1] motion for Summary Judgment/to dismiss and for severance of all claims by Plaintiff Frisbee from Gonzales and Fyvie (wjg) (Entered: 07/31/2001)"
        },
        {
          "row_number": 58,
          "id": 1787249,
          "entry_number": "50",
          "date_filed": "2001-04-03T00:00:00-04:00",
          "attachments": [],
          "url": "nan",
          "recap_pdf_url": null,
          "pacer_doc_id": null,
          "description": "Scheduling Notice: resetting [48-1] Motion for Sanctions to 5/14/01 @ 10:00am before USDJ McAvoy in Albany. (wjg) (Entered: 04/04/2001)"
        },
        {
          "row_number": 65,
          "id": 1787256,
          "entry_number": "58",
          "date_filed": "2001-05-04T00:00:00-04:00",
          "attachments": [],
          "url": "nan",
          "recap_pdf_url": null,
          "pacer_doc_id": null,
          "description": "Court NOTICE to counsel dd 5/4/01 advising that the pending motions [48-1] will be taken on submit; no appearances necessary (sfp) (Entered: 05/04/2001)"
        },
        {
          "row_number": 66,
          "id": 1787257,
          "entry_number": "59",
          "date_filed": "2001-05-11T00:00:00-04:00",
          "attachments": [],
          "url": "nan",
          "recap_pdf_url": null,
          "pacer_doc_id": null,
          "description": "Letter of Attorney Luibrand to the Court dd 5/9/01 advising Pltf Fyvie's claim is ready for trial and anticipates trial to take 3 to 4 days and could begin on 6/1/01 [copy forwarded to chambers/CML] (amt) (Entered: 05/11/2001)"
        },
        {
          "row_number": 28,
          "id": 1787219,
          "entry_number": "24",
          "date_filed": "2001-01-03T00:00:00-05:00",
          "attachments": [],
          "url": "nan",
          "recap_pdf_url": null,
          "pacer_doc_id": null,
          "description": "ORDER APPROVING DEFTS' WAIVER OF POTENTIAL CONFLICT, that based upon the circumstances as presently known, including the info set forth in the affidavits of defts Mattice, Glasser, Mosher, Lachanski and Hesch, the Court finds that those defts have been provided with sufficient written notice by counsel of the potential for conflict inherent in their being jointly represented by the same atty, and have knowingly and voluntarily chosen to proceed with that joint representation , and that the affidavits of Mattice, Glasser, Mosher, Lachanski and Hesch, with attachments, which were submitted pursuant to the court's Order dd 10/27/00, and contain sensitive and attorney-client priviledged matters, shall be filed by the court under seal ( signed by Magistrate Judge David R. Homer ) Date Entered: 1/3/01 (wjg) (Entered: 01/04/2001)"
        },
        {
          "row_number": 48,
          "id": 1787239,
          "entry_number": "43",
          "date_filed": "2001-03-14T00:00:00-05:00",
          "attachments": [],
          "url": "nan",
          "recap_pdf_url": null,
          "pacer_doc_id": null,
          "description": "MEMORANDUM OF LAW by City of Schenectady, Thomas X. Mattice, Michael Glasser, Marisela Mosher, William Lachanski, Eric Hesch in opposition to [38-1] motion for Partial Summary Judgment, and in support of [41-1] cross motion for Summary Judgment (wjg) (Entered: 03/15/2001)"
        },
        {
          "row_number": 12,
          "id": 1787203,
          "entry_number": null,
          "date_filed": "2000-10-19T00:00:00-04:00",
          "attachments": [],
          "url": "nan",
          "recap_pdf_url": null,
          "pacer_doc_id": null,
          "description": "CASE Reassigned to Judge Thomas J. McAvoy (fce) (Entered: 10/19/2000)"
        },
        {
          "row_number": 25,
          "id": 1787216,
          "entry_number": "21",
          "date_filed": "2000-12-11T00:00:00-05:00",
          "attachments": [],
          "url": "nan",
          "recap_pdf_url": null,
          "pacer_doc_id": null,
          "description": "ORDER denying [12-1] motion to Stay discovery pending resolution of a criminal case in which Siler is a named deft ( signed by Magistrate Judge David R. Homer ) (wjg) (Entered: 12/12/2000)"
        },
        {
          "row_number": 35,
          "id": 1787226,
          "entry_number": "32",
          "date_filed": "2001-01-22T00:00:00-05:00",
          "attachments": [],
          "url": "nan",
          "recap_pdf_url": null,
          "pacer_doc_id": null,
          "description": "ANSWER by Richard Barnett (Attorney Daniel J. Stewart) to amended complaint (wjg) (Entered: 01/22/2001)"
        },
        {
          "row_number": 57,
          "id": 1787248,
          "entry_number": "49",
          "date_filed": "2001-04-03T00:00:00-04:00",
          "attachments": [],
          "url": "nan",
          "recap_pdf_url": null,
          "pacer_doc_id": null,
          "description": "Rule 11 Compliance AFFIDAVIT by Kevin Luibrand for Elizabeth Gonzalez Re: support of [48-1] motion for Rule 11 Sanctions [STRICKEN FROM RECORD AND RETURNED TO COUNSEL PER COURT'S (60-1) ORDER] (wjg) Modified on 05/16/2001 (Entered: 04/04/2001)"
        },
        {
          "row_number": 72,
          "id": 1787263,
          "entry_number": "63",
          "date_filed": "2001-06-25T00:00:00-04:00",
          "attachments": [],
          "url": "nan",
          "recap_pdf_url": null,
          "pacer_doc_id": null,
          "description": "Minute entry: SETTLEMENT CNF BEFORE MJ HOMER ON 6/20/01; APP-Kevin Luibrand, Mike Murphy and Dan Stewart, Esqs.; no settlement reached. (wjg) (Entered: 06/25/2001)"
        },
        {
          "row_number": 74,
          "id": 1787265,
          "entry_number": "75",
          "date_filed": "2001-06-27T00:00:00-04:00",
          "attachments": [],
          "url": "nan",
          "recap_pdf_url": null,
          "pacer_doc_id": null,
          "description": "**This motion was received by the Court on 7/31/01, but is considered filed as of 6/27/01, pursuant to the CJRA reporting requirements instituted 3/1/00** MOTION by City of Schenectady for Partial Summary Judgment , Hearing set for 10:00 9/10/01 Motion returnable before Judge/Mag. Judge: McAvoy in Albany, NY (wjg) (Entered: 07/31/2001)"
        },
        {
          "row_number": 77,
          "id": 1787268,
          "entry_number": null,
          "date_filed": "2001-07-03T00:00:00-04:00",
          "attachments": [],
          "url": "nan",
          "recap_pdf_url": null,
          "pacer_doc_id": null,
          "description": "Returned Offer of Judgment, Affidavit to counsel Michael Murphy with Document Rejection Order (copies of Order to Counsel). (wjg) (Entered: 07/05/2001)"
        },
        {
          "row_number": 79,
          "id": 1787270,
          "entry_number": null,
          "date_filed": "2001-07-03T00:00:00-04:00",
          "attachments": [],
          "url": "nan",
          "recap_pdf_url": null,
          "pacer_doc_id": null,
          "description": "Returned deft Barnett's Motion for Summary Judgment & supporting papers to atty Stewart w/Document Rejection Order (copies of Order to Counsel). (wjg) (Entered: 07/05/2001)"
        },
        {
          "row_number": 81,
          "id": 1787272,
          "entry_number": "68",
          "date_filed": "2001-07-19T00:00:00-04:00",
          "attachments": [],
          "url": "nan",
          "recap_pdf_url": null,
          "pacer_doc_id": null,
          "description": "LETTER dated 7/18/01 by Kevin A. Luibrand, Esq., on behalf of Elizabeth Gonzalez, Michael Fyvie, Charles Frisbee pursuant to Local Rule 7.1(b) regarding Motion: opposition to partial summary judgment Date Served upon counsel: 7/18/01 (jel) (Entered: 07/24/2001)"
        },
        {
          "row_number": 89,
          "id": 1787280,
          "entry_number": "77",
          "date_filed": "2001-07-31T00:00:00-04:00",
          "attachments": [],
          "url": "nan",
          "recap_pdf_url": null,
          "pacer_doc_id": null,
          "description": "MEMORANDUM OF LAW by City of Schenectady in support of [75-1] motion for Partial Summary Judgment (wjg) (Entered: 07/31/2001)"
        },
        {
          "row_number": 90,
          "id": 1787281,
          "entry_number": "79",
          "date_filed": "2001-07-31T00:00:00-04:00",
          "attachments": [],
          "url": "nan",
          "recap_pdf_url": null,
          "pacer_doc_id": null,
          "description": "Statement of Material Facts in response/opposition to [70-1] motion for Summary Judgment/to dismiss and for severance of all claims by Plaintiff Frisbee from Gonzales and Fyvie filed by Charles Frisbee (wjg) (Entered: 07/31/2001)"
        },
        {
          "row_number": 18,
          "id": 1787209,
          "entry_number": "15",
          "date_filed": "2000-11-13T00:00:00-05:00",
          "attachments": [],
          "url": "nan",
          "recap_pdf_url": null,
          "pacer_doc_id": null,
          "description": "ORDER, to Amend [13-1] order , Reply to Response to Motion reset to 11/15/00 for [12-1] motion to Stay discovery pending resolution of a criminal case in which Siler is a named deft , Motion Hearing set for 10:00 11/20/00 re: [12-1] motion to Stay discovery pending resolution of a criminal case in which Siler is a named deft; the motion will be taken on submit and without oral argument , and to Stay deposition of Siler pending resolution of this motion ( signed by Magistrate Judge David R. Homer ) (wjg) (Entered: 11/14/2000)"
        },
        {
          "row_number": 22,
          "id": 1787213,
          "entry_number": null,
          "date_filed": "2000-12-04T00:00:00-05:00",
          "attachments": [],
          "url": "nan",
          "recap_pdf_url": null,
          "pacer_doc_id": null,
          "description": "Deadline updated; set Service Deadline to 2/2/01 for Eric Hesch, for Jane Doe, for John Doe, for William Lachanski, for Marisela Mosher, for Michael Glasser, for Thomas X. Mattice, for Michael Siler, for Richard Barnett, for City of Schenectady (wjg) (Entered: 12/04/2000)"
        },
        {
          "row_number": 94,
          "id": 1787285,
          "entry_number": "83",
          "date_filed": "2001-07-31T00:00:00-04:00",
          "attachments": [],
          "url": "nan",
          "recap_pdf_url": null,
          "pacer_doc_id": null,
          "description": "REPLY MEMORANDUM OF LAW by Richard Barnett in further support of [70-1] motion for Summary Judgment/to dismiss and for severance of all claims by Plaintiff Frisbee from Gonzales and Fyvie (wjg) (Entered: 07/31/2001)"
        },
        {
          "row_number": 98,
          "id": 1787289,
          "entry_number": "86",
          "date_filed": "2001-09-14T00:00:00-04:00",
          "attachments": [],
          "url": "nan",
          "recap_pdf_url": null,
          "pacer_doc_id": null,
          "description": "DECISION & ORDER granting in part, denying in part [70-1] summary judgment motion by City of Sch'dy and Mr. Banett; That much of Fourth Amendment claims and state law false arrest claims seeking damages from these defts for Mr. Frisbee's detention after the point in time that the marijuana was discovered are dismissed. These same claims, however, remain viable against these defts inasmuch as they seek damages for the detention up to the time of the discovery of the marijuana. , granting in part, denying in part [75-1] summary judgment motion by Deft Barnett on the grounds of qualified immunity; Mr. Barnett is granted qualified immunity for his role in the strip search of Mr. Frisbee occurring on 4/1/98 and this much of Plaintiff's claim is dismissed. His motion for summary judgment on the grounds of qualified immunity is denied in all other respects. Deft Barnett's motion to dismiss the state law claims against him is granted, and all state law claims brought against Mr. Barnett are dismissed. Deft Barnett's motion to sever the claims of Mr. Frisbee from the other plaintiffs' claims is Granted pursuant to FRCivP 21. The Cler is Ordered to assign the severed action a separate trial date as close in time as possible to the trial date set in the R16 Scheduling Order in the main action, taking into account the Court's schedule and the overlap of counsel in the now-separate actions. Deft Barnett's motion to bifurcate the trial of the claim between the individual officers and the municipal claims is Granted, however, the claims shall be tried back to back to the same jury. (signed by Judge Thomas J. McAvoy ) (wjg) (Entered: 09/17/2001)"
        },
        {
          "row_number": 41,
          "id": 1787232,
          "entry_number": "37",
          "date_filed": "2001-02-28T00:00:00-05:00",
          "attachments": [],
          "url": "nan",
          "recap_pdf_url": null,
          "pacer_doc_id": null,
          "description": "STATUS REPORT LETTER advising of impending deadlines. Status report due on 3/14/01 ( signed by Magistrate Judge David R. Homer ) (wjg) (Entered: 02/28/2001)"
        },
        {
          "row_number": 62,
          "id": 1787253,
          "entry_number": "55",
          "date_filed": "2001-04-27T00:00:00-04:00",
          "attachments": [],
          "url": "nan",
          "recap_pdf_url": null,
          "pacer_doc_id": null,
          "description": "Minute entry: MOTION CALENDAR HELD 4/27/01 bef Judge McAvoy in Binghamton, NY: APP: None; CR: V. Theleman; LC/SE; CRD/cml. Defts City/Schenectady+ [41-1] cross motion for Summary Judgment; and, Pltfs' [38-1] motion for Partial Summary Judgment - TAKEN ON SUBMIT [addressed by TJM [51-1] order] (cml) (Entered: 04/30/2001)"
        },
        {
          "row_number": 64,
          "id": 1787255,
          "entry_number": "57",
          "date_filed": "2001-05-01T00:00:00-04:00",
          "attachments": [],
          "url": "nan",
          "recap_pdf_url": null,
          "pacer_doc_id": null,
          "description": "RESPONSE AFFIDAVIT by Michael Murphy for City of Schenectady to [48-1] motion for Rule 11 Sanctions [STRICKEN FROM RECORD AND RETURNED TO COUNSEL PER COURT'S (60-1) ORDER] (wjg) Modified on 05/16/2001 (Entered: 05/01/2001)"
        },
        {
          "row_number": 70,
          "id": 1787261,
          "entry_number": "62",
          "date_filed": "2001-05-25T00:00:00-04:00",
          "attachments": [],
          "url": "nan",
          "recap_pdf_url": null,
          "pacer_doc_id": null,
          "description": "NOTICE to Daniel Stewart, Esq. from Clerk advising that (per USDJ McAvoy's chambers) the Court will not consider request to sever without a formal motion. (wjg) (Entered: 05/25/2001)"
        },
        {
          "row_number": 63,
          "id": 1787254,
          "entry_number": "56",
          "date_filed": "2001-04-30T00:00:00-04:00",
          "attachments": [],
          "url": "nan",
          "recap_pdf_url": null,
          "pacer_doc_id": null,
          "description": "ORDER, set Settlement Conference for 9:30 6/20/01 ( signed by Magistrate Judge David R. Homer ) (wjg) (Entered: 05/01/2001)"
        },
        {
          "row_number": 16,
          "id": 1787207,
          "entry_number": "13",
          "date_filed": "2000-11-07T00:00:00-05:00",
          "attachments": [],
          "url": "nan",
          "recap_pdf_url": null,
          "pacer_doc_id": null,
          "description": "ORDER, Motion Hearing set for 10:00 12/15/00 re: [12-1] motion to Stay discovery pending resolution of a criminal case in which Siler is a named deft , Response to Motion reset to 11/27/00 for [12-1] motion to Stay discovery pending resolution of a criminal case in which Siler is a named deft , Reply to Response to Motion reset to 12/8/00 for [12-1] motion to Stay discovery pending resolution of a criminal case in which Siler is a named deft , and to Stay the deposition of Siler pending resolution of [12-1] Motion ( signed by Magistrate Judge David R. Homer ) Date Entered: 11/7/00 (wjg) (Entered: 11/07/2000)"
        },
        {
          "row_number": 36,
          "id": 1787227,
          "entry_number": "33",
          "date_filed": "2001-01-24T00:00:00-05:00",
          "attachments": [],
          "url": "nan",
          "recap_pdf_url": null,
          "pacer_doc_id": null,
          "description": "Scheduling Notice:, set In Chambers Conference (regarding deft Siler's representation) for 11:00 1/30/01 (wjg) (Entered: 01/24/2001)"
        },
        {
          "row_number": 51,
          "id": 1787242,
          "entry_number": "46",
          "date_filed": "2001-03-14T00:00:00-05:00",
          "attachments": [],
          "url": "nan",
          "recap_pdf_url": null,
          "pacer_doc_id": null,
          "description": "LETTER on of Kevin Luibrand dd 3/13/01 on behalf of Elizabeth Gonzalez, Michael Fyvie pursuant to Local Rule 7.1(b) regarding reply to response to Motion: for summary judgment (and opposition papers as to cross-motion for summary judgment); Date Served upon counsel: 3/13/01 (wjg) (Entered: 03/15/2001)"
        },
        {
          "row_number": 37,
          "id": 1787228,
          "entry_number": "38",
          "date_filed": "2001-01-30T00:00:00-05:00",
          "attachments": [],
          "url": "nan",
          "recap_pdf_url": null,
          "pacer_doc_id": null,
          "description": "**This motion was received by the Court on 3/14/01, but is considered filed as of 1/30/01 (date of initial 7.1[b] letter), pursuant to the CJRA Reporting requirements instituted 3/1/00** MOTION by Elizabeth Gonzalez, Michael Fyvie for Partial Summary Judgment , Hearing set for 10:00 4/27/01 Motion returnable before Judge/Mag. Judge: McAvoy in Binghamton, NY (wjg) (Entered: 03/15/2001)"
        },
        {
          "row_number": 69,
          "id": 1787260,
          "entry_number": "61",
          "date_filed": "2001-05-14T00:00:00-04:00",
          "attachments": [],
          "url": "nan",
          "recap_pdf_url": null,
          "pacer_doc_id": null,
          "description": "Minute entry: MOTION CALENDAR HELD 5/14/01 bef Judge McAvoy in Albany, NY: APP: None; CR: B. Buckley; LC/SSt; CRD/mp. Pltfs' [48-1] motion for Rule 11 Sanctions - TAKEN ON SUBMIT [addressed by TJM [60-1] order] (cml) (Entered: 05/15/2001)"
        },
        {
          "row_number": 95,
          "id": 1787286,
          "entry_number": "84",
          "date_filed": "2001-09-04T00:00:00-04:00",
          "attachments": [],
          "url": "nan",
          "recap_pdf_url": null,
          "pacer_doc_id": null,
          "description": "Court NOTICE to counsel advising that the pending motions for 9/10/01 will hear oral argument at 10:00 am in Albany before Judge McAvoy (sfp) (Entered: 09/04/2001)"
        },
        {
          "row_number": 45,
          "id": 1787236,
          "entry_number": "40",
          "date_filed": "2001-03-14T00:00:00-05:00",
          "attachments": [],
          "url": "nan",
          "recap_pdf_url": null,
          "pacer_doc_id": null,
          "description": "MEMORANDUM OF LAW by Elizabeth Gonzalez, Michael Fyvie in support of [38-1] motion for Partial Summary Judgment (wjg) (Entered: 03/15/2001)"
        },
        {
          "row_number": 60,
          "id": 1787251,
          "entry_number": "53",
          "date_filed": "2001-04-09T00:00:00-04:00",
          "attachments": [],
          "url": "nan",
          "recap_pdf_url": null,
          "pacer_doc_id": null,
          "description": "AMENDED NOTICE of attorney appearance for City of Schenectady, Thomas X. Mattice, Michael Glasser, Marisela Mosher, William Lachanski, Eric Hesch by Michael Murphy (wjg) (Entered: 04/10/2001)"
        },
        {
          "row_number": 44,
          "id": 1787235,
          "entry_number": "39",
          "date_filed": "2001-03-14T00:00:00-05:00",
          "attachments": [],
          "url": "nan",
          "recap_pdf_url": null,
          "pacer_doc_id": null,
          "description": "Statement of Material Facts in Support of [38-1] motion for Partial Summary Judgment filed by Elizabeth Gonzalez, Michael Fyvie (wjg) Modified on 03/15/2001 (Entered: 03/15/2001)"
        },
        {
          "row_number": 30,
          "id": 1787221,
          "entry_number": "26",
          "date_filed": "2001-01-03T00:00:00-05:00",
          "attachments": [],
          "url": "nan",
          "recap_pdf_url": null,
          "pacer_doc_id": null,
          "description": "SEALED AFFIDAVIT (sealed per [24-1] Order) (wjg) (Entered: 01/04/2001)"
        },
        {
          "row_number": 15,
          "id": 1787206,
          "entry_number": "12",
          "date_filed": "2000-11-07T00:00:00-05:00",
          "attachments": [],
          "url": "nan",
          "recap_pdf_url": null,
          "pacer_doc_id": null,
          "description": "LETTER MOTION by Michael Siler to Stay discovery pending resolution of a criminal case in which Siler is a named deft Motion returnable before Judge/Mag. Judge: Homer (wjg) (Entered: 11/07/2000)"
        },
        {
          "row_number": 8,
          "id": 1787199,
          "entry_number": "7",
          "date_filed": "2000-10-03T00:00:00-04:00",
          "attachments": [],
          "url": "nan",
          "recap_pdf_url": null,
          "pacer_doc_id": null,
          "description": "LETTER REQUEST by Kevin Luibrand dd 9/20/00 and ORDER, for schedule of deposition of defts Thomas Mattice (10/31/00 @ 10:00am), Marisela Mosher (10/31 @ 11:30am), Eric Hesch (10/31 @ 1:00pm), Richard Barnett (10/31 @ 2:00pm), Michael Glasser (11/1 @ 10:00), William Lachanski (11/1 @ 11:30) and Michael Siler (11/1 @ 1:00pm); all depositions to take place at the offices of Tobin & Dempf ( signed by Magistrate Judge David R. Homer ) (wjg) (Entered: 10/03/2000)"
        },
        {
          "row_number": 56,
          "id": 1787247,
          "entry_number": "48",
          "date_filed": "2001-04-03T00:00:00-04:00",
          "attachments": [],
          "url": "nan",
          "recap_pdf_url": null,
          "pacer_doc_id": null,
