{
  "case_id": 10378,
  "fetched_at": "2025-10-20T22:38:17.260759",
  "case_data": {
    "attorney_orgs": [],
    "available_documents": [
      "Trial Court Docket",
      "Complaint (any)",
      "Any published opinion"
    ],
    "case_defendants": [
      {
        "defendant_level": null,
        "institution": "",
        "institution_alt_state": null,
        "institution_city": "",
        "institution_county": null,
        "name": "Wisconsin Department of Corrections",
        "defendant_level_other": "",
        "is_active": true
      }
    ],
    "case_ongoing": "No",
    "case_status": "Coding Complete",
    "case_types": [
      "Prison Conditions"
    ],
    "cause_other": "",
    "causes": [
      "42 U.S.C. ยง 1983"
    ],
    "class_action_granted": "Not sought",
    "class_action_sought": "No",
    "closing_year": 2006,
    "constitutional_clause": [
      {
        "value": "Due Process"
      },
      {
        "value": "Unreasonable search and seizure"
      },
      {
        "value": "Cruel and Unusual Punishment"
      }
    ],
    "content_of_injunction": [],
    "court": "Western District of Wisconsin",
    "custom_issues": [],
    "defendant_payment": "",
    "defendant_type": [
      {
        "value": "Corrections"
      }
    ],
    "docket_status": "Complete as of retrieval date",
    "facility_type": [
      {
        "value": "Government-run"
      }
    ],
    "filing_date": "2003-02-13",
    "filing_year": 2003,
    "id": 10378,
    "injunction_duration": "",
    "issues": [
      "General/Misc.: Disciplinary procedures",
      "General/Misc.: Search policies",
      "General/Misc.: Food service / nutrition / hydration",
      "General/Misc.: Sanitation / living conditions",
      "Jails, Prisons, Detention Centers, and Other Institutions: Recreation / Exercise",
      "Medical/Mental Health Care: Self-injurious behaviors",
      "Jails, Prisons, Detention Centers, and Other Institutions: Strip search policy (facilities)",
      "General/Misc.: Conditions of confinement",
      "Jails, Prisons, Detention Centers, and Other Institutions: Solitary confinement/Supermax (conditions or process)",
      "General/Misc.: Totality of conditions",
      "Affected Sex/Gender(s): Male",
      "Jails, Prisons, Detention Centers, and Other Institutions: Assault/abuse by staff (facilities)"
    ],
    "last_checked_date": "2014-10-16T00:00:00-04:00",
    "main_docket": {
      "id": 32638,
      "docket_entries": [
        {
          "row_number": 250,
          "id": 9512105,
          "entry_number": null,
          "date_filed": "2003-01-23T00:00:00-05:00",
          "attachments": [],
          "url": "https://www.courtlistener.com",
          "recap_pdf_url": null,
          "pacer_doc_id": null,
          "description": "Case Note: BRIEFING FOR MOT #216, JUDGMENT AS A MATTER OF LAW;AFTER TRIAL TRANSCRIPTS ARE FILED, SET 30/30/10 BRFG.JUDGMENT NEEDS REFERENCE TO #2, #129"
        },
        {
          "row_number": 251,
          "id": 9512107,
          "entry_number": null,
          "date_filed": "2003-01-28T00:00:00-05:00",
          "attachments": [],
          "url": "https://www.courtlistener.com",
          "recap_pdf_url": null,
          "pacer_doc_id": null,
          "description": "RECD. INITIAL PARTIAL FILING FEE OF $2.21."
        },
        {
          "row_number": 111,
          "id": 9512108,
          "entry_number": "2",
          "date_filed": "2003-02-13T00:00:00-05:00",
          "attachments": [],
          "url": "https://www.courtlistener.com/docket/12006291/2/freeman-berrell-v-berge-gerald/",
          "recap_pdf_url": null,
          "pacer_doc_id": null,
          "description": "ORDER TO PROCEED ifp - GRANTED IN PART; PETR. MOTION FOR APPOINTMENT OF COUNSEL DENIED. (Entered: 02/13/2003)"
        },
        {
          "row_number": 172,
          "id": 9512109,
          "entry_number": "3",
          "date_filed": "2003-02-13T00:00:00-05:00",
          "attachments": [],
          "url": "https://www.courtlistener.com/docket/12006291/3/freeman-berrell-v-berge-gerald/",
          "recap_pdf_url": null,
          "pacer_doc_id": null,
          "description": "COMPLAINT (Entered: 02/13/2003)"
        },
        {
          "row_number": 183,
          "id": 9512110,
          "entry_number": "4",
          "date_filed": "2003-02-13T00:00:00-05:00",
          "attachments": [],
          "url": "https://www.courtlistener.com/docket/12006291/4/freeman-berrell-v-berge-gerald/",
          "recap_pdf_url": null,
          "pacer_doc_id": null,
          "description": "MOTION BY PLTF./ FOR APPOINTMENT OF COUNSEL. (Entered: 02/13/2003)"
        },
        {
          "row_number": 252,
          "id": 9512111,
          "entry_number": null,
          "date_filed": "2003-02-13T00:00:00-05:00",
          "attachments": [],
          "url": "https://www.courtlistener.com",
          "recap_pdf_url": null,
          "pacer_doc_id": null,
          "description": "MATERIALS MLD. TO ATTY. GENERAL FOR ACCEPTANCE OF SERVICE. (JMD)"
        },
        {
          "row_number": 194,
          "id": 9512112,
          "entry_number": "5",
          "date_filed": "2003-02-20T00:00:00-05:00",
          "attachments": [],
          "url": "https://www.courtlistener.com/docket/12006291/5/freeman-berrell-v-berge-gerald/",
          "recap_pdf_url": null,
          "pacer_doc_id": null,
          "description": "NOTICE OF APPEARANCE OF AAG URDAN ON BEHALF OF RESPTS. (Entered: 02/20/2003)"
        },
        {
          "row_number": 205,
          "id": 9512113,
          "entry_number": "6",
          "date_filed": "2003-02-21T00:00:00-05:00",
          "attachments": [],
          "url": "https://www.courtlistener.com/docket/12006291/6/freeman-berrell-v-berge-gerald/",
          "recap_pdf_url": null,
          "pacer_doc_id": null,
          "description": "ACCEPTANCE OF SERVICE ON BEHALF OF DEFTS. (Entered: 02/24/2003)"
        },
        {
          "row_number": 227,
          "id": 9512115,
          "entry_number": "8",
          "date_filed": "2003-03-18T00:00:00-05:00",
          "attachments": [],
          "url": "https://www.courtlistener.com/docket/12006291/8/freeman-berrell-v-berge-gerald/",
          "recap_pdf_url": null,
          "pacer_doc_id": null,
          "description": "AFFIDAVIT OF BERRELL FREEMAN. (Entered: 03/18/2003)"
        },
        {
          "row_number": 238,
          "id": 9512116,
          "entry_number": "9",
          "date_filed": "2003-03-20T00:00:00-05:00",
          "attachments": [],
          "url": "https://www.courtlistener.com/docket/12006291/9/freeman-berrell-v-berge-gerald/",
          "recap_pdf_url": null,
          "pacer_doc_id": null,
          "description": "ORDER DENYING PLTF. MOTION FOR DEFAULT JUDGMENT. (Entered: 03/20/2003)"
        },
        {
          "row_number": 12,
          "id": 9512118,
          "entry_number": "11",
          "date_filed": "2003-03-21T00:00:00-05:00",
          "attachments": [],
          "url": "https://www.courtlistener.com/docket/12006291/11/freeman-berrell-v-berge-gerald/",
          "recap_pdf_url": null,
          "pacer_doc_id": null,
          "description": "MOTION BY DEFTS. TO DISMISS. (Entered: 03/21/2003)"
        },
        {
          "row_number": 23,
          "id": 9512119,
          "entry_number": "12",
          "date_filed": "2003-03-21T00:00:00-05:00",
          "attachments": [],
          "url": "https://www.courtlistener.com/docket/12006291/12/freeman-berrell-v-berge-gerald/",
          "recap_pdf_url": null,
          "pacer_doc_id": null,
          "description": "BRIEF IN SUPPORT OF DEFTS. MOTION TO DISMISS. (Entered: 03/21/2003)"
        },
        {
          "row_number": 34,
          "id": 9512120,
          "entry_number": "13",
          "date_filed": "2003-03-21T00:00:00-05:00",
          "attachments": [],
          "url": "https://www.courtlistener.com/docket/12006291/13/freeman-berrell-v-berge-gerald/",
          "recap_pdf_url": null,
          "pacer_doc_id": null,
          "description": "AFFIDAVIT OF JOHN RAY. (Entered: 03/21/2003)"
        },
        {
          "row_number": 56,
          "id": 9512122,
          "entry_number": "15",
          "date_filed": "2003-03-25T00:00:00-05:00",
          "attachments": [],
          "url": "https://www.courtlistener.com/docket/12006291/15/freeman-berrell-v-berge-gerald/",
          "recap_pdf_url": null,
          "pacer_doc_id": null,
          "description": "MOTION BY PLTF. TO EXPUNGE TESTIMONY/AFFIDAVIT OF JOHN RAY AND BAR HIS FUTURE TESTIMONY. (Entered: 03/25/2003)"
        },
        {
          "row_number": 67,
          "id": 9512123,
          "entry_number": "16",
          "date_filed": "2003-04-18T00:00:00-04:00",
          "attachments": [],
          "url": "https://www.courtlistener.com/docket/12006291/16/freeman-berrell-v-berge-gerald/",
          "recap_pdf_url": null,
          "pacer_doc_id": null,
          "description": "BRIEF IN REPLY IN SUPPORT OF DEFTS. MOTION TO DISMISS. (Entered: 04/18/2003)"
        },
        {
          "row_number": 89,
          "id": 9512125,
          "entry_number": "18",
          "date_filed": "2003-04-18T00:00:00-04:00",
          "attachments": [],
          "url": "https://www.courtlistener.com/docket/12006291/18/freeman-berrell-v-berge-gerald/",
          "recap_pdf_url": null,
          "pacer_doc_id": null,
          "description": "BRIEF IN SUPPORT OF DEFTS. MOTION FOR PROTECTIVE ORDER. (Entered: 04/18/2003)"
        },
        {
          "row_number": 100,
          "id": 9512126,
          "entry_number": "19",
          "date_filed": "2003-04-18T00:00:00-04:00",
          "attachments": [],
          "url": "https://www.courtlistener.com/docket/12006291/19/freeman-berrell-v-berge-gerald/",
          "recap_pdf_url": null,
          "pacer_doc_id": null,
          "description": "AFFIDAVIT OF SANDRA J. HUTAMAKI. (Entered: 04/18/2003)"
        },
        {
          "row_number": 123,
          "id": 9512128,
          "entry_number": "21",
          "date_filed": "2003-04-25T00:00:00-04:00",
          "attachments": [],
          "url": "https://www.courtlistener.com/docket/12006291/21/freeman-berrell-v-berge-gerald/",
          "recap_pdf_url": null,
          "pacer_doc_id": null,
          "description": "PTC ORDER (SLC) (Entered: 04/25/2003)"
        },
        {
          "row_number": 145,
          "id": 9512130,
          "entry_number": "23",
          "date_filed": "2003-05-30T00:00:00-04:00",
          "attachments": [],
          "url": "https://www.courtlistener.com/docket/12006291/23/freeman-berrell-v-berge-gerald/",
          "recap_pdf_url": null,
          "pacer_doc_id": null,
          "description": "MOTION FOR APPOINTMENT OF COUNSEL BY PLTF. (Entered: 05/30/2003)"
        },
        {
          "row_number": 156,
          "id": 9512131,
          "entry_number": "24",
          "date_filed": "2003-06-04T00:00:00-04:00",
          "attachments": [],
          "url": "https://www.courtlistener.com/docket/12006291/24/freeman-berrell-v-berge-gerald/",
          "recap_pdf_url": null,
          "pacer_doc_id": null,
          "description": "ORDER GRANTING IN PART DEFTS. MOTION TO DISMIS; DENYING PLTF. MOT. TO APPT. CNSL. (Entered: 06/04/2003)"
        },
        {
          "row_number": 167,
          "id": 9512132,
          "entry_number": "25",
          "date_filed": "2003-06-12T00:00:00-04:00",
          "attachments": [],
          "url": "https://www.courtlistener.com/docket/12006291/25/freeman-berrell-v-berge-gerald/",
          "recap_pdf_url": null,
          "pacer_doc_id": null,
          "description": "NOTICE OF APPEARANCE FOR DEFTS. (Entered: 06/12/2003)"
        },
        {
          "row_number": 168,
          "id": 9512133,
          "entry_number": "26",
          "date_filed": "2003-06-13T00:00:00-04:00",
          "attachments": [],
          "url": "https://www.courtlistener.com/docket/12006291/26/freeman-berrell-v-berge-gerald/",
          "recap_pdf_url": null,
          "pacer_doc_id": null,
          "description": "MOTION BY PLTF. FOR RECONSIDERATION. (Entered: 06/13/2003)"
        },
        {
          "row_number": 169,
          "id": 9512134,
          "entry_number": "27",
          "date_filed": "2003-06-13T00:00:00-04:00",
          "attachments": [],
          "url": "https://www.courtlistener.com/docket/12006291/27/freeman-berrell-v-berge-gerald/",
          "recap_pdf_url": null,
          "pacer_doc_id": null,
          "description": "MOTION BY PLTF. FOR COURT ORDER/INTERVENTION. (Entered: 06/13/2003)"
        },
        {
          "row_number": 170,
          "id": 9512135,
          "entry_number": "28",
          "date_filed": "2003-06-20T00:00:00-04:00",
          "attachments": [],
          "url": "https://www.courtlistener.com/docket/12006291/28/freeman-berrell-v-berge-gerald/",
          "recap_pdf_url": null,
          "pacer_doc_id": null,
          "description": "ORDER DENYING IN PART PLTF. MOTION FOR RECONSIDERATION; DEFTS. TO ADVISE STATUS OF PLTF. LEGAL MATERIAL BY 6/26/03. (Entered: 06/20/2003)"
        },
        {
          "row_number": 171,
          "id": 9512136,
          "entry_number": "29",
          "date_filed": "2003-06-23T00:00:00-04:00",
          "attachments": [],
          "url": "https://www.courtlistener.com/docket/12006291/29/freeman-berrell-v-berge-gerald/",
          "recap_pdf_url": null,
          "pacer_doc_id": null,
          "description": "MOTION BY PLTF. TO COMPEL DISCOVERY. (Entered: 06/23/2003)"
        },
        {
          "row_number": 173,
          "id": 9512137,
          "entry_number": "30",
          "date_filed": "2003-06-23T00:00:00-04:00",
          "attachments": [],
          "url": "https://www.courtlistener.com/docket/12006291/30/freeman-berrell-v-berge-gerald/",
          "recap_pdf_url": null,
          "pacer_doc_id": null,
          "description": "MOTION BY PLTF. THAT MATTER IS ADMITTED OR THAT AN AMENDED ANSWER BE SERVED. (Entered: 06/23/2003)"
        },
        {
          "row_number": 174,
          "id": 9512138,
          "entry_number": "31",
          "date_filed": "2003-06-25T00:00:00-04:00",
          "attachments": [],
          "url": "https://www.courtlistener.com/docket/12006291/31/freeman-berrell-v-berge-gerald/",
          "recap_pdf_url": null,
          "pacer_doc_id": null,
          "description": "MOTION BY PLTF. FOR ORDER TO PRODUCE DOCUMENTS. (Entered: 06/25/2003)"
        },
        {
          "row_number": 175,
          "id": 9512139,
          "entry_number": "32",
          "date_filed": "2003-06-25T00:00:00-04:00",
          "attachments": [],
          "url": "https://www.courtlistener.com/docket/12006291/32/freeman-berrell-v-berge-gerald/",
          "recap_pdf_url": null,
          "pacer_doc_id": null,
          "description": "MOTION BY PLTF. TO TURN OVER/SUBMIT EVIDENCE. (Entered: 06/25/2003)"
        },
        {
          "row_number": 176,
          "id": 9512140,
          "entry_number": "33",
          "date_filed": "2003-06-26T00:00:00-04:00",
          "attachments": [],
          "url": "https://www.courtlistener.com/docket/12006291/33/freeman-berrell-v-berge-gerald/",
          "recap_pdf_url": null,
          "pacer_doc_id": null,
          "description": "DEFTS. RESPONSE TO PLTF. MOTION TO COMPEL. (Entered: 06/26/2003)"
        },
        {
          "row_number": 177,
          "id": 9512141,
          "entry_number": "34",
          "date_filed": "2003-06-26T00:00:00-04:00",
          "attachments": [],
          "url": "https://www.courtlistener.com/docket/12006291/34/freeman-berrell-v-berge-gerald/",
          "recap_pdf_url": null,
          "pacer_doc_id": null,
          "description": "DEFTS. RESPONSE TO PLTF. REQUEST FOR ADMISSIONS. (Entered: 06/26/2003)"
        },
        {
          "row_number": 178,
          "id": 9512142,
          "entry_number": "35",
          "date_filed": "2003-06-26T00:00:00-04:00",
          "attachments": [],
          "url": "https://www.courtlistener.com/docket/12006291/35/freeman-berrell-v-berge-gerald/",
          "recap_pdf_url": null,
          "pacer_doc_id": null,
          "description": "DEFTS. RESPONSE TO PLTF. 1ST REQUEST FOR PRODUCTION OF DOCUMENTS. (Entered: 06/26/2003)"
        },
        {
          "row_number": 179,
          "id": 9512143,
          "entry_number": "36",
          "date_filed": "2003-06-27T00:00:00-04:00",
          "attachments": [],
          "url": "https://www.courtlistener.com/docket/12006291/36/freeman-berrell-v-berge-gerald/",
          "recap_pdf_url": null,
          "pacer_doc_id": null,
          "description": "DEFTS. RESPONSE TO 6/19/03 ORDER. (Entered: 06/30/2003)"
        },
        {
          "row_number": 180,
          "id": 9512144,
          "entry_number": "37",
          "date_filed": "2003-06-30T00:00:00-04:00",
          "attachments": [],
          "url": "https://www.courtlistener.com/docket/12006291/37/freeman-berrell-v-berge-gerald/",
          "recap_pdf_url": null,
          "pacer_doc_id": null,
          "description": "PLTF. REPLY TO DEFTS. RESPONSE TO MOTION TO COMPEL AND MOTION TO ADMIT. (Entered: 06/30/2003)"
        },
        {
          "row_number": 182,
          "id": 9512146,
          "entry_number": "39",
          "date_filed": "2003-07-09T00:00:00-04:00",
          "attachments": [],
          "url": "https://www.courtlistener.com/docket/12006291/39/freeman-berrell-v-berge-gerald/",
          "recap_pdf_url": null,
          "pacer_doc_id": null,
          "description": "PLTF. RESPONSE TO COURT ORDER OF 6/30/03. (Entered: 07/09/2003)"
        },
        {
          "row_number": 184,
          "id": 9512147,
          "entry_number": "40",
          "date_filed": "2003-07-21T00:00:00-04:00",
          "attachments": [],
          "url": "https://www.courtlistener.com/docket/12006291/40/freeman-berrell-v-berge-gerald/",
          "recap_pdf_url": null,
          "pacer_doc_id": null,
          "description": "MOTION BY PLTF. FOR COURT APPOINTED EXPERTS. (Entered: 07/21/2003)"
        },
        {
          "row_number": 186,
          "id": 9512149,
          "entry_number": "42",
          "date_filed": "2003-07-31T00:00:00-04:00",
          "attachments": [],
          "url": "https://www.courtlistener.com/docket/12006291/42/freeman-berrell-v-berge-gerald/",
          "recap_pdf_url": null,
          "pacer_doc_id": null,
          "description": "ORDER DENYING MOTS. BY PLTF. TO COMPEL; GRANTING MOT. BY PLTF. THAT DEFT. PRODUCE RECORDS OF TEMPERATURES AT SMCI. (SLC) (Entered: 07/31/2003)"
        },
        {
          "row_number": 187,
          "id": 9512150,
          "entry_number": "43",
          "date_filed": "2003-08-01T00:00:00-04:00",
          "attachments": [],
          "url": "https://www.courtlistener.com/docket/12006291/43/freeman-berrell-v-berge-gerald/",
          "recap_pdf_url": null,
          "pacer_doc_id": null,
          "description": "MOTION BY PLTF. FOR ORDER TO COMPEL DISCOVERY. (Entered: 08/01/2003)"
        },
        {
          "row_number": 188,
          "id": 9512151,
          "entry_number": "44",
          "date_filed": "2003-08-04T00:00:00-04:00",
          "attachments": [],
          "url": "https://www.courtlistener.com/docket/12006291/44/freeman-berrell-v-berge-gerald/",
          "recap_pdf_url": null,
          "pacer_doc_id": null,
          "description": "MOTION BY PLTF. FOR RECONSIDERATION OF COURT ORDER OF 7/25/03. (Entered: 08/04/2003)"
        },
        {
          "row_number": 189,
          "id": 9512152,
          "entry_number": "45",
          "date_filed": "2003-08-05T00:00:00-04:00",
          "attachments": [],
          "url": "https://www.courtlistener.com/docket/12006291/45/freeman-berrell-v-berge-gerald/",
          "recap_pdf_url": null,
          "pacer_doc_id": null,
          "description": "MOTION BY PLTF. FOR RECONSIDERATION OF COURT ORDER OF 7/30/03. (Entered: 08/05/2003)"
        },
        {
          "row_number": 190,
          "id": 9512153,
          "entry_number": "46",
          "date_filed": "2003-08-06T00:00:00-04:00",
          "attachments": [],
          "url": "https://www.courtlistener.com/docket/12006291/46/freeman-berrell-v-berge-gerald/",
          "recap_pdf_url": null,
          "pacer_doc_id": null,
          "description": "ORDER DENYING PLTF. MOTION FOR RECONSIDERATION OF 7/25/03 ORDER. (Entered: 08/06/2003)"
        },
        {
          "row_number": 193,
          "id": 9512156,
          "entry_number": "49",
          "date_filed": "2003-08-07T00:00:00-04:00",
          "attachments": [],
          "url": "https://www.courtlistener.com/docket/12006291/49/freeman-berrell-v-berge-gerald/",
          "recap_pdf_url": null,
          "pacer_doc_id": null,
          "description": "MOTION BY PLTF. FOR COURT ORDER THAT WITNESSES BE BROUGHT TO COURT AT TIME OF TRIAL. (Entered: 08/07/2003)"
        },
        {
          "row_number": 197,
          "id": 9512159,
          "entry_number": "52",
          "date_filed": "2003-08-13T00:00:00-04:00",
          "attachments": [],
          "url": "https://www.courtlistener.com/docket/12006291/52/freeman-berrell-v-berge-gerald/",
          "recap_pdf_url": null,
          "pacer_doc_id": null,
          "description": "ORDER DENYING PLTF. MOT. TO STOP/CEASE AND DESIST RETALIATION. (Entered: 08/13/2003)"
        },
        {
          "row_number": 198,
          "id": 9512160,
          "entry_number": "53",
          "date_filed": "2003-08-14T00:00:00-04:00",
          "attachments": [],
          "url": "https://www.courtlistener.com/docket/12006291/53/freeman-berrell-v-berge-gerald/",
          "recap_pdf_url": null,
          "pacer_doc_id": null,
          "description": "MOTION BY PLTF. FOR FILING AND INFORMATION. (Entered: 08/14/2003)"
        },
        {
          "row_number": 199,
          "id": 9512161,
          "entry_number": "54",
          "date_filed": "2003-08-14T00:00:00-04:00",
          "attachments": [],
          "url": "https://www.courtlistener.com/docket/12006291/54/freeman-berrell-v-berge-gerald/",
          "recap_pdf_url": null,
          "pacer_doc_id": null,
          "description": "MOTION FOR SUMMARY JUDGMENT BY PLTF. (Entered: 08/14/2003)"
        },
        {
          "row_number": 200,
          "id": 9512162,
          "entry_number": "55",
          "date_filed": "2003-08-14T00:00:00-04:00",
          "attachments": [],
          "url": "https://www.courtlistener.com/docket/12006291/55/freeman-berrell-v-berge-gerald/",
          "recap_pdf_url": null,
          "pacer_doc_id": null,
          "description": "BRIEF IN SUPPORT OF PLTF. MOTION FOR SUMMARY JUDGMENT. (Entered: 08/14/2003)"
        },
        {
          "row_number": 202,
          "id": 9512164,
          "entry_number": "57",
          "date_filed": "2003-08-14T00:00:00-04:00",
          "attachments": [],
          "url": "https://www.courtlistener.com/docket/12006291/57/freeman-berrell-v-berge-gerald/",
          "recap_pdf_url": null,
          "pacer_doc_id": null,
          "description": "AFFIDAVIT OF BERRELL FREEMAN. (Entered: 08/14/2003)"
        },
        {
          "row_number": 203,
          "id": 9512165,
          "entry_number": "58",
          "date_filed": "2003-08-14T00:00:00-04:00",
          "attachments": [],
          "url": "https://www.courtlistener.com/docket/12006291/58/freeman-berrell-v-berge-gerald/",
          "recap_pdf_url": null,
          "pacer_doc_id": null,
          "description": "AFFIDAVIT OF JONATHAN P. COLE. (Entered: 08/14/2003)"
        },
        {
          "row_number": 204,
          "id": 9512166,
          "entry_number": "59",
          "date_filed": "2003-08-14T00:00:00-04:00",
          "attachments": [],
          "url": "https://www.courtlistener.com/docket/12006291/59/freeman-berrell-v-berge-gerald/",
          "recap_pdf_url": null,
          "pacer_doc_id": null,
          "description": "AFFIDAVIT OF A'KINHO J.S. HASHIM-TIGGS. (Entered: 08/14/2003)"
        },
        {
          "row_number": 206,
          "id": 9512167,
          "entry_number": "60",
          "date_filed": "2003-08-14T00:00:00-04:00",
          "attachments": [],
          "url": "https://www.courtlistener.com/docket/12006291/60/freeman-berrell-v-berge-gerald/",
          "recap_pdf_url": null,
          "pacer_doc_id": null,
          "description": "AFFIDAVIT OF JEREMY S. DAUBON. (Entered: 08/14/2003)"
        },
        {
          "row_number": 209,
          "id": 9512170,
          "entry_number": "63",
          "date_filed": "2003-08-14T00:00:00-04:00",
          "attachments": [],
          "url": "https://www.courtlistener.com/docket/12006291/63/freeman-berrell-v-berge-gerald/",
          "recap_pdf_url": null,
          "pacer_doc_id": null,
          "description": "AFFIDAVIT OF RAYNELL D. MORGAN. (Entered: 08/14/2003)"
        },
        {
          "row_number": 210,
          "id": 9512171,
          "entry_number": "64",
          "date_filed": "2003-08-14T00:00:00-04:00",
          "attachments": [],
          "url": "https://www.courtlistener.com/docket/12006291/64/freeman-berrell-v-berge-gerald/",
          "recap_pdf_url": null,
          "pacer_doc_id": null,
          "description": "AFFIDAVIT OF EDDIE JOHNIKIN. (Entered: 08/14/2003)"
        },
        {
          "row_number": 212,
          "id": 9512173,
          "entry_number": "66",
          "date_filed": "2003-08-14T00:00:00-04:00",
          "attachments": [],
          "url": "https://www.courtlistener.com/docket/12006291/66/freeman-berrell-v-berge-gerald/",
          "recap_pdf_url": null,
          "pacer_doc_id": null,
          "description": "AFFIDAVIT OF JOHN SPICER. (Entered: 08/14/2003)"
        },
        {
          "row_number": 213,
          "id": 9512174,
          "entry_number": "67",
          "date_filed": "2003-08-14T00:00:00-04:00",
          "attachments": [],
          "url": "https://www.courtlistener.com/docket/12006291/67/freeman-berrell-v-berge-gerald/",
          "recap_pdf_url": null,
          "pacer_doc_id": null,
          "description": "AFFIDAVIT OF ONTARIO DAVIS. (Entered: 08/14/2003)"
        },
        {
          "row_number": 214,
          "id": 9512175,
          "entry_number": "68",
          "date_filed": "2003-08-15T00:00:00-04:00",
          "attachments": [],
          "url": "https://www.courtlistener.com/docket/12006291/68/freeman-berrell-v-berge-gerald/",
          "recap_pdf_url": null,
          "pacer_doc_id": null,
          "description": "PLTF. NOTICE OF CLARIFICATION TO COURT. (Entered: 08/15/2003)"
        },
        {
          "row_number": 215,
          "id": 9512176,
          "entry_number": "69",
          "date_filed": "2003-08-19T00:00:00-04:00",
          "attachments": [],
          "url": "https://www.courtlistener.com/docket/12006291/69/freeman-berrell-v-berge-gerald/",
          "recap_pdf_url": null,
          "pacer_doc_id": null,
          "description": "MOTION BY PLTF. FOR ORDER TO COMPEL DISCOVERY. (Entered: 08/19/2003)"
        },
        {
          "row_number": 217,
          "id": 9512177,
          "entry_number": "70",
          "date_filed": "2003-08-20T00:00:00-04:00",
          "attachments": [],
          "url": "https://www.courtlistener.com/docket/12006291/70/freeman-berrell-v-berge-gerald/",
          "recap_pdf_url": null,
          "pacer_doc_id": null,
          "description": "MOTION BY PLTF. TO WITHDRAW ACCESS AND PERMISSION TO USE MEDICAL/CLINICAL RECORDS. (Entered: 08/20/2003)"
        },
        {
          "row_number": 218,
          "id": 9512178,
          "entry_number": "71",
          "date_filed": "2003-08-21T00:00:00-04:00",
          "attachments": [],
          "url": "https://www.courtlistener.com/docket/12006291/71/freeman-berrell-v-berge-gerald/",
          "recap_pdf_url": null,
          "pacer_doc_id": null,
          "description": "AFFIDAVIT OF GLEN T. TURNER. (Entered: 08/21/2003)"
        },
        {
          "row_number": 219,
          "id": 9512179,
          "entry_number": "72",
          "date_filed": "2003-08-21T00:00:00-04:00",
          "attachments": [],
          "url": "https://www.courtlistener.com/docket/12006291/72/freeman-berrell-v-berge-gerald/",
          "recap_pdf_url": null,
          "pacer_doc_id": null,
          "description": "AFFIDAVIT OF ANDRAE ROBERTS. (Entered: 08/21/2003)"
        },
        {
          "row_number": 220,
          "id": 9512180,
          "entry_number": "73",
          "date_filed": "2003-08-21T00:00:00-04:00",
          "attachments": [],
          "url": "https://www.courtlistener.com/docket/12006291/73/freeman-berrell-v-berge-gerald/",
          "recap_pdf_url": null,
          "pacer_doc_id": null,
          "description": "AFFIDAVIT OF RODOSVALDO C. POZO. (Entered: 08/21/2003)"
        },
        {
          "row_number": 221,
          "id": 9512181,
          "entry_number": "74",
          "date_filed": "2003-08-21T00:00:00-04:00",
          "attachments": [],
          "url": "https://www.courtlistener.com/docket/12006291/74/freeman-berrell-v-berge-gerald/",
          "recap_pdf_url": null,
          "pacer_doc_id": null,
          "description": "AFFIDAVIT OF NATE LINDELL. (Entered: 08/21/2003)"
        },
        {
          "row_number": 222,
          "id": 9512182,
          "entry_number": "75",
          "date_filed": "2003-08-21T00:00:00-04:00",
          "attachments": [],
          "url": "https://www.courtlistener.com/docket/12006291/75/freeman-berrell-v-berge-gerald/",
          "recap_pdf_url": null,
          "pacer_doc_id": null,
          "description": "AFFIDAVIT OF DENNIS GONZALEZ. (Entered: 08/21/2003)"
        },
        {
          "row_number": 223,
          "id": 9512183,
          "entry_number": "76",
          "date_filed": "2003-08-21T00:00:00-04:00",
          "attachments": [],
          "url": "https://www.courtlistener.com/docket/12006291/76/freeman-berrell-v-berge-gerald/",
          "recap_pdf_url": null,
          "pacer_doc_id": null,
          "description": "AFFIDAVIT OF WAYNE L. BREWER. (Entered: 08/21/2003)"
        },
        {
          "row_number": 224,
          "id": 9512184,
          "entry_number": "77",
          "date_filed": "2003-08-21T00:00:00-04:00",
          "attachments": [],
          "url": "https://www.courtlistener.com/docket/12006291/77/freeman-berrell-v-berge-gerald/",
          "recap_pdf_url": null,
          "pacer_doc_id": null,
          "description": "AFFIDAVIT OF DENNIS E. JONES-EL. (Entered: 08/21/2003)"
        },
        {
          "row_number": 225,
          "id": 9512185,
          "entry_number": "78",
          "date_filed": "2003-08-21T00:00:00-04:00",
          "attachments": [],
          "url": "https://www.courtlistener.com/docket/12006291/78/freeman-berrell-v-berge-gerald/",
          "recap_pdf_url": null,
          "pacer_doc_id": null,
          "description": "AFFIDAVIT OF JOSEPH D. KOUTNIK. (Entered: 08/21/2003)"
        },
        {
          "row_number": 226,
          "id": 9512186,
          "entry_number": "79",
          "date_filed": "2003-08-21T00:00:00-04:00",
          "attachments": [],
          "url": "https://www.courtlistener.com/docket/12006291/79/freeman-berrell-v-berge-gerald/",
          "recap_pdf_url": null,
          "pacer_doc_id": null,
          "description": "AFFIDAVIT OF KARRY D. HILLEY, JR. (Entered: 08/21/2003)"
        },
        {
          "row_number": 228,
          "id": 9512187,
          "entry_number": "80",
          "date_filed": "2003-08-21T00:00:00-04:00",
          "attachments": [],
          "url": "https://www.courtlistener.com/docket/12006291/80/freeman-berrell-v-berge-gerald/",
          "recap_pdf_url": null,
          "pacer_doc_id": null,
          "description": "AFFIDAVIT OF PRESLEY HUBANKS. (Entered: 08/21/2003)"
        },
        {
          "row_number": 230,
          "id": 9512189,
          "entry_number": "82",
          "date_filed": "2003-08-21T00:00:00-04:00",
          "attachments": [],
          "url": "https://www.courtlistener.com/docket/12006291/82/freeman-berrell-v-berge-gerald/",
          "recap_pdf_url": null,
          "pacer_doc_id": null,
          "description": "AFFIDAVIT OF KEEYON BARKER. (Entered: 08/21/2003)"
        },
        {
          "row_number": 232,
          "id": 9512191,
          "entry_number": "84",
          "date_filed": "2003-08-21T00:00:00-04:00",
          "attachments": [],
          "url": "https://www.courtlistener.com/docket/12006291/84/freeman-berrell-v-berge-gerald/",
          "recap_pdf_url": null,
          "pacer_doc_id": null,
          "description": "AFFIDAVIT OF THOMAS EDWARD DEERING. (Entered: 08/21/2003)"
        },
        {
          "row_number": 233,
          "id": 9512192,
          "entry_number": "85",
          "date_filed": "2003-08-21T00:00:00-04:00",
          "attachments": [],
          "url": "https://www.courtlistener.com/docket/12006291/85/freeman-berrell-v-berge-gerald/",
          "recap_pdf_url": null,
          "pacer_doc_id": null,
          "description": "PLTF. NOTICE TO COURT WITH PROOF OF OBSTRUCTION BY DEFTS. (Entered: 08/21/2003)"
        },
        {
          "row_number": 235,
          "id": 9512194,
          "entry_number": "87",
          "date_filed": "2003-08-21T00:00:00-04:00",
          "attachments": [],
          "url": "https://www.courtlistener.com/docket/12006291/87/freeman-berrell-v-berge-gerald/",
          "recap_pdf_url": null,
          "pacer_doc_id": null,
          "description": "MOTION BY PLTF. TO ADMIT MATTER. (Entered: 08/21/2003)"
        },
        {
          "row_number": 236,
          "id": 9512195,
          "entry_number": "88",
          "date_filed": "2003-08-21T00:00:00-04:00",
          "attachments": [],
          "url": "https://www.courtlistener.com/docket/12006291/88/freeman-berrell-v-berge-gerald/",
          "recap_pdf_url": null,
          "pacer_doc_id": null,
          "description": "MOTION BY PLTF. FOR ORDER COMPELLING DISCOVERY. (Entered: 08/21/2003)"
        },
        {
          "row_number": 237,
          "id": 9512196,
          "entry_number": "89",
          "date_filed": "2003-08-21T00:00:00-04:00",
          "attachments": [],
          "url": "https://www.courtlistener.com/docket/12006291/89/freeman-berrell-v-berge-gerald/",
          "recap_pdf_url": null,
          "pacer_doc_id": null,
          "description": "MOTION BY PLTF. FOR SUBPOENAS. (Entered: 08/21/2003)"
        },
        {
          "row_number": 239,
          "id": 9512197,
          "entry_number": "90",
          "date_filed": "2003-08-21T00:00:00-04:00",
          "attachments": [],
          "url": "https://www.courtlistener.com/docket/12006291/90/freeman-berrell-v-berge-gerald/",
          "recap_pdf_url": null,
          "pacer_doc_id": null,
          "description": "MOTION BY PLTF. TO ADMIT MATTER AND FOR CONTEMPT OF COURT. (Entered: 08/21/2003)"
        },
        {
          "row_number": 240,
          "id": 9512198,
          "entry_number": "91",
          "date_filed": "2003-08-26T00:00:00-04:00",
          "attachments": [],
          "url": "https://www.courtlistener.com/docket/12006291/91/freeman-berrell-v-berge-gerald/",
          "recap_pdf_url": null,
          "pacer_doc_id": null,
          "description": "MOTION BY PLTF. FOR ORDER TO STOP/CEASE AND DESIST RETALIATION. (Entered: 08/26/2003)"
        },
        {
          "row_number": 241,
          "id": 9512199,
          "entry_number": "92",
          "date_filed": "2003-08-27T00:00:00-04:00",
          "attachments": [],
          "url": "https://www.courtlistener.com/docket/12006291/92/freeman-berrell-v-berge-gerald/",
          "recap_pdf_url": null,
          "pacer_doc_id": null,
          "description": "ORDER RULING ON MOTIONS NOS. 45, 47, 49, 53, 86 AND 91; BRFG. SET ON PLTF. MOTION FOR S/J. (Entered: 08/27/2003)"
        },
        {
          "row_number": 243,
          "id": 9512201,
          "entry_number": "94",
          "date_filed": "2003-08-29T00:00:00-04:00",
          "attachments": [],
          "url": "https://www.courtlistener.com/docket/12006291/94/freeman-berrell-v-berge-gerald/",
          "recap_pdf_url": null,
          "pacer_doc_id": null,
          "description": "ORDER GRANTING MOTS. 43, 69, 87, AND 88; DENYING MOTS. 70, 90 AND 93; GRANTING IN PART MOT. 89. (SLC) (Entered: 08/29/2003)"
        },
        {
          "row_number": 244,
          "id": 9512202,
          "entry_number": "95",
          "date_filed": "2003-09-03T00:00:00-04:00",
          "attachments": [],
          "url": "https://www.courtlistener.com/docket/12006291/95/freeman-berrell-v-berge-gerald/",
          "recap_pdf_url": null,
          "pacer_doc_id": null,
          "description": "MOTION BY PLTF. FOR RECONSIDERATION. (Entered: 09/03/2003)"
        },
        {
          "row_number": 246,
          "id": 9512204,
          "entry_number": "97",
          "date_filed": "2003-09-04T00:00:00-04:00",
          "attachments": null,
          "url": "https://www.courtlistener.com/docket/12006291/97/freeman-berrell-v-berge-gerald/",
          "recap_pdf_url": null,
          "pacer_doc_id": null,
          "description": "AFFIDAVIT OF BERRELL FREEMAN. (Entered: 09/04/2003)"
        },
        {
          "row_number": 248,
          "id": 9512206,
          "entry_number": "99",
          "date_filed": "2003-09-05T00:00:00-04:00",
          "attachments": null,
          "url": "https://www.courtlistener.com/docket/12006291/99/freeman-berrell-v-berge-gerald/",
          "recap_pdf_url": null,
          "pacer_doc_id": null,
          "description": "BRIEF IN SUPPORT OF DEFTS. MOTION FOR S/J. (Entered: 09/05/2003)"
        },
        {
          "row_number": 2,
          "id": 9512207,
          "entry_number": "100",
          "date_filed": "2003-09-05T00:00:00-04:00",
          "attachments": null,
          "url": "https://www.courtlistener.com/docket/12006291/100/freeman-berrell-v-berge-gerald/",
          "recap_pdf_url": null,
          "pacer_doc_id": null,
          "description": "PROPOSED FINDINGS/CONCL. BY DEFTS. (Entered: 09/05/2003)"
        },
        {
          "row_number": 3,
          "id": 9512208,
          "entry_number": "101",
          "date_filed": "2003-09-05T00:00:00-04:00",
          "attachments": null,
          "url": "https://www.courtlistener.com/docket/12006291/101/freeman-berrell-v-berge-gerald/",
          "recap_pdf_url": null,
          "pacer_doc_id": null,
          "description": "AFFIDAVIT OF GERALD A. BERGE. (Entered: 09/05/2003)"
        },
        {
          "row_number": 4,
          "id": 9512209,
          "entry_number": "102",
          "date_filed": "2003-09-05T00:00:00-04:00",
          "attachments": null,
          "url": "https://www.courtlistener.com/docket/12006291/102/freeman-berrell-v-berge-gerald/",
          "recap_pdf_url": null,
          "pacer_doc_id": null,
          "description": "AFFIDAVIT OF SAMUEL A. NELSON. (Entered: 09/05/2003)"
        },
        {
          "row_number": 5,
          "id": 9512210,
          "entry_number": "103",
          "date_filed": "2003-09-05T00:00:00-04:00",
          "attachments": null,
          "url": "https://www.courtlistener.com/docket/12006291/103/freeman-berrell-v-berge-gerald/",
          "recap_pdf_url": null,
          "pacer_doc_id": null,
          "description": "AFFIDAVIT OF ELLEN RAY. (Entered: 09/05/2003)"
        },
        {
          "row_number": 6,
          "id": 9512211,
          "entry_number": "104",
          "date_filed": "2003-09-05T00:00:00-04:00",
          "attachments": null,
          "url": "https://www.courtlistener.com/docket/12006291/104/freeman-berrell-v-berge-gerald/",
          "recap_pdf_url": null,
          "pacer_doc_id": null,
          "description": "RESPONSE TO PROPOSED S/J FINDINGS/CONCL. BY DEFTS. (Entered: 09/05/2003)"
        },
        {
          "row_number": 7,
          "id": 9512212,
          "entry_number": "105",
          "date_filed": "2003-09-15T00:00:00-04:00",
          "attachments": null,
          "url": "https://www.courtlistener.com/docket/12006291/105/freeman-berrell-v-berge-gerald/",
          "recap_pdf_url": null,
          "pacer_doc_id": null,
          "description": "BRIEF IN OPPOSITION BY PLTF. TO DEFTS. MOTION FOR SUMMARY JUDGMENT. (Entered: 09/15/2003)"
        },
        {
          "row_number": 8,
          "id": 9512213,
          "entry_number": "106",
          "date_filed": "2003-09-15T00:00:00-04:00",
          "attachments": null,
          "url": "https://www.courtlistener.com/docket/12006291/106/freeman-berrell-v-berge-gerald/",
          "recap_pdf_url": null,
          "pacer_doc_id": null,
          "description": "AFFIDAVIT OF BERRELL FREEMAN. (Entered: 09/15/2003)"
        },
        {
          "row_number": 10,
          "id": 9512215,
          "entry_number": "108",
          "date_filed": "2003-09-15T00:00:00-04:00",
          "attachments": null,
          "url": "https://www.courtlistener.com/docket/12006291/108/freeman-berrell-v-berge-gerald/",
          "recap_pdf_url": null,
          "pacer_doc_id": null,
          "description": "MOTION BY PLTF. FOR SANCTIONS AND TO STRIKE AFFIDAVIT. (Entered: 09/15/2003)"
        },
        {
          "row_number": 14,
          "id": 9512218,
          "entry_number": "111",
          "date_filed": "2003-09-18T00:00:00-04:00",
          "attachments": null,
          "url": "https://www.courtlistener.com/docket/12006291/111/freeman-berrell-v-berge-gerald/",
          "recap_pdf_url": null,
          "pacer_doc_id": null,
          "description": "MOTION BY PLTF. FOR CLARIFICATION. (Entered: 09/18/2003)"
        },
        {
          "row_number": 15,
          "id": 9512219,
          "entry_number": "112",
          "date_filed": "2003-09-18T00:00:00-04:00",
          "attachments": null,
          "url": "https://www.courtlistener.com/docket/12006291/112/freeman-berrell-v-berge-gerald/",
          "recap_pdf_url": null,
          "pacer_doc_id": null,
          "description": "MOTION BY PLTF. FOR JOINDER. (Entered: 09/18/2003)"
        },
        {
          "row_number": 16,
          "id": 9512220,
          "entry_number": "113",
          "date_filed": "2003-09-22T00:00:00-04:00",
          "attachments": null,
          "url": "https://www.courtlistener.com/docket/12006291/113/freeman-berrell-v-berge-gerald/",
          "recap_pdf_url": null,
          "pacer_doc_id": null,
          "description": "MOTION BY PLTF. TO REVISIT DENIAL OF CLAIM. (Entered: 09/22/2003)"
        },
        {
          "row_number": 17,
          "id": 9512221,
          "entry_number": "114",
          "date_filed": "2003-09-22T00:00:00-04:00",
          "attachments": null,
          "url": "https://www.courtlistener.com/docket/12006291/114/freeman-berrell-v-berge-gerald/",
          "recap_pdf_url": null,
          "pacer_doc_id": null,
          "description": "ORDER DENYING PLTF. MOTIONS FOR CLARIFICATION AND JOINDER. (Entered: 09/22/2003)"
        },
        {
          "row_number": 18,
          "id": 9512222,
          "entry_number": "115",
          "date_filed": "2003-09-24T00:00:00-04:00",
          "attachments": null,
          "url": "https://www.courtlistener.com/docket/12006291/115/freeman-berrell-v-berge-gerald/",
          "recap_pdf_url": null,
          "pacer_doc_id": null,
          "description": "ORDER DENYING PLTF. MOTION TO REVISIT DENIAL OF CLAIM. (Entered: 09/24/2003)"
        },
        {
          "row_number": 19,
          "id": 9512223,
          "entry_number": "116",
          "date_filed": "2003-09-25T00:00:00-04:00",
          "attachments": null,
          "url": "https://www.courtlistener.com/docket/12006291/116/freeman-berrell-v-berge-gerald/",
          "recap_pdf_url": null,
          "pacer_doc_id": null,
          "description": "ORDER DENYING PLTF. MOTION FOR RECONSIDERATION OF 8/26/03 ORDER DENYING MOTION FOR TRIAL WITNESSES. (Entered: 09/25/2003)"
        },
        {
          "row_number": 22,
          "id": 9512226,
          "entry_number": "119",
          "date_filed": "2003-10-23T00:00:00-04:00",
          "attachments": null,
          "url": "https://www.courtlistener.com/docket/12006291/119/freeman-berrell-v-berge-gerald/",
          "recap_pdf_url": null,
          "pacer_doc_id": null,
          "description": "MOTION BY PLTF. TO STRIKE ALL EXHIBITS PRODUCED BY DEFTS. RE: MOTIONS FOR S/J. (Entered: 10/23/2003)"
        },
        {
          "row_number": 25,
          "id": 9512228,
          "entry_number": "121",
          "date_filed": "2003-10-23T00:00:00-04:00",
          "attachments": null,
          "url": "https://www.courtlistener.com/docket/12006291/121/freeman-berrell-v-berge-gerald/",
          "recap_pdf_url": null,
          "pacer_doc_id": null,
          "description": "MOTION (FIRST) BY PLTF. TO COMPEL. (Entered: 10/23/2003)"
        },
        {
          "row_number": 27,
          "id": 9512230,
          "entry_number": "123",
          "date_filed": "2003-10-29T00:00:00-05:00",
          "attachments": null,
          "url": "https://www.courtlistener.com/docket/12006291/123/freeman-berrell-v-berge-gerald/",
          "recap_pdf_url": null,
          "pacer_doc_id": null,
          "description": "MOTION BY PLTF. TO COMPEL DISCOVERY. (Entered: 10/29/2003)"
        },
        {
          "row_number": 28,
          "id": 9512231,
          "entry_number": "124",
          "date_filed": "2003-12-04T00:00:00-05:00",
          "attachments": null,
          "url": "https://www.courtlistener.com/docket/12006291/124/freeman-berrell-v-berge-gerald/",
          "recap_pdf_url": null,
          "pacer_doc_id": null,
          "description": "MOTION BY PLTF. TO WITHDRAW ACCESS AND PERMISSION TO USE MEDICAL/CLINICAL RECORDS. (Entered: 12/04/2003)"
        },
        {
          "row_number": 29,
          "id": 9512232,
          "entry_number": "125",
          "date_filed": "2003-12-04T00:00:00-05:00",
          "attachments": null,
          "url": "https://www.courtlistener.com/docket/12006291/125/freeman-berrell-v-berge-gerald/",
          "recap_pdf_url": null,
          "pacer_doc_id": null,
          "description": "ORDER DENYING PLTF. MOTIONS DOCKETED AS 108, 109, 110, 117, 118, 119, 120, 121, 122 AND 123. (Entered: 12/04/2003)"
        },
        {
          "row_number": 31,
          "id": 9512234,
          "entry_number": "127",
          "date_filed": "2003-12-16T00:00:00-05:00",
          "attachments": null,
          "url": "https://www.courtlistener.com/docket/12006291/127/freeman-berrell-v-berge-gerald/",
          "recap_pdf_url": null,
          "pacer_doc_id": null,
          "description": "ORDER GRANTING IN PART PLTF. MOTION FOR RECONSIDERATION. (SLC) (Entered: 12/16/2003)"
        },
        {
          "row_number": 32,
          "id": 9512235,
          "entry_number": "128",
          "date_filed": "2003-12-17T00:00:00-05:00",
          "attachments": null,
          "url": "https://www.courtlistener.com/docket/12006291/128/freeman-berrell-v-berge-gerald/",
          "recap_pdf_url": null,
          "pacer_doc_id": null,
          "description": "MOTION BY PLTF. FOR JUDICIAL NOTICE. (Entered: 12/17/2003)"
        },
        {
          "row_number": 33,
          "id": 9512236,
          "entry_number": "129",
          "date_filed": "2003-12-17T00:00:00-05:00",
          "attachments": null,
          "url": "https://www.courtlistener.com/docket/12006291/129/freeman-berrell-v-berge-gerald/",
          "recap_pdf_url": null,
          "pacer_doc_id": null,
          "description": "ORDER PARTIALLY GRANTING DEFTS. MOTION FOR S/J; DENYING PLTF. MOTION FOR S/J; DMSG. DEFT. LITSCHER FROM CASE. (Entered: 12/17/2003)"
        },
        {
          "row_number": 36,
          "id": 9512238,
          "entry_number": "131",
          "date_filed": "2004-01-07T00:00:00-05:00",
          "attachments": null,
          "url": "https://www.courtlistener.com/docket/12006291/131/freeman-berrell-v-berge-gerald/",
          "recap_pdf_url": null,
          "pacer_doc_id": null,
          "description": "ORDER DENYING PLTF. MOTION FOR PROTECTIVE ORDER AND TO REVISIT RULING ON WITNESS PRODUCTION AS MOOT. (SLC) (Entered: 01/07/2004)"
        },
        {
          "row_number": 37,
          "id": 9512239,
          "entry_number": "132",
          "date_filed": "2004-01-07T00:00:00-05:00",
          "attachments": null,
          "url": "https://www.courtlistener.com/docket/12006291/132/freeman-berrell-v-berge-gerald/",
          "recap_pdf_url": null,
          "pacer_doc_id": null,
          "description": "ORDER APPOINTING ATTYS. DAVID HARTH AND SARAH WALKENHORST AS COUNSEL FOR PLTF; TRIAL DATE RESCINDED. (Entered: 01/07/2004)"
        },
        {
          "row_number": 39,
          "id": 9512241,
          "entry_number": "134",
          "date_filed": "2004-02-09T00:00:00-05:00",
          "attachments": null,
          "url": "https://www.courtlistener.com/docket/12006291/134/freeman-berrell-v-berge-gerald/",
          "recap_pdf_url": null,
          "pacer_doc_id": null,
          "description": "COMPLAINT - AMENDED. (Entered: 02/09/2004)"
        },
        {
          "row_number": 40,
          "id": 9512242,
          "entry_number": "135",
          "date_filed": "2004-02-13T00:00:00-05:00",
          "attachments": null,
          "url": "https://www.courtlistener.com/docket/12006291/135/freeman-berrell-v-berge-gerald/",
          "recap_pdf_url": null,
          "pacer_doc_id": null,
          "description": "ORDER THAT AMENDED COMPLAINT OPERATIVE PLEADING IN CASE; DEFT. LITSCHER DISMISSED. (Entered: 02/13/2004)"
        },
        {
          "row_number": 41,
          "id": 9512243,
          "entry_number": "136",
          "date_filed": "2004-02-23T00:00:00-05:00",
          "attachments": null,
          "url": "https://www.courtlistener.com/docket/12006291/136/freeman-berrell-v-berge-gerald/",
          "recap_pdf_url": null,
          "pacer_doc_id": null,
          "description": "ANSWER TO AMENDED COMPLAINT. (Entered: 02/23/2004)"
        },
        {
          "row_number": 42,
          "id": 9512244,
          "entry_number": "137",
          "date_filed": "2004-05-03T00:00:00-04:00",
          "attachments": null,
          "url": "https://www.courtlistener.com/docket/12006291/137/freeman-berrell-v-berge-gerald/",
          "recap_pdf_url": null,
          "pacer_doc_id": null,
          "description": "ORDER - 2ND AMENDED SCHEDULING; SCHEDULE SET FOR FILING AND BRIEFING OF MOTION TO AMEND COMPLT.; SCHEDULE RESET. (SLC) (Entered: 05/03/2004)"
        },
        {
          "row_number": 44,
          "id": 9512246,
          "entry_number": "139",
          "date_filed": "2004-05-24T00:00:00-04:00",
          "attachments": null,
          "url": "https://www.courtlistener.com/docket/12006291/139/freeman-berrell-v-berge-gerald/",
          "recap_pdf_url": null,
          "pacer_doc_id": null,
          "description": "DEPOSITION OF GARY A. BOUGHTON, TAKEN 4/27/04 AND 4/28/04. (Entered: 05/24/2004)"
        },
        {
          "row_number": 46,
          "id": 9512247,
          "entry_number": "140",
          "date_filed": "2004-05-24T00:00:00-04:00",
          "attachments": null,
          "url": "https://www.courtlistener.com/docket/12006291/140/freeman-berrell-v-berge-gerald/",
          "recap_pdf_url": null,
          "pacer_doc_id": null,
          "description": "DEPOSITION OF ELLEN KAY RAY, TAKEN 4/28/04. (Entered: 05/24/2004)"
        },
        {
          "row_number": 47,
          "id": 9512248,
          "entry_number": "141",
          "date_filed": "2004-05-24T00:00:00-04:00",
          "attachments": null,
          "url": "https://www.courtlistener.com/docket/12006291/141/freeman-berrell-v-berge-gerald/",
          "recap_pdf_url": null,
          "pacer_doc_id": null,
          "description": "DEPOSITION OF MICHAEL J. SLANEY, TAKEN 4/28/04. (Entered: 05/24/2004)"
        },
        {
          "row_number": 48,
          "id": 9512249,
          "entry_number": "142",
          "date_filed": "2004-05-24T00:00:00-04:00",
          "attachments": null,
          "url": "https://www.courtlistener.com/docket/12006291/142/freeman-berrell-v-berge-gerald/",
          "recap_pdf_url": null,
          "pacer_doc_id": null,
          "description": "DEPOSITION OF JOHN S. SPICER, TAKEN 4/29/04. (Entered: 05/24/2004)"
        },
        {
          "row_number": 51,
          "id": 9512252,
          "entry_number": "145",
          "date_filed": "2004-05-24T00:00:00-04:00",
          "attachments": null,
          "url": "https://www.courtlistener.com/docket/12006291/145/freeman-berrell-v-berge-gerald/",
          "recap_pdf_url": null,
          "pacer_doc_id": null,
          "description": "DEPOSITION OF COLETTE CULLEN, TAKEN 4/30/04. (Entered: 05/24/2004)"
        },
        {
          "row_number": 52,
          "id": 9512253,
          "entry_number": "146",
          "date_filed": "2004-05-24T00:00:00-04:00",
          "attachments": null,
          "url": "https://www.courtlistener.com/docket/12006291/146/freeman-berrell-v-berge-gerald/",
          "recap_pdf_url": null,
          "pacer_doc_id": null,
          "description": "DEPOSITION OF JOSEPH PETER MAIER, M.D., TAKEN 4/30/04. (Entered: 05/24/2004)"
        },
        {
          "row_number": 53,
          "id": 9512254,
          "entry_number": "147",
          "date_filed": "2004-07-02T00:00:00-04:00",
          "attachments": null,
          "url": "https://www.courtlistener.com/docket/12006291/147/freeman-berrell-v-berge-gerald/",
          "recap_pdf_url": null,
          "pacer_doc_id": null,
          "description": "PLTF. EXPERT REPORT OF LINDA FARLEY. (Entered: 07/02/2004)"
        },
        {
          "row_number": 54,
          "id": 9512255,
          "entry_number": "148",
          "date_filed": "2004-07-02T00:00:00-04:00",
          "attachments": null,
          "url": "https://www.courtlistener.com/docket/12006291/148/freeman-berrell-v-berge-gerald/",
          "recap_pdf_url": null,
          "pacer_doc_id": null,
          "description": "PLTF. EXPERT REPORT OF CHARLES M. MONTGOMERY. (Entered: 07/02/2004)"
        },
        {
          "row_number": 55,
          "id": 9512256,
          "entry_number": "149",
          "date_filed": "2004-07-09T00:00:00-04:00",
          "attachments": null,
          "url": "https://www.courtlistener.com/docket/12006291/149/freeman-berrell-v-berge-gerald/",
          "recap_pdf_url": null,
          "pacer_doc_id": null,
          "description": "MOTION BY PLTF. FOR LEAVE TO AMEND COMPLAINT. (Entered: 07/09/2004)"
        },
        {
          "row_number": 60,
          "id": 9512260,
          "entry_number": "153",
          "date_filed": "2004-07-20T00:00:00-04:00",
          "attachments": null,
          "url": "https://www.courtlistener.com/docket/12006291/153/freeman-berrell-v-berge-gerald/",
          "recap_pdf_url": null,
          "pacer_doc_id": null,
          "description": "EXPERT REPORT OF LINDA FARLEY. (Entered: 07/20/2004)"
        },
        {
          "row_number": 61,
          "id": 9512261,
          "entry_number": "154",
          "date_filed": "2004-07-22T00:00:00-04:00",
          "attachments": null,
          "url": "https://www.courtlistener.com/docket/12006291/154/freeman-berrell-v-berge-gerald/",
          "recap_pdf_url": null,
          "pacer_doc_id": null,
          "description": "BRIEF IN OPPOSITION BY DEFT. TO PLTF. MOTION TO AMEND COMPLAINT. (Entered: 07/22/2004)"
        },
        {
          "row_number": 62,
          "id": 9512262,
          "entry_number": "155",
          "date_filed": "2004-07-23T00:00:00-04:00",
          "attachments": null,
          "url": "https://www.courtlistener.com/docket/12006291/155/freeman-berrell-v-berge-gerald/",
          "recap_pdf_url": null,
          "pacer_doc_id": null,
          "description": "SUPPLEMENT TO DEFTS. OPPOSITION TO PLTF. MOTION TO AMEND COMPLAINT. (Entered: 07/23/2004)"
        },
        {
          "row_number": 63,
          "id": 9512263,
          "entry_number": "156",
          "date_filed": "2004-07-26T00:00:00-04:00",
          "attachments": null,
          "url": "https://www.courtlistener.com/docket/12006291/156/freeman-berrell-v-berge-gerald/",
          "recap_pdf_url": null,
          "pacer_doc_id": null,
          "description": "PLTF. RULE 26 DISCLOSURES. (Entered: 07/26/2004)"
        },
        {
          "row_number": 64,
          "id": 9512264,
          "entry_number": "157",
          "date_filed": "2004-07-26T00:00:00-04:00",
          "attachments": null,
          "url": "https://www.courtlistener.com/docket/12006291/157/freeman-berrell-v-berge-gerald/",
          "recap_pdf_url": null,
          "pacer_doc_id": null,
          "description": "DEFT. RULE 26 DISCLOSURES. (Entered: 07/26/2004)"
        },
        {
          "row_number": 65,
          "id": 9512265,
          "entry_number": "158",
          "date_filed": "2004-07-27T00:00:00-04:00",
          "attachments": null,
          "url": "https://www.courtlistener.com/docket/12006291/158/freeman-berrell-v-berge-gerald/",
          "recap_pdf_url": null,
          "pacer_doc_id": null,
          "description": "ORDER GRANTING PLTF. LEAVE TO TAKE ADDITIONAL DEPOSITIONS. (SLC) (Entered: 07/27/2004)"
        },
        {
          "row_number": 66,
          "id": 9512266,
          "entry_number": "159",
          "date_filed": "2004-07-29T00:00:00-04:00",
          "attachments": null,
          "url": "https://www.courtlistener.com/docket/12006291/159/freeman-berrell-v-berge-gerald/",
          "recap_pdf_url": null,
          "pacer_doc_id": null,
          "description": "ORDER GRANTING PLTF MOT/AMEND COMPLT; TRIAL DATE RESCINDED; PLTF TO SERVE AMENDED COMPLT; SCHED CONF. TO BE SET. (Entered: 07/29/2004)"
        },
        {
          "row_number": 68,
          "id": 9512267,
          "entry_number": "160",
          "date_filed": "2004-07-29T00:00:00-04:00",
          "attachments": null,
          "url": "https://www.courtlistener.com/docket/12006291/160/freeman-berrell-v-berge-gerald/",
          "recap_pdf_url": null,
          "pacer_doc_id": null,
          "description": "COMPLAINT - SECOND AMENDED (Entered: 07/29/2004)"
        },
        {
          "row_number": 69,
          "id": 9512268,
          "entry_number": "161",
          "date_filed": "2004-08-05T00:00:00-04:00",
          "attachments": null,
          "url": "https://www.courtlistener.com/docket/12006291/161/freeman-berrell-v-berge-gerald/",
          "recap_pdf_url": null,
          "pacer_doc_id": null,
          "description": "WAIVER OF SERVICE OF SUMMONS. (Entered: 08/05/2004)"
        },
        {
          "row_number": 71,
          "id": 9512270,
          "entry_number": "163",
          "date_filed": "2004-08-19T00:00:00-04:00",
          "attachments": null,
          "url": "https://www.courtlistener.com/docket/12006291/163/freeman-berrell-v-berge-gerald/",
          "recap_pdf_url": null,
          "pacer_doc_id": null,
          "description": "ANSWER TO SECOND AMENDED COMPLAINT. (Entered: 08/19/2004)"
        },
        {
          "row_number": 72,
          "id": 9512271,
          "entry_number": "164",
          "date_filed": "2004-09-01T00:00:00-04:00",
          "attachments": null,
          "url": "https://www.courtlistener.com/docket/12006291/164/freeman-berrell-v-berge-gerald/",
          "recap_pdf_url": null,
          "pacer_doc_id": null,
          "description": "PTC ORDER (SLC) (Entered: 09/01/2004)"
        },
        {
          "row_number": 253,
          "id": 9512272,
          "entry_number": null,
          "date_filed": "2004-09-02T00:00:00-04:00",
          "attachments": null,
          "url": "https://www.courtlistener.com",
          "recap_pdf_url": null,
          "pacer_doc_id": null,
          "description": "TELE. SCHEDULING CONFERENCE SET FOR 9/7/04, 11:00 AM. (SLC)"
        },
        {
          "row_number": 73,
          "id": 9512273,
          "entry_number": "165",
          "date_filed": "2004-09-07T00:00:00-04:00",
          "attachments": null,
          "url": "https://www.courtlistener.com/docket/12006291/165/freeman-berrell-v-berge-gerald/",
          "recap_pdf_url": null,
          "pacer_doc_id": null,
          "description": "MOTION BY RESPTS. TO DISMISS. (Entered: 09/07/2004)"
        },
        {
          "row_number": 74,
          "id": 9512274,
          "entry_number": "166",
          "date_filed": "2004-09-07T00:00:00-04:00",
          "attachments": null,
          "url": "https://www.courtlistener.com/docket/12006291/166/freeman-berrell-v-berge-gerald/",
          "recap_pdf_url": null,
          "pacer_doc_id": null,
          "description": "BRIEF IN SUPPORT OF DEFTS. MOTION TO DISMISS. (Entered: 09/07/2004)"
        },
        {
          "row_number": 75,
          "id": 9512275,
          "entry_number": "167",
          "date_filed": "2004-09-08T00:00:00-04:00",
          "attachments": null,
          "url": "https://www.courtlistener.com/docket/12006291/167/freeman-berrell-v-berge-gerald/",
          "recap_pdf_url": null,
          "pacer_doc_id": null,
          "description": "ORDER ON 9/7/04 TELE. SCHEDULING CONFERENCE; BRIEFING SET ON RESPTS. MOT. TO DMS. (SLC) (Entered: 09/08/2004)"
        },
        {
          "row_number": 76,
          "id": 9512276,
          "entry_number": "168",
          "date_filed": "2004-09-08T00:00:00-04:00",
          "attachments": null,
          "url": "https://www.courtlistener.com/docket/12006291/168/freeman-berrell-v-berge-gerald/",
          "recap_pdf_url": null,
          "pacer_doc_id": null,
          "description": "PLTF. RESPONSE THAT DEFTS. MOTION TO DISMISS SHOULD BE DISMISSED WITHOUT FULL RESPONSIVE BRIEFING. (Entered: 09/10/2004)"
        },
        {
          "row_number": 83,
          "id": 9512282,
          "entry_number": "174",
          "date_filed": "2004-10-13T00:00:00-04:00",
          "attachments": null,
          "url": "https://www.courtlistener.com/docket/12006291/174/freeman-berrell-v-berge-gerald/",
          "recap_pdf_url": null,
          "pacer_doc_id": null,
          "description": "BRIEF IN SUPPORT OF DEFTS. MOTION TO STAY DISCOVERY PENDING RESOLUTION OF THEIR MOTION TO DISMISS. (Entered: 10/14/2004)"
        },
        {
          "row_number": 85,
          "id": 9512284,
          "entry_number": "176",
          "date_filed": "2004-10-18T00:00:00-04:00",
          "attachments": null,
          "url": "https://www.courtlistener.com/docket/12006291/176/freeman-berrell-v-berge-gerald/",
          "recap_pdf_url": null,
          "pacer_doc_id": null,
          "description": "BRIEF IN OPPOSITION BY PLTF. TO RESPTS. MOTION TO STAY DISCOVERY PENDING RESOLUTION OF THEIR MOTION TO DISMISS. (Entered: 10/19/2004)"
        },
        {
          "row_number": 87,
          "id": 9512286,
          "entry_number": "178",
          "date_filed": "2004-10-25T00:00:00-04:00",
          "attachments": null,
          "url": "https://www.courtlistener.com/docket/12006291/178/freeman-berrell-v-berge-gerald/",
          "recap_pdf_url": null,
          "pacer_doc_id": null,
          "description": "MOTION BY PLTF. FOR ISSUANCE OF WRIT OF H/C FOR APPEARANCE AT TRIAL ON 11/29/04 AND 11/30/04. (Entered: 10/25/2004)"
        },
        {
          "row_number": 88,
          "id": 9512287,
          "entry_number": "179",
          "date_filed": "2004-11-01T00:00:00-05:00",
          "attachments": null,
          "url": "https://www.courtlistener.com/docket/12006291/179/freeman-berrell-v-berge-gerald/",
          "recap_pdf_url": null,
          "pacer_doc_id": null,
          "description": "NOTICE OF APPEARANCE OF JAMES MCCAMBRIDGE IN PLACE OF COREY FINKELMEYER FOR DEFTS. (Entered: 11/02/2004)"
        },
        {
          "row_number": 90,
          "id": 9512288,
          "entry_number": "180",
          "date_filed": "2004-11-01T00:00:00-05:00",
          "attachments": null,
          "url": "https://www.courtlistener.com/docket/12006291/180/freeman-berrell-v-berge-gerald/",
          "recap_pdf_url": null,
          "pacer_doc_id": null,
          "description": "DEFTS. PRETRIAL DISCLOSURES. (Entered: 11/02/2004)"
        },
        {
          "row_number": 91,
          "id": 9512289,
          "entry_number": "181",
          "date_filed": "2004-11-10T00:00:00-05:00",
          "attachments": null,
          "url": "https://www.courtlistener.com/docket/12006291/181/freeman-berrell-v-berge-gerald/",
          "recap_pdf_url": null,
          "pacer_doc_id": null,
          "description": "ORDER DENYING DEFTS. MOTION TO DISMISS. (Entered: 11/10/2004)"
        },
        {
          "row_number": 254,
          "id": 9512290,
          "entry_number": null,
          "date_filed": "2004-11-10T00:00:00-05:00",
          "attachments": null,
          "url": "https://www.courtlistener.com",
          "recap_pdf_url": null,
          "pacer_doc_id": null,
          "description": "WRIT ISSUED FOR PLTF. APPEARANCE AT TRIAL; DELIVERED TO WSPF FOR SERVICE. (BBC)"
        },
        {
          "row_number": 92,
          "id": 9512291,
          "entry_number": "182",
          "date_filed": "2004-11-12T00:00:00-05:00",
          "attachments": null,
          "url": "https://www.courtlistener.com/docket/12006291/182/freeman-berrell-v-berge-gerald/",
          "recap_pdf_url": null,
          "pacer_doc_id": null,
          "description": "PROPOSED VOIR DIRE BY DEFTS. (Entered: 11/12/2004)"
        },
        {
          "row_number": 93,
          "id": 9512292,
          "entry_number": "183",
          "date_filed": "2004-11-12T00:00:00-05:00",
          "attachments": null,
          "url": "https://www.courtlistener.com/docket/12006291/183/freeman-berrell-v-berge-gerald/",
          "recap_pdf_url": null,
          "pacer_doc_id": null,
          "description": "PROPOSED JURY INSTRUCTIONS BY DEFTS. (Entered: 11/12/2004)"
        },
        {
          "row_number": 94,
          "id": 9512293,
          "entry_number": "184",
          "date_filed": "2004-11-12T00:00:00-05:00",
          "attachments": null,
          "url": "https://www.courtlistener.com/docket/12006291/184/freeman-berrell-v-berge-gerald/",
          "recap_pdf_url": null,
          "pacer_doc_id": null,
          "description": "PROPOSED SPECIAL VERDICT BY DEFTS. (Entered: 11/12/2004)"
        },
        {
          "row_number": 96,
          "id": 9512295,
          "entry_number": "186",
          "date_filed": "2004-11-15T00:00:00-05:00",
          "attachments": null,
          "url": "https://www.courtlistener.com/docket/12006291/186/freeman-berrell-v-berge-gerald/",
          "recap_pdf_url": null,
          "pacer_doc_id": null,
          "description": "PLTF. AMENDED PRETRIAL DISCLOSURES. (Entered: 11/15/2004)"
        },
        {
          "row_number": 97,
          "id": 9512296,
          "entry_number": "187",
          "date_filed": "2004-11-15T00:00:00-05:00",
          "attachments": null,
          "url": "https://www.courtlistener.com/docket/12006291/187/freeman-berrell-v-berge-gerald/",
          "recap_pdf_url": null,
          "pacer_doc_id": null,
          "description": "MOTION IN LIMINE BY PLTF. TO EXCLUDE ANY EXPERT TESTIMONY BY DEFENSE WITNESSES. (Entered: 11/15/2004)"
        },
        {
          "row_number": 98,
          "id": 9512297,
          "entry_number": "188",
          "date_filed": "2004-11-15T00:00:00-05:00",
          "attachments": null,
          "url": "https://www.courtlistener.com/docket/12006291/188/freeman-berrell-v-berge-gerald/",
          "recap_pdf_url": null,
          "pacer_doc_id": null,
          "description": "PROPOSED VOIR DIRE BY PLTF. (Entered: 11/15/2004)"
        },
        {
          "row_number": 99,
          "id": 9512298,
          "entry_number": "189",
          "date_filed": "2004-11-15T00:00:00-05:00",
          "attachments": null,
          "url": "https://www.courtlistener.com/docket/12006291/189/freeman-berrell-v-berge-gerald/",
          "recap_pdf_url": null,
          "pacer_doc_id": null,
          "description": "PROPOSED JURY INSTRUCTIONS BY PLTF. (Entered: 11/15/2004)"
        },
        {
          "row_number": 102,
          "id": 9512300,
          "entry_number": "191",
          "date_filed": "2004-11-16T00:00:00-05:00",
          "attachments": null,
          "url": "https://www.courtlistener.com/docket/12006291/191/freeman-berrell-v-berge-gerald/",
          "recap_pdf_url": null,
          "pacer_doc_id": null,
          "description": "DEPOSITION OF JOHN W. SHARPE, TAKEN 11/10/04. (VIDEOTAPE) (Entered: 11/16/2004)"
        },
        {
          "row_number": 103,
          "id": 9512301,
          "entry_number": "192",
          "date_filed": "2004-11-16T00:00:00-05:00",
          "attachments": null,
          "url": "https://www.courtlistener.com/docket/12006291/192/freeman-berrell-v-berge-gerald/",
          "recap_pdf_url": null,
          "pacer_doc_id": null,
          "description": "DEPOSITION OF JOHN MURRAY, TAKEN 11/10/04. (SEALED) (Entered: 11/16/2004)"
        },
        {
          "row_number": 104,
          "id": 9512302,
          "entry_number": "193",
          "date_filed": "2004-11-16T00:00:00-05:00",
          "attachments": null,
          "url": "https://www.courtlistener.com/docket/12006291/193/freeman-berrell-v-berge-gerald/",
          "recap_pdf_url": null,
          "pacer_doc_id": null,
          "description": "DEPOSITION OF PETER HUIBREGTSE, TAKEN 11/10/04. (VIDEOTAPE) (Entered: 11/16/2004)"
        },
        {
          "row_number": 105,
          "id": 9512303,
          "entry_number": "194",
          "date_filed": "2004-11-16T00:00:00-05:00",
          "attachments": null,
          "url": "https://www.courtlistener.com/docket/12006291/194/freeman-berrell-v-berge-gerald/",
          "recap_pdf_url": null,
          "pacer_doc_id": null,
          "description": "DEPOSITION OF PETER HUIBREGTSE, TAKEN 11/11/04. (SEALED) (VIDEOTAPE FILED 11/18/04) (Entered: 11/16/2004)"
        },
        {
          "row_number": 106,
          "id": 9512304,
          "entry_number": "195",
          "date_filed": "2004-11-16T00:00:00-05:00",
          "attachments": null,
          "url": "https://www.courtlistener.com/docket/12006291/195/freeman-berrell-v-berge-gerald/",
          "recap_pdf_url": null,
          "pacer_doc_id": null,
          "description": "DEPOSITION OF BERRELL FREEMAN, TAKEN 11/11/04. (VIDEOTAPE FILED 11/18/04) (Entered: 11/16/2004)"
        },
        {
          "row_number": 107,
          "id": 9512305,
          "entry_number": "196",
          "date_filed": "2004-11-17T00:00:00-05:00",
          "attachments": null,
          "url": "https://www.courtlistener.com/docket/12006291/196/freeman-berrell-v-berge-gerald/",
          "recap_pdf_url": null,
          "pacer_doc_id": null,
          "description": "DEPOSITION OF BRAD HOMPE, TAKEN 11/15/04. (VIDEOTAPE) (Entered: 11/17/2004)"
        },
        {
          "row_number": 108,
          "id": 9512306,
          "entry_number": "197",
          "date_filed": "2004-11-18T00:00:00-05:00",
          "attachments": null,
          "url": "https://www.courtlistener.com/docket/12006291/197/freeman-berrell-v-berge-gerald/",
          "recap_pdf_url": null,
          "pacer_doc_id": null,
          "description": "PLTF. 2ND AMENDED PRETRIAL DISCLOSURES. (Entered: 11/18/2004)"
        },
        {
          "row_number": 109,
          "id": 9512307,
          "entry_number": "198",
          "date_filed": "2004-11-18T00:00:00-05:00",
          "attachments": null,
          "url": "https://www.courtlistener.com/docket/12006291/198/freeman-berrell-v-berge-gerald/",
          "recap_pdf_url": null,
          "pacer_doc_id": null,
          "description": "CTRM. MIN. FINAL PRETRIAL CONFERENCE; CONFERENCE ADJOURNED TO 11/19/04 AT 2:00. (SLC) 10 (Entered: 11/19/2004)"
        },
        {
          "row_number": 110,
          "id": 9512308,
          "entry_number": "199",
          "date_filed": "2004-11-19T00:00:00-05:00",
          "attachments": null,
          "url": "https://www.courtlistener.com/docket/12006291/199/freeman-berrell-v-berge-gerald/",
          "recap_pdf_url": null,
          "pacer_doc_id": null,
          "description": "CTRM. MIN. FINAL PRETRIAL CONFERENCE; 3 DAY TRIAL EST; MOTIONS IN LIMINE, VOIR DIRE, VERDICT FORM DISCUSSED. 22 (Entered: 11/19/2004)"
        },
        {
          "row_number": 113,
          "id": 9512309,
          "entry_number": "200",
          "date_filed": "2004-11-26T00:00:00-05:00",
          "attachments": null,
          "url": "https://www.courtlistener.com/docket/12006291/200/freeman-berrell-v-berge-gerald/",
          "recap_pdf_url": null,
          "pacer_doc_id": null,
          "description": "ORDER ON FPTC; PLTF. AND DEFTS. MOTIONS IN LIMINE GRANTED. (Entered: 11/26/2004)"
        },
        {
          "row_number": 115,
          "id": 9512311,
          "entry_number": "202",
          "date_filed": "2004-11-29T00:00:00-05:00",
          "attachments": null,
          "url": "https://www.courtlistener.com/docket/12006291/202/freeman-berrell-v-berge-gerald/",
          "recap_pdf_url": null,
          "pacer_doc_id": null,
          "description": "JURY SELECTION SHEET (Entered: 11/29/2004)"
        },
        {
          "row_number": 116,
          "id": 9512312,
          "entry_number": "203",
          "date_filed": "2004-11-29T00:00:00-05:00",
          "attachments": null,
          "url": "https://www.courtlistener.com/docket/12006291/203/freeman-berrell-v-berge-gerald/",
          "recap_pdf_url": null,
          "pacer_doc_id": null,
          "description": "CTRM. MIN. JURY SELECTION AND FIRST DAY JURY TRIAL. (Entered: 11/30/2004)"
        },
        {
          "row_number": 117,
          "id": 9512313,
          "entry_number": "204",
          "date_filed": "2004-11-30T00:00:00-05:00",
          "attachments": null,
          "url": "https://www.courtlistener.com/docket/12006291/204/freeman-berrell-v-berge-gerald/",
          "recap_pdf_url": null,
          "pacer_doc_id": null,
          "description": "CTRM. MIN. ; SECOND DAY JURY TRIAL. (Entered: 12/01/2004)"
        },
        {
          "row_number": 118,
          "id": 9512314,
          "entry_number": "205",
          "date_filed": "2004-12-01T00:00:00-05:00",
          "attachments": null,
          "url": "https://www.courtlistener.com/docket/12006291/205/freeman-berrell-v-berge-gerald/",
          "recap_pdf_url": null,
          "pacer_doc_id": null,
          "description": "CTRM. MIN. ; THIRD DAY JURY TRIAL; JURY DELIBERATES; LIABILTY FOUND; DAMAGES AWARDED; BRFG. SET ON P/I RELIEF. (Entered: 12/02/2004)"
        },
        {
          "row_number": 119,
          "id": 9512315,
          "entry_number": "206",
          "date_filed": "2004-12-01T00:00:00-05:00",
          "attachments": null,
          "url": "https://www.courtlistener.com/docket/12006291/206/freeman-berrell-v-berge-gerald/",
          "recap_pdf_url": null,
          "pacer_doc_id": null,
          "description": "JURY INSTRUCTIONS RE: LIABILITY. (Entered: 12/02/2004)"
        },
        {
          "row_number": 120,
          "id": 9512316,
          "entry_number": "207",
          "date_filed": "2004-12-01T00:00:00-05:00",
          "attachments": null,
          "url": "https://www.courtlistener.com/docket/12006291/207/freeman-berrell-v-berge-gerald/",
          "recap_pdf_url": null,
          "pacer_doc_id": null,
          "description": "SPECIAL VERDICT RE: LIABILITY. (Entered: 12/02/2004)"
        },
        {
          "row_number": 121,
          "id": 9512317,
          "entry_number": "208",
          "date_filed": "2004-12-01T00:00:00-05:00",
          "attachments": null,
          "url": "https://www.courtlistener.com/docket/12006291/208/freeman-berrell-v-berge-gerald/",
          "recap_pdf_url": null,
          "pacer_doc_id": null,
          "description": "JURY INSTRUCTIONS RE: DAMAGES. (Entered: 12/02/2004)"
        },
        {
          "row_number": 122,
          "id": 9512318,
          "entry_number": "209",
          "date_filed": "2004-12-01T00:00:00-05:00",
          "attachments": null,
          "url": "https://www.courtlistener.com/docket/12006291/209/freeman-berrell-v-berge-gerald/",
          "recap_pdf_url": null,
          "pacer_doc_id": null,
          "description": "SPECIAL VERDICT RE: DAMAGES. (Entered: 12/02/2004)"
        },
        {
          "row_number": 124,
          "id": 9512320,
          "entry_number": "210",
          "date_filed": "2004-12-03T00:00:00-05:00",
          "attachments": null,
          "url": "https://www.courtlistener.com/docket/12006291/210/freeman-berrell-v-berge-gerald/",
          "recap_pdf_url": null,
          "pacer_doc_id": null,
          "description": "PLTF. PROPOSED PERMANENT INJUNCTION ORDER. (Entered: 12/03/2004)"
        },
        {
          "row_number": 125,
          "id": 9512321,
          "entry_number": "211",
          "date_filed": "2004-12-07T00:00:00-05:00",
          "attachments": null,
          "url": "https://www.courtlistener.com/docket/12006291/211/freeman-berrell-v-berge-gerald/",
          "recap_pdf_url": null,
          "pacer_doc_id": null,
          "description": "DEFTS. OPPOSITION TO PLTF. PROPOSED PERMANENT INJUNCTION ORDER. (Entered: 12/08/2004)"
        },
        {
          "row_number": 126,
          "id": 9512322,
          "entry_number": "212",
          "date_filed": "2004-12-07T00:00:00-05:00",
          "attachments": null,
          "url": "https://www.courtlistener.com/docket/12006291/212/freeman-berrell-v-berge-gerald/",
          "recap_pdf_url": null,
          "pacer_doc_id": null,
          "description": "AFFIDAVIT OF GERALD BERGE. (Entered: 12/08/2004)"
        },
        {
          "row_number": 127,
          "id": 9512323,
          "entry_number": "213",
          "date_filed": "2004-12-13T00:00:00-05:00",
          "attachments": null,
          "url": "https://www.courtlistener.com/docket/12006291/213/freeman-berrell-v-berge-gerald/",
          "recap_pdf_url": null,
          "pacer_doc_id": null,
          "description": "BRIEF IN REPLY IN SUPPORT OF PLTF. PROPOSED PERMANENT INJUNCTION. (Entered: 12/14/2004)"
        },
        {
          "row_number": 128,
          "id": 9512324,
          "entry_number": "214",
          "date_filed": "2004-12-23T00:00:00-05:00",
          "attachments": null,
          "url": "https://www.courtlistener.com/docket/12006291/214/freeman-berrell-v-berge-gerald/",
          "recap_pdf_url": null,
          "pacer_doc_id": null,
          "description": "ORDER GRANTING PLTF. MOTION FOR PERMANENT INJUNCTION. (Entered: 12/23/2004)"
        },
        {
          "row_number": 129,
          "id": 9512325,
          "entry_number": "215",
          "date_filed": "2004-12-30T00:00:00-05:00",
          "attachments": null,
          "url": "https://www.courtlistener.com/docket/12006291/215/freeman-berrell-v-berge-gerald/",
          "recap_pdf_url": null,
          "pacer_doc_id": null,
          "description": "JUDGMENT DMSG. CERTAIN CLAIMS; AWARDING PLTF. INJ. RELIEF AND $1,250,000 AGNST. DEFTS. BERGE, HUIBREGTSE & HOMPE. CC MLD (Entered: 12/30/2004)"
        },
        {
          "row_number": 130,
          "id": 9512326,
          "entry_number": "216",
          "date_filed": "2005-01-10T00:00:00-05:00",
          "attachments": null,
          "url": "https://www.courtlistener.com/docket/12006291/216/freeman-berrell-v-berge-gerald/",
          "recap_pdf_url": null,
          "pacer_doc_id": null,
          "description": "MOTION BY DEFTS. FOR JUDGMENT AS A MATTER OF LAW, TO AMEND JUDGMENT OR FOR A NEW DAMAGES TRIAL. (Entered: 01/10/2005)"
        },
        {
          "row_number": 131,
          "id": 9512327,
          "entry_number": "217",
          "date_filed": "2005-01-12T00:00:00-05:00",
          "attachments": null,
          "url": "https://www.courtlistener.com/docket/12006291/217/freeman-berrell-v-berge-gerald/",
          "recap_pdf_url": null,
          "pacer_doc_id": null,
          "description": "ORDER SETTING BRIEFING ON DEFTS. MOTION FOR JUDGMENT AS A MATTER OF LAW, TO AMEND JUDGMENT OR FOR A NEW TRIAL. (Entered: 01/12/2005)"
        },
        {
          "row_number": 132,
          "id": 9512328,
          "entry_number": "218",
          "date_filed": "2005-01-12T00:00:00-05:00",
          "attachments": null,
          "url": "https://www.courtlistener.com/docket/12006291/218/freeman-berrell-v-berge-gerald/",
          "recap_pdf_url": null,
          "pacer_doc_id": null,
          "description": "TRANSCRIPT OF FIRST DAY JURY TRIAL (VOLUME 1-A), HELD 11/29/04. (Entered: 01/12/2005)"
        },
        {
          "row_number": 133,
          "id": 9512329,
          "entry_number": "219",
          "date_filed": "2005-01-12T00:00:00-05:00",
          "attachments": null,
          "url": "https://www.courtlistener.com/docket/12006291/219/freeman-berrell-v-berge-gerald/",
          "recap_pdf_url": null,
          "pacer_doc_id": null,
          "description": "TRANSCRIPT OF THIRD DAY JURY TRIAL (VOLUME 3), HELD 12/1/04. (Entered: 01/12/2005)"
        },
        {
          "row_number": 138,
          "id": 9512333,
          "entry_number": "223",
          "date_filed": "2005-01-18T00:00:00-05:00",
          "attachments": null,
          "url": "https://www.courtlistener.com/docket/12006291/223/freeman-berrell-v-berge-gerald/",
          "recap_pdf_url": null,
          "pacer_doc_id": null,
          "description": "AAG MCCAMBRIDGE WITHDRAWAL OF APPEARANCE FOR DEFTS; AAG HOORNSTRA WILL CONTINUE TO REPRESENT. (Entered: 01/19/2005)"
        },
        {
          "row_number": 139,
          "id": 9512334,
          "entry_number": "224",
          "date_filed": "2005-01-20T00:00:00-05:00",
          "attachments": null,
          "url": "https://www.courtlistener.com/docket/12006291/224/freeman-berrell-v-berge-gerald/",
          "recap_pdf_url": null,
          "pacer_doc_id": null,
          "description": "TRANSCRIPT OF FIRST DAY JURY TRIAL (VOLUME 1-B), HELD 11/29/04. (Entered: 01/21/2005)"
        },
        {
          "row_number": 144,
          "id": 9512339,
          "entry_number": "229",
          "date_filed": "2005-01-28T00:00:00-05:00",
          "attachments": null,
          "url": "https://www.courtlistener.com/docket/12006291/229/freeman-berrell-v-berge-gerald/",
          "recap_pdf_url": null,
          "pacer_doc_id": null,
          "description": "TRANSCRIPT OF JURY INSTRUCTIONS HELD 12/1/04. (Entered: 01/28/2005)"
        },
        {
          "row_number": 147,
          "id": 9512341,
          "entry_number": "231",
          "date_filed": "2005-02-07T00:00:00-05:00",
          "attachments": null,
          "url": "https://www.courtlistener.com/docket/12006291/231/freeman-berrell-v-berge-gerald/",
          "recap_pdf_url": null,
          "pacer_doc_id": null,
          "description": "AFFIDAVIT OF CHARLES D. HOORNSTRA. (Entered: 02/07/2005)"
        },
        {
          "row_number": 149,
          "id": 9512343,
          "entry_number": "233",
          "date_filed": "2005-02-18T00:00:00-05:00",
          "attachments": null,
          "url": "https://www.courtlistener.com/docket/12006291/233/freeman-berrell-v-berge-gerald/",
          "recap_pdf_url": null,
          "pacer_doc_id": null,
          "description": "BRIEF IN SUPPORT OF DEFTS. POST JUDGMENT MOTIONS. (Entered: 02/18/2005)"
        },
        {
          "row_number": 150,
          "id": 9512344,
          "entry_number": "234",
          "date_filed": "2005-02-23T00:00:00-05:00",
          "attachments": null,
          "url": "https://www.courtlistener.com/docket/12006291/234/freeman-berrell-v-berge-gerald/",
          "recap_pdf_url": null,
          "pacer_doc_id": null,
          "description": "BRIEF IN REPLY IN SUPPORT OF PLTF. MOTION FOR ATTY. FEES. (Entered: 02/24/2005)"
        },
        {
          "row_number": 151,
          "id": 9512345,
          "entry_number": "235",
          "date_filed": "2005-03-22T00:00:00-05:00",
          "attachments": null,
          "url": "https://www.courtlistener.com/docket/12006291/235/freeman-berrell-v-berge-gerald/",
          "recap_pdf_url": null,
          "pacer_doc_id": null,
          "description": "STIPULATION AND ORDER EXTENDING TIME FOR PLTF. TO FILE RESPONSE TO DEFTS. POST JUDGMENT MOTS. UNTIL 3/23/05.(TMO) CC MLD (Entered: 03/22/2005)"
        },
        {
          "row_number": 152,
          "id": 9512346,
          "entry_number": "236",
          "date_filed": "2005-03-23T00:00:00-05:00",
          "attachments": null,
          "url": "https://www.courtlistener.com/docket/12006291/236/freeman-berrell-v-berge-gerald/",
          "recap_pdf_url": null,
          "pacer_doc_id": null,
          "description": "BRIEF IN OPPOSITION BY PLTF. TO DEFTS. POST JUDGMENT MOTIONS. (Entered: 03/23/2005)"
        },
        {
          "row_number": 153,
          "id": 9512347,
          "entry_number": "237",
          "date_filed": "2005-03-30T00:00:00-05:00",
          "attachments": null,
          "url": "https://www.courtlistener.com/docket/12006291/237/freeman-berrell-v-berge-gerald/",
          "recap_pdf_url": null,
          "pacer_doc_id": null,
          "description": "BRIEF IN REPLY IN SUPPORT OF DEFTS. POST JUDGMENT MOTIONS. (Entered: 03/30/2005)"
        },
        {
          "row_number": 154,
          "id": 9512348,
          "entry_number": "238",
          "date_filed": "2005-04-18T00:00:00-04:00",
          "attachments": null,
          "url": "https://www.courtlistener.com/docket/12006291/238/freeman-berrell-v-berge-gerald/",
          "recap_pdf_url": null,
          "pacer_doc_id": null,
          "description": "ORDER REQUESTING PARTIES TO SUPPLEMENT POST-JUDGMENT BRIEFS; DEFTS. SUPPORT 4/29/05; PLTF. OPPO. 5/9/05; NO REPLY. (Entered: 04/18/2005)"
        },
        {
          "row_number": 157,
          "id": 9512350,
          "entry_number": "240",
          "date_filed": "2005-05-09T00:00:00-04:00",
          "attachments": null,
          "url": "https://www.courtlistener.com/docket/12006291/240/freeman-berrell-v-berge-gerald/",
          "recap_pdf_url": null,
          "pacer_doc_id": "2050418940",
          "description": "BRIEF IN OPPOSITION (SUPPLEMENTAL) BY PLTF. TO DEFTS. POST JUDGMENT MOTIONS. (Entered: 05/10/2005)"
        },
        {
          "row_number": 159,
          "id": 9512352,
          "entry_number": "242",
          "date_filed": "2005-05-17T00:00:00-04:00",
          "attachments": null,
          "url": "https://www.courtlistener.com/docket/12006291/242/freeman-berrell-v-berge-gerald/",
          "recap_pdf_url": null,
          "pacer_doc_id": "2050418942",
          "description": "ORDER GRANTING DEFTS. MOTION FOR JUDGMENT AS A MATTER OF LAW; JUDGMENT VACTED; PLTF. MOT./ATTY FEES DENIED AS MOOT. (Entered: 05/17/2005)"
        },
        {
          "row_number": 161,
          "id": 9512354,
          "entry_number": "244",
          "date_filed": "2005-05-23T00:00:00-04:00",
          "attachments": null,
          "url": "https://www.courtlistener.com/docket/12006291/244/freeman-berrell-v-berge-gerald/",
          "recap_pdf_url": null,
          "pacer_doc_id": null,
          "description": "NOTICE OF APPEAL BY PLTF. NO FEE PAID, NO DS FILED, SR SENT CC:PARTIES (05-2512) (Entered: 05/24/2005)"
        },
        {
          "row_number": 162,
          "id": 9512355,
          "entry_number": "245",
          "date_filed": "2005-05-24T00:00:00-04:00",
          "attachments": null,
          "url": "https://www.courtlistener.com/docket/12006291/245/freeman-berrell-v-berge-gerald/",
          "recap_pdf_url": null,
          "pacer_doc_id": null,
          "description": "AFFIDAVIT (PETITION) OF PLTF TO APPEAL IFP. (Entered: 05/24/2005)"
        },
        {
          "row_number": 163,
          "id": 9512356,
          "entry_number": "246",
          "date_filed": "2005-06-20T00:00:00-04:00",
          "attachments": null,
          "url": "https://www.courtlistener.com/docket/12006291/246/freeman-berrell-v-berge-gerald/",
          "recap_pdf_url": null,
          "pacer_doc_id": null,
          "description": "NOTICE OF APPEAL BY PLTF. FEE PAID, DS FILED, SR SENT CC:PARTIES (05-2820) (Entered: 06/20/2005)"
        },
        {
          "row_number": 164,
          "id": 9512357,
          "entry_number": "247",
          "date_filed": "2005-06-22T00:00:00-04:00",
          "attachments": null,
          "url": "https://www.courtlistener.com/docket/12006291/247/freeman-berrell-v-berge-gerald/",
          "recap_pdf_url": null,
          "pacer_doc_id": "2050418943",
          "description": "ORDER THAT PLTF'S APPEAL OF 5-23-05 W/BE DISREGARDED BECAUSE PLTF HAS APPTD ATTY. TRANS OF TRIAL PROD & FEES PAID BY US. (Entered: 06/22/2005)"
        },
        {
          "row_number": 256,
          "id": 9512358,
          "entry_number": null,
          "date_filed": "2005-07-01T00:00:00-04:00",
          "attachments": null,
          "url": "https://www.courtlistener.com",
          "recap_pdf_url": null,
          "pacer_doc_id": null,
          "description": "RECORD PREPARED"
        },
        {
          "row_number": 165,
          "id": 9512359,
          "entry_number": "248",
          "date_filed": "2005-08-15T00:00:00-04:00",
          "attachments": null,
          "url": "https://www.courtlistener.com/docket/12006291/248/freeman-berrell-v-berge-gerald/",
          "recap_pdf_url": null,
          "pacer_doc_id": null,
          "description": "ORDER FROM USCA DISMISSING #05-2512 AS DUPLICATIVE AND WAIVING THE APPEAL FEE FOR THIS APPEAL. (Entered: 08/15/2005)"
        },
        {
          "row_number": 258,
          "id": 9512361,
          "entry_number": null,
          "date_filed": "2005-10-03T00:00:00-04:00",
          "attachments": null,
          "url": "https://www.courtlistener.com",
          "recap_pdf_url": null,
          "pacer_doc_id": null,
          "description": "RECORD SENT"
        },
        {
          "row_number": 166,
          "id": 9512362,
          "entry_number": "249",
          "date_filed": "2006-04-17T00:00:00-04:00",
          "attachments": null,
          "url": "https://www.courtlistener.com/docket/12006291/249/freeman-berrell-v-berge-gerald/",
          "recap_pdf_url": null,
          "pacer_doc_id": null,
          "description": "JUDGMENT FROM USCA AFFIRMING DIST CRT. (05-2820) RECORD NOT RETURNED (Entered: 04/17/2006)"
        },
        {
          "row_number": 70,
          "id": 9512269,
          "entry_number": "162",
          "date_filed": "2004-08-12T00:00:00-04:00",
          "attachments": null,
          "url": "https://www.courtlistener.com/docket/12006291/162/freeman-berrell-v-berge-gerald/",
          "recap_pdf_url": null,
          "pacer_doc_id": null,
          "description": "DEPOSITION OF CHARLES W. MONTGOMERY, TAKEN 7/27/04. (Entered: 08/12/2004)"
        },
        {
          "row_number": 155,
          "id": 9512349,
          "entry_number": "239",
          "date_filed": "2005-04-29T00:00:00-04:00",
          "attachments": null,
          "url": "https://www.courtlistener.com/docket/12006291/239/freeman-berrell-v-berge-gerald/",
          "recap_pdf_url": null,
          "pacer_doc_id": null,
          "description": "BRIEF IN SUPPORT (SUPPLEMENT) OF DEFTS. POST JUDGMENT MOTIONS. (Entered: 04/29/2005)"
        },
        {
          "row_number": 257,
          "id": 9512360,
          "entry_number": null,
          "date_filed": "2005-10-03T00:00:00-04:00",
          "attachments": null,
          "url": "https://www.courtlistener.com",
          "recap_pdf_url": null,
          "pacer_doc_id": null,
          "description": "Certified and Transmitted Record on Appeal to US Court of Appeals re 246 Notice of Appeal"
        },
        {
          "row_number": 112,
          "id": 9512127,
          "entry_number": "20",
          "date_filed": "2003-04-18T00:00:00-04:00",
          "attachments": [],
          "url": "https://www.courtlistener.com/docket/12006291/20/freeman-berrell-v-berge-gerald/",
          "recap_pdf_url": null,
          "pacer_doc_id": null,
          "description": "AFFIDAVIT OF JOELY URDAN. (Entered: 04/18/2003)"
        },
        {
          "row_number": 249,
          "id": 9512104,
          "entry_number": null,
          "date_filed": "2003-01-23T00:00:00-05:00",
          "attachments": [],
          "url": "https://www.courtlistener.com",
          "recap_pdf_url": null,
          "pacer_doc_id": null,
          "description": "Jams Import Utility Entry"
        },
        {
          "row_number": 78,
          "id": 9512124,
          "entry_number": "17",
          "date_filed": "2003-04-18T00:00:00-04:00",
          "attachments": [],
          "url": "https://www.courtlistener.com/docket/12006291/17/freeman-berrell-v-berge-gerald/",
          "recap_pdf_url": null,
          "pacer_doc_id": null,
          "description": "MOTION BY DEFTS. FOR PROTECTIVE ORDER. (Entered: 04/18/2003)"
        },
        {
          "row_number": 134,
          "id": 9512129,
          "entry_number": "22",
          "date_filed": "2003-05-02T00:00:00-04:00",
          "attachments": [],
          "url": "https://www.courtlistener.com/docket/12006291/22/freeman-berrell-v-berge-gerald/",
          "recap_pdf_url": null,
          "pacer_doc_id": null,
          "description": "ORDER GRANTING DEFTS. MOTION FOR PROTECTIVE ORDER; DISCOVERY STAYED PENDING RESOLUTION OF MOTION TO DISMISS. (SLC) (Entered: 05/02/2003)"
        },
        {
          "row_number": 181,
          "id": 9512145,
          "entry_number": "38",
          "date_filed": "2003-06-30T00:00:00-04:00",
          "attachments": [],
          "url": "https://www.courtlistener.com/docket/12006291/38/freeman-berrell-v-berge-gerald/",
          "recap_pdf_url": null,
          "pacer_doc_id": null,
          "description": "ORDER DENYING PLTF. MOT. FOR CT. ORDER/INTERVENTION; CT. PROVIDING PLTF. W/COPIES OF RECORD FOR PROSECUTION OF CLMS. (Entered: 06/30/2003)"
        },
        {
          "row_number": 185,
          "id": 9512148,
          "entry_number": "41",
          "date_filed": "2003-07-28T00:00:00-04:00",
          "attachments": [],
          "url": "https://www.courtlistener.com/docket/12006291/41/freeman-berrell-v-berge-gerald/",
          "recap_pdf_url": null,
          "pacer_doc_id": null,
          "description": "ORDER DENYING PLTF. REQUEST THAT THE COURT APPOINT EXPERT WITNESSES TO TESTIFY ON HIS BEHALF. (Entered: 07/28/2003)"
        },
        {
          "row_number": 191,
          "id": 9512154,
          "entry_number": "47",
          "date_filed": "2003-08-07T00:00:00-04:00",
          "attachments": [],
          "url": "https://www.courtlistener.com/docket/12006291/47/freeman-berrell-v-berge-gerald/",
          "recap_pdf_url": null,
          "pacer_doc_id": null,
          "description": "MOTION BY PLTF. TO RECONSIDER 7/30/03 ORDER. (Entered: 08/07/2003)"
        },
        {
          "row_number": 192,
          "id": 9512155,
          "entry_number": "48",
          "date_filed": "2003-08-07T00:00:00-04:00",
          "attachments": [],
          "url": "https://www.courtlistener.com/docket/12006291/48/freeman-berrell-v-berge-gerald/",
          "recap_pdf_url": null,
          "pacer_doc_id": null,
          "description": "PLTF. DISCLOSURE OF EXPERT TESTIMONY. (Entered: 08/07/2003)"
        },
        {
          "row_number": 195,
          "id": 9512157,
          "entry_number": "50",
          "date_filed": "2003-08-07T00:00:00-04:00",
          "attachments": [],
          "url": "https://www.courtlistener.com/docket/12006291/50/freeman-berrell-v-berge-gerald/",
          "recap_pdf_url": null,
          "pacer_doc_id": null,
          "description": "AFFIDAVIT OF BERRELL FREEMAN. (Entered: 08/07/2003)"
        },
        {
          "row_number": 196,
          "id": 9512158,
          "entry_number": "51",
          "date_filed": "2003-08-11T00:00:00-04:00",
          "attachments": [],
          "url": "https://www.courtlistener.com/docket/12006291/51/freeman-berrell-v-berge-gerald/",
          "recap_pdf_url": null,
          "pacer_doc_id": null,
          "description": "MOTION BY PLTF. TO CEASE AND DESIST RETALIATION. (Entered: 08/11/2003)"
        },
        {
          "row_number": 231,
          "id": 9512190,
          "entry_number": "83",
          "date_filed": "2003-08-21T00:00:00-04:00",
          "attachments": [],
          "url": "https://www.courtlistener.com/docket/12006291/83/freeman-berrell-v-berge-gerald/",
          "recap_pdf_url": null,
          "pacer_doc_id": null,
          "description": "AFFIDAVIT OF CARLOS G. ROSA (Entered: 08/21/2003)"
        },
        {
          "row_number": 234,
          "id": 9512193,
          "entry_number": "86",
          "date_filed": "2003-08-21T00:00:00-04:00",
          "attachments": [],
          "url": "https://www.courtlistener.com/docket/12006291/86/freeman-berrell-v-berge-gerald/",
          "recap_pdf_url": null,
          "pacer_doc_id": null,
          "description": "MOTION BY PLTF. FOR APPOINTMENT OF COUNSEL. (Entered: 08/21/2003)"
        },
        {
          "row_number": 242,
          "id": 9512200,
          "entry_number": "93",
          "date_filed": "2003-08-27T00:00:00-04:00",
          "attachments": [],
          "url": "https://www.courtlistener.com/docket/12006291/93/freeman-berrell-v-berge-gerald/",
          "recap_pdf_url": null,
          "pacer_doc_id": null,
          "description": "MOTION BY PLTF. FOR MENTAL HEALTH AND MEDICAL RECORDS. (Entered: 08/27/2003)"
        },
        {
          "row_number": 245,
          "id": 9512203,
          "entry_number": "96",
          "date_filed": "2003-09-03T00:00:00-04:00",
          "attachments": [],
          "url": "https://www.courtlistener.com/docket/12006291/96/freeman-berrell-v-berge-gerald/",
          "recap_pdf_url": null,
          "pacer_doc_id": null,
          "description": "PLTF. STATEMENT TO THE COURT. (Entered: 09/03/2003)"
        },
        {
          "row_number": 247,
          "id": 9512205,
          "entry_number": "98",
          "date_filed": "2003-09-05T00:00:00-04:00",
          "attachments": null,
          "url": "https://www.courtlistener.com/docket/12006291/98/freeman-berrell-v-berge-gerald/",
          "recap_pdf_url": null,
          "pacer_doc_id": null,
          "description": "MOTION FOR SUMMARY JUDGMENT BY DEFTS. (Entered: 09/05/2003)"
        },
        {
          "row_number": 20,
          "id": 9512224,
          "entry_number": "117",
          "date_filed": "2003-10-06T00:00:00-04:00",
          "attachments": null,
          "url": "https://www.courtlistener.com/docket/12006291/117/freeman-berrell-v-berge-gerald/",
          "recap_pdf_url": null,
          "pacer_doc_id": null,
