{
  "case_id": 43329,
  "fetched_at": "2025-10-22T00:37:02.411894",
  "case_data": {
    "attorney_orgs": [
      "Legal Services/Legal Aid"
    ],
    "available_documents": [
      "Trial Court Docket",
      "Complaint (any)",
      "Monetary Relief",
      "Injunctive (or Injunctive-like) Relief",
      "Any published opinion"
    ],
    "case_defendants": [],
    "case_ongoing": "Yes",
    "case_status": "Approved",
    "case_types": [
      "Policing"
    ],
    "cause_other": "",
    "causes": [
      "42 U.S.C. § 1983"
    ],
    "class_action_granted": "Denied",
    "class_action_sought": "Yes",
    "closing_year": null,
    "constitutional_clause": [
      {
        "value": "Due Process"
      },
      {
        "value": "Equal Protection"
      }
    ],
    "content_of_injunction": [
      {
        "value": "Discrimination Prohibition"
      },
      {
        "value": "Provide antidiscrimination training"
      },
      {
        "value": "Implement complaint/dispute resolution process"
      }
    ],
    "court": "Southern District of New York",
    "custom_issues": [],
    "defendant_payment": "40000",
    "defendant_type": [
      {
        "value": "Law-enforcement"
      }
    ],
    "docket_status": "Complete as of retrieval date",
    "facility_type": [],
    "filing_date": "2017-03-27",
    "filing_year": 2017,
    "id": 43329,
    "injunction_duration": "3",
    "issues": [
      "LGBTQ+: LGBTQ+",
      "General/Misc.: Failure to supervise",
      "Discrimination Basis: Sexual orientation",
      "Discrimination Basis: Gender identity",
      "Affected Sex/Gender(s): Male",
      "General/Misc.: Failure to train",
      "Policing: False arrest",
      "General/Misc.: Bathrooms"
    ],
    "last_checked_date": "2022-07-06T00:00:00-04:00",
    "main_docket": {
      "id": 55945,
      "docket_entries": [
        {
          "row_number": 253,
          "id": 9029222,
          "entry_number": "7",
          "date_filed": "2017-03-27T00:00:00-04:00",
          "attachments": [],
          "url": "https://www.courtlistener.com/docket/4671197/7/holden-v-the-port-authority-of-new-york-and-new-jersey/",
          "recap_pdf_url": null,
          "pacer_doc_id": "127019968365",
          "description": "REQUEST FOR ISSUANCE OF SUMMONS as to John Tone, re: 1 Complaint,. Document filed by Cornell Holden, Miguel Mejia. (Lane, Thomas) (Entered: 03/27/2017)"
        },
        {
          "row_number": 1,
          "id": 9029232,
          "entry_number": "10",
          "date_filed": "2017-03-28T00:00:00-04:00",
          "attachments": [],
          "url": "https://www.courtlistener.com/docket/4671197/10/holden-v-the-port-authority-of-new-york-and-new-jersey/",
          "recap_pdf_url": null,
          "pacer_doc_id": "127019975016",
          "description": "ELECTRONIC SUMMONS ISSUED as to Michael Opromalla. (kl) (Entered: 03/28/2017)"
        },
        {
          "row_number": 45,
          "id": 9029238,
          "entry_number": "14",
          "date_filed": "2017-03-30T00:00:00-04:00",
          "attachments": [],
          "url": "https://www.courtlistener.com/docket/4671197/14/holden-v-the-port-authority-of-new-york-and-new-jersey/",
          "recap_pdf_url": null,
          "pacer_doc_id": "127019992739",
          "description": "AFFIDAVIT OF SERVICE of Summons and Complaint,. The Port Authority Police Department served on 3/29/2017, answer due 4/19/2017. Service was accepted by John Herrera, Security Supervisor. Document filed by Cornell Holden ; Miguel Mejia. (Lane, Thomas) (Entered: 03/30/2017)"
        },
        {
          "row_number": 100,
          "id": 9029244,
          "entry_number": "19",
          "date_filed": "2017-04-10T00:00:00-04:00",
          "attachments": [],
          "url": "https://www.courtlistener.com/docket/4671197/19/holden-v-the-port-authority-of-new-york-and-new-jersey/",
          "recap_pdf_url": null,
          "pacer_doc_id": "127020057527",
          "description": "NOTICE OF APPEARANCE by Thomas Robert Brophy on behalf of The Port Authority of New York and New Jersey. (Brophy, Thomas) (Entered: 04/10/2017)"
        },
        {
          "row_number": 156,
          "id": 9029247,
          "entry_number": "24",
          "date_filed": "2017-05-01T00:00:00-04:00",
          "attachments": [],
          "url": "https://www.courtlistener.com/docket/4671197/24/holden-v-the-port-authority-of-new-york-and-new-jersey/",
          "recap_pdf_url": null,
          "pacer_doc_id": "127020194119",
          "description": "LETTER MOTION for Extension of Time to File Answer addressed to Judge John G. Koeltl from Kathleen Gill Miller dated 5/1/2017. Document filed by Shaun Kehoe, Michael Opromalla, The Port Authority of New York and New Jersey, John Tone. (Attachments: # 1 Exhibit A, # 2 Exhibit B)(Miller, Kathleen) (Entered: 05/01/2017)"
        },
        {
          "row_number": 211,
          "id": 9029257,
          "entry_number": "31",
          "date_filed": "2017-06-22T00:00:00-04:00",
          "attachments": [],
          "url": "https://www.courtlistener.com/docket/4671197/31/holden-v-the-port-authority-of-new-york-and-new-jersey/",
          "recap_pdf_url": null,
          "pacer_doc_id": "127020513208",
          "description": "FILING ERROR - WRONG EVENT TYPE SELECTED FROM MENU - LETTER MOTION for Discovery NOT TO ALLOW AN EXTENSION OF TIME TO ADD PARTIES TO THE COMPLAINT addressed to Judge John G. Koeltl from Kathleen Gill Miller dated 6/22/2017. Document filed by Shaun Kehoe, Michael Opromalla, The Port Authority Police Department, The Port Authority of New York and New Jersey, John Tone.(Miller, Kathleen) Modified on 8/23/2017 (ldi). (Entered: 06/22/2017)"
        },
        {
          "row_number": 214,
          "id": 9029261,
          "entry_number": "34",
          "date_filed": "2017-07-31T00:00:00-04:00",
          "attachments": [],
          "url": "https://www.courtlistener.com/docket/4671197/34/holden-v-the-port-authority-of-new-york-and-new-jersey/",
          "recap_pdf_url": null,
          "pacer_doc_id": "127020726628",
          "description": "ORDER granting 33 Letter Motion for Extension of Time to Amend. Application Granted. So Ordered. (Amended Pleadings due by 9/8/2017.) (Signed by Judge John G. Koeltl on 7/20/17) (yv) (Entered: 07/31/2017)"
        },
        {
          "row_number": 216,
          "id": 9029264,
          "entry_number": "36",
          "date_filed": "2017-09-07T00:00:00-04:00",
          "attachments": [],
          "url": "https://www.courtlistener.com/docket/4671197/36/holden-v-the-port-authority-of-new-york-and-new-jersey/",
          "recap_pdf_url": null,
          "pacer_doc_id": "127020944255",
          "description": "SECOND LETTER MOTION for Extension of Time to Amend pleadings, addressed to Judge John G. Koeltl from Dorian Slater Thomas dated September 7, 2017. Document filed by Cornell Holden, Miguel Mejia. (Attachments: # 1 Exhibit A - Plaintiffs' First Set of Interrogatories)(Thomas, Dorian) (Entered: 09/07/2017)"
        },
        {
          "row_number": 223,
          "id": 9029268,
          "entry_number": "42",
          "date_filed": "2017-09-14T00:00:00-04:00",
          "attachments": [],
          "url": "https://www.courtlistener.com/docket/4671197/42/holden-v-the-port-authority-of-new-york-and-new-jersey/",
          "recap_pdf_url": null,
          "pacer_doc_id": "127020983514",
          "description": "ORDER REFERRING CASE TO MAGISTRATE JUDGE. Order that case be referred to the Clerk of Court for assignment to a Magistrate Judge for General Pretrial (includes scheduling, discovery, non-dispositive pretrial motions, and settlement). Referred to Magistrate Judge James C. Francis. SO ORDERED. (Signed by Judge John G. Koeltl on 9/14/17) (yv) (Entered: 09/14/2017)"
        },
        {
          "row_number": 249,
          "id": 9029305,
          "entry_number": "66",
          "date_filed": "2018-01-26T00:00:00-05:00",
          "attachments": [],
          "url": "https://www.courtlistener.com/docket/4671197/66/holden-v-the-port-authority-of-new-york-and-new-jersey/",
          "recap_pdf_url": null,
          "pacer_doc_id": "127021762863",
          "description": "LETTER MOTION to Seal Document or For The Order of January 16, 2018 be Vacated or Modified to Protect The Incomparably Serious Privacy Interests at Issue. addressed to Magistrate Judge Robert W. Lehrburger from Kathleen Gill Miller dated 1/26/2018. Document filed by The Port Authority of New York and New Jersey.(Miller, Kathleen) (Entered: 01/26/2018)"
        },
        {
          "row_number": 304,
          "id": 9029307,
          "entry_number": null,
          "date_filed": "2018-01-30T00:00:00-05:00",
          "attachments": [],
          "url": "https://www.courtlistener.com",
          "recap_pdf_url": null,
          "pacer_doc_id": null,
          "description": ">>>NOTICE REGARDING PRO HAC VICE MOTION. Regarding Document No. 72 MOTION for Daniel R. McNeely to Appear Pro Hac Vice . Filing fee $ 200.00, receipt number 0208-14639053. Motion and supporting papers to be reviewed by Clerk's Office staff.. The document has been reviewed and there are no deficiencies. (wb)"
        },
        {
          "row_number": 267,
          "id": 9029328,
          "entry_number": "82",
          "date_filed": "2018-03-28T00:00:00-04:00",
          "attachments": null,
          "url": "https://www.courtlistener.com/docket/4671197/82/holden-v-the-port-authority-of-new-york-and-new-jersey/",
          "recap_pdf_url": null,
          "pacer_doc_id": "127022136614",
          "description": "LETTER addressed to Robert W. Lehrburger from Daniel R. McNeely dated March 28, 2018 re: letter to potential plaintiffs, and consent form. Document filed by Cornell Holden, Miguel Mejia. (Attachments: # 1 Exhibit A1 - Plaintiffs' version of draft letter to potential class members, # 2 Exhibit A2 - Defendants' version of draft letter to potential class members, # 3 Exhibit B - Consent form, # 4 Exhibit C - Stipulation)(McNeely, Daniel) (Entered: 03/28/2018)"
        },
        {
          "row_number": 312,
          "id": 9029330,
          "entry_number": null,
          "date_filed": "2018-03-29T00:00:00-04:00",
          "attachments": null,
          "url": "https://www.courtlistener.com",
          "recap_pdf_url": null,
          "pacer_doc_id": null,
          "description": "Order"
        },
        {
          "row_number": 285,
          "id": 9029349,
          "entry_number": "99",
          "date_filed": "2018-10-12T00:00:00-04:00",
          "attachments": null,
          "url": "https://www.courtlistener.com/docket/4671197/99/holden-v-the-port-authority-of-new-york-and-new-jersey/",
          "recap_pdf_url": null,
          "pacer_doc_id": "127023393505",
          "description": "LETTER MOTION for Leave to File motion to amend the First Amended Complaint, with request for pre-motion conference, addressed to Judge John G. Koeltl from Thomas Patrick Lane dated October 12, 2018. Document filed by Cornell Holden, Miguel Mejia.(Lane, Thomas) (Entered: 10/12/2018)"
        },
        {
          "row_number": 8,
          "id": 9029357,
          "entry_number": "106",
          "date_filed": "2018-10-26T00:00:00-04:00",
          "attachments": null,
          "url": "https://www.courtlistener.com/docket/4671197/106/holden-v-the-port-authority-of-new-york-and-new-jersey/",
          "recap_pdf_url": null,
          "pacer_doc_id": "127023490331",
          "description": "LETTER RESPONSE to Motion addressed to Magistrate Judge Robert W. Lehrburger from Kathleen Gill MIller dated 10/26/2018 re: 104 LETTER MOTION for Local Rule 37.2 Conference regarding resolution of discovery dispute addressed to Magistrate Judge Robert W. Lehrburger from Daniel R. McNeely dated October 25, 2018. . Document filed by Richard Alymer, Michael DeMartino, Jordan Esposito, Shaun Kehoe, Michael Opromalla, The Port Authority of New York and New Jersey, John Tone. (Attachments: # 1 Exhibit A, # 2 Exhibit B, # 3 Exhibit C)(Miller, Kathleen) (Entered: 10/26/2018)"
        },
        {
          "row_number": 11,
          "id": 9029361,
          "entry_number": "109",
          "date_filed": "2018-11-02T00:00:00-04:00",
          "attachments": null,
          "url": "https://www.courtlistener.com/docket/4671197/109/holden-v-the-port-authority-of-new-york-and-new-jersey/",
          "recap_pdf_url": null,
          "pacer_doc_id": "127023539307",
          "description": "ORDER granting 104 Letter Motion for Local Rule 37.2 Conference; granting 105 Letter Motion for Leave to File Document. On November 2, 2018, the Court held a conference regarding discovery disputes and Plaintiffs' motion to amend. For the reasons stated at the conference, the Court orders the following: 1. All fact discovery shall be completed by January 15, 2019. 2. Expert reports shall be due by February 15, 2019. 3. All expert discovery shall be completed by March 31, 2019. 4. Defendants shall conduct a reasonable inquiry into whether they can produce Plaintiffs' requested discovery of arrest statistics from 2014-2017 in native format, shall confer with Plaintiffs about the result and next steps. 5. Defendants shall produce what they have in response to Plaintiffs' requested discovery of arrest statistics from 2011-2013. 6. Plaintiffs' motion to amend is granted subject to a review of the second amended complaint by the Court. As discussed, Plaintiffs' amendments shall be limited to: substituting the John Doe defendants; adding both new plaintiffs and defendants; amending the proposed class definition; and adding detail to the existing claims. Plaintiffs' counsel is directed to file a proposed second amended complaint by November 16, 2018. 7. Defendants may depose the two plaintiffs to be added to the action. Plaintiffs may depose two of the additional defendants, and may make an application based on good cause if additional depositions are needed beyond those. (Signed by Magistrate Judge Robert W. Lehrburger on 4/21/2018) Copies Sent By Chambers. (mml) (Entered: 11/02/2018)"
        },
        {
          "row_number": 20,
          "id": 9029369,
          "entry_number": "117",
          "date_filed": "2018-11-28T00:00:00-05:00",
          "attachments": null,
          "url": "https://www.courtlistener.com/docket/4671197/117/holden-v-the-port-authority-of-new-york-and-new-jersey/",
          "recap_pdf_url": "https://www.courtlistener.com/recap/gov.uscourts.nysd.471526/gov.uscourts.nysd.471526.117.0.pdf",
          "pacer_doc_id": "127023687339",
          "description": "SECOND AMENDED COMPLAINT amending 43 Amended Complaint,, against Richard Alymer, Michael DeMartino, Jordan Esposito, Shaun Kehoe, Michael Opromalla, The Port Authority Police Department, The Port Authority of New York and New Jersey, John Tone, Mark Montero, Vijay Seetaram, Martin Jaycard, Melvin Cruz, Paul Miller, Paul O'Dell, John Fitzpatrick, Officers John Doe 1-93 with JURY DEMAND.Document filed by Miguel Mejia, Cornell Holden, Malcom Russell, Marcos Polonia. Related document: 43 Amended Complaint,,. (Attachments: # 1 Exhibit A - 10/7/2014 NY Times article, # 2 Exhibit B - Martinez v. Port Authority decision, # 3 Exhibit C - 10/10/2014 letter, # 4 Exhibit D - Notice of Claim)(Lane, Thomas) (Entered: 11/28/2018)"
        },
        {
          "row_number": 50,
          "id": 9029398,
          "entry_number": "144",
          "date_filed": "2018-12-18T00:00:00-05:00",
          "attachments": null,
          "url": "https://www.courtlistener.com/docket/4671197/144/holden-v-the-port-authority-of-new-york-and-new-jersey/",
          "recap_pdf_url": null,
          "pacer_doc_id": "127023820723",
          "description": "ANSWER to 117 Amended Complaint,, with JURY DEMAND. Document filed by Richard Alymer, Michael DeMartino, Jordan Esposito, Shaun Kehoe, Paul Miller, Michael Opromalla, The Port Authority Police Department, The Port Authority of New York and New Jersey, John Tone.(Miller, Kathleen) (Entered: 12/18/2018)"
        },
        {
          "row_number": 55,
          "id": 9029400,
          "entry_number": "149",
          "date_filed": "2018-12-21T00:00:00-05:00",
          "attachments": null,
          "url": "https://www.courtlistener.com/docket/4671197/149/holden-v-the-port-authority-of-new-york-and-new-jersey/",
          "recap_pdf_url": null,
          "pacer_doc_id": null,
          "description": "ORDER: Pursuant to the December 21, 2018 telephone call, the parties are ordered to meet and confer to resolve the issues identified during the conference, to the extent these issues have not already been resolved. (Signed by Magistrate Judge Robert W. Lehrburger on 12/21/2018) (Lehrburger, Robert) (Entered: 12/21/2018)"
        },
        {
          "row_number": 320,
          "id": 9029402,
          "entry_number": null,
          "date_filed": "2018-12-21T00:00:00-05:00",
          "attachments": null,
          "url": "https://www.courtlistener.com",
          "recap_pdf_url": null,
          "pacer_doc_id": null,
          "description": "Order"
        },
        {
          "row_number": 52,
          "id": 9029406,
          "entry_number": "146",
          "date_filed": "2018-12-21T00:00:00-05:00",
          "attachments": null,
          "url": "https://www.courtlistener.com/docket/4671197/146/holden-v-the-port-authority-of-new-york-and-new-jersey/",
          "recap_pdf_url": null,
          "pacer_doc_id": null,
          "description": "SCHEDULING ORDER: Telephone Conference set for 12/21/2018 at 3:00 PM before Magistrate Judge Robert W. Lehrburger. Parties shall jointly call the chambers conference line at (212) 805-0113. (Signed by Magistrate Judge Robert W. Lehrburger on 12/20/2018) (rsh) (Entered: 12/21/2018)"
        },
        {
          "row_number": 57,
          "id": 9029407,
          "entry_number": "150",
          "date_filed": "2018-12-22T00:00:00-05:00",
          "attachments": null,
          "url": "https://www.courtlistener.com/docket/4671197/150/holden-v-the-port-authority-of-new-york-and-new-jersey/",
          "recap_pdf_url": null,
          "pacer_doc_id": "127023853818",
          "description": "FIRST LETTER MOTION for Extension of Time to File Answer addressed to Magistrate Judge Robert W. Lehrburger from Barry M. Goldstein dated December 22, 2018. Document filed by John Fitzpatrick. (Attachments: # 1 Text of Proposed Order)(Goldstein, Barry) (Entered: 12/22/2018)"
        },
        {
          "row_number": 60,
          "id": 9029411,
          "entry_number": "153",
          "date_filed": "2019-01-11T00:00:00-05:00",
          "attachments": null,
          "url": "https://www.courtlistener.com/docket/4671197/153/holden-v-the-port-authority-of-new-york-and-new-jersey/",
          "recap_pdf_url": null,
          "pacer_doc_id": "127023952916",
          "description": "LETTER addressed to Magistrate Judge Robert W. Lehrburger from Kathleen Gill Miller, Esq. dated January 11, 2019 re: Plaintiff's January 10, 2019 Letter [Doc. 152]. Document filed by Richard Alymer, Melvin Cruz, Michael DeMartino, Jordan Esposito, Martin Jaycard, Shaun Kehoe, Paul Miller, Mark Montero, Paul O'Dell, Michael Opromalla, Vijay Seetaram, The Port Authority Police Department, The Port Authority of New York and New Jersey, John Tone.(Miller, Kathleen) (Entered: 01/11/2019)"
        },
        {
          "row_number": 73,
          "id": 9029426,
          "entry_number": "165",
          "date_filed": "2019-06-14T00:00:00-04:00",
          "attachments": null,
          "url": "https://www.courtlistener.com/docket/4671197/165/holden-v-the-port-authority-of-new-york-and-new-jersey/",
          "recap_pdf_url": "https://www.courtlistener.com/recap/gov.uscourts.nysd.471526/gov.uscourts.nysd.471526.165.0.pdf",
          "pacer_doc_id": "127024940270",
          "description": "MOTION to Certify Class . Document filed by Cornell Holden, Miguel Mejia, Marcos Polonia, Malcom Russell.(Lane, Thomas) (Entered: 06/14/2019)"
        },
        {
          "row_number": 109,
          "id": 9029464,
          "entry_number": "198",
          "date_filed": "2020-02-26T00:00:00-05:00",
          "attachments": null,
          "url": "https://www.courtlistener.com/docket/4671197/198/holden-v-the-port-authority-of-new-york-and-new-jersey/",
          "recap_pdf_url": "https://www.courtlistener.com/recap/gov.uscourts.nysd.471526/gov.uscourts.nysd.471526.198.0.pdf",
          "pacer_doc_id": "127026461316",
          "description": "ORDER denying 165 Motion to Certify Class; denying without prejudice to renewal by formal motion 176 Motion to Preclude. For the reasons stated at the conference held on February 26, 2020, the plaintiffs' motion for class certification is denied and motion in limine to exclude portions of the defendant's expert report is denied without prejudice to renewal. The Clerk is directed to close Docket Nos. 165 and 176. The plaintiffs and defendants may file motions in limine by March 11, 2020. Responses to the motions are due by March 25, 2020 and replies are due by April 3, 2020. Pre-motion letters for any dispositive motions are due March 11, 2020 and responses are due March 25, 2020. The deadline to file any dispositive motions is April 17, 2020. Responses to dispositive motions are due May 15, 2020 and replies are due June 5, 2020. This matter is referred to the Magistrate Judge Lehrburger for purposes of settlement. SO ORDERED.. (Signed by Judge John G. Koeltl on 2/26/2020) (va) (Entered: 02/26/2020)"
        },
        {
          "row_number": 121,
          "id": 9029471,
          "entry_number": "208",
          "date_filed": "2020-03-11T00:00:00-04:00",
          "attachments": null,
          "url": "https://www.courtlistener.com/docket/4671197/208/holden-v-the-port-authority-of-new-york-and-new-jersey/",
          "recap_pdf_url": "https://www.courtlistener.com/recap/gov.uscourts.nysd.471526/gov.uscourts.nysd.471526.208.0_1.pdf",
          "pacer_doc_id": "127026555680",
          "description": "MOTION for Reconsideration re; 198 Order on Motion to Certify Class, Order on Motion to Preclude,,,,,,,, (Notice of Motion for Partial Reconsideration). Document filed by Cornell Holden, Miguel Mejia..(Lane, Thomas) (Entered: 03/11/2020)"
        },
        {
          "row_number": 129,
          "id": 9029487,
          "entry_number": "215",
          "date_filed": "2020-04-09T00:00:00-04:00",
          "attachments": null,
          "url": "https://www.courtlistener.com/docket/4671197/215/holden-v-the-port-authority-of-new-york-and-new-jersey/",
          "recap_pdf_url": "https://www.courtlistener.com/recap/gov.uscourts.nysd.471526/gov.uscourts.nysd.471526.215.0.pdf",
          "pacer_doc_id": "127026710548",
          "description": "ORDER: As discussed during the April 9, 2020 pre-settlement conference call, the current settlement conference date is adjourned to a time after the Court resolves the motion for reconsideration concerning individual injunctive relief, which is set to be fully briefed by May 1, 2020. Within seven days of entry of the decision on that motion, the parties shall contact the chambers of the undersigned to schedule a settlement conference if the Court has not already reached out to do so. (Signed by Magistrate Judge Robert W. Lehrburger on 4/9/2020) (rro) (Entered: 04/10/2020)"
        },
        {
          "row_number": 138,
          "id": 9029497,
          "entry_number": "223",
          "date_filed": "2020-05-01T00:00:00-04:00",
          "attachments": null,
          "url": "https://www.courtlistener.com/docket/4671197/223/holden-v-the-port-authority-of-new-york-and-new-jersey/",
          "recap_pdf_url": "https://www.courtlistener.com/recap/gov.uscourts.nysd.471526/gov.uscourts.nysd.471526.223.0.pdf",
          "pacer_doc_id": "127026822483",
          "description": "REPLY MEMORANDUM OF LAW in Support re: 208 MOTION for Reconsideration re; 198 Order on Motion to Certify Class, Order on Motion to Preclude,,,,,,,, (Notice of Motion for Partial Reconsideration). . Document filed by Cornell Holden, Miguel Mejia. (Attachments: # 1 Tone Deposition Excerpt).(Lane, Thomas) (Entered: 05/01/2020)"
        },
        {
          "row_number": 144,
          "id": 9029498,
          "entry_number": "229",
          "date_filed": "2020-05-29T00:00:00-04:00",
          "attachments": null,
          "url": "https://www.courtlistener.com/docket/4671197/229/holden-v-the-port-authority-of-new-york-and-new-jersey/",
          "recap_pdf_url": "https://www.courtlistener.com/recap/gov.uscourts.nysd.471526/gov.uscourts.nysd.471526.229.0.pdf",
          "pacer_doc_id": "127026966574",
          "description": "MEMORANDUM OF LAW in Support re: 226 MOTION for Summary Judgment . . Document filed by Richard Alymer, Michael DeMartino, Jordan Esposito, John Fitzpatrick, Shaun Kehoe, Paul Miller, Paul O'Dell, Michael Opromalla, The Port Authority Police Department, The Port Authority of New York and New Jersey, John Tone..(Miller, Kathleen) (Entered: 05/29/2020)"
        },
        {
          "row_number": 350,
          "id": 9029554,
          "entry_number": null,
          "date_filed": "2021-09-23T00:00:00-04:00",
          "attachments": null,
          "url": "https://www.courtlistener.com",
          "recap_pdf_url": null,
          "pacer_doc_id": null,
          "description": "Settlement Conference"
        },
        {
          "row_number": 206,
          "id": 10168271,
          "entry_number": "285",
          "date_filed": "2024-05-07T00:00:00-04:00",
          "attachments": null,
          "url": "https://www.courtlistener.com/docket/4671197/285/holden-v-the-port-authority-of-new-york-and-new-jersey/",
          "recap_pdf_url": null,
          "pacer_doc_id": "127035426253",
          "description": "Sealed Document Attorney Notice to Retrieve"
        },
        {
          "row_number": 218,
          "id": 9029266,
          "entry_number": "38",
          "date_filed": "2017-09-08T00:00:00-04:00",
          "attachments": [],
          "url": "https://www.courtlistener.com/docket/4671197/38/holden-v-the-port-authority-of-new-york-and-new-jersey/",
          "recap_pdf_url": null,
          "pacer_doc_id": "127020952570",
          "description": "LETTER addressed to Judge John G. Koeltl from Dorian Slater Thomas dated September 8, 2017 re: proposed order to unseal case files of potential class members. Document filed by Cornell Holden, Miguel Mejia. (Attachments: # 1 Proposed Unsealing Order)(Thomas, Dorian) (Entered: 09/08/2017)"
        },
        {
          "row_number": 288,
          "id": 9029236,
          "entry_number": null,
          "date_filed": "2017-03-28T00:00:00-04:00",
          "attachments": [],
          "url": "https://www.courtlistener.com",
          "recap_pdf_url": null,
          "pacer_doc_id": null,
          "description": "Magistrate Judge James C. Francis IV is so designated. (kl)"
        },
        {
          "row_number": 290,
          "id": 9029253,
          "entry_number": null,
          "date_filed": "2017-06-19T00:00:00-04:00",
          "attachments": [],
          "url": "https://www.courtlistener.com",
          "recap_pdf_url": null,
          "pacer_doc_id": null,
          "description": "Minute Entry for proceedings held before Judge John G. Koeltl: Scheduling Conference held on 6/19/2017. (Fletcher, Donnie)"
        },
        {
          "row_number": 287,
          "id": 9029235,
          "entry_number": null,
          "date_filed": "2017-03-28T00:00:00-04:00",
          "attachments": [],
          "url": "https://www.courtlistener.com",
          "recap_pdf_url": null,
          "pacer_doc_id": null,
          "description": "Case Designated ECF. (kl)"
        },
        {
          "row_number": 242,
          "id": 9029223,
          "entry_number": "6",
          "date_filed": "2017-03-27T00:00:00-04:00",
          "attachments": [],
          "url": "https://www.courtlistener.com/docket/4671197/6/holden-v-the-port-authority-of-new-york-and-new-jersey/",
          "recap_pdf_url": null,
          "pacer_doc_id": "127019968357",
          "description": "REQUEST FOR ISSUANCE OF SUMMONS as to Shaun Kehoe, re: 1 Complaint,. Document filed by Cornell Holden, Miguel Mejia. (Lane, Thomas) (Entered: 03/27/2017)"
        },
        {
          "row_number": 231,
          "id": 9029224,
          "entry_number": "5",
          "date_filed": "2017-03-27T00:00:00-04:00",
          "attachments": [],
          "url": "https://www.courtlistener.com/docket/4671197/5/holden-v-the-port-authority-of-new-york-and-new-jersey/",
          "recap_pdf_url": null,
          "pacer_doc_id": "127019968326",
          "description": "REQUEST FOR ISSUANCE OF SUMMONS as to Michael Opromalla, re: 1 Complaint,. Document filed by Cornell Holden, Miguel Mejia. (Lane, Thomas) (Entered: 03/27/2017)"
        },
        {
          "row_number": 220,
          "id": 9029225,
          "entry_number": "4",
          "date_filed": "2017-03-27T00:00:00-04:00",
          "attachments": [],
          "url": "https://www.courtlistener.com/docket/4671197/4/holden-v-the-port-authority-of-new-york-and-new-jersey/",
          "recap_pdf_url": null,
          "pacer_doc_id": "127019968287",
          "description": "REQUEST FOR ISSUANCE OF SUMMONS as to The Port Authority Police Department, re: 1 Complaint,. Document filed by Cornell Holden, Miguel Mejia. (Lane, Thomas) (Entered: 03/27/2017)"
        },
        {
          "row_number": 209,
          "id": 9029226,
          "entry_number": "3",
          "date_filed": "2017-03-27T00:00:00-04:00",
          "attachments": [],
          "url": "https://www.courtlistener.com/docket/4671197/3/holden-v-the-port-authority-of-new-york-and-new-jersey/",
          "recap_pdf_url": null,
          "pacer_doc_id": "127019968264",
          "description": "REQUEST FOR ISSUANCE OF SUMMONS as to The Port Authority of New York and New Jersey, re: 1 Complaint,. Document filed by Cornell Holden, Miguel Mejia. (Lane, Thomas) (Entered: 03/27/2017)"
        },
        {
          "row_number": 23,
          "id": 9029229,
          "entry_number": "12",
          "date_filed": "2017-03-28T00:00:00-04:00",
          "attachments": [],
          "url": "https://www.courtlistener.com/docket/4671197/12/holden-v-the-port-authority-of-new-york-and-new-jersey/",
          "recap_pdf_url": null,
          "pacer_doc_id": "127019975069",
          "description": "ELECTRONIC SUMMONS ISSUED as to John Tone. (kl) (Entered: 03/28/2017)"
        },
        {
          "row_number": 286,
          "id": 9029230,
          "entry_number": null,
          "date_filed": "2017-03-28T00:00:00-04:00",
          "attachments": [],
          "url": "https://www.courtlistener.com",
          "recap_pdf_url": null,
          "pacer_doc_id": null,
          "description": "Case Opening Initial Assignment Notice"
        },
        {
          "row_number": 12,
          "id": 9029231,
          "entry_number": "11",
          "date_filed": "2017-03-28T00:00:00-04:00",
          "attachments": [],
          "url": "https://www.courtlistener.com/docket/4671197/11/holden-v-the-port-authority-of-new-york-and-new-jersey/",
          "recap_pdf_url": null,
          "pacer_doc_id": "127019975045",
          "description": "ELECTRONIC SUMMONS ISSUED as to Shaun Kehoe. (kl) (Entered: 03/28/2017)"
        },
        {
          "row_number": 275,
          "id": 9029233,
          "entry_number": "9",
          "date_filed": "2017-03-28T00:00:00-04:00",
          "attachments": [],
          "url": "https://www.courtlistener.com/docket/4671197/9/holden-v-the-port-authority-of-new-york-and-new-jersey/",
          "recap_pdf_url": null,
          "pacer_doc_id": "127019974992",
          "description": "ELECTRONIC SUMMONS ISSUED as to The Port Authority Police Department. (kl) (Entered: 03/28/2017)"
        },
        {
          "row_number": 264,
          "id": 9029234,
          "entry_number": "8",
          "date_filed": "2017-03-28T00:00:00-04:00",
          "attachments": [],
          "url": "https://www.courtlistener.com/docket/4671197/8/holden-v-the-port-authority-of-new-york-and-new-jersey/",
          "recap_pdf_url": null,
          "pacer_doc_id": "127019974927",
          "description": "ELECTRONIC SUMMONS ISSUED as to The Port Authority of New York and New Jersey. (kl) (Entered: 03/28/2017)"
        },
        {
          "row_number": 289,
          "id": 9029237,
          "entry_number": null,
          "date_filed": "2017-03-28T00:00:00-04:00",
          "attachments": [],
          "url": "https://www.courtlistener.com",
          "recap_pdf_url": null,
          "pacer_doc_id": null,
          "description": "CASE OPENING INITIAL ASSIGNMENT NOTICE: The above-entitled action is assigned to Judge John G. Koeltl. Please download and review the Individual Practices of the assigned District Judge, located at http://nysd.uscourts.gov/judges/District. Attorneys are responsible for providing courtesy copies to judges where their Individual Practices require such. Please download and review the ECF Rules and Instructions, located at http://nysd.uscourts.gov/ecf_filing.php. (kl)"
        },
        {
          "row_number": 34,
          "id": 9029239,
          "entry_number": "13",
          "date_filed": "2017-03-30T00:00:00-04:00",
          "attachments": [],
          "url": "https://www.courtlistener.com/docket/4671197/13/holden-v-the-port-authority-of-new-york-and-new-jersey/",
          "recap_pdf_url": null,
          "pacer_doc_id": "127019992717",
          "description": "AFFIDAVIT OF SERVICE of Summons and Complaint,. The Port Authority of New York and New Jersey served on 3/29/2017, answer due 4/19/2017. Service was accepted by John Herrera, Security Supervisor. Document filed by Cornell Holden ; Miguel Mejia. (Lane, Thomas) (Entered: 03/30/2017)"
        },
        {
          "row_number": 56,
          "id": 9029240,
          "entry_number": "15",
          "date_filed": "2017-03-31T00:00:00-04:00",
          "attachments": [],
          "url": "https://www.courtlistener.com/docket/4671197/15/holden-v-the-port-authority-of-new-york-and-new-jersey/",
          "recap_pdf_url": null,
          "pacer_doc_id": "127020006524",
          "description": "AFFIDAVIT OF SERVICE of Summons and Complaint,. Shaun Kehoe served on 3/30/2017, answer due 4/20/2017. Service was accepted by Mrs. Kehoe. Document filed by Cornell Holden ; Miguel Mejia. (Lane, Thomas) (Entered: 03/31/2017)"
        },
        {
          "row_number": 67,
          "id": 9029241,
          "entry_number": "16",
          "date_filed": "2017-04-04T00:00:00-04:00",
          "attachments": [],
          "url": "https://www.courtlistener.com/docket/4671197/16/holden-v-the-port-authority-of-new-york-and-new-jersey/",
          "recap_pdf_url": null,
          "pacer_doc_id": "127020020307",
          "description": "AFFIDAVIT OF SERVICE of Summons and Complaint,. Michael Opromalla served on 3/31/2017, answer due 4/21/2017. Service was accepted by Mrs. Opromalla. Document filed by Cornell Holden ; Miguel Mejia. (Lane, Thomas) (Entered: 04/04/2017)"
        },
        {
          "row_number": 78,
          "id": 9029242,
          "entry_number": "17",
          "date_filed": "2017-04-06T00:00:00-04:00",
          "attachments": [],
          "url": "https://www.courtlistener.com/docket/4671197/17/holden-v-the-port-authority-of-new-york-and-new-jersey/",
          "recap_pdf_url": null,
          "pacer_doc_id": "127020038474",
          "description": "NOTICE OF COURT CONFERENCE: You are directed to appear for a pretrial conference, to be held on Tuesday, May 2, 2017, in Courtroom 12B, at 4:30pm in front of the Honorable John G. Koeltl. All requests for adjournments must be made in writing to the Court. For any further information, please contact the Court at (212) 805-0107. (Pretrial Conference set for 5/2/2017 at 04:30 PM in Courtroom 12B, 500 Pearl Street, New York, NY 10007 before Judge John G. Koeltl.) (ras) (Entered: 04/06/2017)"
        },
        {
          "row_number": 89,
          "id": 9029243,
          "entry_number": "18",
          "date_filed": "2017-04-07T00:00:00-04:00",
          "attachments": [],
          "url": "https://www.courtlistener.com/docket/4671197/18/holden-v-the-port-authority-of-new-york-and-new-jersey/",
          "recap_pdf_url": null,
          "pacer_doc_id": "127020046976",
          "description": "NOTICE OF APPEARANCE by Kathleen Gill Miller on behalf of The Port Authority of New York and New Jersey. (Miller, Kathleen) (Entered: 04/07/2017)"
        },
        {
          "row_number": 123,
          "id": 9029245,
          "entry_number": "21",
          "date_filed": "2017-04-11T00:00:00-04:00",
          "attachments": [],
          "url": "https://www.courtlistener.com/docket/4671197/21/holden-v-the-port-authority-of-new-york-and-new-jersey/",
          "recap_pdf_url": null,
          "pacer_doc_id": "127020062999",
          "description": "AFFIDAVIT OF SERVICE of Summons and Complaint,. John Tone served on 4/1/2017, answer due 4/24/2017. Service was accepted by Andrea Tone. Document filed by Cornell Holden ; Miguel Mejia. (Lane, Thomas) (Entered: 04/11/2017)"
        },
        {
          "row_number": 112,
          "id": 9029246,
          "entry_number": "20",
          "date_filed": "2017-04-11T00:00:00-04:00",
          "attachments": [],
          "url": "https://www.courtlistener.com/docket/4671197/20/holden-v-the-port-authority-of-new-york-and-new-jersey/",
          "recap_pdf_url": null,
          "pacer_doc_id": "127020061434",
          "description": "NOTICE OF APPEARANCE by Cynthia Helen Conti-Cook on behalf of Cornell Holden, Miguel Mejia. (Conti-Cook, Cynthia) (Entered: 04/11/2017)"
        },
        {
          "row_number": 145,
          "id": 9029248,
          "entry_number": "23",
          "date_filed": "2017-05-01T00:00:00-04:00",
          "attachments": [],
          "url": "https://www.courtlistener.com/docket/4671197/23/holden-v-the-port-authority-of-new-york-and-new-jersey/",
          "recap_pdf_url": null,
          "pacer_doc_id": "127020193927",
          "description": "ORDER: granting 22 Letter Motion to Adjourn Conference. ADJOURNED TO WEDNESDAY, JUNE 14, 2017, at 4:30 PM. SO ORDERED. Pretrial Conference set for 6/14/2017 at 04:30 PM before Judge John G. Koeltl. (Signed by Judge John G. Koeltl on 5/1/2017) (ap) (Entered: 05/01/2017)"
        },
        {
          "row_number": 134,
          "id": 9029249,
          "entry_number": "22",
          "date_filed": "2017-05-01T00:00:00-04:00",
          "attachments": [],
          "url": "https://www.courtlistener.com/docket/4671197/22/holden-v-the-port-authority-of-new-york-and-new-jersey/",
          "recap_pdf_url": null,
          "pacer_doc_id": "127020192546",
          "description": "LETTER MOTION to Adjourn Conference re: pretrial conference scheduled for May 2, 2017, addressed to Judge John G. Koeltl from Thomas Patrick Lane dated 5/1/2017. Document filed by Cornell Holden, Miguel Mejia.(Lane, Thomas) (Entered: 05/01/2017)"
        },
        {
          "row_number": 167,
          "id": 9029250,
          "entry_number": "25",
          "date_filed": "2017-05-03T00:00:00-04:00",
          "attachments": [],
          "url": "https://www.courtlistener.com/docket/4671197/25/holden-v-the-port-authority-of-new-york-and-new-jersey/",
          "recap_pdf_url": null,
          "pacer_doc_id": "127020209427",
          "description": "ORDER: granting 24 Letter Motion for Extension of Time to Answer. Time to move or answer extended to 5/19/17. So ordered. Shaun Kehoe answer due 5/19/2017; Michael Opromalla answer due 5/19/2017; The Port Authority Police Department answer due 5/19/2017; The Port Authority of New York and New Jersey answer due 5/19/2017; John Tone answer due 5/19/2017. (Signed by Judge John G. Koeltl on 5/2/2017) (ap) (Entered: 05/03/2017)"
        },
        {
          "row_number": 178,
          "id": 9029251,
          "entry_number": "26",
          "date_filed": "2017-05-19T00:00:00-04:00",
          "attachments": [],
          "url": "https://www.courtlistener.com/docket/4671197/26/holden-v-the-port-authority-of-new-york-and-new-jersey/",
          "recap_pdf_url": "https://www.courtlistener.com/recap/gov.uscourts.nysd.471526/gov.uscourts.nysd.471526.26.0.pdf",
          "pacer_doc_id": "127020311541",
          "description": "ANSWER to 1 Complaint, with JURY DEMAND. Document filed by Shaun Kehoe, Michael Opromalla, The Port Authority Police Department, The Port Authority of New York and New Jersey, John Tone.(Miller, Kathleen) (Entered: 05/19/2017)"
        },
        {
          "row_number": 189,
          "id": 9029252,
          "entry_number": "27",
          "date_filed": "2017-06-14T00:00:00-04:00",
          "attachments": [],
          "url": "https://www.courtlistener.com/docket/4671197/27/holden-v-the-port-authority-of-new-york-and-new-jersey/",
          "recap_pdf_url": null,
          "pacer_doc_id": "127020457287",
          "description": "RULE 26(f) DISCOVERY PLAN REPORT.Document filed by Cornell Holden, Miguel Mejia.(Lane, Thomas) (Entered: 06/14/2017)"
        },
        {
          "row_number": 208,
          "id": 9029254,
          "entry_number": "29",
          "date_filed": "2017-06-19T00:00:00-04:00",
          "attachments": [],
          "url": "https://www.courtlistener.com/docket/4671197/29/holden-v-the-port-authority-of-new-york-and-new-jersey/",
          "recap_pdf_url": null,
          "pacer_doc_id": "127020484989",
          "description": "NOTICE OF APPEARANCE by Ross Mitchell Kramer on behalf of Cornell Holden, Miguel Mejia. (Kramer, Ross) (Entered: 06/19/2017)"
        },
        {
          "row_number": 200,
          "id": 9029255,
          "entry_number": "28",
          "date_filed": "2017-06-19T00:00:00-04:00",
          "attachments": [],
          "url": "https://www.courtlistener.com/docket/4671197/28/holden-v-the-port-authority-of-new-york-and-new-jersey/",
          "recap_pdf_url": null,
          "pacer_doc_id": "127020483399",
          "description": "NOTICE OF APPEARANCE by Dorian Slater Thomas on behalf of Cornell Holden, Miguel Mejia. (Thomas, Dorian) (Entered: 06/19/2017)"
        },
        {
          "row_number": 291,
          "id": 9029258,
          "entry_number": null,
          "date_filed": "2017-06-23T00:00:00-04:00",
          "attachments": [],
          "url": "https://www.courtlistener.com",
          "recap_pdf_url": null,
          "pacer_doc_id": null,
          "description": "Set/Reset Deadlines: Joinder of Parties due by 7/14/2017. (ama)"
        },
        {
          "row_number": 212,
          "id": 9029259,
          "entry_number": "32",
          "date_filed": "2017-06-23T00:00:00-04:00",
          "attachments": [],
          "url": "https://www.courtlistener.com/docket/4671197/32/holden-v-the-port-authority-of-new-york-and-new-jersey/",
          "recap_pdf_url": null,
          "pacer_doc_id": "127020520314",
          "description": "ORDER: denying 31 Letter Motion for Discovery. 1.Common Courtesy should have produced an agreement to extend by one week the date to add additional parties. July 14, 2017 is a reasonable date and is so ordered. 2. The parties should agree on a date for initial disclosures or the Court will impose one. 3. The Court expects a stipulated scheduling order by the close of the day today, June 23, 2017. SO ORDERED. (Signed by Judge John G. Koeltl on 6/23/2017) (ama) (Entered: 06/23/2017)"
        },
        {
          "row_number": 213,
          "id": 9029260,
          "entry_number": "33",
          "date_filed": "2017-07-28T00:00:00-04:00",
          "attachments": [],
          "url": "https://www.courtlistener.com/docket/4671197/33/holden-v-the-port-authority-of-new-york-and-new-jersey/",
          "recap_pdf_url": null,
          "pacer_doc_id": "127020720638",
          "description": "LETTER MOTION for Extension of Time to Amend, as to deadline to amend pleadings, in regard to Civil Scheduling Order (dkt. entry #30), addressed to Judge John G. Koeltl from Dorian Slater Thomas dated 7/28/2017. Document filed by Cornell Holden, Miguel Mejia.(Thomas, Dorian) (Entered: 07/28/2017)"
        },
        {
          "row_number": 292,
          "id": 9029262,
          "entry_number": null,
          "date_filed": "2017-08-03T00:00:00-04:00",
          "attachments": [],
          "url": "https://www.courtlistener.com",
          "recap_pdf_url": null,
          "pacer_doc_id": null,
          "description": "Minute Entry for proceedings held before Judge John G. Koeltl: Status Conference held on 8/3/2017. (Fletcher, Donnie)"
        },
        {
          "row_number": 215,
          "id": 9029263,
          "entry_number": "35",
          "date_filed": "2017-09-05T00:00:00-04:00",
          "attachments": [],
          "url": "https://www.courtlistener.com/docket/4671197/35/holden-v-the-port-authority-of-new-york-and-new-jersey/",
          "recap_pdf_url": null,
          "pacer_doc_id": "127020923751",
          "description": "LETTER addressed to Judge John G. Koeltl from Dorian Slater Thomas dated September 5, 2017 re: Representation of Jeffrey Reed. Document filed by Cornell Holden, Miguel Mejia.(Thomas, Dorian) (Entered: 09/05/2017)"
        },
        {
          "row_number": 219,
          "id": 9029265,
          "entry_number": "39",
          "date_filed": "2017-09-08T00:00:00-04:00",
          "attachments": [],
          "url": "https://www.courtlistener.com/docket/4671197/39/holden-v-the-port-authority-of-new-york-and-new-jersey/",
          "recap_pdf_url": null,
          "pacer_doc_id": "127020952591",
          "description": "ORDER granting 36 Letter Motion for Extension of Time to Amend. APPLICATION GRANTED. SO ORDERED. (Amended Pleadings due by 10/6/2017.) (Signed by Judge John G. Koeltl on 9/8/2017) (anc) (Entered: 09/08/2017)"
        },
        {
          "row_number": 217,
          "id": 9029267,
          "entry_number": "37",
          "date_filed": "2017-09-08T00:00:00-04:00",
          "attachments": [],
          "url": "https://www.courtlistener.com/docket/4671197/37/holden-v-the-port-authority-of-new-york-and-new-jersey/",
          "recap_pdf_url": null,
          "pacer_doc_id": "127020951044",
          "description": "LETTER RESPONSE to Motion addressed to Judge John G. Koeltl from Kathleen Gill MIller dated 9/8/2017 re: 36 SECOND LETTER MOTION for Extension of Time to Amend pleadings, addressed to Judge John G. Koeltl from Dorian Slater Thomas dated September 7, 2017. . Document filed by Shaun Kehoe, Michael Opromalla, The Port Authority of New York and New Jersey, John Tone. (Miller, Kathleen) (Entered: 09/08/2017)"
        },
        {
          "row_number": 293,
          "id": 9029269,
          "entry_number": null,
          "date_filed": "2017-09-14T00:00:00-04:00",
          "attachments": [],
          "url": "https://www.courtlistener.com",
          "recap_pdf_url": null,
          "pacer_doc_id": null,
          "description": "Transmission to Sealed Records Clerk"
        },
        {
          "row_number": 294,
          "id": 9029270,
          "entry_number": null,
          "date_filed": "2017-09-14T00:00:00-04:00",
          "attachments": [],
          "url": "https://www.courtlistener.com",
          "recap_pdf_url": null,
          "pacer_doc_id": null,
          "description": "Transmission to Sealed Records Clerk. Transmitted re: 41 Order, to the Sealed Records Clerk for the sealing or unsealing of document or case. (yv)"
        },
        {
          "row_number": 222,
          "id": 9029271,
          "entry_number": "41",
          "date_filed": "2017-09-14T00:00:00-04:00",
          "attachments": [],
          "url": "https://www.courtlistener.com/docket/4671197/41/holden-v-the-port-authority-of-new-york-and-new-jersey/",
          "recap_pdf_url": null,
          "pacer_doc_id": "127020982853",
          "description": "UNSEALING ORDER. IT IS HEREBY ORDERED THAT the Port Authority of New York and New Jersey, the Port Authority of New York and New Jersey Police Department, the Manhattan District Attorney's Office, and the New York State Office of Court Administration shall not be bound by the statutory sealing requirements of CPL§§ 160.50 and 160.55, as it relates to the sealed records of potential members of the alleged class as defined in the Civil Complaint filed in the above captioned matter, for the years 2014 through the present, including those individuals arrested by the Port Authority Police Department at the Port Authority Bus Terminal under N.Y.P.L. §§ 245.00 and 245.01, from 2014 to the present; IT IS FURTHER ORDERED that the aforementioned records shall be disclosed to Kathleen Gill Miller, Counsel for the Port Authority of New York and New Jersey, or her authorized representative; IT IS FURTHER ORDERED that defendants may redact the name and other identifying information concerning the arrestee but are on notice that production of the name and other identifying information may be required to be produced at a later date; and IT IS FURTHER ORDERED that defendants shall produce redacted copies of the aforementioned records to plaintiffs; IT IS FURTHER ORDERED that the aforementioned records shall be deemed confidential and used only for the purposes of this litigation and in accordance with the forthcoming confidentiality agreement. (Signed by Judge John G. Koeltl on 9/14/17) (yv) (Entered: 09/14/2017)"
        },
        {
          "row_number": 221,
          "id": 9029272,
          "entry_number": "40",
          "date_filed": "2017-09-14T00:00:00-04:00",
          "attachments": [],
          "url": "https://www.courtlistener.com/docket/4671197/40/holden-v-the-port-authority-of-new-york-and-new-jersey/",
          "recap_pdf_url": null,
          "pacer_doc_id": "127020981459",
          "description": "LETTER addressed to Judge John G. Koeltl from Thomas R. Brophy, Esq. dated September 14, 2017 re: Opposition to Plaintiff's Proposed Unsealing Order [Docket #38]. Document filed by Shaun Kehoe, Michael Opromalla, The Port Authority of New York and New Jersey, John Tone.(Brophy, Thomas) (Entered: 09/14/2017)"
        },
        {
          "row_number": 227,
          "id": 9029273,
          "entry_number": "46",
          "date_filed": "2017-10-06T00:00:00-04:00",
          "attachments": [],
          "url": "https://www.courtlistener.com/docket/4671197/46/holden-v-the-port-authority-of-new-york-and-new-jersey/",
          "recap_pdf_url": null,
          "pacer_doc_id": "127021127670",
          "description": "REQUEST FOR ISSUANCE OF SUMMONS as to Richard Alymer, re: 43 Amended Complaint,,. Document filed by Cornell Holden, Miguel Mejia. (Lane, Thomas) (Entered: 10/06/2017)"
        },
        {
          "row_number": 226,
          "id": 9029274,
          "entry_number": "45",
          "date_filed": "2017-10-06T00:00:00-04:00",
          "attachments": [],
          "url": "https://www.courtlistener.com/docket/4671197/45/holden-v-the-port-authority-of-new-york-and-new-jersey/",
          "recap_pdf_url": null,
          "pacer_doc_id": "127021127638",
          "description": "REQUEST FOR ISSUANCE OF SUMMONS as to Michael DeMartino, re: 43 Amended Complaint,,. Document filed by Cornell Holden, Miguel Mejia. (Lane, Thomas) (Entered: 10/06/2017)"
        },
        {
          "row_number": 225,
          "id": 9029275,
          "entry_number": "44",
          "date_filed": "2017-10-06T00:00:00-04:00",
          "attachments": [],
          "url": "https://www.courtlistener.com/docket/4671197/44/holden-v-the-port-authority-of-new-york-and-new-jersey/",
          "recap_pdf_url": null,
          "pacer_doc_id": "127021127603",
          "description": "REQUEST FOR ISSUANCE OF SUMMONS as to Jordan Esposito, re: 43 Amended Complaint,,. Document filed by Cornell Holden, Miguel Mejia. (Lane, Thomas) (Entered: 10/06/2017)"
        },
        {
          "row_number": 230,
          "id": 9029277,
          "entry_number": "49",
          "date_filed": "2017-10-10T00:00:00-04:00",
          "attachments": [],
          "url": "https://www.courtlistener.com/docket/4671197/49/holden-v-the-port-authority-of-new-york-and-new-jersey/",
          "recap_pdf_url": null,
          "pacer_doc_id": "127021142514",
          "description": "ELECTRONIC SUMMONS ISSUED as to Jordan Esposito. (pc) (Entered: 10/10/2017)"
        },
        {
          "row_number": 229,
          "id": 9029278,
          "entry_number": "48",
          "date_filed": "2017-10-10T00:00:00-04:00",
          "attachments": [],
          "url": "https://www.courtlistener.com/docket/4671197/48/holden-v-the-port-authority-of-new-york-and-new-jersey/",
          "recap_pdf_url": null,
          "pacer_doc_id": "127021142511",
          "description": "ELECTRONIC SUMMONS ISSUED as to Richard Alymer. (pc) (Entered: 10/10/2017)"
        },
        {
          "row_number": 228,
          "id": 9029279,
          "entry_number": "47",
          "date_filed": "2017-10-10T00:00:00-04:00",
          "attachments": [],
          "url": "https://www.courtlistener.com/docket/4671197/47/holden-v-the-port-authority-of-new-york-and-new-jersey/",
          "recap_pdf_url": null,
          "pacer_doc_id": "127021142508",
          "description": "ELECTRONIC SUMMONS ISSUED as to Michael DeMartino. (pc) (Entered: 10/10/2017)"
        },
        {
          "row_number": 295,
          "id": 9029281,
          "entry_number": null,
          "date_filed": "2017-10-30T00:00:00-04:00",
          "attachments": [],
          "url": "https://www.courtlistener.com",
          "recap_pdf_url": null,
          "pacer_doc_id": null,
          "description": "NOTICE OF REASSIGNMENT OF A REFERRAL TO ANOTHER MAGISTRATE JUDGE. The referral in the above entitled action has been reassigned to Magistrate Judge Robert W. Lehrburger, for General Pretrial (includes scheduling, discovery, non-dispositive pretrial motions, and settlement). Magistrate Judge James C. Francis no longer referred to the case. (tro) Modified on 11/7/2017 (kw)."
        },
        {
          "row_number": 296,
          "id": 9029282,
          "entry_number": null,
          "date_filed": "2017-10-30T00:00:00-04:00",
          "attachments": [],
          "url": "https://www.courtlistener.com",
          "recap_pdf_url": null,
          "pacer_doc_id": null,
          "description": "Notice of Reassignment of Referral to Magistrate Judge"
        },
        {
          "row_number": 297,
          "id": 9029283,
          "entry_number": null,
          "date_filed": "2017-10-30T00:00:00-04:00",
          "attachments": [],
          "url": "https://www.courtlistener.com",
          "recap_pdf_url": null,
          "pacer_doc_id": null,
          "description": "Notice of Redesignation to Magistrate Judge"
        },
        {
          "row_number": 298,
          "id": 9029284,
          "entry_number": null,
          "date_filed": "2017-10-30T00:00:00-04:00",
          "attachments": [],
          "url": "https://www.courtlistener.com",
          "recap_pdf_url": null,
          "pacer_doc_id": null,
          "description": "NOTICE OF REDESIGNATION TO ANOTHER MAGISTRATE JUDGE. The above entitled action has been redesignated to Magistrate Judge Robert W. Lehrburger. Please note that this is a reassignment of the designation only. (tro)"
        },
        {
          "row_number": 233,
          "id": 9029285,
          "entry_number": "51",
          "date_filed": "2017-11-01T00:00:00-04:00",
          "attachments": [],
          "url": "https://www.courtlistener.com/docket/4671197/51/holden-v-the-port-authority-of-new-york-and-new-jersey/",
          "recap_pdf_url": null,
          "pacer_doc_id": "127021275178",
          "description": "NOTICE OF APPEARANCE by Kimberly Forte on behalf of Cornell Holden, Miguel Mejia. (Forte, Kimberly) (Entered: 11/01/2017)"
        },
        {
          "row_number": 235,
          "id": 9029287,
          "entry_number": "53",
          "date_filed": "2017-11-07T00:00:00-05:00",
          "attachments": [],
          "url": "https://www.courtlistener.com/docket/4671197/53/holden-v-the-port-authority-of-new-york-and-new-jersey/",
          "recap_pdf_url": null,
          "pacer_doc_id": "127021312724",
          "description": "LETTER addressed to Robert W. Lehrburger from Kathleen Gill MIller dated 11/7/2017 re: The Proposed Confidentiality Agreement. Document filed by Shaun Kehoe, Michael Opromalla, The Port Authority of New York and New Jersey, John Tone.(Miller, Kathleen) (Entered: 11/07/2017)"
        },
        {
          "row_number": 299,
          "id": 9029289,
          "entry_number": null,
          "date_filed": "2017-11-08T00:00:00-05:00",
          "attachments": [],
          "url": "https://www.courtlistener.com",
          "recap_pdf_url": null,
          "pacer_doc_id": null,
          "description": "Order on Motion for Local Rule 37.2 Conference"
        },
        {
          "row_number": 237,
          "id": 9029290,
          "entry_number": "55",
          "date_filed": "2017-11-14T00:00:00-05:00",
          "attachments": [],
          "url": "https://www.courtlistener.com/docket/4671197/55/holden-v-the-port-authority-of-new-york-and-new-jersey/",
          "recap_pdf_url": null,
          "pacer_doc_id": "127021353157",
          "description": "ANSWER to 43 Amended Complaint,, with JURY DEMAND. Document filed by Jordan Esposito.(Miller, Kathleen) (Entered: 11/14/2017)"
        },
        {
          "row_number": 238,
          "id": 9029291,
          "entry_number": "56",
          "date_filed": "2017-11-28T00:00:00-05:00",
          "attachments": [],
          "url": "https://www.courtlistener.com/docket/4671197/56/holden-v-the-port-authority-of-new-york-and-new-jersey/",
          "recap_pdf_url": null,
          "pacer_doc_id": "127021428271",
          "description": "FILING ERROR - WRONG EVENT TYPE SELECTED FROM MENU - LETTER MOTION for Local Rule 37.2 Conference addressed to Magistrate Judge Robert W. Lehrburger from Dorian Slater Thomas dated November 28, 2017. Document filed by Cornell Holden, Miguel Mejia. (Attachments: # 1 Exhibit A - Proposed revised Confidentiality Agreement, # 2 Exhibit B - November 21, 2017 letter, # 3 Exhibit C - November 21, 2017 letter response)(Thomas, Dorian) Modified on 11/29/2017 (db). (Entered: 11/28/2017)"
        },
        {
          "row_number": 239,
          "id": 9029292,
          "entry_number": "57",
          "date_filed": "2017-11-29T00:00:00-05:00",
          "attachments": [],
          "url": "https://www.courtlistener.com/docket/4671197/57/holden-v-the-port-authority-of-new-york-and-new-jersey/",
          "recap_pdf_url": null,
          "pacer_doc_id": "127021432406",
          "description": "LETTER MOTION for Local Rule 37.2 Conference addressed to Magistrate Judge Robert W. Lehrburger from Dorian Slater Thomas dated November 29, 2017. Document filed by Cornell Holden, Miguel Mejia. (Attachments: # 1 Exhibit A - Proposed revised Confidentiality Agreement, # 2 Exhibit B - November 21, 2017 letter, # 3 Exhibit C - November 21, 2017 letter response)(Thomas, Dorian) (Entered: 11/29/2017)"
        },
        {
          "row_number": 300,
          "id": 9029293,
          "entry_number": null,
          "date_filed": "2017-11-29T00:00:00-05:00",
          "attachments": [],
          "url": "https://www.courtlistener.com",
          "recap_pdf_url": null,
          "pacer_doc_id": null,
          "description": "Notice to Attorney to Re-File Document - Event Type Error"
        },
        {
          "row_number": 301,
          "id": 9029294,
          "entry_number": null,
          "date_filed": "2017-11-29T00:00:00-05:00",
          "attachments": [],
          "url": "https://www.courtlistener.com",
          "recap_pdf_url": null,
          "pacer_doc_id": null,
          "description": "***NOTICE TO ATTORNEY TO RE-FILE DOCUMENT - EVENT TYPE ERROR. Notice to Attorney Dorian Slater Thomas to RE-FILE Document 56 LETTER MOTION for Local Rule 37.2 Conference addressed to Magistrate Judge Robert W. Lehrburger from Dorian Slater Thomas dated November 28, 2017. Use the event type Discovery found under the event list Motion (Letter). (db)"
        },
        {
          "row_number": 302,
          "id": 9029296,
          "entry_number": null,
          "date_filed": "2017-11-30T00:00:00-05:00",
          "attachments": [],
          "url": "https://www.courtlistener.com",
          "recap_pdf_url": null,
          "pacer_doc_id": null,
          "description": "Order on Motion for Local Rule 37.2 Conference"
        },
        {
          "row_number": 244,
          "id": 9029299,
          "entry_number": "61",
          "date_filed": "2017-12-06T00:00:00-05:00",
          "attachments": [],
          "url": "https://www.courtlistener.com/docket/4671197/61/holden-v-the-port-authority-of-new-york-and-new-jersey/",
          "recap_pdf_url": null,
          "pacer_doc_id": "127021479409",
          "description": "LETTER MOTION for Extension of Time to File Motion for Class Certification (unopposed), addressed to Magistrate Judge Robert W. Lehrburger from Dorian Slater Thomas dated December 6, 2017. Document filed by Cornell Holden, Miguel Mejia.(Thomas, Dorian) (Entered: 12/06/2017)"
        },
        {
          "row_number": 245,
          "id": 9029300,
          "entry_number": "62",
          "date_filed": "2017-12-12T00:00:00-05:00",
          "attachments": [],
          "url": "https://www.courtlistener.com/docket/4671197/62/holden-v-the-port-authority-of-new-york-and-new-jersey/",
          "recap_pdf_url": null,
          "pacer_doc_id": null,
          "description": "ORDER granting 61 Letter Motion for Extension of Time to File Motion for Class Certification. The unopposed request to extend the time for Plaintiffs to file their Motion for Class Certification is granted. Plaintiffs shall have until March 15, 2018 to file their Motion for Class Certification. (HEREBY ORDERED by Magistrate Judge Robert W. Lehrburger)(Text Only Order) (Lehrburger, Robert) (Entered: 12/12/2017)"
        },
        {
          "row_number": 303,
          "id": 9029301,
          "entry_number": null,
          "date_filed": "2017-12-12T00:00:00-05:00",
          "attachments": [],
          "url": "https://www.courtlistener.com",
          "recap_pdf_url": null,
          "pacer_doc_id": null,
          "description": "Order on Motion for Extension of Time to File"
        },
        {
          "row_number": 246,
          "id": 9029302,
          "entry_number": "63",
          "date_filed": "2017-12-15T00:00:00-05:00",
          "attachments": [],
          "url": "https://www.courtlistener.com/docket/4671197/63/holden-v-the-port-authority-of-new-york-and-new-jersey/",
          "recap_pdf_url": null,
          "pacer_doc_id": "127021536871",
          "description": "ANSWER to 43 Amended Complaint,, with JURY DEMAND. Document filed by Richard Alymer, Michael DeMartino.(Miller, Kathleen) (Entered: 12/15/2017)"
        },
        {
          "row_number": 247,
          "id": 9029303,
          "entry_number": "64",
          "date_filed": "2018-01-12T00:00:00-05:00",
          "attachments": [],
          "url": "https://www.courtlistener.com/docket/4671197/64/holden-v-the-port-authority-of-new-york-and-new-jersey/",
          "recap_pdf_url": null,
          "pacer_doc_id": "127021679170",
          "description": "LETTER addressed to Robert W. Lehrburger from Dorian S. Thomas dated January 12, 2018 re: unsealing of arrest records of potential class members. Document filed by Cornell Holden, Miguel Mejia. (Attachments: # 1 Exhibit A - list of arrest records, # 2 Exhibit B - proposed unsealing order)(Thomas, Dorian) (Entered: 01/12/2018)"
        },
        {
          "row_number": 305,
          "id": 9029308,
          "entry_number": null,
          "date_filed": "2018-01-30T00:00:00-05:00",
          "attachments": [],
          "url": "https://www.courtlistener.com",
          "recap_pdf_url": null,
          "pacer_doc_id": null,
          "description": "Notice Regarding Pro Hac Vice Motion"
        },
        {
          "row_number": 256,
          "id": 9029309,
          "entry_number": "72",
          "date_filed": "2018-01-30T00:00:00-05:00",
          "attachments": [],
          "url": "https://www.courtlistener.com/docket/4671197/72/holden-v-the-port-authority-of-new-york-and-new-jersey/",
          "recap_pdf_url": null,
          "pacer_doc_id": "127021777470",
          "description": "MOTION for Daniel R. McNeely to Appear Pro Hac Vice . Filing fee $ 200.00, receipt number 0208-14639053. Motion and supporting papers to be reviewed by Clerk's Office staff. Document filed by Cornell Holden, Miguel Mejia. (Attachments: # 1 Declaration of Daniel R. McNeely, # 2 Exhibit A - Certificate - IL, # 3 Exhibit B - Certificate - DC, # 4 Text of Proposed Order)(McNeely, Daniel) (Entered: 01/30/2018)"
        },
        {
          "row_number": 255,
          "id": 9029310,
          "entry_number": "71",
          "date_filed": "2018-01-30T00:00:00-05:00",
          "attachments": [],
          "url": "https://www.courtlistener.com/docket/4671197/71/holden-v-the-port-authority-of-new-york-and-new-jersey/",
          "recap_pdf_url": null,
          "pacer_doc_id": "127021777363",
          "description": "DECLARATION of Thomas Patrick Lane in Support re: 70 MOTION for Dorian Slater Thomas to Withdraw as Attorney .. Document filed by Cornell Holden, Miguel Mejia. (Lane, Thomas) (Entered: 01/30/2018)"
        },
        {
          "row_number": 252,
          "id": 9029312,
          "entry_number": "69",
          "date_filed": "2018-01-30T00:00:00-05:00",
          "attachments": [],
          "url": "https://www.courtlistener.com/docket/4671197/69/holden-v-the-port-authority-of-new-york-and-new-jersey/",
          "recap_pdf_url": null,
          "pacer_doc_id": "127021777291",
          "description": "NOTICE OF APPEARANCE by Seth Eliot Spitzer on behalf of Cornell Holden, Miguel Mejia. (Spitzer, Seth) (Entered: 01/30/2018)"
        },
        {
          "row_number": 251,
          "id": 9029313,
          "entry_number": "68",
          "date_filed": "2018-01-30T00:00:00-05:00",
          "attachments": [],
          "url": "https://www.courtlistener.com/docket/4671197/68/holden-v-the-port-authority-of-new-york-and-new-jersey/",
          "recap_pdf_url": null,
          "pacer_doc_id": "127021776110",
          "description": "LETTER MOTION for Extension of Time to File Response/Reply addressed to Judge John G. Koeltl from Kathleen Gill Miller dated 1/30/2018. Document filed by Richard Alymer, Michael DeMartino, Jordan Esposito, Shaun Kehoe, Michael Opromalla, The Port Authority of New York and New Jersey, John Tone.(Miller, Kathleen) (Entered: 01/30/2018)"
        },
        {
          "row_number": 259,
          "id": 9029314,
          "entry_number": "75",
          "date_filed": "2018-01-31T00:00:00-05:00",
          "attachments": [],
          "url": "https://www.courtlistener.com/docket/4671197/75/holden-v-the-port-authority-of-new-york-and-new-jersey/",
          "recap_pdf_url": null,
          "pacer_doc_id": "127021789480",
          "description": "ORDER granting 68 Letter Motion for Extension of Time to File Response/Reply/ Application granted. So ordered. (Signed by Judge John G. Koeltl on 1/31/2018) (anc) (Entered: 01/31/2018)"
        },
        {
          "row_number": 257,
          "id": 9029316,
          "entry_number": "73",
          "date_filed": "2018-01-31T00:00:00-05:00",
          "attachments": [],
          "url": "https://www.courtlistener.com/docket/4671197/73/holden-v-the-port-authority-of-new-york-and-new-jersey/",
          "recap_pdf_url": null,
          "pacer_doc_id": "127021784488",
          "description": "ORDER FOR ADMISSION PRO HAC VICE granting 72 Motion for Daniel R. McNeely to Appear Pro Hac Vice. (Signed by Magistrate Judge Robert W. Lehrburger on 1/31/2018) (anc) (Entered: 01/31/2018)"
        },
        {
          "row_number": 260,
          "id": 9029317,
          "entry_number": "76",
          "date_filed": "2018-02-05T00:00:00-05:00",
          "attachments": [],
          "url": "https://www.courtlistener.com/docket/4671197/76/holden-v-the-port-authority-of-new-york-and-new-jersey/",
          "recap_pdf_url": null,
          "pacer_doc_id": "127021814547",
          "description": "JOINT LETTER addressed to Robert W. Lehrburger from Daniel R. McNeely and Kathleen Gill Miller dated February 5, 2018 re: joint proposal for contacting potential class members. Document filed by Cornell Holden, Miguel Mejia.(McNeely, Daniel) (Entered: 02/05/2018)"
        },
        {
          "row_number": 306,
          "id": 9029318,
          "entry_number": null,
          "date_filed": "2018-02-06T00:00:00-05:00",
          "attachments": [],
          "url": "https://www.courtlistener.com",
          "recap_pdf_url": null,
          "pacer_doc_id": null,
          "description": "NOTICE of Hearing: Telephone Conference set for 2/7/2018 at 11:00 AM before Magistrate Judge Robert W. Lehrburger. Parties shall jointly call the chambers conference line at (212) 805-0113.(rsh)"
        },
        {
          "row_number": 308,
          "id": 9029320,
          "entry_number": null,
          "date_filed": "2018-02-07T00:00:00-05:00",
          "attachments": [],
          "url": "https://www.courtlistener.com",
          "recap_pdf_url": null,
          "pacer_doc_id": null,
          "description": "ORDER: Pursuant to the telephone conference held today, the parties shall submit their proposed revised schedule by February 19, 2018. (Signed by Magistrate Judge Robert W. Lehrburger on 2/7/2018) (Lehrburger, Robert)"
        },
        {
          "row_number": 261,
          "id": 9029324,
          "entry_number": "77",
          "date_filed": "2018-02-16T00:00:00-05:00",
          "attachments": null,
          "url": "https://www.courtlistener.com/docket/4671197/77/holden-v-the-port-authority-of-new-york-and-new-jersey/",
          "recap_pdf_url": null,
          "pacer_doc_id": "127021888236",
          "description": "JOINT LETTER MOTION for Extension of Time re: fact discovery and to file motion for class certification, addressed to Magistrate Judge Robert W. Lehrburger from Daniel R. McNeely and Kathleen Gill Miller dated February 16, 2018. Document filed by Cornell Holden, Miguel Mejia. (Attachments: # 1 [Proposed] Amended Scheduling Order)(McNeely, Daniel) (Entered: 02/16/2018)"
        },
        {
          "row_number": 263,
          "id": 9029325,
          "entry_number": "79",
          "date_filed": "2018-02-20T00:00:00-05:00",
          "attachments": null,
          "url": "https://www.courtlistener.com/docket/4671197/79/holden-v-the-port-authority-of-new-york-and-new-jersey/",
          "recap_pdf_url": null,
          "pacer_doc_id": "127021903689",
          "description": "LETTER MOTION for Local Rule 37.2 Conference addressed to Magistrate Judge Robert W. Lehrburger from Daniel McNeely dated February 20, 2018. Document filed by Cornell Holden, Miguel Mejia. (Attachments: # 1 Exhibit A - Ltr. to K. Miller, Sept. 20, 2017, # 2 Exhibit B - Ltr. to D. Thomas, Nov. 21, 2017, # 3 Exhibit C - Ltr. to D. Thomas, Dec. 13, 2017, # 4 Exhibit D - Ltr. to K. Miller, Nov. 17, 2017, # 5 Exhibit E - Ltr. to K. Miller, Dec. 7, 2017, # 6 Exhibit F - Ltr. to K. Miller, Dec. 13, 2017)(McNeely, Daniel) (Entered: 02/20/2018)"
        },
        {
          "row_number": 265,
          "id": 9029326,
          "entry_number": "80",
          "date_filed": "2018-02-23T00:00:00-05:00",
          "attachments": null,
          "url": "https://www.courtlistener.com/docket/4671197/80/holden-v-the-port-authority-of-new-york-and-new-jersey/",
          "recap_pdf_url": null,
          "pacer_doc_id": "127021930812",
          "description": "LETTER RESPONSE to Motion addressed to Magistrate Judge Robert W. Lehrburger from Kathleen Gill Miller dated 2/23/2018 re: 79 LETTER MOTION for Local Rule 37.2 Conference addressed to Magistrate Judge Robert W. Lehrburger from Daniel McNeely dated February 20, 2018. . Document filed by The Port Authority of New York and New Jersey. (Miller, Kathleen) (Entered: 02/23/2018)"
        },
        {
          "row_number": 266,
          "id": 9029327,
          "entry_number": "81",
          "date_filed": "2018-02-26T00:00:00-05:00",
          "attachments": null,
          "url": "https://www.courtlistener.com/docket/4671197/81/holden-v-the-port-authority-of-new-york-and-new-jersey/",
          "recap_pdf_url": null,
          "pacer_doc_id": "127021936361",
          "description": "ORDER denying 79 Letter Motion for Local Rule 37.2 Conference. This resolves the letter motion at Dkt. 79. Plaintiffs' letter motion to compel and for sanctions regarding information from Defendants' personal cell phones is DENIED. The arrests at issue were made in 2014. This case was filed in 2017. Plaintiffs provide no basis to believe that any of the 59 officers' personal cell phones have had or would be likely to have had information relevant to the events in this case. Rather, Plaintiffs speculate that the officers may have used their cell phones in connection with official business or while off duty. Plaintiffs selectively quote from a Port Authority Operations Order that says, \"A cellular phone can be a useful alternative for conducting official business, when conveying information that would be inappropriate to transmit over a Department radio.\" But the immediately preceding sentence makes clear that cellular phones generally are not to be used, stating that \"cellular phones are not a substitute for the use of Department radios and members are required to use Department radios for communications in the field, whenever possible.\" If Plaintiffs obtain information in discovery - such as through interrogatories or deposition testimony - that Defendants actually used their personal cell phones in connection with the arrests and events in this case, then Plaintiffs may have a basis to renew their request. But at this juncture, the request for cell phone data is not proportional to the needs of the case. (Signed by Magistrate Judge Robert W. Lehrburger on 2/26/2018) (mml) (Entered: 02/26/2018)"
        },
        {
          "row_number": 311,
          "id": 9029329,
          "entry_number": null,
          "date_filed": "2018-03-29T00:00:00-04:00",
          "attachments": null,
          "url": "https://www.courtlistener.com",
          "recap_pdf_url": null,
          "pacer_doc_id": null,
          "description": "ORDER: The Court is in receipt of the Port Authority's letter filed today (Dkt. 84). The Court had understood (apparently incorrectly) Plaintiff's letter filed yesterday to be a joint letter for all parties. The Court's ruling issued earlier today concerning the content of the letter to be sent to prospective plaintiffs stands. However, that ruling is not, and should not be construed as, a recognition of whether or not the PAPD is an independently suable entity. (Signed by Magistrate Judge Robert W. Lehrburger on 3/29/2018) (Lehrburger, Robert)"
        },
        {
          "row_number": 269,
          "id": 9029331,
          "entry_number": "84",
          "date_filed": "2018-03-29T00:00:00-04:00",
          "attachments": null,
          "url": "https://www.courtlistener.com/docket/4671197/84/holden-v-the-port-authority-of-new-york-and-new-jersey/",
          "recap_pdf_url": null,
          "pacer_doc_id": "127022141687",
          "description": "LETTER addressed to Robert W. Lehrburger from Kathleen Gill Miller dated 3/29/2018 re: Reponse to Plaintiff's Letter. Document filed by The Port Authority of New York and New Jersey.(Miller, Kathleen) (Entered: 03/29/2018)"
        },
        {
          "row_number": 268,
          "id": 9029332,
          "entry_number": "83",
          "date_filed": "2018-03-29T00:00:00-04:00",
          "attachments": null,
          "url": "https://www.courtlistener.com/docket/4671197/83/holden-v-the-port-authority-of-new-york-and-new-jersey/",
          "recap_pdf_url": null,
          "pacer_doc_id": null,
          "description": "ORDER: The Court is in receipt of the parties' joint letter (Dkt. 82) concerning wording of notice to potential class members. With respect to the specific issue in dispute, the parties shall use Plaintiffs' proposed letter, with one alteration: reference to the PAPD should come after, not before, reference to the Port Authority. Additionally, the parties shall change the last four digits of the court phone number appearing at the bottom of the page (or any other place) to \"0248\". The Court looks forward to receiving the revised materials. (Signed by Magistrate Judge Robert W. Lehrburger on 3/29/2018) (Lehrburger, Robert) (Entered: 03/29/2018)"
        },
        {
          "row_number": 270,
          "id": 9029333,
          "entry_number": "85",
          "date_filed": "2018-04-02T00:00:00-04:00",
          "attachments": null,
          "url": "https://www.courtlistener.com/docket/4671197/85/holden-v-the-port-authority-of-new-york-and-new-jersey/",
          "recap_pdf_url": null,
          "pacer_doc_id": "127022163507",
          "description": "LETTER addressed to Robert W. Lehrburger from Daniel R. McNeely dated April 2, 2018 re: Procedural stipulation regarding the letter to potential plaintiffs. Document filed by Cornell Holden, Miguel Mejia. (Attachments: # 1 Stipulated Procedural Agreement for Contacting Potential Plaintiffs, # 2 Exhibit A to Stipulation - Letter to potential plaintiffs, # 3 Exhibit B to Stipulation - Consent form)(McNeely, Daniel) (Entered: 04/02/2018)"
        },
        {
          "row_number": 271,
          "id": 9029334,
          "entry_number": "86",
          "date_filed": "2018-04-03T00:00:00-04:00",
          "attachments": null,
          "url": "https://www.courtlistener.com/docket/4671197/86/holden-v-the-port-authority-of-new-york-and-new-jersey/",
          "recap_pdf_url": null,
          "pacer_doc_id": "127022170355",
          "description": "STIPULATED PROCEDURAL AGREEMENT & ORDER FOR CONTACTING POTENTIAL PLAINTIFFS: 1. Some or all of the criminal court files including arrest records for the potential class are sealed pursuant to N.Y.Crim. Procedural Law§ 160.50; 2. Plaintiffs have drafted a generally addressed letter to potential class members that Defendants have reviewed and approved. 3. The letter will be submitted to the Court for approval and is attached hereto as Exhibit A. 4. The letter will be printed on the Court's stationery and sealed m envelopes indicating it is from the Court. 5. The Port Authority will provide to the Court mailing labels with the names and addresses from all of the arrest records previously produced to Plaintiffs. The Port Authority will also provide to the Court a list of the arrest numbers and the corresponding name and address that appear on the arrest files. This list will be provided to Plaintiffs with the names and addresses redacted. 6. The letter will include an agreed-upon form letter, attached hereto as Exhibit B, allowing arrestees to provide their contact information and indicate whether they would like to be contacted by Plaintiffs' counsel and further whether they consent to releasing their sealed arrest records to Plaintiffs' counsel. 7. Plaintiffs will provide a pre-addressed and stamped envelope to be mailed with the letter for interested individuals to send to Plaintiffs' counsel if they choose within 30 days of receipt of letter. 8. The letter will be presented to the Court for mailing to the addressees. 9. Within three business days of receipt by Plaintiffs' counsel of any signed Consent Form, Plaintiffs' counsel will provide to Defendants' counsel copies of such Consent Form received from interested individuals. 10. Within three business of receiving from Plaintiffs' counsel copies of any responsive forms received from interested individuals, Defendants' counsel must advise Plaintiffs' counsel whether there is any dispute that there has been a clear waiver of the individual's rights with respect to either the permission to contact the individual or the release of that individual's unredacted arrest records. 11. If three business days have passed and Defendants have not advised Plaintiffs' counsel of any disputes with respect to the adequacy of any waiver by a specific individual, Plaintiffs' counsel may contact said individuals. 12. If, within three business days, Defendants advise Plaintiffs' counsel that they have a good faith belief that any response did not constitute a clear waiver of the arrestee's rights, this dispute will immediately be submitted to the Court by Plaintiffs' counsel for resolution. 13. If there is no dispute, or once any dispute has been resolved by the Court, and it has been determined that there has been a waiver, Plaintiffs' counsel may contact said individual and Defendants will provide Plaintiffs' counsel with an unredacted copy of that individual's arrest file. 14. Should a record not contain an address, Defendants will advise Plaintiffs and the Court. The parties will meet and confer to resolve any issues regarding arrest records without addresses or returned mail. Any unresolved issues will be presented to the Court for resolution. SO ORDERED. (Signed by Magistrate Judge Robert W. Lehrburger on 4/3/2018) (rj) (Entered: 04/03/2018)"
        },
        {
          "row_number": 272,
          "id": 9029335,
          "entry_number": "87",
          "date_filed": "2018-04-04T00:00:00-04:00",
          "attachments": null,
          "url": "https://www.courtlistener.com/docket/4671197/87/holden-v-the-port-authority-of-new-york-and-new-jersey/",
          "recap_pdf_url": null,
          "pacer_doc_id": "127022181160",
          "description": "LETTER addressed to Robert W. Lehrburger from Kathleen Gill Miller dated 4/4/2018 re: The \"so ordered\" Stipulation Of The Court. Document filed by The Port Authority of New York and New Jersey.(Miller, Kathleen) (Entered: 04/04/2018)"
        },
        {
          "row_number": 273,
          "id": 9029336,
          "entry_number": "88",
          "date_filed": "2018-05-21T00:00:00-04:00",
          "attachments": null,
          "url": "https://www.courtlistener.com/docket/4671197/88/holden-v-the-port-authority-of-new-york-and-new-jersey/",
          "recap_pdf_url": null,
          "pacer_doc_id": "127022482635",
          "description": "ORDER: The Court informs the parties that eight envelopes mailed to the arrestees were returned to the Court as undeliverable. The names and addresses of those arrestees are attached to this Order and will be filed under seal. A copy of the attachment will be provided to defense counsel via email. SO ORDERED. (Signed by Magistrate Judge Robert W. Lehrburger on 5/21/2018) Copies Sent By Chambers. (mml) (Entered: 05/21/2018)"
        },
        {
          "row_number": 274,
          "id": 9029337,
          "entry_number": "89",
          "date_filed": "2018-05-22T00:00:00-04:00",
          "attachments": null,
          "url": "https://www.courtlistener.com/docket/4671197/89/holden-v-the-port-authority-of-new-york-and-new-jersey/",
          "recap_pdf_url": null,
          "pacer_doc_id": null,
          "description": "SEALED DOCUMENT placed in vault.(mps) (Entered: 05/22/2018)"
        },
        {
          "row_number": 276,
          "id": 9029338,
          "entry_number": "90",
          "date_filed": "2018-05-23T00:00:00-04:00",
          "attachments": null,
          "url": "https://www.courtlistener.com/docket/4671197/90/holden-v-the-port-authority-of-new-york-and-new-jersey/",
          "recap_pdf_url": null,
          "pacer_doc_id": "127022502791",
          "description": "FILING ERROR - WRONG EVENT TYPE SELECTED FROM MENU - LETTER MOTION for Discovery re: May 21, 2018 Order addressed to Magistrate Judge Robert W. Lehrburger from Kathleen Gill Miller dated May 23, 2018. Document filed by Richard Alymer, Michael DeMartino, Jordan Esposito, Shaun Kehoe, Michael Opromalla, The Port Authority Police Department, The Port Authority of New York and New Jersey, John Tone.(Miller, Kathleen) Modified on 5/31/2018 (ldi). (Entered: 05/23/2018)"
        },
        {
          "row_number": 277,
          "id": 9029339,
          "entry_number": "91",
          "date_filed": "2018-05-24T00:00:00-04:00",
          "attachments": null,
          "url": "https://www.courtlistener.com/docket/4671197/91/holden-v-the-port-authority-of-new-york-and-new-jersey/",
          "recap_pdf_url": null,
          "pacer_doc_id": null,
          "description": "ORDER granting 90 Letter Motion for Discovery. Defendants' letter motion is granted. Defendants may provide Plaintiffs' counsel the identifying information so long as the information is attorneys' eyes only and counsel does not contact the individuals directly. (HEREBY ORDERED by Magistrate Judge Robert W. Lehrburger)(Text Only Order) (Lehrburger, Robert) (Entered: 05/24/2018)"
        },
        {
          "row_number": 278,
          "id": 9029340,
          "entry_number": "92",
          "date_filed": "2018-06-04T00:00:00-04:00",
          "attachments": null,
          "url": "https://www.courtlistener.com/docket/4671197/92/holden-v-the-port-authority-of-new-york-and-new-jersey/",
          "recap_pdf_url": null,
          "pacer_doc_id": "127022571681",
          "description": "LETTER addressed to Robert W. Lehrburger from Kathleen Gill Miller, Esq. dated June 4, 2018 re: Identifying Information for Five Arrestees. Document filed by Richard Alymer, Michael DeMartino, Jordan Esposito, Shaun Kehoe, Michael Opromalla, The Port Authority Police Department, The Port Authority of New York and New Jersey, John Tone.(Miller, Kathleen) (Entered: 06/04/2018)"
        },
        {
          "row_number": 282,
          "id": 9029345,
          "entry_number": "96",
          "date_filed": "2018-08-28T00:00:00-04:00",
          "attachments": null,
          "url": "https://www.courtlistener.com/docket/4671197/96/holden-v-the-port-authority-of-new-york-and-new-jersey/",
          "recap_pdf_url": null,
          "pacer_doc_id": "127023113545",
          "description": "LETTER MOTION for Extension of Time to Complete Discovery, and class certification, addressed to Magistrate Judge Robert W. Lehrburger from Daniel R. McNeely dated August 28, 2018. Document filed by Cornell Holden, Miguel Mejia. (Attachments: # 1 [Plaintiffs' Proposed] Amended Scheduling Order)(McNeely, Daniel) (Entered: 08/28/2018)"
        },
        {
          "row_number": 314,
          "id": 9029346,
          "entry_number": null,
          "date_filed": "2018-08-30T00:00:00-04:00",
          "attachments": null,
          "url": "https://www.courtlistener.com",
          "recap_pdf_url": null,
          "pacer_doc_id": null,
          "description": "Set/Reset Deadlines: Expert Discovery due by 12/21/2018. Fact Discovery due by 10/30/2018. (mml)"
        },
        {
          "row_number": 284,
          "id": 9029347,
          "entry_number": "98",
          "date_filed": "2018-08-30T00:00:00-04:00",
          "attachments": null,
          "url": "https://www.courtlistener.com/docket/4671197/98/holden-v-the-port-authority-of-new-york-and-new-jersey/",
          "recap_pdf_url": null,
          "pacer_doc_id": "127023129395",
          "description": "ORDER granting 96 Letter Motion for Extension of Time to Complete Discovery. The Court has considered the parties' submissions dated August 28 and 30, 2018, and amends this action's schedule as follows: 1. All fact discovery shall be completed by October 30, 2018. 2. Expert disclosures for issues as to which a party has the burden of proof shall be completed by November 14, 2018. Rebuttal disclosures to the opening expert disclosures are due December 13, 2018. All expert discovery shall be completed by December 21, 2018. 3. The motion for class certification, if any, shall be filed by January 14, 2019. 4. The pretrial order is due February 13, 2019, unless a dispositive motion is filed, in which case the pretrial order would be due thirty days after that motion is decided. 5. The parties shall be ready for trial on 48 hours notice 14 days after the pretrial order is filed. The estimated trial time is 8 days, and this is a jury trial. SO ORDERED. Motions due by 1/14/2019. Pretrial Order due by 2/13/2019. (Signed by Magistrate Judge Robert W. Lehrburger on 8/30/2018) Copies Sent By Chambers. (mml) (Entered: 08/30/2018)"
        },
        {
          "row_number": 283,
          "id": 9029348,
          "entry_number": "97",
          "date_filed": "2018-08-30T00:00:00-04:00",
          "attachments": null,
          "url": "https://www.courtlistener.com/docket/4671197/97/holden-v-the-port-authority-of-new-york-and-new-jersey/",
          "recap_pdf_url": null,
          "pacer_doc_id": "127023124732",
          "description": "LETTER addressed to Robert W. Lehrburger from Kathleen Gill Miller, Esq. dated August 30, 2018 re: Plaintiff's 8/28/18 Letter Motion for Extension of Time to Complete Discovery. Document filed by Richard Alymer, Michael DeMartino, Jordan Esposito, Shaun Kehoe, Michael Opromalla, The Port Authority Police Department, The Port Authority of New York and New Jersey, John Tone.(Miller, Kathleen) (Entered: 08/30/2018)"
        },
        {
          "row_number": 2,
          "id": 9029350,
          "entry_number": "100",
          "date_filed": "2018-10-15T00:00:00-04:00",
          "attachments": null,
          "url": "https://www.courtlistener.com/docket/4671197/100/holden-v-the-port-authority-of-new-york-and-new-jersey/",
          "recap_pdf_url": null,
          "pacer_doc_id": "127023402229",
          "description": "ORDER granting 99 Letter Motion for Leave to File Document. A pre-motion conference will be held on Tuesday, October 23, 2018, at 4:30pm. SO ORDERED. (Signed by Judge John G. Koeltl on 10/12/18) (yv) (Entered: 10/15/2018)"
        },
        {
          "row_number": 3,
          "id": 9029352,
          "entry_number": "101",
          "date_filed": "2018-10-22T00:00:00-04:00",
          "attachments": null,
          "url": "https://www.courtlistener.com/docket/4671197/101/holden-v-the-port-authority-of-new-york-and-new-jersey/",
          "recap_pdf_url": null,
          "pacer_doc_id": "127023449372",
          "description": "FILING ERROR - DEFICIENT DOCKET ENTRY - MOTION for Kimberly Forte to Withdraw as Attorney for Plaintiffs. Document filed by Cornell Holden, Miguel Mejia. (Attachments: # 1 Declaration)(Forte, Kimberly) Modified on 11/20/2018 (ldi). (Entered: 10/22/2018)"
        },
        {
          "row_number": 315,
          "id": 9029353,
          "entry_number": null,
          "date_filed": "2018-10-23T00:00:00-04:00",
          "attachments": null,
          "url": "https://www.courtlistener.com",
          "recap_pdf_url": null,
          "pacer_doc_id": null,
          "description": "Minute Entry for proceedings held before Judge John G. Koeltl: Pre-Motion Conference held on 10/23/2018. (Fletcher, Donnie)"
        },
        {
          "row_number": 15,
          "id": 9029365,
          "entry_number": "112",
          "date_filed": "2018-11-16T00:00:00-05:00",
          "attachments": null,
          "url": "https://www.courtlistener.com/docket/4671197/112/holden-v-the-port-authority-of-new-york-and-new-jersey/",
          "recap_pdf_url": null,
          "pacer_doc_id": "127023629116",
          "description": "LETTER addressed to Magistrate Judge Robert W. Lehrburger from Thomas Patrick Lane dated November 16, 2018 re: proposed Second Amended Class Action Complaint. Document filed by Cornell Holden, Miguel Mejia. (Attachments: # 1 Proposed Second Amended Class Action Complaint, # 2 Exhibit A to Complaint - 10/7/14 NY Times article, # 3 Exhibit B to Complaint - Martinez v. Port Authority decision, # 4 Exhibit C to Complaint - 10/10/2014 letter, # 5 Exhibit D to Complaint - Notice of Claim)(Lane, Thomas) (Entered: 11/16/2018)"
        },
        {
          "row_number": 18,
          "id": 9029367,
          "entry_number": "115",
          "date_filed": "2018-11-20T00:00:00-05:00",
          "attachments": null,
          "url": "https://www.courtlistener.com/docket/4671197/115/holden-v-the-port-authority-of-new-york-and-new-jersey/",
          "recap_pdf_url": null,
          "pacer_doc_id": "127023650131",
          "description": "LETTER addressed to Magistrate Judge Robert W. Lehrburger from Thomas Patrick Lane dated November 20, 2018 re: black-line of the proposed Second Amended Class Action Complaint. Document filed by Cornell Holden, Miguel Mejia. (Attachments: # 1 Black-line of the proposed Second Amended Class Action Complaint)(Lane, Thomas) (Entered: 11/20/2018)"
        },
        {
          "row_number": 17,
          "id": 9029368,
          "entry_number": "114",
          "date_filed": "2018-11-20T00:00:00-05:00",
          "attachments": null,
          "url": "https://www.courtlistener.com/docket/4671197/114/holden-v-the-port-authority-of-new-york-and-new-jersey/",
          "recap_pdf_url": null,
          "pacer_doc_id": null,
          "description": "ORDER: The Court is in receipt of Plaintiff's letter dated November 16, 2019 (ECF 112). A separate order will issue clarifying dates. In the meantime, no later than November 21, 2018, Plaintiff shall file a black-lined version of the proposed Second Amended Complaint showing changes from the First Amended Complaint. (Signed by Magistrate Judge Robert W. Lehrburger on 11/20/2019) (Lehrburger, Robert) (Entered: 11/20/2018)"
        },
        {
          "row_number": 19,
          "id": 9029370,
          "entry_number": "116",
          "date_filed": "2018-11-28T00:00:00-05:00",
          "attachments": null,
          "url": "https://www.courtlistener.com/docket/4671197/116/holden-v-the-port-authority-of-new-york-and-new-jersey/",
          "recap_pdf_url": null,
          "pacer_doc_id": null,
          "description": "ORDER: On November 20, 2018, and pursuant to prior rulings and proceedings, Plaintiffs submitted a proposed Second Amended Complaint (\"SAC\"). The Court has reviewed the draft and finds that it reflects the changes discussed in prior correspondence and proceedings. Defendants, while objecting to all of the amendments, have not submitted anything contending that the proposed SAC does not reflect the changes previously proposed. (To be clear, Defendants have preserved their objections to all of the amendments within the scope of those proposed changes.) Subject to correction of any typographical errors (\"punitive\" in paragraph 4 of the prayer for relief should be \"putative\"), Plaintiffs may proceed with filing the SAC. (Signed by Magistrate Judge Robert W. Lehrburger on 11/28/2018) (Lehrburger, Robert) (Entered: 11/28/2018)"
        },
        {
          "row_number": 28,
          "id": 9029371,
          "entry_number": "124",
          "date_filed": "2018-11-29T00:00:00-05:00",
          "attachments": null,
          "url": "https://www.courtlistener.com/docket/4671197/124/holden-v-the-port-authority-of-new-york-and-new-jersey/",
          "recap_pdf_url": null,
          "pacer_doc_id": "127023691865",
          "description": "REQUEST FOR ISSUANCE OF SUMMONS as to Paul O'Dell, re: 117 Amended Complaint,,. Document filed by Cornell Holden, Miguel Mejia, Marcos Polonia, Malcom Russell. (Lane, Thomas) (Entered: 11/29/2018)"
        },
        {
          "row_number": 27,
          "id": 9029372,
          "entry_number": "123",
          "date_filed": "2018-11-29T00:00:00-05:00",
          "attachments": null,
          "url": "https://www.courtlistener.com/docket/4671197/123/holden-v-the-port-authority-of-new-york-and-new-jersey/",
          "recap_pdf_url": null,
          "pacer_doc_id": "127023691852",
          "description": "REQUEST FOR ISSUANCE OF SUMMONS as to Martin Jaycard, re: 117 Amended Complaint,,. Document filed by Cornell Holden, Miguel Mejia, Marcos Polonia, Malcom Russell. (Lane, Thomas) (Entered: 11/29/2018)"
        },
        {
          "row_number": 26,
          "id": 9029373,
          "entry_number": "122",
          "date_filed": "2018-11-29T00:00:00-05:00",
          "attachments": null,
          "url": "https://www.courtlistener.com/docket/4671197/122/holden-v-the-port-authority-of-new-york-and-new-jersey/",
          "recap_pdf_url": null,
          "pacer_doc_id": "127023691847",
          "description": "REQUEST FOR ISSUANCE OF SUMMONS as to Melvin Cruz, re: 117 Amended Complaint,,. Document filed by Cornell Holden, Miguel Mejia, Marcos Polonia, Malcom Russell. (Lane, Thomas) (Entered: 11/29/2018)"
        },
        {
          "row_number": 25,
          "id": 9029374,
          "entry_number": "121",
          "date_filed": "2018-11-29T00:00:00-05:00",
          "attachments": null,
          "url": "https://www.courtlistener.com/docket/4671197/121/holden-v-the-port-authority-of-new-york-and-new-jersey/",
          "recap_pdf_url": null,
          "pacer_doc_id": "127023691840",
          "description": "REQUEST FOR ISSUANCE OF SUMMONS as to Vijay Seetaram, re: 117 Amended Complaint,,. Document filed by Cornell Holden, Miguel Mejia, Marcos Polonia, Malcom Russell. (Lane, Thomas) (Entered: 11/29/2018)"
        },
        {
          "row_number": 24,
          "id": 9029375,
          "entry_number": "120",
          "date_filed": "2018-11-29T00:00:00-05:00",
          "attachments": null,
          "url": "https://www.courtlistener.com/docket/4671197/120/holden-v-the-port-authority-of-new-york-and-new-jersey/",
          "recap_pdf_url": null,
          "pacer_doc_id": "127023691831",
          "description": "REQUEST FOR ISSUANCE OF SUMMONS as to Mark Montero, re: 117 Amended Complaint,,. Document filed by Cornell Holden, Miguel Mejia, Marcos Polonia, Malcom Russell. (Lane, Thomas) (Entered: 11/29/2018)"
        },
        {
          "row_number": 22,
          "id": 9029376,
          "entry_number": "119",
          "date_filed": "2018-11-29T00:00:00-05:00",
          "attachments": null,
          "url": "https://www.courtlistener.com/docket/4671197/119/holden-v-the-port-authority-of-new-york-and-new-jersey/",
          "recap_pdf_url": null,
          "pacer_doc_id": "127023691820",
          "description": "REQUEST FOR ISSUANCE OF SUMMONS as to John Fitzpatrick, re: 117 Amended Complaint,,. Document filed by Cornell Holden, Miguel Mejia, Marcos Polonia, Malcom Russell. (Lane, Thomas) (Entered: 11/29/2018)"
        },
        {
          "row_number": 21,
          "id": 9029377,
          "entry_number": "118",
          "date_filed": "2018-11-29T00:00:00-05:00",
          "attachments": null,
          "url": "https://www.courtlistener.com/docket/4671197/118/holden-v-the-port-authority-of-new-york-and-new-jersey/",
          "recap_pdf_url": null,
          "pacer_doc_id": "127023691812",
