{
  "case_id": 43154,
  "fetched_at": "2025-10-22T00:36:16.418435",
  "case_data": {
    "attorney_orgs": [
      "Center for Reproductive Rights"
    ],
    "available_documents": [
      "Trial Court Docket",
      "Complaint (any)",
      "Monetary Relief",
      "Injunctive (or Injunctive-like) Relief",
      "Non-settlement Outcome",
      "Any published opinion",
      "U.S. Supreme Court merits opinion"
    ],
    "case_defendants": [
      {
        "defendant_level": null,
        "institution": "",
        "institution_alt_state": null,
        "institution_city": "",
        "institution_county": null,
        "name": "Louisiana",
        "defendant_level_other": "",
        "is_active": true
      }
    ],
    "case_ongoing": "Yes",
    "case_status": "Approved",
    "case_types": [
      "Healthcare Access and Reproductive Issues"
    ],
    "cause_other": "",
    "causes": [
      "42 U.S.C. ยง 1983"
    ],
    "class_action_granted": "Not sought",
    "class_action_sought": "No",
    "closing_year": null,
    "constitutional_clause": [
      {
        "value": "Due Process"
      },
      {
        "value": "Due Process: Substantive Due Process"
      }
    ],
    "content_of_injunction": [
      {
        "value": "Preliminary relief granted"
      }
    ],
    "court": "Middle District of Louisiana",
    "custom_issues": [],
    "defendant_payment": "3,800,000",
    "defendant_type": [
      {
        "value": "Jurisdiction-wide"
      },
      {
        "value": "Hospital/Health Department"
      }
    ],
    "docket_status": "Complete as of retrieval date",
    "facility_type": [],
    "filing_date": "2014-08-22",
    "filing_year": 2014,
    "id": 43154,
    "injunction_duration": "28.5",
    "issues": [
      "Reproductive rights: Abortion",
      "Reproductive rights: Reproductive health care (including birth control, abortion, and others)",
      "Reproductive rights: Admitting privileges"
    ],
    "last_checked_date": "2022-11-21T00:00:00-05:00",
    "main_docket": {
      "id": 55607,
      "docket_entries": [
        {
          "row_number": 462,
          "id": 9012461,
          "entry_number": "6",
          "date_filed": "2014-08-22T00:00:00-04:00",
          "attachments": [],
          "url": "https://www.courtlistener.com/docket/4271273/6/june-medical-services-llc-v-caldwell/",
          "recap_pdf_url": null,
          "pacer_doc_id": null,
          "description": "Notice to Counsel: Telephone Conference set for 8/25/2014 at 10:00 AM before Judge John W. deGravelles. (This is a TEXT ENTRY ONLY. There is no hyperlink or PDF document associated with this entry.)(KDC) (Entered: 08/22/2014)"
        },
        {
          "row_number": 23,
          "id": 9012468,
          "entry_number": "12",
          "date_filed": "2014-08-25T00:00:00-04:00",
          "attachments": [],
          "url": "https://www.courtlistener.com/docket/4271273/12/june-medical-services-llc-v-caldwell/",
          "recap_pdf_url": null,
          "pacer_doc_id": "08701557509",
          "description": "Minute Entry for proceedings held before Judge John W. deGravelles: Telephone Conference held on 8/25/2014. The parties present on this call having agreed that the hearing on Wednesday should be limited to the Motion for TRO (doc. 5); IT IS ORDERED that the Motion for TRO is hereby assigned for hearing at 10:00 a.m. on Wednesday, August 27, 2014; IT IS FURTHER ORDERED that the parties have until 5:00 p.m. today, August 25, 2014, to file briefs on the issues discussed during the telephone status conference; IT IS FURTHER ORDERED that the parties make a good faith effort to reach a stipulation which would resolve the Motion for TRO.(Recorded) (KDC) (Entered: 08/25/2014)"
        },
        {
          "row_number": 78,
          "id": 9012473,
          "entry_number": "17",
          "date_filed": "2014-08-26T00:00:00-04:00",
          "attachments": [],
          "url": "https://www.courtlistener.com/docket/4271273/17/june-medical-services-llc-v-caldwell/",
          "recap_pdf_url": null,
          "pacer_doc_id": "08701558458",
          "description": "MEMORANDUM in Opposition to 5 MOTION for Temporary Restraining Order MOTION for Preliminary Injunction filed by James David Caldwell. (Freel, Angelique) (Entered: 08/26/2014)"
        },
        {
          "row_number": 256,
          "id": 9012484,
          "entry_number": "33",
          "date_filed": "2014-08-28T00:00:00-04:00",
          "attachments": [],
          "url": "https://www.courtlistener.com/docket/4271273/33/june-medical-services-llc-v-caldwell/",
          "recap_pdf_url": null,
          "pacer_doc_id": "08701560690",
          "description": "Minute Entry for proceedings held before Judge John W. deGravelles: Motion Hearing held on 8/28/2014 re 5 MOTION for Temporary Restraining Order MOTION for Preliminary Injunction filed by Bossier City Medical Suite, John Doe 1, Choice Inc. of Texas, John Doe 2, June Medical Services LLC...Counsel presented arguments....On or before 5:00 p.m. today, the secretary of the Louisiana Department of Health and Hospitals (the Department) shall file an amended declaration as set forth in Open Court...With the agreement of the parties and for oral reasons assigned, IT IS ORDERED that Jimmy Guidry, in his official capacity as Louisiana State Health Officer and Medical Director of the Louisiana Department of Health and Hospitals, is hereby DISMISSED....The Court takes the Motion to Dismiss filed by James David Caldwell ( R. Doc. 16) under advisement. A supplemental brief in support of the Motion to Dismiss shall be filed on or before 12:00 p.m. on Friday, August 29, 2014. (Court Reporter SHANNON THOMPSON.) (KDC) (Entered: 09/02/2014)"
        },
        {
          "row_number": 245,
          "id": 9012489,
          "entry_number": "32",
          "date_filed": "2014-09-02T00:00:00-04:00",
          "attachments": [],
          "url": "https://www.courtlistener.com/docket/4271273/32/june-medical-services-llc-v-caldwell/",
          "recap_pdf_url": null,
          "pacer_doc_id": "08701560678",
          "description": "NOTICE of Certificate of Service Regarding Declaration and Amended Declaration by Kathy Kliebert re 27 Notice of (other), 25 Notice of (other) (Duncan, S.) (Entered: 09/02/2014)"
        },
        {
          "row_number": 422,
          "id": 9012510,
          "entry_number": "48",
          "date_filed": "2014-10-08T00:00:00-04:00",
          "attachments": [],
          "url": "https://www.courtlistener.com/docket/4271273/48/june-medical-services-llc-v-caldwell/",
          "recap_pdf_url": null,
          "pacer_doc_id": null,
          "description": "ORDER granting 44 Motion to Enroll Additional Attorney. Added attorney J. Michael Johnson as co-counsel for Kathy Kliebert. Signed by Magistrate Judge Richard L. Bourgeois, Jr on 10/8/2014. (This is a TEXT ENTRY ONLY. There is no hyperlink or PDF document associated with this entry.) (JSL) (Entered: 10/08/2014)"
        },
        {
          "row_number": 457,
          "id": 9012517,
          "entry_number": "55",
          "date_filed": "2014-10-15T00:00:00-04:00",
          "attachments": [],
          "url": "https://www.courtlistener.com/docket/4271273/55/june-medical-services-llc-v-caldwell/",
          "recap_pdf_url": null,
          "pacer_doc_id": "08701578707",
          "description": "ORDER granting Motion for Protective Order (This motion was originally filed in 14-597 and is moved to 14-525 for case management purposes; see doc 4 in 14-597 to view image of document). Signed by Magistrate Judge Richard L. Bourgeois, Jr on 10/15/2014. (SMG) (Entered: 10/15/2014)"
        },
        {
          "row_number": 464,
          "id": 9012524,
          "entry_number": "61",
          "date_filed": "2014-11-12T00:00:00-05:00",
          "attachments": [],
          "url": "https://www.courtlistener.com/docket/4271273/61/june-medical-services-llc-v-caldwell/",
          "recap_pdf_url": null,
          "pacer_doc_id": "08701589189",
          "description": "MOTION for Janet Crepps to Appear Pro Hac Vice (Filing fee $100.00, Receipt Number 053N-1148880) by Bossier City Medical Suite, Choice Inc. of Texas, John Doe 1, John Doe 2, June Medical Services LLC. (Attachments: # 1 Attachment Declaration of Janet Crepps in Support of Motion for Admission Pro Hac Vice, # 2 Attachment Proposed Order Admitting Janet Crepps Pro Hac Vice)(Rittenberg, William) (Entered: 11/12/2014)"
        },
        {
          "row_number": 476,
          "id": 9012538,
          "entry_number": "72",
          "date_filed": "2014-12-09T00:00:00-05:00",
          "attachments": [],
          "url": "https://www.courtlistener.com/docket/4271273/72/june-medical-services-llc-v-caldwell/",
          "recap_pdf_url": null,
          "pacer_doc_id": "08701599220",
          "description": "NOTICE of No Opposition to 70 Motion for Voluntary Dismissal by Mark Henry Dawson (Wall, Ralph) Modified to edit text on 12/9/2014 (BCL). (Entered: 12/09/2014)"
        },
        {
          "row_number": 504,
          "id": 9012565,
          "entry_number": "98",
          "date_filed": "2015-03-10T00:00:00-04:00",
          "attachments": null,
          "url": "https://www.courtlistener.com/docket/4271273/98/june-medical-services-llc-v-caldwell/",
          "recap_pdf_url": null,
          "pacer_doc_id": "08701635163",
          "description": "MOTION in Limine to Preclude Evidence of DHH Deficiency Reports and Related Evidence by All Plaintiffs. (Attachments: # 1 Memorandum in Support of Plaintiff's Motion to Exclude Evidence of DHH Deficiency Reports, # 2 Proposed Pleading; Proposed Order)(Rittenberg, William) Modified to edit text on 3/11/2015 (BCL). (Entered: 03/10/2015)"
        },
        {
          "row_number": 33,
          "id": 9012590,
          "entry_number": "129",
          "date_filed": "2015-03-19T00:00:00-04:00",
          "attachments": null,
          "url": "https://www.courtlistener.com/docket/4271273/129/june-medical-services-llc-v-caldwell/",
          "recap_pdf_url": null,
          "pacer_doc_id": "08701640491",
          "description": "Minute Entry for proceedings held before Judge John W. deGravelles: Initial Pretrial Conference held on 3/19/2015. Trial procedures and previously set deadlines were discussed with the parties. Follow-up telephone conference was held on 3/20/2015. Bench Trial continued and set for 6/22/2015 - 6/29/2015 at 09:00 AM in Courtroom 1 before Judge John W. deGravelles. Oral argument on the pending motions in limine is rescheduled and will be held telephonically on 4/1/2015 at 10:00 a.m.. Per agreement at the 3/19/2015 pretrial conference, the Temporary Restraining Order remains in effect until the completion of the trial ruling on the merits. (LLH) (Entered: 03/23/2015)"
        },
        {
          "row_number": 46,
          "id": 9012609,
          "entry_number": "140",
          "date_filed": "2015-05-12T00:00:00-04:00",
          "attachments": null,
          "url": "https://www.courtlistener.com/docket/4271273/140/june-medical-services-llc-v-caldwell/",
          "recap_pdf_url": null,
          "pacer_doc_id": null,
          "description": "For the reasons given in the Court's Ruling and Order (Doc. 138) on Defendant Kathy Kliebert's Motion for Partial Summary Judgment, Plaintiff's Motion To Exclude Evidence of DHH Deficiency Reports and Related Evidence[Doc. 98] is DENIED. Signed by Judge John W. deGravelles on 05/12/2015. (This is a TEXT ENTRY ONLY. There is no hyperlink or PDF document associated with this entry.) (KDC) (Entered: 05/12/2015)"
        },
        {
          "row_number": 94,
          "id": 9012659,
          "entry_number": "184",
          "date_filed": "2015-08-20T00:00:00-04:00",
          "attachments": null,
          "url": "https://www.courtlistener.com/docket/4271273/184/june-medical-services-llc-v-caldwell/",
          "recap_pdf_url": null,
          "pacer_doc_id": "08701705882",
          "description": "SEALED TRANSCRIPT of Proceedings NOTICE RE REDACTION OF TRANSCRIPTS: The parties have five (5) business days to file with the Court a Notice of Intent to Request Redaction of this transcript. If no such Notice is filed, the transcript will be made remotely electronically available to the public without redaction after 90 calendar days. The policy is located on our website at www.lamd.uscourts.gov. Transcript may be viewed at the court public terminal or purchased through the Court Reporter/Transcriber before the deadline for Release of Transcript Restriction. After that date it may be obtained through PACER.. Release of Transcript Restriction set for 11/18/2015. (Delatte-Richard, Gina) (Entered: 08/20/2015)"
        },
        {
          "row_number": 142,
          "id": 9012709,
          "entry_number": "227",
          "date_filed": "2016-02-10T00:00:00-05:00",
          "attachments": null,
          "url": "https://www.courtlistener.com/docket/4271273/227/june-medical-services-llc-v-caldwell/",
          "recap_pdf_url": "https://www.courtlistener.com/recap/gov.uscourts.lamd.46729.227.0.pdf",
          "pacer_doc_id": "08701781411",
          "description": "JUDGMENT: Defendant Kathy H. Kliebert and her successors, as well as any and all employees, agents, entities, or other persons acting in concert with her, are preliminarily enjoined from enforcing LA. R.S. ยง 40:1299.35.2 et seq. against the following persons: Doctor John Doe 1; Doctor John Doe 2; June Medical Services, LLC, d/b/a Hope Medical Group for Women, and its physicians and staff; Bossier City Medical Suite, as well as its physicians and staff; Choice, Inc. of Texas, d/b/a Causeway Medical Clinic, and its physicians andstaff, including Doctor John Doe 4; and any and all others encompassed by the Parties' stipulations. This injunction will remain in effect until further notice from this Court or the United States Court of Appeals for the Fifth Circuit. Signed by Judge John W. deGravelles on 2/10/2016. (BCL) (Entered: 02/10/2016)"
        },
        {
          "row_number": 153,
          "id": 9012720,
          "entry_number": "237",
          "date_filed": "2016-02-18T00:00:00-05:00",
          "attachments": null,
          "url": "https://www.courtlistener.com/docket/4271273/237/june-medical-services-llc-v-caldwell/",
          "recap_pdf_url": null,
          "pacer_doc_id": "08701785693",
          "description": "SEALED ELECTRONIC EXHIBITS for hearing dated 06/22/15.. (Attachments: # 1 Exhibit Pla-135, # 2 Exhibit Def-76, # 3 Exhibit Def-78, # 4 Exhibit Def-93, # 5 Exhibit Def-97, # 6 Exhibit Def-99, # 7 Exhibit Def-104, # 8 Exhibit Def-108, # 9 Exhibit Def-122, # 10 Exhibit Def-127, # 11 Exhibit Def-141, # 12 Exhibit Def-142, # 13 Exhibit Def-143, # 14 Exhibit Def-144, # 15 Exhibit Def-145, # 16 Exhibit JX 50, Part 1, # 17 Exhibit JX 50, Part 2, # 18 Exhibit JX 50, Part 3, # 19 Exhibit JX 50, Part 4, # 20 Exhibit JX 50, Part 5, # 21 Exhibit JX 50, Part 6, # 22 Exhibit JX 50, Part 7, # 23 Exhibit JX 50, Part 8, # 24 Exhibit JX 50, Part 9, # 25 Exhibit JX 50, Part 10, # 26 Exhibit JX 50, Part 11, # 27 Exhibit JX 50, Part 12, # 28 Exhibit JX 50, Part 13, # 29 Exhibit JX 50, Part 14, # 30 Exhibit JX 50, Part 15)(TMR) (Additional attachment(s) added on 2/22/2016: # 31 Exhibit JX 51, Part 1, # 32 Exhibit JX 51, Part 2, # 33 Exhibit JX 51, Part 3, # 34 Exhibit JX 51, Part 4, # 35 Exhibit JX 51, Part 5, # 36 Exhibit JX 51, Part 6, # 37 Exhibit JX 51, Part 7, # 38 Exhibit JX 51, Part 8, # 39 Exhibit JX 51, Part 9, # 40 Exhibit JX 51, Part 10, # 41 Exhibit JX 52, Part 1, # 42 Exhibit JX 52, Part 2, # 43 Exhibit JX 52, Part 3, # 44 Exhibit JX 52, Part 4, # 47 Exhibit JX 53, Part 1, # 48 Exhibit JX 53, Part 2, # 49 Exhibit JX 53, Part 3, # 50 Exhibit JX 53, Part 4) (TMR). (Additional attachment(s) added on 2/22/2016: # 51 Exhibit JX 55, # 52 Exhibit JX 56, # 53 Exhibit JX 57, Part 1, # 54 Exhibit JX 57, Part 2, # 55 Exhibit JX 57, Part 3, # 56 Exhibit JX 57, Part 4, # 57 Exhibit JX 58, # 58 Exhibit JX 59, # 59 Exhibit JX 60, # 60 Exhibit JX 67, Part 1, # 61 Exhibit JX 67, Part 2, # 62 Exhibit JX 67, Part 3, # 63 Exhibit JX 67, Part 4, # 64 Exhibit JX 67, Part 5, # 65 Exhibit JX 67, Part 6) (TMR). (Additional attachment(s) added on 2/22/2016: # 66 Exhibit JX 68, Part 1, # 67 Exhibit JX 68, Part 2, # 68 Exhibit JX 68, Part 3, # 69 Exhibit JX 68, Part 4, # 70 Exhibit JX 68, Part 5, # 71 Exhibit JX 68, Part 6, # 72 Exhibit JX 68, Part 7, # 73 Exhibit JX 68, Part 8, # 74 Exhibit JX 68, Part 9, # 75 Exhibit JX 68, Part 10, # 76 Exhibit JX 68, Part 11, # 77 Exhibit JX 69, # 78 Exhibit JX 70, Part 1, # 79 Exhibit JX 70, Part 2, # 80 Exhibit JX 70, Part 3, # 81 Exhibit JX 70, Part 4, # 82 Exhibit JX 70, Part 5, # 83 Exhibit JX 70, Part 6, # 84 Exhibit JX 70, Part 7, # 85 Exhibit JX 70, Part 8, # 86 Exhibit JX 70, Part 9, # 87 Exhibit JX 70, Part 10) (TMR). (Additional attachment(s) added on 2/22/2016: # 88 Exhibit JX 71, # 89 Exhibit JX 75, # 90 Exhibit JX 77, # 91 Exhibit JX 78, Part 1, # 92 Exhibit JX 78, Part 2, # 93 Exhibit JX 78, Part 3, # 94 Exhibit JX 78, Part 4, # 95 Exhibit JX 78, Part 5, # 96 Exhibit JX 78, Part 6, # 97 Exhibit JX 78, Part 7, # 98 Exhibit JX 78, Part 8, # 99 Exhibit JX 89. (Additional attachment(s) added on 2/22/2016: # 100 Exhibit JX 97, Part 1, # 101 Exhibit JX 97, Part 2, # 102 Exhibit JX 97, Part 3, # 103 Exhibit JX 97, Part 4, # 104 Exhibit JX 98, # 105 Exhibit JX 100, # 106 Exhibit JX 102, # 107 Exhibit JX 103, # 108 Exhibit JX 127, # 109 Exhibit JX 128, # 110 Exhibit JX 129) (TMR). (Additional attachment(s) added on 2/22/2016: # 111 Exhibit JX 130, # 112 Exhibit JX 131, # 113 Exhibit JX 132, # 114 Exhibit JX 133, # 115 Exhibit JX 134, # 116 Exhibit JX 144, # 117 Exhibit JX 145, # 118 Exhibit JX 146, # 119 Exhibit JX 147, # 120 Exhibit JX 148, # 121 Exhibit JX 149, # 122 Exhibit JX 150, # 123 Exhibit JX 151, # 124 Exhibit JX 152, # 125 Exhibit JX 153) (TMR). (Additional attachment(s) added on 2/22/2016: # 126 Exhibit JX 154, # 127 Exhibit JX 155, # 128 Exhibit JX 156, # 129 Exhibit JX 157, # 130 Exhibit JX 158, # 131 Exhibit JX 159, # 132 Exhibit JX 160, # 133 Exhibit JX 161, # 134 Exhibit JX 162, # 135 Exhibit JX 163, # 136 Exhibit JX 164, # 137 Exhibit JX 165, # 139 Exhibit JX 167, # 140 Exhibit JX 169, # 141 Exhibit JX 170, # 142 Exhibit JX 171, # 143 Exhibit JX 172) (TMR). (Additional attachment(s) added on 2/22/2016: # 144 Exhibit JX 173, # 145 Exhibit JX 174, # 146 Exhibit JX 175, # 147 Exhibit JX 176, # 148 Exhibit JX 177, # 149 Exhibit JX 178, # 150 Exhibit JX 179, # 151 Exhibit JX 180, # 152 Exhibit JX 181, # 153 Exhibit JX 182, # 154 Exhibit JX 183, # 155 Exhibit JX 184, # 156 Exhibit JX 185, # 157 Exhibit JX 189, # 158 Exhibit JX 190) (TMR). Modified on 5/14/2021 to unseal docs as per Order #445 (LLH). (Entered: 02/18/2016)"
        },
        {
          "row_number": 154,
          "id": 9012721,
          "entry_number": "238",
          "date_filed": "2016-02-22T00:00:00-05:00",
          "attachments": null,
          "url": "https://www.courtlistener.com/docket/4271273/238/june-medical-services-llc-v-caldwell/",
          "recap_pdf_url": null,
          "pacer_doc_id": null,
          "description": "Electronic Access to the Record on Appeal is now available through the Court of Appeals CM/ECF document filing system. Instructions for accessing the record can be found at www.ca5.uscourts.gov/attorneys/attorney-forms/eroa_downloads. Request for paper exhibits in addition to the record on appeal and shipping information should be faxed to the clerks office at 225-389-3501. The clerk of court will retain the responsibility of sending the record to the 5th Circuit upon their request. (This is a TEXT ENTRY ONLY. There is no hyperlink or PDF document associated with this entry.) (TMR) (Entered: 02/22/2016)"
        },
        {
          "row_number": 161,
          "id": 9012728,
          "entry_number": "244",
          "date_filed": "2016-03-17T00:00:00-04:00",
          "attachments": null,
          "url": "https://www.courtlistener.com/docket/4271273/244/june-medical-services-llc-v-caldwell/",
          "recap_pdf_url": null,
          "pacer_doc_id": "08701800005",
          "description": "NOTICE of Receipt of sealed exhibits re 241 . (BLR) Modified to change file date on 3/21/2016 (BLR). (Entered: 03/18/2016)"
        },
        {
          "row_number": 164,
          "id": 9012731,
          "entry_number": "247",
          "date_filed": "2016-06-01T00:00:00-04:00",
          "attachments": null,
          "url": "https://www.courtlistener.com/docket/4271273/247/june-medical-services-llc-v-caldwell/",
          "recap_pdf_url": null,
          "pacer_doc_id": "08701835690",
          "description": "Supplemental STATUS REPORT of Admitting Privileges Applications by All Plaintiffs. (Rittenberg, William) (Entered: 06/01/2016)"
        },
        {
          "row_number": 168,
          "id": 9012734,
          "entry_number": "250",
          "date_filed": "2016-08-03T00:00:00-04:00",
          "attachments": null,
          "url": "https://www.courtlistener.com/docket/4271273/250/june-medical-services-llc-v-caldwell/",
          "recap_pdf_url": null,
          "pacer_doc_id": null,
          "description": "Notice to Counsel: Telephone Conference, set for 8/5/2016 at 9:00 AM before Judge John W. deGravelles. Counsel for Plaintiffs is responsible for coordinating the call to the Court. Counsel shall call the Court from a land-line, if possible, in order to eliminate any extraneous noise. (This is a TEXT ENTRY ONLY. There is no hyperlink or PDF document associated with this entry.)(KDC) (Entered: 08/03/2016)"
        },
        {
          "row_number": 169,
          "id": 9012735,
          "entry_number": "251",
          "date_filed": "2016-08-04T00:00:00-04:00",
          "attachments": null,
          "url": "https://www.courtlistener.com/docket/4271273/251/june-medical-services-llc-v-caldwell/",
          "recap_pdf_url": null,
          "pacer_doc_id": null,
          "description": "NOTICE of TELEPHONE CONFERENCE: Telephone Conference reset for 8/8/2016 at 10:30 AM before Judge John W. deGravelles. Counsel for Plaintiffs is responsible for coordinating the call to the Court. Counsel shall call the Court from a land-line, if possible, in order to eliminate any extraneous noise. (This is a TEXT ENTRY ONLY. There is no hyperlink or PDF document associated with this entry.)(KDC) (Entered: 08/04/2016)"
        },
        {
          "row_number": 537,
          "id": 9012745,
          "entry_number": null,
          "date_filed": "2016-09-22T00:00:00-04:00",
          "attachments": null,
          "url": "https://www.courtlistener.com",
          "recap_pdf_url": null,
          "pacer_doc_id": null,
          "description": "Order on Motion to Withdraw as Attorney"
        },
        {
          "row_number": 538,
          "id": 9012750,
          "entry_number": null,
          "date_filed": "2016-10-17T00:00:00-04:00",
          "attachments": null,
          "url": "https://www.courtlistener.com",
          "recap_pdf_url": null,
          "pacer_doc_id": null,
          "description": "Order on Motion for Miscellaneous Relief"
        },
        {
          "row_number": 539,
          "id": 9012754,
          "entry_number": null,
          "date_filed": "2017-03-30T00:00:00-04:00",
          "attachments": null,
          "url": "https://www.courtlistener.com",
          "recap_pdf_url": null,
          "pacer_doc_id": null,
          "description": "Order"
        },
        {
          "row_number": 215,
          "id": 9012783,
          "entry_number": "293",
          "date_filed": "2017-05-10T00:00:00-04:00",
          "attachments": null,
          "url": "https://www.courtlistener.com/docket/4271273/293/june-medical-services-llc-v-caldwell/",
          "recap_pdf_url": "https://www.courtlistener.com/recap/gov.uscourts.lamd.46729/gov.uscourts.lamd.46729.293.0.pdf",
          "pacer_doc_id": "08701988460",
          "description": "BILL OF COSTS by Bossier City Medical Suite, Choice Inc. of Texas, John Doe 1, John Doe 2, June Medical Services LLC. (Attachments: # 1 Exhibit A, # 2 Exhibit B, # 3 Exhibit C)(Brown, David) (Main Document 293 replaced on 5/12/2017) (ELW). Modified on 5/12/2017 to flatten document (ELW). (Entered: 05/10/2017)"
        },
        {
          "row_number": 249,
          "id": 9012823,
          "entry_number": "323",
          "date_filed": "2018-10-02T00:00:00-04:00",
          "attachments": null,
          "url": "https://www.courtlistener.com/docket/4271273/323/june-medical-services-llc-v-caldwell/",
          "recap_pdf_url": null,
          "pacer_doc_id": null,
          "description": "Electronic Access to the Record on Appeal is now available to Travis Tu through the Court of Appeals CM/ECF document filing system. Instructions for accessing the record can be found at www.ca5.uscourts.gov/attorneys/attorney-forms/eroa_downloads. Request for paper exhibits in addition to the record on appeal and shipping information should be faxed to the clerks office at 225-389-3501. The clerk of court will retain the responsibility of sending the record to the 5th Circuit upon their request. (This is a TEXT ENTRY ONLY. There is no hyperlink or PDF document associated with this entry.) (KAH) (Entered: 10/02/2018)"
        },
        {
          "row_number": 271,
          "id": 9012850,
          "entry_number": "343",
          "date_filed": "2020-08-31T00:00:00-04:00",
          "attachments": null,
          "url": "https://www.courtlistener.com/docket/4271273/343/june-medical-services-llc-v-caldwell/",
          "recap_pdf_url": null,
          "pacer_doc_id": null,
          "description": "ORDER: Given the Court's order granting the Joint Motion to Adjourn Plaintiffs' Application for Fees and Expenses (Doc. 340), IT IS ORDERED that the Plaintiffs' Petition for Attorney's Fees (Doc. 278) is DENIED WITHOUT PREJUDICE. Plaintiffs may refile this after the sixty day period they requested to resolve the attorney fee issue. For the same reasons, the Motion to Dismiss Plaintiffs' Motion for Attorney's Fees Without Prejudice or, in the alternative, to Reset Briefing Deadlines (Doc. 297) is denied as moot. Signed by Judge John W. deGravelles on 08/31/2020. (This is a TEXT ENTRY ONLY. There is no hyperlink or PDF document associated with this entry.) (KDC) (Entered: 08/31/2020)"
        },
        {
          "row_number": 272,
          "id": 9012855,
          "entry_number": "344",
          "date_filed": "2020-09-04T00:00:00-04:00",
          "attachments": null,
          "url": "https://www.courtlistener.com/docket/4271273/344/june-medical-services-llc-v-caldwell/",
          "recap_pdf_url": null,
          "pacer_doc_id": "08702636461",
          "description": "MOTION to Maintain Documents Under Seal by John Doe 1, John Doe 2, June Medical Services LLC. (Attachments: # 1 Memorandum in Support, # 2 Proposed Order, # 3 Exhibit A)(Samuel, Charles) Modified on 9/8/2020 to edit text (ELW). (Entered: 09/04/2020)"
        },
        {
          "row_number": 275,
          "id": 9012858,
          "entry_number": "347",
          "date_filed": "2020-09-08T00:00:00-04:00",
          "attachments": null,
          "url": "https://www.courtlistener.com/docket/4271273/347/june-medical-services-llc-v-caldwell/",
          "recap_pdf_url": null,
          "pacer_doc_id": "08702637779",
          "description": "MOTION to Clarify Protective Order Obligations or, Alternatively, to Preserve Documents by Rebekah Gee. (Attachments: # 1 Memorandum in Support, # 2 Declaration of Joseph Scott St. John, # 3 Exhibit A, # 4 Exhibit B, # 5 Exhibit C, # 6 Exhibit D, # 7 Exhibit E, # 8 Proposed Order)(Murrill, Elizabeth). Added MOTION on 9/9/2020 (KMW). Modified on 9/29/2020 (NLT). (Entered: 09/08/2020)"
        },
        {
          "row_number": 332,
          "id": 9012930,
          "entry_number": "399",
          "date_filed": "2021-02-03T00:00:00-05:00",
          "attachments": null,
          "url": "https://www.courtlistener.com/docket/4271273/399/june-medical-services-llc-v-caldwell/",
          "recap_pdf_url": null,
          "pacer_doc_id": null,
          "description": "Notice to Counsel: A Status Conference to discuss record document 398 is set for 2/5/2021 at 10:00 AM (Central Standard Time) by zoom video conferencing before Judge John W. deGravelles. A separate email with zoom information will be forwarded to counsel.Evidence, in electronic format, shall be provided in accordance with Local Rule 79 and Administrative Procedures.(This is a TEXT ENTRY ONLY. There is no hyperlink or PDF document associated with this entry.) (KDC) (Entered: 02/03/2021)"
        },
        {
          "row_number": 459,
          "id": 9012519,
          "entry_number": "57",
          "date_filed": "2014-11-03T00:00:00-05:00",
          "attachments": [],
          "url": "https://www.courtlistener.com/docket/4271273/57/june-medical-services-llc-v-caldwell/",
          "recap_pdf_url": null,
          "pacer_doc_id": "08701585654",
          "description": "ORDER CLARIFYING TEMPORARY RESTRAINING ORDER OF AUGUST 31, 2014 AND SETTING STATUS CONFERENCE FOR NOVEMBER 6, 2014: The Court therefore grants leave to the Womens Health Plaintiffs to Move for a TRO. The Court sets a telephone status conference on 11/6/2014 at 10 a.m. for the purpose of selecting a date for the hearing on this motion. In addition, all parties will be allowed to introduce any additional evidence and argument in support of or opposition to the TRO now in effect. The Court's TRO issued on August 31, 2014 (Doc. 31), as clarified herein, will remain in effect until the conclusion of the hearing on the preliminary injunction motion or as otherwise modified by the Court. Signed by Judge John W. deGravelles on 11/3/2014. (NLT) (Entered: 11/03/2014)"
        },
        {
          "row_number": 471,
          "id": 9012532,
          "entry_number": "68",
          "date_filed": "2014-11-17T00:00:00-05:00",
          "attachments": [],
          "url": "https://www.courtlistener.com/docket/4271273/68/june-medical-services-llc-v-caldwell/",
          "recap_pdf_url": null,
          "pacer_doc_id": "08701591880",
          "description": "ANSWER to Complaint in 14-cv-597 by Mark Henry Dawson. This document was originally filed in the member case by counsel. (JDL) Modified on 11/21/2014 to add text (JDL). (Entered: 11/19/2014)"
        },
        {
          "row_number": 519,
          "id": 9012547,
          "entry_number": null,
          "date_filed": "2015-01-06T00:00:00-05:00",
          "attachments": [],
          "url": "https://www.courtlistener.com",
          "recap_pdf_url": null,
          "pacer_doc_id": null,
          "description": "MOTION(S) REFERRED: 80 MOTION for Zoe Levine to Appear Pro Hac Vice (Filing fee $100.00, Receipt Number 053N-1171695), 81 MOTION for David Brown to Appear Pro Hac Vice (Filing fee $100.00, Receipt Number 053N-1171825). This motion is now pending before the USMJ. (BCL)"
        },
        {
          "row_number": 134,
          "id": 9012478,
          "entry_number": "22",
          "date_filed": "2014-08-26T00:00:00-04:00",
          "attachments": [],
          "url": "https://www.courtlistener.com/docket/4271273/22/june-medical-services-llc-v-caldwell/",
          "recap_pdf_url": null,
          "pacer_doc_id": "08701558595",
          "description": "ORDER as to 16 MOTION to Dismiss Pursuant to Fed.R.Civ.P. 12(B)(1) filed by James David Caldwell...James D. Buddy Caldwell, in his official capacity as the Attorney General for the State of Louisiana has filed a Motion to Dismiss Plaintiffs complaint for lack of subject matter jurisdiction. In addition, defendant, Dr. Jimmy Guidry, argues in its brief that this Court lacks jurisdiction as to him. Finally, in its brief, Dr. Mark Dawson argues that this Court has no Article III jurisdiction to issue injunctive relief against him...IT IS ORDERED that on or before 12:00 P.M. Central time on Wednesday, August 27, 2014, Plaintiffs shall file a brief responding to the Motion and arguments outlined above. Signed by Judge John W. deGravelles on 08/26/14. (KDC) (Entered: 08/26/2014)"
        },
        {
          "row_number": 111,
          "id": 9012454,
          "entry_number": "2",
          "date_filed": "2014-08-22T00:00:00-04:00",
          "attachments": [],
          "url": "https://www.courtlistener.com/docket/4271273/2/june-medical-services-llc-v-caldwell/",
          "recap_pdf_url": null,
          "pacer_doc_id": "08701556752",
          "description": "MOTION for Dimitra Doufekias to Appear Pro Hac Vice (Filing fee $100.00, Receipt Number 053N-1117518) by All Plaintiffs. (Attachments: # 1 Declaration of Dimitra Doufekias, # 2 Certificate of Good Standing, # 3 Proposed Order)(Rittenberg, William) (Entered: 08/22/2014)"
        },
        {
          "row_number": 222,
          "id": 9012455,
          "entry_number": "3",
          "date_filed": "2014-08-22T00:00:00-04:00",
          "attachments": [],
          "url": "https://www.courtlistener.com/docket/4271273/3/june-medical-services-llc-v-caldwell/",
          "recap_pdf_url": null,
          "pacer_doc_id": "08701556758",
          "description": "MOTION for Ilene Jaroslaw to Appear Pro Hac Vice (Filing fee $100.00, Receipt Number 053N-1117522) by All Plaintiffs. (Attachments: # 1 Declaration of Ilene Jaroslaw, # 2 Certificate of Good Standing, # 3 Proposed Order)(Rittenberg, William) (Entered: 08/22/2014)"
        },
        {
          "row_number": 451,
          "id": 10168887,
          "entry_number": "505",
          "date_filed": "2022-11-14T00:00:00-05:00",
          "attachments": null,
          "url": "https://www.courtlistener.com/docket/4271273/505/june-medical-services-llc-v-caldwell/",
          "recap_pdf_url": "https://www.courtlistener.com/recap/gov.uscourts.lamd.46729/gov.uscourts.lamd.46729.505.0.pdf",
          "pacer_doc_id": "08702984938",
          "description": "RULING AND ORDER granting  501   Motion to Vacate   501   Renewed Emergency Rule 60(b) Motion to Vacate Permanent Injunction (doc. 274, 275) as set forth in document. Signed by Judge John W. deGravelles on 11/14/2022.   (JEG)"
        },
        {
          "row_number": 444,
          "id": 9012457,
          "entry_number": "5",
          "date_filed": "2014-08-22T00:00:00-04:00",
          "attachments": [],
          "url": "https://www.courtlistener.com/docket/4271273/5/june-medical-services-llc-v-caldwell/",
          "recap_pdf_url": null,
          "pacer_doc_id": "08701556795",
          "description": "MOTION for Temporary Restraining Order and Motion for Preliminary Injunction by All Plaintiffs. (Attachments: # 1 Memorandum in Support, # 2 Exhibit H.B. 388, # 3 Exhibit Declaration of Kathaleen Pittman, # 4 Exhibit Declaration of Robert Gross, # 5 Exhibit Declaration of John Doe 1, M.D., # 6 Exhibit Declaration of John Doe 2, M.D., # 7 Exhibit Declaration of John Doe 3, M.D., # 8 Exhibit Declaration of Christopher M. Estes, M.D., M.P.H., # 9 Exhibit Summary of Hospital Admitting Privilege Requirements)(Rittenberg, William). Added MOTION for Preliminary Injunction on 8/22/2014 (SMG). Modified to edit motion text on 8/22/2014 (SMG). (Entered: 08/22/2014)"
        },
        {
          "row_number": 506,
          "id": 9012458,
          "entry_number": null,
          "date_filed": "2014-08-22T00:00:00-04:00",
          "attachments": [],
          "url": "https://www.courtlistener.com",
          "recap_pdf_url": null,
          "pacer_doc_id": null,
          "description": "MOTION(S) REFERRED: 2 MOTION for Dimitra Doufekias to Appear Pro Hac Vice (Filing fee $100.00, Receipt Number 053N-1117518). This motion is now pending before the USMJ. (SMG)"
        },
        {
          "row_number": 507,
          "id": 9012459,
          "entry_number": null,
          "date_filed": "2014-08-22T00:00:00-04:00",
          "attachments": [],
          "url": "https://www.courtlistener.com",
          "recap_pdf_url": null,
          "pacer_doc_id": null,
          "description": "MOTION(S) REFERRED: 3 MOTION for Ilene Jaroslaw to Appear Pro Hac Vice (Filing fee $100.00, Receipt Number 053N-1117522). This motion is now pending before the USMJ. (SMG)"
        },
        {
          "row_number": 508,
          "id": 9012460,
          "entry_number": null,
          "date_filed": "2014-08-22T00:00:00-04:00",
          "attachments": [],
          "url": "https://www.courtlistener.com",
          "recap_pdf_url": null,
          "pacer_doc_id": null,
          "description": "MOTION(S) REFERRED: 4 MOTION for Protective Order . This motion is now pending before the USMJ. (SMG)"
        },
        {
          "row_number": 473,
          "id": 9012462,
          "entry_number": "7",
          "date_filed": "2014-08-22T00:00:00-04:00",
          "attachments": [],
          "url": "https://www.courtlistener.com/docket/4271273/7/june-medical-services-llc-v-caldwell/",
          "recap_pdf_url": null,
          "pacer_doc_id": null,
          "description": "ORDER granting 2 Motion for Dimitra Doufekias to Appear Pro Hac Vice in this matter. Signed by Magistrate Judge Richard L. Bourgeois, Jr on 8/22/2014. (This is a TEXT ENTRY ONLY. There is no hyperlink or PDF document associated with this entry.) (JSL) (Entered: 08/22/2014)"
        },
        {
          "row_number": 484,
          "id": 9012463,
          "entry_number": "8",
          "date_filed": "2014-08-22T00:00:00-04:00",
          "attachments": [],
          "url": "https://www.courtlistener.com/docket/4271273/8/june-medical-services-llc-v-caldwell/",
          "recap_pdf_url": null,
          "pacer_doc_id": null,
          "description": "ORDER granting 3 Motion for Ilene Jaroslaw to Appear Pro Hac Vice in this matter. Signed by Magistrate Judge Richard L. Bourgeois, Jr on 8/22/2014. (This is a TEXT ENTRY ONLY. There is no hyperlink or PDF document associated with this entry.) (JSL) (Entered: 08/22/2014)"
        },
        {
          "row_number": 495,
          "id": 9012464,
          "entry_number": "9",
          "date_filed": "2014-08-22T00:00:00-04:00",
          "attachments": [],
          "url": "https://www.courtlistener.com/docket/4271273/9/june-medical-services-llc-v-caldwell/",
          "recap_pdf_url": null,
          "pacer_doc_id": "08701557100",
          "description": "Minute Entry for proceedings held before Judge John W. deGravelles: Telephone Conference held on 8/22/2014. Telephone Conference set for 8/25/2014 at 10:00 AM before Judge John W. deGravelles. (Recorded) (KDC) (Entered: 08/25/2014)"
        },
        {
          "row_number": 1,
          "id": 9012465,
          "entry_number": "10",
          "date_filed": "2014-08-25T00:00:00-04:00",
          "attachments": [],
          "url": "https://www.courtlistener.com/docket/4271273/10/june-medical-services-llc-v-caldwell/",
          "recap_pdf_url": null,
          "pacer_doc_id": "08701557242",
          "description": "MOTION to Enroll S. Kyle Duncan as Attorney for Defendant Jimmy Guidry by Jimmy Guidry. (Duncan, S.) (Entered: 08/25/2014)"
        },
        {
          "row_number": 12,
          "id": 9012466,
          "entry_number": "11",
          "date_filed": "2014-08-25T00:00:00-04:00",
          "attachments": [],
          "url": "https://www.courtlistener.com/docket/4271273/11/june-medical-services-llc-v-caldwell/",
          "recap_pdf_url": null,
          "pacer_doc_id": "08701557300",
          "description": "Corporate Disclosure Statement by Bossier City Medical Suite, Choice Inc. of Texas, June Medical Services LLC identifying Corporate Parent Martin, Martin & Richards, Inc. for Bossier City Medical Suite, Choice Inc. of Texas. (SMG) (Entered: 08/25/2014)"
        },
        {
          "row_number": 509,
          "id": 9012467,
          "entry_number": null,
          "date_filed": "2014-08-25T00:00:00-04:00",
          "attachments": [],
          "url": "https://www.courtlistener.com",
          "recap_pdf_url": null,
          "pacer_doc_id": null,
          "description": "MOTION(S) REFERRED: 10 MOTION to Enroll S. Kyle Duncan as Attorney for Defendant Jimmy Guidry. This motion is now pending before the USMJ. (SMG)"
        },
        {
          "row_number": 34,
          "id": 9012469,
          "entry_number": "13",
          "date_filed": "2014-08-25T00:00:00-04:00",
          "attachments": [],
          "url": "https://www.courtlistener.com/docket/4271273/13/june-medical-services-llc-v-caldwell/",
          "recap_pdf_url": null,
          "pacer_doc_id": "08701557656",
          "description": "NOTICE TO COUNSEL: The oral request for extension of Court's current deadline to file briefs of Mark Henry Dawson, in his official capacity as President of the Louisiana State Board of Medical Examiners, is granted. Brief deadline is reassigned for 3:00 p.m. on 9/25/2014. The Hearing on the pending Motion for Temporary Restraining Order is reassigned for 8/28/2014 at 10:00 AM in Courtroom 1 before Judge John W. deGravelles. Signed by Judge John W. deGravelles on 8/25/2014. (SMG) (Entered: 08/25/2014)"
        },
        {
          "row_number": 56,
          "id": 9012471,
          "entry_number": "15",
          "date_filed": "2014-08-26T00:00:00-04:00",
          "attachments": [],
          "url": "https://www.courtlistener.com/docket/4271273/15/june-medical-services-llc-v-caldwell/",
          "recap_pdf_url": null,
          "pacer_doc_id": "08701558323",
          "description": "Summons Issued as to Kathy Kliebert. (NOTICE: Counsel shall print and serve both the summons and all attachments in accordance with Federal Rule of Civil Procedure 4.) (SMG) (Entered: 08/26/2014)"
        },
        {
          "row_number": 67,
          "id": 9012472,
          "entry_number": "16",
          "date_filed": "2014-08-26T00:00:00-04:00",
          "attachments": [],
          "url": "https://www.courtlistener.com/docket/4271273/16/june-medical-services-llc-v-caldwell/",
          "recap_pdf_url": null,
          "pacer_doc_id": "08701558443",
          "description": "MOTION to Dismiss Pursuant to Fed.R.Civ.P. 12(B)(1) by James David Caldwell. (Attachments: # 1 Memorandum in Support)(Freel, Angelique) Modified to edit text on 8/26/2014 (SMG). (Entered: 08/26/2014)"
        },
        {
          "row_number": 89,
          "id": 9012474,
          "entry_number": "18",
          "date_filed": "2014-08-26T00:00:00-04:00",
          "attachments": [],
          "url": "https://www.courtlistener.com/docket/4271273/18/june-medical-services-llc-v-caldwell/",
          "recap_pdf_url": null,
          "pacer_doc_id": "08701558468",
          "description": "MEMORANDUM in Opposition to 5 MOTION for Temporary Restraining Order MOTION for Preliminary Injunction filed by Mark Henry Dawson. (McKinney, Don) (Entered: 08/26/2014)"
        },
        {
          "row_number": 112,
          "id": 9012476,
          "entry_number": "20",
          "date_filed": "2014-08-26T00:00:00-04:00",
          "attachments": [],
          "url": "https://www.courtlistener.com/docket/4271273/20/june-medical-services-llc-v-caldwell/",
          "recap_pdf_url": null,
          "pacer_doc_id": "08701558477",
          "description": "MEMORANDUM in Opposition to 5 MOTION for Temporary Restraining Order MOTION for Preliminary Injunction filed by Jimmy Guidry, Kathy Kliebert. (Duncan, S.) (Entered: 08/26/2014)"
        },
        {
          "row_number": 167,
          "id": 9012481,
          "entry_number": "25",
          "date_filed": "2014-08-28T00:00:00-04:00",
          "attachments": [],
          "url": "https://www.courtlistener.com/docket/4271273/25/june-medical-services-llc-v-caldwell/",
          "recap_pdf_url": null,
          "pacer_doc_id": "08701559310",
          "description": "Declaration of Secretary Kathy Kliebert by Kathy Kliebert (Duncan, S.) Modified to edit text on 8/28/2014 (SMG). (Entered: 08/28/2014)"
        },
        {
          "row_number": 178,
          "id": 9012482,
          "entry_number": "26",
          "date_filed": "2014-08-28T00:00:00-04:00",
          "attachments": [],
          "url": "https://www.courtlistener.com/docket/4271273/26/june-medical-services-llc-v-caldwell/",
          "recap_pdf_url": null,
          "pacer_doc_id": "08701559721",
          "description": "NOTICE of Supplemental Authority Declaration by Mark Henry Dawson (McKinney, Don) (Entered: 08/28/2014)"
        },
        {
          "row_number": 189,
          "id": 9012483,
          "entry_number": "27",
          "date_filed": "2014-08-28T00:00:00-04:00",
          "attachments": [],
          "url": "https://www.courtlistener.com/docket/4271273/27/june-medical-services-llc-v-caldwell/",
          "recap_pdf_url": null,
          "pacer_doc_id": "08701559735",
          "description": "NOTICE of Supplemental Authority Amended Declaration of Kathy Kliebert by Kathy Kliebert (Duncan, S.) (Entered: 08/28/2014)"
        },
        {
          "row_number": 200,
          "id": 9012485,
          "entry_number": "28",
          "date_filed": "2014-08-29T00:00:00-04:00",
          "attachments": [],
          "url": "https://www.courtlistener.com/docket/4271273/28/june-medical-services-llc-v-caldwell/",
          "recap_pdf_url": null,
          "pacer_doc_id": "08701559828",
          "description": "TRANSCRIPT REQUEST by Bossier City Medical Suite, Choice Inc. of Texas, John Doe 1, John Doe 2, June Medical Services LLC for proceedings held on August 28, 2014 before Judge deGravelles.. (Rittenberg, William) (Entered: 08/29/2014)"
        },
        {
          "row_number": 223,
          "id": 9012487,
          "entry_number": "30",
          "date_filed": "2014-08-29T00:00:00-04:00",
          "attachments": [],
          "url": "https://www.courtlistener.com/docket/4271273/30/june-medical-services-llc-v-caldwell/",
          "recap_pdf_url": null,
          "pacer_doc_id": "08701559910",
          "description": "Supplemental Memorandum in Support of 16 MOTION to Dismiss Pursuant to Fed.R.Civ.P. 12(B)(1) pursuant to Court order filed by James David Caldwell. (Thornhill, Jessica) Modified to edit text on 9/3/2014 (SMG). (Entered: 08/29/2014)"
        },
        {
          "row_number": 234,
          "id": 9012488,
          "entry_number": "31",
          "date_filed": "2014-08-31T00:00:00-04:00",
          "attachments": [],
          "url": "https://www.courtlistener.com/docket/4271273/31/june-medical-services-llc-v-caldwell/",
          "recap_pdf_url": "https://www.courtlistener.com/recap/gov.uscourts.lamd.46729.31.0.pdf",
          "pacer_doc_id": "08701560286",
          "description": " ORDER granting  5   Motion for Temporary Restraining Order to the extent that any enforcement of ยง A(2)(a) of Act 620, amending La. R.S. 40:1299.35.2, is enjoined until a hearing is held for the purpose of determining whether a preliminary injun ction should issue.  Plaintiffs will continue to seek admitting privileges. The Act will be allowed to take effect but Plaintiffs will not be subject to the penalties and sanctions allowed in the statute at this time or in the future for practicing w ithout the relevant admitting privileges during the applications process.  Plaintiffs will be allowed to operate lawfully while continuing their efforts to obtain privileges.  Plaintiffs Application for a Preliminary Injunction will remain pending. A ll parties indicated at the TRO Hearing that, if a TRO was granted, additional time was needed to conduct discovery and prepare for the hearing on the preliminary injunction. Thus, in accordance with Fed. R. Civ. P. 65(b)(2), a status conference will  be set no later than 30 days hence for the purpose of receiving a status report regarding the pending applications for admitting privileges, determining the amount of time needed by the parties to prepare for the hearing on the preliminary injunctio n, setting a date for the preliminary injunction hearing, discussing the scope of the issues and nature of the proof which will be presented and discussing all additional issues which the parties and the Court deem relevant. The Court understands tha t the events in this case are fluid. Should circumstances change, the parties are free to seek any other relief as they may deem appropriate. Given the nature of the relief sought and because there is no risk of monetary loss to the defendant by virt ue of the granting of this injunction, it is unnecessary for Plaintiffs to post a bond in this matter...IT IS FURTHER ORDERED that   16    Motion to Dismiss Louisiana State Health Officer and Medical Director, Dr. Jimmy Guidry, is granted and Dr. Jim my Guidry is hereby DISMISSED..IT IS FURTHER ORDERED that the Motion to Dismiss filed by Defendant Attorney General James David Caldwell is hereby GRANTED and Louisiana State Health Officer and Medical Director, Dr. Jimmy Guidry, is hereby DISMISSED... Signed by Judge John W. deGravelles on 08/31/14.   (KDC) Modified on 8/31/2014 (KDC). (Main Document 31 replaced on 9/2/2014) (NLT)."
        },
        {
          "row_number": 267,
          "id": 9012490,
          "entry_number": "34",
          "date_filed": "2014-09-02T00:00:00-04:00",
          "attachments": [],
          "url": "https://www.courtlistener.com/docket/4271273/34/june-medical-services-llc-v-caldwell/",
          "recap_pdf_url": null,
          "pacer_doc_id": "08701560816",
          "description": "NOTICE of Certificate of Service Regarding Declaration of Mark H. Dawson by Mark Henry Dawson re 26 Notice of (other) (McKinney, Don) (Entered: 09/02/2014)"
        },
        {
          "row_number": 278,
          "id": 9012491,
          "entry_number": "35",
          "date_filed": "2014-09-02T00:00:00-04:00",
          "attachments": [],
          "url": "https://www.courtlistener.com/docket/4271273/35/june-medical-services-llc-v-caldwell/",
          "recap_pdf_url": null,
          "pacer_doc_id": "08701561018",
          "description": "NOTICE TO COUNSEL: A Telephone Status Conference is set for 9/30/2014 at 10:00 AM before Judge John W. deGravelles. The parties shall submit to the Court on or before 5:00 PM on 09/23/2014, a brief memo (not more than 3 pages) addressing the issues stated herein. Signed by Judge John W. deGravelles on 09/02/2014. (NLT) (Entered: 09/02/2014)"
        },
        {
          "row_number": 289,
          "id": 9012492,
          "entry_number": "36",
          "date_filed": "2014-09-10T00:00:00-04:00",
          "attachments": [],
          "url": "https://www.courtlistener.com/docket/4271273/36/june-medical-services-llc-v-caldwell/",
          "recap_pdf_url": null,
          "pacer_doc_id": "08701564798",
          "description": "Summons Issued as to Mark Henry Dawson. (NOTICE: Counsel shall print and serve both the summons and all attachments in accordance with Federal Rule of Civil Procedure 4.) (NLT) (Entered: 09/10/2014)"
        },
        {
          "row_number": 510,
          "id": 9012493,
          "entry_number": null,
          "date_filed": "2014-09-19T00:00:00-04:00",
          "attachments": [],
          "url": "https://www.courtlistener.com",
          "recap_pdf_url": null,
          "pacer_doc_id": null,
          "description": "MOTION for Protective Order by John Doe 5, John Doe 6. This motion was originally filed in 14-597 and is moved to 14-525 for case management purposes; see doc 4 in 14-597 to view image of document. (CGP)"
        },
        {
          "row_number": 511,
          "id": 9012494,
          "entry_number": null,
          "date_filed": "2014-09-19T00:00:00-04:00",
          "attachments": [],
          "url": "https://www.courtlistener.com",
          "recap_pdf_url": null,
          "pacer_doc_id": null,
          "description": "MOTION for Preliminary Injunction by Delta Clinic of Baton Rouge, Inc., John Doe 5, John Doe 6, Women's Health Care Center, Inc. This motion was originally filed in 14-597 and is moved to 14-525 for case management purposes; see doc. 5 in 14-597 to view image of document. (CGP)"
        },
        {
          "row_number": 300,
          "id": 9012495,
          "entry_number": "37",
          "date_filed": "2014-09-23T00:00:00-04:00",
          "attachments": [],
          "url": "https://www.courtlistener.com/docket/4271273/37/june-medical-services-llc-v-caldwell/",
          "recap_pdf_url": null,
          "pacer_doc_id": "08701570230",
          "description": "Plaintiffs' Brief Provided in Advance of the September 30, 2014 Status Conference by All Plaintiffs. (Rittenberg, William) Modified to edit text on 9/24/2014 (SMG). (Entered: 09/23/2014)"
        },
        {
          "row_number": 311,
          "id": 9012496,
          "entry_number": "38",
          "date_filed": "2014-09-23T00:00:00-04:00",
          "attachments": [],
          "url": "https://www.courtlistener.com/docket/4271273/38/june-medical-services-llc-v-caldwell/",
          "recap_pdf_url": null,
          "pacer_doc_id": "08701570257",
          "description": "Defendants' Memorandum on Preliminary Injunction Hearing by Mark Henry Dawson, Kathy Kliebert. (Duncan, S.) Modified to edit text on 9/24/2014 (SMG). (Entered: 09/23/2014)"
        },
        {
          "row_number": 512,
          "id": 9012497,
          "entry_number": null,
          "date_filed": "2014-09-23T00:00:00-04:00",
          "attachments": [],
          "url": "https://www.courtlistener.com",
          "recap_pdf_url": null,
          "pacer_doc_id": null,
          "description": "Ex Parte MOTION for Extension of Time by Delta Clinic of Baton Rouge, Inc., John Doe 5, John Doe 6, Women's Health Care Center, Inc. This motion was originally filed in 14-597 and is moved to 14-525 for case management purposes; see doc. 7 in 14-597 to view image of document (CGP) Modified on 9/24/2014 to edit text (CGP)."
        },
        {
          "row_number": 322,
          "id": 9012498,
          "entry_number": "39",
          "date_filed": "2014-09-24T00:00:00-04:00",
          "attachments": [],
          "url": "https://www.courtlistener.com/docket/4271273/39/june-medical-services-llc-v-caldwell/",
          "recap_pdf_url": null,
          "pacer_doc_id": "08701570516",
          "description": "ORDER granting 2 Motion to Consolidate Case. The Clerk is directed to consolidate this action with Civil Action Number 14-CV-525-JWD-RLB. Signed by Judge John W. deGravelles on 09/24/2014. (CGP) (Entered: 09/24/2014)"
        },
        {
          "row_number": 345,
          "id": 9012499,
          "entry_number": "41",
          "date_filed": "2014-09-24T00:00:00-04:00",
          "attachments": [],
          "url": "https://www.courtlistener.com/docket/4271273/41/june-medical-services-llc-v-caldwell/",
          "recap_pdf_url": null,
          "pacer_doc_id": "08701571696",
          "description": "ORDER granting [] Motion for Extension of Time filed by Plaintiff's Women's Health Care Center, Inc., Delta Clinic of Baton Rouge, Inc., John Doe 5, M.D. and John Doe 6. The time in which Plaintiffs have to file the memorandum requested by this Court with regard to a status conference scheduled for 09/30/2014 in June Med. Servs. LLC, et al. v. Caldwell, et al. CA No.: 3:14-cv-00525-JWD-RLB (M.D. La. 2014) is hereby extended for a period of two (2) days, or until 5:00PM on 09/25/2014. Signed by Judge John W. deGravelles on 9/24/2014. (JDL) (Entered: 09/26/2014)"
        },
        {
          "row_number": 334,
          "id": 9012500,
          "entry_number": "40",
          "date_filed": "2014-09-25T00:00:00-04:00",
          "attachments": [],
          "url": "https://www.courtlistener.com/docket/4271273/40/june-medical-services-llc-v-caldwell/",
          "recap_pdf_url": null,
          "pacer_doc_id": "08701571277",
          "description": "Plaintiff's Memorandum Regarding September 30, 2014 Status Conference filed by Delta Clinic of Baton Rouge, Inc., John Doe 5, John Doe 6, Women's Health Care Center, Inc.. (Attachments: # 1 Exhibit A: Letter Agreement with DHH, # 2 Exhibit B: Letter from LSBME)(Schilling, Ellie) Modified on 9/26/2014 to edit text (LLH). (Entered: 09/25/2014)"
        },
        {
          "row_number": 513,
          "id": 9012501,
          "entry_number": null,
          "date_filed": "2014-09-29T00:00:00-04:00",
          "attachments": [],
          "url": "https://www.courtlistener.com",
          "recap_pdf_url": null,
          "pacer_doc_id": null,
          "description": "MOTION(S) REFERRED: MOTION for Protective Order. This motion is now pending before the USMJ. (NLT)"
        },
        {
          "row_number": 356,
          "id": 9012502,
          "entry_number": "42",
          "date_filed": "2014-09-29T00:00:00-04:00",
          "attachments": [],
          "url": "https://www.courtlistener.com/docket/4271273/42/june-medical-services-llc-v-caldwell/",
          "recap_pdf_url": null,
          "pacer_doc_id": "08701572390",
          "description": "WAIVER OF SERVICE Returned Executed by John Doe 1, Bossier City Medical Suite, John Doe 2, Choice Inc. of Texas, June Medical Services LLC. Mark Henry Dawson waiver sent on 9/17/2014, answer due 11/17/2014. (Rittenberg, William) (Entered: 09/29/2014)"
        },
        {
          "row_number": 367,
          "id": 9012503,
          "entry_number": "43",
          "date_filed": "2014-09-29T00:00:00-04:00",
          "attachments": [],
          "url": "https://www.courtlistener.com/docket/4271273/43/june-medical-services-llc-v-caldwell/",
          "recap_pdf_url": null,
          "pacer_doc_id": "08701572393",
          "description": "WAIVER OF SERVICE Returned Executed by John Doe 1, Bossier City Medical Suite, John Doe 2, Choice Inc. of Texas, June Medical Services LLC. Kathy Kliebert waiver sent on 9/17/2014, answer due 11/17/2014. (Rittenberg, William) (Entered: 09/29/2014)"
        },
        {
          "row_number": 378,
          "id": 9012504,
          "entry_number": "44",
          "date_filed": "2014-09-30T00:00:00-04:00",
          "attachments": [],
          "url": "https://www.courtlistener.com/docket/4271273/44/june-medical-services-llc-v-caldwell/",
          "recap_pdf_url": null,
          "pacer_doc_id": "08701572806",
          "description": "MOTION to Enroll J. Michael Johnson as Additional Attorney by Kathy Kliebert. (Attachments: # 1 Attachment Proposed Order)(Duncan, S.) (Entered: 09/30/2014)"
        },
        {
          "row_number": 514,
          "id": 9012505,
          "entry_number": null,
          "date_filed": "2014-09-30T00:00:00-04:00",
          "attachments": [],
          "url": "https://www.courtlistener.com",
          "recap_pdf_url": null,
          "pacer_doc_id": null,
          "description": "MOTION(S) REFERRED: 44 MOTION to Enroll J. Michael Johnson as Additional Attorney . This motion is now pending before the USMJ. (LLH)"
        },
        {
          "row_number": 400,
          "id": 9012508,
          "entry_number": "46",
          "date_filed": "2014-10-03T00:00:00-04:00",
          "attachments": [],
          "url": "https://www.courtlistener.com/docket/4271273/46/june-medical-services-llc-v-caldwell/",
          "recap_pdf_url": null,
          "pacer_doc_id": "08701574411",
          "description": "WAIVER OF SERVICE Returned Executed by John Doe 5, Women's Health Care Center, Inc., John Doe 6, Delta Clinic of Baton Rouge, Inc.. Mark Henry Dawson waiver sent on 9/19/2014, answer due 11/18/2014. (Schilling, Ellie) (Entered: 10/03/2014)"
        },
        {
          "row_number": 411,
          "id": 9012509,
          "entry_number": "47",
          "date_filed": "2014-10-03T00:00:00-04:00",
          "attachments": [],
          "url": "https://www.courtlistener.com/docket/4271273/47/june-medical-services-llc-v-caldwell/",
          "recap_pdf_url": null,
          "pacer_doc_id": "08701574414",
          "description": "WAIVER OF SERVICE Returned Executed by John Doe 5, Women's Health Care Center, Inc., John Doe 6, Delta Clinic of Baton Rouge, Inc.. Kathy Kliebert waiver sent on 9/19/2014, answer due 11/18/2014. (Schilling, Ellie) (Entered: 10/03/2014)"
        },
        {
          "row_number": 433,
          "id": 9012511,
          "entry_number": "49",
          "date_filed": "2014-10-08T00:00:00-04:00",
          "attachments": [],
          "url": "https://www.courtlistener.com/docket/4271273/49/june-medical-services-llc-v-caldwell/",
          "recap_pdf_url": null,
          "pacer_doc_id": "08701576543",
          "description": "Joint Proposed Schedule by Kathy Kliebert. (Duncan, S.) Modified to edit text on 10/9/2014 (SMG). (Entered: 10/08/2014)"
        },
        {
          "row_number": 445,
          "id": 9012512,
          "entry_number": "50",
          "date_filed": "2014-10-08T00:00:00-04:00",
          "attachments": [],
          "url": "https://www.courtlistener.com/docket/4271273/50/june-medical-services-llc-v-caldwell/",
          "recap_pdf_url": null,
          "pacer_doc_id": "08701576566",
          "description": "Chart of Pending Applications by All Plaintiffs. (Rittenberg, William) Modified to edit text on 10/9/2014 (SMG). (Entered: 10/08/2014)"
        },
        {
          "row_number": 453,
          "id": 9012513,
          "entry_number": "51",
          "date_filed": "2014-10-08T00:00:00-04:00",
          "attachments": [],
          "url": "https://www.courtlistener.com/docket/4271273/51/june-medical-services-llc-v-caldwell/",
          "recap_pdf_url": null,
          "pacer_doc_id": "08701576614",
          "description": "Memorandum Regarding Status of Pending Applications for Privileges by Delta Clinic of Baton Rouge, Inc., John Doe 5, John Doe 6, Women's Health Care Center, Inc. (Schilling, Ellie) Modified to edit text on 10/9/2014 (SMG). (Entered: 10/08/2014)"
        },
        {
          "row_number": 454,
          "id": 9012514,
          "entry_number": "52",
          "date_filed": "2014-10-09T00:00:00-04:00",
          "attachments": [],
          "url": "https://www.courtlistener.com/docket/4271273/52/june-medical-services-llc-v-caldwell/",
          "recap_pdf_url": null,
          "pacer_doc_id": "08701577199",
          "description": "Brief regarding Clarifying the Scope of the TRO. (Rittenberg, William) (Entered: 10/09/2014)"
        },
        {
          "row_number": 455,
          "id": 9012515,
          "entry_number": "53",
          "date_filed": "2014-10-09T00:00:00-04:00",
          "attachments": [],
          "url": "https://www.courtlistener.com/docket/4271273/53/june-medical-services-llc-v-caldwell/",
          "recap_pdf_url": null,
          "pacer_doc_id": "08701577227",
          "description": "Brief regarding Scope of Temporary Restraining Order. (Duncan, S.) (Entered: 10/09/2014)"
        },
        {
          "row_number": 456,
          "id": 9012516,
          "entry_number": "54",
          "date_filed": "2014-10-09T00:00:00-04:00",
          "attachments": [],
          "url": "https://www.courtlistener.com/docket/4271273/54/june-medical-services-llc-v-caldwell/",
          "recap_pdf_url": null,
          "pacer_doc_id": "08701577258",
          "description": "Brief regarding Scope of Temporary Restraining Order. (Attachments: # 1 Exhibit \"A,\" Email Correspondence)(Schilling, Ellie) (Entered: 10/09/2014)"
        },
        {
          "row_number": 458,
          "id": 9012518,
          "entry_number": "56",
          "date_filed": "2014-10-21T00:00:00-04:00",
          "attachments": [],
          "url": "https://www.courtlistener.com/docket/4271273/56/june-medical-services-llc-v-caldwell/",
          "recap_pdf_url": null,
          "pacer_doc_id": "08701580933",
          "description": "JOINT SCHEDULING ORDER: The following deadlines are hereby established: Defendants' Answer in 14-525 due by 11/17/2014. Defendants' Answer in 14-597 due by 11/18/2014. Plaintiffs' and Defendants' Expert Reports due by 11/17/2014. Rebuttal Expert Reports due by 12/1/2014. Discovery Cut-Off is 12/31/2014. Pre-Trial Motions due by 2/16/2015. Responses to Pre-Trial Motions is 3/2/2015. Reply Responses due by 3/9/2015. Defendants' Opposition to Preliminary Injunction due by 2/16/2015. Plaintiff's Reply due by 3/6/2015. Pretrial Order due by 3/12/2015. Pretrial Conference set for 3/18/2015 at 1:30 p.m. Trial set for 3/30/2015 at 9:00 a.m. Signed by Judge John W. deGravelles on 10/21/2014. (SMG) Modified on 10/22/2014 (NLT). (Entered: 10/21/2014)"
        },
        {
          "row_number": 460,
          "id": 9012520,
          "entry_number": "58",
          "date_filed": "2014-11-05T00:00:00-05:00",
          "attachments": [],
          "url": "https://www.courtlistener.com/docket/4271273/58/june-medical-services-llc-v-caldwell/",
          "recap_pdf_url": null,
          "pacer_doc_id": "08701586575",
          "description": "Joint MOTION for Protective Order by Bossier City Medical Suite, Choice Inc. of Texas, Delta Clinic of Baton Rouge, Inc., John Doe 1, John Doe 2, John Doe 5, John Doe 6, June Medical Services LLC, Women's Health Care Center, Inc.. (Attachments: # 1 Proposed Protective Order)(Rittenberg, William) (Entered: 11/05/2014)"
        },
        {
          "row_number": 516,
          "id": 9012521,
          "entry_number": null,
          "date_filed": "2014-11-06T00:00:00-05:00",
          "attachments": [],
          "url": "https://www.courtlistener.com",
          "recap_pdf_url": null,
          "pacer_doc_id": null,
          "description": "MOTION(S) REFERRED: 58 Joint MOTION for Protective Order . This motion is now pending before the USMJ. (LLH)"
        },
        {
          "row_number": 517,
          "id": 9012525,
          "entry_number": null,
          "date_filed": "2014-11-12T00:00:00-05:00",
          "attachments": [],
          "url": "https://www.courtlistener.com",
          "recap_pdf_url": null,
          "pacer_doc_id": null,
          "description": "MOTION(S) REFERRED: 61 MOTION for Janet Crepps to Appear Pro Hac Vice (Filing fee $100.00, Receipt Number 053N-1148880). This motion is now pending before the USMJ. (LLH)"
        },
        {
          "row_number": 465,
          "id": 9012526,
          "entry_number": "62",
          "date_filed": "2014-11-12T00:00:00-05:00",
          "attachments": [],
          "url": "https://www.courtlistener.com/docket/4271273/62/june-medical-services-llc-v-caldwell/",
          "recap_pdf_url": null,
          "pacer_doc_id": "08701589528",
          "description": "Additional Exhibits to 61 MOTION for Janet Crepps to Appear Pro Hac Vice (Filing fee $100.00, Receipt Number 053N-1148880) by Bossier City Medical Suite, Choice Inc. of Texas, John Doe 1, John Doe 2, June Medical Services LLC. filed by Bossier City Medical Suite, Choice Inc. of Texas, John Doe 1, John Doe 2, June Medical Services LLC. (Rittenberg, William) (Entered: 11/12/2014)"
        },
        {
          "row_number": 466,
          "id": 9012527,
          "entry_number": "63",
          "date_filed": "2014-11-14T00:00:00-05:00",
          "attachments": [],
          "url": "https://www.courtlistener.com/docket/4271273/63/june-medical-services-llc-v-caldwell/",
          "recap_pdf_url": null,
          "pacer_doc_id": "08701590459",
          "description": "SEALED DOCUMENT List of Doctor John Does' Names. (Rittenberg, William) Modified to edit text on 11/17/2014 (SMG). (Entered: 11/14/2014)"
        },
        {
          "row_number": 467,
          "id": 9012528,
          "entry_number": "64",
          "date_filed": "2014-11-17T00:00:00-05:00",
          "attachments": [],
          "url": "https://www.courtlistener.com/docket/4271273/64/june-medical-services-llc-v-caldwell/",
          "recap_pdf_url": null,
          "pacer_doc_id": "08701590645",
          "description": "ANSWER of Defendant Kathy Kliebert to June Medical Services 14 Amended Complaint, by Kathy Kliebert.(Duncan, S.) Modified on 11/17/2014 to edit text (LLH). (Entered: 11/17/2014)"
        },
        {
          "row_number": 468,
          "id": 9012529,
          "entry_number": "65",
          "date_filed": "2014-11-17T00:00:00-05:00",
          "attachments": [],
          "url": "https://www.courtlistener.com/docket/4271273/65/june-medical-services-llc-v-caldwell/",
          "recap_pdf_url": null,
          "pacer_doc_id": "08701590829",
          "description": "ANSWER of Defendant Kathy Kliebert to Women's Health Care Center Complaint (This document was originally filed in the member case, civil action 14-597, by counsel.) by Kathy Kliebert.(LLH) (Entered: 11/17/2014)"
        },
        {
          "row_number": 469,
          "id": 9012530,
          "entry_number": "66",
          "date_filed": "2014-11-17T00:00:00-05:00",
          "attachments": [],
          "url": "https://www.courtlistener.com/docket/4271273/66/june-medical-services-llc-v-caldwell/",
          "recap_pdf_url": null,
          "pacer_doc_id": "08701590877",
          "description": "ANSWER to 14 Amended Complaint, by Mark Henry Dawson.(McKinney, Don) (Entered: 11/17/2014)"
        },
        {
          "row_number": 470,
          "id": 9012531,
          "entry_number": "67",
          "date_filed": "2014-11-17T00:00:00-05:00",
          "attachments": [],
          "url": "https://www.courtlistener.com/docket/4271273/67/june-medical-services-llc-v-caldwell/",
          "recap_pdf_url": null,
          "pacer_doc_id": "08701590998",
          "description": "Notice of Appearance by Kathy Kliebert. (Johnson, J.) Modified to replace and flatten document on 11/19/2014 (BCL). Modified to edit text on 12/3/2014 (SMG). (Entered: 11/17/2014)"
        },
        {
          "row_number": 518,
          "id": 9012533,
          "entry_number": null,
          "date_filed": "2014-11-19T00:00:00-05:00",
          "attachments": [],
          "url": "https://www.courtlistener.com",
          "recap_pdf_url": null,
          "pacer_doc_id": null,
          "description": "MOTION(S) REFERRED: 67 First MOTION to Enroll Charlotte Y. Bergeron as Additional Attorney. This motion is now pending before the USMJ. (BCL)"
        },
        {
          "row_number": 472,
          "id": 9012534,
          "entry_number": "69",
          "date_filed": "2014-11-24T00:00:00-05:00",
          "attachments": [],
          "url": "https://www.courtlistener.com/docket/4271273/69/june-medical-services-llc-v-caldwell/",
          "recap_pdf_url": null,
          "pacer_doc_id": "08701594151",
          "description": "ORDER granting 61 Motion for Janet Crepps to Appear Pro Hac Vice as co-counsel for plaintiffs, Bossier City Medical Suite, Choice, Inc. of Texas, John Doe 1, MD, John Doe 2, MD and June Medical Services, LLC. Signed by Magistrate Judge Richard L. Bourgeois, Jr on 11/21/2014. (JDL) (Entered: 11/24/2014)"
        },
        {
          "row_number": 474,
          "id": 9012535,
          "entry_number": "70",
          "date_filed": "2014-12-05T00:00:00-05:00",
          "attachments": [],
          "url": "https://www.courtlistener.com/docket/4271273/70/june-medical-services-llc-v-caldwell/",
          "recap_pdf_url": null,
          "pacer_doc_id": "08701598275",
          "description": "MOTION for Voluntary Dismissal by Delta Clinic of Baton Rouge, Inc., John Doe 5, John Doe 6, Women's Health Care Center, Inc.. (Attachments: # 1 Proposed Order)(Schilling, Ellie) Modified to edit text on 12/8/2014 (SMG). (Entered: 12/05/2014)"
        },
        {
          "row_number": 475,
          "id": 9012536,
          "entry_number": "71",
          "date_filed": "2014-12-08T00:00:00-05:00",
          "attachments": [],
          "url": "https://www.courtlistener.com/docket/4271273/71/june-medical-services-llc-v-caldwell/",
          "recap_pdf_url": null,
          "pacer_doc_id": null,
          "description": "Notice to Counsel: Telephone Conference set for 12/8/2014 at 3:00 PM Central Time before Judge John W. deGravelles. Counsel for plaintiff shall initiate the call to the Court.(This is a TEXT ENTRY ONLY. There is no hyperlink or PDF document associated with this entry.)(KDC) (Entered: 12/08/2014)"
        },
        {
          "row_number": 478,
          "id": 9012539,
          "entry_number": "74",
          "date_filed": "2014-12-10T00:00:00-05:00",
          "attachments": [],
          "url": "https://www.courtlistener.com/docket/4271273/74/june-medical-services-llc-v-caldwell/",
          "recap_pdf_url": null,
          "pacer_doc_id": "08701599964",
          "description": "Brief regarding 70 MOTION for Voluntary Dismissal. (Rittenberg, William) Modified to edit text on 12/12/2014 (BCL). (Entered: 12/10/2014)"
        },
        {
          "row_number": 479,
          "id": 9012540,
          "entry_number": "75",
          "date_filed": "2014-12-10T00:00:00-05:00",
          "attachments": [],
          "url": "https://www.courtlistener.com/docket/4271273/75/june-medical-services-llc-v-caldwell/",
          "recap_pdf_url": null,
          "pacer_doc_id": "08701599973",
          "description": "Brief on 70 MOTION for Voluntary Dismissal. (Attachments: # 1 Exhibit Exhibit A Solansky Report)(Duncan, S.) Modified to edit text on 12/12/2014 (BCL). (Entered: 12/10/2014)"
        },
        {
          "row_number": 480,
          "id": 9012541,
          "entry_number": "76",
          "date_filed": "2014-12-10T00:00:00-05:00",
          "attachments": [],
          "url": "https://www.courtlistener.com/docket/4271273/76/june-medical-services-llc-v-caldwell/",
          "recap_pdf_url": null,
          "pacer_doc_id": "08701599989",
          "description": "Brief on 70 MOTION for Voluntary Dismissal filed by Mark Henry Dawson. (Wall, Ralph) Modified to edit text on 12/12/2014 (BCL). (Entered: 12/10/2014)"
        },
        {
          "row_number": 481,
          "id": 9012542,
          "entry_number": "77",
          "date_filed": "2014-12-11T00:00:00-05:00",
          "attachments": [],
          "url": "https://www.courtlistener.com/docket/4271273/77/june-medical-services-llc-v-caldwell/",
          "recap_pdf_url": null,
          "pacer_doc_id": null,
          "description": "ORDER granting 70 Motion to Dismiss without prejudice the claims of plaintiffs in Civil Action 14-597. Signed by Judge John W. deGravelles on 12/11/14. (This is a TEXT ENTRY ONLY. There is no hyperlink or PDF document associated with this entry.) (KDC) (Entered: 12/11/2014)"
        },
        {
          "row_number": 482,
          "id": 9012543,
          "entry_number": "78",
          "date_filed": "2014-12-15T00:00:00-05:00",
          "attachments": [],
          "url": "https://www.courtlistener.com/docket/4271273/78/june-medical-services-llc-v-caldwell/",
          "recap_pdf_url": null,
          "pacer_doc_id": null,
          "description": "Notice to Counsel: Hearing set for December 16, 2014, at 1:30 p.m. is hereby canceled.(This is a TEXT ENTRY ONLY. There is no hyperlink or PDF document associated with this entry.) (KDC) (Entered: 12/15/2014)"
        },
        {
          "row_number": 483,
          "id": 9012544,
          "entry_number": "79",
          "date_filed": "2014-12-17T00:00:00-05:00",
          "attachments": [],
          "url": "https://www.courtlistener.com/docket/4271273/79/june-medical-services-llc-v-caldwell/",
          "recap_pdf_url": null,
          "pacer_doc_id": "08701602886",
          "description": "Reply to 75 Brief Regarding Women's Health Voluntary Dismissal filed by All Plaintiffs. (Rittenberg, William) Modified to edit text on 12/18/2014 (BCL). (Entered: 12/17/2014)"
        },
        {
          "row_number": 485,
          "id": 9012545,
          "entry_number": "80",
          "date_filed": "2015-01-06T00:00:00-05:00",
          "attachments": [],
          "url": "https://www.courtlistener.com/docket/4271273/80/june-medical-services-llc-v-caldwell/",
          "recap_pdf_url": null,
          "pacer_doc_id": "08701607791",
          "description": "MOTION for Zoe Levine to Appear Pro Hac Vice (Filing fee $100.00, Receipt Number 053N-1171695) by Bossier City Medical Suite, Choice Inc. of Texas, John Doe 1, John Doe 2, June Medical Services LLC. (Attachments: # 1 Attachment Declaration of Zoe Levine in Support of Motion for Admission Pro Hac Vice, # 2 Attachment Proposed Order Admitting Zoe Levine Pro Hac Vice)(Rittenberg, William) (Entered: 01/06/2015)"
        },
        {
          "row_number": 486,
          "id": 9012546,
          "entry_number": "81",
          "date_filed": "2015-01-06T00:00:00-05:00",
          "attachments": [],
          "url": "https://www.courtlistener.com/docket/4271273/81/june-medical-services-llc-v-caldwell/",
          "recap_pdf_url": null,
          "pacer_doc_id": "08701607960",
          "description": "MOTION for David Brown to Appear Pro Hac Vice (Filing fee $100.00, Receipt Number 053N-1171825) by Bossier City Medical Suite, Choice Inc. of Texas, John Doe 1, John Doe 2, June Medical Services LLC. (Attachments: # 1 Attachment Declaration of David Brown in Support of Motion for Admission Pro Hac Vice, # 2 Attachment Proposed Order Admitting David Brown Pro Hac Vice)(Rittenberg, William) (Entered: 01/06/2015)"
        },
        {
          "row_number": 487,
          "id": 9012548,
          "entry_number": "82",
          "date_filed": "2015-01-13T00:00:00-05:00",
          "attachments": [],
          "url": "https://www.courtlistener.com/docket/4271273/82/june-medical-services-llc-v-caldwell/",
          "recap_pdf_url": null,
          "pacer_doc_id": "08701610517",
          "description": "ORDER granting 80 Motion for Zoe Levine to Appear Pro Hac Vice as co-counsel for the plaintiffs. Signed by Magistrate Judge Richard L. Bourgeois, Jr on 1/12/2015. (JDL) (Entered: 01/13/2015)"
        },
        {
          "row_number": 488,
          "id": 9012549,
          "entry_number": "83",
          "date_filed": "2015-01-13T00:00:00-05:00",
          "attachments": [],
          "url": "https://www.courtlistener.com/docket/4271273/83/june-medical-services-llc-v-caldwell/",
          "recap_pdf_url": null,
          "pacer_doc_id": "08701610569",
          "description": "ORDER granting 81 Motion for David Brown to Appear Pro Hac Vice as co-counsel for the plaintiffs. Signed by Magistrate Judge Richard L. Bourgeois, Jr on 1/12/2015. (JDL) (Entered: 01/13/2015)"
        },
        {
          "row_number": 490,
          "id": 9012551,
          "entry_number": "85",
          "date_filed": "2015-02-03T00:00:00-05:00",
          "attachments": [],
          "url": "https://www.courtlistener.com/docket/4271273/85/june-medical-services-llc-v-caldwell/",
          "recap_pdf_url": null,
          "pacer_doc_id": null,
          "description": "Notice to Counsel: Telephone Conference set for 2/5/2015 at 11:00 AM before Judge John W. deGravelles. Counsel for plaintiff shall set up the conference call to the Court as previously done in this matter. (This is a TEXT ENTRY ONLY. There is no hyperlink or PDF document associated with this entry.)(KDC) (Entered: 02/03/2015)"
        },
        {
          "row_number": 491,
          "id": 9012552,
          "entry_number": "86",
          "date_filed": "2015-02-05T00:00:00-05:00",
          "attachments": [],
          "url": "https://www.courtlistener.com/docket/4271273/86/june-medical-services-llc-v-caldwell/",
          "recap_pdf_url": null,
          "pacer_doc_id": "08701621165",
          "description": "Minute Entry for proceedings held before Judge John W. deGravelles: Telephone Conference held on 2/5/2015. The pretrial motion deadline is reset to March 10, 2015. Response to pretrial motions shall be filed on or before March 17, 2015, and any reply briefs shall be filed on or before March 20, 2015. Defendants may file a response to Plaintiffs' reply memo to Preliminary Injunction motion on or before March 14, 2015. The parties shall submit to the Court a proposed deadline for submission of an exhibit and witness list. The Court advised the parties that the pretrial conference in this matter will be held in person. (Court Reporter S. Thompson.) (SMG) (Entered: 02/06/2015)"
        },
        {
          "row_number": 494,
          "id": 9012556,
          "entry_number": "89",
          "date_filed": "2015-02-20T00:00:00-05:00",
          "attachments": null,
          "url": "https://www.courtlistener.com/docket/4271273/89/june-medical-services-llc-v-caldwell/",
          "recap_pdf_url": null,
          "pacer_doc_id": null,
          "description": "ORDER: The parties have advised the Court that they have reached an agreement as to dates by which to exchange exhibit and witness lists. The dates are amenable to the Court. Accordingly, IT IS ORDERED that the parties exchange exhibit and witness lists by March 6, 2015, and notify the Court of any objections to the exhibit and witness lists by March 13, 2015. Signed by Judge John W. deGravelles on 02/20/2015. (This is a TEXT ENTRY ONLY. There is no hyperlink or PDF document associated with this entry.)(KDC) (Entered: 02/20/2015)"
        },
        {
          "row_number": 496,
          "id": 9012557,
          "entry_number": "90",
          "date_filed": "2015-02-24T00:00:00-05:00",
          "attachments": null,
          "url": "https://www.courtlistener.com/docket/4271273/90/june-medical-services-llc-v-caldwell/",
          "recap_pdf_url": null,
          "pacer_doc_id": "08701628427",
          "description": "MOTION for Oral Argument on 87 MOTION for Partial Summary Judgment by Mark Henry Dawson, Kathy Kliebert. (Attachments: # 1 Memorandum in Support Defendants' Memorandum in Support of Motion for Oral Argument, # 2 Proposed Pleading; Proposed Order)(Duncan, S.) (Entered: 02/24/2015)"
        },
        {
          "row_number": 497,
          "id": 9012558,
          "entry_number": "91",
          "date_filed": "2015-02-26T00:00:00-05:00",
          "attachments": null,
          "url": "https://www.courtlistener.com/docket/4271273/91/june-medical-services-llc-v-caldwell/",
          "recap_pdf_url": null,
          "pacer_doc_id": "08701629824",
          "description": "Supplemental STATUS REPORT Regarding Pending Applications for Privileges by All Plaintiffs. (Rittenberg, William) (Entered: 02/26/2015)"
        },
        {
          "row_number": 498,
          "id": 9012559,
          "entry_number": "92",
          "date_filed": "2015-03-03T00:00:00-05:00",
          "attachments": null,
          "url": "https://www.courtlistener.com/docket/4271273/92/june-medical-services-llc-v-caldwell/",
          "recap_pdf_url": null,
          "pacer_doc_id": null,
          "description": "ORDER granting 90 MOTION for Oral Argument on 87 MOTION for Partial Summary Judgment, 87 MOTION for Partial Summary Judgment set for hearing on 3/19/2015 at 1:00 PM in Courtroom 1 before Judge John W. deGravelles. The Pretrial Conference is reset for 3/19/2015 at 1:00 PM before Judge John W. deGravelles. The Court will conduct the pretrial conference immediately after oral argument. Signed by Judge John W. deGravelles on 03/03/2015. (This is a TEXT ENTRY ONLY. There is no hyperlink or PDF document associated with this entry.)(KDC) (Entered: 03/03/2015)"
        },
        {
          "row_number": 499,
          "id": 9012560,
          "entry_number": "93",
          "date_filed": "2015-03-06T00:00:00-05:00",
          "attachments": null,
          "url": "https://www.courtlistener.com/docket/4271273/93/june-medical-services-llc-v-caldwell/",
          "recap_pdf_url": null,
          "pacer_doc_id": "08701633709",
          "description": "SEALED MOTION for Leave to File Plaintiffs' Reply In Support Of Their Motion For A Preliminary Injunction Under Seal by All Plaintiffs. (Attachments: # 1 Plaintiffs' Reply In Support Of Their Motion For A Preliminary Injunction)(Rittenberg, William) Modified on 3/15/2021 to unseal docs as per Order #413 (LLH). (Entered: 03/06/2015)"
        },
        {
          "row_number": 500,
          "id": 9012561,
          "entry_number": "94",
          "date_filed": "2015-03-06T00:00:00-05:00",
          "attachments": null,
          "url": "https://www.courtlistener.com/docket/4271273/94/june-medical-services-llc-v-caldwell/",
          "recap_pdf_url": null,
          "pacer_doc_id": "08701633727",
          "description": "MOTION for Leave to File Plaintiffs' Opposition to Defendants' Motion for Partial Summary Judgment Under Seal by All Plaintiffs. (Attachments: # 1 Plaintiffs' Opposition to Defendants' Motion for Partial Summary Judgment, # 2 Plaintiffs' Response to Defendants' Statement of Undisputed Facts, # 3 Abrams Declaration, # 4 Abrams Ex. 1, # 5 Abrams Ex. 2, # 6 Abrams Ex. 3, # 7 Abrams Ex. 4, # 8 Abrams Ex. 5, # 9 Abrams Ex. 6, # 10 Abrams Ex. 7, # 11 Abrams Ex. 8, # 12 Abrams Ex. 9, # 13 Abrams Ex. 10, # 14 Abrams Ex. 11, # 15 Abrams Ex. 12, # 16 Abrams Ex. 13, # 17 Abrams Ex. 14, # 18 Abrams Ex. 15, # 19 Abrams Ex. 16, # 20 Abrams Ex. 17, # 21 Abrams Ex. 18, # 22 Abrams Ex. 19, # 23 Abrams Ex. 20, # 24 Abrams Ex. 21, # 25 Abrams Ex. 22)(Rittenberg, William) Modified on 3/15/2021 to unseal docs as per Order #413 (LLH). (Entered: 03/06/2015)"
        },
        {
          "row_number": 502,
          "id": 9012563,
          "entry_number": "96",
          "date_filed": "2015-03-10T00:00:00-04:00",
          "attachments": null,
          "url": "https://www.courtlistener.com/docket/4271273/96/june-medical-services-llc-v-caldwell/",
          "recap_pdf_url": null,
          "pacer_doc_id": "08701635150",
          "description": "MOTION in Limine to Preclude Expert Testimony of Dr. Tumulesh Solanky by All Plaintiffs. (Attachments: # 1 Memorandum in Support Memorandum of Law In Support of Plaintiffs' Motion in Limine to Preclude Expert Testimony of Dr. Solanky, # 2 Exhibit Exhibit A, # 3 Proposed Pleading; Proposed Order)(Rittenberg, William) Modified to edit text on 3/11/2015 (BCL). (Entered: 03/10/2015)"
        },
        {
          "row_number": 503,
          "id": 9012564,
          "entry_number": "97",
          "date_filed": "2015-03-10T00:00:00-04:00",
          "attachments": null,
          "url": "https://www.courtlistener.com/docket/4271273/97/june-medical-services-llc-v-caldwell/",
          "recap_pdf_url": null,
          "pacer_doc_id": "08701635156",
          "description": "MOTION in Limine to Preclude Expert Report and Testimony by Dr. McMillan by All Plaintiffs. (Attachments: # 1 Memorandum in Support of Plaintiff's Motion to Preclude Expert Testimony by Dr. McMillan, # 2 Exhibit Exhibit A, # 3 Exhibit Exhibit B, # 4 Proposed Pleading; Proposed Order)(Rittenberg, William) Modified to edit text 3/11/2015 (BCL). (Entered: 03/10/2015)"
        },
        {
          "row_number": 7,
          "id": 9012572,
          "entry_number": "105",
          "date_filed": "2015-03-13T00:00:00-04:00",
          "attachments": null,
          "url": "https://www.courtlistener.com/docket/4271273/105/june-medical-services-llc-v-caldwell/",
          "recap_pdf_url": null,
          "pacer_doc_id": "08701637156",
          "description": "Objections to Defendant's Witness List by Bossier City Medical Suite, Choice Inc. of Texas, John Doe 1, John Doe 2, June Medical Services LLC. (For your free look at document, enter your ECF login and pw to confirm your right to view). (Rittenberg, William) Modified to edit text on 3/16/2015 (SMG). (Entered: 03/13/2015)"
        },
        {
          "row_number": 8,
          "id": 9012573,
          "entry_number": "106",
          "date_filed": "2015-03-13T00:00:00-04:00",
          "attachments": null,
          "url": "https://www.courtlistener.com/docket/4271273/106/june-medical-services-llc-v-caldwell/",
          "recap_pdf_url": null,
          "pacer_doc_id": "08701637159",
          "description": "Plaintiffs' Objections to Defendants' Exhibit List by Bossier City Medical Suite, Choice Inc. of Texas, John Doe 1, John Doe 2, June Medical Services LLC.. (Rittenberg, William) Modified to edit text on 3/16/2015 (SMG). (Entered: 03/13/2015)"
        },
        {
          "row_number": 9,
          "id": 9012574,
          "entry_number": "107",
          "date_filed": "2015-03-13T00:00:00-04:00",
          "attachments": null,
          "url": "https://www.courtlistener.com/docket/4271273/107/june-medical-services-llc-v-caldwell/",
          "recap_pdf_url": null,
          "pacer_doc_id": "08701637165",
          "description": "REPLY in Support of 87 MOTION for Partial Summary Judgment filed by Mark Henry Dawson, Kathy Kliebert. (Attachments: # 1 Affidavit Declaration of J. Michael Johnson, # 2 Exhibit Johnson Declaration Ex #1, # 3 Exhibit Johnson Declaration Ex #2, # 4 Exhibit Johnson Declaration Ex #3, # 5 Exhibit Johnson Declaration Ex #4, # 6 Exhibit Johnson Declaration Ex #5)(Duncan, S.) Modified to edit text on 3/16/2015 (SMG). (Entered: 03/13/2015)"
        },
        {
          "row_number": 10,
          "id": 9012575,
          "entry_number": "108",
          "date_filed": "2015-03-13T00:00:00-04:00",
          "attachments": null,
          "url": "https://www.courtlistener.com/docket/4271273/108/june-medical-services-llc-v-caldwell/",
          "recap_pdf_url": null,
          "pacer_doc_id": "08701637174",
          "description": "Defendant's Objections to Plaintiffs' Witness and Exhibit Lists by Kathy Kliebert. (Attachments: # 1 Exhibit Plaintiffs' Witness List, # 2 Exhibit Plaintiffs' Exhibit List)(Duncan, S.) Modified to edit text on 3/16/2015 (SMG). (Entered: 03/13/2015)"
        },
        {
          "row_number": 17,
          "id": 9012581,
          "entry_number": "114",
          "date_filed": "2015-03-17T00:00:00-04:00",
          "attachments": null,
          "url": "https://www.courtlistener.com/docket/4271273/114/june-medical-services-llc-v-caldwell/",
          "recap_pdf_url": null,
          "pacer_doc_id": "08701638611",
          "description": "MEMORANDUM in Opposition to 96 MOTION in Limine to Preclude Expert Testimony of Dr. Tumulesh Solanky filed by Kathy Kliebert. (Attachments: # 1 Exhibit Solanky Report)(Duncan, S.) (Entered: 03/17/2015)"
        },
        {
          "row_number": 18,
          "id": 9012582,
          "entry_number": "115",
          "date_filed": "2015-03-17T00:00:00-04:00",
          "attachments": null,
          "url": "https://www.courtlistener.com/docket/4271273/115/june-medical-services-llc-v-caldwell/",
          "recap_pdf_url": null,
          "pacer_doc_id": null,
          "description": "STRICKEN FROM THE RECORD MEMORANDUM in Opposition to 98 MOTION in Limine to Exclude Evidence of DHH Deficiency Reports and Related Evidence filed by Kathy Kliebert. (Johnson, J.) Modified to edit text on 3/18/2015 (BCL). Modified on 3/25/2015 to remove the document as it has been stricken in accordance with record document 130(NLT). (Entered: 03/17/2015)"
        },
        {
          "row_number": 19,
          "id": 9012583,
          "entry_number": "116",
          "date_filed": "2015-03-18T00:00:00-04:00",
          "attachments": null,
          "url": "https://www.courtlistener.com/docket/4271273/116/june-medical-services-llc-v-caldwell/",
          "recap_pdf_url": null,
          "pacer_doc_id": "08701638621",
          "description": "MEMORANDUM in Opposition to 98 MOTION in Limine to Exclude Evidence of DHH Deficiency Reports and Related Evidence filed by Kathy Kliebert. (Johnson, J.) Modified to edit text on 3/18/2015 (BCL). (Entered: 03/18/2015)"
        },
        {
          "row_number": 20,
          "id": 9012584,
          "entry_number": "117",
          "date_filed": "2015-03-18T00:00:00-04:00",
          "attachments": null,
          "url": "https://www.courtlistener.com/docket/4271273/117/june-medical-services-llc-v-caldwell/",
          "recap_pdf_url": null,
          "pacer_doc_id": "08701638687",
          "description": "ORDER granting 112 Sealed Motion for Leave to File Plaintiffs' Opposition to Defendants' Motion in Limine to Exclude the Expert Testimony of Dr. Sheila Katz, Ph.D. Signed by Judge John W. deGravelles on 3/18/2015. (JDL) (Entered: 03/18/2015)"
        },
        {
          "row_number": 22,
          "id": 9012586,
          "entry_number": "119",
          "date_filed": "2015-03-18T00:00:00-04:00",
          "attachments": null,
          "url": "https://www.courtlistener.com/docket/4271273/119/june-medical-services-llc-v-caldwell/",
          "recap_pdf_url": null,
          "pacer_doc_id": "08701638714",
          "description": "ORDER granting 113 Sealed Motion for Leave to File Plaintiffs' Opposition to Defendants' Motion in Limine to Exclude Evidence Under Seal. Signed by Judge John W. deGravelles on 3/18/2015. (JDL) (Entered: 03/18/2015)"
        },
        {
          "row_number": 24,
          "id": 9012587,
          "entry_number": "120",
          "date_filed": "2015-03-18T00:00:00-04:00",
          "attachments": null,
          "url": "https://www.courtlistener.com/docket/4271273/120/june-medical-services-llc-v-caldwell/",
          "recap_pdf_url": null,
          "pacer_doc_id": "08701638728",
          "description": "SEALED MEMORANDUM of Law in Opposition to 95 MOTION in Limine to Exclude Irrelevant Evidence filed by All Plaintiffs. (Attachments: # 1 Declaration of Hanna Abrams, # 2 Exhibit 1, # 3 Exhibit 2, # 4 Exhibit 3, # 5 Exhibit 4, # 6 Exhibit 5)(JDL) (Entered: 03/18/2015)"
        },
        {
          "row_number": 31,
          "id": 9012596,
          "entry_number": "127",
          "date_filed": "2015-03-20T00:00:00-04:00",
          "attachments": null,
          "url": "https://www.courtlistener.com/docket/4271273/127/june-medical-services-llc-v-caldwell/",
          "recap_pdf_url": "https://www.courtlistener.com/recap/gov.uscourts.lamd.46729.127.0.pdf",
          "pacer_doc_id": "08701640316",
          "description": "REPLY Memorandum to 99 MOTION to Exclude the Expert Testimony of Sheila Katz Ph.D. filed by Kathy Kliebert. (Johnson, J.) Modified to edit text on 3/23/2015 (SMG). (Entered: 03/20/2015)"
        },
        {
          "row_number": 37,
          "id": 9012600,
          "entry_number": "132",
          "date_filed": "2015-03-24T00:00:00-04:00",
          "attachments": null,
          "url": "https://www.courtlistener.com/docket/4271273/132/june-medical-services-llc-v-caldwell/",
          "recap_pdf_url": null,
          "pacer_doc_id": "08701641341",
          "description": "Letter dated 3/24/2015 to Judge deGravelles from Ilene Jaroslaw re: New Decision in Planned Parenthood of Wisc., Inc. v. Van Hollen (Mar. 20, 2015) by Bossier City Medical Suite, Choice Inc. of Texas, John Doe 1, John Doe 2, June Medical Services LLC (Rittenberg, William) Modified to edit text on 3/24/2015 (SMG). (Entered: 03/24/2015)"
        },
        {
          "row_number": 41,
          "id": 9012603,
          "entry_number": "136",
          "date_filed": "2015-04-01T00:00:00-04:00",
          "attachments": null,
          "url": "https://www.courtlistener.com/docket/4271273/136/june-medical-services-llc-v-caldwell/",
          "recap_pdf_url": "https://www.courtlistener.com/recap/gov.uscourts.lamd.46729.136.0.pdf",
          "pacer_doc_id": "08701647943",
          "description": "Minute Entry for proceedings held before Judge John W. deGravelles: Motion Hearing held on 4/1/2015. Counsel presented arguments. The 95 Motion in Limine to Exclude Irrelevant Evidence is taken under advisement. The 96 Motion in Limine to Preclude Expert Testimony of Dr. Tumulesh Solanky is DENIED. Since the Defendants do not intend to call Dr. McMillian as a witness, the 97 Motion in Limine is DENIED as moot. the 98 Motion in Limine to Exclude Evidence of DHH Deficiency Reports and Related Evidence is take under advisement. The 99 Motion to Exclude the Expert testimony of Sheila Katz, PHD is DENIED. (Court Reporter S. Thompson.) (LLH) (Entered: 04/08/2015)"
        },
        {
          "row_number": 40,
          "id": 9012604,
          "entry_number": "135",
          "date_filed": "2015-04-08T00:00:00-04:00",
          "attachments": null,
          "url": "https://www.courtlistener.com/docket/4271273/135/june-medical-services-llc-v-caldwell/",
          "recap_pdf_url": null,
          "pacer_doc_id": "08701647816",
          "description": "TRANSCRIPT REQUEST by Bossier City Medical Suite, Choice Inc. of Texas, John Doe 1, John Doe 2, June Medical Services LLC for proceedings held on April 1, 2015 before Judge John W. deGravelles.. (Rittenberg, William) Modified on 4/8/2015 to flatten document(LLH). (Entered: 04/08/2015)"
        },
        {
          "row_number": 47,
          "id": 9012610,
          "entry_number": "141",
          "date_filed": "2015-05-22T00:00:00-04:00",
          "attachments": null,
          "url": "https://www.courtlistener.com/docket/4271273/141/june-medical-services-llc-v-caldwell/",
          "recap_pdf_url": null,
          "pacer_doc_id": null,
          "description": "Notice to Counsel: Telephone Conference set for 6/9/2015 at 3:30 PM (Central Time) before Judge John W. deGravelles. Counsel for Plaintiffs shall coordinate the conference call to the Court. (This is a TEXT ENTRY ONLY. There is no hyperlink or PDF document associated with this entry.)(KDC) (Entered: 05/22/2015)"
        },
        {
          "row_number": 51,
          "id": 9012617,
          "entry_number": "145",
          "date_filed": "2015-06-11T00:00:00-04:00",
          "attachments": null,
          "url": "https://www.courtlistener.com/docket/4271273/145/june-medical-services-llc-v-caldwell/",
          "recap_pdf_url": null,
          "pacer_doc_id": null,
          "description": "Notice to Counsel: Telephone Conference set for 6/12/2015 at 1:30 PM before Judge John W. deGravelles. Counsel for Plaintiff agreed to circulate a telephone call in number for the conference.(This is a TEXT ENTRY ONLY. There is no hyperlink or PDF document associated with this entry.)(KDC) (Entered: 06/11/2015)"
        },
        {
          "row_number": 53,
          "id": 9012618,
          "entry_number": "147",
          "date_filed": "2015-06-12T00:00:00-04:00",
          "attachments": null,
          "url": "https://www.courtlistener.com/docket/4271273/147/june-medical-services-llc-v-caldwell/",
          "recap_pdf_url": null,
          "pacer_doc_id": "08701676084",
          "description": "TRANSCRIPT REQUEST by Bossier City Medical Suite, Choice Inc. of Texas, John Doe 1, John Doe 2, June Medical Services LLC for proceedings held on April 1, 2015 before Judge John W. deGravelles.. (Rittenberg, William) (Entered: 06/12/2015)"
        },
        {
          "row_number": 54,
          "id": 9012619,
          "entry_number": "148",
          "date_filed": "2015-06-12T00:00:00-04:00",
          "attachments": null,
          "url": "https://www.courtlistener.com/docket/4271273/148/june-medical-services-llc-v-caldwell/",
          "recap_pdf_url": null,
          "pacer_doc_id": "08701676311",
          "description": "Minute Entry for proceedings held before Judge John W. deGravelles: Telephone Conference held on 6/12/2015. Motion to Reconsider Rulings on Summary Judgment and Motion in Limine were discussed. The trial currently set remains. (NLT) (Entered: 06/12/2015)"
        },
        {
