{
  "case_id": 17485,
  "fetched_at": "2025-10-22T00:30:50.455653",
  "case_data": {
    "attorney_orgs": [
      "ACLU Affiliates (any)"
    ],
    "available_documents": [
      "Trial Court Docket",
      "Complaint (any)",
      "Injunctive (or Injunctive-like) Relief"
    ],
    "case_defendants": [
      {
        "defendant_level": null,
        "institution": "Sheriff of Weld County",
        "institution_alt_state": null,
        "institution_city": "",
        "institution_county": "Weld",
        "name": "Weld County",
        "defendant_level_other": "",
        "is_active": true
      }
    ],
    "case_ongoing": "No",
    "case_status": "Coding Complete",
    "case_types": [
      "Jail Conditions",
      "Healthcare Access and Reproductive Issues"
    ],
    "cause_other": "",
    "causes": [
      "42 U.S.C. ยง 1983",
      "Declaratory Judgment Act, 28 U.S.C. ยง 2201"
    ],
    "class_action_granted": "Granted",
    "class_action_sought": "Yes",
    "closing_year": 2021,
    "constitutional_clause": [
      {
        "value": "Due Process"
      },
      {
        "value": "Due Process: Substantive Due Process"
      },
      {
        "value": "Cruel and Unusual Punishment"
      }
    ],
    "content_of_injunction": [
      {
        "value": "Preliminary relief granted"
      }
    ],
    "court": "District of Colorado",
    "custom_issues": [],
    "defendant_payment": "$122,387.60",
    "defendant_type": [
      {
        "value": "Jurisdiction-wide"
      },
      {
        "value": "Corrections"
      }
    ],
    "docket_status": "Complete as of retrieval date",
    "facility_type": [
      {
        "value": "Government-run"
      }
    ],
    "filing_date": "2020-04-07",
    "filing_year": 2020,
    "id": 17485,
    "injunction_duration": "",
    "issues": [
      "Jails, Prisons, Detention Centers, and Other Institutions: Crowding (General)",
      "General/Misc.: Sanitation / living conditions",
      "Medical/Mental Health Care: Medical care, general",
      "General/Misc.: Conditions of confinement",
      "COVID-19: Mitigation Requested",
      "COVID-19: Mitigation Granted",
      "COVID-19: Release Requested",
      "COVID-19: Mitigation Denied",
      "COVID-19: Release Denied",
      "General/Misc.: Bathing and hygiene",
      "COVID-19: Transfer-ordered or process created/modified",
      "COVID-19: CDC Guidance ordered implemented",
      "COVID-19: Social distancing ordered",
      "COVID-19: Quarantine/isolation ordered",
      "COVID-19: Contact tracing ordered",
      "COVID-19: COVID testing ordered/modified",
      "COVID-19: Wellness/temperature checks ordered",
      "COVID-19: PPE-ordered provided to prisoners for free",
      "COVID-19: Sanitizer/Handsoap ordered made available/used",
      "COVID-19: Solitary confinement regulated",
      "COVID-19: COVID reporting ordered",
      "COVID-19: Attorneys fees or sanctions ordered"
    ],
    "last_checked_date": "2021-03-19T00:00:00-04:00",
    "main_docket": {
      "id": 28011,
      "docket_entries": [
        {
          "row_number": 47,
          "id": 8606528,
          "entry_number": "4",
          "date_filed": "2020-04-08T00:00:00-04:00",
          "attachments": [],
          "url": "https://www.courtlistener.com/docket/17051431/4/carranza-v-reams/",
          "recap_pdf_url": null,
          "pacer_doc_id": "03908761717",
          "description": "NOTICE of Entry of Appearance by Mark Silverstein on behalf of Richard Barnum, Thomas LewisAttorney Mark Silverstein added to party Richard Barnum(pty:pla), Attorney Mark Silverstein added to party Thomas Lewis(pty:pla) (Silverstein, Mark) (Entered: 04/08/2020)"
        },
        {
          "row_number": 21,
          "id": 8606540,
          "entry_number": "16",
          "date_filed": "2020-04-08T00:00:00-04:00",
          "attachments": [],
          "url": "https://www.courtlistener.com/docket/17051431/16/carranza-v-reams/",
          "recap_pdf_url": null,
          "pacer_doc_id": "03908762453",
          "description": "NOTICE of Entry of Appearance by David A. Lane on behalf of Thomas Carranza, Chad Hunter, Jesus Martinez, Colby Propes, Michael WardAttorney David A. Lane added to party Thomas Carranza(pty:pla), Attorney David A. Lane added to party Chad Hunter(pty:pla), Attorney David A. Lane added to party Jesus Martinez(pty:pla), Attorney David A. Lane added to party Colby Propes(pty:pla), Attorney David A. Lane added to party Michael Ward(pty:pla) (Lane, David) (Entered: 04/08/2020)"
        },
        {
          "row_number": 23,
          "id": 8606542,
          "entry_number": "18",
          "date_filed": "2020-04-08T00:00:00-04:00",
          "attachments": [],
          "url": "https://www.courtlistener.com/docket/17051431/18/carranza-v-reams/",
          "recap_pdf_url": null,
          "pacer_doc_id": "03908762534",
          "description": "NOTICE of Entry of Appearance by David George Maxted on behalf of Thomas Carranza, Chad Hunter, Jesus Martinez, Colby Propes, Michael WardAttorney David George Maxted added to party Thomas Carranza(pty:pla), Attorney David George Maxted added to party Chad Hunter(pty:pla), Attorney David George Maxted added to party Jesus Martinez(pty:pla), Attorney David George Maxted added to party Colby Propes(pty:pla), Attorney David George Maxted added to party Michael Ward(pty:pla) (Maxted, David) (Entered: 04/08/2020)"
        },
        {
          "row_number": 24,
          "id": 8606543,
          "entry_number": "19",
          "date_filed": "2020-04-08T00:00:00-04:00",
          "attachments": [],
          "url": "https://www.courtlistener.com/docket/17051431/19/carranza-v-reams/",
          "recap_pdf_url": null,
          "pacer_doc_id": "03908763161",
          "description": "WAIVER OF SERVICE Returned Executed by Colby Propes, Richard Barnum, Chad Hunter, Jesus Martinez, Thomas Carranza, Thomas Lewis, Michael Ward. Steven Reams waiver sent on 4/8/2020, answer due 6/8/2020. (McNulty, Andrew) (Entered: 04/08/2020)"
        },
        {
          "row_number": 26,
          "id": 8606544,
          "entry_number": "20",
          "date_filed": "2020-04-08T00:00:00-04:00",
          "attachments": [],
          "url": "https://www.courtlistener.com/docket/17051431/20/carranza-v-reams/",
          "recap_pdf_url": null,
          "pacer_doc_id": "03908763517",
          "description": "NOTICE of Entry of Appearance by Matthew Joseph Hegarty on behalf of Steven ReamsAttorney Matthew Joseph Hegarty added to party Steven Reams(pty:dft) (Hegarty, Matthew) (Entered: 04/08/2020)"
        },
        {
          "row_number": 29,
          "id": 8606547,
          "entry_number": "23",
          "date_filed": "2020-04-08T00:00:00-04:00",
          "attachments": [],
          "url": "https://www.courtlistener.com/docket/17051431/23/carranza-v-reams/",
          "recap_pdf_url": null,
          "pacer_doc_id": "03908763677",
          "description": "MINUTE ORDER by Chief Judge Philip A. Brimmer on 4/8/2020, re: 1 MOTION for Temporary Restraining Order Preliminary Injunction and Expedited Hearing filed by Chad Hunter, Michael Ward, Thomas Carranza, Jesus Martinez, Colby Propes. ORDERED that defendant shall file a response to that portion of plaintiffs' motion seeking a temporary restraining order and expedited hearing on or before April 13, 2020, at 9:00 a.m.. (sphil, ) (Entered: 04/09/2020)"
        },
        {
          "row_number": 30,
          "id": 8606548,
          "entry_number": "24",
          "date_filed": "2020-04-13T00:00:00-04:00",
          "attachments": [],
          "url": "https://www.courtlistener.com/docket/17051431/24/carranza-v-reams/",
          "recap_pdf_url": null,
          "pacer_doc_id": "03908768201",
          "description": "Unopposed MOTION for Leave to File Excess Pages for Response to Motion for Temporary Restraining Order, Preliminary Injunction, and Expedited Hearing [ECF 1] by Defendant Steven Reams. (Hegarty, Matthew) (Entered: 04/13/2020)"
        },
        {
          "row_number": 31,
          "id": 8606551,
          "entry_number": "25",
          "date_filed": "2020-04-13T00:00:00-04:00",
          "attachments": [],
          "url": "https://www.courtlistener.com/docket/17051431/25/carranza-v-reams/",
          "recap_pdf_url": null,
          "pacer_doc_id": null,
          "description": "ORDER by Chief Judge Philip A. Brimmer on 4/13/2020 re: 24 Motion for Leave to File Excess Pages is GRANTED. Defendant may file a response not to exceed 42 pages. Text Only Entry(pabsec2) (Entered: 04/13/2020)"
        },
        {
          "row_number": 37,
          "id": 8606556,
          "entry_number": "30",
          "date_filed": "2020-04-15T00:00:00-04:00",
          "attachments": [],
          "url": "https://www.courtlistener.com/docket/17051431/30/carranza-v-reams/",
          "recap_pdf_url": null,
          "pacer_doc_id": "03908772680",
          "description": "MINUTE ORDER by Chief Judge Philip A. Brimmer on 4/15/2020, re: 29 plaintiffs' Withdrawal of Request for Temporary RestrainingOrder and Request for Setting of Preliminary Injunction Hearing is GRANTED. ORDERED that the portion of plaintiffs' Motion for Temporary Restraining Order, Preliminary Injunction, and Expedited Hearing [Docket No. 1] seeking a temporary restraining order is WITHDRAWN. ORDERED that counsel shall jointly contact Chambers via conference call (303- 335-2794) on April 21, 2020 to schedule a preliminary injunction hearing for the week of April 27, 2020..(sphil, ) Modified on 4/15/2020 to edit text. (sphil, ). (Entered: 04/15/2020)"
        },
        {
          "row_number": 115,
          "id": 8606558,
          "entry_number": null,
          "date_filed": "2020-04-17T00:00:00-04:00",
          "attachments": [],
          "url": "https://www.courtlistener.com",
          "recap_pdf_url": null,
          "pacer_doc_id": null,
          "description": "Minute Order"
        },
        {
          "row_number": 39,
          "id": 8606559,
          "entry_number": "32",
          "date_filed": "2020-04-17T00:00:00-04:00",
          "attachments": [],
          "url": "https://www.courtlistener.com/docket/17051431/32/carranza-v-reams/",
          "recap_pdf_url": null,
          "pacer_doc_id": "03908777018",
          "description": "Witness List by Plaintiffs Richard Barnum, Thomas Carranza, Chad Hunter, Thomas Lewis, Jesus Martinez, Colby Propes, Michael Ward. (Williams, Daniel) (Entered: 04/17/2020)"
        },
        {
          "row_number": 40,
          "id": 8606560,
          "entry_number": "33",
          "date_filed": "2020-04-17T00:00:00-04:00",
          "attachments": [],
          "url": "https://www.courtlistener.com/docket/17051431/33/carranza-v-reams/",
          "recap_pdf_url": null,
          "pacer_doc_id": null,
          "description": "MINUTE ORDER by Chief Judge Philip A. Brimmer on 4/17/2020. Defendant shall file a response to plaintiffs' 31 Emergency Motion for Discovery, not to exceed 10 pages, on or before 4/20/2020 at 12:00 p.m. Text Only Entry (pabsec2) (Entered: 04/17/2020)"
        },
        {
          "row_number": 42,
          "id": 8606562,
          "entry_number": "35",
          "date_filed": "2020-04-20T00:00:00-04:00",
          "attachments": [],
          "url": "https://www.courtlistener.com/docket/17051431/35/carranza-v-reams/",
          "recap_pdf_url": null,
          "pacer_doc_id": "03908779714",
          "description": "Witness List by Defendant Steven Reams. (Hegarty, Matthew) (Entered: 04/20/2020)"
        },
        {
          "row_number": 46,
          "id": 8606567,
          "entry_number": "39",
          "date_filed": "2020-04-22T00:00:00-04:00",
          "attachments": [],
          "url": "https://www.courtlistener.com/docket/17051431/39/carranza-v-reams/",
          "recap_pdf_url": null,
          "pacer_doc_id": "03908784497",
          "description": "MINUTE ORDER by Chief Judge Philip A. Brimmer on 4/21/2020. ORDERED A preliminary injunction hearing is set for Thursday, April 30, 2020 at 8:00 a.m. before Chief Judge Philip A. Brimmer in Courtroom A 701 and will be conducted VIA VIDEO TELECONFERENCE. ORDERED A Status Conference is set for Thursday, April 23, 2020 at 2:00 p.m. before Chief Judge Philip A. Brimmer in Courtroom A 701 and will be conducted VIA VIDEO TELECONFERENCE. The Court will provide the participants with instructions for connecting to the status conference via email. The public may access the hearing by following the procedures outlined in General Order 2020-3. ORDERED that the parties shall exchange with each other, and submit to the Court, their exhibits on or before April 24, 2020. ORDERED that the parties shall file any updated witness lists with the Court on or before April 24, 2020. ORDERED that defendant shall file a response to plaintiffs motion for a preliminary injunction, not to exceed 15 pages, by April 24, 2020 at noon. ORDERED that plaintiff may file a reply, not to exceed 10 pages, by April 28, 2020 at noon. Text Only Entry (pabsec2, ) (Entered: 04/22/2020)"
        },
        {
          "row_number": 50,
          "id": 8606570,
          "entry_number": "42",
          "date_filed": "2020-04-24T00:00:00-04:00",
          "attachments": [],
          "url": "https://www.courtlistener.com/docket/17051431/42/carranza-v-reams/",
          "recap_pdf_url": null,
          "pacer_doc_id": "03908789172",
          "description": "Witness List - Revised by Plaintiffs Richard Barnum, Thomas Carranza, Chad Hunter, Thomas Lewis, Jesus Martinez, Colby Propes, Michael Ward. (Williams, Daniel) (Entered: 04/24/2020)"
        },
        {
          "row_number": 52,
          "id": 8606572,
          "entry_number": "44",
          "date_filed": "2020-04-24T00:00:00-04:00",
          "attachments": [],
          "url": "https://www.courtlistener.com/docket/17051431/44/carranza-v-reams/",
          "recap_pdf_url": null,
          "pacer_doc_id": "03908789185",
          "description": "Witness List REVISED by Defendant Steven Reams. (Hegarty, Matthew) (Entered: 04/24/2020)"
        },
        {
          "row_number": 54,
          "id": 8606574,
          "entry_number": "46",
          "date_filed": "2020-04-24T00:00:00-04:00",
          "attachments": [],
          "url": "https://www.courtlistener.com/docket/17051431/46/carranza-v-reams/",
          "recap_pdf_url": null,
          "pacer_doc_id": "03908789219",
          "description": "Exhibit List for Preliminary Injunction Hearing by Plaintiffs Richard Barnum, Thomas Carranza, Chad Hunter, Thomas Lewis, Jesus Martinez, Colby Propes, Michael Ward. (Hubbard, Jamie) (Entered: 04/24/2020)"
        },
        {
          "row_number": 56,
          "id": 8606576,
          "entry_number": "48",
          "date_filed": "2020-04-27T00:00:00-04:00",
          "attachments": [],
          "url": "https://www.courtlistener.com/docket/17051431/48/carranza-v-reams/",
          "recap_pdf_url": null,
          "pacer_doc_id": "03908790071",
          "description": "MINUTE ORDER by Chief Judge Philip A. Brimmer on 4/27/2020, re: 47 defendant's Motion for Protective Order is DENIED. (sphil, ) (Entered: 04/27/2020)"
        },
        {
          "row_number": 59,
          "id": 8606578,
          "entry_number": "50",
          "date_filed": "2020-04-29T00:00:00-04:00",
          "attachments": [],
          "url": "https://www.courtlistener.com/docket/17051431/50/carranza-v-reams/",
          "recap_pdf_url": null,
          "pacer_doc_id": "03908796243",
          "description": "NOTICE Joint Notice of Stipulation as to Authenticity and Admissibility of Certain Exhibits, and as to Areas of Expert Qualification, for Hearing on Plaintiffs Motion for Preliminary Injunction [ECF 1] by Defendant Steven Reams (Hegarty, Matthew) (Entered: 04/29/2020)"
        },
        {
          "row_number": 64,
          "id": 8606583,
          "entry_number": "55",
          "date_filed": "2020-05-11T00:00:00-04:00",
          "attachments": [],
          "url": "https://www.courtlistener.com/docket/17051431/55/carranza-v-reams/",
          "recap_pdf_url": "https://www.courtlistener.com/recap/gov.uscourts.cod.196804/gov.uscourts.cod.196804.55.0_1.pdf",
          "pacer_doc_id": "03908813462",
          "description": "ORDER by Chief Judge Philip A. Brimmer on 5/11/2020, re: 1 portion of plaintiffs' Motion for Temporary Restraining Order, Preliminary Injunction, and Expedited Hearing seeking a preliminary injunction is GRANTED IN PART. ORDERED that plaintiffs' motion for a preliminary injunction is otherwise is DENIED. ORDERED that, on or before May 18, 2020, at 5:00 p.m., defendant shall certify to the Court that he has compiled a list of those persons (\"medically vulnerable inmates\") currently held at the Weld County Jail who have one or more of the following conditions: are 65 years and older, have chronic lung disease or moderate to severeasthma, have serious heart conditions, are immunocompromised, have severe obesity, have diabetes, have chronic kidney disease and undergoing dialysis, or have liver disease. ORDERED that, on or before May 21, 2020, at 5:00 p.m., defendant is ordered to file a report with the Court, identifying what new policies have been instituted in accordance with this order. Defendant shall explain in such report what steps the Jail has taken to acquire an adequate mask supply for inmates housed in the Jail.(sphil, ) (Entered: 05/11/2020)"
        },
        {
          "row_number": 117,
          "id": 8606585,
          "entry_number": null,
          "date_filed": "2020-05-12T00:00:00-04:00",
          "attachments": [],
          "url": "https://www.courtlistener.com",
          "recap_pdf_url": null,
          "pacer_doc_id": null,
          "description": "Order Referring Case to Magistrate Judge"
        },
        {
          "row_number": 66,
          "id": 8606586,
          "entry_number": "57",
          "date_filed": "2020-05-12T00:00:00-04:00",
          "attachments": [],
          "url": "https://www.courtlistener.com/docket/17051431/57/carranza-v-reams/",
          "recap_pdf_url": null,
          "pacer_doc_id": "03908815933",
          "description": "ORDER OF RECUSAL by Magistrate Judge Michael E. Hegarty on 5/12/2020. The Clerk of the Court to cause this matter to be reassigned by random draw to another Magistrate Judge. (tsher, ) (Entered: 05/12/2020)"
        },
        {
          "row_number": 67,
          "id": 8606587,
          "entry_number": "58",
          "date_filed": "2020-05-12T00:00:00-04:00",
          "attachments": [],
          "url": "https://www.courtlistener.com/docket/17051431/58/carranza-v-reams/",
          "recap_pdf_url": null,
          "pacer_doc_id": null,
          "description": "CASE REASSIGNED pursuant 57 Order of Recusal. This case is randomly reassigned to Magistrate Judge S. Kato Crews. All future pleadings should be designated as 20-cv-00977-PAB-SKC. (Text Only Entry) (tsher, ) (Entered: 05/12/2020)"
        },
        {
          "row_number": 118,
          "id": 8606589,
          "entry_number": null,
          "date_filed": "2020-05-13T00:00:00-04:00",
          "attachments": [],
          "url": "https://www.courtlistener.com",
          "recap_pdf_url": null,
          "pacer_doc_id": null,
          "description": "Order"
        },
        {
          "row_number": 75,
          "id": 8606595,
          "entry_number": "65",
          "date_filed": "2020-06-08T00:00:00-04:00",
          "attachments": [],
          "url": "https://www.courtlistener.com/docket/17051431/65/carranza-v-reams/",
          "recap_pdf_url": null,
          "pacer_doc_id": "03908860554",
          "description": "Defendant's ANSWER to 7 Amended Complaint, by Steven Reams.(Hegarty, Matthew) (Entered: 06/08/2020)"
        },
        {
          "row_number": 78,
          "id": 8606598,
          "entry_number": "68",
          "date_filed": "2020-06-18T00:00:00-04:00",
          "attachments": [],
          "url": "https://www.courtlistener.com/docket/17051431/68/carranza-v-reams/",
          "recap_pdf_url": null,
          "pacer_doc_id": null,
          "description": "ORDER by Chief Judge Philip A. Brimmer on 6/18/2020 re: 67 Motion for Extension of Time to File Response/Reply is GRANTED. Plaintiffs shall file a reply to 2 Motion to Certify Class on or before June 29, 2020. Text Only Entry(pabsec2) (Entered: 06/18/2020)"
        },
        {
          "row_number": 82,
          "id": 8606603,
          "entry_number": "71",
          "date_filed": "2020-06-29T00:00:00-04:00",
          "attachments": [],
          "url": "https://www.courtlistener.com/docket/17051431/71/carranza-v-reams/",
          "recap_pdf_url": "https://www.courtlistener.com/recap/gov.uscourts.cod.196804/gov.uscourts.cod.196804.71.0.pdf",
          "pacer_doc_id": "03908895302",
          "description": "BRIEF in Support of 2 MOTION to Certify Class filed by Plaintiffs Richard Barnum, Thomas Carranza, Chad Hunter, Thomas Lewis, Jesus Martinez, Colby Propes, Michael Ward. (Williams, Daniel) (Entered: 06/29/2020)"
        },
        {
          "row_number": 85,
          "id": 8606606,
          "entry_number": "74",
          "date_filed": "2020-06-30T00:00:00-04:00",
          "attachments": [],
          "url": "https://www.courtlistener.com/docket/17051431/74/carranza-v-reams/",
          "recap_pdf_url": null,
          "pacer_doc_id": null,
          "description": "MINUTE ORDER re: Rule 16(b) Scheduling Conference. For the 7/9/2020 Scheduling Conference, the Parties may choose to appear in person or by telephone. However, the Parties must convey their respective decision re: appearance with each other first. Then, they shall inform the Court of their respective decisions by joint email to Crews_Chambers@cod.uscourts.gov on or before 7/3/2020. Any party appearing by telephone shall dial into the Scheduling Conference by using the following dial in information:CONFERENCE CALL LINE: (888) 251-2909ACCESS CODE: 5662814# SO ORDERED by Magistrate Judge S. Kato Crews on 6/30/2020. Text Only Entry (skclc2) (Entered: 06/30/2020)"
        },
        {
          "row_number": 121,
          "id": 8606608,
          "entry_number": null,
          "date_filed": "2020-06-30T00:00:00-04:00",
          "attachments": [],
          "url": "https://www.courtlistener.com",
          "recap_pdf_url": null,
          "pacer_doc_id": null,
          "description": "Minute Order"
        },
        {
          "row_number": 90,
          "id": 8606613,
          "entry_number": "79",
          "date_filed": "2020-07-09T00:00:00-04:00",
          "attachments": [],
          "url": "https://www.courtlistener.com/docket/17051431/79/carranza-v-reams/",
          "recap_pdf_url": null,
          "pacer_doc_id": "03908913816",
          "description": "COURTROOM MINUTES for proceedings held before Magistrate Judge S. Kato Crews: Telephone Scheduling Conference held on 7/9/2020. Discovery due by 12/18/2020. Dispositive Motions due by 1/22/2021. Joint Status Report due by 9/22/2020. Telephone Final Pretrial Conference set for 3/25/2021 10:00 AM in Courtroom C201 before Magistrate Judge S. Kato Crews. FTR: Courtroom C-201. (amont, ) (Entered: 07/09/2020)"
        },
        {
          "row_number": 92,
          "id": 8606614,
          "entry_number": "80",
          "date_filed": "2020-07-09T00:00:00-04:00",
          "attachments": [],
          "url": "https://www.courtlistener.com/docket/17051431/80/carranza-v-reams/",
          "recap_pdf_url": null,
          "pacer_doc_id": "03908913822",
          "description": "SCHEDULING ORDER: by Magistrate Judge S. Kato Crews on 7/9/2020. (amont, ) (Entered: 07/09/2020)"
        },
        {
          "row_number": 93,
          "id": 8606615,
          "entry_number": "81",
          "date_filed": "2020-07-24T00:00:00-04:00",
          "attachments": [],
          "url": "https://www.courtlistener.com/docket/17051431/81/carranza-v-reams/",
          "recap_pdf_url": null,
          "pacer_doc_id": "03908941410",
          "description": "MOTION to Amend/Correct/Modify 55 Order on Motion for TRO,,,, Unopposed Motion to Renew Preliminary Injunction for Additional Thirty Days by Plaintiffs Richard Barnum, Thomas Carranza, Chad Hunter, Thomas Lewis, Jesus Martinez, Colby Propes, Michael Ward. (Williams, Daniel) (Entered: 07/24/2020)"
        },
        {
          "row_number": 94,
          "id": 8606616,
          "entry_number": "82",
          "date_filed": "2020-07-29T00:00:00-04:00",
          "attachments": [],
          "url": "https://www.courtlistener.com/docket/17051431/82/carranza-v-reams/",
          "recap_pdf_url": null,
          "pacer_doc_id": "03908949490",
          "description": "MINUTE ORDER by Chief Judge Philip A. Brimmer on 7/29/2020, re: 81 plaintiffs Unopposed Motion to Renew Preliminary Injunction for Additional Thirty Days is GRANTED. ORDERED that the Court's order granting a preliminary injunction, Docket No. 55, is extended to run an additional 30 days. The order will expire on September 8, 2020 unless extended by the Court.(sphil, ) (Entered: 07/29/2020)"
        },
        {
          "row_number": 95,
          "id": 8606617,
          "entry_number": "83",
          "date_filed": "2020-09-03T00:00:00-04:00",
          "attachments": [],
          "url": "https://www.courtlistener.com/docket/17051431/83/carranza-v-reams/",
          "recap_pdf_url": null,
          "pacer_doc_id": "03909018346",
          "description": "Second MOTION for Order to Renew Preliminary Injunction for Additional Thirty Days by Plaintiffs Richard Barnum, Thomas Carranza, Chad Hunter, Thomas Lewis, Jesus Martinez, Colby Propes, Michael Ward. (Hubbard, Jamie) (Entered: 09/03/2020)"
        },
        {
          "row_number": 96,
          "id": 8606618,
          "entry_number": "84",
          "date_filed": "2020-09-04T00:00:00-04:00",
          "attachments": [],
          "url": "https://www.courtlistener.com/docket/17051431/84/carranza-v-reams/",
          "recap_pdf_url": null,
          "pacer_doc_id": "03909020457",
          "description": "ORDER by Chief Judge Philip A. Brimmer on 9/4/2020, re: 83 Second MOTION to Renew Preliminary Injunction for Additional Thirty Days. ORDERED that the Court's order GRANTING a preliminary injunction, Docket No. 55, is extended to run an additional 30 days. The order will expire on October 8, 2020 unless extended by the Court.(sphil, ) (Entered: 09/04/2020)"
        },
        {
          "row_number": 98,
          "id": 8606620,
          "entry_number": "86",
          "date_filed": "2020-09-22T00:00:00-04:00",
          "attachments": [],
          "url": "https://www.courtlistener.com/docket/17051431/86/carranza-v-reams/",
          "recap_pdf_url": null,
          "pacer_doc_id": "03909050407",
          "description": "Joint STATUS REPORT by Plaintiffs Richard Barnum, Thomas Carranza, Chad Hunter, Thomas Lewis, Jesus Martinez, Colby Propes, Michael Ward. (Williams, Daniel) (Entered: 09/22/2020)"
        },
        {
          "row_number": 99,
          "id": 8606621,
          "entry_number": "87",
          "date_filed": "2020-10-06T00:00:00-04:00",
          "attachments": [],
          "url": "https://www.courtlistener.com/docket/17051431/87/carranza-v-reams/",
          "recap_pdf_url": null,
          "pacer_doc_id": "03909077162",
          "description": "Third Unopposed MOTION to Renew Preliminary Injunction by Plaintiffs Richard Barnum, Thomas Carranza, Chad Hunter, Thomas Lewis, Jesus Martinez, Colby Propes, Michael Ward. (Williams, Daniel) Modified on 10/7/2020 to correct event text (athom, ). (Entered: 10/06/2020)"
        },
        {
          "row_number": 103,
          "id": 8606624,
          "entry_number": "90",
          "date_filed": "2020-10-15T00:00:00-04:00",
          "attachments": [],
          "url": "https://www.courtlistener.com/docket/17051431/90/carranza-v-reams/",
          "recap_pdf_url": null,
          "pacer_doc_id": null,
          "description": "MEMORANDUM regarding 89 Unopposed MOTION for Extension of Time to Answer and Respond to Plaintiffs' First Set of Written Discovery to Defendant filed by Steven Reams. Motion referred to Magistrate Judge S. Kato Crews, by Chief Judge Philip A. Brimmer on 10/15/2020. Text Only Entry (pabsec2) (Entered: 10/15/2020)"
        },
        {
          "row_number": 104,
          "id": 8606626,
          "entry_number": "91",
          "date_filed": "2020-10-21T00:00:00-04:00",
          "attachments": null,
          "url": "https://www.courtlistener.com/docket/17051431/91/carranza-v-reams/",
          "recap_pdf_url": null,
          "pacer_doc_id": null,
          "description": "ORDER granting 89 Unopposed Motion for Extension of Time to File. Defendant's move the Court requesting additional time to respond to Plaintiffs' First Set of Written Discovery and argues press of business. Press of business is not considered good cause under Chief Judge Brimmer's Practice Standards. See PAB Practice Standards 1.G.1. However, the Court finds good cause given the Motion is unopposed and the Parties are attempting to resolve this matter. Accordingly, Defendant Reams has up to, and including, 11-27-2020 to file his answer to Plaintiffs' First Set of Written Discovery. SO ORDERED by Magistrate Judge S. Kato Crews on 10-21-2020. Text Only Entry (skclc2). (Entered: 10/21/2020)"
        },
        {
          "row_number": 105,
          "id": 8606628,
          "entry_number": "92",
          "date_filed": "2020-11-06T00:00:00-05:00",
          "attachments": null,
          "url": "https://www.courtlistener.com/docket/17051431/92/carranza-v-reams/",
          "recap_pdf_url": null,
          "pacer_doc_id": "03909135582",
          "description": "Joint MOTION for Order to for Fourth Extension of Preliminary Injunction Order, Second Extension of Time for Defendant to Answer and Respond to Plaintiffs' First Set of Written Discovery to Defendant, and First Amendment of Scheduling Order Deadlines by Defendant Steven Reams. (Hegarty, Matthew) (Entered: 11/06/2020)"
        },
        {
          "row_number": 108,
          "id": 8606632,
          "entry_number": "95",
          "date_filed": "2020-11-30T00:00:00-05:00",
          "attachments": null,
          "url": "https://www.courtlistener.com/docket/17051431/95/carranza-v-reams/",
          "recap_pdf_url": null,
          "pacer_doc_id": "03909170076",
          "description": "Stipulation of Dismissal of Claims by Plaintiffs Richard Barnum, Thomas Carranza, Thomas Lewis, Colby Propes, Michael Ward. (Williams, Daniel) Modified on 11/30/2020 to edit name of the document.(sphil, ). (Entered: 11/30/2020)"
        },
        {
          "row_number": 110,
          "id": 8606634,
          "entry_number": "97",
          "date_filed": "2020-11-30T00:00:00-05:00",
          "attachments": null,
          "url": "https://www.courtlistener.com/docket/17051431/97/carranza-v-reams/",
          "recap_pdf_url": null,
          "pacer_doc_id": "03909171123",
          "description": "Joint MOTION for Order to For Fifth Extension of Preliminary Injunction Order and for Stay of All Proceedings Pending Ruling on Joint Motion for Preliminary Approval of Class Action Settlement, Certification of a Class and Appointment of Class Counsel, and Permission to Post Class Notice by Defendant Steven Reams. (Hegarty, Matthew) (Entered: 11/30/2020)"
        },
        {
          "row_number": 111,
          "id": 8606635,
          "entry_number": "98",
          "date_filed": "2020-12-02T00:00:00-05:00",
          "attachments": null,
          "url": "https://www.courtlistener.com/docket/17051431/98/carranza-v-reams/",
          "recap_pdf_url": null,
          "pacer_doc_id": "03909175360",
          "description": "MINUTE ORDER by Chief Judge Philip A. Brimmer on 12/2/2020, re: 95 Stipulation of Dismissal of Claims. ORDERED plaintiffs Thomas Carranza, Richard Barnum, Thomas Lewis, Michael Ward, and Colby Propes were dismissed without prejudice as of the entry of the stipulation of dismissal. No Court order is necessary. (sphil, ) (Entered: 12/02/2020)"
        },
        {
          "row_number": 2,
          "id": 8606637,
          "entry_number": "100",
          "date_filed": "2020-12-11T00:00:00-05:00",
          "attachments": null,
          "url": "https://www.courtlistener.com/docket/17051431/100/carranza-v-reams/",
          "recap_pdf_url": "https://www.courtlistener.com/recap/gov.uscourts.cod.196804/gov.uscourts.cod.196804.100.0_1.pdf",
          "pacer_doc_id": "03909192588",
          "description": "ORDER by Chief Judge Philip A. Brimmer on 12/11/2020 re: 96 Joint Motion for Preliminary Approval of Class Action Settlement filed by Steven Reams. ORDERED that the parties shall file supplemental briefs on or before December 18, 2020. (rvill, ) (Entered: 12/11/2020)"
        },
        {
          "row_number": 9,
          "id": 8606644,
          "entry_number": "107",
          "date_filed": "2021-02-12T00:00:00-05:00",
          "attachments": null,
          "url": "https://www.courtlistener.com/docket/17051431/107/carranza-v-reams/",
          "recap_pdf_url": null,
          "pacer_doc_id": "03909291607",
          "description": "Unopposed MOTION for Leave to Restrict by Plaintiff Richard Barnum. (Attachments: # 1 Proposed Order (PDF Only) Proposed Order re Plaintiffs' Unopposed Motion for Order to Restrict Documents)(Williams, Daniel) (Entered: 02/12/2021)"
        },
        {
          "row_number": 11,
          "id": 8606646,
          "entry_number": "109",
          "date_filed": "2021-02-12T00:00:00-05:00",
          "attachments": null,
          "url": "https://www.courtlistener.com/docket/17051431/109/carranza-v-reams/",
          "recap_pdf_url": null,
          "pacer_doc_id": "03909292910",
          "description": "COURTROOM MINUTES for Fairness Hearing via Video Teleconference held on 2/12/2021 before Chief Judge Philip A. Brimmer. ORDERED: Joint Motion for Final Approval of Class Action Settlement and Final Certification of the Proposed Class 105 is GRANTED, as stated on record. Court Reporter: Terri Lindblom. (sgrim, ) (Entered: 02/12/2021)"
        },
        {
          "row_number": 126,
          "id": 8606647,
          "entry_number": null,
          "date_filed": "2021-02-12T00:00:00-05:00",
          "attachments": null,
          "url": "https://www.courtlistener.com",
          "recap_pdf_url": null,
          "pacer_doc_id": null,
          "description": "Memorandum"
        },
        {
          "row_number": 14,
          "id": 10145368,
          "entry_number": "111",
          "date_filed": "2021-02-16T00:00:00-05:00",
          "attachments": null,
          "url": "https://www.courtlistener.com/docket/17051431/111/carranza-v-reams/",
          "recap_pdf_url": null,
          "pacer_doc_id": null,
          "description": "ORDER denying 107 Motion for Leave to Restrict. The Court has reviewed Plaintiff's Motion and finds it does not address all the factors required by the Local Rules. Specifically, Plaintiff has failed to explain why no alternative to restriction is practicable or why only restriction will adequately protect the interest in question. Accordingly, Plaintiff's Motion is DENIED without prejudice to refile addressing all the factors at D.Colo.LCivR 7.2(c). SO ORDERED by Magistrate Judge S. Kato Crews on 2-16-2021. Text Only Entry (skclc2). (Entered: 02/16/2021)"
        },
        {
          "row_number": 15,
          "id": 10145369,
          "entry_number": "112",
          "date_filed": "2021-02-16T00:00:00-05:00",
          "attachments": null,
          "url": "https://www.courtlistener.com/docket/17051431/112/carranza-v-reams/",
          "recap_pdf_url": "https://www.courtlistener.com/recap/gov.uscourts.cod.196804/gov.uscourts.cod.196804.112.0.pdf",
          "pacer_doc_id": "03909296409",
          "description": "ORDER granting 105 Joint Motion for Final Approval of Class Action Settlement and Final Certification of the Proposed Class. Denying as moot 2 Plaintiff's Motion for Class Certification. The Court gives final approval to the Consent Decree and Final Judgment in all respects and authorizes and directs the parties to consummate the Consent Decree and Final Judgment in accordance with its terms and provisions. Judgment shall be entered dismissing this case with prejudice, by Chief Judge Philip A. Brimmer on 2/16/2021. (ebuch) (Entered: 02/16/2021)"
        },
        {
          "row_number": 13,
          "id": 10145367,
          "entry_number": "110",
          "date_filed": "2021-02-16T00:00:00-05:00",
          "attachments": null,
          "url": "https://www.courtlistener.com/docket/17051431/110/carranza-v-reams/",
          "recap_pdf_url": "https://www.courtlistener.com/recap/gov.uscourts.cod.196804/gov.uscourts.cod.196804.110.0.pdf",
          "pacer_doc_id": "03909295888",
          "description": "CONSENT DECREE AND FINAL JUDGMENT, By Chief Judge Philip A. Brimmer on 2/16/2021. (Attachments: # 1 Exhibit, # 2 Exhibit, # 3 Exhibit) (angar, ) (Entered: 02/16/2021)"
        },
        {
          "row_number": 65,
          "id": 8606584,
          "entry_number": "56",
          "date_filed": "2020-05-12T00:00:00-04:00",
          "attachments": [],
          "url": "https://www.courtlistener.com/docket/17051431/56/carranza-v-reams/",
          "recap_pdf_url": null,
          "pacer_doc_id": null,
          "description": "ORDER REFERRING CASE to Magistrate Judge Michael E. Hegarty for non-dispositive matters. Pursuant to 28 U.S.C. ยง 636(b)(1)(A) and (B) and Fed. R. Civ. P. 72(a) and (b), this case is referred to the assigned United States Magistrate Judge to (1) convene a scheduling conference under Fed. R. Civ. P. 16(b) and enter a scheduling order meeting the requirements of D.C.COLO.LCivR 16.2, (2) conduct such status conferences and issue such orders necessary for compliance with the scheduling order, including amendments or modifications of the scheduling order upon a showing of good cause, (3) hear and determine pretrial matters, including discovery and other non-dispositive motions, and (4) conduct a pretrial conference and enter a pretrial order. Court sponsored alternative dispute resolution is governed by D.C.COLO.LCivR 16.6. On the recommendation or informal request of the magistrate judge or on the request of the parties by motion, this court may direct the parties to engage in an early neutral evaluation, a settlement conference, or another alternative dispute resolution proceeding, by Chief Judge Philip A. Brimmer on 5/12/2020. Text Only Entry (pabsec2) (Entered: 05/12/2020)"
        },
        {
          "row_number": 36,
          "id": 8606527,
          "entry_number": "3",
          "date_filed": "2020-04-08T00:00:00-04:00",
          "attachments": [],
          "url": "https://www.courtlistener.com/docket/17051431/3/carranza-v-reams/",
          "recap_pdf_url": null,
          "pacer_doc_id": "03908761705",
          "description": "NOTICE of Entry of Appearance by Sara R. Neel on behalf of Richard Barnum, Thomas LewisAttorney Sara R. Neel added to party Richard Barnum(pty:pla), Attorney Sara R. Neel added to party Thomas Lewis(pty:pla) (Neel, Sara) (Entered: 04/08/2020)"
        },
        {
          "row_number": 22,
          "id": 8606541,
          "entry_number": "17",
          "date_filed": "2020-04-08T00:00:00-04:00",
          "attachments": [],
          "url": "https://www.courtlistener.com/docket/17051431/17/carranza-v-reams/",
          "recap_pdf_url": null,
          "pacer_doc_id": "03908762459",
          "description": "NOTICE of Entry of Appearance by Darold W. Killmer on behalf of Thomas Carranza, Chad Hunter, Jesus Martinez, Colby Propes, Michael WardAttorney Darold W. Killmer added to party Thomas Carranza(pty:pla), Attorney Darold W. Killmer added to party Chad Hunter(pty:pla), Attorney Darold W. Killmer added to party Jesus Martinez(pty:pla), Attorney Darold W. Killmer added to party Colby Propes(pty:pla), Attorney Darold W. Killmer added to party Michael Ward(pty:pla) (Killmer, Darold) (Entered: 04/08/2020)"
        },
        {
          "row_number": 76,
          "id": 8606596,
          "entry_number": "66",
          "date_filed": "2020-06-11T00:00:00-04:00",
          "attachments": [
            {
              "recap_id": 157204383,
              "pacer_url": "https://ecf.cod.uscourts.gov/doc1/03908867748?caseid=196804",
              "description": "Exhibit I -- Fourth Suppl Declaration of Capt Matthew Turner",
              "attachment_number": 1
            },
            {
              "recap_id": 157204384,
              "pacer_url": "https://ecf.cod.uscourts.gov/doc1/03908867749?caseid=196804",
              "description": "Exhibit I-1 -- 2020-05-14 Email to Dustin Owens",
              "attachment_number": 2
            },
            {
              "recap_id": 157204385,
              "pacer_url": "https://ecf.cod.uscourts.gov/doc1/03908867750?caseid=196804",
              "description": "Exhibit I-2 -- 2020-05-19 Email to Capt Matt Turner",
              "attachment_number": 3
            },
            {
              "recap_id": 157204386,
              "pacer_url": "https://ecf.cod.uscourts.gov/doc1/03908867751?caseid=196804",
              "description": "Exhibit I-3 -- 2020-05-18 Email from Lt Matt Elbe",
              "attachment_number": 4
            },
            {
              "recap_id": 157204387,
              "pacer_url": "https://ecf.cod.uscourts.gov/doc1/03908867752?caseid=196804",
              "description": "Exhibit I-4 -- 2020-05-28 Email from Lt Matt Elbe",
              "attachment_number": 5
            },
            {
              "recap_id": 157204388,
              "pacer_url": "https://ecf.cod.uscourts.gov/doc1/03908867753?caseid=196804",
              "description": "Exhibit I-5 -- 2020-05-19 Email from Lt Marcy Roles Foos",
              "attachment_number": 6
            },
            {
              "recap_id": 157204389,
              "pacer_url": "https://ecf.cod.uscourts.gov/doc1/03908867754?caseid=196804",
              "description": "Exhibit I-6 -- 2020-05-15 Email from Capt Matt Turner",
              "attachment_number": 7
            }
          ],
          "url": "https://www.courtlistener.com/docket/17051431/66/carranza-v-reams/",
          "recap_pdf_url": null,
          "pacer_doc_id": "03908867747",
          "description": "RESPONSE to 62 MOTION for Hearing/Conference re 60 Notice (Other),,,, Plaintiffs' Motion for Forthwith Hearing Regarding Defendant's Non-Compliance with the Court's Preliminary Injunction filed by Defendant Steven Reams. (Attachments: # 1 Exhibit I -- Fourth Suppl Declaration of Capt Matthew Turner, # 2 Exhibit I-1 -- 2020-05-14 Email to Dustin Owens, # 3 Exhibit I-2 -- 2020-05-19 Email to Capt Matt Turner, # 4 Exhibit I-3 -- 2020-05-18 Email from Lt Matt Elbe, # 5 Exhibit I-4 -- 2020-05-28 Email from Lt Matt Elbe, # 6 Exhibit I-5 -- 2020-05-19 Email from Lt Marcy Roles Foos, # 7 Exhibit I-6 -- 2020-05-15 Email from Capt Matt Turner)(Hegarty, Matthew) (Entered: 06/11/2020)"
        },
        {
          "row_number": 79,
          "id": 8606600,
          "entry_number": "69",
          "date_filed": "2020-06-24T00:00:00-04:00",
          "attachments": [],
          "url": "https://www.courtlistener.com/docket/17051431/69/carranza-v-reams/",
          "recap_pdf_url": null,
          "pacer_doc_id": "03908888917",
          "description": "Unopposed MOTION for Extension of Time to File Response/Reply as to 62 MOTION for Hearing/Conference re 60 Notice (Other),,,, Plaintiffs' Motion for Forthwith Hearing Regarding Defendant's Non-Compliance with the Court's Preliminary Injunction by Plaintiffs Thomas Carranza, Chad Hunter, Jesus Martinez, Colby Propes. (Hubbard, Jamie) (Entered: 06/24/2020)"
        },
        {
          "row_number": 101,
          "id": 8606623,
          "entry_number": "89",
          "date_filed": "2020-10-15T00:00:00-04:00",
          "attachments": [],
          "url": "https://www.courtlistener.com/docket/17051431/89/carranza-v-reams/",
          "recap_pdf_url": null,
          "pacer_doc_id": "03909095702",
          "description": "Unopposed MOTION for Extension of Time to Answer and Respond to Plaintiffs' First Set of Written Discovery to Defendant by Defendant Steven Reams. (Hegarty, Matthew) (Entered: 10/15/2020)"
        },
        {
          "row_number": 112,
          "id": 8606636,
          "entry_number": "99",
          "date_filed": "2020-12-04T00:00:00-05:00",
          "attachments": null,
          "url": "https://www.courtlistener.com/docket/17051431/99/carranza-v-reams/",
          "recap_pdf_url": "https://www.courtlistener.com/recap/gov.uscourts.cod.196804/gov.uscourts.cod.196804.99.0.pdf",
          "pacer_doc_id": "03909179077",
          "description": "ORDER by Chief Judge Philip A. Brimmer on 12/4/2020. ORDERED that the Joint Motion for Fifth Extension of Preliminary Injunction Order and for Stay of All Proceedings Pending Ruling on Joint Motion for Preliminary Approval of Class Action Settlement, Certification of a Class and Appointment of Class Counsel, and Permission to Post Class Notice [Docket No. 97 ] is GRANTED. It is further ORDERED that this case is hereby STAYED until the entry of an order of the Court on the Class Settlement Motion. It is further ORDERED that the Court's order granting a preliminary injunction, Docket No. 55, is extended for an additional 58 days. The order will expire on February 5, 2021, unless extended by the Court. (rvill, ) (Entered: 12/04/2020)"
        },
        {
          "row_number": 16,
          "id": 10145370,
          "entry_number": "113",
          "date_filed": "2021-02-16T00:00:00-05:00",
          "attachments": null,
          "url": "https://www.courtlistener.com/docket/17051431/113/carranza-v-reams/",
          "recap_pdf_url": "https://www.courtlistener.com/recap/gov.uscourts.cod.196804/gov.uscourts.cod.196804.113.0.pdf",
          "pacer_doc_id": "03909296804",
          "description": "FINAL JUDGMENT pursuant to 112 Order, by Clerk on 2/16/2021. (ebuch) (Entered: 02/16/2021)"
        },
        {
          "row_number": 0,
          "id": 8606525,
          "entry_number": "1",
          "date_filed": "2020-04-07T00:00:00-04:00",
          "attachments": [
            {
              "recap_id": 157204298,
              "pacer_url": "https://ecf.cod.uscourts.gov/doc1/03908761579?caseid=196804",
              "description": "Exhibit 1 - Meyer Declaration",
              "attachment_number": 1
            },
            {
              "recap_id": 157204299,
              "pacer_url": "https://ecf.cod.uscourts.gov/doc1/03908761580?caseid=196804",
              "description": "Exhibit 2 - Franco-Paredes Report",
              "attachment_number": 2
            },
            {
              "recap_id": 157204300,
              "pacer_url": "https://ecf.cod.uscourts.gov/doc1/03908761581?caseid=196804",
              "description": "Exhibit 3 - Carranza Declaration",
              "attachment_number": 3
            },
            {
              "recap_id": 157204301,
              "pacer_url": "https://ecf.cod.uscourts.gov/doc1/03908761582?caseid=196804",
              "description": "Exhibit 4 - Ward Declaration",
              "attachment_number": 4
            },
            {
              "recap_id": 157204302,
              "pacer_url": "https://ecf.cod.uscourts.gov/doc1/03908761583?caseid=196804",
              "description": "Proposed Order (PDF Only)",
              "attachment_number": 5
            }
          ],
          "url": "https://www.courtlistener.com/docket/17051431/1/carranza-v-reams/",
          "recap_pdf_url": null,
          "pacer_doc_id": "03908761578",
          "description": "MOTION for Temporary Restraining Order Preliminary Injunction and Expedited Hearing by Plaintiffs Thomas Carranza, Chad Hunter, Jesus Martinez, Colby Propes, Michael Ward. (Attachments: # 1 Exhibit 1 - Meyer Declaration, # 2 Exhibit 2 - Franco-Paredes Report, # 3 Exhibit 3 - Carranza Declaration, # 4 Exhibit 4 - Ward Declaration, # 5 Proposed Order (PDF Only))(McNulty, Andrew) (sphil, ). Modified on 4/22/2020 to edit text. (sphil, ). (Entered: 04/07/2020)"
        },
        {
          "row_number": 25,
          "id": 8606526,
          "entry_number": "2",
          "date_filed": "2020-04-07T00:00:00-04:00",
          "attachments": [],
          "url": "https://www.courtlistener.com/docket/17051431/2/carranza-v-reams/",
          "recap_pdf_url": null,
          "pacer_doc_id": "03908761589",
          "description": "MOTION to Certify Class by Plaintiffs Richard Barnum, Thomas Carranza, Chad Hunter, Thomas Lewis, Jesus Martinez, Colby Propes, Michael Ward. (McNulty, Andrew) (Entered: 04/07/2020)"
        },
        {
          "row_number": 58,
          "id": 8606529,
          "entry_number": "5",
          "date_filed": "2020-04-08T00:00:00-04:00",
          "attachments": [],
          "url": "https://www.courtlistener.com/docket/17051431/5/carranza-v-reams/",
          "recap_pdf_url": null,
          "pacer_doc_id": "03908761742",
          "description": "NOTICE of Entry of Appearance by Rebecca Teitelbaum Wallace on behalf of Richard Barnum, Thomas LewisAttorney Rebecca Teitelbaum Wallace added to party Richard Barnum(pty:pla), Attorney Rebecca Teitelbaum Wallace added to party Thomas Lewis(pty:pla) (Wallace, Rebecca) (Entered: 04/08/2020)"
        },
        {
          "row_number": 69,
          "id": 8606530,
          "entry_number": "6",
          "date_filed": "2020-04-08T00:00:00-04:00",
          "attachments": [],
          "url": "https://www.courtlistener.com/docket/17051431/6/carranza-v-reams/",
          "recap_pdf_url": null,
          "pacer_doc_id": null,
          "description": "Administrative Notice: No initiating document. Attorney contacted with instructions to file the initiating document within 24 hours. (Text Only Entry) (trvo, ) (Entered: 04/08/2020)"
        },
        {
          "row_number": 91,
          "id": 8606532,
          "entry_number": "8",
          "date_filed": "2020-04-08T00:00:00-04:00",
          "attachments": [],
          "url": "https://www.courtlistener.com/docket/17051431/8/carranza-v-reams/",
          "recap_pdf_url": null,
          "pacer_doc_id": "03908762009",
          "description": "NOTICE of Entry of Appearance by Daniel David Williams on behalf of Richard Barnum, Thomas LewisAttorney Daniel David Williams added to party Richard Barnum(pty:pla), Attorney Daniel David Williams added to party Thomas Lewis(pty:pla) (Williams, Daniel) (Entered: 04/08/2020)"
        },
        {
          "row_number": 12,
          "id": 8606535,
          "entry_number": "11",
          "date_filed": "2020-04-08T00:00:00-04:00",
          "attachments": [],
          "url": "https://www.courtlistener.com/docket/17051431/11/carranza-v-reams/",
          "recap_pdf_url": null,
          "pacer_doc_id": null,
          "description": "Administrative Notice: Duplicate filing fee received. Financial notified and a refund is pending. (Text Only Entry) (alave, ) (Entered: 04/08/2020)"
        },
        {
          "row_number": 17,
          "id": 8606536,
          "entry_number": "12",
          "date_filed": "2020-04-08T00:00:00-04:00",
          "attachments": [],
          "url": "https://www.courtlistener.com/docket/17051431/12/carranza-v-reams/",
          "recap_pdf_url": null,
          "pacer_doc_id": "03908762295",
          "description": "NOTICE of Entry of Appearance by Jamie Hughes Hubbard on behalf of Thomas Carranza, Chad Hunter, Jesus Martinez, Colby PropesAttorney Jamie Hughes Hubbard added to party Thomas Carranza(pty:pla), Attorney Jamie Hughes Hubbard added to party Chad Hunter(pty:pla), Attorney Jamie Hughes Hubbard added to party Jesus Martinez(pty:pla), Attorney Jamie Hughes Hubbard added to party Colby Propes(pty:pla) (Hubbard, Jamie) (Entered: 04/08/2020)"
        },
        {
          "row_number": 18,
          "id": 8606537,
          "entry_number": "13",
          "date_filed": "2020-04-08T00:00:00-04:00",
          "attachments": [],
          "url": "https://www.courtlistener.com/docket/17051431/13/carranza-v-reams/",
          "recap_pdf_url": null,
          "pacer_doc_id": null,
          "description": "Case assigned to Chief Judge Philip A. Brimmer and drawn to Magistrate Judge Michael E. Hegarty. Text Only Entry (cmadr, ) (Entered: 04/08/2020)"
        },
        {
          "row_number": 19,
          "id": 8606538,
          "entry_number": "14",
          "date_filed": "2020-04-08T00:00:00-04:00",
          "attachments": [],
          "url": "https://www.courtlistener.com/docket/17051431/14/carranza-v-reams/",
          "recap_pdf_url": null,
          "pacer_doc_id": "03908762428",
          "description": "Magistrate Judge consent form issued pursuant to 28 U.S.C. 636(c). NO SUMMONS ISSUED. (cmadr, ) (Entered: 04/08/2020)"
        },
        {
          "row_number": 20,
          "id": 8606539,
          "entry_number": "15",
          "date_filed": "2020-04-08T00:00:00-04:00",
          "attachments": [],
          "url": "https://www.courtlistener.com/docket/17051431/15/carranza-v-reams/",
          "recap_pdf_url": null,
          "pacer_doc_id": "03908762441",
          "description": "NOTICE of Entry of Appearance by Michael Paul Fairhurst on behalf of Thomas Carranza, Chad Hunter, Jesus Martinez, Colby Propes, Michael WardAttorney Michael Paul Fairhurst added to party Thomas Carranza(pty:pla), Attorney Michael Paul Fairhurst added to party Chad Hunter(pty:pla), Attorney Michael Paul Fairhurst added to party Jesus Martinez(pty:pla), Attorney Michael Paul Fairhurst added to party Colby Propes(pty:pla), Attorney Michael Paul Fairhurst added to party Michael Ward(pty:pla) (Fairhurst, Michael) (Entered: 04/08/2020)"
        },
        {
          "row_number": 27,
          "id": 8606545,
          "entry_number": "21",
          "date_filed": "2020-04-08T00:00:00-04:00",
          "attachments": [],
          "url": "https://www.courtlistener.com/docket/17051431/21/carranza-v-reams/",
          "recap_pdf_url": null,
          "pacer_doc_id": "03908763522",
          "description": "NOTICE of Entry of Appearance by Andrew David Ringel on behalf of Steven ReamsAttorney Andrew David Ringel added to party Steven Reams(pty:dft) (Ringel, Andrew) (Entered: 04/08/2020)"
        },
        {
          "row_number": 28,
          "id": 8606546,
          "entry_number": "22",
          "date_filed": "2020-04-08T00:00:00-04:00",
          "attachments": [],
          "url": "https://www.courtlistener.com/docket/17051431/22/carranza-v-reams/",
          "recap_pdf_url": null,
          "pacer_doc_id": "03908763525",
          "description": "NOTICE of Entry of Appearance by John Felix Peters on behalf of Steven ReamsAttorney John Felix Peters added to party Steven Reams(pty:dft) (Peters, John) (Entered: 04/08/2020)"
        },
        {
          "row_number": 116,
          "id": 8606566,
          "entry_number": null,
          "date_filed": "2020-04-22T00:00:00-04:00",
          "attachments": [],
          "url": "https://www.courtlistener.com",
          "recap_pdf_url": null,
          "pacer_doc_id": null,
          "description": "Order on Motion for Extension of Time to File Response/Reply"
        },
        {
          "row_number": 72,
          "id": 8606592,
          "entry_number": "62",
          "date_filed": "2020-05-21T00:00:00-04:00",
          "attachments": [],
          "url": "https://www.courtlistener.com/docket/17051431/62/carranza-v-reams/",
          "recap_pdf_url": null,
          "pacer_doc_id": "03908831664",
          "description": "MOTION for Hearing/Conference re 60 Notice (Other),,,, Plaintiffs' Motion for Forthwith Hearing Regarding Defendant's Non-Compliance with the Court's Preliminary Injunction by Plaintiffs Richard Barnum, Thomas Carranza, Chad Hunter, Thomas Lewis, Jesus Martinez, Colby Propes, Michael Ward. (Hubbard, Jamie) (Entered: 05/21/2020)"
        },
        {
          "row_number": 122,
          "id": 8606612,
          "entry_number": null,
          "date_filed": "2020-07-02T00:00:00-04:00",
          "attachments": [],
          "url": "https://www.courtlistener.com",
          "recap_pdf_url": null,
          "pacer_doc_id": null,
          "description": "Minute Order"
        },
        {
          "row_number": 123,
          "id": 8606625,
          "entry_number": null,
          "date_filed": "2020-10-15T00:00:00-04:00",
          "attachments": null,
          "url": "https://www.courtlistener.com",
          "recap_pdf_url": null,
          "pacer_doc_id": null,
          "description": "Memorandum"
        },
        {
          "row_number": 124,
          "id": 8606627,
          "entry_number": null,
          "date_filed": "2020-10-21T00:00:00-04:00",
          "attachments": null,
          "url": "https://www.courtlistener.com",
          "recap_pdf_url": null,
          "pacer_doc_id": null,
          "description": "Order on Motion for Extension of Time to File"
        },
        {
          "row_number": 106,
          "id": 8606629,
          "entry_number": "93",
          "date_filed": "2020-11-06T00:00:00-05:00",
          "attachments": null,
          "url": "https://www.courtlistener.com/docket/17051431/93/carranza-v-reams/",
          "recap_pdf_url": null,
          "pacer_doc_id": "03909135977",
          "description": "MINUTE ORDER by Chief Judge Philip A. Brimmer on 11/06/2020 re: 92 Joint MOTION for Order to for Fourth Extension of Preliminary Injunction Order, Second Extension of Time for Defendant to Answer and Respond to Plaintiffs' First Set of Written Discovery to Defendant, and First Amendment of Scheduling Order Deadlines filed by Steven Reams. It is ORDERED that the Court's order granting a preliminary injunction, Docket No. 55, is extended for an additional 30 days. The order will expire on December 9, 2020, unless extended by the Court. The remainder of the parties' Joint Motion for Fourth Extension of Preliminary Injunction Order, Second Extension of Time for Defendant to Answer and Respond to Plaintiffs' First Set of Written Discovery to Defendant, and First Amendment of Scheduling Order Deadlines [Docket No. 92 ] is referred to Magistrate Judge S. Kato Crews. (athom, ) (Entered: 11/06/2020)"
        },
        {
          "row_number": 107,
          "id": 8606630,
          "entry_number": "94",
          "date_filed": "2020-11-25T00:00:00-05:00",
          "attachments": null,
          "url": "https://www.courtlistener.com/docket/17051431/94/carranza-v-reams/",
          "recap_pdf_url": null,
          "pacer_doc_id": null,
          "description": "ORDER granting [#92] MOTION for Order for Fourth Extension of Preliminary Injunction Order, Second Extension of Time for Defendant to Answer and Respond to Plaintiffs' First Set of Written Discovery to Defendant, and First Amendment of Scheduling Order Deadlines . As an initial matter, the Court notes Chief Judge Brimmer addressed the portion of the Motion regarding the parties' request to extend the preliminary injunction order [#93.] The Court, therefore, limits its order to parties' request for Extension of Time for Defendant's Answer and Respond to Plaintiff's First Set of Written Discovery and their Motion to Amend the Scheduling Order. The Court finds good cause to GRANT both portions of the Motion. Accordingly, Defendants have up to, and including, 12-28-2020 to Respond to Plaintiff's First Set of Written Discovery. Further, the Scheduling Order is modified as follows: Affirmative Experts due 1-29-2021; Written Discovery served on parties by 2-5-2021; Rebuttal Experts due 3-5-2021; Discovery closes 3-19-2021; 702 Motions deadline 4-5-2021; Dispositive Motions deadline 4-23-2021; and Final Pretial Conference is set for 6-23-2021 at 9:30 am in Courtroom C201 before Magistrate Judge S. Kato Crews. SO ORDERED by Magistrate Judge S. Kato Crews on 11-25-2020. Text Only Entry (skclc2). (Entered: 11/25/2020)"
        },
        {
          "row_number": 109,
          "id": 8606633,
          "entry_number": "96",
          "date_filed": "2020-11-30T00:00:00-05:00",
          "attachments": null,
          "url": "https://www.courtlistener.com/docket/17051431/96/carranza-v-reams/",
          "recap_pdf_url": null,
          "pacer_doc_id": "03909171096",
          "description": "Joint MOTION for Order to for Preliminary Approval of Class Action Settlement, Certification of a Class and Appointment of Class Counsel, and Permission to Post Class Notice by Defendant Steven Reams. (Attachments: # 1 Exhibit A - Proposed Consent Decree and Final Judgment, # 2 Exhibit A-1 - Modification of Arrest Standards Due to COVID-19, # 3 Exhibit A-2 - Notice of Determination of Being Medically Vulnerable With Respect to COVID-19, # 4 Exhibit A-3 - Second Updated Screening Form, # 5 Exhibit B - Notice To Class)(Hegarty, Matthew) (Entered: 11/30/2020)"
        },
        {
          "row_number": 3,
          "id": 8606638,
          "entry_number": "101",
          "date_filed": "2020-12-18T00:00:00-05:00",
          "attachments": null,
          "url": "https://www.courtlistener.com/docket/17051431/101/carranza-v-reams/",
          "recap_pdf_url": null,
          "pacer_doc_id": "03909203750",
          "description": "JOINT SUPPLEMENT to 96 Joint MOTION for Order to for Preliminary Approval of Class Action Settlement, Certification of a Class and Appointment of Class Counsel, and Permission to Post Class Notice by Defendant Steven Reams. (Attachments: # 1 Exhibit B -- UPDATED Version of Notice in English, # 2 Exhibit B-1 -- UPDATED Version of Notice Translated into Spanish, # 3 Exhibit B-2 -- UPDATED Decl of WCSO Translator)(Hegarty, Matthew) Modified on 12/20/2020 to edit text. (sphil, ). (Entered: 12/18/2020)"
        },
        {
          "row_number": 4,
          "id": 8606639,
          "entry_number": "102",
          "date_filed": "2020-12-29T00:00:00-05:00",
          "attachments": null,
          "url": "https://www.courtlistener.com/docket/17051431/102/carranza-v-reams/",
          "recap_pdf_url": "https://www.courtlistener.com/recap/gov.uscourts.cod.196804/gov.uscourts.cod.196804.102.0.pdf",
          "pacer_doc_id": "03909217388",
          "description": "ORDER by Chief Judge Philip A. Brimmer on 12/29/2020, re: 96 the Joint Motion for Preliminary Approval of Class Action Settlement, Certification of a Class and Appointment of Class Counsel, and Permission to Post Class Notice is GRANTED. ORDERED that the Proposed Consent Decree and Final Judgment [Docket No. 96-1] is PRELIMINARILY APPROVED with regard to present and future medically vulnerable inmates. ORDERED that a Fairness Hearing is set for February 12, 2021 at 3:30 p.m. by Video Teleconference (VTC) only. (sphil, ) (Entered: 12/29/2020)"
        },
        {
          "row_number": 5,
          "id": 8606640,
          "entry_number": "103",
          "date_filed": "2021-01-25T00:00:00-05:00",
          "attachments": null,
          "url": "https://www.courtlistener.com/docket/17051431/103/carranza-v-reams/",
          "recap_pdf_url": null,
          "pacer_doc_id": "03909257174",
          "description": "NOTICE re 102 Order on Motion for Order,, Proposed Consent Decree and Final Judgment by Defendant Steven Reams (Hegarty, Matthew) (Entered: 01/25/2021)"
        },
        {
          "row_number": 6,
          "id": 8606641,
          "entry_number": "104",
          "date_filed": "2021-02-10T00:00:00-05:00",
          "attachments": null,
          "url": "https://www.courtlistener.com/docket/17051431/104/carranza-v-reams/",
          "recap_pdf_url": null,
          "pacer_doc_id": "03909287709",
          "description": "MINUTE ORDER by Chief Judge Philip A. Brimmer on 2/10/2021 re: 101 Joint Supplement filed by Steven Reams. ORDERED that the parties shall file a motion for final approval of the settlement agreement and final certification of the proposed class on Thursday, February 11, 2021 by 5:00 p.m.. (sphil, ) (Entered: 02/10/2021)"
        },
        {
          "row_number": 7,
          "id": 8606642,
          "entry_number": "105",
          "date_filed": "2021-02-11T00:00:00-05:00",
          "attachments": null,
          "url": "https://www.courtlistener.com/docket/17051431/105/carranza-v-reams/",
          "recap_pdf_url": null,
          "pacer_doc_id": "03909290564",
          "description": "Joint MOTION for Order to for Final Approval of Class Action Settlement and Final Certification of the Proposed Class by Defendant Steven Reams. (Hegarty, Matthew) (Entered: 02/11/2021)"
        },
        {
          "row_number": 8,
          "id": 8606643,
          "entry_number": "106",
          "date_filed": "2021-02-11T00:00:00-05:00",
          "attachments": null,
          "url": "https://www.courtlistener.com/docket/17051431/106/carranza-v-reams/",
          "recap_pdf_url": null,
          "pacer_doc_id": "03909290572",
          "description": "RESTRICTED DOCUMENT - Level 1: by Defendant Steven Reams.. (Hegarty, Matthew) (Entered: 02/11/2021)"
        },
        {
          "row_number": 10,
          "id": 8606645,
          "entry_number": "108",
          "date_filed": "2021-02-12T00:00:00-05:00",
          "attachments": null,
          "url": "https://www.courtlistener.com/docket/17051431/108/carranza-v-reams/",
          "recap_pdf_url": null,
          "pacer_doc_id": null,
          "description": "MEMORANDUM regarding 107 Unopposed MOTION for Leave to Restrict filed by Richard Barnum. Motion referred to Magistrate Judge S. Kato Crews, by Chief Judge Philip A. Brimmer on 2/12/2021. Text Only Entry (pabsec2) (Entered: 02/12/2021)"
        },
        {
          "row_number": 127,
          "id": 10145371,
          "entry_number": null,
          "date_filed": "2021-02-16T00:00:00-05:00",
          "attachments": null,
          "url": "https://www.courtlistener.com",
          "recap_pdf_url": null,
          "pacer_doc_id": null,
          "description": "Order on Motion for Leave to Restrict"
        },
        {
          "row_number": 45,
          "id": 8606565,
          "entry_number": "38",
          "date_filed": "2020-04-22T00:00:00-04:00",
          "attachments": [],
          "url": "https://www.courtlistener.com/docket/17051431/38/carranza-v-reams/",
          "recap_pdf_url": null,
          "pacer_doc_id": null,
          "description": "ORDER by Chief Judge Philip A. Brimmer on 4/22/2020 re: 37 Motion for Extension of Time to File Response/Reply is GRANTED. Defendant shall respond to plaintiff' Motion to Certify Class 2 on or before June 8, 2020. Text Only Entry(pabsec2) (Entered: 04/22/2020)"
        },
        {
          "row_number": 48,
          "id": 8606568,
          "entry_number": "40",
          "date_filed": "2020-04-23T00:00:00-04:00",
          "attachments": [],
          "url": "https://www.courtlistener.com/docket/17051431/40/carranza-v-reams/",
          "recap_pdf_url": null,
          "pacer_doc_id": "03908786266",
          "description": "COURTROOM MINUTES for Status Conference via Video Teleconference held on 4/23/2020 before Chief Judge Philip A. Brimmer. ORDERED: Plaintiff's oral motion to except the experts from the sequestration order is GRANTED. Fact witnesses will be sequestered. Court Reporter: Janet Coppock. (sgrim) (Main Document 40 replaced on 4/24/2020) (sgrim, ). (Entered: 04/23/2020)"
        },
        {
          "row_number": 114,
          "id": 8606550,
          "entry_number": null,
          "date_filed": "2020-04-13T00:00:00-04:00",
          "attachments": [],
          "url": "https://www.courtlistener.com",
          "recap_pdf_url": null,
          "pacer_doc_id": null,
          "description": "Minute Order"
        },
        {
          "row_number": 32,
          "id": 8606552,
          "entry_number": "26",
          "date_filed": "2020-04-13T00:00:00-04:00",
          "attachments": [
            {
              "recap_id": 130650639,
              "pacer_url": "https://ecf.cod.uscourts.gov/doc1/03908768335?caseid=196804",
              "description": "Exhibit A - Declaration of Sheriff Reams",
              "attachment_number": 1
            },
            {
              "recap_id": 130650646,
              "pacer_url": "https://ecf.cod.uscourts.gov/doc1/03908768336?caseid=196804",
              "description": "Exhibit A-1 to Exhibit A-5",
              "attachment_number": 2
            },
            {
              "recap_id": 130650653,
              "pacer_url": "https://ecf.cod.uscourts.gov/doc1/03908768337?caseid=196804",
              "description": "Exhibit A-6 to Exhibit A-10",
              "attachment_number": 3
            },
            {
              "recap_id": 130650658,
              "pacer_url": "https://ecf.cod.uscourts.gov/doc1/03908768338?caseid=196804",
              "description": "Exhibit A-11 to Exhibit A-15",
              "attachment_number": 4
            },
            {
              "recap_id": 130650664,
              "pacer_url": "https://ecf.cod.uscourts.gov/doc1/03908768339?caseid=196804",
              "description": "Exhibit A-16 to Exhibit A-20",
              "attachment_number": 5
            },
            {
              "recap_id": 130650666,
              "pacer_url": "https://ecf.cod.uscourts.gov/doc1/03908768340?caseid=196804",
              "description": "Exhibit A-21 to Exhibit A-25",
              "attachment_number": 6
            },
            {
              "recap_id": 130650671,
              "pacer_url": "https://ecf.cod.uscourts.gov/doc1/03908768341?caseid=196804",
              "description": "Exhibit A-26 to Exhibit A-30",
              "attachment_number": 7
            },
            {
              "recap_id": 130650676,
              "pacer_url": "https://ecf.cod.uscourts.gov/doc1/03908768342?caseid=196804",
              "description": "Exhibit A-31 to Exhibit A-35",
              "attachment_number": 8
            },
            {
              "recap_id": 130650680,
              "pacer_url": "https://ecf.cod.uscourts.gov/doc1/03908768343?caseid=196804",
              "description": "Exhibit A-36 to Exhibit A-39",
              "attachment_number": 9
            },
            {
              "recap_id": 130650683,
              "pacer_url": "https://ecf.cod.uscourts.gov/doc1/03908768344?caseid=196804",
              "description": "Exhibit A-40 to Exhibit A-46",
              "attachment_number": 10
            }
          ],
          "url": "https://www.courtlistener.com/docket/17051431/26/carranza-v-reams/",
          "recap_pdf_url": "https://www.courtlistener.com/recap/gov.uscourts.cod.196804/gov.uscourts.cod.196804.26.0.pdf",
          "pacer_doc_id": "03908768334",
          "description": "RESPONSE to 1 MOTION for Temporary Restraining Order Preliminary Injunction and Expedited Hearing filed by Defendant Steven Reams. (Attachments: # 1 Exhibit A - Declaration of Sheriff Reams, # 2 Exhibit A-1 to Exhibit A-5, # 3 Exhibit A-6 to Exhibit A-10, # 4 Exhibit A-11 to Exhibit A-15, # 5 Exhibit A-16 to Exhibit A-20, # 6 Exhibit A-21 to Exhibit A-25, # 7 Exhibit A-26 to Exhibit A-30, # 8 Exhibit A-31 to Exhibit A-35, # 9 Exhibit A-36 to Exhibit A-39, # 10 Exhibit A-40 to Exhibit A-46)(Hegarty, Matthew) (Entered: 04/13/2020)"
        },
        {
          "row_number": 125,
          "id": 8606631,
          "entry_number": null,
          "date_filed": "2020-11-25T00:00:00-05:00",
          "attachments": null,
          "url": "https://www.courtlistener.com",
          "recap_pdf_url": null,
          "pacer_doc_id": null,
          "description": "Order on Motion for Order"
        },
        {
          "row_number": 80,
          "id": 8606531,
          "entry_number": "7",
          "date_filed": "2020-04-08T00:00:00-04:00",
          "attachments": [
            {
              "recap_id": 157204303,
              "pacer_url": "https://ecf.cod.uscourts.gov/doc1/03908761878?caseid=196804",
              "description": "Civil Cover Sheet",
              "attachment_number": 1
            }
          ],
          "url": "https://www.courtlistener.com/docket/17051431/7/carranza-v-reams/",
          "recap_pdf_url": null,
          "pacer_doc_id": "03908761877",
          "description": "COMPLAINT for Injunctive and Declaratory Relief against Steven Reams, filed by Colby Propes, Richard Barnum, Chad Hunter, Jesus Martinez, Thomas Carranza, Thomas Lewis, Michael Ward. (Attachments: # 1 Civil Cover Sheet)(McNulty, Andrew) Modified on 4/8/2020 to correct docket. (alave, ). (Entered: 04/08/2020)"
        },
        {
          "row_number": 34,
          "id": 8606554,
          "entry_number": "28",
          "date_filed": "2020-04-13T00:00:00-04:00",
          "attachments": [
            {
              "recap_id": 157204305,
              "pacer_url": "https://ecf.cod.uscourts.gov/doc1/03908770114?caseid=196804",
              "description": "Exhibit 1 - Cook Declaration",
              "attachment_number": 1
            },
            {
              "recap_id": 157204306,
              "pacer_url": "https://ecf.cod.uscourts.gov/doc1/03908770115?caseid=196804",
              "description": "Exhibit 2 - Vecchiarelli Declaration",
              "attachment_number": 2
            },
            {
              "recap_id": 157204307,
              "pacer_url": "https://ecf.cod.uscourts.gov/doc1/03908770116?caseid=196804",
              "description": "Exhibit 3 - Brewer Declaration",
              "attachment_number": 3
            },
            {
              "recap_id": 157204308,
              "pacer_url": "https://ecf.cod.uscourts.gov/doc1/03908770117?caseid=196804",
              "description": "Exhibit 4 - Lewis Declaration",
              "attachment_number": 4
            },
            {
              "recap_id": 157204309,
              "pacer_url": "https://ecf.cod.uscourts.gov/doc1/03908770118?caseid=196804",
              "description": "Exhibit 5 - Griffiths Declaration",
              "attachment_number": 5
            },
            {
              "recap_id": 157204310,
              "pacer_url": "https://ecf.cod.uscourts.gov/doc1/03908770119?caseid=196804",
              "description": "Exhibit 6 - Swain v Junior",
              "attachment_number": 6
            },
            {
              "recap_id": 157204311,
              "pacer_url": "https://ecf.cod.uscourts.gov/doc1/03908770120?caseid=196804",
              "description": "Exhibit 7 - New York v Braun",
              "attachment_number": 7
            },
            {
              "recap_id": 157204312,
              "pacer_url": "https://ecf.cod.uscourts.gov/doc1/03908770121?caseid=196804",
              "description": "Exhibit 8 - US v Plunk",
              "attachment_number": 8
            }
          ],
          "url": "https://www.courtlistener.com/docket/17051431/28/carranza-v-reams/",
          "recap_pdf_url": null,
          "pacer_doc_id": "03908770113",
          "description": "NOTICE of Supplemental Authorities re: 1 MOTION for Temporary Restraining Order Preliminary Injunction and Expedited Hearing by Plaintiffs Richard Barnum, Thomas Carranza, Chad Hunter, Thomas Lewis, Jesus Martinez, Colby Propes, Michael Ward (Attachments: # 1 Exhibit 1 - Cook Declaration, # 2 Exhibit 2 - Vecchiarelli Declaration, # 3 Exhibit 3 - Brewer Declaration, # 4 Exhibit 4 - Lewis Declaration, # 5 Exhibit 5 - Griffiths Declaration, # 6 Exhibit 6 - Swain v Junior, # 7 Exhibit 7 - New York v Braun, # 8 Exhibit 8 - US v Plunk)(McNulty, Andrew) (Entered: 04/13/2020)"
        },
        {
          "row_number": 41,
          "id": 8606561,
          "entry_number": "34",
          "date_filed": "2020-04-20T00:00:00-04:00",
          "attachments": [
            {
              "recap_id": 157204313,
              "pacer_url": "https://ecf.cod.uscourts.gov/doc1/03908779226?caseid=196804",
              "description": "Exhibit A -- 2020-04-16 -- Relevant Conferral Efforts on ECF 31",
              "attachment_number": 1
            },
            {
              "recap_id": 157204314,
              "pacer_url": "https://ecf.cod.uscourts.gov/doc1/03908779227?caseid=196804",
              "description": "Exhibit B -- 2020-04-10 -- Agreed Upon Inspection Protocol for WCJ -- Short Form",
              "attachment_number": 2
            },
            {
              "recap_id": 157204315,
              "pacer_url": "https://ecf.cod.uscourts.gov/doc1/03908779228?caseid=196804",
              "description": "Exhibit C -- Decl of Capt Matthew Turner",
              "attachment_number": 3
            }
          ],
          "url": "https://www.courtlistener.com/docket/17051431/34/carranza-v-reams/",
          "recap_pdf_url": null,
          "pacer_doc_id": "03908779225",
          "description": "RESPONSE to 31 Emergency MOTION for Discovery Limited and Expedited Discovery filed by Defendant Steven Reams. (Attachments: # 1 Exhibit A -- 2020-04-16 -- Relevant Conferral Efforts on ECF 31, # 2 Exhibit B -- 2020-04-10 -- Agreed Upon Inspection Protocol for WCJ -- Short Form, # 3 Exhibit C -- Decl of Capt Matthew Turner)(Hegarty, Matthew) (Entered: 04/20/2020)"
        },
        {
          "row_number": 44,
          "id": 8606564,
          "entry_number": "37",
          "date_filed": "2020-04-21T00:00:00-04:00",
          "attachments": [
            {
              "recap_id": 157204316,
              "pacer_url": "https://ecf.cod.uscourts.gov/doc1/03908782504?caseid=196804",
              "description": "Proposed Order (PDF Only)",
              "attachment_number": 1
            }
          ],
          "url": "https://www.courtlistener.com/docket/17051431/37/carranza-v-reams/",
          "recap_pdf_url": null,
          "pacer_doc_id": "03908782503",
          "description": "Unopposed MOTION for Extension of Time to File Response/Reply as to 2 MOTION to Certify Class CERTIFICATION [ECF 2] by Defendant Steven Reams. (Attachments: # 1 Proposed Order (PDF Only))(Peters, John) (Entered: 04/21/2020)"
        },
        {
          "row_number": 49,
          "id": 8606569,
          "entry_number": "41",
          "date_filed": "2020-04-24T00:00:00-04:00",
          "attachments": [
            {
              "recap_id": 157204320,
              "pacer_url": "https://ecf.cod.uscourts.gov/doc1/03908787636?caseid=196804",
              "description": "Exhibit -- Supplemental Declaration of Capt Matthew Turner for Def Resp to Mot f",
              "attachment_number": 1
            },
            {
              "recap_id": 157204321,
              "pacer_url": "https://ecf.cod.uscourts.gov/doc1/03908787637?caseid=196804",
              "description": "Exhibit 2020-04-10 Inmate Masks",
              "attachment_number": 2
            },
            {
              "recap_id": 157204322,
              "pacer_url": "https://ecf.cod.uscourts.gov/doc1/03908787638?caseid=196804",
              "description": "Exhibit 2020-04-10 Protocol Update",
              "attachment_number": 3
            },
            {
              "recap_id": 157204323,
              "pacer_url": "https://ecf.cod.uscourts.gov/doc1/03908787639?caseid=196804",
              "description": "Exhibit 2020-04-11 Reminder to DD Deputies about HALT.",
              "attachment_number": 4
            },
            {
              "recap_id": 157204324,
              "pacer_url": "https://ecf.cod.uscourts.gov/doc1/03908787640?caseid=196804",
              "description": "Exhibit 2020-04-11 Reminder to DD Deputies about Goggles",
              "attachment_number": 5
            },
            {
              "recap_id": 157204325,
              "pacer_url": "https://ecf.cod.uscourts.gov/doc1/03908787641?caseid=196804",
              "description": "Exhibit 2020-04-13 Reminder to DD Deputies about Inmate HALT Directive",
              "attachment_number": 6
            },
            {
              "recap_id": 157204326,
              "pacer_url": "https://ecf.cod.uscourts.gov/doc1/03908787642?caseid=196804",
              "description": "Exhibit 2020-04-13 Resp to 19th JD about IM XXXXX w Ltr",
              "attachment_number": 7
            },
            {
              "recap_id": 157204327,
              "pacer_url": "https://ecf.cod.uscourts.gov/doc1/03908787643?caseid=196804",
              "description": "Exhibit 2020-04-13 Receipt of 100 COVID-19 Test Kits.pdf",
              "attachment_number": 8
            },
            {
              "recap_id": 157204328,
              "pacer_url": "https://ecf.cod.uscourts.gov/doc1/03908787644?caseid=196804",
              "description": "Exhibit 2020-04-13 CDPHE and WCDPHE Notice about JBS w Ltr.pdf",
              "attachment_number": 9
            },
            {
              "recap_id": 157204329,
              "pacer_url": "https://ecf.cod.uscourts.gov/doc1/03908787645?caseid=196804",
              "description": "Exhibit 2020-04-14 Sgt Reminder to tell IMs to Clean Sinks.pdf",
              "attachment_number": 10
            },
            {
              "recap_id": 157204330,
              "pacer_url": "https://ecf.cod.uscourts.gov/doc1/03908787646?caseid=196804",
              "description": "Exhibit 2020-04-14 Reminder to DD about Profl Visitors",
              "attachment_number": 11
            },
            {
              "recap_id": 157204331,
              "pacer_url": "https://ecf.cod.uscourts.gov/doc1/03908787647?caseid=196804",
              "description": "Exhibit 2020-04-14 Documenting HALT Bottle Labeling",
              "attachment_number": 12
            },
            {
              "recap_id": 157204332,
              "pacer_url": "https://ecf.cod.uscourts.gov/doc1/03908787648?caseid=196804",
              "description": "Exhibit 2020-04-15 Distillery Hand Sanitizer",
              "attachment_number": 13
            },
            {
              "recap_id": 157204333,
              "pacer_url": "https://ecf.cod.uscourts.gov/doc1/03908787649?caseid=196804",
              "description": "Exhibit 2020-04-16 WCBOG Masks on Back Order",
              "attachment_number": 14
            },
            {
              "recap_id": 157204334,
              "pacer_url": "https://ecf.cod.uscourts.gov/doc1/03908787650?caseid=196804",
              "description": "Exhibit 2020-04-16 CDOC No-Transport Notice w Ltr",
              "attachment_number": 15
            },
            {
              "recap_id": 157204335,
              "pacer_url": "https://ecf.cod.uscourts.gov/doc1/03908787651?caseid=196804",
              "description": "Exhibit 2020-04-17 Notice from 19th JD Chief Judge Hartmann w Ltr",
              "attachment_number": 16
            },
            {
              "recap_id": 157204336,
              "pacer_url": "https://ecf.cod.uscourts.gov/doc1/03908787652?caseid=196804",
              "description": "Exhibit Video from Capt Turner to WCJ Inmates.pdf",
              "attachment_number": 17
            },
            {
              "recap_id": 157204337,
              "pacer_url": "https://ecf.cod.uscourts.gov/doc1/03908787653?caseid=196804",
              "description": "Exhibit Elbe Notes on CJA TeleMtg w Notes.pdf",
              "attachment_number": 18
            },
            {
              "recap_id": 157204338,
              "pacer_url": "https://ecf.cod.uscourts.gov/doc1/03908787654?caseid=196804",
              "description": "Exhibit 2020-04-17 No Receipt of COVID-19 Work Release IM.pdf",
              "attachment_number": 19
            },
            {
              "recap_id": 157204339,
              "pacer_url": "https://ecf.cod.uscourts.gov/doc1/03908787655?caseid=196804",
              "description": "Exhibit 2020-04-18 WCJ Movement and Medical Protocol for High Risk IMs.pdf",
              "attachment_number": 20
            },
            {
              "recap_id": 157204340,
              "pacer_url": "https://ecf.cod.uscourts.gov/doc1/03908787656?caseid=196804",
              "description": "Exhibit EXH B-20 -- 2020-04-20 19th JD 'furloughing' IM Sentences",
              "attachment_number": 21
            },
            {
              "recap_id": 157204341,
              "pacer_url": "https://ecf.cod.uscourts.gov/doc1/03908787657?caseid=196804",
              "description": "Exhibit 2020-04-20 TKHC Revised Iso Protocol.pdf",
              "attachment_number": 22
            },
            {
              "recap_id": 157204342,
              "pacer_url": "https://ecf.cod.uscourts.gov/doc1/03908787658?caseid=196804",
              "description": "Exhibit 2020-04-20 Moving Female Inmates.pdf",
              "attachment_number": 23
            },
            {
              "recap_id": 157204343,
              "pacer_url": "https://ecf.cod.uscourts.gov/doc1/03908787659?caseid=196804",
              "description": "Exhibit 2020-04-20 Email to WCHD about WCSO Efforts.pdf",
              "attachment_number": 24
            },
            {
              "recap_id": 157204344,
              "pacer_url": "https://ecf.cod.uscourts.gov/doc1/03908787660?caseid=196804",
              "description": "Exhibit",
              "attachment_number": 25
            },
            {
              "recap_id": 157204345,
              "pacer_url": "https://ecf.cod.uscourts.gov/doc1/03908787661?caseid=196804",
              "description": "Exhibit",
              "attachment_number": 26
            },
            {
              "recap_id": 157204346,
              "pacer_url": "https://ecf.cod.uscourts.gov/doc1/03908787662?caseid=196804",
              "description": "Exhibit",
              "attachment_number": 27
            },
            {
              "recap_id": 157204347,
              "pacer_url": "https://ecf.cod.uscourts.gov/doc1/03908787663?caseid=196804",
              "description": "Exhibit",
              "attachment_number": 28
            },
            {
              "recap_id": 157204348,
              "pacer_url": "https://ecf.cod.uscourts.gov/doc1/03908787664?caseid=196804",
              "description": "Exhibit",
              "attachment_number": 29
            },
            {
              "recap_id": 157204349,
              "pacer_url": "https://ecf.cod.uscourts.gov/doc1/03908787665?caseid=196804",
              "description": "Exhibit",
              "attachment_number": 30
            },
            {
              "recap_id": 157204350,
              "pacer_url": "https://ecf.cod.uscourts.gov/doc1/03908787666?caseid=196804",
              "description": "Exhibit",
              "attachment_number": 31
            },
            {
              "recap_id": 157204351,
              "pacer_url": "https://ecf.cod.uscourts.gov/doc1/03908787667?caseid=196804",
              "description": "Exhibit",
              "attachment_number": 32
            },
            {
              "recap_id": 157204352,
              "pacer_url": "https://ecf.cod.uscourts.gov/doc1/03908787668?caseid=196804",
              "description": "Exhibit EXH B-32 -- Pod diagrams",
              "attachment_number": 33
            },
            {
              "recap_id": 157204353,
              "pacer_url": "https://ecf.cod.uscourts.gov/doc1/03908787669?caseid=196804",
              "description": "Exhibit EXH C - Decl - Owens, D - Executed",
              "attachment_number": 34
            },
            {
              "recap_id": 157204354,
              "pacer_url": "https://ecf.cod.uscourts.gov/doc1/03908787670?caseid=196804",
              "description": "Exhibit Final Executed Declaration - William Cooper.pdf",
              "attachment_number": 35
            },
            {
              "recap_id": 157204355,
              "pacer_url": "https://ecf.cod.uscourts.gov/doc1/03908787671?caseid=196804",
              "description": "Exhibit CV - Dr. Cooper.pdf",
              "attachment_number": 36
            },
            {
              "recap_id": 157204356,
              "pacer_url": "https://ecf.cod.uscourts.gov/doc1/03908787672?caseid=196804",
              "description": "Exhibit Greeley Tribune News Story on JBS.pdf",
              "attachment_number": 37
            }
          ],
          "url": "https://www.courtlistener.com/docket/17051431/41/carranza-v-reams/",
          "recap_pdf_url": null,
          "pacer_doc_id": "03908787635",
          "description": "RESPONSE to 1 MOTION for Temporary Restraining Order Preliminary Injunction and Expedited Hearing filed by Defendant Steven Reams. (Attachments: # 1 Exhibit -- Supplemental Declaration of Capt Matthew Turner for Def Resp to Mot for PI, # 2 Exhibit 2020-04-10 Inmate Masks, # 3 Exhibit 2020-04-10 Protocol Update, # 4 Exhibit 2020-04-11 Reminder to DD Deputies about HALT., # 5 Exhibit 2020-04-11 Reminder to DD Deputies about Goggles, # 6 Exhibit 2020-04-13 Reminder to DD Deputies about Inmate HALT Directive, # 7 Exhibit 2020-04-13 Resp to 19th JD about IM XXXXX w Ltr, # 8 Exhibit 2020-04-13 Receipt of 100 COVID-19 Test Kits.pdf, # 9 Exhibit 2020-04-13 CDPHE and WCDPHE Notice about JBS w Ltr.pdf, # 10 Exhibit 2020-04-14 Sgt Reminder to tell IMs to Clean Sinks.pdf, # 11 Exhibit 2020-04-14 Reminder to DD about Profl Visitors, # 12 Exhibit 2020-04-14 Documenting HALT Bottle Labeling, # 13 Exhibit 2020-04-15 Distillery Hand Sanitizer, # 14 Exhibit 2020-04-16 WCBOG Masks on Back Order, # 15 Exhibit 2020-04-16 CDOC No-Transport Notice w Ltr, # 16 Exhibit 2020-04-17 Notice from 19th JD Chief Judge Hartmann w Ltr, # 17 Exhibit Video from Capt Turner to WCJ Inmates.pdf, # 18 Exhibit Elbe Notes on CJA TeleMtg w Notes.pdf, # 19 Exhibit 2020-04-17 No Receipt of COVID-19 Work Release IM.pdf, # 20 Exhibit 2020-04-18 WCJ Movement and Medical Protocol for High Risk IMs.pdf, # 21 Exhibit EXH B-20 -- 2020-04-20 19th JD 'furloughing' IM Sentences, # 22 Exhibit 2020-04-20 TKHC Revised Iso Protocol.pdf, # 23 Exhibit 2020-04-20 Moving Female Inmates.pdf, # 24 Exhibit 2020-04-20 Email to WCHD about WCSO Efforts.pdf, # 25 Exhibit, # 26 Exhibit, # 27 Exhibit, # 28 Exhibit, # 29 Exhibit, # 30 Exhibit, # 31 Exhibit, # 32 Exhibit, # 33 Exhibit EXH B-32 -- Pod diagrams, # 34 Exhibit EXH C - Decl - Owens, D - Executed, # 35 Exhibit Final Executed Declaration - William Cooper.pdf, # 36 Exhibit CV - Dr. Cooper.pdf, # 37 Exhibit Greeley Tribune News Story on JBS.pdf)(Hegarty, Matthew) (Entered: 04/24/2020)"
        },
        {
          "row_number": 51,
          "id": 8606571,
          "entry_number": "43",
          "date_filed": "2020-04-24T00:00:00-04:00",
          "attachments": [
            {
              "recap_id": 157204357,
              "pacer_url": "https://ecf.cod.uscourts.gov/doc1/03908789176?caseid=196804",
              "description": "Exhibit",
              "attachment_number": 1
            }
          ],
          "url": "https://www.courtlistener.com/docket/17051431/43/carranza-v-reams/",
          "recap_pdf_url": null,
          "pacer_doc_id": "03908789175",
          "description": "NOTICE re 1 MOTION for Temporary Restraining Order Preliminary Injunction and Expedited Hearing by Defendant Steven Reams (Attachments: # 1 Exhibit)(Hegarty, Matthew) (Entered: 04/24/2020)"
        },
        {
          "row_number": 53,
          "id": 8606573,
          "entry_number": "45",
          "date_filed": "2020-04-24T00:00:00-04:00",
          "attachments": [],
          "url": "https://www.courtlistener.com/docket/17051431/45/carranza-v-reams/",
          "recap_pdf_url": null,
          "pacer_doc_id": "03908789216",
          "description": "Exhibit List for Preliminary Injunction Hearing by Defendant Steven Reams. (Hegarty, Matthew) (Entered: 04/24/2020)"
        },
        {
          "row_number": 55,
          "id": 8606575,
          "entry_number": "47",
          "date_filed": "2020-04-26T00:00:00-04:00",
          "attachments": [
            {
              "recap_id": 157204317,
              "pacer_url": "https://ecf.cod.uscourts.gov/doc1/03908789293?caseid=196804",
              "description": "Exhibit",
              "attachment_number": 1
            },
            {
              "recap_id": 157204318,
              "pacer_url": "https://ecf.cod.uscourts.gov/doc1/03908789294?caseid=196804",
              "description": "Exhibit",
              "attachment_number": 2
            },
            {
              "recap_id": 157204319,
              "pacer_url": "https://ecf.cod.uscourts.gov/doc1/03908789295?caseid=196804",
              "description": "Exhibit",
              "attachment_number": 3
            }
          ],
          "url": "https://www.courtlistener.com/docket/17051431/47/carranza-v-reams/",
          "recap_pdf_url": null,
          "pacer_doc_id": "03908789292",
          "description": "MOTION for Protective Order Against Circumvention of ECF 36 by Defendant Steven Reams. (Attachments: # 1 Exhibit, # 2 Exhibit, # 3 Exhibit)(Hegarty, Matthew) (Entered: 04/26/2020)"
        },
        {
          "row_number": 57,
          "id": 8606577,
          "entry_number": "49",
          "date_filed": "2020-04-28T00:00:00-04:00",
          "attachments": [
            {
              "recap_id": 157204358,
              "pacer_url": "https://ecf.cod.uscourts.gov/doc1/03908792243?caseid=196804",
              "description": "Exhibit 1 - Declaration of Franco-Paredes",
              "attachment_number": 1
            },
            {
              "recap_id": 157204359,
              "pacer_url": "https://ecf.cod.uscourts.gov/doc1/03908792244?caseid=196804",
              "description": "Exhibit 2 - Amended Proposed Order",
              "attachment_number": 2
            }
          ],
          "url": "https://www.courtlistener.com/docket/17051431/49/carranza-v-reams/",
          "recap_pdf_url": null,
          "pacer_doc_id": "03908792242",
          "description": "REPLY to Response to 1 MOTION for Temporary Restraining Order Preliminary Injunction and Expedited Hearing filed by Plaintiffs Richard Barnum, Thomas Carranza, Chad Hunter, Thomas Lewis, Jesus Martinez, Colby Propes, Michael Ward. (Attachments: # 1 Exhibit 1 - Declaration of Franco-Paredes, # 2 Exhibit 2 - Amended Proposed Order)(McNulty, Andrew) (Entered: 04/28/2020)"
        },
        {
          "row_number": 60,
          "id": 8606579,
          "entry_number": "51",
          "date_filed": "2020-04-30T00:00:00-04:00",
          "attachments": [
            {
              "recap_id": 157204360,
              "pacer_url": "https://ecf.cod.uscourts.gov/doc1/03908798271?caseid=196804",
              "description": "Exhibit 1 - Zepeda-Rivas v Jennings",
              "attachment_number": 1
            }
          ],
          "url": "https://www.courtlistener.com/docket/17051431/51/carranza-v-reams/",
          "recap_pdf_url": null,
          "pacer_doc_id": "03908798270",
          "description": "Second NOTICE of Supplemental Authorities re: 1 MOTION for Temporary Restraining Order Preliminary Injunction and Expedited Hearing by Plaintiffs Richard Barnum, Thomas Carranza, Chad Hunter, Thomas Lewis, Jesus Martinez, Colby Propes, Michael Ward (Attachments: # 1 Exhibit 1 - Zepeda-Rivas v Jennings)(McNulty, Andrew) Modified on 5/11/2020 to edit text. (sphil, ). (Entered: 04/30/2020)"
        },
        {
          "row_number": 62,
          "id": 8606581,
          "entry_number": "53",
          "date_filed": "2020-04-30T00:00:00-04:00",
          "attachments": [
            {
              "recap_id": 157204361,
              "pacer_url": "https://ecf.cod.uscourts.gov/doc1/03908798610?caseid=196804",
              "description": "Exhibit Exhibit 1 - Swain v. Junior",
              "attachment_number": 1
            }
          ],
          "url": "https://www.courtlistener.com/docket/17051431/53/carranza-v-reams/",
          "recap_pdf_url": null,
          "pacer_doc_id": "03908798609",
          "description": "THIRD NOTICE of Supplemental Authorities in Support of 1 MOTION for Temporary Restraining Order by Plaintiffs Richard Barnum, Thomas Carranza, Chad Hunter, Thomas Lewis, Jesus Martinez, Colby Propes, Michael Ward (Attachments: # 1 Exhibit Exhibit 1 - Swain v. Junior)(McNulty, Andrew) Modified on 5/11/2020 to add linkage. (sphil, ). (Entered: 04/30/2020)"
        },
        {
          "row_number": 63,
          "id": 8606582,
          "entry_number": "54",
          "date_filed": "2020-05-01T00:00:00-04:00",
          "attachments": [
            {
              "recap_id": 157204362,
              "pacer_url": "https://ecf.cod.uscourts.gov/doc1/03908799988?caseid=196804",
              "description": "Exhibit A-1",
              "attachment_number": 1
            },
            {
              "recap_id": 157204363,
              "pacer_url": "https://ecf.cod.uscourts.gov/doc1/03908799989?caseid=196804",
              "description": "Exhibit A-2",
              "attachment_number": 2
            },
            {
              "recap_id": 157204364,
              "pacer_url": "https://ecf.cod.uscourts.gov/doc1/03908799990?caseid=196804",
              "description": "Exhibit A-3",
              "attachment_number": 3
            }
          ],
          "url": "https://www.courtlistener.com/docket/17051431/54/carranza-v-reams/",
          "recap_pdf_url": null,
          "pacer_doc_id": "03908799987",
          "description": "NOTICE of Supplemental Authorities in Support of Supplemental Response re: 41 Response to Motion,,,,,,,, by Defendant Steven Reams (Attachments: # 1 Exhibit A-1, # 2 Exhibit A-2, # 3 Exhibit A-3)(Peters, John) (Entered: 05/01/2020)"
        },
        {
          "row_number": 68,
          "id": 8606588,
          "entry_number": "59",
          "date_filed": "2020-05-12T00:00:00-04:00",
          "attachments": [],
          "url": "https://www.courtlistener.com/docket/17051431/59/carranza-v-reams/",
          "recap_pdf_url": null,
          "pacer_doc_id": null,
          "description": "ORDER Setting Rule 16(b) Scheduling Conference. The Scheduling Conference is set for 7/9/2020 at 10:30 AM in Courtroom C201 before Magistrate Judge S. Kato Crews. The parties shall file their proposed scheduling order, and email a copy in Word format to Crews_Chambers@cod.uscourts.gov, on or before 7/2/2020. The Magistrate Judge Consent Form (ECF. # 14 ) is due 7/2/2020. SO ORDERED by Magistrate Judge S. Kato Crews on 5/12/2020. Text Only Entry (skclc2) (Entered: 05/12/2020)"
        },
        {
          "row_number": 70,
          "id": 8606590,
          "entry_number": "60",
          "date_filed": "2020-05-18T00:00:00-04:00",
          "attachments": [
            {
              "recap_id": 157204367,
              "pacer_url": "https://ecf.cod.uscourts.gov/doc1/03908824974?caseid=196804",
              "description": "Exhibit F -- Second Suppl Decl of Capt Matthew Turner for Def Resp to ECF 55",
              "attachment_number": 1
            },
            {
              "recap_id": 157204368,
              "pacer_url": "https://ecf.cod.uscourts.gov/doc1/03908824975?caseid=196804",
              "description": "Exhibit F-1 -- April 28 2020 COVID-19 SCREENING FORM",
              "attachment_number": 2
            },
            {
              "recap_id": 157204369,
