{
  "case_id": 415,
  "fetched_at": "2025-10-22T00:04:25.450053",
  "case_data": {
    "attorney_orgs": [],
    "available_documents": [
      "Trial Court Docket",
      "Any published opinion"
    ],
    "case_defendants": [
      {
        "defendant_level": null,
        "institution": "Mass. Treatment Center for Sexually Dangerous Persons",
        "institution_alt_state": null,
        "institution_city": "Bridgewater",
        "institution_county": "Plymouth",
        "name": "Massachusetts ",
        "defendant_level_other": "",
        "is_active": true
      }
    ],
    "case_ongoing": "No",
    "case_status": "Coding Complete",
    "case_types": [
      "Mental Health (Facility)"
    ],
    "cause_other": "",
    "causes": [
      "42 U.S.C. ยง 1983"
    ],
    "class_action_granted": "Granted",
    "class_action_sought": "Yes",
    "closing_year": 1999,
    "constitutional_clause": [
      {
        "value": "Due Process"
      },
      {
        "value": "Cruel and Unusual Punishment"
      }
    ],
    "content_of_injunction": [],
    "court": "District of Massachusetts",
    "custom_issues": [],
    "defendant_payment": "",
    "defendant_type": [],
    "docket_status": "Complete as of retrieval date",
    "facility_type": [
      {
        "value": "Government-run"
      }
    ],
    "filing_date": "1972-02-15",
    "filing_year": 1972,
    "id": 415,
    "injunction_duration": "",
    "issues": [
      "Jails, Prisons, Detention Centers, and Other Institutions: Crowding (General)",
      "General/Misc.: Staff (number, training, qualifications, wages)",
      "General/Misc.: Sanitation / living conditions",
      "Jails, Prisons, Detention Centers, and Other Institutions: Recreation / Exercise",
      "Jails, Prisons, Detention Centers, and Other Institutions: Habilitation (training/treatment)",
      "Medical/Mental Health Care: Medical care, general",
      "Medical/Mental Health Care: Medical care, unspecified",
      "Medical/Mental Health Care: Mental health care, unspecified",
      "General/Misc.: Bathing and hygiene"
    ],
    "last_checked_date": "2005-10-25T00:00:00-04:00",
    "main_docket": {
      "id": 38980,
      "docket_entries": [
        {
          "row_number": 0,
          "id": 1844934,
          "entry_number": "1",
          "date_filed": "1972-02-15T00:00:00-05:00",
          "attachments": [],
          "url": "nan",
          "recap_pdf_url": null,
          "pacer_doc_id": null,
          "description": "Complaint for Declaratory Judgment and Injunctive Relief filed. (tmc) Modified on 08/23/1994 (Entered: 08/23/1994)"
        },
        {
          "row_number": 17,
          "id": 1844951,
          "entry_number": "13",
          "date_filed": "1994-01-21T00:00:00-05:00",
          "attachments": [],
          "url": "nan",
          "recap_pdf_url": null,
          "pacer_doc_id": null,
          "description": "Motion by Michael Lesiak, Charles W. Gaughan, John P. Kerle, Milton Greenblatt, John O. Boone to consolidate cases with CA-72-788 , filed. c/s (tmc) (Entered: 08/23/1994)"
        },
        {
          "row_number": 7,
          "id": 1844941,
          "entry_number": "4",
          "date_filed": "1993-09-16T00:00:00-04:00",
          "attachments": [],
          "url": "nan",
          "recap_pdf_url": null,
          "pacer_doc_id": null,
          "description": "Copy of Report of Special Master filed. (NOTE: Report was received in six installments. Except for the FIRST PROGRESS REPORT (F. 9/18/93 AND DOCKETED AS NO. 65) each installment was maintained IN CAMERA until today's filing of the report, with the Clerk. The remaining five installments of the Special Masters Report are as follows: SECOND PROGRESS REPORT (dated 10/30/92); THIRD PROGRESS REPORT (DATED 12/21/92); FOURTH PROGRESS REPORT (DATED 2/25/93); FIFTH PROGRESS REPORT (DATED 9/7/93); SIXTH AND FINAL PROGRESS REPORT (DATED 9/7/93) (tmc) (Entered: 08/23/1994)"
        },
        {
          "row_number": 97,
          "id": 1845031,
          "entry_number": "80",
          "date_filed": "1995-08-17T00:00:00-04:00",
          "attachments": [],
          "url": "nan",
          "recap_pdf_url": null,
          "pacer_doc_id": null,
          "description": "Judge A. D. Mazzone . Memorandum and Order entered. cc/cl re: De Wolf's motion.... (sad) Modified on 09/06/1995 (Entered: 08/18/1995)"
        },
        {
          "row_number": 100,
          "id": 1845034,
          "entry_number": "85",
          "date_filed": "1995-09-03T00:00:00-04:00",
          "attachments": [],
          "url": "nan",
          "recap_pdf_url": null,
          "pacer_doc_id": null,
          "description": "Motion by Dennis J Quintal Sr. to be habed to court for hearings , filed. (sad) (Entered: 09/12/1995)"
        },
        {
          "row_number": 101,
          "id": 1845035,
          "entry_number": "82",
          "date_filed": "1995-09-08T00:00:00-04:00",
          "attachments": [],
          "url": "nan",
          "recap_pdf_url": null,
          "pacer_doc_id": null,
          "description": "Letter dated: 8/28/95 to: Judge Mazzone re: D-Report , filed. (sad) (Entered: 09/08/1995)"
        },
        {
          "row_number": 102,
          "id": 1845036,
          "entry_number": "83",
          "date_filed": "1995-09-08T00:00:00-04:00",
          "attachments": [],
          "url": "nan",
          "recap_pdf_url": null,
          "pacer_doc_id": null,
          "description": "Judge A. D. Mazzone . Notice of Hearing/conference: set status conference for 10:30 9/14/95 cc/cl . (sad) (Entered: 09/11/1995)"
        },
        {
          "row_number": 103,
          "id": 1845037,
          "entry_number": "84",
          "date_filed": "1995-09-11T00:00:00-04:00",
          "attachments": [],
          "url": "nan",
          "recap_pdf_url": null,
          "pacer_doc_id": null,
          "description": "Motion by Sherman Miller in 1:72-cv-00571 to stay hearing and settlement conference , filed. (sad) (Entered: 09/12/1995)"
        },
        {
          "row_number": 104,
          "id": 1845038,
          "entry_number": null,
          "date_filed": "1995-09-12T00:00:00-04:00",
          "attachments": [],
          "url": "nan",
          "recap_pdf_url": null,
          "pacer_doc_id": null,
          "description": "Judge A. D. Mazzone . Endorsed Order entered denying [84-1] motion to stay hearing and settlement conference . cc/cl (sad) (Entered: 09/12/1995)"
        },
        {
          "row_number": 105,
          "id": 1845039,
          "entry_number": "86",
          "date_filed": "1995-09-13T00:00:00-04:00",
          "attachments": [],
          "url": "nan",
          "recap_pdf_url": null,
          "pacer_doc_id": null,
          "description": "Status report by Harold Williams in 1:72-cv-00571, Thomas Minervino in 1:72-cv-00571, James M. Kater in 1:72-cv-00571, Michael Lesiak in 1:72-cv-00571, Charles W. Gaughan in 1:72-cv-00571, John P. Kerle in 1:72-cv-00571, Milton Greenblatt in 1:72-cv-00571, John O. Boone in 1:72-cv-00571, Class of 48 + 1 in 1:72-cv-00571 , filed. (sad) (Entered: 09/14/1995)"
        },
        {
          "row_number": 106,
          "id": 1845040,
          "entry_number": null,
          "date_filed": "1995-09-14T00:00:00-04:00",
          "attachments": [],
          "url": "nan",
          "recap_pdf_url": null,
          "pacer_doc_id": null,
          "description": "Judge A. D. Mazzone . Endorsement re: [82-1] letter . noted and filed cc/cl (sad) (Entered: 09/15/1995)"
        },
        {
          "row_number": 107,
          "id": 1845041,
          "entry_number": null,
          "date_filed": "1995-09-14T00:00:00-04:00",
          "attachments": [],
          "url": "nan",
          "recap_pdf_url": null,
          "pacer_doc_id": null,
          "description": "Judge A. D. Mazzone . Endorsed Order entered denying [85-1] motion to be habed to court for hearings . cc/cl (sad) (Entered: 09/15/1995)"
        },
        {
          "row_number": 108,
          "id": 1845042,
          "entry_number": "87",
          "date_filed": "1995-09-20T00:00:00-04:00",
          "attachments": [],
          "url": "nan",
          "recap_pdf_url": null,
          "pacer_doc_id": null,
          "description": "Notice of appearance of attorney for Sherman Miller in 1:72-cv-00571, Norman Knight in 1:72-cv-00571, Wayne Raymond in 1:72-cv-00571, David Martel in 1:72-cv-00571, Eric Gallagher in 1:72-cv-00571, Patton Flannery in 1:72-cv-00571, Richard Moseley in 1:72-cv-00571, Michael Woodward in 1:72-cv-00571, Edward Nadeau in 1:72-cv-00571, Philip Pizzo in 1:72-cv-00571, James LeBlanc in 1:72-cv-00571 by Jonathan I. Handler, filed. (sad) (Entered: 09/21/1995)"
        },
        {
          "row_number": 109,
          "id": 1845043,
          "entry_number": "93",
          "date_filed": "1995-09-24T00:00:00-04:00",
          "attachments": [],
          "url": "nan",
          "recap_pdf_url": null,
          "pacer_doc_id": null,
          "description": "Letter dated: 9/24/95 to: Judge re: personal letter to the court , filed. (sad) (Entered: 10/18/1995)"
        },
        {
          "row_number": 110,
          "id": 1845044,
          "entry_number": "88",
          "date_filed": "1995-10-02T00:00:00-04:00",
          "attachments": [],
          "url": "nan",
          "recap_pdf_url": null,
          "pacer_doc_id": null,
          "description": "Letter to: court re: personal letter , filed. (sad) (Entered: 10/02/1995)"
        },
        {
          "row_number": 111,
          "id": 1845045,
          "entry_number": "89",
          "date_filed": "1995-10-02T00:00:00-04:00",
          "attachments": [],
          "url": "nan",
          "recap_pdf_url": null,
          "pacer_doc_id": null,
          "description": "Judge A. D. Mazzone . Memorandum and Order entered, the motion to staty proceedings is Denied. cc/cl (sad) (Entered: 10/02/1995)"
        },
        {
          "row_number": 126,
          "id": 1845060,
          "entry_number": "104",
          "date_filed": "1996-04-18T00:00:00-04:00",
          "attachments": [],
          "url": "nan",
          "recap_pdf_url": null,
          "pacer_doc_id": null,
          "description": "Judge A. D. Mazzone . Memorandum and Order entered. granting [99-1] motion to intervene, cc/cl (sad) (Entered: 04/29/1996)"
        },
        {
          "row_number": 127,
          "id": 1845061,
          "entry_number": "118",
          "date_filed": "1996-05-20T00:00:00-04:00",
          "attachments": [],
          "url": "nan",
          "recap_pdf_url": null,
          "pacer_doc_id": null,
          "description": "Notice of appeal by Sherman Miller in 1:72-cv-00571, Wayne Raymond in 1:72-cv-00571, David Martel in 1:72-cv-00571, Eric Gallagher in 1:72-cv-00571, Michael Woodward in 1:72-cv-00571, Philip Pizzo in 1:72-cv-00571, Thomas Minervino in 1:72-cv-00571 filed. Appeal record due on 6/19/96 Patton Flannery, Edward Nadeau (fmr) (Entered: 06/11/1996)"
        },
        {
          "row_number": 128,
          "id": 1845062,
          "entry_number": "105",
          "date_filed": "1996-05-21T00:00:00-04:00",
          "attachments": [],
          "url": "nan",
          "recap_pdf_url": null,
          "pacer_doc_id": null,
          "description": "Assented to Motion by Class of 48 + 1 in 1:72-cv-00571 to extend time to 2 days to file brief , filed. (sad) (Entered: 05/22/1996)"
        },
        {
          "row_number": 129,
          "id": 1845063,
          "entry_number": "106",
          "date_filed": "1996-05-22T00:00:00-04:00",
          "attachments": [],
          "url": "nan",
          "recap_pdf_url": null,
          "pacer_doc_id": null,
          "description": "Judge A. D. Mazzone . Memorandum and Order, the motion for contempt is denied and the motion to compel is also denied, entered. cc/cl (sad) (Entered: 05/22/1996)"
        },
        {
          "row_number": 130,
          "id": 1845064,
          "entry_number": "107",
          "date_filed": "1996-05-23T00:00:00-04:00",
          "attachments": [],
          "url": "nan",
          "recap_pdf_url": null,
          "pacer_doc_id": null,
          "description": "Response in opposition to motion to modify consent decrees, filed. (sad) (Entered: 05/24/1996)"
        },
        {
          "row_number": 131,
          "id": 1845065,
          "entry_number": "108",
          "date_filed": "1996-05-23T00:00:00-04:00",
          "attachments": [],
          "url": "nan",
          "recap_pdf_url": null,
          "pacer_doc_id": null,
          "description": "Joint supplemental Response by Class of 48 + 1 in 1:72-cv-00571, Sherman Miller in 1:72-cv-00571, Sherman Miller in 1:72-cv-00571, Norman Knight in 1:72-cv-00571, Wayne Raymond in 1:72-cv-00571, David Martel in 1:72-cv-00571, Eric Gallagher in 1:72-cv-00571, Patton Flannery in 1:72-cv-00571, Richard Moseley in 1:72-cv-00571, Michael Woodward in 1:72-cv-00571, Edward Nadeau in 1:72-cv-00571, Philip Pizzo in 1:72-cv-00571, James LeBlanc in 1:72-cv-00571, Herbert P. Gleason in 1:72-cv-00571, Herbert P. Gleason in 1:72-cv-00571 in opposition to motion to mmodify and vacate consent decrees , filed. (sad) (Entered: 05/24/1996)"
        },
        {
          "row_number": 132,
          "id": 1845066,
          "entry_number": "109",
          "date_filed": "1996-05-23T00:00:00-04:00",
          "attachments": [],
          "url": "nan",
          "recap_pdf_url": null,
          "pacer_doc_id": null,
          "description": "Affidavit of Gabrielle R. Wolohojian , re: Volume I, II , filed. (sad) (Entered: 05/24/1996)"
        },
        {
          "row_number": 133,
          "id": 1845067,
          "entry_number": "110",
          "date_filed": "1996-05-30T00:00:00-04:00",
          "attachments": [],
          "url": "nan",
          "recap_pdf_url": null,
          "pacer_doc_id": null,
          "description": "Affidavit of Gabrielle R. Wolohojian , Volume II re: Includes correct exhibit V , filed. (sad) (Entered: 05/30/1996)"
        },
        {
          "row_number": 134,
          "id": 1845068,
          "entry_number": "111",
          "date_filed": "1996-05-30T00:00:00-04:00",
          "attachments": [],
          "url": "nan",
          "recap_pdf_url": null,
          "pacer_doc_id": null,
          "description": "Joint motion by Class of 48 + 1 in 1:72-cv-00571 to substitute correct exhibit , filed. . (sad) (Entered: 05/31/1996)"
        },
        {
          "row_number": 135,
          "id": 1845069,
          "entry_number": null,
          "date_filed": "1996-06-03T00:00:00-04:00",
          "attachments": [],
          "url": "nan",
          "recap_pdf_url": null,
          "pacer_doc_id": null,
          "description": "Judge A. D. Mazzone . Endorsed Order entered granting [111-1] joint motion to substitute correct exhibit . cc/cl (sad) (Entered: 06/03/1996)"
        },
        {
          "row_number": 136,
          "id": 1845070,
          "entry_number": "112",
          "date_filed": "1996-06-06T00:00:00-04:00",
          "attachments": [],
          "url": "nan",
          "recap_pdf_url": null,
          "pacer_doc_id": null,
          "description": "Motion by Michael Lesiak in 1:72-cv-00571, Charles W. Gaughan in 1:72-cv-00571, John P. Kerle in 1:72-cv-00571, Milton Greenblatt in 1:72-cv-00571, John O. Boone in 1:72-cv-00571 to extend time to 6/7/96 to for responding to memoranda of the residents , filed, c/s. (ktb) (Entered: 06/10/1996)"
        },
        {
          "row_number": 137,
          "id": 1845071,
          "entry_number": "113",
          "date_filed": "1996-06-07T00:00:00-04:00",
          "attachments": [],
          "url": "nan",
          "recap_pdf_url": null,
          "pacer_doc_id": null,
          "description": "Affidavit of Gregory M.S. Canfield, program director for Justice Resource Institute, Inc., filed. (ktb) (Entered: 06/10/1996)"
        },
        {
          "row_number": 153,
          "id": 1845087,
          "entry_number": null,
          "date_filed": "1996-07-08T00:00:00-04:00",
          "attachments": [],
          "url": "nan",
          "recap_pdf_url": null,
          "pacer_doc_id": null,
          "description": "Judge A. D. Mazzone . Endorsed Order entered granting [126-1] motion to extend time to 7/26/96 to preliminary injunction . cc/cl (sad) (Entered: 07/08/1996)"
        },
        {
          "row_number": 154,
          "id": 1845088,
          "entry_number": "127",
          "date_filed": "1996-07-19T00:00:00-04:00",
          "attachments": [],
          "url": "nan",
          "recap_pdf_url": null,
          "pacer_doc_id": null,
          "description": "Motion by Michael Lesiak in 1:72-cv-00571, Charles W. Gaughan in 1:72-cv-00571, John P. Kerle in 1:72-cv-00571, Milton Greenblatt in 1:72-cv-00571, John O. Boone in 1:72-cv-00571 to extend time to 8/2/96 to respond , filed. (sad) (Entered: 07/22/1996)"
        },
        {
          "row_number": 155,
          "id": 1845089,
          "entry_number": null,
          "date_filed": "1996-07-22T00:00:00-04:00",
          "attachments": [],
          "url": "nan",
          "recap_pdf_url": null,
          "pacer_doc_id": null,
          "description": "Judge A. D. Mazzone . Endorsed Order entered granting [127-1] motion to extend time to 8/2/96 to respond . cc/cl (sad) (Entered: 07/25/1996)"
        },
        {
          "row_number": 156,
          "id": 1845090,
          "entry_number": "128",
          "date_filed": "1996-07-26T00:00:00-04:00",
          "attachments": [],
          "url": "nan",
          "recap_pdf_url": null,
          "pacer_doc_id": null,
          "description": "Letter dated: 7/26/96 to: Judge Mazzone re: schedule hearing filed. (sad) (Entered: 08/01/1996)"
        },
        {
          "row_number": 157,
          "id": 1845091,
          "entry_number": "129",
          "date_filed": "1996-07-31T00:00:00-04:00",
          "attachments": [],
          "url": "nan",
          "recap_pdf_url": null,
          "pacer_doc_id": null,
          "description": "Supplemental Affidavit , re: of Gabrielle R. Wolohojian , filed. (sad) (Entered: 08/01/1996)"
        },
        {
          "row_number": 158,
          "id": 1845092,
          "entry_number": "130",
          "date_filed": "1996-08-02T00:00:00-04:00",
          "attachments": [],
          "url": "nan",
          "recap_pdf_url": null,
          "pacer_doc_id": null,
          "description": "Response by Michael Lesiak in 1:72-cv-00571, Charles W. Gaughan in 1:72-cv-00571, John P. Kerle in 1:72-cv-00571, Milton Greenblatt in 1:72-cv-00571, John O. Boone in 1:72-cv-00571 in opposition to [121-1] motion for preliminary injunction , with attached exhibits, filed. (sad) (Entered: 08/06/1996)"
        },
        {
          "row_number": 159,
          "id": 1845093,
          "entry_number": "131",
          "date_filed": "1996-08-23T00:00:00-04:00",
          "attachments": [],
          "url": "nan",
          "recap_pdf_url": null,
          "pacer_doc_id": null,
          "description": "Letter by William L. Pardee in 1:72-cv-00571 dated: 8/23/96 to: Mr. Lyons re: pending motions filed. (sad) (Entered: 08/27/1996)"
        },
        {
          "row_number": 160,
          "id": 1845094,
          "entry_number": "133",
          "date_filed": "1996-08-29T00:00:00-04:00",
          "attachments": [],
          "url": "nan",
          "recap_pdf_url": null,
          "pacer_doc_id": null,
          "description": "Letter dated: 8/29/96 to: Mr. Lyons re: motion for preliminary injunction, filed. (sad) (Entered: 09/05/1996)"
        },
        {
          "row_number": 161,
          "id": 1845095,
          "entry_number": "132",
          "date_filed": "1996-09-03T00:00:00-04:00",
          "attachments": [],
          "url": "nan",
          "recap_pdf_url": null,
          "pacer_doc_id": null,
          "description": "Judge A. D. Mazzone . Notice of Hearing/conference: Motion hearing set for 11:00 9/13/96 for [121-1] motion for preliminary injunction , and Motion hearing set for 10:00 9/16/96 for [48-1] motion to vacate [35-1] memorandum order . cc/cl (sad) (Entered: 09/03/1996)"
        },
        {
          "row_number": 162,
          "id": 1845096,
          "entry_number": "134",
          "date_filed": "1996-09-06T00:00:00-04:00",
          "attachments": [],
          "url": "nan",
          "recap_pdf_url": null,
          "pacer_doc_id": null,
          "description": "Motion by Harold Williams in 1:72-cv-00571, Thomas Minervino in 1:72-cv-00571, James M. Kater in 1:72-cv-00571 for leave to file reply , filed. (sad) (Entered: 09/10/1996)"
        },
        {
          "row_number": 163,
          "id": 1845097,
          "entry_number": "135",
          "date_filed": "1996-09-09T00:00:00-04:00",
          "attachments": [],
          "url": "nan",
          "recap_pdf_url": null,
          "pacer_doc_id": null,
          "description": "Motion by Michael Lesiak in 1:72-cv-00571, Charles W. Gaughan in 1:72-cv-00571, John P. Kerle in 1:72-cv-00571, Milton Greenblatt in 1:72-cv-00571, John O. Boone in 1:72-cv-00571 to strike tate's motion for contempt and opposition to tate's motion for contempt , filed. (sad) (Entered: 09/10/1996)"
        },
        {
          "row_number": 164,
          "id": 1845098,
          "entry_number": "136",
          "date_filed": "1996-09-12T00:00:00-04:00",
          "attachments": [],
          "url": "nan",
          "recap_pdf_url": null,
          "pacer_doc_id": null,
          "description": "Objection to Special Master reporting facts or making factual findings, by Michael Lesiak in 1:72-cv-00571, Charles W. Gaughan in 1:72-cv- 00571, John P. Kerle in 1:72-cv-00571, Milton Greenblatt in 1:72-cv- 00571, John O. Boone in 1:72-cv-00571 re: , filed. (sad) (Entered: 09/13/1996)"
        },
        {
          "row_number": 165,
          "id": 1845099,
          "entry_number": "137",
          "date_filed": "1996-09-26T00:00:00-04:00",
          "attachments": [],
          "url": "nan",
          "recap_pdf_url": null,
          "pacer_doc_id": null,
          "description": "Motion for contempt of defendants , filed. (sad) (Entered: 09/27/1996)"
        },
        {
          "row_number": 173,
          "id": 1845107,
          "entry_number": "145",
          "date_filed": "1996-10-15T00:00:00-04:00",
          "attachments": [],
          "url": "nan",
          "recap_pdf_url": null,
          "pacer_doc_id": null,
          "description": "Memorandum by Class of 48 + 1 in 1:72-cv-00571 in opposition to modify and vacate the consent decrees , filed. (sad) (Entered: 10/16/1996)"
        },
        {
          "row_number": 174,
          "id": 1845108,
          "entry_number": "146",
          "date_filed": "1996-10-22T00:00:00-04:00",
          "attachments": [],
          "url": "nan",
          "recap_pdf_url": null,
          "pacer_doc_id": null,
          "description": "Judge A. D. Mazzone . Memorandum and Order, The motion to modify is ALLOWED, the motion to vacate is Denied without prejudice to renew, entered. cc/cl (sad) (Entered: 10/22/1996)"
        },
        {
          "row_number": 195,
          "id": 1845129,
          "entry_number": null,
          "date_filed": "1997-01-15T00:00:00-05:00",
          "attachments": [],
          "url": "nan",
          "recap_pdf_url": null,
          "pacer_doc_id": null,
          "description": "Judge A. D. Mazzone . Endorsed Order entered granting [162-1] motion to extend time to 1/22/97 to file monthly report . cc/cl (sad) (Entered: 01/15/1997)"
        },
        {
          "row_number": 196,
          "id": 1845130,
          "entry_number": "248",
          "date_filed": "1997-01-20T00:00:00-05:00",
          "attachments": [],
          "url": "nan",
          "recap_pdf_url": null,
          "pacer_doc_id": null,
          "description": "Monthly report for December 1997 filed c/s (sad) (Entered: 01/21/1998)"
        },
        {
          "row_number": 197,
          "id": 1845131,
          "entry_number": "163",
          "date_filed": "1997-01-22T00:00:00-05:00",
          "attachments": [],
          "url": "nan",
          "recap_pdf_url": null,
          "pacer_doc_id": null,
          "description": "Monthly report filed (sad) (Entered: 01/23/1997)"
        },
        {
          "row_number": 198,
          "id": 1845132,
          "entry_number": "164",
          "date_filed": "1997-01-30T00:00:00-05:00",
          "attachments": [],
          "url": "nan",
          "recap_pdf_url": null,
          "pacer_doc_id": null,
          "description": "Judge A. D. Mazzone . Memorandum and Order entered. denying [153-1] motion to relief from judgment, cc/cl (sad) (Entered: 01/31/1997)"
        },
        {
          "row_number": 199,
          "id": 1845133,
          "entry_number": "165",
          "date_filed": "1997-01-30T00:00:00-05:00",
          "attachments": [],
          "url": "nan",
          "recap_pdf_url": null,
          "pacer_doc_id": null,
          "description": "Judge A. D. Mazzone . Memorandum and Order entered. for the reasons set forth above, the defendants are ordered to report to the court as scheduled. So Ordered. cc/cl (sad) (Entered: 01/31/1997)"
        },
        {
          "row_number": 200,
          "id": 1845134,
          "entry_number": "166",
          "date_filed": "1997-02-11T00:00:00-05:00",
          "attachments": [],
          "url": "nan",
          "recap_pdf_url": null,
          "pacer_doc_id": null,
          "description": "Plaintiffs' joint response to defendants' monthly report for December 1996, filed (sad) (Entered: 02/12/1997)"
        },
        {
          "row_number": 201,
          "id": 1845135,
          "entry_number": "168",
          "date_filed": "1997-02-21T00:00:00-05:00",
          "attachments": [],
          "url": "nan",
          "recap_pdf_url": null,
          "pacer_doc_id": null,
          "description": "Letter dated: 2/18/97 to: Ms. Diskes re: attachments to Monthly report filed. (sad) (Entered: 02/21/1997)"
        },
        {
          "row_number": 202,
          "id": 1845136,
          "entry_number": "169",
          "date_filed": "1997-02-21T00:00:00-05:00",
          "attachments": [],
          "url": "nan",
          "recap_pdf_url": null,
          "pacer_doc_id": null,
          "description": "Statement of Facts by Harold Williams in 1:72-cv-00571 re: , filed. (sad) (Entered: 02/24/1997)"
        },
        {
          "row_number": 203,
          "id": 1845137,
          "entry_number": null,
          "date_filed": "1997-02-21T00:00:00-05:00",
          "attachments": [],
          "url": "nan",
          "recap_pdf_url": null,
          "pacer_doc_id": null,
          "description": "Statement of Representation filed by plaintiff (72-788) represented by Robert Keefe. Intervenor plaintiffs in the Williams case(72-571) are represented by Charles Donelan. (fmr) (Entered: 02/24/1997)"
        },
        {
          "row_number": 204,
          "id": 1845138,
          "entry_number": "170",
          "date_filed": "1997-02-26T00:00:00-05:00",
          "attachments": [],
          "url": "nan",
          "recap_pdf_url": null,
          "pacer_doc_id": null,
          "description": "Defendants' reply to Intervenor Plaintiffs response to defendants' Monthly report for December 1996, filed (sad) (Entered: 02/27/1997)"
        },
        {
          "row_number": 205,
          "id": 1845139,
          "entry_number": "171",
          "date_filed": "1997-02-27T00:00:00-05:00",
          "attachments": [],
          "url": "nan",
          "recap_pdf_url": null,
          "pacer_doc_id": null,
          "description": "Plaintiffs joint response to defendants' monthly report for January 1997, filed (sad) (Entered: 02/27/1997)"
        },
        {
          "row_number": 206,
          "id": 1845140,
          "entry_number": "172",
          "date_filed": "1997-03-07T00:00:00-05:00",
          "attachments": [],
          "url": "nan",
          "recap_pdf_url": null,
          "pacer_doc_id": null,
          "description": "Judge A. D. Mazzone. Memorandum and Order entered re Commonwealth's Monthly Report. cc/cl. Commonwealth's Monthly Report. (ktb) (Entered: 03/07/1997)"
        },
        {
          "row_number": 207,
          "id": 1845141,
          "entry_number": "173",
          "date_filed": "1997-03-10T00:00:00-05:00",
          "attachments": [],
          "url": "nan",
          "recap_pdf_url": null,
          "pacer_doc_id": null,
          "description": "Intervenor Plaintiff Calvin Tate's Response to Defendants' Monthly Report of December 1996 filed on February 26, 1997, filed; c/s. (sat) (Entered: 03/10/1997)"
        },
        {
          "row_number": 208,
          "id": 1845142,
          "entry_number": "174",
          "date_filed": "1997-03-12T00:00:00-05:00",
          "attachments": [],
          "url": "nan",
          "recap_pdf_url": null,
          "pacer_doc_id": null,
          "description": "Supplemental Reply/response by Michael Lesiak in 1:72-cv-00571, Charles W. Gaughan in 1:72-cv-00571, John P. Kerle in 1:72-cv-00571, Milton Greenblatt in 1:72-cv-00571, John O. Boone in 1:72-cv-00571 to [171-1] Intervenors Pltfs' Response to Defts' Montly Report for December 1996, with attachments, FILED, c/s. (ktb) (Entered: 03/13/1997)"
        },
        {
          "row_number": 212,
          "id": 1845146,
          "entry_number": "178",
          "date_filed": "1997-04-14T00:00:00-04:00",
          "attachments": [],
          "url": "nan",
          "recap_pdf_url": null,
          "pacer_doc_id": null,
          "description": "Motion by Michael Lesiak in 1:72-cv-00571, Charles W. Gaughan in 1:72-cv-00571, John P. Kerle in 1:72-cv-00571, Milton Greenblatt in 1:72-cv-00571, John O. Boone in 1:72-cv-00571 to extend time to 3 days to file monthly report , filed. (sad) (Entered: 04/14/1997)"
        },
        {
          "row_number": 213,
          "id": 1845147,
          "entry_number": null,
          "date_filed": "1997-04-15T00:00:00-04:00",
          "attachments": [],
          "url": "nan",
          "recap_pdf_url": null,
          "pacer_doc_id": null,
          "description": "Judge A. D. Mazzone . Endorsed Order entered granting [178-1] motion to extend time to 3 days to file monthly report . cc/cl (sad) (Entered: 04/15/1997)"
        },
        {
          "row_number": 214,
          "id": 1845148,
          "entry_number": "179",
          "date_filed": "1997-04-18T00:00:00-04:00",
          "attachments": [],
          "url": "nan",
          "recap_pdf_url": null,
          "pacer_doc_id": null,
          "description": "Notice of filing monthly report by Michael Lesiak in 1:72-cv-00571, Charles W. Gaughan in 1:72-cv-00571, John P. Kerle in 1:72-cv-00571, Milton Greenblatt in 1:72-cv-00571, John O. Boone in 1:72-cv-00571 , filed. (sad) (Entered: 04/21/1997)"
        },
        {
          "row_number": 215,
          "id": 1845149,
          "entry_number": "180",
          "date_filed": "1997-04-24T00:00:00-04:00",
          "attachments": [],
          "url": "nan",
          "recap_pdf_url": null,
          "pacer_doc_id": null,
          "description": "Plaintiffs' joint response to defendants' report for March 1997, filed (sad) (Entered: 04/24/1997)"
        },
        {
          "row_number": 216,
          "id": 1845150,
          "entry_number": "181",
          "date_filed": "1997-04-29T00:00:00-04:00",
          "attachments": [],
          "url": "nan",
          "recap_pdf_url": null,
          "pacer_doc_id": null,
          "description": "Judge A. D. Mazzone . Memorandum and Order, As I indicated during the tour, and as requested by plaintiffs' counsel, I will schedule a visit to the treatment center in the future which will provide residents with an opportunity to more directly convey their concerns to the court, entered. cc/cl (sad) (Entered: 04/30/1997)"
        },
        {
          "row_number": 217,
          "id": 1845151,
          "entry_number": "182",
          "date_filed": "1997-05-14T00:00:00-04:00",
          "attachments": [],
          "url": "nan",
          "recap_pdf_url": null,
          "pacer_doc_id": null,
          "description": "Motion by Michael Lesiak in 1:72-cv-00571, Charles W. Gaughan in 1:72-cv-00571, John P. Kerle in 1:72-cv-00571, Milton Greenblatt in 1:72-cv-00571, John O. Boone in 1:72-cv-00571 to extend time to 5/20/97 to file monthly report , filed. c/s (sad) (Entered: 05/15/1997)"
        },
        {
          "row_number": 218,
          "id": 1845152,
          "entry_number": null,
          "date_filed": "1997-05-15T00:00:00-04:00",
          "attachments": [],
          "url": "nan",
          "recap_pdf_url": null,
          "pacer_doc_id": null,
          "description": "Judge A. D. Mazzone . Endorsed Order entered granting [182-1] motion to extend time to 5/20/97 to file monthly report . cc/cl (sad) (Entered: 05/15/1997)"
        },
        {
          "row_number": 219,
          "id": 1845153,
          "entry_number": "183",
          "date_filed": "1997-05-20T00:00:00-04:00",
          "attachments": [],
          "url": "nan",
          "recap_pdf_url": null,
          "pacer_doc_id": null,
          "description": "Notice of filing monthly report by Michael Lesiak in 1:72-cv-00571, Charles W. Gaughan in 1:72-cv-00571, John P. Kerle in 1:72-cv-00571, Milton Greenblatt in 1:72-cv-00571, John O. Boone in 1:72-cv-00571 , filed. c/s (sad) (Entered: 05/21/1997)"
        },
        {
          "row_number": 234,
          "id": 1845168,
          "entry_number": "194",
          "date_filed": "1997-07-03T00:00:00-04:00",
          "attachments": [],
          "url": "nan",
          "recap_pdf_url": null,
          "pacer_doc_id": null,
          "description": "Plaintiffs' response to defendants' monthly report for May,1997, filed c/s (sad) (Entered: 07/03/1997)"
        },
        {
          "row_number": 243,
          "id": 1845177,
          "entry_number": "203",
          "date_filed": "1997-07-23T00:00:00-04:00",
          "attachments": [],
          "url": "nan",
          "recap_pdf_url": null,
          "pacer_doc_id": null,
          "description": "Monthly report for June 1997, filed c/s (sad) (Entered: 07/24/1997)"
        },
        {
          "row_number": 244,
          "id": 1845178,
          "entry_number": "204",
          "date_filed": "1997-07-29T00:00:00-04:00",
          "attachments": [],
          "url": "nan",
          "recap_pdf_url": null,
          "pacer_doc_id": null,
          "description": "Plaintiffs' joint supplemental response to May 1997 Report filed c/s (sad) (Entered: 07/30/1997)"
        },
        {
          "row_number": 245,
          "id": 1845179,
          "entry_number": null,
          "date_filed": "1997-08-05T00:00:00-04:00",
          "attachments": [],
          "url": "nan",
          "recap_pdf_url": null,
          "pacer_doc_id": null,
          "description": "Judge A. D. Mazzone . Endorsed Order entered granting [202-1] motion to seal/impound . cc/cl (sad) (Entered: 08/05/1997)"
        },
        {
          "row_number": 246,
          "id": 1845180,
          "entry_number": null,
          "date_filed": "1997-08-05T00:00:00-04:00",
          "attachments": [],
          "url": "nan",
          "recap_pdf_url": null,
          "pacer_doc_id": null,
          "description": "Judge A. D. Mazzone . Endorsed Order entered granting [192-1] motion to seal/impound . cc/cl (sad) (Entered: 08/05/1997)"
        },
        {
          "row_number": 247,
          "id": 1845181,
          "entry_number": null,
          "date_filed": "1997-08-05T00:00:00-04:00",
          "attachments": [],
          "url": "nan",
          "recap_pdf_url": null,
          "pacer_doc_id": null,
          "description": "Judge A. D. Mazzone . Endorsed Order entered granting [196-1] motion to extend time to 7 days to file report . cc/cl (sad) (Entered: 08/05/1997)"
        },
        {
          "row_number": 248,
          "id": 1845182,
          "entry_number": null,
          "date_filed": "1997-08-05T00:00:00-04:00",
          "attachments": [],
          "url": "nan",
          "recap_pdf_url": null,
          "pacer_doc_id": null,
          "description": "Judge A. D. Mazzone . Endorsed Order entered granting [199-1] motion to withdraw [197-1] motion response . cc/cl (sad) (Entered: 08/05/1997)"
        },
        {
          "row_number": 249,
          "id": 1845183,
          "entry_number": "205",
          "date_filed": "1997-08-05T00:00:00-04:00",
          "attachments": [],
          "url": "nan",
          "recap_pdf_url": null,
          "pacer_doc_id": null,
          "description": "Judge A. D. Mazzone . Memorandum and Order entered. cc/cl (sad) (Entered: 08/05/1997)"
        },
        {
          "row_number": 250,
          "id": 1845184,
          "entry_number": "207",
          "date_filed": "1997-08-15T00:00:00-04:00",
          "attachments": [],
          "url": "nan",
          "recap_pdf_url": null,
          "pacer_doc_id": null,
          "description": "Motion by Michael Lesiak in 1:72-cv-00571, Charles W. Gaughan in 1:72-cv-00571, John P. Kerle in 1:72-cv-00571, Milton Greenblatt in 1:72-cv-00571, John O. Boone in 1:72-cv-00571 to seal/impound , filed. (sad) (Entered: 08/18/1997)"
        },
        {
          "row_number": 251,
          "id": 1845185,
          "entry_number": "208",
          "date_filed": "1997-08-15T00:00:00-04:00",
          "attachments": [],
          "url": "nan",
          "recap_pdf_url": null,
          "pacer_doc_id": null,
          "description": "MONTHLY REPORT FOR JULY 1997 , FILED (sad) (Entered: 08/18/1997)"
        },
        {
          "row_number": 252,
          "id": 1845186,
          "entry_number": "209",
          "date_filed": "1997-08-25T00:00:00-04:00",
          "attachments": [],
          "url": "nan",
          "recap_pdf_url": null,
          "pacer_doc_id": null,
          "description": "Plaintiffs' joint response to defendants' report for July 1997, filed (sad) (Entered: 08/25/1997)"
        },
        {
          "row_number": 253,
          "id": 1845187,
          "entry_number": "210",
          "date_filed": "1997-09-09T00:00:00-04:00",
          "attachments": [],
          "url": "nan",
          "recap_pdf_url": null,
          "pacer_doc_id": null,
          "description": "Judge A. D. Mazzone . Memorandum and Order entered. cc/cl (sad) (Entered: 09/10/1997)"
        },
        {
          "row_number": 254,
          "id": 1845188,
          "entry_number": "211",
          "date_filed": "1997-09-11T00:00:00-04:00",
          "attachments": [],
          "url": "nan",
          "recap_pdf_url": null,
          "pacer_doc_id": null,
          "description": "Motion by Michael Lesiak in 1:72-cv-00571, Charles W. Gaughan in 1:72-cv-00571, John P. Kerle in 1:72-cv-00571, Milton Greenblatt in 1:72-cv-00571, John O. Boone in 1:72-cv-00571 to extend time to 4 days to file report , filed. (sad) (Entered: 09/12/1997)"
        },
        {
          "row_number": 270,
          "id": 1845204,
          "entry_number": "226",
          "date_filed": "1997-10-30T00:00:00-05:00",
          "attachments": [],
          "url": "nan",
          "recap_pdf_url": null,
          "pacer_doc_id": null,
          "description": "Judge A. D. Mazzone . Memorandum and Order entered. cc/cl (sad) (Entered: 10/31/1997)"
        },
        {
          "row_number": 271,
          "id": 1845205,
          "entry_number": "227",
          "date_filed": "1997-11-07T00:00:00-05:00",
          "attachments": [],
          "url": "nan",
          "recap_pdf_url": null,
          "pacer_doc_id": null,
          "description": "Response by Harold Williams in 1:72-cv-00571, Thomas Minervino in 1:72-cv-00571, James M. Kater in 1:72-cv-00571 in opposition to [217- 1] motion for protective order , filed. c/s (sad) (Entered: 11/10/1997)"
        },
        {
          "row_number": 272,
          "id": 1845206,
          "entry_number": "228",
          "date_filed": "1997-11-10T00:00:00-05:00",
          "attachments": [],
          "url": "nan",
          "recap_pdf_url": null,
          "pacer_doc_id": null,
          "description": "Joint statement by Harold Williams in 1:72-cv-00571, Thomas Minervino in 1:72-cv-00571, James M. Kater in 1:72-cv-00571 , re: concerning supplemental decree, filed. (sad) (Entered: 11/13/1997)"
        },
        {
          "row_number": 273,
          "id": 1845207,
          "entry_number": "229",
          "date_filed": "1997-11-10T00:00:00-05:00",
          "attachments": [],
          "url": "nan",
          "recap_pdf_url": null,
          "pacer_doc_id": null,
          "description": "Affidavit of DR. Austin Deslauriers , filed. (sad) (Entered: 11/13/1997)"
        },
        {
          "row_number": 274,
          "id": 1845208,
          "entry_number": "230",
          "date_filed": "1997-11-10T00:00:00-05:00",
          "attachments": [],
          "url": "nan",
          "recap_pdf_url": null,
          "pacer_doc_id": null,
          "description": "Affidavit of Jeffrey S. Follett , filed. (sad) (Entered: 11/13/1997)"
        },
        {
          "row_number": 275,
          "id": 1845209,
          "entry_number": "231",
          "date_filed": "1997-11-17T00:00:00-05:00",
          "attachments": [],
          "url": "nan",
          "recap_pdf_url": null,
          "pacer_doc_id": null,
          "description": "Notice of filing monthly report by Michael Lesiak in 1:72-cv-00571, Charles W. Gaughan in 1:72-cv-00571, John P. Kerle in 1:72-cv-00571, Milton Greenblatt in 1:72-cv-00571, John O. Boone in 1:72-cv-00571 , filed. (sad) (Entered: 11/18/1997)"
        },
        {
          "row_number": 276,
          "id": 1845210,
          "entry_number": "233",
          "date_filed": "1997-11-17T00:00:00-05:00",
          "attachments": [],
          "url": "nan",
          "recap_pdf_url": null,
          "pacer_doc_id": null,
          "description": "Monthly report for October 1997, filed (sad) (Entered: 11/18/1997)"
        },
        {
          "row_number": 277,
          "id": 1845211,
          "entry_number": "234",
          "date_filed": "1997-11-26T00:00:00-05:00",
          "attachments": [],
          "url": "nan",
          "recap_pdf_url": null,
          "pacer_doc_id": null,
          "description": "Special interim statement of the superintendent for the month of November 1997, filed (sad) (Entered: 12/01/1997)"
        },
        {
          "row_number": 278,
          "id": 1845212,
          "entry_number": "235",
          "date_filed": "1997-12-01T00:00:00-05:00",
          "attachments": [],
          "url": "nan",
          "recap_pdf_url": null,
          "pacer_doc_id": null,
          "description": "Joint motion by Harold Williams in 1:72-cv-00571, Thomas Minervino in 1:72-cv-00571, James M. Kater in 1:72-cv-00571, Michael Lesiak in 1:72-cv-00571, Charles W. Gaughan in 1:72-cv-00571, John P. Kerle in 1:72-cv-00571, Milton Greenblatt in 1:72-cv-00571, John O. Boone in 1:72-cv-00571, Class of 48 + 1 in 1:72-cv-00571 for leave to file affidavit , filed. . (sad) (Entered: 12/01/1997)"
        },
        {
          "row_number": 279,
          "id": 1845213,
          "entry_number": "236",
          "date_filed": "1997-12-05T00:00:00-05:00",
          "attachments": [],
          "url": "nan",
          "recap_pdf_url": null,
          "pacer_doc_id": null,
          "description": "Special interim statement of the superintendent for the month of November 1997, filed c/s (sad) (Entered: 12/09/1997)"
        },
        {
          "row_number": 280,
          "id": 1845214,
          "entry_number": "237",
          "date_filed": "1997-12-12T00:00:00-05:00",
          "attachments": [],
          "url": "nan",
          "recap_pdf_url": null,
          "pacer_doc_id": null,
          "description": "Motion by Michael Lesiak in 1:72-cv-00571, Charles W. Gaughan in 1:72-cv-00571, John P. Kerle in 1:72-cv-00571, Milton Greenblatt in 1:72-cv-00571, John O. Boone in 1:72-cv-00571 to extend time to 12/19/97 to file monthly report , filed. (sad) (Entered: 12/15/1997)"
        },
        {
          "row_number": 281,
          "id": 1845215,
          "entry_number": "238",
          "date_filed": "1997-12-16T00:00:00-05:00",
          "attachments": [],
          "url": "nan",
          "recap_pdf_url": null,
          "pacer_doc_id": null,
          "description": "Judge A. D. Mazzone . Memorandum and Order entered. cc/cl (sad) (Entered: 12/18/1997)"
        },
        {
          "row_number": 282,
          "id": 1845216,
          "entry_number": null,
          "date_filed": "1997-12-17T00:00:00-05:00",
          "attachments": [],
          "url": "nan",
          "recap_pdf_url": null,
          "pacer_doc_id": null,
          "description": "Judge A. D. Mazzone . Endorsed Order entered granting [237-1] motion to extend time to 12/19/97 to file monthly report . cc/cl (sad) (Entered: 12/19/1997)"
        },
        {
          "row_number": 283,
          "id": 1845217,
          "entry_number": null,
          "date_filed": "1997-12-18T00:00:00-05:00",
          "attachments": [],
          "url": "nan",
          "recap_pdf_url": null,
          "pacer_doc_id": null,
          "description": "Judge A. D. Mazzone . Endorsed Order entered granting [231-1] motion to impound . cc/cl (sad) (Entered: 12/18/1997)"
        },
        {
          "row_number": 284,
          "id": 1845218,
          "entry_number": "239",
          "date_filed": "1997-12-19T00:00:00-05:00",
          "attachments": [],
          "url": "nan",
          "recap_pdf_url": null,
          "pacer_doc_id": null,
          "description": "Notice of filing monthly report by Michael Lesiak in 1:72-cv-00571, Charles W. Gaughan in 1:72-cv-00571, John P. Kerle in 1:72-cv-00571, Milton Greenblatt in 1:72-cv-00571, John O. Boone in 1:72-cv-00571 , filed. (sad) (Entered: 12/23/1997)"
        },
        {
          "row_number": 285,
          "id": 1845219,
          "entry_number": "240",
          "date_filed": "1997-12-19T00:00:00-05:00",
          "attachments": [],
          "url": "nan",
          "recap_pdf_url": null,
          "pacer_doc_id": null,
          "description": "Motion by Michael Lesiak in 1:72-cv-00571, Charles W. Gaughan in 1:72-cv-00571, John P. Kerle in 1:72-cv-00571, Milton Greenblatt in 1:72-cv-00571, John O. Boone in 1:72-cv-00571 to seal/impound exhibits I- J , filed. (sad) (Entered: 12/23/1997)"
        },
        {
          "row_number": 286,
          "id": 1845220,
          "entry_number": "241",
          "date_filed": "1997-12-19T00:00:00-05:00",
          "attachments": [],
          "url": "nan",
          "recap_pdf_url": null,
          "pacer_doc_id": null,
          "description": "Monthly Report for November 1997 filed c/s (sad) (Entered: 12/23/1997)"
        },
        {
          "row_number": 287,
          "id": 1845221,
          "entry_number": "242",
          "date_filed": "1997-12-29T00:00:00-05:00",
          "attachments": [],
          "url": "nan",
          "recap_pdf_url": null,
          "pacer_doc_id": null,
          "description": "Plaintiffs' joint response to defendants' November 1997 report filed c/s (sad) (Entered: 12/30/1997)"
        },
        {
          "row_number": 288,
          "id": 1845222,
          "entry_number": null,
          "date_filed": "1997-12-29T00:00:00-05:00",
          "attachments": [],
          "url": "nan",
          "recap_pdf_url": null,
          "pacer_doc_id": null,
          "description": "Judge A. D. Mazzone . Endorsed Order entered granting [240-1] motion to seal/impound exhibits I- J . cc/cl (sad) (Entered: 12/30/1997)"
        },
        {
          "row_number": 289,
          "id": 1845223,
          "entry_number": "243",
          "date_filed": "1997-12-29T00:00:00-05:00",
          "attachments": [],
          "url": "nan",
          "recap_pdf_url": null,
          "pacer_doc_id": null,
          "description": "Judge A. D. Mazzone . Memorandum and Order entered. cc/cl (sad) (Entered: 12/30/1997)"
        },
        {
          "row_number": 290,
          "id": 1845224,
          "entry_number": null,
          "date_filed": "1998-01-09T00:00:00-05:00",
          "attachments": [],
          "url": "nan",
          "recap_pdf_url": null,
          "pacer_doc_id": null,
          "description": "Terminated document: mooting [211-1] motion to extend time to 4 days to file report Requested by adm. (sad) (Entered: 01/09/1998)"
        },
        {
          "row_number": 291,
          "id": 1845225,
          "entry_number": "244",
          "date_filed": "1998-01-12T00:00:00-05:00",
          "attachments": [],
          "url": "nan",
          "recap_pdf_url": null,
          "pacer_doc_id": null,
          "description": "Motion by Harold Williams in 1:72-cv-00571, Thomas Minervino in 1:72-cv-00571, James M. Kater in 1:72-cv-00571 for obstruction of justice , filed. (sad) (Entered: 01/12/1998)"
        },
        {
          "row_number": 292,
          "id": 1845226,
          "entry_number": "245",
          "date_filed": "1998-01-12T00:00:00-05:00",
          "attachments": [],
          "url": "nan",
          "recap_pdf_url": null,
          "pacer_doc_id": null,
          "description": "Motion by Harold Williams in 1:72-cv-00571, Thomas Minervino in 1:72-cv-00571, James M. Kater in 1:72-cv-00571 to stay , filed. (sad) (Entered: 01/12/1998)"
        },
        {
          "row_number": 293,
          "id": 1845227,
          "entry_number": "246",
          "date_filed": "1998-01-14T00:00:00-05:00",
          "attachments": [],
          "url": "nan",
          "recap_pdf_url": null,
          "pacer_doc_id": null,
          "description": "Judge A. D. Mazzone . Memorandum and Order entered. cc/cl (sad) Modified on 02/11/1998 (Entered: 01/15/1998)"
        },
        {
          "row_number": 300,
          "id": 1845234,
          "entry_number": "253",
          "date_filed": "1998-02-17T00:00:00-05:00",
          "attachments": null,
          "url": "nan",
          "recap_pdf_url": null,
          "pacer_doc_id": null,
          "description": "Monthly report for January 1998 filed with exhibits (sad) (Entered: 02/18/1998)"
        },
        {
          "row_number": 301,
          "id": 1845235,
          "entry_number": "254",
          "date_filed": "1998-02-24T00:00:00-05:00",
          "attachments": null,
          "url": "nan",
          "recap_pdf_url": null,
          "pacer_doc_id": null,
          "description": "Plaintiffs' joint response to defendants' January 1998 report filed (sad) (Entered: 02/25/1998)"
        },
        {
          "row_number": 302,
          "id": 1845236,
          "entry_number": null,
          "date_filed": "1998-03-09T00:00:00-05:00",
          "attachments": null,
          "url": "nan",
          "recap_pdf_url": null,
          "pacer_doc_id": null,
          "description": "Judge A. D. Mazzone . Endorsed Order entered granting [252-1] motion to seal/impound . cc/cl (sad) (Entered: 03/10/1998)"
        },
        {
          "row_number": 303,
          "id": 1845237,
          "entry_number": "255",
          "date_filed": "1998-03-09T00:00:00-05:00",
          "attachments": null,
          "url": "nan",
          "recap_pdf_url": null,
          "pacer_doc_id": null,
          "description": "Judge A. D. Mazzone . Memorandum and Order entered. denying [245-1] motion to stay, cc/cl (sad) (Entered: 03/10/1998)"
        },
        {
          "row_number": 304,
          "id": 1845238,
          "entry_number": "256",
          "date_filed": "1998-03-16T00:00:00-05:00",
          "attachments": null,
          "url": "nan",
          "recap_pdf_url": null,
          "pacer_doc_id": null,
          "description": "Motion by Michael Lesiak in 1:72-cv-00571, Charles W. Gaughan in 1:72-cv-00571, John P. Kerle in 1:72-cv-00571, Milton Greenblatt in 1:72-cv-00571, John O. Boone in 1:72-cv-00571 to seal/impound , filed. (sad) (Entered: 03/17/1998)"
        },
        {
          "row_number": 305,
          "id": 1845239,
          "entry_number": "257",
          "date_filed": "1998-03-16T00:00:00-05:00",
          "attachments": null,
          "url": "nan",
          "recap_pdf_url": null,
          "pacer_doc_id": null,
          "description": "Monthly Report for February 1998, filed c/s (sad) (Entered: 03/17/1998)"
        },
        {
          "row_number": 306,
          "id": 1845240,
          "entry_number": "258",
          "date_filed": "1998-03-16T00:00:00-05:00",
          "attachments": null,
          "url": "nan",
          "recap_pdf_url": null,
          "pacer_doc_id": null,
          "description": "SEALED DOCUMENT placed in vault. (sad) (Entered: 03/17/1998)"
        },
        {
          "row_number": 307,
          "id": 1845241,
          "entry_number": null,
          "date_filed": "1998-03-18T00:00:00-05:00",
          "attachments": null,
          "url": "nan",
          "recap_pdf_url": null,
          "pacer_doc_id": null,
          "description": "Judge A. D. Mazzone . Endorsed Order entered granting [256-1] motion to seal/impound . cc/cl (sad) (Entered: 03/19/1998)"
        },
        {
          "row_number": 308,
          "id": 1845242,
          "entry_number": "259",
          "date_filed": "1998-03-20T00:00:00-05:00",
          "attachments": null,
          "url": "nan",
          "recap_pdf_url": null,
          "pacer_doc_id": null,
          "description": "Letter by Jonathan I. Handler in 1:72-cv-00571 dated: 3/20/98 to: Mr. Lyons re: filing monthly report filed. (sad) (Entered: 03/23/1998)"
        },
        {
          "row_number": 309,
          "id": 1845243,
          "entry_number": "260",
          "date_filed": "1998-03-23T00:00:00-05:00",
          "attachments": null,
          "url": "nan",
          "recap_pdf_url": null,
          "pacer_doc_id": null,
          "description": "Original pages 9-11 to defendants' monthly report for February 1998, filed (sad) (Entered: 03/23/1998)"
        },
        {
          "row_number": 310,
          "id": 1845244,
          "entry_number": "261",
          "date_filed": "1998-03-27T00:00:00-05:00",
          "attachments": null,
          "url": "nan",
          "recap_pdf_url": null,
          "pacer_doc_id": null,
          "description": "Reply/response by Harold Williams in 1:72-cv-00571, Thomas Minervino in 1:72-cv-00571, James M. Kater in 1:72-cv-00571, Michael Lesiak in 1:72-cv-00571, Charles W. Gaughan in 1:72-cv-00571, John P. Kerle in 1:72-cv-00571, Milton Greenblatt in 1:72-cv-00571, John O. Boone in 1:72-cv-00571, Class of 48 + 1 in 1:72-cv-00571 to [260-1] monthly report for February 1998 , filed. (sad) (Entered: 03/27/1998)"
        },
        {
          "row_number": 311,
          "id": 1845245,
          "entry_number": "262",
          "date_filed": "1998-03-30T00:00:00-05:00",
          "attachments": null,
          "url": "nan",
          "recap_pdf_url": null,
          "pacer_doc_id": null,
          "description": "Judge A. D. Mazzone . Memorandum and Order entered. Accordingly, the commonwealth is relieved of its responsibility for further reports until further notice. cc/cl (sad) (Entered: 04/01/1998)"
        },
        {
          "row_number": 312,
          "id": 1845246,
          "entry_number": null,
          "date_filed": "1998-03-31T00:00:00-05:00",
          "attachments": null,
          "url": "nan",
          "recap_pdf_url": null,
          "pacer_doc_id": null,
          "description": "Terminated document: [232-1] motion to seal/impound in 1:72-cv-00571, [220-1] motion to seal/impound exhibits A-M in 1:72-cv-00571, [207-1] motion to seal/impound in 1:72-cv-00571, [500-1] motion to seal/impound exhibits A -M in 1:72-cv-00788, [486-1] motion to seal/impound in 1:72-cv-00788 Requested by PJ Lyons after review of CJRA report. (vah) (Entered: 04/08/1998)"
        },
        {
          "row_number": 313,
          "id": 1845247,
          "entry_number": "263",
          "date_filed": "1998-06-29T00:00:00-04:00",
          "attachments": null,
          "url": "nan",
          "recap_pdf_url": null,
          "pacer_doc_id": null,
          "description": "Joint motion by Harold Williams in 1:72-cv-00571, Thomas Minervino in 1:72-cv-00571, James M. Kater in 1:72-cv-00571, Michael Lesiak in 1:72-cv-00571, Charles W. Gaughan in 1:72-cv-00571, John P. Kerle in 1:72-cv-00571, Milton Greenblatt in 1:72-cv-00571, John O. Boone in 1:72-cv-00571, Class of 48 + 1 in 1:72-cv-00571 for leave to file affidavit under seal , filed. . (sad) (Entered: 06/29/1998)"
        },
        {
          "row_number": 314,
          "id": 1845248,
          "entry_number": null,
          "date_filed": "1998-08-10T00:00:00-04:00",
          "attachments": null,
          "url": "nan",
          "recap_pdf_url": null,
          "pacer_doc_id": null,
          "description": "Judge A. D. Mazzone . Endorsed Order entered granting [263-1] joint motion for leave to file affidavit under seal . cc/cl (sad) (Entered: 08/11/1998)"
        },
        {
          "row_number": 315,
          "id": 1845249,
          "entry_number": "264",
          "date_filed": "1998-08-10T00:00:00-04:00",
          "attachments": null,
          "url": "nan",
          "recap_pdf_url": null,
          "pacer_doc_id": null,
          "description": "SEALED DOCUMENT placed in vault. (sad) (Entered: 08/11/1998)"
        },
        {
          "row_number": 316,
          "id": 1845250,
          "entry_number": "265",
          "date_filed": "1998-09-08T00:00:00-04:00",
          "attachments": null,
          "url": "nan",
          "recap_pdf_url": null,
          "pacer_doc_id": null,
          "description": "Status report by Harold Williams in 1:72-cv-00571, Thomas Minervino in 1:72-cv-00571, James M. Kater in 1:72-cv-00571, Michael Lesiak in 1:72-cv-00571, Charles W. Gaughan in 1:72-cv-00571, John P. Kerle in 1:72-cv-00571, Milton Greenblatt in 1:72-cv-00571, John O. Boone in 1:72-cv-00571, Class of 48 + 1 in 1:72-cv-00571 , filed. (sad) (Entered: 09/08/1998)"
        },
        {
          "row_number": 317,
          "id": 1845251,
          "entry_number": "266",
          "date_filed": "1998-09-16T00:00:00-04:00",
          "attachments": null,
          "url": "nan",
          "recap_pdf_url": null,
          "pacer_doc_id": null,
          "description": "Notice of filing and opposition to motion for corrective action... by Michael Lesiak in 1:72-cv-00571, Charles W. Gaughan in 1:72-cv- 00571, John P. Kerle in 1:72-cv-00571, Milton Greenblatt in 1:72-cv- 00571, John O. Boone in 1:72-cv-00571 , filed. (tmc) (Entered: 09/17/1998)"
        },
        {
          "row_number": 318,
          "id": 1845252,
          "entry_number": "267",
          "date_filed": "1998-09-16T00:00:00-04:00",
          "attachments": null,
          "url": "nan",
          "recap_pdf_url": null,
          "pacer_doc_id": null,
          "description": "Reply/response by Superintendent Robert Murphy's response to plaintiffs' and intervenor plaintiffs' joint status report on conditions at the treatment center... to [265-1] status report , filed. c/s (tmc) (Entered: 09/17/1998)"
        },
        {
          "row_number": 319,
          "id": 1845253,
          "entry_number": "268",
          "date_filed": "1998-09-22T00:00:00-04:00",
          "attachments": null,
          "url": "nan",
          "recap_pdf_url": null,
          "pacer_doc_id": null,
          "description": "Superintendent Robert Murphy's response to plaintiffs' and intervenor plaintiffs' joint status report on conditions at the treatment center, filed. (sad) (Entered: 09/23/1998)"
        },
        {
          "row_number": 320,
          "id": 1845254,
          "entry_number": "269",
          "date_filed": "1998-09-23T00:00:00-04:00",
          "attachments": null,
          "url": "nan",
          "recap_pdf_url": null,
          "pacer_doc_id": null,
          "description": "RENEWED Motion by Michael Lesiak in 1:72-cv-00571, Charles W. Gaughan in 1:72-cv-00571, John P. Kerle in 1:72-cv-00571, Milton Greenblatt in 1:72-cv-00571, John O. Boone in 1:72-cv-00571 to vacate consent decreeds , with attachment addendum to motion to vacate, filed c/s filed. (sad) (Entered: 09/24/1998)"
        },
        {
          "row_number": 321,
          "id": 1845255,
          "entry_number": "270",
          "date_filed": "1998-09-28T00:00:00-04:00",
          "attachments": null,
          "url": "nan",
          "recap_pdf_url": null,
          "pacer_doc_id": null,
          "description": "ASSENTED TO Motion by Class of 48 + 1 in 1:72-cv-00571 to extend time to 2 weeks to file response , filed. (sad) (Entered: 09/28/1998)"
        },
        {
          "row_number": 322,
          "id": 1845256,
          "entry_number": "271",
          "date_filed": "1998-10-16T00:00:00-04:00",
          "attachments": null,
          "url": "nan",
          "recap_pdf_url": null,
          "pacer_doc_id": null,
          "description": "ASSENTED TO Motion by Class of 48 + 1 in 1:72-cv-00571 to extend time to 10/23/98 to respond , filed. (sad) (Entered: 10/21/1998)"
        },
        {
          "row_number": 323,
          "id": 1845257,
          "entry_number": null,
          "date_filed": "1998-10-19T00:00:00-04:00",
          "attachments": null,
          "url": "nan",
          "recap_pdf_url": null,
          "pacer_doc_id": null,
          "description": "Judge A. D. Mazzone . Endorsed Order entered granting [271-1] motion to extend time to 10/23/98 to respond . cc/cl (sad) (Entered: 10/21/1998)"
        },
        {
          "row_number": 324,
          "id": 1845258,
          "entry_number": "272",
          "date_filed": "1998-10-23T00:00:00-04:00",
          "attachments": null,
          "url": "nan",
          "recap_pdf_url": null,
          "pacer_doc_id": null,
          "description": "Request (non motion) production of documents filed. (sad) (Entered: 10/26/1998)"
        },
        {
          "row_number": 325,
          "id": 1845259,
          "entry_number": "273",
          "date_filed": "1998-10-23T00:00:00-04:00",
          "attachments": null,
          "url": "nan",
          "recap_pdf_url": null,
          "pacer_doc_id": null,
          "description": "Response by Harold Williams in 1:72-cv-00571 in opposition to [269-1] motion to vacate consent decreeds , filed. (sad) (Entered: 10/26/1998)"
        },
        {
          "row_number": 326,
          "id": 1845260,
          "entry_number": "274",
          "date_filed": "1998-10-30T00:00:00-05:00",
          "attachments": null,
          "url": "nan",
          "recap_pdf_url": null,
          "pacer_doc_id": null,
          "description": "Memorandum by Michael Lesiak in 1:72-cv-00571, Charles W. Gaughan in 1:72-cv-00571, John P. Kerle in 1:72-cv-00571, Milton Greenblatt in 1:72-cv-00571, John O. Boone in 1:72-cv-00571 in support of [269-1] motion to vacate consent decreeds , filed. c/s (sad) (Entered: 11/02/1998)"
        },
        {
          "row_number": 327,
          "id": 1845261,
          "entry_number": "275",
          "date_filed": "1998-11-03T00:00:00-05:00",
          "attachments": null,
          "url": "nan",
          "recap_pdf_url": null,
          "pacer_doc_id": null,
          "description": "Objection by Michael Lesiak in 1:72-cv-00571, Charles W. Gaughan in 1:72-cv-00571, John P. Kerle in 1:72-cv-00571, Milton Greenblatt in 1:72-cv-00571, John O. Boone in 1:72-cv-00571 re: [272-1] to discovery request, filed. (sad) (Entered: 11/04/1998)"
        },
        {
          "row_number": 328,
          "id": 1845262,
          "entry_number": "276",
          "date_filed": "1998-11-23T00:00:00-05:00",
          "attachments": null,
          "url": "nan",
          "recap_pdf_url": null,
          "pacer_doc_id": null,
          "description": "Judge A. D. Mazzone . Notice of Hearing/conference: set status conference for 2:00 11/30/98 . cc/cl (sad) (Entered: 11/23/1998)"
        },
        {
          "row_number": 329,
          "id": 1845263,
          "entry_number": "277",
          "date_filed": "1998-11-30T00:00:00-05:00",
          "attachments": null,
          "url": "nan",
          "recap_pdf_url": null,
          "pacer_doc_id": null,
          "description": "Judge A. D. Mazzone . Clerk's Notes: re: motion hearing [269-1] motion to vacate consent decreeds taken under advisement Court Reporter: Pat Casey price (sad) (Entered: 12/02/1998)"
        },
        {
          "row_number": 330,
          "id": 1845264,
          "entry_number": "278",
          "date_filed": "1998-12-31T00:00:00-05:00",
          "attachments": null,
          "url": "nan",
          "recap_pdf_url": null,
          "pacer_doc_id": null,
          "description": "ASSENTED TO Motion by Harold Williams in 1:72-cv-00571, Thomas Minervino in 1:72-cv-00571, James M. Kater in 1:72-cv-00571 for to file affidavits underseal , filed. (sad) (Entered: 01/05/1999)"
        },
        {
          "row_number": 331,
          "id": 1845265,
          "entry_number": "279",
          "date_filed": "1999-01-11T00:00:00-05:00",
          "attachments": null,
          "url": "nan",
          "recap_pdf_url": null,
          "pacer_doc_id": null,
          "description": "Motion by Michael Lesiak in 1:72-cv-00571, Charles W. Gaughan in 1:72-cv-00571, John P. Kerle in 1:72-cv-00571, Milton Greenblatt in 1:72-cv-00571, John O. Boone in 1:72-cv-00571 to seal/impound , filed. (sad) (Entered: 01/11/1999)"
        },
        {
          "row_number": 332,
          "id": 1845266,
          "entry_number": "280",
          "date_filed": "1999-01-14T00:00:00-05:00",
          "attachments": null,
          "url": "nan",
          "recap_pdf_url": null,
          "pacer_doc_id": null,
          "description": "Judge A. D. Mazzone . Memorandum and Order entered., set evidentiary hearing for 3/16/99 , set discovery due for 3/16/99 cc/cl (sad) (Entered: 01/14/1999)"
        },
        {
          "row_number": 333,
          "id": 1845267,
          "entry_number": "281",
          "date_filed": "1999-02-19T00:00:00-05:00",
          "attachments": null,
          "url": "nan",
          "recap_pdf_url": null,
          "pacer_doc_id": null,
          "description": "Joint motion by Class of 48 + 1 in 1:72-cv-00571, Sherman Miller in 1:72-cv-00571 to postpone evidentiary hearing and discovery deadlines , filed. c/s . (sad) (Entered: 02/19/1999)"
        },
        {
          "row_number": 334,
          "id": 1845268,
          "entry_number": "282",
          "date_filed": "1999-02-22T00:00:00-05:00",
          "attachments": null,
          "url": "nan",
          "recap_pdf_url": null,
          "pacer_doc_id": null,
          "description": "Notice of appearance of attorney for Sherman Miller in 1:72-cv-00571, David Martel in 1:72-cv-00571, Eric Gallagher in 1:72-cv-00571, Patton Flannery in 1:72-cv-00571, Richard Moseley in 1:72-cv-00571, Michael Woodward in 1:72-cv-00571, Edward Nadeau in 1:72-cv-00571, Philip Pizzo in 1:72-cv-00571, James LeBlanc in 1:72-cv-00571 by Anton R. Reinert, filed. (sad) (Entered: 02/23/1999)"
        },
        {
          "row_number": 335,
          "id": 1845269,
          "entry_number": "284",
          "date_filed": "1999-02-22T00:00:00-05:00",
          "attachments": null,
          "url": "nan",
          "recap_pdf_url": null,
          "pacer_doc_id": null,
          "description": "Joint motion by Harold Williams in 1:72-cv-00571, Thomas Minervino in 1:72-cv-00571, James M. Kater in 1:72-cv-00571, Class of 48 + 1 in 1:72-cv-00571 to quash deposition notice , filed. c/s . (sad) (Entered: 02/23/1999)"
        },
        {
          "row_number": 336,
          "id": 1845270,
          "entry_number": "283",
          "date_filed": "1999-02-23T00:00:00-05:00",
          "attachments": null,
          "url": "nan",
          "recap_pdf_url": null,
          "pacer_doc_id": null,
          "description": "Response by Michael Lesiak in 1:72-cv-00571, Charles W. Gaughan in 1:72-cv-00571, John P. Kerle in 1:72-cv-00571, Milton Greenblatt in 1:72-cv-00571, John O. Boone in 1:72-cv-00571 in opposition to [281-1] joint motion to postpone evidentiary hearing and discovery deadlines , filed. c/s (sad) (Entered: 02/23/1999)"
        },
        {
          "row_number": 337,
          "id": 1845271,
          "entry_number": "285",
          "date_filed": "1999-02-24T00:00:00-05:00",
          "attachments": null,
          "url": "nan",
          "recap_pdf_url": null,
          "pacer_doc_id": null,
          "description": "Judge A. D. Mazzone . Memorandum and Order entered. granting [284- 1] joint motion to quash deposition notice , cc/cl (sad) (Entered: 02/24/1999)"
        },
        {
          "row_number": 338,
          "id": 1845272,
          "entry_number": "286",
          "date_filed": "1999-02-25T00:00:00-05:00",
          "attachments": null,
          "url": "nan",
          "recap_pdf_url": null,
          "pacer_doc_id": null,
          "description": "Assented to Motion by Sherman Miller in 1:72-cv-00571 for Jonathan I. Handler to withdraw as attorney , filed. (sad) (Entered: 02/26/1999)"
        },
        {
          "row_number": 339,
          "id": 1845273,
          "entry_number": "287",
          "date_filed": "1999-02-25T00:00:00-05:00",
          "attachments": null,
          "url": "nan",
          "recap_pdf_url": null,
          "pacer_doc_id": null,
          "description": "Response by Michael Lesiak in 1:72-cv-00571, Charles W. Gaughan in 1:72-cv-00571, John P. Kerle in 1:72-cv-00571, Milton Greenblatt in 1:72-cv-00571, John O. Boone in 1:72-cv-00571 in opposition to [284-1] joint motion to quash deposition notice , filed. c/s (sad) (Entered: 02/26/1999)"
        },
        {
          "row_number": 340,
          "id": 1845274,
          "entry_number": null,
          "date_filed": "1999-03-01T00:00:00-05:00",
          "attachments": null,
          "url": "nan",
          "recap_pdf_url": null,
          "pacer_doc_id": null,
          "description": "Judge A. D. Mazzone . Endorsed Order entered granting [286-1] motion for Jonathan I. Handler to withdraw as attorney (Terminated attorney Jonathan I. Handler for James LeBlanc in 1:72-cv-00571, attorney Jonathan I. Handler for Philip Pizzo in 1:72-cv-00571, attorney Jonathan I. Handler for Edward Nadeau in 1:72-cv-00571, attorney Jonathan I. Handler for Michael Woodward in 1:72-cv-00571, attorney Jonathan I. Handler for Richard Moseley in 1:72-cv-00571, attorney Jonathan I. Handler for Patton Flannery in 1:72-cv-00571, attorney Jonathan I. Handler for Eric Gallagher in 1:72-cv-00571, attorney Jonathan I. Handler for David Martel in 1:72-cv-00571, attorney Jonathan I. Handler for Wayne Raymond in 1:72-cv-00571, attorney Jonathan I. Handler for Norman Knight in 1:72-cv-00571, attorney Jonathan I. Handler for Sherman Miller in 1:72-cv-00571 . cc/cl (sad) (Entered: 03/02/1999)"
        },
        {
          "row_number": 341,
          "id": 1845275,
          "entry_number": "289",
          "date_filed": "1999-03-05T00:00:00-05:00",
          "attachments": null,
          "url": "nan",
          "recap_pdf_url": null,
          "pacer_doc_id": null,
          "description": "Motion in letter form by: Eugene F. Rector dated: 3/2/99 to dismiss counsel , filed. (sad) (Entered: 03/05/1999)"
        },
        {
          "row_number": 342,
          "id": 1845276,
          "entry_number": null,
          "date_filed": "1999-03-05T00:00:00-05:00",
          "attachments": null,
          "url": "nan",
          "recap_pdf_url": null,
          "pacer_doc_id": null,
          "description": "Judge A. D. Mazzone . Endorsed Order entered denying [289-1] motion to dismiss counsel . cc/cl (sad) (Entered: 03/05/1999)"
        },
        {
          "row_number": 343,
          "id": 1845277,
          "entry_number": "290",
          "date_filed": "1999-03-05T00:00:00-05:00",
          "attachments": null,
          "url": "nan",
          "recap_pdf_url": null,
          "pacer_doc_id": null,
          "description": "Motion by Class of 48 + 1 in 1:72-cv-00571 for DOnald W. Wiest to appear pro hac vice fee status: paid fee amt: 50.00 Receipt #: 12788 , filed. (sad) (Entered: 03/10/1999)"
        },
        {
          "row_number": 344,
          "id": 1845278,
          "entry_number": "291",
          "date_filed": "1999-03-11T00:00:00-05:00",
          "attachments": null,
          "url": "nan",
          "recap_pdf_url": null,
          "pacer_doc_id": null,
          "description": "Petition for writ of habeas corpus filed. (sad) (Entered: 03/16/1999)"
        },
        {
          "row_number": 345,
          "id": 1845279,
          "entry_number": null,
          "date_filed": "1999-03-13T00:00:00-05:00",
          "attachments": null,
          "url": "nan",
          "recap_pdf_url": null,
          "pacer_doc_id": null,
          "description": "Judge A. D. Mazzone . Endorsed Order entered granting [291-1] petition for writ of habeas corpus . cc/cl (sad) (Entered: 03/16/1999)"
        },
        {
          "row_number": 346,
          "id": 1845280,
          "entry_number": "292",
          "date_filed": "1999-03-19T00:00:00-05:00",
          "attachments": null,
          "url": "nan",
          "recap_pdf_url": null,
          "pacer_doc_id": null,
          "description": "plaintiffs' and intervenor plaintiffs' joint supplemental breif regarding the prison litigation reform act filed in open court. (sad) (Entered: 03/25/1999)"
        },
        {
          "row_number": 347,
          "id": 1845281,
          "entry_number": "294",
          "date_filed": "1999-03-26T00:00:00-05:00",
          "attachments": null,
          "url": "nan",
          "recap_pdf_url": null,
          "pacer_doc_id": null,
          "description": "Affidavit of Robert Murphy , re: [293-1] reply , filed. (sad) (Entered: 03/30/1999)"
        },
        {
          "row_number": 348,
          "id": 1845282,
          "entry_number": "293",
          "date_filed": "1999-03-29T00:00:00-05:00",
          "attachments": null,
          "url": "nan",
          "recap_pdf_url": null,
          "pacer_doc_id": null,
          "description": "Reply/response by Michael Lesiak in 1:72-cv-00571, Charles W. Gaughan in 1:72-cv-00571, John P. Kerle in 1:72-cv-00571, Milton Greenblatt in 1:72-cv-00571, John O. Boone in 1:72-cv-00571 to plaintiffs' and intervenor plaintiffs' joint supplemental brief regarding the prison litigation reform act , filed. c/s (sad) (Entered: 03/30/1999)"
        },
        {
          "row_number": 349,
          "id": 1845283,
          "entry_number": "295",
          "date_filed": "1999-06-21T00:00:00-04:00",
          "attachments": null,
          "url": "nan",
          "recap_pdf_url": null,
          "pacer_doc_id": null,
          "description": "Judge A. D. Mazzone . Memorandum and Order entered. [EOD Date 6/23/99] I grant the moton to terminate the consent decrees. the King and Williams cases are to be closed by the clerk. cc/cl (sad) (Entered: 06/23/1999)"
        },
        {
          "row_number": 350,
          "id": 1845284,
          "entry_number": null,
          "date_filed": "1999-06-23T00:00:00-04:00",
          "attachments": null,
          "url": "nan",
          "recap_pdf_url": null,
          "pacer_doc_id": null,
          "description": "Case closed. (sad) (Entered: 06/23/1999)"
        },
        {
          "row_number": 351,
          "id": 1845285,
          "entry_number": "296",
          "date_filed": "1999-12-13T00:00:00-05:00",
          "attachments": null,
          "url": "nan",
          "recap_pdf_url": null,
          "pacer_doc_id": null,
          "description": "Joint motion by Harold Williams in 1:72-cv-00571, Thomas Minervino in 1:72-cv-00571, James M. Kater in 1:72-cv-00571, Michael Lesiak in 1:72-cv-00571, Charles W. Gaughan in 1:72-cv-00571, John P. Kerle in 1:72-cv-00571, Milton Greenblatt in 1:72-cv-00571, John O. Boone in 1:72-cv-00571, Class of 48 + 1 in 1:72-cv-00571 for approval of agreement concerning fees and costs , filed. . (sad) (Entered: 12/13/1999)"
        },
        {
          "row_number": 352,
          "id": 1845286,
          "entry_number": "297",
          "date_filed": "1999-12-16T00:00:00-05:00",
          "attachments": null,
          "url": "nan",
          "recap_pdf_url": null,
          "pacer_doc_id": null,
          "description": "Judge A. D. Mazzone . Order entered granting [296-1] joint motion for approval of agreement concerning fees and costs . [EOD Date 12/16/99] cc/cl (sad) (Entered: 12/16/1999)"
        },
        {
          "row_number": 353,
          "id": 1845287,
          "entry_number": "298",
          "date_filed": "2002-07-16T00:00:00-04:00",
          "attachments": null,
          "url": "nan",
          "recap_pdf_url": null,
          "pacer_doc_id": null,
          "description": "Motion of Francis W. Durfee for Hearing , filed. c/s (sad) (Entered: 07/16/2002)"
        },
        {
          "row_number": 354,
          "id": 1845288,
          "entry_number": "299",
          "date_filed": "2002-07-16T00:00:00-04:00",
          "attachments": null,
          "url": "nan",
          "recap_pdf_url": null,
          "pacer_doc_id": null,
          "description": "Motion of Francis Durfee requesting relief or court sua sponte issue , filed. c/s (sad) (Entered: 07/16/2002)"
        },
        {
          "row_number": 355,
          "id": 1845289,
          "entry_number": "300",
          "date_filed": "2002-07-16T00:00:00-04:00",
          "attachments": null,
          "url": "nan",
          "recap_pdf_url": null,
          "pacer_doc_id": null,
          "description": "Memorandum in support of [299-1] motion requesting relief or court sua sponte issue , filed. (sad) (Entered: 07/16/2002)"
        },
        {
          "row_number": 356,
          "id": 1845290,
          "entry_number": "301",
          "date_filed": "2002-07-16T00:00:00-04:00",
          "attachments": null,
          "url": "nan",
          "recap_pdf_url": null,
          "pacer_doc_id": null,
          "description": "Affidavit , re: in support [299-1] motion requesting relief or court sua sponte issue , filed. (sad) (Entered: 07/16/2002)"
        },
        {
          "row_number": 357,
          "id": 1845291,
          "entry_number": null,
          "date_filed": "2004-08-20T00:00:00-04:00",
          "attachments": null,
          "url": "nan",
          "recap_pdf_url": null,
          "pacer_doc_id": null,
          "description": "Motions terminated: [299] Motion for Miscellaneous Relief, [298] Motion for Hearing. Motions are Moot. (Entered: 08/20/2004)"
        },
        {
          "row_number": 62,
          "id": 1844996,
          "entry_number": "50",
          "date_filed": "1994-11-16T00:00:00-05:00",
          "attachments": [],
          "url": "nan",
          "recap_pdf_url": null,
          "pacer_doc_id": null,
          "description": "Affidavit , of Mark A Fridovich, filed. (sad) Modified on 09/06/1995 (Entered: 11/16/1994)"
        },
        {
          "row_number": 27,
          "id": 1844961,
          "entry_number": "23",
          "date_filed": "1994-02-10T00:00:00-05:00",
          "attachments": [],
          "url": "nan",
          "recap_pdf_url": null,
          "pacer_doc_id": null,
          "description": "Response by Class of 48 + 1 in opposition to [13-1] motion to consolidate cases with CA-72-788, filed. c/s (tmc) (Entered: 08/25/1994)"
        },
        {
          "row_number": 67,
          "id": 1845001,
          "entry_number": "56",
          "date_filed": "1994-12-09T00:00:00-05:00",
          "attachments": [],
          "url": "nan",
          "recap_pdf_url": null,
          "pacer_doc_id": null,
          "description": "Response by Michael Lesiak in 1:72-cv-00571, Charles W. Gaughan in 1:72-cv-00571, John P. Kerle in 1:72-cv-00571, Milton Greenblatt in 1:72-cv-00571, John O. Boone in 1:72-cv-00571 in opposition to [28-1] motion to vacate [35-1] memorandum order , filed. (sad) Modified on 09/06/1995 (Entered: 12/13/1994)"
        },
        {
          "row_number": 29,
          "id": 1844963,
          "entry_number": "25",
          "date_filed": "1994-02-10T00:00:00-05:00",
          "attachments": [],
          "url": "nan",
          "recap_pdf_url": null,
          "pacer_doc_id": null,
          "description": "Motion by Class of 48 + 1 for Federal receivership , filed. c/s (tmc) (Entered: 08/25/1994)"
        },
        {
          "row_number": 24,
          "id": 1844958,
          "entry_number": "19",
          "date_filed": "1994-02-02T00:00:00-05:00",
          "attachments": [],
          "url": "nan",
          "recap_pdf_url": null,
          "pacer_doc_id": null,
          "description": "Letter dated: 2/2/94 to: Mr. Halpern re: pending motions, filed. (tmc) (Entered: 08/25/1994)"
        },
        {
          "row_number": 12,
          "id": 1844946,
          "entry_number": "9",
          "date_filed": "1993-10-01T00:00:00-04:00",
          "attachments": [],
          "url": "nan",
          "recap_pdf_url": null,
          "pacer_doc_id": null,
          "description": "Copy of RESPONSE OF DEFENDANTS TO NOTICE OF FILING OF SPECIAL MASTER'S REPORT. Due to non-adjudicative nature of SM'S REPORT, defendants do not intend to file obj's or motions for action on report but will, instead, file written response commenting on SM's observations and conclusions. Defs. intend t/f/motion to amend or vacate CDs. (tmc) Modified on 09/07/1994 (Entered: 08/23/1994)"
        },
        {
          "row_number": 35,
          "id": 1844969,
          "entry_number": "29",
          "date_filed": "1994-04-08T00:00:00-04:00",
          "attachments": [],
          "url": "nan",
          "recap_pdf_url": null,
          "pacer_doc_id": null,
          "description": "Letter by Robert D. Keefe dated: 4/8/94 to: Judge Mazzone re: Order of Appointment of Counsel, filed. (tmc) (Entered: 08/26/1994)"
        },
        {
          "row_number": 31,
          "id": 1844965,
          "entry_number": "27",
          "date_filed": "1994-02-18T00:00:00-05:00",
          "attachments": [],
          "url": "nan",
          "recap_pdf_url": null,
          "pacer_doc_id": null,
          "description": "Response by Charles W. Gaughan, Milton Greenblatt and Leslie Taylor in opposition to [21-1] motion to become permissive joinder of parties as class action, filed. c/s (tmc) (Entered: 08/26/1994)"
        },
        {
          "row_number": 59,
          "id": 1844993,
          "entry_number": "47",
          "date_filed": "1994-11-16T00:00:00-05:00",
          "attachments": [],
          "url": "nan",
          "recap_pdf_url": null,
          "pacer_doc_id": null,
          "description": "Memorandum by Michael Lesiak in 1:72-cv-00571, Charles W. Gaughan in 1:72-cv-00571, John P. Kerle in 1:72-cv-00571, Milton Greenblatt in 1:72-cv-00571, John O. Boone in 1:72-cv-00571 in support of [26-1] motion to modify consent decrees , filed. (sad) Modified on 09/06/1995 (Entered: 11/16/1994)"
        },
        {
          "row_number": 5,
          "id": 1844939,
          "entry_number": null,
          "date_filed": "1978-01-09T00:00:00-05:00",
          "attachments": [],
          "url": "nan",
          "recap_pdf_url": null,
          "pacer_doc_id": null,
          "description": "Case closed. (tmc) (Entered: 08/23/1994)"
        },
        {
          "row_number": 55,
          "id": 1844989,
          "entry_number": "44",
          "date_filed": "1994-09-29T00:00:00-04:00",
          "attachments": [],
          "url": "nan",
          "recap_pdf_url": null,
          "pacer_doc_id": null,
          "description": "Letter dated: 9/29/94 to: Judge Mazzone re: personal letter to the court from the class of 48-1 , filed. (sad) Modified on 09/06/1995 (Entered: 10/18/1994)"
        },
        {
          "row_number": 68,
          "id": 1845002,
          "entry_number": "57",
          "date_filed": "1994-12-13T00:00:00-05:00",
          "attachments": [],
          "url": "nan",
          "recap_pdf_url": null,
          "pacer_doc_id": null,
          "description": "Letter by Sherman Miller in 1:72-cv-00571 dated: 12/9/94 to: Judge Mazzone re: clarification , filed. (sad) Modified on 09/06/1995 (Entered: 12/13/1994)"
        },
        {
          "row_number": 65,
          "id": 1844999,
          "entry_number": "53",
          "date_filed": "1994-11-17T00:00:00-05:00",
          "attachments": [],
          "url": "nan",
          "recap_pdf_url": null,
          "pacer_doc_id": null,
          "description": "Judge A. D. Mazzone . Memorandum and Order entered. cc/cl (sad) Modified on 09/06/1995 (Entered: 11/18/1994)"
        },
        {
          "row_number": 44,
          "id": 1844978,
          "entry_number": null,
          "date_filed": "1994-06-07T00:00:00-04:00",
          "attachments": [],
          "url": "nan",
          "recap_pdf_url": null,
          "pacer_doc_id": null,
          "description": "Proposals for the treatment center filed. received for docketing on 9/7/95. (sad) (Entered: 09/08/1995)"
        },
        {
          "row_number": 13,
          "id": 1844947,
          "entry_number": "10",
          "date_filed": "1993-10-01T00:00:00-04:00",
          "attachments": [],
          "url": "nan",
          "recap_pdf_url": null,
          "pacer_doc_id": null,
          "description": "Copy of Response of Plaintiffs Quintal, Gosselin and Cameron (on behalf of the Class of 48 + 1) in opposition to [95-1] SPECIAL MASTER'S REPORT, filed. (no c/s) (in CA 72-788) (tmc) (Entered: 08/23/1994)"
        },
        {
          "row_number": 30,
          "id": 1844964,
          "entry_number": "26",
          "date_filed": "1994-02-11T00:00:00-05:00",
          "attachments": [],
          "url": "nan",
          "recap_pdf_url": null,
          "pacer_doc_id": null,
          "description": "Response by Intervenor-Plaintiffs in opposition to [14-1] motion to modify consent decree, filed. c/s (tmc) (Entered: 08/25/1994)"
        },
        {
          "row_number": 47,
          "id": 1844981,
          "entry_number": "36",
          "date_filed": "1994-08-24T00:00:00-04:00",
          "attachments": [],
          "url": "nan",
          "recap_pdf_url": null,
          "pacer_doc_id": null,
          "description": "Letter dated: 8/22/94 from Paul N. Smith to: Mr. Pardee re: meeting with Mr. Gleason on 8/16/94, filed. (tmc) (Entered: 08/26/1994)"
        },
        {
          "row_number": 32,
          "id": 1844966,
          "entry_number": null,
          "date_filed": "1994-03-02T00:00:00-05:00",
          "attachments": [],
          "url": "nan",
          "recap_pdf_url": null,
          "pacer_doc_id": null,
          "description": "Status conference held . (tmc) (Entered: 08/26/1994)"
        },
        {
          "row_number": 69,
          "id": 1845003,
          "entry_number": "58",
          "date_filed": "1994-12-19T00:00:00-05:00",
          "attachments": [],
          "url": "nan",
          "recap_pdf_url": null,
          "pacer_doc_id": null,
          "description": "Judge A. D. Mazzone . Memorandum and Order entered. For all of the foregoing reasons, I will wait for the conclusion of the pending appeal before ruling on the Commonwealth's motions , So Ordered cc/cl (sad) Modified on 09/06/1995 (Entered: 12/19/1994)"
        },
        {
          "row_number": 64,
          "id": 1844998,
          "entry_number": "52",
          "date_filed": "1994-11-17T00:00:00-05:00",
          "attachments": [],
          "url": "nan",
          "recap_pdf_url": null,
          "pacer_doc_id": null,
          "description": "Response to comments of the Special Master on the plan for administration of the treatment center filed (sad) Modified on 09/06/1995 (Entered: 11/17/1994)"
        },
        {
          "row_number": 70,
          "id": 1845004,
          "entry_number": "59",
          "date_filed": "1994-12-19T00:00:00-05:00",
          "attachments": [],
          "url": "nan",
          "recap_pdf_url": null,
          "pacer_doc_id": null,
          "description": "Letter dated: 12/15/94 to: Clerk re: motion for contempt , filed. (sad) Modified on 09/06/1995 (Entered: 12/20/1994)"
        },
        {
          "row_number": 74,
          "id": 1845008,
          "entry_number": "62",
          "date_filed": "1995-04-17T00:00:00-04:00",
          "attachments": [],
          "url": "nan",
          "recap_pdf_url": null,
          "pacer_doc_id": null,
          "description": "Motion by Harold Williams in 1:72-cv-00571, Thomas Minervino in 1:72-cv-00571, James M. Kater in 1:72-cv-00571 to stay , filed. (sad) Modified on 09/06/1995 (Entered: 04/18/1995)"
        },
        {
          "row_number": 93,
          "id": 1845027,
          "entry_number": "77",
          "date_filed": "1995-08-04T00:00:00-04:00",
          "attachments": [],
          "url": "nan",
          "recap_pdf_url": null,
          "pacer_doc_id": null,
          "description": "Response by Michael Lesiak in 1:72-cv-00571, Charles W. Gaughan in 1:72-cv-00571, John P. Kerle in 1:72-cv-00571, Milton Greenblatt in 1:72-cv-00571, John O. Boone in 1:72-cv-00571 in opposition to [55-1] motion to intervene by Sherman Miller in 1:72-cv-00571 , filed. (sad) Modified on 09/06/1995 (Entered: 08/08/1995)"
        },
        {
          "row_number": 45,
          "id": 1844979,
          "entry_number": null,
          "date_filed": "1994-06-07T00:00:00-04:00",
          "attachments": [],
          "url": "nan",
          "recap_pdf_url": null,
          "pacer_doc_id": null,
          "description": "Statement filed. received for docketing on 9/7/95... (sad) (Entered: 09/08/1995)"
        },
        {
          "row_number": 4,
          "id": 1844938,
          "entry_number": null,
          "date_filed": "1975-01-02T00:00:00-05:00",
          "attachments": [],
          "url": "nan",
          "recap_pdf_url": null,
          "pacer_doc_id": null,
          "description": "WYZANSKI, D.J.: (COPY) PARTIAL CONSENT DECREE (Williams v. Lesiak) (reproduced in 8/28/89 Opinion), filed. (tmc) (Entered: 08/23/1994)"
        },
        {
          "row_number": 91,
          "id": 1845025,
          "entry_number": null,
          "date_filed": "1995-08-02T00:00:00-04:00",
          "attachments": [],
          "url": "nan",
          "recap_pdf_url": null,
          "pacer_doc_id": null,
          "description": "Certified copy of docket and record on appeal forwarded to U.S. Court of Appeals re: [59-1] appeal . (fmr) (Entered: 08/04/1995)"
        },
        {
          "row_number": 26,
          "id": 1844960,
          "entry_number": "22",
          "date_filed": "1994-02-10T00:00:00-05:00",
          "attachments": [],
          "url": "nan",
          "recap_pdf_url": null,
          "pacer_doc_id": null,
          "description": "Response by Class 48 + 1 in opposition to [12-1] motion to reopen and assign case, filed. c/s (tmc) (Entered: 08/25/1994)"
        },
        {
          "row_number": 23,
          "id": 1844957,
          "entry_number": null,
          "date_filed": "1994-02-02T00:00:00-05:00",
          "attachments": [],
          "url": "nan",
          "recap_pdf_url": null,
          "pacer_doc_id": null,
          "description": "Judge A. D. Mazzone . Endorsed Order entered granting [16-1] motion to extend time to 2/11/94 to respond to motions. cc/cl (tmc) Modified on 09/12/1994 (Entered: 08/25/1994)"
        },
        {
          "row_number": 25,
          "id": 1844959,
          "entry_number": "21",
          "date_filed": "1994-02-10T00:00:00-05:00",
          "attachments": [],
          "url": "nan",
          "recap_pdf_url": null,
          "pacer_doc_id": null,
          "description": "Motion by Class of 48 + 1 to become permissive joinder of parties as class action , filed. c/s (tmc) (Entered: 08/25/1994)"
        },
        {
          "row_number": 10,
          "id": 1844944,
          "entry_number": "7",
          "date_filed": "1993-09-30T00:00:00-04:00",
          "attachments": [],
          "url": "nan",
          "recap_pdf_url": null,
          "pacer_doc_id": null,
          "description": "Copy of motion by pro se plaintiffs Dewolfe, Gonsalves and Davis to extend time to file opposition to SM's report, filed. c/s (tmc) (Entered: 08/23/1994)"
        },
        {
          "row_number": 98,
          "id": 1845032,
          "entry_number": "81",
          "date_filed": "1995-08-17T00:00:00-04:00",
          "attachments": [],
          "url": "nan",
          "recap_pdf_url": null,
          "pacer_doc_id": null,
          "description": "Judge A. D. Mazzone . Memorandum and Order entered. re: Gagney's motion. cc/cl (sad) Modified on 09/06/1995 (Entered: 08/18/1995)"
        },
        {
          "row_number": 112,
          "id": 1845046,
          "entry_number": "92",
          "date_filed": "1995-10-02T00:00:00-04:00",
          "attachments": [],
          "url": "nan",
          "recap_pdf_url": null,
          "pacer_doc_id": null,
          "description": "Letter dated: 10/2/95 to: Judge re: personal letter to the court , filed. (sad) (Entered: 10/18/1995)"
        },
        {
          "row_number": 113,
          "id": 1845047,
          "entry_number": "90",
          "date_filed": "1995-10-10T00:00:00-04:00",
          "attachments": [],
          "url": "nan",
          "recap_pdf_url": null,
          "pacer_doc_id": null,
          "description": "Letter by John O. Boone in 1:72-cv-00571 dated: 10/2/95 to: Mr. Smith re: emerngency motion , filed. (sad) (Entered: 10/10/1995)"
        },
        {
          "row_number": 114,
          "id": 1845048,
          "entry_number": "91",
          "date_filed": "1995-10-17T00:00:00-04:00",
          "attachments": [],
          "url": "nan",
          "recap_pdf_url": null,
          "pacer_doc_id": null,
          "description": "Status report by Harold Williams in 1:72-cv-00571, Thomas Minervino in 1:72-cv-00571, James M. Kater in 1:72-cv-00571, Michael Lesiak in 1:72-cv-00571, Charles W. Gaughan in 1:72-cv-00571, John P. Kerle in 1:72-cv-00571, Milton Greenblatt in 1:72-cv-00571, John O. Boone in 1:72-cv-00571, Class of 48 + 1 in 1:72-cv-00571 , filed. (sad) (Entered: 10/17/1995)"
        },
        {
          "row_number": 115,
          "id": 1845049,
          "entry_number": "94",
          "date_filed": "1995-10-17T00:00:00-04:00",
          "attachments": [],
          "url": "nan",
          "recap_pdf_url": null,
          "pacer_doc_id": null,
          "description": "Letter by William L. Pardee in 1:72-cv-00571 dated: 10/17/95 to: Ms.Diskes re: NOrman F Knight , filed. (sad) (Entered: 10/18/1995)"
        },
        {
          "row_number": 116,
          "id": 1845050,
          "entry_number": "95",
          "date_filed": "1995-10-23T00:00:00-04:00",
          "attachments": [],
          "url": "nan",
          "recap_pdf_url": null,
          "pacer_doc_id": null,
          "description": "Motion by Sherman Miller in 1:72-cv-00571, Sherman Miller in 1:72-cv- 00571, Norman Knight in 1:72-cv-00571, Wayne Raymond in 1:72-cv- 00571, David Martel in 1:72-cv-00571, Eric Gallagher in 1:72-cv-00571, Patton Flannery in 1:72-cv-00571, Richard Moseley in 1:72-cv-00571, Michael Woodward in 1:72-cv-00571, Edward Nadeau in 1:72-cv-00571, Philip Pizzo in 1:72-cv-00571, James LeBlanc in 1:72-cv-00571 to authorize attendance of applicants in intervention , filed. (sad) (Entered: 10/24/1995)"
        },
        {
          "row_number": 117,
          "id": 1845051,
          "entry_number": null,
          "date_filed": "1995-10-25T00:00:00-04:00",
          "attachments": [],
          "url": "nan",
          "recap_pdf_url": null,
          "pacer_doc_id": null,
          "description": "Judge A. D. Mazzone . Endorsed Order entered reserving [95-1] motion to authorize attendance of applicants in intervention for district judge . pending the scheduling of a hearing at the treatment center in the near future. The clerk will inform the parties of date and time, cc/cl (sad) (Entered: 10/25/1995)"
        },
        {
          "row_number": 118,
          "id": 1845052,
          "entry_number": "96",
          "date_filed": "1995-12-01T00:00:00-05:00",
          "attachments": [],
          "url": "nan",
          "recap_pdf_url": null,
          "pacer_doc_id": null,
          "description": "Judge A. D. Mazzone . Notice of Hearing/conference: set status conference for 9:30 12/15/95 cc/cl . (sad) (Entered: 12/01/1995)"
        },
        {
          "row_number": 119,
          "id": 1845053,
          "entry_number": "97",
          "date_filed": "1996-01-10T00:00:00-05:00",
          "attachments": [],
          "url": "nan",
          "recap_pdf_url": null,
          "pacer_doc_id": null,
          "description": "Judge A. D. Mazzone . Order entered, set status conference for 10:00 1/17/96 hearing to be held at the Treatment Center in Bridgewater MA. cc/cl . (sad) Modified on 01/12/1996 (Entered: 01/11/1996)"
        },
        {
          "row_number": 120,
          "id": 1845054,
          "entry_number": "98",
          "date_filed": "1996-01-17T00:00:00-05:00",
          "attachments": [],
          "url": "nan",
          "recap_pdf_url": null,
          "pacer_doc_id": null,
          "description": "Letter dated: 1/17/96 to: Judge re: hearing filed. (sad) (Entered: 02/01/1996)"
        },
        {
          "row_number": 121,
          "id": 1845055,
          "entry_number": "99",
          "date_filed": "1996-02-01T00:00:00-05:00",
          "attachments": [],
          "url": "nan",
          "recap_pdf_url": null,
          "pacer_doc_id": null,
          "description": "Motion by Harold Williams in 1:72-cv-00571, Thomas Minervino in 1:72-cv-00571, James M. Kater in 1:72-cv-00571 to intervene , filed. (sad) (Entered: 02/01/1996)"
        },
        {
          "row_number": 122,
          "id": 1845056,
          "entry_number": "100",
          "date_filed": "1996-04-01T00:00:00-05:00",
          "attachments": [],
          "url": "nan",
          "recap_pdf_url": null,
          "pacer_doc_id": null,
          "description": "Joint Status report by Harold Williams in 1:72-cv-00571, Thomas Minervino in 1:72-cv-00571, James M. Kater in 1:72-cv-00571, Michael Lesiak in 1:72-cv-00571, Charles W. Gaughan in 1:72-cv-00571, John P. Kerle in 1:72-cv-00571, Milton Greenblatt in 1:72-cv-00571, John O. Boone in 1:72-cv-00571, Class of 48 + 1 in 1:72-cv-00571 , filed. (sad) (Entered: 04/02/1996)"
        },
        {
          "row_number": 123,
          "id": 1845057,
          "entry_number": "101",
          "date_filed": "1996-04-01T00:00:00-05:00",
          "attachments": [],
          "url": "nan",
          "recap_pdf_url": null,
          "pacer_doc_id": null,
