{
  "case_id": 10254,
  "fetched_at": "2025-10-20T22:38:34.911886",
  "case_data": {
    "attorney_orgs": [],
    "available_documents": [
      "Trial Court Docket",
      "Any published opinion"
    ],
    "case_defendants": [
      {
        "defendant_level": null,
        "institution": "Kaufman County Sheriff",
        "institution_alt_state": null,
        "institution_city": "",
        "institution_county": "Kaufman",
        "name": "Kaufman County",
        "defendant_level_other": "",
        "is_active": true
      }
    ],
    "case_ongoing": "No",
    "case_status": "Coding Complete",
    "case_types": [
      "Jail Conditions"
    ],
    "cause_other": "",
    "causes": [
      "42 U.S.C. ยง 1983"
    ],
    "class_action_granted": "Not sought",
    "class_action_sought": "No",
    "closing_year": 2004,
    "constitutional_clause": [
      {
        "value": "Unreasonable search and seizure"
      }
    ],
    "content_of_injunction": [],
    "court": "Northern District of Texas",
    "custom_issues": [],
    "defendant_payment": "",
    "defendant_type": [],
    "docket_status": "Complete as of retrieval date",
    "facility_type": [
      {
        "value": "Government-run"
      }
    ],
    "filing_date": "1997-04-21",
    "filing_year": 1997,
    "id": 10254,
    "injunction_duration": "",
    "issues": [
      "Affected Sex/Gender(s): Male",
      "Affected Sex/Gender(s): Female",
      "Policing: Strip search policy (policing)"
    ],
    "last_checked_date": "2007-07-18T00:00:00-04:00",
    "main_docket": {
      "id": 32767,
      "docket_entries": [
        {
          "row_number": 36,
          "id": 1840345,
          "entry_number": "32",
          "date_filed": "1998-05-08T00:00:00-04:00",
          "attachments": [],
          "url": "nan",
          "recap_pdf_url": null,
          "pacer_doc_id": null,
          "description": "MOTION with memorandum in support by plaintiff Oscar D Williams Jr, plaintiff Thomas Gene Brown, plaintiff Leonard Avery, plaintiff Francis Booker, plaintiff Cecil NMI Jackson, plaintiff Jacquelynn Surrell, plaintiff Ricky Lewis, plaintiff Brenda Allen, plaintiff James nmi McDonald, plaintiff Sylvester Lewis, plaintiff L B Brumley, plaintiff Clifford L Gibson, plaintiff Gloria Surrell, plaintiff Alisa NMI Allen, plaintiff John NMI Jackson, plaintiff Karran Brown, plaintiff David NMN Brown to amend [13-1] amended complaint (4) (jrb) (Entered: 05/11/1998)"
        },
        {
          "row_number": 95,
          "id": 1840404,
          "entry_number": "84",
          "date_filed": "1998-10-13T00:00:00-04:00",
          "attachments": [],
          "url": "nan",
          "recap_pdf_url": null,
          "pacer_doc_id": null,
          "description": "Joint STATUS REPORT by plaintiffs and defendants. (2) (jrb) (Entered: 10/14/1998)"
        },
        {
          "row_number": 27,
          "id": 1840336,
          "entry_number": "24",
          "date_filed": "1998-04-14T00:00:00-04:00",
          "attachments": [],
          "url": "nan",
          "recap_pdf_url": null,
          "pacer_doc_id": null,
          "description": "ORDER unfiling [21-1] motion to dismiss/to non-suit by plaintiff Oscar D Williams Jr, plaintiff Thomas Gene Brown, plaintiff Leonard Avery, plaintiff Francis Booker, plaintiff Cecil NMI Jackson, plaintiff Jacquelynn Surrell, plaintiff Ricky Lewis, plaintiff Brenda Allen, plaintiff James nmi McDonald, plaintiff Sylvester Lewis, plaintiff L B Brumley, plaintiff Clifford L Gibson, plaintiff Gloria Surrell, plaintiff Alisa NMI Allen, plaintiff John NMI Jackson, plaintiff Karran Brown, plaintiff David NMN Brown due to the following deficiency: no proposed order Copies to counsel: 4/15/98 (signed by Judge Jerry Buchmeyer ) Page(s) 2 (jrb) (Entered: 04/15/1998)"
        },
        {
          "row_number": 45,
          "id": 1840354,
          "entry_number": "41",
          "date_filed": "1998-05-26T00:00:00-04:00",
          "attachments": [],
          "url": "nan",
          "recap_pdf_url": null,
          "pacer_doc_id": null,
          "description": "RESPONSE by defendant Kaufman County, defendant Robert Harris to [34-1] motion to compel dfts to produce documents, to extend time to designate plaintiffs' experts and to extend the discovery deadline, [33-1] motion to quash deposition notices and mtn for protective order, [32-1] motion to amend [13-1] amended complaint (15+) (jrb) (Entered: 05/27/1998)"
        },
        {
          "row_number": 29,
          "id": 1840338,
          "entry_number": "26",
          "date_filed": "1998-04-17T00:00:00-04:00",
          "attachments": [],
          "url": "nan",
          "recap_pdf_url": null,
          "pacer_doc_id": null,
          "description": "Minute order: Mtn to compel Held before Magistrate Judge Jeff Kaplan Court Reporter: electronic (2) (jrb) (Entered: 04/20/1998)"
        },
        {
          "row_number": 30,
          "id": 1840339,
          "entry_number": null,
          "date_filed": "1998-04-17T00:00:00-04:00",
          "attachments": [],
          "url": "nan",
          "recap_pdf_url": null,
          "pacer_doc_id": null,
          "description": "Motion hearing re: [14-1] motion to compel Motion hearing held (jrb) (Entered: 04/20/1998)"
        },
        {
          "row_number": 84,
          "id": 1840393,
          "entry_number": "72",
          "date_filed": "1998-09-18T00:00:00-04:00",
          "attachments": [],
          "url": "nan",
          "recap_pdf_url": null,
          "pacer_doc_id": null,
          "description": "Minute order: Mtn hearing Held before Magistrate Judge Jeff Kaplan re: pla's mtn for sum jgm and dft's mtn for sum jgm Court Reporter: electronic; order to follow (3) (jas) (Entered: 09/21/1998)"
        },
        {
          "row_number": 100,
          "id": 1840409,
          "entry_number": "89",
          "date_filed": "1998-12-21T00:00:00-05:00",
          "attachments": null,
          "url": "nan",
          "recap_pdf_url": null,
          "pacer_doc_id": null,
          "description": "MOTION with memorandum in support by plaintiff Oscar D Williams Jr, plaintiff Thomas Gene Brown, plaintiff Leonard Avery, plaintiff Francis Booker, plaintiff Cecil NMI Jackson, plaintiff Jacquelynn Surrell, plaintiff Ricky Lewis, plaintiff Brenda Allen, plaintiff James nmi McDonald, plaintiff Sylvester Lewis, plaintiff L B Brumley, plaintiff Clifford L Gibson, plaintiff Gloria Surrell, plaintiff Alisa NMI Allen, plaintiff Karran Brown to strike summary judgment affidavit (4) (djd) (Entered: 12/22/1998)"
        },
        {
          "row_number": 101,
          "id": 1840410,
          "entry_number": "90",
          "date_filed": "1998-12-23T00:00:00-05:00",
          "attachments": null,
          "url": "nan",
          "recap_pdf_url": null,
          "pacer_doc_id": null,
          "description": "MOTION by plaintiff Oscar D Williams Jr, plaintiff Thomas Gene Brown, plaintiff Leonard Avery, plaintiff Francis Booker, plaintiff Cecil NMI Jackson, plaintiff Jacquelynn Surrell, plaintiff Ricky Lewis, plaintiff Brenda Allen, plaintiff James nmi McDonald, plaintiff Sylvester Lewis, plaintiff L B Brumley, plaintiff Clifford L Gibson, plaintiff Gloria Surrell, plaintiff Alisa NMI Allen, plaintiff Karran Brown to extend time to file plaintiffs' response to supplemental motion for summary judgment (5) (djd) (Entered: 12/24/1998)"
        },
        {
          "row_number": 102,
          "id": 1840411,
          "entry_number": "91",
          "date_filed": "1998-12-23T00:00:00-05:00",
          "attachments": null,
          "url": "nan",
          "recap_pdf_url": null,
          "pacer_doc_id": null,
          "description": "RESPONSE by plaintiff Oscar D Williams Jr, plaintiff Thomas Gene Brown, plaintiff Leonard Avery, plaintiff Francis Booker, plaintiff Cecil NMI Jackson, plaintiff Jacquelynn Surrell, plaintiff Ricky Lewis, plaintiff Brenda Allen, plaintiff James nmi McDonald, plaintiff Sylvester Lewis, plaintiff L B Brumley, plaintiff Clifford L Gibson, plaintiff Gloria Surrell, plaintiff Alisa NMI Allen, plaintiff Karran Brown to supplemental [88-1] motion for summary judgment (15+) (djd) (Entered: 12/24/1998)"
        },
        {
          "row_number": 103,
          "id": 1840412,
          "entry_number": "92",
          "date_filed": "1998-12-23T00:00:00-05:00",
          "attachments": null,
          "url": "nan",
          "recap_pdf_url": null,
          "pacer_doc_id": null,
          "description": "APPENDIX by plaintiff Oscar D Williams Jr, plaintiff Thomas Gene Brown, plaintiff Leonard Avery, plaintiff Francis Booker, plaintiff Cecil NMI Jackson, plaintiff Jacquelynn Surrell, plaintiff Ricky Lewis, plaintiff Brenda Allen, plaintiff James nmi McDonald, plaintiff Sylvester Lewis, plaintiff L B Brumley, plaintiff Clifford L Gibson, plaintiff Gloria Surrell, plaintiff Alisa NMI Allen, plaintiff Karran Brown in support of [91-1] motion response/in opposition to supplemental motion for summary judgment (15+)(USC) (djd) (Entered: 12/24/1998)"
        },
        {
          "row_number": 104,
          "id": 1840413,
          "entry_number": "93",
          "date_filed": "1998-12-28T00:00:00-05:00",
          "attachments": null,
          "url": "nan",
          "recap_pdf_url": null,
          "pacer_doc_id": null,
          "description": "ORDER granting [90-1] motion to extend time to file plaintiffs' response to supplemental motion for summary judgment Response to motion reset to 12/23/98 for [88-1] motion for summary judgment ( signed by Judge Lindsay) Copies to counsel: 12/29/98 Page(s) 1 (jas) (Entered: 12/29/1998)"
        },
        {
          "row_number": 105,
          "id": 1840414,
          "entry_number": "94",
          "date_filed": "1998-12-29T00:00:00-05:00",
          "attachments": null,
          "url": "nan",
          "recap_pdf_url": null,
          "pacer_doc_id": null,
          "description": "MOTION by defendant Kaufman County, defendant Robert Harris to extend time to file reply to plaintiffs' response to dfts' supplemental mtn for sumjgm (3) (jrb) (Entered: 12/30/1998)"
        },
        {
          "row_number": 106,
          "id": 1840415,
          "entry_number": "95",
          "date_filed": "1998-12-31T00:00:00-05:00",
          "attachments": null,
          "url": "nan",
          "recap_pdf_url": null,
          "pacer_doc_id": null,
          "description": "ORDER granting [94-1] motion to extend time to file reply to plaintiffs' response to dfts' supplemental mtn for sumjgm Reply to Response to Motion reset to 1/8/99 for [88-1] motion for summary judgment ( signed by SAL) Copies to counsel: 1/4/99 Page(s) 2 (jrb) (Entered: 01/04/1999)"
        },
        {
          "row_number": 107,
          "id": 1840416,
          "entry_number": "96",
          "date_filed": "1999-01-08T00:00:00-05:00",
          "attachments": null,
          "url": "nan",
          "recap_pdf_url": null,
          "pacer_doc_id": null,
          "description": "REPLY by defendant Kaufman County, defendant Robert Harris to response to [88-1] motion for summary judgment (9) (jrb) (Entered: 01/11/1999)"
        },
        {
          "row_number": 108,
          "id": 1840417,
          "entry_number": "97",
          "date_filed": "1999-01-08T00:00:00-05:00",
          "attachments": null,
          "url": "nan",
          "recap_pdf_url": null,
          "pacer_doc_id": null,
          "description": "NOTICE of ADDRESS CHANGE by defendant Kaufman County, defendant Robert Harris New address is: Sheinfeld Maley and Kay PC 1700 Pacific Avenue Suite 4400 Dallas, TX 75201 (2) (jrb) (Entered: 01/11/1999)"
        },
        {
          "row_number": 109,
          "id": 1840418,
          "entry_number": "98",
          "date_filed": "1999-04-14T00:00:00-04:00",
          "attachments": null,
          "url": "nan",
          "recap_pdf_url": null,
          "pacer_doc_id": null,
          "description": "ORDER granting [89-1] motion to strike summary judgment affidavit ( signed by SAL) Copies to counsel: 4/15/99 Page(s) 2 (jrb) (Entered: 04/15/1999)"
        },
        {
          "row_number": 110,
          "id": 1840419,
          "entry_number": "99",
          "date_filed": "1999-04-28T00:00:00-04:00",
          "attachments": null,
          "url": "nan",
          "recap_pdf_url": null,
          "pacer_doc_id": null,
          "description": "NOTICE of change of address for plaintiffs' counsel...Wm Charles Bundren...PO Box 702647 Dallas TX 75370. (3) (jrb) (Entered: 04/29/1999)"
        },
        {
          "row_number": 111,
          "id": 1840420,
          "entry_number": "100",
          "date_filed": "2000-02-07T00:00:00-05:00",
          "attachments": null,
          "url": "nan",
          "recap_pdf_url": null,
          "pacer_doc_id": null,
          "description": "MEMORANDUM OPINION AND ORDER granting in part, denying in part [88-1] motion for summary judgment...see order for specifics. ( signed by SAL) Copies to counsel: 2/7/00 Page(s): 23 (jrb) (Entered: 02/07/2000)"
        },
        {
          "row_number": 112,
          "id": 1840421,
          "entry_number": "101",
          "date_filed": "2000-02-09T00:00:00-05:00",
          "attachments": null,
          "url": "nan",
          "recap_pdf_url": null,
          "pacer_doc_id": null,
          "description": "ORDER setting pretrial deadlines and trial reset scheduling order deadlines: Bench trial reset for 9:00 5/1/00 ; Pretrial materials due 4/10/00 Proposed pretrial order due 4/10/00 Pretrial conference by 11:00 4/28/00 ( signed by SAL) Copies to counsel: 2/10/00 Page(s) 5 (jrb) (Entered: 02/10/2000)"
        },
        {
          "row_number": 113,
          "id": 1840422,
          "entry_number": "103",
          "date_filed": "2000-02-23T00:00:00-05:00",
          "attachments": null,
          "url": "nan",
          "recap_pdf_url": null,
          "pacer_doc_id": null,
          "description": "ORDER resetting pretrial deadlines and trial reset scheduling order deadlines: Bench trial reset for 9:00 9/5/00 ; Pretrial materials due 8/14/00 Proposed pretrial order due 8/14/00 Pretrial conference by 3:00 8/31/00 ( signed by SAL) Copies to counsel: 2/24/00 Page(s) 5 (jrb) (Entered: 02/24/2000)"
        },
        {
          "row_number": 114,
          "id": 1840423,
          "entry_number": "104",
          "date_filed": "2000-07-18T00:00:00-04:00",
          "attachments": null,
          "url": "nan",
          "recap_pdf_url": null,
          "pacer_doc_id": null,
          "description": "ORDER...dfts and the following plaintiffs are directed to file the necessary dismissal papers with the US District Clerk's office by 8/17/00...Alisa Allen Brenda Allen Francis Booker Ricky Lewis James McDonald Gloria Surrell Jacquelynn Surrell and Oscar D Williams Jr. ( signed by SAL) Copies to counsel: 7/19/00 Page(s) 1 (jrb) (Entered: 07/19/2000)"
        },
        {
          "row_number": 115,
          "id": 1840424,
          "entry_number": "105",
          "date_filed": "2000-07-24T00:00:00-04:00",
          "attachments": null,
          "url": "nan",
          "recap_pdf_url": null,
          "pacer_doc_id": null,
          "description": "Partial MOTION by plaintiff Oscar D Williams Jr, plaintiff Francis Booker, plaintiff Ricky Lewis, plaintiff Brenda Allen, plaintiff Jacquelynn Surrell, plaintiff James nmi McDonald, plaintiff Gloria Surrell, plaintiff Alisa NMI Allen to dismiss certain claims (3) (jrb) (Entered: 07/25/2000)"
        },
        {
          "row_number": 116,
          "id": 1840425,
          "entry_number": "106",
          "date_filed": "2000-07-25T00:00:00-04:00",
          "attachments": null,
          "url": "nan",
          "recap_pdf_url": null,
          "pacer_doc_id": null,
          "description": "ORDER...that necessary dismissal papers are to be filed with the US District Clerk's office by 8/21/00. ( signed by SAL) Copies to counsel: 7/25/00 Page(s) 1 (jrb) (Entered: 07/25/2000)"
        },
        {
          "row_number": 117,
          "id": 1840426,
          "entry_number": "107",
          "date_filed": "2000-07-25T00:00:00-04:00",
          "attachments": null,
          "url": "nan",
          "recap_pdf_url": null,
          "pacer_doc_id": null,
          "description": "Alternative Dispute Resolution Summary. Filed by ADR Provider Jerome S Levy . Attorneys in attendance Wm Charles Bundren, Caryn L Carson, S Cass Weiland . Disposition: In ADR (1) (jrb) (Entered: 07/25/2000)"
        },
        {
          "row_number": 118,
          "id": 1840427,
          "entry_number": "109",
          "date_filed": "2000-07-25T00:00:00-04:00",
          "attachments": null,
          "url": "nan",
          "recap_pdf_url": null,
          "pacer_doc_id": null,
          "description": "ORDER granting [105-1] motion to dismiss certain claims; Ordered that the claims of Oscar D Williams, Francis Booker, Ricky Lewis, Brenda Allen, Jacquelynn Surrel, James McDonald, Gloria Surrel & Alisa Allen against dfts Kaufman County & Kaufman County Sheriff Robert Harris with respect to all matters and things in controversy in this case are dismissed with prejudice to the settling plfs refiling of same ( signed by sal) Copies to counsel: 7.26.00 Page(s) 2 (mlh) (Entered: 07/26/2000)"
        },
        {
          "row_number": 119,
          "id": 1840428,
          "entry_number": "108",
          "date_filed": "2000-07-26T00:00:00-04:00",
          "attachments": null,
          "url": "nan",
          "recap_pdf_url": null,
          "pacer_doc_id": null,
          "description": "MOTION by plaintiff Leonard Avery to dismiss certain claims (relative to Leonard Avery) (3) (djd) (Entered: 07/26/2000)"
        },
        {
          "row_number": 120,
          "id": 1840429,
          "entry_number": "110",
          "date_filed": "2000-07-26T00:00:00-04:00",
          "attachments": null,
          "url": "nan",
          "recap_pdf_url": null,
          "pacer_doc_id": null,
          "description": "MOTION by defendant Kaufman County, defendant Robert Harris to reconvene court-ordered mediation and to continue trial (6) (nmc) (Entered: 07/27/2000)"
        },
        {
          "row_number": 121,
          "id": 1840430,
          "entry_number": "111",
          "date_filed": "2000-07-26T00:00:00-04:00",
          "attachments": null,
          "url": "nan",
          "recap_pdf_url": null,
          "pacer_doc_id": null,
          "description": "ORDER granting [108-1] motion to dismiss certain claims with prejudice relative to Plaintiff Leonard Avery against defendants Kaufman County and Kaufman County Sheriff Robert Harris ( signed by Judge Lindsay) Copies to counsel: 7/27/00 Page(s) 2 (lch) Modified on 07/27/2000 (Entered: 07/27/2000)"
        },
        {
          "row_number": 122,
          "id": 1840431,
          "entry_number": "112",
          "date_filed": "2000-07-27T00:00:00-04:00",
          "attachments": null,
          "url": "nan",
          "recap_pdf_url": null,
          "pacer_doc_id": null,
          "description": "ORDER Response to motion reset to 8/2/00 for [110-1] motion to reconvene court-ordered mediation and to continue trial ( signed by Sam A. Lindsay) Copies to counsel: 7/28/00 Page(s) 1 (djd) (Entered: 07/28/2000)"
        },
        {
          "row_number": 123,
          "id": 1840432,
          "entry_number": "113",
          "date_filed": "2000-07-28T00:00:00-04:00",
          "attachments": null,
          "url": "nan",
          "recap_pdf_url": null,
          "pacer_doc_id": null,
          "description": "RESPONSE by plfs to [110-1] motion to reconvene court-ordered mediation and to continue trial (6) (mlh) Modified on 07/31/2000 (Entered: 07/31/2000)"
        },
        {
          "row_number": 124,
          "id": 1840433,
          "entry_number": "115",
          "date_filed": "2000-08-14T00:00:00-04:00",
          "attachments": null,
          "url": "nan",
          "recap_pdf_url": null,
          "pacer_doc_id": null,
          "description": "Witness list by defendant Kaufman County, defendant Robert Harris (6) (jrb) (Entered: 08/15/2000)"
        },
        {
          "row_number": 125,
          "id": 1840434,
          "entry_number": "116",
          "date_filed": "2000-08-14T00:00:00-04:00",
          "attachments": null,
          "url": "nan",
          "recap_pdf_url": null,
          "pacer_doc_id": null,
          "description": "Settlement STATUS REPORT by plaintiffs and defendants. (3) (jrb) (Entered: 08/15/2000)"
        },
        {
          "row_number": 126,
          "id": 1840435,
          "entry_number": "117",
          "date_filed": "2000-08-14T00:00:00-04:00",
          "attachments": null,
          "url": "nan",
          "recap_pdf_url": null,
          "pacer_doc_id": null,
          "description": "Exhibit list by defendant Kaufman County, defendant Robert Harris (3) (jrb) (Entered: 08/15/2000)"
        },
        {
          "row_number": 127,
          "id": 1840436,
          "entry_number": "118",
          "date_filed": "2000-08-14T00:00:00-04:00",
          "attachments": null,
          "url": "nan",
          "recap_pdf_url": null,
          "pacer_doc_id": null,
          "description": "Witness list by plaintiffs. (6) (jrb) (Entered: 08/15/2000)"
        },
        {
          "row_number": 128,
          "id": 1840437,
          "entry_number": "119",
          "date_filed": "2000-08-14T00:00:00-04:00",
          "attachments": null,
          "url": "nan",
          "recap_pdf_url": null,
          "pacer_doc_id": null,
          "description": "Exhibit list by plaintiffs . (3) (jrb) (Entered: 08/15/2000)"
        },
        {
          "row_number": 129,
          "id": 1840438,
          "entry_number": "119",
          "date_filed": "2000-08-14T00:00:00-04:00",
          "attachments": null,
          "url": "nan",
          "recap_pdf_url": null,
          "pacer_doc_id": null,
          "description": "Designation of Deposition testimony by plaintiffs. (3) (jrb) (Entered: 08/15/2000)"
        },
        {
          "row_number": 130,
          "id": 1840439,
          "entry_number": "120",
          "date_filed": "2000-08-14T00:00:00-04:00",
          "attachments": null,
          "url": "nan",
          "recap_pdf_url": null,
          "pacer_doc_id": null,
          "description": "Proposed findings of fact and conclusions of law. by plaintiffs. (13) (jrb) (Entered: 08/15/2000)"
        },
        {
          "row_number": 131,
          "id": 1840440,
          "entry_number": "121",
          "date_filed": "2000-08-21T00:00:00-04:00",
          "attachments": null,
          "url": "nan",
          "recap_pdf_url": null,
          "pacer_doc_id": null,
          "description": "Plaintiff's objection to dft's pretrial disclosure under Rule 26 of witnesses to be called for trial and exhibits to be offered. (3) (jrb) (Entered: 08/22/2000)"
        },
        {
          "row_number": 132,
          "id": 1840441,
          "entry_number": "122",
          "date_filed": "2000-08-29T00:00:00-04:00",
          "attachments": null,
          "url": "nan",
          "recap_pdf_url": null,
          "pacer_doc_id": null,
          "description": "Proposed findings of fact and conclusions of law. by defendant Kaufman County, defendant Robert Harris (6) (jrb) (Entered: 08/30/2000)"
        },
        {
          "row_number": 133,
          "id": 1840442,
          "entry_number": "123",
          "date_filed": "2000-09-01T00:00:00-04:00",
          "attachments": null,
          "url": "nan",
          "recap_pdf_url": null,
          "pacer_doc_id": null,
          "description": "Minute order: re: pretrial conference Held before Judge Sam A. Lindsay Court Reporter: Pam Wilson (1) (jrb) (Entered: 09/06/2000)"
        },
        {
          "row_number": 134,
          "id": 1840443,
          "entry_number": null,
          "date_filed": "2000-09-01T00:00:00-04:00",
          "attachments": null,
          "url": "nan",
          "recap_pdf_url": null,
          "pacer_doc_id": null,
          "description": "Pre-trial conference held (jrb) (Entered: 09/06/2000)"
        },
        {
          "row_number": 135,
          "id": 1840444,
          "entry_number": "124",
          "date_filed": "2000-09-07T00:00:00-04:00",
          "attachments": null,
          "url": "nan",
          "recap_pdf_url": null,
          "pacer_doc_id": null,
          "description": "MOTION by plaintiffs to dismiss certain claims (relative to Clifford Gibson) (3) (jrb) (Entered: 09/08/2000)"
        },
        {
          "row_number": 136,
          "id": 1840445,
          "entry_number": "125",
          "date_filed": "2000-09-08T00:00:00-04:00",
          "attachments": null,
          "url": "nan",
          "recap_pdf_url": null,
          "pacer_doc_id": null,
          "description": "ORDER granting [124-1] motion to dismiss certain claims (relative to Clifford Gibson)...that claims of plaintiff Gibson against the dfts Kaufman County and Kaufman County Sheriff Robert Harris with respect to all matters and things in controvery are dismissed with prejudice to the plaintiff's refiling of the same. ( signed by SAL) Copies to counsel: 9/12/00 Page(s) 2 (jrb) (Entered: 09/12/2000)"
        },
        {
          "row_number": 137,
          "id": 1840446,
          "entry_number": "126",
          "date_filed": "2000-09-12T00:00:00-04:00",
          "attachments": null,
          "url": "nan",
          "recap_pdf_url": null,
          "pacer_doc_id": null,
          "description": "Minute order: 1st day of bench trial Held before Judge Sam A. Lindsay Court Reporter: Debbie Roberts (jrb) Modified on 09/15/2000 (Entered: 09/15/2000)"
        },
        {
          "row_number": 138,
          "id": 1840447,
          "entry_number": null,
          "date_filed": "2000-09-12T00:00:00-04:00",
          "attachments": null,
          "url": "nan",
          "recap_pdf_url": null,
          "pacer_doc_id": null,
          "description": "1st day of Bench trial held (jrb) Modified on 09/15/2000 (Entered: 09/15/2000)"
        },
        {
          "row_number": 139,
          "id": 1840448,
          "entry_number": "128",
          "date_filed": "2000-09-12T00:00:00-04:00",
          "attachments": null,
          "url": "nan",
          "recap_pdf_url": null,
          "pacer_doc_id": null,
          "description": "Plaintiffs' and dfts' PRETRIAL ORDER filed...see order for specifics. ( signed by SAL) Page(s): 12 (jrb) (Entered: 09/15/2000)"
        },
        {
          "row_number": 140,
          "id": 1840449,
          "entry_number": "127",
          "date_filed": "2000-09-13T00:00:00-04:00",
          "attachments": null,
          "url": "nan",
          "recap_pdf_url": null,
          "pacer_doc_id": null,
          "description": "Minute order: 2nd day of bench trial Held before Judge Sam A. Lindsay Court Reporter: Debbie Roberts (1) (jrb) Modified on 09/15/2000 (Entered: 09/15/2000)"
        },
        {
          "row_number": 141,
          "id": 1840450,
          "entry_number": null,
          "date_filed": "2000-09-13T00:00:00-04:00",
          "attachments": null,
          "url": "nan",
          "recap_pdf_url": null,
          "pacer_doc_id": null,
          "description": "2nd day of Bench trial held (jrb) Modified on 09/15/2000 (Entered: 09/15/2000)"
        },
        {
          "row_number": 142,
          "id": 1840451,
          "entry_number": null,
          "date_filed": "2000-09-15T00:00:00-04:00",
          "attachments": null,
          "url": "nan",
          "recap_pdf_url": null,
          "pacer_doc_id": null,
          "description": "3rd day of Bench trial held (jrb) (Entered: 09/18/2000)"
        },
        {
          "row_number": 143,
          "id": 1840452,
          "entry_number": "130",
          "date_filed": "2000-10-03T00:00:00-04:00",
          "attachments": null,
          "url": "nan",
          "recap_pdf_url": null,
          "pacer_doc_id": null,
          "description": "RETURN OF SERVICE executed re: subpoena in a civil case to Clifford L Gibson. (2) (jrb) (Entered: 10/04/2000)"
        },
        {
          "row_number": 144,
          "id": 1840453,
          "entry_number": "131",
          "date_filed": "2000-10-03T00:00:00-04:00",
          "attachments": null,
          "url": "nan",
          "recap_pdf_url": null,
          "pacer_doc_id": null,
          "description": "RETURN OF SERVICE executed re: subpoena in a civil case addressed to Francis Booker. (2) (jrb) (Entered: 10/04/2000)"
        },
        {
          "row_number": 145,
          "id": 1840454,
          "entry_number": "132",
          "date_filed": "2000-10-03T00:00:00-04:00",
          "attachments": null,
          "url": "nan",
          "recap_pdf_url": null,
          "pacer_doc_id": null,
          "description": "RETURN OF SERVICE executed re: subpoena in a civil case to Gloria Surrell-White. (2) (jrb) (Entered: 10/04/2000)"
        },
        {
          "row_number": 146,
          "id": 1840455,
          "entry_number": "133",
          "date_filed": "2000-10-03T00:00:00-04:00",
          "attachments": null,
          "url": "nan",
          "recap_pdf_url": null,
          "pacer_doc_id": null,
          "description": "RETURN OF SERVICE executed re: subpoena in a civil case to Leonard Avery. (2) (jrb) (Entered: 10/04/2000)"
        },
        {
          "row_number": 147,
          "id": 1840456,
          "entry_number": "134",
          "date_filed": "2000-10-03T00:00:00-04:00",
          "attachments": null,
          "url": "nan",
          "recap_pdf_url": null,
          "pacer_doc_id": null,
          "description": "RETURN OF SERVICE executed re: subpoena in a civil case to Alisa Allen. (2) (jrb) (Entered: 10/04/2000)"
        },
        {
          "row_number": 148,
          "id": 1840457,
          "entry_number": "135",
          "date_filed": "2001-01-26T00:00:00-05:00",
          "attachments": null,
          "url": "nan",
          "recap_pdf_url": null,
          "pacer_doc_id": null,
          "description": "ORDER...within 30 days after the trial transcript is filed, the parties are directed to file amended proposed findings of fact and conclusions of law...because Fifth Circuit and Supreme Court cases are the only precedent binding on this court, the parties should to the extend possible rely on these sources for the proposed conclusions of law...see order for specifics. ( Signed by Judge Sam A. Lindsay ) Copies to counsel: 1/29/01 Page(s) 1 (jrb) Modified on 01/31/2001 (Entered: 01/29/2001)"
        },
        {
          "row_number": 149,
          "id": 1840458,
          "entry_number": "136",
          "date_filed": "2001-07-02T00:00:00-04:00",
          "attachments": null,
          "url": "nan",
          "recap_pdf_url": null,
          "pacer_doc_id": null,
          "description": "TRANSCRIPT filed Court Reporter: Deborah Roberts Date(s): September 12 2000 Volume(s): II Type of proceeding: Bench trial (USC)(15+) (jrb) (Entered: 07/03/2001)"
        },
        {
          "row_number": 150,
          "id": 1840459,
          "entry_number": "137",
          "date_filed": "2001-07-02T00:00:00-04:00",
          "attachments": null,
          "url": "nan",
          "recap_pdf_url": null,
          "pacer_doc_id": null,
          "description": "TRANSCRIPT filed Court Reporter: Deborah Roberts Date(s): September 13 2000 Volume(s): III Type of proceeding: bench trial (USC)(15+) (jrb) (Entered: 07/03/2001)"
        },
        {
          "row_number": 151,
          "id": 1840460,
          "entry_number": "138",
          "date_filed": "2001-07-02T00:00:00-04:00",
          "attachments": null,
          "url": "nan",
          "recap_pdf_url": null,
          "pacer_doc_id": null,
          "description": "TRANSCRIPT filed Court Reporter: Deborah Roberts Date(s): September 14 2000 Volume(s): IV Type of proceeding: Bench trial (15+)(USC) (jrb) (Entered: 07/03/2001)"
        },
        {
          "row_number": 152,
          "id": 1840461,
          "entry_number": "139",
          "date_filed": "2001-07-02T00:00:00-04:00",
          "attachments": null,
          "url": "nan",
          "recap_pdf_url": null,
          "pacer_doc_id": null,
          "description": "ORDER...the parties are directed to file amended proposed findings of fact and conclusions of law by no later than 8/17/01. ( Signed by Judge Sam A. Lindsay ) Copies to counsel: 7/3/01 Page(s) 1 (jrb) (Entered: 07/03/2001)"
        },
        {
          "row_number": 153,
          "id": 1840462,
          "entry_number": "140",
          "date_filed": "2001-07-31T00:00:00-04:00",
          "attachments": null,
          "url": "nan",
          "recap_pdf_url": null,
          "pacer_doc_id": null,
          "description": "Unopposed MOTION by defendant Kaufman County, defendant Robert Harris to extend time to file amended proposed findings of fact and conclusions of law (4) (jrb) (Entered: 08/01/2001)"
        },
        {
          "row_number": 154,
          "id": 1840463,
          "entry_number": "141",
          "date_filed": "2001-07-31T00:00:00-04:00",
          "attachments": null,
          "url": "nan",
          "recap_pdf_url": null,
          "pacer_doc_id": null,
          "description": "ORDER granting [140-1] motion to extend time to file amended proposed findings of fact and conclusions of law...given until 8/31/01. ( Signed by Judge Sam A. Lindsay ) Copies to counsel: 8/1/01 Page(s) 1 (jrb) (Entered: 08/01/2001)"
        },
        {
          "row_number": 155,
          "id": 1840464,
          "entry_number": "142",
          "date_filed": "2001-08-02T00:00:00-04:00",
          "attachments": null,
          "url": "nan",
          "recap_pdf_url": null,
          "pacer_doc_id": null,
          "description": "ORDER granting [140-1] motion to extend time to file amended proposed findings of fact and conclusions of law...extended to 8/31/01. ( Signed by Judge Sam A. Lindsay ) Copies to counsel: 8/3/01 Page(s) 1 (jrb) (Entered: 08/03/2001)"
        },
        {
          "row_number": 156,
          "id": 1840465,
          "entry_number": "144",
          "date_filed": "2001-08-29T00:00:00-04:00",
          "attachments": null,
          "url": "nan",
          "recap_pdf_url": null,
          "pacer_doc_id": null,
          "description": "Amended Proposed findings of fact and conclusions of law. by defendant Kaufman County, defendant Robert Harris (9) (jrb) (Entered: 08/30/2001)"
        },
        {
          "row_number": 157,
          "id": 1840466,
          "entry_number": "145",
          "date_filed": "2001-08-31T00:00:00-04:00",
          "attachments": null,
          "url": "nan",
          "recap_pdf_url": null,
          "pacer_doc_id": null,
          "description": "First Amended Proposed findings of fact and conclusions of law by plaintiffs (15+) (jrb) Modified on 09/04/2001 (Entered: 09/04/2001)"
        },
        {
          "row_number": 158,
          "id": 1840467,
          "entry_number": "146",
          "date_filed": "2001-09-10T00:00:00-04:00",
          "attachments": null,
          "url": "nan",
          "recap_pdf_url": null,
          "pacer_doc_id": null,
          "description": "Unopposed MOTION by plaintiffs for leave to file post-trial brief (6) (jrb) Modified on 09/12/2001 (Entered: 09/12/2001)"
        },
        {
          "row_number": 159,
          "id": 1840468,
          "entry_number": "147",
          "date_filed": "2001-09-19T00:00:00-04:00",
          "attachments": null,
          "url": "nan",
          "recap_pdf_url": null,
          "pacer_doc_id": null,
          "description": "ORDER granting [146-1] motion for leave to file post-trial brief...due no later than 10/19/01. ( Signed by Judge Sam A. Lindsay ) Copies to counsel: 9/20/01 Page(s) 1 (jrb) (Entered: 09/20/2001)"
        },
        {
          "row_number": 160,
          "id": 1840469,
          "entry_number": "148",
          "date_filed": "2001-10-19T00:00:00-04:00",
          "attachments": null,
          "url": "nan",
          "recap_pdf_url": null,
          "pacer_doc_id": null,
          "description": "MOTION with post trial brief/memorandum in support by plaintiffs for judgment (15+) (jrb) Modified on 10/19/2001 (Entered: 10/19/2001)"
        },
        {
          "row_number": 161,
          "id": 1840470,
          "entry_number": "149",
          "date_filed": "2001-10-19T00:00:00-04:00",
          "attachments": null,
          "url": "nan",
          "recap_pdf_url": null,
          "pacer_doc_id": null,
          "description": "POST TRIAL BRIEF by defendant Robert Harris, defendant Kaufman County (15+) (mlh) (Entered: 10/22/2001)"
        },
        {
          "row_number": 162,
          "id": 1840471,
          "entry_number": "150",
          "date_filed": "2002-03-29T00:00:00-05:00",
          "attachments": null,
          "url": "nan",
          "recap_pdf_url": null,
          "pacer_doc_id": null,
          "description": "MEMORANDUM OPINION AND ORDER...in light of the court's findings and conclusions herein, it will render judgment against dfts Kaufman County and Robert Harris by separate document...all allowable and reasonable costs are assessed against dfts...see order for specifics. ( Signed by Judge Sam A. Lindsay ) Copies to counsel: 4/2/02 Page(s): 24 (jrb) (Entered: 04/02/2002)"
        },
        {
          "row_number": 163,
          "id": 1840472,
          "entry_number": "151",
          "date_filed": "2002-03-29T00:00:00-05:00",
          "attachments": null,
          "url": "nan",
          "recap_pdf_url": null,
          "pacer_doc_id": null,
          "description": "JUDGMENT for plaintiff L B Brumley, plaintiff Cecil NMI Jackson, plaintiff Thomas Gene Brown against defendant Robert Harris, defendant Kaufman County...plaintiffs shall each recover the sum of $100 as nominal damages from dfts. Each dft is jointly and severally liable for the amt to be paid to each plaintiff. Plaintiffs shall each recover the sum of $15,000.00 as punitive damages against dft Harris...post judgment interest shall accrue on the amts set forth in Subparts A and B at the rate of 2.7% per annum from the date of entry of this judgment. All allowable and reasonable costs are taxed against dfts Kaufman County and Harris. All relief not expressly granted herein is denied...see judgment for specifics. ( Signed by Judge Sam A. Lindsay ) Copies to counsel: 4/2/02 Page(s): 2 (jrb) (Entered: 04/02/2002)"
        },
        {
          "row_number": 164,
          "id": 1840473,
          "entry_number": null,
          "date_filed": "2002-03-29T00:00:00-05:00",
          "attachments": null,
          "url": "nan",
          "recap_pdf_url": null,
          "pacer_doc_id": null,
          "description": "Case closed (jrb) (Entered: 04/02/2002)"
        },
        {
          "row_number": 165,
          "id": 1840474,
          "entry_number": "152",
          "date_filed": "2002-04-12T00:00:00-04:00",
          "attachments": null,
          "url": "nan",
          "recap_pdf_url": null,
          "pacer_doc_id": null,
          "description": "Application/MOTION by plaintiffs for attorney fees and related expenses (11) (jrb) (Entered: 04/15/2002)"
        },
        {
          "row_number": 166,
          "id": 1840475,
          "entry_number": "153",
          "date_filed": "2002-04-24T00:00:00-04:00",
          "attachments": null,
          "url": "nan",
          "recap_pdf_url": null,
          "pacer_doc_id": null,
          "description": "MOTION with memorandum in support by defendant Robert Harris, defendant Kaufman County to extend time to file notice of appeal and to respond to appl for attys' fees (3) (jrb) (Entered: 04/25/2002)"
        },
        {
          "row_number": 167,
          "id": 1840476,
          "entry_number": "154",
          "date_filed": "2002-04-26T00:00:00-04:00",
          "attachments": null,
          "url": "nan",
          "recap_pdf_url": null,
          "pacer_doc_id": null,
          "description": "NOTICE OF APPEAL by plaintiff Thomas Gene Brown re [151-1] judgment order Payment: 105.00 Receipt # 168262 TOOC (1) cc:Judge (jmr) (Entered: 04/26/2002)"
        },
        {
          "row_number": 168,
          "id": 1840477,
          "entry_number": "155",
          "date_filed": "2002-04-26T00:00:00-04:00",
          "attachments": null,
          "url": "nan",
          "recap_pdf_url": null,
          "pacer_doc_id": null,
          "description": "Transcript order form from attorney for Thomas Roberts: Transcript requested [154-1] appeal 9/13/02 Bench Trial; 9/15/00 Bench Trial; 9/12/00 Bench Trial (jmr) (Entered: 04/26/2002)"
        },
        {
          "row_number": 169,
          "id": 1840478,
          "entry_number": null,
          "date_filed": "2002-04-29T00:00:00-04:00",
          "attachments": null,
          "url": "nan",
          "recap_pdf_url": null,
          "pacer_doc_id": null,
          "description": "USCA appeal fees received $ 105.00 [154-1] appeal Receipt # 168262 (jmr) (Entered: 04/29/2002)"
        },
        {
          "row_number": 170,
          "id": 1840479,
          "entry_number": "156",
          "date_filed": "2002-04-29T00:00:00-04:00",
          "attachments": null,
          "url": "nan",
          "recap_pdf_url": null,
          "pacer_doc_id": null,
          "description": "AMENDED NOTICE OF APPEAL by plaintiff Thomas Gene Brown, plaintiff Cecil NMI Jackson, plaintiff L B Brumley re [151-1] judgment order NO Fee Paid TO already given (1) cc:Judge (jmr) Modified on 06/04/2002 (Entered: 04/29/2002)"
        },
        {
          "row_number": 171,
          "id": 1840480,
          "entry_number": null,
          "date_filed": "2002-04-29T00:00:00-04:00",
          "attachments": null,
          "url": "nan",
          "recap_pdf_url": null,
          "pacer_doc_id": null,
          "description": "AMENDED Notice of appeal and certified copy of docket to USCA: [156-1] appeal (jmr) (Entered: 04/29/2002)"
        },
        {
          "row_number": 172,
          "id": 1840481,
          "entry_number": "157",
          "date_filed": "2002-04-29T00:00:00-04:00",
          "attachments": null,
          "url": "nan",
          "recap_pdf_url": null,
          "pacer_doc_id": null,
          "description": "NOTICE OF APPEAL by defendant Kaufman County, defendant Robert Harris re [151-1] judgment order Payment: 105.00 Receipt # 168331 (2) cc:Judge (jmr) (Entered: 04/30/2002)"
        },
        {
          "row_number": 173,
          "id": 1840482,
          "entry_number": "158",
          "date_filed": "2002-04-29T00:00:00-04:00",
          "attachments": null,
          "url": "nan",
          "recap_pdf_url": null,
          "pacer_doc_id": null,
          "description": "MOTION by defendant Robert Harris to substitute E Leon Carter, John B Rizo Sr for S Cass Weiland, Robert A Hawkins and the law firm of Patton Boggs LLP (3) (jrb) (Entered: 04/30/2002)"
        },
        {
          "row_number": 174,
          "id": 1840483,
          "entry_number": "159",
          "date_filed": "2002-04-29T00:00:00-04:00",
          "attachments": null,
          "url": "nan",
          "recap_pdf_url": null,
          "pacer_doc_id": null,
          "description": "DUPLICATE NOTICE OF APPEAL by defendant Kaufman County, defendant Robert Harris re [151-1] judgment order Payment: 105.00 Receipt # 168331 TOOC (2) cc:Judge (jmr) Modified on 05/07/2002 (Entered: 05/01/2002)"
        },
        {
          "row_number": 175,
          "id": 1840484,
          "entry_number": "160",
          "date_filed": "2002-04-29T00:00:00-04:00",
          "attachments": null,
          "url": "nan",
          "recap_pdf_url": null,
          "pacer_doc_id": null,
          "description": "NOTICE OF APPEAL by plaintiff Thomas Gene Brown, plaintiff Cecil NMI Jackson, plaintiff L B Brumley re [150-1] order, [151-1] judgment order Payment: 105.00 Receipt # 168338 TOOC (2) cc:Judge (jmr) (Entered: 05/01/2002)"
        },
        {
          "row_number": 176,
          "id": 1840485,
          "entry_number": null,
          "date_filed": "2002-04-30T00:00:00-04:00",
          "attachments": null,
          "url": "nan",
          "recap_pdf_url": null,
          "pacer_doc_id": null,
          "description": "Notice of appeal and certified copy of docket to USCA: [156-1] appeal (jmr) (Entered: 04/30/2002)"
        },
        {
          "row_number": 177,
          "id": 1840486,
          "entry_number": "162",
          "date_filed": "2002-04-30T00:00:00-04:00",
          "attachments": null,
          "url": "nan",
          "recap_pdf_url": null,
          "pacer_doc_id": null,
          "description": "ORDER denying [153-1] motion to extend time to file notice of appeal and granting extension of time to respond to appl for attys' fees. The Court orders Plaintiffs to resubmit an Application for Atty's fees and related expenses that provides the requisite detail by 5/29/02. The court orders Dfts to respond to plaintiffs' resubmitted application by 6/29/02. ( Signed by Judge Sam A. Lindsay ) Copies to counsel: 5/1/02 Page(s) 2 (jrb) (Entered: 05/01/2002)"
        },
        {
          "row_number": 178,
          "id": 1840487,
          "entry_number": null,
          "date_filed": "2002-05-01T00:00:00-04:00",
          "attachments": null,
          "url": "nan",
          "recap_pdf_url": null,
          "pacer_doc_id": null,
          "description": "Notice of appeal and certified copy of docket to USCA: [159-1] appeal (jmr) (Entered: 05/01/2002)"
        },
        {
          "row_number": 179,
          "id": 1840488,
          "entry_number": null,
          "date_filed": "2002-05-01T00:00:00-04:00",
          "attachments": null,
          "url": "nan",
          "recap_pdf_url": null,
          "pacer_doc_id": null,
          "description": "Notice of appeal and certified copy of docket to USCA: [160-1] appeal (jmr) (Entered: 05/01/2002)"
        },
        {
          "row_number": 180,
          "id": 1840489,
          "entry_number": "161",
          "date_filed": "2002-05-01T00:00:00-04:00",
          "attachments": null,
          "url": "nan",
          "recap_pdf_url": null,
          "pacer_doc_id": null,
          "description": "ORDER granting [158-1] motion to substitute E Leon Carter, John B Rizo Sr for S Cass Weiland, Robert A Hawkins and the law firm of Patton Boggs LLP ( Signed by Judge Sam A. Lindsay ) Copies to counsel: 5/1/02 Page(s) 1 (jrb) (Entered: 05/01/2002)"
        },
        {
          "row_number": 181,
          "id": 1840490,
          "entry_number": "164",
          "date_filed": "2002-05-10T00:00:00-04:00",
          "attachments": null,
          "url": "nan",
          "recap_pdf_url": null,
          "pacer_doc_id": null,
          "description": "***vacated per order of 3/28/03***ORDER OF REFERENCE: [152-1] motion for attorney fees and related expenses referred to Magistrate Judge Jeff Kaplan ( Signed by Judge Sam A. Lindsay ) Copies to counsel: 5/10/02 Page(s): 1 (jrb) Modified on 3/31/2003 (jrb, ). (Entered: 05/10/2002)"
        },
        {
          "row_number": 182,
          "id": 1840491,
          "entry_number": "165",
          "date_filed": "2002-05-13T00:00:00-04:00",
          "attachments": null,
          "url": "nan",
          "recap_pdf_url": null,
          "pacer_doc_id": null,
          "description": "Transcript order form from attorney for Defendant Harris : Transcript not requested [157-1] appeal, [159-1] appeal Transcript already in Clerk's office (jmr) (Entered: 05/14/2002)"
        },
        {
          "row_number": 183,
          "id": 1840492,
          "entry_number": "166",
          "date_filed": "2002-05-14T00:00:00-04:00",
          "attachments": null,
          "url": "nan",
          "recap_pdf_url": null,
          "pacer_doc_id": null,
          "description": "Transcript order form from Defendants Kaufman Co. and Harris: Transcript not requested [157-1] appeal, [159-1] appeal Transcript already on file in Clerk's office (jmr) (Entered: 05/14/2002)"
        },
        {
          "row_number": 184,
          "id": 1840493,
          "entry_number": null,
          "date_filed": "2002-05-14T00:00:00-04:00",
          "attachments": null,
          "url": "nan",
          "recap_pdf_url": null,
          "pacer_doc_id": null,
          "description": "USCA Case Number, 02-10500 Re: [156-1] appeal (jmr) (Entered: 05/14/2002)"
        },
        {
          "row_number": 185,
          "id": 1840494,
          "entry_number": null,
          "date_filed": "2002-05-23T00:00:00-04:00",
          "attachments": null,
          "url": "nan",
          "recap_pdf_url": null,
          "pacer_doc_id": null,
          "description": "Transmitted 7 vol. record and 3 transcripts on appeal to U.S. Court of Appeals: [156-1] appeal, [160-1] appeal, [159-1] appeal, [157-1] appeal, [154-1] appeal (jmr) Modified on 05/24/2002 (Entered: 05/23/2002)"
        },
        {
          "row_number": 186,
          "id": 1840495,
          "entry_number": "167",
          "date_filed": "2002-05-23T00:00:00-04:00",
          "attachments": null,
          "url": "nan",
          "recap_pdf_url": null,
          "pacer_doc_id": null,
          "description": "ORDER re: plaintiff's appl for atty fees and related expenses....see order for specifics. ( Signed by Magistrate Judge Jeff Kaplan ) Copies to counsel: 5/24/02 Page(s) 3 (jrb) (Entered: 05/24/2002)"
        },
        {
          "row_number": 187,
          "id": 1840496,
          "entry_number": null,
          "date_filed": "2002-06-03T00:00:00-04:00",
          "attachments": null,
          "url": "nan",
          "recap_pdf_url": null,
          "pacer_doc_id": null,
          "description": "USCA appeal fees received $ 105.00 [156-1] appeal Receipt #169587 (jmr) (Entered: 06/04/2002)"
        },
        {
          "row_number": 188,
          "id": 1840497,
          "entry_number": "168",
          "date_filed": "2002-07-02T00:00:00-04:00",
          "attachments": null,
          "url": "nan",
          "recap_pdf_url": null,
          "pacer_doc_id": null,
          "description": "ORDER...the deadline for filing a joint status report in connect with plaintiffs' appl for atty's fees and related expenses is extended until 7/25/02. ( Signed by Magistrate Judge Jeff Kaplan ) Copies to counsel: 7/3/02 Page(s) 1 (jrb) (Entered: 07/03/2002)"
        },
        {
          "row_number": 189,
          "id": 1840498,
          "entry_number": "169",
          "date_filed": "2002-07-02T00:00:00-04:00",
          "attachments": null,
          "url": "nan",
          "recap_pdf_url": null,
          "pacer_doc_id": null,
          "description": "ORDER/Notice of option to consent to proceed before the Magistrate Judge. ( Signed by Magistrate Judge Jeff Kaplan ) Copies to counsel: 7/3/02 Page(s) 2 (jrb) (Entered: 07/03/2002)"
        },
        {
          "row_number": 190,
          "id": 1840499,
          "entry_number": "170",
          "date_filed": "2002-07-24T00:00:00-04:00",
          "attachments": null,
          "url": "nan",
          "recap_pdf_url": null,
          "pacer_doc_id": null,
          "description": "Refusalto consent filed by plaintiffs. (1) (jrb) (Entered: 07/25/2002)"
        },
        {
          "row_number": 191,
          "id": 1840500,
          "entry_number": "171",
          "date_filed": "2002-08-05T00:00:00-04:00",
          "attachments": null,
          "url": "nan",
          "recap_pdf_url": null,
          "pacer_doc_id": null,
          "description": "MEMORANDUM by defendant Kaufman County in opposition to [152-1] motion for attorney fees and related expenses (15+)(USC)(jrb) Additional attachment(s) added on 7/8/2004 (jmr). (Entered: 08/06/2002)"
        },
        {
          "row_number": 192,
          "id": 1840501,
          "entry_number": "172",
          "date_filed": "2002-08-05T00:00:00-04:00",
          "attachments": null,
          "url": "nan",
          "recap_pdf_url": null,
          "pacer_doc_id": null,
          "description": "Joint STATUS REPORT by defendant Robert Harris, defendant Kaufman County concerning attorneys fees issues. (15+) (jrb) (Entered: 08/06/2002)"
        },
        {
          "row_number": 193,
          "id": 1840502,
          "entry_number": "173",
          "date_filed": "2002-08-05T00:00:00-04:00",
          "attachments": null,
          "url": "nan",
          "recap_pdf_url": null,
          "pacer_doc_id": null,
          "description": "MEMORANDUM by defendant Robert Harris in support of [171-1] opposition memorandum/Memorandum of Law regarding atty's fees. (4) (jrb) (Entered: 08/06/2002)"
        },
        {
          "row_number": 194,
          "id": 1840503,
          "entry_number": "174",
          "date_filed": "2002-08-08T00:00:00-04:00",
          "attachments": null,
          "url": "nan",
          "recap_pdf_url": null,
          "pacer_doc_id": null,
          "description": "NOTICE of limited appearance by plaintiff Karran Brown, plaintiff L B Brumley, plaintiff Sylvester Lewis, plaintiff Cecil NMI Jackson, plaintiff Leonard Avery...by Gerald M Birnberg. (2) (jrb) (Entered: 08/09/2002)"
        },
        {
          "row_number": 195,
          "id": 1840504,
          "entry_number": "176",
          "date_filed": "2002-08-09T00:00:00-04:00",
          "attachments": null,
          "url": "nan",
          "recap_pdf_url": null,
          "pacer_doc_id": null,
          "description": "JOINT STATUS REPORT CONCERNING ATTORNEY'S FEES ISSUES by plaintiffs.(15+) (lmr) Modified on 08/12/2002 (Entered: 08/12/2002)"
        },
        {
          "row_number": 196,
          "id": 1840505,
          "entry_number": "177",
          "date_filed": "2002-08-09T00:00:00-04:00",
          "attachments": null,
          "url": "nan",
          "recap_pdf_url": null,
          "pacer_doc_id": null,
          "description": "MEMORANDUM OF LAW by plaintiffs in support of [176-1] report concerning attorney's fees issues.(15+) (lmr) Modified on 08/12/2002 (Entered: 08/12/2002)"
        },
        {
          "row_number": 197,
          "id": 1840506,
          "entry_number": "178",
          "date_filed": "2002-09-11T00:00:00-04:00",
          "attachments": null,
          "url": "nan",
          "recap_pdf_url": null,
          "pacer_doc_id": null,
          "description": "SPECIAL ORDER NO. 3-214 The Clerk is hereby ordered to change the preliminary magistrate judge assignment in each case listed in Attachment A from Magistrate Judge Jeff Kaplan to Magistrate Judge Irma C. Ramirez for disposition of all pending referred motions, referral of future motions, and assignment for trial by consent. See order for specifics. (Signed by Chief Judge A. Joe Fish) Copies to counsel: 9/12/02 Page(s) 4 (jaw) (Entered: 09/12/2002)"
        },
        {
          "row_number": 198,
          "id": 1840507,
          "entry_number": null,
          "date_filed": "2002-09-11T00:00:00-04:00",
          "attachments": null,
          "url": "nan",
          "recap_pdf_url": null,
          "pacer_doc_id": null,
          "description": "Motion(s) no longer referred: [152-1] motion for attorney fees and related expenses (jaw) (Entered: 09/12/2002)"
        },
        {
          "row_number": 199,
          "id": 1840508,
          "entry_number": null,
          "date_filed": "2002-09-11T00:00:00-04:00",
          "attachments": null,
          "url": "nan",
          "recap_pdf_url": null,
          "pacer_doc_id": null,
          "description": "PRELIMINARY ASSIGNMENT TO Magistrate Judge Irma C Ramirez (jaw) (Entered: 09/12/2002)"
        },
        {
          "row_number": 200,
          "id": 1840509,
          "entry_number": null,
          "date_filed": "2002-09-11T00:00:00-04:00",
          "attachments": null,
          "url": "nan",
          "recap_pdf_url": null,
          "pacer_doc_id": null,
          "description": "Motion(s) referred: [152-1] motion for attorney fees and related expenses referred to Magistrate Judge Irma C. Ramirez (jaw) (Entered: 09/12/2002)"
        },
        {
          "row_number": 201,
          "id": 1840510,
          "entry_number": "179",
          "date_filed": "2002-09-27T00:00:00-04:00",
          "attachments": null,
          "url": "nan",
          "recap_pdf_url": null,
          "pacer_doc_id": null,
          "description": "RESPONSE by plaintiffs in opposition to [171-1] opposition memorandum/Response to dfts' August 5, 2002 objections to plaintiffs' counsels' time records. (13) (jrb) Modified on 09/30/2002 (Entered: 09/30/2002)"
        },
        {
          "row_number": 202,
          "id": 1840511,
          "entry_number": "180",
          "date_filed": "2002-09-27T00:00:00-04:00",
          "attachments": null,
          "url": "nan",
          "recap_pdf_url": null,
          "pacer_doc_id": null,
          "description": "Plaintiffs' Supplemental Transcript of evidence in support of plaintiffs' application for attys' fees. (Volume 1) (15+)(USC) (jrb) (Entered: 09/30/2002)"
        },
        {
          "row_number": 203,
          "id": 1840512,
          "entry_number": "181",
          "date_filed": "2002-09-27T00:00:00-04:00",
          "attachments": null,
          "url": "nan",
          "recap_pdf_url": null,
          "pacer_doc_id": null,
          "description": "Plaintiffs' Supplemental Transcript of evidence in support of plaintiffs' Application for Attys' Fees. (Volume 2) (15+)(USC) (jrb) (Entered: 09/30/2002)"
        },
        {
          "row_number": 204,
          "id": 1840513,
          "entry_number": "182",
          "date_filed": "2002-09-30T00:00:00-04:00",
          "attachments": null,
          "url": "nan",
          "recap_pdf_url": null,
          "pacer_doc_id": null,
          "description": "Agreed MOTION by plaintiffs for leave relative to briefing on attoreys' fees issue (4) (jrb) (Entered: 10/01/2002)"
        },
        {
          "row_number": 205,
          "id": 1840514,
          "entry_number": "183",
          "date_filed": "2002-10-04T00:00:00-04:00",
          "attachments": null,
          "url": "nan",
          "recap_pdf_url": null,
          "pacer_doc_id": null,
          "description": "ORDER granting [182-1] motion for leave relative to briefing on attoreys' fees issue...see order for specifics. ( Signed by Magistrate Judge Irma C. Ramirez ) Copies to counsel: 10/7/02 Page(s) 2 (jrb) (Entered: 10/07/2002)"
        },
        {
          "row_number": 206,
          "id": 1840515,
          "entry_number": "184",
          "date_filed": "2002-10-10T00:00:00-04:00",
          "attachments": null,
          "url": "nan",
          "recap_pdf_url": null,
          "pacer_doc_id": null,
          "description": "RESPONSE and supplemental memorandum of law concerning attorney's fees issues by plaintiffs to [171-1] opposition memorandum (15+) (jrb) (Entered: 10/11/2002)"
        },
        {
          "row_number": 207,
          "id": 1840516,
          "entry_number": "185",
          "date_filed": "2003-03-28T00:00:00-05:00",
          "attachments": null,
          "url": "nan",
          "recap_pdf_url": null,
          "pacer_doc_id": null,
          "description": "ORDER. The court's order of reference, filed 5/10/02 referring Plaintiff's Application for attys' fees and related expenses to the US Magistrate Judge is hereby vacated. (Signed by Judge Sam A Lindsay on 3/28/03) (jrb, ) (Entered: 03/31/2003)"
        },
        {
          "row_number": 208,
          "id": 1840517,
          "entry_number": null,
          "date_filed": "2003-03-28T00:00:00-05:00",
          "attachments": null,
          "url": "nan",
          "recap_pdf_url": null,
          "pacer_doc_id": null,
          "description": "Motions No Longer Referred: 152 Motion for Attorney Fees (jrb, ) (Entered: 03/31/2003)"
        },
        {
          "row_number": 209,
          "id": 1840518,
          "entry_number": "187",
          "date_filed": "2003-04-09T00:00:00-04:00",
          "attachments": null,
          "url": "nan",
          "recap_pdf_url": null,
          "pacer_doc_id": null,
          "description": "***vacated per order of 4/30/03***Judgment for atty's fees and costs. Ordered that plaintiffs recover from dfts jointly and severally the amt of $373,555.45 as atty's fees, and the amt of $31,946.99 as costs. The total amt of judgment is $405,502.44 and postjdugment interest shall accrue on this amt per annum at the applicable federal rate beginning 30 days from the date of entry of the judgmnet until it is paid in full. All relief not expressly granted herein is denied. (Signed by Judge Sam A Lindsay on 4/9/03) (jrb, ) (Entered: 04/10/2003)"
        },
        {
          "row_number": 210,
          "id": 1840519,
          "entry_number": "188",
          "date_filed": "2003-04-21T00:00:00-04:00",
          "attachments": null,
          "url": "nan",
          "recap_pdf_url": null,
          "pacer_doc_id": null,
          "description": "Rule 59 MOTION to modify, alter or amend 187 Order by Thomas Gene Brown, L B Brumley, Cecil NMI Jackson (jrb, ) (Entered: 04/22/2003)"
        },
        {
          "row_number": 211,
          "id": 1840520,
          "entry_number": "189",
          "date_filed": "2003-04-21T00:00:00-04:00",
          "attachments": null,
          "url": "nan",
          "recap_pdf_url": null,
          "pacer_doc_id": null,
          "description": "Supplemental Application/MOTION for Attorney Fees and related expenses by plaintiffs.(jrb, ) (Entered: 04/22/2003)"
        },
        {
          "row_number": 212,
          "id": 1840521,
          "entry_number": "190",
          "date_filed": "2003-04-21T00:00:00-04:00",
          "attachments": null,
          "url": "nan",
          "recap_pdf_url": null,
          "pacer_doc_id": null,
          "description": "Appendix in Support re 189 MOTION for Attorney Fees filed by plaintiffs. (jrb, ) (Entered: 04/22/2003)"
        },
        {
          "row_number": 213,
          "id": 1840522,
          "entry_number": "191",
          "date_filed": "2003-05-12T00:00:00-04:00",
          "attachments": null,
          "url": "nan",
          "recap_pdf_url": null,
          "pacer_doc_id": null,
          "description": "Brief in RESPONSE to Motion re 188 MOTION to Amend/Correct 187 Order,, filed by Robert Harris. (jrb, ) (Entered: 05/13/2003)"
        },
        {
          "row_number": 214,
          "id": 1840523,
          "entry_number": "192",
          "date_filed": "2003-05-12T00:00:00-04:00",
          "attachments": null,
          "url": "nan",
          "recap_pdf_url": null,
          "pacer_doc_id": null,
          "description": "RESPONSE to Motion re 188 MOTION to Amend/Correct 187 Order,, filed by Kaufman County. (jrb, ) (Entered: 05/13/2003)"
        },
        {
          "row_number": 215,
          "id": 1840524,
          "entry_number": "193",
          "date_filed": "2003-05-27T00:00:00-04:00",
          "attachments": null,
          "url": "nan",
          "recap_pdf_url": null,
          "pacer_doc_id": null,
          "description": "REPLY to Response to Motion re 188 Rule 59 MOTION to modify, alter or amend 187 Judgment for Attorney's Fees and Costs filed by Thomas Gene Brown, L B Brumley, Cecil NMI Jackson. (svc, ) (Entered: 05/29/2003)"
        },
        {
          "row_number": 216,
          "id": 1840525,
          "entry_number": "194",
          "date_filed": "2003-07-30T00:00:00-04:00",
          "attachments": null,
          "url": "nan",
          "recap_pdf_url": null,
          "pacer_doc_id": null,
          "description": "ORDER granting 188 Motion to Amend/Correct. The court vacates the Memorandum Opinion and Order filed 4/9/03 and also vacates the Judgment for Atty's fees and costs filed and entered on 4/9/03. See order for specifics. (Signed by Judge Sam A Lindsay on 7/30/03) (jrb, ) (Entered: 07/30/2003)"
        },
        {
          "row_number": 217,
          "id": 1840526,
          "entry_number": "195",
          "date_filed": "2003-07-30T00:00:00-04:00",
          "attachments": null,
          "url": "nan",
          "recap_pdf_url": null,
          "pacer_doc_id": null,
          "description": "Memorandum Opinion and Order. The court vacates the Memorandum Opinion and Order issued 4/9/03 and substitutes the following Amended Memorandum Opinion and Order in its place. Plaintiff's Appl for attys' fees and related expenses is granted in part and denied in part. Accordingly, plaintiffs shall recover the amount of $373,555.45 as reasonable atty's fees. The amount awarded as costs is $31,946.99. The total awarded for atty's fees and costs on plaintiffs' initial appl for atty's fees and related expenses is $405,502.44. See order for specifics. (Signed by Judge Sam A Lindsay on 7/30/03) (jrb, ) (Entered: 07/30/2003)"
        },
        {
          "row_number": 218,
          "id": 1840527,
          "entry_number": "196",
          "date_filed": "2003-08-13T00:00:00-04:00",
          "attachments": null,
          "url": "nan",
          "recap_pdf_url": null,
          "pacer_doc_id": null,
          "description": "Revised Supplemental Application for Attorney Fees and Related Expenses by Karran Brown, Thomas Gene Brown, L B Brumley, Cecil NMI Jackson, Sylvester Lewis (jrb, ) (Entered: 08/14/2003)"
        },
        {
          "row_number": 219,
          "id": 1840528,
          "entry_number": "198",
          "date_filed": "2003-08-20T00:00:00-04:00",
          "attachments": null,
          "url": "nan",
          "recap_pdf_url": null,
          "pacer_doc_id": null,
          "description": "RESPONSE to Motion re 196 MOTION for Attorney Fees filed by Kaufman County. (jrb, ) (Entered: 08/21/2003)"
        },
        {
          "row_number": 220,
          "id": 1840529,
          "entry_number": "199",
          "date_filed": "2003-11-26T00:00:00-05:00",
          "attachments": null,
          "url": "nan",
          "recap_pdf_url": null,
          "pacer_doc_id": null,
          "description": "ORDER granting 196 Motion for Attorney Fees. Plaintiffs are entitled to recover from defendants Kaufman County and Kaufman County Sheriff Robert Harris, jointly and severally, the amt of $21,760 as attorney's fees for establishing and defending their fee claim, and shall recover the sum of $13,689.85 as related expenses with respect to the revised supplemental request. See order for specifics. (Signed by Judge Sam A Lindsay on 11/26/03) (jrb, ) (Entered: 12/02/2003)"
        },
        {
          "row_number": 221,
          "id": 1840530,
          "entry_number": "200",
          "date_filed": "2003-11-26T00:00:00-05:00",
          "attachments": null,
          "url": "nan",
          "recap_pdf_url": null,
          "pacer_doc_id": null,
          "description": "JUDGMENT. Ordered that plaintiffs are entitled to and shall recover from defendants Kaufman County and Kaufman County Sheriff Robert Harris, jointly and severally, the amount of $395,315.45 as reasonable attorney's fees and the amount of $45,636.84 as out of pocket costs and related expenses. The total amount of this judgment for attorney's fees and out of pocket costs and related expenses is $440,952.29. This judgment shall accrue postjudgment interest at the current federal rate per annum from the date of its entry until it is paid in full. (Signed by Judge Sam A Lindsay on 11/26/03) (jrb, ) (Entered: 12/02/2003)"
        },
        {
          "row_number": 222,
          "id": 1840531,
          "entry_number": "201",
          "date_filed": "2003-12-11T00:00:00-05:00",
          "attachments": null,
          "url": "nan",
          "recap_pdf_url": null,
          "pacer_doc_id": null,
          "description": "MOTION for New Trial on the Issue of Attorney's Fees and Brief in Support and Request for Leave to Take Related Discovery by Kaufman County (jrb, ) (Entered: 12/12/2003)"
        },
        {
          "row_number": 223,
          "id": 1840532,
          "entry_number": "202",
          "date_filed": "2003-12-11T00:00:00-05:00",
          "attachments": null,
          "url": "nan",
          "recap_pdf_url": null,
          "pacer_doc_id": null,
          "description": "Appendix in Support re 201 MOTION filed by Kaufman County. (USC) (jrb, ) (Entered: 12/15/2003)"
        },
        {
          "row_number": 224,
          "id": 1840533,
          "entry_number": "203",
          "date_filed": "2003-12-23T00:00:00-05:00",
          "attachments": null,
          "url": "nan",
          "recap_pdf_url": null,
          "pacer_doc_id": null,
          "description": "Opinion of USCA: AFFIRMED; (certified copy) in accordance with USCA judgment re 159 Notice of Appeal filed by Robert Harris, Kaufman County, 160 Notice of Appeal filed by Thomas Gene Brown, Cecil NMI Jackson, L B Brumley, 154 Notice of Appeal filed by Thomas Gene Brown, 157 Notice of Appeal filed by Robert Harris, Kaufman County. (jmr) (Entered: 12/24/2003)"
        },
        {
          "row_number": 225,
          "id": 1840534,
          "entry_number": "204",
          "date_filed": "2003-12-23T00:00:00-05:00",
          "attachments": null,
          "url": "nan",
          "recap_pdf_url": null,
          "pacer_doc_id": null,
          "description": "JUDGMENT/MANDATE of USCA; Judgment of the District Court is affirmed; as to 159 Notice of Appeal filed by Robert Harris, Kaufman County, 160 Notice of Appeal filed by Thomas Gene Brown, Cecil NMI Jackson, L B Brumley, 156 Notice of Appeal filed by Thomas Gene Brown, Cecil NMI Jackson, L B Brumley, 154 Notice of Appeal filed by Thomas Gene Brown, 157 Notice of Appeal filed by Robert Harris, Kaufman County. Issued as Mandate: 12/17/03. (jmr) (Entered: 12/24/2003)"
        },
        {
          "row_number": 226,
          "id": 1840535,
          "entry_number": null,
          "date_filed": "2003-12-29T00:00:00-05:00",
          "attachments": null,
          "url": "nan",
          "recap_pdf_url": null,
          "pacer_doc_id": null,
          "description": "Appeal Record Returned consisting of 3 vols of case papers; 7 transcripts 160 Notice of Appeal (svc, ) (Entered: 12/30/2003)"
        },
        {
          "row_number": 227,
          "id": 1840536,
          "entry_number": "205",
          "date_filed": "2003-12-30T00:00:00-05:00",
          "attachments": null,
          "url": "nan",
          "recap_pdf_url": null,
          "pacer_doc_id": null,
          "description": "MOTION to Strike and Unfile 201 MOTION by Karran Brown, Thomas Gene Brown, L B Brumley, Cecil NMI Jackson, Sylvester Lewis with Brief in Support Thereof. (jrb, ) (Entered: 12/31/2003)"
        },
        {
          "row_number": 228,
          "id": 1840537,
          "entry_number": "206",
          "date_filed": "2003-12-30T00:00:00-05:00",
          "attachments": null,
          "url": "nan",
          "recap_pdf_url": null,
          "pacer_doc_id": null,
          "description": "RESPONSE to Motion re 201 MOTION filed by Karran Brown, Thomas Gene Brown, L B Brumley, Cecil NMI Jackson, Sylvester Lewis. (jrb, ) (Entered: 12/31/2003)"
        },
        {
          "row_number": 229,
          "id": 1840538,
          "entry_number": "207",
          "date_filed": "2003-12-30T00:00:00-05:00",
          "attachments": null,
          "url": "nan",
          "recap_pdf_url": null,
          "pacer_doc_id": null,
          "description": "Appendix in Support re 205 MOTION to Strike 201 MOTION filed by Karran Brown, Thomas Gene Brown, L B Brumley, Cecil NMI Jackson, Sylvester Lewis. (USC) (jrb, ) (Entered: 12/31/2003)"
        },
        {
          "row_number": 230,
          "id": 1840539,
          "entry_number": "208",
          "date_filed": "2004-01-13T00:00:00-05:00",
          "attachments": null,
          "url": "nan",
          "recap_pdf_url": null,
          "pacer_doc_id": null,
          "description": "Consolidated RESPONSE to Motion re 205 MOTION to Strike 201 MOTION filed by Kaufman County. (jrb, ) (Entered: 01/14/2004)"
        },
        {
          "row_number": 231,
          "id": 1840540,
          "entry_number": "209",
          "date_filed": "2004-03-01T00:00:00-05:00",
          "attachments": null,
          "url": "nan",
          "recap_pdf_url": null,
          "pacer_doc_id": null,
          "description": "JUDGMENT/MANDATE of USCA: Appellants-cross-appellees' motion to remand the case to the U. S. District Court for the Northern District of Texas, Dallas Division, with instructions to award them reasonable attorney's fees incurred in connection with this appeal, is Denied... Appellants-cross-appellees' alternative motion for award of attorney's fees and expenses is Granted; in the total sum, however, of $75,000; as to 160 Notice of Appeal filed by Thomas Gene Brown, Cecil NMI Jackson, L B Brumley, 156 Notice of Appeal filed by Thomas Gene Brown, Cecil NMI Jackson, L B Brumley, 154 Notice of Appeal filed by Thomas Gene Brown. Issued as Mandate: 2/20/04. (jmr) (Entered: 03/05/2004)"
        },
        {
          "row_number": 232,
          "id": 1840541,
          "entry_number": "210",
          "date_filed": "2004-03-15T00:00:00-05:00",
          "attachments": null,
          "url": "nan",
          "recap_pdf_url": null,
          "pacer_doc_id": null,
          "description": "Memorandum Opinion and Order denying 201 Motion for Miscellaneous Relief filed by Kaufman County, 205 Motion to Strike filed by Thomas Gene Brown, Cecil NMI Jackson, Sylvester Lewis, L B Brumley, Karran Brown. See order for other specifics. (Signed by Judge Sam A Lindsay on 3/15/04) (jrb, ) (Entered: 03/16/2004)"
        },
        {
          "row_number": 233,
          "id": 1840542,
          "entry_number": "211",
          "date_filed": "2004-03-29T00:00:00-05:00",
          "attachments": null,
          "url": "nan",
          "recap_pdf_url": null,
          "pacer_doc_id": null,
          "description": "Second Supplemental Application for Attorney's Fees and Related Expenses by Karran Brown, Thomas Gene Brown, L B Brumley, Cecil NMI Jackson, Sylvester Lewis (jrb, ) (Entered: 03/30/2004)"
        },
        {
          "row_number": 234,
          "id": 1840543,
          "entry_number": "212",
          "date_filed": "2004-03-29T00:00:00-05:00",
          "attachments": null,
          "url": "nan",
          "recap_pdf_url": null,
          "pacer_doc_id": null,
          "description": "Appendix in Support re 211 MOTION for Attorney Fees filed by Karran Brown, Thomas Gene Brown, L B Brumley, Cecil NMI Jackson, Sylvester Lewis. (jrb, ) (Entered: 03/30/2004)"
        },
        {
          "row_number": 235,
          "id": 1840544,
          "entry_number": "213",
          "date_filed": "2004-04-13T00:00:00-04:00",
          "attachments": null,
          "url": "nan",
          "recap_pdf_url": null,
          "pacer_doc_id": null,
          "description": "Objections and Response to 211 MOTION for Attorney Fees filed by Kaufman County. (jrb, ) (Entered: 04/14/2004)"
        },
        {
          "row_number": 236,
          "id": 1840545,
          "entry_number": "214",
          "date_filed": "2004-04-22T00:00:00-04:00",
          "attachments": null,
          "url": "nan",
          "recap_pdf_url": null,
          "pacer_doc_id": null,
          "description": "ORDER re: Plaintiff's Second Supplemental Appl for Attorney's Fees and Related Expenses filed 3/29/04. Such notices to the court shall not exceed three pages and must be filed by 4/29/04. See order for specifics. (Signed by Judge Sam A Lindsay on 4/22/04) (jrb, ) (Entered: 04/22/2004)"
        },
        {
          "row_number": 237,
          "id": 1840546,
          "entry_number": "215",
          "date_filed": "2004-04-28T00:00:00-04:00",
          "attachments": null,
          "url": "nan",
          "recap_pdf_url": null,
          "pacer_doc_id": null,
          "description": "NOTICE to the District Court of the Request of the Fifth Circuit filed by the Plaintiffs. (jrb, ) (Entered: 04/29/2004)"
        },
        {
          "row_number": 238,
          "id": 1840547,
          "entry_number": "216",
          "date_filed": "2004-04-29T00:00:00-04:00",
          "attachments": null,
          "url": "nan",
          "recap_pdf_url": null,
          "pacer_doc_id": null,
          "description": "Notice to the Court Pursuant to the Court's April 22, 2004 214 Order, filed by Kaufman County. (jrb, ) (Entered: 05/03/2004)"
        },
        {
          "row_number": 239,
          "id": 1840548,
          "entry_number": "217",
          "date_filed": "2004-05-24T00:00:00-04:00",
          "attachments": null,
          "url": "nan",
          "recap_pdf_url": null,
          "pacer_doc_id": null,
          "description": "Memorandum Opinion and Order granting 211 Motion for Attorney Fees filed by Thomas Gene Brown, Cecil NMI Jackson, Sylvester Lewis, L B Brumley, Karran Brown. Plaintiff shall recover from dft Kaufman County the total amount of $23,748.60 as attorney's fees and costs. Kaufman County shall pay this amount to plaintiffs within 30 days of the entry of this order. If the total amount is not paid within 30 days, postjudgment interest shall accrue on any remaining amt at the applicable, lawful federal rate until it is paid in full. (Signed by Judge Sam A Lindsay on 5/24/04) (jrb, ) (Entered: 05/25/2004)"
        },
        {
          "row_number": 240,
          "id": 1840549,
          "entry_number": "218",
          "date_filed": "2004-05-26T00:00:00-04:00",
          "attachments": null,
          "url": "nan",
          "recap_pdf_url": null,
          "pacer_doc_id": null,
          "description": "NOTICE OF APPEAL as to 217 Memorandum Opinion and Order, by Kaufman County. Filing fee $ 255, receipt number 207481. TOOC. (jmr) (Entered: 05/28/2004)"
        },
        {
          "row_number": 241,
          "id": 1840550,
          "entry_number": "219",
          "date_filed": "2004-05-27T00:00:00-04:00",
          "attachments": null,
          "url": "nan",
          "recap_pdf_url": null,
          "pacer_doc_id": null,
          "description": "AMENDED NOTICE OF APPEAL as to 210 Memorandum Opinion and Order, 217 Memorandum Opinion and Order, by Kaufman County. NO FEE PAID. (jmr) (Entered: 06/01/2004)"
        },
        {
          "row_number": 242,
          "id": 1840551,
          "entry_number": null,
          "date_filed": "2004-05-28T00:00:00-04:00",
          "attachments": null,
          "url": "nan",
          "recap_pdf_url": null,
          "pacer_doc_id": null,
          "description": "Transmission of Notice of Appeal and Docket Sheet to US Court of Appeals re 218 Notice of Appeal. (jmr) (Entered: 05/28/2004)"
        },
        {
          "row_number": 243,
          "id": 1840552,
          "entry_number": null,
          "date_filed": "2004-06-01T00:00:00-04:00",
          "attachments": null,
          "url": "nan",
          "recap_pdf_url": null,
          "pacer_doc_id": null,
          "description": "Transmission of Amended Notice of Appeal and Docket Sheet to US Court of Appeals re 219 Notice of Appeal. (jmr) (Entered: 06/01/2004)"
        },
        {
          "row_number": 244,
          "id": 1840553,
          "entry_number": null,
          "date_filed": "2004-06-04T00:00:00-04:00",
          "attachments": null,
          "url": "nan",
          "recap_pdf_url": null,
          "pacer_doc_id": null,
          "description": "USCA Case Number 04-10658 for 219 Notice of Appeal filed by Kaufman County. (jmr) (Entered: 06/21/2004)"
        },
        {
          "row_number": 245,
          "id": 1840554,
          "entry_number": "220",
          "date_filed": "2004-06-08T00:00:00-04:00",
          "attachments": null,
          "url": "nan",
          "recap_pdf_url": null,
          "pacer_doc_id": null,
          "description": "PROTECTIVE CONDITIONAL NOTICE OF CROSS APPEAL as to 210 Memorandum Opinion and Order, 217 Memorandum Opinion and Order, 200 Judgment, by Kaufman County. NO FEE PAID. (jmr) (Entered: 06/16/2004)"
        },
        {
          "row_number": 246,
          "id": 1840555,
          "entry_number": "221",
          "date_filed": "2004-06-09T00:00:00-04:00",
          "attachments": null,
          "url": "nan",
          "recap_pdf_url": null,
          "pacer_doc_id": null,
          "description": "Transcript Order Form from Plaintiff: transcript not requested and is unnecessary for appeal; re 160 Notice of Appeal. (jmr) (Entered: 06/16/2004)"
        },
        {
          "row_number": 247,
          "id": 1840556,
          "entry_number": null,
          "date_filed": "2004-06-10T00:00:00-04:00",
          "attachments": null,
          "url": "nan",
          "recap_pdf_url": null,
          "pacer_doc_id": null,
          "description": "USCA Appeal Fees received $ 255 receipt number 208040 re 219 Notice of Appeal filed by Kaufman County (ddb, ) (Entered: 06/10/2004)"
        },
        {
          "row_number": 248,
          "id": 1840557,
          "entry_number": null,
          "date_filed": "2004-06-16T00:00:00-04:00",
          "attachments": null,
          "url": "nan",
          "recap_pdf_url": null,
          "pacer_doc_id": null,
          "description": "Transmission of Notice of Appeal and Docket Sheet to US Court of Appeals re 220 Notice of Appeal. (jmr) (Entered: 06/16/2004)"
        },
        {
          "row_number": 249,
          "id": 1840558,
          "entry_number": null,
          "date_filed": "2004-06-21T00:00:00-04:00",
          "attachments": null,
          "url": "nan",
          "recap_pdf_url": null,
          "pacer_doc_id": null,
          "description": "Set Appeal Deadline re Transmission of Notice of Appeal and Docket Sheet to USCA, 219 Notice of Appeal, 220 Notice of Appeal, 218 Notice of Appeal: Appeal Record due by 7/6/2004. (jmr) (Entered: 06/21/2004)"
        },
        {
          "row_number": 250,
          "id": 1840559,
          "entry_number": null,
          "date_filed": "2004-07-06T00:00:00-04:00",
          "attachments": null,
          "url": "nan",
          "recap_pdf_url": null,
          "pacer_doc_id": null,
          "description": "Certified and Transmitted Record on Appeal to US Court of Appeals re 220 Notice of Appeal, 218 Notice of Appeal, 219 Notice of Appeal : 8 vol. record, 3 transcripts and 2 brown folders. (jmr) (Entered: 07/08/2004)"
        },
        {
          "row_number": 251,
          "id": 1840560,
          "entry_number": null,
          "date_filed": "2004-07-14T00:00:00-04:00",
          "attachments": null,
          "url": "nan",
          "recap_pdf_url": null,
          "pacer_doc_id": null,
          "description": "USCA Case Number 04-10658 for 220 Notice of Appeal filed by Kaufman County. (jmr) (Entered: 07/15/2004)"
        },
        {
          "row_number": 252,
          "id": 1840561,
          "entry_number": null,
          "date_filed": "2004-10-07T00:00:00-04:00",
          "attachments": null,
          "url": "nan",
          "recap_pdf_url": null,
          "pacer_doc_id": null,
          "description": "Appeal Record Returned: 220 Notice of Appeal, 218 Notice of Appeal, 219 Notice of Appeal: 10 vol. record, 3 transcripts. (jmr) (Entered: 10/08/2004)"
        },
        {
          "row_number": 253,
          "id": 1840562,
          "entry_number": "222",
          "date_filed": "2004-10-07T00:00:00-04:00",
          "attachments": null,
          "url": "nan",
          "recap_pdf_url": null,
          "pacer_doc_id": null,
          "description": "JUDGMENT/MANDATE of USCA as to 220 Notice of Appeal filed by Kaufman County, 218 Notice of Appeal filed by Kaufman County, 219 Notice of Appeal filed by Kaufman County. Issued as Mandate: 10/4/04. Pursuant to the joint motion fo the parties, these appeals are dismissed (jmr) (Entered: 10/08/2004)"
        },
        {
          "row_number": 34,
          "id": 1840343,
          "entry_number": "30",
          "date_filed": "1998-04-30T00:00:00-04:00",
          "attachments": [],
          "url": "nan",
          "recap_pdf_url": null,
          "pacer_doc_id": null,
          "description": "MOTION by defendant Kaufman County, defendant Robert Harris to continue trial date and modify dispositive mtn deadline (12) (jrb) (Entered: 05/01/1998)"
        },
        {
          "row_number": 48,
          "id": 1840357,
          "entry_number": "43",
          "date_filed": "1998-06-03T00:00:00-04:00",
          "attachments": [],
          "url": "nan",
          "recap_pdf_url": null,
          "pacer_doc_id": null,
          "description": "ORDER denying [34-1] motion to compel dfts to produce documents, to extend time to designate plaintiffs' experts and to extend the discovery deadline ( signed by JK) Copies to counsel: 6/4/98 Page(s) 3 (jrb) (Entered: 06/04/1998)"
        },
        {
          "row_number": 63,
          "id": 1840372,
          "entry_number": "56",
          "date_filed": "1998-07-08T00:00:00-04:00",
          "attachments": [],
          "url": "nan",
          "recap_pdf_url": null,
          "pacer_doc_id": null,
          "description": "ORDER OF REFERENCE: [50-1] motion to dismiss Sylvester Lewis and for sanctions and plaintiffs' mtn for sumjgm (notice filed 6/12/98 and dfts' mtn for sumjgm (notice filed 6/12/98) referred to Magistrate Judge Jeff Kaplan ( Signed by JB) Copies to counsel: 7/9/98 Page(s): 1 (jrb) (Entered: 07/09/1998)"
        },
        {
          "row_number": 71,
          "id": 1840380,
          "entry_number": "63",
          "date_filed": "1998-07-15T00:00:00-04:00",
          "attachments": [],
          "url": "nan",
          "recap_pdf_url": null,
          "pacer_doc_id": null,
          "description": "JOINT MOTION SUBMISSION: for summary judgment by plaintiff Oscar D Williams Jr, plaintiff Thomas Gene Brown, plaintiff Leonard Avery, plaintiff Francis Booker, plaintiff Cecil NMI Jackson, plaintiff Jacquelynn Surrell, plaintiff Ricky Lewis, plaintiff Brenda Allen, plaintiff James nmi McDonald, plaintiff Sylvester Lewis, plaintiff L B Brumley, plaintiff Clifford L Gibson, plaintiff Gloria Surrell, plaintiff Alisa NMI Allen, plaintiff Karran Brown, defendant Kaufman County, defendant Robert Harris (15+) (jrb) (Entered: 07/16/1998)"
        },
        {
          "row_number": 78,
          "id": 1840387,
          "entry_number": "68",
          "date_filed": "1998-07-28T00:00:00-04:00",
          "attachments": [],
          "url": "nan",
          "recap_pdf_url": null,
          "pacer_doc_id": null,
          "description": "ORDER Motion hearing set for 10:00 9/11/98 for [65-1] joint motion for summary judgment, set for 10:00 9/11/98 for [63-1] joint motion for summary judgment, set for 10:00 9/11/98 for [57-1] motion for summary judgment ( signed by JK) Copies to counsel: 7/29/98 Page(s) 1 (jrb) (Entered: 07/29/1998)"
        },
        {
          "row_number": 6,
          "id": 1840315,
          "entry_number": "7",
          "date_filed": "1997-06-02T00:00:00-04:00",
          "attachments": [],
          "url": "nan",
          "recap_pdf_url": null,
          "pacer_doc_id": null,
          "description": "RETURN OF SERVICE executed personally as to defendant Robert Harris 5/21/97 Answer due on 6/10/97 for Robert Harris (2) (jrb) Modified on 07/31/1998 (Entered: 06/05/1997)"
        },
        {
          "row_number": 0,
          "id": 1840309,
          "entry_number": "1",
          "date_filed": "1997-04-21T00:00:00-04:00",
          "attachments": [],
          "url": "nan",
          "recap_pdf_url": null,
          "pacer_doc_id": null,
          "description": "COMPLAINT filed. Filing Fee $ 150.00 Receipt # 91536 (15+) (jrb) (Entered: 04/22/1997)"
        },
        {
          "row_number": 68,
          "id": 1840377,
          "entry_number": "62",
          "date_filed": "1998-07-09T00:00:00-04:00",
          "attachments": [],
          "url": "nan",
          "recap_pdf_url": null,
          "pacer_doc_id": null,
          "description": "RESPONSE by defendant Kaufman County, defendant Robert Harris to [57-1] motion for summary judgment (6) (jrb) (Entered: 07/16/1998)"
        },
        {
          "row_number": 90,
          "id": 1840399,
          "entry_number": "78",
          "date_filed": "1998-09-23T00:00:00-04:00",
          "attachments": [],
          "url": "nan",
          "recap_pdf_url": null,
          "pacer_doc_id": null,
          "description": "CERTIFIED MAIL executed as to Kaufman County, Robert Harris 9/22/98 [75-1] findings & recommendations (1) (jrb) (Entered: 09/24/1998)"
        },
        {
          "row_number": 92,
          "id": 1840401,
          "entry_number": "80",
          "date_filed": "1998-09-23T00:00:00-04:00",
          "attachments": [],
          "url": "nan",
          "recap_pdf_url": null,
          "pacer_doc_id": null,
          "description": "CERTIFIED MAIL executed as to Oscar D Williams Jr, Thomas Gene Brown, Leonard Avery, Francis Booker, Cecil NMI Jackson, Jacquelynn Surrell, Ricky Lewis, Brenda Allen, James nmi McDonald, Sylvester Lewis, L B Brumley, Clifford L Gibson, Gloria Surrell, Alisa NMI Allen, Karran Brown 9/22/98 [73-1] findings & recommendations (1) (jrb) (Entered: 09/24/1998)"
        },
        {
          "row_number": 33,
          "id": 1840342,
          "entry_number": "29",
          "date_filed": "1998-04-28T00:00:00-04:00",
          "attachments": [],
          "url": "nan",
          "recap_pdf_url": null,
          "pacer_doc_id": null,
          "description": "ORDER granting [27-1] motion to dismiss/to non-suit...without prejudice to the refiling of same. ( signed by JB) Copies to counsel: 4/29/98 Page(s) 1 (jrb) (Entered: 04/29/1998)"
        },
        {
          "row_number": 52,
          "id": 1840361,
          "entry_number": "47",
          "date_filed": "1998-06-05T00:00:00-04:00",
          "attachments": [],
          "url": "nan",
          "recap_pdf_url": null,
          "pacer_doc_id": null,
          "description": "NOTICE of mtn to dismiss filed by defendant Kaufman County, defendant Robert Harris (2) (jrb) (Entered: 06/08/1998)"
        },
        {
          "row_number": 87,
          "id": 1840396,
          "entry_number": "75",
          "date_filed": "1998-09-18T00:00:00-04:00",
          "attachments": [],
          "url": "nan",
          "recap_pdf_url": null,
          "pacer_doc_id": null,
          "description": "FINDINGS, CONCLUSIONS AND RECOMMENDATIONS of Magistrate Judge Jeff Kaplan Re: [71-1] motion to dismiss Sylvester Lewis and for contempt ; Motion no longer referred Objections to F and R due by 10/1/98...should be granted. The claims asserted by Plaintiff Sylvester Lewis should be dismissed with prejudice. (jrb) (Entered: 09/22/1998)"
        },
        {
          "row_number": 76,
          "id": 1840385,
          "entry_number": null,
          "date_filed": "1998-07-24T00:00:00-04:00",
          "attachments": [],
          "url": "nan",
          "recap_pdf_url": null,
          "pacer_doc_id": null,
          "description": "Motion hearing re: [50-1] motion to dismiss Sylvester Lewis and for sanctions Motion hearing held (jrb) (Entered: 07/24/1998)"
        },
        {
          "row_number": 46,
          "id": 1840355,
          "entry_number": "42",
          "date_filed": "1998-05-29T00:00:00-04:00",
          "attachments": [],
          "url": "nan",
          "recap_pdf_url": null,
          "pacer_doc_id": null,
          "description": "Minute order: plaintiff's mtns Held before Magistrate Judge Jeff Kaplan Court Reporter: electronic (3) (jrb) (Entered: 05/29/1998)"
        },
        {
          "row_number": 31,
          "id": 1840340,
          "entry_number": "27",
          "date_filed": "1998-04-27T00:00:00-04:00",
          "attachments": [],
          "url": "nan",
          "recap_pdf_url": null,
          "pacer_doc_id": null,
          "description": "Second MOTION by plaintiff David NMN Brown to dismiss/to non-suit (2) (jrb) (Entered: 04/29/1998)"
        },
        {
          "row_number": 72,
          "id": 1840381,
          "entry_number": null,
          "date_filed": "1998-07-15T00:00:00-04:00",
          "attachments": [],
          "url": "nan",
          "recap_pdf_url": null,
          "pacer_doc_id": null,
          "description": "Motion(s) referred: [63-1] joint motion for summary judgment referred to Magistrate Judge Jeff Kaplan (amy) (Entered: 08/04/1998)"
        },
        {
          "row_number": 88,
          "id": 1840397,
          "entry_number": "76",
          "date_filed": "1998-09-18T00:00:00-04:00",
          "attachments": [],
          "url": "nan",
          "recap_pdf_url": null,
          "pacer_doc_id": null,
          "description": "Instructions for service and NOTICE of right to object. (2) (jrb) (Entered: 09/22/1998)"
        },
        {
          "row_number": 99,
          "id": 1840408,
          "entry_number": "88",
          "date_filed": "1998-11-30T00:00:00-05:00",
          "attachments": [],
          "url": "nan",
          "recap_pdf_url": null,
          "pacer_doc_id": null,
          "description": "Supplemental MOTION with memorandum in support by defendant Kaufman County, defendant Robert Harris for summary judgment (15+) (lag) (Entered: 12/01/1998)"
        },
        {
          "row_number": 55,
          "id": 1840364,
          "entry_number": "50",
          "date_filed": "1998-06-29T00:00:00-04:00",
          "attachments": [],
          "url": "nan",
          "recap_pdf_url": null,
          "pacer_doc_id": null,
          "description": "MOTION with memorandum in support by defendant Kaufman County, defendant Robert Harris to dismiss Sylvester Lewis and for sanctions (9) (jrb) (Entered: 06/30/1998)"
        },
        {
          "row_number": 4,
          "id": 1840313,
          "entry_number": "5",
          "date_filed": "1997-06-02T00:00:00-04:00",
          "attachments": [],
          "url": "nan",
          "recap_pdf_url": null,
          "pacer_doc_id": null,
          "description": "RETURN OF SERVICE executed as to defendant Kaufman County by serving Kaufman County Judge...Maxine Darst... 5/21/97 Answer due on 6/10/97 for Kaufman County (2) (jrb) Modified on 06/30/1998 (Entered: 06/03/1997)"
        },
        {
          "row_number": 17,
          "id": 1840326,
          "entry_number": "15",
          "date_filed": "1998-04-03T00:00:00-05:00",
          "attachments": [],
          "url": "nan",
          "recap_pdf_url": null,
          "pacer_doc_id": null,
          "description": "ORDER Motion hearing set for 9:30 4/8/98 for [14-1] motion to compel , and Response to motion reset to 12:00 4/7/98 for [14-1] motion to compel ( signed by JK) Copies to counsel: 4/6/98 Page(s) 2 (jrb) (Entered: 04/06/1998)"
        },
        {
          "row_number": 5,
          "id": 1840314,
          "entry_number": "6",
          "date_filed": "1997-06-02T00:00:00-04:00",
          "attachments": [],
          "url": "nan",
          "recap_pdf_url": null,
          "pacer_doc_id": null,
          "description": "RETURN OF SERVICE executed as to defendant Robert Harris 5/21/97 Answer due on 6/10/97 for Robert Harris (2) (duplicate entry of #7; no corresponding document) (jrb) Modified on 07/31/1998 (Entered: 06/03/1997)"
        },
        {
          "row_number": 75,
          "id": 1840384,
          "entry_number": "66",
          "date_filed": "1998-07-24T00:00:00-04:00",
          "attachments": [],
          "url": "nan",
          "recap_pdf_url": null,
          "pacer_doc_id": null,
          "description": "Minute order: Mtn to dismiss and for sanctions Held before Magistrate Judge Jeff Kaplan Court Reporter: electronic (3) (jrb) (Entered: 07/24/1998)"
        },
        {
          "row_number": 28,
          "id": 1840337,
          "entry_number": "25",
          "date_filed": "1998-04-15T00:00:00-04:00",
          "attachments": [],
          "url": "nan",
          "recap_pdf_url": null,
          "pacer_doc_id": null,
          "description": "ORDER unfiling [23-1] motion to quash deposition notices, mtn for protective order and plaintiffs' response to dfts' \"Discovery Dispute No 1 and brief in support\" and Plaintiffs' brief in support of such mtns and responses, unfiling [22-1] motion to compel dfts to produce documenets, to extend time to designate plaintiffs' experts and to extend the discovery deadline ( signed by JK) Copies to counsel: 4/15/98 Page(s) 4 (jrb) (Entered: 04/15/1998)"
        },
        {
          "row_number": 42,
          "id": 1840351,
          "entry_number": "38",
          "date_filed": "1998-05-19T00:00:00-04:00",
          "attachments": [],
          "url": "nan",
          "recap_pdf_url": null,
          "pacer_doc_id": null,
          "description": "MOTION by plaintiff John NMI Jackson to dismiss/to non-suit (2) (jrb) (Entered: 05/20/1998)"
        },
        {
          "row_number": 47,
          "id": 1840356,
          "entry_number": null,
          "date_filed": "1998-05-29T00:00:00-04:00",
          "attachments": [],
          "url": "nan",
          "recap_pdf_url": null,
          "pacer_doc_id": null,
          "description": "Motion hearing re: [34-1] motion to compel dfts to produce documents, to extend time to designate plaintiffs' experts and to extend the discovery deadline Motion hearing held, [33-1] motion to quash deposition notices and mtn for protective order Motion hearing held, [32-1] motion to amend [13-1] amended complaint Motion hearing held (jrb) (Entered: 05/29/1998)"
        },
        {
          "row_number": 89,
          "id": 1840398,
          "entry_number": "77",
          "date_filed": "1998-09-23T00:00:00-04:00",
          "attachments": [],
          "url": "nan",
          "recap_pdf_url": null,
          "pacer_doc_id": null,
          "description": "CERTIFIED MAIL executed as to Kaufman County, Robert Harris 9/22/98 [73-1] findings & recommendations (jrb) (Entered: 09/24/1998)"
        },
        {
          "row_number": 19,
          "id": 1840328,
          "entry_number": "17",
          "date_filed": "1998-04-09T00:00:00-04:00",
          "attachments": [],
          "url": "nan",
          "recap_pdf_url": null,
          "pacer_doc_id": null,
          "description": "***unfiled***MOTION by plaintiff Oscar D Williams Jr, plaintiff Thomas Gene Brown, plaintiff Leonard Avery, plaintiff Francis Booker, plaintiff Cecil NMI Jackson, plaintiff Jacquelynn Surrell, plaintiff Ricky Lewis, plaintiff Brenda Allen, plaintiff James nmi McDonald, plaintiff Sylvester Lewis, plaintiff L B Brumley, plaintiff Clifford L Gibson, plaintiff Gloria Surrell, plaintiff Alisa NMI Allen, plaintiff John NMI Jackson, plaintiff Karran Brown, plaintiff David NMN Brown to amend [13-1] amended complaint (5) (jrb) Modified on 07/29/1998 (Entered: 04/10/1998)"
        },
        {
          "row_number": 58,
          "id": 1840367,
          "entry_number": "53",
          "date_filed": "1998-06-30T00:00:00-04:00",
          "attachments": [],
