{
  "case_id": 9942,
  "fetched_at": "2025-10-20T22:40:48.570780",
  "case_data": {
    "attorney_orgs": [],
    "available_documents": [
      "Trial Court Docket",
      "Any published opinion"
    ],
    "case_defendants": [
      {
        "defendant_level": null,
        "institution": "Floyd County Jail",
        "institution_alt_state": null,
        "institution_city": "",
        "institution_county": "Floyd",
        "name": "Floyd County Sheriff",
        "defendant_level_other": "",
        "is_active": true
      }
    ],
    "case_ongoing": "No",
    "case_status": "Coding Complete",
    "case_types": [
      "Jail Conditions"
    ],
    "cause_other": "",
    "causes": [
      "42 U.S.C. ยง 1983"
    ],
    "class_action_granted": "Granted",
    "class_action_sought": "Yes",
    "closing_year": 2002,
    "constitutional_clause": [
      {
        "value": "Due Process"
      },
      {
        "value": "Unreasonable search and seizure"
      }
    ],
    "content_of_injunction": [],
    "court": "Southern District of Indiana",
    "custom_issues": [],
    "defendant_payment": "",
    "defendant_type": [],
    "docket_status": "Complete as of retrieval date",
    "facility_type": [
      {
        "value": "Government-run"
      }
    ],
    "filing_date": "1999-01-13",
    "filing_year": 1999,
    "id": 9942,
    "injunction_duration": "",
    "issues": [
      "General/Misc.: Search policies",
      "Jails, Prisons, Detention Centers, and Other Institutions: Strip search policy (facilities)",
      "Affected Sex/Gender(s): Male",
      "Affected Sex/Gender(s): Female"
    ],
    "last_checked_date": "2008-04-11T00:00:00-04:00",
    "main_docket": {
      "id": 33139,
      "docket_entries": [
        {
          "row_number": 212,
          "id": 3540558,
          "entry_number": "9",
          "date_filed": "1999-01-20T00:00:00-05:00",
          "attachments": [],
          "url": "https://www.courtlistener.com/docket/33882506/9/doan-mindy-v-watson-sheriff-leland/",
          "recap_pdf_url": null,
          "pacer_doc_id": null,
          "description": "ENTRY denies pltfs' mot. for early disc. & no setting on mot. for P.I. at this time. DFH cm eod 01/20/99 [CFW] (Entered: 01/20/1999)"
        },
        {
          "row_number": 2,
          "id": 3540559,
          "entry_number": "10",
          "date_filed": "1999-01-27T00:00:00-05:00",
          "attachments": [],
          "url": "https://www.courtlistener.com/docket/33882506/10/doan-mindy-v-watson-sheriff-leland/",
          "recap_pdf_url": null,
          "pacer_doc_id": null,
          "description": "APPEARANCE of Richard T Mullineaux & Van T Willis, KIGHTLINGER & GRAY, for deft Floyd County, Indiana, c/s eod 01/27/99 [KTK] (Entered: 01/27/1999)"
        },
        {
          "row_number": 13,
          "id": 3540560,
          "entry_number": "11",
          "date_filed": "1999-01-27T00:00:00-05:00",
          "attachments": [],
          "url": "https://www.courtlistener.com/docket/33882506/11/doan-mindy-v-watson-sheriff-leland/",
          "recap_pdf_url": null,
          "pacer_doc_id": null,
          "description": "APPEARANCE of Dave Whalin & R Thad Keal, LANDRUM & SHOUSE, for defts Watson & Hubbard, c/s eod 01/27/99 [KTK] (Entered: 01/27/1999)"
        },
        {
          "row_number": 46,
          "id": 3540563,
          "entry_number": "14",
          "date_filed": "1999-02-09T00:00:00-05:00",
          "attachments": [],
          "url": "https://www.courtlistener.com/docket/33882506/14/doan-mindy-v-watson-sheriff-leland/",
          "recap_pdf_url": null,
          "pacer_doc_id": null,
          "description": "RESPONSE to defts' Mot to Dismiss w/MOTION TO AM COMPLT for damages by pltfs, c/s eod 02/09/99 [KTK] (Entered: 02/09/1999)"
        },
        {
          "row_number": 56,
          "id": 3540564,
          "entry_number": "15",
          "date_filed": "1999-02-09T00:00:00-05:00",
          "attachments": [],
          "url": "https://www.courtlistener.com/docket/33882506/15/doan-mindy-v-watson-sheriff-leland/",
          "recap_pdf_url": null,
          "pacer_doc_id": null,
          "description": "MEMORANDUM in support of Mot in Opposition to defts' Mot to Dismiss & to Mot to AM Complt for damages, c/s eod 02/09/99 [KTK] (Entered: 02/09/1999)"
        },
        {
          "row_number": 140,
          "id": 3540572,
          "entry_number": "24",
          "date_filed": "1999-03-05T00:00:00-05:00",
          "attachments": [],
          "url": "https://www.courtlistener.com/docket/33882506/24/doan-mindy-v-watson-sheriff-leland/",
          "recap_pdf_url": null,
          "pacer_doc_id": null,
          "description": "ENTRY ASSIGNS CONF to 03/22/99 at 08:30AM Room 228 (VSS) c/m (Status Conf) eod 03/05/99 [KTK] (Entered: 03/05/1999)"
        },
        {
          "row_number": 141,
          "id": 3540573,
          "entry_number": "25",
          "date_filed": "1999-03-05T00:00:00-05:00",
          "attachments": [],
          "url": "https://www.courtlistener.com/docket/33882506/25/doan-mindy-v-watson-sheriff-leland/",
          "recap_pdf_url": null,
          "pacer_doc_id": null,
          "description": "NOTICE OF PARTIES' FIRST EXTENSION OF TIME - Defts Ans to AM Complt due 4/5/99; Resp to SJ due 4/12/99; & Resp to Discovery Request due 4/12/99, c/s eod 03/05/99 [KTK] (Entered: 03/05/1999)"
        },
        {
          "row_number": 142,
          "id": 3540574,
          "entry_number": "26",
          "date_filed": "1999-03-05T00:00:00-05:00",
          "attachments": [],
          "url": "https://www.courtlistener.com/docket/33882506/26/doan-mindy-v-watson-sheriff-leland/",
          "recap_pdf_url": null,
          "pacer_doc_id": null,
          "description": "ENTRY pursuant to LR 40.1(e) case REASSIGNED to the docket of Judge SEBarker & Magistrate Judge VSSHields (SEB), c/m eod 03/10/99 [KTK] (Entered: 03/10/1999)"
        },
        {
          "row_number": 144,
          "id": 3540577,
          "entry_number": "28",
          "date_filed": "1999-03-15T00:00:00-05:00",
          "attachments": [],
          "url": "https://www.courtlistener.com/docket/33882506/28/doan-mindy-v-watson-sheriff-leland/",
          "recap_pdf_url": null,
          "pacer_doc_id": null,
          "description": "ENTRY - deadline for response to pltf's pending SJ Mot & pet for certification as a class action will be determined after Court's ruling on consolidation & the proposed AM Complt (SEB), c/m eod 03/17/99 [KTK] (Entered: 03/17/1999)"
        },
        {
          "row_number": 145,
          "id": 3540578,
          "entry_number": "29",
          "date_filed": "1999-03-22T00:00:00-05:00",
          "attachments": [],
          "url": "https://www.courtlistener.com/docket/33882506/29/doan-mindy-v-watson-sheriff-leland/",
          "recap_pdf_url": null,
          "pacer_doc_id": null,
          "description": "APPEARANCE of Stephen L Huddleston for deft Hubbard, c/s eod 03/22/99 [KTK] (Entered: 03/22/1999)"
        },
        {
          "row_number": 147,
          "id": 3540579,
          "entry_number": "30",
          "date_filed": "1999-03-22T00:00:00-05:00",
          "attachments": [],
          "url": "https://www.courtlistener.com/docket/33882506/30/doan-mindy-v-watson-sheriff-leland/",
          "recap_pdf_url": null,
          "pacer_doc_id": null,
          "description": "MOTION FOR TIME TO Answer/Respond to pltfs AM Complt, SJ Mot, Interrogatories & Request for Production of Documents, c/s eod 03/22/99 [KTK] (Entered: 03/22/1999)"
        },
        {
          "row_number": 148,
          "id": 3540580,
          "entry_number": "31",
          "date_filed": "1999-03-22T00:00:00-05:00",
          "attachments": [],
          "url": "https://www.courtlistener.com/docket/33882506/31/doan-mindy-v-watson-sheriff-leland/",
          "recap_pdf_url": null,
          "pacer_doc_id": null,
          "description": "PTC ORDER FROM P/T ON 3/22/99: conf held & concluded; order to follow; & recommends 3/13/2000 trial date before Judge Hamilton (VSS), c/m eod 03/23/99 [KTK] (Entered: 03/23/1999)"
        },
        {
          "row_number": 154,
          "id": 3540586,
          "entry_number": "37",
          "date_filed": "1999-04-06T00:00:00-04:00",
          "attachments": [],
          "url": "https://www.courtlistener.com/docket/33882506/37/doan-mindy-v-watson-sheriff-leland/",
          "recap_pdf_url": null,
          "pacer_doc_id": null,
          "description": "MOTION FOR HEARING on pltfs' objection to defts' proposed entry, c/s eod 04/06/99 [KTK] (Entered: 04/06/1999)"
        },
        {
          "row_number": 155,
          "id": 3540587,
          "entry_number": "38",
          "date_filed": "1999-04-20T00:00:00-04:00",
          "attachments": [],
          "url": "https://www.courtlistener.com/docket/33882506/38/doan-mindy-v-watson-sheriff-leland/",
          "recap_pdf_url": null,
          "pacer_doc_id": null,
          "description": "ENTRY (AMENDED) for 3/22/99 PTC w/deadlines. Parties to complete a CMP following Court's ruling on petition for class certification {S E} (VSS0, c/m eod 04/21/99 [KTK] (Entered: 04/21/1999)"
        },
        {
          "row_number": 158,
          "id": 3540589,
          "entry_number": "40",
          "date_filed": "1999-04-30T00:00:00-04:00",
          "attachments": [],
          "url": "https://www.courtlistener.com/docket/33882506/40/doan-mindy-v-watson-sheriff-leland/",
          "recap_pdf_url": null,
          "pacer_doc_id": null,
          "description": "JOINT MOTION by defts for PTC, c/s eod 04/30/99 [KTK] (Entered: 04/30/1999)"
        },
        {
          "row_number": 159,
          "id": 3540590,
          "entry_number": "41",
          "date_filed": "1999-04-30T00:00:00-04:00",
          "attachments": [],
          "url": "https://www.courtlistener.com/docket/33882506/41/doan-mindy-v-watson-sheriff-leland/",
          "recap_pdf_url": null,
          "pacer_doc_id": null,
          "description": "ANSWER to pltfs' Revised 1st AM Complt for Damages by deft Watson, c/s eod 04/30/99 [KTK] (Entered: 04/30/1999)"
        },
        {
          "row_number": 160,
          "id": 3540591,
          "entry_number": "42",
          "date_filed": "1999-04-30T00:00:00-04:00",
          "attachments": [],
          "url": "https://www.courtlistener.com/docket/33882506/42/doan-mindy-v-watson-sheriff-leland/",
          "recap_pdf_url": null,
          "pacer_doc_id": null,
          "description": "JOINT MEMORANDUM by defts IN OPPOSITION to pltfs' Revised Petiton for Ceritication of Class, c/s eod 04/30/99 [KTK] (Entered: 04/30/1999)"
        },
        {
          "row_number": 161,
          "id": 3540592,
          "entry_number": "43",
          "date_filed": "1999-05-07T00:00:00-04:00",
          "attachments": [],
          "url": "https://www.courtlistener.com/docket/33882506/43/doan-mindy-v-watson-sheriff-leland/",
          "recap_pdf_url": null,
          "pacer_doc_id": null,
          "description": "ORDER ASSIGNS P/T (TELEPHONIC) to 05/13/99 at 01:30PM Room 256 (VSS) c/m (IP time; Court will initiate call) eod 05/07/99 [KTK] (Entered: 05/07/1999)"
        },
        {
          "row_number": 162,
          "id": 3540593,
          "entry_number": "44",
          "date_filed": "1999-05-10T00:00:00-04:00",
          "attachments": [],
          "url": "https://www.courtlistener.com/docket/33882506/44/doan-mindy-v-watson-sheriff-leland/",
          "recap_pdf_url": null,
          "pacer_doc_id": null,
          "description": "ENTRY REASSIGNS CONF (TELEPHONIC) to 05/19/99 at 12:00PM Room 256 (VSS) c/m (Settlement Conf, Court will initiate call) eod 05/10/99 edited 05/10/99 [KTK] (Entered: 05/10/1999)"
        },
        {
          "row_number": 164,
          "id": 3540594,
          "entry_number": "46",
          "date_filed": "1999-05-19T00:00:00-04:00",
          "attachments": [],
          "url": "https://www.courtlistener.com/docket/33882506/46/doan-mindy-v-watson-sheriff-leland/",
          "recap_pdf_url": null,
          "pacer_doc_id": null,
          "description": "PTC ORDER FROM P/T ON 5/19/99: Conf held & concluded; pltfs to respond to defts opposition to revised pet for class certification by 6/1/99 w/ds reply 15 days after service of the response; & defts to respond to pltfs SJ Mot 30 days after ruling on pet for class certification by 8/30/99, whichever date is the earliest (VSS), c/m eod 05/25/99 [KTK] (Entered: 05/25/1999)"
        },
        {
          "row_number": 166,
          "id": 3540597,
          "entry_number": "48",
          "date_filed": "1999-06-01T00:00:00-04:00",
          "attachments": [],
          "url": "https://www.courtlistener.com/docket/33882506/48/doan-mindy-v-watson-sheriff-leland/",
          "recap_pdf_url": null,
          "pacer_doc_id": null,
          "description": "MEMORANDUM in support of pltfs' Response to defts' Obj to plts' Pet for Certification as a Class Action & MOT to Sever the issue of damages, c/s eod 06/01/99 [KTK] (Entered: 06/01/1999)"
        },
        {
          "row_number": 169,
          "id": 3540599,
          "entry_number": "50",
          "date_filed": "1999-06-15T00:00:00-04:00",
          "attachments": [],
          "url": "https://www.courtlistener.com/docket/33882506/50/doan-mindy-v-watson-sheriff-leland/",
          "recap_pdf_url": null,
          "pacer_doc_id": null,
          "description": "REPLY (JOINT) to pltfs' response to defts' Objection to class certification, c/s DEFTS eod 06/15/99 [KTK] (Entered: 06/15/1999)"
        },
        {
          "row_number": 170,
          "id": 3540600,
          "entry_number": "51",
          "date_filed": "1999-08-24T00:00:00-04:00",
          "attachments": [],
          "url": "https://www.courtlistener.com/docket/33882506/51/doan-mindy-v-watson-sheriff-leland/",
          "recap_pdf_url": null,
          "pacer_doc_id": null,
          "description": "MOTION FOR TIME TO (JOINT) to Respond to pltfs' SJ Mot, c/s eod 08/24/99 [KTK] (Entered: 08/24/1999)"
        },
        {
          "row_number": 171,
          "id": 3540601,
          "entry_number": "52",
          "date_filed": "1999-08-27T00:00:00-04:00",
          "attachments": [],
          "url": "https://www.courtlistener.com/docket/33882506/52/doan-mindy-v-watson-sheriff-leland/",
          "recap_pdf_url": null,
          "pacer_doc_id": null,
          "description": "ORDER GRANTS agreed motion for time for defts to respond to pltfs' Motion for S/J to 10/29/99. cm SEB eod 08/30/99 [MAC] (Entered: 08/30/1999)"
        },
        {
          "row_number": 174,
          "id": 3540604,
          "entry_number": "55",
          "date_filed": "1999-09-03T00:00:00-04:00",
          "attachments": [],
          "url": "https://www.courtlistener.com/docket/33882506/55/doan-mindy-v-watson-sheriff-leland/",
          "recap_pdf_url": null,
          "pacer_doc_id": null,
          "description": "STATEMENT (COUNSEL'S) in Compliance with LR 37.1 in support of Mot to Compel, c/s DEFTS eod 09/03/99 [BJS] (Entered: 09/03/1999)"
        },
        {
          "row_number": 175,
          "id": 3540605,
          "entry_number": "56",
          "date_filed": "1999-09-10T00:00:00-04:00",
          "attachments": [],
          "url": "https://www.courtlistener.com/docket/33882506/56/doan-mindy-v-watson-sheriff-leland/",
          "recap_pdf_url": null,
          "pacer_doc_id": null,
          "description": "ORDER - pltfs to appear for depositions on a date agreed to by counsel but not beyond 10/1/99 (54) (VSS), c/m eod 09/13/99 [KTK] (Entered: 09/13/1999)"
        },
        {
          "row_number": 178,
          "id": 3540608,
          "entry_number": "59",
          "date_filed": "1999-10-22T00:00:00-04:00",
          "attachments": [],
          "url": "https://www.courtlistener.com/docket/33882506/59/doan-mindy-v-watson-sheriff-leland/",
          "recap_pdf_url": null,
          "pacer_doc_id": null,
          "description": "MOTION FOR TIME TO (2nd Joint) to file a response to pltfs SJ Mot, c/s - DEFTS eod 10/22/99 [KTK] (Entered: 10/22/1999)"
        },
        {
          "row_number": 182,
          "id": 3540611,
          "entry_number": "62",
          "date_filed": "1999-10-25T00:00:00-04:00",
          "attachments": [],
          "url": "https://www.courtlistener.com/docket/33882506/62/doan-mindy-v-watson-sheriff-leland/",
          "recap_pdf_url": null,
          "pacer_doc_id": null,
          "description": "ORDER - defts' response to pltfs' SJ Mot is due 30 days after the depositions are completed (59) (SEB), c/m eod 10/25/99 [KTK] (Entered: 10/25/1999)"
        },
        {
          "row_number": 183,
          "id": 3540612,
          "entry_number": "63",
          "date_filed": "1999-10-25T00:00:00-04:00",
          "attachments": [],
          "url": "https://www.courtlistener.com/docket/33882506/63/doan-mindy-v-watson-sheriff-leland/",
          "recap_pdf_url": null,
          "pacer_doc_id": null,
          "description": "ENTRY Directs Clerk to modify the title of the Complaint filed this date to read Second Amended Complaint. cm SEB eod 10/25/99 [MAC] (Entered: 10/25/1999)"
        },
        {
          "row_number": 185,
          "id": 3540614,
          "entry_number": "65",
          "date_filed": "1999-11-16T00:00:00-05:00",
          "attachments": [],
          "url": "https://www.courtlistener.com/docket/33882506/65/doan-mindy-v-watson-sheriff-leland/",
          "recap_pdf_url": null,
          "pacer_doc_id": null,
          "description": "NOTICE of Service of Notice of Rule 30(B) Depos served upon cnsl for defts, c/s PLTFS eod 11/16/99 [BJS] (Entered: 11/16/1999)"
        },
        {
          "row_number": 186,
          "id": 3540616,
          "entry_number": "66",
          "date_filed": "1999-12-03T00:00:00-05:00",
          "attachments": [],
          "url": "https://www.courtlistener.com/docket/33882506/66/doan-mindy-v-watson-sheriff-leland/",
          "recap_pdf_url": null,
          "pacer_doc_id": null,
          "description": "MOTION TO DISMISS (joint) pltfs L Arnold & W Taylor, c/s DEFTS eod 12/03/99 [KTK] (Entered: 12/03/1999)"
        },
        {
          "row_number": 189,
          "id": 3540618,
          "entry_number": "69",
          "date_filed": "2000-01-13T00:00:00-05:00",
          "attachments": [],
          "url": "https://www.courtlistener.com/docket/33882506/69/doan-mindy-v-watson-sheriff-leland/",
          "recap_pdf_url": null,
          "pacer_doc_id": null,
          "description": "DISMISSAL of plaintiffs, Linda Sue Arnold and Wesley Taylor with prejudice. cm SEB eod 01/14/00 [MAC] (Entered: 01/14/2000)"
        },
        {
          "row_number": 192,
          "id": 3540620,
          "entry_number": "71",
          "date_filed": "2000-04-17T00:00:00-04:00",
          "attachments": [],
          "url": "https://www.courtlistener.com/docket/33882506/71/doan-mindy-v-watson-sheriff-leland/",
          "recap_pdf_url": null,
          "pacer_doc_id": null,
          "description": "ORDER - cnsl for class to file w/Clerk of Court by 7/30/00 an affidavit identifying persons to whom notice has been mailed & who have not timely requested exclusion {SE} (SEB), c/m eod 04/19/00 [BJS] (Entered: 04/19/2000)"
        },
        {
          "row_number": 194,
          "id": 3540622,
          "entry_number": "73",
          "date_filed": "2000-05-01T00:00:00-04:00",
          "attachments": [],
          "url": "https://www.courtlistener.com/docket/33882506/73/doan-mindy-v-watson-sheriff-leland/",
          "recap_pdf_url": null,
          "pacer_doc_id": null,
          "description": "MOTION FOR S/J (PARTIAL) w/Brief in Support, c/s PLTFS eod 05/01/00 [BJS] (Entered: 05/01/2000)"
        },
        {
          "row_number": 195,
          "id": 3540623,
          "entry_number": "74",
          "date_filed": "2000-05-01T00:00:00-04:00",
          "attachments": [],
          "url": "https://www.courtlistener.com/docket/33882506/74/doan-mindy-v-watson-sheriff-leland/",
          "recap_pdf_url": null,
          "pacer_doc_id": null,
          "description": "STATEMENT of Material Facts, c/s PLTFS eod 05/01/00 [BJS] (Entered: 05/01/2000)"
        },
        {
          "row_number": 199,
          "id": 3540627,
          "entry_number": "78",
          "date_filed": "2000-05-26T00:00:00-04:00",
          "attachments": [],
          "url": "https://www.courtlistener.com/docket/33882506/78/doan-mindy-v-watson-sheriff-leland/",
          "recap_pdf_url": null,
          "pacer_doc_id": null,
          "description": "NOTICE OF FILING Depositions, c/s DEFT Watson eod 05/26/00 [BJS] (Entered: 05/26/2000)"
        },
        {
          "row_number": 206,
          "id": 3540633,
          "entry_number": "84",
          "date_filed": "2000-05-30T00:00:00-04:00",
          "attachments": [],
          "url": "https://www.courtlistener.com/docket/33882506/84/doan-mindy-v-watson-sheriff-leland/",
          "recap_pdf_url": null,
          "pacer_doc_id": null,
          "description": "RESPONSE to pltfs' Statement of Material Facts, c/s DEFT Hubbard eod 05/30/00 [BJS] (Entered: 05/30/2000)"
        },
        {
          "row_number": 222,
          "id": 3540648,
          "entry_number": "99",
          "date_filed": "2000-07-07T00:00:00-04:00",
          "attachments": [],
          "url": "https://www.courtlistener.com/docket/33882506/99/doan-mindy-v-watson-sheriff-leland/",
          "recap_pdf_url": null,
          "pacer_doc_id": null,
          "description": "RESPONSE to pltfs' Mot to Redesignate defts' Mot for SJ, to Strike Portion of defts' Response to Mot for SJ and to Set further Briefing Parameters, c/s DEFTS Watson & Hubbard eod 07/07/00 [BJS] (Entered: 07/07/2000)"
        },
        {
          "row_number": 3,
          "id": 3540649,
          "entry_number": "100",
          "date_filed": "2000-07-13T00:00:00-04:00",
          "attachments": [],
          "url": "https://www.courtlistener.com/docket/33882506/100/doan-mindy-v-watson-sheriff-leland/",
          "recap_pdf_url": null,
          "pacer_doc_id": null,
          "description": "REPLY in support of Mot to Redesignate defts' Mot for SJ, to Strike Portion of defts' Response to Mot for SJ, and to Set Further Briefing Parameters, c/s PLTFS eod 07/13/00 [BJS] (Entered: 07/13/2000)"
        },
        {
          "row_number": 4,
          "id": 3540650,
          "entry_number": "101",
          "date_filed": "2000-07-19T00:00:00-04:00",
          "attachments": null,
          "url": "https://www.courtlistener.com/docket/33882506/101/doan-mindy-v-watson-sheriff-leland/",
          "recap_pdf_url": null,
          "pacer_doc_id": null,
          "description": "ORDER GRANTS in Part and DENIES in part pltfs' Motion to Re-designate defts' Motion for S/J, to Strike portions of defts' Response to S/J and to set further briefing parameters. (S.O.) cm SEB eod 07/20/00 [MAC] (Entered: 07/20/2000)"
        },
        {
          "row_number": 8,
          "id": 3540654,
          "entry_number": "105",
          "date_filed": "2000-09-01T00:00:00-04:00",
          "attachments": null,
          "url": "https://www.courtlistener.com/docket/33882506/105/doan-mindy-v-watson-sheriff-leland/",
          "recap_pdf_url": null,
          "pacer_doc_id": null,
          "description": "REPLY to pltfs' Response to SJ Mot, c/s - DEFTS Watson & Hubbard eod 09/01/00 [KTK] (Entered: 09/01/2000)"
        },
        {
          "row_number": 15,
          "id": 3540660,
          "entry_number": "111",
          "date_filed": "2000-09-15T00:00:00-04:00",
          "attachments": null,
          "url": "https://www.courtlistener.com/docket/33882506/111/doan-mindy-v-watson-sheriff-leland/",
          "recap_pdf_url": null,
          "pacer_doc_id": null,
          "description": "MOTION FOR CONT OF SCHEDULED 9/25/00 telephonic PTConf, c/s DEFT Hubbard eod 09/15/00 [BJS] (Entered: 09/15/2000)"
        },
        {
          "row_number": 17,
          "id": 3540661,
          "entry_number": "113",
          "date_filed": "2000-09-25T00:00:00-04:00",
          "attachments": null,
          "url": "https://www.courtlistener.com/docket/33882506/113/doan-mindy-v-watson-sheriff-leland/",
          "recap_pdf_url": null,
          "pacer_doc_id": null,
          "description": "ENTRY - Parties appear by counsel telephonically for pretrial conf. Conf held and concluded without further order other than that pltfs shall advise the court, in writing, within fourteen (14) days, whether there are other persons to whom notice should be sent who may be within the class as certified but to whom notice was not sent inasmuch as the booking was based upon a bench warrant, body attachment, or similar order to seizure which did not describe the underlying offense. VSS c/m mri eod 09/29/00 [MRI] (Entered: 09/29/2000)"
        },
        {
          "row_number": 16,
          "id": 3540662,
          "entry_number": "112",
          "date_filed": "2000-09-26T00:00:00-04:00",
          "attachments": null,
          "url": "https://www.courtlistener.com/docket/33882506/112/doan-mindy-v-watson-sheriff-leland/",
          "recap_pdf_url": null,
          "pacer_doc_id": null,
          "description": "ENTRY Denies Defts Motion for continuance of telephonic pretrial conf. (side entry). VSS eod 09/29/00 [MRI] (Entered: 09/29/2000)"
        },
        {
          "row_number": 18,
          "id": 3540663,
          "entry_number": "114",
          "date_filed": "2000-10-10T00:00:00-04:00",
          "attachments": null,
          "url": "https://www.courtlistener.com/docket/33882506/114/doan-mindy-v-watson-sheriff-leland/",
          "recap_pdf_url": null,
          "pacer_doc_id": null,
          "description": "REPORT to the Court per 9/25/00 Order, c/s - PLTFS eod 10/10/00 [KTK] (Entered: 10/10/2000)"
        },
        {
          "row_number": 19,
          "id": 3540664,
          "entry_number": "115",
          "date_filed": "2001-01-26T00:00:00-05:00",
          "attachments": null,
          "url": "https://www.courtlistener.com/docket/33882506/115/doan-mindy-v-watson-sheriff-leland/",
          "recap_pdf_url": null,
          "pacer_doc_id": null,
          "description": "ENTRY ASSIGNS CONF (TELEPHONIC) to 01/31/01 at 09:00AM Room 256 (VSS) c/m (Status Conf; Court to initiate call) eod 01/26/01 [KTK] (Entered: 01/26/2001)"
        },
        {
          "row_number": 21,
          "id": 3540666,
          "entry_number": "117",
          "date_filed": "2001-01-31T00:00:00-05:00",
          "attachments": null,
          "url": "https://www.courtlistener.com/docket/33882506/117/doan-mindy-v-watson-sheriff-leland/",
          "recap_pdf_url": null,
          "pacer_doc_id": null,
          "description": "ENTRY - Parties appear by counsel telephonically for status conf. Conf held and concluded during which it is agreed that within sixty (60) days defts will respond to the pltf's notice of mailing (116) (filed January 29, 2001) which will reference areas of agreement and disagreement as to inclusion within the defined class. VSS c/m eod 02/01/01 [MRI] (Entered: 02/01/2001)"
        },
        {
          "row_number": 23,
          "id": 3540668,
          "entry_number": "119",
          "date_filed": "2001-03-30T00:00:00-05:00",
          "attachments": null,
          "url": "https://www.courtlistener.com/docket/33882506/119/doan-mindy-v-watson-sheriff-leland/",
          "recap_pdf_url": null,
          "pacer_doc_id": null,
          "description": "MOTION FOR TIME TO respond to pltfs' notice of mailing to putative class members, cs/ - DEFTS eod 03/30/01 [KTK] (Entered: 03/30/2001)"
        },
        {
          "row_number": 25,
          "id": 3540669,
          "entry_number": "120",
          "date_filed": "2001-04-05T00:00:00-04:00",
          "attachments": null,
          "url": "https://www.courtlistener.com/docket/33882506/120/doan-mindy-v-watson-sheriff-leland/",
          "recap_pdf_url": null,
          "pacer_doc_id": null,
          "description": "MOTION TO COMPEL response to pltfs' notice of mailing, c/s PLTFS eod 04/05/01 [BJS] (Entered: 04/05/2001)"
        },
        {
          "row_number": 26,
          "id": 3540670,
          "entry_number": "121",
          "date_filed": "2001-04-05T00:00:00-04:00",
          "attachments": null,
          "url": "https://www.courtlistener.com/docket/33882506/121/doan-mindy-v-watson-sheriff-leland/",
          "recap_pdf_url": null,
          "pacer_doc_id": null,
          "description": "PTC ORDER FROM P/T ON 4/5/01 Status Conf: conf held; issue presented in pltfs' obj to defts' Mot to EX time to respond is resolved; & agreement to proceed to determine the proper composition of the class {S E} (119 & 120) (VSS), c/m eod 04/06/01 [KTK] (Entered: 04/06/2001)"
        },
        {
          "row_number": 27,
          "id": 3540671,
          "entry_number": "122",
          "date_filed": "2001-04-05T00:00:00-04:00",
          "attachments": null,
          "url": "https://www.courtlistener.com/docket/33882506/122/doan-mindy-v-watson-sheriff-leland/",
          "recap_pdf_url": null,
          "pacer_doc_id": null,
          "description": "ORDER GRANTS defts motion for time to respond to pltfs' Notice of mailing to putative Class Members for 30 days. cm SEB eod 04/06/01 [MAC] (Entered: 04/06/2001)"
        },
        {
          "row_number": 28,
          "id": 3540672,
          "entry_number": "123",
          "date_filed": "2001-04-16T00:00:00-04:00",
          "attachments": null,
          "url": "https://www.courtlistener.com/docket/33882506/123/doan-mindy-v-watson-sheriff-leland/",
          "recap_pdf_url": null,
          "pacer_doc_id": null,
          "description": "SUBMISSION of Counsel's Certificate of Compliance RE: copies of req for exclusion from class action; disc with copy of current individuals included in class; and key of abbreviations used in pltfs' list of class members, c/s PLTFS eod 04/16/01 [BJS] (Entered: 04/16/2001)"
        },
        {
          "row_number": 29,
          "id": 3540673,
          "entry_number": "124",
          "date_filed": "2001-05-15T00:00:00-04:00",
          "attachments": null,
          "url": "https://www.courtlistener.com/docket/33882506/124/doan-mindy-v-watson-sheriff-leland/",
          "recap_pdf_url": null,
          "pacer_doc_id": null,
          "description": "RESPONSE to pltfs' (Notice) Certificate of Mailing, c/s DEFTS eod 05/15/01 [BJS] (Entered: 05/15/2001)"
        },
        {
          "row_number": 30,
          "id": 3540674,
          "entry_number": "125",
          "date_filed": "2001-05-24T00:00:00-04:00",
          "attachments": null,
          "url": "https://www.courtlistener.com/docket/33882506/125/doan-mindy-v-watson-sheriff-leland/",
          "recap_pdf_url": null,
          "pacer_doc_id": null,
          "description": "MOTION FOR TIME TO Reply to defts' Response to Notice of Mailing, c/s - PLTFS eod 05/24/01 [KTK] (Entered: 05/24/2001)"
        },
        {
          "row_number": 32,
          "id": 3540676,
          "entry_number": "127",
          "date_filed": "2001-06-01T00:00:00-04:00",
          "attachments": null,
          "url": "https://www.courtlistener.com/docket/33882506/127/doan-mindy-v-watson-sheriff-leland/",
          "recap_pdf_url": null,
          "pacer_doc_id": null,
          "description": "REPLY to defts' Response to pltf's Certificate of Mailing & Req for Ruling, c/s PLTFS eod 06/01/01 [BJS] (Entered: 06/01/2001)"
        },
        {
          "row_number": 33,
          "id": 3540677,
          "entry_number": "128",
          "date_filed": "2001-06-04T00:00:00-04:00",
          "attachments": null,
          "url": "https://www.courtlistener.com/docket/33882506/128/doan-mindy-v-watson-sheriff-leland/",
          "recap_pdf_url": null,
          "pacer_doc_id": null,
          "description": "ORDER GRANTS defts motion for time to Reply to Notice of Mailing to 6/1/01. cm SEB eod 06/05/01 [MAC] (Entered: 06/05/2001)"
        },
        {
          "row_number": 34,
          "id": 3540678,
          "entry_number": "129",
          "date_filed": "2001-06-20T00:00:00-04:00",
          "attachments": null,
          "url": "https://www.courtlistener.com/docket/33882506/129/doan-mindy-v-watson-sheriff-leland/",
          "recap_pdf_url": null,
          "pacer_doc_id": null,
          "description": "MOTION FOR PTC (Status Conf), c/s DEFTS Watson & Hubbard eod 06/20/01 [BJS] (Entered: 06/20/2001)"
        },
        {
          "row_number": 36,
          "id": 3540679,
          "entry_number": "130",
          "date_filed": "2001-06-21T00:00:00-04:00",
          "attachments": null,
          "url": "https://www.courtlistener.com/docket/33882506/130/doan-mindy-v-watson-sheriff-leland/",
          "recap_pdf_url": null,
          "pacer_doc_id": null,
          "description": "ENTRY ASSIGNS CONF to 06/25/01 at 04:00PM Room 228 (VSS) c/m (status conf) eod 06/21/01 [SLL] (Entered: 06/21/2001)"
        },
        {
          "row_number": 38,
          "id": 3540681,
          "entry_number": "132",
          "date_filed": "2001-06-28T00:00:00-04:00",
          "attachments": null,
          "url": "https://www.courtlistener.com/docket/33882506/132/doan-mindy-v-watson-sheriff-leland/",
          "recap_pdf_url": null,
          "pacer_doc_id": null,
          "description": "ENTRY re: offenses to be included in previously approved class definition {S E} (VSS), c/m eod 06/28/01 [KTK] (Entered: 06/28/2001)"
        },
        {
          "row_number": 41,
          "id": 3540684,
          "entry_number": "135",
          "date_filed": "2001-09-26T00:00:00-04:00",
          "attachments": null,
          "url": "https://www.courtlistener.com/docket/33882506/135/doan-mindy-v-watson-sheriff-leland/",
          "recap_pdf_url": null,
          "pacer_doc_id": null,
          "description": "MOTION to End Class Member Challenges by Defts and Finalizing the Class, c/s PLTFS eod 09/26/01 [BJS] (Entered: 09/26/2001)"
        },
        {
          "row_number": 42,
          "id": 3540685,
          "entry_number": "136",
          "date_filed": "2001-09-28T00:00:00-04:00",
          "attachments": null,
          "url": "https://www.courtlistener.com/docket/33882506/136/doan-mindy-v-watson-sheriff-leland/",
          "recap_pdf_url": null,
          "pacer_doc_id": null,
          "description": "SUBMISSION of Supplemental Authority on SJ, c/s - DEFTS Watson & Hubbard eod 09/28/01 [KTK] (Entered: 09/28/2001)"
        },
        {
          "row_number": 43,
          "id": 3540686,
          "entry_number": "137",
          "date_filed": "2001-09-28T00:00:00-04:00",
          "attachments": null,
          "url": "https://www.courtlistener.com/docket/33882506/137/doan-mindy-v-watson-sheriff-leland/",
          "recap_pdf_url": null,
          "pacer_doc_id": null,
          "description": "MOTION FOR TIME TO Challenge members of the Putative Class, c/s DEFTS eod 09/28/01 [SLL] (Entered: 09/28/2001)"
        },
        {
          "row_number": 49,
          "id": 3540691,
          "entry_number": "142",
          "date_filed": "2001-10-24T00:00:00-04:00",
          "attachments": null,
          "url": "https://www.courtlistener.com/docket/33882506/142/doan-mindy-v-watson-sheriff-leland/",
          "recap_pdf_url": null,
          "pacer_doc_id": null,
          "description": "MOTION to ALTER or AMEND the Court's Order on Cross Mots for SJ, c/s - DEFTS eod 10/25/01 [KTK] (Entered: 10/25/2001)"
        },
        {
          "row_number": 51,
          "id": 3540693,
          "entry_number": "144",
          "date_filed": "2001-10-26T00:00:00-04:00",
          "attachments": null,
          "url": "https://www.courtlistener.com/docket/33882506/144/doan-mindy-v-watson-sheriff-leland/",
          "recap_pdf_url": null,
          "pacer_doc_id": null,
          "description": "ENTRY ASSIGNS CONF to 11/02/01 at 01:00PM Room 228 (VSS) c/m & by fax (Pre-Settlement Conf; only attnys need to attend) eod 10/26/01 [KTK] (Entered: 10/26/2001)"
        },
        {
          "row_number": 52,
          "id": 3540694,
          "entry_number": "146",
          "date_filed": "2001-11-02T00:00:00-05:00",
          "attachments": null,
          "url": "https://www.courtlistener.com/docket/33882506/146/doan-mindy-v-watson-sheriff-leland/",
          "recap_pdf_url": null,
          "pacer_doc_id": null,
          "description": "RESPONSE to defts' Mot to Alter or Amend, c/s - PLTFS eod 11/02/01 [KTK] (Entered: 11/02/2001)"
        },
        {
          "row_number": 53,
          "id": 3540695,
          "entry_number": "147",
          "date_filed": "2001-11-02T00:00:00-05:00",
          "attachments": null,
          "url": "https://www.courtlistener.com/docket/33882506/147/doan-mindy-v-watson-sheriff-leland/",
          "recap_pdf_url": null,
          "pacer_doc_id": null,
          "description": "MOTION TO STRIKE undesignated facts, c/s - PLTFS eod 11/02/01 [KTK] (Entered: 11/02/2001)"
        },
        {
          "row_number": 57,
          "id": 3540698,
          "entry_number": "150",
          "date_filed": "2001-11-02T00:00:00-05:00",
          "attachments": null,
          "url": "https://www.courtlistener.com/docket/33882506/150/doan-mindy-v-watson-sheriff-leland/",
          "recap_pdf_url": null,
          "pacer_doc_id": null,
          "description": "MOTION to exclude persons from class who were booked into the Floyd County Jail on warrants, c/s - DEFTS eod 11/02/01 [SLL] (Entered: 11/02/2001)"
        },
        {
          "row_number": 58,
          "id": 3540699,
          "entry_number": "151",
          "date_filed": "2001-11-02T00:00:00-05:00",
          "attachments": null,
          "url": "https://www.courtlistener.com/docket/33882506/151/doan-mindy-v-watson-sheriff-leland/",
          "recap_pdf_url": null,
          "pacer_doc_id": null,
          "description": "MEMORANDUM in support of their Mot to Exclude Members, c/s - DEFTS eod 11/02/01 [SLL] (Entered: 11/02/2001)"
        },
        {
          "row_number": 60,
          "id": 3540701,
          "entry_number": "153",
          "date_filed": "2001-11-29T00:00:00-05:00",
          "attachments": null,
          "url": "https://www.courtlistener.com/docket/33882506/153/doan-mindy-v-watson-sheriff-leland/",
          "recap_pdf_url": null,
          "pacer_doc_id": null,
          "description": "MOTION for PTC to establish trial format or finalize settlement, c/s - PLTFS eod 11/30/01 [KTK] (Entered: 11/30/2001)"
        },
        {
          "row_number": 61,
          "id": 3540702,
          "entry_number": "154",
          "date_filed": "2001-12-13T00:00:00-05:00",
          "attachments": null,
          "url": "https://www.courtlistener.com/docket/33882506/154/doan-mindy-v-watson-sheriff-leland/",
          "recap_pdf_url": null,
          "pacer_doc_id": null,
          "description": "MOTION IN LIMINE, c/s - PLTFS eod 12/13/01 [KTK] (Entered: 12/13/2001)"
        },
        {
          "row_number": 64,
          "id": 3540705,
          "entry_number": "157",
          "date_filed": "2002-01-14T00:00:00-05:00",
          "attachments": null,
          "url": "https://www.courtlistener.com/docket/33882506/157/doan-mindy-v-watson-sheriff-leland/",
          "recap_pdf_url": null,
          "pacer_doc_id": null,
          "description": "NOTICE OF CHANGE of Address of Cnsl Dave Whalin, LANDRUM & SHOUSE LLP, c/s DEFT eod 01/14/02 [BJS] (Entered: 01/14/2002)"
        },
        {
          "row_number": 65,
          "id": 3540706,
          "entry_number": "158",
          "date_filed": "2002-02-01T00:00:00-05:00",
          "attachments": null,
          "url": "https://www.courtlistener.com/docket/33882506/158/doan-mindy-v-watson-sheriff-leland/",
          "recap_pdf_url": null,
          "pacer_doc_id": null,
          "description": "ENTRY VACATES JURY TRIAL of 02/19/02 at 09:30AM Room 200 (SEB) c/m (to be reassigned as necessary upon the recommendation of the presiding Magistrate Judge) eod 02/04/02 [MAC] (Entered: 02/04/2002)"
        },
        {
          "row_number": 66,
          "id": 3540707,
          "entry_number": "159",
          "date_filed": "2002-02-28T00:00:00-05:00",
          "attachments": null,
          "url": "https://www.courtlistener.com/docket/33882506/159/doan-mindy-v-watson-sheriff-leland/",
          "recap_pdf_url": null,
          "pacer_doc_id": null,
          "description": "MOTION FOR SET TRIAL, c/s Pltf Brewer eod 02/28/02 [SLL] (Entered: 02/28/2002)"
        },
        {
          "row_number": 67,
          "id": 3540708,
          "entry_number": "160",
          "date_filed": "2002-04-01T00:00:00-05:00",
          "attachments": null,
          "url": "https://www.courtlistener.com/docket/33882506/160/doan-mindy-v-watson-sheriff-leland/",
          "recap_pdf_url": null,
          "pacer_doc_id": null,
          "description": "SECOND MOTION to Set Trial, c/s PLTFS eod 04/01/02 [BJS] (Entered: 04/01/2002)"
        },
        {
          "row_number": 68,
          "id": 3540709,
          "entry_number": "161",
          "date_filed": "2002-04-04T00:00:00-05:00",
          "attachments": null,
          "url": "https://www.courtlistener.com/docket/33882506/161/doan-mindy-v-watson-sheriff-leland/",
          "recap_pdf_url": null,
          "pacer_doc_id": null,
          "description": "ORDER ASSIGNS JURY TRIAL to 06/24/02 at 09:30AM Room 200 (SEB) c/m eod 04/09/02 [BJS] (Entered: 04/09/2002)"
        },
        {
          "row_number": 69,
          "id": 3540710,
          "entry_number": "162",
          "date_filed": "2002-04-10T00:00:00-04:00",
          "attachments": null,
          "url": "https://www.courtlistener.com/docket/33882506/162/doan-mindy-v-watson-sheriff-leland/",
          "recap_pdf_url": null,
          "pacer_doc_id": null,
          "description": "MOTION for appointment of a Special Master to conduct jury trials of class damagegs claims, c/s - PLTFS eod 04/10/02 [KTK] (Entered: 04/10/2002)"
        },
        {
          "row_number": 70,
          "id": 3540711,
          "entry_number": "163",
          "date_filed": "2002-04-23T00:00:00-04:00",
          "attachments": null,
          "url": "https://www.courtlistener.com/docket/33882506/163/doan-mindy-v-watson-sheriff-leland/",
          "recap_pdf_url": null,
          "pacer_doc_id": null,
          "description": "MOTION FOR CONT OF SCHEDULED 6/24/02 JT, c/s - DEFT Watson eod 04/23/02 [KTK] (Entered: 04/23/2002)"
        },
        {
          "row_number": 71,
          "id": 3540712,
          "entry_number": "164",
          "date_filed": "2002-04-25T00:00:00-04:00",
          "attachments": null,
          "url": "https://www.courtlistener.com/docket/33882506/164/doan-mindy-v-watson-sheriff-leland/",
          "recap_pdf_url": null,
          "pacer_doc_id": null,
          "description": "MOTION Objecting to Continuance & Requesting Affidavit, c/s PLTFS eod 04/25/02 [SLL] (Entered: 04/25/2002)"
        },
        {
          "row_number": 72,
          "id": 3540713,
          "entry_number": "165",
          "date_filed": "2002-05-02T00:00:00-04:00",
          "attachments": null,
          "url": "https://www.courtlistener.com/docket/33882506/165/doan-mindy-v-watson-sheriff-leland/",
          "recap_pdf_url": null,
          "pacer_doc_id": null,
          "description": "MOTION IN LIMINE for a Partial Directed Verdict, c/s PLTFS eod 05/02/02 [SLL] (Entered: 05/02/2002)"
        },
        {
          "row_number": 73,
          "id": 3540714,
          "entry_number": "166",
          "date_filed": "2002-05-02T00:00:00-04:00",
          "attachments": null,
          "url": "https://www.courtlistener.com/docket/33882506/166/doan-mindy-v-watson-sheriff-leland/",
          "recap_pdf_url": null,
          "pacer_doc_id": null,
          "description": "MOTION TO ESTABLISH TRIAL PROCEDURE & set Pretrial Deadlines, c/s PLTFS eod 05/02/02 [SLL] (Entered: 05/02/2002)"
        },
        {
          "row_number": 75,
          "id": 3540717,
          "entry_number": "168",
          "date_filed": "2002-05-08T00:00:00-04:00",
          "attachments": null,
          "url": "https://www.courtlistener.com/docket/33882506/168/doan-mindy-v-watson-sheriff-leland/",
          "recap_pdf_url": null,
          "pacer_doc_id": null,
          "description": "MOTION IN LIMINE to bar rule 404(b) evidence & to require defts to disclose, before trial, of intention to introduce Rule 404 or 609 evidence, c/s - PLTFS eod 05/08/02 [KTK] (Entered: 05/08/2002)"
        },
        {
          "row_number": 76,
          "id": 3540718,
          "entry_number": "169",
          "date_filed": "2002-05-08T00:00:00-04:00",
          "attachments": null,
          "url": "https://www.courtlistener.com/docket/33882506/169/doan-mindy-v-watson-sheriff-leland/",
          "recap_pdf_url": null,
          "pacer_doc_id": null,
          "description": "MOTION IN LIMINE barring any argument that any award of damages should be related to the fact that pltfs had been arrested, & for Specific Jury Instructions on this issue, c/s - PLTFS eod 05/08/02 [KTK] (Entered: 05/08/2002)"
        },
        {
          "row_number": 81,
          "id": 3540721,
          "entry_number": "173",
          "date_filed": "2002-05-13T00:00:00-04:00",
          "attachments": null,
          "url": "https://www.courtlistener.com/docket/33882506/173/doan-mindy-v-watson-sheriff-leland/",
          "recap_pdf_url": null,
          "pacer_doc_id": null,
          "description": "RESPONSE to pltfs' Motion in Limine for Jury View and for Preservation of Evidence c/s - DEFTS eod 05/14/02 [MAC] (Entered: 05/14/2002)"
        },
        {
          "row_number": 83,
          "id": 3540723,
          "entry_number": "175",
          "date_filed": "2002-05-13T00:00:00-04:00",
          "attachments": null,
          "url": "https://www.courtlistener.com/docket/33882506/175/doan-mindy-v-watson-sheriff-leland/",
          "recap_pdf_url": null,
          "pacer_doc_id": null,
          "description": "OBJECTION to pltfs' Motion to Appoint a Special Master to Conduct Jury Trials of Class Damages Claims c/s - DEFTS eod 05/14/02 [MAC] (Entered: 05/14/2002)"
        },
        {
          "row_number": 84,
          "id": 3540724,
          "entry_number": "176",
          "date_filed": "2002-05-13T00:00:00-04:00",
          "attachments": null,
          "url": "https://www.courtlistener.com/docket/33882506/176/doan-mindy-v-watson-sheriff-leland/",
          "recap_pdf_url": null,
          "pacer_doc_id": null,
          "description": "RESPONSE to pltfs' Motion in Limine to Bar any Evidence of the Crimes for which the pltfs were arrested if they were previously or subsequently arrested for a Crime that did allow a strip search, but were not convicted of a felony, and for a specific Jury Instruction on this issue c/s - DEFTS eod 05/14/02 [MAC] (Entered: 05/14/2002)"
        },
        {
          "row_number": 85,
          "id": 3540725,
          "entry_number": "177",
          "date_filed": "2002-05-13T00:00:00-04:00",
          "attachments": null,
          "url": "https://www.courtlistener.com/docket/33882506/177/doan-mindy-v-watson-sheriff-leland/",
          "recap_pdf_url": null,
          "pacer_doc_id": null,
          "description": "RESPONSE to pltfs' Motion for Partial Directed Verdict to Award each Class Member a minimum of five thousand dollars for presumed damages c/s - DEFTS eod 05/14/02 [MAC] (Entered: 05/14/2002)"
        },
        {
          "row_number": 86,
          "id": 3540726,
          "entry_number": "178",
          "date_filed": "2002-05-13T00:00:00-04:00",
          "attachments": null,
          "url": "https://www.courtlistener.com/docket/33882506/178/doan-mindy-v-watson-sheriff-leland/",
          "recap_pdf_url": null,
          "pacer_doc_id": null,
          "description": "RESPONSE to pltfs' Motion in Limine to prevent defts from referring to the strip searches by other euphemisms c/s - DEFTS eod 05/14/02 [MAC] (Entered: 05/14/2002)"
        },
        {
          "row_number": 89,
          "id": 3540728,
          "entry_number": "180",
          "date_filed": "2002-05-13T00:00:00-04:00",
          "attachments": null,
          "url": "https://www.courtlistener.com/docket/33882506/180/doan-mindy-v-watson-sheriff-leland/",
          "recap_pdf_url": null,
          "pacer_doc_id": null,
          "description": "RESPONSE to pltfs' Motion in Limine to Bar Rule 404(b) Evidence and to require defts to disclose, before trial, of intention to introduce Rule 404 or 609 Evidence c/s - DEFTS eod 05/14/02 [MAC] (Entered: 05/14/2002)"
        },
        {
          "row_number": 90,
          "id": 3540729,
          "entry_number": "181",
          "date_filed": "2002-05-13T00:00:00-04:00",
          "attachments": null,
          "url": "https://www.courtlistener.com/docket/33882506/181/doan-mindy-v-watson-sheriff-leland/",
          "recap_pdf_url": null,
          "pacer_doc_id": null,
          "description": "RESPONSE to pltfs' Motion in Limine to prevent defts from arguing at trial that it was proper to search any of the individual pltfs that makes up the Class c/s - DEFTS eod 05/14/02 [MAC] (Entered: 05/14/2002)"
        },
        {
          "row_number": 91,
          "id": 3540730,
          "entry_number": "182",
          "date_filed": "2002-05-13T00:00:00-04:00",
          "attachments": null,
          "url": "https://www.courtlistener.com/docket/33882506/182/doan-mindy-v-watson-sheriff-leland/",
          "recap_pdf_url": null,
          "pacer_doc_id": null,
          "description": "ENTRY DENIES defts' Motion to Alter or Amend Court's Order on Cross Motions for S/J. (S.E.) cm SEB eod 05/14/02 [MAC] (Entered: 05/14/2002)"
        },
        {
          "row_number": 92,
          "id": 3540731,
          "entry_number": "183",
          "date_filed": "2002-05-13T00:00:00-04:00",
          "attachments": null,
          "url": "https://www.courtlistener.com/docket/33882506/183/doan-mindy-v-watson-sheriff-leland/",
          "recap_pdf_url": null,
          "pacer_doc_id": null,
          "description": "ENTRY Vacates all deadlines previously established and Denies as Moot any pending Motion. Counsel are directed to proceed to finalize their agreement to resolve these claims and to file the appropriate class certification and dismissal documents with the Clerk of the Court as expeditiously as possible. cm SEB eod 05/14/02 [MAC] (Entered: 05/14/2002)"
        },
        {
          "row_number": 93,
          "id": 3540732,
          "entry_number": "184",
          "date_filed": "2002-06-03T00:00:00-04:00",
          "attachments": null,
          "url": "https://www.courtlistener.com/docket/33882506/184/doan-mindy-v-watson-sheriff-leland/",
          "recap_pdf_url": null,
          "pacer_doc_id": null,
          "description": "NOTICE of proposed Notice of Class Action Settlement, c/s - PLTFS eod 06/03/02 [KTK] (Entered: 06/03/2002)"
        },
        {
          "row_number": 94,
          "id": 3540733,
          "entry_number": "185",
          "date_filed": "2002-06-18T00:00:00-04:00",
          "attachments": null,
          "url": "https://www.courtlistener.com/docket/33882506/185/doan-mindy-v-watson-sheriff-leland/",
          "recap_pdf_url": null,
          "pacer_doc_id": null,
          "description": "RESPONSE to tendered proposed Notice of Class Action Settlement, c/s DEFTS eod 06/18/02 [BJS] (Entered: 06/18/2002)"
        },
        {
          "row_number": 95,
          "id": 3540734,
          "entry_number": "186",
          "date_filed": "2002-06-24T00:00:00-04:00",
          "attachments": null,
          "url": "https://www.courtlistener.com/docket/33882506/186/doan-mindy-v-watson-sheriff-leland/",
          "recap_pdf_url": null,
          "pacer_doc_id": null,
          "description": "PLTFS REPLY w/Amended Notice of Class Settlement, c/s PLTFS eod 06/24/02 [SLL] (Entered: 06/24/2002)"
        },
        {
          "row_number": 96,
          "id": 3540735,
          "entry_number": "187",
          "date_filed": "2002-06-24T00:00:00-04:00",
          "attachments": null,
          "url": "https://www.courtlistener.com/docket/33882506/187/doan-mindy-v-watson-sheriff-leland/",
          "recap_pdf_url": null,
          "pacer_doc_id": null,
          "description": "NOTICE of CLASS ACTION SETTLEMENT w/Order attached, c/s PLTFS eod 06/24/02 [SLL] (Entered: 06/24/2002)"
        },
        {
          "row_number": 97,
          "id": 3540736,
          "entry_number": "188",
          "date_filed": "2002-07-05T00:00:00-04:00",
          "attachments": null,
          "url": "https://www.courtlistener.com/docket/33882506/188/doan-mindy-v-watson-sheriff-leland/",
          "recap_pdf_url": null,
          "pacer_doc_id": null,
          "description": "ADD'L REPLY to deft's Response to tendered proposed notice of class action settlement, c/s - PLTF eod 07/05/02 [KTK] (Entered: 07/05/2002)"
        },
        {
          "row_number": 98,
          "id": 3540737,
          "entry_number": "189",
          "date_filed": "2002-07-16T00:00:00-04:00",
          "attachments": null,
          "url": "https://www.courtlistener.com/docket/33882506/189/doan-mindy-v-watson-sheriff-leland/",
          "recap_pdf_url": null,
          "pacer_doc_id": null,
          "description": "SUBMISSION of Tender of Notice of Class Action Settlement, c/s PLTFS eod 07/16/02 [BJS] (Entered: 07/16/2002)"
        },
        {
          "row_number": 100,
          "id": 3540738,
          "entry_number": "190",
          "date_filed": "2002-07-16T00:00:00-04:00",
          "attachments": null,
          "url": "https://www.courtlistener.com/docket/33882506/190/doan-mindy-v-watson-sheriff-leland/",
          "recap_pdf_url": null,
          "pacer_doc_id": null,
          "description": "MOTION to exclude persons listed on pltfs' most recent class list & agreement on remaining names on list, c/s eod 07/16/02 [KTK] (Entered: 07/16/2002)"
        },
        {
          "row_number": 101,
          "id": 3540739,
          "entry_number": "191",
          "date_filed": "2002-07-23T00:00:00-04:00",
          "attachments": null,
          "url": "https://www.courtlistener.com/docket/33882506/191/doan-mindy-v-watson-sheriff-leland/",
          "recap_pdf_url": null,
          "pacer_doc_id": null,
          "description": "RESPONSE to pltfs' Tendered Notice of Class Action Settlement, c/s DEFTS eod 07/23/02 [BJS] (Entered: 07/23/2002)"
        },
        {
          "row_number": 102,
          "id": 3540740,
          "entry_number": "192",
          "date_filed": "2002-07-23T00:00:00-04:00",
          "attachments": null,
          "url": "https://www.courtlistener.com/docket/33882506/192/doan-mindy-v-watson-sheriff-leland/",
          "recap_pdf_url": null,
          "pacer_doc_id": null,
          "description": "RESPONSE to defts' Motion to Exclude, c/s PLTFS eod 07/23/02 [BJS] (Entered: 07/23/2002)"
        },
        {
          "row_number": 103,
          "id": 3540741,
          "entry_number": "193",
          "date_filed": "2002-07-30T00:00:00-04:00",
          "attachments": null,
          "url": "https://www.courtlistener.com/docket/33882506/193/doan-mindy-v-watson-sheriff-leland/",
          "recap_pdf_url": null,
          "pacer_doc_id": null,
          "description": "REPLY in Support of Mailing of Tend Notice, c/s PLTF eod 07/30/02 [SLL] (Entered: 07/30/2002)"
        },
        {
          "row_number": 105,
          "id": 3540743,
          "entry_number": "195",
          "date_filed": "2002-09-20T00:00:00-04:00",
          "attachments": null,
          "url": "https://www.courtlistener.com/docket/33882506/195/doan-mindy-v-watson-sheriff-leland/",
          "recap_pdf_url": null,
          "pacer_doc_id": null,
          "description": "MOTION TO EXCLUDE Persons who have returned Executed releases, c/s DEFTS eod 09/20/02 [SLL] (Entered: 09/20/2002)"
        },
        {
          "row_number": 106,
          "id": 3540744,
          "entry_number": "196",
          "date_filed": "2002-10-01T00:00:00-04:00",
          "attachments": null,
          "url": "https://www.courtlistener.com/docket/33882506/196/doan-mindy-v-watson-sheriff-leland/",
          "recap_pdf_url": null,
          "pacer_doc_id": null,
          "description": "REQUEST for hearing on Mot to Exclude, c/s PLTFS eod 10/01/02 [KTK] (Entered: 10/01/2002)"
        },
        {
          "row_number": 107,
          "id": 3540745,
          "entry_number": "197",
          "date_filed": "2002-10-18T00:00:00-04:00",
          "attachments": null,
          "url": "https://www.courtlistener.com/docket/33882506/197/doan-mindy-v-watson-sheriff-leland/",
          "recap_pdf_url": null,
          "pacer_doc_id": null,
          "description": "REPLY to pltfs' Response to Mot to Exclude Persons, c/s DEFTS eod 10/18/02 [BJS] (Entered: 10/18/2002)"
        },
        {
          "row_number": 108,
          "id": 3540746,
          "entry_number": "198",
          "date_filed": "2002-11-01T00:00:00-05:00",
          "attachments": null,
          "url": "https://www.courtlistener.com/docket/33882506/198/doan-mindy-v-watson-sheriff-leland/",
          "recap_pdf_url": null,
          "pacer_doc_id": null,
          "description": "ENTRY (AGREED) regarding defts' Motion to Exclude pltfs who returned executed releases {SE} (195) (SEB), c/m eod 11/05/02 [BJS] (Entered: 11/05/2002)"
        },
        {
          "row_number": 109,
          "id": 3540747,
          "entry_number": "199",
          "date_filed": "2002-11-07T00:00:00-05:00",
          "attachments": null,
          "url": "https://www.courtlistener.com/docket/33882506/199/doan-mindy-v-watson-sheriff-leland/",
          "recap_pdf_url": null,
          "pacer_doc_id": null,
          "description": "MOTION TO SCHEDULE A FAIRNESS HEARING, c/s PLTFS eod 11/07/02 [SLL] (Entered: 11/07/2002)"
        },
        {
          "row_number": 112,
          "id": 3540748,
          "entry_number": "200",
          "date_filed": "2002-11-14T00:00:00-05:00",
          "attachments": null,
          "url": "https://www.courtlistener.com/docket/33882506/200/doan-mindy-v-watson-sheriff-leland/",
          "recap_pdf_url": null,
          "pacer_doc_id": null,
          "description": "ORDER ASSIGNS HEARING to 12/04/02 at 10:00AM Room 216 (SEB) c/m (Fairness Hearing at Indianapolis) eod 11/20/02 [MAC] (Entered: 11/20/2002)"
        },
        {
          "row_number": 113,
          "id": 3540749,
          "entry_number": "201",
          "date_filed": "2002-11-27T00:00:00-05:00",
          "attachments": null,
          "url": "https://www.courtlistener.com/docket/33882506/201/doan-mindy-v-watson-sheriff-leland/",
          "recap_pdf_url": null,
          "pacer_doc_id": null,
          "description": "NOTICE OF FILING Settlement Proceeds with the Court, c/s - DEFTS eod 11/27/02 [KTK] (Entered: 11/27/2002)"
        },
        {
          "row_number": 116,
          "id": 3540751,
          "entry_number": "204",
          "date_filed": "2002-12-04T00:00:00-05:00",
          "attachments": null,
          "url": "https://www.courtlistener.com/docket/33882506/204/doan-mindy-v-watson-sheriff-leland/",
          "recap_pdf_url": null,
          "pacer_doc_id": null,
          "description": "COURTROOM MINUTES for Fairness Hearing {S E} (SEB), c/m eod 12/10/02 [KTK] (Entered: 12/10/2002)"
        },
        {
          "row_number": 117,
          "id": 3540752,
          "entry_number": "205",
          "date_filed": "2002-12-04T00:00:00-05:00",
          "attachments": null,
          "url": "https://www.courtlistener.com/docket/33882506/205/doan-mindy-v-watson-sheriff-leland/",
          "recap_pdf_url": null,
          "pacer_doc_id": null,
          "description": "OBV 53 PG 121 eod 12/10/02 [KTK] (Entered: 12/10/2002)"
        },
        {
          "row_number": 115,
          "id": 3540753,
          "entry_number": "203",
          "date_filed": "2002-12-05T00:00:00-05:00",
          "attachments": null,
          "url": "https://www.courtlistener.com/docket/33882506/203/doan-mindy-v-watson-sheriff-leland/",
          "recap_pdf_url": null,
          "pacer_doc_id": null,
          "description": "MOTION TO RELEASE SETTLEMENT PROCEEDS Funds to cnsl for PLTFS, c/s PLTF eod 12/05/02 [SLL] (Entered: 12/05/2002)"
        },
        {
          "row_number": 118,
          "id": 3540754,
          "entry_number": "206",
          "date_filed": "2002-12-09T00:00:00-05:00",
          "attachments": null,
          "url": "https://www.courtlistener.com/docket/33882506/206/doan-mindy-v-watson-sheriff-leland/",
          "recap_pdf_url": null,
          "pacer_doc_id": null,
          "description": "ORDER directing Clerk to forward settlement proceeds to counsel for pltfs {S E} (203) (SEB), c/m eod 12/11/02 [KTK] (Entered: 12/11/2002)"
        },
        {
          "row_number": 119,
          "id": 3540755,
          "entry_number": "207",
          "date_filed": "2002-12-13T00:00:00-05:00",
          "attachments": null,
          "url": "https://www.courtlistener.com/docket/33882506/207/doan-mindy-v-watson-sheriff-leland/",
          "recap_pdf_url": null,
          "pacer_doc_id": null,
          "description": "PETITION TO INCLUDE Raymond Hayes in Class, c/s PLTF eod 12/13/02 [SLL] (Entered: 12/13/2002)"
        },
        {
          "row_number": 120,
          "id": 3540756,
          "entry_number": "208",
          "date_filed": "2003-01-06T00:00:00-05:00",
          "attachments": null,
          "url": "https://www.courtlistener.com/docket/33882506/208/doan-mindy-v-watson-sheriff-leland/",
          "recap_pdf_url": null,
          "pacer_doc_id": null,
          "description": "RESPONSE to pltfs' Petition to include Raymond Hayes in the Class, c/s - DEFTS eod 01/06/03 [KTK] (Entered: 01/06/2003)"
        },
        {
          "row_number": 121,
          "id": 3540757,
          "entry_number": "209",
          "date_filed": "2003-01-07T00:00:00-05:00",
          "attachments": null,
          "url": "https://www.courtlistener.com/docket/33882506/209/doan-mindy-v-watson-sheriff-leland/",
          "recap_pdf_url": null,
          "pacer_doc_id": null,
          "description": "NOTICE OF FILING Settlement Proceeds for late-filing claimants, c/s - DEFTS eod 01/07/03 [KTK] (Entered: 01/07/2003)"
        },
        {
          "row_number": 123,
          "id": 3540758,
          "entry_number": "210",
          "date_filed": "2003-01-07T00:00:00-05:00",
          "attachments": null,
          "url": "https://www.courtlistener.com/docket/33882506/210/doan-mindy-v-watson-sheriff-leland/",
          "recap_pdf_url": null,
          "pacer_doc_id": null,
          "description": "RECEIPT #401-265, $9,000.00; #401-266, $16,000.00; and #401-267, $3,000.00 - Settlement Proceeds from Scottsdale Insurance Co. eod 01/07/03 [KTK] (Entered: 01/07/2003)"
        },
        {
          "row_number": 124,
          "id": 3540759,
          "entry_number": "211",
          "date_filed": "2003-01-14T00:00:00-05:00",
          "attachments": null,
          "url": "https://www.courtlistener.com/docket/33882506/211/doan-mindy-v-watson-sheriff-leland/",
          "recap_pdf_url": null,
          "pacer_doc_id": null,
          "description": "REPLY to deft's Response to Petition to Include Raymond Hayes in the Class, c/s PLTF eod 01/14/03 [BJS] (Entered: 01/14/2003)"
        },
        {
          "row_number": 125,
          "id": 3540760,
          "entry_number": "212",
          "date_filed": "2003-01-14T00:00:00-05:00",
          "attachments": null,
          "url": "https://www.courtlistener.com/docket/33882506/212/doan-mindy-v-watson-sheriff-leland/",
          "recap_pdf_url": null,
          "pacer_doc_id": null,
          "description": "MOTION (PRAECIPE) for transcript of Telephonic Conference of 12/11/02, c/s PLTF eod 01/14/03 [BJS] (Entered: 01/14/2003)"
        },
        {
          "row_number": 126,
          "id": 3540761,
          "entry_number": "213",
          "date_filed": "2003-01-15T00:00:00-05:00",
          "attachments": null,
          "url": "https://www.courtlistener.com/docket/33882506/213/doan-mindy-v-watson-sheriff-leland/",
          "recap_pdf_url": null,
          "pacer_doc_id": null,
          "description": "MOTION for accounting, c/s - DEFTS eod 01/15/03 [KTK] (Entered: 01/15/2003)"
        },
        {
          "row_number": 128,
          "id": 3540763,
          "entry_number": "215",
          "date_filed": "2003-01-17T00:00:00-05:00",
          "attachments": null,
          "url": "https://www.courtlistener.com/docket/33882506/215/doan-mindy-v-watson-sheriff-leland/",
          "recap_pdf_url": null,
          "pacer_doc_id": null,
          "description": "MOTION to Release Settlement Proceeds Funds to counsel for pltfs, c/s - PLTFS eod 01/17/03 [KTK] (Entered: 01/17/2003)"
        },
        {
          "row_number": 129,
          "id": 3540764,
          "entry_number": "216",
          "date_filed": "2003-02-10T00:00:00-05:00",
          "attachments": null,
          "url": "https://www.courtlistener.com/docket/33882506/216/doan-mindy-v-watson-sheriff-leland/",
          "recap_pdf_url": null,
          "pacer_doc_id": null,
          "description": "ENTRY - to the extent that the Court has forwarded pltfs' request for transcript of the telephonic conference of 12/11/02, to the Court Reporter present at that conf, the pltfs' praecipe of that conf is granted. Within 15 days of the filing of that transcript, pltfs may supplement their petition to include Raymond Hayes in class. Defts may respond 15 days from the filing of the supplement. cm SEB eod 02/10/03 [MAC] (Entered: 02/10/2003)"
        },
        {
          "row_number": 130,
          "id": 3540765,
          "entry_number": "217",
          "date_filed": "2003-02-20T00:00:00-05:00",
          "attachments": null,
          "url": "https://www.courtlistener.com/docket/33882506/217/doan-mindy-v-watson-sheriff-leland/",
          "recap_pdf_url": null,
          "pacer_doc_id": null,
          "description": "ORDER GRANTING defts' Mot for Accounting of Settlement Proceeds by 3/7/03 {S E} (213) (SEB), c/m eod 02/24/03 [KTK] (Entered: 02/24/2003)"
        },
        {
          "row_number": 131,
          "id": 3540766,
          "entry_number": "218",
          "date_filed": "2003-02-20T00:00:00-05:00",
          "attachments": null,
          "url": "https://www.courtlistener.com/docket/33882506/218/doan-mindy-v-watson-sheriff-leland/",
          "recap_pdf_url": null,
          "pacer_doc_id": null,
          "description": "ORDER Directing Clerk to forward settlement proceeds, $28,000.00, to counsel for pltfs {S E} (215) (SEB), c/m eod 02/24/03 [KTK] (Entered: 02/24/2003)"
        },
        {
          "row_number": 132,
          "id": 3540767,
          "entry_number": "219",
          "date_filed": "2003-03-03T00:00:00-05:00",
          "attachments": null,
          "url": "https://www.courtlistener.com/docket/33882506/219/doan-mindy-v-watson-sheriff-leland/",
          "recap_pdf_url": null,
          "pacer_doc_id": null,
          "description": "CT REPORTER'S TRANSCRIPT of Telephone Conference of 12/11/02 - One Volume eod 03/03/03 [MAC] (Entered: 03/03/2003)"
        },
        {
          "row_number": 134,
          "id": 3540768,
          "entry_number": "220",
          "date_filed": "2003-03-05T00:00:00-05:00",
          "attachments": null,
          "url": "https://www.courtlistener.com/docket/33882506/220/doan-mindy-v-watson-sheriff-leland/",
          "recap_pdf_url": null,
          "pacer_doc_id": null,
          "description": "NOTICE of Accounting of Settlement Proceeds, c/s PLTF eod 03/05/03 [BJS] (Entered: 03/05/2003)"
        },
        {
          "row_number": 135,
          "id": 3540769,
          "entry_number": "221",
          "date_filed": "2003-04-17T00:00:00-04:00",
          "attachments": null,
          "url": "https://www.courtlistener.com/docket/33882506/221/doan-mindy-v-watson-sheriff-leland/",
          "recap_pdf_url": null,
          "pacer_doc_id": null,
          "description": "CLOSED Dismissed Settled with prejudice (SEB), c/m eod 04/21/03 [BJS] (Entered: 04/21/2003)"
        },
        {
          "row_number": 136,
          "id": 3540770,
          "entry_number": "222",
          "date_filed": "2006-03-15T00:00:00-05:00",
          "attachments": null,
          "url": "https://www.courtlistener.com/docket/33882506/222/doan-mindy-v-watson-sheriff-leland/",
          "recap_pdf_url": null,
          "pacer_doc_id": null,
          "description": "LETTER sent to Richard Mullineaux regarding return of exhibits/attachments to Doc. #151. eod 03/15/06 [JLM] (Entered: 03/15/2006)"
        },
        {
          "row_number": 137,
          "id": 3540771,
          "entry_number": "223",
          "date_filed": "2006-09-27T00:00:00-04:00",
          "attachments": null,
          "url": "https://www.courtlistener.com/docket/33882506/223/doan-mindy-v-watson-sheriff-leland/",
          "recap_pdf_url": null,
          "pacer_doc_id": null,
          "description": "NOTICE - Exhibits/attachments to Doc #151 destroyed per email from Richard Mullineaux. eod 09/27/06 [JLM] (Entered: 09/27/2006)"
        },
        {
          "row_number": 138,
          "id": 10196713,
          "entry_number": "224",
          "date_filed": "2008-04-11T00:00:00-04:00",
          "attachments": null,
          "url": "https://www.courtlistener.com/docket/33882506/224/doan-mindy-v-watson-sheriff-leland/",
          "recap_pdf_url": null,
          "pacer_doc_id": null,
          "description": "FRC shipped on 03/26/08; Accession # 021-08-107; Location # 88906 B A N; Box 1 of 17, Vol 1 and Vol 2 and, Location # 88908 B A N; Box 2 of 17, Vol 3, Vol 4 and Vol 5. eod 05/15/08 [KTK] (Entered: 05/15/2008)"
        },
        {
          "row_number": 167,
          "id": 3540598,
          "entry_number": "49",
          "date_filed": "1999-06-15T00:00:00-04:00",
          "attachments": [],
          "url": "https://www.courtlistener.com/docket/33882506/49/doan-mindy-v-watson-sheriff-leland/",
          "recap_pdf_url": null,
          "pacer_doc_id": null,
          "description": "JOINT MOTION for oral argument on the issue of class certification, c/s DEFTS eod 06/15/99 [KTK] (Entered: 06/15/1999)"
        },
        {
          "row_number": 104,
          "id": 3540742,
          "entry_number": "194",
          "date_filed": "2002-08-02T00:00:00-04:00",
          "attachments": null,
          "url": "https://www.courtlistener.com/docket/33882506/194/doan-mindy-v-watson-sheriff-leland/",
          "recap_pdf_url": null,
          "pacer_doc_id": null,
          "description": "ORDER re: sending out Notice of Class Action; all potential claimants response due 9/1/02; defts counsel to receive copies of all responses by 9/5/02; w/deadlines {S E} (SEB), c/m eod 08/08/02 [KTK] (Entered: 08/08/2002)"
        },
        {
          "row_number": 10,
          "id": 3540656,
          "entry_number": "107",
          "date_filed": "2000-09-01T00:00:00-04:00",
          "attachments": null,
          "url": "https://www.courtlistener.com/docket/33882506/107/doan-mindy-v-watson-sheriff-leland/",
          "recap_pdf_url": null,
          "pacer_doc_id": null,
          "description": "RESPONSE to pltfs' Mot for Pretrial to redefine definition of class, c/s - DEFTS Watson & Hubbard eod 09/01/00 [KTK] (Entered: 09/01/2000)"
        },
        {
          "row_number": 14,
          "id": 3540659,
          "entry_number": "110",
          "date_filed": "2000-09-11T00:00:00-04:00",
          "attachments": null,
          "url": "https://www.courtlistener.com/docket/33882506/110/doan-mindy-v-watson-sheriff-leland/",
          "recap_pdf_url": null,
          "pacer_doc_id": null,
          "description": "RESPONSE to pltfs' Mot for Pretrial to refine definition of class, c/s DEFT Hubbard eod 09/11/00 [BJS] (Entered: 09/11/2000)"
        },
        {
          "row_number": 20,
          "id": 3540665,
          "entry_number": "116",
          "date_filed": "2001-01-29T00:00:00-05:00",
          "attachments": null,
          "url": "https://www.courtlistener.com/docket/33882506/116/doan-mindy-v-watson-sheriff-leland/",
          "recap_pdf_url": null,
          "pacer_doc_id": null,
          "description": "NOTICE of counsel's certificate of mailing EX A, Notice of Class Action & pltf's EX B, c/s - PLTF's counsel eod 01/29/01 [KTK] (Entered: 01/29/2001)"
        },
        {
          "row_number": 190,
          "id": 3540556,
          "entry_number": "7",
          "date_filed": "1999-01-14T00:00:00-05:00",
          "attachments": [],
          "url": "https://www.courtlistener.com/docket/33882506/7/doan-mindy-v-watson-sheriff-leland/",
          "recap_pdf_url": null,
          "pacer_doc_id": null,
          "description": "MOTION FOR PRELIM INJ (Petition for Preliminary, Emergency Injunction) by pltfs, c/s eod 01/14/99 [BJS] (Entered: 01/14/1999)"
        },
        {
          "row_number": 77,
          "id": 3540565,
          "entry_number": "17",
          "date_filed": "1999-02-09T00:00:00-05:00",
          "attachments": [],
          "url": "https://www.courtlistener.com/docket/33882506/17/doan-mindy-v-watson-sheriff-leland/",
          "recap_pdf_url": null,
          "pacer_doc_id": null,
          "description": "MOTION FOR S/J by pltfs, c/s eod 02/09/99 [KTK] (Entered: 02/09/1999)"
        },
        {
          "row_number": 143,
          "id": 3540576,
          "entry_number": "27",
          "date_filed": "1999-03-10T00:00:00-05:00",
          "attachments": [],
          "url": "https://www.courtlistener.com/docket/33882506/27/doan-mindy-v-watson-sheriff-leland/",
          "recap_pdf_url": null,
          "pacer_doc_id": null,
          "description": "ADDENDUM (2nd) to pltfs' SJ MOT, c/s eod 03/10/99 [KTK] (Entered: 03/10/1999)"
        },
        {
          "row_number": 149,
          "id": 3540581,
          "entry_number": "32",
          "date_filed": "1999-03-24T00:00:00-05:00",
          "attachments": [],
          "url": "https://www.courtlistener.com/docket/33882506/32/doan-mindy-v-watson-sheriff-leland/",
          "recap_pdf_url": null,
          "pacer_doc_id": null,
          "description": "ORDER w/dates as to filing AM Complt & Answers; pltfs w/d pending SJ, Pet for Class Certification, & all pending discovery requests; pltfs new SJ & Pet for Class Certification due 3/31/99 w/defts Resps due 6/1/99 & 4/30/99; CMP due 30 days after Court rules on Class Certification issue; & TR assigned for 3/13/2000 {S E} (VSS), c/m eod 03/25/99 [KTK] (Entered: 03/25/1999)"
        },
        {
          "row_number": 196,
          "id": 3540624,
          "entry_number": "75",
          "date_filed": "2000-05-26T00:00:00-04:00",
          "attachments": [],
          "url": "https://www.courtlistener.com/docket/33882506/75/doan-mindy-v-watson-sheriff-leland/",
          "recap_pdf_url": null,
          "pacer_doc_id": null,
          "description": "RESPONSE to SJ Mot, c/s DEFT Watson eod 05/26/00 [BJS] (Entered: 05/26/2000)"
        },
        {
          "row_number": 221,
          "id": 3540647,
          "entry_number": "98",
          "date_filed": "2000-07-05T00:00:00-04:00",
          "attachments": [],
          "url": "https://www.courtlistener.com/docket/33882506/98/doan-mindy-v-watson-sheriff-leland/",
          "recap_pdf_url": null,
          "pacer_doc_id": null,
          "description": "ORDER GRANTING pltf to 7/15/00 to mail notices of class action (97) (SEB), c/m eod 07/07/00 [BJS] (Entered: 07/07/2000)"
        },
        {
          "row_number": 5,
          "id": 3540651,
          "entry_number": "102",
          "date_filed": "2000-08-16T00:00:00-04:00",
          "attachments": null,
          "url": "https://www.courtlistener.com/docket/33882506/102/doan-mindy-v-watson-sheriff-leland/",
          "recap_pdf_url": null,
          "pacer_doc_id": null,
          "description": "MOTION FOR PTC to refine definition of Class, c/s PLTFS eod 08/16/00 [BJS] (Entered: 08/16/2000)"
        },
        {
          "row_number": 6,
          "id": 3540652,
          "entry_number": "103",
          "date_filed": "2000-08-17T00:00:00-04:00",
          "attachments": null,
          "url": "https://www.courtlistener.com/docket/33882506/103/doan-mindy-v-watson-sheriff-leland/",
          "recap_pdf_url": null,
          "pacer_doc_id": null,
          "description": "REPLY BRIEF in support of Mot for PSJ, c/s PLTFS eod 08/17/00 [BJS] (Entered: 08/17/2000)"
        },
        {
          "row_number": 7,
          "id": 3540653,
          "entry_number": "104",
          "date_filed": "2000-08-17T00:00:00-04:00",
          "attachments": null,
          "url": "https://www.courtlistener.com/docket/33882506/104/doan-mindy-v-watson-sheriff-leland/",
          "recap_pdf_url": null,
          "pacer_doc_id": null,
          "description": "SUPPLEMENTAL STATEMENT of Material Facts, c/s PLTFS eod 08/17/00 [BJS] (Entered: 08/17/2000)"
        },
        {
          "row_number": 9,
          "id": 3540655,
          "entry_number": "106",
          "date_filed": "2000-09-01T00:00:00-04:00",
          "attachments": null,
          "url": "https://www.courtlistener.com/docket/33882506/106/doan-mindy-v-watson-sheriff-leland/",
          "recap_pdf_url": null,
          "pacer_doc_id": null,
          "description": "RESPONSE to supplemental statement of material facts, c/s - DEFTS Watson & Hubbard eod 09/01/00 [KTK] (Entered: 09/01/2000)"
        },
        {
          "row_number": 11,
          "id": 3540657,
          "entry_number": "108",
          "date_filed": "2000-09-05T00:00:00-04:00",
          "attachments": null,
          "url": "https://www.courtlistener.com/docket/33882506/108/doan-mindy-v-watson-sheriff-leland/",
          "recap_pdf_url": null,
          "pacer_doc_id": null,
          "description": "RESPONSE to pltfs' Mot to Refine Definition of Class, c/s DEFTS eod 09/06/00 [BJS] (Entered: 09/06/2000)"
        },
        {
          "row_number": 12,
          "id": 3540658,
          "entry_number": "109",
          "date_filed": "2000-09-08T00:00:00-04:00",
          "attachments": null,
          "url": "https://www.courtlistener.com/docket/33882506/109/doan-mindy-v-watson-sheriff-leland/",
          "recap_pdf_url": null,
          "pacer_doc_id": null,
          "description": "ENTRY ASSIGNS P/T (TELEPHONIC) to 09/25/00 at 11:00AM Room 256 (VSS) c/m sdw (court to initiate the call) Indpls time eod 09/08/00 [SWM] (Entered: 09/08/2000)"
        },
        {
          "row_number": 22,
          "id": 3540667,
          "entry_number": "118",
          "date_filed": "2001-03-29T00:00:00-05:00",
          "attachments": null,
          "url": "https://www.courtlistener.com/docket/33882506/118/doan-mindy-v-watson-sheriff-leland/",
          "recap_pdf_url": null,
          "pacer_doc_id": null,
          "description": "ORDER - pending SJ Mots to be WITHDRAWN & to be REFILED upon receipt of defts' response to pltfs' notice of mailing (SEB), c/m from IP eod 03/30/01 [KTK] (Entered: 03/30/2001)"
        },
        {
          "row_number": 31,
          "id": 3540675,
          "entry_number": "126",
          "date_filed": "2001-05-24T00:00:00-04:00",
          "attachments": null,
          "url": "https://www.courtlistener.com/docket/33882506/126/doan-mindy-v-watson-sheriff-leland/",
          "recap_pdf_url": null,
          "pacer_doc_id": null,
          "description": "REQUEST that all of the filings, by all of the parties, related to the previously filed SJ Mot stand submitted to the Court, c/s - PLTFS eod 05/24/01 [KTK] (Entered: 05/24/2001)"
        },
        {
          "row_number": 37,
          "id": 3540680,
          "entry_number": "131",
          "date_filed": "2001-06-25T00:00:00-04:00",
          "attachments": null,
          "url": "https://www.courtlistener.com/docket/33882506/131/doan-mindy-v-watson-sheriff-leland/",
          "recap_pdf_url": null,
          "pacer_doc_id": null,
          "description": "PTC ORDER FROM P/T ON 6/25/01 Status Conf: conf held & concluded {S E} (VSS) c/m eod 06/26/01 [KTK] (Entered: 06/26/2001)"
        },
        {
          "row_number": 39,
          "id": 3540682,
          "entry_number": "133",
          "date_filed": "2001-07-06T00:00:00-04:00",
          "attachments": null,
          "url": "https://www.courtlistener.com/docket/33882506/133/doan-mindy-v-watson-sheriff-leland/",
          "recap_pdf_url": null,
          "pacer_doc_id": null,
          "description": "ENTRY ASSIGNS JURY TRIAL to 02/19/02 at 09:30AM Room 200 (SEB) c/m eod 07/09/01 [CBU] (Entered: 07/09/2001)"
        },
        {
          "row_number": 40,
          "id": 3540683,
          "entry_number": "134",
          "date_filed": "2001-09-10T00:00:00-04:00",
          "attachments": null,
          "url": "https://www.courtlistener.com/docket/33882506/134/doan-mindy-v-watson-sheriff-leland/",
          "recap_pdf_url": null,
          "pacer_doc_id": null,
          "description": "NOTICE of filing of supplemental authority in support of SJ Mot, c/s - PLTFS eod 09/10/01 [KTK] (Entered: 09/10/2001)"
        },
        {
          "row_number": 44,
          "id": 3540687,
          "entry_number": "138",
          "date_filed": "2001-10-05T00:00:00-04:00",
          "attachments": null,
          "url": "https://www.courtlistener.com/docket/33882506/138/doan-mindy-v-watson-sheriff-leland/",
          "recap_pdf_url": null,
          "pacer_doc_id": null,
          "description": "RESPONSE to Defts Motion to Extend Time for Class Member Challenges, c/s PLTFs eod 10/05/01 [SLL] (Entered: 10/05/2001)"
        },
        {
          "row_number": 45,
          "id": 3540688,
          "entry_number": "139",
          "date_filed": "2001-10-05T00:00:00-04:00",
          "attachments": null,
          "url": "https://www.courtlistener.com/docket/33882506/139/doan-mindy-v-watson-sheriff-leland/",
          "recap_pdf_url": null,
          "pacer_doc_id": null,
          "description": "MOTION TO AMEND Entry of 6/28/01 to include other Misc Reasons for Arrest, c/s PLTFS eod 10/05/01 [SLL] (Entered: 10/05/2001)"
        },
        {
          "row_number": 47,
          "id": 3540689,
          "entry_number": "140",
          "date_filed": "2001-10-10T00:00:00-04:00",
          "attachments": null,
          "url": "https://www.courtlistener.com/docket/33882506/140/doan-mindy-v-watson-sheriff-leland/",
          "recap_pdf_url": null,
          "pacer_doc_id": null,
          "description": "OBV 52 PG 192 eod 10/11/01 [MAC] (Entered: 10/11/2001)"
        },
        {
          "row_number": 48,
          "id": 3540690,
          "entry_number": "141",
          "date_filed": "2001-10-17T00:00:00-04:00",
          "attachments": null,
          "url": "https://www.courtlistener.com/docket/33882506/141/doan-mindy-v-watson-sheriff-leland/",
          "recap_pdf_url": null,
          "pacer_doc_id": null,
          "description": "MOTION for PTC to establish trial format, c/s - PLTFS eod 10/17/01 [KTK] (Entered: 10/17/2001)"
        },
        {
          "row_number": 50,
          "id": 3540692,
          "entry_number": "143",
          "date_filed": "2001-10-24T00:00:00-04:00",
          "attachments": null,
          "url": "https://www.courtlistener.com/docket/33882506/143/doan-mindy-v-watson-sheriff-leland/",
          "recap_pdf_url": null,
          "pacer_doc_id": null,
          "description": "MEMORANDUM of law in support of Mot to Alter or Amend, c/s - DEFTS eod 10/25/01 [KTK] (Entered: 10/25/2001)"
        },
        {
          "row_number": 54,
          "id": 3540696,
          "entry_number": "148",
          "date_filed": "2001-11-02T00:00:00-05:00",
          "attachments": null,
          "url": "https://www.courtlistener.com/docket/33882506/148/doan-mindy-v-watson-sheriff-leland/",
          "recap_pdf_url": null,
          "pacer_doc_id": null,
          "description": "APPEARANCE of R. Jeffrey Lowe, KIGHTLINGER & GRAY, c/s DEFTS eod 11/02/01 [SLL] (Entered: 11/02/2001)"
        },
        {
          "row_number": 55,
          "id": 3540697,
          "entry_number": "149",
          "date_filed": "2001-11-02T00:00:00-05:00",
          "attachments": null,
          "url": "https://www.courtlistener.com/docket/33882506/149/doan-mindy-v-watson-sheriff-leland/",
          "recap_pdf_url": null,
          "pacer_doc_id": null,
          "description": "RESPONSE TO PLTFS MOTION TO AMEND ENTRY OF 6/28/01, c/s DEFTS eod 11/02/01 [SLL] (Entered: 11/02/2001)"
        },
        {
          "row_number": 59,
          "id": 3540700,
          "entry_number": "152",
          "date_filed": "2001-11-02T00:00:00-05:00",
          "attachments": null,
          "url": "https://www.courtlistener.com/docket/33882506/152/doan-mindy-v-watson-sheriff-leland/",
          "recap_pdf_url": null,
          "pacer_doc_id": null,
          "description": "PTC ORDER FROM P/T ON 11/2/01 preliminary settlement conf; conf held & contd to 11/14/01 to provide parties the opportunity to consider a proposed resolution (VSS), c/m eod 11/05/01 [KTK] (Entered: 11/05/2001)"
        },
        {
          "row_number": 62,
          "id": 3540703,
          "entry_number": "155",
          "date_filed": "2001-12-13T00:00:00-05:00",
          "attachments": null,
          "url": "https://www.courtlistener.com/docket/33882506/155/doan-mindy-v-watson-sheriff-leland/",
          "recap_pdf_url": null,
          "pacer_doc_id": null,
          "description": "MOTION for hearing to finalize class membership, c/s - PLTFS eod 12/13/01 [KTK] (Entered: 12/13/2001)"
        },
        {
          "row_number": 63,
          "id": 3540704,
          "entry_number": "156",
          "date_filed": "2001-12-13T00:00:00-05:00",
          "attachments": null,
          "url": "https://www.courtlistener.com/docket/33882506/156/doan-mindy-v-watson-sheriff-leland/",
          "recap_pdf_url": null,
          "pacer_doc_id": null,
          "description": "MOTION for PT Order, c/s - PLTFS eod 12/13/01 [KTK] (Entered: 12/13/2001)"
        },
        {
          "row_number": 80,
          "id": 3540715,
          "entry_number": "172",
          "date_filed": "2002-05-07T00:00:00-04:00",
          "attachments": null,
          "url": "https://www.courtlistener.com/docket/33882506/172/doan-mindy-v-watson-sheriff-leland/",
          "recap_pdf_url": null,
          "pacer_doc_id": null,
          "description": "ENTRY ASSIGNS P/T to 05/13/02 at 01:30PM Room 216 (SEB) c/m (Pretrial/Settlement Conference at Indianapolis) eod 05/08/02 [MAC] (Entered: 05/08/2002)"
        },
        {
          "row_number": 74,
          "id": 3540716,
          "entry_number": "167",
          "date_filed": "2002-05-08T00:00:00-04:00",
          "attachments": null,
          "url": "https://www.courtlistener.com/docket/33882506/167/doan-mindy-v-watson-sheriff-leland/",
          "recap_pdf_url": null,
          "pacer_doc_id": null,
          "description": "MOTION IN LIMINE to bar any evidence of the crimes that did allow a strip search, but pltfs were not convicted of a felony & for a specific jury instruction on this issue, c/s - PLTFS eod 05/08/02 [KTK] (Entered: 05/08/2002)"
        },
        {
          "row_number": 78,
          "id": 3540719,
          "entry_number": "170",
          "date_filed": "2002-05-08T00:00:00-04:00",
          "attachments": null,
          "url": "https://www.courtlistener.com/docket/33882506/170/doan-mindy-v-watson-sheriff-leland/",
          "recap_pdf_url": null,
          "pacer_doc_id": null,
          "description": "MOTION IN LIMINE to prevent defts from referring to the strip searches by other euphemisms, c/s - PLTFS eod 05/08/02 [KTK] (Entered: 05/08/2002)"
        },
        {
          "row_number": 79,
          "id": 3540720,
          "entry_number": "171",
          "date_filed": "2002-05-08T00:00:00-04:00",
          "attachments": null,
          "url": "https://www.courtlistener.com/docket/33882506/171/doan-mindy-v-watson-sheriff-leland/",
          "recap_pdf_url": null,
          "pacer_doc_id": null,
          "description": "MOTION IN LIMINE for jury view & for preservation of evidence, c/s - PLTFS eod 05/08/02 [KTK] (Entered: 05/08/2002)"
        },
        {
          "row_number": 82,
          "id": 3540722,
          "entry_number": "174",
          "date_filed": "2002-05-13T00:00:00-04:00",
          "attachments": null,
          "url": "https://www.courtlistener.com/docket/33882506/174/doan-mindy-v-watson-sheriff-leland/",
          "recap_pdf_url": null,
          "pacer_doc_id": null,
          "description": "RESPONSE to pltfs' Motion to Establish Trial Procedure and set Pre-Trial Deadlines c/s - DEFTS eod 05/14/02 [MAC] (Entered: 05/14/2002)"
        },
        {
          "row_number": 87,
          "id": 3540727,
          "entry_number": "179",
          "date_filed": "2002-05-13T00:00:00-04:00",
          "attachments": null,
          "url": "https://www.courtlistener.com/docket/33882506/179/doan-mindy-v-watson-sheriff-leland/",
          "recap_pdf_url": null,
          "pacer_doc_id": null,
          "description": "RESPONSE to pltfs' Motion in Limine to Bar any Evidence of the Crimes for which the pltfs were arrested, barring any argument that any award of damages should be related to the fact pltfs had been arrested, and for specific Jury Instructions on the issue c/s - DEFTS eod 05/14/02 [MAC] (Entered: 05/14/2002)"
        },
        {
          "row_number": 114,
          "id": 3540750,
          "entry_number": "202",
          "date_filed": "2002-11-27T00:00:00-05:00",
          "attachments": null,
          "url": "https://www.courtlistener.com/docket/33882506/202/doan-mindy-v-watson-sheriff-leland/",
          "recap_pdf_url": null,
          "pacer_doc_id": null,
          "description": "RECEIPT #401-218, $164,000.00; #401-219, $288,000.00; #401-220, $163,000.00 - settlement proceeds from Scottsdale Insurance Company eod 11/27/02 [KTK] (Entered: 11/27/2002)"
        },
        {
          "row_number": 127,
          "id": 3540762,
          "entry_number": "214",
          "date_filed": "2003-01-15T00:00:00-05:00",
          "attachments": null,
          "url": "https://www.courtlistener.com/docket/33882506/214/doan-mindy-v-watson-sheriff-leland/",
          "recap_pdf_url": null,
          "pacer_doc_id": null,
          "description": "NOTICE of Compliance with Settlement Agreement & Court's Order of 12/4/02, c/s - DEFTS eod 01/15/03 [KTK] (Entered: 01/15/2003)"
        },
        {
          "row_number": 24,
          "id": 3540561,
          "entry_number": "12",
          "date_filed": "1999-02-03T00:00:00-05:00",
          "attachments": [],
          "url": "https://www.courtlistener.com/docket/33882506/12/doan-mindy-v-watson-sheriff-leland/",
          "recap_pdf_url": null,
          "pacer_doc_id": null,
          "description": "MOTION TO DISMISS by defts w/MEMORANDUM & AFFIDAVIT of Sheriff Randall Hubbard, c/s eod 02/03/99 [KTK] (Entered: 02/03/1999)"
        },
        {
          "row_number": 35,
          "id": 3540562,
          "entry_number": "13",
          "date_filed": "1999-02-09T00:00:00-05:00",
          "attachments": [],
          "url": "https://www.courtlistener.com/docket/33882506/13/doan-mindy-v-watson-sheriff-leland/",
          "recap_pdf_url": null,
          "pacer_doc_id": null,
          "description": "REQUEST FOR PRODUCTION directed to defts, c/s eod 02/09/99 [KTK] (Entered: 02/09/1999)"
        },
        {
          "row_number": 1,
          "id": 3540550,
          "entry_number": "1",
          "date_filed": "1999-01-13T00:00:00-05:00",
          "attachments": [],
          "url": "https://www.courtlistener.com/docket/33882506/1/doan-mindy-v-watson-sheriff-leland/",
          "recap_pdf_url": null,
          "pacer_doc_id": null,
          "description": "COMPLAINT for damages w/JURY DEMAND eod 01/13/99 [KTK] (Entered: 01/13/1999)"
        },
        {
          "row_number": 110,
          "id": 3540551,
          "entry_number": "2",
          "date_filed": "1999-01-13T00:00:00-05:00",
          "attachments": [],
          "url": "https://www.courtlistener.com/docket/33882506/2/doan-mindy-v-watson-sheriff-leland/",
          "recap_pdf_url": null,
          "pacer_doc_id": null,
          "description": "SUMMONS issued & retd to counsel for service eod 01/13/99 [KTK] (Entered: 01/13/1999)"
        },
        {
          "row_number": 146,
          "id": 3540552,
          "entry_number": "3",
          "date_filed": "1999-01-13T00:00:00-05:00",
          "attachments": [],
          "url": "https://www.courtlistener.com/docket/33882506/3/doan-mindy-v-watson-sheriff-leland/",
          "recap_pdf_url": null,
          "pacer_doc_id": null,
          "description": "CIVIL COVER SHEET eod 01/13/99 [KTK] (Entered: 01/13/1999)"
        },
        {
          "row_number": 157,
          "id": 3540553,
          "entry_number": "4",
          "date_filed": "1999-01-13T00:00:00-05:00",
          "attachments": [],
          "url": "https://www.courtlistener.com/docket/33882506/4/doan-mindy-v-watson-sheriff-leland/",
          "recap_pdf_url": null,
          "pacer_doc_id": null,
          "description": "MAGISTRATE'S NOTICE & CONSENT issued eod 01/13/99 [KTK] (Entered: 01/13/1999)"
        },
        {
          "row_number": 168,
          "id": 3540554,
          "entry_number": "5",
          "date_filed": "1999-01-13T00:00:00-05:00",
          "attachments": [],
          "url": "https://www.courtlistener.com/docket/33882506/5/doan-mindy-v-watson-sheriff-leland/",
          "recap_pdf_url": null,
          "pacer_doc_id": null,
          "description": "RECEIPT #14147, payment of $150.00 filing fee eod 01/13/99 [KTK] (Entered: 01/13/1999)"
        },
        {
          "row_number": 88,
          "id": 3540566,
          "entry_number": "18",
          "date_filed": "1999-02-09T00:00:00-05:00",
          "attachments": [],
          "url": "https://www.courtlistener.com/docket/33882506/18/doan-mindy-v-watson-sheriff-leland/",
          "recap_pdf_url": null,
          "pacer_doc_id": null,
          "description": "STATEMENT OF MATERIAL FACTS by pltfs, c/s eod 02/09/99 [KTK] (Entered: 02/09/1999)"
        },
        {
          "row_number": 99,
          "id": 3540567,
          "entry_number": "19",
          "date_filed": "1999-02-09T00:00:00-05:00",
          "attachments": [],
          "url": "https://www.courtlistener.com/docket/33882506/19/doan-mindy-v-watson-sheriff-leland/",
          "recap_pdf_url": null,
          "pacer_doc_id": null,
          "description": "PROPOSED Findings of Undisputed Fact & Conclusions of Law by pltfs, c/s eod 02/09/99 [KTK] (Entered: 02/09/1999)"
        },
        {
          "row_number": 122,
          "id": 3540569,
          "entry_number": "21",
          "date_filed": "1999-02-18T00:00:00-05:00",
          "attachments": [],
          "url": "https://www.courtlistener.com/docket/33882506/21/doan-mindy-v-watson-sheriff-leland/",
          "recap_pdf_url": null,
          "pacer_doc_id": null,
          "description": "ORDER GRANTS pltfs' motion for leave to file an amended complaint, and the tendered First Amended Complaint shall be deemed filed on 2/18/99. Defts' motion to dismiss is DENIED AS MOOT. Court will set a scheduling conference in the near future after consulting with counsel. c/m DFH eod 02/18/99 [PLM] (Entered: 02/18/1999)"
        },
        {
          "row_number": 133,
          "id": 3540570,
          "entry_number": "22",
          "date_filed": "1999-02-18T00:00:00-05:00",
          "attachments": [],
          "url": "https://www.courtlistener.com/docket/33882506/22/doan-mindy-v-watson-sheriff-leland/",
          "recap_pdf_url": null,
          "pacer_doc_id": null,
          "description": "AMENDED COMPLAINT c/s PLTF eod 02/18/99 [PLM] (Entered: 02/18/1999)"
        },
        {
          "row_number": 139,
          "id": 3540571,
          "entry_number": "23",
          "date_filed": "1999-02-19T00:00:00-05:00",
          "attachments": [],
          "url": "https://www.courtlistener.com/docket/33882506/23/doan-mindy-v-watson-sheriff-leland/",
          "recap_pdf_url": null,
          "pacer_doc_id": null,
          "description": "SUBMISSION of Responses to Req for Admissions, by defts, c/s eod 02/19/99 [BJS] (Entered: 02/19/1999)"
        },
        {
          "row_number": 179,
          "id": 3540555,
          "entry_number": "6",
          "date_filed": "1999-01-14T00:00:00-05:00",
          "attachments": [],
          "url": "https://www.courtlistener.com/docket/33882506/6/doan-mindy-v-watson-sheriff-leland/",
          "recap_pdf_url": null,
          "pacer_doc_id": null,
          "description": "PETITION for Certification as a class Action, by pltfs, c/s eod 01/14/99 [BJS] (Entered: 01/14/1999)"
        },
        {
          "row_number": 201,
          "id": 3540557,
          "entry_number": "8",
          "date_filed": "1999-01-19T00:00:00-05:00",
          "attachments": [],
          "url": "https://www.courtlistener.com/docket/33882506/8/doan-mindy-v-watson-sheriff-leland/",
          "recap_pdf_url": null,
          "pacer_doc_id": null,
          "description": "MOTION FOR EARLY DISCOVERY by pltfs, c/s eod 01/19/99 [KTK] (Entered: 01/19/1999)"
        },
        {
          "row_number": 150,
          "id": 3540582,
          "entry_number": "33",
          "date_filed": "1999-03-31T00:00:00-05:00",
          "attachments": [],
          "url": "https://www.courtlistener.com/docket/33882506/33/doan-mindy-v-watson-sheriff-leland/",
          "recap_pdf_url": null,
          "pacer_doc_id": null,
          "description": "REVISED PETITION for Certification of Class Action, by pltfs, c/s eod 03/31/99 [BJS] (Entered: 03/31/1999)"
        },
        {
          "row_number": 151,
          "id": 3540583,
          "entry_number": "34",
          "date_filed": "1999-03-31T00:00:00-05:00",
          "attachments": [],
          "url": "https://www.courtlistener.com/docket/33882506/34/doan-mindy-v-watson-sheriff-leland/",
          "recap_pdf_url": null,
          "pacer_doc_id": null,
          "description": "AMENDED COMPLAINT (REVISED FIRST) w/Demand for Jury Trial, by pltfs, c/s eod 03/31/99 [BJS] (Entered: 03/31/1999)"
        },
        {
          "row_number": 152,
          "id": 3540584,
          "entry_number": "35",
          "date_filed": "1999-03-31T00:00:00-05:00",
          "attachments": [],
          "url": "https://www.courtlistener.com/docket/33882506/35/doan-mindy-v-watson-sheriff-leland/",
          "recap_pdf_url": null,
          "pacer_doc_id": null,
          "description": "MOTION FOR S/J (REVISED) by pltfs, c/s eod 03/31/99 [BJS] (Entered: 03/31/1999)"
        },
        {
          "row_number": 153,
          "id": 3540585,
          "entry_number": "36",
