{
  "case_id": 1011,
  "fetched_at": "2025-10-22T00:07:00.986733",
  "case_data": {
    "attorney_orgs": [],
    "available_documents": [
      "Trial Court Docket",
      "Complaint (any)",
      "Injunctive (or Injunctive-like) Relief",
      "Any published opinion"
    ],
    "case_defendants": [
      {
        "defendant_level": null,
        "institution": "",
        "institution_alt_state": null,
        "institution_city": "Kansas City, MO",
        "institution_county": null,
        "name": "Housing Authority of Kansas City, Missouri ",
        "defendant_level_other": "",
        "is_active": true
      }
    ],
    "case_ongoing": "Yes",
    "case_status": "Coding Complete",
    "case_types": [
      "Public Housing"
    ],
    "cause_other": "",
    "causes": [
      "42 U.S.C. ยง 1983"
    ],
    "class_action_granted": "Granted",
    "class_action_sought": "Yes",
    "closing_year": 0,
    "constitutional_clause": [
      {
        "value": "Equal Protection"
      }
    ],
    "content_of_injunction": [
      {
        "value": "Receivership"
      }
    ],
    "court": "Western District of Missouri",
    "custom_issues": [],
    "defendant_payment": "",
    "defendant_type": [],
    "docket_status": "Incomplete",
    "facility_type": [
      {
        "value": "Government-run"
      }
    ],
    "filing_date": "1989-01-17",
    "filing_year": 1989,
    "id": 1011,
    "injunction_duration": "",
    "issues": [
      "General/Misc.: Sanitation / living conditions",
      "General/Misc.: Totality of conditions",
      "Discrimination Basis: Race discrimination",
      "Affected Race(s): Black",
      "Discrimination Area: Housing Sales/Rental"
    ],
    "last_checked_date": "2008-04-21T00:00:00-04:00",
    "main_docket": {
      "id": 42032,
      "docket_entries": [
        {
          "row_number": 356,
          "id": 2989989,
          "entry_number": "432",
          "date_filed": "2006-04-26T00:00:00-04:00",
          "attachments": [],
          "url": "https://www.courtlistener.com/docket/9448269/432/tinsley-v-pierce/",
          "recap_pdf_url": null,
          "pacer_doc_id": null,
          "description": "NOTICE of hearing: Status Conference set for 5/11/2006 at 9:00 A.M. in Courtroom 8B, Kansas City, MO. before Dean Whipple. (Johnson, Yvonne) (Entered: 04/26/2006)"
        },
        {
          "row_number": 0,
          "id": 2989576,
          "entry_number": "10",
          "date_filed": "1989-01-31T00:00:00-05:00",
          "attachments": [],
          "url": "https://www.courtlistener.com/docket/9448269/10/tinsley-v-pierce/",
          "recap_pdf_url": null,
          "pacer_doc_id": null,
          "description": "MOTION by plaintiff for order determining that action be maintained as class action, w/memorandum & affidavit (Sue Anderson) (Entered: 04/21/1989)"
        },
        {
          "row_number": 133,
          "id": 2989579,
          "entry_number": "23",
          "date_filed": "1989-04-17T00:00:00-04:00",
          "attachments": [],
          "url": "https://www.courtlistener.com/docket/9448269/23/tinsley-v-pierce/",
          "recap_pdf_url": null,
          "pacer_doc_id": null,
          "description": "Memorandum by defendant Mike Fisher, defendant Housing Authority of in opposition to motion for order determining that action be maintained as class action [10-1] (Sue Anderson) Modified on 04/24/1989 (Entered: 04/21/1989)"
        },
        {
          "row_number": 144,
          "id": 2989580,
          "entry_number": "24",
          "date_filed": "1989-04-27T00:00:00-04:00",
          "attachments": [],
          "url": "https://www.courtlistener.com/docket/9448269/24/tinsley-v-pierce/",
          "recap_pdf_url": null,
          "pacer_doc_id": null,
          "description": "Reply by plaintiffs to dfts Mike Fisher & Housing Authority of KCMO'S memorandum in oppo to motion for class certification determining that action be maintained as class action [10-1] (Sue Anderson) (Entered: 04/29/1989)"
        },
        {
          "row_number": 177,
          "id": 2989583,
          "entry_number": "27",
          "date_filed": "1989-06-08T00:00:00-04:00",
          "attachments": [],
          "url": "https://www.courtlistener.com/docket/9448269/27/tinsley-v-pierce/",
          "recap_pdf_url": null,
          "pacer_doc_id": null,
          "description": "ORDER by Judge Dean Whipple re motion to extend time to respond to federal dfts' motion to dismiss [26-1] until 6/28/89 (cc: all counsel) (Sue Anderson) (Entered: 06/08/1989)"
        },
        {
          "row_number": 188,
          "id": 2989584,
          "entry_number": "28",
          "date_filed": "1989-06-28T00:00:00-04:00",
          "attachments": [],
          "url": "https://www.courtlistener.com/docket/9448269/28/tinsley-v-pierce/",
          "recap_pdf_url": null,
          "pacer_doc_id": null,
          "description": "Suggestions by plaintiff in opposition motion to dismiss action against them [25-1] (Court Employee) (Entered: 06/28/1989)"
        },
        {
          "row_number": 199,
          "id": 2989585,
          "entry_number": "29",
          "date_filed": "1989-06-30T00:00:00-04:00",
          "attachments": [],
          "url": "https://www.courtlistener.com/docket/9448269/29/tinsley-v-pierce/",
          "recap_pdf_url": null,
          "pacer_doc_id": null,
          "description": "MOTION by defendant Housing Authority of, defendant Jack L Kemp, defendant U.S. Dept. of H.U.D. to extend time to file reply to plaintiffs' response to federal dfts' motion to dismiss (Sue Anderson) (Entered: 07/06/1989)"
        },
        {
          "row_number": 210,
          "id": 2989586,
          "entry_number": "30",
          "date_filed": "1989-07-05T00:00:00-04:00",
          "attachments": [],
          "url": "https://www.courtlistener.com/docket/9448269/30/tinsley-v-pierce/",
          "recap_pdf_url": null,
          "pacer_doc_id": null,
          "description": "CERTIFICATE by plaintiffs of service of amended 1st req for production of documents to dfts Housing Authority of KCMO & Mike Fisher (Sue Anderson) (Entered: 07/06/1989)"
        },
        {
          "row_number": 221,
          "id": 2989587,
          "entry_number": "31",
          "date_filed": "1989-07-06T00:00:00-04:00",
          "attachments": [],
          "url": "https://www.courtlistener.com/docket/9448269/31/tinsley-v-pierce/",
          "recap_pdf_url": null,
          "pacer_doc_id": null,
          "description": "CERTIFICATE by plaintiff of service of 1st req for production of documents to dfts U.S. Dept. of Housing & Urban Dev. & Jack L. Kemp (Sue Anderson) (Entered: 07/07/1989)"
        },
        {
          "row_number": 254,
          "id": 2989590,
          "entry_number": "34",
          "date_filed": "1989-07-14T00:00:00-04:00",
          "attachments": [],
          "url": "https://www.courtlistener.com/docket/9448269/34/tinsley-v-pierce/",
          "recap_pdf_url": null,
          "pacer_doc_id": null,
          "description": "Proposed scheduling order by defendants, plaintiffs (Sue Anderson) (Entered: 07/17/1989)"
        },
        {
          "row_number": 276,
          "id": 2989592,
          "entry_number": "36",
          "date_filed": "1989-07-27T00:00:00-04:00",
          "attachments": [],
          "url": "https://www.courtlistener.com/docket/9448269/36/tinsley-v-pierce/",
          "recap_pdf_url": null,
          "pacer_doc_id": null,
          "description": "Reply suggestions by defendant Jack L Kemp, defendant Jack L Kemp, defendant U.S. Dept. of H.U.D. pla's oppo to dfts' motion to dismiss action against them [25-1] (Sue Anderson) (Entered: 07/28/1989)"
        },
        {
          "row_number": 287,
          "id": 2989593,
          "entry_number": "37",
          "date_filed": "1989-08-08T00:00:00-04:00",
          "attachments": [],
          "url": "https://www.courtlistener.com/docket/9448269/37/tinsley-v-pierce/",
          "recap_pdf_url": null,
          "pacer_doc_id": null,
          "description": "MOTION by defendant Jack L Kemp, defendant Housing Authority of, defendant Jack L Kemp, defendant U.S. Dept. of H.U.D. to stay discovery, w/suggs (Sue Anderson) (Entered: 08/08/1989)"
        },
        {
          "row_number": 298,
          "id": 2989594,
          "entry_number": "38",
          "date_filed": "1989-08-11T00:00:00-04:00",
          "attachments": [],
          "url": "https://www.courtlistener.com/docket/9448269/38/tinsley-v-pierce/",
          "recap_pdf_url": null,
          "pacer_doc_id": null,
          "description": "MOTION by plaintiffs to extend time to respond to federal dfts' motion to stay discovery (Sue Anderson) (Entered: 08/14/1989)"
        },
        {
          "row_number": 331,
          "id": 2989597,
          "entry_number": "41",
          "date_filed": "1989-09-08T00:00:00-04:00",
          "attachments": [],
          "url": "https://www.courtlistener.com/docket/9448269/41/tinsley-v-pierce/",
          "recap_pdf_url": null,
          "pacer_doc_id": null,
          "description": "Reply suggestions by defendant Jack L Kemp, defendant U.S. Dept. of H.U.D., defendant Jack L Kemp, defendant Housing Authority to plas' oppo to federal dfts' motion to stay discovery [37-0] (Sue Anderson) (Entered: 09/11/1989)"
        },
        {
          "row_number": 342,
          "id": 2989598,
          "entry_number": "42",
          "date_filed": "1989-10-19T00:00:00-04:00",
          "attachments": [],
          "url": "https://www.courtlistener.com/docket/9448269/42/tinsley-v-pierce/",
          "recap_pdf_url": null,
          "pacer_doc_id": null,
          "description": "Reply (suppl suggs oppo) suggestions by plaintiffs to motion to dismiss action against them [25-0] (Phyllis Travers) (Entered: 10/20/1989)"
        },
        {
          "row_number": 364,
          "id": 2989600,
          "entry_number": "44",
          "date_filed": "1989-11-01T00:00:00-05:00",
          "attachments": [],
          "url": "https://www.courtlistener.com/docket/9448269/44/tinsley-v-pierce/",
          "recap_pdf_url": null,
          "pacer_doc_id": null,
          "description": "Suggestions by plaintiffs in opposition to federal dfts' motion to strike plas' suppl suggs [43-1] (Sue Anderson) (Entered: 11/02/1989)"
        },
        {
          "row_number": 386,
          "id": 2989602,
          "entry_number": "46",
          "date_filed": "1989-11-21T00:00:00-05:00",
          "attachments": [],
          "url": "https://www.courtlistener.com/docket/9448269/46/tinsley-v-pierce/",
          "recap_pdf_url": null,
          "pacer_doc_id": null,
          "description": "CERTIFICATE by plaintiffs of service of 1st interrs to dfts Housing Authority of KCMO & Michael Fiser (Sue Anderson) (Entered: 11/21/1989)"
        },
        {
          "row_number": 397,
          "id": 2989603,
          "entry_number": "47",
          "date_filed": "1989-12-06T00:00:00-05:00",
          "attachments": [],
          "url": "https://www.courtlistener.com/docket/9448269/47/tinsley-v-pierce/",
          "recap_pdf_url": null,
          "pacer_doc_id": null,
          "description": "MOTION by plaintiffs to compel prod of docs requested in plas' 1st req for prod of docs to fed dfts (Sue Anderson) (Entered: 12/07/1989)"
        },
        {
          "row_number": 398,
          "id": 2989604,
          "entry_number": "48",
          "date_filed": "1989-12-06T00:00:00-05:00",
          "attachments": [],
          "url": "https://www.courtlistener.com/docket/9448269/48/tinsley-v-pierce/",
          "recap_pdf_url": null,
          "pacer_doc_id": null,
          "description": "Suggestions by plaintiffs in support of motion to compel prod of docs requested in plas' 1st req for prod of docs to fed dfts [47-1] (Sue Anderson) (Entered: 12/07/1989)"
        },
        {
          "row_number": 399,
          "id": 2989605,
          "entry_number": "49",
          "date_filed": "1989-12-21T00:00:00-05:00",
          "attachments": [],
          "url": "https://www.courtlistener.com/docket/9448269/49/tinsley-v-pierce/",
          "recap_pdf_url": null,
          "pacer_doc_id": null,
          "description": "Response by defendant Jack L Kemp, defendant U.S. Dept. of H.U.D., defendant Housing Authority of to plas' motion to compel prod of docs requested in plas' 1st req for prod of docs to fed dfts [47-1] (Sue Anderson) (Entered: 12/28/1989)"
        },
        {
          "row_number": 410,
          "id": 2989616,
          "entry_number": "60",
          "date_filed": "1990-01-30T00:00:00-05:00",
          "attachments": [],
          "url": "https://www.courtlistener.com/docket/9448269/60/tinsley-v-pierce/",
          "recap_pdf_url": null,
          "pacer_doc_id": null,
          "description": "ORDER by Judge Dean Whipple granting dft's motion to extend time until 1/31/90 to respond to plas' interrs [56-1] (cc: all counsel) (Sue Anderson) (Entered: 01/30/1990)"
        },
        {
          "row_number": 416,
          "id": 2989621,
          "entry_number": "66",
          "date_filed": "1990-02-02T00:00:00-05:00",
          "attachments": [],
          "url": "https://www.courtlistener.com/docket/9448269/66/tinsley-v-pierce/",
          "recap_pdf_url": null,
          "pacer_doc_id": null,
          "description": "ANSWER to 2nd amended complaint by defendant Housing Authority of, defendant Mike Fisher (Sue Anderson) Modified on 02/05/1990 (Entered: 02/05/1990)"
        },
        {
          "row_number": 418,
          "id": 2989624,
          "entry_number": "68",
          "date_filed": "1990-02-16T00:00:00-05:00",
          "attachments": [],
          "url": "https://www.courtlistener.com/docket/9448269/68/tinsley-v-pierce/",
          "recap_pdf_url": null,
          "pacer_doc_id": null,
          "description": "CERTIFICATE by defendants of service of 1st interrs to plas (Sue Anderson) (Entered: 02/20/1990)"
        },
        {
          "row_number": 419,
          "id": 2989625,
          "entry_number": "69",
          "date_filed": "1990-02-20T00:00:00-05:00",
          "attachments": [],
          "url": "https://www.courtlistener.com/docket/9448269/69/tinsley-v-pierce/",
          "recap_pdf_url": null,
          "pacer_doc_id": null,
          "description": "ANSWER to 2nd amended complaint by defendant Jack L Kemp, defendant U.S. Dept. of H.U.D., defendant Housing Authority of (Sue Anderson) (Entered: 02/21/1990)"
        },
        {
          "row_number": 420,
          "id": 2989626,
          "entry_number": "70",
          "date_filed": "1990-02-23T00:00:00-05:00",
          "attachments": [],
          "url": "https://www.courtlistener.com/docket/9448269/70/tinsley-v-pierce/",
          "recap_pdf_url": null,
          "pacer_doc_id": null,
          "description": "CERTIFICATE by defendant Jack L Kemp, defendant U.S. Dept. of H.U.D., defendant Housing Authority of of service of response to plas' 1st interrs to HUD (Sue Anderson) (Entered: 02/23/1990)"
        },
        {
          "row_number": 422,
          "id": 2989628,
          "entry_number": "72",
          "date_filed": "1990-04-27T00:00:00-04:00",
          "attachments": [],
          "url": "https://www.courtlistener.com/docket/9448269/72/tinsley-v-pierce/",
          "recap_pdf_url": null,
          "pacer_doc_id": null,
          "description": "CERTIFICATE by defendant Jack L Kemp, defendant U.S. Dept. of H.U.D., defendant Housing Authority of of service of suppl response to plas' 1st req for prod of docs & suppl response to plas' 1st interrs to HUD (Sue Anderson) (Entered: 04/30/1990)"
        },
        {
          "row_number": 423,
          "id": 2989629,
          "entry_number": "73",
          "date_filed": "1990-06-29T00:00:00-04:00",
          "attachments": [],
          "url": "https://www.courtlistener.com/docket/9448269/73/tinsley-v-pierce/",
          "recap_pdf_url": null,
          "pacer_doc_id": null,
          "description": "MOTION by plaintiffs to compel dfts Housing Auth of KCMO & Michael Fisher to produce docs & respond to interrs, w/attachment {Exhibits 1-5} (Sue Anderson) Modified on 06/29/1990 (Entered: 06/29/1990)"
        },
        {
          "row_number": 424,
          "id": 2989630,
          "entry_number": "74",
          "date_filed": "1990-06-29T00:00:00-04:00",
          "attachments": [],
          "url": "https://www.courtlistener.com/docket/9448269/74/tinsley-v-pierce/",
          "recap_pdf_url": null,
          "pacer_doc_id": null,
          "description": "Suggestions by plaintiffs in support of motion to compel dfts Housing Auth of KCMO & Michael Fisher to produce docs & respond to interrs [73-1] (Sue Anderson) (Entered: 06/29/1990)"
        },
        {
          "row_number": 425,
          "id": 2989631,
          "entry_number": "75",
          "date_filed": "1990-08-29T00:00:00-04:00",
          "attachments": [],
          "url": "https://www.courtlistener.com/docket/9448269/75/tinsley-v-pierce/",
          "recap_pdf_url": null,
          "pacer_doc_id": null,
          "description": "ORDER by Judge Dean Whipple granting plas' motion to compel dfts Housing Auth of KCMO & Michael Fisher to provide more complete answers to interrs & to produce docs sought in plas' amended 1st req for prod of docs; [73-1]; court will take under advisement plas' request that dfts pay plas' reasonable expenses, including atty's fees, incurred in filing this motion (cc: all counsel) (Rhonda Enss) (Entered: 08/30/1990)"
        },
        {
          "row_number": 428,
          "id": 2989634,
          "entry_number": "78",
          "date_filed": "1990-09-28T00:00:00-04:00",
          "attachments": [],
          "url": "https://www.courtlistener.com/docket/9448269/78/tinsley-v-pierce/",
          "recap_pdf_url": null,
          "pacer_doc_id": null,
          "description": "Amended Scheduling ORDER by Judge Dean Whipple granting motion to extend deadlines stated in scheduling order [76-1] ; discovery set for 12/28/90 (cc: all counsel) (Rhonda Enss) (Entered: 09/28/1990)"
        },
        {
          "row_number": 431,
          "id": 2989637,
          "entry_number": "81",
          "date_filed": "1990-10-16T00:00:00-04:00",
          "attachments": [],
          "url": "https://www.courtlistener.com/docket/9448269/81/tinsley-v-pierce/",
          "recap_pdf_url": null,
          "pacer_doc_id": null,
          "description": "Objections by plaintiff to motion to extend time to respond to pla's motion for sanctions [80-1] (Court Employee) (Entered: 10/16/1990)"
        },
        {
          "row_number": 433,
          "id": 2989639,
          "entry_number": "83",
          "date_filed": "1990-10-23T00:00:00-04:00",
          "attachments": [],
          "url": "https://www.courtlistener.com/docket/9448269/83/tinsley-v-pierce/",
          "recap_pdf_url": null,
          "pacer_doc_id": null,
          "description": "Response by defendant Housing Authority of, defendant Mike Fisher to motion for sanctions [79-1] (Court Employee) (Entered: 10/24/1990)"
        },
        {
          "row_number": 435,
          "id": 2989641,
          "entry_number": "85",
          "date_filed": "1990-11-01T00:00:00-05:00",
          "attachments": [],
          "url": "https://www.courtlistener.com/docket/9448269/85/tinsley-v-pierce/",
          "recap_pdf_url": null,
          "pacer_doc_id": null,
          "description": "ORDER by Judge Dean Whipple granting motion for leave to file Response to plts' mt for sanctions against HAKA [84-1] (cc: all counsel) (Court Employee) (Entered: 11/01/1990)"
        },
        {
          "row_number": 438,
          "id": 2989644,
          "entry_number": "88",
          "date_filed": "1990-11-08T00:00:00-05:00",
          "attachments": [],
          "url": "https://www.courtlistener.com/docket/9448269/88/tinsley-v-pierce/",
          "recap_pdf_url": null,
          "pacer_doc_id": null,
          "description": "ORDER by Judge Dean Whipple Settlement conference re set for 4:00 11/20/90 (cc: all counsel) (Court Employee) (Entered: 11/08/1990)"
        },
        {
          "row_number": 446,
          "id": 2989652,
          "entry_number": "96",
          "date_filed": "1991-03-26T00:00:00-05:00",
          "attachments": [],
          "url": "https://www.courtlistener.com/docket/9448269/96/tinsley-v-pierce/",
          "recap_pdf_url": null,
          "pacer_doc_id": null,
          "description": "AMENDED ORDER by Judge Dean Whipple granting motion to extend discovery [94-1] to 6/28/91 (cc: all counsel) (Court Employee) (Entered: 03/26/1991)"
        },
        {
          "row_number": 448,
          "id": 2989654,
          "entry_number": "98",
          "date_filed": "1991-06-24T00:00:00-04:00",
          "attachments": [],
          "url": "https://www.courtlistener.com/docket/9448269/98/tinsley-v-pierce/",
          "recap_pdf_url": null,
          "pacer_doc_id": null,
          "description": "Amended Joint Proposed scheduling order (Court Employee) (Entered: 06/25/1991)"
        },
        {
          "row_number": 449,
          "id": 2989655,
          "entry_number": "99",
          "date_filed": "1991-06-26T00:00:00-04:00",
          "attachments": [],
          "url": "https://www.courtlistener.com/docket/9448269/99/tinsley-v-pierce/",
          "recap_pdf_url": null,
          "pacer_doc_id": null,
          "description": "ORDER by Judge Dean Whipple granting joint motion to extend time to complete discovery w/sugg [97-1] ; discovery due on 7/29/91 granting parties mot for scheduling order [98-1], s ;proposed scheduling order due 7/29/91 (cc: all counsel) (Court Employee) (Entered: 06/27/1991)"
        },
        {
          "row_number": 2,
          "id": 2989657,
          "entry_number": "101",
          "date_filed": "1991-10-21T00:00:00-04:00",
          "attachments": [],
          "url": "https://www.courtlistener.com/docket/9448269/101/tinsley-v-pierce/",
          "recap_pdf_url": null,
          "pacer_doc_id": null,
          "description": "ORDER by Judge Dean Whipple granting motion for approval of consent decree and notice to class members [100-1] plas' will hereby distribute the approved notice to all class members w/n ten (10) days of the date of this Order. (cc: all counsel) (Court Employee) (Entered: 10/21/1991)"
        },
        {
          "row_number": 4,
          "id": 2989659,
          "entry_number": "103",
          "date_filed": "1991-11-25T00:00:00-05:00",
          "attachments": [],
          "url": "https://www.courtlistener.com/docket/9448269/103/tinsley-v-pierce/",
          "recap_pdf_url": null,
          "pacer_doc_id": null,
          "description": "CONSENT JUDGMENT by Judge Dean Whipple; HEREBY ORDERED, ADJUDGED, AND DECREED as follows: HAKC will pay $95,000.00 to plaintiffs in full compensation for their attorney's fees It is agreed and the Court so finds that all of the foregoing obligations of defendants were agreed upon w/full participationof plaintiffs; that all of the obligations benefit the members of the defined plaintiff class. Bill of costs mailed to atty for plas' terminating case (cc: all counsel) (Court Employee) Modified on 11/26/1991 (Entered: 11/26/1991)"
        },
        {
          "row_number": 5,
          "id": 2989661,
          "entry_number": "104",
          "date_filed": "1991-12-23T00:00:00-05:00",
          "attachments": [],
          "url": "https://www.courtlistener.com/docket/9448269/104/tinsley-v-pierce/",
          "recap_pdf_url": null,
          "pacer_doc_id": null,
          "description": "Objections by defendant U.S. Dept. of H.U.D., defendant Housing Authority of to bill of costs ;reply to obj to bcst by 12/30/91 (Court Employee) (Entered: 12/26/1991)"
        },
        {
          "row_number": 7,
          "id": 2989663,
          "entry_number": "106",
          "date_filed": "1992-01-09T00:00:00-05:00",
          "attachments": [],
          "url": "https://www.courtlistener.com/docket/9448269/106/tinsley-v-pierce/",
          "recap_pdf_url": null,
          "pacer_doc_id": null,
          "description": "ORDER by Judge Dean Whipple granting motion to extend time to file their resp to the dfts' objcs to the Bill of Costs [105-1] (cc: all counsel) (Court Employee) Modified on 01/27/1992 (Entered: 01/09/1992)"
        },
        {
          "row_number": 9,
          "id": 2989665,
          "entry_number": "108",
          "date_filed": "1992-05-05T00:00:00-04:00",
          "attachments": [],
          "url": "https://www.courtlistener.com/docket/9448269/108/tinsley-v-pierce/",
          "recap_pdf_url": null,
          "pacer_doc_id": null,
          "description": "MOTION by plaintiffs for order adjudicating defendants Housing Authority of Kansas City, Missouri; Interim Executi ve Director, Janice Owens, Jack L. Kemp and the United States Dept of Houseing & Urban Development acting as Temporary Operator and Manager of the Housing Authority in Civil Contempt for Violation of Consent Decree (Court Employee) (Entered: 05/06/1992)"
        },
        {
          "row_number": 10,
          "id": 2989666,
          "entry_number": "109",
          "date_filed": "1992-05-05T00:00:00-04:00",
          "attachments": [],
          "url": "https://www.courtlistener.com/docket/9448269/109/tinsley-v-pierce/",
          "recap_pdf_url": null,
          "pacer_doc_id": null,
          "description": "Suggestions by plaintiff in support of motion for order adjudicating defendants Housing Authority of Kansas City, Missouri; Interim Executi ve Director, Janice Owens, Jack L. Kemp and the United States Dept of Houseing & Urban Development acting as Temporary Operator and Manager of the Housing Authority in Civil Contempt for Violation of Consent Decree [108-1] (Court Employee) (Entered: 05/06/1992)"
        },
        {
          "row_number": 13,
          "id": 2989668,
          "entry_number": "111",
          "date_filed": "1992-05-20T00:00:00-04:00",
          "attachments": [],
          "url": "https://www.courtlistener.com/docket/9448269/111/tinsley-v-pierce/",
          "recap_pdf_url": null,
          "pacer_doc_id": null,
          "description": "ORDER by Judge Dean Whipple granting dfts motion to extend time to resp to pla's mot to reopen [110-1] setting motion for order adjudicating defendants Housing Authority of Kansas City, Missouri; Interim Executi ve Director, Janice Owens, Jack L. Kemp and the United States Dept of Houseing & Urban Development acting as Temporary Operator and Manager of the Housing Authority in Civil Contempt for Violation of Consent Decree [108-1] 6/1/92 (cc: all counsel) (Court Employee) (Entered: 05/21/1992)"
        },
        {
          "row_number": 15,
          "id": 2989670,
          "entry_number": "113",
          "date_filed": "1992-06-03T00:00:00-04:00",
          "attachments": [],
          "url": "https://www.courtlistener.com/docket/9448269/113/tinsley-v-pierce/",
          "recap_pdf_url": null,
          "pacer_doc_id": null,
          "description": "COSTS TAXED for plaintiff Doletha Tinsley in the amount of $ 7,019.21 against defendant (cc: all counsel) (Phyllis Travers) (Entered: 06/03/1992)"
        },
        {
          "row_number": 16,
          "id": 2989671,
          "entry_number": "114",
          "date_filed": "1992-06-03T00:00:00-04:00",
          "attachments": [],
          "url": "https://www.courtlistener.com/docket/9448269/114/tinsley-v-pierce/",
          "recap_pdf_url": null,
          "pacer_doc_id": null,
          "description": "ORDER by Judge Dean Whipple granting federal defendants' motion to extend time to resp to plas' mot to reopen [112-1] setting motion for order adjudicating defendants Housing Authority of Kansas City, Missouri; Interim Executi ve Director, Janice Owens, Jack L. Kemp and the United States Dept of Houseing & Urban Development acting as Temporary Operator and Manager of the Housing Authority in Civil Contempt for Violation of Consent Decree [108-1] 6/10/92 (cc: all counsel) (Court Employee) (Entered: 06/03/1992)"
        },
        {
          "row_number": 17,
          "id": 2989672,
          "entry_number": "115",
          "date_filed": "1992-06-10T00:00:00-04:00",
          "attachments": [],
          "url": "https://www.courtlistener.com/docket/9448269/115/tinsley-v-pierce/",
          "recap_pdf_url": null,
          "pacer_doc_id": null,
          "description": "Suggestions by defendants in opposition to motion for order adjudicating defendants Housing Authority of Kansas City, Missouri; Interim Executi ve Director, Janice Owens, Jack L. Kemp and the United States Dept of Houseing & Urban Development acting as Temporary Operator and Manager of the Housing Authority in Civil Contempt for Violation of Consent Decree [108-1] (Court Employee) (Entered: 06/12/1992)"
        },
        {
          "row_number": 19,
          "id": 2989674,
          "entry_number": "117",
          "date_filed": "1992-06-15T00:00:00-04:00",
          "attachments": [],
          "url": "https://www.courtlistener.com/docket/9448269/117/tinsley-v-pierce/",
          "recap_pdf_url": null,
          "pacer_doc_id": null,
          "description": "Proposed Stipulation and Agreement (Court Employee) (Entered: 06/15/1992)"
        },
        {
          "row_number": 21,
          "id": 2989676,
          "entry_number": "119",
          "date_filed": "1992-10-27T00:00:00-05:00",
          "attachments": null,
          "url": "https://www.courtlistener.com/docket/9448269/119/tinsley-v-pierce/",
          "recap_pdf_url": null,
          "pacer_doc_id": null,
          "description": "CERTIFICATE of transmission of deposition of Roger Allen Williams taken on 9/27/90 on behalf of plaintiffs Costs: $414.80 (Kelly McIlvain) (Entered: 10/27/1992)"
        },
        {
          "row_number": 22,
          "id": 2989677,
          "entry_number": "120",
          "date_filed": "1992-11-03T00:00:00-05:00",
          "attachments": null,
          "url": "https://www.courtlistener.com/docket/9448269/120/tinsley-v-pierce/",
          "recap_pdf_url": null,
          "pacer_doc_id": null,
          "description": "Written status report by defendant Jack L Kemp, defendant U.S. Dept. of H.U.D., defendant Housing Authority's compliance w/Tensley Consent decree and Joint stip (Court Employee) (Entered: 11/04/1992)"
        },
        {
          "row_number": 23,
          "id": 2989678,
          "entry_number": "121",
          "date_filed": "1992-11-09T00:00:00-05:00",
          "attachments": null,
          "url": "https://www.courtlistener.com/docket/9448269/121/tinsley-v-pierce/",
          "recap_pdf_url": null,
          "pacer_doc_id": null,
          "description": "ORDER by Judge Dean Whipple ; Contempt hearing set for all parties at 2:00 on 11/19/92 (cc: all counsel) (Court Employee) (Entered: 11/09/1992)"
        },
        {
          "row_number": 24,
          "id": 2989679,
          "entry_number": "122",
          "date_filed": "1992-11-10T00:00:00-05:00",
          "attachments": null,
          "url": "https://www.courtlistener.com/docket/9448269/122/tinsley-v-pierce/",
          "recap_pdf_url": null,
          "pacer_doc_id": null,
          "description": "Written status report by defendant Housing Authority of K.C. Mo., to the TInsley Consent Decree (Court Employee) (Entered: 11/12/1992)"
        },
        {
          "row_number": 26,
          "id": 2989681,
          "entry_number": "124",
          "date_filed": "1992-11-20T00:00:00-05:00",
          "attachments": null,
          "url": "https://www.courtlistener.com/docket/9448269/124/tinsley-v-pierce/",
          "recap_pdf_url": null,
          "pacer_doc_id": null,
          "description": "Reply by plaintiff to dft Housing & Authority's annual and status rpts to the cout on Tinsley Consent Decree (Court Employee) (Entered: 11/23/1992)"
        },
        {
          "row_number": 27,
          "id": 2989682,
          "entry_number": "125",
          "date_filed": "1992-12-14T00:00:00-05:00",
          "attachments": null,
          "url": "https://www.courtlistener.com/docket/9448269/125/tinsley-v-pierce/",
          "recap_pdf_url": null,
          "pacer_doc_id": null,
          "description": "RETURN OF SERVICE by plaintiffs to Natlie Cole for depos returned on 12/11/92 (Kelly McIlvain) (Entered: 12/14/1992)"
        },
        {
          "row_number": 28,
          "id": 2989683,
          "entry_number": "126",
          "date_filed": "1992-12-17T00:00:00-05:00",
          "attachments": null,
          "url": "https://www.courtlistener.com/docket/9448269/126/tinsley-v-pierce/",
          "recap_pdf_url": null,
          "pacer_doc_id": null,
          "description": "EXHIBIT INDEX by plaintiffs (Court Employee) (Entered: 12/18/1992)"
        },
        {
          "row_number": 29,
          "id": 2989684,
          "entry_number": "127",
          "date_filed": "1992-12-17T00:00:00-05:00",
          "attachments": null,
          "url": "https://www.courtlistener.com/docket/9448269/127/tinsley-v-pierce/",
          "recap_pdf_url": null,
          "pacer_doc_id": null,
          "description": "EXHIBIT INDEX by defendants (Court Employee) (Entered: 12/18/1992)"
        },
        {
          "row_number": 30,
          "id": 2989685,
          "entry_number": "128",
          "date_filed": "1992-12-17T00:00:00-05:00",
          "attachments": null,
          "url": "https://www.courtlistener.com/docket/9448269/128/tinsley-v-pierce/",
          "recap_pdf_url": null,
          "pacer_doc_id": null,
          "description": "MINUTE ENTRY: of Contempt Hearing; Court finds Housing Authority in Contempt (Court Employee) (Entered: 12/18/1992)"
        },
        {
          "row_number": 31,
          "id": 2989686,
          "entry_number": "129",
          "date_filed": "1993-01-22T00:00:00-05:00",
          "attachments": null,
          "url": "https://www.courtlistener.com/docket/9448269/129/tinsley-v-pierce/",
          "recap_pdf_url": null,
          "pacer_doc_id": null,
          "description": "ORDER by Judge Dean Whipple the Court having held dfts in contempt of this Court for failure to comply w/Consent Decree and 6/12/92 Stip orders that Dfts shall conform their performance and conduct to the Consent Decree; Dfts are ordered to pay the full attys fees of plas by modifying 1993 budget to provide for $86,000.00 salary for Ex Dir and to pay attys fees from that fund; If HAKC and HUD are unable to pay plas' attys fees & costs, the Court directs that HAKC must reduce its 1993 budget 5% pay increase for HAKC staff; plas' counsel shall submit a bill for atty fees due as a result of the hrs expended in prosecuting this mt for contempt to dfts w/n 30 days; Dfts HAKC shall pay these addl atty fees from the $86,000.00; When dft contends all the money has been paid, they shall so advise the Court and plas shall acknowledge that said fees and costs have been paid. (cc: all counsel) (Kelly McIlvain) (Entered: 01/25/1993)"
        },
        {
          "row_number": 32,
          "id": 2989687,
          "entry_number": "130",
          "date_filed": "1993-01-27T00:00:00-05:00",
          "attachments": null,
          "url": "https://www.courtlistener.com/docket/9448269/130/tinsley-v-pierce/",
          "recap_pdf_url": null,
          "pacer_doc_id": null,
          "description": "Notice by plaintiffs of copy of plas' bill to dfts for plas' atty fees pursuant to Court order of 1/22/93 (Kelly McIlvain) (Entered: 01/27/1993)"
        },
        {
          "row_number": 35,
          "id": 2989690,
          "entry_number": "133",
          "date_filed": "1993-07-02T00:00:00-04:00",
          "attachments": null,
          "url": "https://www.courtlistener.com/docket/9448269/133/tinsley-v-pierce/",
          "recap_pdf_url": null,
          "pacer_doc_id": null,
          "description": "ORDER TO SHOW CAUSE: by Judge Dean Whipple ; the parties appear before the court for show cause hearing set 9:00 7/6/93 to show cause why dfts should not be held in contempt of 11/25/91 consent decree and the 1/22/93 order (cc: all counsel) (Kelly McIlvain) (Entered: 07/02/1993)"
        },
        {
          "row_number": 36,
          "id": 2989691,
          "entry_number": "134",
          "date_filed": "1993-07-02T00:00:00-04:00",
          "attachments": null,
          "url": "https://www.courtlistener.com/docket/9448269/134/tinsley-v-pierce/",
          "recap_pdf_url": null,
          "pacer_doc_id": null,
          "description": "MOTION by plaintiff for court order adjudicating housing authority of Kansas City, Missouri in contempt of court (Kelly McIlvain) (Entered: 07/06/1993)"
        },
        {
          "row_number": 37,
          "id": 2989692,
          "entry_number": "135",
          "date_filed": "1993-07-06T00:00:00-04:00",
          "attachments": null,
          "url": "https://www.courtlistener.com/docket/9448269/135/tinsley-v-pierce/",
          "recap_pdf_url": null,
          "pacer_doc_id": null,
          "description": "MINUTE ENTRY: Hrg; Exhibits admitted in camera; further hrg on Friday 9:00 a.m to hear any complaints (Kelly McIlvain) (Entered: 07/06/1993)"
        },
        {
          "row_number": 38,
          "id": 2989693,
          "entry_number": "136",
          "date_filed": "1993-07-06T00:00:00-04:00",
          "attachments": null,
          "url": "https://www.courtlistener.com/docket/9448269/136/tinsley-v-pierce/",
          "recap_pdf_url": null,
          "pacer_doc_id": null,
          "description": "Joint Stipulation of facts for 7/6/93 hrg to show cause on pla's mt for contempt (Kelly McIlvain) (Entered: 07/06/1993)"
        },
        {
          "row_number": 40,
          "id": 2989695,
          "entry_number": "138",
          "date_filed": "1993-07-06T00:00:00-04:00",
          "attachments": null,
          "url": "https://www.courtlistener.com/docket/9448269/138/tinsley-v-pierce/",
          "recap_pdf_url": null,
          "pacer_doc_id": null,
          "description": "ORDER by Judge Dean Whipple that the court recinds the appt of Joseph James as receiver of the Housing Authority of KC and that the Court appts the Honorable Robert E. Larson, US Mag Judge for the WDMO as special master pending the court's appt of the receiver. (cc: all counsel) (Kelly McIlvain) (Entered: 07/07/1993)"
        },
        {
          "row_number": 41,
          "id": 2989696,
          "entry_number": "139",
          "date_filed": "1993-07-08T00:00:00-04:00",
          "attachments": null,
          "url": "https://www.courtlistener.com/docket/9448269/139/tinsley-v-pierce/",
          "recap_pdf_url": null,
          "pacer_doc_id": null,
          "description": "ORDER by Judge Dean Whipple that the in camera submission is hereby trnasferred to Judge Larsen and may be unsealed by him for the purpose of his review and the review of those he may designate. (cc: all counsel) (Kelly McIlvain) (Entered: 07/08/1993)"
        },
        {
          "row_number": 42,
          "id": 2989697,
          "entry_number": "140",
          "date_filed": "1993-07-09T00:00:00-04:00",
          "attachments": null,
          "url": "https://www.courtlistener.com/docket/9448269/140/tinsley-v-pierce/",
          "recap_pdf_url": null,
          "pacer_doc_id": null,
          "description": "MINUTE ENTRY: Hrg parties appear and reading for \"Conference\" spectator's participate by testifying in regard to status,critisizm. (Kelly McIlvain) (Entered: 07/09/1993)"
        },
        {
          "row_number": 43,
          "id": 2989698,
          "entry_number": "141",
          "date_filed": "1993-07-12T00:00:00-04:00",
          "attachments": null,
          "url": "https://www.courtlistener.com/docket/9448269/141/tinsley-v-pierce/",
          "recap_pdf_url": null,
          "pacer_doc_id": null,
          "description": "Notice of filing return by US Marshal's Office executed on 7/6/93 (Kelly McIlvain) (Entered: 07/12/1993)"
        },
        {
          "row_number": 45,
          "id": 2989700,
          "entry_number": "143",
          "date_filed": "1993-07-16T00:00:00-04:00",
          "attachments": null,
          "url": "https://www.courtlistener.com/docket/9448269/143/tinsley-v-pierce/",
          "recap_pdf_url": null,
          "pacer_doc_id": null,
          "description": "MINUTE ENTRY: Hrg for classification of an order the parties have worked out (Kelly McIlvain) (Entered: 07/19/1993)"
        },
        {
          "row_number": 46,
          "id": 2989701,
          "entry_number": "144",
          "date_filed": "1993-07-22T00:00:00-04:00",
          "attachments": null,
          "url": "https://www.courtlistener.com/docket/9448269/144/tinsley-v-pierce/",
          "recap_pdf_url": null,
          "pacer_doc_id": null,
          "description": "TRANSCRIPT of proceedings on 7/9/93 before the Honorable Dean Whipple (Kelly McIlvain) (Entered: 07/22/1993)"
        },
        {
          "row_number": 47,
          "id": 2989702,
          "entry_number": "145",
          "date_filed": "1993-07-22T00:00:00-04:00",
          "attachments": null,
          "url": "https://www.courtlistener.com/docket/9448269/145/tinsley-v-pierce/",
          "recap_pdf_url": null,
          "pacer_doc_id": null,
          "description": "TRANSCRIPT of proceedings for the following date(s): 7/6/93 before the Honorable Dean Whipple (Kelly McIlvain) (Entered: 07/22/1993)"
        },
        {
          "row_number": 49,
          "id": 2989704,
          "entry_number": "147",
          "date_filed": "1993-09-08T00:00:00-04:00",
          "attachments": null,
          "url": "https://www.courtlistener.com/docket/9448269/147/tinsley-v-pierce/",
          "recap_pdf_url": null,
          "pacer_doc_id": null,
          "description": "ORDER by Judge Dean Whipple that the HUD employees Janice Owens, Steve Israelite, Carrie Dobbins and Dru Thomas shall appear at a hrg before Robert E. Larsen in his capacity as Sepcial Master, at 2:00 p.m. on Monday, Sept 13, 1993, fr the purpose of answering quest from Judge Larsen or attys representing one or moer employees of the Housing Authority of Kansas City; that the Clerk shall serve copies of this order on counsel of record and on William Nichols (cc: all counsel) (Kelly McIlvain) (Entered: 09/08/1993)"
        },
        {
          "row_number": 50,
          "id": 2989705,
          "entry_number": "148",
          "date_filed": "1993-09-23T00:00:00-04:00",
          "attachments": null,
          "url": "https://www.courtlistener.com/docket/9448269/148/tinsley-v-pierce/",
          "recap_pdf_url": null,
          "pacer_doc_id": null,
          "description": "MOTION by defendant U.S. Dept. of H.U.D. to expedite appt of receiver w/sugg in supp (Kelly McIlvain) (Entered: 09/23/1993)"
        },
        {
          "row_number": 51,
          "id": 2989706,
          "entry_number": "149",
          "date_filed": "1993-10-04T00:00:00-04:00",
          "attachments": null,
          "url": "https://www.courtlistener.com/docket/9448269/149/tinsley-v-pierce/",
          "recap_pdf_url": null,
          "pacer_doc_id": null,
          "description": "Suggestions by plaintiff in opposition to motion to expedite appt of receiver [148-1] (Kelly McIlvain) (Entered: 10/05/1993)"
        },
        {
          "row_number": 52,
          "id": 2989707,
          "entry_number": "150",
          "date_filed": "1993-10-25T00:00:00-04:00",
          "attachments": null,
          "url": "https://www.courtlistener.com/docket/9448269/150/tinsley-v-pierce/",
          "recap_pdf_url": null,
          "pacer_doc_id": null,
          "description": "MOTION by defendant U.S. Dept. of H.U.D. for leave to file out of time reply to pla's response to HUD's motion to expedite appointment of a receiver (Court Employee) (Entered: 10/26/1993)"
        },
        {
          "row_number": 53,
          "id": 2989708,
          "entry_number": "151",
          "date_filed": "1993-11-04T00:00:00-05:00",
          "attachments": null,
          "url": "https://www.courtlistener.com/docket/9448269/151/tinsley-v-pierce/",
          "recap_pdf_url": null,
          "pacer_doc_id": null,
          "description": "ORDER by Judge Dean Whipple granting dft HUD's motion for leave to file out of time reply to pla's response to HUD's motion to expedite appointment of a receiver [150-1] (cc: all counsel) (Kelly McIlvain) (Entered: 11/04/1993)"
        },
        {
          "row_number": 54,
          "id": 2989709,
          "entry_number": "152",
          "date_filed": "1993-11-04T00:00:00-05:00",
          "attachments": null,
          "url": "https://www.courtlistener.com/docket/9448269/152/tinsley-v-pierce/",
          "recap_pdf_url": null,
          "pacer_doc_id": null,
          "description": "Reply suggestions by defendant U.S. Dept. of H.U.D. to motion to expedite appt of receiver [148-1] (Kelly McIlvain) (Entered: 11/04/1993)"
        },
        {
          "row_number": 55,
          "id": 2989710,
          "entry_number": "153",
          "date_filed": "1993-12-03T00:00:00-05:00",
          "attachments": null,
          "url": "https://www.courtlistener.com/docket/9448269/153/tinsley-v-pierce/",
          "recap_pdf_url": null,
          "pacer_doc_id": null,
          "description": "ORDER by Judge Dean Whipple that the court orders a hrg be conducted at 9:00 a.m. on 12/8/93 to receive a report of the Special Master which may be either oral or in writing or both; that the rpt advise the Court in detail if the Consent Decree has been implemented and if not, why it has not been implemented; the court will be seeking information as to what individual and/or organizations are not cooperating in assisting or are interfering w/the efforts of the Special Master to comply w/the Consent Decree and to operate the KCHA under the Court's recievership; the court encourages all parties to be present for the hearing as the court if necessary will be directing parties and employees of the parties afte reasonable notice to respond to the Special Master's rpt. (cc: all counsel) (Kelly McIlvain) (Entered: 12/06/1993)"
        },
        {
          "row_number": 56,
          "id": 2989711,
          "entry_number": "154",
          "date_filed": "1993-12-08T00:00:00-05:00",
          "attachments": null,
          "url": "https://www.courtlistener.com/docket/9448269/154/tinsley-v-pierce/",
          "recap_pdf_url": null,
          "pacer_doc_id": null,
          "description": "ATTORNEY APPEARANCE by Terence J. Thum and James Eisenbrandt for Special Master Robert E. Larsen and Joseph James (Kelly McIlvain) (Entered: 12/08/1993)"
        },
        {
          "row_number": 57,
          "id": 2989712,
          "entry_number": "155",
          "date_filed": "1993-12-08T00:00:00-05:00",
          "attachments": null,
          "url": "https://www.courtlistener.com/docket/9448269/155/tinsley-v-pierce/",
          "recap_pdf_url": null,
          "pacer_doc_id": null,
          "description": "ORDER by Judge Dean Whipple that the court having hrd evidence that Special Master Robert E. Larsen presented to the court today, 12/8/93; the court directs taht the appropriate employees from the HUD regional or national office or both present themselves on 12/20/93 at 9:00 a.m. to resp to the Special Master's rpt and the evidence presented to the court at todays hrg; the Court directs that HUD have employees who have the authority to commit and bind HUD by the ans they give and to commit and bind HUD to do what the court orders HUD to do as a result of the 12/20/93 hrg; Dft shall be prepared to ans all questions that are rasied concerning the conduct of HUD and its employees during the period of time HUD and its employees during the period of time HUD was operating the KCHA from 4/30/92 through 6/1/93 and from 7/6/93 when the Court placed the KCHA in receivership to the present; the following is a list of questions the Court directs HUD to ans in the manner prescribed above. (questions in Order of 12/8/93) the court reserves the right to revise this order at a later date and will notify the parties if it does so. (cc: all counsel) (Kelly McIlvain) (Entered: 12/09/1993)"
        },
        {
          "row_number": 58,
          "id": 2989713,
          "entry_number": "156",
          "date_filed": "1993-12-08T00:00:00-05:00",
          "attachments": null,
          "url": "https://www.courtlistener.com/docket/9448269/156/tinsley-v-pierce/",
          "recap_pdf_url": null,
          "pacer_doc_id": null,
          "description": "MINUTE ENTRY: Hrg; Judge Larsen's rpt filed; Joe James articulates specifics of obstacles taht the special master and he face; Hrg to be held on 12/20/93 at 9:00 a.m. (Kelly McIlvain) (Entered: 12/09/1993)"
        },
        {
          "row_number": 62,
          "id": 2989714,
          "entry_number": "160",
          "date_filed": "1993-12-08T00:00:00-05:00",
          "attachments": null,
          "url": "https://www.courtlistener.com/docket/9448269/160/tinsley-v-pierce/",
          "recap_pdf_url": null,
          "pacer_doc_id": null,
          "description": "Motion/Order for pro hac vice on behalf of Robert E Larsen, Joseph James by Terence J. Thum Receipt #: 69261 in the amount of $25.00 (Kelly McIlvain) (Entered: 12/09/1993)"
        },
        {
          "row_number": 73,
          "id": 2989715,
          "entry_number": "171",
          "date_filed": "1993-12-08T00:00:00-05:00",
          "attachments": null,
          "url": "https://www.courtlistener.com/docket/9448269/171/tinsley-v-pierce/",
          "recap_pdf_url": null,
          "pacer_doc_id": null,
          "description": "Written status report by Judge Robert W. Larsen of Housing Authority of Kansas City's Compliance w/Consent Decree (Court Employee) (Entered: 01/04/1994)"
        },
        {
          "row_number": 59,
          "id": 2989716,
          "entry_number": "157",
          "date_filed": "1993-12-09T00:00:00-05:00",
          "attachments": null,
          "url": "https://www.courtlistener.com/docket/9448269/157/tinsley-v-pierce/",
          "recap_pdf_url": null,
          "pacer_doc_id": null,
          "description": "MOTION by non-party The Kansas City Star Company to vacate or modify court's Decmeber 8, 1993 order (Kelly McIlvain) (Entered: 12/09/1993)"
        },
        {
          "row_number": 60,
          "id": 2989717,
          "entry_number": "158",
          "date_filed": "1993-12-09T00:00:00-05:00",
          "attachments": null,
          "url": "https://www.courtlistener.com/docket/9448269/158/tinsley-v-pierce/",
          "recap_pdf_url": null,
          "pacer_doc_id": null,
          "description": "MOTION of non-party Kansas City Star Company to accelerate the briefing schedule and to schedule oral argument w/sugg in supp (Kelly McIlvain) (Entered: 12/09/1993)"
        },
        {
          "row_number": 61,
          "id": 2989718,
          "entry_number": "159",
          "date_filed": "1993-12-09T00:00:00-05:00",
          "attachments": null,
          "url": "https://www.courtlistener.com/docket/9448269/159/tinsley-v-pierce/",
          "recap_pdf_url": null,
          "pacer_doc_id": null,
          "description": "Suggestions in support of motion to accelerate the briefing schedule and to schedule oral argument [158-1] (Kelly McIlvain) (Entered: 12/09/1993)"
        },
        {
          "row_number": 63,
          "id": 2989719,
          "entry_number": "161",
          "date_filed": "1993-12-09T00:00:00-05:00",
          "attachments": null,
          "url": "https://www.courtlistener.com/docket/9448269/161/tinsley-v-pierce/",
          "recap_pdf_url": null,
          "pacer_doc_id": null,
          "description": "Motion/Order for pro hac vice on behalf of Robert E Larsen, Joseph James by Thomas J. Bath Jr. Receipt #: 69300 in the amount of $25.00 (Kelly McIlvain) (Entered: 12/10/1993)"
        },
        {
          "row_number": 64,
          "id": 2989720,
          "entry_number": "162",
          "date_filed": "1993-12-10T00:00:00-05:00",
          "attachments": null,
          "url": "https://www.courtlistener.com/docket/9448269/162/tinsley-v-pierce/",
          "recap_pdf_url": null,
          "pacer_doc_id": null,
          "description": "CERTIFICATE by plaintiff of service of req for prod of docs (Kelly McIlvain) (Entered: 12/10/1993)"
        },
        {
          "row_number": 65,
          "id": 2989721,
          "entry_number": "163",
          "date_filed": "1993-12-10T00:00:00-05:00",
          "attachments": null,
          "url": "https://www.courtlistener.com/docket/9448269/163/tinsley-v-pierce/",
          "recap_pdf_url": null,
          "pacer_doc_id": null,
          "description": "ORDER by Judge Dean Whipple that the 12/8/93 order restraining Steve Israelite and Elmer Binford from answering specific questions before the scheduled 12/20/93 hrg is vacated; denying as moot Kansas City Star's motion to accelerate the briefing schedule and to schedule oral argument [158-1], denying Kansas City Star's motion to vacate or modify court's Decmeber 8, 1993 order [157-1] as moot (cc: all counsel) (Kelly McIlvain) (Entered: 12/10/1993)"
        },
        {
          "row_number": 66,
          "id": 2989722,
          "entry_number": "164",
          "date_filed": "1993-12-13T00:00:00-05:00",
          "attachments": null,
          "url": "https://www.courtlistener.com/docket/9448269/164/tinsley-v-pierce/",
          "recap_pdf_url": null,
          "pacer_doc_id": null,
          "description": "Notice by special master Robert E Larsen, special master Joseph James proposed addl questions to HUD (Kelly McIlvain) (Entered: 12/13/1993)"
        },
        {
          "row_number": 67,
          "id": 2989723,
          "entry_number": "165",
          "date_filed": "1993-12-13T00:00:00-05:00",
          "attachments": null,
          "url": "https://www.courtlistener.com/docket/9448269/165/tinsley-v-pierce/",
          "recap_pdf_url": null,
          "pacer_doc_id": null,
          "description": "TRANSCRIPT of proceedings for the following date(s): 12/8/93 before the Honorable Dean Whipple (Kelly McIlvain) (Entered: 12/13/1993)"
        },
        {
          "row_number": 68,
          "id": 2989724,
          "entry_number": "166",
          "date_filed": "1993-12-13T00:00:00-05:00",
          "attachments": null,
          "url": "https://www.courtlistener.com/docket/9448269/166/tinsley-v-pierce/",
          "recap_pdf_url": null,
          "pacer_doc_id": null,
          "description": "Notice by plaintiffs' of questions to be raised at the 12/20/93 hrg (Kelly McIlvain) (Entered: 12/14/1993)"
        },
        {
          "row_number": 69,
          "id": 2989725,
          "entry_number": "167",
          "date_filed": "1993-12-13T00:00:00-05:00",
          "attachments": null,
          "url": "https://www.courtlistener.com/docket/9448269/167/tinsley-v-pierce/",
          "recap_pdf_url": null,
          "pacer_doc_id": null,
          "description": "Notice by special master Robert E Larsen, special master Joseph James 2nd set of proposed addl quetions to HUD (Kelly McIlvain) (Entered: 12/14/1993)"
        },
        {
          "row_number": 70,
          "id": 2989726,
          "entry_number": "168",
          "date_filed": "1993-12-20T00:00:00-05:00",
          "attachments": null,
          "url": "https://www.courtlistener.com/docket/9448269/168/tinsley-v-pierce/",
          "recap_pdf_url": null,
          "pacer_doc_id": null,
          "description": "Reply (Response) by defendant Housing Authority of to inquiries concerning compliance w/consent decree (Court Employee) (Entered: 12/20/1993)"
        },
        {
          "row_number": 72,
          "id": 2989727,
          "entry_number": "170",
          "date_filed": "1993-12-20T00:00:00-05:00",
          "attachments": null,
          "url": "https://www.courtlistener.com/docket/9448269/170/tinsley-v-pierce/",
          "recap_pdf_url": null,
          "pacer_doc_id": null,
          "description": "MINUTE ENTRY: of Hrg of Special Master Judge Larsen; neither party waives the right to a full evideniary hrg (Kelly McIlvain) (Entered: 12/21/1993)"
        },
        {
          "row_number": 74,
          "id": 2989729,
          "entry_number": "172",
          "date_filed": "1994-01-26T00:00:00-05:00",
          "attachments": null,
          "url": "https://www.courtlistener.com/docket/9448269/172/tinsley-v-pierce/",
          "recap_pdf_url": null,
          "pacer_doc_id": null,
          "description": "TRANSCRIPT of proceedings for the following date(s): 12/20/93 before the Honorable Dean Whipple (Kelly McIlvain) (Entered: 01/26/1994)"
        },
        {
          "row_number": 75,
          "id": 2989730,
          "entry_number": "173",
          "date_filed": "1994-01-26T00:00:00-05:00",
          "attachments": null,
          "url": "https://www.courtlistener.com/docket/9448269/173/tinsley-v-pierce/",
          "recap_pdf_url": null,
          "pacer_doc_id": null,
          "description": "TRANSCRIPT of proceedings for the following date(s): 12/17/92 before the Honorable Dean Whipple (Kelly McIlvain) (Entered: 01/26/1994)"
        },
        {
          "row_number": 76,
          "id": 2989731,
          "entry_number": "174",
          "date_filed": "1994-02-10T00:00:00-05:00",
          "attachments": null,
          "url": "https://www.courtlistener.com/docket/9448269/174/tinsley-v-pierce/",
          "recap_pdf_url": null,
          "pacer_doc_id": null,
          "description": "ORDER by Judge Dean Whipple ; status hearing set for 9:00 3/18/94 (cc: all counsel) (Kelly McIlvain) (Entered: 02/10/1994)"
        },
        {
          "row_number": 77,
          "id": 2989732,
          "entry_number": "175",
          "date_filed": "1994-02-24T00:00:00-05:00",
          "attachments": null,
          "url": "https://www.courtlistener.com/docket/9448269/175/tinsley-v-pierce/",
          "recap_pdf_url": null,
          "pacer_doc_id": null,
          "description": "ORDER by Judge Dean Whipple, ; status hearing reset for 1:30 3/17/94 instead of 3/18/94 (cc: all counsel) (Kelly McIlvain) (Entered: 02/24/1994)"
        },
        {
          "row_number": 78,
          "id": 2989733,
          "entry_number": "176",
          "date_filed": "1994-02-24T00:00:00-05:00",
          "attachments": null,
          "url": "https://www.courtlistener.com/docket/9448269/176/tinsley-v-pierce/",
          "recap_pdf_url": null,
          "pacer_doc_id": null,
          "description": "ORDER by Judge Dean Whipple That J.B. Littlejohn shall appear at a hrg before US Magistrate Judge Robert E. Larsen in his capcity as Special Master at 9:00 a.m. on 3/2/94 for the purpose of answering questions from Judge Larsen or attys representing the person whose employment at the Housing Authority of Kansas City is the subject of this hrg; that the Clerk shall serve a copy of this Order on William Nichols, Acting Regional Attorney, US Dept of Housing and Urban Development, 400 State Avenue, Kansas City, Missouri 66101 (cc: all counsel) (Kelly McIlvain) (Entered: 02/25/1994)"
        },
        {
          "row_number": 80,
          "id": 2989735,
          "entry_number": "178",
          "date_filed": "1994-03-17T00:00:00-05:00",
          "attachments": null,
          "url": "https://www.courtlistener.com/docket/9448269/178/tinsley-v-pierce/",
          "recap_pdf_url": null,
          "pacer_doc_id": null,
          "description": "MINUTE ENTRY: Status hrg; Consent decree will be tansmitted into a work program (Kelly McIlvain) (Entered: 03/21/1994)"
        },
        {
          "row_number": 81,
          "id": 2989736,
          "entry_number": "179",
          "date_filed": "1994-03-24T00:00:00-05:00",
          "attachments": null,
          "url": "https://www.courtlistener.com/docket/9448269/179/tinsley-v-pierce/",
          "recap_pdf_url": null,
          "pacer_doc_id": null,
          "description": "MOTION by defendant U.S. Dept. of H.U.D. for order staying and enjoining certain acts and/or proceedings against interim reciever, the Housing Authority of Kansas City, Missouri and/or the receivership estate (Kelly McIlvain) (Entered: 03/25/1994)"
        },
        {
          "row_number": 82,
          "id": 2989737,
          "entry_number": "180",
          "date_filed": "1994-03-24T00:00:00-05:00",
          "attachments": null,
          "url": "https://www.courtlistener.com/docket/9448269/180/tinsley-v-pierce/",
          "recap_pdf_url": null,
          "pacer_doc_id": null,
          "description": "Suggestions by defendant U.S. Dept. of H.U.D. in support of motion for order staying and enjoining certain acts and/or proceedings against interim reciever, the Housing Authority of Kansas City, Missouri and/or the receivership estate [179-1] (Kelly McIlvain) (Entered: 03/25/1994)"
        },
        {
          "row_number": 83,
          "id": 2989738,
          "entry_number": "181",
          "date_filed": "1994-04-01T00:00:00-05:00",
          "attachments": null,
          "url": "https://www.courtlistener.com/docket/9448269/181/tinsley-v-pierce/",
          "recap_pdf_url": null,
          "pacer_doc_id": null,
          "description": "TRANSCRIPT of status conf held on 3/17/94 before Judge Dean Whipple as to plaintiffs, and defendants (Court Employee) (Entered: 04/01/1994)"
        },
        {
          "row_number": 84,
          "id": 2989739,
          "entry_number": "182",
          "date_filed": "1994-04-01T00:00:00-05:00",
          "attachments": null,
          "url": "https://www.courtlistener.com/docket/9448269/182/tinsley-v-pierce/",
          "recap_pdf_url": null,
          "pacer_doc_id": null,
          "description": "ORDER by Judge Dean Whipple granting motion for order staying and enjoining certain acts and/or proceedings against interim reciever, the Housing Authority of Kansas City, Missouri and/or the receivership estate [179-1]; that such stay, restraint and injunc is w/o prej to the right and ability of the Interim Receiver to seek other or further temporary, preliminary and/or permanent relief restraining and enjoining the commission of specific acts or the commencement or continuation of specific actions or proceedings, ncluding actions or proceedings arising under 28 USC 959 (cc: all counsel) (Kelly McIlvain) (Entered: 04/01/1994)"
        },
        {
          "row_number": 85,
          "id": 2989740,
          "entry_number": "183",
          "date_filed": "1994-04-01T00:00:00-05:00",
          "attachments": null,
          "url": "https://www.courtlistener.com/docket/9448269/183/tinsley-v-pierce/",
          "recap_pdf_url": null,
          "pacer_doc_id": null,
          "description": "MOTION by plaintiff to extend time to resp to mt of interim receiver of and for the Housing Autho of KC for an order staying and enjoining certain acts and/or proceeding against interim receiver, the Housing Authority of KC and/or the receivership estate. (Kelly McIlvain) (Entered: 04/04/1994)"
        },
        {
          "row_number": 86,
          "id": 2989741,
          "entry_number": "184",
          "date_filed": "1994-04-07T00:00:00-04:00",
          "attachments": null,
          "url": "https://www.courtlistener.com/docket/9448269/184/tinsley-v-pierce/",
          "recap_pdf_url": null,
          "pacer_doc_id": null,
          "description": "ORDER by Judge Dean Whipple denying plaintiffs motion to extend time to resp to mt of interim receiver of and for the Housing Autho of KC for an order staying and enjoining certain acts and/or proceeding against interim receiver, the Housing Authority of KC and/or the receivership estate. [183-1] (cc: all counsel) (Court Employee) (Entered: 04/07/1994)"
        },
        {
          "row_number": 87,
          "id": 2989742,
          "entry_number": "185",
          "date_filed": "1994-04-08T00:00:00-04:00",
          "attachments": null,
          "url": "https://www.courtlistener.com/docket/9448269/185/tinsley-v-pierce/",
          "recap_pdf_url": null,
          "pacer_doc_id": null,
          "description": "MOTION by defendant Housing Authority of to alter judgment order entered 4/1/94 staying and enjoining certain acts and/or proceedings against interim receiver, the HAKC and/or the receivership estate w/sugg, to amend order entered 4/1/94 staying and enjoining certain acts and/or proceedings against interim receiver, the HAKC and/or receivership estate (Kelly McIlvain) (Entered: 04/08/1994)"
        },
        {
          "row_number": 88,
          "id": 2989743,
          "entry_number": "186",
          "date_filed": "1994-04-15T00:00:00-04:00",
          "attachments": null,
          "url": "https://www.courtlistener.com/docket/9448269/186/tinsley-v-pierce/",
          "recap_pdf_url": null,
          "pacer_doc_id": null,
          "description": "ORDER by Judge Dean Whipple that dfts shall pay to plas' atty an addl atty fee of $12,439.20 for the work performed in the contempt proceedings; as plas have already received $40,260.00 in atty fees in connection w/the req at issue here, they must reimburse HAKC in the amt of $27,820.80, or in the alternative issue a credit to HAKC in that amt which shall draw interest at the same rate of interest that plas req and received from HAKC for the unpaid balance of original atty fees in the Consent Decree; the hourly rate of $120.00 will be applicable for all future awards of atty fees; plas may make further application for atty fees concerning work done subsequent to 12/22/92 ( the last billing date on plas 1/27/93 filing) by filing with the Court a motion for such together w/counsel's contemporaneous time sheets; dfts will be given an opportunity to file a resp w/n the time period provided in the local rules. (cc: all counsel) (Kelly McIlvain) (Entered: 04/15/1994)"
        },
        {
          "row_number": 89,
          "id": 2989744,
          "entry_number": "187",
          "date_filed": "1994-04-21T00:00:00-04:00",
          "attachments": null,
          "url": "https://www.courtlistener.com/docket/9448269/187/tinsley-v-pierce/",
          "recap_pdf_url": null,
          "pacer_doc_id": null,
          "description": "Response by defendant U.S. Dept. of H.U.D. to motion to alter judgment order entered 4/1/94 staying and enjoining certain acts and/or proceedings against interim receiver, the HAKC and/or the receivership estate [185-1], motion to amend order entered 4/1/94 staying and enjoining certain acts and/or proceedings against interim receiver, the HAKC and/or receivership estate [185-2] (Kelly McIlvain) (Entered: 04/22/1994)"
        },
        {
          "row_number": 90,
          "id": 2989745,
          "entry_number": "188",
          "date_filed": "1994-04-25T00:00:00-04:00",
          "attachments": null,
          "url": "https://www.courtlistener.com/docket/9448269/188/tinsley-v-pierce/",
          "recap_pdf_url": null,
          "pacer_doc_id": null,
          "description": "MOTION by plaintiffs' for reconsideration of order awarding attorney's fees and accompanying suggs in support (Court Employee) (Entered: 04/25/1994)"
        },
        {
          "row_number": 91,
          "id": 2989746,
          "entry_number": "189",
          "date_filed": "1994-04-29T00:00:00-04:00",
          "attachments": null,
          "url": "https://www.courtlistener.com/docket/9448269/189/tinsley-v-pierce/",
          "recap_pdf_url": null,
          "pacer_doc_id": null,
          "description": "Response by defendant U.S. Dept. of H.U.D. to motion for reconsideration of order awarding attorney's fees and accompanying suggs in support [188-1] (Kelly McIlvain) (Entered: 04/29/1994)"
        },
        {
          "row_number": 92,
          "id": 2989747,
          "entry_number": "190",
          "date_filed": "1994-05-09T00:00:00-04:00",
          "attachments": null,
          "url": "https://www.courtlistener.com/docket/9448269/190/tinsley-v-pierce/",
          "recap_pdf_url": null,
          "pacer_doc_id": null,
          "description": "Suggestions by defendant Housing Authority of in opposition to motion for reconsideration of order awarding attorney's fees and accompanying suggs in support [188-1] (Kelly McIlvain) (Entered: 05/10/1994)"
        },
        {
          "row_number": 93,
          "id": 2989748,
          "entry_number": "191",
          "date_filed": "1994-05-19T00:00:00-04:00",
          "attachments": null,
          "url": "https://www.courtlistener.com/docket/9448269/191/tinsley-v-pierce/",
          "recap_pdf_url": null,
          "pacer_doc_id": null,
          "description": "MOTION by plaintiffs to extend time w/in which to reply to response of interim receiver for the Housing Authority of Kansas City, MO, to plas' motion for reconsideration (Court Employee) (Entered: 05/20/1994)"
        },
        {
          "row_number": 94,
          "id": 2989749,
          "entry_number": "192",
          "date_filed": "1994-05-23T00:00:00-04:00",
          "attachments": null,
          "url": "https://www.courtlistener.com/docket/9448269/192/tinsley-v-pierce/",
          "recap_pdf_url": null,
          "pacer_doc_id": null,
          "description": "ORDER by Judge Dean Whipple granting pla's motion to extend time w/in which to reply to response of interim receiver for the Housing Authority of Kansas City, MO, to plas' motion for reconsideration [191-1] setting motion for reconsideration of order awarding attorney's fees and accompanying suggs in support [188-1] 5/27/94 (cc: all counsel) (Georgia Kee) (Entered: 05/23/1994)"
        },
        {
          "row_number": 95,
          "id": 2989750,
          "entry_number": "193",
          "date_filed": "1994-05-26T00:00:00-04:00",
          "attachments": null,
          "url": "https://www.courtlistener.com/docket/9448269/193/tinsley-v-pierce/",
          "recap_pdf_url": null,
          "pacer_doc_id": null,
          "description": "MOTION by plaintiffs to extend time w/in which to reply to response of interim receiver for the Housing Authority of KCMO to plas' motion for reconsideration (Court Employee) (Entered: 05/27/1994)"
        },
        {
          "row_number": 96,
          "id": 2989751,
          "entry_number": "194",
          "date_filed": "1994-05-27T00:00:00-04:00",
          "attachments": null,
          "url": "https://www.courtlistener.com/docket/9448269/194/tinsley-v-pierce/",
          "recap_pdf_url": null,
          "pacer_doc_id": null,
          "description": "Reply suggestions by plaintiff to motion for reconsideration of order awarding attorney's fees and accompanying suggs in support [188-1] (Kelly McIlvain) (Entered: 05/27/1994)"
        },
        {
          "row_number": 97,
          "id": 2989752,
          "entry_number": "195",
          "date_filed": "1994-06-02T00:00:00-04:00",
          "attachments": null,
          "url": "https://www.courtlistener.com/docket/9448269/195/tinsley-v-pierce/",
          "recap_pdf_url": null,
          "pacer_doc_id": null,
          "description": "ORDER by Judge Dean Whipple granting motion to extend time w/in which to reply to response of interim receiver for the Housing Authority of KCMO to plas' motion for reconsideration [193-1] up to and including 6/10/94 (cc: all counsel) (Kelly McIlvain) (Entered: 06/02/1994)"
        },
        {
          "row_number": 98,
          "id": 2989753,
          "entry_number": "196",
          "date_filed": "1994-06-13T00:00:00-04:00",
          "attachments": null,
          "url": "https://www.courtlistener.com/docket/9448269/196/tinsley-v-pierce/",
          "recap_pdf_url": null,
          "pacer_doc_id": null,
          "description": "ORDER by Judge Dean Whipple denying plas motion for reconsideration of order awarding attorney's fees and accompanying suggs in support [188-1] (cc: all counsel) (Kelly McIlvain) (Entered: 06/13/1994)"
        },
        {
          "row_number": 99,
          "id": 2989754,
          "entry_number": "197",
          "date_filed": "1994-06-17T00:00:00-04:00",
          "attachments": null,
          "url": "https://www.courtlistener.com/docket/9448269/197/tinsley-v-pierce/",
          "recap_pdf_url": null,
          "pacer_doc_id": null,
          "description": "ORDER by Judge Dean Whipple granting motion to alter judgment order entered 4/1/94 staying and enjoining certain acts and/or proceedings against interim receiver, the HAKC and/or the receivership estate [185-1], granting motion to amend order entered 4/1/94 staying and enjoining certain acts and/or proceedings against interim receiver, the HAKC and/or receivership estate [185-2] (cc: all counsel) (Kelly McIlvain) (Entered: 06/17/1994)"
        },
        {
          "row_number": 100,
          "id": 2989755,
          "entry_number": "198",
          "date_filed": "1994-06-28T00:00:00-04:00",
          "attachments": null,
          "url": "https://www.courtlistener.com/docket/9448269/198/tinsley-v-pierce/",
          "recap_pdf_url": null,
          "pacer_doc_id": null,
          "description": "ORDER by Judge Dean Whipple that the Interim Receiver is authorized to pay the sum of $10,162.33 to Dunn Allied-Housing due from the HA of KC, MO under its contract with Dunn Allied-Housing, for consulting services through April 30, 1994 (cc: all counsel) (Kelly McIlvain) (Entered: 06/29/1994)"
        },
        {
          "row_number": 101,
          "id": 2989756,
          "entry_number": "199",
          "date_filed": "1994-07-06T00:00:00-04:00",
          "attachments": null,
          "url": "https://www.courtlistener.com/docket/9448269/199/tinsley-v-pierce/",
          "recap_pdf_url": null,
          "pacer_doc_id": null,
          "description": "MOTION by receiver Paula L Schwach for order directing dfts Sec of the US Dept of Housing and Urban Development and the US Dept of Housing and Urban Development to show cause why construction and construction management agreements between the interim receiver and J.E. Dunn Construction Co and Dunn/Allied-Housing Joint Venture should not be executed, ratified, approved, implemented and funded (Kelly McIlvain) (Entered: 07/06/1994)"
        },
        {
          "row_number": 102,
          "id": 2989757,
          "entry_number": "200",
          "date_filed": "1994-07-06T00:00:00-04:00",
          "attachments": null,
          "url": "https://www.courtlistener.com/docket/9448269/200/tinsley-v-pierce/",
          "recap_pdf_url": null,
          "pacer_doc_id": null,
          "description": "Suggestions by receiver Paula L Schwach in support of motion for order directing dfts Sec of the US Dept of Housing and Urban Development and the US Dept of Housing and Urban Development to show cause why construction and construction management agreements between the interim receiver and J.E. Dunn Construction Co and Dunn/Allied-Housing Joint Venture should not be executed, ratified, approved, implemented and funded [199-1] (Kelly McIlvain) (Entered: 07/06/1994)"
        },
        {
          "row_number": 103,
          "id": 2989758,
          "entry_number": "201",
          "date_filed": "1994-07-07T00:00:00-04:00",
          "attachments": null,
          "url": "https://www.courtlistener.com/docket/9448269/201/tinsley-v-pierce/",
          "recap_pdf_url": null,
          "pacer_doc_id": null,
          "description": "ORDER TO SHOW CAUSE: by Judge Dean Whipple ;that w/n 15 days from and after the date of this order dfts Secretary and HUD are ordered to show cause (by 7/22/94) in writing why the contracts, agreements and undertakings by and between Receiver HAKC, J.E. Dunn Construction Co. and Dunn/Allied-Housing, Joint Venture, as identified in the mt should not be deemed to have been executed and entered into by the Receiver and HAKC, as a proper exercise of the procurement prowers provided for under inter alia, 24 CFR 85.36 and/or why any and all constraints upon the procurement procedures employed with respect to such contracts, agreements and understakings should not be waived, forthwith, in accordance with the public exigency or emergency exceptions provided for under 24 CFR 85.36 (d)(4)(i)(B), and all such contracts, agreements, and undertakings ratified, approved and funded by dfts immediately, that in the event the dfts Secretary and/or HUD shall timely respond to this Order this matter shall be heard before the Court on 7/29/94 commencing at 11:00 a.m. (cc: all counsel) (Kelly McIlvain) (Entered: 07/07/1994)"
        },
        {
          "row_number": 104,
          "id": 2989759,
          "entry_number": "202",
          "date_filed": "1994-07-22T00:00:00-04:00",
          "attachments": null,
          "url": "https://www.courtlistener.com/docket/9448269/202/tinsley-v-pierce/",
          "recap_pdf_url": null,
          "pacer_doc_id": null,
          "description": "MOTION by defendant to extend time to file resp to show cause order dated 7/8/94 (Kelly McIlvain) (Entered: 07/22/1994)"
        },
        {
          "row_number": 105,
          "id": 2989760,
          "entry_number": "203",
          "date_filed": "1994-07-22T00:00:00-04:00",
          "attachments": null,
          "url": "https://www.courtlistener.com/docket/9448269/203/tinsley-v-pierce/",
          "recap_pdf_url": null,
          "pacer_doc_id": null,
          "description": "MOTION by federal defendants to extend time to respond to 7/27/94 OTSC (Court Employee) (Entered: 07/25/1994)"
        },
        {
          "row_number": 106,
          "id": 2989761,
          "entry_number": "204",
          "date_filed": "1994-07-26T00:00:00-04:00",
          "attachments": null,
          "url": "https://www.courtlistener.com/docket/9448269/204/tinsley-v-pierce/",
          "recap_pdf_url": null,
          "pacer_doc_id": null,
          "description": "ORDER by Judge Dean Whipple granting motion to extend time to file resp to show cause order dated 7/8/94 [202-1] to and including 7/27/94 (cc: all counsel) (Kelly McIlvain) (Entered: 07/26/1994)"
        },
        {
          "row_number": 107,
          "id": 2989762,
          "entry_number": "205",
          "date_filed": "1994-07-26T00:00:00-04:00",
          "attachments": null,
          "url": "https://www.courtlistener.com/docket/9448269/205/tinsley-v-pierce/",
          "recap_pdf_url": null,
          "pacer_doc_id": null,
          "description": "MOTION by defendant U.S. Dept. of H.U.D. to continue (Kelly McIlvain) (Entered: 07/27/1994)"
        },
        {
          "row_number": 108,
          "id": 2989763,
          "entry_number": "206",
          "date_filed": "1994-07-26T00:00:00-04:00",
          "attachments": null,
          "url": "https://www.courtlistener.com/docket/9448269/206/tinsley-v-pierce/",
          "recap_pdf_url": null,
          "pacer_doc_id": null,
          "description": "Response by defendant U.S. Dept. of H.U.D. to Order (Kelly McIlvain) (Entered: 07/27/1994)"
        },
        {
          "row_number": 109,
          "id": 2989764,
          "entry_number": "207",
          "date_filed": "1994-08-05T00:00:00-04:00",
          "attachments": null,
          "url": "https://www.courtlistener.com/docket/9448269/207/tinsley-v-pierce/",
          "recap_pdf_url": null,
          "pacer_doc_id": null,
          "description": "ORDER by Judge Dean Whipple granting dfts Disnero and HUD's motion to continue is rescheduled [205-1] ; status hearing set for 9:30 9/30/94 (cc: all counsel) (Court Employee) (Entered: 08/05/1994)"
        },
        {
          "row_number": 110,
          "id": 2989765,
          "entry_number": "208",
          "date_filed": "1994-08-16T00:00:00-04:00",
          "attachments": null,
          "url": "https://www.courtlistener.com/docket/9448269/208/tinsley-v-pierce/",
          "recap_pdf_url": null,
          "pacer_doc_id": null,
          "description": "ORDER by Judge Dean Whipple that the Special Master is authorized to pay the sum of $21,000.91 to Dunn Allied-Housing due from HAKC under its contract w/Dunn Allied-Housing, for consulting services through 5/31/94 (cc: all counsel) (Kelly McIlvain) (Entered: 08/16/1994)"
        },
        {
          "row_number": 111,
          "id": 2989766,
          "entry_number": "209",
          "date_filed": "1994-08-18T00:00:00-04:00",
          "attachments": null,
          "url": "https://www.courtlistener.com/docket/9448269/209/tinsley-v-pierce/",
          "recap_pdf_url": null,
          "pacer_doc_id": null,
          "description": "ORDER by Judge Dean Whipple that an immediate hrg is scheduled on 8/25/94 at 9:00 a.m. for the purpose of hrg the parties' positions and intentions w/regard to approval of the J.E. Dunn Constr Company contract. (cc: all counsel) (Kelly McIlvain) (Entered: 08/18/1994)"
        },
        {
          "row_number": 112,
          "id": 2989767,
          "entry_number": "210",
          "date_filed": "1994-08-22T00:00:00-04:00",
          "attachments": null,
          "url": "https://www.courtlistener.com/docket/9448269/210/tinsley-v-pierce/",
          "recap_pdf_url": null,
          "pacer_doc_id": null,
          "description": "ORDER by Judge Dean Whipple that all preliminary expenses shall be fully documented and shall include reimbursement for attys fee not to exceed $500.00. (cc: all counsel) (Kelly McIlvain) (Entered: 08/22/1994)"
        },
        {
          "row_number": 113,
          "id": 2989768,
          "entry_number": "211",
          "date_filed": "1994-08-25T00:00:00-04:00",
          "attachments": null,
          "url": "https://www.courtlistener.com/docket/9448269/211/tinsley-v-pierce/",
          "recap_pdf_url": null,
          "pacer_doc_id": null,
          "description": "MINUTE ENTRY: Defendant Exhibit A admitted into evidence, w/o obj (Kelly McIlvain) (Entered: 08/25/1994)"
        },
        {
          "row_number": 114,
          "id": 2989769,
          "entry_number": "212",
          "date_filed": "1994-08-31T00:00:00-04:00",
          "attachments": null,
          "url": "https://www.courtlistener.com/docket/9448269/212/tinsley-v-pierce/",
          "recap_pdf_url": null,
          "pacer_doc_id": null,
          "description": "ORDER by Judge Dean Whipple that the Housing Authority of Kansas City, Missouri, by and through the Special Master, the Honorable Robert E. Larsen; caused to be incorported a Missouri not-for-profit corporation to be known as the \"Regional Housing Development Corporation of Kansas City, Missouri, Inc.,\" the incorporators and directors of which shall be Pamela A. Alexander, Stanley E. Rice and Daniel Y. Hall; the Corporation's duration shall be perpetual; its registered agent shall be Robert E. Larsen at US District Courthouse, the Corporation shall serve as successor to the Issuer and shall have the same benevolent purposes of assisting low-income housing as provided in the Articles of Incorporation for the Issuer; and the Housing Authority of Kansas City shall be the sole member of the Corporation; Employ the firm of King Burke Hershey Farchmin & Scholmann, P.X. to assist in the incorporation of the Corporation; Accept the rights, assests and obligations, if any, of Issuer, pursuant to the Issuer's plan of distribution, and immediately thereafter transfer and convey the same to the Corporation; As the sole member of the Issuer and Corporation, the Housing Authority of Kansas City, Missouri shalld irect the Corporation as successor Issuer to issue a ntc of election to redeem, to the Succssor Trustee of those certain $5,130,000 HDRB, in the form attached as Exh A and made a part thereof, which shall instruct such successor Trustee to issue a ntc of call for redemption on or before 9/1/94 in the form attached as Exh B attached hereto and made a part hereof, which ntc of call shall indicate that the same is conditional in its nature; that the Corporation is and shall be for all purposes successor of the Issuer; by the Court to be effective immediately. (cc: all counsel) (Kelly McIlvain) (Entered: 08/31/1994)"
        },
        {
          "row_number": 115,
          "id": 2989770,
          "entry_number": "213",
          "date_filed": "1994-09-06T00:00:00-04:00",
          "attachments": null,
          "url": "https://www.courtlistener.com/docket/9448269/213/tinsley-v-pierce/",
          "recap_pdf_url": null,
          "pacer_doc_id": null,
          "description": "ORDER by Judge Dean Whipple The Special Master having appted an Advisory Committee to select a receiver for the HAKC and the Advisory Committee having recommended the appt of TAG Associates of KC, Inc as receiver; it is Ordered (look in order of 9/6/94) for the Appt of TAG as Receiver of HAKC; the Powers, Duties, Reports, Immunity and Compensation; the Modification of this order may be modified as necessary to assure the success of this receivership, and eventually, to return the operation of the HAKC to the HAKC Board (cc: all counsel) (Kelly McIlvain) (Entered: 09/06/1994)"
        },
        {
          "row_number": 116,
          "id": 2989771,
          "entry_number": "214",
          "date_filed": "1994-09-16T00:00:00-04:00",
          "attachments": null,
          "url": "https://www.courtlistener.com/docket/9448269/214/tinsley-v-pierce/",
          "recap_pdf_url": null,
          "pacer_doc_id": null,
          "description": "MOTION by defendant U.S. Dept. of H.U.D. to amend or revise w/supporting suggs (Court Employee) (Entered: 09/19/1994)"
        },
        {
          "row_number": 117,
          "id": 2989772,
          "entry_number": "215",
          "date_filed": "1994-09-22T00:00:00-04:00",
          "attachments": null,
          "url": "https://www.courtlistener.com/docket/9448269/215/tinsley-v-pierce/",
          "recap_pdf_url": null,
          "pacer_doc_id": null,
          "description": "ORDER by Judge Dean Whipple that the hrg scheduled for 9/30/94 at 9:30 a.m. is cancelled (cc: all counsel) (Kelly McIlvain) (Entered: 09/22/1994)"
        },
        {
          "row_number": 118,
          "id": 2989773,
          "entry_number": "216",
          "date_filed": "1994-09-22T00:00:00-04:00",
          "attachments": null,
          "url": "https://www.courtlistener.com/docket/9448269/216/tinsley-v-pierce/",
          "recap_pdf_url": null,
          "pacer_doc_id": null,
          "description": "ORDER by Judge Dean Whipple that shall serve the function of a contract for TAG as reciever and shall not be construed to create any riths or obligations in any parties other than TAG, HUD and this Court. (cc: all counsel) (Kelly McIlvain) (Entered: 09/23/1994)"
        },
        {
          "row_number": 119,
          "id": 2989774,
          "entry_number": "217",
          "date_filed": "1994-09-28T00:00:00-04:00",
          "attachments": null,
          "url": "https://www.courtlistener.com/docket/9448269/217/tinsley-v-pierce/",
          "recap_pdf_url": null,
          "pacer_doc_id": null,
          "description": "ORDER by Judge Dean Whipple on Findings of Facts as to the Order made on 8/31/94 (cc: all counsel) (Kelly McIlvain) (Entered: 09/28/1994)"
        },
        {
          "row_number": 120,
          "id": 2989775,
          "entry_number": "218",
          "date_filed": "1994-11-03T00:00:00-05:00",
          "attachments": null,
          "url": "https://www.courtlistener.com/docket/9448269/218/tinsley-v-pierce/",
          "recap_pdf_url": null,
          "pacer_doc_id": null,
          "description": "MOTION by plaintiffs for attorney fees & expenses (Court Employee) (Entered: 11/03/1994)"
        },
        {
          "row_number": 121,
          "id": 2989776,
          "entry_number": "219",
          "date_filed": "1994-11-03T00:00:00-05:00",
          "attachments": null,
          "url": "https://www.courtlistener.com/docket/9448269/219/tinsley-v-pierce/",
          "recap_pdf_url": null,
          "pacer_doc_id": null,
          "description": "Suggestions by plaintiff in support of motion for attorney fees & expenses [218-1] (Court Employee) (Entered: 11/03/1994)"
        },
        {
          "row_number": 123,
          "id": 2989777,
          "entry_number": "220",
          "date_filed": "1994-11-15T00:00:00-05:00",
          "attachments": null,
          "url": "https://www.courtlistener.com/docket/9448269/220/tinsley-v-pierce/",
          "recap_pdf_url": null,
          "pacer_doc_id": null,
          "description": "ENTRY OF APPEARANCE on behalf of defendant Housing Authority of by Sallie D. Colaco (Kelly McIlvain) (Entered: 11/16/1994)"
        },
        {
          "row_number": 124,
          "id": 2989778,
          "entry_number": "221",
          "date_filed": "1994-11-15T00:00:00-05:00",
          "attachments": null,
          "url": "https://www.courtlistener.com/docket/9448269/221/tinsley-v-pierce/",
          "recap_pdf_url": null,
          "pacer_doc_id": null,
          "description": "Suggestions by defendant Housing Authority of in opposition to motion for attorney fees & expenses [218-1] (Kelly McIlvain) (Entered: 11/16/1994)"
        },
        {
          "row_number": 125,
          "id": 2989779,
          "entry_number": "222",
          "date_filed": "1994-11-18T00:00:00-05:00",
          "attachments": null,
          "url": "https://www.courtlistener.com/docket/9448269/222/tinsley-v-pierce/",
          "recap_pdf_url": null,
          "pacer_doc_id": null,
          "description": "MOTION by plaintiff to extend time to file rply to dft Housing Authority of Kansas City's sugg in opp to plas' apl for atty fees (Kelly McIlvain) (Entered: 11/21/1994)"
        },
        {
          "row_number": 126,
          "id": 2989780,
          "entry_number": "223",
          "date_filed": "1994-11-21T00:00:00-05:00",
          "attachments": null,
          "url": "https://www.courtlistener.com/docket/9448269/223/tinsley-v-pierce/",
          "recap_pdf_url": null,
          "pacer_doc_id": null,
          "description": "Response by defendant U.S. Dept. of H.U.D. to motion for attorney fees & expenses [218-1] (Kelly McIlvain) (Entered: 11/22/1994)"
        },
        {
          "row_number": 127,
          "id": 2989781,
          "entry_number": "224",
          "date_filed": "1994-11-28T00:00:00-05:00",
          "attachments": null,
          "url": "https://www.courtlistener.com/docket/9448269/224/tinsley-v-pierce/",
          "recap_pdf_url": null,
          "pacer_doc_id": null,
          "description": "ORDER by Judge Dean Whipple granting plas' motion to extend time to 12/9/94 to file rply to dft Housing Authority of Kansas City's sugg in opp to plas' apl for atty fees [222-1] (cc: all counsel) (Court Employee) (Entered: 11/28/1994)"
        },
        {
          "row_number": 128,
          "id": 2989782,
          "entry_number": "225",
          "date_filed": "1994-12-02T00:00:00-05:00",
          "attachments": null,
          "url": "https://www.courtlistener.com/docket/9448269/225/tinsley-v-pierce/",
          "recap_pdf_url": null,
          "pacer_doc_id": null,
          "description": "MOTION by plaintiff to extend time w/n which to file rply to dft HAKC's sugg in opp to plas' application for attys fees and to HUD'S resp to plas' application for attys fees (Kelly McIlvain) (Entered: 12/02/1994)"
        },
        {
          "row_number": 129,
          "id": 2989783,
          "entry_number": "226",
          "date_filed": "1994-12-05T00:00:00-05:00",
          "attachments": null,
          "url": "https://www.courtlistener.com/docket/9448269/226/tinsley-v-pierce/",
          "recap_pdf_url": null,
          "pacer_doc_id": null,
          "description": "MOTION by defendant Housing Authority of to withdraw attorney Sallie D. Colaco and to substitute James F.B. Daniels and the firm of Daniels & Kaplan, P.C. (Kelly McIlvain) (Entered: 12/06/1994)"
        },
        {
          "row_number": 130,
          "id": 2989784,
          "entry_number": "227",
          "date_filed": "1994-12-14T00:00:00-05:00",
          "attachments": null,
          "url": "https://www.courtlistener.com/docket/9448269/227/tinsley-v-pierce/",
          "recap_pdf_url": null,
          "pacer_doc_id": null,
          "description": "ORDER by Judge Dean Whipple granting motion to extend time w/n which to file rply to dft HAKC's sugg in opp to plas' application for attys fees and to HUD'S resp to plas' application for attys fees [225-1] setting resp to motion for attorney fees & expenses to and including 1/15/95 [218-1] (cc: all counsel) (Kelly McIlvain) (Entered: 12/14/1994)"
        },
        {
          "row_number": 132,
          "id": 2989786,
          "entry_number": "229",
          "date_filed": "1995-01-10T00:00:00-05:00",
          "attachments": null,
          "url": "https://www.courtlistener.com/docket/9448269/229/tinsley-v-pierce/",
          "recap_pdf_url": null,
          "pacer_doc_id": null,
          "description": "MOTION by defendant Housing Authority of to withdraw attorney John L. Williams (Kelly McIlvain) (Entered: 01/11/1995)"
        },
        {
          "row_number": 134,
          "id": 2989787,
          "entry_number": "230",
          "date_filed": "1995-01-11T00:00:00-05:00",
          "attachments": null,
          "url": "https://www.courtlistener.com/docket/9448269/230/tinsley-v-pierce/",
          "recap_pdf_url": null,
          "pacer_doc_id": null,
          "description": "MOTION by defendant Housing Authority of for clarification (Kelly McIlvain) (Entered: 01/12/1995)"
        },
        {
          "row_number": 135,
          "id": 2989788,
          "entry_number": "231",
          "date_filed": "1995-01-12T00:00:00-05:00",
          "attachments": null,
          "url": "https://www.courtlistener.com/docket/9448269/231/tinsley-v-pierce/",
          "recap_pdf_url": null,
          "pacer_doc_id": null,
          "description": "MOTION by plaintiff Mary Vann, defendant U.S. Dept. of H.U.D. for approval of settlement agreement and accompanying suggs in support (Court Employee) (Entered: 01/12/1995)"
        },
        {
          "row_number": 136,
          "id": 2989789,
          "entry_number": "232",
          "date_filed": "1995-01-12T00:00:00-05:00",
          "attachments": null,
          "url": "https://www.courtlistener.com/docket/9448269/232/tinsley-v-pierce/",
          "recap_pdf_url": null,
          "pacer_doc_id": null,
          "description": "Reply suggestions by plaintiff to motion for attorney fees & expenses [218-1] (Court Employee) (Entered: 01/12/1995)"
        },
        {
          "row_number": 137,
          "id": 2989790,
          "entry_number": "233",
          "date_filed": "1995-01-12T00:00:00-05:00",
          "attachments": null,
          "url": "https://www.courtlistener.com/docket/9448269/233/tinsley-v-pierce/",
          "recap_pdf_url": null,
          "pacer_doc_id": null,
          "description": "Reply suggestions by plaintiff to motion for attorney fees & expenses [218-1] (Court Employee) (Entered: 01/12/1995)"
        },
        {
          "row_number": 138,
          "id": 2989791,
          "entry_number": "234",
          "date_filed": "1995-01-12T00:00:00-05:00",
          "attachments": null,
          "url": "https://www.courtlistener.com/docket/9448269/234/tinsley-v-pierce/",
          "recap_pdf_url": null,
          "pacer_doc_id": null,
          "description": "CERTIFICATE by plaintiff of service of reply to dft HUD's suggs in oppo to pla's mot for attorney's fees (Court Employee) (Entered: 01/12/1995)"
        },
        {
          "row_number": 139,
          "id": 2989792,
          "entry_number": "235",
          "date_filed": "1995-01-19T00:00:00-05:00",
          "attachments": null,
          "url": "https://www.courtlistener.com/docket/9448269/235/tinsley-v-pierce/",
          "recap_pdf_url": null,
          "pacer_doc_id": null,
          "description": "ORDER by Judge Dean Whipple that plas supply the Court w/counsel's contemporaneous time sheets w/n 15 days of the date of this order (cc: all counsel) (Kelly McIlvain) (Entered: 01/19/1995)"
        },
        {
          "row_number": 140,
          "id": 2989793,
          "entry_number": "236",
          "date_filed": "1995-01-19T00:00:00-05:00",
          "attachments": null,
          "url": "https://www.courtlistener.com/docket/9448269/236/tinsley-v-pierce/",
          "recap_pdf_url": null,
          "pacer_doc_id": null,
          "description": "ORDER by Judge Dean Whipple granting motion to withdraw attorney John L. Williams [229-1] attorney John L. Williams for Housing Authority of (cc: all counsel) (Kelly McIlvain) (Entered: 01/19/1995)"
        },
        {
          "row_number": 141,
          "id": 2989794,
          "entry_number": "237",
          "date_filed": "1995-01-20T00:00:00-05:00",
          "attachments": null,
          "url": "https://www.courtlistener.com/docket/9448269/237/tinsley-v-pierce/",
          "recap_pdf_url": null,
          "pacer_doc_id": null,
          "description": "Response by plaintiff to motion for clarification [230-1] (Kelly McIlvain) (Entered: 01/23/1995)"
        },
        {
          "row_number": 142,
          "id": 2989795,
          "entry_number": "238",
          "date_filed": "1995-01-25T00:00:00-05:00",
          "attachments": null,
          "url": "https://www.courtlistener.com/docket/9448269/238/tinsley-v-pierce/",
          "recap_pdf_url": null,
          "pacer_doc_id": null,
          "description": "MOTION by defendant Housing Authority of for order permitting its genreal counsel, Ms. Sallie Colaco Esq. to act as its counsel in all matters arising in or relating to this case w/supp sugg (Kelly McIlvain) (Entered: 01/25/1995)"
        },
        {
          "row_number": 143,
          "id": 2989796,
          "entry_number": "239",
          "date_filed": "1995-02-01T00:00:00-05:00",
          "attachments": null,
          "url": "https://www.courtlistener.com/docket/9448269/239/tinsley-v-pierce/",
          "recap_pdf_url": null,
          "pacer_doc_id": null,
          "description": "MOTION by interested party Natalia Coe to intervene (Kelly McIlvain) (Entered: 02/01/1995)"
        },
        {
          "row_number": 145,
          "id": 2989797,
          "entry_number": "240",
          "date_filed": "1995-02-01T00:00:00-05:00",
          "attachments": null,
          "url": "https://www.courtlistener.com/docket/9448269/240/tinsley-v-pierce/",
          "recap_pdf_url": null,
          "pacer_doc_id": null,
          "description": "MOTION by interested party Natalia Coe for relief from stay proceedings (Kelly McIlvain) (Entered: 02/01/1995)"
        },
        {
          "row_number": 146,
          "id": 2989798,
          "entry_number": "241",
          "date_filed": "1995-02-01T00:00:00-05:00",
          "attachments": null,
          "url": "https://www.courtlistener.com/docket/9448269/241/tinsley-v-pierce/",
          "recap_pdf_url": null,
          "pacer_doc_id": null,
