{
  "case_id": 17416,
  "fetched_at": "2025-10-22T00:30:31.648880",
  "case_data": {
    "attorney_orgs": [],
    "available_documents": [
      "Trial Court Docket",
      "Complaint (any)",
      "Monetary Relief",
      "Injunctive (or Injunctive-like) Relief"
    ],
    "case_defendants": [
      {
        "defendant_level": null,
        "institution": "",
        "institution_alt_state": null,
        "institution_city": "",
        "institution_county": null,
        "name": "Sullivan Correctional Facility",
        "defendant_level_other": "",
        "is_active": true
      }
    ],
    "case_ongoing": "Yes",
    "case_status": "Approved",
    "case_types": [
      "Prison Conditions",
      "Healthcare Access and Reproductive Issues"
    ],
    "cause_other": "42 U.S.C. 1985, state medical malpractice law",
    "causes": [
      "42 U.S.C. § 1983",
      "State law"
    ],
    "class_action_granted": "Not sought",
    "class_action_sought": "No",
    "closing_year": null,
    "constitutional_clause": [
      {
        "value": "Equal Protection"
      },
      {
        "value": "Cruel and Unusual Punishment"
      }
    ],
    "content_of_injunction": [],
    "court": "Southern District of New York",
    "custom_issues": [],
    "defendant_payment": "$5,000,000",
    "defendant_type": [
      {
        "value": "Corrections"
      }
    ],
    "docket_status": "Complete as of retrieval date",
    "facility_type": [
      {
        "value": "Government-run"
      }
    ],
    "filing_date": "2016-07-20",
    "filing_year": 2016,
    "id": 17416,
    "injunction_duration": "",
    "issues": [
      "General/Misc.: Disciplinary procedures",
      "General/Misc.: Personal injury",
      "General/Misc.: Staff (number, training, qualifications, wages)",
      "General/Misc.: Sanitation / living conditions",
      "Medical/Mental Health Care: Mental health care, general",
      "General/Misc.: Conditions of confinement",
      "Jails, Prisons, Detention Centers, and Other Institutions: Solitary confinement/Supermax (conditions or process)",
      "Discrimination Basis: Race discrimination",
      "Affected Race(s): Black",
      "Disability and Disability Rights: Mental impairment",
      "General/Misc.: Bathing and hygiene",
      "Jails, Prisons, Detention Centers, and Other Institutions: Assault/abuse by staff (facilities)",
      "Jails, Prisons, Detention Centers, and Other Institutions: Assault/abuse by non-staff (facilities)"
    ],
    "last_checked_date": "2020-05-27T00:00:00-04:00",
    "main_docket": {
      "id": 28081,
      "docket_entries": [
        {
          "row_number": 74,
          "id": 2059351,
          "entry_number": "166",
          "date_filed": "2018-06-13T01:00:00-04:00",
          "attachments": [
            {
              "recap_id": 157198221,
              "pacer_url": "https://ecf.nysd.uscourts.gov/doc1/127022636009?caseid=460586",
              "description": "Exhibit 1",
              "attachment_number": 1
            },
            {
              "recap_id": 157198222,
              "pacer_url": "https://ecf.nysd.uscourts.gov/doc1/127022636010?caseid=460586",
              "description": "Exhibit 2",
              "attachment_number": 2
            },
            {
              "recap_id": 157198223,
              "pacer_url": "https://ecf.nysd.uscourts.gov/doc1/127022636011?caseid=460586",
              "description": "Exhibit 3",
              "attachment_number": 3
            },
            {
              "recap_id": 157198224,
              "pacer_url": "https://ecf.nysd.uscourts.gov/doc1/127022636012?caseid=460586",
              "description": "Exhibit 4",
              "attachment_number": 4
            }
          ],
          "url": "https://www.courtlistener.com/docket/4524093/166/ramsay-nobles-v-keyser/",
          "recap_pdf_url": null,
          "pacer_doc_id": "127022636008",
          "description": "LETTER MOTION for Conference to resolve a dispute re: depositions addressed to Magistrate Judge Barbara C. Moses from Adeel A. Mangi dated June 13, 2018. Document filed by Julia Ramsay-Nobles(Individually ). (Attachments: # 1 Exhibit 1, # 2 Exhibit 2, # 3 Exhibit 3, # 4 Exhibit 4)(Mangi, Adeel) (Entered: 06/13/2018)"
        },
        {
          "row_number": 5,
          "id": 2059279,
          "entry_number": "103",
          "date_filed": "2018-03-02T01:00:00-05:00",
          "attachments": [],
          "url": "https://www.courtlistener.com/docket/4524093/103/ramsay-nobles-v-keyser/",
          "recap_pdf_url": null,
          "pacer_doc_id": "127021991897",
          "description": "MEMO ENDORSEMENT on re: 102 Letter, filed by Julia Ramsay-Nobles. ENDORSEMENT: You will seek to add new defendants via a second amended complaint. Assuming I grant the motion, many procedural steps will need to be accomplished-service, analysis of representation by the A.G., the hiring of counsel if the A.G. decides to represent. It is probably not your fault that you have not sought to add new parties until the close of fact discovery, but by doing so you have reset the clock. Can't get around that, I will not allow an open ended extension. The motion for leave to amend will be decided next week. If leave is granted (1) Service must be accomplished on any new defendant by March 30 (2) representation analysis must be completed and a decision made by April 27 (3) any defendant who is not represented by the A.G. must appear by his/her own attorney by May 31 (4) depositions of new defendants must be completed by June 29 (5) any other additional discovery must be completed by July 31 - including expert discovery (6) the State's expert reports are due by May 18 There is no need to abide the new EBTs. ( Deposition due by 6/29/2018., Discovery due by 7/31/2018., Expert Discovery due by 7/31/2018., Service due by 3/30/2018.) (Signed by Judge Colleen McMahon on 3/2/2018) (kgo) (Entered: 03/06/2018)"
        },
        {
          "row_number": 465,
          "id": 2059271,
          "entry_number": "95",
          "date_filed": "2018-02-09T01:00:00-05:00",
          "attachments": [
            {
              "recap_id": 157198256,
              "pacer_url": "https://ecf.nysd.uscourts.gov/doc1/127021848418?caseid=460586",
              "description": "Exhibit A-1",
              "attachment_number": 1
            },
            {
              "recap_id": 157198257,
              "pacer_url": "https://ecf.nysd.uscourts.gov/doc1/127021848419?caseid=460586",
              "description": "Exhibit A-2",
              "attachment_number": 2
            },
            {
              "recap_id": 157198258,
              "pacer_url": "https://ecf.nysd.uscourts.gov/doc1/127021848420?caseid=460586",
              "description": "Exhibit B",
              "attachment_number": 3
            },
            {
              "recap_id": 157198259,
              "pacer_url": "https://ecf.nysd.uscourts.gov/doc1/127021848421?caseid=460586",
              "description": "Exhibit C",
              "attachment_number": 4
            },
            {
              "recap_id": 157198260,
              "pacer_url": "https://ecf.nysd.uscourts.gov/doc1/127021848422?caseid=460586",
              "description": "Exhibit D",
              "attachment_number": 5
            },
            {
              "recap_id": 157198261,
              "pacer_url": "https://ecf.nysd.uscourts.gov/doc1/127021848423?caseid=460586",
              "description": "Exhibit E",
              "attachment_number": 6
            },
            {
              "recap_id": 157198262,
              "pacer_url": "https://ecf.nysd.uscourts.gov/doc1/127021848424?caseid=460586",
              "description": "Exhibit F",
              "attachment_number": 7
            }
          ],
          "url": "https://www.courtlistener.com/docket/4524093/95/ramsay-nobles-v-keyser/",
          "recap_pdf_url": null,
          "pacer_doc_id": "127021848417",
          "description": "DECLARATION of Eugene M. Gelernter in Support re: 93 MOTION for Leave to File Second Amended Complaint .. Document filed by Julia Ramsay-Nobles(as Administratrix of the Estate of Karl Taylor, Deceased), Julia Ramsay-Nobles(Individually ). (Attachments: # 1 Exhibit A-1, # 2 Exhibit A-2, # 3 Exhibit B, # 4 Exhibit C, # 5 Exhibit D, # 6 Exhibit E, # 7 Exhibit F)(Gelernter, Eugene) (Entered: 02/09/2018)"
        },
        {
          "row_number": 101,
          "id": 2059376,
          "entry_number": "190",
          "date_filed": "2018-08-22T01:00:00-04:00",
          "attachments": [
            {
              "recap_id": 157198241,
              "pacer_url": "https://ecf.nysd.uscourts.gov/doc1/127023078167?caseid=460586",
              "description": "Memorandum of Law",
              "attachment_number": 1
            }
          ],
          "url": "https://www.courtlistener.com/docket/4524093/190/ramsay-nobles-v-keyser/",
          "recap_pdf_url": null,
          "pacer_doc_id": "127023078166",
          "description": "FILING ERROR - DEFICIENT DOCKET ENTRY - CROSS MOTION consenting to portion of plaintiff's motion and seeking leave to amend answer to plaintiff's second amended complaint so as to include counterclaim for cross-movants . Document filed by Shane Topel, Bruce Tucker, Steven Witte. (Attachments: # 1 Memorandum of Law)(Orseck, Gerald) Modified on 8/28/2018 (ldi). (Entered: 08/22/2018)"
        },
        {
          "row_number": 287,
          "id": 10235884,
          "entry_number": "358",
          "date_filed": "2019-12-23T00:00:00-05:00",
          "attachments": null,
          "url": "https://www.courtlistener.com/docket/4524093/358/ramsay-nobles-v-keyser/",
          "recap_pdf_url": null,
          "pacer_doc_id": "127026096464",
          "description": "PROPOSED VOIR DIRE QUESTIONS. Document filed by Julia Ramsay-Nobles(Individually ), Julia Ramsay-Nobles(as Administratrix of the Estate of Karl Taylor, Deceased).(Mangi, Adeel) (Entered: 12/23/2019)"
        },
        {
          "row_number": 290,
          "id": 10235886,
          "entry_number": "360",
          "date_filed": "2019-12-24T00:00:00-05:00",
          "attachments": null,
          "url": "https://www.courtlistener.com/docket/4524093/360/ramsay-nobles-v-keyser/",
          "recap_pdf_url": null,
          "pacer_doc_id": "127026098242",
          "description": "MOTION for Writ of Habeas Corpus ad testificandum as to V. Jackson, S. Liggan, S. Lovett, S. Spence & M. Thomas . Document filed by Julia Ramsay-Nobles(Individually ), Julia Ramsay-Nobles(as Administratrix of the Estate of Karl Taylor, Deceased). (Attachments: # 1 Proposed Order & Writ of Habeas Corpus Ad Testificandum - Jackson, # 2 Proposed Order & Writ of Habeas Corpus Ad Testificandum - Liggan, # 3 Proposed Order & Writ of Habeas Corpus Ad Testificandum - Lovett, # 4 Proposed Order & Writ of Habeas Corpus Ad Testificandum - Spence, # 5 Proposed Order & Writ of Habeas Corpus Ad Testificandum - Thomas)(Mangi, Adeel) (Entered: 12/24/2019)"
        },
        {
          "row_number": 291,
          "id": 10235887,
          "entry_number": "361",
          "date_filed": "2019-12-26T00:00:00-05:00",
          "attachments": null,
          "url": "https://www.courtlistener.com/docket/4524093/361/ramsay-nobles-v-keyser/",
          "recap_pdf_url": null,
          "pacer_doc_id": "127026100157",
          "description": "LETTER MOTION for Extension of Time to File Response/Reply as to 359 LETTER MOTION for Extension of Time to File Response/Reply to Motions in Limine addressed to Judge Colleen McMahon from Barbara K. Hathaway dated December 24, 2019. addressed to Judge Colleen McMahon from Kirk O. Orseck dated 12-26-19. Document filed by Timothy Bunch, Joseph Daddezio, Kevin Darling, John Frunzi, Felix Santos, James Steinberg, Jr, Shane Topel, Bruce Tucker, Daniel Walter, Michael Weir, Steven Witte.(Orseck, Kirk) (Entered: 12/26/2019)"
        },
        {
          "row_number": 293,
          "id": 10235889,
          "entry_number": "363",
          "date_filed": "2020-01-07T00:00:00-05:00",
          "attachments": null,
          "url": "https://www.courtlistener.com/docket/4524093/363/ramsay-nobles-v-keyser/",
          "recap_pdf_url": null,
          "pacer_doc_id": "127026148936",
          "description": "MEMORANDUM OF LAW in Opposition re: 349 THIRD MOTION in Limine to Exclude Post-Incident Evidence of or Reference to Corrections Officers' Injuries., 346 SECOND MOTION in Limine to Exclude Evidence of or Reference to the Inmate Witnesses' Criminal Convictions or Prison Disciplinary Records., 351 FOURTH MOTION in Limine to Exclude Evidence of or Reference to Grand Jury Proceedings., 343 FIRST MOTION in Limine to Exclude Evidence of or Reference to Karl Taylor's Criminal Convictions or Prison Disciplinary History., 353 FIFTH MOTION in Limine to Exclude Evidence of and Reference to Factual Findings and Conclusions of Investigative Reports. . Document filed by Timothy Bunch, Joseph Daddezio, Kevin Darling, John Frunzi, Felix Santos, James Steinberg, Jr, Shane Topel, Bruce Tucker, Daniel Walter, Michael Weir, Steven Witte. (Orseck, Kirk) (Entered: 01/07/2020)"
        },
        {
          "row_number": 294,
          "id": 10235890,
          "entry_number": "364",
          "date_filed": "2020-01-07T00:00:00-05:00",
          "attachments": null,
          "url": "https://www.courtlistener.com/docket/4524093/364/ramsay-nobles-v-keyser/",
          "recap_pdf_url": null,
          "pacer_doc_id": "127026151860",
          "description": "MEMORANDUM OF LAW in Opposition re: 349 THIRD MOTION in Limine to Exclude Post-Incident Evidence of or Reference to Corrections Officers' Injuries., 351 FOURTH MOTION in Limine to Exclude Evidence of or Reference to Grand Jury Proceedings., 343 FIRST MOTION in Limine to Exclude Evidence of or Reference to Karl Taylor's Criminal Convictions or Prison Disciplinary History., 353 FIFTH MOTION in Limine to Exclude Evidence of and Reference to Factual Findings and Conclusions of Investigative Reports. . Document filed by Edward Burnett, William Keyser. (Durden, Rebecca) (Entered: 01/07/2020)"
        },
        {
          "row_number": 299,
          "id": 10235895,
          "entry_number": "369",
          "date_filed": "2020-01-10T00:00:00-05:00",
          "attachments": null,
          "url": "https://www.courtlistener.com/docket/4524093/369/ramsay-nobles-v-keyser/",
          "recap_pdf_url": null,
          "pacer_doc_id": "127026177368",
          "description": "MEMO ENDORSEMENT on re: 367 Response to Motion, filed by William Keyser, Edward Burnett. ENDORSEMENT: I agree with Corp Counsel follow the usual procedure. (Signed by Judge Colleen McMahon on 1/10/2020) (mml) (Entered: 01/10/2020)"
        },
        {
          "row_number": 302,
          "id": 10235897,
          "entry_number": "371",
          "date_filed": "2020-01-14T00:00:00-05:00",
          "attachments": null,
          "url": "https://www.courtlistener.com/docket/4524093/371/ramsay-nobles-v-keyser/",
          "recap_pdf_url": null,
          "pacer_doc_id": "127026190978",
          "description": "LETTER addressed to Judge Colleen McMahon from Adeel A. Mangi dated January 13, 2020 re: Proposed Writs of Habeas Corpus ad Testificandum. Document filed by Julia Ramsay-Nobles(Individually ), Julia Ramsay-Nobles(as Administratrix of the Estate of Karl Taylor, Deceased).(Mangi, Adeel) (Entered: 01/14/2020)"
        },
        {
          "row_number": 303,
          "id": 10235898,
          "entry_number": "372",
          "date_filed": "2020-01-14T00:00:00-05:00",
          "attachments": null,
          "url": "https://www.courtlistener.com/docket/4524093/372/ramsay-nobles-v-keyser/",
          "recap_pdf_url": null,
          "pacer_doc_id": "127026191027",
          "description": "PROPOSED WRIT OF HABEAS CORPUS AD TESTIFICANDUM. Document filed by Julia Ramsay-Nobles(Individually ), Julia Ramsay-Nobles(as Administratrix of the Estate of Karl Taylor, Deceased). (Mangi, Adeel) Proposed Writ of Habeas Corpus Ad Testificandum to be reviewed by Clerk's Office staff. (Entered: 01/14/2020)"
        },
        {
          "row_number": 304,
          "id": 10235899,
          "entry_number": "373",
          "date_filed": "2020-01-14T00:00:00-05:00",
          "attachments": null,
          "url": "https://www.courtlistener.com/docket/4524093/373/ramsay-nobles-v-keyser/",
          "recap_pdf_url": null,
          "pacer_doc_id": "127026191042",
          "description": "PROPOSED WRIT OF HABEAS CORPUS AD TESTIFICANDUM. Document filed by Julia Ramsay-Nobles(Individually ), Julia Ramsay-Nobles(as Administratrix of the Estate of Karl Taylor, Deceased). (Mangi, Adeel) Proposed Writ of Habeas Corpus Ad Testificandum to be reviewed by Clerk's Office staff. (Entered: 01/14/2020)"
        },
        {
          "row_number": 305,
          "id": 10235900,
          "entry_number": "374",
          "date_filed": "2020-01-14T00:00:00-05:00",
          "attachments": null,
          "url": "https://www.courtlistener.com/docket/4524093/374/ramsay-nobles-v-keyser/",
          "recap_pdf_url": null,
          "pacer_doc_id": "127026191052",
          "description": "PROPOSED WRIT OF HABEAS CORPUS AD TESTIFICANDUM. Document filed by Julia Ramsay-Nobles(Individually ), Julia Ramsay-Nobles(as Administratrix of the Estate of Karl Taylor, Deceased). (Mangi, Adeel) Proposed Writ of Habeas Corpus Ad Testificandum to be reviewed by Clerk's Office staff. (Entered: 01/14/2020)"
        },
        {
          "row_number": 306,
          "id": 10235901,
          "entry_number": "375",
          "date_filed": "2020-01-14T00:00:00-05:00",
          "attachments": null,
          "url": "https://www.courtlistener.com/docket/4524093/375/ramsay-nobles-v-keyser/",
          "recap_pdf_url": null,
          "pacer_doc_id": "127026191267",
          "description": "PROPOSED WRIT OF HABEAS CORPUS AD TESTIFICANDUM. Document filed by Julia Ramsay-Nobles(Individually ), Julia Ramsay-Nobles(as Administratrix of the Estate of Karl Taylor, Deceased). (Mangi, Adeel) Proposed Writ of Habeas Corpus Ad Testificandum to be reviewed by Clerk's Office staff. (Entered: 01/14/2020)"
        },
        {
          "row_number": 307,
          "id": 10235902,
          "entry_number": "376",
          "date_filed": "2020-01-14T00:00:00-05:00",
          "attachments": null,
          "url": "https://www.courtlistener.com/docket/4524093/376/ramsay-nobles-v-keyser/",
          "recap_pdf_url": null,
          "pacer_doc_id": "127026191285",
          "description": "PROPOSED WRIT OF HABEAS CORPUS AD TESTIFICANDUM. Document filed by Julia Ramsay-Nobles(Individually ), Julia Ramsay-Nobles(as Administratrix of the Estate of Karl Taylor, Deceased). (Mangi, Adeel) Proposed Writ of Habeas Corpus Ad Testificandum to be reviewed by Clerk's Office staff. (Entered: 01/14/2020)"
        },
        {
          "row_number": 308,
          "id": 10235903,
          "entry_number": "377",
          "date_filed": "2020-01-14T00:00:00-05:00",
          "attachments": null,
          "url": "https://www.courtlistener.com/docket/4524093/377/ramsay-nobles-v-keyser/",
          "recap_pdf_url": null,
          "pacer_doc_id": "127026191302",
          "description": "PROPOSED WRIT OF HABEAS CORPUS AD TESTIFICANDUM. Document filed by Julia Ramsay-Nobles(Individually ), Julia Ramsay-Nobles(as Administratrix of the Estate of Karl Taylor, Deceased). (Mangi, Adeel) Proposed Writ of Habeas Corpus Ad Testificandum to be reviewed by Clerk's Office staff. (Entered: 01/14/2020)"
        },
        {
          "row_number": 324,
          "id": 10235913,
          "entry_number": "391",
          "date_filed": "2020-02-05T00:00:00-05:00",
          "attachments": null,
          "url": "https://www.courtlistener.com/docket/4524093/391/ramsay-nobles-v-keyser/",
          "recap_pdf_url": null,
          "pacer_doc_id": "127026327440",
          "description": "BRIEF - Plaintiff's Bench Memorandum on Supervisor Defendants' Objections to Plaintiff's Deposition Designations for Jeffrey Hunt. Document filed by Julia Ramsay-Nobles(Individually ), Julia Ramsay-Nobles(as Administratrix of the Estate of Karl Taylor, Deceased). (Attachments: # 1 Exhibit A - Objections and Counterdesignations, # 2 Exhibit B - Hunt Designations).(Mangi, Adeel) (Entered: 02/05/2020)"
        },
        {
          "row_number": 309,
          "id": 10235904,
          "entry_number": "378",
          "date_filed": "2020-01-15T00:00:00-05:00",
          "attachments": null,
          "url": "https://www.courtlistener.com/docket/4524093/378/ramsay-nobles-v-keyser/",
          "recap_pdf_url": null,
          "pacer_doc_id": "127026204337",
          "description": "Writ of Habeas Corpus ad Testificandum Issued as to Malik Thomas for February 10, 2020. (Signed by Judge Colleen McMahon on 01/15/2020) (dt) Picked up by Patterson Belknap Webb & Tyler LLP January 16, 2020. Modified on 1/16/2020 (dt). (Entered: 01/15/2020)"
        },
        {
          "row_number": 314,
          "id": 10235908,
          "entry_number": "382",
          "date_filed": "2020-01-15T00:00:00-05:00",
          "attachments": null,
          "url": "https://www.courtlistener.com/docket/4524093/382/ramsay-nobles-v-keyser/",
          "recap_pdf_url": null,
          "pacer_doc_id": "127026204517",
          "description": "Writ of Habeas Corpus ad Testificandum Issued as to Silburn Spence for February 10, 2020. (Signed by Judge Colleen McMahon on 01/15/2020). Picked up by Patterson Belknap Webb & Tyler LLP January 16, 2020. (dt) Modified on 1/16/2020 (dt). (Entered: 01/15/2020)"
        },
        {
          "row_number": 315,
          "id": 10235909,
          "entry_number": "383",
          "date_filed": "2020-01-15T00:00:00-05:00",
          "attachments": null,
          "url": "https://www.courtlistener.com/docket/4524093/383/ramsay-nobles-v-keyser/",
          "recap_pdf_url": null,
          "pacer_doc_id": "127026204567",
          "description": "Vacated as per Judge's Order dated 1/28/2020, Doc. # 385 Writ of Habeas Corpus ad Testificandum Issued as to Stacy Liggan for February 11, 2020. (Signed by Judge Colleen McMahon on 01/15/2020). Picked up by Patterson Belknap Webb & Tyler LLP January 16, 2020. (dt) Modified on 1/16/2020 (dt). Modified on 1/28/2020 (mml). (Entered: 01/15/2020)"
        },
        {
          "row_number": 321,
          "id": 10235911,
          "entry_number": "389",
          "date_filed": "2020-02-04T00:00:00-05:00",
          "attachments": null,
          "url": "https://www.courtlistener.com/docket/4524093/389/ramsay-nobles-v-keyser/",
          "recap_pdf_url": null,
          "pacer_doc_id": "127026323445",
          "description": "LETTER addressed to Judge Colleen McMahon from Kirk O. Orseck dated 02-04-2020 re: Proffer. Document filed by Timothy Bunch, Joseph Daddezio, Kevin Darling, John Frunzi, Felix Santos, James Steinberg, Jr, Shane Topel, Bruce Tucker, Daniel Walter, Michael Weir, Steven Witte..(Orseck, Kirk) (Entered: 02/04/2020)"
        },
        {
          "row_number": 323,
          "id": 10235912,
          "entry_number": "390",
          "date_filed": "2020-02-05T00:00:00-05:00",
          "attachments": null,
          "url": "https://www.courtlistener.com/docket/4524093/390/ramsay-nobles-v-keyser/",
          "recap_pdf_url": null,
          "pacer_doc_id": "127026326486",
          "description": "PRETRIAL MEMORANDUM. Document filed by Julia Ramsay-Nobles(Individually ), Julia Ramsay-Nobles(as Administratrix of the Estate of Karl Taylor, Deceased). (Attachments: # 1 Exhibit A - Bardey Expert Report, # 2 Exhibit B - Bardey Deposition Transcript).(Mangi, Adeel) (Entered: 02/05/2020)"
        },
        {
          "row_number": 222,
          "id": 2059165,
          "entry_number": "3",
          "date_filed": "2016-07-20T01:00:00-04:00",
          "attachments": [],
          "url": "https://www.courtlistener.com/docket/4524093/3/ramsay-nobles-v-keyser/",
          "recap_pdf_url": null,
          "pacer_doc_id": "127018559888",
          "description": "REQUEST FOR ISSUANCE OF SUMMONS as to William Keyser, re: 1 Complaint,. Document filed by Julia Ramsay-Nobles. (Gelernter, Eugene) (Entered: 07/20/2016)"
        },
        {
          "row_number": 333,
          "id": 2059166,
          "entry_number": "4",
          "date_filed": "2016-07-20T01:00:00-04:00",
          "attachments": [],
          "url": "https://www.courtlistener.com/docket/4524093/4/ramsay-nobles-v-keyser/",
          "recap_pdf_url": null,
          "pacer_doc_id": "127018559906",
          "description": "REQUEST FOR ISSUANCE OF SUMMONS as to Edward Burnett, re: 1 Complaint,. Document filed by Julia Ramsay-Nobles. (Gelernter, Eugene) (Entered: 07/20/2016)"
        },
        {
          "row_number": 415,
          "id": 2059167,
          "entry_number": "5",
          "date_filed": "2016-07-20T01:00:00-04:00",
          "attachments": [],
          "url": "https://www.courtlistener.com/docket/4524093/5/ramsay-nobles-v-keyser/",
          "recap_pdf_url": null,
          "pacer_doc_id": "127018559933",
          "description": "REQUEST FOR ISSUANCE OF SUMMONS as to Shane Topel, re: 1 Complaint,. Document filed by Julia Ramsay-Nobles. (Gelernter, Eugene) (Entered: 07/20/2016)"
        },
        {
          "row_number": 426,
          "id": 2059168,
          "entry_number": "6",
          "date_filed": "2016-07-20T01:00:00-04:00",
          "attachments": [],
          "url": "https://www.courtlistener.com/docket/4524093/6/ramsay-nobles-v-keyser/",
          "recap_pdf_url": null,
          "pacer_doc_id": "127018559942",
          "description": "REQUEST FOR ISSUANCE OF SUMMONS as to Bruce Tucker, re: 1 Complaint,. Document filed by Julia Ramsay-Nobles. (Gelernter, Eugene) (Entered: 07/20/2016)"
        },
        {
          "row_number": 437,
          "id": 2059169,
          "entry_number": "7",
          "date_filed": "2016-07-20T01:00:00-04:00",
          "attachments": [],
          "url": "https://www.courtlistener.com/docket/4524093/7/ramsay-nobles-v-keyser/",
          "recap_pdf_url": null,
          "pacer_doc_id": "127018559945",
          "description": "REQUEST FOR ISSUANCE OF SUMMONS as to Steven Witte, re: 1 Complaint,. Document filed by Julia Ramsay-Nobles. (Gelernter, Eugene) (Entered: 07/20/2016)"
        },
        {
          "row_number": 470,
          "id": 2059170,
          "entry_number": null,
          "date_filed": "2016-07-21T01:00:00-04:00",
          "attachments": [],
          "url": "https://www.courtlistener.com",
          "recap_pdf_url": null,
          "pacer_doc_id": null,
          "description": "***NOTICE TO ATTORNEY REGARDING DEFICIENT PLEADING. Notice to Attorney Eugene Martin Gelernter to RE-FILE re: Document No. 1 Complaint,. The filing is deficient for the following reason(s): all of the parties listed on the pleading were not entered on CM ECF; Plaintiff has to be added again, in the party text insert as Administratrix of the Estate of Karl Taylor, Deceased. Docket the event type Add Party to Pleading found under the event list Complaints and Other Initiating Documents.. Re-file the pleading using the event type Complaint found under the event list Complaints and Other Initiating Documents - attach the correct signed PDF - select the individually named filer/filers - select the individually named party/parties the pleading is against. (dgo)"
        },
        {
          "row_number": 474,
          "id": 2059172,
          "entry_number": null,
          "date_filed": "2016-07-21T01:00:00-04:00",
          "attachments": [],
          "url": "https://www.courtlistener.com",
          "recap_pdf_url": null,
          "pacer_doc_id": null,
          "description": "Magistrate Judge Barbara C. Moses is so designated. (dgo)"
        },
        {
          "row_number": 475,
          "id": 2059173,
          "entry_number": null,
          "date_filed": "2016-07-21T01:00:00-04:00",
          "attachments": [],
          "url": "https://www.courtlistener.com",
          "recap_pdf_url": null,
          "pacer_doc_id": null,
          "description": "Case Designated ECF. (dgo)"
        },
        {
          "row_number": 448,
          "id": 2059174,
          "entry_number": "8",
          "date_filed": "2016-07-21T01:00:00-04:00",
          "attachments": [],
          "url": "https://www.courtlistener.com/docket/4524093/8/ramsay-nobles-v-keyser/",
          "recap_pdf_url": null,
          "pacer_doc_id": "127018567160",
          "description": "ELECTRONIC SUMMONS ISSUED as to William Keyser. (dgo) (Entered: 07/21/2016)"
        },
        {
          "row_number": 459,
          "id": 2059175,
          "entry_number": "9",
          "date_filed": "2016-07-21T01:00:00-04:00",
          "attachments": [],
          "url": "https://www.courtlistener.com/docket/4524093/9/ramsay-nobles-v-keyser/",
          "recap_pdf_url": null,
          "pacer_doc_id": "127018567186",
          "description": "ELECTRONIC SUMMONS ISSUED as to Edward Burnett. (dgo) (Entered: 07/21/2016)"
        },
        {
          "row_number": 12,
          "id": 2059177,
          "entry_number": "11",
          "date_filed": "2016-07-21T01:00:00-04:00",
          "attachments": [],
          "url": "https://www.courtlistener.com/docket/4524093/11/ramsay-nobles-v-keyser/",
          "recap_pdf_url": null,
          "pacer_doc_id": "127018567214",
          "description": "ELECTRONIC SUMMONS ISSUED as to Bruce Tucker. (dgo) (Entered: 07/21/2016)"
        },
        {
          "row_number": 476,
          "id": 2059179,
          "entry_number": null,
          "date_filed": "2016-07-21T01:00:00-04:00",
          "attachments": [],
          "url": "https://www.courtlistener.com",
          "recap_pdf_url": null,
          "pacer_doc_id": null,
          "description": "ADD PARTY FOR PLEADING. Plaintiffs/Petitioners Julia Ramsay-Nobles, Julia Ramsay-Nobles added. Party added pursuant to 1 Complaint,. Document filed by Julia Ramsay-Nobles, Julia Ramsay-Nobles. Related document: 1 Complaint, filed by Julia Ramsay-Nobles.(Gelernter, Eugene)"
        },
        {
          "row_number": 34,
          "id": 2059180,
          "entry_number": "13",
          "date_filed": "2016-07-21T01:00:00-04:00",
          "attachments": [],
          "url": "https://www.courtlistener.com/docket/4524093/13/ramsay-nobles-v-keyser/",
          "recap_pdf_url": null,
          "pacer_doc_id": "127018568708",
          "description": "NOTICE OF APPEARANCE OF PRO BONO COUNSEL by Eugene Martin Gelernter on behalf of Julia Ramsay-Nobles(as Administratrix of the Estate of Karl Taylor, Deceased), Julia Ramsay-Nobles(Individually ) (Gelernter, Eugene) (Entered: 07/21/2016)"
        },
        {
          "row_number": 56,
          "id": 2059182,
          "entry_number": "15",
          "date_filed": "2016-07-21T01:00:00-04:00",
          "attachments": [],
          "url": "https://www.courtlistener.com/docket/4524093/15/ramsay-nobles-v-keyser/",
          "recap_pdf_url": null,
          "pacer_doc_id": "127018568792",
          "description": "NOTICE OF APPEARANCE OF PRO BONO COUNSEL by Daniel Eisenberg on behalf of Julia Ramsay-Nobles(as Administratrix of the Estate of Karl Taylor, Deceased), Julia Ramsay-Nobles(Individually ) (Eisenberg, Daniel) (Entered: 07/21/2016)"
        },
        {
          "row_number": 67,
          "id": 2059183,
          "entry_number": "16",
          "date_filed": "2016-08-02T01:00:00-04:00",
          "attachments": [],
          "url": "https://www.courtlistener.com/docket/4524093/16/ramsay-nobles-v-keyser/",
          "recap_pdf_url": null,
          "pacer_doc_id": "127018631468",
          "description": "ORDER SCHEDULING AN INITIAL PRETRIAL CONFERENCE: Initial Conference set for 8/12/2016 at 10:30 AM in Courtroom 24A, 500 Pearl Street, New York, NY 10007 before Judge Colleen McMahon. (Signed by Judge Colleen McMahon on 8/2/2016) (kgo) (Entered: 08/02/2016)"
        },
        {
          "row_number": 78,
          "id": 2059184,
          "entry_number": "17",
          "date_filed": "2016-08-04T01:00:00-04:00",
          "attachments": [],
          "url": "https://www.courtlistener.com/docket/4524093/17/ramsay-nobles-v-keyser/",
          "recap_pdf_url": null,
          "pacer_doc_id": "127018643297",
          "description": "LETTER MOTION to Adjourn Conference addressed to Judge Colleen McMahon from Adeel A. Mangi dated August 4, 2016. Document filed by Julia Ramsay-Nobles(as Administratrix of the Estate of Karl Taylor, Deceased).(Mangi, Adeel) (Entered: 08/04/2016)"
        },
        {
          "row_number": 89,
          "id": 2059185,
          "entry_number": "18",
          "date_filed": "2016-08-05T01:00:00-04:00",
          "attachments": [],
          "url": "https://www.courtlistener.com/docket/4524093/18/ramsay-nobles-v-keyser/",
          "recap_pdf_url": null,
          "pacer_doc_id": "127018650447",
          "description": "ORDER granting 17 Letter Motion to Adjourn Conference. Rescheduled to September 23, 2016 @ 11:15 am. Initial Conference set for 9/23/2016 at 11:15 AM before Judge Colleen McMahon. (Signed by Judge Colleen McMahon on 8/4/2016) (kgo) (Entered: 08/05/2016)"
        },
        {
          "row_number": 100,
          "id": 2059186,
          "entry_number": "19",
          "date_filed": "2016-09-01T01:00:00-04:00",
          "attachments": [],
          "url": "https://www.courtlistener.com/docket/4524093/19/ramsay-nobles-v-keyser/",
          "recap_pdf_url": null,
          "pacer_doc_id": "127018799518",
          "description": "NOTICE OF APPEARANCE by Rebecca Ann Durden on behalf of Edward Burnett, William Keyser, Shane Topel. (Durden, Rebecca) (Entered: 09/01/2016)"
        },
        {
          "row_number": 112,
          "id": 2059187,
          "entry_number": "20",
          "date_filed": "2016-09-01T01:00:00-04:00",
          "attachments": [],
          "url": "https://www.courtlistener.com/docket/4524093/20/ramsay-nobles-v-keyser/",
          "recap_pdf_url": null,
          "pacer_doc_id": "127018799534",
          "description": "LETTER MOTION for Extension of Time on behalf of Superintendent Keyser to respond to the complaint addressed to Judge Colleen McMahon from Rebecca Ann Durden dated September 1, 2016. Document filed by Edward Burnett, William Keyser, Shane Topel.(Durden, Rebecca) (Entered: 09/01/2016)"
        },
        {
          "row_number": 123,
          "id": 2059188,
          "entry_number": "21",
          "date_filed": "2016-09-12T01:00:00-04:00",
          "attachments": [],
          "url": "https://www.courtlistener.com/docket/4524093/21/ramsay-nobles-v-keyser/",
          "recap_pdf_url": null,
          "pacer_doc_id": "127018850488",
          "description": "ORDER granting 20 Letter Motion for Extension of Time. OK - response due October 31, 2016. (Signed by Judge Colleen McMahon on 9/12/2016) (kgo) (Entered: 09/12/2016)"
        },
        {
          "row_number": 134,
          "id": 2059190,
          "entry_number": "22",
          "date_filed": "2016-09-20T01:00:00-04:00",
          "attachments": [],
          "url": "https://www.courtlistener.com/docket/4524093/22/ramsay-nobles-v-keyser/",
          "recap_pdf_url": null,
          "pacer_doc_id": "127018896670",
          "description": "WAIVER OF SERVICE RETURNED EXECUTED. Edward Burnett waiver sent on 8/31/2016, answer due 10/31/2016. Document filed by Edward Burnett. (Durden, Rebecca) (Entered: 09/20/2016)"
        },
        {
          "row_number": 145,
          "id": 2059191,
          "entry_number": "23",
          "date_filed": "2016-09-20T01:00:00-04:00",
          "attachments": [],
          "url": "https://www.courtlistener.com/docket/4524093/23/ramsay-nobles-v-keyser/",
          "recap_pdf_url": null,
          "pacer_doc_id": "127018896679",
          "description": "WAIVER OF SERVICE RETURNED EXECUTED. Shane Topel waiver sent on 8/31/2016, answer due 10/31/2016. Document filed by Shane Topel. (Durden, Rebecca) (Entered: 09/20/2016)"
        },
        {
          "row_number": 156,
          "id": 2059192,
          "entry_number": "24",
          "date_filed": "2016-09-20T01:00:00-04:00",
          "attachments": [],
          "url": "https://www.courtlistener.com/docket/4524093/24/ramsay-nobles-v-keyser/",
          "recap_pdf_url": null,
          "pacer_doc_id": "127018896693",
          "description": "WAIVER OF SERVICE RETURNED EXECUTED. Steven Witte waiver sent on 8/31/2016, answer due 10/31/2016. Document filed by Steven Witte. (Durden, Rebecca) (Entered: 09/20/2016)"
        },
        {
          "row_number": 167,
          "id": 2059193,
          "entry_number": "25",
          "date_filed": "2016-09-20T01:00:00-04:00",
          "attachments": [],
          "url": "https://www.courtlistener.com/docket/4524093/25/ramsay-nobles-v-keyser/",
          "recap_pdf_url": null,
          "pacer_doc_id": "127018896699",
          "description": "WAIVER OF SERVICE RETURNED EXECUTED. Bruce Tucker waiver sent on 8/31/2016, answer due 10/31/2016. Document filed by Bruce Tucker. (Durden, Rebecca) (Entered: 09/20/2016)"
        },
        {
          "row_number": 178,
          "id": 2059194,
          "entry_number": "26",
          "date_filed": "2016-09-20T01:00:00-04:00",
          "attachments": [],
          "url": "https://www.courtlistener.com/docket/4524093/26/ramsay-nobles-v-keyser/",
          "recap_pdf_url": null,
          "pacer_doc_id": "127018897475",
          "description": "RULE 26(f) DISCOVERY PLAN REPORT.Document filed by Julia Ramsay-Nobles(as Administratrix of the Estate of Karl Taylor, Deceased), Julia Ramsay-Nobles(Individually ).(Gelernter, Eugene) (Entered: 09/20/2016)"
        },
        {
          "row_number": 189,
          "id": 2059195,
          "entry_number": "27",
          "date_filed": "2016-09-21T01:00:00-04:00",
          "attachments": [],
          "url": "https://www.courtlistener.com/docket/4524093/27/ramsay-nobles-v-keyser/",
          "recap_pdf_url": null,
          "pacer_doc_id": "127018904814",
          "description": "CIVIL CASE MANAGEMENT PLAN: This case is to be tried to a jury. Discovery due by 11/11/2016. Amended Pleadings due by 3/10/2017. Joinder of Parties due by 3/10/2017. Deposition due by 12/2/2016. Expert Discovery due by 10/27/2017. In fact, this schedule is so generous that it will NOT be extended. So do not waste your time - you have 13 months to do discovery - get moving! (Signed by Judge Colleen McMahon on 9/21/2016) (cla) (Entered: 09/21/2016)"
        },
        {
          "row_number": 200,
          "id": 2059196,
          "entry_number": "28",
          "date_filed": "2016-09-21T01:00:00-04:00",
          "attachments": [],
          "url": "https://www.courtlistener.com/docket/4524093/28/ramsay-nobles-v-keyser/",
          "recap_pdf_url": null,
          "pacer_doc_id": "127018904859",
          "description": "MEMO ENDORSEMENT on re: 26 Rule 26(f) Discovery Plan Report filed by Julia Ramsay-Nobles. ENDORSEMENT: Conference on 9/23/16 is cancelled. (Signed by Judge Colleen McMahon on 9/21/2016) (cla) (Entered: 09/21/2016)"
        },
        {
          "row_number": 211,
          "id": 2059197,
          "entry_number": "29",
          "date_filed": "2016-10-25T01:00:00-04:00",
          "attachments": [],
          "url": "https://www.courtlistener.com/docket/4524093/29/ramsay-nobles-v-keyser/",
          "recap_pdf_url": null,
          "pacer_doc_id": "127019101915",
          "description": "NOTICE OF APPEARANCE by Kristen Rose Vogel on behalf of Edward Burnett, William Keyser, Shane Topel, Bruce Tucker, Steven Witte. (Vogel, Kristen) (Entered: 10/25/2016)"
        },
        {
          "row_number": 223,
          "id": 2059198,
          "entry_number": "30",
          "date_filed": "2016-10-31T01:00:00-04:00",
          "attachments": [],
          "url": "https://www.courtlistener.com/docket/4524093/30/ramsay-nobles-v-keyser/",
          "recap_pdf_url": null,
          "pacer_doc_id": "127019133429",
          "description": "ANSWER to 1 Complaint, with JURY DEMAND. Document filed by Edward Burnett, William Keyser, Shane Topel, Bruce Tucker, Steven Witte.(Durden, Rebecca) (Entered: 10/31/2016)"
        },
        {
          "row_number": 234,
          "id": 2059199,
          "entry_number": "31",
          "date_filed": "2016-11-03T01:00:00-04:00",
          "attachments": [],
          "url": "https://www.courtlistener.com/docket/4524093/31/ramsay-nobles-v-keyser/",
          "recap_pdf_url": null,
          "pacer_doc_id": "127019156138",
          "description": "STIPULATED ORDER GOVERNING ELECTRONIC DISCOVERY: Prior to the scheduled Rule 16 conference date, the parties shall exchange the following information (as further set out in the order). (Signed by Judge Colleen McMahon on 11/1/2016) (cla) (Entered: 11/03/2016)"
        },
        {
          "row_number": 245,
          "id": 2059200,
          "entry_number": "32",
          "date_filed": "2016-11-09T01:00:00-05:00",
          "attachments": [],
          "url": "https://www.courtlistener.com/docket/4524093/32/ramsay-nobles-v-keyser/",
          "recap_pdf_url": null,
          "pacer_doc_id": "127019189385",
          "description": "STIPULATION OF CONFIDENTIALITY AND PROTECTIVE ORDER...regarding procedures to be followed that shall govern the handling of confidential material... (Signed by Judge Colleen McMahon on 11/7/2016) (kgo) (Entered: 11/09/2016)"
        },
        {
          "row_number": 256,
          "id": 2059201,
          "entry_number": "33",
          "date_filed": "2016-12-08T01:00:00-05:00",
          "attachments": [
            {
              "recap_id": 157198202,
              "pacer_url": "https://ecf.nysd.uscourts.gov/doc1/127019352743?caseid=460586",
              "description": "Exhibit 1, Subpoena to Commission",
              "attachment_number": 1
            },
            {
              "recap_id": 157198203,
              "pacer_url": "https://ecf.nysd.uscourts.gov/doc1/127019352744?caseid=460586",
              "description": "Text of Proposed Order",
              "attachment_number": 2
            }
          ],
          "url": "https://www.courtlistener.com/docket/4524093/33/ramsay-nobles-v-keyser/",
          "recap_pdf_url": null,
          "pacer_doc_id": "127019352742",
          "description": "LETTER addressed to Judge Colleen McMahon from Adeel A. Mangi dated December 8, 2016 re: the proposed release of third-party responsive documents to the Parties. Document filed by Julia Ramsay-Nobles(as Administratrix of the Estate of Karl Taylor, Deceased). (Attachments: # 1 Exhibit 1, Subpoena to Commission, # 2 Text of Proposed Order)(Mangi, Adeel) (Entered: 12/08/2016)"
        },
        {
          "row_number": 267,
          "id": 2059202,
          "entry_number": "34",
          "date_filed": "2016-12-12T01:00:00-05:00",
          "attachments": [],
          "url": "https://www.courtlistener.com/docket/4524093/34/ramsay-nobles-v-keyser/",
          "recap_pdf_url": null,
          "pacer_doc_id": "127019368289",
          "description": "ORDER REFERRING CASE TO MAGISTRATE JUDGE. Order that case be referred to the Clerk of Court for assignment to a Magistrate Judge for General Pretrial (includes scheduling, discovery, non-dispositive pretrial motions, and settlement). Referred to Magistrate Judge Barbara C. Moses. (Signed by Judge Colleen McMahon on 12/12/2016) (kgo) (Entered: 12/12/2016)"
        },
        {
          "row_number": 278,
          "id": 2059203,
          "entry_number": "35",
          "date_filed": "2016-12-12T01:00:00-05:00",
          "attachments": [],
          "url": "https://www.courtlistener.com/docket/4524093/35/ramsay-nobles-v-keyser/",
          "recap_pdf_url": null,
          "pacer_doc_id": "127019369008",
          "description": "MEMO ENDORSEMENT on re: 33 Letter, filed by Julia Ramsay-Nobles. ENDORSEMENT: Telephone Conference is scheduled for tomorrow 12/13/16 @ 2:30 pm. Plaintiff's counsel to initiate call to Chambers with opposing counsel on the phone. ( Telephone Conference set for 12/13/2016 at 02:30 PM before Judge Colleen McMahon.) (Signed by Judge Colleen McMahon on 12/12/2016) (kgo) (Entered: 12/12/2016)"
        },
        {
          "row_number": 478,
          "id": 2059204,
          "entry_number": null,
          "date_filed": "2016-12-13T01:00:00-05:00",
          "attachments": [],
          "url": "https://www.courtlistener.com",
          "recap_pdf_url": null,
          "pacer_doc_id": null,
          "description": "Minute Entry for proceedings held before Judge Colleen McMahon: Telephone Conference held on 12/13/2016. Decision: Conference held. The Court will enter the unopposed Proposed Order.Submitted By: Jeremy R. Girton. (mde)"
        },
        {
          "row_number": 289,
          "id": 2059205,
          "entry_number": "36",
          "date_filed": "2016-12-13T00:00:00-05:00",
          "attachments": [],
          "url": "https://www.courtlistener.com/docket/4524093/36/ramsay-nobles-v-keyser/",
          "recap_pdf_url": null,
          "pacer_doc_id": "127019382712",
          "description": "ORDER REGARDING DISCLOSURE OF DOCUMENTS FROM THE NEW YORK STATE COMMISSION OF CORRECTION: IT IS HEREBY ORDERED, pursuant to N.Y. Mental Hygiene Law ยง 33.13(c)(1), that: 1. The New York State Commission of Correction's disclosure of documents responsive to Plaintiff's subpoena, dated November 15, 2016 and attached as Exhibit 1 to this Order, is in the interest of justice and significantly outweighs the need for confidentiality. 2. The New York State Commission of Correction should disclose these documents to the Parties under the Stipulation of Confidentiality and Protective Order (Dkt. No. 32) with a confidentiality designation of \"Highly Confidential - Attorneys' Eyes Only.\" (Signed by Judge Colleen McMahon on 12/13/2016) (kgo) (Entered: 12/13/2016)"
        },
        {
          "row_number": 300,
          "id": 2059206,
          "entry_number": "37",
          "date_filed": "2016-12-14T00:00:00-05:00",
          "attachments": [],
          "url": "https://www.courtlistener.com/docket/4524093/37/ramsay-nobles-v-keyser/",
          "recap_pdf_url": null,
          "pacer_doc_id": "127019393104",
          "description": "ORDER REGARDING GENERAL PRETRIAL MANAGEMENT: The above-referenced action has been referred to Magistrate Judge Barbara Moses for general pretrial management, including scheduling, discovery, non-dispositive pretrial motions,and settlement, pursuant to 28 U.S.C. ยง 636(b)(1)(A). All discovery must be initiated in time to be concluded by the close of discovery set by the Court. And as set forth herein. SO ORDERED. (Signed by Magistrate Judge Barbara C. Moses on 12/14/2016) (ama) (Entered: 12/15/2016)"
        },
        {
          "row_number": 311,
          "id": 2059207,
          "entry_number": "38",
          "date_filed": "2017-02-10T01:00:00-05:00",
          "attachments": [],
          "url": "https://www.courtlistener.com/docket/4524093/38/ramsay-nobles-v-keyser/",
          "recap_pdf_url": null,
          "pacer_doc_id": "127019708627",
          "description": "LETTER MOTION for Discovery addressed to Magistrate Judge Barbara C. Moses from Adeel Mangi dated February 10, 2017. Document filed by Julia Ramsay-Nobles(as Administratrix of the Estate of Karl Taylor, Deceased).(Mangi, Adeel) (Entered: 02/10/2017)"
        },
        {
          "row_number": 322,
          "id": 2059208,
          "entry_number": "39",
          "date_filed": "2017-02-13T01:00:00-05:00",
          "attachments": [],
          "url": "https://www.courtlistener.com/docket/4524093/39/ramsay-nobles-v-keyser/",
          "recap_pdf_url": null,
          "pacer_doc_id": "127019721060",
          "description": "ORDER REGARDING DISCLOSURE OF DOCUMENTS FROM THE DIVISION OF STATE POLICE granting 38 Letter Motion for Discovery. IT IS HEREBY ORDERED that the State Police shall produce all documents responsive to Plaintiff's subpoena to the State Police which was dated November 11, 2016 and is attached as Exhibit 1 to this Order. (As further set forth in this Order.) (Signed by Magistrate Judge Barbara C. Moses on 2/13/2017) (cf) (Entered: 02/13/2017)"
        },
        {
          "row_number": 334,
          "id": 2059209,
          "entry_number": "40",
          "date_filed": "2017-02-27T01:00:00-05:00",
          "attachments": [],
          "url": "https://www.courtlistener.com/docket/4524093/40/ramsay-nobles-v-keyser/",
          "recap_pdf_url": null,
          "pacer_doc_id": "127019804412",
          "description": "LETTER MOTION for Discovery addressed to Magistrate Judge Barbara C. Moses from Adeel Mangi dated February 27, 2017. Document filed by Julia Ramsay-Nobles(as Administratrix of the Estate of Karl Taylor, Deceased).(Mangi, Adeel) (Entered: 02/27/2017)"
        },
        {
          "row_number": 356,
          "id": 2059211,
          "entry_number": "42",
          "date_filed": "2017-03-08T01:00:00-05:00",
          "attachments": [],
          "url": "https://www.courtlistener.com/docket/4524093/42/ramsay-nobles-v-keyser/",
          "recap_pdf_url": null,
          "pacer_doc_id": "127019862579",
          "description": "STIPULATION EXTENDING TIME TO AMEND PLEADINGS OR JOIN PARTIES: IT IS HEREBY stipulated by the Parties, subject to the approval of the Court, that the deadline to amend pleadings or join additional parties is extended from March 10, 2017 to April 19, 2017. (As further set forth in this Order.) (Amended Pleadings due by 4/19/2017., Joinder of Parties due by 4/19/2017.) (Signed by Magistrate Judge Barbara C. Moses on 3/7/2017) (cf) (Entered: 03/08/2017)"
        },
        {
          "row_number": 367,
          "id": 2059212,
          "entry_number": "43",
          "date_filed": "2017-04-14T01:00:00-04:00",
          "attachments": [],
          "url": "https://www.courtlistener.com/docket/4524093/43/ramsay-nobles-v-keyser/",
          "recap_pdf_url": null,
          "pacer_doc_id": "127020087930",
          "description": "NOTICE OF APPEARANCE OF PRO BONO COUNSEL by David Robert Allen on behalf of Julia Ramsay-Nobles(as Administratrix of the Estate of Karl Taylor, Deceased) (Allen, David) (Entered: 04/14/2017)"
        },
        {
          "row_number": 378,
          "id": 2059213,
          "entry_number": "44",
          "date_filed": "2017-04-14T01:00:00-04:00",
          "attachments": [],
          "url": "https://www.courtlistener.com/docket/4524093/44/ramsay-nobles-v-keyser/",
          "recap_pdf_url": null,
          "pacer_doc_id": "127020088230",
          "description": "NOTICE OF APPEARANCE OF PRO BONO COUNSEL by Courtney Elizabeth Finerty on behalf of Julia Ramsay-Nobles(as Administratrix of the Estate of Karl Taylor, Deceased) (Finerty, Courtney) (Entered: 04/14/2017)"
        },
        {
          "row_number": 389,
          "id": 2059214,
          "entry_number": "45",
          "date_filed": "2017-04-19T01:00:00-04:00",
          "attachments": [
            {
              "recap_id": 157198204,
              "pacer_url": "https://ecf.nysd.uscourts.gov/doc1/127020117427?caseid=460586",
              "description": "Exhibit Certificate of Merit",
              "attachment_number": 1
            }
          ],
          "url": "https://www.courtlistener.com/docket/4524093/45/ramsay-nobles-v-keyser/",
          "recap_pdf_url": null,
          "pacer_doc_id": "127020117426",
          "description": "FILING ERROR - DEFICIENT PLEADING - FILED AGAINST PARTY ERROR FIRST AMENDED COMPLAINT amending 1 Complaint, against Edward Burnett, William Keyser, Senior Sullivan Officers, Sullivan Correction Officers, Shane Topel, Bruce Tucker, Steven Witte, John Frunzi, Sin Ho Lee with JURY DEMAND.Document filed by Julia Ramsay-Nobles(as Administratrix of the Estate of Karl Taylor, Deceased). Related document: 1 Complaint, filed by Julia Ramsay-Nobles. (Attachments: # 1 Exhibit Certificate of Merit)(Gelernter, Eugene) Modified on 4/20/2017 (pc). (Entered: 04/19/2017)"
        },
        {
          "row_number": 400,
          "id": 2059215,
          "entry_number": "46",
          "date_filed": "2017-04-19T01:00:00-04:00",
          "attachments": [],
          "url": "https://www.courtlistener.com/docket/4524093/46/ramsay-nobles-v-keyser/",
          "recap_pdf_url": null,
          "pacer_doc_id": "127020117504",
          "description": "REQUEST FOR ISSUANCE OF SUMMONS as to John Frunzi, re: 45 Amended Complaint,. Document filed by Julia Ramsay-Nobles(as Administratrix of the Estate of Karl Taylor, Deceased). (Gelernter, Eugene) (Entered: 04/19/2017)"
        },
        {
          "row_number": 414,
          "id": 2059219,
          "entry_number": "49",
          "date_filed": "2017-04-21T01:00:00-04:00",
          "attachments": [
            {
              "recap_id": 157198205,
              "pacer_url": "https://ecf.nysd.uscourts.gov/doc1/127020134463?caseid=460586",
              "description": "Appendix Revised Case Management Plan",
              "attachment_number": 1
            }
          ],
          "url": "https://www.courtlistener.com/docket/4524093/49/ramsay-nobles-v-keyser/",
          "recap_pdf_url": null,
          "pacer_doc_id": "127020134462",
          "description": "LETTER MOTION to Stay addressed to Judge Colleen McMahon from Rebecca Ann Durden dated April 21, 2017. Document filed by Edward Burnett, William Keyser, Shane Topel, Bruce Tucker, Steven Witte. (Attachments: # 1 Appendix Revised Case Management Plan)(Durden, Rebecca) (Entered: 04/21/2017)"
        },
        {
          "row_number": 416,
          "id": 2059220,
          "entry_number": "50",
          "date_filed": "2017-04-24T01:00:00-04:00",
          "attachments": [],
          "url": "https://www.courtlistener.com/docket/4524093/50/ramsay-nobles-v-keyser/",
          "recap_pdf_url": null,
          "pacer_doc_id": "127020142032",
          "description": "ORDER granting 49 Letter Motion to Stay. OK. (Case Stayed.) (Signed by Judge Colleen McMahon on 4/24/2017) (kgo) (Entered: 04/24/2017)"
        },
        {
          "row_number": 418,
          "id": 2059222,
          "entry_number": "52",
          "date_filed": "2017-04-24T01:00:00-04:00",
          "attachments": [],
          "url": "https://www.courtlistener.com/docket/4524093/52/ramsay-nobles-v-keyser/",
          "recap_pdf_url": null,
          "pacer_doc_id": "127020144708",
          "description": "ORDER granting 48 Letter Motion for Leave to File Document. Application GRANTED. The Clerk of the Court is respectfully directed to accept the First Amended Complaint for refiling. (Signed by Magistrate Judge Barbara C. Moses on 4/24/2017) (cf) (Entered: 04/24/2017)"
        },
        {
          "row_number": 419,
          "id": 2059223,
          "entry_number": "53",
          "date_filed": "2017-04-25T01:00:00-04:00",
          "attachments": [],
          "url": "https://www.courtlistener.com/docket/4524093/53/ramsay-nobles-v-keyser/",
          "recap_pdf_url": null,
          "pacer_doc_id": "127020149730",
          "description": "AMENDED COMPLAINT amending 1 Complaint, against Edward Burnett, John Frunzi, William Keyser, Sin Ho Lee, Sullivan Correction Officers, Shane Topel, Bruce Tucker, Steven Witte, SENIOR SULLIVAN OFFICERS 1-19 with JURY DEMAND.Document filed by Julia Ramsay-Nobles(as Administratrix of the Estate of Karl Taylor, Deceased). Related document: 1 Complaint, filed by Julia Ramsay-Nobles.(Gelernter, Eugene) (Entered: 04/25/2017)"
        },
        {
          "row_number": 421,
          "id": 2059226,
          "entry_number": "55",
          "date_filed": "2017-05-02T01:00:00-04:00",
          "attachments": [],
          "url": "https://www.courtlistener.com/docket/4524093/55/ramsay-nobles-v-keyser/",
          "recap_pdf_url": null,
          "pacer_doc_id": "127020198915",
          "description": "ELECTRONIC SUMMONS ISSUED as to John Frunzi. (pc) (Entered: 05/02/2017)"
        },
        {
          "row_number": 422,
          "id": 2059227,
          "entry_number": "56",
          "date_filed": "2017-05-11T01:00:00-04:00",
          "attachments": [],
          "url": "https://www.courtlistener.com/docket/4524093/56/ramsay-nobles-v-keyser/",
          "recap_pdf_url": null,
          "pacer_doc_id": "127020261874",
          "description": "SUMMONS RETURNED EXECUTED Summons and Amended Complaint, served. John Frunzi served on 5/4/2017, answer due 5/25/2017. Service was accepted by John R. Frunzi. Document filed by Julia Ramsay-Nobles(as Administratrix of the Estate of Karl Taylor, Deceased). (Gelernter, Eugene) (Entered: 05/11/2017)"
        },
        {
          "row_number": 423,
          "id": 2059228,
          "entry_number": "57",
          "date_filed": "2017-07-12T01:00:00-04:00",
          "attachments": [],
          "url": "https://www.courtlistener.com/docket/4524093/57/ramsay-nobles-v-keyser/",
          "recap_pdf_url": null,
          "pacer_doc_id": "127020617739",
          "description": "LETTER MOTION for Extension of Time to File Answer addressed to Judge Colleen McMahon from Rebecca Ann Durden dated July 12, 2017. Document filed by Sin Ho Lee.(Durden, Rebecca) (Entered: 07/12/2017)"
        },
        {
          "row_number": 424,
          "id": 2059229,
          "entry_number": "58",
          "date_filed": "2017-07-12T01:00:00-04:00",
          "attachments": [],
          "url": "https://www.courtlistener.com/docket/4524093/58/ramsay-nobles-v-keyser/",
          "recap_pdf_url": null,
          "pacer_doc_id": "127020619102",
          "description": "ANSWER to 53 Amended Complaint, with JURY DEMAND. Document filed by Edward Burnett, John Frunzi, William Keyser, Shane Topel, Bruce Tucker, Steven Witte.(Durden, Rebecca) (Entered: 07/12/2017)"
        },
        {
          "row_number": 425,
          "id": 2059230,
          "entry_number": "59",
          "date_filed": "2017-07-12T01:00:00-04:00",
          "attachments": [],
          "url": "https://www.courtlistener.com/docket/4524093/59/ramsay-nobles-v-keyser/",
          "recap_pdf_url": null,
          "pacer_doc_id": "127020622289",
          "description": "ORDER granting 57 Letter Motion for Extension of Time to Answer re 1 Complaint. Ok. (Sin Ho Lee answer due 9/14/2017.) (Signed by Judge Colleen McMahon on 7/12/17) (yv) (Entered: 07/13/2017)"
        },
        {
          "row_number": 428,
          "id": 2059232,
          "entry_number": "61",
          "date_filed": "2017-09-14T01:00:00-04:00",
          "attachments": [],
          "url": "https://www.courtlistener.com/docket/4524093/61/ramsay-nobles-v-keyser/",
          "recap_pdf_url": null,
          "pacer_doc_id": "127020987136",
          "description": "ANSWER to 53 Amended Complaint, with JURY DEMAND. Document filed by Sin Ho Lee.(Hechtkopf, Helene) (Entered: 09/14/2017)"
        },
        {
          "row_number": 429,
          "id": 2059233,
          "entry_number": "62",
          "date_filed": "2017-09-18T01:00:00-04:00",
          "attachments": [
            {
              "recap_id": 157198207,
              "pacer_url": "https://ecf.nysd.uscourts.gov/doc1/127021001132?caseid=460586",
              "description": "Appendix A [Proposed] Second Amended Civil Case Management Plan",
              "attachment_number": 1
            }
          ],
          "url": "https://www.courtlistener.com/docket/4524093/62/ramsay-nobles-v-keyser/",
          "recap_pdf_url": null,
          "pacer_doc_id": "127021001131",
          "description": "RULE 26(f) DISCOVERY PLAN REPORT.Document filed by Julia Ramsay-Nobles(as Administratrix of the Estate of Karl Taylor, Deceased). (Attachments: # 1 Appendix A [Proposed] Second Amended Civil Case Management Plan)(Gelernter, Eugene) (Entered: 09/18/2017)"
        },
        {
          "row_number": 430,
          "id": 2059234,
          "entry_number": "63",
          "date_filed": "2017-09-20T01:00:00-04:00",
          "attachments": [],
          "url": "https://www.courtlistener.com/docket/4524093/63/ramsay-nobles-v-keyser/",
          "recap_pdf_url": null,
          "pacer_doc_id": "127021019254",
          "description": "AMENDED JOINT SCHEDULING ORDER: The parties recommend that the deadline for joinder of additional parties and any amendments to the pleadings remain as March 10, 2017. The parties have also agreed upon a Second Amended Case Management Order, which is attached at Appendix A. The parties agree that all discovery, including expert discovery, will be completed on or before March 26, 2018. The parties cannot prevent the court from referring this matter to a Magistrate Judge for any purpose for which consent is not required and the court construes this paragraph simply as a referral to consent to trial before a Magistrate Judge. So ordered as modified, and as further set forth in this order. Motions due by 5/7/2018. Expert Discovery due by 3/26/2018. Discovery due by 3/26/2018. Pretrial Order due by 6/6/2018. Ready for Trial by 6/6/2018. (Signed by Judge Colleen McMahon on 9/20/2017) (ap) (Entered: 09/20/2017)"
        },
        {
          "row_number": 432,
          "id": 2059236,
          "entry_number": "65",
          "date_filed": "2017-10-16T01:00:00-04:00",
          "attachments": [],
          "url": "https://www.courtlistener.com/docket/4524093/65/ramsay-nobles-v-keyser/",
          "recap_pdf_url": null,
          "pacer_doc_id": "127021175447",
          "description": "LETTER MOTION for Discovery Re: Protective Order addressed to Judge Colleen McMahon from Rebecca Ann Durden dated October 16, 2017. Document filed by Edward Burnett, John Frunzi, William Keyser, Shane Topel, Bruce Tucker, Steven Witte.(Durden, Rebecca) (Entered: 10/16/2017)"
        },
        {
          "row_number": 433,
          "id": 2059237,
          "entry_number": "66",
          "date_filed": "2017-10-17T01:00:00-04:00",
          "attachments": [],
          "url": "https://www.courtlistener.com/docket/4524093/66/ramsay-nobles-v-keyser/",
          "recap_pdf_url": null,
          "pacer_doc_id": "127021183732",
          "description": "ORDER denying 65 Letter Motion for Discovery. There is no need to modify the order, because plaintiff's interpretation is simply WRONG. I will NOT allow the identities of witnesses to remain secret. I am opposed to filings under seal generally. (Signed by Judge Colleen McMahon on 10/17/2017) (kgo) (Entered: 10/17/2017)"
        },
        {
          "row_number": 434,
          "id": 2059238,
          "entry_number": "67",
          "date_filed": "2017-10-24T01:00:00-04:00",
          "attachments": [],
          "url": "https://www.courtlistener.com/docket/4524093/67/ramsay-nobles-v-keyser/",
          "recap_pdf_url": null,
          "pacer_doc_id": "127021225130",
          "description": "CONSENT LETTER MOTION for Discovery /Leave to Take Depositions addressed to Magistrate Judge Barbara C. Moses from Adeel A. Mangi dated October 24, 2017. Document filed by Julia Ramsay-Nobles(as Administratrix of the Estate of Karl Taylor, Deceased).(Mangi, Adeel) (Entered: 10/24/2017)"
        },
        {
          "row_number": 436,
          "id": 2059240,
          "entry_number": "69",
          "date_filed": "2017-10-25T01:00:00-04:00",
          "attachments": [],
          "url": "https://www.courtlistener.com/docket/4524093/69/ramsay-nobles-v-keyser/",
          "recap_pdf_url": null,
          "pacer_doc_id": "127021238440",
          "description": "ORDER: The Court has received and reviewed plaintiffs October 24, 2017 consent letter-motion requesting leave to depose six non-party prison inmates. (Dkt. No. 67.) Plaintiff's application is hereby GRANTED. The Court will conduct a status conference on December 5, 2017, at 10:00 a.m., in Courtroom 20A, 500 Pearl Street, New York, NY 10007. No later than one week prior to that date, the parties shall submit a joint status letter outlining the progress of discovery to date, as well as any settlement efforts. If no discovery controversies exist at that time, the parties may request that the conference be held telephonically.( Status Conference set for 12/5/2017 at 10:00 AM in Courtroom 20A, 500 Pearl Street, New York, NY 10007 before Magistrate Judge Barbara C. Moses.) (Signed by Magistrate Judge Barbara C. Moses on 10/25/2017) (rj) (Entered: 10/26/2017)"
        },
        {
          "row_number": 438,
          "id": 2059241,
          "entry_number": "70",
          "date_filed": "2017-11-21T01:00:00-05:00",
          "attachments": [
            {
              "recap_id": 157198208,
              "pacer_url": "https://ecf.nysd.uscourts.gov/doc1/127021399487?caseid=460586",
              "description": "Exhibit A",
              "attachment_number": 1
            },
            {
              "recap_id": 157198209,
              "pacer_url": "https://ecf.nysd.uscourts.gov/doc1/127021399488?caseid=460586",
              "description": "Exhibit B",
              "attachment_number": 2
            },
            {
              "recap_id": 157198210,
              "pacer_url": "https://ecf.nysd.uscourts.gov/doc1/127021399489?caseid=460586",
              "description": "Exhibit C",
              "attachment_number": 3
            },
            {
              "recap_id": 157198211,
              "pacer_url": "https://ecf.nysd.uscourts.gov/doc1/127021399490?caseid=460586",
              "description": "Exhibit D",
              "attachment_number": 4
            },
            {
              "recap_id": 157198212,
              "pacer_url": "https://ecf.nysd.uscourts.gov/doc1/127021399491?caseid=460586",
              "description": "Exhibit E",
              "attachment_number": 5
            }
          ],
          "url": "https://www.courtlistener.com/docket/4524093/70/ramsay-nobles-v-keyser/",
          "recap_pdf_url": null,
          "pacer_doc_id": "127021399486",
          "description": "LETTER MOTION for Conference - requesting a pre-motion discovery conference addressed to Magistrate Judge Barbara C. Moses from Eugene M. Gelernter dated November 21, 2017. Document filed by Julia Ramsay-Nobles(Individually ). (Attachments: # 1 Exhibit A, # 2 Exhibit B, # 3 Exhibit C, # 4 Exhibit D, # 5 Exhibit E)(Gelernter, Eugene) (Entered: 11/21/2017)"
        },
        {
          "row_number": 439,
          "id": 2059242,
          "entry_number": "71",
          "date_filed": "2017-11-22T01:00:00-05:00",
          "attachments": [],
          "url": "https://www.courtlistener.com/docket/4524093/71/ramsay-nobles-v-keyser/",
          "recap_pdf_url": null,
          "pacer_doc_id": "127021406230",
          "description": "NOTICE OF APPEARANCE by Joseph Robert Richie on behalf of Julia Ramsay-Nobles(as Administratrix of the Estate of Karl Taylor, Deceased). (Richie, Joseph) (Entered: 11/22/2017)"
        },
        {
          "row_number": 442,
          "id": 2059245,
          "entry_number": "74",
          "date_filed": "2017-11-29T01:00:00-05:00",
          "attachments": [],
          "url": "https://www.courtlistener.com/docket/4524093/74/ramsay-nobles-v-keyser/",
          "recap_pdf_url": null,
          "pacer_doc_id": "127021435235",
          "description": "ORDER SCHEDULING CONFERENCE: The Court has received and reviewed plaintiff's November 21, 2017 letter-motion (Dkt. No. 70) requesting a conference regarding a discovery dispute related to a subpoena duces tecum that plaintiff served on non-party New York State Office of Mental Health (OMH). Although OMH's counsel was copied on plaintiff's application, OMH has not yet filed a response, which was due November 27, 2017 per the Court's Individual Practices. If OMH wishes to file a response, it must do so no later than Tuesday, December 5, 2017. Plaintiff shall file any reply no later than Thursday, December 7, 2017. The Court will hold a conference regarding the OMH dispute on Friday, December 8, 2017, at 9:30 a.m., in Courtroom 20A. If any party or OMH has an unavoidable scheduling conflict, counsel for that party (or non-party) must promptly telephone Judge Moses's courtroom deputy with two proposed alternative dates, acceptable to all counsel, for a morning discovery conference. ( Responses due by 12/5/2017, Replies due by 12/7/2017., Status Conference set for 12/8/2017 at 09:30 AM in Courtroom 20A, 500 Pearl Street, New York, NY 10007 before Magistrate Judge Barbara C. Moses.) (Signed by Magistrate Judge Barbara C. Moses on 11/29/2017) (mro) (Main Document 74 replaced on 12/1/2017) (cf). Modified on 12/1/2017 (cf). (Entered: 11/29/2017)"
        },
        {
          "row_number": 443,
          "id": 2059246,
          "entry_number": "75",
          "date_filed": "2017-11-30T01:00:00-05:00",
          "attachments": [],
          "url": "https://www.courtlistener.com/docket/4524093/75/ramsay-nobles-v-keyser/",
          "recap_pdf_url": null,
          "pacer_doc_id": "127021438125",
          "description": "MOTION for Courtney E. Finerty-Stelzner to Withdraw as Attorney . Document filed by Julia Ramsay-Nobles(as Administratrix of the Estate of Karl Taylor, Deceased).(Finerty, Courtney) (Entered: 11/30/2017)"
        },
        {
          "row_number": 444,
          "id": 2059247,
          "entry_number": "76",
          "date_filed": "2017-12-01T01:00:00-05:00",
          "attachments": [],
          "url": "https://www.courtlistener.com/docket/4524093/76/ramsay-nobles-v-keyser/",
          "recap_pdf_url": null,
          "pacer_doc_id": "127021446749",
          "description": "ORDER: At the request of the parties and non-party New York State Office of Mental Health (OMH), the discovery hearing previously scheduled for December 8, 2017 is hereby adjourned to December 14, 2017, at 11:00 a.m. Plaintiff is directed to promptly serve this Order on OMH. (Status Conference set for 12/14/2017 at 11:00 AM before Magistrate Judge Barbara C. Moses.) (Signed by Magistrate Judge Barbara C. Moses on 12/1/2017) (cf) (Entered: 12/01/2017)"
        },
        {
          "row_number": 445,
          "id": 2059248,
          "entry_number": "77",
          "date_filed": "2017-12-01T01:00:00-05:00",
          "attachments": [],
          "url": "https://www.courtlistener.com/docket/4524093/77/ramsay-nobles-v-keyser/",
          "recap_pdf_url": null,
          "pacer_doc_id": "127021451583",
          "description": "LETTER addressed to Magistrate Judge Barbara C. Moses from Margaret Drake dated 12/1/2017 re: In response to the letter from plaintiff's attorney dated November 21, 2017, concerning a discovery dispute related to a subpoena duces tecum served on the New York State Office of Mental Health (OMH) on January 18, 2017. (cf) (Entered: 12/01/2017)"
        },
        {
          "row_number": 446,
          "id": 2059250,
          "entry_number": "78",
          "date_filed": "2017-12-06T01:00:00-05:00",
          "attachments": [],
          "url": "https://www.courtlistener.com/docket/4524093/78/ramsay-nobles-v-keyser/",
          "recap_pdf_url": null,
          "pacer_doc_id": "127021480783",
          "description": "LETTER REPLY to Response to Motion addressed to Magistrate Judge Barbara C. Moses from Eugene M. Gelernter dated December 6, 2017 re: 70 LETTER MOTION for Conference - requesting a pre-motion discovery conference addressed to Magistrate Judge Barbara C. Moses from Eugene M. Gelernter dated November 21, 2017. . Document filed by Julia Ramsay-Nobles(as Administratrix of the Estate of Karl Taylor, Deceased). (Gelernter, Eugene) (Entered: 12/06/2017)"
        },
        {
          "row_number": 449,
          "id": 2059252,
          "entry_number": "80",
          "date_filed": "2017-12-08T01:00:00-05:00",
          "attachments": [],
          "url": "https://www.courtlistener.com/docket/4524093/80/ramsay-nobles-v-keyser/",
          "recap_pdf_url": null,
          "pacer_doc_id": "127021495294",
          "description": "LETTER MOTION for Conference - requesting a pre-motion discovery conference addressed to Magistrate Judge Barbara C. Moses from Eugene M. Gelernter dated December 8, 2017. Document filed by Julia Ramsay-Nobles(as Administratrix of the Estate of Karl Taylor, Deceased).(Gelernter, Eugene) (Entered: 12/08/2017)"
        },
        {
          "row_number": 451,
          "id": 2059254,
          "entry_number": "82",
          "date_filed": "2017-12-11T01:00:00-05:00",
          "attachments": [],
          "url": "https://www.courtlistener.com/docket/4524093/82/ramsay-nobles-v-keyser/",
          "recap_pdf_url": null,
          "pacer_doc_id": "127021507467",
          "description": "LETTER MOTION for Extension of Time to File Response/Reply as to 80 LETTER MOTION for Conference - requesting a pre-motion discovery conference addressed to Magistrate Judge Barbara C. Moses from Eugene M. Gelernter dated December 8, 2017. addressed to Magistrate Judge Barbara C. Moses from Rebecca Ann Durden dated December 11, 2017. Document filed by Edward Burnett, John Frunzi, William Keyser, Shane Topel, Bruce Tucker, Steven Witte.(Durden, Rebecca) (Entered: 12/11/2017)"
        },
        {
          "row_number": 452,
          "id": 2059255,
          "entry_number": "83",
          "date_filed": "2017-12-12T01:00:00-05:00",
          "attachments": [
            {
              "recap_id": 157198216,
              "pacer_url": "https://ecf.nysd.uscourts.gov/doc1/127021510472?caseid=460586",
              "description": "Text of Proposed Order Granting Leave to Depose Person Confined to Prison",
              "attachment_number": 1
            }
          ],
          "url": "https://www.courtlistener.com/docket/4524093/83/ramsay-nobles-v-keyser/",
          "recap_pdf_url": null,
          "pacer_doc_id": "127021510471",
          "description": "FILING ERROR - WRONG EVENT TYPE SELECTED FROM MENU - LETTER MOTION for Discovery addressed to Magistrate Judge Barbara C. Moses from Adeel A. Mangi dated 12/12/2017. Document filed by Julia Ramsay-Nobles(as Administratrix of the Estate of Karl Taylor, Deceased). (Attachments: # 1 Text of Proposed Order Granting Leave to Depose Person Confined to Prison)(Mangi, Adeel) Modified on 1/12/2018 (ldi). (Entered: 12/12/2017)"
        },
        {
          "row_number": 453,
          "id": 2059256,
          "entry_number": "84",
          "date_filed": "2017-12-12T01:00:00-05:00",
          "attachments": [],
          "url": "https://www.courtlistener.com/docket/4524093/84/ramsay-nobles-v-keyser/",
          "recap_pdf_url": null,
          "pacer_doc_id": "127021510538",
          "description": "ORDER denying as moot 70 Letter Motion for Conference. (Dkt. No. 70) is DENIED as moot. OMH is excused from attending the hearing scheduled for December 14, 2017. Instead, at the hearing, the Court will address the issues raised in plaintiff's December 8, 2017 letter-motion (Dkt. No. 80). Defendants shall respond to plaintiff's letter-motion no later than December 13, 2017. Plaintiff need not file a reply. (As further set forth in this Order.) (Signed by Magistrate Judge Barbara C. Moses on 12/11/2017) (cf) (Entered: 12/12/2017)"
        },
        {
          "row_number": 457,
          "id": 2059261,
          "entry_number": "88",
          "date_filed": "2017-12-13T01:00:00-05:00",
          "attachments": [],
          "url": "https://www.courtlistener.com/docket/4524093/88/ramsay-nobles-v-keyser/",
          "recap_pdf_url": null,
          "pacer_doc_id": "127021521967",
          "description": "LETTER RESPONSE in Opposition to Motion addressed to Magistrate Judge Barbara C. Moses from Rebecca Ann Durden dated December 13, 2017 re: 80 LETTER MOTION for Conference - requesting a pre-motion discovery conference addressed to Magistrate Judge Barbara C. Moses from Eugene M. Gelernter dated December 8, 2017. . Document filed by Edward Burnett, John Frunzi, William Keyser, Shane Topel, Bruce Tucker, Steven Witte. (Durden, Rebecca) (Entered: 12/13/2017)"
        },
        {
          "row_number": 485,
          "id": 2059263,
          "entry_number": null,
          "date_filed": "2017-12-14T01:00:00-05:00",
          "attachments": [],
          "url": "https://www.courtlistener.com",
          "recap_pdf_url": null,
          "pacer_doc_id": null,
          "description": "Minute Entry for proceedings held before Magistrate Judge Barbara Moses: Status Conference held on 12/14/2017. (Snell, Kevin)"
        },
        {
          "row_number": 460,
          "id": 2059264,
          "entry_number": "90",
          "date_filed": "2017-12-14T01:00:00-05:00",
          "attachments": [],
          "url": "https://www.courtlistener.com/docket/4524093/90/ramsay-nobles-v-keyser/",
          "recap_pdf_url": null,
          "pacer_doc_id": "127021532907",
          "description": "ORDER terminating 80 Letter Motion for Conference. Plaintiff may take a total of nineteen (19) depositions, including the party and non-party witnesses identified at today's hearing, no later than February 5, 2018. Promptly thereafter, the parties shall meet and confer regarding whether any party requires additional depositions to be taken prior to the close of all discovery, which remains March 26, 2018. (As further set forth in this Order.) This Order resolves the discovery disputes raised in plaintiffs letter-application dated December 8, 2017 (Dkt. No. 80). (Signed by Magistrate Judge Barbara C. Moses on 12/14/2017) (cf) (Entered: 12/15/2017)"
        },
        {
          "row_number": 486,
          "id": 2059265,
          "entry_number": null,
          "date_filed": "2017-12-14T01:00:00-05:00",
          "attachments": [],
          "url": "https://www.courtlistener.com",
          "recap_pdf_url": null,
          "pacer_doc_id": null,
          "description": "Set/Reset Deadlines: Deposition due by 2/5/2018. (cf)"
        },
        {
          "row_number": 462,
          "id": 2059268,
          "entry_number": "92",
          "date_filed": "2018-01-23T01:00:00-05:00",
          "attachments": [],
          "url": "https://www.courtlistener.com/docket/4524093/92/ramsay-nobles-v-keyser/",
          "recap_pdf_url": null,
          "pacer_doc_id": "127021733450",
          "description": "ORDER GRANTING MOTION FOR ADMISSION PRO HAC VICE granting 91 Motion for Timothy H. Gray to Appear Pro Hac Vice. (Signed by Magistrate Judge Barbara C. Moses on 1/23/2018) (rj) (Entered: 01/23/2018)"
        },
        {
          "row_number": 463,
          "id": 2059269,
          "entry_number": "93",
          "date_filed": "2018-02-09T01:00:00-05:00",
          "attachments": [],
          "url": "https://www.courtlistener.com/docket/4524093/93/ramsay-nobles-v-keyser/",
          "recap_pdf_url": null,
          "pacer_doc_id": "127021848354",
          "description": "MOTION for Leave to File Second Amended Complaint . Document filed by Julia Ramsay-Nobles(as Administratrix of the Estate of Karl Taylor, Deceased), Julia Ramsay-Nobles(Individually ).(Gelernter, Eugene) (Entered: 02/09/2018)"
        },
        {
          "row_number": 464,
          "id": 2059270,
          "entry_number": "94",
          "date_filed": "2018-02-09T01:00:00-05:00",
          "attachments": [],
          "url": "https://www.courtlistener.com/docket/4524093/94/ramsay-nobles-v-keyser/",
          "recap_pdf_url": null,
          "pacer_doc_id": "127021848368",
          "description": "MEMORANDUM OF LAW in Support re: 93 MOTION for Leave to File Second Amended Complaint . . Document filed by Julia Ramsay-Nobles(as Administratrix of the Estate of Karl Taylor, Deceased), Julia Ramsay-Nobles(Individually ). (Gelernter, Eugene) (Entered: 02/09/2018)"
        },
        {
          "row_number": 467,
          "id": 2059273,
          "entry_number": "97",
          "date_filed": "2018-02-22T01:00:00-05:00",
          "attachments": [],
          "url": "https://www.courtlistener.com/docket/4524093/97/ramsay-nobles-v-keyser/",
          "recap_pdf_url": null,
          "pacer_doc_id": "127021922821",
          "description": "MEMORANDUM OF LAW in Opposition re: 93 MOTION for Leave to File Second Amended Complaint . . Document filed by Edward Burnett, John Frunzi, William Keyser, Shane Topel, Bruce Tucker, Steven Witte. (Durden, Rebecca) (Entered: 02/22/2018)"
        },
        {
          "row_number": 468,
          "id": 2059274,
          "entry_number": "98",
          "date_filed": "2018-02-22T01:00:00-05:00",
          "attachments": [
            {
              "recap_id": 157198264,
              "pacer_url": "https://ecf.nysd.uscourts.gov/doc1/127021922855?caseid=460586",
              "description": "Exhibit Hunt - Deposition Testimony",
              "attachment_number": 1
            },
            {
              "recap_id": 157198265,
              "pacer_url": "https://ecf.nysd.uscourts.gov/doc1/127021922856?caseid=460586",
              "description": "Exhibit E-Mail Exchange re: autopsy",
              "attachment_number": 2
            },
            {
              "recap_id": 157198266,
              "pacer_url": "https://ecf.nysd.uscourts.gov/doc1/127021922857?caseid=460586",
              "description": "Exhibit Dr. Prial - Deposition Testiomony",
              "attachment_number": 3
            }
          ],
          "url": "https://www.courtlistener.com/docket/4524093/98/ramsay-nobles-v-keyser/",
          "recap_pdf_url": null,
          "pacer_doc_id": "127021922854",
          "description": "DECLARATION of Rebecca Ann Durden in Opposition re: 93 MOTION for Leave to File Second Amended Complaint .. Document filed by Edward Burnett, John Frunzi, William Keyser, Shane Topel, Bruce Tucker, Steven Witte. (Attachments: # 1 Exhibit Hunt - Deposition Testimony, # 2 Exhibit E-Mail Exchange re: autopsy, # 3 Exhibit Dr. Prial - Deposition Testiomony)(Durden, Rebecca) (Entered: 02/22/2018)"
        },
        {
          "row_number": 469,
          "id": 2059275,
          "entry_number": "99",
          "date_filed": "2018-03-01T01:00:00-05:00",
          "attachments": [],
          "url": "https://www.courtlistener.com/docket/4524093/99/ramsay-nobles-v-keyser/",
          "recap_pdf_url": null,
          "pacer_doc_id": "127021964927",
          "description": "REPLY MEMORANDUM OF LAW in Support re: 93 MOTION for Leave to File Second Amended Complaint . . Document filed by Julia Ramsay-Nobles(as Administratrix of the Estate of Karl Taylor, Deceased), Julia Ramsay-Nobles(Individually ). (Gelernter, Eugene) (Entered: 03/01/2018)"
        },
        {
          "row_number": 2,
          "id": 2059276,
          "entry_number": "100",
          "date_filed": "2018-03-01T01:00:00-05:00",
          "attachments": [
            {
              "recap_id": 157198267,
              "pacer_url": "https://ecf.nysd.uscourts.gov/doc1/127021964966?caseid=460586",
              "description": "Exhibit G",
              "attachment_number": 1
            },
            {
              "recap_id": 157198268,
              "pacer_url": "https://ecf.nysd.uscourts.gov/doc1/127021964967?caseid=460586",
              "description": "Exhibit H",
              "attachment_number": 2
            },
            {
              "recap_id": 157198269,
              "pacer_url": "https://ecf.nysd.uscourts.gov/doc1/127021964968?caseid=460586",
              "description": "Exhibit I",
              "attachment_number": 3
            }
          ],
          "url": "https://www.courtlistener.com/docket/4524093/100/ramsay-nobles-v-keyser/",
          "recap_pdf_url": null,
          "pacer_doc_id": "127021964965",
          "description": "DECLARATION of Eugene M. Gelernter in Support re: 93 MOTION for Leave to File Second Amended Complaint .. Document filed by Julia Ramsay-Nobles(as Administratrix of the Estate of Karl Taylor, Deceased), Julia Ramsay-Nobles(Individually ). (Attachments: # 1 Exhibit G, # 2 Exhibit H, # 3 Exhibit I)(Gelernter, Eugene) (Entered: 03/01/2018)"
        },
        {
          "row_number": 4,
          "id": 2059278,
          "entry_number": "102",
          "date_filed": "2018-03-01T01:00:00-05:00",
          "attachments": [],
          "url": "https://www.courtlistener.com/docket/4524093/102/ramsay-nobles-v-keyser/",
          "recap_pdf_url": null,
          "pacer_doc_id": "127021967267",
          "description": "LETTER addressed to Judge Colleen McMahon from Adeel A. Mangi dated March 1, 2018 re: response to State Represented Defendants letter dated March 1, 2018 101 . Document filed by Julia Ramsay-Nobles(as Administratrix of the Estate of Karl Taylor, Deceased), Julia Ramsay-Nobles(Individually ).(Mangi, Adeel) (Entered: 03/01/2018)"
        },
        {
          "row_number": 6,
          "id": 2059280,
          "entry_number": "104",
          "date_filed": "2018-03-08T01:00:00-05:00",
          "attachments": [
            {
              "recap_id": 157198270,
              "pacer_url": "https://ecf.nysd.uscourts.gov/doc1/127022006445?caseid=460586",
              "description": "Supplemental Memorandum in Further Support of Plaintiff's Motion for Leave",
              "attachment_number": 1
            },
            {
              "recap_id": 157198271,
              "pacer_url": "https://ecf.nysd.uscourts.gov/doc1/127022006446?caseid=460586",
              "description": "Exhibit I, to the Supplemental Memorandum",
              "attachment_number": 2
            }
          ],
          "url": "https://www.courtlistener.com/docket/4524093/104/ramsay-nobles-v-keyser/",
          "recap_pdf_url": null,
          "pacer_doc_id": "127022006444",
          "description": "MOTION for Leave to File Supplemental Memorandum in Further Support of Plaintiff's Motion for Leave to File a Second Amended Complaint . Document filed by Julia Ramsay-Nobles(as Administratrix of the Estate of Karl Taylor, Deceased), Julia Ramsay-Nobles(Individually ). (Attachments: # 1 Supplemental Memorandum in Further Support of Plaintiff's Motion for Leave to File a Second Amended Complaint, # 2 Exhibit I, to the Supplemental Memorandum)(Gelernter, Eugene) (Entered: 03/08/2018)"
        },
        {
          "row_number": 7,
          "id": 2059281,
          "entry_number": "105",
          "date_filed": "2018-03-20T01:00:00-04:00",
          "attachments": [],
          "url": "https://www.courtlistener.com/docket/4524093/105/ramsay-nobles-v-keyser/",
          "recap_pdf_url": null,
          "pacer_doc_id": "127022083296",
          "description": "MEMO ENDORSEMENT granting 93 Letter Motion for Leave to File Document. ENDORSEMENT: The motion is GRANTED. (Signed by Judge Colleen McMahon on 3/20/2018) (kgo) (Entered: 03/20/2018)"
        },
        {
          "row_number": 489,
          "id": 2059282,
          "entry_number": null,
          "date_filed": "2018-03-22T01:00:00-04:00",
          "attachments": [],
          "url": "https://www.courtlistener.com",
          "recap_pdf_url": null,
          "pacer_doc_id": null,
          "description": "ADD PARTY FOR PLEADING. Defendants/Respondents Timothy Bunch, Daniel Walter, Joseph Daddezio, Kevin Darling, James Steinberg, Jr, Felix Santos, Michael Weir added. Party added pursuant to 53 Amended Complaint,.Document filed by Julia Ramsay-Nobles(as Administratrix of the Estate of Karl Taylor, Deceased), Julia Ramsay-Nobles(Individually ). Related document: 53 Amended Complaint,.(Gelernter, Eugene)"
        },
        {
          "row_number": 8,
          "id": 2059283,
          "entry_number": "106",
          "date_filed": "2018-03-22T01:00:00-04:00",
          "attachments": [
            {
              "recap_id": 157198272,
              "pacer_url": "https://ecf.nysd.uscourts.gov/doc1/127022095772?caseid=460586",
              "description": "Certificate of Merit",
              "attachment_number": 1
            }
          ],
          "url": "https://www.courtlistener.com/docket/4524093/106/ramsay-nobles-v-keyser/",
          "recap_pdf_url": null,
          "pacer_doc_id": "127022095771",
          "description": "FILING ERROR - DEFICIENT PLEADING - FILED AGAINST PARTY ERROR SECOND AMENDED COMPLAINT amending 53 Amended Complaint, against Timothy Bunch, Edward Burnett, Joseph Daddezio, Kevin Darling, John Frunzi, William Keyser, Sin Ho Lee, Felix Santos, Senior Sullivan Officers, Senior Sullivan Officers 1-19, James Steinberg, Jr, Sullivan Correction Officers, Shane Topel, Bruce Tucker, Daniel Walter, Michael Weir, Steven Witte with JURY DEMAND.Document filed by Julia Ramsay-Nobles(Individually ), Julia Ramsay-Nobles(as Administratrix of the Estate of Karl Taylor, Deceased). Related document: 53 Amended Complaint,. (Attachments: # 1 Certificate of Merit)(Gelernter, Eugene) Modified on 3/23/2018 (vf). (Entered: 03/22/2018)"
        },
        {
          "row_number": 9,
          "id": 2059284,
          "entry_number": "107",
          "date_filed": "2018-03-22T01:00:00-04:00",
          "attachments": [],
          "url": "https://www.courtlistener.com/docket/4524093/107/ramsay-nobles-v-keyser/",
          "recap_pdf_url": null,
          "pacer_doc_id": "127022095829",
          "description": "FILING ERROR - DEFICIENT REQUEST FOR ISSUANCE OF SUMMONS REQUEST FOR ISSUANCE OF SUMMONS as to Timothy Bunch, re: 106 Amended Complaint,,. Document filed by Julia Ramsay-Nobles(Individually ), Julia Ramsay-Nobles(as Administratrix of the Estate of Karl Taylor, Deceased). (Gelernter, Eugene) Modified on 3/23/2018 (vf). (Entered: 03/22/2018)"
        },
        {
          "row_number": 10,
          "id": 2059285,
          "entry_number": "108",
          "date_filed": "2018-03-22T01:00:00-04:00",
          "attachments": [],
          "url": "https://www.courtlistener.com/docket/4524093/108/ramsay-nobles-v-keyser/",
          "recap_pdf_url": null,
          "pacer_doc_id": "127022095851",
          "description": "FILING ERROR - DEFICIENT REQUEST FOR ISSUANCE OF SUMMONS REQUEST FOR ISSUANCE OF SUMMONS as to Joseph Daddezio, re: 106 Amended Complaint,,. Document filed by Julia Ramsay-Nobles(Individually ), Julia Ramsay-Nobles(as Administratrix of the Estate of Karl Taylor, Deceased). (Gelernter, Eugene) Modified on 3/23/2018 (vf). (Entered: 03/22/2018)"
        },
        {
          "row_number": 11,
          "id": 2059286,
          "entry_number": "109",
          "date_filed": "2018-03-22T01:00:00-04:00",
          "attachments": [],
          "url": "https://www.courtlistener.com/docket/4524093/109/ramsay-nobles-v-keyser/",
          "recap_pdf_url": null,
          "pacer_doc_id": "127022095874",
          "description": "FILING ERROR - DEFICIENT REQUEST FOR ISSUANCE OF SUMMONS REQUEST FOR ISSUANCE OF SUMMONS as to Kevin Darling, re: 106 Amended Complaint,,. Document filed by Julia Ramsay-Nobles(Individually ), Julia Ramsay-Nobles(as Administratrix of the Estate of Karl Taylor, Deceased). (Gelernter, Eugene) Modified on 3/23/2018 (vf). (Entered: 03/22/2018)"
        },
        {
          "row_number": 13,
          "id": 2059287,
          "entry_number": "110",
          "date_filed": "2018-03-22T01:00:00-04:00",
          "attachments": [],
          "url": "https://www.courtlistener.com/docket/4524093/110/ramsay-nobles-v-keyser/",
          "recap_pdf_url": null,
          "pacer_doc_id": "127022095891",
          "description": "FILING ERROR - DEFICIENT REQUEST FOR ISSUANCE OF SUMMONS REQUEST FOR ISSUANCE OF SUMMONS as to Felix Santos, re: 106 Amended Complaint,,. Document filed by Julia Ramsay-Nobles(Individually ), Julia Ramsay-Nobles(as Administratrix of the Estate of Karl Taylor, Deceased). (Gelernter, Eugene) Modified on 3/23/2018 (vf). (Entered: 03/22/2018)"
        },
        {
          "row_number": 14,
          "id": 2059288,
          "entry_number": "111",
          "date_filed": "2018-03-22T01:00:00-04:00",
          "attachments": [],
          "url": "https://www.courtlistener.com/docket/4524093/111/ramsay-nobles-v-keyser/",
          "recap_pdf_url": null,
          "pacer_doc_id": "127022095916",
          "description": "FILING ERROR - DEFICIENT REQUEST FOR ISSUANCE OF SUMMONS REQUEST FOR ISSUANCE OF SUMMONS as to James Steinberg Jr., re: 106 Amended Complaint,,. Document filed by Julia Ramsay-Nobles(Individually ), Julia Ramsay-Nobles(as Administratrix of the Estate of Karl Taylor, Deceased). (Gelernter, Eugene) Modified on 3/23/2018 (vf). (Entered: 03/22/2018)"
        },
        {
          "row_number": 15,
          "id": 2059289,
          "entry_number": "112",
          "date_filed": "2018-03-22T01:00:00-04:00",
          "attachments": [],
          "url": "https://www.courtlistener.com/docket/4524093/112/ramsay-nobles-v-keyser/",
          "recap_pdf_url": null,
          "pacer_doc_id": "127022095938",
          "description": "FILING ERROR - DEFICIENT REQUEST FOR ISSUANCE OF SUMMONS REQUEST FOR ISSUANCE OF SUMMONS as to Daniel Walter, re: 106 Amended Complaint,,. Document filed by Julia Ramsay-Nobles(Individually ), Julia Ramsay-Nobles(as Administratrix of the Estate of Karl Taylor, Deceased). (Gelernter, Eugene) Modified on 3/23/2018 (vf). (Entered: 03/22/2018)"
        },
        {
          "row_number": 490,
          "id": 2059291,
          "entry_number": null,
          "date_filed": "2018-03-23T01:00:00-04:00",
          "attachments": [],
          "url": "https://www.courtlistener.com",
          "recap_pdf_url": null,
          "pacer_doc_id": null,
          "description": "***NOTICE TO ATTORNEY REGARDING DEFICIENT PLEADING. Notice to Attorney Eugene Martin Gelernter to RE-FILE re: Document No. 106 Second Amended Complaint. The filing is deficient for the following reason(s): all of the parties listed on the pleading( Senior Sullivan Officers 1-18; Sullivan Correction Officers 1-14; Dr. Seung Ho Lee) were not entered on CM ECF; wrong party/parties whom the pleading is against were selected. Docket the event type Add Party to Pleading found under the event list Complaints and Other Initiating Documents. Re-file the pleading using the event type Second Amended Complaint found under the event list Complaints and Other Initiating Documents - attach the correct signed PDF - select the individually named filer/filers - select the individually named party/parties the pleading is against. (vf)"
        },
        {
          "row_number": 494,
          "id": 2059292,
          "entry_number": null,
          "date_filed": "2018-03-23T01:00:00-04:00",
          "attachments": [],
          "url": "https://www.courtlistener.com",
          "recap_pdf_url": null,
          "pacer_doc_id": null,
          "description": "***NOTICE TO ATTORNEY REGARDING PARTY MODIFICATION. Notice to attorney Eugene Martin Gelernter. The party information for the following party/parties has been modified: John Frunzi. The information for the party/parties has been modified for the following reason/reasons: party text was omitted. (vf)"
        },
        {
          "row_number": 495,
          "id": 2059293,
          "entry_number": null,
          "date_filed": "2018-03-23T01:00:00-04:00",
          "attachments": [],
          "url": "https://www.courtlistener.com",
          "recap_pdf_url": null,
          "pacer_doc_id": null,
          "description": "***NOTICE TO ATTORNEY REGARDING DEFICIENT REQUEST FOR ISSUANCE OF SUMMONS. Notice to Attorney Eugene Martin Gelernter to RE-FILE Document No. 112 Request for Issuance of Summons, 113 Request for Issuance of Summons, 109 Request for Issuance of Summons, 111 Request for Issuance of Summons, 108 Request for Issuance of Summons, 110 Request for Issuance of Summons, 107 Request for Issuance of Summons. The filing is deficient for the following reason(s): defendant party name errors; party names must correspond to pleading. The summons requested was not processed due to the deficient pleading. Please file your request for summons when you correct and refile your pleading. Re-file the document using the event type Request for Issuance of Summons found under the event list Service of Process - select the correct filer/filers - and attach the correct summons form PDF. (vf)"
        },
        {
          "row_number": 496,
          "id": 2059294,
          "entry_number": null,
          "date_filed": "2018-03-23T01:00:00-04:00",
          "attachments": [],
          "url": "https://www.courtlistener.com",
          "recap_pdf_url": null,
          "pacer_doc_id": null,
          "description": "ADD PARTY FOR PLEADING. Defendants/Respondents Senior Sullivan Officers 1-18, Sullivan Correction Officers 1-14, Seung Ho Lee added. Party added pursuant to 106 Amended Complaint,,.Document filed by Julia Ramsay-Nobles(Individually ), Julia Ramsay-Nobles(as Administratrix of the Estate of Karl Taylor, Deceased). Related document: 106 Amended Complaint,,.(Gelernter, Eugene)"
        },
        {
          "row_number": 497,
          "id": 2059296,
          "entry_number": null,
          "date_filed": "2018-03-23T01:00:00-04:00",
          "attachments": [],
          "url": "https://www.courtlistener.com",
          "recap_pdf_url": null,
          "pacer_doc_id": null,
          "description": "***NOTICE TO ATTORNEY REGARDING DEFICIENT PLEADING. Notice to Attorney Eugene Martin Gelernter to RE-FILE Document No. 114 Amended Complaint. The filing is deficient for the following reason(s): the wrong event type was used to file the pleading. Re-file the pleading using the event type Second Amended Complaint found under the event list Complaints and Other Initiating Documents - attach the correct signed PDF - select the individually named filer/filers - select the individually named party/parties the pleading is against. (vf)"
        },
        {
          "row_number": 18,
          "id": 2059297,
          "entry_number": "115",
          "date_filed": "2018-03-23T01:00:00-04:00",
          "attachments": [
            {
              "recap_id": 157198274,
              "pacer_url": "https://ecf.nysd.uscourts.gov/doc1/127022103496?caseid=460586",
              "description": "Certificate of Merit",
              "attachment_number": 1
            }
          ],
          "url": "https://www.courtlistener.com/docket/4524093/115/ramsay-nobles-v-keyser/",
          "recap_pdf_url": null,
          "pacer_doc_id": "127022103495",
          "description": "SECOND AMENDED COMPLAINT amending 114 Amended Complaint,,, 106 Amended Complaint,, 53 Amended Complaint, against Timothy Bunch, Edward Burnett, Joseph Daddezio, Kevin Darling, John Frunzi, Seung Ho Lee, William Keyser, Felix Santos, Senior Sullivan Officers 1-18, James Steinberg, Jr, Sullivan Correction Officers 1-14, Shane Topel, Bruce Tucker, Daniel Walter, Michael Weir, Steven Witte with JURY DEMAND.Document filed by Julia Ramsay-Nobles(Individually ), Julia Ramsay-Nobles(as Administratrix of the Estate of Karl Taylor, Deceased). Related document: 114 Amended Complaint,,, 106 Amended Complaint,, 53 Amended Complaint,. (Attachments: # 1 Certificate of Merit)(Gelernter, Eugene) (Entered: 03/23/2018)"
        },
        {
          "row_number": 20,
          "id": 2059299,
          "entry_number": "117",
          "date_filed": "2018-03-23T01:00:00-04:00",
          "attachments": [],
          "url": "https://www.courtlistener.com/docket/4524093/117/ramsay-nobles-v-keyser/",
