{
  "case_id": 9894,
  "fetched_at": "2025-10-20T22:40:54.302843",
  "case_data": {
    "attorney_orgs": [
      "Washington Lawyers' Committee"
    ],
    "available_documents": [
      "Trial Court Docket",
      "Complaint (any)",
      "Any published opinion"
    ],
    "case_defendants": [
      {
        "defendant_level": null,
        "institution": "",
        "institution_alt_state": null,
        "institution_city": "",
        "institution_county": "Knox",
        "name": "Knox County, Maine",
        "defendant_level_other": "",
        "is_active": true
      }
    ],
    "case_ongoing": "No",
    "case_status": "Coding Complete",
    "case_types": [
      "Jail Conditions"
    ],
    "cause_other": "",
    "causes": [
      "42 U.S.C. ยง 1983"
    ],
    "class_action_granted": "Granted",
    "class_action_sought": "Yes",
    "closing_year": 0,
    "constitutional_clause": [
      {
        "value": "Due Process"
      },
      {
        "value": "Unreasonable search and seizure"
      }
    ],
    "content_of_injunction": [],
    "court": "District of Maine",
    "custom_issues": [],
    "defendant_payment": "",
    "defendant_type": [],
    "docket_status": "Complete as of retrieval date",
    "facility_type": [
      {
        "value": "Government-run"
      }
    ],
    "filing_date": "2002-12-17",
    "filing_year": 2002,
    "id": 9894,
    "injunction_duration": "",
    "issues": [
      "General/Misc.: Search policies",
      "Jails, Prisons, Detention Centers, and Other Institutions: Strip search policy (facilities)",
      "Affected Sex/Gender(s): Male",
      "Affected Sex/Gender(s): Female"
    ],
    "last_checked_date": "2009-03-23T00:00:00-04:00",
    "main_docket": {
      "id": 33184,
      "docket_entries": [
        {
          "row_number": 377,
          "id": 3149213,
          "entry_number": "439",
          "date_filed": "2007-08-22T00:00:00-04:00",
          "attachments": [],
          "url": "https://www.courtlistener.com/docket/4647359/439/dare-v-knox-county/",
          "recap_pdf_url": null,
          "pacer_doc_id": "0910327554",
          "description": "TRANSCRIPT of Proceedings Chambers Conference held on 8-17-07 before Judge Gene Carter. Court Reporter: Dennis R. Ford. For a bound copy of this transcript, contact Dennis R. Ford at 207-831-8056. NOTICE: -- Transcripts are NOT remotely electronically available via PACER at this time. (FORD, DENNIS) (Entered: 08/22/2007)"
        },
        {
          "row_number": 379,
          "id": 3149214,
          "entry_number": "440",
          "date_filed": "2007-08-23T00:00:00-04:00",
          "attachments": [],
          "url": "https://www.courtlistener.com/docket/4647359/440/dare-v-knox-county/",
          "recap_pdf_url": null,
          "pacer_doc_id": "091071958",
          "description": "MOTION for Judgment by DALE DARE.Responses due by 9/13/2007. (Attachments: # 1 Exhibit A# 2 Exhibit B# 3 Exhibit C)(STOLT, ROBERT) (Entered: 08/23/2007)"
        },
        {
          "row_number": 381,
          "id": 3149216,
          "entry_number": "442",
          "date_filed": "2007-10-05T00:00:00-04:00",
          "attachments": [],
          "url": "https://www.courtlistener.com/docket/4647359/442/dare-v-knox-county/",
          "recap_pdf_url": null,
          "pacer_doc_id": "0910477968",
          "description": "MOTION Motion to Lift Stay by DALE DARE.Responses due by 10/26/2007. (Attachments: # 1 Settlement Fund Acct. Summary# 2 Proposed Order)(STOLT, ROBERT) (Entered: 10/05/2007)"
        },
        {
          "row_number": 382,
          "id": 3149217,
          "entry_number": "443",
          "date_filed": "2007-10-05T00:00:00-04:00",
          "attachments": [],
          "url": "https://www.courtlistener.com/docket/4647359/443/dare-v-knox-county/",
          "recap_pdf_url": null,
          "pacer_doc_id": null,
          "description": "ORDER granting 442 Motion to Lift Stay - \"GRANTED. The Claims Administrator shall forthwith make the distributions as approved in the Court's Judgment of 9/4/07.\" By Judge GENE CARTER. (mnw, ) (Entered: 10/05/2007)"
        },
        {
          "row_number": 383,
          "id": 3149218,
          "entry_number": "444",
          "date_filed": "2007-12-11T00:00:00-05:00",
          "attachments": [],
          "url": "https://www.courtlistener.com/docket/4647359/444/dare-v-knox-county/",
          "recap_pdf_url": null,
          "pacer_doc_id": "0910488775",
          "description": "ORDER ON FINAL REPORT OF SETTLEMENT :( Accounting by the Claims Administrator(1) due by 12/31/2007.) By JUDGE GENE CARTER. (mjlt) (Entered: 12/11/2007)"
        },
        {
          "row_number": 384,
          "id": 3149219,
          "entry_number": "445",
          "date_filed": "2007-12-21T00:00:00-05:00",
          "attachments": [],
          "url": "https://www.courtlistener.com/docket/4647359/445/dare-v-knox-county/",
          "recap_pdf_url": null,
          "pacer_doc_id": "0910493153",
          "description": "NOTICE/CORRESPONDENCE Re: Final Report and Accounting by DALE DARE (Attachments: # 1 Exhibit Analytics, Inc. Accounting)(STOLT, ROBERT) (Entered: 12/21/2007)"
        },
        {
          "row_number": 385,
          "id": 3149220,
          "entry_number": "446",
          "date_filed": "2008-01-02T00:00:00-05:00",
          "attachments": [],
          "url": "https://www.courtlistener.com/docket/4647359/446/dare-v-knox-county/",
          "recap_pdf_url": null,
          "pacer_doc_id": "0910495565",
          "description": "ORDER ON SETTING ACCOUNTING re: Copies of the state and/or federal tax filings made that support the payment of $11,663.00 in taxes due by 1/11/2008. By JUDGE GENE CARTER. (mjlt) (Entered: 01/03/2008)"
        },
        {
          "row_number": 386,
          "id": 3149221,
          "entry_number": "447",
          "date_filed": "2008-01-04T00:00:00-05:00",
          "attachments": [],
          "url": "https://www.courtlistener.com/docket/4647359/447/dare-v-knox-county/",
          "recap_pdf_url": null,
          "pacer_doc_id": "0910496777",
          "description": "NOTICE/CORRESPONDENCE Re: RESPONSE TO ORDER ON SETTLEMENT ACCOUNTING by DALE DARE (Attachments: # 1 Exhibit Federal Tax Form, # 2 Exhibit State Form)(STOLT, ROBERT) (Entered: 01/04/2008)"
        },
        {
          "row_number": 0,
          "id": 10324414,
          "entry_number": "1",
          "date_filed": "2002-12-17T00:00:00-05:00",
          "attachments": null,
          "url": "https://www.courtlistener.com/docket/4647359/1/dare-v-knox-county/",
          "recap_pdf_url": null,
          "pacer_doc_id": null,
          "description": "COMPLAINT filed; FILING FEE $ 150.00 RECEIPT # 46871; jury demand (Service of Process Deadline 4/16/03 ) (dw) (Entered: 12/17/2002)"
        },
        {
          "row_number": 111,
          "id": 10324415,
          "entry_number": "2",
          "date_filed": "2002-12-26T00:00:00-05:00",
          "attachments": null,
          "url": "https://www.courtlistener.com/docket/4647359/2/dare-v-knox-county/",
          "recap_pdf_url": null,
          "pacer_doc_id": "0910340827",
          "description": "AMENDED COMPLAINT by LAURIE TARDIFF amending [1-1] complaint jury demand (amending parties' capacities) (dw) Modified on 12/27/2002 Additional attachment(s) added on 8/15/2005 (mjlt, ). (Entered: 12/27/2002)"
        },
        {
          "row_number": 333,
          "id": 10324417,
          "entry_number": "4",
          "date_filed": "2003-01-07T00:00:00-05:00",
          "attachments": null,
          "url": "https://www.courtlistener.com/docket/4647359/4/dare-v-knox-county/",
          "recap_pdf_url": null,
          "pacer_doc_id": null,
          "description": "SCHEDULING ORDER setting Discovery cutoff 5/13/03 ; Deadline for filing of all motions 5/20/03 ; Ready for Trial Date 8/4/03 ; ( signed by MAG. JUDGE DAVID M. COHEN ) cc: cnsl. CONSENT FORM mailed to pltf cnsl. (mnm) (Entered: 01/08/2003)"
        },
        {
          "row_number": 396,
          "id": 10324418,
          "entry_number": "5",
          "date_filed": "2003-01-17T00:00:00-05:00",
          "attachments": null,
          "url": "https://www.courtlistener.com/docket/4647359/5/dare-v-knox-county/",
          "recap_pdf_url": null,
          "pacer_doc_id": null,
          "description": "ANSWER by KNOX COUNTY, DANIEL DAVEY, JANE DOE, JOHN DOE (Attorney Peter Marchesi) to [2-1] amended complaint (mjl) (Entered: 01/17/2003)"
        },
        {
          "row_number": 407,
          "id": 10324419,
          "entry_number": "6",
          "date_filed": "2003-01-22T00:00:00-05:00",
          "attachments": null,
          "url": "https://www.courtlistener.com/docket/4647359/6/dare-v-knox-county/",
          "recap_pdf_url": null,
          "pacer_doc_id": null,
          "description": "MOTION by KNOX COUNTY, DANIEL DAVEY, JANE DOE, JOHN DOE to Amend Scheduling Order - Reason: Extend Deadlines & Possibly Put Case On Complex Track ; Response to Motion due 2/12/03 for LAURIE TARDIFF (mjl) (Entered: 01/22/2003)"
        },
        {
          "row_number": 418,
          "id": 10324420,
          "entry_number": "7",
          "date_filed": "2003-01-27T00:00:00-05:00",
          "attachments": null,
          "url": "https://www.courtlistener.com/docket/4647359/7/dare-v-knox-county/",
          "recap_pdf_url": null,
          "pacer_doc_id": null,
          "description": "MOTION by LAURIE TARDIFF to Amend Scheduling Order - Reason: Assigned Case To The Complex Track and Extend Deadlines (mjl) (Entered: 01/28/2003)"
        },
        {
          "row_number": 429,
          "id": 10324421,
          "entry_number": "8",
          "date_filed": "2003-01-30T00:00:00-05:00",
          "attachments": null,
          "url": "https://www.courtlistener.com/docket/4647359/8/dare-v-knox-county/",
          "recap_pdf_url": null,
          "pacer_doc_id": "091096497",
          "description": "FIRST AMENDED ANSWER by KNOX COUNTY, DANIEL DAVEY, JANE DOE, JOHN DOE (Attorney Peter Marchesi ) to [2-1] amended complaint (mjl) Additional attachment(s) added on 8/15/2005 (mjlt, ). (Entered: 01/30/2003)"
        },
        {
          "row_number": 440,
          "id": 10324422,
          "entry_number": "9",
          "date_filed": "2003-02-07T00:00:00-05:00",
          "attachments": null,
          "url": "https://www.courtlistener.com/docket/4647359/9/dare-v-knox-county/",
          "recap_pdf_url": null,
          "pacer_doc_id": null,
          "description": "MOTION to Certify Class by LAURIE TARDIFF With Memo in Support.Responses due by 2/28/2003. (mjl, ) (Entered: 02/10/2003)"
        },
        {
          "row_number": 1,
          "id": 10324423,
          "entry_number": "10",
          "date_filed": "2003-02-13T00:00:00-05:00",
          "attachments": null,
          "url": "https://www.courtlistener.com/docket/4647359/10/dare-v-knox-county/",
          "recap_pdf_url": null,
          "pacer_doc_id": null,
          "description": "REPORT OF CONFERENCE OF COUNSEL AND ORDER re: Motion to amend scheduling order issued in this case (Docket No. 4) and during the conference, the defendants orally requested an additional 30 days to respond to the plaintiff's motion for class certification (Docket No. 9) ( Signed by Judge DAVID M. COHEN on 2/13/03. (See pleading No. 10 for amended scheduling order deadlines)(mjl, ) Modified on 2/13/2003 (mjl, ). (Entered: 02/13/2003)"
        },
        {
          "row_number": 12,
          "id": 10324424,
          "entry_number": "11",
          "date_filed": "2003-03-31T00:00:00-05:00",
          "attachments": null,
          "url": "https://www.courtlistener.com/docket/4647359/11/dare-v-knox-county/",
          "recap_pdf_url": null,
          "pacer_doc_id": null,
          "description": "RESPONSE to Motion re 9 MOTION to Certify Class filed by DANIEL DAVEY, JANE DOE, JOHN DOE, KNOX COUNTY.Reply due by 4/11/2003. (mjl, ) (Entered: 03/31/2003)"
        },
        {
          "row_number": 34,
          "id": 10324426,
          "entry_number": "13",
          "date_filed": "2003-03-31T00:00:00-05:00",
          "attachments": null,
          "url": "https://www.courtlistener.com/docket/4647359/13/dare-v-knox-county/",
          "recap_pdf_url": null,
          "pacer_doc_id": null,
          "description": "MOTION for Leave to File Response to Motion For Class Certifcation In Excess Page Limit by DANIEL DAVEY, JANE DOE, JOHN DOE, KNOX COUNTY.Responses due by 4/21/2003. (mjl, ) (Entered: 03/31/2003)"
        },
        {
          "row_number": 45,
          "id": 10324427,
          "entry_number": "14",
          "date_filed": "2003-04-04T00:00:00-05:00",
          "attachments": null,
          "url": "https://www.courtlistener.com/docket/4647359/14/dare-v-knox-county/",
          "recap_pdf_url": null,
          "pacer_doc_id": null,
          "description": "MOTION to Extend Time To File Reply To Motion For Class Certification On Or Before April 21, 2003 by LAURIE TARDIFF.Responses due by 4/25/2003. (mjl, ) (Entered: 04/04/2003)"
        },
        {
          "row_number": 67,
          "id": 10324429,
          "entry_number": "16",
          "date_filed": "2003-04-08T00:00:00-04:00",
          "attachments": null,
          "url": "https://www.courtlistener.com/docket/4647359/16/dare-v-knox-county/",
          "recap_pdf_url": null,
          "pacer_doc_id": null,
          "description": "NOTICE of Hearing via t/c & in writing:Discovery Hearing set for 4/18/2003 09:00 AM in Hearing Room, Portland before MAG. JUDGE DAVID M. COHEN re: disputes presented in letter from Atty Stolt. Cnsl to confer in good faith per Local Rules and court's directive in an effort to resolve disputes.(slh, ) (Entered: 04/08/2003)"
        },
        {
          "row_number": 78,
          "id": 10324430,
          "entry_number": "17",
          "date_filed": "2003-04-14T00:00:00-04:00",
          "attachments": null,
          "url": "https://www.courtlistener.com/docket/4647359/17/dare-v-knox-county/",
          "recap_pdf_url": null,
          "pacer_doc_id": null,
          "description": "ORDER re: Discovery Dispute Surrounding Plaintiff's First Request For Production Of Documents Signed by Judge DAVID M. COHEN on 4/14/03. (mjl, ) (Entered: 04/14/2003)"
        },
        {
          "row_number": 100,
          "id": 10324432,
          "entry_number": "19",
          "date_filed": "2003-04-21T00:00:00-04:00",
          "attachments": null,
          "url": "https://www.courtlistener.com/docket/4647359/19/dare-v-knox-county/",
          "recap_pdf_url": null,
          "pacer_doc_id": null,
          "description": "REPLY to Response to Motion re 9 MOTION to Certify Class filed by LAURIE TARDIFF. (mjl, ) (Entered: 04/22/2003)"
        },
        {
          "row_number": 112,
          "id": 10324433,
          "entry_number": "20",
          "date_filed": "2003-05-28T00:00:00-04:00",
          "attachments": null,
          "url": "https://www.courtlistener.com/docket/4647359/20/dare-v-knox-county/",
          "recap_pdf_url": null,
          "pacer_doc_id": null,
          "description": "Minute Entry for proceedings held before Judge DAVID M. COHEN : Discovery Hearing held, Oral Order: discovery reopened and extended to 6/27/03 for the limited purpose of allowing the noticed depositions of John Hinkley and Richard Robbins to go forward and to legitimize the plaintiff's outstanding requests for admissions. Counsel to confer/agree on new deposition dates. (Court Reporter None) (mjl, ) (Entered: 05/29/2003)"
        },
        {
          "row_number": 123,
          "id": 10324434,
          "entry_number": "21",
          "date_filed": "2003-11-05T00:00:00-05:00",
          "attachments": null,
          "url": "https://www.courtlistener.com/docket/4647359/21/dare-v-knox-county/",
          "recap_pdf_url": null,
          "pacer_doc_id": null,
          "description": "ORDER granting 9 Motion to Certify Class By Judge GENE CARTER. (mjl, ) (Entered: 11/05/2003)"
        },
        {
          "row_number": 134,
          "id": 10324435,
          "entry_number": "22",
          "date_filed": "2003-11-05T00:00:00-05:00",
          "attachments": null,
          "url": "https://www.courtlistener.com/docket/4647359/22/dare-v-knox-county/",
          "recap_pdf_url": null,
          "pacer_doc_id": null,
          "description": "ORDER granting 18 Motion for Leave to File Motion granted. For the Court, Michelle J. Levasseur,DEPUTY CLERK:. (mjl, ) (Entered: 11/05/2003)"
        },
        {
          "row_number": 156,
          "id": 10324437,
          "entry_number": "24",
          "date_filed": "2004-01-14T00:00:00-05:00",
          "attachments": null,
          "url": "https://www.courtlistener.com/docket/4647359/24/dare-v-knox-county/",
          "recap_pdf_url": null,
          "pacer_doc_id": null,
          "description": "NOTICE OF APPEAL by DANIEL DAVEY, JANE DOE, JOHN DOE, KNOX COUNTY (ORDER OF USCA granting defendants' petition for leave to appeal under Fed. R. Civ. P. 23(f)). Filing fee $ 255, receipt number 49846. (bfa, ) (Entered: 01/16/2004)"
        },
        {
          "row_number": 189,
          "id": 10324440,
          "entry_number": "27",
          "date_filed": "2004-05-05T00:00:00-04:00",
          "attachments": null,
          "url": "https://www.courtlistener.com/docket/4647359/27/dare-v-knox-county/",
          "recap_pdf_url": null,
          "pacer_doc_id": null,
          "description": "MANDATE of USCA as to 24 Notice of Appeal filed by DANIEL DAVEY, JANE DOE, JOHN DOE, KNOX COUNTY. Affirmed. Check for Receipt of Appeal Record on 6/21/2004. (bfa, ) (Entered: 05/06/2004)"
        },
        {
          "row_number": 211,
          "id": 10324442,
          "entry_number": "29",
          "date_filed": "2004-05-13T00:00:00-04:00",
          "attachments": null,
          "url": "https://www.courtlistener.com/docket/4647359/29/dare-v-knox-county/",
          "recap_pdf_url": null,
          "pacer_doc_id": null,
          "description": "ORDER of USCA re: taxation of costs in the amount of $82.60 as to 24 Notice of Appeal filed by DANIEL DAVEY, JANE DOE, JOHN DOE, KNOX COUNTY (bfa, ) (Entered: 05/13/2004)"
        },
        {
          "row_number": 223,
          "id": 10324443,
          "entry_number": "30",
          "date_filed": "2004-05-17T00:00:00-04:00",
          "attachments": null,
          "url": "https://www.courtlistener.com/docket/4647359/30/dare-v-knox-county/",
          "recap_pdf_url": null,
          "pacer_doc_id": null,
          "description": "Defendant & Plaintiff's Proposed Discovery and Motion Filing Plan by DANIEL DAVEY, KNOX COUNTY. (mjl, ) (Entered: 05/18/2004)"
        },
        {
          "row_number": 245,
          "id": 10324445,
          "entry_number": "32",
          "date_filed": "2004-05-21T00:00:00-04:00",
          "attachments": null,
          "url": "https://www.courtlistener.com/docket/4647359/32/dare-v-knox-county/",
          "recap_pdf_url": null,
          "pacer_doc_id": null,
          "description": "Oral MOTION to Extend Time to File Joint Proposed Discovery & Motion Plan to May 26, 2004, by LAURIE TARDIFF. (slh, ) (Entered: 05/21/2004)"
        },
        {
          "row_number": 256,
          "id": 10324446,
          "entry_number": "33",
          "date_filed": "2004-05-21T00:00:00-04:00",
          "attachments": null,
          "url": "https://www.courtlistener.com/docket/4647359/33/dare-v-knox-county/",
          "recap_pdf_url": null,
          "pacer_doc_id": null,
          "description": "Oral ORDER granting 32 Motion to Extend Time to May 26, 2004, to File Joint Proposed Discovery & Motion Plan By Mag.Judge DAVID M. COHEN. (slh, ) (Entered: 05/21/2004)"
        },
        {
          "row_number": 267,
          "id": 10324447,
          "entry_number": "34",
          "date_filed": "2004-05-26T00:00:00-04:00",
          "attachments": null,
          "url": "https://www.courtlistener.com/docket/4647359/34/dare-v-knox-county/",
          "recap_pdf_url": null,
          "pacer_doc_id": null,
          "description": "JOINT Proposed Discovery and Motion Filing Plan by DANIEL DAVEY, JANE DOE, JOHN DOE, KNOX COUNTY, LAURIE TARDIFF. (mjl, ) (Entered: 05/26/2004)"
        },
        {
          "row_number": 278,
          "id": 10324448,
          "entry_number": "35",
          "date_filed": "2004-06-16T00:00:00-04:00",
          "attachments": null,
          "url": "https://www.courtlistener.com/docket/4647359/35/dare-v-knox-county/",
          "recap_pdf_url": null,
          "pacer_doc_id": null,
          "description": "NOTICE of Hearing per tele-call to counsel: Scheduling Conference of Counsel set for 6/18/2004 04:00 PM in Hearing Room, Portland before MAG. JUDGE DAVID M. COHEN. This is a joint conference per the court's directive in this case and the NILSEN case, 02cv212ph. Any parties participating via telephone should arrange for placement of a conference call to Chambers.(slh, ) (Entered: 06/16/2004)"
        },
        {
          "row_number": 289,
          "id": 10324449,
          "entry_number": "36",
          "date_filed": "2004-06-18T00:00:00-04:00",
          "attachments": null,
          "url": "https://www.courtlistener.com/docket/4647359/36/dare-v-knox-county/",
          "recap_pdf_url": null,
          "pacer_doc_id": null,
          "description": "Minute Entry for proceedings held before Mag.Judge DAVID M. COHEN : Scheduling Conference of Counsel held. Report & Order to issue. (Court Reporter NONE) (slh, ) (Entered: 06/18/2004)"
        },
        {
          "row_number": 311,
          "id": 10324451,
          "entry_number": "38",
          "date_filed": "2004-06-24T00:00:00-04:00",
          "attachments": null,
          "url": "https://www.courtlistener.com/docket/4647359/38/dare-v-knox-county/",
          "recap_pdf_url": null,
          "pacer_doc_id": null,
          "description": "MOTION For Clarification Of Report Of Scheduling Conference And Revised Scheduling Order Dated June 18, 2004 by DANIEL DAVEY, JANE DOE, JOHN DOE, KNOX COUNTY.Responses due by 7/15/2004. (mjl, ) (Entered: 06/24/2004)"
        },
        {
          "row_number": 322,
          "id": 10324452,
          "entry_number": "39",
          "date_filed": "2004-06-25T00:00:00-04:00",
          "attachments": null,
          "url": "https://www.courtlistener.com/docket/4647359/39/dare-v-knox-county/",
          "recap_pdf_url": null,
          "pacer_doc_id": null,
          "description": "NOTICE of Hearing per tele-call from Atty Thistle on Discovery Issue and on Motion 38 MOTION For Clarification Of Report Of Scheduling Conference And Revised Scheduling Order Dated June 18, 2004:Telephone Discovery & Motion Hearing set for 6/28/2004 03:30 PM before MAG. JUDGE DAVID M. COHEN; Atty Thistle to initiate call to Chambers. (slh, ) (Entered: 06/25/2004)"
        },
        {
          "row_number": 334,
          "id": 10324453,
          "entry_number": "40",
          "date_filed": "2004-06-28T00:00:00-04:00",
          "attachments": null,
          "url": "https://www.courtlistener.com/docket/4647359/40/dare-v-knox-county/",
          "recap_pdf_url": null,
          "pacer_doc_id": null,
          "description": "AMENDED REPORT OF SCHEDULING CONFERENCE AND REVISED SCHEDULING ORDER- Scheduling Order Deadlines Discovery due by 12/31/2004. Motions due by 1/28/2005. Ready for Trial on 4/5/2005. Proposed Notice Plan To Class(1) due by 9/15/2004. Any objections to Proposed Notice (2) due by 10/6/2004. By Judge DAVID M. COHEN. (mjl, ) Modified on 6/29/2004 to reflect the ready for trial date is 4/5/2005 and not 4/5/1954 as previously indicated. (mjl, ). (Entered: 06/29/2004)"
        },
        {
          "row_number": 345,
          "id": 10324454,
          "entry_number": "41",
          "date_filed": "2004-06-28T00:00:00-04:00",
          "attachments": null,
          "url": "https://www.courtlistener.com/docket/4647359/41/dare-v-knox-county/",
          "recap_pdf_url": null,
          "pacer_doc_id": null,
          "description": "REPORT OF HEARING AND ORDER re: Discovery Dispute By Judge DAVID M. COHEN. (mjl, ) (Entered: 06/29/2004)"
        },
        {
          "row_number": 367,
          "id": 10324456,
          "entry_number": "43",
          "date_filed": "2004-06-28T00:00:00-04:00",
          "attachments": null,
          "url": "https://www.courtlistener.com/docket/4647359/43/dare-v-knox-county/",
          "recap_pdf_url": null,
          "pacer_doc_id": null,
          "description": "Minute Entry for proceedings held before Mag.Judge DAVID M. COHEN : Telephone Discovery Hearing held, Telephone Motion Hearing held re 38 MOTION For Clarification Of Report Of Scheduling Conference And Revised Scheduling Order Dated June 18, 2004 filed by DANIEL DAVEY, JANE DOE, JOHN DOE, KNOX COUNTY. (Court Reporter NONE) (slh, ) (Entered: 06/29/2004)"
        },
        {
          "row_number": 378,
          "id": 10324457,
          "entry_number": "44",
          "date_filed": "2004-06-29T00:00:00-04:00",
          "attachments": null,
          "url": "https://www.courtlistener.com/docket/4647359/44/dare-v-knox-county/",
          "recap_pdf_url": null,
          "pacer_doc_id": null,
          "description": "MOTION to Extend Time To File Objections To The Revised Scheduling Order by DANIEL DAVEY, JANE DOE, JOHN DOE, KNOX COUNTY.Responses due by 7/20/2004. (mjl, ) (Entered: 06/30/2004)"
        },
        {
          "row_number": 389,
          "id": 10324458,
          "entry_number": "45",
          "date_filed": "2004-07-02T00:00:00-04:00",
          "attachments": null,
          "url": "https://www.courtlistener.com/docket/4647359/45/dare-v-knox-county/",
          "recap_pdf_url": null,
          "pacer_doc_id": null,
          "description": "ORDER granting 44 Motion to Extend Time By Judge DAVID M. COHEN. (mjl, ) (Entered: 07/02/2004)"
        },
        {
          "row_number": 392,
          "id": 10324459,
          "entry_number": "46",
          "date_filed": "2004-07-09T00:00:00-04:00",
          "attachments": null,
          "url": "https://www.courtlistener.com/docket/4647359/46/dare-v-knox-county/",
          "recap_pdf_url": null,
          "pacer_doc_id": null,
          "description": "OBJECTION to 40 AMENDED REPORT OF SCHEDULING CONFERENCE AND REVISED SCHEDULING ORDER, filed by DANIEL DAVEY, JANE DOE, JOHN DOE, KNOX COUNTY.Responses due by 7/26/2004. (mjl, ) (Entered: 07/09/2004)"
        },
        {
          "row_number": 393,
          "id": 10324460,
          "entry_number": "47",
          "date_filed": "2004-07-30T00:00:00-04:00",
          "attachments": null,
          "url": "https://www.courtlistener.com/docket/4647359/47/dare-v-knox-county/",
          "recap_pdf_url": null,
          "pacer_doc_id": null,
          "description": "ORDER reserving ruling 46 Objection To Amend The Amended Report Of Scheduling Order By Judge GENE CARTER. (mjl, ) (Entered: 07/30/2004)"
        },
        {
          "row_number": 395,
          "id": 10324462,
          "entry_number": "49",
          "date_filed": "2004-09-15T00:00:00-04:00",
          "attachments": null,
          "url": "https://www.courtlistener.com/docket/4647359/49/dare-v-knox-county/",
          "recap_pdf_url": null,
          "pacer_doc_id": "0910292745",
          "description": "MOTION for Order in Aid of Identification of Class Members by LAURIE TARDIFF.Responses due by 10/6/2004. (STOLT, ROBERT) (Entered: 09/15/2004)"
        },
        {
          "row_number": 397,
          "id": 10324463,
          "entry_number": "50",
          "date_filed": "2004-09-15T00:00:00-04:00",
          "attachments": null,
          "url": "https://www.courtlistener.com/docket/4647359/50/dare-v-knox-county/",
          "recap_pdf_url": null,
          "pacer_doc_id": "091052057",
          "description": "MEMORANDUM by LAURIE TARDIFF in support of 49 MOTION for Order in Aid of Identification of Class Members. (STOLT, ROBERT) (Entered: 09/15/2004)"
        },
        {
          "row_number": 398,
          "id": 10324464,
          "entry_number": "51",
          "date_filed": "2004-09-15T00:00:00-04:00",
          "attachments": null,
          "url": "https://www.courtlistener.com/docket/4647359/51/dare-v-knox-county/",
          "recap_pdf_url": null,
          "pacer_doc_id": "0910292776",
          "description": "**ORIGINAL PAPER DOCUMENTS & EXHIBITS ARE ON FILE WITH THE CLERK'S OFFICE**AFFIDAVIT of Robert J. Stolt filed by LAURIE TARDIFF. (STOLT, ROBERT) Modified on 9/16/2004 To reflect original pleading along with exhibits are on file with the clerk's office (mjl, ). (Entered: 09/15/2004)"
        },
        {
          "row_number": 399,
          "id": 10324465,
          "entry_number": "52",
          "date_filed": "2004-09-16T00:00:00-04:00",
          "attachments": null,
          "url": "https://www.courtlistener.com/docket/4647359/52/dare-v-knox-county/",
          "recap_pdf_url": null,
          "pacer_doc_id": null,
          "description": "MOTION for Leave to File Plaintiff's Motion For Order In Aid Of Identification Of Class Members In Excess Page Limit by LAURIE TARDIFF.Responses due by 10/7/2004. (mjl, ) Modified on 9/21/2004 to fix a typographical error (mjl, ). (Entered: 09/16/2004)"
        },
        {
          "row_number": 400,
          "id": 10324466,
          "entry_number": "53",
          "date_filed": "2004-09-16T00:00:00-04:00",
          "attachments": null,
          "url": "https://www.courtlistener.com/docket/4647359/53/dare-v-knox-county/",
          "recap_pdf_url": null,
          "pacer_doc_id": null,
          "description": "MOTION for Order In Aid Of Identification of Class Members by LAURIE TARDIFF WITH INCORPORATED MEMO.Responses due by 10/7/2004. (mjl, ) (Entered: 09/16/2004)"
        },
        {
          "row_number": 401,
          "id": 10324467,
          "entry_number": "54",
          "date_filed": "2004-10-05T00:00:00-04:00",
          "attachments": null,
          "url": "https://www.courtlistener.com/docket/4647359/54/dare-v-knox-county/",
          "recap_pdf_url": null,
          "pacer_doc_id": null,
          "description": "Unopposed MOTION to Extend Time UNTIL OCTOBER 13, 2004 TO FILE OBJECTION TO PLAINTIFF'S MOTION FOR APPROVAL OF NOTICE TO THE CLASS AND PLAINTIFF'S MOTION FOR ORDER IN AID OF IDENTIFICATION OF CLASS MEMBERS by DANIEL DAVEY, JANE DOE, JOHN DOE, KNOX COUNTY. (mnm, ) (Entered: 10/05/2004)"
        },
        {
          "row_number": 402,
          "id": 10324468,
          "entry_number": "55",
          "date_filed": "2004-10-06T00:00:00-04:00",
          "attachments": null,
          "url": "https://www.courtlistener.com/docket/4647359/55/dare-v-knox-county/",
          "recap_pdf_url": null,
          "pacer_doc_id": null,
          "description": "ORDER granting without objection 54 Motion to Extend Time Within Which To File Objections To Plaintiff's Motion For Approval Of Notice To The Class And Plaintiff's Motion For Order In Aid Of Identification Of Class Memembers By Judge GENE CARTER. (mjl, ) (Entered: 10/06/2004)"
        },
        {
          "row_number": 403,
          "id": 10324469,
          "entry_number": "56",
          "date_filed": "2004-10-13T00:00:00-04:00",
          "attachments": null,
          "url": "https://www.courtlistener.com/docket/4647359/56/dare-v-knox-county/",
          "recap_pdf_url": null,
          "pacer_doc_id": null,
          "description": "RESPONSE to Motion re 48 MOTION for Approval of Notice to the Class filed by DANIEL DAVEY, JANE DOE, JOHN DOE, KNOX COUNTY.Reply due by 10/25/2004. (mjl, ) (Entered: 10/14/2004)"
        },
        {
          "row_number": 404,
          "id": 10324470,
          "entry_number": "57",
          "date_filed": "2004-10-13T00:00:00-04:00",
          "attachments": null,
          "url": "https://www.courtlistener.com/docket/4647359/57/dare-v-knox-county/",
          "recap_pdf_url": null,
          "pacer_doc_id": null,
          "description": "MOTION to Extend Time To File Objection To Plaintiff's Motion For Order In Aid Of Identification Of Class Members Until October 14, 2004 by DANIEL DAVEY, JANE DOE, JOHN DOE, KNOX COUNTY.Responses due by 11/3/2004. (mjl, ) (Entered: 10/14/2004)"
        },
        {
          "row_number": 405,
          "id": 10324471,
          "entry_number": "58",
          "date_filed": "2004-10-14T00:00:00-04:00",
          "attachments": null,
          "url": "https://www.courtlistener.com/docket/4647359/58/dare-v-knox-county/",
          "recap_pdf_url": null,
          "pacer_doc_id": null,
          "description": "ORDER granting without objection 57 Motion to Extend Time No objection by the Plaintiff, the motion is granted.The defendants' are to file their objection to the Plaintiffs' Motion For Order In Aid Of Identification Of Class Members by October 14, 2004. For the Court, Michelle Levasseur, DEPUTY CLERK. (mjl, ) (Entered: 10/14/2004)"
        },
        {
          "row_number": 406,
          "id": 10324472,
          "entry_number": "59",
          "date_filed": "2004-10-14T00:00:00-04:00",
          "attachments": null,
          "url": "https://www.courtlistener.com/docket/4647359/59/dare-v-knox-county/",
          "recap_pdf_url": null,
          "pacer_doc_id": null,
          "description": "MOTION for Leave to File Memorandum In Opposition To Plaintiff's Motion For Order In Aid Of Identification Of Class Members In Excess Page Limit by DANIEL DAVEY, JANE DOE, JOHN DOE, KNOX COUNTY.Responses due by 11/4/2004. (mjl, ) (Entered: 10/14/2004)"
        },
        {
          "row_number": 408,
          "id": 10324473,
          "entry_number": "60",
          "date_filed": "2004-10-14T00:00:00-04:00",
          "attachments": null,
          "url": "https://www.courtlistener.com/docket/4647359/60/dare-v-knox-county/",
          "recap_pdf_url": null,
          "pacer_doc_id": null,
          "description": "RESPONSE to Motion re 53 MOTION for Order In Aid Of Identification of Class Members, 49 MOTION for Order in Aid of Identification of Class Members filed by DANIEL DAVEY, JANE DOE, JOHN DOE, KNOX COUNTY.Reply due by 10/25/2004. (mjl, ) (Entered: 10/14/2004)"
        },
        {
          "row_number": 409,
          "id": 10324474,
          "entry_number": "61",
          "date_filed": "2004-10-14T00:00:00-04:00",
          "attachments": null,
          "url": "https://www.courtlistener.com/docket/4647359/61/dare-v-knox-county/",
          "recap_pdf_url": null,
          "pacer_doc_id": null,
          "description": "AFFIDAVIT of Peter T. Marchesi, Esq. re 60 Response to Motion, filed by DANIEL DAVEY, JANE DOE, JOHN DOE, KNOX COUNTY. (mjl, ) (Entered: 10/14/2004)"
        },
        {
          "row_number": 410,
          "id": 10324475,
          "entry_number": "62",
          "date_filed": "2004-10-18T00:00:00-04:00",
          "attachments": null,
          "url": "https://www.courtlistener.com/docket/4647359/62/dare-v-knox-county/",
          "recap_pdf_url": null,
          "pacer_doc_id": null,
          "description": "Unopposed MOTION to Extend Time UNTIL NOVEMBER 4, 2004 TO REPLY TO PLAINTIFF'S MOTION FOR APPROVAL OF NOTICE TO THE CLASS AND PLAINTIFF'S MOTION FOR ORDER IN AID OF IDENTIFICATION OF CLASS MEMBERS by LAURIE TARDIFF. (mnm, ) (Entered: 10/19/2004)"
        },
        {
          "row_number": 411,
          "id": 10324476,
          "entry_number": "63",
          "date_filed": "2004-10-19T00:00:00-04:00",
          "attachments": null,
          "url": "https://www.courtlistener.com/docket/4647359/63/dare-v-knox-county/",
          "recap_pdf_url": null,
          "pacer_doc_id": null,
          "description": "ORDER granting 62 Motion to Extend Time UNTIL NOVEMBER 4, 2004 TO REPLY TO PLAINTIFF'S MOTION FOR APPROVAL OF NOTICE TO THE CLASS AND PLAINTIFF'S MOTION FOR ORDER IN AID OF IDENTIFICATION OF CLASS MEMBERS. \"Granted as prayed for\" By Judge DAVID M. COHEN. (mnm, ) (Entered: 10/19/2004)"
        },
        {
          "row_number": 412,
          "id": 10324477,
          "entry_number": "64",
          "date_filed": "2004-11-03T00:00:00-05:00",
          "attachments": null,
          "url": "https://www.courtlistener.com/docket/4647359/64/dare-v-knox-county/",
          "recap_pdf_url": null,
          "pacer_doc_id": null,
          "description": "MOTION for Leave to File Reply Memorandum By Plaintiffs In Support Of Motion For Order In Aid Of Indentification Of Class Members And For Approval Of Notice To The Class by LAURIE TARDIFF.Responses due by 11/24/2004. (mjl, ) (Entered: 11/04/2004)"
        },
        {
          "row_number": 413,
          "id": 10324478,
          "entry_number": "65",
          "date_filed": "2004-11-03T00:00:00-05:00",
          "attachments": null,
          "url": "https://www.courtlistener.com/docket/4647359/65/dare-v-knox-county/",
          "recap_pdf_url": null,
          "pacer_doc_id": null,
          "description": "REPLY to Response to Motion re 48 MOTION for Approval of Notice to the Class, 53 MOTION for Order In Aid Of Identification of Class Members, 49 MOTION for Order in Aid of Identification of Class Members filed by LAURIE TARDIFF. (mjl, ) (Entered: 11/04/2004)"
        },
        {
          "row_number": 415,
          "id": 10324480,
          "entry_number": "67",
          "date_filed": "2004-11-03T00:00:00-05:00",
          "attachments": null,
          "url": "https://www.courtlistener.com/docket/4647359/67/dare-v-knox-county/",
          "recap_pdf_url": null,
          "pacer_doc_id": null,
          "description": "NOTICE of Appearance Pro Hac Vice of David M. Hoffman filed by SUMNER H. LIPMAN on behalf of LAURIE TARDIFF (mjl, ) (Entered: 11/04/2004)"
        },
        {
          "row_number": 416,
          "id": 10324481,
          "entry_number": "68",
          "date_filed": "2004-11-03T00:00:00-05:00",
          "attachments": null,
          "url": "https://www.courtlistener.com/docket/4647359/68/dare-v-knox-county/",
          "recap_pdf_url": null,
          "pacer_doc_id": null,
          "description": "NOTICE of Appearance Pro Hac Vice of Frank P. DiPrima filed by SUMNER H. LIPMAN on behalf of LAURIE TARDIFF (mjl, ) (Entered: 11/04/2004)"
        },
        {
          "row_number": 419,
          "id": 10324483,
          "entry_number": "70",
          "date_filed": "2004-11-10T00:00:00-05:00",
          "attachments": null,
          "url": "https://www.courtlistener.com/docket/4647359/70/dare-v-knox-county/",
          "recap_pdf_url": null,
          "pacer_doc_id": null,
          "description": "Minute Entry for proceedings held before Judge DAVID M. COHEN : Telephone Conference was held this date,Attorney Sumner H. Lipman, Dale T. Thistle for the Plaintiffs, and Peter T. Marchesi and John Wall for the Defendants. During the confernece the Court proposed a number of attorneys for the parties to agree upon for a mediator. Parties to notify the Court if they need further assistance in finding an agreed upon mediator. (Court Reporter None) (mjl, ) (Entered: 11/10/2004)"
        },
        {
          "row_number": 420,
          "id": 10324484,
          "entry_number": "71",
          "date_filed": "2004-11-10T00:00:00-05:00",
          "attachments": null,
          "url": "https://www.courtlistener.com/docket/4647359/71/dare-v-knox-county/",
          "recap_pdf_url": null,
          "pacer_doc_id": null,
          "description": "ORDER DENYING DEFENDANTS' OBJECTION TO AMENDED REPORT OF SCHEDULING CONFERENCE AND REVISED SCHEDULING ORDER 46 Objection By Judge GENE CARTER. (mjl, ) (Entered: 11/10/2004)"
        },
        {
          "row_number": 421,
          "id": 10324485,
          "entry_number": "72",
          "date_filed": "2004-11-26T00:00:00-05:00",
          "attachments": null,
          "url": "https://www.courtlistener.com/docket/4647359/72/dare-v-knox-county/",
          "recap_pdf_url": null,
          "pacer_doc_id": null,
          "description": "MOTION for Order (FOR CONFIDENTIALITY ORDER) by DANIEL DAVEY, JANE DOE, JOHN DOE, KNOX COUNTY.Responses due by 12/17/2004. (mnw, ) (Entered: 11/26/2004)"
        },
        {
          "row_number": 422,
          "id": 10324486,
          "entry_number": "73",
          "date_filed": "2004-12-06T00:00:00-05:00",
          "attachments": null,
          "url": "https://www.courtlistener.com/docket/4647359/73/dare-v-knox-county/",
          "recap_pdf_url": null,
          "pacer_doc_id": null,
          "description": "RESPONSE in Opposition re 72 MOTION for Order (FOR CONFIDENTIALITY ORDER) filed by LAURIE TARDIFF.Reply due by 12/17/2004. (mjl, ) (Entered: 12/06/2004)"
        },
        {
          "row_number": 424,
          "id": 10324488,
          "entry_number": "75",
          "date_filed": "2004-12-16T00:00:00-05:00",
          "attachments": null,
          "url": "https://www.courtlistener.com/docket/4647359/75/dare-v-knox-county/",
          "recap_pdf_url": null,
          "pacer_doc_id": null,
          "description": "NOTICE of Hearing on Motion per tele-call w/Atty Marchesi's office Re: 72 MOTION for Order (FOR CONFIDENTIALITY ORDER):Telephone Motion Hearing set for 12/20/2004 03:00 PM before MAG. JUDGE DAVID M. COHEN. Atty Marchesi to initiate conference call.(slh, ) (Entered: 12/16/2004)"
        },
        {
          "row_number": 425,
          "id": 10324489,
          "entry_number": "76",
          "date_filed": "2004-12-20T00:00:00-05:00",
          "attachments": null,
          "url": "https://www.courtlistener.com/docket/4647359/76/dare-v-knox-county/",
          "recap_pdf_url": null,
          "pacer_doc_id": null,
          "description": "Minute Entry for proceedings held before Judge DAVID M. COHEN : Telephone Conference held.For the plaintiff: Sumner Lipman, Esq. and Robert Stolt, Esq. For the Defendant: Peter Marchesi, Esq. and John Wall, Esq. After discussion I ruled that the documents at issue are entitled to confidentiality protection pursuant to Fed. R. Civ.P. 26(c)(7) (Commercial information) and directed the defendants to submit a proposed order to the Court in connection with Local Rule 26(d). (Court Reporter None) (mjl, ) (Entered: 12/21/2004)"
        },
        {
          "row_number": 427,
          "id": 10324491,
          "entry_number": "78",
          "date_filed": "2005-01-12T00:00:00-05:00",
          "attachments": null,
          "url": "https://www.courtlistener.com/docket/4647359/78/dare-v-knox-county/",
          "recap_pdf_url": null,
          "pacer_doc_id": null,
          "description": "ORDER granting 52 Motion for Leave to File, granting 59 Motion for Leave to File, granting 64 Motion for Leave to File \"Motions are hereby GRANTED. So ORDERED.\" By Judge GENE CARTER. (mjl, ) (Entered: 01/12/2005)"
        },
        {
          "row_number": 428,
          "id": 10324492,
          "entry_number": "79",
          "date_filed": "2005-01-12T00:00:00-05:00",
          "attachments": null,
          "url": "https://www.courtlistener.com/docket/4647359/79/dare-v-knox-county/",
          "recap_pdf_url": null,
          "pacer_doc_id": null,
          "description": "MEMORANDUM OF DECISION AND ORDER DENYING THE RELIEF REQUESTED BY PLAINTIFF'S MOTION IN AID OF IDENTIFICATION OF CLASS MEMBERS 53 MOTION for Order In Aid Of Identification of Class Members filed by LAURIE TARDIFF - The following deadlines have been reset pursuant to this order: Discovery due by 3/14/2005. Motions due by 5/16/2005. By Judge GENE CARTER. (mjl, ) Modified on 1/24/2005 to fix typographical error (mjl, ). (Entered: 01/12/2005)"
        },
        {
          "row_number": 430,
          "id": 10324493,
          "entry_number": "80",
          "date_filed": "2004-09-16T00:00:00-04:00",
          "attachments": null,
          "url": "https://www.courtlistener.com/docket/4647359/80/dare-v-knox-county/",
          "recap_pdf_url": null,
          "pacer_doc_id": null,
          "description": "AFFIDAVIT of Duane Degler re 53 MOTION for Order In Aid Of Identification of Class Members, 49 MOTION for Order in Aid of Identification of Class Members filed by LAURIE TARDIFF. (mjl, ) (Entered: 01/12/2005)"
        },
        {
          "row_number": 431,
          "id": 10324494,
          "entry_number": "81",
          "date_filed": "2005-02-01T00:00:00-05:00",
          "attachments": null,
          "url": "https://www.courtlistener.com/docket/4647359/81/dare-v-knox-county/",
          "recap_pdf_url": null,
          "pacer_doc_id": "0910398237",
          "description": "MOTION to Extend Time to April 29, 2005 to complete document review and to May 13, 2005 to notify the Court by LAURIE TARDIFF.Responses due by 2/22/2005. (LIPMAN, SUMNER) (Entered: 02/01/2005)"
        },
        {
          "row_number": 432,
          "id": 10324495,
          "entry_number": "82",
          "date_filed": "2005-02-22T00:00:00-05:00",
          "attachments": null,
          "url": "https://www.courtlistener.com/docket/4647359/82/dare-v-knox-county/",
          "recap_pdf_url": null,
          "pacer_doc_id": null,
          "description": "RESPONSE to Motion re 81 MOTION to Extend Time to April 29, 2005 to complete document review and to May 13, 2005 to notify the Court filed by KNOX COUNTY, DANIEL DAVEY, JANE DOE, JOHN DOE.Reply due by 3/7/2005. (mo, ) (Entered: 02/22/2005)"
        },
        {
          "row_number": 433,
          "id": 10324496,
          "entry_number": "83",
          "date_filed": "2005-02-23T00:00:00-05:00",
          "attachments": null,
          "url": "https://www.courtlistener.com/docket/4647359/83/dare-v-knox-county/",
          "recap_pdf_url": null,
          "pacer_doc_id": null,
          "description": "NOTICE of Hearing on Motion per tele-call to counsel Re: 81 MOTION to Extend Time to April 29, 2005 to complete document review and to May 13, 2005 to notify the Court: Telephone Motion Hearing (and Discovery Hearing on dispute presented by Atty Stolt) set for 2/23/2005 01:00 PM before MAG. JUDGE DAVID M. COHEN; Pltf to initiate conference call to Chambers. (slh, ) (Entered: 02/23/2005)"
        },
        {
          "row_number": 434,
          "id": 10324497,
          "entry_number": "84",
          "date_filed": "2005-02-23T00:00:00-05:00",
          "attachments": null,
          "url": "https://www.courtlistener.com/docket/4647359/84/dare-v-knox-county/",
          "recap_pdf_url": null,
          "pacer_doc_id": null,
          "description": "Minute Entry for proceedings held before Mag.Judge DAVID M. COHEN : Telephone Discovery Hearing and Motion Hearing held re 81 MOTION to Extend Time to April 29, 2005 to complete document review and to May 13, 2005 to notify the Court filed by LAURIE TARDIFF. (Court Reporter NONE) (slh, ) (Entered: 02/23/2005)"
        },
        {
          "row_number": 435,
          "id": 10324498,
          "entry_number": "85",
          "date_filed": "2005-02-23T00:00:00-05:00",
          "attachments": null,
          "url": "https://www.courtlistener.com/docket/4647359/85/dare-v-knox-county/",
          "recap_pdf_url": null,
          "pacer_doc_id": null,
          "description": "REPORT OF HEARING AND ORDER RE: DISCOVERY DISPUTE - By Judge DAVID M. COHEN. (mnw, ) (Entered: 02/24/2005)"
        },
        {
          "row_number": 436,
          "id": 10324499,
          "entry_number": "86",
          "date_filed": "2005-02-23T00:00:00-05:00",
          "attachments": null,
          "url": "https://www.courtlistener.com/docket/4647359/86/dare-v-knox-county/",
          "recap_pdf_url": null,
          "pacer_doc_id": null,
          "description": "ORDER denying 81 Motion to Extend Time - \"After discussion, motion denied without prejudice to its renewal when the current deadline is nearer at hand and if the plaintiffs preceive a need for more time.\" By Judge DAVID M. COHEN. (mnw, ) (Entered: 02/24/2005)"
        },
        {
          "row_number": 437,
          "id": 10324500,
          "entry_number": "87",
          "date_filed": "2005-03-17T00:00:00-05:00",
          "attachments": null,
          "url": "https://www.courtlistener.com/docket/4647359/87/dare-v-knox-county/",
          "recap_pdf_url": null,
          "pacer_doc_id": null,
          "description": "Unopposed MOTION to Amend Scheduling Order by LAURIE TARDIFF.Responses due by 4/7/2005. (mjl, ) (Entered: 03/17/2005)"
        },
        {
          "row_number": 438,
          "id": 10324501,
          "entry_number": "88",
          "date_filed": "2005-03-17T00:00:00-05:00",
          "attachments": null,
          "url": "https://www.courtlistener.com/docket/4647359/88/dare-v-knox-county/",
          "recap_pdf_url": null,
          "pacer_doc_id": null,
          "description": "NOTICE of Hearing on Motion per tele-call w/Atty Stolt's office Re: 87 Unopposed MOTION to Amend Scheduling Order: Telephone Motion Hearing set for 3/23/2005 03:00 PM before MAG. JUDGE MARGARET J. KRAVCHUK in Portland; Atty Stolt to initiate conference call to USMJ Cohen's Chambers. (slh, ) (Entered: 03/23/2005)"
        },
        {
          "row_number": 439,
          "id": 10324502,
          "entry_number": "89",
          "date_filed": "2005-03-23T00:00:00-05:00",
          "attachments": null,
          "url": "https://www.courtlistener.com/docket/4647359/89/dare-v-knox-county/",
          "recap_pdf_url": null,
          "pacer_doc_id": null,
          "description": "ORDER granting 87 Motion to Amend Scheduling Order Motions due by 6/15/2005. Discovery due by 4/8/2005. \"Granted as prayed for.\" By Judge DAVID M. COHEN. (mjl, ) (Entered: 03/24/2005)"
        },
        {
          "row_number": 441,
          "id": 10324503,
          "entry_number": "90",
          "date_filed": "2005-05-02T00:00:00-04:00",
          "attachments": null,
          "url": "https://www.courtlistener.com/docket/4647359/90/dare-v-knox-county/",
          "recap_pdf_url": null,
          "pacer_doc_id": null,
          "description": "PLAINTIFF'S REPORT ON DEFICIENCES IN RECORD MAINTAINED BY DEFENDANT'S NECESSARY TO ACCURATELY IDENTIFY MEMBERS OF THE CLASS by LAURIE TARDIFF. (mjl, ) (Entered: 05/02/2005)"
        },
        {
          "row_number": 442,
          "id": 10324504,
          "entry_number": "91",
          "date_filed": "2005-05-09T00:00:00-04:00",
          "attachments": null,
          "url": "https://www.courtlistener.com/docket/4647359/91/dare-v-knox-county/",
          "recap_pdf_url": null,
          "pacer_doc_id": null,
          "description": "ORAL ORDER re 90 Plaintiff's Report On Deficiences In Record Maintained By Defendant's Necessary To Accurately Identify Members Of The Class.Defendant's Responses due by 5/19/2005. By Judge GENE CARTER. (mjl, ) (Entered: 05/09/2005)"
        },
        {
          "row_number": 443,
          "id": 10324505,
          "entry_number": "92",
          "date_filed": "2005-05-17T00:00:00-04:00",
          "attachments": null,
          "url": "https://www.courtlistener.com/docket/4647359/92/dare-v-knox-county/",
          "recap_pdf_url": null,
          "pacer_doc_id": null,
          "description": "MOTION to Extend Time To File A Response To Plaintiff's Request On Deficiencies by KNOX COUNTY, DANIEL DAVEY, JANE DOE, JOHN DOE.Responses due by 6/7/2005. (mjl, ) (Entered: 05/17/2005)"
        },
        {
          "row_number": 444,
          "id": 10324506,
          "entry_number": "93",
          "date_filed": "2005-05-19T00:00:00-04:00",
          "attachments": null,
          "url": "https://www.courtlistener.com/docket/4647359/93/dare-v-knox-county/",
          "recap_pdf_url": null,
          "pacer_doc_id": null,
          "description": "ORDER granting 92 Motion to Extend Time By Judge GENE CARTER. (mjl, ) (Entered: 05/19/2005)"
        },
        {
          "row_number": 447,
          "id": 10324509,
          "entry_number": "96",
          "date_filed": "2005-06-10T00:00:00-04:00",
          "attachments": null,
          "url": "https://www.courtlistener.com/docket/4647359/96/dare-v-knox-county/",
          "recap_pdf_url": null,
          "pacer_doc_id": null,
          "description": "RESPONSE in Opposition re 94 MOTION to Extend Time Within Which To File Response To Plaintiff's Report On Deficiencies filed by LAURIE TARDIFF.Reply due by 6/21/2005. (ckb, ) (Entered: 06/10/2005)"
        },
        {
          "row_number": 448,
          "id": 10324510,
          "entry_number": "97",
          "date_filed": "2005-06-15T00:00:00-04:00",
          "attachments": null,
          "url": "https://www.courtlistener.com/docket/4647359/97/dare-v-knox-county/",
          "recap_pdf_url": null,
          "pacer_doc_id": null,
          "description": "MOTION for Leave to File Motion In Excess of Twenty Pages by LAURIE TARDIFF with Incorporated Memorandum.Responses due by 7/6/2005. (ckb, ) (Entered: 06/16/2005)"
        },
        {
          "row_number": 449,
          "id": 10324511,
          "entry_number": "98",
          "date_filed": "2005-06-15T00:00:00-04:00",
          "attachments": null,
          "url": "https://www.courtlistener.com/docket/4647359/98/dare-v-knox-county/",
          "recap_pdf_url": null,
          "pacer_doc_id": null,
          "description": "MOTION for Leave to File to File Jail Intake Release Data Under Seal by LAURIE TARDIFF.Responses due by 7/6/2005. (ckb, ) (Entered: 06/16/2005)"
        },
        {
          "row_number": 450,
          "id": 10324512,
          "entry_number": "99",
          "date_filed": "2005-06-15T00:00:00-04:00",
          "attachments": null,
          "url": "https://www.courtlistener.com/docket/4647359/99/dare-v-knox-county/",
          "recap_pdf_url": "https://www.courtlistener.com/recap/gov.uscourts.med.14294/gov.uscourts.med.14294.99.0.pdf",
          "pacer_doc_id": "0910340717",
          "description": "MOTION for Summary Judgment on the issue of liability against all Defendants by LAURIE TARDIFF with Incorporated Memorandum of Law.Responses due by 7/6/2005. (ckb, ) Additional attachment(s) added on 8/15/2005 (mjlt, ). (Entered: 06/16/2005)"
        },
        {
          "row_number": 2,
          "id": 10324513,
          "entry_number": "100",
          "date_filed": "2005-06-15T00:00:00-04:00",
          "attachments": null,
          "url": "https://www.courtlistener.com/docket/4647359/100/dare-v-knox-county/",
          "recap_pdf_url": null,
          "pacer_doc_id": "091096595",
          "description": "STATEMENT OF UNCONTROVERTED FACT by LAURIE TARDIFF. (ckb, ) Additional attachment(s) added on 8/15/2005 (mjlt, ). (Entered: 06/16/2005)"
        },
        {
          "row_number": 3,
          "id": 10324514,
          "entry_number": "101",
          "date_filed": "2005-06-17T00:00:00-04:00",
          "attachments": null,
          "url": "https://www.courtlistener.com/docket/4647359/101/dare-v-knox-county/",
          "recap_pdf_url": null,
          "pacer_doc_id": "091097035",
          "description": "Defendants' Response To Plaintiff's Report of Deficiences In Record Maintained By Defendant's Necessary To Accurately Identify Members Of The Class - re: Pleading No. 90 by KNOX COUNTY, DANIEL DAVEY, JANE DOE, JOHN DOE. (mjl, ) Additional attachment(s) added on 8/15/2005 (mjlt, ). (Entered: 06/20/2005)"
        },
        {
          "row_number": 4,
          "id": 10324515,
          "entry_number": "102",
          "date_filed": "2005-06-21T00:00:00-04:00",
          "attachments": null,
          "url": "https://www.courtlistener.com/docket/4647359/102/dare-v-knox-county/",
          "recap_pdf_url": null,
          "pacer_doc_id": "0910340799",
          "description": "REPLY to Response to Motion re 94 MOTION to Extend Time Within Which To File Response To Plaintiff's Report On Deficiencies filed by KNOX COUNTY, DANIEL DAVEY, JANE DOE, JOHN DOE. (mjlt, ) Additional attachment(s) added on 8/15/2005 (mjlt, ). (Entered: 06/22/2005)"
        },
        {
          "row_number": 5,
          "id": 10324516,
          "entry_number": "103",
          "date_filed": "2005-06-22T00:00:00-04:00",
          "attachments": null,
          "url": "https://www.courtlistener.com/docket/4647359/103/dare-v-knox-county/",
          "recap_pdf_url": null,
          "pacer_doc_id": "091096055",
          "description": "OBJECTION TO AUTHENTICITY OF DOCUMENTS IDENTIFIED IN PLAINTIFFS'LOCAL RULE 44 RECORDS DISCLOSURE filed by KNOX COUNTY, DANIEL DAVEY, JANE DOE, JOHN DOE.Responses due by 7/11/2005. (mjlt, ) Additional attachment(s) added on 8/15/2005 (mjlt, ). (Entered: 06/24/2005)"
        },
        {
          "row_number": 6,
          "id": 10324517,
          "entry_number": "104",
          "date_filed": "2005-06-27T00:00:00-04:00",
          "attachments": null,
          "url": "https://www.courtlistener.com/docket/4647359/104/dare-v-knox-county/",
          "recap_pdf_url": null,
          "pacer_doc_id": "0910341511",
          "description": "REPLY MEMORANDUM TO DEFENDANT'S RESPONSE 101 TO PLAINTIFFS' REPORT ON DEFICIENCIES 90 (mjlt, ) Additional attachment(s) added on 8/15/2005 (mjlt, ). (Entered: 06/29/2005)"
        },
        {
          "row_number": 7,
          "id": 10324518,
          "entry_number": "105",
          "date_filed": "2005-06-30T00:00:00-04:00",
          "attachments": null,
          "url": "https://www.courtlistener.com/docket/4647359/105/dare-v-knox-county/",
          "recap_pdf_url": null,
          "pacer_doc_id": "0910340671",
          "description": "MOTION to Extend Time To File Response To Motion For Summary Judgment by KNOX COUNTY, DANIEL DAVEY, JANE DOE, JOHN DOE.Responses due by 7/21/2005. (mjlt, ) Additional attachment(s) added on 8/15/2005 (mjlt, ). (Entered: 06/30/2005)"
        },
        {
          "row_number": 8,
          "id": 10324519,
          "entry_number": "106",
          "date_filed": "2005-07-01T00:00:00-04:00",
          "attachments": null,
          "url": "https://www.courtlistener.com/docket/4647359/106/dare-v-knox-county/",
          "recap_pdf_url": null,
          "pacer_doc_id": "091096984",
          "description": "ORDER granting in part and denying in part 105 Motion to Extend Time: Defendant's response to the Plaintiff's Motion for Summary Judgment is due 7/11/05 By Judge GENE CARTER. (ckb, ) Additional attachment(s) added on 8/15/2005 (mjlt, ). (Entered: 07/01/2005)"
        },
        {
          "row_number": 9,
          "id": 10324520,
          "entry_number": "107",
          "date_filed": "2005-07-01T00:00:00-04:00",
          "attachments": null,
          "url": "https://www.courtlistener.com/docket/4647359/107/dare-v-knox-county/",
          "recap_pdf_url": null,
          "pacer_doc_id": "091068897",
          "description": "RESPONSE in Opposition re 105 MOTION to Extend Time To File Response To Motion For Summary Judgment filed by LAURIE TARDIFF. (mjlt, ) Additional attachment(s) added on 8/11/2005 (mjlt, ). (Entered: 07/05/2005)"
        },
        {
          "row_number": 10,
          "id": 10324521,
          "entry_number": "108",
          "date_filed": "2005-07-07T00:00:00-04:00",
          "attachments": null,
          "url": "https://www.courtlistener.com/docket/4647359/108/dare-v-knox-county/",
          "recap_pdf_url": null,
          "pacer_doc_id": null,
          "description": "NOTICE of Hearing: Conference of Counsel about Pleading No. 90 re: Plaintiff's Of Deficiences In Record Maintained By Defendants' Necessary To Identify Members of The Class set for 7/25/2005 03:00 PM before JUDGE GENE CARTER. (mjlt, ) (Entered: 07/07/2005)"
        },
        {
          "row_number": 14,
          "id": 10324524,
          "entry_number": "111",
          "date_filed": "2005-07-11T00:00:00-04:00",
          "attachments": null,
          "url": "https://www.courtlistener.com/docket/4647359/111/dare-v-knox-county/",
          "recap_pdf_url": null,
          "pacer_doc_id": "0910313204",
          "description": "MOTION to Strike Affidavit Of Robert Pedreira by KNOX COUNTY, DANIEL DAVEY, JANE DOE, JOHN DOE.Responses due by 8/1/2005. (mjlt, ) Additional attachment(s) added on 8/11/2005 (mjlt, ). (Entered: 07/11/2005)"
        },
        {
          "row_number": 15,
          "id": 10324525,
          "entry_number": "112",
          "date_filed": "2005-07-11T00:00:00-04:00",
          "attachments": null,
          "url": "https://www.courtlistener.com/docket/4647359/112/dare-v-knox-county/",
          "recap_pdf_url": null,
          "pacer_doc_id": "0910341205",
          "description": "RESPONSE to Statement of Fact with Statement of Additional Facts filed by KNOX COUNTY, DANIEL DAVEY, JANE DOE, JOHN DOE. (mjlt, ) Additional attachment(s) added on 8/15/2005 (mjlt, ). (Entered: 07/11/2005)"
        },
        {
          "row_number": 16,
          "id": 10324526,
          "entry_number": "113",
          "date_filed": "2005-07-11T00:00:00-04:00",
          "attachments": null,
          "url": "https://www.courtlistener.com/docket/4647359/113/dare-v-knox-county/",
          "recap_pdf_url": null,
          "pacer_doc_id": "091070894",
          "description": "RESPONSE to 103 OBJECTION TO DEFENDANTS' OBJECTION TO AUTHENTICITY OF DOCUMENTS IDENTIFIED IN PLAINTIFF'S LOCAL RULE 44 DISCLOSURE filed by LAURIE TARDIFF. (mjlt, ) Additional attachment(s) added on 8/11/2005 (mjlt, ). (Entered: 07/13/2005)"
        },
        {
          "row_number": 18,
          "id": 10324528,
          "entry_number": "115",
          "date_filed": "2005-07-22T00:00:00-04:00",
          "attachments": null,
          "url": "https://www.courtlistener.com/docket/4647359/115/dare-v-knox-county/",
          "recap_pdf_url": null,
          "pacer_doc_id": "0910314274",
          "description": "REPLY TO ADDITIONAL Statement of Fact filed by LAURIE TARDIFF. (mjlt, ) Additional attachment(s) added on 8/12/2005 (mjlt, ). (Entered: 07/25/2005)"
        },
        {
          "row_number": 19,
          "id": 10324529,
          "entry_number": "116",
          "date_filed": "2005-07-22T00:00:00-04:00",
          "attachments": null,
          "url": "https://www.courtlistener.com/docket/4647359/116/dare-v-knox-county/",
          "recap_pdf_url": null,
          "pacer_doc_id": "091071788",
          "description": "SUPPLEMENTAL AFFIDAVIT of Michelle Ward re 115 Reply to Additional Statement of Fact (Exhibit No. 27) filed by LAURIE TARDIFF. (mjlt, ) Additional attachment(s) added on 8/11/2005 (mjlt, ). (Entered: 07/25/2005)"
        },
        {
          "row_number": 20,
          "id": 10324530,
          "entry_number": "117",
          "date_filed": "2005-07-26T00:00:00-04:00",
          "attachments": null,
          "url": "https://www.courtlistener.com/docket/4647359/117/dare-v-knox-county/",
          "recap_pdf_url": null,
          "pacer_doc_id": "091096656",
          "description": "DEPOSITION filed by LAURIE TARDIFF of John Hinkley taken on June 11, 2003. (mjlt, ) Additional attachment(s) added on 8/15/2005 (mjlt, ). (Entered: 07/27/2005)"
        },
        {
          "row_number": 21,
          "id": 10324531,
          "entry_number": "118",
          "date_filed": "2005-07-26T00:00:00-04:00",
          "attachments": null,
          "url": "https://www.courtlistener.com/docket/4647359/118/dare-v-knox-county/",
          "recap_pdf_url": null,
          "pacer_doc_id": "0910339500",
          "description": "DEPOSITION along with Deposition Exhibits 1-8 filed by LAURIE TARDIFF of Richard J. Robbins taken on June 19, 2003. (mjlt, ) Additional attachment(s) added on 8/15/2005 (mjlt, ). (Entered: 07/27/2005)"
        },
        {
          "row_number": 22,
          "id": 10324532,
          "entry_number": "119",
          "date_filed": "2005-08-01T00:00:00-04:00",
          "attachments": null,
          "url": "https://www.courtlistener.com/docket/4647359/119/dare-v-knox-county/",
          "recap_pdf_url": null,
          "pacer_doc_id": null,
          "description": "ORDER granting without objection 94 Motion to Extend Time - By Judge GENE CARTER. (mjlt, ) (Entered: 08/01/2005)"
        },
        {
          "row_number": 26,
          "id": 10324535,
          "entry_number": "122",
          "date_filed": "2005-08-03T00:00:00-04:00",
          "attachments": null,
          "url": "https://www.courtlistener.com/docket/4647359/122/dare-v-knox-county/",
          "recap_pdf_url": null,
          "pacer_doc_id": null,
          "description": "NOTICE of Hearing: Conference of Counsel to discuss Pleading No. 90 re: Plaintiff's Report of Deficiences In The Record Maintained By Defendants' Necessary To Identify Members of The Class set for 8/10/2005 01:00 PM in Judge Carter's Chambers before JUDGE GENE CARTER. (mjlt, ) (Entered: 08/03/2005)"
        },
        {
          "row_number": 29,
          "id": 10324538,
          "entry_number": "125",
          "date_filed": "2005-08-10T00:00:00-04:00",
          "attachments": null,
          "url": "https://www.courtlistener.com/docket/4647359/125/dare-v-knox-county/",
          "recap_pdf_url": null,
          "pacer_doc_id": null,
          "description": "ORAL ORDER - No Action Necessary on 103 Objection by Defendant's To Authenticity Of Documents Identified In Plaintiff's Local Rule 44 Records Disclosures- The reasons for the order are stated on the record during the conference of counsel held this date. By Judge GENE CARTER. (mjlt, ) (Entered: 08/10/2005)"
        },
        {
          "row_number": 30,
          "id": 10324539,
          "entry_number": "126",
          "date_filed": "2005-08-11T00:00:00-04:00",
          "attachments": null,
          "url": "https://www.courtlistener.com/docket/4647359/126/dare-v-knox-county/",
          "recap_pdf_url": null,
          "pacer_doc_id": "091071759",
          "description": "TRANSCRIPT of Proceedings: Chambers Conference held on 8/10/05 before Judge Gene Carter, Senior Judge. Court Reporter: Dennis R. Ford. Phone Number: 2078318056. IMPORTANT NOTICE -- REDACTION OF TRANSCRIPTS: In order to remove personal identifier data from the transcript, a party must electronically file a Notice of Intent to Redact with the Clerk's Office within 5 business days of this date. The policy governing the redaction of personal information is located on the court website at www.med.uscourts.gov. Read this policy carefully. If no Notice of Intent to Redact is filed within 5 business days of this date, the court will assume redaction of personal data identifiers is not necessary and the transcript will be made available on the web. (Ford, Dennis) (Entered: 08/11/2005)"
        },
        {
          "row_number": 31,
          "id": 10324540,
          "entry_number": "127",
          "date_filed": "2005-08-15T00:00:00-04:00",
          "attachments": null,
          "url": "https://www.courtlistener.com/docket/4647359/127/dare-v-knox-county/",
          "recap_pdf_url": null,
          "pacer_doc_id": "091096466",
          "description": "STATUS REPORT by LAURIE TARDIFF. (Attachments: # 1 Exhibit Letter to P. Marchesi, 8/15/05# 2 Exhibit Inmate Number List# 3 Exhibit E-Mail# 4 Exhibit Ltr. from.P.Marchesi)(STOLT, ROBERT) (Entered: 08/15/2005)"
        },
        {
          "row_number": 33,
          "id": 10324542,
          "entry_number": "129",
          "date_filed": "2005-08-16T00:00:00-04:00",
          "attachments": null,
          "url": "https://www.courtlistener.com/docket/4647359/129/dare-v-knox-county/",
          "recap_pdf_url": null,
          "pacer_doc_id": "0910343044",
          "description": "PROPOSED NOTICE TO CLASS MEMBERS filed by Plaintiff (Attachments: # 1 Exhibit B# 2 Exhibit C) (mjlt, ) (Entered: 08/16/2005)"
        },
        {
          "row_number": 35,
          "id": 10324543,
          "entry_number": "130",
          "date_filed": "2005-08-18T00:00:00-04:00",
          "attachments": null,
          "url": "https://www.courtlistener.com/docket/4647359/130/dare-v-knox-county/",
          "recap_pdf_url": null,
          "pacer_doc_id": "0910345570",
          "description": "AFFIDAVIT of Cheryl Daniello filed by KNOX COUNTY, DANIEL DAVEY, JANE DOE, JOHN DOE. (MARCHESI, PETER) (Entered: 08/18/2005)"
        },
        {
          "row_number": 36,
          "id": 10324544,
          "entry_number": "131",
          "date_filed": "2005-08-19T00:00:00-04:00",
          "attachments": null,
          "url": "https://www.courtlistener.com/docket/4647359/131/dare-v-knox-county/",
          "recap_pdf_url": null,
          "pacer_doc_id": "0910345776",
          "description": "OBJECTION to 129 Remark AND PROPOSED REVISIONS TO PROPOSED CLASS NOTICE DOCUMENTS filed by LAURIE TARDIFF, KNOX COUNTY, DANIEL DAVEY. (MARCHESI, PETER) (Entered: 08/19/2005)"
        },
        {
          "row_number": 37,
          "id": 10324545,
          "entry_number": "132",
          "date_filed": "2005-08-22T00:00:00-04:00",
          "attachments": null,
          "url": "https://www.courtlistener.com/docket/4647359/132/dare-v-knox-county/",
          "recap_pdf_url": null,
          "pacer_doc_id": "0910102406",
          "description": "REPLY to Response to Motion re 131 OBJECTION to 129 Remark AND PROPOSED REVISIONS TO PROPOSED CLASS NOTICE DOCUMENTS filed by LAURIE TARDIFF. (STOLT, ROBERT) (Entered: 08/22/2005)"
        },
        {
          "row_number": 38,
          "id": 10324546,
          "entry_number": "133",
          "date_filed": "2005-08-26T00:00:00-04:00",
          "attachments": null,
          "url": "https://www.courtlistener.com/docket/4647359/133/dare-v-knox-county/",
          "recap_pdf_url": null,
          "pacer_doc_id": "091082170",
          "description": "MOTION to Extend Time to Respond to Plaintiff's Rule 44 Records Disclosure by KNOX COUNTY, DANIEL DAVEY, JANE DOE, JOHN DOE WITH INCORPORATED MEMO.Responses due by 9/16/2005. (MARCHESI, PETER) (Entered: 08/26/2005)"
        },
        {
          "row_number": 39,
          "id": 10324547,
          "entry_number": "134",
          "date_filed": "2005-08-29T00:00:00-04:00",
          "attachments": null,
          "url": "https://www.courtlistener.com/docket/4647359/134/dare-v-knox-county/",
          "recap_pdf_url": null,
          "pacer_doc_id": "091043768",
          "description": "RESPONSE to Motion re 133 MOTION to Extend Time to Respond to Plaintiff's Rule 44 Records Disclosure filed by LAURIE TARDIFF.Reply due by 9/9/2005. (STOLT, ROBERT) (Entered: 08/29/2005)"
        },
        {
          "row_number": 41,
          "id": 10324549,
          "entry_number": "136",
          "date_filed": "2005-09-02T00:00:00-04:00",
          "attachments": null,
          "url": "https://www.courtlistener.com/docket/4647359/136/dare-v-knox-county/",
          "recap_pdf_url": null,
          "pacer_doc_id": "091094633",
          "description": "REPLY to Response to Motion re 133 MOTION to Extend Time to Respond to Plaintiff's Rule 44 Records Disclosure filed by KNOX COUNTY, DANIEL DAVEY, JANE DOE, JOHN DOE. (MARCHESI, PETER) (Entered: 09/02/2005)"
        },
        {
          "row_number": 42,
          "id": 10324550,
          "entry_number": "137",
          "date_filed": "2005-09-06T00:00:00-04:00",
          "attachments": null,
          "url": "https://www.courtlistener.com/docket/4647359/137/dare-v-knox-county/",
          "recap_pdf_url": null,
          "pacer_doc_id": null,
          "description": "ORDER granting 133 Motion to Extend Time By Judge GENE CARTER. (mjlt, ) (Entered: 09/06/2005)"
        },
        {
          "row_number": 43,
          "id": 10324551,
          "entry_number": "138",
          "date_filed": "2005-11-02T00:00:00-05:00",
          "attachments": null,
          "url": "https://www.courtlistener.com/docket/4647359/138/dare-v-knox-county/",
          "recap_pdf_url": null,
          "pacer_doc_id": null,
          "description": "ORDER granting 97 . The Motion for Leave to File is hereby GRANTED. By Judge GENE CARTER. (CARTER, GENE) (Entered: 11/02/2005)"
        },
        {
          "row_number": 44,
          "id": 10324552,
          "entry_number": "139",
          "date_filed": "2005-11-02T00:00:00-05:00",
          "attachments": null,
          "url": "https://www.courtlistener.com/docket/4647359/139/dare-v-knox-county/",
          "recap_pdf_url": null,
          "pacer_doc_id": null,
          "description": "ORDER granting 109 . The Motion for Leave to File is hereby GRANTED. By Judge GENE CARTER. (CARTER, GENE) (Entered: 11/02/2005)"
        },
        {
          "row_number": 46,
          "id": 10324553,
          "entry_number": "140",
          "date_filed": "2005-11-02T00:00:00-05:00",
          "attachments": null,
          "url": "https://www.courtlistener.com/docket/4647359/140/dare-v-knox-county/",
          "recap_pdf_url": null,
          "pacer_doc_id": null,
          "description": "ORDER granting 111 . The Motion to Strike is hereby GRANTED. By Judge GENE CARTER. (CARTER, GENE) (Entered: 11/02/2005)"
        },
        {
          "row_number": 48,
          "id": 10324554,
          "entry_number": "142",
          "date_filed": "2005-11-02T00:00:00-05:00",
          "attachments": null,
          "url": "https://www.courtlistener.com/docket/4647359/142/dare-v-knox-county/",
          "recap_pdf_url": null,
          "pacer_doc_id": "0910104360",
          "description": "ORDER APPROVING NOTICE TO CLASS re: 48 Motion for Approval Of Notice To The Class & 131 Objection to Proposed Revisions To Proposed Class Notice Documents By Judge GENE CARTER. (mjlt, ) (Entered: 11/02/2005)"
        },
        {
          "row_number": 49,
          "id": 10324555,
          "entry_number": "143",
          "date_filed": "2005-11-03T00:00:00-05:00",
          "attachments": null,
          "url": "https://www.courtlistener.com/docket/4647359/143/dare-v-knox-county/",
          "recap_pdf_url": null,
          "pacer_doc_id": null,
          "description": "NOTICE- Counsel please be advised Judge Carter will not be publishing a Civil Trial List for the months of January, February, and March of 2006. This case will be the first case listed on Judge Carter's April 2006 Civil Trial List. If counsel should have any questions, please do not hesitate to call the Clerk's Office. (mjlt, ) (Entered: 11/03/2005)"
        },
        {
          "row_number": 50,
          "id": 10324556,
          "entry_number": "144",
          "date_filed": "2005-11-03T00:00:00-05:00",
          "attachments": null,
          "url": "https://www.courtlistener.com/docket/4647359/144/dare-v-knox-county/",
          "recap_pdf_url": null,
          "pacer_doc_id": null,
          "description": "ORDER dismissing 135 Objection By Judge GENE CARTER. (mjlt, ) (Entered: 11/03/2005)"
        },
        {
          "row_number": 51,
          "id": 10324557,
          "entry_number": "145",
          "date_filed": "2005-12-30T00:00:00-05:00",
          "attachments": null,
          "url": "https://www.courtlistener.com/docket/4647359/145/dare-v-knox-county/",
          "recap_pdf_url": null,
          "pacer_doc_id": "0910364664",
          "description": "MOTION for Conference of Counsel by LAURIE TARDIFF.Responses due by 1/20/2006. (STOLT, ROBERT) (Entered: 12/30/2005)"
        },
        {
          "row_number": 52,
          "id": 10324558,
          "entry_number": "146",
          "date_filed": "2006-01-04T00:00:00-05:00",
          "attachments": null,
          "url": "https://www.courtlistener.com/docket/4647359/146/dare-v-knox-county/",
          "recap_pdf_url": null,
          "pacer_doc_id": null,
          "description": "ORDER granting 145 Motion for Conference of Counsel By Mag.Judge DAVID M. COHEN. Clerk to schedule a telephone conference. (slh, ) (Entered: 01/05/2006)"
        },
        {
          "row_number": 53,
          "id": 10324559,
          "entry_number": "147",
          "date_filed": "2006-01-23T00:00:00-05:00",
          "attachments": null,
          "url": "https://www.courtlistener.com/docket/4647359/147/dare-v-knox-county/",
          "recap_pdf_url": null,
          "pacer_doc_id": null,
          "description": "NOTICE of Hearing: Telephone Conference set for 2/8/2006 03:00 PM before MAG. JUDGE DAVID M. COHEN to discuss trial prep issues per letter of 12/30/05 from Atty Stolt. (slh, ) (Entered: 01/23/2006)"
        },
        {
          "row_number": 54,
          "id": 10324560,
          "entry_number": "148",
          "date_filed": "2006-01-31T00:00:00-05:00",
          "attachments": null,
          "url": "https://www.courtlistener.com/docket/4647359/148/dare-v-knox-county/",
          "recap_pdf_url": null,
          "pacer_doc_id": null,
          "description": "NOTICE of Hearing per tele-call w/Atty Stolt's office: Telephone Conference to discuss trial prep issues per letter of 12/30/05 from Atty Stolt reset for 2/22/2006 03:00 PM before MAG. JUDGE DAVID M. COHEN. Pltf to initiate conference call to Chambers.(slh, ) (Entered: 01/31/2006)"
        },
        {
          "row_number": 55,
          "id": 10324561,
          "entry_number": "149",
          "date_filed": "2006-02-09T00:00:00-05:00",
          "attachments": null,
          "url": "https://www.courtlistener.com/docket/4647359/149/dare-v-knox-county/",
          "recap_pdf_url": null,
          "pacer_doc_id": "0910167634",
          "description": "MOTION for Leave to File Memorandum of Law in Support of Motion for Reconsideration in Excess of Page Limits by KNOX COUNTY, DANIEL DAVEY, JANE DOE, JOHN DOE WITH INCORPORATED MEMO.Responses due by 3/2/2006. (MARCHESI, PETER) (Entered: 02/09/2006)"
        },
        {
          "row_number": 58,
          "id": 10324563,
          "entry_number": "151",
          "date_filed": "2006-02-13T00:00:00-05:00",
          "attachments": null,
          "url": "https://www.courtlistener.com/docket/4647359/151/dare-v-knox-county/",
          "recap_pdf_url": null,
          "pacer_doc_id": null,
          "description": "NOTICE TO COUNSEL- Please be advised this case will not be placed on Judge Carter's April Trial List, due to the pending Motion For Reconsideration. This case will be placed on Judge Carter's May Civil Trial List. (mjlt, ) (Entered: 02/13/2006)"
        },
        {
          "row_number": 59,
          "id": 10324564,
          "entry_number": "152",
          "date_filed": "2006-02-15T00:00:00-05:00",
          "attachments": null,
          "url": "https://www.courtlistener.com/docket/4647359/152/dare-v-knox-county/",
          "recap_pdf_url": null,
          "pacer_doc_id": null,
          "description": "NOTICE of Hearing: Telephone Conference to discuss trial preparation issues per letter of 12/30/05 from Atty Stolt reset for 2/27/2006 03:00 PM before MAG. JUDGE DAVID M. COHEN per telephonic request of Atty Marchesi; Plaintiff to initiate call to Chambers. (slh, ) (Entered: 02/15/2006)"
        },
        {
          "row_number": 61,
          "id": 10324566,
          "entry_number": "154",
          "date_filed": "2006-03-07T00:00:00-05:00",
          "attachments": null,
          "url": "https://www.courtlistener.com/docket/4647359/154/dare-v-knox-county/",
          "recap_pdf_url": null,
          "pacer_doc_id": null,
          "description": "ORDER granting 149 Motion for Leave to File By Judge GENE CARTER. (mjlt, ) (Entered: 03/07/2006)"
        },
        {
          "row_number": 62,
          "id": 10324567,
          "entry_number": "155",
          "date_filed": "2006-03-10T00:00:00-05:00",
          "attachments": null,
          "url": "https://www.courtlistener.com/docket/4647359/155/dare-v-knox-county/",
          "recap_pdf_url": null,
          "pacer_doc_id": "0910414904",
          "description": "TRIAL LIST:. On Trial List for 5/1/2006. Final Pretrial Conference set for 4/14/2006 09:00 AM before MAG. JUDGE DAVID M. COHEN. Final Pretrial Memo due by 4/6/2006.(mjlt, ) (Entered: 03/10/2006)"
        },
        {
          "row_number": 64,
          "id": 10324569,
          "entry_number": "157",
          "date_filed": "2006-03-13T00:00:00-05:00",
          "attachments": null,
          "url": "https://www.courtlistener.com/docket/4647359/157/dare-v-knox-county/",
          "recap_pdf_url": "https://www.courtlistener.com/recap/gov.uscourts.med.14294/gov.uscourts.med.14294.157.0.pdf",
          "pacer_doc_id": "0910415400",
          "description": "REPLY to Response to Motion re 150 MOTION for Reconsideration re 141 Order on Motion for Summary Judgment WITH INCORPORATED MEMOANDUM filed by KNOX COUNTY, DANIEL DAVEY, JANE DOE, JOHN DOE. (MARCHESI, PETER) (Entered: 03/13/2006)"
        },
        {
          "row_number": 65,
          "id": 10324570,
          "entry_number": "158",
          "date_filed": "2006-03-14T00:00:00-05:00",
          "attachments": null,
          "url": "https://www.courtlistener.com/docket/4647359/158/dare-v-knox-county/",
          "recap_pdf_url": null,
          "pacer_doc_id": null,
          "description": "NOTICE of Hearing: Final Pretrial Conference reset for 4/13/2006 02:00 PM before MAG. JUDGE DAVID M. COHEN. Final Pretrial Memo due by 4/6/2006. (slh, ) (Entered: 03/14/2006)"
        },
        {
          "row_number": 66,
          "id": 10324571,
          "entry_number": "159",
          "date_filed": "2006-03-14T00:00:00-05:00",
          "attachments": null,
          "url": "https://www.courtlistener.com/docket/4647359/159/dare-v-knox-county/",
          "recap_pdf_url": null,
          "pacer_doc_id": "0910173360",
          "description": "MOTION for Conference of Counsel by LAURIE TARDIFF.Responses due by 4/4/2006. (STOLT, ROBERT) (Entered: 03/14/2006)"
        },
        {
          "row_number": 68,
          "id": 10324572,
          "entry_number": "160",
          "date_filed": "2006-03-15T00:00:00-05:00",
          "attachments": null,
          "url": "https://www.courtlistener.com/docket/4647359/160/dare-v-knox-county/",
          "recap_pdf_url": null,
          "pacer_doc_id": null,
          "description": "ORDER reserving ruling 159 Motion for Conference of Counsel - Ruling is hereby RESERVED until the Court has ruled on the pending motion for reconsideration. By Judge GENE CARTER. (mjlt, ) (Entered: 03/15/2006)"
        },
        {
          "row_number": 69,
          "id": 10324573,
          "entry_number": "161",
          "date_filed": "2006-03-29T00:00:00-05:00",
          "attachments": null,
          "url": "https://www.courtlistener.com/docket/4647359/161/dare-v-knox-county/",
          "recap_pdf_url": null,
          "pacer_doc_id": "0910174956",
          "description": "MOTION Motion to Extend Class Period with Incorporated Memorandum of Law by LAURIE TARDIFF.Responses due by 4/19/2006. (Attachments: # 1 Affidavit Affidavit of Jennifer Collins)(THISTLE, DALE) (Entered: 03/29/2006)"
        },
        {
          "row_number": 70,
          "id": 10324574,
          "entry_number": "162",
          "date_filed": "2006-03-31T00:00:00-05:00",
          "attachments": null,
          "url": "https://www.courtlistener.com/docket/4647359/162/dare-v-knox-county/",
          "recap_pdf_url": null,
          "pacer_doc_id": "0910394918",
          "description": "RESPONSE to Motion re 156 MOTION for Leave to File Reply Memorandum in Excess of Page Limits filed by LAURIE TARDIFF.Reply due by 4/11/2006. (THISTLE, DALE) (Entered: 03/31/2006)"
        },
        {
          "row_number": 71,
          "id": 10324575,
          "entry_number": "163",
          "date_filed": "2006-04-04T00:00:00-04:00",
          "attachments": null,
          "url": "https://www.courtlistener.com/docket/4647359/163/dare-v-knox-county/",
          "recap_pdf_url": null,
          "pacer_doc_id": "0910176255",
          "description": "RESPONSE to Motion re 159 MOTION for Conference of Counsel filed by KNOX COUNTY, DANIEL DAVEY.Reply due by 4/17/2006. (MARCHESI, PETER) (Entered: 04/04/2006)"
        },
        {
          "row_number": 76,
          "id": 10324577,
          "entry_number": "168",
          "date_filed": "2006-04-04T00:00:00-04:00",
          "attachments": null,
          "url": "https://www.courtlistener.com/docket/4647359/168/dare-v-knox-county/",
          "recap_pdf_url": null,
          "pacer_doc_id": null,
          "description": "ORDER granting 159 Motion for Conference of Counsel - Counsel should refer to pleading no. 166 By Judge GENE CARTER. (mjlt, ) (Entered: 04/04/2006)"
        },
        {
          "row_number": 77,
          "id": 10324578,
          "entry_number": "169",
          "date_filed": "2006-04-06T00:00:00-04:00",
          "attachments": null,
          "url": "https://www.courtlistener.com/docket/4647359/169/dare-v-knox-county/",
          "recap_pdf_url": null,
          "pacer_doc_id": "0910176958",
          "description": "FINAL PRETRIAL MEMORANDUM by KNOX COUNTY, DANIEL DAVEY, JANE DOE, JOHN DOE. (MARCHESI, PETER) Modified on 4/7/2006 to reflect this is final pretrial memorandum and not a trial brief (mjlt, ). (Entered: 04/06/2006)"
        },
        {
          "row_number": 79,
          "id": 10324579,
          "entry_number": "170",
          "date_filed": "2006-04-06T00:00:00-04:00",
          "attachments": null,
          "url": "https://www.courtlistener.com/docket/4647359/170/dare-v-knox-county/",
          "recap_pdf_url": null,
          "pacer_doc_id": "0910177026",
          "description": "FINAL PRETRIAL MEMORANDUM by LAURIE TARDIFF. (STOLT, ROBERT) (Entered: 04/06/2006)"
        },
        {
          "row_number": 80,
          "id": 10324580,
          "entry_number": "171",
          "date_filed": "2006-04-06T00:00:00-04:00",
          "attachments": null,
          "url": "https://www.courtlistener.com/docket/4647359/171/dare-v-knox-county/",
          "recap_pdf_url": null,
          "pacer_doc_id": "0910416183",
          "description": "MOTION Participate in Final Pretrial Conference by Telephone by LAURIE TARDIFF.Responses due by 4/27/2006. (STOLT, ROBERT) (Entered: 04/06/2006)"
        },
        {
          "row_number": 81,
          "id": 10324581,
          "entry_number": "172",
          "date_filed": "2006-04-07T00:00:00-04:00",
          "attachments": null,
          "url": "https://www.courtlistener.com/docket/4647359/172/dare-v-knox-county/",
          "recap_pdf_url": null,
          "pacer_doc_id": "0910416404",
          "description": "Supplemental Written Notice of Class Members by LAURIE TARDIFF. (STOLT, ROBERT) Modified on 4/20/2006 to remove the word Motion and remove the response deadline contained within the docket text. This docket entry should not have been filed as a motion. (mjlt, ). (Entered: 04/07/2006)"
        },
        {
          "row_number": 86,
          "id": 10324586,
          "entry_number": "177",
          "date_filed": "2006-04-12T00:00:00-04:00",
          "attachments": null,
          "url": "https://www.courtlistener.com/docket/4647359/177/dare-v-knox-county/",
          "recap_pdf_url": null,
          "pacer_doc_id": "0910418084",
          "description": "MOTION to Continue by LAURIE TARDIFF.Responses due by 5/3/2006. (STOLT, ROBERT) (Entered: 04/12/2006)"
        },
        {
          "row_number": 87,
          "id": 10324587,
          "entry_number": "178",
          "date_filed": "2006-04-12T00:00:00-04:00",
          "attachments": null,
          "url": "https://www.courtlistener.com/docket/4647359/178/dare-v-knox-county/",
          "recap_pdf_url": null,
          "pacer_doc_id": "0910178391",
          "description": "FINAL PRETRIAL MEMORANDUM by LAURIE TARDIFF. (STOLT, ROBERT) (Entered: 04/12/2006)"
        },
        {
          "row_number": 90,
          "id": 10324589,
          "entry_number": "180",
          "date_filed": "2006-04-13T00:00:00-04:00",
          "attachments": null,
          "url": "https://www.courtlistener.com/docket/4647359/180/dare-v-knox-county/",
          "recap_pdf_url": null,
          "pacer_doc_id": null,
          "description": "Minute Entry for proceedings held before Judge GENE CARTER : Final Pretrial Conference held. Report of Final Pretrial Order to issue. (Court Reporter Pauline Terry) (mjlt, ) (Entered: 04/13/2006)"
        },
        {
          "row_number": 93,
          "id": 10324592,
          "entry_number": "183",
          "date_filed": "2006-04-27T00:00:00-04:00",
          "attachments": null,
          "url": "https://www.courtlistener.com/docket/4647359/183/dare-v-knox-county/",
          "recap_pdf_url": null,
          "pacer_doc_id": "0910422639",
          "description": "MEMORANDUM by KNOX COUNTY, DANIEL DAVEY in support of 174 OBJECTION to Plaintiff's List of Class Members WRITTEN STATEMENT OF BASIS AS TO WHY CLASS MEMBERS LISTED IN EXHIBITS A, B, H, AND J OF DEFENDANTS' OBJECTION SHOULD BE REMOVED FROM THE CLASS. (MARCHESI, PETER) (Entered: 04/27/2006)"
        },
        {
          "row_number": 94,
          "id": 10324593,
          "entry_number": "184",
          "date_filed": "2006-04-28T00:00:00-04:00",
          "attachments": null,
          "url": "https://www.courtlistener.com/docket/4647359/184/dare-v-knox-county/",
          "recap_pdf_url": null,
          "pacer_doc_id": "0910182173",
          "description": "MOTION to Extend Time Within Which to File Written Statements of the Defendants' Objection to Specific Class Members and Statement of All Bases of Objection to Class Membership by KNOX COUNTY, DANIEL DAVEY WITH INCORPORATED MEMO.Responses due by 5/19/2006. (MARCHESI, PETER) (Entered: 04/28/2006)"
        },
        {
          "row_number": 95,
          "id": 10324594,
          "entry_number": "185",
          "date_filed": "2006-04-28T00:00:00-04:00",
          "attachments": null,
          "url": "https://www.courtlistener.com/docket/4647359/185/dare-v-knox-county/",
          "recap_pdf_url": null,
          "pacer_doc_id": "0910422784",
          "description": "OBJECTION to 181 Report of Final Pretrial Conference and Order filed by LAURIE TARDIFF. (STOLT, ROBERT) (Entered: 04/28/2006)"
        },
        {
          "row_number": 98,
          "id": 10324596,
          "entry_number": "188",
          "date_filed": "2006-05-08T00:00:00-04:00",
          "attachments": null,
          "url": "https://www.courtlistener.com/docket/4647359/188/dare-v-knox-county/",
          "recap_pdf_url": null,
          "pacer_doc_id": "0910424799",
          "description": "RESPONSE in Opposition re 184 MOTION to Extend Time Within Which to File Written Statements of the Defendants' Objection to Specific Class Members and Statement of All Bases of Objection to Class Membership filed by LAURIE TARDIFF.Reply due by 5/19/2006. (STOLT, ROBERT) (Entered: 05/08/2006)"
        },
        {
          "row_number": 99,
          "id": 10324597,
          "entry_number": "189",
          "date_filed": "2006-05-10T00:00:00-04:00",
          "attachments": null,
          "url": "https://www.courtlistener.com/docket/4647359/189/dare-v-knox-county/",
          "recap_pdf_url": null,
          "pacer_doc_id": "0910400152",
          "description": "Letter MOTION for Conference of Counsel re 187 Order on Objection,,, by LAURIE TARDIFF.Responses due by 5/31/2006. (Attachments: # 1 Exhibit Marchesi Letter of 5/9/06)(THISTLE, DALE) (Entered: 05/10/2006)"
        },
        {
          "row_number": 101,
          "id": 10324598,
          "entry_number": "190",
          "date_filed": "2006-05-11T00:00:00-04:00",
          "attachments": null,
          "url": "https://www.courtlistener.com/docket/4647359/190/dare-v-knox-county/",
          "recap_pdf_url": null,
          "pacer_doc_id": "0910410932",
          "description": "ORDER STAYING PARAGRAPH 2.D OF THE AMENDED REPORT OF FINAL PRETRIAL CONFERENCE AND ORDER By Judge GENE CARTER. (mjlt, ) (Entered: 05/11/2006)"
        },
        {
          "row_number": 102,
          "id": 10324599,
          "entry_number": "191",
          "date_filed": "2006-05-11T00:00:00-04:00",
          "attachments": null,
          "url": "https://www.courtlistener.com/docket/4647359/191/dare-v-knox-county/",
          "recap_pdf_url": null,
          "pacer_doc_id": "0910411186",
          "description": "ORDER DENYING MOTION FOR ENLARGEMENT OF TIME WITHIN WHICH TO FILE WRITTEN STATEMENTS OF THE DEFENDANT'S OBJECTION TO SPECIFIC CLASS MEMBERS AND STATEMENT OF ALL BASES OF OBJECTIONS TO CLASS MEMBERSHIP WITH INCORPORATED MEMORANDUM OF LAW re: 184 Motion to Extend Time By Judge GENE CARTER. (mjlt, ) (Entered: 05/11/2006)"
        },
        {
          "row_number": 103,
          "id": 10324600,
          "entry_number": "192",
          "date_filed": "2006-05-12T00:00:00-04:00",
          "attachments": null,
          "url": "https://www.courtlistener.com/docket/4647359/192/dare-v-knox-county/",
          "recap_pdf_url": null,
          "pacer_doc_id": null,
          "description": "NOTICE of Hearing: Conference of Counsel set for 5/16/2006 02:00 PM in Judge Carter's Chambers in PORTLAND before JUDGE GENE CARTER. All counsel must be present for the conference.(mjlt, ) (Entered: 05/12/2006)"
        },
        {
          "row_number": 104,
          "id": 10324601,
          "entry_number": "193",
          "date_filed": "2006-05-15T00:00:00-04:00",
          "attachments": null,
          "url": "https://www.courtlistener.com/docket/4647359/193/dare-v-knox-county/",
          "recap_pdf_url": null,
          "pacer_doc_id": "0910414978",
          "description": "** DUPLICATE FILING SEE- PLEADING NO. 194**MEMORANDUM by KNOX COUNTY in support of 191 Order on Motion to Extend Time, (Statement of Bases for Objections). (MARCHESI, PETER) Modified on 5/16/2006 to reflect this is a duplicate filing(mjlt, ). (Entered: 05/15/2006)"
        },
        {
          "row_number": 105,
          "id": 10324602,
          "entry_number": "194",
          "date_filed": "2006-05-15T00:00:00-04:00",
          "attachments": null,
          "url": "https://www.courtlistener.com/docket/4647359/194/dare-v-knox-county/",
          "recap_pdf_url": null,
          "pacer_doc_id": "091069575",
          "description": "DEFENDANTS' STATEMENT OF ALL BASES OF OBJECTIONS TO INDIVIDUALS LISTED ON PLAINTIFF'S CLASS MEMBERSHIP LIST by KNOX COUNTY, DANIEL DAVEY. (Attachments: # 1 Exhibits 1-43 Are On File In Paper With The Clerk's Office)(mjlt, ) (Entered: 05/15/2006)"
        },
        {
          "row_number": 106,
          "id": 10324603,
          "entry_number": "195",
          "date_filed": "2006-05-16T00:00:00-04:00",
          "attachments": null,
          "url": "https://www.courtlistener.com/docket/4647359/195/dare-v-knox-county/",
          "recap_pdf_url": null,
          "pacer_doc_id": null,
          "description": "Minute Entry for proceedings held before Judge GENE CARTER.Conference of Counsel held re: Thistle Letter 189 . Matter taken under advisement, written decision to issue. (Court Reporter PAULINE TERRY) (mnw, ) (Entered: 05/16/2006)"
        },
        {
          "row_number": 107,
          "id": 10324604,
          "entry_number": "196",
          "date_filed": "2006-05-16T00:00:00-04:00",
          "attachments": null,
          "url": "https://www.courtlistener.com/docket/4647359/196/dare-v-knox-county/",
          "recap_pdf_url": null,
          "pacer_doc_id": "091076862",
          "description": "ORDER PRESCRIBING THE PERFORMANCE OF FURTHER DISCOVERY BY DEFENDANTS OF THOSE CLASS MEMBERS PLAINTIFF DOES NOT DESIGNATE TO CALL AS WITNESSES AT TRIAL - Set Deadlines: Specific Document Deadline (1) (Defense counsel to add to its July 15, 2006 Witness List class members interviewed pursuant to this Order after July 15, 2006 who Defense counsel intends to call as witnesses at trial) due by 9/4/2006. By Judge GENE CARTER. (mnw, ) (Entered: 05/16/2006)"
        },
        {
          "row_number": 108,
          "id": 10324605,
          "entry_number": "197",
          "date_filed": "2006-05-17T00:00:00-04:00",
          "attachments": null,
          "url": "https://www.courtlistener.com/docket/4647359/197/dare-v-knox-county/",
          "recap_pdf_url": null,
          "pacer_doc_id": "0910416868",
          "description": "TRANSCRIPT of Proceedings Conference held on 5/16/06 before Judge Gene Carter. Court Reporter: P. Terry. For a bound copy of this transcript, contact P. Terry at 207-775-4331. NOTICE: -- Transcripts are NOT remotely electronically available via PACER at this time. (TERRY, PAULINE) (Entered: 05/17/2006)"
        },
        {
          "row_number": 109,
          "id": 10324606,
          "entry_number": "198",
          "date_filed": "2006-05-25T00:00:00-04:00",
          "attachments": null,
          "url": "https://www.courtlistener.com/docket/4647359/198/dare-v-knox-county/",
          "recap_pdf_url": null,
          "pacer_doc_id": "0910420264",
          "description": "Witness List by KNOX COUNTY, DANIEL DAVEY. (MARCHESI, PETER) (Entered: 05/25/2006)"
        },
        {
          "row_number": 110,
          "id": 10324607,
          "entry_number": "199",
          "date_filed": "2006-05-25T00:00:00-04:00",
          "attachments": null,
          "url": "https://www.courtlistener.com/docket/4647359/199/dare-v-knox-county/",
          "recap_pdf_url": null,
          "pacer_doc_id": "0910419956",
          "description": "NOTICE/CORRESPONDENCE Re: Defendants' Proposed Plan for Completing Discovery of Absent Class Members Who Will Not Be Called by Plaintiff as Witnesses at Trial by KNOX COUNTY, DANIEL DAVEY (MARCHESI, PETER) (Entered: 05/25/2006)"
        },
        {
          "row_number": 113,
          "id": 10324608,
          "entry_number": "200",
          "date_filed": "2006-05-26T00:00:00-04:00",
          "attachments": null,
          "url": "https://www.courtlistener.com/docket/4647359/200/dare-v-knox-county/",
          "recap_pdf_url": null,
          "pacer_doc_id": "0910420749",
          "description": "OBJECTION to 199 Notice (Other)/Corresondence filed by LAURIE TARDIFF. (STOLT, ROBERT) (Entered: 05/26/2006)"
        },
        {
          "row_number": 114,
          "id": 10324609,
          "entry_number": "201",
          "date_filed": "2006-05-30T00:00:00-04:00",
          "attachments": null,
          "url": "https://www.courtlistener.com/docket/4647359/201/dare-v-knox-county/",
          "recap_pdf_url": null,
          "pacer_doc_id": null,
          "description": "ORDER re 199 Notice (Other)/Corresondence filed by DANIEL DAVEY,, KNOX COUNTY- \"After full review of the written submission on the defendants' motion it is hereby denied.\" By Judge GENE CARTER. (mjlt, ) (Entered: 05/30/2006)"
        },
        {
          "row_number": 115,
          "id": 10324610,
          "entry_number": "202",
          "date_filed": "2006-05-30T00:00:00-04:00",
          "attachments": null,
          "url": "https://www.courtlistener.com/docket/4647359/202/dare-v-knox-county/",
          "recap_pdf_url": null,
          "pacer_doc_id": null,
          "description": "ORDER sustaining 200 Objection By Judge GENE CARTER. (mjlt, ) (Entered: 05/30/2006)"
        },
        {
          "row_number": 117,
          "id": 10324612,
          "entry_number": "204",
          "date_filed": "2006-06-02T00:00:00-04:00",
          "attachments": null,
