{
  "case_id": 10022,
  "fetched_at": "2025-10-20T22:39:01.582309",
  "case_data": {
    "attorney_orgs": [],
    "available_documents": [
      "Trial Court Docket",
      "Complaint (any)",
      "Any published opinion"
    ],
    "case_defendants": [
      {
        "defendant_level": null,
        "institution": "",
        "institution_alt_state": null,
        "institution_city": "",
        "institution_county": "Erie",
        "name": "The County of Erie",
        "defendant_level_other": "",
        "is_active": true
      },
      {
        "defendant_level": null,
        "institution": "",
        "institution_alt_state": null,
        "institution_city": "",
        "institution_county": "Erie",
        "name": "Erie County Holding Center",
        "defendant_level_other": "",
        "is_active": true
      },
      {
        "defendant_level": null,
        "institution": "",
        "institution_alt_state": null,
        "institution_city": "",
        "institution_county": "Erie",
        "name": "Erie County Correctional Facility",
        "defendant_level_other": "",
        "is_active": true
      }
    ],
    "case_ongoing": "No",
    "case_status": "Approved",
    "case_types": [
      "Jail Conditions"
    ],
    "cause_other": "",
    "causes": [
      "42 U.S.C. ยง 1983"
    ],
    "class_action_granted": "Denied",
    "class_action_sought": "Yes",
    "closing_year": 2018,
    "constitutional_clause": [
      {
        "value": "Unreasonable search and seizure"
      }
    ],
    "content_of_injunction": [],
    "court": "Western District of New York",
    "custom_issues": [],
    "defendant_payment": "",
    "defendant_type": [
      {
        "value": "Corrections"
      }
    ],
    "docket_status": "Complete as of retrieval date",
    "facility_type": [
      {
        "value": "Government-run"
      }
    ],
    "filing_date": "2004-07-21",
    "filing_year": 2004,
    "id": 10022,
    "injunction_duration": "",
    "issues": [
      "General/Misc.: Search policies",
      "Jails, Prisons, Detention Centers, and Other Institutions: Strip search policy (facilities)"
    ],
    "last_checked_date": "2022-10-04T00:00:00-04:00",
    "main_docket": {
      "id": 33057,
      "docket_entries": [
        {
          "row_number": 317,
          "id": 8889933,
          "entry_number": null,
          "date_filed": "2004-07-21T00:00:00-04:00",
          "attachments": [],
          "url": "https://www.courtlistener.com",
          "recap_pdf_url": null,
          "pacer_doc_id": null,
          "description": "Summons Issued"
        },
        {
          "row_number": 318,
          "id": 8889934,
          "entry_number": null,
          "date_filed": "2004-07-21T00:00:00-04:00",
          "attachments": [],
          "url": "https://www.courtlistener.com",
          "recap_pdf_url": null,
          "pacer_doc_id": null,
          "description": "Summons Issued as to Patrick M. Gallivan, H. McCarthy Gibson, Timothy. Howard, Robert Huggins, Donald J. Livingston, The County of Erie. (DZ, )"
        },
        {
          "row_number": 110,
          "id": 8889935,
          "entry_number": "2",
          "date_filed": "2004-08-20T00:00:00-04:00",
          "attachments": [],
          "url": "https://www.courtlistener.com/docket/4680081/2/pritchard-v-the-county-of-erie/",
          "recap_pdf_url": null,
          "pacer_doc_id": "1290158696",
          "description": "STIPULATION AND ORDER granting all defendants an extension of time to answer until 9/16/04; plaintiffs' time to move for class certification will be extended by 30 days. Signed by Hon. John T. Curtin on 8/20/04. (DZ, ) (Entered: 08/24/2004)"
        },
        {
          "row_number": 320,
          "id": 8889937,
          "entry_number": null,
          "date_filed": "2004-08-20T00:00:00-04:00",
          "attachments": [],
          "url": "https://www.courtlistener.com",
          "recap_pdf_url": null,
          "pacer_doc_id": null,
          "description": "Answer due date updated as to all defendants to 9/16/04 (DZ, )"
        },
        {
          "row_number": 221,
          "id": 8889938,
          "entry_number": "3",
          "date_filed": "2004-09-16T00:00:00-04:00",
          "attachments": [],
          "url": "https://www.courtlistener.com/docket/4680081/3/pritchard-v-the-county-of-erie/",
          "recap_pdf_url": null,
          "pacer_doc_id": "1290568642",
          "description": "ANSWER to Complaint with Jury Demand, CROSSCLAIM against H. McCarthy Gibson by Patrick M. Gallivan, Timothy. Howard, Robert Huggins, Donald J. Livingston, The County of Erie.(Wheaton, Kristin) (Entered: 09/16/2004)"
        },
        {
          "row_number": 251,
          "id": 8889939,
          "entry_number": "4",
          "date_filed": "2004-09-16T00:00:00-04:00",
          "attachments": [],
          "url": "https://www.courtlistener.com/docket/4680081/4/pritchard-v-the-county-of-erie/",
          "recap_pdf_url": null,
          "pacer_doc_id": "1290568079",
          "description": "ANSWER to Complaint with Jury Demand, CROSSCLAIM against Patrick M. Gallivan, Timothy. Howard, Robert Huggins, Donald J. Livingston, The County of Erie, Julenne Tucker by H. McCarthy Gibson. (Attachments: # 1 Certificate of Service)(D'Agostino, Thomas) (Entered: 09/16/2004)"
        },
        {
          "row_number": 322,
          "id": 8889941,
          "entry_number": null,
          "date_filed": "2004-10-07T00:00:00-04:00",
          "attachments": [],
          "url": "https://www.courtlistener.com",
          "recap_pdf_url": null,
          "pacer_doc_id": null,
          "description": "NOTICE of Hearing: Status Telephone Conference set for 10/25/2004 11:00 AM before Hon. John T. Curtin. (JEC)"
        },
        {
          "row_number": 324,
          "id": 8889943,
          "entry_number": null,
          "date_filed": "2004-10-21T00:00:00-04:00",
          "attachments": [],
          "url": "https://www.courtlistener.com",
          "recap_pdf_url": null,
          "pacer_doc_id": null,
          "description": "TAKE NOTICE that the Meeting scheduled in this matter for 10/25/2004 is adjourned generally. A new meeting date will be set shortly. (JEC)"
        },
        {
          "row_number": 262,
          "id": 8889944,
          "entry_number": "5",
          "date_filed": "2004-12-13T00:00:00-05:00",
          "attachments": [],
          "url": "https://www.courtlistener.com/docket/4680081/5/pritchard-v-the-county-of-erie/",
          "recap_pdf_url": null,
          "pacer_doc_id": "1290753634",
          "description": "**RESCINDED per Order item # 162** ORDER REFERRING CASE to Magistrate Judge Hugh B. Scott. Signed by Hon. Richard J. Arcara on 12/09/2004. (JEC) Modified on 1/9/2007 (DZ, ). (Entered: 12/13/2004)"
        },
        {
          "row_number": 273,
          "id": 8889945,
          "entry_number": "6",
          "date_filed": "2004-12-21T00:00:00-05:00",
          "attachments": [],
          "url": "https://www.courtlistener.com/docket/4680081/6/pritchard-v-the-county-of-erie/",
          "recap_pdf_url": null,
          "pacer_doc_id": "1290177334",
          "description": "STIPULATION AND ORDERPlaintiffs' Motion for class certification due by 2/18/2005. Signed by Hon. Hugh B. Scott on 12/20/2004. (DRH) (Entered: 12/21/2004)"
        },
        {
          "row_number": 284,
          "id": 8889946,
          "entry_number": "7",
          "date_filed": "2005-01-03T00:00:00-05:00",
          "attachments": [],
          "url": "https://www.courtlistener.com/docket/4680081/7/pritchard-v-the-county-of-erie/",
          "recap_pdf_url": null,
          "pacer_doc_id": "1290214564",
          "description": "NOTICE of Appearance by David Gerald Jay on behalf of Adam Pritchard, Edward Robinson, Julenne Tucker (DZ, ) (Entered: 01/03/2005)"
        },
        {
          "row_number": 295,
          "id": 8889947,
          "entry_number": "8",
          "date_filed": "2005-01-31T00:00:00-05:00",
          "attachments": [],
          "url": "https://www.courtlistener.com/docket/4680081/8/pritchard-v-the-county-of-erie/",
          "recap_pdf_url": null,
          "pacer_doc_id": "1290722225",
          "description": "STATUS REPORT and Request for Case Management Conference with the Court by Adam Pritchard, Edward Robinson, Julenne Tucker. (Keach, Elmer) (Entered: 01/31/2005)"
        },
        {
          "row_number": 306,
          "id": 8889950,
          "entry_number": "9",
          "date_filed": "2005-02-03T00:00:00-05:00",
          "attachments": [],
          "url": "https://www.courtlistener.com/docket/4680081/9/pritchard-v-the-county-of-erie/",
          "recap_pdf_url": null,
          "pacer_doc_id": "1290747352",
          "description": "ORDER OF MAGISTRATE JUDGE HUGH B. SCOTT Scheduling Conference set for 2/23/2005, 11:00 AM, before Hon. Hugh B. Scott. The date for class certification motion (see Docket No. 6 ), is held in abeyance pending this scheduling conference. Signed by Hon. Hugh B. Scott on 2/3/2005. (DRH) (Entered: 02/03/2005)"
        },
        {
          "row_number": 1,
          "id": 8889951,
          "entry_number": "10",
          "date_filed": "2005-02-11T00:00:00-05:00",
          "attachments": [],
          "url": "https://www.courtlistener.com/docket/4680081/10/pritchard-v-the-county-of-erie/",
          "recap_pdf_url": null,
          "pacer_doc_id": "1290576076",
          "description": "NOTICE of Appearance by Frank T. Gaglione on behalf of Timothy. Howard, Donald J. Livingston, Robert Huggins, Patrick M. Gallivan, Timothy. Howard, Robert Huggins, Donald J. Livingston, The County of Erie, Patrick M. Gallivan, Timothy. Howard, Robert Huggins, Donald J. Livingston, The County of Erie, The County of Erie, Patrick M. Gallivan (Gaglione, Frank) (Entered: 02/11/2005)"
        },
        {
          "row_number": 22,
          "id": 8889953,
          "entry_number": "12",
          "date_filed": "2005-02-23T00:00:00-05:00",
          "attachments": [],
          "url": "https://www.courtlistener.com/docket/4680081/12/pritchard-v-the-county-of-erie/",
          "recap_pdf_url": null,
          "pacer_doc_id": null,
          "description": "HONORABLE HUGH B. SCOTTTEXT OF MINUTE ENTRYFor proceedings held before Magistrate Judge Hugh B. Scott:David G. Jay, Esq., Elmer R. Keach, III, Esq., Jonathan Cuneo, Esq., for plaintiffs; Assistant County Attorney Kristin Klein Wheaton, Frank Gaglione, Esq., Michael Driscoll, Esq., for defendants (except Gibson); Thomas D'Agostino, Esq., for defendant Gibson.Scheduling Conference held on 2/23/2005. Cause shown for extended schedule. Scheduling Order to be entered. (DRH) (Entered: 02/23/2005)"
        },
        {
          "row_number": 44,
          "id": 8889955,
          "entry_number": "14",
          "date_filed": "2005-04-14T00:00:00-04:00",
          "attachments": [],
          "url": "https://www.courtlistener.com/docket/4680081/14/pritchard-v-the-county-of-erie/",
          "recap_pdf_url": null,
          "pacer_doc_id": null,
          "description": "ORDER OF MAGISTRATE JUDGE HUGH B. SCOTTTEXT OF ORDER re 13 Scheduling Order, Set Deadlines/Hearings, Set Scheduling Order Deadlines Initial Settlement Conference reset for 9/7/2005, 11:00 AM, before Hon. Hugh B. Scott. All other dates remain in place. Signed by Hon. Hugh B. Scott on 4/14/2005. (DRH) (Entered: 04/14/2005)"
        },
        {
          "row_number": 55,
          "id": 8889956,
          "entry_number": "15",
          "date_filed": "2005-06-23T00:00:00-04:00",
          "attachments": [],
          "url": "https://www.courtlistener.com/docket/4680081/15/pritchard-v-the-county-of-erie/",
          "recap_pdf_url": null,
          "pacer_doc_id": "129048603",
          "description": "ORDER OF MAGISTRATE JUDGE HUGH B. SCOTTSTIPULATION AND ORDERDefendants stipulated to dismissing cross-claims filed against each other. Cross-Claimants H. McCarthy Gibson, County of Erie, Patrick M. Gallivan, Timothy. Howard, Donald Livingston, and Robert Huggins terminated; Cross-Defendants H. McCarthy Gibson, Timothy. Howard, Robert Huggins, Donald J. Livingston, The County of Erie, and Patrick M. Gallivan terminated.So Ordered. Signed by Hon. Hugh B. Scott on 6/23/2005. (DRH) (Entered: 06/23/2005)"
        },
        {
          "row_number": 66,
          "id": 8889957,
          "entry_number": "16",
          "date_filed": "2005-07-22T00:00:00-04:00",
          "attachments": [],
          "url": "https://www.courtlistener.com/docket/4680081/16/pritchard-v-the-county-of-erie/",
          "recap_pdf_url": null,
          "pacer_doc_id": "1290234562",
          "description": "MOTION to Compel by The County of Erie, Patrick M. Gallivan, Timothy Howard, Donald Livingston and by Robert Huggins.(Domagalski, James) (Entered: 07/22/2005)"
        },
        {
          "row_number": 77,
          "id": 8889958,
          "entry_number": "17",
          "date_filed": "2005-07-22T00:00:00-04:00",
          "attachments": [],
          "url": "https://www.courtlistener.com/docket/4680081/17/pritchard-v-the-county-of-erie/",
          "recap_pdf_url": null,
          "pacer_doc_id": "1290234724",
          "description": "AFFIDAVIT re 16 MOTION to Compel by The County of Erie, Patrick M. Gallivan, Timothy Howard, Donald Livingston and by Robert Huggins. (Attachments: # 1 # 2 # 3 # 4 # 5 # 6 # 7)(Domagalski, James) (Entered: 07/22/2005)"
        },
        {
          "row_number": 88,
          "id": 8889959,
          "entry_number": "18",
          "date_filed": "2005-07-25T00:00:00-04:00",
          "attachments": [],
          "url": "https://www.courtlistener.com/docket/4680081/18/pritchard-v-the-county-of-erie/",
          "recap_pdf_url": null,
          "pacer_doc_id": null,
          "description": "ORDER OF MAGISTRATE JUDGE HUGH B. SCOTTTEXT OF ORDER re 16 MOTION to Compel by The County of Erie, Patrick M. Gallivan, Timothy Howard, Donald Livingston and filed by Robert HugginsPlaintiffs' counsel requested a status conference to discuss discovery and the timing of the class certification motion; also, defendants have moved to compel discovery from plaintiffs (Docket No. 16 ). To discuss these issues, Status Conference set for 8/17/2005, 11:30 AM, before Hon. Hugh B. Scott; plaintiff's non-local counsel may appear by telephone. All other counsel (including plaintiffs' local counsel) are expected to appear in person. Parties are reminded that chamber guidelines requires submission of paper courtesy copies of all motion papers to the chambers of the undersigned.So Ordered. Signed by Hon. Hugh B. Scott on 7/25/2005. (DRH) (Entered: 07/25/2005)"
        },
        {
          "row_number": 327,
          "id": 8889961,
          "entry_number": null,
          "date_filed": "2005-07-28T00:00:00-04:00",
          "attachments": [],
          "url": "https://www.courtlistener.com",
          "recap_pdf_url": null,
          "pacer_doc_id": null,
          "description": "Remark"
        },
        {
          "row_number": 111,
          "id": 8889963,
          "entry_number": "20",
          "date_filed": "2005-07-28T00:00:00-04:00",
          "attachments": [],
          "url": "https://www.courtlistener.com/docket/4680081/20/pritchard-v-the-county-of-erie/",
          "recap_pdf_url": null,
          "pacer_doc_id": "1290224454",
          "description": "NOTICE of Change of Address by James Paul Domagalski (Domagalski, James) (Entered: 07/28/2005)"
        },
        {
          "row_number": 133,
          "id": 8889965,
          "entry_number": "22",
          "date_filed": "2005-08-09T00:00:00-04:00",
          "attachments": [],
          "url": "https://www.courtlistener.com/docket/4680081/22/pritchard-v-the-county-of-erie/",
          "recap_pdf_url": null,
          "pacer_doc_id": "1290229989",
          "description": "MOTION to Compel or Preclude Discovery by H. McCarthy Gibson.(D'Agostino, Thomas) (Entered: 08/09/2005)"
        },
        {
          "row_number": 155,
          "id": 8889967,
          "entry_number": "24",
          "date_filed": "2005-08-10T00:00:00-04:00",
          "attachments": [],
          "url": "https://www.courtlistener.com/docket/4680081/24/pritchard-v-the-county-of-erie/",
          "recap_pdf_url": null,
          "pacer_doc_id": "1290230326",
          "description": "AFFIDAVIT of Service for Affidavit in Support of Motion to Compel or Preclude Discovery served on All parties on August 9, 2005, filed by H. McCarthy Gibson. (D'Agostino, Thomas) (Entered: 08/10/2005)"
        },
        {
          "row_number": 329,
          "id": 8889968,
          "entry_number": null,
          "date_filed": "2005-08-10T00:00:00-04:00",
          "attachments": [],
          "url": "https://www.courtlistener.com",
          "recap_pdf_url": null,
          "pacer_doc_id": null,
          "description": "E-Filing Notification"
        },
        {
          "row_number": 330,
          "id": 8889969,
          "entry_number": null,
          "date_filed": "2005-08-10T00:00:00-04:00",
          "attachments": [],
          "url": "https://www.courtlistener.com",
          "recap_pdf_url": null,
          "pacer_doc_id": null,
          "description": "E-Filing Error Notification: 24 AFFIDAVIT of Service (D'Agostino, Thomas) **Document to be refiled in proper format with case caption and number** (DZ, )"
        },
        {
          "row_number": 166,
          "id": 8889970,
          "entry_number": "25",
          "date_filed": "2005-08-11T00:00:00-04:00",
          "attachments": [],
          "url": "https://www.courtlistener.com/docket/4680081/25/pritchard-v-the-county-of-erie/",
          "recap_pdf_url": null,
          "pacer_doc_id": "1290231020",
          "description": "MOTION to Compel and for Protective Order, Leave to Intervene and Enlargement of Time by Adam Pritchard, Edward Robinson, Julenne Tucker. (Attachments: # 1 Affidavit Affirmation of Elmer Keach# 2 Exhibit Exhibit A to Keach Affirmation -- Plaintiffs' Document Request# 3 Exhibit Exhibit C to Keach Affirmation -- Defendants' Response to Document Request# 4 Exhibit Exhibit C to Keach Affirmation -- Defendant County of Erie's Answer# 5 Exhibit Exhibit D to Keach Affirmation -- Gibson Memo on Strip Searches, August 2003# 6 Exhibit Exhibit E to Keach Affirmation -- Marriott Protective Order# 7 Exhibit Exhibit F to Keach Affirmation -- Defendants' Letter regarding booking sheets# 8 Exhibit Exhibit G to Keach Affirmation -- Order in Bruce v. County of Rensselaer# 9 Exhibit Exhibit H to the Keach Affirmation -- transcript from Marriott v. County of Montgomery# 10 Exhibit Exhibit I to Keach Affirmation -- Transcript in McDaniel v. County of Schenectady# 11 Exhibit Exhibit J to Keach Affirmation -- Order in McDaniel v. County of Schenectady on booking sheets# 12 Exhibit Exhibit K to Keach Affirmation -- Protective Order in McDaniel v. County of Schenectady# 13 Exhibit Exhibit L to Keach Affirmation -- Booking Records for Edward Robinson# 14 Exhibit Exhibit M to Keach Affirmation -- County of Erie Original Privilege Log# 15 Exhibit Exhibit N to Keach Affirmation -- County of Erie Amended Privilege Log# 16 Exhibit Exhibit O to Keach Affirmation -- Depostion to Daniel Harig# 17 Exhibit Exhibit P to Keach Affirmation -- Email between counsel regarding Stanley and McNamara# 18 Exhibit Exhibit R to Keach Affirmation -- Redlined Amended Complaint# 19 Exhibit Exhibit Q to Keach Affirmation -- Intervention Complaint# 20 Exhibit Exhibit S to Keach Affirmation -- Order in McDaniel v. County of Schenectady regarding extension of class certification deadline# 21 Memorandum in Support Memorandum of Law In support of motion to compel, for protective order, for permissive intervention and enlargement of time)(Keach, Elmer) (Entered: 08/11/2005)"
        },
        {
          "row_number": 331,
          "id": 8889971,
          "entry_number": null,
          "date_filed": "2005-08-12T00:00:00-04:00",
          "attachments": [],
          "url": "https://www.courtlistener.com",
          "recap_pdf_url": null,
          "pacer_doc_id": null,
          "description": "Remark"
        },
        {
          "row_number": 188,
          "id": 8889975,
          "entry_number": "27",
          "date_filed": "2005-08-12T00:00:00-04:00",
          "attachments": [],
          "url": "https://www.courtlistener.com/docket/4680081/27/pritchard-v-the-county-of-erie/",
          "recap_pdf_url": null,
          "pacer_doc_id": "1290231287",
          "description": "STIPULATION re 13 Scheduling Order,,,, Set Deadlines/Hearings,,,, Set Scheduling Order Deadlines,,, extending time for Plaintiffs to move for class certification by Adam Pritchard, Edward Robinson, Julenne Tucker. (Keach, Elmer) (Entered: 08/12/2005)"
        },
        {
          "row_number": 334,
          "id": 8889976,
          "entry_number": null,
          "date_filed": "2005-08-12T00:00:00-04:00",
          "attachments": [],
          "url": "https://www.courtlistener.com",
          "recap_pdf_url": null,
          "pacer_doc_id": null,
          "description": "E-Filing Error Notation: 27 STIPULATION (Keach, Elmer) **document to be re-filed to comply with signature block requirements* (DZ, )"
        },
        {
          "row_number": 335,
          "id": 8889979,
          "entry_number": null,
          "date_filed": "2005-08-17T00:00:00-04:00",
          "attachments": [],
          "url": "https://www.courtlistener.com",
          "recap_pdf_url": null,
          "pacer_doc_id": null,
          "description": "E-Filing Notification"
        },
        {
          "row_number": 222,
          "id": 8889980,
          "entry_number": "30",
          "date_filed": "2005-08-17T00:00:00-04:00",
          "attachments": [],
          "url": "https://www.courtlistener.com/docket/4680081/30/pritchard-v-the-county-of-erie/",
          "recap_pdf_url": null,
          "pacer_doc_id": "1290624470",
          "description": "AFFIRMATION signed by James P. Domagalski, Esq. re 29 Memorandum in Opposition to Motion,, filed by The County of Erie, The County of Erie filed by The County of Erie, The County of Erie. (Attachments: # 1 Ex. A;# 2 Ex. B;# 3 Ex. C;# 4 Ex. D;# 5 Ex. E;# 6 Ex. F;# 7 Ex. G.)(Domagalski, James) (Entered: 08/17/2005)"
        },
        {
          "row_number": 233,
          "id": 8889981,
          "entry_number": "31",
          "date_filed": "2005-08-17T00:00:00-04:00",
          "attachments": [],
          "url": "https://www.courtlistener.com/docket/4680081/31/pritchard-v-the-county-of-erie/",
          "recap_pdf_url": null,
          "pacer_doc_id": "129059655",
          "description": "AFFIRMATION signed by Thomas C. D'Agostino, Esq. re 25 MOTION to Compel and for Protective Order, Leave to Intervene and Enlargement of Time filed by H. McCarthy Gibson, Timothy. Howard Affirmation in opposition to the portion of Plaintiff's motion which seeks an enlargement of time for Plaintiffs to file their motion for class certification filed by H. McCarthy Gibson, Timothy. Howard. (D'Agostino, Thomas) (Entered: 08/17/2005)"
        },
        {
          "row_number": 243,
          "id": 8889982,
          "entry_number": "32",
          "date_filed": "2005-08-17T00:00:00-04:00",
          "attachments": [],
          "url": "https://www.courtlistener.com/docket/4680081/32/pritchard-v-the-county-of-erie/",
          "recap_pdf_url": null,
          "pacer_doc_id": "1290628297",
          "description": "CERTIFICATE OF SERVICE by The County of Erie re 29 Memorandum in Opposition to Motion,,, 30 Affirmation, (Domagalski, James) (Entered: 08/17/2005)"
        },
        {
          "row_number": 244,
          "id": 8889983,
          "entry_number": "33",
          "date_filed": "2005-08-17T00:00:00-04:00",
          "attachments": [],
          "url": "https://www.courtlistener.com/docket/4680081/33/pritchard-v-the-county-of-erie/",
          "recap_pdf_url": null,
          "pacer_doc_id": "129069244",
          "description": "MEMORANDUM in Opposition re 22 MOTION to Compel or Preclude Discovery, 16 MOTION to Compel by The County of Erie, Patrick M. Gallivan, Timothy Howard, Donald Livingston and filed by Adam Pritchard, Edward Robinson, Julenne Tucker. (Attachments: # 1 Affidavit Affidavit of Elmer Keach in Opposition, with one exhibit -- declaration of amina robinson)(Keach, Elmer) (Entered: 08/17/2005)"
        },
        {
          "row_number": 338,
          "id": 8889986,
          "entry_number": null,
          "date_filed": "2005-08-18T00:00:00-04:00",
          "attachments": [],
          "url": "https://www.courtlistener.com",
          "recap_pdf_url": null,
          "pacer_doc_id": null,
          "description": "Document #33 (Memorandum by Elmer Keach) filed without proof of service (DZ, )"
        },
        {
          "row_number": 246,
          "id": 8889988,
          "entry_number": "35",
          "date_filed": "2005-08-18T00:00:00-04:00",
          "attachments": [],
          "url": "https://www.courtlistener.com/docket/4680081/35/pritchard-v-the-county-of-erie/",
          "recap_pdf_url": null,
          "pacer_doc_id": "1290660690",
          "description": "CERTIFICATE OF SERVICE by The County of Erie re 32 Certificate of Service, 29 Memorandum in Opposition to Motion,,, 30 Affirmation, which corrects and replaces entry 32 (Domagalski, James) (Entered: 08/18/2005)"
        },
        {
          "row_number": 247,
          "id": 8889989,
          "entry_number": "36",
          "date_filed": "2005-08-19T00:00:00-04:00",
          "attachments": [],
          "url": "https://www.courtlistener.com/docket/4680081/36/pritchard-v-the-county-of-erie/",
          "recap_pdf_url": null,
          "pacer_doc_id": "1290717337",
          "description": "CERTIFICATE OF SERVICE by Adam Pritchard, Edward Robinson, Julenne Tucker re 25 MOTION to Compel and for Protective Order, Leave to Intervene and Enlargement of Time (Keach, Elmer) (Entered: 08/19/2005)"
        },
        {
          "row_number": 248,
          "id": 8889990,
          "entry_number": "37",
          "date_filed": "2005-08-19T00:00:00-04:00",
          "attachments": [],
          "url": "https://www.courtlistener.com/docket/4680081/37/pritchard-v-the-county-of-erie/",
          "recap_pdf_url": null,
          "pacer_doc_id": "1290168943",
          "description": "CERTIFICATE OF SERVICE by Adam Pritchard, Edward Robinson, Julenne Tucker re 33 Memorandum in Opposition to Motion, (Keach, Elmer) (Entered: 08/19/2005)"
        },
        {
          "row_number": 249,
          "id": 8889991,
          "entry_number": "38",
          "date_filed": "2005-08-22T00:00:00-04:00",
          "attachments": [],
          "url": "https://www.courtlistener.com/docket/4680081/38/pritchard-v-the-county-of-erie/",
          "recap_pdf_url": null,
          "pacer_doc_id": "1290169191",
          "description": "MOTION for Protective Order by The County of Erie.(Domagalski, James) (Entered: 08/22/2005)"
        },
        {
          "row_number": 250,
          "id": 8889993,
          "entry_number": "39",
          "date_filed": "2005-08-22T00:00:00-04:00",
          "attachments": [],
          "url": "https://www.courtlistener.com/docket/4680081/39/pritchard-v-the-county-of-erie/",
          "recap_pdf_url": null,
          "pacer_doc_id": "1290718111",
          "description": "AFFIRMATION signed by James P. Domagalski, Esq. re 38 MOTION for Protective Order filed by The County of Erie,further in support of County Defendants' motion to preclude. (Attachments: # 1 Exhibit A# 2 Exhibit B# 3 Exhibit C# 4 Exhibit D# 5 Exhibit E)(Domagalski, James) (Entered: 08/22/2005)"
        },
        {
          "row_number": 340,
          "id": 8889994,
          "entry_number": null,
          "date_filed": "2005-08-22T00:00:00-04:00",
          "attachments": [],
          "url": "https://www.courtlistener.com",
          "recap_pdf_url": null,
          "pacer_doc_id": null,
          "description": "E-Filing Notification: 38 MOTION for Protective Order, 39 AFFIRMATION **documents refiled** (DZ, )"
        },
        {
          "row_number": 252,
          "id": 8889995,
          "entry_number": "40",
          "date_filed": "2005-08-23T00:00:00-04:00",
          "attachments": [],
          "url": "https://www.courtlistener.com/docket/4680081/40/pritchard-v-the-county-of-erie/",
          "recap_pdf_url": null,
          "pacer_doc_id": "1290723748",
          "description": "MOTION for Protective Order correcting and replacing docket entry 38 by The County of Erie.(Domagalski, James) (Entered: 08/23/2005)"
        },
        {
          "row_number": 253,
          "id": 8889997,
          "entry_number": "41",
          "date_filed": "2005-08-23T00:00:00-04:00",
          "attachments": [],
          "url": "https://www.courtlistener.com/docket/4680081/41/pritchard-v-the-county-of-erie/",
          "recap_pdf_url": null,
          "pacer_doc_id": "1290723749",
          "description": "AFFIRMATION signed by James P. Domagalski, Esq. re 40 MOTION for Protective Order correcting and replacing docket entry 38 filed by The County of Erie, which Affirmation corrects and replaces docket entry 39. (Attachments: # 1 Exhibit A# 2 Exhibit B# 3 Exhibit C# 4 Exhibit D# 5 Exhibit E)(Domagalski, James) (Entered: 08/23/2005)"
        },
        {
          "row_number": 254,
          "id": 8889998,
          "entry_number": "42",
          "date_filed": "2005-08-23T00:00:00-04:00",
          "attachments": [],
          "url": "https://www.courtlistener.com/docket/4680081/42/pritchard-v-the-county-of-erie/",
          "recap_pdf_url": null,
          "pacer_doc_id": "1290718823",
          "description": "MEMORANDUM IN SUPPORT re 40 MOTION for Protective Order correcting and replacing docket entry 38, 41 Affirmation, byThe County of Erie. (Domagalski, James) (Entered: 08/23/2005)"
        },
        {
          "row_number": 255,
          "id": 8889999,
          "entry_number": "43",
          "date_filed": "2005-08-23T00:00:00-04:00",
          "attachments": [],
          "url": "https://www.courtlistener.com/docket/4680081/43/pritchard-v-the-county-of-erie/",
          "recap_pdf_url": null,
          "pacer_doc_id": "1290178865",
          "description": "CERTIFICATE OF SERVICE by The County of Erie re 40 MOTION for Protective Order correcting and replacing docket entry 38, 41 Affirmation,, 42 Memorandum in Support (Domagalski, James) (Entered: 08/23/2005)"
        },
        {
          "row_number": 342,
          "id": 8890001,
          "entry_number": null,
          "date_filed": "2005-08-23T00:00:00-04:00",
          "attachments": [],
          "url": "https://www.courtlistener.com",
          "recap_pdf_url": null,
          "pacer_doc_id": null,
          "description": "E-Filing Error Corrected: 44 ORDER OF MAGISTRATE JUDGE HUGH B. SCOTTTEXT OF NOTICE of Hearing on Motion 40 MOTION for Protective Order correcting and replacing docket entry 38:Despite this Court's Order (Docket No. 28, see Docket No. 21 minute entry) that motions related to issues raised on 8/3/2005 be filed by 8/10/2005, the Court will consider this latest (otherwise out of time) motion because of the allegation of actions that occurred after that motion deadline.Responses due by 9/1/2005; Replies due by 9/16/2005. Motion Hearing set for Tues., 9/20/2005, 11:00 AM, before Hon. Hugh B. Scott, the same date and time as argument of the other pending motions in this action (Docket Nos. 16, 22, 25). (DRH) Modified on 8/23/2005--correct day of argument (DRH)."
        },
        {
          "row_number": 257,
          "id": 8890002,
          "entry_number": "45",
          "date_filed": "2005-09-01T00:00:00-04:00",
          "attachments": [],
          "url": "https://www.courtlistener.com/docket/4680081/45/pritchard-v-the-county-of-erie/",
          "recap_pdf_url": null,
          "pacer_doc_id": "1290733079",
          "description": "REPLY/RESPONSE to re 33 Memorandum in Opposition to Motion,, 16 MOTION to Compel by The County of Erie, Patrick M. Gallivan, Timothy Howard, Donald Livingston and, 17 Affidavit filed by The County of Erie. (Attachments: # 1 Exhibit A)(Domagalski, James) (Entered: 09/01/2005)"
        },
        {
          "row_number": 343,
          "id": 8890003,
          "entry_number": null,
          "date_filed": "2005-09-01T00:00:00-04:00",
          "attachments": [],
          "url": "https://www.courtlistener.com",
          "recap_pdf_url": null,
          "pacer_doc_id": null,
          "description": "E-Filing Notification"
        },
        {
          "row_number": 259,
          "id": 8890005,
          "entry_number": "47",
          "date_filed": "2005-09-01T00:00:00-04:00",
          "attachments": [],
          "url": "https://www.courtlistener.com/docket/4680081/47/pritchard-v-the-county-of-erie/",
          "recap_pdf_url": null,
          "pacer_doc_id": "1290733251",
          "description": "REPLY to Response to Motion re 25 MOTION to Compel and for Protective Order, Leave to Intervene and Enlargement of Time filed by Adam Pritchard, Edward Robinson, Julenne Tucker. (Attachments: # 1 Exhibit Exhibit A to Keach Affirmation -- Briefing in Marriott v. County of Montgomery# 2 Certificate of Service)(Keach, Elmer) (Entered: 09/01/2005)"
        },
        {
          "row_number": 261,
          "id": 8890008,
          "entry_number": "49",
          "date_filed": "2005-09-16T00:00:00-04:00",
          "attachments": [],
          "url": "https://www.courtlistener.com/docket/4680081/49/pritchard-v-the-county-of-erie/",
          "recap_pdf_url": null,
          "pacer_doc_id": "1290625737",
          "description": "REPLY/RESPONSE to re 40 MOTION for Protective Order correcting and replacing docket entry 38, 47 Reply to Response to Motion,, 48 Affidavit in Opposition to Motion,,, 41 Affirmation,, 42 Memorandum in Support filed by The County of Erie. (Attachments: # 1 Exhibit A# 2 Exhibit B)(Domagalski, James) (Entered: 09/16/2005)"
        },
        {
          "row_number": 263,
          "id": 8890009,
          "entry_number": "50",
          "date_filed": "2005-09-16T00:00:00-04:00",
          "attachments": [],
          "url": "https://www.courtlistener.com/docket/4680081/50/pritchard-v-the-county-of-erie/",
          "recap_pdf_url": null,
          "pacer_doc_id": "129066403",
          "description": "CERTIFICATE OF SERVICE by The County of Erie re 49 Reply/Response, (Domagalski, James) (Entered: 09/16/2005)"
        },
        {
          "row_number": 265,
          "id": 8890011,
          "entry_number": "52",
          "date_filed": "2005-09-26T00:00:00-04:00",
          "attachments": [],
          "url": "https://www.courtlistener.com/docket/4680081/52/pritchard-v-the-county-of-erie/",
          "recap_pdf_url": "https://www.courtlistener.com/recap/gov.uscourts.nywd.51300/gov.uscourts.nywd.51300.52.0.pdf",
          "pacer_doc_id": "1290179014",
          "description": " ORDER OF MAGISTRATE JUDGE HUGH B. SCOTTORDERGranting in part and denying in part  16  County Defendants' Motion to Compel (as detailed in the Order), granting  22  Gipson's Motion to Com pel, granting in part and denying in part  25  plaintiffs' Motion to Compel (as described in detail in the Order), granting in part and denying in part  40  County Defendants' Motion for Protective Order (also as described in the Order). Plaintiffs are either to produce requested disclosure and discovery on plaintiff Julenne Tucker or formally withdraw his claims within 30 days of entry of this Order.The Court will enter a protective Order regarding defendants' production of  booking sheet information.Plaintiffs have until 12/20/2005 in which to file a class certification motion; this is the final extension of the class certification deadline.County Defendants to receive reasonable motion costs for Doc ket No. 16; Gipson is to receive some reasonable motion costs for Docket No. 22 (as described more fully in the Order); plaintiffs to receive some reasonable motion costs for Docket No. 25 (again, as described more fully in the Order).  Parties are t o file and exchange their respective motion cost application affidavits five (5) business days from entry of this Order; the opposing parties may file a response within five (5) business days of service of that affidavit.  No reply papers will be acc epted for the fee applications.  The Court will deem the fee applications submitted as of the date for responding papers and issue an Order awarding costs.  These sanctions shall be paid by respective counsel responsible for the expense.So Ordered. Signed by Magistrate Judge Hugh B. Scott on 9/26/2005. (DRH)"
        },
        {
          "row_number": 267,
          "id": 8890013,
          "entry_number": "54",
          "date_filed": "2005-09-26T00:00:00-04:00",
          "attachments": [],
          "url": "https://www.courtlistener.com/docket/4680081/54/pritchard-v-the-county-of-erie/",
          "recap_pdf_url": null,
          "pacer_doc_id": null,
          "description": "TEXT OF Calendar Entry, deadline for motion for class certification, 12/20/2005. (DRH) (Entered: 09/26/2005)"
        },
        {
          "row_number": 268,
          "id": 8890014,
          "entry_number": "55",
          "date_filed": "2005-09-30T00:00:00-04:00",
          "attachments": [],
          "url": "https://www.courtlistener.com/docket/4680081/55/pritchard-v-the-county-of-erie/",
          "recap_pdf_url": null,
          "pacer_doc_id": "1290298278",
          "description": "STIPULATION re 52 Order on Motion to Compel,,,,,,,,,,,,,,,,,,,,,,,, Order on Motion for Protective Order,,,,,,, Waiving Right of all Counsel to Seek Costs by Adam Pritchard, Edward Robinson, Julenne Tucker. (Keach, Elmer) (Entered: 09/30/2005)"
        },
        {
          "row_number": 270,
          "id": 8890016,
          "entry_number": "57",
          "date_filed": "2005-10-17T00:00:00-04:00",
          "attachments": [],
          "url": "https://www.courtlistener.com/docket/4680081/57/pritchard-v-the-county-of-erie/",
          "recap_pdf_url": null,
          "pacer_doc_id": null,
          "description": "ORDER OF MAGISTRATE JUDGE HUGH B. SCOTTTEXT OF ORDERAt the request of all parties, Status Conference set for Wed., 10/19/2005, 2:30 PM, before Hon. Hugh B. Scott.So Ordered. Signed by Hon. Hugh B. Scott on 10/17/2005. (DRH) (Entered: 10/17/2005)"
        },
        {
          "row_number": 272,
          "id": 8890018,
          "entry_number": "59",
          "date_filed": "2005-10-21T00:00:00-04:00",
          "attachments": [],
          "url": "https://www.courtlistener.com/docket/4680081/59/pritchard-v-the-county-of-erie/",
          "recap_pdf_url": null,
          "pacer_doc_id": "1290788854",
          "description": "AFFIRMATION signed by Louis B. Dingeldey Jr., Esq. filed by H. McCarthy Gibson Affirmation in support of fee appication. (Attachments: # 1 Certificate of Service)(Dingeldey, Louis) (Entered: 10/21/2005)"
        },
        {
          "row_number": 274,
          "id": 8890019,
          "entry_number": "60",
          "date_filed": "2005-10-21T00:00:00-04:00",
          "attachments": [],
          "url": "https://www.courtlistener.com/docket/4680081/60/pritchard-v-the-county-of-erie/",
          "recap_pdf_url": null,
          "pacer_doc_id": "1290240788",
          "description": "AFFIDAVIT re 58 Terminate Hearings,,,,, Status Conference,,,, Affidavit in Support of Application for Motion Costs and Attorneys' Fees by The County of Erie. (Attachments: # 1 Exhibit A)(Domagalski, James) (Entered: 10/21/2005)"
        },
        {
          "row_number": 275,
          "id": 8890020,
          "entry_number": "61",
          "date_filed": "2005-10-21T00:00:00-04:00",
          "attachments": [],
          "url": "https://www.courtlistener.com/docket/4680081/61/pritchard-v-the-county-of-erie/",
          "recap_pdf_url": null,
          "pacer_doc_id": "1290789233",
          "description": "CERTIFICATE OF SERVICE by The County of Erie re 60 Affidavit (Domagalski, James) (Entered: 10/21/2005)"
        },
        {
          "row_number": 276,
          "id": 8890021,
          "entry_number": "62",
          "date_filed": "2005-10-21T00:00:00-04:00",
          "attachments": [],
          "url": "https://www.courtlistener.com/docket/4680081/62/pritchard-v-the-county-of-erie/",
          "recap_pdf_url": null,
          "pacer_doc_id": "1290241111",
          "description": "AFFIRMATION signed by Elmer Robert Keach, III re 56 Order,, Set Deadlines,, 58 Terminate Hearings,,,,, Status Conference,,,,, 52 Order on Motion to Compel,,,,,,,,,,,,,,,,,,,,,,,, Order on Motion for Protective Order,,,,,,, filed by Adam Pritchard, Edward Robinson, Julenne Tucker Regarding Assessment of Attorneys' Fees. (Attachments: # 1 Exhibit Exhibit A -- Memorandum Decision and Order, 09.26.05# 2 Exhibit Exhibit B -- Memorandum Decision and Order, 10.11.05# 3 Exhibit Exhibit C -- Keach Fees Affidavit# 4 Exhibit Exhibit d -- LaDuca Fees Affirmation# 5 Exhibit Exhibit E -- Mason Fees Affidavit# 6 Exhibit Exhibit F -- Rozger Fees Affidavit# 7 Certificate of Service)(Keach, Elmer) (Entered: 10/21/2005)"
        },
        {
          "row_number": 277,
          "id": 8890022,
          "entry_number": "63",
          "date_filed": "2005-10-26T00:00:00-04:00",
          "attachments": [],
          "url": "https://www.courtlistener.com/docket/4680081/63/pritchard-v-the-county-of-erie/",
          "recap_pdf_url": null,
          "pacer_doc_id": "1290805171",
          "description": "MOTION for Extension of Time to File Discontinuance for Julenne Tucker, On Consent by Adam Pritchard, Edward Robinson, Julenne Tucker. (Attachments: # 1 Affidavit Affirmation of Elmer Keach# 2 Certificate of Service)(Keach, Elmer) (Entered: 10/26/2005)"
        },
        {
          "row_number": 345,
          "id": 8890023,
          "entry_number": null,
          "date_filed": "2005-10-26T00:00:00-04:00",
          "attachments": [],
          "url": "https://www.courtlistener.com",
          "recap_pdf_url": null,
          "pacer_doc_id": null,
          "description": "E-Filing Notification"
        },
        {
          "row_number": 346,
          "id": 8890024,
          "entry_number": null,
          "date_filed": "2005-10-26T00:00:00-04:00",
          "attachments": [],
          "url": "https://www.courtlistener.com",
          "recap_pdf_url": null,
          "pacer_doc_id": null,
          "description": "E-Filing Error : 63 MOTION for Extension of Time to File Discontinuance for Julenne Tucker, (Keach, Elmer) **document to be refiled as the Affirmation is not sgined** (DZ, )"
        },
        {
          "row_number": 347,
          "id": 8890026,
          "entry_number": null,
          "date_filed": "2005-10-27T00:00:00-04:00",
          "attachments": [],
          "url": "https://www.courtlistener.com",
          "recap_pdf_url": null,
          "pacer_doc_id": null,
          "description": "Set Deadlines/Hearings"
        },
        {
          "row_number": 348,
          "id": 8890027,
          "entry_number": null,
          "date_filed": "2005-10-27T00:00:00-04:00",
          "attachments": [],
          "url": "https://www.courtlistener.com",
          "recap_pdf_url": null,
          "pacer_doc_id": null,
          "description": "Set Deadlines/Hearings: Motions (discontinuing claims by plaintiff Julenne Tucker or producing discovery for him) due by 11/4/2005. (DRH)"
        },
        {
          "row_number": 279,
          "id": 8890028,
          "entry_number": "65",
          "date_filed": "2005-10-28T00:00:00-04:00",
          "attachments": [],
          "url": "https://www.courtlistener.com/docket/4680081/65/pritchard-v-the-county-of-erie/",
          "recap_pdf_url": null,
          "pacer_doc_id": "1290242523",
          "description": "AFFIDAVIT re 62 Affirmation,, Reply affidavit of James Domagalski regarding Cost Motions by The County of Erie, The County of Erie filed by The County of Erie, The County of Erie. (Domagalski, James) (Entered: 10/28/2005)"
        },
        {
          "row_number": 280,
          "id": 8890029,
          "entry_number": "66",
          "date_filed": "2005-10-28T00:00:00-04:00",
          "attachments": [],
          "url": "https://www.courtlistener.com/docket/4680081/66/pritchard-v-the-county-of-erie/",
          "recap_pdf_url": null,
          "pacer_doc_id": "1290789779",
          "description": "CERTIFICATE OF SERVICE by The County of Erie re 65 Affidavit (Domagalski, James) (Entered: 10/28/2005)"
        },
        {
          "row_number": 281,
          "id": 8890030,
          "entry_number": "67",
          "date_filed": "2005-10-28T00:00:00-04:00",
          "attachments": [],
          "url": "https://www.courtlistener.com/docket/4680081/67/pritchard-v-the-county-of-erie/",
          "recap_pdf_url": null,
          "pacer_doc_id": "1290789580",
          "description": "AFFIRMATION signed by Elmer Robert Keach, III re 56 Order,, Set Deadlines,, 58 Terminate Hearings,,,,, Status Conference,,,,, 52 Order on Motion to Compel,,,,,,,,,,,,,,,,,,,,,,,, Order on Motion for Protective Order,,,,,,, filed by Adam Pritchard, Edward Robinson, Julenne Tucker Regarding Defendants' Request for Attorneys' Fees. (Attachments: # 1 Certificate of Service)(Keach, Elmer) (Entered: 10/28/2005)"
        },
        {
          "row_number": 282,
          "id": 8890031,
          "entry_number": "68",
          "date_filed": "2005-11-04T00:00:00-05:00",
          "attachments": [],
          "url": "https://www.courtlistener.com/docket/4680081/68/pritchard-v-the-county-of-erie/",
          "recap_pdf_url": null,
          "pacer_doc_id": "1290801748",
          "description": "MOTION to Withdraw as Attorney relative to Plaintiff Julenne Tucker by Adam Pritchard, Edward Robinson, Julenne Tucker. (Attachments: # 1 Affidavit Affirmation of Elmer Robert Keach, III# 2 Certificate of Service)(Keach, Elmer) (Entered: 11/04/2005)"
        },
        {
          "row_number": 289,
          "id": 8890039,
          "entry_number": "74",
          "date_filed": "2005-12-06T00:00:00-05:00",
          "attachments": null,
          "url": "https://www.courtlistener.com/docket/4680081/74/pritchard-v-the-county-of-erie/",
          "recap_pdf_url": "https://www.courtlistener.com/recap/gov.uscourts.nywd.51300/gov.uscourts.nywd.51300.74.0.pdf",
          "pacer_doc_id": "1290333162",
          "description": " ORDER OF MAGISTRATE JUDGE HUGH B. SCOTTORDERPlaintiffs' counsel's letter application of 11/30/2005 to file an attorney's affirmation under seal relative to their pending motion ( see Docket Nos 68, 70) is denied.  Plaintiffs' counsel may appeal this decision or withdraw the affirmation within five (5) business days of this Order.  Absent any action by plaintiffs' counsel, the Court Clerk is instructed to file the affirmation.  So Ordered.  Signed by Hon. Hugh B. Scott on 12/6/2005. (DRH)"
        },
        {
          "row_number": 299,
          "id": 8890050,
          "entry_number": "83",
          "date_filed": "2006-02-03T00:00:00-05:00",
          "attachments": null,
          "url": "https://www.courtlistener.com/docket/4680081/83/pritchard-v-the-county-of-erie/",
          "recap_pdf_url": null,
          "pacer_doc_id": null,
          "description": "TEXT Calendar Entry, Set Deadlines/Hearings:Class certification motion due 3/20/2006 (45 days from Order, Docket No. 82). (DRH) (Entered: 02/03/2006)"
        },
        {
          "row_number": 21,
          "id": 8890101,
          "entry_number": "119",
          "date_filed": "2006-06-14T00:00:00-04:00",
          "attachments": null,
          "url": "https://www.courtlistener.com/docket/4680081/119/pritchard-v-the-county-of-erie/",
          "recap_pdf_url": null,
          "pacer_doc_id": "1290893636",
          "description": "MOTION to Compel by Adam Pritchard, Edward Robinson. (Attachments: # 1 Affidavit Affirmation of Elmer Keach# 2 Exhibit Exhibit A to Keach Affirmation -- Plaintiffs' Discovery Requests# 3 Exhibit Exhibit B to Keach Affirmation -- Erie County Discovery Response# 4 Exhibit Exhibit C to Keach Affirmation -- Email not disclosed by Erie County# 5 Exhibit Exhibit D to Keach Affirmation -- Keach Affirmation, 02.16.06# 6 Exhibit Exhibit E to Keach Affirmation -- Domagalski Affidavit, 02.28.06# 7 Exhibit Exhibit F to Keach Affirmation -- Keach Affirmation, 03.07.06# 8 Exhibit Exhibit G to Keach Affirmation -- County Defendants' Proposed Confidentiality Order# 9 Exhibit Exhibit H to Keach Affirmation -- Email between LaDuca and Domagalski regarding confidentiality order# 10 Exhibit Exhibit I -- Inspection Memorandum# 11 Exhibit Exhibit J to Keach Affirmation -- Email correspondence between Erie County and NYS Sheriffs Association# 12 Exhibit Exhibit K to Keach Affirmation -- Email from Keach to Domagalksi and Gaglione regarding discovery issues# 13 Certificate of Service)(Keach, Elmer) (Entered: 06/14/2006)"
        },
        {
          "row_number": 23,
          "id": 8890102,
          "entry_number": "120",
          "date_filed": "2006-06-14T00:00:00-04:00",
          "attachments": null,
          "url": "https://www.courtlistener.com/docket/4680081/120/pritchard-v-the-county-of-erie/",
          "recap_pdf_url": null,
          "pacer_doc_id": "1290321038",
          "description": "Amended MOTION to Compel Corrected to Include a Complete Exhibit I by Adam Pritchard, Edward Robinson. (Attachments: # 1 Affidavit Affirmation of Elmer Keach# 2 Exhibit Exhibit A to Keach Affirmation -- Plaintiffs' Discovery Requests# 3 Exhibit Exhibit B to Keach Affirmation -- Erie County Discovery Responses# 4 Exhibit Exhibit C to Keach Affirmation -- Email not disclosed by Erie County# 5 Exhibit Exhibit D to Keach Affirmation -- Keach Affirmation, 02.16.06# 6 Exhibit Exhibit E to Keach Affirmation -- Domagalski Affidavit, 02.28.06# 7 Exhibit Exhibit F to Keach Affirmation -- Keach Affirmation, 03.07.06# 8 Exhibit Exhibit G to Keach Affirmation -- County Defendants' Proposed Confidentiality Order# 9 Exhibit Exhibit H to Keach Affirmation -- Email between LaDuca and Domalgalski regarding confidentiality order# 10 Exhibit Exhibit I to Keach Affirmation -- Inspection Memorandum# 11 Exhibit Exhibit J to Keach Affirmation -- Email correspondence between Erie County and NYS Sheriffs Association# 12 Exhibit Exhibit K to Keach Affirmation -- Email from Keach to Domagalski and Gaglione regarding discovery issues# 13 Certificate of Service)(Keach, Elmer) (Entered: 06/14/2006)"
        },
        {
          "row_number": 24,
          "id": 8890103,
          "entry_number": "121",
          "date_filed": "2006-06-15T00:00:00-04:00",
          "attachments": null,
          "url": "https://www.courtlistener.com/docket/4680081/121/pritchard-v-the-county-of-erie/",
          "recap_pdf_url": null,
          "pacer_doc_id": null,
          "description": "ORDER OF MAGISTRATE JUDGE HUGH B. SCOTTTEXT OF ORDER re 120 Amended MOTION to Compel Corrected to Include a Complete Exhibit I filed by Adam Pritchard, Edward Robinson Responses due by 6/21/2006, and motion deemed submitted, without further reply or oral argument, on 6/21/2006, to be considered together with County Defendants' pending motion (Docket Nos. 116, 118).Parties are reminded of this Chambers' requirement that a courtesy copy of moving papers must be submitted to the Chambers of the undersigned and, given the short briefing schedule, such submissions should be made as soon as possible.So Ordered. Signed by Hon. Hugh B. Scott on 6/15/2006. (DRH) (Entered: 06/15/2006)"
        },
        {
          "row_number": 370,
          "id": 8890110,
          "entry_number": null,
          "date_filed": "2006-06-21T00:00:00-04:00",
          "attachments": null,
          "url": "https://www.courtlistener.com",
          "recap_pdf_url": null,
          "pacer_doc_id": null,
          "description": "E-Filing Notification: 124 AFFIRMATION signed by James P. Domagalski, Esq. **Document filed without proof of service** (DZ, )"
        },
        {
          "row_number": 377,
          "id": 8890158,
          "entry_number": null,
          "date_filed": "2007-01-24T00:00:00-05:00",
          "attachments": null,
          "url": "https://www.courtlistener.com",
          "recap_pdf_url": null,
          "pacer_doc_id": null,
          "description": "Motions No Longer Referred"
        },
        {
          "row_number": 87,
          "id": 8890171,
          "entry_number": "179",
          "date_filed": "2007-02-06T00:00:00-05:00",
          "attachments": null,
          "url": "https://www.courtlistener.com/docket/4680081/179/pritchard-v-the-county-of-erie/",
          "recap_pdf_url": null,
          "pacer_doc_id": "1290423531",
          "description": "Letter from James P. Domagalski, Esq., dated 02/05/2007, to Hon. John T. Curtin regarding further extension of time. (JEC) (Entered: 02/06/2007)"
        },
        {
          "row_number": 89,
          "id": 8890172,
          "entry_number": "180",
          "date_filed": "2007-02-07T00:00:00-05:00",
          "attachments": null,
          "url": "https://www.courtlistener.com/docket/4680081/180/pritchard-v-the-county-of-erie/",
          "recap_pdf_url": null,
          "pacer_doc_id": "1290424604",
          "description": "Letter from Thomas C. D'Agostino, Esq., dated 02/07/2007, to Hon. John T. Curtin re further extension of time. (JEC) (Entered: 02/07/2007)"
        },
        {
          "row_number": 94,
          "id": 8890177,
          "entry_number": "185",
          "date_filed": "2007-03-19T00:00:00-04:00",
          "attachments": null,
          "url": "https://www.courtlistener.com/docket/4680081/185/pritchard-v-the-county-of-erie/",
          "recap_pdf_url": null,
          "pacer_doc_id": "1290444692",
          "description": "MEMORANDUM IN OPPOSITION re 183 Order,,, Set Deadlines/Hearings,,, 184 Order,, Defendant H. McCarthy Gipson's Supplemental Memorandum of Law by H. McCarthy Gibson. (Boron, Eric) (Entered: 03/19/2007)"
        },
        {
          "row_number": 95,
          "id": 8890178,
          "entry_number": "186",
          "date_filed": "2007-03-19T00:00:00-04:00",
          "attachments": null,
          "url": "https://www.courtlistener.com/docket/4680081/186/pritchard-v-the-county-of-erie/",
          "recap_pdf_url": null,
          "pacer_doc_id": "1290949683",
          "description": "MEMORANDUM/BRIEF re 183 Order,,, Set Deadlines/Hearings,,, 184 Order,, by Timothy. Howard, Donald J. Livingston, Robert Huggins, The County of Erie, Patrick M. Gallivan. (Domagalski, James) (Entered: 03/19/2007)"
        },
        {
          "row_number": 116,
          "id": 8890206,
          "entry_number": "204",
          "date_filed": "2007-07-16T00:00:00-04:00",
          "attachments": null,
          "url": "https://www.courtlistener.com/docket/4680081/204/pritchard-v-the-county-of-erie/",
          "recap_pdf_url": null,
          "pacer_doc_id": "12901054586",
          "description": "AFFIDAVIT Affirmation of Eric T.Boron in Opposition re 200 MOTION for Reconsideration re 199 Order, Set Deadlines/Hearings MOTION for Reconsideration re 199 Order, Set Deadlines/Hearings with Certificate of Service filed by H. McCarthy Gibson. (Boron, Eric) (Entered: 07/16/2007)"
        },
        {
          "row_number": 117,
          "id": 8890207,
          "entry_number": "205",
          "date_filed": "2007-07-16T00:00:00-04:00",
          "attachments": null,
          "url": "https://www.courtlistener.com/docket/4680081/205/pritchard-v-the-county-of-erie/",
          "recap_pdf_url": null,
          "pacer_doc_id": "1290536436",
          "description": "MEMORANDUM in Opposition re 200 MOTION for Reconsideration re 199 Order, Set Deadlines/Hearings MOTION for Reconsideration re 199 Order, Set Deadlines/Hearings with Certificate of Service filed by H. McCarthy Gibson. (Boron, Eric) (Entered: 07/16/2007)"
        },
        {
          "row_number": 120,
          "id": 8890210,
          "entry_number": "208",
          "date_filed": "2007-08-01T00:00:00-04:00",
          "attachments": null,
          "url": "https://www.courtlistener.com/docket/4680081/208/pritchard-v-the-county-of-erie/",
          "recap_pdf_url": null,
          "pacer_doc_id": "1290416781",
          "description": "ORDER granting 206 Motion of Nicholas A. Migliaccio, Esq., for Leave to Appear Pro Hac Vice in this case. Signed by Judge John T. Curtin on 08/01/2007. (JEC) (Entered: 08/01/2007)"
        },
        {
          "row_number": 389,
          "id": 8890211,
          "entry_number": null,
          "date_filed": "2007-08-07T00:00:00-04:00",
          "attachments": null,
          "url": "https://www.courtlistener.com",
          "recap_pdf_url": null,
          "pacer_doc_id": null,
          "description": "Filing Fee Received"
        },
        {
          "row_number": 390,
          "id": 8890212,
          "entry_number": null,
          "date_filed": "2007-08-07T00:00:00-04:00",
          "attachments": null,
          "url": "https://www.courtlistener.com",
          "recap_pdf_url": null,
          "pacer_doc_id": null,
          "description": "Filing fee: $ 75, receipt number 4032, pro hac vice filing fee from Nicholas Migliaccio counsel for plaintiffs (JDK)"
        },
        {
          "row_number": 394,
          "id": 8890216,
          "entry_number": null,
          "date_filed": "2007-10-23T00:00:00-04:00",
          "attachments": null,
          "url": "https://www.courtlistener.com",
          "recap_pdf_url": null,
          "pacer_doc_id": null,
          "description": "NOTICE OF HEARING ON MOTION: ORAL ARGUMENT ON MOTION FOR RECONSIDERATION, originally scheduled for 10/29/2007, is adjourned until 10/30/2007 at 10 a.m. before Hon. John T. Curtin. (JEC)"
        },
        {
          "row_number": 121,
          "id": 8890217,
          "entry_number": "209",
          "date_filed": "2007-10-30T00:00:00-04:00",
          "attachments": null,
          "url": "https://www.courtlistener.com/docket/4680081/209/pritchard-v-the-county-of-erie/",
          "recap_pdf_url": null,
          "pacer_doc_id": null,
          "description": "Minute Entry for proceedings held before Judge John T. Curtin: Oral Argument held on 10/30/2007 on 200 MOTION for Reconsideration. Motion submitted. Appearances: Elmer Robert Keach for Plaintiff; James Domagalski and Eric Boron for Defendants. Court time: 10:20 - 11:20 a.m. (Janet Curry, Electronic Court Recorder Operator.) (JEC) (Entered: 10/31/2007)"
        },
        {
          "row_number": 129,
          "id": 8890226,
          "entry_number": "216",
          "date_filed": "2007-12-21T00:00:00-05:00",
          "attachments": null,
          "url": "https://www.courtlistener.com/docket/4680081/216/pritchard-v-the-county-of-erie/",
          "recap_pdf_url": null,
          "pacer_doc_id": "12901060699",
          "description": "AFFIRMATION signed by Elmer Robert Keach, III re 212 Affirmation, 210 Order on Motion for Reconsideration, 211 Affirmation, filed by Adam Pritchard, Edward Robinson. (Attachments: # 1 Exhibit A -- Plaintiffs' First Demand for Production of Documents# 2 Exhibit B -- Plaintiffs' Second Demand for Production of Documents# 3 Exhibit C -- Email Originally Produced by Erie County# 4 Exhibit D -- Def. Gipson response to Demand for Documents# 5 Exhibit E -- Gipson Email, 12.31.03# 6 Exhibit F -- Livingston Email, May 1, 2003# 7 Exhibit G -- Gipson Email, 3.20.2003# 8 Exhibit H -- Letter from Keach to Domagalski, 11.7.2005# 9 Exhibit I --- Letter from Domagalski to Keach, 11.14.2005# 10 Exhibit J -- Order of Honorable Hugh Scott, 6.26.2006# 11 Exhibit K, part 1 -- Howard Deposition, pp. 1-34# 12 Exhibit K, part 2 -- Howard Dep., pp. 35-73# 13 Exhibit K, Part 3 -- Howard Dep., pp. 74-95# 14 Exhibit L -- Gipson 4.6.06 Deposition# 15 Exhibit M, Part 1 -- Usinski Dep., pp. 1-50# 16 Exhibit M, part 2 -- Usinski Dep. pp. 51-100)(Keach, Elmer) (Entered: 12/21/2007)"
        },
        {
          "row_number": 131,
          "id": 8890228,
          "entry_number": "218",
          "date_filed": "2008-01-11T00:00:00-05:00",
          "attachments": null,
          "url": "https://www.courtlistener.com/docket/4680081/218/pritchard-v-the-county-of-erie/",
          "recap_pdf_url": null,
          "pacer_doc_id": "12901067517",
          "description": "CONTINUATION OF EXHIBITS to 211 Affirmation, Complete and Corrected Copy of Exhibits A to D. (Domagalski, James) (Entered: 01/11/2008)"
        },
        {
          "row_number": 397,
          "id": 8890229,
          "entry_number": null,
          "date_filed": "2008-01-15T00:00:00-05:00",
          "attachments": null,
          "url": "https://www.courtlistener.com",
          "recap_pdf_url": null,
          "pacer_doc_id": null,
          "description": "E-Filing Notification"
        },
        {
          "row_number": 134,
          "id": 8890232,
          "entry_number": "220",
          "date_filed": "2009-06-02T00:00:00-04:00",
          "attachments": null,
          "url": "https://www.courtlistener.com/docket/4680081/220/pritchard-v-the-county-of-erie/",
          "recap_pdf_url": null,
          "pacer_doc_id": "12901472382",
          "description": "NOTICE of Appearance by Bethany B. Schumann-McGhee on behalf of all plaintiffs (Schumann-McGhee, Bethany) (Entered: 06/02/2009)"
        },
        {
          "row_number": 400,
          "id": 8890235,
          "entry_number": null,
          "date_filed": "2009-06-05T00:00:00-04:00",
          "attachments": null,
          "url": "https://www.courtlistener.com",
          "recap_pdf_url": null,
          "pacer_doc_id": null,
          "description": "NOTICE of Hearing: Status Conference set for 6/29/2009 at 10:30 a.m. before Hon. John T. Curtin. The court will initiate the call.(JEC)"
        },
        {
          "row_number": 402,
          "id": 8890238,
          "entry_number": null,
          "date_filed": "2009-06-08T00:00:00-04:00",
          "attachments": null,
          "url": "https://www.courtlistener.com",
          "recap_pdf_url": null,
          "pacer_doc_id": null,
          "description": "Confirmed Admission to the Maryland State Bar for Brendan S. Thompson (SG)"
        },
        {
          "row_number": 141,
          "id": 8890245,
          "entry_number": "227",
          "date_filed": "2009-07-07T00:00:00-04:00",
          "attachments": null,
          "url": "https://www.courtlistener.com/docket/4680081/227/pritchard-v-the-county-of-erie/",
          "recap_pdf_url": null,
          "pacer_doc_id": "12901501855",
          "description": "Letter from James P. Domagalski, Esq., dated 7/7/2009, to Hon. John T. Curtin in response to 225 Letter of Elmer Robert Keach III, Esq. dated 6/30/2009. (JEC) (Entered: 07/07/2009)"
        },
        {
          "row_number": 405,
          "id": 8890252,
          "entry_number": null,
          "date_filed": "2009-08-27T00:00:00-04:00",
          "attachments": null,
          "url": "https://www.courtlistener.com",
          "recap_pdf_url": null,
          "pacer_doc_id": null,
          "description": "Set/Reset Deadlines"
        },
        {
          "row_number": 149,
          "id": 8890253,
          "entry_number": "234",
          "date_filed": "2009-08-27T00:00:00-04:00",
          "attachments": null,
          "url": "https://www.courtlistener.com/docket/4680081/234/pritchard-v-the-county-of-erie/",
          "recap_pdf_url": null,
          "pacer_doc_id": null,
          "description": "TEXT ORDER: The Plaintiffs' 233 Letter Request for a four-day extension of time in which to file their Motion for Class Certification is granted. Therefore, the time for Plaintiffs to file such Motion is extended until 9/1/2009. Likewise, the time for Defendants to file a Response to the Motion is extended until 10/16/2009, and the time for Plaintiffs to file a Reply is extended until 10/30/2009. Signed by Hon. John T. Curtin on 8/27/2009. (JEC) (Entered: 08/27/2009)"
        },
        {
          "row_number": 413,
          "id": 8890285,
          "entry_number": null,
          "date_filed": "2009-11-30T00:00:00-05:00",
          "attachments": null,
          "url": "https://www.courtlistener.com",
          "recap_pdf_url": null,
          "pacer_doc_id": null,
          "description": "Notice of Hearing on Motion"
        },
        {
          "row_number": 414,
          "id": 8890286,
          "entry_number": null,
          "date_filed": "2009-11-30T00:00:00-05:00",
          "attachments": null,
          "url": "https://www.courtlistener.com",
          "recap_pdf_url": null,
          "pacer_doc_id": null,
          "description": "NOTICE of Hearing on Motion-- 235 MOTION to Certify Class: At the request of Plaintiffs' Counsel, and there being no objection from Defense Counsel, ORAL ARGUMENT scheduled in this case for 12/17/2009 is hereby rescheduled to 12/15/2009 at 10:30 a.m. (JEC)"
        },
        {
          "row_number": 415,
          "id": 8890287,
          "entry_number": null,
          "date_filed": "2009-12-07T00:00:00-05:00",
          "attachments": null,
          "url": "https://www.courtlistener.com",
          "recap_pdf_url": null,
          "pacer_doc_id": null,
          "description": "Notice (Other)"
        },
        {
          "row_number": 416,
          "id": 8890288,
          "entry_number": null,
          "date_filed": "2009-12-07T00:00:00-05:00",
          "attachments": null,
          "url": "https://www.courtlistener.com",
          "recap_pdf_url": null,
          "pacer_doc_id": null,
          "description": "TAKE NOTICE THAT the ORAL ARGUMENT currently scheduled for 12/15/2009 is adjourned generally. The court will notify counsel of a new schedule in the near future. (JEC)"
        },
        {
          "row_number": 176,
          "id": 8890289,
          "entry_number": "259",
          "date_filed": "2010-01-28T00:00:00-05:00",
          "attachments": null,
          "url": "https://www.courtlistener.com/docket/4680081/259/pritchard-v-the-county-of-erie/",
          "recap_pdf_url": null,
          "pacer_doc_id": null,
          "description": "TEXT ORDER transferring case to Hon. Richard J. Arcara. Signed by Hon. Richard J. Arcara on 1/28/2010. (JMB) (Entered: 01/28/2010)"
        },
        {
          "row_number": 417,
          "id": 8890290,
          "entry_number": null,
          "date_filed": "2010-01-28T00:00:00-05:00",
          "attachments": null,
          "url": "https://www.courtlistener.com",
          "recap_pdf_url": null,
          "pacer_doc_id": null,
          "description": "Add and Terminate Judges"
        },
        {
          "row_number": 418,
          "id": 8890291,
          "entry_number": null,
          "date_filed": "2010-01-28T00:00:00-05:00",
          "attachments": null,
          "url": "https://www.courtlistener.com",
          "recap_pdf_url": null,
          "pacer_doc_id": null,
          "description": "Set Hearings"
        },
        {
          "row_number": 419,
          "id": 8890292,
          "entry_number": null,
          "date_filed": "2010-01-28T00:00:00-05:00",
          "attachments": null,
          "url": "https://www.courtlistener.com",
          "recap_pdf_url": null,
          "pacer_doc_id": null,
          "description": "Hon. Richard J. Arcara added. Hon. John T. Curtin no longer assigned to case. (JMB)"
        },
        {
          "row_number": 422,
          "id": 8890295,
          "entry_number": null,
          "date_filed": "2010-01-28T00:00:00-05:00",
          "attachments": null,
          "url": "https://www.courtlistener.com",
          "recap_pdf_url": null,
          "pacer_doc_id": null,
          "description": "E-Filing Notification: Correction: Status Conference set for 2/5/2010 09:00 AM before Hon. Richard J. Arcara.. Signed by Hon. Richard J. Arcara on 1/28/2010. (JMB) Modified on 1/28/2010 (JMB). (JMB)"
        },
        {
          "row_number": 429,
          "id": 8890304,
          "entry_number": null,
          "date_filed": "2010-04-06T00:00:00-04:00",
          "attachments": null,
          "url": "https://www.courtlistener.com",
          "recap_pdf_url": null,
          "pacer_doc_id": null,
          "description": "E-Filing Notification No Proof Of Service"
        },
        {
          "row_number": 430,
          "id": 8890305,
          "entry_number": null,
          "date_filed": "2010-04-06T00:00:00-04:00",
          "attachments": null,
          "url": "https://www.courtlistener.com",
          "recap_pdf_url": null,
          "pacer_doc_id": null,
          "description": "E-Filing Notification: No proof of service. Action required: File proof of service 261 STATUS REPORT Providing Supplement Submission on Proposed Class Definition by Adam Pritchard, Edward Robinson. (Keach, Elmer) (DR)"
        },
        {
          "row_number": 437,
          "id": 8890325,
          "entry_number": null,
          "date_filed": "2011-04-19T00:00:00-04:00",
          "attachments": null,
          "url": "https://www.courtlistener.com",
          "recap_pdf_url": null,
          "pacer_doc_id": null,
          "description": "Status Conference"
        },
        {
          "row_number": 240,
          "id": 8890380,
          "entry_number": "316",
          "date_filed": "2017-11-08T00:00:00-05:00",
          "attachments": null,
          "url": "https://www.courtlistener.com/docket/4680081/316/pritchard-v-the-county-of-erie/",
          "recap_pdf_url": null,
          "pacer_doc_id": "12904023063",
          "description": "RESPONSE in Opposition re 315 MOTION to Dismiss Motion for Voluntary Dismissal and for Decertification of Class, with Affidavit in Support Also Addressing Docket Number 311, Pursuant to the Direction of the Court filed by Patrick M. Gallivan, Timothy. Howard, Robert Huggins, Donald J. Livingston, The County of Erie. (Attachments: # 1 Certificate of Service)(Domagalski, James) (Entered: 11/08/2017)"
        },
        {
          "row_number": 241,
          "id": 8890381,
          "entry_number": "317",
          "date_filed": "2018-02-23T00:00:00-05:00",
          "attachments": null,
          "url": "https://www.courtlistener.com/docket/4680081/317/pritchard-v-the-county-of-erie/",
          "recap_pdf_url": "https://www.courtlistener.com/recap/gov.uscourts.nywd.51300/gov.uscourts.nywd.51300.317.0.pdf",
          "pacer_doc_id": "12904122450",
          "description": " DECISION AND ORDER:   For the reasons stated in the attached Decision and Order, the pending motions in the case are resolved as follows: 1) The Plaintiffs' motion to decertify the class  315 ) is granted; (2) The Plaintiffs' motion for vol untary discontinuance  315  is denied; (3) The Plaintiffs' motion to amend  303  is denied; and (4) The Defendants' motion for summary judgment  301  is granted to the extent it seeks judgment against Plaintiffs Adam Pritchard and Edward Ro binson. To the extent the Defendants seek summary judgment against former-Plaintiff Juleen Tucker, or against any member of the now-decertified class, that motion is denied as moot. As to Plaintiffs Adam Pritchard and Edward Robinson, the Clerk of Co urt shall enter judgment in favor of Defendants The County of Erie; Patrick M. Gallivan, in both his individual and official capacities; Timothy Howard, in both his individual and official capacities; Donald Livingston, in both his individual and off icial capacities; Robert G. Huggins, in both his individual and official capacities; and H. McCarthy Gibson, in both his individual and official capacities.  The Clerk of Court shall take all steps necessary to close this case. SO ORDERED.  Signed by Hon. Richard J. Arcara on 2/22/18. (LAS)-CLERK TO FOLLOW UP-"
        },
        {
          "row_number": 326,
          "id": 8889949,
          "entry_number": null,
          "date_filed": "2005-01-31T00:00:00-05:00",
          "attachments": [],
          "url": "https://www.courtlistener.com",
          "recap_pdf_url": null,
          "pacer_doc_id": null,
          "description": "E-Filing Notification: 8 STATUS REPORT (Keach, Elmer) **Reminder that letters are not to be e-filed unless directed to do so by the Court** (DZ, )"
        },
        {
          "row_number": 12,
          "id": 8889952,
          "entry_number": "11",
          "date_filed": "2005-02-11T00:00:00-05:00",
          "attachments": [],
          "url": "https://www.courtlistener.com/docket/4680081/11/pritchard-v-the-county-of-erie/",
          "recap_pdf_url": null,
          "pacer_doc_id": "12905812",
          "description": "NOTICE of Appearance by Michael C. Driscoll on behalf of Timothy. Howard, Donald J. Livingston, Robert Huggins, Patrick M. Gallivan, Timothy. Howard, Robert Huggins, Donald J. Livingston, The County of Erie, Patrick M. Gallivan, Timothy. Howard, Robert Huggins, Donald J. Livingston, The County of Erie, The County of Erie, Patrick M. Gallivan (Driscoll, Michael) (Entered: 02/11/2005)"
        },
        {
          "row_number": 177,
          "id": 8889973,
          "entry_number": "26",
          "date_filed": "2005-08-12T00:00:00-04:00",
          "attachments": [],
          "url": "https://www.courtlistener.com/docket/4680081/26/pritchard-v-the-county-of-erie/",
          "recap_pdf_url": null,
          "pacer_doc_id": "1290231299",
          "description": "CERTIFICATE OF SERVICE by H. McCarthy Gibson re 23 Affidavit (D'Agostino, Thomas) (Entered: 08/12/2005)"
        },
        {
          "row_number": 337,
          "id": 8889985,
          "entry_number": null,
          "date_filed": "2005-08-18T00:00:00-04:00",
          "attachments": [],
          "url": "https://www.courtlistener.com",
          "recap_pdf_url": null,
          "pacer_doc_id": null,
          "description": "Remark"
        },
        {
          "row_number": 339,
          "id": 8889992,
          "entry_number": null,
          "date_filed": "2005-08-22T00:00:00-04:00",
          "attachments": [],
          "url": "https://www.courtlistener.com",
          "recap_pdf_url": null,
          "pacer_doc_id": null,
          "description": "E-Filing Notification"
        },
        {
          "row_number": 298,
          "id": 8890049,
          "entry_number": "82",
          "date_filed": "2006-02-02T00:00:00-05:00",
          "attachments": null,
          "url": "https://www.courtlistener.com/docket/4680081/82/pritchard-v-the-county-of-erie/",
          "recap_pdf_url": null,
          "pacer_doc_id": null,
          "description": "ORDER OF MAGISTRATE JUDGE HUGH B. SCOTT Order re: Request for Extension of Time to File Class Certification MotionThe plaintiffs have requested an extension of time to file a motion for class certification. The request is granted to the extent that the plaintiffs shall have 45 days, from the date of this Order, to file the motion for class certification. So Ordered. Signed by Hon. Hugh B. Scott on 2/2/06. (JRA) (Entered: 02/02/2006)"
        },
        {
          "row_number": 393,
          "id": 8890215,
          "entry_number": null,
          "date_filed": "2007-10-23T00:00:00-04:00",
          "attachments": null,
          "url": "https://www.courtlistener.com",
          "recap_pdf_url": null,
          "pacer_doc_id": null,
          "description": "Notice of Hearing on Motion"
        },
        {
          "row_number": 328,
          "id": 8889962,
          "entry_number": null,
          "date_filed": "2005-07-28T00:00:00-04:00",
          "attachments": [],
          "url": "https://www.courtlistener.com",
          "recap_pdf_url": null,
          "pacer_doc_id": null,
          "description": "Test entry for technical reasons (DZ, )"
        },
        {
          "row_number": 122,
          "id": 8889964,
          "entry_number": "21",
          "date_filed": "2005-08-03T00:00:00-04:00",
          "attachments": [],
          "url": "https://www.courtlistener.com/docket/4680081/21/pritchard-v-the-county-of-erie/",
          "recap_pdf_url": null,
          "pacer_doc_id": null,
          "description": "HONORABLE HUGH B. SCOTTTEXT OF MINUTE ENTRYFor proceedings held before Magistrate Judge Hugh B. Scott:Elmer R. Keach, Esq., for plaintiffs; Frank Gaglione, Esq., James Domagalski, Esq., Thomas D'Agostino, Esq., Assistant County Attorney Kristin Klein Wheaton, for defendants.Status Conference held on 8/3/2005. Parties discussed status of discovery relative to class certification motion and plaintiffs' desire to extend deadline for class certification as well as their intention to move to compel disclosure. Schedule for defendants' pending motion to compel 16 was also discussed. Plaintiffs stated that claims remain against defendant Gallivan in his individual capacity. Plaintiffs complained about the conduct of depositions, and defendants complained about ex parte communication by plaintiffs' investigator with Erie County Sheriff's deputies (an investigator who was serving subpoenaes upon the deputies). Plaintiffs finally complained that they have not received correspondence sent by defense counsel to the Court. Defendants finally mentioned scheduling issues in the ongoing depositions of defendants' staff.The Court admonished counsel to make motions to seek redress raised in this conference and in correspondence leading to this conference. Any such motions are due by 8/10/2005. The Court then will issue a scheduling Order for briefing of those motions, including a schedule for defendants' motion to compel 16 . The class certification motion deadline remains as schedule absent an motion or stipulation requesting a change.All counsel for the parties who have not filed formal notices of appearance (including registration with ECF) must do so in order to receive notices from the Court. (DRH) (Entered: 08/03/2005)"
        },
        {
          "row_number": 323,
          "id": 8889942,
          "entry_number": null,
          "date_filed": "2004-10-21T00:00:00-04:00",
          "attachments": [],
          "url": "https://www.courtlistener.com",
          "recap_pdf_url": null,
          "pacer_doc_id": null,
          "description": "Notice (Other)"
        },
        {
          "row_number": 33,
          "id": 8889954,
          "entry_number": "13",
          "date_filed": "2005-02-23T00:00:00-05:00",
          "attachments": [],
          "url": "https://www.courtlistener.com/docket/4680081/13/pritchard-v-the-county-of-erie/",
          "recap_pdf_url": null,
          "pacer_doc_id": "129032370",
          "description": "ORDER OF MAGISTRATE JUDGE HUGH B. SCOTTSCHEDULING ORDER:Join Parties/Amend Pleadings due by 6/1/2005. Discovery related to class certification due by 8/23/2005. Motion for class certification due by 8/23/2005. Responses to this motion due by 9/23/2005. Reply to this motion, if any, due by 9/30/2005. Court then determine if oral argument is necessary.Initial Settlement Conference set for 9/8/2005, 11:00 AM, before Hon. Hugh B. Scott. Motions to Compel Fact Discovery due by 3/3/2006. Fact Discovery due by 4/6/2006. Plaintiff Expert Witness ID due by 5/1/2006. Defendant Expert Witness ID due by 6/15/2006. All discovery, including expert, due by 7/3/2006. Further Pretrial Conference set for 7/11/2006, 10:00 AM, before Hon. Hugh B. Scott. Motions due by 8/15/2006. Signed by Hon. Hugh B. Scott on 2/23/2005. (DRH) (Entered: 02/23/2005)"
        },
        {
          "row_number": 242,
          "id": 10196721,
          "entry_number": "318",
          "date_filed": "2018-02-27T00:00:00-05:00",
          "attachments": null,
          "url": "https://www.courtlistener.com/docket/4680081/318/pritchard-v-the-county-of-erie/",
          "recap_pdf_url": "https://www.courtlistener.com/recap/gov.uscourts.nywd.51300/gov.uscourts.nywd.51300.318.0.pdf",
          "pacer_doc_id": "12904125039",
          "description": "JUDGMENT in favor of The County of Erie, Donald J. Livingston, H. McCarthy Gibson, Patrick M. Gallivan, Robert Huggins, Timothy Howard against Adam Pritchard, Edward Robinson. Signed by Mary C. Loewenguth, Clerk of Court on 2/27/2018. (KM) (Entered: 02/27/2018)"
        },
        {
          "row_number": 269,
          "id": 8890015,
          "entry_number": "56",
          "date_filed": "2005-10-11T00:00:00-04:00",
          "attachments": [],
          "url": "https://www.courtlistener.com/docket/4680081/56/pritchard-v-the-county-of-erie/",
          "recap_pdf_url": "https://www.courtlistener.com/recap/gov.uscourts.nywd.51300/gov.uscourts.nywd.51300.56.0.pdf",
          "pacer_doc_id": "1290794772",
          "description": " ORDER OF MAGISTRATE JUDGE HUGH B. SCOTTORDER re  55  Stipulation filed by Adam Pritchard, Edward Robinson, Julenne TuckerThe Court declines to enter an Order adopting counsels' stipulation (Docket No. 55).  Parties shall submit to the Court their respective motion costs.  These Motions due by 10/21/2005. Responses to those submissions due by 10/28/2005.  So Ordered.  Signed by Hon. Hugh B. Scott on 10/11/2005. (DRH)"
        },
        {
          "row_number": 333,
          "id": 8889974,
          "entry_number": null,
          "date_filed": "2005-08-12T00:00:00-04:00",
          "attachments": [],
          "url": "https://www.courtlistener.com",
          "recap_pdf_url": null,
          "pacer_doc_id": null,
          "description": "E-Filing Notification"
        },
        {
          "row_number": 258,
          "id": 8890004,
          "entry_number": "46",
          "date_filed": "2005-09-01T00:00:00-04:00",
          "attachments": [],
          "url": "https://www.courtlistener.com/docket/4680081/46/pritchard-v-the-county-of-erie/",
          "recap_pdf_url": null,
          "pacer_doc_id": "1290184624",
          "description": "CERTIFICATE OF SERVICE by The County of Erie re 45 Reply/Response, (Domagalski, James) (Entered: 09/01/2005)"
        },
        {
          "row_number": 349,
          "id": 8890032,
          "entry_number": null,
          "date_filed": "2005-11-04T00:00:00-05:00",
          "attachments": null,
          "url": "https://www.courtlistener.com",
          "recap_pdf_url": null,
          "pacer_doc_id": null,
          "description": "E-Filing Notification"
        },
        {
          "row_number": 350,
          "id": 8890033,
          "entry_number": null,
          "date_filed": "2005-11-04T00:00:00-05:00",
          "attachments": null,
          "url": "https://www.courtlistener.com",
          "recap_pdf_url": null,
          "pacer_doc_id": null,
          "description": "E-Filing Error: 68 MOTION to Withdraw as Attorney (Keach, Elmer) **document to be refiled in its entirety as the Affirmation is not signed** (DZ, )"
        },
        {
          "row_number": 283,
          "id": 8890034,
          "entry_number": "69",
          "date_filed": "2005-11-07T00:00:00-05:00",
          "attachments": null,
          "url": "https://www.courtlistener.com/docket/4680081/69/pritchard-v-the-county-of-erie/",
          "recap_pdf_url": null,
          "pacer_doc_id": "1290309428",
          "description": "ORDER OF MAGISTRATE JUDGE HUGH B. SCOTTNOTICE on Motion 68 MOTION to Withdraw as Attorney relative to Plaintiff Julenne Tucker:Responses due by 11/28/2005; Replies due by 12/12/2005. Motion then deemed submitted without oral argument unless otherwise determined by the Court upon review of the papers. Plaintiffs' counsel to forward a copy of this Order to plaintiff Tucker and to verify to the Court the address used to serve Tucker.(DRH) (Entered: 11/07/2005)"
        },
        {
          "row_number": 285,
          "id": 8890035,
          "entry_number": "70",
          "date_filed": "2005-11-10T00:00:00-05:00",
          "attachments": null,
          "url": "https://www.courtlistener.com/docket/4680081/70/pritchard-v-the-county-of-erie/",
          "recap_pdf_url": null,
          "pacer_doc_id": "1290185378",
          "description": "Amended MOTION to Withdraw as Attorney and for Discontinuance of Individual Claims of Julenne Tucker, Corrected Pursuant to Instructions of Clerk's Office by Adam Pritchard, Edward Robinson, Julenne Tucker. (Attachments: # 1 Affidavit Affidavit of Elmer Keach# 2 Certificate of Service Certificate of Service, amended to reflect address and documents served on Plaintiff Tucker)(Keach, Elmer) (Entered: 11/10/2005)"
        },
        {
          "row_number": 286,
          "id": 8890036,
          "entry_number": "71",
          "date_filed": "2005-11-14T00:00:00-05:00",
          "attachments": null,
          "url": "https://www.courtlistener.com/docket/4680081/71/pritchard-v-the-county-of-erie/",
          "recap_pdf_url": "https://www.courtlistener.com/recap/gov.uscourts.nywd.51300/gov.uscourts.nywd.51300.71.0.pdf",
          "pacer_doc_id": "1290302216",
          "description": " ORDER OF MAGISTRATE JUDGE HUGH B. SCOTTORDER re  52  Order on Motion to Compel, Order on Motion for Protective Order,  56  Order, Set Deadlines,  58  Terminate Hearings, Status Conference,  59  Affirmation filed  by H. McCarthy Gipson,  60  Affidavit filed by The County of Erie,  62  Affirmation, filed by Adam Pritchard, Edward Robinson, Julenne TuckerThe Court finds that each movant or opponent to the discovery motions was substantially justi fied in their respective position.  Alternatively, under Fed. R. Civ. P. 37(a)(4)(C), the Court determines that each party should bear its own motion costs relative to their respective discovery motions.  So Ordered.  Signed by Hon. Hugh B. Scott on 11/14/2005. (DRH)"
        },
        {
          "row_number": 287,
          "id": 8890037,
          "entry_number": "72",
          "date_filed": "2005-11-28T00:00:00-05:00",
          "attachments": null,
          "url": "https://www.courtlistener.com/docket/4680081/72/pritchard-v-the-county-of-erie/",
          "recap_pdf_url": null,
          "pacer_doc_id": "129067041",
          "description": "AFFIRMATION signed by James P. Domagalski re 70 Amended MOTION to Withdraw as Attorney and for Discontinuance of Individual Claims of Julenne Tucker, Corrected Pursuant to Instructions of Clerk's Office, 68 MOTION to Withdraw as Attorney relative to Plaintiff Julenne Tucker filed by The County of Erie, The County of Erie in response to Julenne Tucker's motion filed by The County of Erie, The County of Erie. (Domagalski, James) (Entered: 11/28/2005)"
        },
        {
          "row_number": 288,
          "id": 8890038,
          "entry_number": "73",
          "date_filed": "2005-11-28T00:00:00-05:00",
          "attachments": null,
          "url": "https://www.courtlistener.com/docket/4680081/73/pritchard-v-the-county-of-erie/",
          "recap_pdf_url": null,
          "pacer_doc_id": "1290780916",
          "description": "CERTIFICATE OF SERVICE by The County of Erie re 72 Affirmation, (Domagalski, James) (Entered: 11/28/2005)"
        },
        {
          "row_number": 290,
          "id": 8890040,
          "entry_number": "75",
          "date_filed": "2005-12-12T00:00:00-05:00",
          "attachments": null,
          "url": "https://www.courtlistener.com/docket/4680081/75/pritchard-v-the-county-of-erie/",
          "recap_pdf_url": null,
          "pacer_doc_id": null,
          "description": "ORDER OF MAGISTRATE JUDGE HUGH B. SCOTTTEXT OF ORDER Parties have jointly requested an extension of the final deadline for class certification motion (see Docket No. 52), from 12/20/2005 to 2/3/2006, and an extension of class certification-related discovery (see Docket No. 13) from 8/23/2005 to some unspecified time (note, regular fact discovery deadline is 4/6/2006). The parties note that additional documents were found and produced to plaintiffs that may require further discovery including reopening depositions. This joint request is granted; motion for class certification is due Fri., 2/3/2006, class certification-related discovery shall conclude by Mon., 1/30/2006. So Ordered. Signed by Hon. Hugh B. Scott on 12/12/2005. (DRH) Modified on 12/14/2005--no status conference was held prior to entry of this Order (DRH). (Entered: 12/12/2005)"
        },
        {
          "row_number": 351,
          "id": 8890041,
          "entry_number": null,
          "date_filed": "2005-12-14T00:00:00-05:00",
          "attachments": null,
          "url": "https://www.courtlistener.com",
          "recap_pdf_url": null,
          "pacer_doc_id": null,
          "description": "E-Filing Notification"
        },
        {
          "row_number": 352,
          "id": 8890042,
          "entry_number": null,
          "date_filed": "2005-12-14T00:00:00-05:00",
          "attachments": null,
          "url": "https://www.courtlistener.com",
          "recap_pdf_url": null,
          "pacer_doc_id": null,
          "description": "E-Filing Notification: 75 ORDER OF MAGISTRATE JUDGE HUGH B. SCOTTTEXT OF ORDER Parties have jointly requested an extension of the final deadline for class certification motion (see Docket No. 52), from 12/20/2005 to 2/3/2006, and an extension of class certification-related discovery (see Docket No. 13) from 8/23/2005 to some unspecified time (note, regular fact discovery deadline is 4/6/2006). The parties note that additional documents were found and produced to plaintiffs that may require further discovery including reopening depositions. This joint request is granted; motion for class certification is due Fri., 2/3/2006, class certification-related discovery shall conclude by Mon., 1/30/2006. So Ordered. Signed by Hon. Hugh B. Scott on 12/12/2005. (DRH) Modified on 12/14/2005--no status conference was held prior to entry of this Order (DRH)."
        },
        {
          "row_number": 291,
          "id": 8890043,
          "entry_number": "76",
          "date_filed": "2005-12-16T00:00:00-05:00",
          "attachments": null,
          "url": "https://www.courtlistener.com/docket/4680081/76/pritchard-v-the-county-of-erie/",
          "recap_pdf_url": null,
          "pacer_doc_id": "1290341039",
          "description": "AFFIRMATION signed by Elmer Robert Keach, III in support of motion for leave to discontinue the claims of Julenne Tucker as class representative and to withdraw as counsel for Mr. Tucker. (document filed pursuant to instructions from chambers) (DZ, ) (Entered: 12/19/2005)"
        },
        {
          "row_number": 292,
          "id": 8890044,
          "entry_number": "77",
          "date_filed": "2005-12-27T00:00:00-05:00",
          "attachments": null,
          "url": "https://www.courtlistener.com/docket/4680081/77/pritchard-v-the-county-of-erie/",
          "recap_pdf_url": null,
          "pacer_doc_id": "1290842862",
          "description": "ORDER OF MAGISTRATE JUDGE HUGH B. SCOTTORDER granting in part and denying in part 68 Motion to Withdraw as Attorney, granting in part and denying in part 70 Motion to Withdraw as Attorney.Plaintiffs' motion to discontinue plaintiff Tucker's class claims is deferred until after class certification motion is made and argued. Plaintiffs' counsel's motion for leave to withdraw as counsel to Tucker is denied. Plaintiffs' counsel's motion to allow Tucker to proceed separately, that motion is also denied. So Ordered. Signed by Magistrate Judge Hugh B. Scott on 12/27/2005. (DRH) (Entered: 12/27/2005)"
        },
        {
          "row_number": 293,
          "id": 8890045,
          "entry_number": "78",
          "date_filed": "2006-01-04T00:00:00-05:00",
          "attachments": null,
          "url": "https://www.courtlistener.com/docket/4680081/78/pritchard-v-the-county-of-erie/",
          "recap_pdf_url": "https://www.courtlistener.com/recap/gov.uscourts.nywd.51300/gov.uscourts.nywd.51300.78.0.pdf",
          "pacer_doc_id": "1290845327",
          "description": " ORDER OF MAGISTRATE JUDGE HUGH B. SCOTTORDER re,  52  Order on Motion to Compel, Order on Motion for Protective Order, re  25  MOTION to Compel and for Protective Order, Leave to Intervene and Enlargement of T ime filed by Adam Pritchard, Edward Robinson, Julenne TuckerRegarding the in camera inspection of defendants' documents identified in the County Defendants' privilege log, as specified in the Order, some documents are deemed to be privileged, other documents are not and should be produced.  Defendants shall make arrangements with Chambers to retrieve the in camera documents.  So Ordered.  Signed by Hon. Hugh B. Scott on 1/4/2006. (DRH)"
        },
        {
          "row_number": 294,
          "id": 8890046,
          "entry_number": "79",
          "date_filed": "2006-01-19T00:00:00-05:00",
          "attachments": null,
          "url": "https://www.courtlistener.com/docket/4680081/79/pritchard-v-the-county-of-erie/",
          "recap_pdf_url": null,
          "pacer_doc_id": "1290360313",
          "description": "REPLY/RESPONSE to re 78 Order,, Objections To Magistrate's Pre-Trial Order Regarding Privileged Documents filed by The County of Erie. (Attachments: # 1 Exhibit A# 2 Exhibit B# 3 Exhibit C Documents Under Proposed Seal# 4 Exhibit D, Documents Under Proposed Seal# 5 Exhibit E, Documents Under Proposed Seal)(Domagalski, James) (Entered: 01/19/2006)"
        },
        {
          "row_number": 296,
          "id": 8890047,
          "entry_number": "80",
          "date_filed": "2006-01-19T00:00:00-05:00",
          "attachments": null,
          "url": "https://www.courtlistener.com/docket/4680081/80/pritchard-v-the-county-of-erie/",
          "recap_pdf_url": null,
          "pacer_doc_id": "1290360503",
          "description": "MOTION to Stay discovery Order and for an expedited hearing by The County of Erie. (Attachments: # 1 Affidavit in support# 2 Exhibit A# 3 Exhibit B, Proposed Order)(Domagalski, James) (Entered: 01/19/2006)"
        },
        {
          "row_number": 297,
          "id": 8890048,
          "entry_number": "81",
          "date_filed": "2006-01-19T00:00:00-05:00",
          "attachments": null,
          "url": "https://www.courtlistener.com/docket/4680081/81/pritchard-v-the-county-of-erie/",
          "recap_pdf_url": null,
          "pacer_doc_id": "1290851703",
          "description": "MEMORANDUM in Support re 80 MOTION to Stay discovery Order and for an expedited hearing filed by The County of Erie. (Domagalski, James) (Entered: 01/19/2006)"
        },
        {
          "row_number": 300,
          "id": 8890051,
          "entry_number": "84",
          "date_filed": "2006-02-06T00:00:00-05:00",
          "attachments": null,
          "url": "https://www.courtlistener.com/docket/4680081/84/pritchard-v-the-county-of-erie/",
          "recap_pdf_url": null,
          "pacer_doc_id": "1290251119",
          "description": "ORDER granting 80 Defendants' Motion to Stay. Plaintiffs shall file papers in response to defendants' objections on or before 2/13/2006. Defendants shall file any reply papers on or before 2/20/2006, at which time the objections will be taken under advisement without argument. Any adjustment to this current schedule shall be directed to Judge Scott. Signed by Judge John T. Curtin on 02/06/2006. (JEC) (Entered: 02/06/2006)"
        },
        {
          "row_number": 353,
          "id": 8890052,
          "entry_number": null,
          "date_filed": "2006-02-06T00:00:00-05:00",
          "attachments": null,
          "url": "https://www.courtlistener.com",
          "recap_pdf_url": null,
          "pacer_doc_id": null,
          "description": "Set Deadlines/Hearings"
        },
        {
          "row_number": 354,
          "id": 8890053,
          "entry_number": null,
          "date_filed": "2006-02-06T00:00:00-05:00",
          "attachments": null,
          "url": "https://www.courtlistener.com",
          "recap_pdf_url": null,
          "pacer_doc_id": null,
          "description": "Set Deadlines/Hearings: Plaintiff's Response to Defendant's Objections due by 2/13/2006; Defendants' Replies due by 2/20/2006. (JEC)"
        },
        {
          "row_number": 301,
          "id": 8890054,
          "entry_number": "85",
          "date_filed": "2006-02-13T00:00:00-05:00",
          "attachments": null,
          "url": "https://www.courtlistener.com/docket/4680081/85/pritchard-v-the-county-of-erie/",
          "recap_pdf_url": null,
          "pacer_doc_id": "1290244580",
          "description": "REPLY/RESPONSE to re 78 Order,,, 84 Order on Motion to Stay,, Set Deadlines/Hearings, 80 MOTION to Stay discovery Order and for an expedited hearing, 81 Memorandum in Support of Motion, 79 Reply/Response, filed by Adam Pritchard, Julenne Tucker. (Attachments: # 1 Exhibit A# 2 Exhibit B# 3 Memorandum in Support of Plaintiffs' opposition to Defendants' objections)(Rozger, Jason) (Entered: 02/13/2006)"
        },
        {
          "row_number": 355,
          "id": 8890055,
          "entry_number": null,
          "date_filed": "2006-02-13T00:00:00-05:00",
          "attachments": null,
          "url": "https://www.courtlistener.com",
          "recap_pdf_url": null,
          "pacer_doc_id": null,
          "description": "E-Filing Notification"
        },
        {
          "row_number": 356,
          "id": 8890056,
          "entry_number": null,
          "date_filed": "2006-02-13T00:00:00-05:00",
          "attachments": null,
          "url": "https://www.courtlistener.com",
          "recap_pdf_url": null,
          "pacer_doc_id": null,
          "description": "E-Filing Notification: Dopcument # 85 REPLY/RESPONSE (Rozger, Jason) filed without proof of service. (DZ, )"
        },
        {
          "row_number": 302,
          "id": 8890057,
          "entry_number": "86",
          "date_filed": "2006-02-16T00:00:00-05:00",
          "attachments": null,
          "url": "https://www.courtlistener.com/docket/4680081/86/pritchard-v-the-county-of-erie/",
          "recap_pdf_url": null,
          "pacer_doc_id": "1290251650",
          "description": "MOTION to Compel Deposition Testimony by Adam Pritchard, Edward Robinson. (Attachments: # 1 Affirmation of Elmer Keach In Support of Motion to Compel Deposition Testimony# 2 Exhibit Exhibit 1 to Keach Affirmation -- Plaintiffs' 12/04 Document Demands# 3 Exhibit Exhibit 2 to Keach Affirmation -- Erie County Discovery Response# 4 Exhibit Exhibit 3 to Keach Affirmation -- Undisclosed Email# 5 Exhibit Exhibit 4 to Keach Affirmation -- Erie County Privilege Logs# 6 Exhibit Exhibit 5 to Keach Affirmation -- Letter from Keach to Domagalski, 11.07.05# 7 Exhibit Exhibit 6 to Keach Affirmation -- Letter from Domagalski to Keach and LaDuca, 11.14.05# 8 Exhibit Exhibit 7 to Keach Affirmation -- Scheduling Email from Keach to all Counsel, 02.02.06# 9 Exhibit Exhibit 8 to Keach Affirmation -- Letter from Menken to Domagalski, 02.08.06# 10 Exhibit Exhibit 9 to Keach Affirmation -- Letter from Domagalski to LaDuca, 02.06.06# 11 Exhibit Exhibit 10 to Keach Affirmation -- Letter from Domagalski to Keach, 02.14.06# 12 Certificate of Service)(Keach, Elmer) (Entered: 02/16/2006)"
        },
        {
          "row_number": 303,
          "id": 8890058,
          "entry_number": "87",
          "date_filed": "2006-02-17T00:00:00-05:00",
          "attachments": null,
