{
  "case_id": 14417,
  "fetched_at": "2025-10-20T22:37:13.116476",
  "case_data": {
    "attorney_orgs": [
      "Loevy & Loevy",
      "Uptown People's Law Center"
    ],
    "available_documents": [
      "Trial Court Docket",
      "Complaint (any)",
      "Injunctive (or Injunctive-like) Relief",
      "Any published opinion"
    ],
    "case_defendants": [
      {
        "defendant_level": null,
        "institution": "Illinois River Correctional Center",
        "institution_alt_state": null,
        "institution_city": "",
        "institution_county": null,
        "name": "Illinois Department of Corrections",
        "defendant_level_other": "",
        "is_active": true
      },
      {
        "defendant_level": null,
        "institution": "Big Muddy Correctional Center",
        "institution_alt_state": null,
        "institution_city": "",
        "institution_county": null,
        "name": "Illinois Department of Corrections",
        "defendant_level_other": "",
        "is_active": true
      },
      {
        "defendant_level": null,
        "institution": "Menard Correctional Center",
        "institution_alt_state": null,
        "institution_city": "",
        "institution_county": null,
        "name": "Illinois Department of Corrections",
        "defendant_level_other": "",
        "is_active": true
      },
      {
        "defendant_level": null,
        "institution": "Lawrence Correctional Center",
        "institution_alt_state": null,
        "institution_city": "",
        "institution_county": null,
        "name": "Illinois Department of Corrections",
        "defendant_level_other": "",
        "is_active": true
      }
    ],
    "case_ongoing": "Yes",
    "case_status": "Approved",
    "case_types": [
      "Prison Conditions"
    ],
    "cause_other": "",
    "causes": [
      "42 U.S.C. § 1983",
      "State law",
      "Ex parte Young (federal or state officials)"
    ],
    "class_action_granted": "Granted",
    "class_action_sought": "Yes",
    "closing_year": null,
    "constitutional_clause": [
      {
        "value": "Cruel and Unusual Punishment"
      }
    ],
    "content_of_injunction": [],
    "court": "Southern District of Illinois",
    "custom_issues": [],
    "defendant_payment": "",
    "defendant_type": [
      {
        "value": "Law-enforcement"
      },
      {
        "value": "Corrections"
      }
    ],
    "docket_status": "Complete as of retrieval date",
    "facility_type": [
      {
        "value": "Government-run"
      }
    ],
    "filing_date": "2015-03-19",
    "filing_year": 2015,
    "id": 14417,
    "injunction_duration": "",
    "issues": [
      "General/Misc.: Disciplinary procedures",
      "General/Misc.: Search policies",
      "Jails, Prisons, Detention Centers, and Other Institutions: Strip search policy (facilities)",
      "Policing: Excessive force",
      "General/Misc.: Failure to discipline",
      "General/Misc.: Failure to supervise",
      "Jails, Prisons, Detention Centers, and Other Institutions: Grievance procedures",
      "General/Misc.: Conditions of confinement",
      "Jails, Prisons, Detention Centers, and Other Institutions: Sex w/ staff; sexual harassment by staff",
      "Jails, Prisons, Detention Centers, and Other Institutions: Restraints (physical)",
      "General/Misc.: Failure to train",
      "Jails, Prisons, Detention Centers, and Other Institutions: Prison Rape Elimination Act",
      "Jails, Prisons, Detention Centers, and Other Institutions: Assault/abuse by staff (facilities)"
    ],
    "last_checked_date": "2025-02-23T00:00:00-05:00",
    "main_docket": {
      "id": 29811,
      "docket_entries": [
        {
          "row_number": 837,
          "id": 8714978,
          "entry_number": null,
          "date_filed": "2016-04-18T00:00:00-04:00",
          "attachments": [],
          "url": "https://www.courtlistener.com",
          "recap_pdf_url": null,
          "pacer_doc_id": null,
          "description": "Set Deadlines/Hearings"
        },
        {
          "row_number": 755,
          "id": 8714930,
          "entry_number": "78",
          "date_filed": "2016-01-28T00:00:00-05:00",
          "attachments": [],
          "url": "https://www.courtlistener.com/docket/5346556/78/ross-v-gossett/",
          "recap_pdf_url": "https://www.courtlistener.com/recap/gov.uscourts.ilsd.70322/gov.uscourts.ilsd.70322.78.0_1.pdf",
          "pacer_doc_id": "06903396443",
          "description": "ORDER denying 56 Motion to Dismiss for Failure to State a Claim; denying 56 Motion to Dismiss Case for Lack of Jurisdiction. Signed by Judge Staci M. Yandle on 1/28/2016. (rlw) (Entered: 01/28/2016)"
        },
        {
          "row_number": 165,
          "id": 8715110,
          "entry_number": "248",
          "date_filed": "2017-01-17T00:00:00-05:00",
          "attachments": [
            {
              "recap_id": 156735216,
              "pacer_url": "https://ecf.ilsd.uscourts.gov/doc1/06903690200?caseid=70322",
              "description": "Waiver of Service Returned Executed by Benjamin Haynes",
              "attachment_number": 1
            },
            {
              "recap_id": 156735217,
              "pacer_url": "https://ecf.ilsd.uscourts.gov/doc1/06903690201?caseid=70322",
              "description": "Waiver of Service Returned Executed by Sammy Peradotta",
              "attachment_number": 2
            },
            {
              "recap_id": 156735218,
              "pacer_url": "https://ecf.ilsd.uscourts.gov/doc1/06903690202?caseid=70322",
              "description": "Waiver of Service Returned Executed by James Ochs",
              "attachment_number": 3
            },
            {
              "recap_id": 156735219,
              "pacer_url": "https://ecf.ilsd.uscourts.gov/doc1/06903690203?caseid=70322",
              "description": "Waiver of Service Returned Executed by Gordon Belless",
              "attachment_number": 4
            }
          ],
          "url": "https://www.courtlistener.com/docket/5346556/248/ross-v-gossett/",
          "recap_pdf_url": null,
          "pacer_doc_id": "06903690199",
          "description": "WAIVER OF SERVICE Returned Executed by All Plaintiffs. Gordon Belless waiver sent on 1/4/2017, answer due 3/6/2017; James Ochs waiver sent on 12/13/2016, answer due 2/13/2017; Sam Peradotta waiver sent on 1/4/2017, answer due 3/6/2017. (Attachments: # 1 Waiver of Service Returned Executed by Benjamin Haynes, # 2 Waiver of Service Returned Executed by Sammy Peradotta, # 3 Waiver of Service Returned Executed by James Ochs, # 4 Waiver of Service Returned Executed by Gordon Belless)(Grady, Sarah) (Entered: 01/17/2017)"
        },
        {
          "row_number": 865,
          "id": 8715491,
          "entry_number": null,
          "date_filed": "2022-06-09T00:00:00-04:00",
          "attachments": [],
          "url": "https://www.courtlistener.com",
          "recap_pdf_url": null,
          "pacer_doc_id": null,
          "description": "~Util - Terminate Motions AND Order"
        },
        {
          "row_number": 333,
          "id": 8714856,
          "entry_number": "4",
          "date_filed": "2015-03-20T00:00:00-04:00",
          "attachments": [],
          "url": "https://www.courtlistener.com/docket/5346556/4/ross-v-gossett/",
          "recap_pdf_url": null,
          "pacer_doc_id": "06903101411",
          "description": "Notice of Judge Assignment. Judge Staci M. Yandle and Magistrate Judge Donald G. Wilkerson assigned. All future documents must bear case number 15-309-SMY-DGW. If the parties consent to Magistrate Judge assignment, the consent form with instruction is attached for your convenience. Refer to Civil/Removal Case Processing Requirements, found on the ILSD website, for further service information. (rah) (Entered: 03/20/2015)"
        },
        {
          "row_number": 444,
          "id": 8714857,
          "entry_number": "5",
          "date_filed": "2015-03-20T00:00:00-04:00",
          "attachments": [],
          "url": "https://www.courtlistener.com/docket/5346556/5/ross-v-gossett/",
          "recap_pdf_url": null,
          "pacer_doc_id": null,
          "description": "NOTICE STRIKING ELECTRONICALLY FILED DOCUMENTS striking 4 Case Opening Notification,. Magistrate Judge Donald Wilkerson inadvertently assigned to this case. No referral judge to be assigned at this time. Judge Yandle remains as presiding judge. All future documents must bear case number 15-309-SMY. (rah)THIS TEXT ENTRY IS AN ORDER OF THE COURT. NO FURTHER DOCUMENTATION WILL BE MAILED. (Entered: 03/20/2015)"
        },
        {
          "row_number": 666,
          "id": 8714859,
          "entry_number": "7",
          "date_filed": "2015-03-23T00:00:00-04:00",
          "attachments": [],
          "url": "https://www.courtlistener.com/docket/5346556/7/ross-v-gossett/",
          "recap_pdf_url": null,
          "pacer_doc_id": null,
          "description": "ORDER granting 6 Motion to Appear Pro Hac Vice by Attorney Kanovitz on behalf of Plaintiff. (anm) (Entered: 03/23/2015)"
        },
        {
          "row_number": 777,
          "id": 8714860,
          "entry_number": "8",
          "date_filed": "2015-03-23T00:00:00-04:00",
          "attachments": [],
          "url": "https://www.courtlistener.com/docket/5346556/8/ross-v-gossett/",
          "recap_pdf_url": null,
          "pacer_doc_id": null,
          "description": "ORDER REFERRING CASE TO MAGISTRATE JUDGE. Plaintiff is a prisoner in the custody of the Illinois Department of Corrections. Represented by counsel, he brings this civil rights action pursuant to 42 U.S.C. § 1983, on behalf of himself and other similarly situated inmates at four prisons, three of which are located in this judicial district. Under 28 U.S.C. § 1915A, the Court is required to conduct a prompt threshold review of the complaint. Accepting Plaintiff's allegations as true, the Court finds that Plaintiff has articulated a colorable federal cause of action against Defendants for constitutional, statutory, and supplemental state law claims arising from the Defendants' cell shakedowns, strip searches, use of excessive force, denial of medical care, and related actions at the Illinois River Correctional Center beginning in April 2014, and subsequently at Menard, Big Muddy River, and Lawrence Correctional Centers. Accordingly, pursuant to Local Rule 72.1(a)(2), this action is REFERRED to United States Magistrate Judge Philip M. Frazier for further pre-trial proceedings. Further, this entire matter shall be REFERRED to United States Magistrate Judge Frazier for disposition, pursuant to Local Rule 72.2(b)(2) and 28 U.S.C. § 636(c), if all parties consent to such a referral. Counsel for Plaintiff may initiate service without further delay. Defendants are ORDERED to timely file an appropriate responsive pleading to the complaint and shall not waive filing a reply pursuant to 42 U.S.C. § 1997e(g). Signed by Judge Staci M. Yandle on 3/23/2015. (tjk)THIS TEXT ENTRY IS AN ORDER OF THE COURT. NO FURTHER DOCUMENTATION WILL BE MAILED. (Entered: 03/23/2015)"
        },
        {
          "row_number": 826,
          "id": 8714861,
          "entry_number": "9",
          "date_filed": "2015-03-23T00:00:00-04:00",
          "attachments": [],
          "url": "https://www.courtlistener.com/docket/5346556/9/ross-v-gossett/",
          "recap_pdf_url": null,
          "pacer_doc_id": "06903103721",
          "description": "Summons Requested. (Grady, Sarah) (Entered: 03/23/2015)"
        },
        {
          "row_number": 45,
          "id": 8714866,
          "entry_number": "14",
          "date_filed": "2015-03-24T00:00:00-04:00",
          "attachments": [],
          "url": "https://www.courtlistener.com/docket/5346556/14/ross-v-gossett/",
          "recap_pdf_url": null,
          "pacer_doc_id": "06903104016",
          "description": "Summons Issued as to Gene Bailey, Hubert Brace, Christopher Brant, Bud Brown, Christopher Cales, Fredrick Carter, James Cissell, Scott Ebers, Frank Eovaldi, Jason Furlow, Edwin Gladney, Dustin Harmon, Shayne Howell, Erik Krammer, Jason Lane, James Lloyd, Jason Migneron, Dale Monical, Jason Morris, Dan Mullin, Jared Phillips, John Restoff, James Rigdon, James Watkins, Eric Wenzel, Dallas Willis. (mar) (Entered: 03/24/2015)"
        },
        {
          "row_number": 89,
          "id": 8714870,
          "entry_number": "18",
          "date_filed": "2015-03-24T00:00:00-04:00",
          "attachments": [],
          "url": "https://www.courtlistener.com/docket/5346556/18/ross-v-gossett/",
          "recap_pdf_url": null,
          "pacer_doc_id": "06903104075",
          "description": "Summons Issued as to Pat Anderson, Khorey Anderton, Mike Bowers, Kenny Brown, James Bruce, Matt Cannon, Dawayne Cotton, Josh Curry, Matt Dees, Dwight Dilg, Keneth Finney, Kendall Harris, James Johnson, Justin Johnson, John Jones, John Maragni, Doug Mason, Kyle Massey, Jeremy McBride, John Mohr, Nick Nalley, Larry Provence, Donald Pulliam, Eric Shelton, Randy Smith, Gary Stark. (msd) (Entered: 03/24/2015)"
        },
        {
          "row_number": 145,
          "id": 8714875,
          "entry_number": "23",
          "date_filed": "2015-03-24T00:00:00-04:00",
          "attachments": [],
          "url": "https://www.courtlistener.com/docket/5346556/23/ross-v-gossett/",
          "recap_pdf_url": null,
          "pacer_doc_id": "06903104146",
          "description": "Summons Issued as to Steve Albrecht, Sarah Arnett, Shawn Bailliez, Vincent Cogdal, Andrew Gangloff, Akeem Hamilton, Scott Lamb, Alexander Lockhart, Andrew Mays, William Myers, Andy Stout, Sam Taylor, Tammy Thousand, Andrew Volk, Steve Wilcoxen. (slh) (Entered: 03/24/2015)"
        },
        {
          "row_number": 189,
          "id": 8714879,
          "entry_number": "27",
          "date_filed": "2015-04-09T00:00:00-04:00",
          "attachments": [],
          "url": "https://www.courtlistener.com/docket/5346556/27/ross-v-gossett/",
          "recap_pdf_url": null,
          "pacer_doc_id": "06903119936",
          "description": "SUMMONS Returned Executed by Demetrius Ross. Cayd Walljasper served on 4/2/2015, answer due 4/23/2015. (Grady, Sarah) (Entered: 04/09/2015)"
        },
        {
          "row_number": 245,
          "id": 8714884,
          "entry_number": "32",
          "date_filed": "2015-04-09T00:00:00-04:00",
          "attachments": [],
          "url": "https://www.courtlistener.com/docket/5346556/32/ross-v-gossett/",
          "recap_pdf_url": null,
          "pacer_doc_id": "06903120442",
          "description": "SUMMONS Returned Executed by Demetrius Ross. Robert Adams served on 3/30/2015, answer due 4/20/2015; Steve Albrecht served on 3/30/2015, answer due 4/20/2015; Sarah Arnett served on 3/30/2015, answer due 4/20/2015; Shawn Bailliez served on 3/30/2015, answer due 4/20/2015; Bill Carroll served on 3/30/2015, answer due 4/20/2015; Vincent Cogdal served on 3/30/2015, answer due 4/20/2015; Nick Conklin served on 3/30/2015, answer due 4/20/2015; Angela Craddock served on 3/30/2015, answer due 4/20/2015; Robert Dorethy served on 3/30/2015, answer due 4/20/2015; Lisa Ellinger served on 3/30/2015, answer due 4/20/2015; Blake Elliot served on 3/30/2015, answer due 4/20/2015; M. Fluder served on 3/30/2015, answer due 4/20/2015; Andrew Gangloff served on 3/30/2015, answer due 4/20/2015; Greg Gossett served on 3/30/2015, answer due 4/20/2015; Akeem Hamilton served on 3/30/2015, answer due 4/20/2015; Justin Hammers served on 3/30/2015, answer due 4/20/2015; Ayla Heinzmann served on 3/30/2015, answer due 4/20/2015; David Hermetz served on 3/30/2015, answer due 4/20/2015; Bradley Herzog served on 3/30/2015, answer due 4/20/2015; Jason Jester served on 3/30/2015, answer due 4/20/2015; Loretta Joachim served on 3/30/2015, answer due 4/20/2015; Scott Lamb served on 3/30/2015, answer due 4/20/2015; Ben Lewis served on 3/30/2015, answer due 4/20/2015; Brian Livingston served on 3/30/2015, answer due 4/20/2015; Alexander Lockhart served on 3/30/2015, answer due 4/20/2015; Nick Lohnes served on 3/30/2015, answer due 4/20/2015; Dale Martin served on 3/30/2015, answer due 4/20/2015; Andrew Mays served on 3/30/2015, answer due 4/20/2015; William Myers served on 3/30/2015, answer due 4/20/2015; Lee Parker served on 3/30/2015, answer due 4/20/2015; Robert Passmore served on 3/30/2015, answer due 4/20/2015; Anthony Senn served on 3/30/2015, answer due 4/20/2015; Andy Stout served on 3/30/2015, answer due 4/20/2015; Brad Stuck served on 3/30/2015, answer due 4/20/2015; Sam Taylor served on 3/30/2015, answer due 4/20/2015; Ashley Thompson served on 3/30/2015, answer due 4/20/2015; Frank Thompson served on 3/30/2015, answer due 4/20/2015; Ben Vaughn served on 3/30/2015, answer due 4/20/2015; Andrew Volk served on 3/30/2015, answer due 4/20/2015; Chris White served on 3/30/2015, answer due 4/20/2015; Fred Williams served on 3/30/2015, answer due 4/20/2015; Brice Wilson served on 3/30/2015, answer due 4/20/2015; Brad Yonaka served on 3/30/2015, answer due 4/20/2015; Mike Stufflebeam served on 3/30/2015, answer due 4/20/2015. (Grady, Sarah) Modified on 4/10/2015 (tkm ). (Entered: 04/09/2015)"
        },
        {
          "row_number": 278,
          "id": 8714887,
          "entry_number": "35",
          "date_filed": "2015-04-20T00:00:00-04:00",
          "attachments": [],
          "url": "https://www.courtlistener.com/docket/5346556/35/ross-v-gossett/",
          "recap_pdf_url": "https://www.courtlistener.com/recap/gov.uscourts.ilsd.70322/gov.uscourts.ilsd.70322.35.0.pdf",
          "pacer_doc_id": "06903131305",
          "description": "Summons Returned Unexecuted by Demetrius Ross as to Loretta Joachim, Ron Shoultz, Fred Williams. (Grady, Sarah) (Entered: 04/20/2015)"
        },
        {
          "row_number": 322,
          "id": 8714891,
          "entry_number": "39",
          "date_filed": "2015-04-21T00:00:00-04:00",
          "attachments": [],
          "url": "https://www.courtlistener.com/docket/5346556/39/ross-v-gossett/",
          "recap_pdf_url": null,
          "pacer_doc_id": null,
          "description": "ORDER finding as moot 37 Motion for Extension of Time to Answer ; granting 38 Amended Motion for Extension of Time to Answer. For good cause shown pursuant to Fed.R.Civ.P. 6(b), the deadline for the served defendants to file an answer or responsive pleading is hereby extended to May 4, 2015. Original Motion for Extension of Time (Doc. 37) is now MOOT. Signed by Magistrate Judge Philip M. Frazier on 4/21/15. (kos)THIS TEXT ENTRY IS AN ORDER OF THE COURT. NO FURTHER DOCUMENTATION WILL BE MAILED. (Entered: 04/21/2015)"
        },
        {
          "row_number": 334,
          "id": 8714892,
          "entry_number": "40",
          "date_filed": "2015-04-28T00:00:00-04:00",
          "attachments": [],
          "url": "https://www.courtlistener.com/docket/5346556/40/ross-v-gossett/",
          "recap_pdf_url": null,
          "pacer_doc_id": "06903142493",
          "description": "Summons Reissued as to Loretta Joachim, Ron Shoultz. (rah) (Entered: 04/28/2015)"
        },
        {
          "row_number": 389,
          "id": 8714897,
          "entry_number": "45",
          "date_filed": "2015-05-05T00:00:00-04:00",
          "attachments": [],
          "url": "https://www.courtlistener.com/docket/5346556/45/ross-v-gossett/",
          "recap_pdf_url": null,
          "pacer_doc_id": "06903149651",
          "description": "Summons Issued as to Fred Williams. (cds) (Entered: 05/05/2015)"
        },
        {
          "row_number": 433,
          "id": 8714901,
          "entry_number": "49",
          "date_filed": "2015-06-04T00:00:00-04:00",
          "attachments": [],
          "url": "https://www.courtlistener.com/docket/5346556/49/ross-v-gossett/",
          "recap_pdf_url": null,
          "pacer_doc_id": "06903178938",
          "description": "SUMMONS Returned Executed by Demetrius Ross. Ron Shoultz served on 5/8/2015, answer due 5/29/2015. (Grady, Sarah) (Entered: 06/04/2015)"
        },
        {
          "row_number": 467,
          "id": 8714904,
          "entry_number": "52",
          "date_filed": "2015-06-17T00:00:00-04:00",
          "attachments": [],
          "url": "https://www.courtlistener.com/docket/5346556/52/ross-v-gossett/",
          "recap_pdf_url": null,
          "pacer_doc_id": "06903190449",
          "description": "SUMMONS Returned Executed by Demetrius Ross. Fred Williams served on 5/20/2015, answer due 6/10/2015. (Grady, Sarah) (Entered: 06/17/2015)"
        },
        {
          "row_number": 522,
          "id": 8714909,
          "entry_number": "57",
          "date_filed": "2015-07-02T00:00:00-04:00",
          "attachments": [],
          "url": "https://www.courtlistener.com/docket/5346556/57/ross-v-gossett/",
          "recap_pdf_url": "https://www.courtlistener.com/recap/gov.uscourts.ilsd.70322/gov.uscourts.ilsd.70322.57.0.pdf",
          "pacer_doc_id": "06903205466",
          "description": "MEMORANDUM in Support re 56 MOTION to Dismiss for Failure to State a Claim MOTION to Dismiss for Lack of Jurisdiction filed by Loretta Joachim. (Cook, Lisa) (Entered: 07/02/2015)"
        },
        {
          "row_number": 556,
          "id": 8714912,
          "entry_number": "60",
          "date_filed": "2015-07-22T00:00:00-04:00",
          "attachments": [],
          "url": "https://www.courtlistener.com/docket/5346556/60/ross-v-gossett/",
          "recap_pdf_url": null,
          "pacer_doc_id": "06903222242",
          "description": "MOTION for Leave to File Motion to Dismiss Instanter by Chris White. (Cook, Lisa) (Entered: 07/22/2015)"
        },
        {
          "row_number": 578,
          "id": 8714914,
          "entry_number": "62",
          "date_filed": "2015-07-22T00:00:00-04:00",
          "attachments": [],
          "url": "https://www.courtlistener.com/docket/5346556/62/ross-v-gossett/",
          "recap_pdf_url": null,
          "pacer_doc_id": "06903222594",
          "description": "WAIVER OF SERVICE Returned Executed by Demetrius Ross. David Brock waiver sent on 7/6/2015, answer due 9/4/2015. (Grady, Sarah) (Entered: 07/22/2015)"
        },
        {
          "row_number": 622,
          "id": 8714918,
          "entry_number": "66",
          "date_filed": "2015-07-29T00:00:00-04:00",
          "attachments": [],
          "url": "https://www.courtlistener.com/docket/5346556/66/ross-v-gossett/",
          "recap_pdf_url": null,
          "pacer_doc_id": "06903228511",
          "description": "MOTION to Dismiss for Failure to State a Claim by Chris White. Responses due by 8/31/2015 (Cook, Lisa) (Entered: 07/29/2015)"
        },
        {
          "row_number": 667,
          "id": 8714922,
          "entry_number": "70",
          "date_filed": "2015-09-25T00:00:00-04:00",
          "attachments": [],
          "url": "https://www.courtlistener.com/docket/5346556/70/ross-v-gossett/",
          "recap_pdf_url": null,
          "pacer_doc_id": "06903283543",
          "description": "MOTION for Leave to File Instanter Plaintiffs' Response to Defendants' Motion to Dismiss by Demetrius Ross. (Attachments: # 1 Exhibit A)(Grady, Sarah) (Entered: 09/25/2015)"
        },
        {
          "row_number": 678,
          "id": 8714923,
          "entry_number": "71",
          "date_filed": "2015-09-28T00:00:00-04:00",
          "attachments": [],
          "url": "https://www.courtlistener.com/docket/5346556/71/ross-v-gossett/",
          "recap_pdf_url": null,
          "pacer_doc_id": null,
          "description": "ORDER granting 70 Unopposed Motion for Leave to File Instanter Plaintiffs Response to Defendants Motion to Dismiss. Plaintiffs shall file their response instanter. Signed by Judge Staci M. Yandle on 9/28/2015. (rlw)THIS TEXT ENTRY IS AN ORDER OF THE COURT. NO FURTHER DOCUMENTATION WILL BE MAILED. (Entered: 09/28/2015)"
        },
        {
          "row_number": 722,
          "id": 8714927,
          "entry_number": "75",
          "date_filed": "2015-10-19T00:00:00-04:00",
          "attachments": [],
          "url": "https://www.courtlistener.com/docket/5346556/75/ross-v-gossett/",
          "recap_pdf_url": null,
          "pacer_doc_id": null,
          "description": "Case Reassigned to Magistrate Judge Stephen C. Williams. Magistrate Judge Philip M. Frazier no longer assigned to the case. (msd) (Entered: 10/19/2015)"
        },
        {
          "row_number": 733,
          "id": 8714928,
          "entry_number": "76",
          "date_filed": "2016-01-28T00:00:00-05:00",
          "attachments": [],
          "url": "https://www.courtlistener.com/docket/5346556/76/ross-v-gossett/",
          "recap_pdf_url": "https://www.courtlistener.com/recap/gov.uscourts.ilsd.70322/gov.uscourts.ilsd.70322.76.0.pdf",
          "pacer_doc_id": "06903396418",
          "description": "ORDER granting in part and denying in part 46 Motion to Dismiss for Failure to State a Claim. The motion is DENIED as to Counts I, II, III and V. The motion is GRANTED as to Count IV. Count IV is dismissed with prejudice. Signed by Judge Staci M. Yandle on 1/28/2016. (rlw) (Entered: 01/28/2016)"
        },
        {
          "row_number": 778,
          "id": 8714932,
          "entry_number": "80",
          "date_filed": "2016-01-28T00:00:00-05:00",
          "attachments": [],
          "url": "https://www.courtlistener.com/docket/5346556/80/ross-v-gossett/",
          "recap_pdf_url": "https://www.courtlistener.com/recap/gov.uscourts.ilsd.70322/gov.uscourts.ilsd.70322.80.0.pdf",
          "pacer_doc_id": "06903396496",
          "description": "ORDER denying 68 Motion to Dismiss. Signed by Judge Staci M. Yandle on 1/28/2016. (rlw) (Entered: 01/28/2016)"
        },
        {
          "row_number": 810,
          "id": 8714935,
          "entry_number": "83",
          "date_filed": "2016-02-11T00:00:00-05:00",
          "attachments": [
            {
              "recap_id": 207868120,
              "pacer_url": "https://ecf.ilsd.uscourts.gov/doc1/06903410513?caseid=70322",
              "description": "Exhibits 1 and 2",
              "attachment_number": 1
            }
          ],
          "url": "https://www.courtlistener.com/docket/5346556/83/ross-v-gossett/",
          "recap_pdf_url": null,
          "pacer_doc_id": "06903410512",
          "description": "MOTION to Stay Pursuant to Servicemembers Civil Relief Act by Bill Carroll. (Attachments: # 1 Exhibits 1 and 2)(Cook, Lisa) (Entered: 02/11/2016)"
        },
        {
          "row_number": 822,
          "id": 8714938,
          "entry_number": "86",
          "date_filed": "2016-02-25T00:00:00-05:00",
          "attachments": [],
          "url": "https://www.courtlistener.com/docket/5346556/86/ross-v-gossett/",
          "recap_pdf_url": null,
          "pacer_doc_id": "06903421910",
          "description": "STRICKEN AT DOC. 87 - STATUS REPORT and Proposed Scheduling and Discovery Order (Class Action) by Demetrius Ross. (Grady, Sarah) Modified on 2/26/2016 (mar). (Entered: 02/25/2016)"
        },
        {
          "row_number": 823,
          "id": 8714939,
          "entry_number": "87",
          "date_filed": "2016-02-26T00:00:00-05:00",
          "attachments": [],
          "url": "https://www.courtlistener.com/docket/5346556/87/ross-v-gossett/",
          "recap_pdf_url": null,
          "pacer_doc_id": "06903422752",
          "description": "NOTICE STRIKING ELECTRONICALLY FILED DOCUMENTS striking 86 Status Report filed by Demetrius Ross. See attached document for specifics (mar) (Entered: 02/26/2016)"
        },
        {
          "row_number": 827,
          "id": 8714942,
          "entry_number": "90",
          "date_filed": "2016-03-07T00:00:00-05:00",
          "attachments": [],
          "url": "https://www.courtlistener.com/docket/5346556/90/ross-v-gossett/",
          "recap_pdf_url": null,
          "pacer_doc_id": "06903431431",
          "description": "ORDER TO CONSOLIDATE CASES. The Court will consolidate cases 15-281-SMY-SCW, 15-415-SMY-SCW, 15-515-SMY-SCW, 15-523-SMY-SCW, 15-611-SMY-SCW, 15-690-MJR-SCW, 15-692-SMY-SCW, 15-706-SMY-SCW, 15-1060-SMY-SCW, 15-1263-SMY-SCW and 15-1359-SMY-SCW. Signed by Magistrate Judge Stephen C. Williams on 3/7/16. (lmt) (Entered: 03/08/2016)"
        },
        {
          "row_number": 828,
          "id": 8714943,
          "entry_number": "91",
          "date_filed": "2016-03-10T00:00:00-05:00",
          "attachments": [],
          "url": "https://www.courtlistener.com/docket/5346556/91/ross-v-gossett/",
          "recap_pdf_url": null,
          "pacer_doc_id": "06903435245",
          "description": "STRICKEN per order at doc 100 - MOTION for Default Judgment by Stanley Chairs. (jwf) (Entered: 03/10/2016)"
        },
        {
          "row_number": 829,
          "id": 8714944,
          "entry_number": "92",
          "date_filed": "2016-03-11T00:00:00-05:00",
          "attachments": [],
          "url": "https://www.courtlistener.com/docket/5346556/92/ross-v-gossett/",
          "recap_pdf_url": null,
          "pacer_doc_id": "06903436033",
          "description": "MOTION for Extension of Time to File Answer by Kimberly Butler. (Cook, Lisa) (Entered: 03/11/2016)"
        },
        {
          "row_number": 830,
          "id": 8714945,
          "entry_number": "93",
          "date_filed": "2016-03-11T00:00:00-05:00",
          "attachments": [],
          "url": "https://www.courtlistener.com/docket/5346556/93/ross-v-gossett/",
          "recap_pdf_url": null,
          "pacer_doc_id": "06903436308",
          "description": "ORDER TO CONSOLIDATE CASES. The Court will consolidate case 16-131-SMY-SCW. Terry Turner and Spiller added. Signed by Judge Staci M. Yandle on 3/11/2016. (tjk) (Entered: 03/11/2016)"
        },
        {
          "row_number": 831,
          "id": 8714946,
          "entry_number": "94",
          "date_filed": "2016-03-14T00:00:00-04:00",
          "attachments": [],
          "url": "https://www.courtlistener.com/docket/5346556/94/ross-v-gossett/",
          "recap_pdf_url": null,
          "pacer_doc_id": "06903437060",
          "description": "REQUEST FOR WAIVER of Service sent to Yurkovich on 3/14/2016. Waiver of Service due by 4/13/2016. (tjk) (Entered: 03/14/2016)"
        },
        {
          "row_number": 832,
          "id": 8714947,
          "entry_number": "95",
          "date_filed": "2016-03-14T00:00:00-04:00",
          "attachments": [],
          "url": "https://www.courtlistener.com/docket/5346556/95/ross-v-gossett/",
          "recap_pdf_url": null,
          "pacer_doc_id": "06903437063",
          "description": "REQUEST FOR WAIVER of Service sent to Spiller on 3/14/2016. Waiver of Service due by 4/13/2016. (tjk) (Entered: 03/14/2016)"
        },
        {
          "row_number": 836,
          "id": 8714951,
          "entry_number": "99",
          "date_filed": "2016-03-15T00:00:00-04:00",
          "attachments": [],
          "url": "https://www.courtlistener.com/docket/5346556/99/ross-v-gossett/",
          "recap_pdf_url": "https://www.courtlistener.com/recap/gov.uscourts.ilsd.70322/gov.uscourts.ilsd.70322.99.0.pdf",
          "pacer_doc_id": "06903438725",
          "description": "STRICKEN per order at doc 100 - MOTION to Produce Documents by Brandon Brooks. (jwf) (Entered: 03/15/2016)"
        },
        {
          "row_number": 5,
          "id": 8714955,
          "entry_number": "103",
          "date_filed": "2016-03-23T00:00:00-04:00",
          "attachments": [],
          "url": "https://www.courtlistener.com/docket/5346556/103/ross-v-gossett/",
          "recap_pdf_url": null,
          "pacer_doc_id": "06903447156",
          "description": "REQUEST FOR WAIVER of Service sent to Wexford on 3/23/2016. Waiver of Service due by 4/22/2016. (tjk) (Entered: 03/23/2016)"
        },
        {
          "row_number": 11,
          "id": 8714961,
          "entry_number": "109",
          "date_filed": "2016-04-04T00:00:00-04:00",
          "attachments": [
            {
              "recap_id": 207868487,
              "pacer_url": "https://ecf.ilsd.uscourts.gov/doc1/06903456286?caseid=70322",
              "description": "Exhibit",
              "attachment_number": 1
            },
            {
              "recap_id": 207868488,
              "pacer_url": "https://ecf.ilsd.uscourts.gov/doc1/06903456287?caseid=70322",
              "description": "Exhibit",
              "attachment_number": 2
            },
            {
              "recap_id": 207868489,
              "pacer_url": "https://ecf.ilsd.uscourts.gov/doc1/06903456288?caseid=70322",
              "description": "Exhibit",
              "attachment_number": 3
            },
            {
              "recap_id": 207868490,
              "pacer_url": "https://ecf.ilsd.uscourts.gov/doc1/06903456289?caseid=70322",
              "description": "Exhibit",
              "attachment_number": 4
            }
          ],
          "url": "https://www.courtlistener.com/docket/5346556/109/ross-v-gossett/",
          "recap_pdf_url": null,
          "pacer_doc_id": "06903456285",
          "description": "MOTION to Withdraw as Attorney by Zachary Watts. (Attachments: # 1 Exhibit, # 2 Exhibit, # 3 Exhibit, # 4 Exhibit)(Tracy, Johanna) (Entered: 04/04/2016)"
        },
        {
          "row_number": 13,
          "id": 8714962,
          "entry_number": "110",
          "date_filed": "2016-04-06T00:00:00-04:00",
          "attachments": [],
          "url": "https://www.courtlistener.com/docket/5346556/110/ross-v-gossett/",
          "recap_pdf_url": null,
          "pacer_doc_id": "06903458861",
          "description": "SUMMONS Returned Executed as to Jeremiah Patterson. (tjk) (Entered: 04/06/2016)"
        },
        {
          "row_number": 16,
          "id": 8714965,
          "entry_number": "113",
          "date_filed": "2016-04-07T00:00:00-04:00",
          "attachments": [],
          "url": "https://www.courtlistener.com/docket/5346556/113/ross-v-gossett/",
          "recap_pdf_url": null,
          "pacer_doc_id": null,
          "description": "ORDER granting 109 Motion to Withdraw as Attorney. Attorney Johanna Louise Tracy terminated. Attorney Tracy remains eligible for further appointment to a pro-bono case. Signed by Magistrate Judge Stephen C. Williams on 4/7/2016. (jcp)THIS TEXT ENTRY IS AN ORDER OF THE COURT. NO FURTHER DOCUMENTATION WILL BE MAILED. (Entered: 04/07/2016)"
        },
        {
          "row_number": 19,
          "id": 8714968,
          "entry_number": "116",
          "date_filed": "2016-04-11T00:00:00-04:00",
          "attachments": [],
          "url": "https://www.courtlistener.com/docket/5346556/116/ross-v-gossett/",
          "recap_pdf_url": null,
          "pacer_doc_id": "06903462834",
          "description": "REQUEST FOR WAIVER of Service sent to Butler on 4/11/2016. Waiver of Service due by 5/11/2016. (tjk) (Entered: 04/11/2016)"
        },
        {
          "row_number": 24,
          "id": 8714972,
          "entry_number": "120",
          "date_filed": "2016-04-11T00:00:00-04:00",
          "attachments": [],
          "url": "https://www.courtlistener.com/docket/5346556/120/ross-v-gossett/",
          "recap_pdf_url": null,
          "pacer_doc_id": "06903462969",
          "description": "REQUEST FOR WAIVER of Service sent to Godinez on 4/11/2016. Waiver of Service due by 5/11/2016. (tjk) (Entered: 04/11/2016)"
        },
        {
          "row_number": 28,
          "id": 8714976,
          "entry_number": "124",
          "date_filed": "2016-04-15T00:00:00-04:00",
          "attachments": [],
          "url": "https://www.courtlistener.com/docket/5346556/124/ross-v-gossett/",
          "recap_pdf_url": null,
          "pacer_doc_id": "06903467671",
          "description": "WAIVER OF SERVICE Returned Executed Bradley Clark waiver sent on 4/11/2016, answer due 6/10/2016; Richard Harrington waiver sent on 4/11/2016, answer due 6/10/2016, WAIVER OF SERVICE Returned Executed Kimberly Butler (consolidated case 16-248). (tjk) (Entered: 04/15/2016)"
        },
        {
          "row_number": 838,
          "id": 8714979,
          "entry_number": null,
          "date_filed": "2016-04-18T00:00:00-04:00",
          "attachments": [],
          "url": "https://www.courtlistener.com",
          "recap_pdf_url": null,
          "pacer_doc_id": null,
          "description": "( Action due by 4/29/2016.), Set/Reset Hearings: Status Conference set for 6/16/2016 09:30 AM via Telephone Conference before Magistrate Judge Stephen C. Williams. (mar)"
        },
        {
          "row_number": 38,
          "id": 8714987,
          "entry_number": "133",
          "date_filed": "2016-04-27T00:00:00-04:00",
          "attachments": [],
          "url": "https://www.courtlistener.com/docket/5346556/133/ross-v-gossett/",
          "recap_pdf_url": null,
          "pacer_doc_id": "06903477894",
          "description": "NOTICE of Appearance by Ruth Zemel Brown on behalf of All Plaintiffs (Brown, Ruth) (Entered: 04/27/2016)"
        },
        {
          "row_number": 41,
          "id": 8714990,
          "entry_number": "136",
          "date_filed": "2016-05-10T00:00:00-04:00",
          "attachments": [],
          "url": "https://www.courtlistener.com/docket/5346556/136/ross-v-gossett/",
          "recap_pdf_url": null,
          "pacer_doc_id": "06903488229",
          "description": "PROTECTIVE ORDER. Signed by Magistrate Judge Stephen C. Williams on 5/10/2016. (jcp)THIS TEXT ENTRY IS AN ORDER OF THE COURT. NO FURTHER DOCUMENTATION WILL BE MAILED. (Entered: 05/10/2016)"
        },
        {
          "row_number": 46,
          "id": 8714994,
          "entry_number": "140",
          "date_filed": "2016-05-16T00:00:00-04:00",
          "attachments": [],
          "url": "https://www.courtlistener.com/docket/5346556/140/ross-v-gossett/",
          "recap_pdf_url": null,
          "pacer_doc_id": "06903493927",
          "description": "REQUEST FOR WAIVER of Service sent to Yurkovich, Harrington, and Butler on 5/16/2016. Waiver of Service due by 6/15/2016. (tjk) (Entered: 05/16/2016)"
        },
        {
          "row_number": 48,
          "id": 8714996,
          "entry_number": "142",
          "date_filed": "2016-05-16T00:00:00-04:00",
          "attachments": [],
          "url": "https://www.courtlistener.com/docket/5346556/142/ross-v-gossett/",
          "recap_pdf_url": null,
          "pacer_doc_id": "06903493990",
          "description": "REQUEST FOR WAIVER of Service sent to Baldwin on 5/16/2016. Waiver of Service due by 6/15/2016. (tjk) (Entered: 05/16/2016)"
        },
        {
          "row_number": 50,
          "id": 8714998,
          "entry_number": "144",
          "date_filed": "2016-05-20T00:00:00-04:00",
          "attachments": [],
          "url": "https://www.courtlistener.com/docket/5346556/144/ross-v-gossett/",
          "recap_pdf_url": null,
          "pacer_doc_id": "06903498900",
          "description": "WAIVER OF SERVICE Returned Executed Warden Duncan (consolidated case 16-83). (tjk) (Entered: 05/20/2016)"
        },
        {
          "row_number": 51,
          "id": 8714999,
          "entry_number": "145",
          "date_filed": "2016-05-23T00:00:00-04:00",
          "attachments": [],
          "url": "https://www.courtlistener.com/docket/5346556/145/ross-v-gossett/",
          "recap_pdf_url": null,
          "pacer_doc_id": "06903500384",
          "description": "WAIVER OF SERVICE Returned Executed John R. Balwin waiver sent on 5/16/2016, answer due 7/15/2016. (tjk) Modified on 5/24/2016 (mar). (Entered: 05/23/2016)"
        },
        {
          "row_number": 52,
          "id": 8715000,
          "entry_number": "146",
          "date_filed": "2016-05-23T00:00:00-04:00",
          "attachments": [],
          "url": "https://www.courtlistener.com/docket/5346556/146/ross-v-gossett/",
          "recap_pdf_url": null,
          "pacer_doc_id": "06903500729",
          "description": "MOTION to Dismiss by IDOC. Responses due by 6/27/2016 (Cook, Lisa) (Entered: 05/23/2016)"
        },
        {
          "row_number": 53,
          "id": 8715001,
          "entry_number": "147",
          "date_filed": "2016-05-23T00:00:00-04:00",
          "attachments": [],
          "url": "https://www.courtlistener.com/docket/5346556/147/ross-v-gossett/",
          "recap_pdf_url": "https://www.courtlistener.com/recap/gov.uscourts.ilsd.70322/gov.uscourts.ilsd.70322.147.0.pdf",
          "pacer_doc_id": "06903500732",
          "description": "MEMORANDUM in Support re 146 MOTION to Dismiss filed by IDOC. (Cook, Lisa) (Entered: 05/23/2016)"
        },
        {
          "row_number": 55,
          "id": 8715003,
          "entry_number": "149",
          "date_filed": "2016-05-27T00:00:00-04:00",
          "attachments": [
            {
              "recap_id": 207868806,
              "pacer_url": "https://ecf.ilsd.uscourts.gov/doc1/06903506396?caseid=70322",
              "description": "Proposed Letter",
              "attachment_number": 1
            }
          ],
          "url": "https://www.courtlistener.com/docket/5346556/149/ross-v-gossett/",
          "recap_pdf_url": null,
          "pacer_doc_id": "06903506395",
          "description": "MOTION to Submit Letter to be Considered with Pending Motion Recruitment of Counsel by Samuel C Harding. (Attachments: # 1 Proposed Letter)(jaj) (Entered: 06/01/2016)"
        },
        {
          "row_number": 57,
          "id": 8715004,
          "entry_number": "150",
          "date_filed": "2016-06-01T00:00:00-04:00",
          "attachments": [
            {
              "recap_id": 207869198,
              "pacer_url": "https://ecf.ilsd.uscourts.gov/doc1/06903507275?caseid=70322",
              "description": "Exhibit 1",
              "attachment_number": 1
            },
            {
              "recap_id": 207869199,
              "pacer_url": "https://ecf.ilsd.uscourts.gov/doc1/06903507276?caseid=70322",
              "description": "Exhibit 2",
              "attachment_number": 2
            }
          ],
          "url": "https://www.courtlistener.com/docket/5346556/150/ross-v-gossett/",
          "recap_pdf_url": null,
          "pacer_doc_id": "06903507274",
          "description": "REQUEST for Admissions by Robert Adams. (Attachments: # 1 Exhibit 1, # 2 Exhibit 2)(Cook, Lisa) (Entered: 06/01/2016)"
        },
        {
          "row_number": 61,
          "id": 8715008,
          "entry_number": "154",
          "date_filed": "2016-06-16T00:00:00-04:00",
          "attachments": [],
          "url": "https://www.courtlistener.com/docket/5346556/154/ross-v-gossett/",
          "recap_pdf_url": null,
          "pacer_doc_id": null,
          "description": "Minute Entry for proceedings held before Magistrate Judge Stephen C. Williams: Status Conference held on 6/16/2016. Ruth Brown and Allen Mills for Plaintiffs. Bob Fanning for Defendants. Court discusses progress on discovery. Parties are directed to meet and confer regarding narrowing Pavey issues. Deadline for filing Pavey motions is suspended and will be reset at a later conference. Status Conference set for 7/15/2016 at 3:00 PM via Telephone Conference before Magistrate Judge Stephen C. Williams. Instructions for placing the conference call are as follows: Call toll free 888-684-8852; when prompted enter Access Code 6049846; and when prompted enter Security Code 9467. (Court Reporter n/a.) (amv)THIS TEXT ENTRY IS AN ORDER OF THE COURT. NO FURTHER DOCUMENTATION WILL BE MAILED. (Entered: 06/17/2016)"
        },
        {
          "row_number": 839,
          "id": 8715011,
          "entry_number": null,
          "date_filed": "2016-07-13T00:00:00-04:00",
          "attachments": [],
          "url": "https://www.courtlistener.com",
          "recap_pdf_url": null,
          "pacer_doc_id": null,
          "description": "Set Deadlines/Hearings"
        },
        {
          "row_number": 64,
          "id": 8715013,
          "entry_number": "157",
          "date_filed": "2016-07-14T00:00:00-04:00",
          "attachments": [],
          "url": "https://www.courtlistener.com/docket/5346556/157/ross-v-gossett/",
          "recap_pdf_url": null,
          "pacer_doc_id": "06903542703",
          "description": "ANSWER to 1 Complaint with Affirmative Defenses by Richard Harrington.(Fanning, Robert) (Entered: 07/14/2016)"
        },
        {
          "row_number": 65,
          "id": 8715014,
          "entry_number": "158",
          "date_filed": "2016-07-15T00:00:00-04:00",
          "attachments": [],
          "url": "https://www.courtlistener.com/docket/5346556/158/ross-v-gossett/",
          "recap_pdf_url": null,
          "pacer_doc_id": null,
          "description": "Minute Entry for proceedings held before Magistrate Judge Stephen C. Williams: Discovery Dispute Conference held on 7/15/2016. Alan Mills and Ruth Zemel Brown for Plaintiffs. Robert Fanning for Defendants. The Court discussed with the parties a dispute regarding Defendants' response to Request 6 in Plaintiff's initial Request for Production of Documents. Defendants shall produce IDOC Operations Reports responsive to Plaintiffs' request no later than July 29, 2016. Defendants are also directed to update Plaintiff regarding the existence of any additional documents that may be responsive to Request 6 by July 19, 2016. Should any such documents exist, Defendants shall produce them to Plaintiff no later than August 12, 2016. This matter is set for a status conference on August 23, 2016 at 9:00 a.m. (Court Reporter Laura Esposito.) (rms2)THIS TEXT ENTRY IS AN ORDER OF THE COURT. NO FURTHER DOCUMENTATION WILL BE MAILED. (Entered: 07/15/2016)"
        },
        {
          "row_number": 844,
          "id": 8715020,
          "entry_number": null,
          "date_filed": "2016-07-27T00:00:00-04:00",
          "attachments": [],
          "url": "https://www.courtlistener.com",
          "recap_pdf_url": null,
          "pacer_doc_id": null,
          "description": "Set/Reset Deadlines: Status Report by William Carroll due on/before 10/17/2016. (mar)"
        },
        {
          "row_number": 70,
          "id": 8715022,
          "entry_number": "162",
          "date_filed": "2016-08-04T00:00:00-04:00",
          "attachments": [],
          "url": "https://www.courtlistener.com/docket/5346556/162/ross-v-gossett/",
          "recap_pdf_url": null,
          "pacer_doc_id": null,
          "description": "ORDER finding as moot 161 Motion to Copy. Plaintiff currently proceeds represented by counsel. Plaintiff is reminded that he cannot file motions on his own behalf while represented by counsel, unless he asks for counsel to be removed. Signed by Magistrate Judge Stephen C. Williams on 8/4/2016. (rms2)THIS TEXT ENTRY IS AN ORDER OF THE COURT. NO FURTHER DOCUMENTATION WILL BE MAILED. (Entered: 08/04/2016)"
        },
        {
          "row_number": 71,
          "id": 8715023,
          "entry_number": "163",
          "date_filed": "2016-08-04T00:00:00-04:00",
          "attachments": [],
          "url": "https://www.courtlistener.com/docket/5346556/163/ross-v-gossett/",
          "recap_pdf_url": "https://www.courtlistener.com/recap/gov.uscourts.ilsd.70322/gov.uscourts.ilsd.70322.163.0.pdf",
          "pacer_doc_id": "06903560109",
          "description": "NOTICE of Change of Address by Brandon Brooks (rah) (Entered: 08/04/2016)"
        },
        {
          "row_number": 72,
          "id": 8715024,
          "entry_number": "164",
          "date_filed": "2016-08-12T00:00:00-04:00",
          "attachments": [],
          "url": "https://www.courtlistener.com/docket/5346556/164/ross-v-gossett/",
          "recap_pdf_url": null,
          "pacer_doc_id": "06903568254",
          "description": "MOTION for Extension of Time to Complete Discovery (unopposed) by All Defendants. (Fanning, Robert) (Entered: 08/12/2016)"
        },
        {
          "row_number": 73,
          "id": 8715025,
          "entry_number": "165",
          "date_filed": "2016-08-15T00:00:00-04:00",
          "attachments": [],
          "url": "https://www.courtlistener.com/docket/5346556/165/ross-v-gossett/",
          "recap_pdf_url": null,
          "pacer_doc_id": null,
          "description": "ORDER granting 164 Motion for Extension of Time to Complete Discovery. Defendants shall respond to Plaintiffs' written discovery requests no later than August 26, 2016. Signed by Magistrate Judge Stephen C. Williams on 8/15/2016. (rms2)THIS TEXT ENTRY IS AN ORDER OF THE COURT. NO FURTHER DOCUMENTATION WILL BE MAILED. (Entered: 08/15/2016)"
        },
        {
          "row_number": 74,
          "id": 8715026,
          "entry_number": "166",
          "date_filed": "2016-08-18T00:00:00-04:00",
          "attachments": [],
          "url": "https://www.courtlistener.com/docket/5346556/166/ross-v-gossett/",
          "recap_pdf_url": "https://www.courtlistener.com/recap/gov.uscourts.ilsd.70322/gov.uscourts.ilsd.70322.166.0.pdf",
          "pacer_doc_id": "06903572141",
          "description": "WITHDRAWN PER ORDER AT DOC. 271 - Pro Se MOTION to Sever by Jonathan Tolliver. (rah) Modified on 8/18/2016 (mar). Modified on 3/2/2017 (mar). (Entered: 08/18/2016)"
        },
        {
          "row_number": 75,
          "id": 8715027,
          "entry_number": "167",
          "date_filed": "2016-08-23T00:00:00-04:00",
          "attachments": [],
          "url": "https://www.courtlistener.com/docket/5346556/167/ross-v-gossett/",
          "recap_pdf_url": null,
          "pacer_doc_id": null,
          "description": "Minute Entry for proceedings held before Magistrate Judge Stephen C. Williams: Status Conference held on 8/23/2016.Ruth Brown for Plaintiffs. Robert Fanning for Defendants. Plaintiffs' Motion for Leave to Amend (doc. 156) is GRANTED. Plaintiffs shall file their amended complaint no later than 8/26/16. Due to the fact that the parties contemplate Plaintiffs filing a motion for leave to file a Second Amended Complaint within the next month, the Defendants - without objection from Plaintiffs - are not required to answer the Amended Complaint and shall file a responsive pleading to the Second Amended Complaint in the ordinary course. Additionally, Plaintiffs shall not be required to serve the Amended Complaint, assuming the move for leave to file the Second Amended Complaint by the end of September of 2016. Additionally, by agreement of the parties, the individual Plaintiffs whose claims have been consolidated with this case shall not be required to individually identify additional defendants as all Defendants are already identified in the current complaint, or will be identified in the Amended or Second Amended Complaints. Finally, as counsel for the Defendants is leaving employment with the prisoner litigation unit at the end of the month, this case is set for Status Conference on 9/16/2016 at 2:30 PM via Telephone Conference before Magistrate Judge Stephen C. Williams. Instructions for placing the conference call are as follows: Call toll free 888-684-8852; when prompted enter Access Code 6049846; and when prompted enter Security Code 9467. (Court Reporter n/a.) (amv)THIS TEXT ENTRY IS AN ORDER OF THE COURT. NO FURTHER DOCUMENTATION WILL BE MAILED. (Entered: 08/23/2016)"
        },
        {
          "row_number": 76,
          "id": 8715028,
          "entry_number": "168",
          "date_filed": "2016-08-23T00:00:00-04:00",
          "attachments": [],
          "url": "https://www.courtlistener.com/docket/5346556/168/ross-v-gossett/",
          "recap_pdf_url": null,
          "pacer_doc_id": null,
          "description": "ORDER granting 156 Motion for Leave to Amend. Plaintiff's shall file Amended Complaint no later than 8/26/16. Signed by Magistrate Judge Stephen C. Williams on 8/23/16. (amv)THIS TEXT ENTRY IS AN ORDER OF THE COURT. NO FURTHER DOCUMENTATION WILL BE MAILED. (Entered: 08/23/2016)"
        },
        {
          "row_number": 79,
          "id": 8715030,
          "entry_number": "170",
          "date_filed": "2016-08-24T00:00:00-04:00",
          "attachments": [],
          "url": "https://www.courtlistener.com/docket/5346556/170/ross-v-gossett/",
          "recap_pdf_url": null,
          "pacer_doc_id": "06903576720",
          "description": "WAIVER OF SERVICE Returned Executed Kimberly Butler (consolidated case 16-130). (tjk) (Entered: 08/24/2016)"
        },
        {
          "row_number": 80,
          "id": 8715031,
          "entry_number": "171",
          "date_filed": "2016-08-25T00:00:00-04:00",
          "attachments": [],
          "url": "https://www.courtlistener.com/docket/5346556/171/ross-v-gossett/",
          "recap_pdf_url": null,
          "pacer_doc_id": "06903578085",
          "description": "WITHDRAWN PER ORDER AT DOC. 184 - Pro Se MOTION to Sever by Jonathan Tolliver. (rah) Modified on 9/20/2016 (mar). (Entered: 08/25/2016)"
        },
        {
          "row_number": 81,
          "id": 8715032,
          "entry_number": "172",
          "date_filed": "2016-08-26T00:00:00-04:00",
          "attachments": [],
          "url": "https://www.courtlistener.com/docket/5346556/172/ross-v-gossett/",
          "recap_pdf_url": null,
          "pacer_doc_id": "06903579398",
          "description": "NOTICE of Change of Address by Stanley Chairs (mar) (Entered: 08/26/2016)"
        },
        {
          "row_number": 83,
          "id": 8715034,
          "entry_number": "174",
          "date_filed": "2016-08-26T00:00:00-04:00",
          "attachments": [],
          "url": "https://www.courtlistener.com/docket/5346556/174/ross-v-gossett/",
          "recap_pdf_url": null,
          "pacer_doc_id": null,
          "description": "NOTICE STRIKING ELECTRONICALLY FILED DOCUMENTS striking 173 Motion for Extension of Time to Complete Discovery filed by all Defendants. Filing attorney does not represent all defendants. Document stricken at request of filer so that it may be re-filed on behalf of the appropriate parties. (rah)THIS TEXT ENTRY IS AN ORDER OF THE COURT. NO FURTHER DOCUMENTATION WILL BE MAILED. (Entered: 08/26/2016)"
        },
        {
          "row_number": 85,
          "id": 8715036,
          "entry_number": "176",
          "date_filed": "2016-08-29T00:00:00-04:00",
          "attachments": [],
          "url": "https://www.courtlistener.com/docket/5346556/176/ross-v-gossett/",
          "recap_pdf_url": null,
          "pacer_doc_id": null,
          "description": "ORDER granting 175 Motion for Extension of Time to Complete Discovery. Movant Defendants shall respond to Plaintiff's discovery requests no later than September 9, 2016. Signed by Magistrate Judge Stephen C. Williams on 8/29/2016. (rms2)THIS TEXT ENTRY IS AN ORDER OF THE COURT. NO FURTHER DOCUMENTATION WILL BE MAILED. (Entered: 08/29/2016)"
        },
        {
          "row_number": 91,
          "id": 8715041,
          "entry_number": "181",
          "date_filed": "2016-09-15T00:00:00-04:00",
          "attachments": [],
          "url": "https://www.courtlistener.com/docket/5346556/181/ross-v-gossett/",
          "recap_pdf_url": null,
          "pacer_doc_id": null,
          "description": "ORDER granting 179 Motion for Extension of Time to Complete Discovery. Defendants shall respond to Plaintiffs' discovery requests no later than October 15, 2016. Signed by Magistrate Judge Stephen C. Williams on 9/15/2016. (rms2)THIS TEXT ENTRY IS AN ORDER OF THE COURT. NO FURTHER DOCUMENTATION WILL BE MAILED. (Entered: 09/15/2016)"
        },
        {
          "row_number": 92,
          "id": 8715042,
          "entry_number": "182",
          "date_filed": "2016-09-16T00:00:00-04:00",
          "attachments": [],
          "url": "https://www.courtlistener.com/docket/5346556/182/ross-v-gossett/",
          "recap_pdf_url": null,
          "pacer_doc_id": "06903596837",
          "description": "NOTICE of Appearance by Susannah J. Price on behalf of Officer Armstrong, James Berry, David Brock, Bud Brown, Matt Cannon, Jana Carie, John Chenault, Jr., Daniel Dust, Michael Gilreath, Richard Harrington, Ayla Heinzmann, Loretta Joachim, Roger Moore, Wendy Parks, Gary Perkins, Brandon Richey, Ron Shoultz, Tyson Shurtz, Andy Stout, MaryEllen Thomason, Ben Vaughn, Andrew Volk, Chris White, Fred Williams (Price, Susannah) (Entered: 09/16/2016)"
        },
        {
          "row_number": 845,
          "id": 8715045,
          "entry_number": null,
          "date_filed": "2016-09-20T00:00:00-04:00",
          "attachments": [],
          "url": "https://www.courtlistener.com",
          "recap_pdf_url": null,
          "pacer_doc_id": null,
          "description": "Set Deadlines/Hearings"
        },
        {
          "row_number": 99,
          "id": 8715051,
          "entry_number": "189",
          "date_filed": "2016-10-14T00:00:00-04:00",
          "attachments": [],
          "url": "https://www.courtlistener.com/docket/5346556/189/ross-v-gossett/",
          "recap_pdf_url": null,
          "pacer_doc_id": "06903619198",
          "description": "REQUEST FOR WAIVER of Service sent to Roeckeman on 10/14/2016 (consolidated case 16-416). Waiver of Service due by 11/14/2016. (tjk) (Entered: 10/14/2016)"
        },
        {
          "row_number": 102,
          "id": 8715053,
          "entry_number": "191",
          "date_filed": "2016-10-17T00:00:00-04:00",
          "attachments": [],
          "url": "https://www.courtlistener.com/docket/5346556/191/ross-v-gossett/",
          "recap_pdf_url": null,
          "pacer_doc_id": "06903621847",
          "description": "NOTICE by Bill Carroll re 160 Order on Motion to Stay, (Price, Susannah) (Entered: 10/17/2016)"
        },
        {
          "row_number": 103,
          "id": 8715054,
          "entry_number": "192",
          "date_filed": "2016-10-18T00:00:00-04:00",
          "attachments": [
            {
              "recap_id": 207869532,
              "pacer_url": "https://ecf.ilsd.uscourts.gov/doc1/06903622596?caseid=70322",
              "description": "Exhibit A",
              "attachment_number": 1
            },
            {
              "recap_id": 207869533,
              "pacer_url": "https://ecf.ilsd.uscourts.gov/doc1/06903622597?caseid=70322",
              "description": "Exhibit B",
              "attachment_number": 2
            }
          ],
          "url": "https://www.courtlistener.com/docket/5346556/192/ross-v-gossett/",
          "recap_pdf_url": null,
          "pacer_doc_id": "06903622595",
          "description": "RESPONSE in Opposition re 190 MOTION for Extension of Time to Complete Discovery filed by Demetrius Ross. (Attachments: # 1 Exhibit A, # 2 Exhibit B)(Grady, Sarah) (Entered: 10/18/2016)"
        },
        {
          "row_number": 105,
          "id": 8715056,
          "entry_number": "194",
          "date_filed": "2016-10-20T00:00:00-04:00",
          "attachments": [],
          "url": "https://www.courtlistener.com/docket/5346556/194/ross-v-gossett/",
          "recap_pdf_url": null,
          "pacer_doc_id": "06903625022",
          "description": "WAIVER OF SERVICE Returned Executed as to Godinez (consolidated case 16-416). (tjk) (Entered: 10/20/2016)"
        },
        {
          "row_number": 106,
          "id": 8715057,
          "entry_number": "195",
          "date_filed": "2016-10-21T00:00:00-04:00",
          "attachments": [],
          "url": "https://www.courtlistener.com/docket/5346556/195/ross-v-gossett/",
          "recap_pdf_url": null,
          "pacer_doc_id": "06903626280",
          "description": "WAIVER OF SERVICE Returned Executed as to Stolworthy (consolidated case 16-416). (tjk) (Entered: 10/21/2016)"
        },
        {
          "row_number": 107,
          "id": 8715058,
          "entry_number": "196",
          "date_filed": "2016-10-31T00:00:00-04:00",
          "attachments": [],
          "url": "https://www.courtlistener.com/docket/5346556/196/ross-v-gossett/",
          "recap_pdf_url": null,
          "pacer_doc_id": "06903632447",
          "description": "WAIVER OF SERVICE Returned Executed as to Yurkovich (consolidated case no. 16-416). (tjk) (Entered: 10/31/2016)"
        },
        {
          "row_number": 117,
          "id": 8715066,
          "entry_number": "204",
          "date_filed": "2016-11-22T00:00:00-05:00",
          "attachments": [],
          "url": "https://www.courtlistener.com/docket/5346556/204/ross-v-gossett/",
          "recap_pdf_url": null,
          "pacer_doc_id": "06903649710",
          "description": "STRICKEN AT DOC 211- WAIVER OF SERVICE Returned Executed by All Plaintiffs. Clint Sigrist waiver sent on 11/11/2015, answer due 1/11/2016. (Grady, Sarah) Modified on 11/23/2016 (tjm2). (Entered: 11/22/2016)"
        },
        {
          "row_number": 118,
          "id": 8715067,
          "entry_number": "205",
          "date_filed": "2016-11-22T00:00:00-05:00",
          "attachments": [],
          "url": "https://www.courtlistener.com/docket/5346556/205/ross-v-gossett/",
          "recap_pdf_url": null,
          "pacer_doc_id": "06903649765",
          "description": "WAIVER OF SERVICE Returned Executed by All Plaintiffs. Dustin York waiver sent on 11/11/2016, answer due 1/10/2017. (Grady, Sarah) (Entered: 11/22/2016)"
        },
        {
          "row_number": 119,
          "id": 8715068,
          "entry_number": "206",
          "date_filed": "2016-11-22T00:00:00-05:00",
          "attachments": [],
          "url": "https://www.courtlistener.com/docket/5346556/206/ross-v-gossett/",
          "recap_pdf_url": null,
          "pacer_doc_id": "06903649768",
          "description": "WAIVER OF SERVICE Returned Executed by All Plaintiffs. Jacob Harris waiver sent on 11/11/2016, answer due 1/10/2017. (Grady, Sarah) (Entered: 11/22/2016)"
        },
        {
          "row_number": 120,
          "id": 8715069,
          "entry_number": "207",
          "date_filed": "2016-11-22T00:00:00-05:00",
          "attachments": [],
          "url": "https://www.courtlistener.com/docket/5346556/207/ross-v-gossett/",
          "recap_pdf_url": null,
          "pacer_doc_id": "06903649771",
          "description": "WAIVER OF SERVICE Returned Executed by All Plaintiffs. Jesse Stephens waiver sent on 11/11/2016, answer due 1/10/2017. (Grady, Sarah) (Entered: 11/22/2016)"
        },
        {
          "row_number": 121,
          "id": 8715070,
          "entry_number": "208",
          "date_filed": "2016-11-22T00:00:00-05:00",
          "attachments": [],
          "url": "https://www.courtlistener.com/docket/5346556/208/ross-v-gossett/",
          "recap_pdf_url": null,
          "pacer_doc_id": "06903649774",
          "description": "WAIVER OF SERVICE Returned Executed by All Plaintiffs. Rich Nidey waiver sent on 11/11/2016, answer due 1/10/2017. (Grady, Sarah) (Entered: 11/22/2016)"
        },
        {
          "row_number": 125,
          "id": 8715073,
          "entry_number": "211",
          "date_filed": "2016-11-23T00:00:00-05:00",
          "attachments": [],
          "url": "https://www.courtlistener.com/docket/5346556/211/ross-v-gossett/",
          "recap_pdf_url": null,
          "pacer_doc_id": "06903651277",
          "description": "NOTICE STRIKING ELECTRONICALLY FILED DOCUMENTS striking 204 Waiver of Service Executed. See attached document for specifics (tjm2) (Entered: 11/23/2016)"
        },
        {
          "row_number": 127,
          "id": 8715075,
          "entry_number": "213",
          "date_filed": "2016-11-28T00:00:00-05:00",
          "attachments": [],
          "url": "https://www.courtlistener.com/docket/5346556/213/ross-v-gossett/",
          "recap_pdf_url": null,
          "pacer_doc_id": "06903651866",
          "description": "WAIVER OF SERVICE Returned Executed by All Plaintiffs. Marcus Sawyer waiver sent on 11/11/2016, answer due 1/10/2017. (Grady, Sarah) (Entered: 11/28/2016)"
        },
        {
          "row_number": 130,
          "id": 8715078,
          "entry_number": "216",
          "date_filed": "2016-11-30T00:00:00-05:00",
          "attachments": [],
          "url": "https://www.courtlistener.com/docket/5346556/216/ross-v-gossett/",
          "recap_pdf_url": null,
          "pacer_doc_id": "06903655018",
          "description": "WAIVER OF SERVICE Returned Executed by All Plaintiffs. Rachelle Aiken waiver sent on 11/11/2016, answer due 1/10/2017; Chad Belcher waiver sent on 11/11/2016, answer due 1/10/2017; David Bogart waiver sent on 11/11/2016, answer due 1/10/2017; Christopher Bradley waiver sent on 11/11/2016, answer due 1/10/2017; John Carter waiver sent on 11/11/2016, answer due 1/10/2017; David Childers waiver sent on 11/11/2016, answer due 1/10/2017; Terry Clements waiver sent on 11/11/2016, answer due 1/10/2017; Rod Dial waiver sent on 11/11/2016, answer due 1/10/2017; Wes Dothager waiver sent on 11/11/2016, answer due 1/10/2017; Michael Durbin waiver sent on 11/11/2016, answer due 1/10/2017; Ryan Erickson waiver sent on 11/11/2016, answer due 1/10/2017; David Evelsizer waiver sent on 11/11/2016, answer due 1/10/2017; Tim Feurer waiver sent on 11/11/2016, answer due 1/10/2017; Douglas Gellner waiver sent on 11/11/2016, answer due 1/10/2017; John Green waiver sent on 11/11/2016, answer due 1/10/2017; Raymond Groves waiver sent on 11/11/2016, answer due 1/10/2017; Charles Hahn waiver sent on 11/11/2016, answer due 1/10/2017; Dustin Hewitt waiver sent on 11/11/2016, answer due 1/10/2017; Jeff Hill waiver sent on 11/11/2016, answer due 1/10/2017; Robert Hughes waiver sent on 11/11/2016, answer due 1/10/2017; Josh Kapper waiver sent on 11/11/2016, answer due 1/10/2017; Josh Keener waiver sent on 11/11/2016, answer due 1/10/2017; Shannon Kelly waiver sent on 11/11/2016, answer due 1/10/2017; Walter Kling waiver sent on 11/11/2016, answer due 1/10/2017; Eric Kohl waiver sent on 11/11/2016, answer due 1/10/2017; Tracy Lee waiver sent on 11/11/2016, answer due 1/10/2017; Romelle Lipscomb waiver sent on 11/11/2016, answer due 1/10/2017; Jason McCarty waiver sent on 11/11/2016, answer due 1/10/2017; Justin Miller waiver sent on 11/11/2016, answer due 1/10/2017; Kevin Miller waiver sent on 11/11/2016, answer due 1/10/2017; Dan Moyers waiver sent on 11/11/2016, answer due 1/10/2017; Barry Myers waiver sent on 11/11/2016, answer due 1/10/2017; Myron Neisler waiver sent on 11/11/2016, answer due 1/10/2017; Lareese Olinger waiver sent on 11/11/2016, answer due 1/10/2017; Kris Reynolds waiver sent on 11/11/2016, answer due 1/10/2017; Chris Sanders waiver sent on 11/11/2016, answer due 1/10/2017; Zach Sarver waiver sent on 11/11/2016, answer due 1/10/2017; Ashley Schafer waiver sent on 11/11/2016, answer due 1/10/2017; Bruce Settles waiver sent on 11/11/2016, answer due 1/10/2017; Ronald Sherrock waiver sent on 11/11/2016, answer due 1/10/2017; Nicholas Sroka waiver sent on 11/11/2016, answer due 1/10/2017; Jonathon Staley waiver sent on 11/11/2016, answer due 1/10/2017; Steve Strickell waiver sent on 11/11/2016, answer due 1/10/2017; T.J. Swarts waiver sent on 11/11/2016, answer due 1/10/2017; Nick Ulery waiver sent on 11/11/2016, answer due 1/10/2017; Bill Westfall waiver sent on 11/11/2016, answer due 1/10/2017; John Whitlow waiver sent on 11/11/2016, answer due 1/10/2017; Tim Winans waiver sent on 11/11/2016, answer due 1/10/2017; Tim Worker waiver sent on 11/11/2016, answer due 1/10/2017; Scott Workman waiver sent on 11/11/2016, answer due 1/10/2017. (Attachments: # 1 Waiver of Service Returned Executed by Wes Dothager, # 2 Waiver of Service Returned Executed by Tim Worker, # 3 Waiver of Service Returned Executed by Ryan Erickson, # 4 Waiver of Service Returned Executed by Michael J. Durbin, # 5 Waiver of Service Returned Executed by Lareese Olinger, # 6 Waiver of Service Returned Executed by Kristoffer Reynolds, # 7 Waiver of Service Returned Executed by Justin Miller, # 8 Waiver of Service Returned Executed by Josh Keener, # 9 Waiver of Service Returned Executed by Josh Kapper, # 10 Waiver of Service Returned Executed by John Carter, # 11 Waiver of Service Returned Executed by Jason McCarty, # 12 Waiver of Service Returned Executed by Dustin Hewitt, # 13 Waiver of Service Returned Executed by David Evelsizer, # 14 Waiver of Service Returned Executed by David Childers, # 15 Waiver of Service Returned Executed by David Bogart, # 16 Waiver of Service Returned Executed by Christopher Bradley, # 17 Waiver of Service Returned Executed by Chris W. Sanders, # 18 Waiver of Service Returned Executed by Charles Hahn, # 19 Waiver of Service Returned Executed by Chad Belcher, # 20 Waiver of Service Returned Executed by Bill Westfall, # 21 Waiver of Service Returned Executed by Barry Myers, # 22 Waiver of Service Returned Executed by Tracy Lee, # 23 Waiver of Service Returned Executed by Terry Clements, # 24 Waiver of Service Returned Executed by Steven Strickell, # 25 Waiver of Service Returned Executed by Scott Workman, # 26 Waiver of Service Returned Executed by Robert Hughes, # 27 Waiver of Service Returned Executed by Raymond Groves, # 28 Waiver of Service Returned Executed by Nicholas Sroka, # 29 Waiver of Service Returned Executed by Kevin Miller, # 30 Waiver of Service Returned Executed by Jonathon Staley, # 31 Waiver of Service Returned Executed by Jeffrey Hill, # 32 Waiver of Service Returned Executed by Daniel Moyers, # 33 Waiver of Service Returned Executed by Myron Neisler, # 34 Waiver of Service Returned Executed by Douglas Gellner, # 35 Waiver of Service Returned Executed by Tim Winans, # 36 Waiver of Service Returned Executed by John Whitlow, # 37 Waiver of Service Returned Executed by Ashley Schafer, # 38 Waiver of Service Returned Executed by John Green, # 39 Waiver of Service Returned Executed by Rod Dial, # 40 Waiver of Service Returned Executed by Shannon Kelly, # 41 Waiver of Service Returned Executed by Rachelle Aiken, # 42 Waiver of Service Returned Executed by Anthony Swarts, # 43 Waiver of Service Returned Executed by Eric Kohl, # 44 Waiver of Service Returned Executed by Nick Ulery, # 45 Waiver of Service Returned Executed by Ronald Sherrock, # 46 Waiver of Service Returned Executed by Walter Kling, # 47 Waiver of Service Returned Executed by Bruce Settles, # 48 Waiver of Service Returned Executed by Vince Develey, # 49 Waiver of Service Returned Executed by Tim Feurer, # 50 Waiver of Service Returned Executed by Romelle Lipscomb)(Grady, Sarah) (Entered: 11/30/2016)"
        },
        {
          "row_number": 132,
          "id": 8715080,
          "entry_number": "218",
          "date_filed": "2016-12-05T00:00:00-05:00",
          "attachments": [],
          "url": "https://www.courtlistener.com/docket/5346556/218/ross-v-gossett/",
          "recap_pdf_url": null,
          "pacer_doc_id": "06903658248",
          "description": "STRICKEN AT DOC. 220 - ANSWER to 197 Amended Complaint by Bradley Clark, Roger Moore, Brad Stuck.(Price, Susannah) Modified on 12/6/2016 (mar). (Entered: 12/05/2016)"
        },
        {
          "row_number": 135,
          "id": 8715082,
          "entry_number": "220",
          "date_filed": "2016-12-06T00:00:00-05:00",
          "attachments": [],
          "url": "https://www.courtlistener.com/docket/5346556/220/ross-v-gossett/",
          "recap_pdf_url": null,
          "pacer_doc_id": "06903659119",
          "description": "NOTICE STRIKING ELECTRONICALLY FILED DOCUMENTS striking 218 Answer to Amended Complaint filed by Bradley Clark, Brad Stuck, Roger Moore. See attached document for specifics. (mar) (Entered: 12/06/2016)"
        },
        {
          "row_number": 137,
          "id": 8715084,
          "entry_number": "222",
          "date_filed": "2016-12-09T00:00:00-05:00",
          "attachments": [],
          "url": "https://www.courtlistener.com/docket/5346556/222/ross-v-gossett/",
          "recap_pdf_url": null,
          "pacer_doc_id": "06903663381",
          "description": "WAIVER OF SERVICE Returned Executed by All Plaintiffs. Robert Arnett waiver sent on 11/11/2016, answer due 1/10/2017; John Burle waiver sent on 11/11/2016, answer due 1/10/2017; Marc Coufal waiver sent on 11/11/2016, answer due 1/10/2017; Lonn Howarter waiver sent on 11/11/2016, answer due 1/10/2017; Mike Keithley waiver sent on 11/11/2016, answer due 1/10/2017; Josh Mensing waiver sent on 11/11/2016, answer due 1/10/2017; Todd Shefler waiver sent on 11/11/2016, answer due 1/10/2017. (Attachments: # 1 Waiver of Service Returned Executed by John Mensing, # 2 Waiver of Service Returned Executed by Robert Arnett, # 3 Waiver of Service Returned Executed by John Burle, # 4 Waiver of Service Returned Executed by Mike Keithley, # 5 Waiver of Service Returned Executed by Lonn Howarter, # 6 Waiver of Service Returned Executed by Marc Coufal)(Grady, Sarah) (Entered: 12/09/2016)"
        },
        {
          "row_number": 138,
          "id": 8715085,
          "entry_number": "223",
          "date_filed": "2016-12-12T00:00:00-05:00",
          "attachments": [],
          "url": "https://www.courtlistener.com/docket/5346556/223/ross-v-gossett/",
          "recap_pdf_url": null,
          "pacer_doc_id": "06903663734",
          "description": "NOTICE of Change of Address by Stanley Chairs from Pontiac CC to Menard CC. (jaj) (Entered: 12/12/2016)"
        },
        {
          "row_number": 140,
          "id": 8715087,
          "entry_number": "225",
          "date_filed": "2016-12-14T00:00:00-05:00",
          "attachments": [],
          "url": "https://www.courtlistener.com/docket/5346556/225/ross-v-gossett/",
          "recap_pdf_url": null,
          "pacer_doc_id": null,
          "description": "NOTICE OF MODIFICATION re 224 Waiver of Service Executed. Parties Steven Estes and Tom Smith were inadvertently not added to case at the time of filing the Amended Complaint(s) which then would not allow the filer to select those parties upon filing the Waiver of Service at Doc. 224. Both parties have now been added to the docket sheet and the entry at Doc. 224 has been modified to reflect those parties and the corrected spelling of their names. (mar)THIS TEXT ENTRY IS AN ORDER OF THE COURT. NO FURTHER DOCUMENTATION WILL BE MAILED. (Entered: 12/14/2016)"
        },
        {
          "row_number": 142,
          "id": 8715089,
          "entry_number": "227",
          "date_filed": "2016-12-14T00:00:00-05:00",
          "attachments": [],
          "url": "https://www.courtlistener.com/docket/5346556/227/ross-v-gossett/",
          "recap_pdf_url": null,
          "pacer_doc_id": "06903667498",
          "description": "WAIVER OF SERVICE Returned Executed by All Plaintiffs. Raymond Allen waiver sent on 11/11/2016, answer due 1/10/2017; James Best waiver sent on 11/11/2016, answer due 1/10/2017; Rodney Brady waiver sent on 11/11/2016, answer due 1/10/2017; Wes Fuchs waiver sent on 11/11/2016, answer due 1/10/2017; Alexander Jones waiver sent on 11/11/2016, answer due 1/10/2017; Michael Monje waiver sent on 11/11/2016, answer due 1/10/2017; Tony Payne Jr waiver sent on 11/11/2016, answer due 1/10/2017; Abby Roberts waiver sent on 11/11/2016, answer due 1/10/2017; Michael Samuel waiver sent on 11/11/2016, answer due 1/10/2017; Todd Sexton waiver sent on 11/11/2016, answer due 1/10/2017; Martin M Tovar waiver sent on 11/11/2016, answer due 1/10/2017. (Attachments: # 1 Waiver of Service Returned Executed by Todd Sexton, # 2 Waiver of Service Returned Executed by Rodney Brady, # 3 Waiver of Service Returned Executed by Michael Samuel, # 4 Waiver of Service Returned Executed by Alexander Jones, # 5 Waiver of Service Returned Executed by Martin Tovar, # 6 Waiver of Service Returned Executed by Wes Fuchs, # 7 Waiver of Service Returned Executed by Abagail Roberts, # 8 Waiver of Service Returned Executed by Tony Payne, # 9 Waiver of Service Returned Executed by Raymond Allen, # 10 Waiver of Service Returned Executed by Michael Monje, # 11 Waiver of Service Returned Executed by Chris Sanders)(Grady, Sarah) (Entered: 12/14/2016)"
        },
        {
          "row_number": 148,
          "id": 8715094,
          "entry_number": "232",
          "date_filed": "2016-12-16T00:00:00-05:00",
          "attachments": [],
          "url": "https://www.courtlistener.com/docket/5346556/232/ross-v-gossett/",
          "recap_pdf_url": null,
          "pacer_doc_id": "06903669039",
          "description": "NOTICE STRIKING ELECTRONICALLY FILED DOCUMENTS striking 231 Waiver of Service Returned Executed as to Arnold Steber. See attached document for specifics. (mar) (Entered: 12/16/2016)"
        },
        {
          "row_number": 150,
          "id": 8715096,
          "entry_number": "234",
          "date_filed": "2016-12-27T00:00:00-05:00",
          "attachments": [],
          "url": "https://www.courtlistener.com/docket/5346556/234/ross-v-gossett/",
          "recap_pdf_url": null,
          "pacer_doc_id": "06903675959",
          "description": "WAIVER OF SERVICE Returned Executed Zach Moore waiver sent on 11/11/2016, answer due 1/10/2017. (jaj) (Entered: 12/27/2016)"
        },
        {
          "row_number": 152,
          "id": 8715098,
          "entry_number": "236",
          "date_filed": "2016-12-28T00:00:00-05:00",
          "attachments": [],
          "url": "https://www.courtlistener.com/docket/5346556/236/ross-v-gossett/",
          "recap_pdf_url": null,
          "pacer_doc_id": "06903677477",
          "description": "WAIVER OF SERVICE Returned Executed by All Plaintiffs. Paul Fletcher waiver sent on 11/11/2016, answer due 1/10/2017; Bill Hopkins waiver sent on 11/11/2016, answer due 1/10/2017. (Attachments: # 1 Waiver of Service Returned Executed by Paul Fletcher, # 2 Waiver of Service Returned Executed by Joe Curry)(Grady, Sarah) (Entered: 12/28/2016)"
        },
        {
          "row_number": 153,
          "id": 8715099,
          "entry_number": "237",
          "date_filed": "2016-12-29T00:00:00-05:00",
          "attachments": [],
          "url": "https://www.courtlistener.com/docket/5346556/237/ross-v-gossett/",
          "recap_pdf_url": null,
          "pacer_doc_id": null,
          "description": "ORDER regarding next status conference. At the next scheduled status conference, among other issues, the Court intends to discuss the proper identity of Defendants in the case. In preparation for that discussion the parties are DIRECTED to meet and confer regarding the proper identities of Defendants in an attempt to come to agreement as to whether some Defendants can by stricken from the case as redundant. Signed by Magistrate Judge Stephen C. Williams on 12/29/2016. (anj)THIS TEXT ENTRY IS AN ORDER OF THE COURT. NO FURTHER DOCUMENTATION WILL BE MAILED. (Entered: 12/29/2016)"
        },
        {
          "row_number": 158,
          "id": 8715103,
          "entry_number": "241",
          "date_filed": "2017-01-10T00:00:00-05:00",
          "attachments": [],
          "url": "https://www.courtlistener.com/docket/5346556/241/ross-v-gossett/",
          "recap_pdf_url": null,
          "pacer_doc_id": "06903684849",
          "description": "WAIVER OF SERVICE Returned Executed by All Plaintiffs. Arnold Steber waiver sent on 11/11/2016, answer due 1/10/2017. (Grady, Sarah) (Entered: 01/10/2017)"
        },
        {
          "row_number": 162,
          "id": 8715107,
          "entry_number": "245",
          "date_filed": "2017-01-10T00:00:00-05:00",
          "attachments": [],
          "url": "https://www.courtlistener.com/docket/5346556/245/ross-v-gossett/",
          "recap_pdf_url": null,
          "pacer_doc_id": "06903685475",
          "description": "MOTION for Extension of Time to File Answer by Nathan Anderson, Mike Austin, Jimmy Bonner, Robin Cherim, Tod Childers, Elliot Daymon, Terry Douglas, Brian Dowdy, Brad Duckworth, Larry Henderson, Ryan McClellan, Matt Plummer, David Teske. (Price, Susannah) (Entered: 01/10/2017)"
        },
        {
          "row_number": 164,
          "id": 8715109,
          "entry_number": "247",
          "date_filed": "2017-01-13T00:00:00-05:00",
          "attachments": [],
          "url": "https://www.courtlistener.com/docket/5346556/247/ross-v-gossett/",
          "recap_pdf_url": null,
          "pacer_doc_id": "06903688087",
          "description": "WAIVER OF SERVICE Returned Executed by All Plaintiffs. Kerrye Annable waiver sent on 12/19/2016, answer due 2/17/2017. (Grady, Sarah) (Entered: 01/13/2017)"
        },
        {
          "row_number": 166,
          "id": 8715111,
          "entry_number": "249",
          "date_filed": "2017-01-18T00:00:00-05:00",
          "attachments": [],
          "url": "https://www.courtlistener.com/docket/5346556/249/ross-v-gossett/",
          "recap_pdf_url": null,
          "pacer_doc_id": null,
          "description": "ORDER granting 243 Motion for Extension of Time to Answer. Answer due February 13, 2017. Signed by Magistrate Judge Stephen C. Williams on 1/18/2017. (anj)THIS TEXT ENTRY IS AN ORDER OF THE COURT. NO FURTHER DOCUMENTATION WILL BE MAILED. (Entered: 01/18/2017)"
        },
        {
          "row_number": 170,
          "id": 8715114,
          "entry_number": "252",
          "date_filed": "2017-01-23T00:00:00-05:00",
          "attachments": [],
          "url": "https://www.courtlistener.com/docket/5346556/252/ross-v-gossett/",
          "recap_pdf_url": null,
          "pacer_doc_id": "06903695174",
          "description": "WAIVER OF SERVICE Returned Executed by All Plaintiffs. Randy Davis waiver sent on 12/19/2016, answer due 2/17/2017. (Grady, Sarah) (Entered: 01/23/2017)"
        },
        {
          "row_number": 171,
          "id": 8715115,
          "entry_number": "253",
          "date_filed": "2017-01-25T00:00:00-05:00",
          "attachments": [
            {
              "recap_id": 156735220,
              "pacer_url": "https://ecf.ilsd.uscourts.gov/doc1/06903697359?caseid=70322",
              "description": "Waiver of Service Returned Executed by Roger Waller",
              "attachment_number": 1
            },
            {
              "recap_id": 156735221,
              "pacer_url": "https://ecf.ilsd.uscourts.gov/doc1/06903697360?caseid=70322",
              "description": "Waiver of Service Returned Executed by Thomas Scott",
              "attachment_number": 2
            },
            {
              "recap_id": 156735222,
              "pacer_url": "https://ecf.ilsd.uscourts.gov/doc1/06903697361?caseid=70322",
              "description": "Waiver of Service Returned Executed by Jeremy Alwerdt",
              "attachment_number": 3
            }
          ],
          "url": "https://www.courtlistener.com/docket/5346556/253/ross-v-gossett/",
          "recap_pdf_url": null,
          "pacer_doc_id": "06903697358",
          "description": "WAIVER OF SERVICE Returned Executed by All Plaintiffs. Jeremy Alwerdt waiver sent on 11/11/2016, answer due 1/10/2017; Donald D Gaetz waiver sent on 12/13/2016, answer due 2/13/2017; Thomas Scott waiver sent on 11/11/2016, answer due 1/10/2017; Roger Waller waiver sent on 1/4/2017, answer due 3/6/2017. (Attachments: # 1 Waiver of Service Returned Executed by Roger Waller, # 2 Waiver of Service Returned Executed by Thomas Scott, # 3 Waiver of Service Returned Executed by Jeremy Alwerdt)(Grady, Sarah) (Entered: 01/25/2017)"
        },
        {
          "row_number": 175,
          "id": 8715119,
          "entry_number": "257",
          "date_filed": "2017-02-09T00:00:00-05:00",
          "attachments": [],
          "url": "https://www.courtlistener.com/docket/5346556/257/ross-v-gossett/",
          "recap_pdf_url": null,
          "pacer_doc_id": null,
          "description": "Minute Entry for proceedings held before Magistrate Judge Stephen C. Williams: Status Conference held on 2/9/2017. Sarah Grady for Plaintiffs. Susannah Price for Defendants. Additional Defendants continue to appear in the case as they are served and request representation. Accordingly, in order to facilitate efficient use of resources, and with no objection from Plaintiffs, Defendants shall have until 2/28/17 to file their answers to Plaintiffs' Amended Complaint. Plaintiffs' have subpoenaed IDOC for the contact information of approximately 25 named defendants who have not yet been served. Counsel are awaiting response to that subpoena which was served in January. For good cause shown, and with no objection from the Defendants, the Court extends the time to effect service of the Amended Complaint on those defendants that are the subject of the subpoena until 3/31/17. The parties have also reached an impasse as to two issues concerning esi: 1) search or personal email, text messages, and social media of Defendants, and 2) the scope of time covering searched for esi - specifically, whether the time near the filing of the complaint should be included in esi searches. These issues will be addressed at the 2/23/17 discovery dispute conference. The parties are allowed an additional 3 pages for their submissions to address these two additional issues. (Court Reporter n/a.) (amv)THIS TEXT ENTRY IS AN ORDER OF THE COURT. NO FURTHER DOCUMENTATION WILL BE MAILED. (Entered: 02/09/2017)"
        },
        {
          "row_number": 179,
          "id": 8715122,
          "entry_number": "260",
          "date_filed": "2017-02-23T00:00:00-05:00",
          "attachments": [],
          "url": "https://www.courtlistener.com/docket/5346556/260/ross-v-gossett/",
          "recap_pdf_url": null,
          "pacer_doc_id": null,
          "description": "Minute Entry for proceedings held before Magistrate Judge Stephen C. Williams: Discovery Dispute Conference held on 2/23/2017. Sarah Grady for Plaintiffs. Susannah Price for Defendants. Written order to follow. (Court Reporter Barb Kniepmann.) (rms2)THIS TEXT ENTRY IS AN ORDER OF THE COURT. NO FURTHER DOCUMENTATION WILL BE MAILED. (Entered: 02/23/2017)"
        },
        {
          "row_number": 184,
          "id": 8715127,
          "entry_number": "265",
          "date_filed": "2017-02-28T00:00:00-05:00",
          "attachments": [],
          "url": "https://www.courtlistener.com/docket/5346556/265/ross-v-gossett/",
          "recap_pdf_url": null,
          "pacer_doc_id": "06903727435",
          "description": "NOTICE of Appearance by Susannah J. Price on behalf of Kerrye Annable, Michael Atchison, John R. Balwin, Ron Beebe, Gordon Belless, Trent Birchfield, Danny Britton, Paul Chapin, Randy Davis, Bruce Fisher, Cory Fuqua, Donald D Gaetz, Bruce Hagaman, Benjamin Haynes, George Holton, Robert Kamp, James Ochs, Sam Peradotta, Christopher Quigley, Bruce Sanders, Harold Schuler, Mike Stanart, Jack Townely, Roger Waller, Rick Yocum, Jay Ziegler (Price, Susannah) (Entered: 02/28/2017)"
        },
        {
          "row_number": 190,
          "id": 8715132,
          "entry_number": "270",
          "date_filed": "2017-03-01T00:00:00-05:00",
          "attachments": [],
          "url": "https://www.courtlistener.com/docket/5346556/270/ross-v-gossett/",
          "recap_pdf_url": null,
          "pacer_doc_id": "06903728325",
          "description": "ANSWER to 197 Amended Complaint by Chris Barber, Joe Curry, Dan Moyers, Zach Payne, Thomas Scott, Nicholas Sroka, Steve Strickell, Caleb Wesley, David White.(Price, Susannah) (Entered: 03/01/2017)"
        },
        {
          "row_number": 191,
          "id": 8715133,
          "entry_number": "271",
          "date_filed": "2017-03-01T00:00:00-05:00",
          "attachments": [],
          "url": "https://www.courtlistener.com/docket/5346556/271/ross-v-gossett/",
          "recap_pdf_url": null,
          "pacer_doc_id": null,
          "description": "ORDER withdrawing 166 Motion to Sever. Plaintiff Tolliver's Motion to Sever at Doc 166 also withdrawn per Order at Doc. 184. Signed by Magistrate Judge Stephen C. Williams on 3/1/2017. (rms2)THIS TEXT ENTRY IS AN ORDER OF THE COURT. NO FURTHER DOCUMENTATION WILL BE MAILED. (Entered: 03/01/2017)"
        },
        {
          "row_number": 192,
          "id": 8715134,
          "entry_number": "272",
          "date_filed": "2017-03-08T00:00:00-05:00",
          "attachments": [],
          "url": "https://www.courtlistener.com/docket/5346556/272/ross-v-gossett/",
          "recap_pdf_url": null,
          "pacer_doc_id": "06903736275",
          "description": "Mail Returned as Undeliverable. Document 259 sent to Plaintiff Clark Truly. (jaj) (Entered: 03/08/2017)"
        },
        {
          "row_number": 193,
          "id": 8715135,
          "entry_number": "273",
          "date_filed": "2017-03-20T00:00:00-04:00",
          "attachments": [],
          "url": "https://www.courtlistener.com/docket/5346556/273/ross-v-gossett/",
          "recap_pdf_url": null,
          "pacer_doc_id": null,
          "description": "ORDER CONSOLIDATING CASE. Plaintiff's Complaint in Fisher v. McCallistor, Case No. 15-cv-00007-SMY-RJD concerns shakedowns performed by the Orange Crush Tactical Team at Menard Correctional Center. The Complaint is similar to the pleading in Ross v. Gossett, Case No. 15-cv-309-SMY-SCW, which was filed in this Court on March 19, 2015. Due to similarities between the two cases and the need to consolidate judicial resources concerning Orange Crush cases, this matter is hereby CONSOLIDATED with the lead case, Ross v. Gossett et al., 15-cv-309. The currently scheduled Final Pretrial Conference and trial settings are hereby VACATED. Further, Defendants' motion for summary judgment (Doc. 39) is DENIED without prejudice and may be refiled in accordance with Judge Williams' scheduling and case management orders in 15-cv-309. All future documents shall be filed in the aforementioned case. A copy of this order shall be filed in both cases. The Clerk of Court is DIRECTED to consolidate the two cases. Signed by Judge Staci M. Yandle on 3/20/2017. (tfs)THIS TEXT ENTRY IS AN ORDER OF THE COURT. NO FURTHER DOCUMENTATION WILL BE MAILED. (Entered: 03/20/2017)"
        },
        {
          "row_number": 201,
          "id": 8715142,
          "entry_number": "280",
          "date_filed": "2017-03-28T00:00:00-04:00",
          "attachments": [],
          "url": "https://www.courtlistener.com/docket/5346556/280/ross-v-gossett/",
          "recap_pdf_url": null,
          "pacer_doc_id": "06903755756",
          "description": "Summons Requested. (Grady, Sarah) (Entered: 03/28/2017)"
        },
        {
          "row_number": 207,
          "id": 8715148,
          "entry_number": "286",
          "date_filed": "2017-03-31T00:00:00-04:00",
          "attachments": [],
          "url": "https://www.courtlistener.com/docket/5346556/286/ross-v-gossett/",
          "recap_pdf_url": null,
          "pacer_doc_id": null,
          "description": "NOTICE OF Modification re 284 Notice (Other) filed by Robert Adams, Steve Albrecht, Pat Anderson, Khorey Anderton, Brendan Ankrom, Officer Armstrong, Sarah Arnett, Bradley Ausbrook, Bryan Bailey, Gene Bailey, Shawn Bailliez, Mike Baughman, Derek Bay. Incorrect event selected. For this document, the correct event is \"Motion to Withdraw\" under the heading \"Motions and Related Filings/Motions\". Docket text modified to reflect the correct document. No further action required by the filer.(tjm2)THIS TEXT ENTRY IS AN ORDER OF THE COURT. NO FURTHER DOCUMENTATION WILL BE MAILED. (Entered: 03/31/2017)"
        },
        {
          "row_number": 209,
          "id": 8715150,
          "entry_number": "288",
          "date_filed": "2017-03-31T00:00:00-04:00",
          "attachments": [
            {
              "recap_id": 156735237,
              "pacer_url": "https://ecf.ilsd.uscourts.gov/doc1/06903759337?caseid=70322",
              "description": "Exhibit List",
              "attachment_number": 1
            },
            {
              "recap_id": 156735238,
              "pacer_url": "https://ecf.ilsd.uscourts.gov/doc1/06903759338?caseid=70322",
              "description": "Exhibit A",
              "attachment_number": 2
            },
            {
              "recap_id": 156735239,
              "pacer_url": "https://ecf.ilsd.uscourts.gov/doc1/06903759339?caseid=70322",
              "description": "Exhibit B",
              "attachment_number": 3
            },
            {
              "recap_id": 156735241,
              "pacer_url": "https://ecf.ilsd.uscourts.gov/doc1/06903759340?caseid=70322",
              "description": "Exhibit C",
              "attachment_number": 4
            },
            {
              "recap_id": 156735242,
              "pacer_url": "https://ecf.ilsd.uscourts.gov/doc1/06903759341?caseid=70322",
              "description": "Exhibit D",
              "attachment_number": 5
            },
            {
              "recap_id": 156735243,
              "pacer_url": "https://ecf.ilsd.uscourts.gov/doc1/06903759342?caseid=70322",
              "description": "Exhibit E",
              "attachment_number": 6
            }
          ],
          "url": "https://www.courtlistener.com/docket/5346556/288/ross-v-gossett/",
          "recap_pdf_url": null,
          "pacer_doc_id": "06903759336",
          "description": "MOTION for Extension of Time to Complete Service by James E Dunmore, Kevin L Hamilton, Demetrius Ross, Ronald Smith, Jonathan Tolliver, Glenn Verser, Zachary Watts. (Attachments: # 1 Exhibit List, # 2 Exhibit A, # 3 Exhibit B, # 4 Exhibit C, # 5 Exhibit D, # 6 Exhibit E)(Grady, Sarah) (Entered: 03/31/2017)"
        },
        {
          "row_number": 210,
          "id": 8715151,
          "entry_number": "289",
          "date_filed": "2017-04-03T00:00:00-04:00",
          "attachments": [],
          "url": "https://www.courtlistener.com/docket/5346556/289/ross-v-gossett/",
          "recap_pdf_url": null,
          "pacer_doc_id": null,
          "description": "ORDER striking 287 Motion on How to Proceed. Plaintiff Clark's case has been consolidated into this proposed class action, and Plaintiff Clark now proceeds represented by the law firm of Loevy & Loevy. The court will not accept motions filed by the individual plaintiffs while they are represented by counsel, unless it is a motion seeking to have counsel removed. The Clerk of Court is DIRECTED to strike Plaintiff Clark's motion at Doc. 287. Signed by Magistrate Judge Stephen C. Williams on 4/3/2017. (rms2)THIS TEXT ENTRY IS AN ORDER OF THE COURT. NO FURTHER DOCUMENTATION WILL BE MAILED. (Entered: 04/03/2017)"
        },
        {
          "row_number": 212,
          "id": 8715152,
          "entry_number": "290",
          "date_filed": "2017-04-03T00:00:00-04:00",
          "attachments": [],
          "url": "https://www.courtlistener.com/docket/5346556/290/ross-v-gossett/",
          "recap_pdf_url": null,
          "pacer_doc_id": null,
          "description": "ORDER granting 288 Motion for Extension of Time. Plaintiffs have demonstrated good cause under Rule 4(m), and their Motion for Extension of Time is GRANTED. Plaintiffs shall complete service on the 28 Defendants named in their motion no later than May 15, 2017. Signed by Magistrate Judge Stephen C. Williams on 4/3/2017. (rms2)THIS TEXT ENTRY IS AN ORDER OF THE COURT. NO FURTHER DOCUMENTATION WILL BE MAILED. (Entered: 04/03/2017)"
        },
        {
          "row_number": 213,
          "id": 8715153,
          "entry_number": "291",
          "date_filed": "2017-04-03T00:00:00-04:00",
          "attachments": [
            {
              "recap_id": 156735240,
              "pacer_url": "https://ecf.ilsd.uscourts.gov/doc1/06903759903?caseid=70322",
              "description": "Waiver of Service Returned Executed by Lisa Harris",
              "attachment_number": 1
            }
          ],
          "url": "https://www.courtlistener.com/docket/5346556/291/ross-v-gossett/",
          "recap_pdf_url": null,
          "pacer_doc_id": "06903759902",
          "description": "WAIVER OF SERVICE Returned Executed by All Plaintiffs. Lisa Harris waiver sent on 3/16/2017, answer due 5/15/2017; Dennis Urhig waiver sent on 3/16/2017, answer due 5/15/2017. (Attachments: # 1 Waiver of Service Returned Executed by Lisa Harris)(Grady, Sarah) (Entered: 04/03/2017)"
        },
        {
          "row_number": 214,
          "id": 8715154,
          "entry_number": "292",
          "date_filed": "2017-04-03T00:00:00-04:00",
          "attachments": [],
          "url": "https://www.courtlistener.com/docket/5346556/292/ross-v-gossett/",
          "recap_pdf_url": null,
          "pacer_doc_id": null,
          "description": "ORDER: Defendants filed an appeal of Judge Williams' Order (Doc. 215 ) regarding a discovery dispute, in which he ordered Defendants to produce the operations orders relevant to this case in an unredacted format, but limited to Attorney's Eyes Only (Doc. 203 ). Defendants have now filed a Motion to Withdraw the Appeal of Magistrate Judge Decision (Doc. 284 ). Defendants' Motion to Withdraw the Appeal is GRANTED. Defendants are ORDERED to comply with Judge Williams' Order at (Doc. 203 ) on or before April 10, 2017. Defendants' appeal (Doc. 215 ) is TERMINATED as MOOT. Signed by Judge Staci M. Yandle on 4/3/2017. (tfs)THIS TEXT ENTRY IS AN ORDER OF THE COURT. NO FURTHER DOCUMENTATION WILL BE MAILED. (Entered: 04/03/2017)"
        },
        {
          "row_number": 848,
          "id": 8715156,
          "entry_number": null,
          "date_filed": "2017-04-04T00:00:00-04:00",
          "attachments": [],
          "url": "https://www.courtlistener.com",
          "recap_pdf_url": null,
          "pacer_doc_id": null,
          "description": "Set/Reset Deadlines"
        },
        {
          "row_number": 215,
          "id": 8715157,
          "entry_number": "293",
          "date_filed": "2017-04-04T00:00:00-04:00",
          "attachments": [],
          "url": "https://www.courtlistener.com/docket/5346556/293/ross-v-gossett/",
          "recap_pdf_url": null,
          "pacer_doc_id": null,
          "description": "ORDER CONSOLIDATING CASE. Plaintiff's Complaint in Clark v. Tact Team et al., Case No. 17-cv-00146-SMY-RJD concerns shakedowns performed by the Orange Crush Tactical Team. The Complaint is similar to the pleading in Ross v. Gossett, Case No. 15-cv-309-SMY-SCW, which was filed in this Court on March 19, 2015. Due to similarities between the two cases and the need to consolidate judicial resources concerning Orange Crush cases, this matter is hereby CONSOLIDATED with the lead case, Ross v. Gossett et al., 15-cv-309. All future documents shall be filed in the aforementioned case. A copy of this order shall be filed in both cases. The Clerk of Court is DIRECTED to consolidate the two cases. Signed by Judge Staci M. Yandle on 4/4/2017. (tfs)THIS TEXT ENTRY IS AN ORDER OF THE COURT. NO FURTHER DOCUMENTATION WILL BE MAILED. (Entered: 04/04/2017)"
        },
        {
          "row_number": 216,
          "id": 8715158,
          "entry_number": "294",
          "date_filed": "2017-04-06T00:00:00-04:00",
          "attachments": [
            {
              "recap_id": 156735244,
              "pacer_url": "https://ecf.ilsd.uscourts.gov/doc1/06903763743?caseid=70322",
              "description": "Waiver of Service Returned Executed by Scott Petijean",
              "attachment_number": 1
            }
          ],
