{
  "case_id": 44186,
  "fetched_at": "2025-10-22T00:40:53.786107",
  "case_data": {
    "attorney_orgs": [],
    "available_documents": [
      "Trial Court Docket",
      "Complaint (any)",
      "Any published opinion"
    ],
    "case_defendants": [
      {
        "defendant_level": null,
        "institution": "",
        "institution_alt_state": null,
        "institution_city": "",
        "institution_county": null,
        "name": "SeaWorld Parks & Entertainment, Inc.",
        "defendant_level_other": "",
        "is_active": true
      },
      {
        "defendant_level": null,
        "institution": "",
        "institution_alt_state": null,
        "institution_city": "",
        "institution_county": null,
        "name": "Sesame Place Philadelphia",
        "defendant_level_other": "",
        "is_active": true
      },
      {
        "defendant_level": null,
        "institution": "",
        "institution_alt_state": null,
        "institution_city": "",
        "institution_county": null,
        "name": "SeaWorld Parks & Entertainment LLC",
        "defendant_level_other": "",
        "is_active": true
      }
    ],
    "case_ongoing": "Yes",
    "case_status": "Approved",
    "case_types": [
      "Public Accommodations/Contracting"
    ],
    "cause_other": "",
    "causes": [
      "42 U.S.C. ยง 1981",
      "State law"
    ],
    "class_action_granted": "Denied",
    "class_action_sought": "Yes",
    "closing_year": null,
    "constitutional_clause": [],
    "content_of_injunction": [],
    "court": "Eastern District of Pennsylvania",
    "custom_issues": [],
    "defendant_payment": "",
    "defendant_type": [
      {
        "value": "Movie Theater or Other Entertainment facility"
      }
    ],
    "docket_status": "Complete as of retrieval date",
    "facility_type": [
      {
        "value": "Non-government for-profit"
      }
    ],
    "filing_date": "2022-07-27",
    "filing_year": 2022,
    "id": 44186,
    "injunction_duration": "",
    "issues": [
      "General/Misc.: Staff (number, training, qualifications, wages)",
      "General/Misc.: Food service / nutrition / hydration",
      "General/Misc.: Juveniles",
      "Affected National Origin/Ethnicity(s), Affected Language(s), General/Misc.: Other",
      "General/Misc.: Failure to supervise",
      "Discrimination Basis: Race discrimination",
      "Affected Race(s): Black",
      "Affected National Origin/Ethnicity(s): Hispanic",
      "General/Misc.: Failure to train",
      "Discrimination Area: Disparate Treatment",
      "General/Misc.: Pattern or Practice"
    ],
    "last_checked_date": "2025-04-17T00:00:00-04:00",
    "main_docket": {
      "id": 57780,
      "docket_entries": [
        {
          "row_number": 186,
          "id": 10167079,
          "entry_number": "267",
          "date_filed": "2025-01-17T00:00:00-05:00",
          "attachments": null,
          "url": "https://www.courtlistener.com/docket/64436633/267/burns-v-seaworld-parks-entertainment-inc/",
          "recap_pdf_url": "https://www.courtlistener.com/recap/gov.uscourts.paed.599124/gov.uscourts.paed.599124.267.0.pdf",
          "pacer_doc_id": "153022586134",
          "description": "MEMORANDUM AND/OR OPINION. SIGNED BY DISTRICT JUDGE WENDY BEETLESTONE ON 1/17/25. 1/21/25 ENTERED AND COPIES E-MAILED.(rf, ) (Entered: 01/21/2025)"
        },
        {
          "row_number": 187,
          "id": 10167080,
          "entry_number": "268",
          "date_filed": "2025-01-17T00:00:00-05:00",
          "attachments": null,
          "url": "https://www.courtlistener.com/docket/64436633/268/burns-v-seaworld-parks-entertainment-inc/",
          "recap_pdf_url": "https://www.courtlistener.com/recap/gov.uscourts.paed.599124/gov.uscourts.paed.599124.268.0.pdf",
          "pacer_doc_id": "153022586137",
          "description": "MEMORANDUM AND ORDER THAT MOTION FOR RELIEF (DOC. 258) IS DENIED. SIGNED BY DISTRICT JUDGE WENDY BEETLESTONE ON 1/17/25. 1/21/25 ENTERED AND COPIES E-MAILED.(rf, ) (Entered: 01/21/2025)"
        },
        {
          "row_number": 190,
          "id": 10167082,
          "entry_number": "270",
          "date_filed": "2025-03-05T00:00:00-05:00",
          "attachments": null,
          "url": "https://www.courtlistener.com/docket/64436633/270/burns-v-seaworld-parks-entertainment-inc/",
          "recap_pdf_url": null,
          "pacer_doc_id": "153022698336",
          "description": "Joint MOTION to Seal filed by NATHAN FLEMING.Memorandum, Certificate of Service. (Attachments: # 1 Memorandum, # 2 Certificate of Service, # 3 Text of Proposed Order)(MARGULIES, RICHARD) (Entered: 03/05/2025)"
        },
        {
          "row_number": 201,
          "id": 9086143,
          "entry_number": "33",
          "date_filed": "2022-12-14T00:00:00-05:00",
          "attachments": [],
          "url": "https://www.courtlistener.com/docket/64436633/33/burns-v-seaworld-parks-entertainment-inc/",
          "recap_pdf_url": null,
          "pacer_doc_id": "153020854605",
          "description": "REPLY to Response to Motion re 29 MOTION TO DISMISS FOR FAILURE TO STATE A CLAIM MOTION to Dismiss for Lack of Jurisdiction filed by SEAWORLD PARKS & ENTERTAINMENT LLC, SEAWORLD PARKS & ENTERTAINMENT, INC.. (Attachments: # 1 Certificate of Service)(SKIPPER, LEIGH) (Entered: 12/14/2022)"
        },
        {
          "row_number": 274,
          "id": 9086153,
          "entry_number": null,
          "date_filed": "2023-05-05T00:00:00-04:00",
          "attachments": [],
          "url": "https://www.courtlistener.com",
          "recap_pdf_url": null,
          "pacer_doc_id": null,
          "description": "Notice of Hearing on Motion"
        },
        {
          "row_number": 267,
          "id": 9086208,
          "entry_number": "93",
          "date_filed": "2023-11-13T00:00:00-05:00",
          "attachments": [],
          "url": "https://www.courtlistener.com/docket/64436633/93/burns-v-seaworld-parks-entertainment-inc/",
          "recap_pdf_url": null,
          "pacer_doc_id": "153021578198",
          "description": "JOINT STIPULATION AND ORDER THAT DAUBERT MOTIONS DUE BY 12/18/2023., MOTION FOR SUMMARY JUDGMENT DUE BY 12/18/2023. ALL OTHER SCHEDULING ORDER DEADLINES OUTLINED HEREIN. SIGNED BY HONORABLE WENDY BEETLESTONE ON 11/13/23. 11/13/23 ENTERED AND COPIES E-MAILED.(rf, ) (Entered: 11/13/2023)"
        },
        {
          "row_number": 270,
          "id": 9086211,
          "entry_number": "96",
          "date_filed": "2023-11-20T00:00:00-05:00",
          "attachments": [],
          "url": "https://www.courtlistener.com/docket/64436633/96/burns-v-seaworld-parks-entertainment-inc/",
          "recap_pdf_url": "https://www.courtlistener.com/recap/gov.uscourts.paed.599124/gov.uscourts.paed.599124.96.0.pdf",
          "pacer_doc_id": "153021592912",
          "description": "ORDER THAT THE REPORT AND RECOMMENDATION OF THE SPECIAL MASTER (ECF NO. 79 ) IS HEREBY APPROVED AND THEREFORE ORDERED THAT PLAINTIFFS' LETTER MOTION TO COMPEL DISCOVERY IS GRANTED IN PART AND DENIED IN PART AS OUTLINED HEREIN. SIGNED BY HONORABLE WENDY BEETLESTONE ON 11/17/2023. 11/20/20023 ENTERED AND COPIES E-MAILED.(nd) (Entered: 11/20/2023)"
        },
        {
          "row_number": 53,
          "id": 9086268,
          "entry_number": "147",
          "date_filed": "2024-04-26T00:00:00-04:00",
          "attachments": [],
          "url": "https://www.courtlistener.com/docket/64436633/147/burns-v-seaworld-parks-entertainment-inc/",
          "recap_pdf_url": null,
          "pacer_doc_id": "153021967612",
          "description": "Second MOTION in Limine to Exclude the Testimony of Barbara Simmons and Testimony and Argument Regarding Racial Incidents in Bucks County filed by SEAWORLD PARKS & ENTERTAINMENT LLC, SEAWORLD PARKS & ENTERTAINMENT, INC..Memorandum, Certificate of Service. (Attachments: # 1 Memorandum, # 2 Exhibit 1 - Excerpts from Deposition of B. Simmons, # 3 Exhibit 2 - Excerpts from Deposition of K. Connelly, # 4 Exhibit 3 - Plaintiffs' Rule 26(a)(2) Disclosures, # 5 Exhibit 4 - Peace Center Tracking Bias Incidents Spreadsheet, # 6 Text of Proposed Order, # 7 Certificate of Service)(SKIPPER, LEIGH) (Entered: 04/26/2024)"
        },
        {
          "row_number": 150,
          "id": 9086362,
          "entry_number": "234",
          "date_filed": "2024-09-04T00:00:00-04:00",
          "attachments": [],
          "url": "https://www.courtlistener.com/docket/64436633/234/burns-v-seaworld-parks-entertainment-inc/",
          "recap_pdf_url": null,
          "pacer_doc_id": "153022280247",
          "description": "MEMORANDUM of Law in Support re 233 MOTION for Sanctions filed by SEAWORLD PARKS & ENTERTAINMENT LLC, SEAWORLD PARKS & ENTERTAINMENT, INC., Declaration, Exhibits.(FILED UNDER SEAL) (md) (Additional attachment(s) added on 9/5/2024: # 1 Sealed Document, # 2 Sealed Document, # 3 Sealed Document, # 4 Sealed Document, # 5 Sealed Document, # 6 Sealed Document, # 7 Sealed Document) (md). (Entered: 09/05/2024)"
        },
        {
          "row_number": 157,
          "id": 9086368,
          "entry_number": "240",
          "date_filed": "2024-09-16T00:00:00-04:00",
          "attachments": [],
          "url": "https://www.courtlistener.com/docket/64436633/240/burns-v-seaworld-parks-entertainment-inc/",
          "recap_pdf_url": null,
          "pacer_doc_id": "153022306550",
          "description": "MEMORANDUM of Law in Support re Oral Motion for Judgment as a Matter of Law pursuant to FRCP 50(a) filed by SEAWORLD PARKS & ENTERTAINMENT LLC, SEAWORLD PARKS & ENTERTAINMENT, INC. (Attachments: # 1 Certificate of Service)(SKIPPER, LEIGH) Modified on 9/18/2024 (md). (Entered: 09/16/2024)"
        },
        {
          "row_number": 174,
          "id": 9260203,
          "entry_number": "256",
          "date_filed": "2024-09-19T00:00:00-04:00",
          "attachments": [],
          "url": "https://www.courtlistener.com/docket/64436633/256/burns-v-seaworld-parks-entertainment-inc/",
          "recap_pdf_url": null,
          "pacer_doc_id": "153022314400",
          "description": "Notice of Filing of Official Transcript with Certificate of Service re 254 Transcript - PDF, 255 Transcript - PDF, 253 Transcript - PDF, 252 Transcript - PDF, 250 Transcript - PDF, 251 Transcript - PDF, 9/19/24 Entered and Copies Emailed and Mailed.. (rf, ) (Entered: 09/19/2024)"
        },
        {
          "row_number": 193,
          "id": 10167085,
          "entry_number": "273",
          "date_filed": "2025-03-07T00:00:00-05:00",
          "attachments": null,
          "url": "https://www.courtlistener.com/docket/64436633/273/burns-v-seaworld-parks-entertainment-inc/",
          "recap_pdf_url": null,
          "pacer_doc_id": "153022705901",
          "description": "ORDER FILED UNDER SEAL. THE CLERK OF COURT IS FURTHER DIRECTED TO TERMINATE THIS CASE AND MARK IT AS CLOSED. SIGNED BY DISTRICT JUDGE WENDY BEETLESTONE ON 3/7/2025. 3/7/2025 ENTERED AND COPIES E-MAILED.(md) (md). (ATTY FAUBLAS TO BE MAILED; EMAIL UNSUCCESSFUL) Modified on 3/7/2025 (md). (Entered: 03/07/2025)"
        },
        {
          "row_number": 185,
          "id": 10261250,
          "entry_number": "266",
          "date_filed": "2024-09-18T00:00:00-04:00",
          "attachments": null,
          "url": "https://www.courtlistener.com/docket/64436633/266/burns-v-seaworld-parks-entertainment-inc/",
          "recap_pdf_url": null,
          "pacer_doc_id": "153022560862",
          "description": "FINAL VERDICT FORM. (rf, ) (Entered: 01/09/2025)"
        },
        {
          "row_number": 14,
          "id": 9086226,
          "entry_number": "111",
          "date_filed": "2023-12-18T00:00:00-05:00",
          "attachments": [],
          "url": "https://www.courtlistener.com/docket/64436633/111/burns-v-seaworld-parks-entertainment-inc/",
          "recap_pdf_url": null,
          "pacer_doc_id": "153021657572",
          "description": "Statement of Undisputed Material Facts and Joint Appendix re 108 MOTION for Summary Judgment filed by SEAWORLD PARKS & ENTERTAINMENT LLC, SEAWORLD PARKS & ENTERTAINMENT, INC.(FILED UNDER SEAL)(md) (Additional attachment(s) added on 12/19/2023: # 1 Sealed Document) (md). (Entered: 12/19/2023)"
        },
        {
          "row_number": 160,
          "id": 9086373,
          "entry_number": "243",
          "date_filed": "2024-09-18T00:00:00-04:00",
          "attachments": [],
          "url": "https://www.courtlistener.com/docket/64436633/243/burns-v-seaworld-parks-entertainment-inc/",
          "recap_pdf_url": null,
          "pacer_doc_id": "153022312592",
          "description": "NOTICE by SEAWORLD PARKS & ENTERTAINMENT LLC, SEAWORLD PARKS & ENTERTAINMENT, INC. Notice of Lodging (Attachments: # 1 Exhibit A - September 10, 2024 Bench Memo re Dennis Brislin, # 2 Exhibit B - September 10, 2024 Bench Memo re: Lauren Willie, # 3 Exhibit C - September 9, 2024 Bench Memo re: Fed. R. Evid. 613, # 4 Certificate of Service)(SKIPPER, LEIGH) (Entered: 09/18/2024)"
        },
        {
          "row_number": 168,
          "id": 9260197,
          "entry_number": "250",
          "date_filed": "2024-09-19T00:00:00-04:00",
          "attachments": [],
          "url": "https://www.courtlistener.com/docket/64436633/250/burns-v-seaworld-parks-entertainment-inc/",
          "recap_pdf_url": null,
          "pacer_doc_id": "153022314259",
          "description": "TRANSCRIPT of CIVIL JURY TRIAL DAY ONE held on 9/9/24, before Judge BEETLESTONE. Court Reporter/Transcriber B. SCHANFELDER. Transcript may be viewed at the court public terminal or purchased through the Court Reporter/Transcriber before the deadline for Release of Transcript Restriction. After that date it may be obtained through PACER.. Redaction Request due 10/10/2024. Redacted Transcript Deadline set for 10/21/2024. Release of Transcript Restriction set for 12/18/2024. (rf, ) (Entered: 09/19/2024)"
        },
        {
          "row_number": 246,
          "id": 9086187,
          "entry_number": "74",
          "date_filed": "2023-09-29T00:00:00-04:00",
          "attachments": [],
          "url": "https://www.courtlistener.com/docket/64436633/74/burns-v-seaworld-parks-entertainment-inc/",
          "recap_pdf_url": null,
          "pacer_doc_id": "153021487262",
          "description": "RESPONSE in Opposition re 65 MOTION to Quash Subpoena to Non-Party Sadiqa Reynolds filed by QUINTON BURNS. (Attachments: # 1 Exhibit Ex. 1 selections from Paul Schweizer's Deposition, # 2 Exhibit Ex 2 selections from Kaylah Connelly's Deposition, # 3 Exhibit Ex 3 selections from Kienna Childs Alexander's Deposition, # 4 Exhibit Ex 4 Sesame Place press release 7/23/22, # 5 Exhibit Ex 5 Sesame Place press release 8/9/22, # 6 Exhibit Ex 6 Court Order, # 7 Exhibit Ex 7 Plaintiffs' Rule 34 discovery, # 8 Text of Proposed Order Proposed Order)(RICHARDSON, RONALD) (Entered: 09/29/2023)"
        },
        {
          "row_number": 269,
          "id": 9086210,
          "entry_number": "95",
          "date_filed": "2023-11-15T00:00:00-05:00",
          "attachments": [],
          "url": "https://www.courtlistener.com/docket/64436633/95/burns-v-seaworld-parks-entertainment-inc/",
          "recap_pdf_url": null,
          "pacer_doc_id": "153021585008",
          "description": "NOTICE: The settlement conference that was scheduled for November 8, 2023 is rescheduled to February 6, 2024 via the internet at 2:00 p.m., before the Honorable Richard A. Lloret, United States Magistrate Judge. Please email all participants names and emails to sheila_mccurry@paed.uscourts.gov by January 30, 2024. The ZOOM log-on information will be emailed prior to the conference. The status call that was scheduled for November 1, 2023 is rescheduled to January 30, 2024 at 10:00 a.m. Counsel will call chambers call-in number which was provided via e-mail. Please complete the attached summary and e-mail it to Chambers at sheila_mccurry@paed.uscourts.gov on or before January 30, 2024. If it is NOT emailed by then Judge Lloret may CANCEL the settlement conference.(smcc) (Entered: 11/15/2023)"
        },
        {
          "row_number": 251,
          "id": 9086193,
          "entry_number": "79",
          "date_filed": "2023-10-03T00:00:00-04:00",
          "attachments": [],
          "url": "https://www.courtlistener.com/docket/64436633/79/burns-v-seaworld-parks-entertainment-inc/",
          "recap_pdf_url": null,
          "pacer_doc_id": "153021494576",
          "description": "Report Of Report and Recommendation of Special Master Amy Kurland, Esquire by AMY KURLAND. (Attachments: # 1 Text of Proposed Order, # 2 Exhibit A, # 3 Exhibit B, # 4 Exhibit C, # 5 Exhibit D, # 6 Exhibit E, # 7 Exhibit F, # 8 Exhibit G)(KURLAND, AMY) (Entered: 10/03/2023)"
        },
        {
          "row_number": 111,
          "id": 9086112,
          "entry_number": "2",
          "date_filed": "2022-07-28T00:00:00-04:00",
          "attachments": [],
          "url": "https://www.courtlistener.com/docket/64436633/2/burns-v-seaworld-parks-entertainment-inc/",
          "recap_pdf_url": null,
          "pacer_doc_id": "153020535554",
          "description": "Summons Issued as to SEAWORLD PARKS & ENTERTAINMENT LLC, SEAWORLD PARKS & ENTERTAINMENT, INC.. Forwarded To: COUNSEL on 7/28/22 (bw) (Entered: 07/28/2022)"
        },
        {
          "row_number": 197,
          "id": 9086113,
          "entry_number": "3",
          "date_filed": "2022-08-05T00:00:00-04:00",
          "attachments": [],
          "url": "https://www.courtlistener.com/docket/64436633/3/burns-v-seaworld-parks-entertainment-inc/",
          "recap_pdf_url": null,
          "pacer_doc_id": "153020556245",
          "description": "WAIVER OF SERVICE Returned Executed by QUINTON BURNS. SEAWORLD PARKS & ENTERTAINMENT LLC waiver sent on 8/4/2022, answer due 10/3/2022. (HARRIS, MARTELL) (Entered: 08/05/2022)"
        },
        {
          "row_number": 208,
          "id": 9086114,
          "entry_number": "4",
          "date_filed": "2022-08-16T00:00:00-04:00",
          "attachments": [],
          "url": "https://www.courtlistener.com/docket/64436633/4/burns-v-seaworld-parks-entertainment-inc/",
          "recap_pdf_url": null,
          "pacer_doc_id": "153020576645",
          "description": "First MOTION for Pro Hac Vice for Attorney Malcolm P. Ruff ( Filing fee $ 40 receipt number APAEDC-16112849.) filed by QUINTON BURNS.Certificate of Service.(HARRIS, MARTELL) (Entered: 08/16/2022)"
        },
        {
          "row_number": 219,
          "id": 9086115,
          "entry_number": "5",
          "date_filed": "2022-08-16T00:00:00-04:00",
          "attachments": [],
          "url": "https://www.courtlistener.com/docket/64436633/5/burns-v-seaworld-parks-entertainment-inc/",
          "recap_pdf_url": null,
          "pacer_doc_id": "153020576659",
          "description": "First MOTION for Pro Hac Vice William H. Murphy, Jr. ( Filing fee $ 40 receipt number APAEDC-16112856.) filed by QUINTON BURNS.Certificate of Service.(HARRIS, MARTELL) (Entered: 08/16/2022)"
        },
        {
          "row_number": 230,
          "id": 9086116,
          "entry_number": "6",
          "date_filed": "2022-08-16T00:00:00-04:00",
          "attachments": [],
          "url": "https://www.courtlistener.com/docket/64436633/6/burns-v-seaworld-parks-entertainment-inc/",
          "recap_pdf_url": null,
          "pacer_doc_id": "153020576664",
          "description": "First MOTION for Pro Hac Vice for Attorney Andrew K. O'Connell ( Filing fee $ 40 receipt number APAEDC-16112858.) filed by QUINTON BURNS.Certificate of Service.(HARRIS, MARTELL) (Entered: 08/16/2022)"
        },
        {
          "row_number": 241,
          "id": 9086117,
          "entry_number": "7",
          "date_filed": "2022-08-16T00:00:00-04:00",
          "attachments": [],
          "url": "https://www.courtlistener.com/docket/64436633/7/burns-v-seaworld-parks-entertainment-inc/",
          "recap_pdf_url": null,
          "pacer_doc_id": "153020576670",
          "description": "First MOTION for Pro Hac Vice for Attorney Ronald E. Richardson ( Filing fee $ 40 receipt number APAEDC-16112862.) filed by QUINTON BURNS.Certificate of Service.(HARRIS, MARTELL) (Entered: 08/16/2022)"
        },
        {
          "row_number": 252,
          "id": 9086118,
          "entry_number": "8",
          "date_filed": "2022-08-18T00:00:00-04:00",
          "attachments": [],
          "url": "https://www.courtlistener.com/docket/64436633/8/burns-v-seaworld-parks-entertainment-inc/",
          "recap_pdf_url": null,
          "pacer_doc_id": "153020580669",
          "description": "NOTICE of Appearance by LEIGH MICHAEL SKIPPER on behalf of SEAWORLD PARKS & ENTERTAINMENT LLC, SEAWORLD PARKS & ENTERTAINMENT, INC. with Certificate of Service (Attachments: # 1 Certificate of Service)(SKIPPER, LEIGH) (Entered: 08/18/2022)"
        },
        {
          "row_number": 263,
          "id": 9086119,
          "entry_number": "9",
          "date_filed": "2022-08-18T00:00:00-04:00",
          "attachments": [],
          "url": "https://www.courtlistener.com/docket/64436633/9/burns-v-seaworld-parks-entertainment-inc/",
          "recap_pdf_url": null,
          "pacer_doc_id": "153020580724",
          "description": "NOTICE of Appearance by Aleksander Smolij on behalf of SEAWORLD PARKS & ENTERTAINMENT LLC with Cert of Service (Attachments: # 1 Certificate of Service)(Smolij, Aleksander) (Entered: 08/18/2022)"
        },
        {
          "row_number": 1,
          "id": 9086120,
          "entry_number": "10",
          "date_filed": "2022-08-18T00:00:00-04:00",
          "attachments": [],
          "url": "https://www.courtlistener.com/docket/64436633/10/burns-v-seaworld-parks-entertainment-inc/",
          "recap_pdf_url": null,
          "pacer_doc_id": "153020580856",
          "description": "NOTICE of Appearance by Aleksander Smolij on behalf of SEAWORLD PARKS & ENTERTAINMENT, INC. with Certificate of Service (Attachments: # 1 Certificate of Service)(Smolij, Aleksander) (Entered: 08/18/2022)"
        },
        {
          "row_number": 12,
          "id": 9086121,
          "entry_number": "11",
          "date_filed": "2022-08-18T00:00:00-04:00",
          "attachments": [],
          "url": "https://www.courtlistener.com/docket/64436633/11/burns-v-seaworld-parks-entertainment-inc/",
          "recap_pdf_url": null,
          "pacer_doc_id": "153020581656",
          "description": "ORDER THAT APPLICATION FOR PRO HAC VICE ADMISSION OF MALCOLM P. RUFF IS GRANTED. SIGNED BY HONORABLE WENDY BEETLESTONE ON 8/18/22. 8/18/22 ENTERED AND COPIES E-MAILED.(rf, ) (Entered: 08/18/2022)"
        },
        {
          "row_number": 23,
          "id": 9086122,
          "entry_number": "12",
          "date_filed": "2022-08-18T00:00:00-04:00",
          "attachments": [],
          "url": "https://www.courtlistener.com/docket/64436633/12/burns-v-seaworld-parks-entertainment-inc/",
          "recap_pdf_url": null,
          "pacer_doc_id": "153020581662",
          "description": "ORDER THAT APPLICATION FOR PRO HAC VICE ADMISSION OF WILLIAM H. MURPHY JR IS GRANTED. SIGNED BY HONORABLE WENDY BEETLESTONE ON 8/18/22. 8/18/22 ENTERED AND COPIES E-MAILED.(rf, ) (Entered: 08/18/2022)"
        },
        {
          "row_number": 34,
          "id": 9086123,
          "entry_number": "13",
          "date_filed": "2022-08-18T00:00:00-04:00",
          "attachments": [],
          "url": "https://www.courtlistener.com/docket/64436633/13/burns-v-seaworld-parks-entertainment-inc/",
          "recap_pdf_url": null,
          "pacer_doc_id": "153020581701",
          "description": "ORDER THAT APPLICATION FOR PRO HAC VICE ADMISSION OF ANDREW K. O'CONNELL IS GRANTED. SIGNED BY HONORABLE WENDY BEETLESTONE ON 8/18/22. 8/18/22 ENTERED AND COPIES E-MAILED.(rf, ) (Entered: 08/18/2022)"
        },
        {
          "row_number": 45,
          "id": 9086124,
          "entry_number": "14",
          "date_filed": "2022-08-18T00:00:00-04:00",
          "attachments": [],
          "url": "https://www.courtlistener.com/docket/64436633/14/burns-v-seaworld-parks-entertainment-inc/",
          "recap_pdf_url": null,
          "pacer_doc_id": "153020581726",
          "description": "ORDER THAT APPLICATION FOR PRO HAC VICE ADMISSION OF RONALD E. RICHARDSON IS GRANTED. SIGNED BY HONORABLE WENDY BEETLESTONE ON 8/18/22. 8/18/22 ENTERED AND COPIES E-MAILED.(rf, ) (Entered: 08/18/2022)"
        },
        {
          "row_number": 56,
          "id": 9086125,
          "entry_number": "15",
          "date_filed": "2022-08-18T00:00:00-04:00",
          "attachments": [],
          "url": "https://www.courtlistener.com/docket/64436633/15/burns-v-seaworld-parks-entertainment-inc/",
          "recap_pdf_url": null,
          "pacer_doc_id": "153020581838",
          "description": "STIUPLATION AND ORDER THAT DEFENDANT SEAWORLD PARKS AND ENTERTAINMENT, INC. HAS UNTIL 10/3/22 TO ANSWER THE COMPLAINT. SIGNED BY HONORABLE WENDY BEETLESTONE ON 8/18/22. 8/18/22 ENTERED AND COPIES E-MAILED.(rf, ) (Entered: 08/18/2022)"
        },
        {
          "row_number": 78,
          "id": 9086127,
          "entry_number": "17",
          "date_filed": "2022-08-25T00:00:00-04:00",
          "attachments": [],
          "url": "https://www.courtlistener.com/docket/64436633/17/burns-v-seaworld-parks-entertainment-inc/",
          "recap_pdf_url": null,
          "pacer_doc_id": "153020595650",
          "description": "APPLICATION for Admission Pro Hac Vice of Rebecca E. Bazan by SEAWORLD PARKS & ENTERTAINMENT LLC, SEAWORLD PARKS & ENTERTAINMENT, INC.. ( Filing fee $ 40 receipt number APAEDC-16131547.). (Attachments: # 1 Certificate of Service)(SKIPPER, LEIGH) (Entered: 08/25/2022)"
        },
        {
          "row_number": 89,
          "id": 9086128,
          "entry_number": "18",
          "date_filed": "2022-08-25T00:00:00-04:00",
          "attachments": [],
          "url": "https://www.courtlistener.com/docket/64436633/18/burns-v-seaworld-parks-entertainment-inc/",
          "recap_pdf_url": null,
          "pacer_doc_id": "153020595680",
          "description": "APPLICATION for Admission Pro Hac Vice of Michelle C. Pardo by SEAWORLD PARKS & ENTERTAINMENT LLC, SEAWORLD PARKS & ENTERTAINMENT, INC.. ( Filing fee $ 40 receipt number APAEDC-16131610.). (Attachments: # 1 Certificate of Service)(SKIPPER, LEIGH) (Entered: 08/25/2022)"
        },
        {
          "row_number": 100,
          "id": 9086129,
          "entry_number": "19",
          "date_filed": "2022-08-25T00:00:00-04:00",
          "attachments": [],
          "url": "https://www.courtlistener.com/docket/64436633/19/burns-v-seaworld-parks-entertainment-inc/",
          "recap_pdf_url": null,
          "pacer_doc_id": "153020596195",
          "description": "Disclosure Statement Form pursuant to FRCP 7.1 including SeaWorld Parks & Entertainment, Inc. SeaWorld Entertainment, Inc. with Certificate of Service by SEAWORLD PARKS & ENTERTAINMENT LLC, SEAWORLD PARKS & ENTERTAINMENT, INC.. (Attachments: # 1 Certificate of Service)(SKIPPER, LEIGH) (Entered: 08/25/2022)"
        },
        {
          "row_number": 112,
          "id": 9086130,
          "entry_number": "20",
          "date_filed": "2022-09-02T00:00:00-04:00",
          "attachments": [],
          "url": "https://www.courtlistener.com/docket/64436633/20/burns-v-seaworld-parks-entertainment-inc/",
          "recap_pdf_url": null,
          "pacer_doc_id": "153020614809",
          "description": "Report Of the Rule 26(f) Conference of Counsel by QUINTON BURNS. (HARRIS, MARTELL) (Entered: 09/02/2022)"
        },
        {
          "row_number": 134,
          "id": 9086132,
          "entry_number": "22",
          "date_filed": "2022-09-09T00:00:00-04:00",
          "attachments": [],
          "url": "https://www.courtlistener.com/docket/64436633/22/burns-v-seaworld-parks-entertainment-inc/",
          "recap_pdf_url": null,
          "pacer_doc_id": "153020627036",
          "description": "ORDER THAT APPLICATION FOR PRO HAC VICE ADMISSION OF JOHN M. SIMPSON IS GRANTED. SIGNED BY HONORABLE WENDY BEETLESTONE ON 9/9/22. 9/9/22 ENTERED AND COPIES E-MAILED.(rf, ) (Entered: 09/09/2022)"
        },
        {
          "row_number": 145,
          "id": 9086133,
          "entry_number": "23",
          "date_filed": "2022-09-09T00:00:00-04:00",
          "attachments": [],
          "url": "https://www.courtlistener.com/docket/64436633/23/burns-v-seaworld-parks-entertainment-inc/",
          "recap_pdf_url": null,
          "pacer_doc_id": "153020627042",
          "description": "ORDER THAT APPLICATION FOR PRO HAC VICE ADMISSION OF MICHELLE PARDO IS GRANTED. SIGNED BY HONORABLE WENDY BEETLESTONE ON 9/9/22. 9/9/22 ENTERED AND COPIES E-MAILED.(rf, ) (Entered: 09/09/2022)"
        },
        {
          "row_number": 156,
          "id": 9086134,
          "entry_number": "24",
          "date_filed": "2022-09-09T00:00:00-04:00",
          "attachments": [],
          "url": "https://www.courtlistener.com/docket/64436633/24/burns-v-seaworld-parks-entertainment-inc/",
          "recap_pdf_url": null,
          "pacer_doc_id": "153020627056",
          "description": "ORDER THAT APPLICATION FOR PRO HAC VICE ADMISSION OF REBECCA E. BAZAN IS GRANTED. SIGNED BY HONORABLE WENDY BEETLESTONE ON 9/9/22. 9/9/22 ENTERED AND COPIES E-MAILED.(rf, ) (Entered: 09/09/2022)"
        },
        {
          "row_number": 189,
          "id": 9086137,
          "entry_number": "27",
          "date_filed": "2022-10-06T00:00:00-04:00",
          "attachments": [],
          "url": "https://www.courtlistener.com/docket/64436633/27/burns-v-seaworld-parks-entertainment-inc/",
          "recap_pdf_url": null,
          "pacer_doc_id": "153020699723",
          "description": "STIPULATION AND ORDER THAT THE DEADLINE FOR DEFENDANTS TO FILE AN ANSWER OR A RULE 12 MOTION IN RESPONSE TO THE AMENDED CLASS ACTION COMPLAINT IS EXTENDED UNTIL NOVEMBER 2, 2022. IN THE EVENT DEFENDANTS FILE A RULE 12 MOTION IN RESPONSE TO THE AMENDED CLASS ACTION COMPLAINT, PLAINTIFFS DEADLINE TO FILE AN OPPOSITION IS EXTENDED UNTIL NOVEMBER 30, 2022 AND DEFENDANTS DEADLINE TO FILE A REPLY IS EXTENDED UNTIL DECEMBER 14, 2022. SIGNED BY HONORABLE WENDY BEETLESTONE ON 10/6/22. 10/6/22 ENTERED AND COPIES E-MAILED. (va) (Entered: 10/06/2022)"
        },
        {
          "row_number": 195,
          "id": 9086138,
          "entry_number": "28",
          "date_filed": "2022-10-06T00:00:00-04:00",
          "attachments": [],
          "url": "https://www.courtlistener.com/docket/64436633/28/burns-v-seaworld-parks-entertainment-inc/",
          "recap_pdf_url": null,
          "pacer_doc_id": "153020701458",
          "description": "ORDER THAT FINAL PRETRIAL CONFERENCE SET FOR 11/3/2023 03:00 PM IN Courtroom 10A; PLAINTIFF PRETRIAL MEMO DUE BY 10/23/2023., DEFENDANT PRETRIAL MEMO DUE BY 10/30/2023., TRIAL DATE SET FOR 11/6/2023 09:00 AM IN Courtroom 10A. SIGNED BY HONORABLE WENDY BEETLESTONE ON 10/6/22. 10/7/22 ENTERED AND COPIES E-MAILED.(rf, ) (Entered: 10/07/2022)"
        },
        {
          "row_number": 198,
          "id": 9086140,
          "entry_number": "30",
          "date_filed": "2022-11-15T00:00:00-05:00",
          "attachments": [],
          "url": "https://www.courtlistener.com/docket/64436633/30/burns-v-seaworld-parks-entertainment-inc/",
          "recap_pdf_url": null,
          "pacer_doc_id": "153020790975",
          "description": "NOTICE OF DISCOVERY DISPUTE CONFERENCE CALL SET FOR THURSDAY, NOVEMBER 17, 2022 AT 12:30 p.m. PLEASE SEE ATTACHED TELECONFERENCE INFORMATION SHEET FOR DIAL IN DETAILS. (amw) Modified on 11/15/2022 (amw). (Entered: 11/15/2022)"
        },
        {
          "row_number": 199,
          "id": 9086141,
          "entry_number": "31",
          "date_filed": "2022-11-22T00:00:00-05:00",
          "attachments": [],
          "url": "https://www.courtlistener.com/docket/64436633/31/burns-v-seaworld-parks-entertainment-inc/",
          "recap_pdf_url": null,
          "pacer_doc_id": "153020809205",
          "description": "STIPULATED PROTECTIVE ORDER. SIGNED BY HONORABLE WENDY BEETLESTONE ON 11/22/22. 11/22/22 ENTERED AND COPIES E-MAILED. (va) (Entered: 11/22/2022)"
        },
        {
          "row_number": 200,
          "id": 9086142,
          "entry_number": "32",
          "date_filed": "2022-11-30T00:00:00-05:00",
          "attachments": [
            {
              "recap_id": 225338249,
              "pacer_url": "https://ecf.paed.uscourts.gov/doc1/153020823584?caseid=599124",
              "description": "Text of Proposed Order",
              "attachment_number": 1
            }
          ],
          "url": "https://www.courtlistener.com/docket/64436633/32/burns-v-seaworld-parks-entertainment-inc/",
          "recap_pdf_url": null,
          "pacer_doc_id": "153020823583",
          "description": "RESPONSE in Opposition re 29 MOTION TO DISMISS FOR FAILURE TO STATE A CLAIM MOTION to Dismiss for Lack of Jurisdiction filed by QUINTON BURNS. (Attachments: # 1 Text of Proposed Order)(DUNCAN, JASON) (Entered: 11/30/2022)"
        },
        {
          "row_number": 202,
          "id": 9086144,
          "entry_number": "34",
          "date_filed": "2023-02-10T00:00:00-05:00",
          "attachments": [],
          "url": "https://www.courtlistener.com/docket/64436633/34/burns-v-seaworld-parks-entertainment-inc/",
          "recap_pdf_url": "https://www.courtlistener.com/recap/gov.uscourts.paed.599124/gov.uscourts.paed.599124.34.0.pdf",
          "pacer_doc_id": "153020979945",
          "description": "JOINT STIPULATION AND ORDER FOR EXTENSION OF SCHEDULE AND FOR ADDITIONAL DEPOSITIONS; AS OUTLINED HEREIN.. SIGNED BY HONORABLE WENDY BEETLESTONE ON 2/10/23. 2/13/23 ENTERED AND COPIES E-MAILED.(bw) (Entered: 02/13/2023)"
        },
        {
          "row_number": 204,
          "id": 9086145,
          "entry_number": "36",
          "date_filed": "2023-02-10T00:00:00-05:00",
          "attachments": [],
          "url": "https://www.courtlistener.com/docket/64436633/36/burns-v-seaworld-parks-entertainment-inc/",
          "recap_pdf_url": null,
          "pacer_doc_id": "153020979964",
          "description": "AMENDED SCHEDULING ORDER: ALL FACT DISCOVERY DUE BY 9/11/2023. ANY MOTIONS DUE BY 11/6/2023. MOTION FOR SUMMARY JUDGMENT DUE BY 11/20/2023; AS IT IS OUTLINED HEREIN.. SIGNED BY HONORABLE WENDY BEETLESTONE ON 2/10/23. 2/13/23 ENTERED AND COPIES E-MAILED.(bw) (Entered: 02/13/2023)"
        },
        {
          "row_number": 203,
          "id": 9086146,
          "entry_number": "35",
          "date_filed": "2023-02-13T00:00:00-05:00",
          "attachments": [],
          "url": "https://www.courtlistener.com/docket/64436633/35/burns-v-seaworld-parks-entertainment-inc/",
          "recap_pdf_url": null,
          "pacer_doc_id": "153020979951",
          "description": "AMENDED PRETRIAL SCHEDULING ORDER: FINAL PRETRIAL CONFERENCE SET FOR 5/3/2024 03:00 PM IN Courtroom 10A BEFORE HONORABLE WENDY BEETLESTONE. PLAINTIFF PRETRIAL MEMO DUE BY 4/22/2024. DEFENDANT PRETRIAL MEMO DUE BY 4/29/2024. TRIAL DATE SET FOR 5/6/2024 09:00 AM IN Courtroom 10A BEFORE HONORABLE WENDY BEETLESTONE; AS OUTLINED HEREIN.. SIGNED BY HONORABLE WENDY BEETLESTONE ON 2/10/23. 2/13/23 ENTERED AND COPIES E-MAILED.(bw) Modified on 5/2/2023 (nd). Modified on 5/2/2023 (nd). (Entered: 02/13/2023)"
        },
        {
          "row_number": 207,
          "id": 9086149,
          "entry_number": "39",
          "date_filed": "2023-04-27T00:00:00-04:00",
          "attachments": [
            {
              "recap_id": 304355819,
              "pacer_url": "https://ecf.paed.uscourts.gov/doc1/153021145479?caseid=599124",
              "description": "Memorandum",
              "attachment_number": 1
            },
            {
              "recap_id": 304355820,
              "pacer_url": "https://ecf.paed.uscourts.gov/doc1/153021145480?caseid=599124",
              "description": "Text of Proposed Order",
              "attachment_number": 2
            },
            {
              "recap_id": 304355821,
              "pacer_url": "https://ecf.paed.uscourts.gov/doc1/153021145481?caseid=599124",
              "description": "Certificate of Service",
              "attachment_number": 3
            }
          ],
          "url": "https://www.courtlistener.com/docket/64436633/39/burns-v-seaworld-parks-entertainment-inc/",
          "recap_pdf_url": null,
          "pacer_doc_id": "153021145478",
          "description": "MOTION to Strike 25 Amended Complaint Class Allegations filed by SEAWORLD PARKS & ENTERTAINMENT LLC, SEAWORLD PARKS & ENTERTAINMENT, INC..Memorandum, Certificate of Service. (Attachments: # 1 Memorandum, # 2 Text of Proposed Order, # 3 Certificate of Service)(SKIPPER, LEIGH) (Entered: 04/27/2023)"
        },
        {
          "row_number": 209,
          "id": 9086150,
          "entry_number": "40",
          "date_filed": "2023-05-02T00:00:00-04:00",
          "attachments": [],
          "url": "https://www.courtlistener.com/docket/64436633/40/burns-v-seaworld-parks-entertainment-inc/",
          "recap_pdf_url": null,
          "pacer_doc_id": "153021155717",
          "description": "Consent MOTION for Extension of Time to File Response/Reply as to 39 MOTION to Strike 25 Amended Complaint Class Allegations filed by QUINTON BURNS.. (Attachments: # 1 Text of Proposed Order)(O'CONNELL, ANDREW) (Entered: 05/02/2023)"
        },
        {
          "row_number": 210,
          "id": 9086151,
          "entry_number": "41",
          "date_filed": "2023-05-03T00:00:00-04:00",
          "attachments": [],
          "url": "https://www.courtlistener.com/docket/64436633/41/burns-v-seaworld-parks-entertainment-inc/",
          "recap_pdf_url": null,
          "pacer_doc_id": "153021158130",
          "description": "ORDER granting 40 MOTION FOR EXTENSION OF TIME TO FILE RESPONSE/REPLY RE 40 Consent MOTION for Extension of Time to File Response/Reply as to 39 MOTION to Strike 25 Amended Complaint Class Allegations, 39 MOTION to Strike 25 Amended Complaint Class Allegations RESPONSES DUE BY 5/26/2023. REPLIES DUE BY 6/2/2023.. SIGNED BY HONORABLE WENDY BEETLESTONE ON 5/3/23.5/3/23 ENTERED AND COPIES E-MAILED. NOT MAILED TO ATTY RICHARDSON.(rf, ) Modified on 5/8/2023 (md). (Entered: 05/03/2023)"
        },
        {
          "row_number": 211,
          "id": 9086152,
          "entry_number": "42",
          "date_filed": "2023-05-05T00:00:00-04:00",
          "attachments": [],
          "url": "https://www.courtlistener.com/docket/64436633/42/burns-v-seaworld-parks-entertainment-inc/",
          "recap_pdf_url": null,
          "pacer_doc_id": null,
          "description": "NOTICEOF HEARING ON MOTION 29 MOTION TO DISMISS FOR FAILURE TO STATE A CLAIM MOTION to Dismiss for Lack of Jurisdiction : MOTION HEARING SET FOR 5/9/2023 02:00 PM IN Courtroom 10A BEFORE HONORABLE WENDY BEETLESTONE.(amw) (Entered: 05/05/2023)"
        },
        {
          "row_number": 276,
          "id": 9086155,
          "entry_number": null,
          "date_filed": "2023-05-08T00:00:00-04:00",
          "attachments": [],
          "url": "https://www.courtlistener.com",
          "recap_pdf_url": null,
          "pacer_doc_id": null,
          "description": "DOC. NO. 41 MAILED TO ATTY RICHARDSON ON 5/8/2023. (md)"
        },
        {
          "row_number": 212,
          "id": 9086156,
          "entry_number": "43",
          "date_filed": "2023-05-11T00:00:00-04:00",
          "attachments": [],
          "url": "https://www.courtlistener.com/docket/64436633/43/burns-v-seaworld-parks-entertainment-inc/",
          "recap_pdf_url": null,
          "pacer_doc_id": "153021174792",
          "description": "Minute Entry for proceedings held before HONORABLE WENDY BEETLESTONE Motion Hearing held on 5/9/23 re 29 MOTION TO DISMISS FOR FAILURE TO STATE A CLAIM MOTION to Dismiss for Lack of Jurisdiction filed by SEAWORLD PARKS & ENTERTAINMENT LLC, SEAWORLD PARKS & ENTERTAINMENT, INC. (rf, ) (Entered: 05/11/2023)"
        },
        {
          "row_number": 214,
          "id": 9086158,
          "entry_number": "45",
          "date_filed": "2023-05-30T00:00:00-04:00",
          "attachments": [
            {
              "recap_id": 344538513,
              "pacer_url": "https://ecf.paed.uscourts.gov/doc1/153021210845?caseid=599124",
              "description": "Text of Proposed Order",
              "attachment_number": 1
            }
          ],
          "url": "https://www.courtlistener.com/docket/64436633/45/burns-v-seaworld-parks-entertainment-inc/",
          "recap_pdf_url": null,
          "pacer_doc_id": "153021210844",
          "description": "First MOTION to Seal Document 44 Response in Opposition to Motion,, to Defendants' Motion to Strike Plaintiffs' Class Allegation and filed by QUINTON BURNS.Certificate of Service. (Attachments: # 1 Text of Proposed Order)(RICHARDSON, RONALD) (Entered: 05/30/2023)"
        },
        {
          "row_number": 216,
          "id": 9086160,
          "entry_number": "47",
          "date_filed": "2023-06-02T00:00:00-04:00",
          "attachments": [],
          "url": "https://www.courtlistener.com/docket/64436633/47/burns-v-seaworld-parks-entertainment-inc/",
          "recap_pdf_url": null,
          "pacer_doc_id": "153021222545",
          "description": "REPLY to Response to Motion re 39 MOTION to Strike 25 Amended Complaint Class Allegations filed by SEAWORLD PARKS & ENTERTAINMENT LLC, SEAWORLD PARKS & ENTERTAINMENT, INC.. (Attachments: # 1 Certificate of Service)(SKIPPER, LEIGH) (Entered: 06/02/2023)"
        },
        {
          "row_number": 217,
          "id": 9086161,
          "entry_number": "48",
          "date_filed": "2023-06-05T00:00:00-04:00",
          "attachments": [],
          "url": "https://www.courtlistener.com/docket/64436633/48/burns-v-seaworld-parks-entertainment-inc/",
          "recap_pdf_url": "https://www.courtlistener.com/recap/gov.uscourts.paed.599124/gov.uscourts.paed.599124.48.0.pdf",
          "pacer_doc_id": "153021224479",
          "description": "MEMORANDUM AND/OR OPINION. SIGNED BY HONORABLE WENDY BEETLESTONE ON 6/5/23. 6/5/23 ENTERED AND COPIES MAILED TO COUNSEL AND E-MAILED.(rf, ) (Main Document 48 replaced on 6/5/2023) (rf, ). (Entered: 06/05/2023)"
        },
        {
          "row_number": 218,
          "id": 9086162,
          "entry_number": "49",
          "date_filed": "2023-06-05T00:00:00-04:00",
          "attachments": [],
          "url": "https://www.courtlistener.com/docket/64436633/49/burns-v-seaworld-parks-entertainment-inc/",
          "recap_pdf_url": "https://www.courtlistener.com/recap/gov.uscourts.paed.599124/gov.uscourts.paed.599124.49.0.pdf",
          "pacer_doc_id": "153021224489",
          "description": "MEMORANDUM AND ORDER THAT MOTION TO DISMISS (DOC. 29 & 33) ARE GRANTED IN PART AND DENIED IN PART AS OUTLINED HEREIN. SIGNED BY HONORABLE WENDY BEETLESTONE ON 6/5/23. 6/5/23 ENTERED AND COPIES MAILED TO COUNSEL AND E-MAILED.(rf, ) (Main Document 49 replaced on 6/5/2023) (rf, ). (Entered: 06/05/2023)"
        },
        {
          "row_number": 220,
          "id": 9086163,
          "entry_number": "50",
          "date_filed": "2023-06-07T00:00:00-04:00",
          "attachments": [],
          "url": "https://www.courtlistener.com/docket/64436633/50/burns-v-seaworld-parks-entertainment-inc/",
          "recap_pdf_url": "https://www.courtlistener.com/recap/gov.uscourts.paed.599124/gov.uscourts.paed.599124.50.0.pdf",
          "pacer_doc_id": "153021230127",
          "description": "ORDER THAT MOTION (DOC. 45) IS GRANTED. ACCORDINGLY, EXHIBITS 2 AND 4 (ECF NOS. 44-2 & 44-4) TO PLAINTIFFS OPPOSITION TO DEFENDANTS' MOTION TO STRIKE CLASS ALLEGATIONS (DOC. 44) SHALL BE WITHDRAWN AND SEALED. SIGNED BY HONORABLE WENDY BEETLESTONE ON 6/6/23. 6/7/23 ENTERED AND COPIES E-MAILED.(rf, ) (Entered: 06/07/2023)"
        },
        {
          "row_number": 222,
          "id": 9086165,
          "entry_number": "52",
          "date_filed": "2023-06-12T00:00:00-04:00",
          "attachments": [],
          "url": "https://www.courtlistener.com/docket/64436633/52/burns-v-seaworld-parks-entertainment-inc/",
          "recap_pdf_url": null,
          "pacer_doc_id": "153021240219",
          "description": "TRANSCRIPT of MOTION TO DISMISS HEARING held on 5/9/23, before Judge BEETLESTONE. Court Reporter/Transcriber REDDOOR LEGAL SERVICES, LLC. Transcript may be viewed at the court public terminal or purchased through the Court Reporter/Transcriber before the deadline for Release of Transcript Restriction. After that date it may be obtained through PACER.. Redaction Request due 7/3/2023. Redacted Transcript Deadline set for 7/13/2023. Release of Transcript Restriction set for 9/11/2023. (rf, ) (Entered: 06/12/2023)"
        },
        {
          "row_number": 223,
          "id": 9086166,
          "entry_number": "53",
          "date_filed": "2023-06-12T00:00:00-04:00",
          "attachments": [],
          "url": "https://www.courtlistener.com/docket/64436633/53/burns-v-seaworld-parks-entertainment-inc/",
          "recap_pdf_url": null,
          "pacer_doc_id": "153021240239",
          "description": "Notice of Filing of Official Transcript with Certificate of Service re 52 Transcript - PDF, 6/12/23 Entered and Copies Emailed and Mailed.. (rf, ) (Entered: 06/12/2023)"
        },
        {
          "row_number": 224,
          "id": 9086167,
          "entry_number": "54",
          "date_filed": "2023-06-19T00:00:00-04:00",
          "attachments": [],
          "url": "https://www.courtlistener.com/docket/64436633/54/burns-v-seaworld-parks-entertainment-inc/",
          "recap_pdf_url": null,
          "pacer_doc_id": "153021254559",
          "description": "ANSWER to 25 Amended Complaint by SEAWORLD PARKS & ENTERTAINMENT LLC, SEAWORLD PARKS & ENTERTAINMENT, INC.. (Attachments: # 1 Certificate of Service)(SKIPPER, LEIGH) (Entered: 06/19/2023)"
        },
        {
          "row_number": 225,
          "id": 9086168,
          "entry_number": "55",
          "date_filed": "2023-08-14T00:00:00-04:00",
          "attachments": [],
          "url": "https://www.courtlistener.com/docket/64436633/55/burns-v-seaworld-parks-entertainment-inc/",
          "recap_pdf_url": null,
          "pacer_doc_id": "153021377415",
          "description": "APPLICATION for Admission Pro Hac Vice of Phylecia R. Faublas by QUINTON BURNS, NATHAN FLEMING, LASHONDA MILES, INGRID MORALES, YOSELIS ROMERO, KATIE VALDEZ, ASHLEY VALETTE, LAUREN WILLIE. ( Filing fee $ 75 receipt number APAEDC-16876777.). (HARRIS, MARTELL) (Entered: 08/14/2023)"
        },
        {
          "row_number": 226,
          "id": 9086169,
          "entry_number": "56",
          "date_filed": "2023-08-16T00:00:00-04:00",
          "attachments": [],
          "url": "https://www.courtlistener.com/docket/64436633/56/burns-v-seaworld-parks-entertainment-inc/",
          "recap_pdf_url": null,
          "pacer_doc_id": "153021384828",
          "description": "ORDER THAT APPLICATION FOR PRO HAC VICE ADMISSION OF PHYLECIA R. FAUBLAS IS GRANTED. SIGNED BY HONORABLE WENDY BEETLESTONE ON 8/16/23. 8/16/23 ENTERED AND COPIES E-MAILED.(rf, ) (Entered: 08/16/2023)"
        },
        {
          "row_number": 228,
          "id": 9086171,
          "entry_number": "58",
          "date_filed": "2023-08-23T00:00:00-04:00",
          "attachments": [],
          "url": "https://www.courtlistener.com/docket/64436633/58/burns-v-seaworld-parks-entertainment-inc/",
          "recap_pdf_url": null,
          "pacer_doc_id": "153021398351",
          "description": "NOTICE OF DISCOVERY DISPUTE TELECONFERENCE SET FOR TODAY, WEDNESDAY, AUGUST 23, 2023, AT 2:30 P.M. PLEASE SEE ATTACHED TELECONFERENCE INFORMATION SHEET FOR DIAL IN INFORMATION. THANK YOU. (amw) (Entered: 08/23/2023)"
        },
        {
          "row_number": 231,
          "id": 9086173,
          "entry_number": "60",
          "date_filed": "2023-08-24T00:00:00-04:00",
          "attachments": [],
          "url": "https://www.courtlistener.com/docket/64436633/60/burns-v-seaworld-parks-entertainment-inc/",
          "recap_pdf_url": null,
          "pacer_doc_id": "153021404122",
          "description": "Minute Entry for proceedings held before HONORABLE WENDY BEETLESTONE Discovery Hearing held on 8/23/23. (rf, ) (Entered: 08/25/2023)"
        },
        {
          "row_number": 233,
          "id": 9086175,
          "entry_number": "62",
          "date_filed": "2023-09-05T00:00:00-04:00",
          "attachments": [],
          "url": "https://www.courtlistener.com/docket/64436633/62/burns-v-seaworld-parks-entertainment-inc/",
          "recap_pdf_url": null,
          "pacer_doc_id": "153021426032",
          "description": "Minute Entry for proceedings held before HONORABLE WENDY BEETLESTONE Discovery Hearing held on 9/5/23. (rf, ) (Entered: 09/05/2023)"
        },
        {
          "row_number": 235,
          "id": 9086177,
          "entry_number": "64",
          "date_filed": "2023-09-22T00:00:00-04:00",
          "attachments": [],
          "url": "https://www.courtlistener.com/docket/64436633/64/burns-v-seaworld-parks-entertainment-inc/",
          "recap_pdf_url": null,
          "pacer_doc_id": "153021468989",
          "description": "NOTICE of Appearance by LEIGH MICHAEL SKIPPER on behalf of Sadiqa Reynolds with Certificate of Service(SKIPPER, LEIGH) (Entered: 09/22/2023)"
        },
        {
          "row_number": 236,
          "id": 9086178,
          "entry_number": "65",
          "date_filed": "2023-09-22T00:00:00-04:00",
          "attachments": [],
          "url": "https://www.courtlistener.com/docket/64436633/65/burns-v-seaworld-parks-entertainment-inc/",
          "recap_pdf_url": null,
          "pacer_doc_id": "153021469124",
          "description": "MOTION to Quash filed by Sadiqa Reynolds.. (Attachments: # 1 Memorandum, # 2 Exhibit 1, # 3 Exhibit 2, # 4 Exhibit 3, # 5 Exhibit 4, # 6 Exhibit 5, # 7 Exhibit 6, # 8 Exhibit 7)(SKIPPER, LEIGH) (Entered: 09/22/2023)"
        },
        {
          "row_number": 237,
          "id": 9086179,
          "entry_number": "66",
          "date_filed": "2023-09-22T00:00:00-04:00",
          "attachments": [],
          "url": "https://www.courtlistener.com/docket/64436633/66/burns-v-seaworld-parks-entertainment-inc/",
          "recap_pdf_url": null,
          "pacer_doc_id": "153021469157",
          "description": "MOTION to Seal filed by Sadiqa Reynolds.. (Attachments: # 1 Proposed Order, # 2 Memorandum)(SKIPPER, LEIGH) (Entered: 09/22/2023)"
        },
        {
          "row_number": 238,
          "id": 9086180,
          "entry_number": "67",
          "date_filed": "2023-09-22T00:00:00-04:00",
          "attachments": [],
          "url": "https://www.courtlistener.com/docket/64436633/67/burns-v-seaworld-parks-entertainment-inc/",
          "recap_pdf_url": null,
          "pacer_doc_id": "153021469444",
          "description": "MOTION to Quash Plaintiffs' Subpoena to Non-Party Debo P. Adegbile filed by SEAWORLD PARKS & ENTERTAINMENT LLC, SEAWORLD PARKS & ENTERTAINMENT, INC..Memorandum, Certificate of Service. (Attachments: # 1 Memorandum of Law, # 2 Exhibit 1, # 3 Exhibit 2, # 4 Exhibit 3, # 5 Exhibit 4, # 6 Exhibit 5, # 7 Exhibit 6, # 8 Text of Proposed Order, # 9 Certificate of Service)(SKIPPER, LEIGH) (Entered: 09/22/2023)"
        },
        {
          "row_number": 239,
          "id": 9086181,
          "entry_number": "68",
          "date_filed": "2023-09-22T00:00:00-04:00",
          "attachments": [],
          "url": "https://www.courtlistener.com/docket/64436633/68/burns-v-seaworld-parks-entertainment-inc/",
          "recap_pdf_url": null,
          "pacer_doc_id": "153021469461",
          "description": "MOTION to Seal Exhibit 6 to Motion to Quash Plaintiffs' Subpoena to Non-Party Debo P. Adegbile filed by SEAWORLD PARKS & ENTERTAINMENT LLC, SEAWORLD PARKS & ENTERTAINMENT, INC..Memorandum, Certificate of Service. (Attachments: # 1 Memorandum of Law, # 2 Text of Proposed Order, # 3 Certificate of Service)(SKIPPER, LEIGH) (Entered: 09/22/2023)"
        },
        {
          "row_number": 240,
          "id": 9086182,
          "entry_number": "69",
          "date_filed": "2023-09-22T00:00:00-04:00",
          "attachments": [],
          "url": "https://www.courtlistener.com/docket/64436633/69/burns-v-seaworld-parks-entertainment-inc/",
          "recap_pdf_url": null,
          "pacer_doc_id": "153021470623",
          "description": "EXHIBIT 7 by Sadiqa Reynolds re 65 MOTION to Quash.(FILED UNDER SEAL) (md) (md). (Entered: 09/25/2023)"
        },
        {
          "row_number": 243,
          "id": 9086183,
          "entry_number": "71",
          "date_filed": "2023-09-22T00:00:00-04:00",
          "attachments": [],
          "url": "https://www.courtlistener.com/docket/64436633/71/burns-v-seaworld-parks-entertainment-inc/",
          "recap_pdf_url": null,
          "pacer_doc_id": "153021470675",
          "description": "EXHIBIT 6 by SEAWORLD PARKS & ENTERTAINMENT LLC, SEAWORLD PARKS & ENTERTAINMENT, INC. re 67 MOTION to Quash.(FILED UNDER SEAL)(md) (md). (Entered: 09/25/2023)"
        },
        {
          "row_number": 242,
          "id": 9086184,
          "entry_number": "70",
          "date_filed": "2023-09-25T00:00:00-04:00",
          "attachments": [],
          "url": "https://www.courtlistener.com/docket/64436633/70/burns-v-seaworld-parks-entertainment-inc/",
          "recap_pdf_url": null,
          "pacer_doc_id": "153021470638",
          "description": "Proposed Order re Motion to Quash (ECF No. 65) by Sadiqa Reynolds.. (SKIPPER, LEIGH) Modified on 9/27/2023 (md). (Entered: 09/25/2023)"
        },
        {
          "row_number": 244,
          "id": 9086185,
          "entry_number": "72",
          "date_filed": "2023-09-25T00:00:00-04:00",
          "attachments": [],
          "url": "https://www.courtlistener.com/docket/64436633/72/burns-v-seaworld-parks-entertainment-inc/",
          "recap_pdf_url": null,
          "pacer_doc_id": "153021470961",
          "description": "ORDER granting 66 MOTION TO SEAL. EXHIBIT 7 TO MS. REYNOLDS MOTION TO QUASH SHALL BE FILED AN KEPT UNDER SEAL BY CLERK UNTIL FURTHER COURT ORDER. SIGNED BY HONORABLE WENDY BEETLESTONE ON 9/25/23.9/25/23 ENTERED AND COPIES E-MAILED.(rf, ) (Entered: 09/25/2023)"
        },
        {
          "row_number": 245,
          "id": 9086186,
          "entry_number": "73",
          "date_filed": "2023-09-25T00:00:00-04:00",
          "attachments": [],
          "url": "https://www.courtlistener.com/docket/64436633/73/burns-v-seaworld-parks-entertainment-inc/",
          "recap_pdf_url": null,
          "pacer_doc_id": "153021470979",
          "description": "ORDER granting 68 MOTION TO SEAL. SIGNED BY HONORABLE WENDY BEETLESTONE ON 9/25/23.9/25/23 ENTERED AND COPIES E-MAILED.(rf, ) (Entered: 09/25/2023)"
        },
        {
          "row_number": 247,
          "id": 9086188,
          "entry_number": "75",
          "date_filed": "2023-09-29T00:00:00-04:00",
          "attachments": [],
          "url": "https://www.courtlistener.com/docket/64436633/75/burns-v-seaworld-parks-entertainment-inc/",
          "recap_pdf_url": null,
          "pacer_doc_id": "153021487449",
          "description": "RESPONSE in Opposition re 67 MOTION to Quash Plaintiffs' Subpoena to Non-Party Debo P. Adegbile filed by QUINTON BURNS. (Attachments: # 1 Exhibit Ex 1 Press Release 7/23/22, # 2 Exhibit Ex 2 Press Release 8/9/22, # 3 Exhibit Ex 3 Excerpt of Paul Joseph Schweizer Deposition, # 4 Exhibit Ex 4 (Filed Under Seal) - Excerpt of Kaylah Connelly's Deposition, # 5 Exhibit Ex 5 Excerpts of Kienna Childs Alexander, # 6 Exhibit Ex Correspondence from Joseph West 8/22/23, # 7 Text of Proposed Order Proposed Order)(RICHARDSON, RONALD) (Entered: 09/29/2023)"
        },
        {
          "row_number": 248,
          "id": 9086189,
          "entry_number": "76",
          "date_filed": "2023-09-29T00:00:00-04:00",
          "attachments": [],
          "url": "https://www.courtlistener.com/docket/64436633/76/burns-v-seaworld-parks-entertainment-inc/",
          "recap_pdf_url": null,
          "pacer_doc_id": "153021487459",
          "description": "MOTION Withdraw and File Under Seal re 74 Response in Opposition to Motion,, and Exhibit 2 (74-2) filed by QUINTON BURNS.Certificate of Service. (Attachments: # 1 Exhibit Proposed Order)(RICHARDSON, RONALD) (Entered: 09/29/2023)"
        },
        {
          "row_number": 249,
          "id": 9086190,
          "entry_number": "77",
          "date_filed": "2023-09-29T00:00:00-04:00",
          "attachments": [],
          "url": "https://www.courtlistener.com/docket/64436633/77/burns-v-seaworld-parks-entertainment-inc/",
          "recap_pdf_url": null,
          "pacer_doc_id": "153021488238",
          "description": "EXHIBIT 4 by QUINTON BURNS re 75 RESPONSE in Opposition.(FILED UNDER SEAL)(md) (md). (Entered: 10/02/2023)"
        },
        {
          "row_number": 250,
          "id": 9086191,
          "entry_number": "78",
          "date_filed": "2023-10-03T00:00:00-04:00",
          "attachments": [],
          "url": "https://www.courtlistener.com/docket/64436633/78/burns-v-seaworld-parks-entertainment-inc/",
          "recap_pdf_url": null,
          "pacer_doc_id": null,
          "description": "ORDER GRANTING 76 Motion TO WITHDRAW AND SEAL BY HONORABLE WENDY BEETLESTONE ON 10/03/2023.10/03/2023 ENTERED AND COPIES E-MAILED.(amw) (Entered: 10/03/2023)"
        },
        {
          "row_number": 277,
          "id": 9086192,
          "entry_number": null,
          "date_filed": "2023-10-03T00:00:00-04:00",
          "attachments": [],
          "url": "https://www.courtlistener.com",
          "recap_pdf_url": null,
          "pacer_doc_id": null,
          "description": "Order on Motion for Miscellaneous Relief"
        },
        {
          "row_number": 253,
          "id": 9086194,
          "entry_number": "80",
          "date_filed": "2023-10-03T00:00:00-04:00",
          "attachments": [],
          "url": "https://www.courtlistener.com/docket/64436633/80/burns-v-seaworld-parks-entertainment-inc/",
          "recap_pdf_url": null,
          "pacer_doc_id": "153021494721",
          "description": "ORDER REFERRING MOTION TO JUDGE SPECIAL MASTER AMY KURLAND: 65 MOTION to Quash filed by Sadiqa Reynolds, 67 MOTION to Quash Plaintiffs' Subpoena to Non-Party Debo P. Adegbile filed by SEAWORLD PARKS & ENTERTAINMENT LLC, SEAWORLD PARKS & ENTERTAINMENT, INC.. SIGNED BY HONORABLE WENDY BEETLESTONE ON 10/3/23. 10/4/23 ENTERED AND COPIES E-MAILED.(rf, ) (Entered: 10/04/2023)"
        },
        {
          "row_number": 254,
          "id": 9086195,
          "entry_number": "81",
          "date_filed": "2023-10-04T00:00:00-04:00",
          "attachments": [],
          "url": "https://www.courtlistener.com/docket/64436633/81/burns-v-seaworld-parks-entertainment-inc/",
          "recap_pdf_url": null,
          "pacer_doc_id": "153021496990",
          "description": "NOTICE OF DISPUTE TELECONFERENCE SET FOR THURSDAY, OCTOBER 5, 2023 AT 12:00 P.M. PLEASE SEE ATTACHED TELECONFERENCE INFORMATION SHEET FOR DIAL IN INFORMATION. (amw) (Entered: 10/04/2023)"
        },
        {
          "row_number": 255,
          "id": 9086196,
          "entry_number": "82",
          "date_filed": "2023-10-05T00:00:00-04:00",
          "attachments": [],
          "url": "https://www.courtlistener.com/docket/64436633/82/burns-v-seaworld-parks-entertainment-inc/",
          "recap_pdf_url": null,
          "pacer_doc_id": "153021499442",
          "description": "AMENDED SCHEDULING ORDER. SIGNED BY HONORABLE WENDY BEETLESTONE ON 10/5/23. 10/5/23 ENTERED AND COPIES E-MAILED.(rf, ) (Entered: 10/05/2023)"
        },
        {
          "row_number": 256,
          "id": 9086197,
          "entry_number": "83",
          "date_filed": "2023-10-06T00:00:00-04:00",
          "attachments": [],
          "url": "https://www.courtlistener.com/docket/64436633/83/burns-v-seaworld-parks-entertainment-inc/",
          "recap_pdf_url": null,
          "pacer_doc_id": "153021502019",
          "description": "REPLY to Response to Motion re 65 MOTION to Quash filed by Sadiqa Reynolds. (SKIPPER, LEIGH) (Entered: 10/06/2023)"
        },
        {
          "row_number": 257,
          "id": 9086198,
          "entry_number": "84",
          "date_filed": "2023-10-06T00:00:00-04:00",
          "attachments": [],
          "url": "https://www.courtlistener.com/docket/64436633/84/burns-v-seaworld-parks-entertainment-inc/",
          "recap_pdf_url": null,
          "pacer_doc_id": "153021502312",
          "description": "REPLY to Response to Motion re 67 MOTION to Quash Plaintiffs' Subpoena to Non-Party Debo P. Adegbile filed by SEAWORLD PARKS & ENTERTAINMENT LLC, SEAWORLD PARKS & ENTERTAINMENT, INC.. (SKIPPER, LEIGH) (Entered: 10/06/2023)"
        },
        {
          "row_number": 259,
          "id": 9086200,
          "entry_number": "86",
          "date_filed": "2023-10-10T00:00:00-04:00",
          "attachments": [],
          "url": "https://www.courtlistener.com/docket/64436633/86/burns-v-seaworld-parks-entertainment-inc/",
          "recap_pdf_url": null,
          "pacer_doc_id": "153021506964",
          "description": "APPLICATION for Admission Pro Hac Vice of Joseph K. West by SEAWORLD PARKS & ENTERTAINMENT LLC, SEAWORLD PARKS & ENTERTAINMENT, INC.. ( Filing fee $ 75 receipt number APAEDC-16999764.). (Attachments: # 1 Proposed Order, # 2 Certificate of Service)(Smolij, Aleksander) (Entered: 10/10/2023)"
        },
        {
          "row_number": 261,
          "id": 9086202,
          "entry_number": "88",
          "date_filed": "2023-10-19T00:00:00-04:00",
          "attachments": [
            {
              "recap_id": 375774439,
              "pacer_url": "https://ecf.paed.uscourts.gov/doc1/153021527595?caseid=599124",
              "description": "Proposed Order",
              "attachment_number": 1
            },
            {
              "recap_id": 375774440,
              "pacer_url": "https://ecf.paed.uscourts.gov/doc1/153021527596?caseid=599124",
              "description": "Exhibit 1",
              "attachment_number": 2
            },
            {
              "recap_id": 375774441,
              "pacer_url": "https://ecf.paed.uscourts.gov/doc1/153021527597?caseid=599124",
              "description": "Exhibit 2",
              "attachment_number": 3
            },
            {
              "recap_id": 375774442,
              "pacer_url": "https://ecf.paed.uscourts.gov/doc1/153021527598?caseid=599124",
              "description": "Exhibit 3",
              "attachment_number": 4
            },
            {
              "recap_id": 375774443,
              "pacer_url": "https://ecf.paed.uscourts.gov/doc1/153021527599?caseid=599124",
              "description": "Exhibit 4",
              "attachment_number": 5
            },
            {
              "recap_id": 375774444,
              "pacer_url": "https://ecf.paed.uscourts.gov/doc1/153021527600?caseid=599124",
              "description": "Exhibit 5",
              "attachment_number": 6
            }
          ],
          "url": "https://www.courtlistener.com/docket/64436633/88/burns-v-seaworld-parks-entertainment-inc/",
          "recap_pdf_url": "https://www.courtlistener.com/recap/gov.uscourts.paed.599124/gov.uscourts.paed.599124.88.0.pdf",
          "pacer_doc_id": "153021527594",
          "description": "MOTION for Reconsideration re 82 Order, Terminate Deadlines and Hearings filed by SEAWORLD PARKS & ENTERTAINMENT LLC, SEAWORLD PARKS & ENTERTAINMENT, INC..Memorandum. (Attachments: # 1 Proposed Order, # 2 Exhibit 1, # 3 Exhibit 2, # 4 Exhibit 3, # 5 Exhibit 4, # 6 Exhibit 5)(SKIPPER, LEIGH) (Entered: 10/19/2023)"
        },
        {
          "row_number": 262,
          "id": 9086203,
          "entry_number": "89",
          "date_filed": "2023-10-23T00:00:00-04:00",
          "attachments": [],
          "url": "https://www.courtlistener.com/docket/64436633/89/burns-v-seaworld-parks-entertainment-inc/",
          "recap_pdf_url": null,
          "pacer_doc_id": "153021534665",
          "description": "Report Of Report and Recommendation of Special Master Amy Kurland, Esq. by AMY KURLAND. (Attachments: # 1 Text of Proposed Order)(KURLAND, AMY) (Entered: 10/23/2023)"
        },
        {
          "row_number": 264,
          "id": 9086204,
          "entry_number": "90",
          "date_filed": "2023-11-02T00:00:00-04:00",
          "attachments": [],
          "url": "https://www.courtlistener.com/docket/64436633/90/burns-v-seaworld-parks-entertainment-inc/",
          "recap_pdf_url": null,
          "pacer_doc_id": "153021557475",
          "description": "RESPONSE to Motion re 88 MOTION for Reconsideration re 82 Order, Terminate Deadlines and Hearings filed by QUINTON BURNS, NATHAN FLEMING, LASHONDA MILES, INGRID MORALES, YOSELIS ROMERO, KATIE VALDEZ, ASHLEY VALETTE, LAUREN WILLIE. (Attachments: # 1 Text of Proposed Order)(RICHARDSON, RONALD) (Entered: 11/02/2023)"
        },
        {
          "row_number": 278,
          "id": 9086206,
          "entry_number": null,
          "date_filed": "2023-11-03T00:00:00-04:00",
          "attachments": [],
          "url": "https://www.courtlistener.com",
          "recap_pdf_url": null,
          "pacer_doc_id": null,
          "description": "Order on Motion for Reconsideration"
        },
        {
          "row_number": 266,
          "id": 9086207,
          "entry_number": "92",
          "date_filed": "2023-11-04T00:00:00-04:00",
          "attachments": [],
          "url": "https://www.courtlistener.com/docket/64436633/92/burns-v-seaworld-parks-entertainment-inc/",
          "recap_pdf_url": null,
          "pacer_doc_id": "153021561848",
          "description": "Report Of Report and Recommendation of Special Master Amy Kurland, Esquire by AMY KURLAND. (Attachments: # 1 Text of Proposed Order Proposed Order)(KURLAND, AMY) (Entered: 11/04/2023)"
        },
        {
          "row_number": 268,
          "id": 9086209,
          "entry_number": "94",
          "date_filed": "2023-11-14T00:00:00-05:00",
          "attachments": [],
          "url": "https://www.courtlistener.com/docket/64436633/94/burns-v-seaworld-parks-entertainment-inc/",
          "recap_pdf_url": null,
          "pacer_doc_id": "153021582652",
          "description": "ORDER granting 65 MOTION TO QUASH. SIGNED BY HONORABLE WENDY BEETLESTONE ON 11/14/23.11/15/23 ENTERED AND COPIES E-MAILED.(rf, ) (Entered: 11/15/2023)"
        },
        {
          "row_number": 2,
          "id": 9086215,
          "entry_number": "100",
          "date_filed": "2023-11-29T00:00:00-05:00",
          "attachments": [],
          "url": "https://www.courtlistener.com/docket/64436633/100/burns-v-seaworld-parks-entertainment-inc/",
          "recap_pdf_url": null,
          "pacer_doc_id": "153021613313",
          "description": "ORDER denying 99 MOTION TO WITHDRAW 99 MOTION to Withdraw and Seal Exhibit 26 to Plaintiffs' Motion for Certification of the Class. SIGNED BY HONORABLE WENDY BEETLESTONE ON 11/29/23.11/29/23 ENTERED AND COPIES E-MAILED.(rf, ) (Entered: 11/29/2023)"
        },
        {
          "row_number": 4,
          "id": 9086217,
          "entry_number": "102",
          "date_filed": "2023-11-30T00:00:00-05:00",
          "attachments": [],
          "url": "https://www.courtlistener.com/docket/64436633/102/burns-v-seaworld-parks-entertainment-inc/",
          "recap_pdf_url": null,
          "pacer_doc_id": "153021619013",
          "description": "ORDER granting 101 MOTION TO SUBSTITUTE AS OUTLINED HEREIN. SIGNED BY HONORABLE WENDY BEETLESTONE ON 11/30/23.12/1/23 ENTERED AND COPIES E-MAILED.(rf, ) (Entered: 12/01/2023)"
        },
        {
          "row_number": 5,
          "id": 9086218,
          "entry_number": "103",
          "date_filed": "2023-12-11T00:00:00-05:00",
          "attachments": [
            {
              "recap_id": 393012284,
              "pacer_url": "https://ecf.paed.uscourts.gov/doc1/153021639927?caseid=599124",
              "description": "Proposed Order",
              "attachment_number": 1
            },
            {
              "recap_id": 393012285,
              "pacer_url": "https://ecf.paed.uscourts.gov/doc1/153021639928?caseid=599124",
              "description": "Exhibit A - Defendants 30(b)(6) November 7, 2023 Deposition Transcript Excerpts",
              "attachment_number": 2
            },
            {
              "recap_id": 393012289,
              "pacer_url": "https://ecf.paed.uscourts.gov/doc1/153021639929?caseid=599124",
              "description": "Exhibit B - Nicholas Manna (Sesame Place Vice President of Entertainment) May 19",
              "attachment_number": 3
            },
            {
              "recap_id": 393012292,
              "pacer_url": "https://ecf.paed.uscourts.gov/doc1/153021639930?caseid=599124",
              "description": "Exhibit C - Shavonne Strange (Sesame Place Entertainment Operations Manager) May",
              "attachment_number": 4
            },
            {
              "recap_id": 393012293,
              "pacer_url": "https://ecf.paed.uscourts.gov/doc1/153021639931?caseid=599124",
              "description": "Exhibit D - Paul Joseph Schweizer (Sesame Place Entertainment Events and Product",
              "attachment_number": 5
            },
            {
              "recap_id": 393012295,
              "pacer_url": "https://ecf.paed.uscourts.gov/doc1/153021639932?caseid=599124",
              "description": "Exhibit E - Plaintiff Lashonda Miles March 30, 2023 Deposition Transcript Excerp",
              "attachment_number": 6
            },
            {
              "recap_id": 393012296,
              "pacer_url": "https://ecf.paed.uscourts.gov/doc1/153021639933?caseid=599124",
              "description": "Exhibit F - Plaintiff Nathan Fleming February 27, 2023 Deposition Transcript Exc",
              "attachment_number": 7
            },
            {
              "recap_id": 393012298,
              "pacer_url": "https://ecf.paed.uscourts.gov/doc1/153021639934?caseid=599124",
              "description": "Exhibit G - SeaWorld Ambassador Handbook",
              "attachment_number": 8
            },
            {
              "recap_id": 393012299,
              "pacer_url": "https://ecf.paed.uscourts.gov/doc1/153021639935?caseid=599124",
              "description": "Exhibit H - Plaintiffs September 25, 2023 Rule 26(a)(2) Disclosures",
              "attachment_number": 9
            },
            {
              "recap_id": 393012301,
              "pacer_url": "https://ecf.paed.uscourts.gov/doc1/153021639936?caseid=599124",
              "description": "Exhibit I - Barbara Simmons October 19, 2023 Deposition Transcript Excerpts",
              "attachment_number": 10
            },
            {
              "recap_id": 393012302,
              "pacer_url": "https://ecf.paed.uscourts.gov/doc1/153021639937?caseid=599124",
              "description": "Exhibit J - Plaintiff Katie Valdez February 19, 2023 Deposition Transcript Excer",
              "attachment_number": 11
            },
            {
              "recap_id": 393012303,
              "pacer_url": "https://ecf.paed.uscourts.gov/doc1/153021639938?caseid=599124",
              "description": "Exhibit K - Plaintiff Katie Valdezs Answers to Defendants First Set of Interroga",
              "attachment_number": 12
            },
            {
              "recap_id": 393012305,
              "pacer_url": "https://ecf.paed.uscourts.gov/doc1/153021639939?caseid=599124",
              "description": "Exhibit L - Defendants 30(b)(6) November 15, 2023 Deposition Transcript Excerpts",
              "attachment_number": 13
            },
            {
              "recap_id": 393012306,
              "pacer_url": "https://ecf.paed.uscourts.gov/doc1/153021639940?caseid=599124",
              "description": "Exhibit M - Declaration of Kimberly Hall",
              "attachment_number": 14
            },
            {
              "recap_id": 393012307,
              "pacer_url": "https://ecf.paed.uscourts.gov/doc1/153021639941?caseid=599124",
              "description": "Exhibit N - Plaintiff Quinton Burns February 28, 2023 Deposition Transcript Exce",
              "attachment_number": 15
            },
            {
              "recap_id": 393012308,
              "pacer_url": "https://ecf.paed.uscourts.gov/doc1/153021639942?caseid=599124",
              "description": "Exhibit O - Plaintiff Ingrid Morales February 14, 2023 Deposition Transcript Exc",
              "attachment_number": 16
            },
            {
              "recap_id": 393012310,
              "pacer_url": "https://ecf.paed.uscourts.gov/doc1/153021639943?caseid=599124",
              "description": "Exhibit P - Plaintiff Yoselis Romero March 3, 2023 Deposition Transcript Excerpt",
              "attachment_number": 17
            },
            {
              "recap_id": 393012311,
              "pacer_url": "https://ecf.paed.uscourts.gov/doc1/153021639944?caseid=599124",
              "description": "Exhibit Q - Plaintiff Ashlee Valette February 20, 2023 Deposition Transcript Exc",
              "attachment_number": 18
            },
            {
              "recap_id": 393012313,
              "pacer_url": "https://ecf.paed.uscourts.gov/doc1/153021639945?caseid=599124",
              "description": "Exhibit R - Plaintiff Lauren Willie April 6, 2023 Deposition Transcript Excerpts",
              "attachment_number": 19
            },
            {
              "recap_id": 393012314,
              "pacer_url": "https://ecf.paed.uscourts.gov/doc1/153021639946?caseid=599124",
              "description": "Exhibit S - Defendants September 8, 2023 Third Supplemental Initial Disclosures",
              "attachment_number": 20
            },
            {
              "recap_id": 393012315,
              "pacer_url": "https://ecf.paed.uscourts.gov/doc1/153021639947?caseid=599124",
              "description": "Certificate of Service",
              "attachment_number": 21
            }
          ],
          "url": "https://www.courtlistener.com/docket/64436633/103/burns-v-seaworld-parks-entertainment-inc/",
          "recap_pdf_url": null,
          "pacer_doc_id": "153021639926",
          "description": "RESPONSE in Opposition re 97 First MOTION to Certify Class filed by SEAWORLD PARKS & ENTERTAINMENT LLC, SEAWORLD PARKS & ENTERTAINMENT, INC.. (Attachments: # 1 Proposed Order, # 2 Exhibit A - Defendants 30(b)(6) November 7, 2023 Deposition Transcript Excerpts (Catherine Valeriano, Sesame Place Park President), # 3 Exhibit B - Nicholas Manna (Sesame Place Vice President of Entertainment) May 19, 2023 Deposition Transcript Excerpts, # 4 Exhibit C - Shavonne Strange (Sesame Place Entertainment Operations Manager) May 11, 2023 Deposition Transcript Excerpts, # 5 Exhibit D - Paul Joseph Schweizer (Sesame Place Entertainment Events and Production Manager) May 18, 2023 Deposition Transcript Excerpts, # 6 Exhibit E - Plaintiff Lashonda Miles March 30, 2023 Deposition Transcript Excerpts, # 7 Exhibit F - Plaintiff Nathan Fleming February 27, 2023 Deposition Transcript Excerpts, # 8 Exhibit G - SeaWorld Ambassador Handbook, # 9 Exhibit H - Plaintiffs September 25, 2023 Rule 26(a)(2) Disclosures, # 10 Exhibit I - Barbara Simmons October 19, 2023 Deposition Transcript Excerpts, # 11 Exhibit J - Plaintiff Katie Valdez February 19, 2023 Deposition Transcript Excerpts, # 12 Exhibit K - Plaintiff Katie Valdezs Answers to Defendants First Set of Interrogatories, # 13 Exhibit L - Defendants 30(b)(6) November 15, 2023 Deposition Transcript Excerpts (Kimberly Hall, Director of Strategic Pricing), # 14 Exhibit M - Declaration of Kimberly Hall, # 15 Exhibit N - Plaintiff Quinton Burns February 28, 2023 Deposition Transcript Excerpts, # 16 Exhibit O - Plaintiff Ingrid Morales February 14, 2023 Deposition Transcript Excerpts, # 17 Exhibit P - Plaintiff Yoselis Romero March 3, 2023 Deposition Transcript Excerpts, # 18 Exhibit Q - Plaintiff Ashlee Valette February 20, 2023 Deposition Transcript Excerpts, # 19 Exhibit R - Plaintiff Lauren Willie April 6, 2023 Deposition Transcript Excerpts, # 20 Exhibit S - Defendants September 8, 2023 Third Supplemental Initial Disclosures, # 21 Certificate of Service)(SKIPPER, LEIGH) (Entered: 12/11/2023)"
        },
        {
          "row_number": 6,
          "id": 9086219,
          "entry_number": "104",
          "date_filed": "2023-12-11T00:00:00-05:00",
          "attachments": [],
          "url": "https://www.courtlistener.com/docket/64436633/104/burns-v-seaworld-parks-entertainment-inc/",
          "recap_pdf_url": null,
          "pacer_doc_id": "153021639992",
          "description": "MOTION to Seal filed by SEAWORLD PARKS & ENTERTAINMENT LLC, SEAWORLD PARKS & ENTERTAINMENT, INC... (Attachments: # 1 Memorandum, # 2 Proposed Order, # 3 Certificate of Service)(SKIPPER, LEIGH) (Entered: 12/11/2023)"
        },
        {
          "row_number": 8,
          "id": 9086221,
          "entry_number": "106",
          "date_filed": "2023-12-18T00:00:00-05:00",
          "attachments": [],
          "url": "https://www.courtlistener.com/docket/64436633/106/burns-v-seaworld-parks-entertainment-inc/",
          "recap_pdf_url": null,
          "pacer_doc_id": "153021655258",
          "description": "ORDER granting in part and denying in part 104 MOTION TO SEAL AS OUTLINED HEREIN. SIGNED BY HONORABLE WENDY BEETLESTONE ON 12/18/23.12/18/23 ENTERED AND COPIES E-MAILED.(rf, ) (Entered: 12/18/2023)"
        },
        {
          "row_number": 10,
          "id": 9086223,
          "entry_number": "108",
          "date_filed": "2023-12-18T00:00:00-05:00",
          "attachments": [
            {
              "pdf_url": "https://www.courtlistener.com/recap/gov.uscourts.paed.599124/gov.uscourts.paed.599124.108.1.pdf",
              "recap_id": 381183429,
              "pacer_url": "https://ecf.paed.uscourts.gov/doc1/153021656923?caseid=599124",
              "description": "Memorandum of Law in Support of Defendants' Motion for Summary Judgment",
              "attachment_number": 1
            },
            {
              "recap_id": 381183430,
              "pacer_url": "https://ecf.paed.uscourts.gov/doc1/153021656924?caseid=599124",
              "description": "Defendants' Statement of Undisputed Material Facts",
              "attachment_number": 2
            },
            {
              "recap_id": 381183431,
              "pacer_url": "https://ecf.paed.uscourts.gov/doc1/153021656925?caseid=599124",
              "description": "Joint Appendix Table of Contents",
              "attachment_number": 3
            },
            {
              "recap_id": 381183432,
              "pacer_url": "https://ecf.paed.uscourts.gov/doc1/153021656926?caseid=599124",
              "description": "Joint Appendix",
              "attachment_number": 4
            },
            {
              "recap_id": 381183433,
              "pacer_url": "https://ecf.paed.uscourts.gov/doc1/153021656927?caseid=599124",
              "description": "Text of Proposed Order",
              "attachment_number": 5
            },
            {
              "recap_id": 381183434,
              "pacer_url": "https://ecf.paed.uscourts.gov/doc1/153021656928?caseid=599124",
              "description": "Certificate of Service",
              "attachment_number": 6
            }
          ],
          "url": "https://www.courtlistener.com/docket/64436633/108/burns-v-seaworld-parks-entertainment-inc/",
          "recap_pdf_url": null,
          "pacer_doc_id": "153021656922",
          "description": "MOTION for Summary Judgment filed by SEAWORLD PARKS & ENTERTAINMENT LLC, SEAWORLD PARKS & ENTERTAINMENT, INC..Memorandum, Certificate of Service. (Attachments: # 1 Memorandum of Law in Support of Defendants' Motion for Summary Judgment, # 2 Defendants' Statement of Undisputed Material Facts, # 3 Joint Appendix Table of Contents, # 4 Joint Appendix, # 5 Text of Proposed Order, # 6 Certificate of Service)(SKIPPER, LEIGH) (Entered: 12/18/2023)"
        },
        {
          "row_number": 11,
          "id": 9086224,
          "entry_number": "109",
          "date_filed": "2023-12-18T00:00:00-05:00",
          "attachments": [],
          "url": "https://www.courtlistener.com/docket/64436633/109/burns-v-seaworld-parks-entertainment-inc/",
          "recap_pdf_url": null,
          "pacer_doc_id": "153021656934",
          "description": "MOTION to Seal Portions of the Joint Appendix and the Statement of Undisputed Material Facts Filed With Defendants' Motion for Summary Judgment filed by SEAWORLD PARKS & ENTERTAINMENT LLC, SEAWORLD PARKS & ENTERTAINMENT, INC..Memorandum, Certificate of Service. (Attachments: # 1 Memorandum of Law in Support of Defendants' Motion to Seal Portions of the Joint Appendix and the Statement of Undisputed Material Facts, # 2 Exhibit 1 - Excerpts from Deposition of J. Hall, # 3 Exhibit 2 - Excerpts from 30(b)(6) Deposition of C. Valeriano, # 4 Text of Proposed Order, # 5 Certificate of Service)(SKIPPER, LEIGH) (Entered: 12/18/2023)"
        },
        {
          "row_number": 15,
          "id": 9086227,
          "entry_number": "112",
          "date_filed": "2023-12-21T00:00:00-05:00",
          "attachments": [],
          "url": "https://www.courtlistener.com/docket/64436633/112/burns-v-seaworld-parks-entertainment-inc/",
          "recap_pdf_url": null,
          "pacer_doc_id": "153021665041",
          "description": "ORDER granting in part and denying in part 109 MOTION TO SEAL. SIGNED BY HONORABLE WENDY BEETLESTONE ON 12/19/23.12/21/23 ENTERED AND COPIES E-MAILED.(rf, ) (Entered: 12/21/2023)"
        },
        {
          "row_number": 17,
          "id": 9086229,
          "entry_number": "114",
          "date_filed": "2024-01-02T00:00:00-05:00",
          "attachments": [],
          "url": "https://www.courtlistener.com/docket/64436633/114/burns-v-seaworld-parks-entertainment-inc/",
          "recap_pdf_url": null,
          "pacer_doc_id": null,
          "description": "ORDER granting 113 MOTION FOR EXTENSION OF TIME TO FILE RESPONSE/REPLY RE 113 Consent MOTION for Extension of Time to File Response/Reply as to 110 MOTION to Strike and Preclude Expert Testimony of Dr. Michael L. Lindsey BY HONORABLE WENDY BEETLESTONE ON 01/02/2024.01/02/2024 ENTERED AND COPIES E-MAILED.(amw) (Entered: 01/02/2024)"
        },
        {
          "row_number": 18,
          "id": 9086231,
          "entry_number": "115",
          "date_filed": "2024-01-08T00:00:00-05:00",
          "attachments": [],
          "url": "https://www.courtlistener.com/docket/64436633/115/burns-v-seaworld-parks-entertainment-inc/",
          "recap_pdf_url": null,
          "pacer_doc_id": "153021696881",
          "description": "RESPONSE in Opposition re 110 MOTION to Strike and Preclude Expert Testimony of Dr. Michael L. Lindsey filed by QUINTON BURNS, NATHAN FLEMING, LASHONDA MILES, INGRID MORALES, YOSELIS ROMERO, KATIE VALDEZ, ASHLEY VALETTE, LAUREN WILLIE. (Attachments: # 1 Exhibit Exhibit A - Michael L. Lindsey October 23, 2023 Deposition Excerpts, # 2 Exhibit Exhibit B - J. Sommers-Flanagan, APA Handbook of Clinical Psychology Applications and Methods, 2016, # 3 Exhibit Exhibit C - Diagnositce and Statistical Manual of Mental Disorders 5th Ed. (pp. 271-274), # 4 Appendix Table of Content, Table of Citations, Rules, # 5 Text of Proposed Order Proposed Order)(O'CONNELL, ANDREW) (Entered: 01/08/2024)"
        },
        {
          "row_number": 20,
          "id": 9086233,
          "entry_number": "117",
          "date_filed": "2024-01-08T00:00:00-05:00",
          "attachments": [],
          "url": "https://www.courtlistener.com/docket/64436633/117/burns-v-seaworld-parks-entertainment-inc/",
          "recap_pdf_url": null,
          "pacer_doc_id": "153021697862",
          "description": "Supplemental Joint Appendix by QUINTON BURNS, NATHAN FLEMING, LASHONDA MILES, INGRID MORALES, YOSELIS ROMERO, KATIE VALDEZ, ASHLEY VALETTE, LAUREN WILLIE re 116 RESPONSE in Opposition.(FILED UNDER SEAL)(md) (Additional attachment(s) added on 1/9/2024: # 1 Sealed Document, # 2 Sealed Document) (md). (Entered: 01/09/2024)"
        },
        {
          "row_number": 22,
          "id": 9086235,
          "entry_number": "119",
          "date_filed": "2024-01-16T00:00:00-05:00",
          "attachments": [],
          "url": "https://www.courtlistener.com/docket/64436633/119/burns-v-seaworld-parks-entertainment-inc/",
          "recap_pdf_url": null,
          "pacer_doc_id": "153021714840",
          "description": "RESPONSE in Support re 108 MOTION for Summary Judgment filed by SEAWORLD PARKS & ENTERTAINMENT LLC, SEAWORLD PARKS & ENTERTAINMENT, INC.. (Attachments: # 1 Defendants' Reply Statement of Undisputed Material Facts in Support of Motion for Summary Judgment, # 2 MSJ Reply Joint Appendix Table of Contents, # 3 Defendants' Supplemental Joint Appendix, # 4 Certificate of Service)(SKIPPER, LEIGH) (Entered: 01/16/2024)"
        },
        {
          "row_number": 27,
          "id": 9086240,
          "entry_number": "123",
          "date_filed": "2024-02-05T00:00:00-05:00",
          "attachments": [],
          "url": "https://www.courtlistener.com/docket/64436633/123/burns-v-seaworld-parks-entertainment-inc/",
          "recap_pdf_url": null,
          "pacer_doc_id": "153021765318",
          "description": "MOTION for Leave to File Second Amended Complaint filed by QUINTON BURNS, NATHAN FLEMING, LASHONDA MILES, INGRID MORALES, YOSELIS ROMERO, KATIE VALDEZ, ASHLEY VALETTE, LAUREN WILLIE.Memorandum, Certificate of Service. (Attachments: # 1 Exhibit Plaintiffs' Second Amended Complaint, # 2 Text of Proposed Order Proposed Order)(RICHARDSON, RONALD) (Entered: 02/05/2024)"
        },
        {
          "row_number": 29,
          "id": 9086243,
          "entry_number": "125",
          "date_filed": "2024-02-20T00:00:00-05:00",
          "attachments": [],
          "url": "https://www.courtlistener.com/docket/64436633/125/burns-v-seaworld-parks-entertainment-inc/",
          "recap_pdf_url": null,
          "pacer_doc_id": null,
          "description": "NOTICE re: Cancellation of Hearing - FIRST MOTION TO CERTIFY CLASS, scheduled for 02/29/2024 AT 11:00 A.M.(amw) (Entered: 02/20/2024)"
        },
        {
          "row_number": 32,
          "id": 9086246,
          "entry_number": "128",
          "date_filed": "2024-02-27T00:00:00-05:00",
          "attachments": [],
          "url": "https://www.courtlistener.com/docket/64436633/128/burns-v-seaworld-parks-entertainment-inc/",
          "recap_pdf_url": null,
          "pacer_doc_id": "153021820223",
          "description": "REPLY to Response to Motion re 123 MOTION for Leave to File Second Amended Complaint filed by QUINTON BURNS, NATHAN FLEMING, LASHONDA MILES, INGRID MORALES, YOSELIS ROMERO, KATIE VALDEZ, ASHLEY VALETTE, LAUREN WILLIE. (Attachments: # 1 Text of Proposed Order)(RICHARDSON, RONALD) (Entered: 02/27/2024)"
        },
        {
          "row_number": 282,
          "id": 9086249,
          "entry_number": null,
          "date_filed": "2024-03-12T00:00:00-04:00",
          "attachments": [],
          "url": "https://www.courtlistener.com",
          "recap_pdf_url": null,
          "pacer_doc_id": null,
          "description": "Notice (Other)"
        },
        {
          "row_number": 283,
          "id": 9086250,
          "entry_number": null,
          "date_filed": "2024-03-12T00:00:00-04:00",
          "attachments": [],
          "url": "https://www.courtlistener.com",
          "recap_pdf_url": null,
          "pacer_doc_id": null,
          "description": "NOTICE re 35 Pretrial Scheduling Order, - FINAL PRETRIAL CONFERENCE RESET FOR THURSDAY, MAY 2, 2024 AT 10:00 A.M. IN CHAMBERS ROOM 10614. PLEASE MAKE NOTE OF THIS CHANGE IN DATE AND TIME. THANK YOU.(amw)"
        },
        {
          "row_number": 37,
          "id": 9086252,
          "entry_number": "132",
          "date_filed": "2024-03-21T00:00:00-04:00",
          "attachments": [],
          "url": "https://www.courtlistener.com/docket/64436633/132/burns-v-seaworld-parks-entertainment-inc/",
          "recap_pdf_url": "https://www.courtlistener.com/recap/gov.uscourts.paed.599124/gov.uscourts.paed.599124.132.0.pdf",
          "pacer_doc_id": "153021880494",
          "description": "ORDER granting 118 Motion AS OUTLINED HEREIN. SIGNED BY DISTRICT JUDGE WENDY BEETLESTONE ON 3/21/24.3/21/24 ENTERED AND COPIES E-MAILED.(rf, ) (Entered: 03/21/2024)"
        },
        {
          "row_number": 39,
          "id": 9086254,
          "entry_number": "134",
          "date_filed": "2024-03-22T00:00:00-04:00",
          "attachments": [],
          "url": "https://www.courtlistener.com/docket/64436633/134/burns-v-seaworld-parks-entertainment-inc/",
          "recap_pdf_url": null,
          "pacer_doc_id": "153021884762",
          "description": "ANSWER to Complaint Second Amended Complaint by SEAWORLD PARKS & ENTERTAINMENT LLC, SEAWORLD PARKS & ENTERTAINMENT, INC.. (Attachments: # 1 Certificate of Service)(SKIPPER, LEIGH) (Entered: 03/22/2024)"
        },
        {
          "row_number": 40,
          "id": 9086255,
          "entry_number": "135",
          "date_filed": "2024-03-25T00:00:00-04:00",
          "attachments": [],
          "url": "https://www.courtlistener.com/docket/64436633/135/burns-v-seaworld-parks-entertainment-inc/",
          "recap_pdf_url": null,
          "pacer_doc_id": "153021885738",
          "description": "REPLY to Response to Motion re 131 Supplemental MOTION for Summary Judgment filed by SEAWORLD PARKS & ENTERTAINMENT LLC, SEAWORLD PARKS & ENTERTAINMENT, INC.. (Attachments: # 1 Certificate of Service)(SKIPPER, LEIGH) (Entered: 03/25/2024)"
        },
        {
          "row_number": 42,
          "id": 9086257,
          "entry_number": "137",
          "date_filed": "2024-04-12T00:00:00-04:00",
          "attachments": [],
          "url": "https://www.courtlistener.com/docket/64436633/137/burns-v-seaworld-parks-entertainment-inc/",
          "recap_pdf_url": null,
          "pacer_doc_id": null,
          "description": "PAPERLESS NOTICE: THE SETTLEMENT CONFERENCE SCHEDULED ON 4/15/24 BEFORE MAGISTRATE JUDGE RICHARD A. LLORET IS NOW CANCELED.(smcc) (Entered: 04/12/2024)"
        },
        {
          "row_number": 49,
          "id": 9086264,
          "entry_number": "143",
          "date_filed": "2024-04-23T00:00:00-04:00",
          "attachments": [],
          "url": "https://www.courtlistener.com/docket/64436633/143/burns-v-seaworld-parks-entertainment-inc/",
          "recap_pdf_url": null,
          "pacer_doc_id": "153021955931",
          "description": "AMENDED DOCUMENT by QUINTON BURNS, NATHAN FLEMING, INGRID MORALES, KATIE VALDEZ, LAUREN WILLIE. Amendment to 142 Pretrial Memorandum,, Exhibit 5 (ECF 142-5). (Attachments: # 1 Exhibit Plaintiffs' Amended Exhibit List)(RICHARDSON, RONALD) (Entered: 04/23/2024)"
        },
        {
          "row_number": 51,
          "id": 9086266,
          "entry_number": "145",
          "date_filed": "2024-04-25T00:00:00-04:00",
          "attachments": [],
          "url": "https://www.courtlistener.com/docket/64436633/145/burns-v-seaworld-parks-entertainment-inc/",
          "recap_pdf_url": null,
          "pacer_doc_id": "153021963358",
          "description": "AMENDED DOCUMENT by QUINTON BURNS, NATHAN FLEMING, INGRID MORALES, KATIE VALDEZ, LAUREN WILLIE. Amendment to 142 Pretrial Memorandum,, Exhibit 5 (ECF 142-5). (Attachments: # 1 Exhibit Plaintiffs' Second Amended Exhibit List)(RICHARDSON, RONALD) (Entered: 04/25/2024)"
        },
        {
          "row_number": 54,
          "id": 9086269,
          "entry_number": "148",
          "date_filed": "2024-04-26T00:00:00-04:00",
          "attachments": [],
          "url": "https://www.courtlistener.com/docket/64436633/148/burns-v-seaworld-parks-entertainment-inc/",
          "recap_pdf_url": null,
          "pacer_doc_id": "153021967639",
          "description": "Third MOTION in Limine to Exclude the Testimony, Opinions, and Related Evidence of Dr. Michael Lindsey filed by SEAWORLD PARKS & ENTERTAINMENT LLC, SEAWORLD PARKS & ENTERTAINMENT, INC..Memorandum, Certificate of Service. (Attachments: # 1 Memorandum, # 2 Exhibit 1 - Dr. Lindsey's Psychological Evaluation of the Willie Family, # 3 Exhibit 2 - Dr. Lindsey's Psychologic Evaluation of the Burns Family, # 4 Text of Proposed Order, # 5 Certificate of Service)(SKIPPER, LEIGH) (Entered: 04/26/2024)"
        },
        {
          "row_number": 57,
          "id": 9086271,
          "entry_number": "150",
          "date_filed": "2024-04-26T00:00:00-04:00",
          "attachments": [],
          "url": "https://www.courtlistener.com/docket/64436633/150/burns-v-seaworld-parks-entertainment-inc/",
          "recap_pdf_url": null,
          "pacer_doc_id": "153021967662",
          "description": "Fifth MOTION in Limine to Exclude Testimony and Related Evidence of Plaintiffs' Investigators filed by SEAWORLD PARKS & ENTERTAINMENT LLC, SEAWORLD PARKS & ENTERTAINMENT, INC..Memorandum, Certificate of Service. (Attachments: # 1 Memorandum, # 2 Exhibit 1 - LinkedIn Page of Rogelio Guerra, # 3 Text of Proposed Order, # 4 Certificate of Service)(SKIPPER, LEIGH) Modified on 5/2/2024 (nd). (Entered: 04/26/2024)"
        },
        {
          "row_number": 58,
          "id": 9086272,
          "entry_number": "151",
          "date_filed": "2024-04-26T00:00:00-04:00",
          "attachments": [],
          "url": "https://www.courtlistener.com/docket/64436633/151/burns-v-seaworld-parks-entertainment-inc/",
          "recap_pdf_url": null,
          "pacer_doc_id": "153021967680",
          "description": "Sixth MOTION in Limine to Exclude Certain Evidence, Testimony, or Argument Regarding Plaintiff Lauren Willie filed by SEAWORLD PARKS & ENTERTAINMENT LLC, SEAWORLD PARKS & ENTERTAINMENT, INC..Memorandum, Certificate of Service. (Attachments: # 1 Memorandum, # 2 Exhibit 1 - Psychological Evaluation of the Willie Family, # 3 Exhibit 2 - Excerpts from Deposition of Dr. Lindsey, # 4 Text of Proposed Order, # 5 Certificate of Service)(SKIPPER, LEIGH) (Entered: 04/26/2024)"
        },
        {
          "row_number": 59,
          "id": 9086273,
          "entry_number": "152",
          "date_filed": "2024-04-26T00:00:00-04:00",
          "attachments": [],
          "url": "https://www.courtlistener.com/docket/64436633/152/burns-v-seaworld-parks-entertainment-inc/",
          "recap_pdf_url": null,
          "pacer_doc_id": "153021967794",
          "description": "MOTION in Limine to Preclude Any Testimony, Evidence, or Argument Concerning a Default Judgment Entered Against Nathan Fleming filed by QUINTON BURNS, NATHAN FLEMING, INGRID MORALES, KATIE VALDEZ, LAUREN WILLIE.Certificate of Service. (Attachments: # 1 Text of Proposed Order Proposed Order)(RUFF, MALCOLM) (Entered: 04/26/2024)"
        },
        {
          "row_number": 62,
          "id": 9086276,
          "entry_number": "155",
          "date_filed": "2024-04-26T00:00:00-04:00",
          "attachments": [],
          "url": "https://www.courtlistener.com/docket/64436633/155/burns-v-seaworld-parks-entertainment-inc/",
          "recap_pdf_url": null,
          "pacer_doc_id": "153021967826",
          "description": "MOTION in Limine to Preclude any Testimony, Evidence or Argument Concerning Nathan Fleming's Public Post on Social Media filed by QUINTON BURNS, NATHAN FLEMING, INGRID MORALES, KATIE VALDEZ, LAUREN WILLIE.Certificate of Service. (Attachments: # 1 Text of Proposed Order Proposed Order, # 2 Exhibit)(RUFF, MALCOLM) (Entered: 04/26/2024)"
        },
        {
          "row_number": 63,
          "id": 9086277,
          "entry_number": "156",
          "date_filed": "2024-04-26T00:00:00-04:00",
          "attachments": [],
          "url": "https://www.courtlistener.com/docket/64436633/156/burns-v-seaworld-parks-entertainment-inc/",
          "recap_pdf_url": null,
          "pacer_doc_id": "153021967831",
          "description": "MOTION in Limine to Exclude Certain Proposed Exhibits by Defendants filed by QUINTON BURNS, NATHAN FLEMING, INGRID MORALES, KATIE VALDEZ, LAUREN WILLIE.Certificate of Service. (Attachments: # 1 Exhibit Photographs of Former Employees, # 2 Text of Proposed Order Proposed Order)(RUFF, MALCOLM) Modified on 5/2/2024 (nd). (Entered: 04/26/2024)"
        },
        {
          "row_number": 64,
          "id": 9086278,
          "entry_number": "157",
          "date_filed": "2024-04-29T00:00:00-04:00",
          "attachments": [],
          "url": "https://www.courtlistener.com/docket/64436633/157/burns-v-seaworld-parks-entertainment-inc/",
          "recap_pdf_url": null,
          "pacer_doc_id": "153021971079",
          "description": "PRETRIAL MEMORANDUM by SEAWORLD PARKS & ENTERTAINMENT LLC, SEAWORLD PARKS & ENTERTAINMENT, INC. Certificate of Service. (Attachments: # 1 Exhibit A - Defendants' Deposition Designations - Deposition of K.B., # 2 Exhibit B - Defendants' Deposition Designations - Deposition of OF, # 3 Exhibit C - Defendants' Trial Exhibit List, # 4 Exhibit D - Plaintiffs' Objections to Defendants' Deposition Designations, # 5 Exhibit E - Defendants' Proposed Substantive Jury Instructions, # 6 Exhibit F - Defendants' Proposed Verdict Form, # 7 Certificate of Service)(SKIPPER, LEIGH) (Entered: 04/29/2024)"
        },
        {
          "row_number": 66,
          "id": 9086280,
          "entry_number": "159",
          "date_filed": "2024-04-30T00:00:00-04:00",
          "attachments": [],
          "url": "https://www.courtlistener.com/docket/64436633/159/burns-v-seaworld-parks-entertainment-inc/",
          "recap_pdf_url": null,
          "pacer_doc_id": "153021974736",
          "description": "RESPONSE to Motion re 152 MOTION in Limine to Preclude Any Testimony, Evidence, or Argument Concerning a Default Judgment Entered Against Nathan Fleming filed by SEAWORLD PARKS & ENTERTAINMENT LLC, SEAWORLD PARKS & ENTERTAINMENT, INC.. (Attachments: # 1 Certificate of Service)(SKIPPER, LEIGH) (Entered: 04/30/2024)"
        },
        {
          "row_number": 68,
          "id": 9086281,
          "entry_number": "160",
          "date_filed": "2024-04-30T00:00:00-04:00",
          "attachments": [],
          "url": "https://www.courtlistener.com/docket/64436633/160/burns-v-seaworld-parks-entertainment-inc/",
          "recap_pdf_url": null,
          "pacer_doc_id": "153021974740",
          "description": "RESPONSE to Motion re 154 MOTION in Limine to Preclude any Testimony, Evidence, or Argument Concering Criminal Charges and or Convictions Involving Nathan Fleming, 153 MOTION in Limine to Preclude any Testimony, Evidence, or Arguments Concering Criminal Charges and or Convictions Involving Nathan Fleming filed by SEAWORLD PARKS & ENTERTAINMENT LLC, SEAWORLD PARKS & ENTERTAINMENT, INC.. (Attachments: # 1 Certificate of Service)(SKIPPER, LEIGH) (Entered: 04/30/2024)"
        },
        {
          "row_number": 69,
          "id": 9086282,
