{
  "case_id": 9621,
  "fetched_at": "2025-10-20T22:43:13.199171",
  "case_data": {
    "attorney_orgs": [],
    "available_documents": [
      "Trial Court Docket",
      "Any published opinion"
    ],
    "case_defendants": [
      {
        "defendant_level": null,
        "institution": "York County Jail",
        "institution_alt_state": null,
        "institution_city": "",
        "institution_county": "York",
        "name": "York County",
        "defendant_level_other": "",
        "is_active": true
      }
    ],
    "case_ongoing": "No",
    "case_status": "Coding Complete",
    "case_types": [
      "Jail Conditions"
    ],
    "cause_other": "",
    "causes": [
      "42 U.S.C. ยง 1983"
    ],
    "class_action_granted": "Granted",
    "class_action_sought": "Yes",
    "closing_year": 2006,
    "constitutional_clause": [
      {
        "value": "Unreasonable search and seizure"
      }
    ],
    "content_of_injunction": [],
    "court": "District of Maine",
    "custom_issues": [],
    "defendant_payment": "",
    "defendant_type": [],
    "docket_status": "Complete as of retrieval date",
    "facility_type": [
      {
        "value": "Government-run"
      }
    ],
    "filing_date": "2002-10-15",
    "filing_year": 2002,
    "id": 9621,
    "injunction_duration": "",
    "issues": [
      "General/Misc.: Search policies",
      "Jails, Prisons, Detention Centers, and Other Institutions: Strip search policy (facilities)",
      "Affected Sex/Gender(s): Male",
      "Affected Sex/Gender(s): Female"
    ],
    "last_checked_date": "2008-02-17T00:00:00-05:00",
    "main_docket": {
      "id": 33456,
      "docket_entries": [
        {
          "row_number": 111,
          "id": 9513050,
          "entry_number": "2",
          "date_filed": "2003-02-13T00:00:00-05:00",
          "attachments": [],
          "url": "https://www.courtlistener.com/docket/12069135/2/nilsen-v-york-county/",
          "recap_pdf_url": null,
          "pacer_doc_id": null,
          "description": "AMENDED COMPLAINT against YORK COUNTY with JURY DEMANDfiled by MICHELE NILSEN. (Service of Process Deadline 6/13/2003)(mo, ) (Entered: 02/13/2003)"
        },
        {
          "row_number": 139,
          "id": 9513051,
          "entry_number": "3",
          "date_filed": "2003-02-13T00:00:00-05:00",
          "attachments": [],
          "url": "https://www.courtlistener.com/docket/12069135/3/nilsen-v-york-county/",
          "recap_pdf_url": null,
          "pacer_doc_id": null,
          "description": "SUMMONS Returned Executed by MICHELE NILSEN. YORK COUNTY served on 2/11/2003. Answer due by 3/3/2003 for YORK COUNTY (mjl, ) (Entered: 02/18/2003)"
        },
        {
          "row_number": 150,
          "id": 9513052,
          "entry_number": "4",
          "date_filed": "2003-02-25T00:00:00-05:00",
          "attachments": [],
          "url": "https://www.courtlistener.com/docket/12069135/4/nilsen-v-york-county/",
          "recap_pdf_url": null,
          "pacer_doc_id": null,
          "description": "ANSWER to Amended Complaint by YORK COUNTY.(mnm, ) (Entered: 02/26/2003)"
        },
        {
          "row_number": 161,
          "id": 9513053,
          "entry_number": "5",
          "date_filed": "2003-02-26T00:00:00-05:00",
          "attachments": [],
          "url": "https://www.courtlistener.com/docket/12069135/5/nilsen-v-york-county/",
          "recap_pdf_url": null,
          "pacer_doc_id": null,
          "description": "SCHEDULING ORDER: Discovery due by 7/2/2003. Motions due by 7/9/2003. Ready for Trial on 10/1/2003. Signed by Judge DAVID M. COHEN on 02/26/03. (mnm, ) (Entered: 03/06/2003)"
        },
        {
          "row_number": 172,
          "id": 9513054,
          "entry_number": "6",
          "date_filed": "2003-03-12T00:00:00-05:00",
          "attachments": [],
          "url": "https://www.courtlistener.com/docket/12069135/6/nilsen-v-york-county/",
          "recap_pdf_url": null,
          "pacer_doc_id": null,
          "description": "Joint MOTION to Amend Scheduling Order to extend ddls for conferring and objecting to scheduling order by YORK COUNTY. (dw, ) (Entered: 03/14/2003)"
        },
        {
          "row_number": 218,
          "id": 9513055,
          "entry_number": null,
          "date_filed": "2003-03-14T00:00:00-05:00",
          "attachments": [],
          "url": "https://www.courtlistener.com",
          "recap_pdf_url": null,
          "pacer_doc_id": null,
          "description": "MOTIONS 6 Joint MOTION to Amend Scheduling Order to extend ddls for conferring and objecting to scheduling order REFERRED to Magistrate Judge MAGISTRATE JUDGE DAVID M. COHEN.(dw)"
        },
        {
          "row_number": 219,
          "id": 9513056,
          "entry_number": null,
          "date_filed": "2003-03-17T00:00:00-05:00",
          "attachments": [],
          "url": "https://www.courtlistener.com",
          "recap_pdf_url": null,
          "pacer_doc_id": null,
          "description": "ENDORSEMENT granting 6 Motion to Amend Scheduling Order Signed by Judge DAVID M. COHEN on 03/17/03. (mnm, )"
        },
        {
          "row_number": 220,
          "id": 9513057,
          "entry_number": null,
          "date_filed": "2003-03-19T00:00:00-05:00",
          "attachments": [],
          "url": "https://www.courtlistener.com",
          "recap_pdf_url": null,
          "pacer_doc_id": null,
          "description": "NOTICE of Appearance by JOHN J. WALL III on behalf of YORK COUNTY (mjl, )"
        },
        {
          "row_number": 183,
          "id": 9513058,
          "entry_number": "7",
          "date_filed": "2003-03-19T00:00:00-05:00",
          "attachments": [],
          "url": "https://www.courtlistener.com/docket/12069135/7/nilsen-v-york-county/",
          "recap_pdf_url": null,
          "pacer_doc_id": null,
          "description": "Unopposed MOTION to Extend Time until April 2, 2003 to file any motion to strike portions of the Defendant's answer Answer to Amended Complaint 4 by MICHELE NILSEN. (mnm, ) (Entered: 03/20/2003)"
        },
        {
          "row_number": 221,
          "id": 9513059,
          "entry_number": null,
          "date_filed": "2003-03-19T00:00:00-05:00",
          "attachments": [],
          "url": "https://www.courtlistener.com",
          "recap_pdf_url": null,
          "pacer_doc_id": null,
          "description": "MOTIONS 7 Unopposed MOTION to Extend Time until April 2, 2003 to file any motion to strike portions of the Defendant's answer Answer to Amended Complaint 4 REFERRED to Magistrate Judge David M. Cohen.(mnm, )"
        },
        {
          "row_number": 194,
          "id": 9513061,
          "entry_number": "8",
          "date_filed": "2003-03-21T00:00:00-05:00",
          "attachments": [],
          "url": "https://www.courtlistener.com/docket/12069135/8/nilsen-v-york-county/",
          "recap_pdf_url": null,
          "pacer_doc_id": null,
          "description": "MOTION to Amend Scheduling Order to Modify: Track Assignment, Amount of Discovery and Deadlines by MICHELE NILSEN.Responses due by 4/11/2003. (ckb, ) (Entered: 03/24/2003)"
        },
        {
          "row_number": 223,
          "id": 9513062,
          "entry_number": null,
          "date_filed": "2003-03-24T00:00:00-05:00",
          "attachments": [],
          "url": "https://www.courtlistener.com",
          "recap_pdf_url": null,
          "pacer_doc_id": null,
          "description": "MOTIONS 8 MOTION to Amend Scheduling Order to Modify: Track Assignment, Amount of Discovery and Deadlines REFERRED to Magistrate Judge Magistrate Judge Cohen.(ckb, )"
        },
        {
          "row_number": 205,
          "id": 9513063,
          "entry_number": "9",
          "date_filed": "2003-04-02T00:00:00-05:00",
          "attachments": [],
          "url": "https://www.courtlistener.com/docket/12069135/9/nilsen-v-york-county/",
          "recap_pdf_url": null,
          "pacer_doc_id": null,
          "description": "MOTION to Strike 4 Answer to Amended Complaint by MICHELE NILSEN WITH MEMO IN SUPPORT.Responses due by 4/23/2003. (ckb, ) (Entered: 04/02/2003)"
        },
        {
          "row_number": 224,
          "id": 9513066,
          "entry_number": null,
          "date_filed": "2003-04-09T00:00:00-04:00",
          "attachments": [],
          "url": "https://www.courtlistener.com",
          "recap_pdf_url": null,
          "pacer_doc_id": null,
          "description": "Minute Entry for proceedings held before Judge DAVID M. COHEN : Telephone Conference held re: Mtn #8 to Amend Scheduling Order. (Court Reporter NONE) (mnm, )"
        },
        {
          "row_number": 23,
          "id": 9513067,
          "entry_number": "12",
          "date_filed": "2003-04-14T00:00:00-04:00",
          "attachments": [],
          "url": "https://www.courtlistener.com/docket/12069135/12/nilsen-v-york-county/",
          "recap_pdf_url": null,
          "pacer_doc_id": null,
          "description": "RESPONSE to Motion re 9 MOTION to Strike 4 Answer to Amended Complaint filed by YORK COUNTY.Reply due by 4/25/2003. (mnm, ) (Entered: 04/15/2003)"
        },
        {
          "row_number": 34,
          "id": 9513068,
          "entry_number": "13",
          "date_filed": "2003-04-25T00:00:00-04:00",
          "attachments": [],
          "url": "https://www.courtlistener.com/docket/12069135/13/nilsen-v-york-county/",
          "recap_pdf_url": null,
          "pacer_doc_id": null,
          "description": "REPLY to Response to Motion re 9 MOTION to Strike 4 Answer to Amended Complaint filed by MICHELE NILSEN. (mnm, ) (Entered: 04/26/2003)"
        },
        {
          "row_number": 225,
          "id": 9513069,
          "entry_number": null,
          "date_filed": "2003-04-26T00:00:00-04:00",
          "attachments": [],
          "url": "https://www.courtlistener.com",
          "recap_pdf_url": null,
          "pacer_doc_id": null,
          "description": "MOTIONS 9 MOTION to Strike 4 Answer to Amended Complaint REFERRED to Magistrate Judge DAVID M. COHEN.(mnm, )"
        },
        {
          "row_number": 226,
          "id": 9513071,
          "entry_number": null,
          "date_filed": "2003-05-01T00:00:00-04:00",
          "attachments": [],
          "url": "https://www.courtlistener.com",
          "recap_pdf_url": null,
          "pacer_doc_id": null,
          "description": "MOTION 14 to Amend Scheduling Order To Change the Track from Standard to Complex REFERRED to Magistrate Judge David M. Cohen.(mo, )"
        },
        {
          "row_number": 56,
          "id": 9513072,
          "entry_number": "15",
          "date_filed": "2003-05-01T00:00:00-04:00",
          "attachments": [],
          "url": "https://www.courtlistener.com/docket/12069135/15/nilsen-v-york-county/",
          "recap_pdf_url": null,
          "pacer_doc_id": null,
          "description": "ORDER pertaining to production of confidential documents Signed by Judge D. BROCK HORNBY on 05/01/03. (mnm, ) (Entered: 05/01/2003)"
        },
        {
          "row_number": 78,
          "id": 9513074,
          "entry_number": "17",
          "date_filed": "2003-05-07T00:00:00-04:00",
          "attachments": [],
          "url": "https://www.courtlistener.com/docket/12069135/17/nilsen-v-york-county/",
          "recap_pdf_url": null,
          "pacer_doc_id": null,
          "description": "REPLY to Response to Motion re 14 MOTION to Amend Scheduling Order To Change the Track from Standard to Complex filed by MICHELE NILSEN. (mnm, ) (Entered: 05/08/2003)"
        },
        {
          "row_number": 89,
          "id": 9513075,
          "entry_number": "18",
          "date_filed": "2003-05-07T00:00:00-04:00",
          "attachments": [],
          "url": "https://www.courtlistener.com/docket/12069135/18/nilsen-v-york-county/",
          "recap_pdf_url": null,
          "pacer_doc_id": null,
          "description": "MOTION to For Leave to File Second Amended Complaint and to Join additional named plaintiff by MICHELE NILSEN WITH MEMO IN SUPPORT.Responses due by 5/28/2003. (mnm, ) Modified on 5/8/2003 (mnm, ). (Entered: 05/08/2003)"
        },
        {
          "row_number": 227,
          "id": 9513076,
          "entry_number": null,
          "date_filed": "2003-05-08T00:00:00-04:00",
          "attachments": [],
          "url": "https://www.courtlistener.com",
          "recap_pdf_url": null,
          "pacer_doc_id": null,
          "description": "MOTIONS 14 MOTION to Amend Scheduling Order To Change the Track from Standard to Complex REFERRED to Magistrate Judge COHEN.(slh, )"
        },
        {
          "row_number": 228,
          "id": 9513077,
          "entry_number": null,
          "date_filed": "2003-05-08T00:00:00-04:00",
          "attachments": [],
          "url": "https://www.courtlistener.com",
          "recap_pdf_url": null,
          "pacer_doc_id": null,
          "description": "ENDORSEMENT ORDER denying 9 Motion to Strike, \"5/8/03 The Motion is denied. The defendant shall file an amended answer to reflect the admission contained in footnote 1 on page 2 of the defendant?s objection to the motion to strike (Docket No. 12) that the referenced document does contain the words quoted in the second sentence of paragraph 4 of the Complaint. So Ordered.\" Signed by Magistrate Judge DAVID M. COHEN on 5/8/03. (mo, )"
        },
        {
          "row_number": 229,
          "id": 9513078,
          "entry_number": null,
          "date_filed": "2003-05-08T00:00:00-04:00",
          "attachments": [],
          "url": "https://www.courtlistener.com",
          "recap_pdf_url": null,
          "pacer_doc_id": null,
          "description": "Motions No Longer Referred: 14 MOTION to Amend Scheduling Order To Change the Track from Standard to Complex(mo, )"
        },
        {
          "row_number": 230,
          "id": 9513079,
          "entry_number": null,
          "date_filed": "2003-05-09T00:00:00-04:00",
          "attachments": [],
          "url": "https://www.courtlistener.com",
          "recap_pdf_url": null,
          "pacer_doc_id": null,
          "description": "Motions Taken Under Advisement: 14 MOTION to Amend Scheduling Order To Change the Track from Standard to Complex(mo, )"
        },
        {
          "row_number": 231,
          "id": 9513080,
          "entry_number": null,
          "date_filed": "2003-05-15T00:00:00-04:00",
          "attachments": [],
          "url": "https://www.courtlistener.com",
          "recap_pdf_url": null,
          "pacer_doc_id": null,
          "description": "NOTICE of Hearing: Conference of Counsel set for 5/23/2003 02:30 PM before JUDGE D. BROCK HORNBY. (mnm, )"
        },
        {
          "row_number": 100,
          "id": 9513081,
          "entry_number": "19",
          "date_filed": "2003-05-15T00:00:00-04:00",
          "attachments": [],
          "url": "https://www.courtlistener.com/docket/12069135/19/nilsen-v-york-county/",
          "recap_pdf_url": null,
          "pacer_doc_id": null,
          "description": "MOTION to Amend Scheduling Order to Extend Deadline for Filing Motion for Class Cert from 05/28/2003 to 06/11/2003 by MICHELE NILSEN W/MEMO IN SUPPORT.Responses due by 6/5/2003. (dw, ) (Entered: 05/15/2003)"
        },
        {
          "row_number": 232,
          "id": 9513083,
          "entry_number": null,
          "date_filed": "2003-05-16T00:00:00-04:00",
          "attachments": [],
          "url": "https://www.courtlistener.com",
          "recap_pdf_url": null,
          "pacer_doc_id": null,
          "description": "ENDORSED ORDER granting without objection 19 Motion to Amend Scheduling Order to extend Pltf's deadline for filing Motion for Class Certification to 06/11/2003. /s/ USDJ D. BROCK HORNBY. (dw)"
        },
        {
          "row_number": 123,
          "id": 9513084,
          "entry_number": "21",
          "date_filed": "2003-05-23T00:00:00-04:00",
          "attachments": [],
          "url": "https://www.courtlistener.com/docket/12069135/21/nilsen-v-york-county/",
          "recap_pdf_url": null,
          "pacer_doc_id": null,
          "description": "PLAINTIFF'S FIRST PROPOSED STIPULATION by MICHELE NILSEN. (mnm, ) (Entered: 05/23/2003)"
        },
        {
          "row_number": 131,
          "id": 9513085,
          "entry_number": "22",
          "date_filed": "2003-05-23T00:00:00-04:00",
          "attachments": [],
          "url": "https://www.courtlistener.com/docket/12069135/22/nilsen-v-york-county/",
          "recap_pdf_url": null,
          "pacer_doc_id": null,
          "description": "SCHEDULING ORDER AND ORDER ON PENDING MOTIONS: Discovery due by 9/26/2003. Motions due by 10/17/2003. By Judge D. BROCK HORNBY. (mnm, ) (Entered: 05/27/2003)"
        },
        {
          "row_number": 233,
          "id": 9513086,
          "entry_number": null,
          "date_filed": "2003-05-23T00:00:00-04:00",
          "attachments": [],
          "url": "https://www.courtlistener.com",
          "recap_pdf_url": null,
          "pacer_doc_id": null,
          "description": "SCHEDULING ORDER AND ORDER ON PENDING MOTIONS (INCLUDED WITHIN DOCKET NO. 22) re: 18 MOTION to Amend 2 Amended Complaint to Join additional named plaintiff filed by MICHELE NILSEN, 14 MOTION to Amend Scheduling Order filed by MICHELE NILSEN. \"Plaintiff's motion for leave to file a second amended complaint to join an additional named plaintiff is GRANTED WITHOUT OBJECTION.\" Set Deadlines: Specific Document Deadline (1)(plaintiff to file a motion for class certification) due by 6/11/2003. By Judge D. BROCK HORNBY. (mnm, )"
        },
        {
          "row_number": 135,
          "id": 9513090,
          "entry_number": "26",
          "date_filed": "2003-06-11T00:00:00-04:00",
          "attachments": [],
          "url": "https://www.courtlistener.com/docket/12069135/26/nilsen-v-york-county/",
          "recap_pdf_url": null,
          "pacer_doc_id": null,
          "description": "Consent MOTION to Extend Time For Two Day Enlargement of Time To File Motion For Class Certification by MICHAEL GOODRICH, MICHELE NILSEN.Responses due by 7/2/2003. (mjl, ) (Entered: 06/12/2003)"
        },
        {
          "row_number": 136,
          "id": 9513091,
          "entry_number": "27",
          "date_filed": "2003-06-11T00:00:00-04:00",
          "attachments": [],
          "url": "https://www.courtlistener.com/docket/12069135/27/nilsen-v-york-county/",
          "recap_pdf_url": null,
          "pacer_doc_id": null,
          "description": "MEMORANDUM by MICHAEL GOODRICH, MICHELE NILSEN in support of 26 Consent MOTION to Extend Time For Two Day Enlargement of Time To File Motion For Class Certification. (mjl, ) (Entered: 06/12/2003)"
        },
        {
          "row_number": 137,
          "id": 9513093,
          "entry_number": "28",
          "date_filed": "2003-06-13T00:00:00-04:00",
          "attachments": [],
          "url": "https://www.courtlistener.com/docket/12069135/28/nilsen-v-york-county/",
          "recap_pdf_url": null,
          "pacer_doc_id": null,
          "description": "MOTION to Certify Class for all people strip searched at the York County Jail after 10/14/96 by MICHAEL GOODRICH, MICHELE NILSEN.Responses due by 7/7/2003. (ka, ) (Entered: 06/16/2003)"
        },
        {
          "row_number": 138,
          "id": 9513094,
          "entry_number": "29",
          "date_filed": "2003-06-17T00:00:00-04:00",
          "attachments": [],
          "url": "https://www.courtlistener.com/docket/12069135/29/nilsen-v-york-county/",
          "recap_pdf_url": null,
          "pacer_doc_id": null,
          "description": "AMENDED ORDER re: Pertaining To Production Of Documents By Judge DAVID M. COHEN. (mjl, ) (Entered: 06/17/2003)"
        },
        {
          "row_number": 235,
          "id": 9513096,
          "entry_number": null,
          "date_filed": "2003-07-01T00:00:00-04:00",
          "attachments": [],
          "url": "https://www.courtlistener.com",
          "recap_pdf_url": null,
          "pacer_doc_id": null,
          "description": "***Set/Reset Deadlines : Specific Document Deadline (2) due by 7/22/2003 - Specific Document Deadline (2)(the Clerk's Office to schedule a further scheduling conference as soon as possible after the court's final decision on class certification is rendered to address these and any other pre-trial schedule-related issues then outstanding and to determine the month in which trial is expected to occur) (ckb, )"
        },
        {
          "row_number": 236,
          "id": 9513098,
          "entry_number": null,
          "date_filed": "2003-07-03T00:00:00-04:00",
          "attachments": [],
          "url": "https://www.courtlistener.com",
          "recap_pdf_url": null,
          "pacer_doc_id": null,
          "description": "ENDORSEMENT granting 31 Motion to Extend Time to Respond to Mtn for Class Certification By Judge DAVID M. COHEN. (ckb, )"
        },
        {
          "row_number": 143,
          "id": 9513102,
          "entry_number": "33",
          "date_filed": "2003-07-14T00:00:00-04:00",
          "attachments": [],
          "url": "https://www.courtlistener.com/docket/12069135/33/nilsen-v-york-county/",
          "recap_pdf_url": null,
          "pacer_doc_id": null,
          "description": "RESPONSE to Motion re 28 MOTION to Certify Class for all people strip searched at the York County Jail after 10/14/96 filed by YORK COUNTY.Reply due by 7/25/2003. (mnm, ) (Entered: 07/16/2003)"
        },
        {
          "row_number": 242,
          "id": 9513108,
          "entry_number": null,
          "date_filed": "2003-07-23T00:00:00-04:00",
          "attachments": [],
          "url": "https://www.courtlistener.com",
          "recap_pdf_url": null,
          "pacer_doc_id": null,
          "description": "ENDORSEMENT granting 35 Motion to Extend Time By Judge DAVID M. COHEN. (mnm, )"
        },
        {
          "row_number": 244,
          "id": 9513110,
          "entry_number": null,
          "date_filed": "2003-07-25T00:00:00-04:00",
          "attachments": [],
          "url": "https://www.courtlistener.com",
          "recap_pdf_url": null,
          "pacer_doc_id": null,
          "description": "***Set/Reset Deadlines : Specific Document Deadline (1)(the Clerk's Office to schedule a further scheduling conference as soon as possible after the court's final decision on class certification is rendered to address these and any other pre-trial schedule-related issues then outstanding and to determine the month in which trial is expected to occur) due by 8/29/2003.(mnm, )"
        },
        {
          "row_number": 146,
          "id": 9513111,
          "entry_number": "36",
          "date_filed": "2003-08-05T00:00:00-04:00",
          "attachments": [],
          "url": "https://www.courtlistener.com/docket/12069135/36/nilsen-v-york-county/",
          "recap_pdf_url": null,
          "pacer_doc_id": null,
          "description": "SUPPLEMENTAL MEMORANDUM OF LAW IN SUPPORT of 33 Response to Motion by York County. (ka, ) (Entered: 08/06/2003)"
        },
        {
          "row_number": 147,
          "id": 9513112,
          "entry_number": "37",
          "date_filed": "2003-08-08T00:00:00-04:00",
          "attachments": [],
          "url": "https://www.courtlistener.com/docket/12069135/37/nilsen-v-york-county/",
          "recap_pdf_url": null,
          "pacer_doc_id": null,
          "description": "Consent MOTION to Extend Time of One Business Day to August 11, 2003, to file Reply Memorandum, MOTION for Leave to File to Exceed the Page Limit to 20 Pages by MICHAEL GOODRICH, MICHELE NILSEN. (ka, ) (Entered: 08/08/2003)"
        },
        {
          "row_number": 148,
          "id": 9513113,
          "entry_number": "38",
          "date_filed": "2003-08-11T00:00:00-04:00",
          "attachments": [],
          "url": "https://www.courtlistener.com/docket/12069135/38/nilsen-v-york-county/",
          "recap_pdf_url": null,
          "pacer_doc_id": null,
          "description": "REPLY to Response to Motion re 28 MOTION to Certify Class for all people strip searched at the York County Jail after 10/14/96 filed by MICHAEL GOODRICH, MICHELE NILSEN. (ka, ) (Entered: 08/12/2003)"
        },
        {
          "row_number": 245,
          "id": 9513114,
          "entry_number": null,
          "date_filed": "2003-08-12T00:00:00-04:00",
          "attachments": [],
          "url": "https://www.courtlistener.com",
          "recap_pdf_url": null,
          "pacer_doc_id": null,
          "description": "ENDORSEMENT granting 37 Motion to Extend Time, granting 37 Motion for Leave to File. \"08/12/03 Granted. /s/ David M. Cohen USMJ\" By Judge DAVID M. COHEN. (ka, ) Modified on 8/12/2003 to correct the endorsement, not order(ka, )."
        },
        {
          "row_number": 151,
          "id": 9513116,
          "entry_number": "40",
          "date_filed": "2003-08-13T00:00:00-04:00",
          "attachments": [],
          "url": "https://www.courtlistener.com/docket/12069135/40/nilsen-v-york-county/",
          "recap_pdf_url": null,
          "pacer_doc_id": null,
          "description": "REPORT OF HEARING AND ORDER RE: DISCOVERY DISPUTE (re: Production of Documents). Specific Document Deadline (1) (Counsel to advise whether dispute has been resolved and, if not, what their respective positions are as of the date of their report) due by 8/29/2003. By Judge DAVID M. COHEN. (ka, ) (Entered: 08/13/2003)"
        },
        {
          "row_number": 152,
          "id": 9513117,
          "entry_number": "41",
          "date_filed": "2003-08-18T00:00:00-04:00",
          "attachments": [],
          "url": "https://www.courtlistener.com/docket/12069135/41/nilsen-v-york-county/",
          "recap_pdf_url": null,
          "pacer_doc_id": null,
          "description": "AFFIDAVIT of Howard Friedman filed by MICHAEL GOODRICH, MICHELE NILSEN. (ka, ) (Entered: 08/18/2003)"
        },
        {
          "row_number": 153,
          "id": 9513118,
          "entry_number": "42",
          "date_filed": "2003-08-22T00:00:00-04:00",
          "attachments": [],
          "url": "https://www.courtlistener.com/docket/12069135/42/nilsen-v-york-county/",
          "recap_pdf_url": null,
          "pacer_doc_id": null,
          "description": "Consent MOTION to Intervene as plaintiff by CHARLES NEVILLE. (mo, ) (Entered: 08/22/2003)"
        },
        {
          "row_number": 154,
          "id": 9513120,
          "entry_number": "43",
          "date_filed": "2003-08-25T00:00:00-04:00",
          "attachments": [],
          "url": "https://www.courtlistener.com/docket/12069135/43/nilsen-v-york-county/",
          "recap_pdf_url": null,
          "pacer_doc_id": null,
          "description": "Intervenor COMPLAINT against YORK COUNTY, filed by CHARLES NEVILLE. (Service of Process Deadline 12/23/2003)(mo, ) (Entered: 08/25/2003)"
        },
        {
          "row_number": 155,
          "id": 9513121,
          "entry_number": "44",
          "date_filed": "2003-08-25T00:00:00-04:00",
          "attachments": [],
          "url": "https://www.courtlistener.com/docket/12069135/44/nilsen-v-york-county/",
          "recap_pdf_url": null,
          "pacer_doc_id": null,
          "description": "MOTION for Leave to File Sur-Reply Memorandum With Regards To The Plaintiff's Motion For Class Certification, MOTION for Oral Arguement On The Motion For Class Certification by YORK COUNTY.Responses due by 9/15/2003. (mjl, ) (Entered: 08/26/2003)"
        },
        {
          "row_number": 156,
          "id": 9513122,
          "entry_number": "45",
          "date_filed": "2003-08-27T00:00:00-04:00",
          "attachments": [],
          "url": "https://www.courtlistener.com/docket/12069135/45/nilsen-v-york-county/",
          "recap_pdf_url": null,
          "pacer_doc_id": null,
          "description": "REPORT AND RECOMMENDED DECISION re 28 MOTION to Certify Class for all people strip searched at the York County Jail after 10/14/96 filed by MICHELE NILSEN, MICHAEL GOODRICH be GRANTED with Certain Class definition Objections to R&R due by 9/15/2003 By Magistrate Judge DAVID M. COHEN. (mo, ) (Entered: 08/27/2003)"
        },
        {
          "row_number": 247,
          "id": 9513124,
          "entry_number": null,
          "date_filed": "2003-09-05T00:00:00-04:00",
          "attachments": [],
          "url": "https://www.courtlistener.com",
          "recap_pdf_url": null,
          "pacer_doc_id": null,
          "description": "Joint MOTION to Amend Scheduling Order to Extend Discovery Deadline to 10/6/03 (Included within Docket #46) by MICHAEL GOODRICH, MICHELE NILSEN, YORK COUNTY WITH INCORPORATED MEMO. (ka, )"
        },
        {
          "row_number": 158,
          "id": 9513125,
          "entry_number": "47",
          "date_filed": "2003-09-05T00:00:00-04:00",
          "attachments": [],
          "url": "https://www.courtlistener.com/docket/12069135/47/nilsen-v-york-county/",
          "recap_pdf_url": null,
          "pacer_doc_id": null,
          "description": "ANSWER to Intervenor Complaint by YORK COUNTY.(ka, ) (Entered: 09/08/2003)"
        },
        {
          "row_number": 248,
          "id": 9513126,
          "entry_number": null,
          "date_filed": "2003-09-09T00:00:00-04:00",
          "attachments": [],
          "url": "https://www.courtlistener.com",
          "recap_pdf_url": null,
          "pacer_doc_id": null,
          "description": "ENDORSEMENT granting 46 Motion to Extend Time. \"9/9/03 Granted as prayed for. /s/ David M. Cohen USMJ\" By Judge DAVID M. COHEN. (ka, )"
        },
        {
          "row_number": 249,
          "id": 9513127,
          "entry_number": null,
          "date_filed": "2003-09-09T00:00:00-04:00",
          "attachments": [],
          "url": "https://www.courtlistener.com",
          "recap_pdf_url": null,
          "pacer_doc_id": null,
          "description": "***Set/Reset Deadlines as to 45 REPORT AND RECOMMENDED DECISION re 28 MOTION to Certify Class for all people strip searched at the York County Jail after 10/14/96 filed by MICHELE NILSEN, MICHAEL GOODRICH. Objections to R&R due by 9/26/2003.(ka, )"
        },
        {
          "row_number": 250,
          "id": 9513128,
          "entry_number": null,
          "date_filed": "2003-09-09T00:00:00-04:00",
          "attachments": [],
          "url": "https://www.courtlistener.com",
          "recap_pdf_url": null,
          "pacer_doc_id": null,
          "description": "ENDORSEMENT granting 46 Motion to Amend Scheduling Order Discovery due by 10/14/2003. By Judge DAVID M. COHEN. (ka, )"
        },
        {
          "row_number": 160,
          "id": 9513130,
          "entry_number": "49",
          "date_filed": "2003-09-26T00:00:00-04:00",
          "attachments": [],
          "url": "https://www.courtlistener.com/docket/12069135/49/nilsen-v-york-county/",
          "recap_pdf_url": null,
          "pacer_doc_id": null,
          "description": "Objection to Report and Recommended Decision re 45 Report and Recommended Decision, filed by YORK COUNTY. Response to Objection to Report and Recommendations due by 10/14/2003. (ka, ) (Entered: 09/26/2003)"
        },
        {
          "row_number": 162,
          "id": 9513131,
          "entry_number": "50",
          "date_filed": "2003-10-14T00:00:00-04:00",
          "attachments": [],
          "url": "https://www.courtlistener.com/docket/12069135/50/nilsen-v-york-county/",
          "recap_pdf_url": null,
          "pacer_doc_id": "0910301594",
          "description": "Response to Objection to Report and Recommended Decision re 45 Report and Recommended Decision, on Plaintiff's Motion for Class Certification filed by YORK COUNTY. (MARCHESI, PETER) Modified on 10/15/2003 to reflect counsel notified as to not file electronic pleadings in pre 2003 cases. Counsel advised to file pleading w/ signature (mnm, ). (Entered: 10/14/2003)"
        },
        {
          "row_number": 163,
          "id": 9513132,
          "entry_number": "51",
          "date_filed": "2003-10-14T00:00:00-04:00",
          "attachments": [],
          "url": "https://www.courtlistener.com/docket/12069135/51/nilsen-v-york-county/",
          "recap_pdf_url": null,
          "pacer_doc_id": null,
          "description": "Response to Objection to Report and Recommended Decision re 45 Report and Recommended Decision, filed by MICHAEL GOODRICH, MICHELE NILSEN. (mnm, ) (Entered: 10/15/2003)"
        },
        {
          "row_number": 164,
          "id": 9513133,
          "entry_number": "52",
          "date_filed": "2003-10-16T00:00:00-04:00",
          "attachments": [],
          "url": "https://www.courtlistener.com/docket/12069135/52/nilsen-v-york-county/",
          "recap_pdf_url": null,
          "pacer_doc_id": null,
          "description": "Response to Objection to Report and Recommended Decision re 45 Report and Recommended Decision, filed by YORK COUNTY. (ka, ) (Entered: 10/16/2003)"
        },
        {
          "row_number": 165,
          "id": 9513135,
          "entry_number": "53",
          "date_filed": "2003-11-06T00:00:00-05:00",
          "attachments": [],
          "url": "https://www.courtlistener.com/docket/12069135/53/nilsen-v-york-county/",
          "recap_pdf_url": null,
          "pacer_doc_id": null,
          "description": "NOTICE of Hearing: Hearing (ORAL ARGUMENT ON THE OBJECTIONS TO THE RECOMMENDED DECISION) set for 11/24/2003 03:00 PM in Courtroom 2 before JUDGE D. BROCK HORNBY. (mnm, ) (Entered: 11/06/2003)"
        },
        {
          "row_number": 166,
          "id": 9513136,
          "entry_number": "54",
          "date_filed": "2003-11-13T00:00:00-05:00",
          "attachments": [],
          "url": "https://www.courtlistener.com/docket/12069135/54/nilsen-v-york-county/",
          "recap_pdf_url": null,
          "pacer_doc_id": null,
          "description": "NOTICE of Hearing (Oral Argument on the Objections to the Recommended Decision): Hearing re-set to 12/18/2003, 09:00 AM in Courtroom 2, before JUDGE D. BROCK HORNBY. (ka, ) (Entered: 11/13/2003)"
        },
        {
          "row_number": 170,
          "id": 9513140,
          "entry_number": "58",
          "date_filed": "2003-12-18T00:00:00-05:00",
          "attachments": [],
          "url": "https://www.courtlistener.com/docket/12069135/58/nilsen-v-york-county/",
          "recap_pdf_url": null,
          "pacer_doc_id": null,
          "description": "Minute Entry for proceedings held before Judge D. BROCK HORNBY : Motion Hearing (ORAL ARGUMENT) held re OBJECTIONS TO 45 REPORT AND RECOMMENDED DECISION re 28 MOTION to Certify Class for all people strip searched at the York County Jail after 10/14/96 filed by MICHELE NILSEN, MICHAEL GOODRICH. Matter taken under advisement. (Court Reporter PAULINE TERRY) (mnm, ) (Entered: 12/18/2003)"
        },
        {
          "row_number": 171,
          "id": 9513141,
          "entry_number": "59",
          "date_filed": "2003-12-18T00:00:00-05:00",
          "attachments": [],
          "url": "https://www.courtlistener.com/docket/12069135/59/nilsen-v-york-county/",
          "recap_pdf_url": null,
          "pacer_doc_id": null,
          "description": "ORDER AFFIRMING RECOMMENDED DECISION OF THE MAGISTRATE JUDGE for 28 Motion to Certify Class filed by MICHELE NILSEN, MICHAEL GOODRICH, 45 Report and Recommended Decision. \"It is therefore ORDERED that the Recommended Decision of the Magistrate Judge is hereby ADOPTED. The plaintiff's motion for class certification is GRANTED, but only as to a class under Fed. R. Civ. P. 23(b)(3) and only as to a class defined as follows: All people strip-searched at the York County Jail after October 14, 1996, under a policy or custom of conducting strip-searches without evaluating individualized reasonable suspicion: (1) while waiting for bail to be set or for a first court appearance after being arrested on charges that did not involve a weapon or drugs or a violent felony; or (2) while waiting for a first court appearance after being arrested on a default or other warrant that did not involve a weapon or drugs or a violent felony. SO ORDERED.\" By Judge D. BROCK HORNBY. (mnm, ) (Entered: 12/18/2003)"
        },
        {
          "row_number": 175,
          "id": 9513144,
          "entry_number": "62",
          "date_filed": "2004-01-05T00:00:00-05:00",
          "attachments": [],
          "url": "https://www.courtlistener.com/docket/12069135/62/nilsen-v-york-county/",
          "recap_pdf_url": null,
          "pacer_doc_id": null,
          "description": "Joint MOTION to Amend Scheduling Order To Enlarge Deadline For Designating Experts by MICHAEL GOODRICH, MICHELE NILSEN, YORK COUNTY. (mjl, ) (Entered: 01/05/2004)"
        },
        {
          "row_number": 251,
          "id": 9513145,
          "entry_number": null,
          "date_filed": "2004-01-06T00:00:00-05:00",
          "attachments": [],
          "url": "https://www.courtlistener.com",
          "recap_pdf_url": null,
          "pacer_doc_id": null,
          "description": "Oral ORDER By Mag.Judge DAVID M. COHEN per t/c to Atty Webbert, Set Deadlines: Joint Proposed Discovery and Motion Plan due by 1/20/2004. In accordance with Magistrate Judge Cohen's review of this case, counsel shall file a joint proposed discovery and motion plan no later than January 20, 2004, following which a (telephone) conference of counsel will be scheduled should such be deemed necessary. To the extent counsel are unable to agree on certain issues, this joint plan shall reflect the parties differing positions on any such issues not agreed to by all parties.(slh, )"
        },
        {
          "row_number": 252,
          "id": 9513146,
          "entry_number": null,
          "date_filed": "2004-01-06T00:00:00-05:00",
          "attachments": [],
          "url": "https://www.courtlistener.com",
          "recap_pdf_url": null,
          "pacer_doc_id": null,
          "description": "Oral ORDER terminating 62 Motion to Amend Scheduling Order to extend expert deadlines By Mag.Judge DAVID M. COHEN. Cnsl to submit proposed plan encompassing all requested relief (for amendments to scheduling order deadlines). (slh, )"
        },
        {
          "row_number": 176,
          "id": 9513147,
          "entry_number": "63",
          "date_filed": "2004-01-20T00:00:00-05:00",
          "attachments": [],
          "url": "https://www.courtlistener.com/docket/12069135/63/nilsen-v-york-county/",
          "recap_pdf_url": null,
          "pacer_doc_id": null,
          "description": "Joint MOTION to Stay PROCEEDINGS AND DEADLINES UNTIL RESOLUTION OF INTERLOCUTORY APPEAL by MICHAEL GOODRICH, MICHELE NILSEN, YORK COUNTY WITH MEMO IN SUPPORT. (mnm, ) (Entered: 01/21/2004)"
        },
        {
          "row_number": 177,
          "id": 9513148,
          "entry_number": "64",
          "date_filed": "2004-01-22T00:00:00-05:00",
          "attachments": null,
          "url": "https://www.courtlistener.com/docket/12069135/64/nilsen-v-york-county/",
          "recap_pdf_url": null,
          "pacer_doc_id": null,
          "description": "ENDORSEMENT granting as prayed for 63 Motion to Stay PROCEEDINGS AND DEADLINES UNTIL RESOLUTION OF INTERLOCUTORY APPEAL - By Judge DAVID M. COHEN. (mnm, ) (Entered: 01/22/2004)"
        },
        {
          "row_number": 178,
          "id": 9513149,
          "entry_number": "65",
          "date_filed": "2004-02-02T00:00:00-05:00",
          "attachments": null,
          "url": "https://www.courtlistener.com/docket/12069135/65/nilsen-v-york-county/",
          "recap_pdf_url": null,
          "pacer_doc_id": null,
          "description": "USCA ORDER GRANTING the Petition by York County for leave to appeal under Fed. R. Civ. 23(f). (bfa, ) (Entered: 02/04/2004)"
        },
        {
          "row_number": 179,
          "id": 9513151,
          "entry_number": "66",
          "date_filed": "2004-02-04T00:00:00-05:00",
          "attachments": null,
          "url": "https://www.courtlistener.com/docket/12069135/66/nilsen-v-york-county/",
          "recap_pdf_url": null,
          "pacer_doc_id": null,
          "description": "CLERK'S CERTIFICATE Re: Interlocutory Appeal, filed by YORK COUNTY Documents Sent to U.S. Court of Appeals: 1 - 66 (bfa, ) (Entered: 02/04/2004)"
        },
        {
          "row_number": 254,
          "id": 9513152,
          "entry_number": null,
          "date_filed": "2004-02-04T00:00:00-05:00",
          "attachments": null,
          "url": "https://www.courtlistener.com",
          "recap_pdf_url": null,
          "pacer_doc_id": null,
          "description": "Certified and Transmitted Record on Appeal to US Court of Appeals re Interlocutory Appeal, (bfa, )"
        },
        {
          "row_number": 255,
          "id": 9513153,
          "entry_number": null,
          "date_filed": "2004-02-04T00:00:00-05:00",
          "attachments": null,
          "url": "https://www.courtlistener.com",
          "recap_pdf_url": null,
          "pacer_doc_id": null,
          "description": "USCA Case Number 04-1165 for Interlocutory Appeal, filed by YORK COUNTY. (bfa, )"
        },
        {
          "row_number": 256,
          "id": 9513154,
          "entry_number": null,
          "date_filed": "2004-02-04T00:00:00-05:00",
          "attachments": null,
          "url": "https://www.courtlistener.com",
          "recap_pdf_url": null,
          "pacer_doc_id": null,
          "description": "USCA Appeal Fees Received from YORK COUNTY : Amount Paid: $255. Receipt Number: 49950. Method of Payment: check. Date Paid: 2/4/2004 re Interlocutory Appeal. (bfa, )"
        },
        {
          "row_number": 180,
          "id": 9513155,
          "entry_number": "67",
          "date_filed": "2004-02-27T00:00:00-05:00",
          "attachments": null,
          "url": "https://www.courtlistener.com/docket/12069135/67/nilsen-v-york-county/",
          "recap_pdf_url": null,
          "pacer_doc_id": null,
          "description": "TRANSCRIPT of Proceedings: Oral Argument held on December 18, 2003 before Judge D. Brock Hornby. Court Reporter: Pauline D. Terry. Phone Number: 207/775-4331. IMPORTANT NOTICE -- REDACTION OF TRANSCRIPTS: Any party who desires to have certain personal identifier data redacted from the transcript must file a Notice of Intent to Redact within 5 business days of this date. The policy governing the redaction of personal information is located on the court website at www.med.uscourts.gov. Read this policy carefully. If no Notice of Intent to Redact is filed within 5 business days of this date, the court will assume redaction of personal data identifiers is not necessary and the transcript will be made available on the web. ACCESS TO TRANSCRIPT: Because access to this transcript is currently restricted to counsel of record, to view this document (unlike other documents), click on the CASE NUMBER hyperlink (not the Document Number hyperlink); enter your ECF login and password; click on Run Report; enter your PACER login and password; and click on the DOCUMENT NUMBER hyperlink. (ka, ) (Entered: 02/27/2004)"
        },
        {
          "row_number": 181,
          "id": 9513156,
          "entry_number": "68",
          "date_filed": "2004-03-01T00:00:00-05:00",
          "attachments": null,
          "url": "https://www.courtlistener.com/docket/12069135/68/nilsen-v-york-county/",
          "recap_pdf_url": null,
          "pacer_doc_id": null,
          "description": "CLERK'S First SUPPLEMENTAL CERTIFICATE Re: Interlocutory Appeal, filed by YORK COUNTY. Documents Sent to U.S. Court of Appeals: 67 (bfa, ) (Entered: 03/01/2004)"
        },
        {
          "row_number": 182,
          "id": 9513158,
          "entry_number": "69",
          "date_filed": "2004-04-28T00:00:00-04:00",
          "attachments": null,
          "url": "https://www.courtlistener.com/docket/12069135/69/nilsen-v-york-county/",
          "recap_pdf_url": null,
          "pacer_doc_id": null,
          "description": "MOTION to Amend Scheduling Order Following Certification Of The Class by MICHAEL GOODRICH, MICHELE NILSEN.Responses due by 5/19/2004. (mjl, ) (Entered: 04/29/2004)"
        },
        {
          "row_number": 185,
          "id": 9513160,
          "entry_number": "71",
          "date_filed": "2004-05-05T00:00:00-04:00",
          "attachments": null,
          "url": "https://www.courtlistener.com/docket/12069135/71/nilsen-v-york-county/",
          "recap_pdf_url": null,
          "pacer_doc_id": null,
          "description": "MANDATE of USCA as to Interlocutory Appeal, filed by YORK COUNTY. Affirmed. Check for Receipt of Appeal Record on 6/21/2004. (bfa, ) (Entered: 05/06/2004)"
        },
        {
          "row_number": 186,
          "id": 9513161,
          "entry_number": "72",
          "date_filed": "2004-05-06T00:00:00-04:00",
          "attachments": null,
          "url": "https://www.courtlistener.com/docket/12069135/72/nilsen-v-york-county/",
          "recap_pdf_url": null,
          "pacer_doc_id": null,
          "description": "ORDER By Mag.Judge DAVID M. COHEN per t/c to Atty Wall re 69 MOTION to Amend Scheduling Order Following Certification Of The Class filed by MICHELE NILSEN, MICHAEL GOODRICH, Set/Reset Deadlines as to 69 MOTION to Amend Scheduling Order Following Certification Of The Class.Response due by 5/12/2004. Dft should indicate whether and to what extent dft disagrees w/pltf and if so, specify why dft disagrees and also indicate dft's own discovery needs. (slh, ) (Entered: 05/06/2004)"
        },
        {
          "row_number": 188,
          "id": 9513163,
          "entry_number": "74",
          "date_filed": "2004-05-11T00:00:00-04:00",
          "attachments": null,
          "url": "https://www.courtlistener.com/docket/12069135/74/nilsen-v-york-county/",
          "recap_pdf_url": null,
          "pacer_doc_id": null,
          "description": "Supplemental MOTION to Amend Scheduling Order FOLLOWING CERTIFICATION OF THE CLASS by MICHAEL GOODRICH, MICHELE NILSEN. (mnm, ) (Entered: 05/12/2004)"
        },
        {
          "row_number": 187,
          "id": 9513164,
          "entry_number": "73",
          "date_filed": "2004-05-12T00:00:00-04:00",
          "attachments": null,
          "url": "https://www.courtlistener.com/docket/12069135/73/nilsen-v-york-county/",
          "recap_pdf_url": null,
          "pacer_doc_id": null,
          "description": "RESPONSE to Motion re 69 MOTION to Amend Scheduling Order Following Certification Of The Class filed by YORK COUNTY.Reply due by 5/24/2004. (mjl, ) (Entered: 05/12/2004)"
        },
        {
          "row_number": 189,
          "id": 9513165,
          "entry_number": "75",
          "date_filed": "2004-05-21T00:00:00-04:00",
          "attachments": null,
          "url": "https://www.courtlistener.com/docket/12069135/75/nilsen-v-york-county/",
          "recap_pdf_url": null,
          "pacer_doc_id": null,
          "description": "REPLY to Response to Motion re 69 MOTION to Amend Scheduling Order Following Certification Of The Class filed by MICHAEL GOODRICH, MICHELE NILSEN. (mjl, ) (Entered: 05/21/2004)"
        },
        {
          "row_number": 190,
          "id": 9513166,
          "entry_number": "76",
          "date_filed": "2004-06-16T00:00:00-04:00",
          "attachments": null,
          "url": "https://www.courtlistener.com/docket/12069135/76/nilsen-v-york-county/",
          "recap_pdf_url": null,
          "pacer_doc_id": null,
          "description": "NOTICE of Hearing per tele-call to counsel: Scheduling Conference of Counsel set for 6/18/2004 04:00 PM in Hearing Room, Portland before MAG. JUDGE DAVID M. COHEN. This is a joint conference per the court's directive in this case and the TARDIFF case, 02cv251pc. Any parties participating via telephone should arrange for placement of a conference call to Chambers.(slh, ) (Entered: 06/16/2004)"
        },
        {
          "row_number": 191,
          "id": 9513167,
          "entry_number": "77",
          "date_filed": "2004-06-18T00:00:00-04:00",
          "attachments": null,
          "url": "https://www.courtlistener.com/docket/12069135/77/nilsen-v-york-county/",
          "recap_pdf_url": null,
          "pacer_doc_id": null,
          "description": "MOTION FOR APPROVAL OF NOTICE TO THE CLASS by MICHAEL GOODRICH, MICHELE NILSEN WITH MEMO IN SUPPORT.Responses due by 7/9/2004. (mnm, ) (Entered: 06/18/2004)"
        },
        {
          "row_number": 192,
          "id": 9513168,
          "entry_number": "78",
          "date_filed": "2004-06-18T00:00:00-04:00",
          "attachments": null,
          "url": "https://www.courtlistener.com/docket/12069135/78/nilsen-v-york-county/",
          "recap_pdf_url": null,
          "pacer_doc_id": null,
          "description": "Minute Entry for proceedings held before Mag.Judge DAVID M. COHEN : Scheduling Conference of Counsel held. Report & Order to issue. (Court Reporter NONE) (slh, ) (Entered: 06/18/2004)"
        },
        {
          "row_number": 193,
          "id": 9513169,
          "entry_number": "79",
          "date_filed": "2004-06-18T00:00:00-04:00",
          "attachments": null,
          "url": "https://www.courtlistener.com/docket/12069135/79/nilsen-v-york-county/",
          "recap_pdf_url": null,
          "pacer_doc_id": null,
          "description": "REPORT OF SCHEDULING CONFERENCE AND REVISED SCHEDULING ORDER: Discovery due by 12/31/2004. Motions due by 1/28/2005. Ready for Trial on 4/5/2005. By Judge DAVID M. COHEN. (mnm, ) (Entered: 06/21/2004)"
        },
        {
          "row_number": 195,
          "id": 9513170,
          "entry_number": "80",
          "date_filed": "2004-06-29T00:00:00-04:00",
          "attachments": null,
          "url": "https://www.courtlistener.com/docket/12069135/80/nilsen-v-york-county/",
          "recap_pdf_url": null,
          "pacer_doc_id": null,
          "description": "MOTION to Extend Time UNTIL AUGUST 9, 2004 TO RESPOND TO MTN #77 PROPOSED CLASS NOTICE by YORK COUNTY.Responses due by 7/20/2004. (mnm, ) (Entered: 07/01/2004)"
        },
        {
          "row_number": 196,
          "id": 9513171,
          "entry_number": "81",
          "date_filed": "2004-06-29T00:00:00-04:00",
          "attachments": null,
          "url": "https://www.courtlistener.com/docket/12069135/81/nilsen-v-york-county/",
          "recap_pdf_url": null,
          "pacer_doc_id": null,
          "description": "MOTION to Extend Time UNTIL JULY 9, 2004 TO OBJECT TO REVISED SCHEDULING ORDER by YORK COUNTY.Responses due by 7/20/2004. (mnm, ) (Entered: 07/01/2004)"
        },
        {
          "row_number": 197,
          "id": 9513172,
          "entry_number": "82",
          "date_filed": "2004-07-02T00:00:00-04:00",
          "attachments": null,
          "url": "https://www.courtlistener.com/docket/12069135/82/nilsen-v-york-county/",
          "recap_pdf_url": null,
          "pacer_doc_id": null,
          "description": "ORDER granting in part and denying in part 80 Motion to Extend Time within which to respond to the plaintiffs' proposed class notice - \"Granted in part as follows: Deadline for defendant's response to plaintiffs' proposed class notice enlarged to July 16, 2004.\" By Judge DAVID M. COHEN. (mnm, ) (Entered: 07/02/2004)"
        },
        {
          "row_number": 259,
          "id": 9513173,
          "entry_number": null,
          "date_filed": "2004-07-02T00:00:00-04:00",
          "attachments": null,
          "url": "https://www.courtlistener.com",
          "recap_pdf_url": null,
          "pacer_doc_id": null,
          "description": "RESET Deadlines as to 77 MOTION FOR APPROVAL OF NOTICE TO THE CLASS - PER ORDER #82: Responses due by 7/16/2004.(mnm, )"
        },
        {
          "row_number": 198,
          "id": 9513174,
          "entry_number": "83",
          "date_filed": "2004-07-02T00:00:00-04:00",
          "attachments": null,
          "url": "https://www.courtlistener.com/docket/12069135/83/nilsen-v-york-county/",
          "recap_pdf_url": null,
          "pacer_doc_id": null,
          "description": "ORDER granting without objection 81 Motion to Extend Time within which to object to the revised scheduling order - By Judge DAVID M. COHEN. (mnm, ) (Entered: 07/02/2004)"
        },
        {
          "row_number": 199,
          "id": 9513175,
          "entry_number": "84",
          "date_filed": "2004-07-09T00:00:00-04:00",
          "attachments": null,
          "url": "https://www.courtlistener.com/docket/12069135/84/nilsen-v-york-county/",
          "recap_pdf_url": null,
          "pacer_doc_id": null,
          "description": "OBJECTION to 79 REPORT OF SCHEDULING CONFERENCE AND REVISED SCHEDULING ORDER - filed by YORK COUNTY.Responses due by 7/26/2004. (mnm, ) (Entered: 07/09/2004)"
        },
        {
          "row_number": 200,
          "id": 9513176,
          "entry_number": "85",
          "date_filed": "2004-07-12T00:00:00-04:00",
          "attachments": null,
          "url": "https://www.courtlistener.com/docket/12069135/85/nilsen-v-york-county/",
          "recap_pdf_url": null,
          "pacer_doc_id": null,
          "description": "OBJECTION to 82 Order on Motion to Extend Time, filed by YORK COUNTY.Responses due by 7/29/2004. (mjl, ) (Entered: 07/12/2004)"
        },
        {
          "row_number": 201,
          "id": 9513177,
          "entry_number": "86",
          "date_filed": "2004-07-16T00:00:00-04:00",
          "attachments": null,
          "url": "https://www.courtlistener.com/docket/12069135/86/nilsen-v-york-county/",
          "recap_pdf_url": null,
          "pacer_doc_id": null,
          "description": "RESPONSE to Motion re 77 MOTION FOR APPROVAL OF NOTICE TO THE CLASS filed by YORK COUNTY.Reply due by 7/27/2004. (mnm, ) (Entered: 07/19/2004)"
        },
        {
          "row_number": 202,
          "id": 9513178,
          "entry_number": "87",
          "date_filed": "2004-07-16T00:00:00-04:00",
          "attachments": null,
          "url": "https://www.courtlistener.com/docket/12069135/87/nilsen-v-york-county/",
          "recap_pdf_url": null,
          "pacer_doc_id": null,
          "description": "AFFIDAVIT of JOHN ANGIS filed by YORK COUNTY. (mnm, ) (Entered: 07/19/2004)"
        },
        {
          "row_number": 204,
          "id": 9513180,
          "entry_number": "89",
          "date_filed": "2004-07-23T00:00:00-04:00",
          "attachments": null,
          "url": "https://www.courtlistener.com/docket/12069135/89/nilsen-v-york-county/",
          "recap_pdf_url": null,
          "pacer_doc_id": null,
          "description": "REPLY to Response to Motion re 77 MOTION FOR APPROVAL OF NOTICE TO THE CLASS filed by MICHAEL GOODRICH, MICHELE NILSEN. (mnm, ) (Entered: 07/26/2004)"
        },
        {
          "row_number": 260,
          "id": 9513182,
          "entry_number": null,
          "date_filed": "2004-07-27T00:00:00-04:00",
          "attachments": null,
          "url": "https://www.courtlistener.com",
          "recap_pdf_url": null,
          "pacer_doc_id": null,
          "description": "NOTICE of Docket Entry Modification regarding 90 Response to Objection: ENTRY MODIFIED TO REFLECT THE CORRECT DATE FILED OF 07/26/2004. (mnm, )"
        },
        {
          "row_number": 209,
          "id": 9513185,
          "entry_number": "93",
          "date_filed": "2004-08-02T00:00:00-04:00",
          "attachments": null,
          "url": "https://www.courtlistener.com/docket/12069135/93/nilsen-v-york-county/",
          "recap_pdf_url": null,
          "pacer_doc_id": null,
          "description": "ORDER terminating 85 Objection - Per telephone call with counsel this date objection #85 is moot. By MELODY MONTANESE, DEPUTY CLERK (mnm, ) (Entered: 08/02/2004)"
        },
        {
          "row_number": 210,
          "id": 9513186,
          "entry_number": "94",
          "date_filed": "2004-09-08T00:00:00-04:00",
          "attachments": null,
          "url": "https://www.courtlistener.com/docket/12069135/94/nilsen-v-york-county/",
          "recap_pdf_url": null,
          "pacer_doc_id": null,
          "description": "NOTICE to Counsel regarding Judge Hornby's participation in a Federal Trade Commission workshop. /s/D. Brock Hornby, USDJ (smd, ) (Entered: 09/08/2004)"
        },
        {
          "row_number": 211,
          "id": 9513187,
          "entry_number": "95",
          "date_filed": "2004-09-09T00:00:00-04:00",
          "attachments": null,
          "url": "https://www.courtlistener.com/docket/12069135/95/nilsen-v-york-county/",
          "recap_pdf_url": null,
          "pacer_doc_id": null,
          "description": "Joint MOTION for Protective Order /Approval of Consent Confidentiality Order by MICHAEL GOODRICH, CHARLES NEVILLE, MICHELE NILSEN, YORK COUNTY. (slh, ) (Entered: 09/10/2004)"
        },
        {
          "row_number": 212,
          "id": 9513188,
          "entry_number": "96",
          "date_filed": "2004-09-10T00:00:00-04:00",
          "attachments": null,
          "url": "https://www.courtlistener.com/docket/12069135/96/nilsen-v-york-county/",
          "recap_pdf_url": null,
          "pacer_doc_id": null,
          "description": "CONSENT CONFIDENTIALITY ORDER granting 95 Motion for Protective Order - By Judge DAVID M. COHEN. (mnm, ) (Entered: 09/13/2004)"
        },
        {
          "row_number": 213,
          "id": 9513189,
          "entry_number": "97",
          "date_filed": "2004-09-20T00:00:00-04:00",
          "attachments": null,
          "url": "https://www.courtlistener.com/docket/12069135/97/nilsen-v-york-county/",
          "recap_pdf_url": null,
          "pacer_doc_id": null,
          "description": "SEALED MOTION to Reduce Class Size by YORK COUNTY WITH INCORPORATED MEMO.Responses due by 10/12/2004. (mo, ) Modified on 12/1/2005 to reflect entry has been sealed per Judge's Order(mv, ). (Entered: 09/20/2004)"
        },
        {
          "row_number": 214,
          "id": 9513190,
          "entry_number": "98",
          "date_filed": "2004-10-12T00:00:00-04:00",
          "attachments": null,
          "url": "https://www.courtlistener.com/docket/12069135/98/nilsen-v-york-county/",
          "recap_pdf_url": null,
          "pacer_doc_id": null,
          "description": "SEALED RESPONSE to Motion re 97 MOTION to Reduce Class Size filed by MICHAEL GOODRICH, MICHELE NILSEN.Reply due by 10/25/2004. (mnm, ) Modified on 12/1/2005 to reflect document status Sealed by order of Judge Singal(mv, ). (Entered: 10/13/2004)"
        },
        {
          "row_number": 2,
          "id": 9513192,
          "entry_number": "100",
          "date_filed": "2004-10-25T00:00:00-04:00",
          "attachments": null,
          "url": "https://www.courtlistener.com/docket/12069135/100/nilsen-v-york-county/",
          "recap_pdf_url": null,
          "pacer_doc_id": null,
          "description": "REPLY to Response to Motion re 97 MOTION to Reduce Class Size filed by YORK COUNTY. (mnm, ) (Entered: 10/27/2004)"
        },
        {
          "row_number": 4,
          "id": 9513194,
          "entry_number": "102",
          "date_filed": "2004-11-29T00:00:00-05:00",
          "attachments": null,
          "url": "https://www.courtlistener.com/docket/12069135/102/nilsen-v-york-county/",
          "recap_pdf_url": null,
          "pacer_doc_id": null,
          "description": "NOTICE of Settlement by Attorney David Webbert. Counsel shall file a joint motion for approval of the settlement no later than 12/21/04.(ckb, ) (Entered: 11/29/2004)"
        },
        {
          "row_number": 5,
          "id": 9513195,
          "entry_number": "103",
          "date_filed": "2004-12-13T00:00:00-05:00",
          "attachments": null,
          "url": "https://www.courtlistener.com/docket/12069135/103/nilsen-v-york-county/",
          "recap_pdf_url": null,
          "pacer_doc_id": null,
          "description": "NOTICE OF EXCLUSION BY TERRY W. MCDANIEL (mnw, ) (Entered: 12/14/2004)"
        },
        {
          "row_number": 7,
          "id": 9513197,
          "entry_number": "105",
          "date_filed": "2004-12-27T00:00:00-05:00",
          "attachments": null,
          "url": "https://www.courtlistener.com/docket/12069135/105/nilsen-v-york-county/",
          "recap_pdf_url": null,
          "pacer_doc_id": null,
          "description": "Consent MOTION for Approval of Settlement (FOR PRELIMINARY APPROVAL OF CLASS SETTLEMENT) by MICHELE NILSEN, MICHAEL GOODRICH WITH INCORPORATED MEMO. (mnw, ) (Entered: 12/27/2004)"
        },
        {
          "row_number": 8,
          "id": 9513198,
          "entry_number": "106",
          "date_filed": "2004-12-27T00:00:00-05:00",
          "attachments": null,
          "url": "https://www.courtlistener.com/docket/12069135/106/nilsen-v-york-county/",
          "recap_pdf_url": null,
          "pacer_doc_id": null,
          "description": "NOTICE of Hearing on Motion 105 Consent MOTION for Approval of Settlement (FOR PRELIMINARY APPROVAL OF CLASS SETTLEMENT): Motion Hearing set for 1/24/2005 at 1:30 PM in Courtroom 2 before JUDGE D. BROCK HORNBY. (mnw, ) (Entered: 12/27/2004)"
        },
        {
          "row_number": 9,
          "id": 9513199,
          "entry_number": "107",
          "date_filed": "2005-01-05T00:00:00-05:00",
          "attachments": null,
          "url": "https://www.courtlistener.com/docket/12069135/107/nilsen-v-york-county/",
          "recap_pdf_url": null,
          "pacer_doc_id": null,
          "description": "PLAINTIFFS' SUPPLEMENTAL MEMORANDUM IN SUPPORT OF CONSENT MOTION FOR PRELIMINARY APPROVAL OF CLASS SETTLEMENT (mnw, ) (Entered: 01/05/2005)"
        },
        {
          "row_number": 11,
          "id": 9513201,
          "entry_number": "109",
          "date_filed": "2005-01-24T00:00:00-05:00",
          "attachments": null,
          "url": "https://www.courtlistener.com/docket/12069135/109/nilsen-v-york-county/",
          "recap_pdf_url": null,
          "pacer_doc_id": null,
          "description": "Minute Entry for proceedings held before Judge D. BROCK HORNBY : Motion Hearing held re 105 Consent MOTION FOR PRELIMINARY APPROVAL OF CLASS SETTLEMENT filed by MICHELE NILSEN, MICHAEL GOODRICH, Set Deadlines - Specific Document Deadline (1) (ANY ADDITIONAL FILINGS ADDRESSING QUESTIONS RAISED BY THE COURT )due by 2/7/2005. (Court Reporter DENNIS FORD) (mnw, ) (Entered: 01/24/2005)"
        },
        {
          "row_number": 14,
          "id": 9513202,
          "entry_number": "111",
          "date_filed": "2005-01-24T00:00:00-05:00",
          "attachments": null,
          "url": "https://www.courtlistener.com/docket/12069135/111/nilsen-v-york-county/",
          "recap_pdf_url": null,
          "pacer_doc_id": null,
          "description": "Court Exhibit List from HEARING ON MOTION FOR PRELIMINARY APPROVAL OF SETTLEMENT held on JANUARY 24, 2005. (mnw, ) (Entered: 01/25/2005)"
        },
        {
          "row_number": 13,
          "id": 9513203,
          "entry_number": "110",
          "date_filed": "2005-01-25T00:00:00-05:00",
          "attachments": null,
          "url": "https://www.courtlistener.com/docket/12069135/110/nilsen-v-york-county/",
          "recap_pdf_url": null,
          "pacer_doc_id": null,
          "description": "NOTICE of Hearing: Final Fairness Hearing set for 8/1/2005 at 10:00 AM in Courtroom 2 before JUDGE D. BROCK HORNBY. (mnw, ) (Entered: 01/25/2005)"
        },
        {
          "row_number": 15,
          "id": 9513204,
          "entry_number": "112",
          "date_filed": "2005-02-07T00:00:00-05:00",
          "attachments": null,
          "url": "https://www.courtlistener.com/docket/12069135/112/nilsen-v-york-county/",
          "recap_pdf_url": null,
          "pacer_doc_id": null,
          "description": "Joint MOTION to Extend Time UNTIL FEBRUARY 9, 2005 TO FILE ANY ADDITIONAL FILINGS ADDRESSING QUESTIONS RAISED BY THE COURT ABOUT THE SETTLEMENT AT THE JANUARY 24, 2005 HEARING by MICHELE NILSEN, YORK COUNTY, MICHAEL GOODRICH. (mnw, ) (Entered: 02/08/2005)"
        },
        {
          "row_number": 261,
          "id": 9513206,
          "entry_number": null,
          "date_filed": "2005-02-08T00:00:00-05:00",
          "attachments": null,
          "url": "https://www.courtlistener.com",
          "recap_pdf_url": null,
          "pacer_doc_id": null,
          "description": "RESET Deadlines - PER ORDER #113: Specific Document Deadline (1)(ANY ADDITIONAL FILINGS ADDRESSING QUESTIONS RAISED BY THE COURT ) due by 2/9/2005.(mnw, )"
        },
        {
          "row_number": 17,
          "id": 9513207,
          "entry_number": "114",
          "date_filed": "2005-02-09T00:00:00-05:00",
          "attachments": null,
          "url": "https://www.courtlistener.com/docket/12069135/114/nilsen-v-york-county/",
          "recap_pdf_url": null,
          "pacer_doc_id": null,
          "description": "Joint MOTION to Extend Time UNTIL FEBRUARY 11, 2005 FOR FILING ADDITIONAL FILINGS ADDRESSING QUESTIONS RAISED BY THE COURT CONCERNING SETTLEMENT by MICHELE NILSEN, YORK COUNTY, MICHAEL GOODRICH. (mnw, ) (Entered: 02/09/2005)"
        },
        {
          "row_number": 18,
          "id": 9513208,
          "entry_number": "115",
          "date_filed": "2005-02-09T00:00:00-05:00",
          "attachments": null,
          "url": "https://www.courtlistener.com/docket/12069135/115/nilsen-v-york-county/",
          "recap_pdf_url": null,
          "pacer_doc_id": null,
          "description": "ORDER granting 114 Motion to Extend Time - By Judge D. BROCK HORNBY. (mnw, ) (Entered: 02/09/2005)"
        },
        {
          "row_number": 262,
          "id": 9513209,
          "entry_number": null,
          "date_filed": "2005-02-09T00:00:00-05:00",
          "attachments": null,
          "url": "https://www.courtlistener.com",
          "recap_pdf_url": null,
          "pacer_doc_id": null,
          "description": "RESET Deadlines - PER ORDER #115: Specific Document Deadline (1)(ANY ADDITIONAL FILINGS ADDRESSING QUESTIONS RAISED BY THE COURT ) due by 2/11/2005.(mnw, )"
        },
        {
          "row_number": 19,
          "id": 9513210,
          "entry_number": "116",
          "date_filed": "2005-02-11T00:00:00-05:00",
          "attachments": null,
          "url": "https://www.courtlistener.com/docket/12069135/116/nilsen-v-york-county/",
          "recap_pdf_url": null,
          "pacer_doc_id": null,
          "description": "PLAINTIFFS' SUPPLEMENTAL CONSENT MEMORANDUM IN SUPPORT OF CONSENT MOTION FOR PRELIMINARY APPROVAL OF CLASS SETTLEMENT. (mo, ) (Entered: 02/11/2005)"
        },
        {
          "row_number": 20,
          "id": 9513211,
          "entry_number": "117",
          "date_filed": "2005-03-04T00:00:00-05:00",
          "attachments": null,
          "url": "https://www.courtlistener.com/docket/12069135/117/nilsen-v-york-county/",
          "recap_pdf_url": null,
          "pacer_doc_id": null,
          "description": "ORDER conditionally granting 105 Motion for Approval of Settlement - By Judge D. BROCK HORNBY. (mnw, ) (Entered: 03/04/2005)"
        },
        {
          "row_number": 21,
          "id": 9513212,
          "entry_number": "118",
          "date_filed": "2005-03-25T00:00:00-05:00",
          "attachments": null,
          "url": "https://www.courtlistener.com/docket/12069135/118/nilsen-v-york-county/",
          "recap_pdf_url": null,
          "pacer_doc_id": null,
          "description": "LETTER TO DISTRICT JUDGE D. BROCK HORNBY by ERNEST J BARILONE DATED MARCH 15, 2005. (mnw, ) (Entered: 03/29/2005)"
        },
        {
          "row_number": 22,
          "id": 9513213,
          "entry_number": "119",
          "date_filed": "2005-03-29T00:00:00-05:00",
          "attachments": null,
          "url": "https://www.courtlistener.com/docket/12069135/119/nilsen-v-york-county/",
          "recap_pdf_url": null,
          "pacer_doc_id": null,
          "description": "PLAINTIFFS' SECOND SUPPLEMENTAL CONSENT MEMORANDUM IN SUPPORT OF CONSENT MOTION FOR PRELIMINARY APPROVAL OF CLASS SETTLEMENT (mnw, ) (Entered: 03/30/2005)"
        },
        {
          "row_number": 24,
          "id": 9513214,
          "entry_number": "120",
          "date_filed": "2005-03-29T00:00:00-05:00",
          "attachments": null,
          "url": "https://www.courtlistener.com/docket/12069135/120/nilsen-v-york-county/",
          "recap_pdf_url": null,
          "pacer_doc_id": null,
          "description": "AMENDED SETTLEMENT AGREEMENT filed by MICHELE NILSEN, YORK COUNTY, MICHAEL GOODRICH. (mnw, ) (Entered: 03/30/2005)"
        },
        {
          "row_number": 25,
          "id": 9513215,
          "entry_number": "121",
          "date_filed": "2005-03-29T00:00:00-05:00",
          "attachments": null,
          "url": "https://www.courtlistener.com/docket/12069135/121/nilsen-v-york-county/",
          "recap_pdf_url": null,
          "pacer_doc_id": null,
          "description": "Consent MOTION for Leave to File SUPPLEMENTAL MEMORANDUM IN SUPPORT OF MOTION FOR ATTORNEY'S FEES AND EXPENSES by MICHELE NILSEN, YORK COUNTY, MICHAEL GOODRICH. (mnw, ) (Entered: 03/30/2005)"
        },
        {
          "row_number": 26,
          "id": 9513216,
          "entry_number": "122",
          "date_filed": "2005-03-30T00:00:00-05:00",
          "attachments": null,
          "url": "https://www.courtlistener.com/docket/12069135/122/nilsen-v-york-county/",
          "recap_pdf_url": null,
          "pacer_doc_id": null,
          "description": "ORDER granting 121 Motion for Leave to File SUPPLEMENTAL MEMORANDUM IN SUPPORT OF MOTION FOR ATTORNEY'S FEES AND EXPENSES. By Judge D. BROCK HORNBY. (mnw, ) (Entered: 03/30/2005)"
        },
        {
          "row_number": 27,
          "id": 9513217,
          "entry_number": "123",
          "date_filed": "2005-03-30T00:00:00-05:00",
          "attachments": null,
          "url": "https://www.courtlistener.com/docket/12069135/123/nilsen-v-york-county/",
          "recap_pdf_url": null,
          "pacer_doc_id": null,
          "description": "PLAINTIFFS' THIRD SUPPLEMENTAL CONSENT MEMORANDUM IN SUPPORT OF CONSENT MOTION FOR PRELIMINARY APPROVAL OF CLASS SETTLEMENT. (mnw, ) (Entered: 03/30/2005)"
        },
        {
          "row_number": 28,
          "id": 9513218,
          "entry_number": "124",
          "date_filed": "2005-03-30T00:00:00-05:00",
          "attachments": null,
          "url": "https://www.courtlistener.com/docket/12069135/124/nilsen-v-york-county/",
          "recap_pdf_url": null,
          "pacer_doc_id": null,
          "description": "MOTION for Attorney Fees AND LITIGATION EXPENSES by MICHELE NILSEN, MICHAEL GOODRICH WITH INCORPORATED MEMO.Responses due by 4/20/2005. (mnw, ) (Entered: 03/30/2005)"
        },
        {
          "row_number": 263,
          "id": 9513219,
          "entry_number": null,
          "date_filed": "2005-03-30T00:00:00-05:00",
          "attachments": null,
          "url": "https://www.courtlistener.com",
          "recap_pdf_url": null,
          "pacer_doc_id": null,
          "description": "MOTION FOR LITIGATION EXPENSES (INCLUDED WITHIN DOCKET NO. 124) by MICHELE NILSEN, MICHAEL GOODRICH. (mnw, )"
        },
        {
          "row_number": 29,
          "id": 9513220,
          "entry_number": "125",
          "date_filed": "2005-04-01T00:00:00-05:00",
          "attachments": null,
          "url": "https://www.courtlistener.com/docket/12069135/125/nilsen-v-york-county/",
          "recap_pdf_url": null,
          "pacer_doc_id": null,
          "description": "ORDER DIRECTING CLASS-WIDE NOTICE OF SETTLEMENT - By Judge D. BROCK HORNBY. (mnw, ) (Entered: 04/01/2005)"
        },
        {
          "row_number": 30,
          "id": 9513221,
          "entry_number": "126",
          "date_filed": "2005-04-05T00:00:00-04:00",
          "attachments": null,
          "url": "https://www.courtlistener.com/docket/12069135/126/nilsen-v-york-county/",
          "recap_pdf_url": null,
          "pacer_doc_id": null,
          "description": "MOTION by Attorney J. Lizette Richards to Withdraw as Attorney by MICHELE NILSEN, MICHAEL GOODRICH. (mnw, ) (Entered: 04/06/2005)"
        },
        {
          "row_number": 31,
          "id": 9513222,
          "entry_number": "127",
          "date_filed": "2005-04-05T00:00:00-04:00",
          "attachments": null,
          "url": "https://www.courtlistener.com/docket/12069135/127/nilsen-v-york-county/",
          "recap_pdf_url": null,
          "pacer_doc_id": null,
          "description": "NOTICE of Appearance Pro Hac Vice of JENNIFER L. BILLS filed by JENNIFER L. BILLS on behalf of MICHELE NILSEN, MICHAEL GOODRICH (mnw, ) (Entered: 04/06/2005)"
        },
        {
          "row_number": 32,
          "id": 9513223,
          "entry_number": "128",
          "date_filed": "2005-04-06T00:00:00-04:00",
          "attachments": null,
          "url": "https://www.courtlistener.com/docket/12069135/128/nilsen-v-york-county/",
          "recap_pdf_url": null,
          "pacer_doc_id": null,
          "description": "ORDER granting 126 Motion to Withdraw as Attorney. Attorney J. LIZETTE RICHARDS terminated. \"Treating this filing as a motion for leave to withdraw, motion granted.\" By Judge DAVID M. COHEN. (mnw, ) (Entered: 04/07/2005)"
        },
        {
          "row_number": 33,
          "id": 9513224,
          "entry_number": "129",
          "date_filed": "2005-05-13T00:00:00-04:00",
          "attachments": null,
          "url": "https://www.courtlistener.com/docket/12069135/129/nilsen-v-york-county/",
          "recap_pdf_url": null,
          "pacer_doc_id": null,
          "description": "NOTICE OF EXCLUSION BY ROBERT C. BOLTON JR (mnw, ) (Entered: 05/13/2005)"
        },
        {
          "row_number": 35,
          "id": 9513225,
          "entry_number": "130",
          "date_filed": "2005-06-06T00:00:00-04:00",
          "attachments": null,
          "url": "https://www.courtlistener.com/docket/12069135/130/nilsen-v-york-county/",
          "recap_pdf_url": null,
          "pacer_doc_id": null,
          "description": "NOTICE OF EXCLUSION BY GLENNA TURNER (mnw, ) (Entered: 06/07/2005)"
        },
        {
          "row_number": 36,
          "id": 9513226,
          "entry_number": "131",
          "date_filed": "2005-06-09T00:00:00-04:00",
          "attachments": null,
          "url": "https://www.courtlistener.com/docket/12069135/131/nilsen-v-york-county/",
          "recap_pdf_url": null,
          "pacer_doc_id": null,
          "description": "Consent MOTION to Extend Time UNTIL JUNE 15, 2005 TO FILE MOTION FOR FINAL APPROVAL OF THE SETTLEMENT AND SUPPLEMENTAL MEMORANDUM ON ATTORNEY FEES by MICHELE NILSEN, MICHAEL GOODRICH. (mnw, ) Modified on 6/9/2005 to correct extension request date to June 15, 2005(mnw, ). (Entered: 06/09/2005)"
        },
        {
          "row_number": 264,
          "id": 9513227,
          "entry_number": null,
          "date_filed": "2005-06-09T00:00:00-04:00",
          "attachments": null,
          "url": "https://www.courtlistener.com",
          "recap_pdf_url": null,
          "pacer_doc_id": null,
          "description": "NOTICE of Docket Entry Modification regarding 131 Consent MOTION to Extend Time UNTIL JUNE 10, 2005 TO FILE MOTION FOR FINAL APPROVAL OF THE SETTLEMENT AND SUPPLEMENTAL MEMORANDUM ON ATTORNEY FEES: DOCKET ENTRY MODIFIED TO CORRECT THE DATE OF EXTENSION REQUEST TO BE JUNE 15, 2005. (mnw, )"
        },
        {
          "row_number": 37,
          "id": 9513228,
          "entry_number": "132",
          "date_filed": "2005-06-10T00:00:00-04:00",
          "attachments": null,
          "url": "https://www.courtlistener.com/docket/12069135/132/nilsen-v-york-county/",
          "recap_pdf_url": null,
          "pacer_doc_id": null,
          "description": "ENDORSEMENT ORDER granting 131 Motion to Extend Time By Judge D. BROCK HORNBY. (mo, ) (Entered: 06/10/2005)"
        },
        {
          "row_number": 39,
          "id": 9513230,
          "entry_number": "134",
          "date_filed": "2005-06-15T00:00:00-04:00",
          "attachments": null,
          "url": "https://www.courtlistener.com/docket/12069135/134/nilsen-v-york-county/",
          "recap_pdf_url": null,
          "pacer_doc_id": null,
          "description": "MEMORANDUM by MICHELE NILSEN, MICHAEL GOODRICH in support of 124 MOTION for Attorney Fees AND LITIGATION EXPENSES. (mnw, ) (Entered: 06/17/2005)"
        },
        {
          "row_number": 40,
          "id": 9513231,
          "entry_number": "135",
          "date_filed": "2005-06-24T00:00:00-04:00",
          "attachments": null,
          "url": "https://www.courtlistener.com/docket/12069135/135/nilsen-v-york-county/",
          "recap_pdf_url": null,
          "pacer_doc_id": null,
          "description": "RESPONSE in Opposition re 133 MOTION for Approval of Settlement (FOR FINAL APPROVAL OF CLASS SETTLEMENT) filed by ERNEST J BARILONE.Reply due by 7/5/2005. (mnw, ) (Entered: 06/27/2005)"
        },
        {
          "row_number": 41,
          "id": 9513232,
          "entry_number": "136",
          "date_filed": "2005-07-07T00:00:00-04:00",
          "attachments": null,
          "url": "https://www.courtlistener.com/docket/12069135/136/nilsen-v-york-county/",
          "recap_pdf_url": null,
          "pacer_doc_id": null,
          "description": "RESPONSE to Motion re 124 MOTION for Attorney Fees AND LITIGATION EXPENSES, 133 MOTION for Approval of Settlement (FOR FINAL APPROVAL OF CLASS SETTLEMENT) filed by YORK COUNTY.Reply due by 7/18/2005. (mnw, ) (Entered: 07/08/2005)"
        },
        {
          "row_number": 42,
          "id": 9513233,
          "entry_number": "137",
          "date_filed": "2005-07-15T00:00:00-04:00",
          "attachments": null,
          "url": "https://www.courtlistener.com/docket/12069135/137/nilsen-v-york-county/",
          "recap_pdf_url": null,
          "pacer_doc_id": null,
          "description": "MEMORANDUM by MICHELE NILSEN, MICHAEL GOODRICH in support of 133 MOTION for Approval of Settlement (FOR FINAL APPROVAL OF CLASS SETTLEMENT). (mnw, ) (Entered: 07/18/2005)"
        },
        {
          "row_number": 43,
          "id": 9513234,
          "entry_number": "138",
          "date_filed": "2005-07-15T00:00:00-04:00",
          "attachments": null,
          "url": "https://www.courtlistener.com/docket/12069135/138/nilsen-v-york-county/",
          "recap_pdf_url": null,
          "pacer_doc_id": null,
          "description": "DECLARATION of HOWARD FRIEDMAN, ESQ. filed by MICHELE NILSEN, MICHAEL GOODRICH. (mnw, ) (Entered: 07/18/2005)"
        },
        {
          "row_number": 44,
          "id": 9513235,
          "entry_number": "139",
          "date_filed": "2005-07-19T00:00:00-04:00",
          "attachments": null,
          "url": "https://www.courtlistener.com/docket/12069135/139/nilsen-v-york-county/",
          "recap_pdf_url": null,
          "pacer_doc_id": null,
          "description": "AFFIDAVIT of HOWARD FRIEDMAN, ESQ. filed by MICHELE NILSEN, MICHAEL GOODRICH. (ORIGINAL) (mnw, ) (Entered: 07/20/2005)"
        },
        {
          "row_number": 46,
          "id": 9513236,
          "entry_number": "140",
          "date_filed": "2005-07-26T00:00:00-04:00",
          "attachments": null,
          "url": "https://www.courtlistener.com/docket/12069135/140/nilsen-v-york-county/",
          "recap_pdf_url": null,
          "pacer_doc_id": null,
          "description": "MEMORANDUM AND REBUTTLE TO CO-COUNSEL OF NILSEN V. YORK COUNTY REGARDING FAIRNESS by ERNEST J BARILONE RE: 133 MOTION (FOR FINAL APPROVAL OF CLASS SETTLEMENT). (mnw, ) (Entered: 07/27/2005)"
        },
        {
          "row_number": 47,
          "id": 9513237,
          "entry_number": "141",
          "date_filed": "2005-07-29T00:00:00-04:00",
          "attachments": null,
          "url": "https://www.courtlistener.com/docket/12069135/141/nilsen-v-york-county/",
          "recap_pdf_url": null,
          "pacer_doc_id": null,
          "description": "PLAINTIFFS' SECOND SUPPLEMENTAL MEMORANDUM IN SUPPORT OF #133 MOTION FOR FINAL APPROVAL OF CLASS SETTLEMENT by MICHELE NILSEN, MICHAEL GOODRICH (mnw, ) (Entered: 07/29/2005)"
        },
        {
          "row_number": 48,
          "id": 9513238,
          "entry_number": "142",
          "date_filed": "2005-07-29T00:00:00-04:00",
          "attachments": null,
          "url": "https://www.courtlistener.com/docket/12069135/142/nilsen-v-york-county/",
          "recap_pdf_url": null,
          "pacer_doc_id": null,
          "description": "DECLARATION of DAVID G. WEBBERT ESQ. filed by MICHELE NILSEN, MICHAEL GOODRICH. (mnw, ) (Entered: 07/29/2005)"
        },
        {
          "row_number": 49,
          "id": 9513239,
          "entry_number": "143",
          "date_filed": "2005-07-29T00:00:00-04:00",
          "attachments": null,
          "url": "https://www.courtlistener.com/docket/12069135/143/nilsen-v-york-county/",
          "recap_pdf_url": null,
          "pacer_doc_id": null,
          "description": "DECLARATION of MYONG J. JOUN filed by MICHELE NILSEN, MICHAEL GOODRICH. (mnw, ) (Entered: 07/29/2005)"
        },
        {
          "row_number": 50,
          "id": 9513240,
          "entry_number": "144",
          "date_filed": "2005-07-29T00:00:00-04:00",
          "attachments": null,
          "url": "https://www.courtlistener.com/docket/12069135/144/nilsen-v-york-county/",
          "recap_pdf_url": null,
          "pacer_doc_id": null,
          "description": "AFFIDAVIT of ESTELLE MCLEAN filed by MICHELE NILSEN, MICHAEL GOODRICH. (mnw, ) (Entered: 07/29/2005)"
        },
        {
          "row_number": 51,
          "id": 9513241,
          "entry_number": "145",
          "date_filed": "2005-08-01T00:00:00-04:00",
          "attachments": null,
          "url": "https://www.courtlistener.com/docket/12069135/145/nilsen-v-york-county/",
          "recap_pdf_url": null,
          "pacer_doc_id": null,
          "description": "Minute Entry for proceedings held before Judge D. BROCK HORNBY. Final Fairness Hearing held on 8/1/2005. Written Decision to Issue. (Court Reporter DENNIS FORD) (mnw, ) (Entered: 08/01/2005)"
        },
        {
          "row_number": 52,
          "id": 9513242,
          "entry_number": "146",
          "date_filed": "2005-08-03T00:00:00-04:00",
          "attachments": null,
          "url": "https://www.courtlistener.com/docket/12069135/146/nilsen-v-york-county/",
          "recap_pdf_url": null,
          "pacer_doc_id": null,
          "description": "NOTICE OF EXCLUSION BY KENNETH L. MCGARRY (mnw, ) (Entered: 08/04/2005)"
        },
        {
          "row_number": 53,
          "id": 9513243,
          "entry_number": "147",
          "date_filed": "2005-08-03T00:00:00-04:00",
          "attachments": null,
          "url": "https://www.courtlistener.com/docket/12069135/147/nilsen-v-york-county/",
          "recap_pdf_url": null,
          "pacer_doc_id": null,
          "description": "NOTICE OF EXCLUSION BY TERRY W. MCDANIEL (mnw, ) (Entered: 08/04/2005)"
        },
        {
          "row_number": 55,
          "id": 9513245,
          "entry_number": "149",
          "date_filed": "2005-08-03T00:00:00-04:00",
          "attachments": null,
          "url": "https://www.courtlistener.com/docket/12069135/149/nilsen-v-york-county/",
          "recap_pdf_url": null,
          "pacer_doc_id": null,
          "description": "NOTICE OF EXCLUSION BY GLENNA TURNER (mnw, ) (Entered: 08/04/2005)"
        },
        {
          "row_number": 57,
          "id": 9513246,
          "entry_number": "150",
          "date_filed": "2005-08-03T00:00:00-04:00",
          "attachments": null,
          "url": "https://www.courtlistener.com/docket/12069135/150/nilsen-v-york-county/",
          "recap_pdf_url": null,
          "pacer_doc_id": null,
          "description": "NOTICE OF EXCLUSION BY CHARLES DOANE (mnw, ) (Entered: 08/04/2005)"
        },
        {
          "row_number": 58,
          "id": 9513247,
          "entry_number": "151",
          "date_filed": "2005-08-04T00:00:00-04:00",
          "attachments": null,
          "url": "https://www.courtlistener.com/docket/12069135/151/nilsen-v-york-county/",
          "recap_pdf_url": null,
          "pacer_doc_id": null,
          "description": "LETTER TO THE COURT FROM COREY GREEN RE: LATE CLAIM FORM (mnw, ) (Entered: 08/05/2005)"
        },
        {
          "row_number": 59,
          "id": 9513248,
          "entry_number": "152",
          "date_filed": "2005-08-08T00:00:00-04:00",
          "attachments": null,
          "url": "https://www.courtlistener.com/docket/12069135/152/nilsen-v-york-county/",
          "recap_pdf_url": null,
          "pacer_doc_id": null,
          "description": "LETTER TO THE COURT BY KAREN K. THOMPSON RE: LATE CLAIM FORM (mnw, ) (Entered: 08/09/2005)"
        },
        {
          "row_number": 60,
          "id": 9513249,
          "entry_number": "153",
          "date_filed": "2005-08-08T00:00:00-04:00",
          "attachments": null,
          "url": "https://www.courtlistener.com/docket/12069135/153/nilsen-v-york-county/",
          "recap_pdf_url": null,
          "pacer_doc_id": null,
          "description": "LETTER TO THE COURT BY LEROY GOVE RE: LATE CLAIM FORM (mnw, ) (Entered: 08/09/2005)"
        },
        {
          "row_number": 61,
          "id": 9513250,
          "entry_number": "154",
          "date_filed": "2005-08-08T00:00:00-04:00",
          "attachments": null,
          "url": "https://www.courtlistener.com/docket/12069135/154/nilsen-v-york-county/",
          "recap_pdf_url": null,
          "pacer_doc_id": null,
          "description": "LETTER TO THE COURT BY PAM TRIPP RE: LATE CLAIM FORM (mnw, ) (Entered: 08/09/2005)"
        },
        {
          "row_number": 63,
          "id": 9513252,
          "entry_number": "156",
          "date_filed": "2005-08-17T00:00:00-04:00",
          "attachments": null,
          "url": "https://www.courtlistener.com/docket/12069135/156/nilsen-v-york-county/",
          "recap_pdf_url": null,
          "pacer_doc_id": null,
          "description": "LETTER TO THE COURT BY CAROL A. JENKINS RE: LATE CLAIM FORM (mnw, ) (Entered: 08/17/2005)"
        },
        {
          "row_number": 65,
          "id": 9513254,
          "entry_number": "158",
          "date_filed": "2005-08-17T00:00:00-04:00",
          "attachments": null,
          "url": "https://www.courtlistener.com/docket/12069135/158/nilsen-v-york-county/",
          "recap_pdf_url": null,
          "pacer_doc_id": null,
          "description": "LETTER TO THE COURT BY BRIAN N. HUOT RE: LATE CLAIM FORM (mnw, ) (Entered: 08/17/2005)"
        },
        {
          "row_number": 66,
          "id": 9513255,
          "entry_number": "159",
          "date_filed": "2005-08-18T00:00:00-04:00",
          "attachments": null,
          "url": "https://www.courtlistener.com/docket/12069135/159/nilsen-v-york-county/",
          "recap_pdf_url": null,
          "pacer_doc_id": null,
          "description": "ORDER ON MOTION FOR FINAL APPROVAL OF CLASS SETTLEMENT reserving ruling 124 Motion for Attorney Fees, granting in part and denying in part 133 Motion for Approval of Settlement. \"I disapprove the settlement but only to the extent that it provides for a gender-based allocation of the settlement proceeds. So Ordered.\" By Judge D. BROCK HORNBY. (mnw, ) (Entered: 08/18/2005)"
        },
        {
          "row_number": 68,
          "id": 9513256,
          "entry_number": "160",
          "date_filed": "2005-08-18T00:00:00-04:00",
          "attachments": null,
          "url": "https://www.courtlistener.com/docket/12069135/160/nilsen-v-york-county/",
          "recap_pdf_url": null,
          "pacer_doc_id": null,
          "description": "PLAINTIFFS' SUPPLEMENTAL MEMORANDUM CONCERNING LATE SETTLEMENT CLAIMS (mnw, ) (Entered: 08/19/2005)"
        },
        {
          "row_number": 70,
          "id": 9513258,
          "entry_number": "162",
          "date_filed": "2005-08-25T00:00:00-04:00",
          "attachments": null,
          "url": "https://www.courtlistener.com/docket/12069135/162/nilsen-v-york-county/",
          "recap_pdf_url": null,
          "pacer_doc_id": null,
          "description": "LETTER TO THE COURT BY GARY E. SMITH RE: LATE CLAIM FORM (mnw, ) (Entered: 08/25/2005)"
        },
        {
          "row_number": 71,
          "id": 9513259,
          "entry_number": "163",
          "date_filed": "2005-08-25T00:00:00-04:00",
          "attachments": null,
          "url": "https://www.courtlistener.com/docket/12069135/163/nilsen-v-york-county/",
          "recap_pdf_url": null,
          "pacer_doc_id": null,
          "description": "LETTER TO THE COURT BY GARY M. VACHON RE: LATE CLAIM FORM (mnw, ) (Entered: 08/25/2005)"
        },
        {
          "row_number": 73,
          "id": 9513261,
          "entry_number": "165",
          "date_filed": "2005-09-02T00:00:00-04:00",
          "attachments": null,
          "url": "https://www.courtlistener.com/docket/12069135/165/nilsen-v-york-county/",
          "recap_pdf_url": null,
          "pacer_doc_id": null,
          "description": "Consent MOTION for Approval of Settlement (PLAINTIFFS' CONSENT MOTION FOR APPROVAL OF SECOND AMENDED SETTLEMENT AGREEMENT) by MICHELE NILSEN, MICHAEL GOODRICH WITH INCORPORATED MEMO.Responses due by 9/23/2005. (mnw, ) (Entered: 09/02/2005)"
        },
        {
          "row_number": 74,
          "id": 9513262,
          "entry_number": "166",
          "date_filed": "2005-09-06T00:00:00-04:00",
          "attachments": null,
          "url": "https://www.courtlistener.com/docket/12069135/166/nilsen-v-york-county/",
          "recap_pdf_url": null,
          "pacer_doc_id": null,
          "description": "LETTER from Jessica Parker re: late claim form. (slh, ) (Entered: 09/06/2005)"
        },
        {
          "row_number": 76,
          "id": 9513263,
          "entry_number": "168",
          "date_filed": "2005-09-06T00:00:00-04:00",
          "attachments": null,
          "url": "https://www.courtlistener.com/docket/12069135/168/nilsen-v-york-county/",
          "recap_pdf_url": null,
          "pacer_doc_id": null,
          "description": "SECOND AMENDED SETTLEMENT AGREEMENT (signed by all parties) (mnw, ) (Entered: 09/09/2005)"
        },
        {
          "row_number": 75,
          "id": 9513264,
          "entry_number": "167",
          "date_filed": "2005-09-08T00:00:00-04:00",
          "attachments": null,
          "url": "https://www.courtlistener.com/docket/12069135/167/nilsen-v-york-county/",
          "recap_pdf_url": null,
          "pacer_doc_id": null,
          "description": "ORDER ON MOTION FOR FINAL APPROVAL OF SECOND AMENDED SETTLEMENT AGREEMENT - granting 165 PLAINTIFFS' CONSENT MOTION FOR APPROVAL OF SECOND AMENDED SETTLEMENT AGREEMENT - By Judge D. BROCK HORNBY. (mnw, ) (Entered: 09/08/2005)"
        },
        {
          "row_number": 79,
          "id": 9513266,
          "entry_number": "170",
          "date_filed": "2005-09-21T00:00:00-04:00",
          "attachments": null,
          "url": "https://www.courtlistener.com/docket/12069135/170/nilsen-v-york-county/",
          "recap_pdf_url": null,
          "pacer_doc_id": null,
          "description": "LETTER TO THE COURT BY PETER JOHN BROWN RE: CLAIM FORM ACCEPTANCE (mnw, ) (Entered: 09/22/2005)"
        },
        {
          "row_number": 80,
          "id": 9513267,
          "entry_number": "171",
          "date_filed": "2005-09-23T00:00:00-04:00",
          "attachments": null,
          "url": "https://www.courtlistener.com/docket/12069135/171/nilsen-v-york-county/",
          "recap_pdf_url": null,
          "pacer_doc_id": null,
          "description": "LETTER TO THE COURT FROM LEE RICHARDSON RE: LATE CLAIM FORM (mnw, ) (Entered: 09/26/2005)"
        },
        {
          "row_number": 81,
          "id": 9513268,
          "entry_number": "172",
          "date_filed": "2005-09-23T00:00:00-04:00",
          "attachments": null,
          "url": "https://www.courtlistener.com/docket/12069135/172/nilsen-v-york-county/",
          "recap_pdf_url": null,
          "pacer_doc_id": null,
          "description": "LETTER TO THE COURT BY SHERRY LASSOR RE: LATE CLAIM FORM (mnw, ) (Entered: 09/26/2005)"
        },
        {
          "row_number": 83,
          "id": 9513270,
          "entry_number": "174",
          "date_filed": "2005-10-04T00:00:00-04:00",
          "attachments": null,
          "url": "https://www.courtlistener.com/docket/12069135/174/nilsen-v-york-county/",
          "recap_pdf_url": null,
          "pacer_doc_id": null,
          "description": "PLAINTIFFS' SECOND SUPPLEMENTAL MEMORANDUM CONCERNING LATE SETTLEMENT CLAIMS by MICHELE NILSEN, MICHAEL GOODRICH re: 170 Letterby Peter J. Brown. (mjlt, ) (Entered: 10/05/2005)"
        },
        {
          "row_number": 84,
          "id": 9513271,
          "entry_number": "175",
          "date_filed": "2005-10-11T00:00:00-04:00",
          "attachments": null,
          "url": "https://www.courtlistener.com/docket/12069135/175/nilsen-v-york-county/",
          "recap_pdf_url": null,
          "pacer_doc_id": null,
          "description": "LETTER TO THE COURT FROM RICHARD HARVEY RE: LATE CLAIM FORM (mnw, ) (Entered: 10/12/2005)"
        },
        {
          "row_number": 85,
          "id": 9513272,
          "entry_number": "176",
          "date_filed": "2005-10-11T00:00:00-04:00",
          "attachments": null,
          "url": "https://www.courtlistener.com/docket/12069135/176/nilsen-v-york-county/",
          "recap_pdf_url": null,
          "pacer_doc_id": null,
          "description": "LETTER TO THE COURT FROM ROY W. ESTON RE: LATE CLAIM FORM (mnw, ) (Entered: 10/12/2005)"
        },
        {
          "row_number": 86,
          "id": 9513273,
          "entry_number": "177",
          "date_filed": "2005-10-11T00:00:00-04:00",
          "attachments": null,
          "url": "https://www.courtlistener.com/docket/12069135/177/nilsen-v-york-county/",
          "recap_pdf_url": null,
          "pacer_doc_id": null,
          "description": "LETTER TO THE COURT FROM NICHOLAS GLADU RE: LATE CLAIM FORM (mnw, ) (Entered: 10/12/2005)"
        },
        {
          "row_number": 87,
          "id": 9513274,
          "entry_number": "178",
          "date_filed": "2005-10-12T00:00:00-04:00",
          "attachments": null,
          "url": "https://www.courtlistener.com/docket/12069135/178/nilsen-v-york-county/",
          "recap_pdf_url": null,
          "pacer_doc_id": null,
          "description": "LETTER TO THE COURT FROM DENNIS P. BANKS SR. RE: LATE CLAIM FORM (mnw, ) (Entered: 10/13/2005)"
        },
        {
          "row_number": 90,
          "id": 9513276,
          "entry_number": "180",
          "date_filed": "2005-11-07T00:00:00-05:00",
          "attachments": null,
          "url": "https://www.courtlistener.com/docket/12069135/180/nilsen-v-york-county/",
          "recap_pdf_url": null,
          "pacer_doc_id": null,
          "description": "APPEAL OF DETERMINATION OF DENIAL BY THE CLAIMS ADMINISTRATOR FILED BY HAROLD NEWENHAM (mnw, ) (Entered: 11/08/2005)"
        },
        {
          "row_number": 91,
          "id": 9513277,
          "entry_number": "181",
          "date_filed": "2005-11-08T00:00:00-05:00",
          "attachments": null,
          "url": "https://www.courtlistener.com/docket/12069135/181/nilsen-v-york-county/",
          "recap_pdf_url": null,
          "pacer_doc_id": null,
          "description": "PLAINTIFFS' REPORT ON ADMINISTRATION OF SETTLEMENT filed by MICHELE NILSEN, MICHAEL GOODRICH. (mnw, ) (Entered: 11/09/2005)"
        },
        {
          "row_number": 92,
          "id": 9513278,
          "entry_number": "182",
          "date_filed": "2005-11-09T00:00:00-05:00",
          "attachments": null,
          "url": "https://www.courtlistener.com/docket/12069135/182/nilsen-v-york-county/",
          "recap_pdf_url": null,
          "pacer_doc_id": null,
          "description": "ORDER ON PENDING REQUESTS BY CLASS MEMBERS FOR EXTENSION TO FILE SETTLEMENT CLAIMS - By Judge D. BROCK HORNBY. (mnw, ) (Entered: 11/09/2005)"
        },
        {
          "row_number": 93,
          "id": 9513279,
          "entry_number": "183",
          "date_filed": "2005-11-09T00:00:00-05:00",
          "attachments": null,
          "url": "https://www.courtlistener.com/docket/12069135/183/nilsen-v-york-county/",
          "recap_pdf_url": null,
          "pacer_doc_id": null,
          "description": "LETTER TO THE COURT FROM RICHARD HARVEY RE: LATE CLAIM FORM (mnw, ) (Entered: 11/10/2005)"
        },
        {
          "row_number": 94,
          "id": 9513280,
          "entry_number": "184",
          "date_filed": "2005-11-09T00:00:00-05:00",
          "attachments": null,
          "url": "https://www.courtlistener.com/docket/12069135/184/nilsen-v-york-county/",
          "recap_pdf_url": null,
          "pacer_doc_id": null,
          "description": "CERTIFICATE OF SERVICE by MICHELE NILSEN, MICHAEL GOODRICH re 181 Plaintiff's Report on Administration of Settlement and Proposed Order (mnw, ) (Entered: 11/10/2005)"
        },
        {
          "row_number": 95,
          "id": 9513281,
          "entry_number": "185",
          "date_filed": "2005-11-10T00:00:00-05:00",
          "attachments": null,
          "url": "https://www.courtlistener.com/docket/12069135/185/nilsen-v-york-county/",
          "recap_pdf_url": null,
          "pacer_doc_id": null,
          "description": "ORDER ON MOTION FOR AWARD OF ATTORNEY FEES AND LITIGATION EXPENSES granting in part 124 Motion for Attorney Fees, reserving ruling on 124 Motion for Litigation Expenses - By Judge D. BROCK HORNBY. (mnw, ) (Entered: 11/10/2005)"
        },
        {
          "row_number": 96,
          "id": 9513282,
          "entry_number": "186",
          "date_filed": "2005-11-14T00:00:00-05:00",
          "attachments": null,
          "url": "https://www.courtlistener.com/docket/12069135/186/nilsen-v-york-county/",
          "recap_pdf_url": null,
          "pacer_doc_id": null,
          "description": "LETTER TO THE COURT BY MICHAEL J.P. DESROSIERS RE: LATE CLAIM FORM (mnw, ) (Entered: 11/15/2005)"
        },
        {
          "row_number": 97,
          "id": 9513283,
          "entry_number": "187",
          "date_filed": "2005-11-14T00:00:00-05:00",
          "attachments": null,
          "url": "https://www.courtlistener.com/docket/12069135/187/nilsen-v-york-county/",
          "recap_pdf_url": null,
          "pacer_doc_id": null,
          "description": "LETTER TO THE COURT BY JOHN WILLIAMS III RE: LATE CLAIM FORM (mnw, ) (Entered: 11/15/2005)"
        },
        {
          "row_number": 99,
          "id": 9513285,
          "entry_number": "189",
          "date_filed": "2005-11-15T00:00:00-05:00",
          "attachments": null,
