{
  "case_id": 43966,
  "fetched_at": "2025-10-22T00:39:39.926844",
  "case_data": {
    "attorney_orgs": [],
    "available_documents": [
      "Trial Court Docket",
      "Complaint (any)",
      "Injunctive (or Injunctive-like) Relief",
      "Any published opinion",
      "U.S. Supreme Court merits opinion"
    ],
    "case_defendants": [
      {
        "defendant_level": null,
        "institution": "",
        "institution_alt_state": null,
        "institution_city": "Grants Pass, OR",
        "institution_county": "Josephine",
        "name": "City of Grants Pass",
        "defendant_level_other": "",
        "is_active": true
      }
    ],
    "case_ongoing": "No",
    "case_status": "Approved",
    "case_types": [
      "Criminal Justice (Other)"
    ],
    "cause_other": "",
    "causes": [
      "42 U.S.C. ยง 1983"
    ],
    "class_action_granted": "Granted",
    "class_action_sought": "Yes",
    "closing_year": 2024,
    "constitutional_clause": [
      {
        "value": "Due Process: Procedural Due Process"
      },
      {
        "value": "Due Process: Substantive Due Process"
      },
      {
        "value": "Equal Protection"
      },
      {
        "value": "Cruel and Unusual Punishment"
      }
    ],
    "content_of_injunction": [],
    "court": "District of Oregon",
    "custom_issues": [],
    "defendant_payment": "",
    "defendant_type": [
      {
        "value": "Jurisdiction-wide"
      }
    ],
    "docket_status": "Complete as of retrieval date",
    "facility_type": [],
    "filing_date": "2018-10-15",
    "filing_year": 2018,
    "id": 43966,
    "injunction_duration": "",
    "issues": [
      "General/Misc.: Poverty/homelessness"
    ],
    "last_checked_date": "2024-10-07T00:00:00-04:00",
    "main_docket": {
      "id": 57104,
      "docket_entries": [
        {
          "row_number": 61,
          "id": 9174313,
          "entry_number": "154",
          "date_filed": "2024-09-12T00:00:00-04:00",
          "attachments": [],
          "url": "https://www.courtlistener.com/docket/8031037/154/blake-v-city-of-grants-pass/",
          "recap_pdf_url": "https://www.courtlistener.com/recap/gov.uscourts.ord.140855/gov.uscourts.ord.140855.154.0.pdf",
          "pacer_doc_id": "15109401836",
          "description": "Stipulated Motion for Order Approving Proposed Settlement. Filed by City of Grants Pass. (Attachments: # 1 Exhibit 1) (Hisel, Aaron) (Entered: 09/12/2024)"
        },
        {
          "row_number": 14,
          "id": 9068705,
          "entry_number": "111",
          "date_filed": "2020-07-22T00:00:00-04:00",
          "attachments": [],
          "url": "https://www.courtlistener.com/docket/8031037/111/blake-v-city-of-grants-pass/",
          "recap_pdf_url": "https://www.courtlistener.com/recap/gov.uscourts.ord.140855/gov.uscourts.ord.140855.111.0.pdf",
          "pacer_doc_id": "15107611008",
          "description": "OPINION AND ORDER: For the reasons set forth in this Opinion and Order, Plaintiff's Motion for Summary Judgment 62 is GRANTED in part and DENIED in part. Defendant's Motion for Summary Judgment 80 is DENIED. Please access entire text by document number hyperlink. Ordered and Signed on 07/22/2020 by Magistrate Judge Mark D. Clarke. (rsm) (Entered: 07/22/2020)"
        },
        {
          "row_number": 69,
          "id": 9068574,
          "entry_number": "2",
          "date_filed": "2018-10-15T00:00:00-04:00",
          "attachments": [],
          "url": "https://www.courtlistener.com/docket/8031037/2/blake-v-city-of-grants-pass/",
          "recap_pdf_url": null,
          "pacer_doc_id": "15106828611",
          "description": "Notice of Case Assignment to Magistrate Judge Mark D. Clarke and Discovery and Pretrial Scheduling Order. NOTICE: Counsel shall print and serve the summonses and all documents issued by the Clerk at the time of filing upon all named parties in accordance with Local Rule 3-5. Discovery is to be completed by 2/12/2019. Joint Alternate Dispute Resolution Report is due by 3/14/2019. Pretrial Order is due by 3/14/2019. Dispositive motions are due 3/14/2019. Ordered by Magistrate Judge Mark D. Clarke. (jkm) (Entered: 10/15/2018)"
        },
        {
          "row_number": 80,
          "id": 9068575,
          "entry_number": "3",
          "date_filed": "2018-10-15T00:00:00-04:00",
          "attachments": [],
          "url": "https://www.courtlistener.com/docket/8031037/3/blake-v-city-of-grants-pass/",
          "recap_pdf_url": null,
          "pacer_doc_id": null,
          "description": "Scheduling Order by Magistrate Judge Mark D. Clarke regarding Discovery order,, 2 . Dispositive Motions are due by 3/14/2019. Ordered by Magistrate Judge Mark D. Clarke. (jkm) (Entered: 10/15/2018)"
        },
        {
          "row_number": 91,
          "id": 9068576,
          "entry_number": "4",
          "date_filed": "2018-10-15T00:00:00-04:00",
          "attachments": [],
          "url": "https://www.courtlistener.com/docket/8031037/4/blake-v-city-of-grants-pass/",
          "recap_pdf_url": null,
          "pacer_doc_id": "15106828663",
          "description": "Summons Issued Electronically as to City of Grants Pass. NOTICE: Counsel shall print and serve the summonses and all documents issued by the Clerk at the time of filing upon all named parties in accordance with Local Rule 3-5. (jkm) (Entered: 10/15/2018)"
        },
        {
          "row_number": 113,
          "id": 9068578,
          "entry_number": "6",
          "date_filed": "2018-10-29T00:00:00-04:00",
          "attachments": [],
          "url": "https://www.courtlistener.com/docket/8031037/6/blake-v-city-of-grants-pass/",
          "recap_pdf_url": null,
          "pacer_doc_id": "15106847284",
          "description": "Declaration of Gerald L. Warren . Filed by City of Grants Pass. (Related document(s): Motion for Extension of Time 5 .) (Warren, Gerald) (Entered: 10/29/2018)"
        },
        {
          "row_number": 124,
          "id": 9068579,
          "entry_number": "7",
          "date_filed": "2018-10-31T00:00:00-04:00",
          "attachments": [],
          "url": "https://www.courtlistener.com/docket/8031037/7/blake-v-city-of-grants-pass/",
          "recap_pdf_url": null,
          "pacer_doc_id": null,
          "description": "ORDER: Granting Motion for Extension of Time 5 to file Answer. Answer is now due by 12/12/2018. Ordered by Magistrate Judge Mark D. Clarke. (rsm) (Entered: 10/31/2018)"
        },
        {
          "row_number": 1,
          "id": 9068582,
          "entry_number": "10",
          "date_filed": "2018-12-05T00:00:00-05:00",
          "attachments": [],
          "url": "https://www.courtlistener.com/docket/8031037/10/blake-v-city-of-grants-pass/",
          "recap_pdf_url": null,
          "pacer_doc_id": "15106892391",
          "description": "Individual Party Consent to Jurisdiction by U.S. Magistrate Judge. (Entered: 12/05/2018)"
        },
        {
          "row_number": 12,
          "id": 9068583,
          "entry_number": "11",
          "date_filed": "2018-12-05T00:00:00-05:00",
          "attachments": [],
          "url": "https://www.courtlistener.com/docket/8031037/11/blake-v-city-of-grants-pass/",
          "recap_pdf_url": null,
          "pacer_doc_id": "15106892560",
          "description": "Fed. R. Civ. P. 26(a)(1) Agreement . Filed by Debra Blake. (Johnson, Edward) (Entered: 12/05/2018)"
        },
        {
          "row_number": 23,
          "id": 9068584,
          "entry_number": "12",
          "date_filed": "2018-12-05T00:00:00-05:00",
          "attachments": [],
          "url": "https://www.courtlistener.com/docket/8031037/12/blake-v-city-of-grants-pass/",
          "recap_pdf_url": null,
          "pacer_doc_id": "15106892715",
          "description": "Individual Party Consent to Jurisdiction by U.S. Magistrate Judge. (Entered: 12/05/2018)"
        },
        {
          "row_number": 45,
          "id": 9068586,
          "entry_number": "14",
          "date_filed": "2018-12-07T00:00:00-05:00",
          "attachments": [],
          "url": "https://www.courtlistener.com/docket/8031037/14/blake-v-city-of-grants-pass/",
          "recap_pdf_url": null,
          "pacer_doc_id": "15106896322",
          "description": "Full Consent by all Parties to Jurisdiction by US Magistrate Judge. (jkm) (Entered: 12/07/2018)"
        },
        {
          "row_number": 56,
          "id": 9068587,
          "entry_number": "15",
          "date_filed": "2019-01-22T00:00:00-05:00",
          "attachments": [],
          "url": "https://www.courtlistener.com/docket/8031037/15/blake-v-city-of-grants-pass/",
          "recap_pdf_url": null,
          "pacer_doc_id": null,
          "description": "MINUTES of Proceedings: Telephonic Rule 16 Conference held. Amended Complaint is due 2/22/2019. A further telephonic Status Conference is set for 3/4/2019 at 09:00AM in Medford before Magistrate Judge Mark D. Clarke. Conference call information will be provided in a separate entry. All current deadlines are vacated and will be reset at a later date. Edward Johnson present as counsel for plaintiff. Gerald Warren present as counsel for defendant. Court Reporter: Hearing was not recorded. Ordered by Magistrate Judge Mark D. Clarke. (rsm) (Entered: 01/22/2019)"
        },
        {
          "row_number": 65,
          "id": 9068588,
          "entry_number": "16",
          "date_filed": "2019-02-22T00:00:00-05:00",
          "attachments": [],
          "url": "https://www.courtlistener.com/docket/8031037/16/blake-v-city-of-grants-pass/",
          "recap_pdf_url": null,
          "pacer_doc_id": "15106985938",
          "description": "Stipulated Motion for Leave to File Amended Complaint/Petition . Filed by All Plaintiffs. (Fonseca, Walter) (Entered: 02/22/2019)"
        },
        {
          "row_number": 66,
          "id": 9068589,
          "entry_number": "17",
          "date_filed": "2019-02-27T00:00:00-05:00",
          "attachments": [],
          "url": "https://www.courtlistener.com/docket/8031037/17/blake-v-city-of-grants-pass/",
          "recap_pdf_url": null,
          "pacer_doc_id": null,
          "description": "ORDER: Granting Motion for Leave to File Amended Complaint/Petition 16 . Ordered by Magistrate Judge Mark D. Clarke. (rsm) (Entered: 02/27/2019)"
        },
        {
          "row_number": 67,
          "id": 9068590,
          "entry_number": "18",
          "date_filed": "2019-02-28T00:00:00-05:00",
          "attachments": [],
          "url": "https://www.courtlistener.com/docket/8031037/18/blake-v-city-of-grants-pass/",
          "recap_pdf_url": null,
          "pacer_doc_id": "15106991435",
          "description": "Notice of Association of Attorney Edward Johnson,Jenny Logan for Debra Blake. Filed by All Plaintiffs. (Johnson, Edward) (Entered: 02/28/2019)"
        },
        {
          "row_number": 70,
          "id": 9068592,
          "entry_number": "20",
          "date_filed": "2019-03-04T00:00:00-05:00",
          "attachments": [],
          "url": "https://www.courtlistener.com/docket/8031037/20/blake-v-city-of-grants-pass/",
          "recap_pdf_url": null,
          "pacer_doc_id": null,
          "description": "MINUTES of Proceedings: Telephonic Status/Scheduling Conference held. Plaintiff's Motion for Class Action is due by 03/22/2019. Defendant's Response is due by 5/17/2019. Plaintiff's Reply is due by 6/14/2019. No further dates set at this time. Edward Johnson present as counsel for plaintiff. Gerald Warren present as counsel for defendant. Court Reporter: Hearing was not recorded. Ordered by Magistrate Judge Mark D. Clarke. (rsm) (Entered: 03/04/2019)"
        },
        {
          "row_number": 71,
          "id": 9068594,
          "entry_number": "21",
          "date_filed": "2019-03-07T00:00:00-05:00",
          "attachments": [],
          "url": "https://www.courtlistener.com/docket/8031037/21/blake-v-city-of-grants-pass/",
          "recap_pdf_url": null,
          "pacer_doc_id": "15107003271",
          "description": "Unopposed Motion for Leave to File Amended Complaint/Petition . Filed by All Plaintiffs. (Fonseca, Walter) (Entered: 03/07/2019)"
        },
        {
          "row_number": 72,
          "id": 9068595,
          "entry_number": "22",
          "date_filed": "2019-03-08T00:00:00-05:00",
          "attachments": [],
          "url": "https://www.courtlistener.com/docket/8031037/22/blake-v-city-of-grants-pass/",
          "recap_pdf_url": null,
          "pacer_doc_id": null,
          "description": "ORDER: Granting Plaintiffs' Unopposed Motion for Leave to File Amended Complaint 21 . Ordered by Magistrate Judge Mark D. Clarke. (rsm) (Entered: 03/08/2019)"
        },
        {
          "row_number": 74,
          "id": 9068598,
          "entry_number": "24",
          "date_filed": "2019-03-11T00:00:00-04:00",
          "attachments": [],
          "url": "https://www.courtlistener.com/docket/8031037/24/blake-v-city-of-grants-pass/",
          "recap_pdf_url": null,
          "pacer_doc_id": "15107005439",
          "description": "Answer to 23 Amended Complaint with Jury Demand (to Second) Amended Complaint. Filed by City of Grants Pass. (Warren, Gerald) (Entered: 03/11/2019)"
        },
        {
          "row_number": 76,
          "id": 9068600,
          "entry_number": "26",
          "date_filed": "2019-03-13T00:00:00-04:00",
          "attachments": [],
          "url": "https://www.courtlistener.com/docket/8031037/26/blake-v-city-of-grants-pass/",
          "recap_pdf_url": null,
          "pacer_doc_id": "15107010029",
          "description": "Declaration of Debra Blake in support of motion to certify class. Filed by All Plaintiffs. (Related document(s): Motion to certify class 25 .) (Johnson, Edward) (Entered: 03/13/2019)"
        },
        {
          "row_number": 77,
          "id": 9068601,
          "entry_number": "27",
          "date_filed": "2019-03-13T00:00:00-04:00",
          "attachments": [],
          "url": "https://www.courtlistener.com/docket/8031037/27/blake-v-city-of-grants-pass/",
          "recap_pdf_url": null,
          "pacer_doc_id": "15107010034",
          "description": "Declaration of Gloria Johnson in support of motion to certify class. Filed by All Plaintiffs. (Related document(s): Motion to certify class 25 .) (Johnson, Edward) (Entered: 03/13/2019)"
        },
        {
          "row_number": 78,
          "id": 9068602,
          "entry_number": "28",
          "date_filed": "2019-03-13T00:00:00-04:00",
          "attachments": [],
          "url": "https://www.courtlistener.com/docket/8031037/28/blake-v-city-of-grants-pass/",
          "recap_pdf_url": null,
          "pacer_doc_id": "15107010042",
          "description": "Declaration of John Logan in support of motion to certify class. Filed by All Plaintiffs. (Related document(s): Motion to certify class 25 .) (Johnson, Edward) (Entered: 03/13/2019)"
        },
        {
          "row_number": 81,
          "id": 9068604,
          "entry_number": "30",
          "date_filed": "2019-03-13T00:00:00-04:00",
          "attachments": [],
          "url": "https://www.courtlistener.com/docket/8031037/30/blake-v-city-of-grants-pass/",
          "recap_pdf_url": null,
          "pacer_doc_id": "15107010074",
          "description": "Declaration of Teresa Santucci in support of motion to certify class. Filed by All Plaintiffs. (Related document(s): Motion to certify class 25 .) (Johnson, Edward) (Entered: 03/13/2019)"
        },
        {
          "row_number": 83,
          "id": 9068606,
          "entry_number": "32",
          "date_filed": "2019-03-14T00:00:00-04:00",
          "attachments": [],
          "url": "https://www.courtlistener.com/docket/8031037/32/blake-v-city-of-grants-pass/",
          "recap_pdf_url": null,
          "pacer_doc_id": null,
          "description": "Scheduling Order by Magistrate Judge Mark D. Clarke regarding Motion to Certify the Class 25 . Response is due by 5/17/2019. Reply is due by 6/14/2019. Motion is taken under advisement as of 6/24/2019. Ordered by Magistrate Judge Mark D. Clarke. (rsm) (Entered: 03/14/2019)"
        },
        {
          "row_number": 160,
          "id": 9068609,
          "entry_number": null,
          "date_filed": "2019-03-27T00:00:00-04:00",
          "attachments": [],
          "url": "https://www.courtlistener.com",
          "recap_pdf_url": null,
          "pacer_doc_id": null,
          "description": "1 - Scheduling"
        },
        {
          "row_number": 85,
          "id": 9068610,
          "entry_number": "34",
          "date_filed": "2019-05-15T00:00:00-04:00",
          "attachments": [],
          "url": "https://www.courtlistener.com/docket/8031037/34/blake-v-city-of-grants-pass/",
          "recap_pdf_url": null,
          "pacer_doc_id": "15107088656",
          "description": "Unopposed Motion for Extension of Time to File a Response/Reply to Motion to Certify the Class 25 . Filed by City of Grants Pass. (Warren, Gerald) (Entered: 05/15/2019)"
        },
        {
          "row_number": 86,
          "id": 9068611,
          "entry_number": "35",
          "date_filed": "2019-05-15T00:00:00-04:00",
          "attachments": [],
          "url": "https://www.courtlistener.com/docket/8031037/35/blake-v-city-of-grants-pass/",
          "recap_pdf_url": null,
          "pacer_doc_id": "15107088670",
          "description": "Declaration of Gerald L. Warren . Filed by City of Grants Pass. (Related document(s): Motion for Extension of Time to File Response/Reply to a Motion 34 .) (Attachments: # 1 Exhibit) (Warren, Gerald) (Entered: 05/15/2019)"
        },
        {
          "row_number": 87,
          "id": 9068612,
          "entry_number": "36",
          "date_filed": "2019-05-16T00:00:00-04:00",
          "attachments": [],
          "url": "https://www.courtlistener.com/docket/8031037/36/blake-v-city-of-grants-pass/",
          "recap_pdf_url": null,
          "pacer_doc_id": null,
          "description": "ORDER: Granting Motion for Extension of Time to File Response/Reply to Motion to Certify the Class 25 filed by John Logan, Gloria Johnson, Debra Blake. Response is due by 5/23/2019. Reply is due by 6/21/2019. Motion is taken under advisement as of 7/9/2019. Ordered by Magistrate Judge Mark D. Clarke. (rsm) (Entered: 05/16/2019)"
        },
        {
          "row_number": 161,
          "id": 9068613,
          "entry_number": null,
          "date_filed": "2019-05-16T00:00:00-04:00",
          "attachments": [],
          "url": "https://www.courtlistener.com",
          "recap_pdf_url": null,
          "pacer_doc_id": null,
          "description": "Order on Motion for Extension of Time to File Response/Reply to Motion"
        },
        {
          "row_number": 88,
          "id": 9068614,
          "entry_number": "37",
          "date_filed": "2019-05-22T00:00:00-04:00",
          "attachments": [],
          "url": "https://www.courtlistener.com/docket/8031037/37/blake-v-city-of-grants-pass/",
          "recap_pdf_url": null,
          "pacer_doc_id": "15107097200",
          "description": "Response to Motion to Certify the Class 25 . Filed by City of Grants Pass. (Warren, Gerald) (Entered: 05/22/2019)"
        },
        {
          "row_number": 89,
          "id": 9068615,
          "entry_number": "38",
          "date_filed": "2019-05-22T00:00:00-04:00",
          "attachments": [],
          "url": "https://www.courtlistener.com/docket/8031037/38/blake-v-city-of-grants-pass/",
          "recap_pdf_url": null,
          "pacer_doc_id": "15107097205",
          "description": "Declaration of Gerald L. Warren . Filed by City of Grants Pass. (Related document(s): Response to Motion 37 .) (Attachments: # 1 Exhibit) (Warren, Gerald) (Entered: 05/22/2019)"
        },
        {
          "row_number": 90,
          "id": 9068616,
          "entry_number": "39",
          "date_filed": "2019-06-05T00:00:00-04:00",
          "attachments": [],
          "url": "https://www.courtlistener.com/docket/8031037/39/blake-v-city-of-grants-pass/",
          "recap_pdf_url": null,
          "pacer_doc_id": null,
          "description": "Scheduling Order by Magistrate Judge Mark D. Clarke. The telephonic Oral Argument set for 07/09/2019 at 2:00 PM has been RESET for an \"In Person\" Oral Argument on 7/9/2019 at 02:00 PM in Medford Courtroom 2 before Magistrate Judge Mark D. Clarke. Ordered by Magistrate Judge Mark D. Clarke. (rsm) Modified on 6/6/2019 to link to Motion #25 (cw). (Entered: 06/05/2019)"
        },
        {
          "row_number": 93,
          "id": 9068619,
          "entry_number": "41",
          "date_filed": "2019-06-21T00:00:00-04:00",
          "attachments": [],
          "url": "https://www.courtlistener.com/docket/8031037/41/blake-v-city-of-grants-pass/",
          "recap_pdf_url": null,
          "pacer_doc_id": "15107133729",
          "description": "Reply to Defendant's Response to Motion to Certify the Class 25 . Filed by All Plaintiffs. (Johnson, Edward) (Entered: 06/21/2019)"
        },
        {
          "row_number": 94,
          "id": 9068620,
          "entry_number": "42",
          "date_filed": "2019-06-21T00:00:00-04:00",
          "attachments": [],
          "url": "https://www.courtlistener.com/docket/8031037/42/blake-v-city-of-grants-pass/",
          "recap_pdf_url": null,
          "pacer_doc_id": "15107133745",
          "description": "Declaration of Kelly Wessels in support of Plaintiff's Reply Brief. Filed by All Plaintiffs. (Related document(s): Motion to certify class 25 .) (Attachments: # 1 Exhibit 1) (Johnson, Edward) (Entered: 06/21/2019)"
        },
        {
          "row_number": 95,
          "id": 9068621,
          "entry_number": "43",
          "date_filed": "2019-06-21T00:00:00-04:00",
          "attachments": [],
          "url": "https://www.courtlistener.com/docket/8031037/43/blake-v-city-of-grants-pass/",
          "recap_pdf_url": null,
          "pacer_doc_id": "15107133754",
          "description": "Declaration of Debra Blake in support of Plaintiffs' Reply Brief. Filed by All Plaintiffs. (Related document(s): Motion to certify class 25 .) (Johnson, Edward) (Entered: 06/21/2019)"
        },
        {
          "row_number": 96,
          "id": 9068622,
          "entry_number": "44",
          "date_filed": "2019-06-21T00:00:00-04:00",
          "attachments": [],
          "url": "https://www.courtlistener.com/docket/8031037/44/blake-v-city-of-grants-pass/",
          "recap_pdf_url": null,
          "pacer_doc_id": "15107133760",
          "description": "Declaration of John Logan in support of Plaintiffs' Reply Brief. Filed by All Plaintiffs. (Related document(s): Motion to certify class 25 .) (Attachments: # 1 Exhibit 1) (Johnson, Edward) (Entered: 06/21/2019)"
        },
        {
          "row_number": 97,
          "id": 9068623,
          "entry_number": "45",
          "date_filed": "2019-06-21T00:00:00-04:00",
          "attachments": [],
          "url": "https://www.courtlistener.com/docket/8031037/45/blake-v-city-of-grants-pass/",
          "recap_pdf_url": null,
          "pacer_doc_id": "15107133766",
          "description": "Declaration of Ed Johnson in support of Plaintiff's Reply Brief. Filed by All Plaintiffs. (Related document(s): Motion to certify class 25 .) (Attachments: # 1 Exhibit 1) (Johnson, Edward) (Entered: 06/21/2019)"
        },
        {
          "row_number": 98,
          "id": 9068624,
          "entry_number": "46",
          "date_filed": "2019-07-09T00:00:00-04:00",
          "attachments": [],
          "url": "https://www.courtlistener.com/docket/8031037/46/blake-v-city-of-grants-pass/",
          "recap_pdf_url": null,
          "pacer_doc_id": null,
          "description": "MINUTES of Proceedings: Motion Hearing Held regarding Motion to certify class 25 . Motion is taken under advisement as of 7/9/2019. Edward Johnson and Walter Fonseca present as counsel for plaintiffs. Gerald Warren present as counsel for defendant. Court Reporter: Deana Mead. Ordered by Magistrate Judge Mark D. Clarke. (rsm) (Entered: 07/09/2019)"
        },
        {
          "row_number": 100,
          "id": 9068627,
          "entry_number": "48",
          "date_filed": "2019-08-15T00:00:00-04:00",
          "attachments": [],
          "url": "https://www.courtlistener.com/docket/8031037/48/blake-v-city-of-grants-pass/",
          "recap_pdf_url": null,
          "pacer_doc_id": null,
          "description": "Scheduling Order by Magistrate Judge Mark D. Clarke. Discovery is to be completed by 11/15/2019. Dispositive Motions are due by 12/20/2019. Responses to Dispositive Motions are due by 1/17/2020. Replies to Dispositive Motions are due by 2/5/2020. Ordered by Magistrate Judge Mark D. Clarke. (rsm) (Entered: 08/15/2019)"
        },
        {
          "row_number": 101,
          "id": 9068629,
          "entry_number": "49",
          "date_filed": "2019-11-13T00:00:00-05:00",
          "attachments": [],
          "url": "https://www.courtlistener.com/docket/8031037/49/blake-v-city-of-grants-pass/",
          "recap_pdf_url": null,
          "pacer_doc_id": "15107307946",
          "description": "Notice of Consent to File Amended Complaint Filed by All Plaintiffs. (Johnson, Edward) (Entered: 11/13/2019)"
        },
        {
          "row_number": 105,
          "id": 9068632,
          "entry_number": "52",
          "date_filed": "2019-12-04T00:00:00-05:00",
          "attachments": [],
          "url": "https://www.courtlistener.com/docket/8031037/52/blake-v-city-of-grants-pass/",
          "recap_pdf_url": null,
          "pacer_doc_id": "15107332080",
          "description": "Unopposed Motion for Extension of Time Modification of Current Scheduling Order. Filed by City of Grants Pass. (Hisel, Aaron) (Entered: 12/04/2019)"
        },
        {
          "row_number": 106,
          "id": 9068633,
          "entry_number": "53",
          "date_filed": "2019-12-04T00:00:00-05:00",
          "attachments": [],
          "url": "https://www.courtlistener.com/docket/8031037/53/blake-v-city-of-grants-pass/",
          "recap_pdf_url": null,
          "pacer_doc_id": "15107332086",
          "description": "Unopposed Declaration of Aaron P. Hisel Motion for Modification of Current Scheduling Order. Filed by City of Grants Pass. (Related document(s): Motion for Extension of Time 52 .) (Hisel, Aaron) (Entered: 12/04/2019)"
        },
        {
          "row_number": 107,
          "id": 9068634,
          "entry_number": "54",
          "date_filed": "2019-12-05T00:00:00-05:00",
          "attachments": [],
          "url": "https://www.courtlistener.com/docket/8031037/54/blake-v-city-of-grants-pass/",
          "recap_pdf_url": null,
          "pacer_doc_id": null,
          "description": "ORDER: Granting Defendant's Unopposed Motion for Extension of Time 52 for Modification of Current Schedule. Dispositive Motions are due by 1/17/2020. Responses to Dispositive Motions are due by 2/14/2020. Replies to Dispositive Motions are due by 3/12/2020. Ordered by Magistrate Judge Mark D. Clarke. (rsm) (Entered: 12/05/2019)"
        },
        {
          "row_number": 165,
          "id": 9068635,
          "entry_number": null,
          "date_filed": "2019-12-05T00:00:00-05:00",
          "attachments": [],
          "url": "https://www.courtlistener.com",
          "recap_pdf_url": null,
          "pacer_doc_id": null,
          "description": "Order on Motion for Extension of Time"
        },
        {
          "row_number": 108,
          "id": 9068636,
          "entry_number": "55",
          "date_filed": "2020-01-07T00:00:00-05:00",
          "attachments": [],
          "url": "https://www.courtlistener.com/docket/8031037/55/blake-v-city-of-grants-pass/",
          "recap_pdf_url": null,
          "pacer_doc_id": "15107367631",
          "description": "Joint Motion to File Excess Pages . Filed by All Plaintiffs. (Johnson, Edward) (Entered: 01/07/2020)"
        },
        {
          "row_number": 166,
          "id": 9068637,
          "entry_number": null,
          "date_filed": "2020-01-07T00:00:00-05:00",
          "attachments": [],
          "url": "https://www.courtlistener.com",
          "recap_pdf_url": null,
          "pacer_doc_id": null,
          "description": "Order on Motion to File Excess Pages"
        },
        {
          "row_number": 109,
          "id": 9068638,
          "entry_number": "56",
          "date_filed": "2020-01-07T00:00:00-05:00",
          "attachments": [],
          "url": "https://www.courtlistener.com/docket/8031037/56/blake-v-city-of-grants-pass/",
          "recap_pdf_url": null,
          "pacer_doc_id": null,
          "description": "ORDER: Granting Motion to File Excess Pages 55 . Memoranda in support of summary judgment may not exceed 50 pages. This limitation includes headings, footnotes and quotations, but excludes the caption, table of contents, table of cases and authorities, signature block, exhibits, and any certificates of counsel. Ordered by Magistrate Judge Mark D. Clarke. (rsm) (Entered: 01/07/2020)"
        },
        {
          "row_number": 110,
          "id": 9068639,
          "entry_number": "57",
          "date_filed": "2020-01-07T00:00:00-05:00",
          "attachments": [],
          "url": "https://www.courtlistener.com/docket/8031037/57/blake-v-city-of-grants-pass/",
          "recap_pdf_url": null,
          "pacer_doc_id": "15107368664",
          "description": "Motion for Extension of Time . Filed by City of Grants Pass. (Hisel, Aaron) (Entered: 01/07/2020)"
        },
        {
          "row_number": 111,
          "id": 9068640,
          "entry_number": "58",
          "date_filed": "2020-01-07T00:00:00-05:00",
          "attachments": [],
          "url": "https://www.courtlistener.com/docket/8031037/58/blake-v-city-of-grants-pass/",
          "recap_pdf_url": null,
          "pacer_doc_id": "15107368679",
          "description": "Declaration of Aaron P. Hisel . Filed by City of Grants Pass. (Related document(s): Motion for Extension of Time 57 .) (Attachments: # 1 Exhibit) (Hisel, Aaron) (Entered: 01/07/2020)"
        },
        {
          "row_number": 112,
          "id": 9068641,
          "entry_number": "59",
          "date_filed": "2020-01-08T00:00:00-05:00",
          "attachments": [],
          "url": "https://www.courtlistener.com/docket/8031037/59/blake-v-city-of-grants-pass/",
          "recap_pdf_url": null,
          "pacer_doc_id": "15107369063",
          "description": "Response in Opposition to Motion for Extension of Time 57 . Filed by All Plaintiffs. (Johnson, Edward) (Entered: 01/08/2020)"
        },
        {
          "row_number": 114,
          "id": 9068642,
          "entry_number": "60",
          "date_filed": "2020-01-08T00:00:00-05:00",
          "attachments": [],
          "url": "https://www.courtlistener.com/docket/8031037/60/blake-v-city-of-grants-pass/",
          "recap_pdf_url": null,
          "pacer_doc_id": "15107369068",
          "description": "Declaration of Edward Johnson . Filed by All Plaintiffs. (Related document(s): Response in Opposition to Motion 59 .) (Johnson, Edward) (Entered: 01/08/2020)"
        },
        {
          "row_number": 115,
          "id": 9068643,
          "entry_number": "61",
          "date_filed": "2020-01-09T00:00:00-05:00",
          "attachments": [],
          "url": "https://www.courtlistener.com/docket/8031037/61/blake-v-city-of-grants-pass/",
          "recap_pdf_url": null,
          "pacer_doc_id": null,
          "description": "ORDER: Defendants Motion 57 is GRANTED. Plaintiffs motion for summary judgment is due 1/17/2020; Defendants Response to Plaintiffs Motion and Cross-Motion for Summary Judgment is due 2/14/2020; Plaintiffs Reply in support of summary judgment and Response in opposition to Defendants motion is due 3/12/2020; Defendants Reply in support of summary judgment is due 4/12/2020. Ordered by Magistrate Judge Mark D. Clarke. (rsm) (Entered: 01/09/2020)"
        },
        {
          "row_number": 167,
          "id": 9068644,
          "entry_number": null,
          "date_filed": "2020-01-09T00:00:00-05:00",
          "attachments": [],
          "url": "https://www.courtlistener.com",
          "recap_pdf_url": null,
          "pacer_doc_id": null,
          "description": "Order on Motion for Extension of Time"
        },
        {
          "row_number": 116,
          "id": 9068645,
          "entry_number": "62",
          "date_filed": "2020-01-17T00:00:00-05:00",
          "attachments": [],
          "url": "https://www.courtlistener.com/docket/8031037/62/blake-v-city-of-grants-pass/",
          "recap_pdf_url": null,
          "pacer_doc_id": "15107383218",
          "description": "Motion for Summary Judgment . Oral Argument requested. Filed by All Plaintiffs. (Attachments: # 1 Appendix A) (Johnson, Edward) (Entered: 01/17/2020)"
        },
        {
          "row_number": 119,
          "id": 9068648,
          "entry_number": "65",
          "date_filed": "2020-01-17T00:00:00-05:00",
          "attachments": [],
          "url": "https://www.courtlistener.com/docket/8031037/65/blake-v-city-of-grants-pass/",
          "recap_pdf_url": null,
          "pacer_doc_id": "15107383264",
          "description": "Declaration of Kelly Wessels . Filed by All Plaintiffs. (Related document(s): Motion for Summary Judgment 62 .) (Attachments: # 1 Exhibit 1, # 2 Exhibit 2) (Johnson, Edward) (Entered: 01/17/2020)"
        },
        {
          "row_number": 120,
          "id": 9068649,
          "entry_number": "66",
          "date_filed": "2020-01-17T00:00:00-05:00",
          "attachments": [],
          "url": "https://www.courtlistener.com/docket/8031037/66/blake-v-city-of-grants-pass/",
          "recap_pdf_url": null,
          "pacer_doc_id": "15107383274",
          "description": "Declaration of Carrielynn Hill . Filed by All Plaintiffs. (Related document(s): Motion for Summary Judgment 62 .) (Attachments: # 1 Exhibit 1) (Johnson, Edward) (Entered: 01/17/2020)"
        },
        {
          "row_number": 121,
          "id": 9068650,
          "entry_number": "67",
          "date_filed": "2020-01-17T00:00:00-05:00",
          "attachments": [],
          "url": "https://www.courtlistener.com/docket/8031037/67/blake-v-city-of-grants-pass/",
          "recap_pdf_url": null,
          "pacer_doc_id": "15107383280",
          "description": "Declaration of John Logan . Filed by All Plaintiffs. (Related document(s): Motion for Summary Judgment 62 .) (Johnson, Edward) (Entered: 01/17/2020)"
        },
        {
          "row_number": 122,
          "id": 9068651,
          "entry_number": "68",
          "date_filed": "2020-01-17T00:00:00-05:00",
          "attachments": [],
          "url": "https://www.courtlistener.com/docket/8031037/68/blake-v-city-of-grants-pass/",
          "recap_pdf_url": null,
          "pacer_doc_id": "15107383288",
          "description": "Declaration of Charles Naylor . Filed by All Plaintiffs. (Related document(s): Motion for Summary Judgment 62 .) (Johnson, Edward) (Entered: 01/17/2020)"
        },
        {
          "row_number": 123,
          "id": 9068652,
          "entry_number": "69",
          "date_filed": "2020-01-17T00:00:00-05:00",
          "attachments": [],
          "url": "https://www.courtlistener.com/docket/8031037/69/blake-v-city-of-grants-pass/",
          "recap_pdf_url": null,
          "pacer_doc_id": "15107383294",
          "description": "Declaration of Troy Patton . Filed by All Plaintiffs. (Related document(s): Motion for Summary Judgment 62 .) (Johnson, Edward) (Entered: 01/17/2020)"
        },
        {
          "row_number": 125,
          "id": 9068653,
          "entry_number": "70",
          "date_filed": "2020-01-17T00:00:00-05:00",
          "attachments": [],
          "url": "https://www.courtlistener.com/docket/8031037/70/blake-v-city-of-grants-pass/",
          "recap_pdf_url": null,
          "pacer_doc_id": "15107383297",
          "description": "Declaration of Judy Ostrowski . Filed by All Plaintiffs. (Related document(s): Motion for Summary Judgment 62 .) (Johnson, Edward) (Entered: 01/17/2020)"
        },
        {
          "row_number": 128,
          "id": 9068656,
          "entry_number": "73",
          "date_filed": "2020-01-17T00:00:00-05:00",
          "attachments": [],
          "url": "https://www.courtlistener.com/docket/8031037/73/blake-v-city-of-grants-pass/",
          "recap_pdf_url": null,
          "pacer_doc_id": "15107383313",
          "description": "Declaration of Gregory Kempffer . Filed by All Plaintiffs. (Related document(s): Motion for Summary Judgment 62 .) (Johnson, Edward) (Entered: 01/17/2020)"
        },
        {
          "row_number": 129,
          "id": 9068657,
          "entry_number": "74",
          "date_filed": "2020-01-17T00:00:00-05:00",
          "attachments": [],
          "url": "https://www.courtlistener.com/docket/8031037/74/blake-v-city-of-grants-pass/",
          "recap_pdf_url": null,
          "pacer_doc_id": "15107383321",
          "description": "Declaration of Alexis Krasco . Filed by All Plaintiffs. (Related document(s): Motion for Summary Judgment 62 .) (Johnson, Edward) (Entered: 01/17/2020)"
        },
        {
          "row_number": 130,
          "id": 9068658,
          "entry_number": "75",
          "date_filed": "2020-01-17T00:00:00-05:00",
          "attachments": [],
          "url": "https://www.courtlistener.com/docket/8031037/75/blake-v-city-of-grants-pass/",
          "recap_pdf_url": null,
          "pacer_doc_id": "15107383329",
          "description": "Declaration of Kellie Parker . Filed by All Plaintiffs. (Related document(s): Motion for Summary Judgment 62 .) (Johnson, Edward) (Entered: 01/17/2020)"
        },
        {
          "row_number": 131,
          "id": 9068659,
          "entry_number": "76",
          "date_filed": "2020-01-17T00:00:00-05:00",
          "attachments": [],
          "url": "https://www.courtlistener.com/docket/8031037/76/blake-v-city-of-grants-pass/",
          "recap_pdf_url": null,
          "pacer_doc_id": "15107383332",
          "description": "Declaration of Shawn Goode . Filed by All Plaintiffs. (Related document(s): Motion for Summary Judgment 62 .) (Johnson, Edward) (Entered: 01/17/2020)"
        },
        {
          "row_number": 132,
          "id": 9068660,
          "entry_number": "77",
          "date_filed": "2020-01-27T00:00:00-05:00",
          "attachments": [],
          "url": "https://www.courtlistener.com/docket/8031037/77/blake-v-city-of-grants-pass/",
          "recap_pdf_url": null,
          "pacer_doc_id": "15107393261",
          "description": "Unopposed Motion for Extension of Time of Current Scheduling Deadlines. Filed by City of Grants Pass. (Warren, Gerald) (Entered: 01/27/2020)"
        },
        {
          "row_number": 134,
          "id": 9068662,
          "entry_number": "79",
          "date_filed": "2020-01-28T00:00:00-05:00",
          "attachments": [],
          "url": "https://www.courtlistener.com/docket/8031037/79/blake-v-city-of-grants-pass/",
          "recap_pdf_url": null,
          "pacer_doc_id": null,
          "description": "ORDER: Granting Motion for Extension of Time 77 . Defendants Response to Plaintiffs Motion for Summary Judgment and deadline to file a Cross-Motion for Summary Judgment is 02/28/2020. Plaintiffs Reply in support of their motion and response in opposition to Defendants Motion is due 03/27/2020. Defendants Reply in support of its Motion is due 04/24/2020. Ordered by Magistrate Judge Mark D. Clarke. (rsm) (Entered: 01/28/2020)"
        },
        {
          "row_number": 168,
          "id": 9068663,
          "entry_number": null,
          "date_filed": "2020-01-28T00:00:00-05:00",
          "attachments": [],
          "url": "https://www.courtlistener.com",
          "recap_pdf_url": null,
          "pacer_doc_id": null,
          "description": "Order on Motion for Extension of Time"
        },
        {
          "row_number": 138,
          "id": 9068666,
          "entry_number": "82",
          "date_filed": "2020-02-28T00:00:00-05:00",
          "attachments": [],
          "url": "https://www.courtlistener.com/docket/8031037/82/blake-v-city-of-grants-pass/",
          "recap_pdf_url": null,
          "pacer_doc_id": "15107432442",
          "description": "Declaration of Terri McClure in SUPPORT OF DEF'S JOINT MSJ AND RESPONSE TO PLTFS' MSJ. Filed by City of Grants Pass. (Related document(s): Motion for Summary Judgment 80 .) (Attachments: # 1 Exhibit) (Hisel, Aaron) (Entered: 02/28/2020)"
        },
        {
          "row_number": 139,
          "id": 9068667,
          "entry_number": "83",
          "date_filed": "2020-02-28T00:00:00-05:00",
          "attachments": [],
          "url": "https://www.courtlistener.com/docket/8031037/83/blake-v-city-of-grants-pass/",
          "recap_pdf_url": null,
          "pacer_doc_id": "15107432476",
          "description": "Declaration of Jim Hamilton in SUPPORT OF DEF'S MSJ AND RESPONSE TO PLTFS' MSJ. Filed by City of Grants Pass. (Related document(s): Motion for Summary Judgment 80 .) (Attachments: # 1 Exhibit) (Hisel, Aaron) (Entered: 02/28/2020)"
        },
        {
          "row_number": 140,
          "id": 9068668,
          "entry_number": "84",
          "date_filed": "2020-02-28T00:00:00-05:00",
          "attachments": [],
          "url": "https://www.courtlistener.com/docket/8031037/84/blake-v-city-of-grants-pass/",
          "recap_pdf_url": null,
          "pacer_doc_id": "15107432492",
          "description": "Declaration of Jason McGinnis in SUPPORT OF DEF'S MSJ AND RESPONSE TO PLTFS' MSJ. Filed by City of Grants Pass. (Related document(s): Motion for Summary Judgment 80 .) (Attachments: # 1 Exhibit) (Hisel, Aaron) (Entered: 02/28/2020)"
        },
        {
          "row_number": 141,
          "id": 9068669,
          "entry_number": "85",
          "date_filed": "2020-02-28T00:00:00-05:00",
          "attachments": [],
          "url": "https://www.courtlistener.com/docket/8031037/85/blake-v-city-of-grants-pass/",
          "recap_pdf_url": null,
          "pacer_doc_id": "15107432623",
          "description": "Motion for Leave to file Brief as Amicus Curiae. Filed by League of Oregon Cities. (Attachments: # 1 Proposed Document Amicus Brief of League of Oregon Cities in Support of Defendant City of Grants Pass) (Gallegos, Stanton) (Entered: 02/28/2020)"
        },
        {
          "row_number": 142,
          "id": 9068670,
          "entry_number": "86",
          "date_filed": "2020-03-03T00:00:00-05:00",
          "attachments": [],
          "url": "https://www.courtlistener.com/docket/8031037/86/blake-v-city-of-grants-pass/",
          "recap_pdf_url": null,
          "pacer_doc_id": null,
          "description": "ORDER: Granting Motion for Leave 85 to file Brief as Amicus Curiae.Plaintiffs are granted leave to respond to LOC's Amicus brief. Ordered by Magistrate Judge Mark D. Clarke. (rsm) (Entered: 03/03/2020)"
        },
        {
          "row_number": 169,
          "id": 9068671,
          "entry_number": null,
          "date_filed": "2020-03-03T00:00:00-05:00",
          "attachments": [],
          "url": "https://www.courtlistener.com",
          "recap_pdf_url": null,
          "pacer_doc_id": null,
          "description": "Order on Motion for Leave"
        },
        {
          "row_number": 143,
          "id": 9068672,
          "entry_number": "87",
          "date_filed": "2020-03-03T00:00:00-05:00",
          "attachments": [],
          "url": "https://www.courtlistener.com/docket/8031037/87/blake-v-city-of-grants-pass/",
          "recap_pdf_url": null,
          "pacer_doc_id": "15107434993",
          "description": "Amicus Curiae Appearance entered by Anna Marie Joyce on behalf of League of Oregon Cities titled, \"Amicus Brief of league of Oregon Cities in Support of Defendant City of Grants Pass\". Filed by on behalf of League of Oregon Cities. (Joyce, Anna) (Entered: 03/03/2020)"
        },
        {
          "row_number": 144,
          "id": 9068673,
          "entry_number": "88",
          "date_filed": "2020-03-27T00:00:00-04:00",
          "attachments": [],
          "url": "https://www.courtlistener.com/docket/8031037/88/blake-v-city-of-grants-pass/",
          "recap_pdf_url": null,
          "pacer_doc_id": "15107467145",
          "description": "Reply Brief on Plaintiffs' Motion for Summary Judgment and Response to Joint Motion for Summary Judgment and RESPONSE TO PLTFS' SUMMARY JUDGMENT 80 Oral Argument requested. Filed by All Plaintiffs. (Johnson, Edward) (Entered: 03/27/2020)"
        },
        {
          "row_number": 147,
          "id": 9068675,
          "entry_number": "90",
          "date_filed": "2020-03-27T00:00:00-04:00",
          "attachments": [],
          "url": "https://www.courtlistener.com/docket/8031037/90/blake-v-city-of-grants-pass/",
          "recap_pdf_url": null,
          "pacer_doc_id": "15107467191",
          "description": "Declaration of Debra Blake . Filed by All Plaintiffs. (Related document(s): Reply to Motion 88 .) (Attachments: # 1 Exhibit 1, # 2 Exhibit 2, # 3 Exhibit 3) (Johnson, Edward) (Entered: 03/27/2020)"
        },
        {
          "row_number": 148,
          "id": 9068676,
          "entry_number": "91",
          "date_filed": "2020-03-27T00:00:00-04:00",
          "attachments": [],
          "url": "https://www.courtlistener.com/docket/8031037/91/blake-v-city-of-grants-pass/",
          "recap_pdf_url": null,
          "pacer_doc_id": "15107467234",
          "description": "Declaration of Gloria Johnson . Filed by All Plaintiffs. (Related document(s): Reply to Motion 88 .) (Johnson, Edward) (Entered: 03/27/2020)"
        },
        {
          "row_number": 149,
          "id": 9068677,
          "entry_number": "92",
          "date_filed": "2020-03-27T00:00:00-04:00",
          "attachments": [],
          "url": "https://www.courtlistener.com/docket/8031037/92/blake-v-city-of-grants-pass/",
          "recap_pdf_url": null,
          "pacer_doc_id": "15107467255",
          "description": "Declaration of Edward Johnson . Filed by All Plaintiffs. (Related document(s): Reply to Motion 88 .) (Attachments: # 1 Exhibit 1, # 2 Exhibit 2) (Johnson, Edward) (Entered: 03/27/2020)"
        },
        {
          "row_number": 151,
          "id": 9068679,
          "entry_number": "94",
          "date_filed": "2020-03-27T00:00:00-04:00",
          "attachments": [],
          "url": "https://www.courtlistener.com/docket/8031037/94/blake-v-city-of-grants-pass/",
          "recap_pdf_url": null,
          "pacer_doc_id": "15107467577",
          "description": "Amicus Curiae Appearance entered by Beth Ann Creighton on behalf of National Law Center on Homelessness & Poverty . Filed by on behalf of National Law Center on Homelessness & Poverty. (Creighton, Beth) (Entered: 03/27/2020)"
        },
        {
          "row_number": 152,
          "id": 9068680,
          "entry_number": "95",
          "date_filed": "2020-03-27T00:00:00-04:00",
          "attachments": [],
          "url": "https://www.courtlistener.com/docket/8031037/95/blake-v-city-of-grants-pass/",
          "recap_pdf_url": null,
          "pacer_doc_id": "15107467583",
          "description": "Corporate Disclosure Statement of the National Law Center on Homelessness & Poverty. Filed by National Law Center on Homelessness & Poverty. (Creighton, Beth) (Entered: 03/27/2020)"
        },
        {
          "row_number": 156,
          "id": 9068684,
          "entry_number": "99",
          "date_filed": "2020-03-27T00:00:00-04:00",
          "attachments": [],
          "url": "https://www.courtlistener.com/docket/8031037/99/blake-v-city-of-grants-pass/",
          "recap_pdf_url": null,
          "pacer_doc_id": "15107467607",
          "description": "Motion for Leave to File Amicus Brief of the National Law Center on Homelessness & Poverty in Support of Plaintiffs' Motion for Summary Judgment. Filed by National Law Center on Homelessness & Poverty. (Attachments: # 1 Exhibit A) (Creighton, Beth) (Entered: 03/27/2020)"
        },
        {
          "row_number": 170,
          "id": 9068685,
          "entry_number": null,
          "date_filed": "2020-03-30T00:00:00-04:00",
          "attachments": [],
          "url": "https://www.courtlistener.com",
          "recap_pdf_url": null,
          "pacer_doc_id": null,
          "description": "Order on Motion for Leave"
        },
        {
          "row_number": 171,
          "id": 9068686,
          "entry_number": null,
          "date_filed": "2020-03-30T00:00:00-04:00",
          "attachments": [],
          "url": "https://www.courtlistener.com",
          "recap_pdf_url": null,
          "pacer_doc_id": null,
          "description": "Order on Motion to Appear as Amicus Curiae"
        },
        {
          "row_number": 173,
          "id": 9068688,
          "entry_number": null,
          "date_filed": "2020-03-30T00:00:00-04:00",
          "attachments": [],
          "url": "https://www.courtlistener.com",
          "recap_pdf_url": null,
          "pacer_doc_id": null,
          "description": "Clerk's Review of Motion for Leave to Appear Pro Hac Vice. Pro Hac Vice admission requested by attorney(s) Nicolle L. Jacoby Filing fee in the amount of $300 collected; Agency Tracking ID: AORDC-6461497 96 : Reviewed and Ready for Ruling. (jkm)"
        },
        {
          "row_number": 175,
          "id": 9068690,
          "entry_number": null,
          "date_filed": "2020-03-30T00:00:00-04:00",
          "attachments": [],
          "url": "https://www.courtlistener.com",
          "recap_pdf_url": null,
          "pacer_doc_id": null,
          "description": "Clerk's Review of Motion for Leave to Appear Pro Hac Vice. Pro Hac Vice admission requested by attorney(s) Tristia M. Bauman Filing fee in the amount of $300 collected; Agency Tracking ID: AORDC-6461519 98 : Reviewed and Ready for Ruling. (jkm)"
        },
        {
          "row_number": 2,
          "id": 9068692,
          "entry_number": "100",
          "date_filed": "2020-03-30T00:00:00-04:00",
          "attachments": [],
          "url": "https://www.courtlistener.com/docket/8031037/100/blake-v-city-of-grants-pass/",
          "recap_pdf_url": null,
          "pacer_doc_id": null,
          "description": "ORDER: Granting Motion for Leave to Appear Pro Hac Vice 96 . Ordered by Magistrate Judge Mark D. Clarke. (jkm) (Entered: 03/30/2020)"
        },
        {
          "row_number": 4,
          "id": 9068694,
          "entry_number": "102",
          "date_filed": "2020-03-30T00:00:00-04:00",
          "attachments": [],
          "url": "https://www.courtlistener.com/docket/8031037/102/blake-v-city-of-grants-pass/",
          "recap_pdf_url": null,
          "pacer_doc_id": null,
          "description": "ORDER: Granting Motion for Leave to Appear Pro Hac Vice 98 . Ordered by Magistrate Judge Mark D. Clarke. (jkm) (Entered: 03/30/2020)"
        },
        {
          "row_number": 5,
          "id": 9068695,
          "entry_number": "103",
          "date_filed": "2020-03-30T00:00:00-04:00",
          "attachments": [],
          "url": "https://www.courtlistener.com/docket/8031037/103/blake-v-city-of-grants-pass/",
          "recap_pdf_url": null,
          "pacer_doc_id": null,
          "description": "ORDER: Granting Motion to Appear as Amicus Curiae 93 . Ordered by Magistrate Judge Mark D. Clarke. (rsm) (Entered: 03/30/2020)"
        },
        {
          "row_number": 7,
          "id": 9068697,
          "entry_number": "105",
          "date_filed": "2020-03-31T00:00:00-04:00",
          "attachments": [],
          "url": "https://www.courtlistener.com/docket/8031037/105/blake-v-city-of-grants-pass/",
          "recap_pdf_url": null,
          "pacer_doc_id": "15107470980",
          "description": "Amicus Brief in Support of Plaintiffs' Motion for Summary Judgment. Filed by National Law Center on Homelessness & Poverty. (Related document(s): Motion for Summary Judgment 62 .) (Creighton, Beth) (Entered: 03/31/2020)"
        },
        {
          "row_number": 8,
          "id": 9068698,
          "entry_number": "106",
          "date_filed": "2020-04-20T00:00:00-04:00",
          "attachments": [],
          "url": "https://www.courtlistener.com/docket/8031037/106/blake-v-city-of-grants-pass/",
          "recap_pdf_url": null,
          "pacer_doc_id": null,
          "description": "Scheduling Order by Magistrate Judge Mark D. Clarke regarding Joint Motion for Summary Judgment and RESPONSE TO PLTFS' SUMMARY JUDGMENT 80, Motion for Summary Judgment 62 . Telephonic Oral Argument is set for 6/2/2020 at 02:00PM in Medford Courtroom 2 before Magistrate Judge Mark D. Clarke. Conference call information to be provided in a separate Ordered by Magistrate Judge Mark D. Clarke. (rsm) (Entered: 04/20/2020)"
        },
        {
          "row_number": 177,
          "id": 9068699,
          "entry_number": null,
          "date_filed": "2020-04-20T00:00:00-04:00",
          "attachments": [],
          "url": "https://www.courtlistener.com",
          "recap_pdf_url": null,
          "pacer_doc_id": null,
          "description": "1 - Scheduling"
        },
        {
          "row_number": 10,
          "id": 9068701,
          "entry_number": "108",
          "date_filed": "2020-04-24T00:00:00-04:00",
          "attachments": [],
          "url": "https://www.courtlistener.com/docket/8031037/108/blake-v-city-of-grants-pass/",
          "recap_pdf_url": null,
          "pacer_doc_id": "15107502782",
          "description": "Declaration of Jason McGinnis in Support of Defendant's Reply to Plaintiff's Response to Defendant's Motion for Summary Judgment 80 88 107 . Filed by City of Grants Pass. (Hisel, Aaron) (Entered: 04/24/2020)"
        },
        {
          "row_number": 11,
          "id": 9068702,
          "entry_number": "109",
          "date_filed": "2020-04-24T00:00:00-04:00",
          "attachments": [],
          "url": "https://www.courtlistener.com/docket/8031037/109/blake-v-city-of-grants-pass/",
          "recap_pdf_url": null,
          "pacer_doc_id": "15107502802",
          "description": "Declaration of Aaron P. Hisel in Support of Defendant's Reply to Plaintiff's Response to Defendant's Motion for Summary Judgment 80 88 107 . Filed by City of Grants Pass. (Attachments: # 1 Exhibit) (Hisel, Aaron) (Entered: 04/24/2020)"
        },
        {
          "row_number": 15,
          "id": 9068706,
          "entry_number": "112",
          "date_filed": "2020-08-24T00:00:00-04:00",
          "attachments": [],
          "url": "https://www.courtlistener.com/docket/8031037/112/blake-v-city-of-grants-pass/",
          "recap_pdf_url": null,
          "pacer_doc_id": "15107657527",
          "description": "Stipulated Notice of Dismissal of Substantive Due Process and Equal Protection Claims Filed by All Plaintiffs. (Fonseca, Walter) (Entered: 08/24/2020)"
        },
        {
          "row_number": 16,
          "id": 9068707,
          "entry_number": "113",
          "date_filed": "2020-08-24T00:00:00-04:00",
          "attachments": [],
          "url": "https://www.courtlistener.com/docket/8031037/113/blake-v-city-of-grants-pass/",
          "recap_pdf_url": null,
          "pacer_doc_id": "15107657539",
          "description": "Proposed Form of Order Submitted . Filed by All Plaintiffs. (Fonseca, Walter) (Entered: 08/24/2020)"
        },
        {
          "row_number": 18,
          "id": 9068709,
          "entry_number": "115",
          "date_filed": "2020-08-26T00:00:00-04:00",
          "attachments": [],
          "url": "https://www.courtlistener.com/docket/8031037/115/blake-v-city-of-grants-pass/",
          "recap_pdf_url": null,
          "pacer_doc_id": "15107662482",
          "description": "Notice of Appeal to the 9th Circuit from Judgment 114 Filing fee $505 collected; Agency Tracking ID AORDC-7159474: . Filed by City of Grants Pass. (Warren, Gerald) (Entered: 08/26/2020)"
        },
        {
          "row_number": 19,
          "id": 9068711,
          "entry_number": "116",
          "date_filed": "2020-08-27T00:00:00-04:00",
          "attachments": [],
          "url": "https://www.courtlistener.com/docket/8031037/116/blake-v-city-of-grants-pass/",
          "recap_pdf_url": null,
          "pacer_doc_id": "15107663461",
          "description": "Transcript Designation and Order Form regarding Notice of Appeal 115 . Filed by City of Grants Pass. Transcript is due by 9/28/2020. (Hisel, Aaron) (Entered: 08/27/2020)"
        },
        {
          "row_number": 180,
          "id": 9068712,
          "entry_number": null,
          "date_filed": "2020-08-27T00:00:00-04:00",
          "attachments": [],
          "url": "https://www.courtlistener.com",
          "recap_pdf_url": null,
          "pacer_doc_id": null,
          "description": "USCA Case Number and Notice confirming Docketing Record on Appeal re Notice of Appeal 115 . Case Appealed to 9TH Circuit Court of Appeals Case Number 20-35752 assigned. (jkm)"
        },
        {
          "row_number": 20,
          "id": 9068713,
          "entry_number": "117",
          "date_filed": "2020-08-27T00:00:00-04:00",
          "attachments": [],
          "url": "https://www.courtlistener.com/docket/8031037/117/blake-v-city-of-grants-pass/",
          "recap_pdf_url": null,
          "pacer_doc_id": "15107664247",
          "description": "Time Schedule Order from USCA for the 9th Circuit, USCA # 20-35752 re Notice of Appeal 115 . (jkm) (Entered: 08/27/2020)"
        },
        {
          "row_number": 22,
          "id": 9068715,
          "entry_number": "119",
          "date_filed": "2020-09-09T00:00:00-04:00",
          "attachments": [],
          "url": "https://www.courtlistener.com/docket/8031037/119/blake-v-city-of-grants-pass/",
          "recap_pdf_url": null,
          "pacer_doc_id": "15107678561",
          "description": "Declaration of David Sugerman . Filed by All Plaintiffs. (Related document(s): Motion for Attorney Fees 118 .) (Attachments: # 1 Exhibit) (Johnson, Edward) (Entered: 09/09/2020)"
        },
        {
          "row_number": 24,
          "id": 9068716,
          "entry_number": "120",
          "date_filed": "2020-09-09T00:00:00-04:00",
          "attachments": [],
          "url": "https://www.courtlistener.com/docket/8031037/120/blake-v-city-of-grants-pass/",
          "recap_pdf_url": null,
          "pacer_doc_id": "15107678575",
          "description": "Declaration of Edward Johnson . Filed by All Plaintiffs. (Related document(s): Motion for Attorney Fees 118 .) (Attachments: # 1 Exhibit, # 2 Exhibit) (Johnson, Edward) (Entered: 09/09/2020)"
        },
        {
          "row_number": 25,
          "id": 9068717,
          "entry_number": "121",
          "date_filed": "2020-09-09T00:00:00-04:00",
          "attachments": [],
          "url": "https://www.courtlistener.com/docket/8031037/121/blake-v-city-of-grants-pass/",
          "recap_pdf_url": null,
          "pacer_doc_id": "15107678582",
          "description": "Declaration of Walter Fonseca . Filed by All Plaintiffs. (Related document(s): Motion for Attorney Fees 118 .) (Attachments: # 1 Exhibit) (Johnson, Edward) (Entered: 09/09/2020)"
        },
        {
          "row_number": 27,
          "id": 9068719,
          "entry_number": "123",
          "date_filed": "2020-09-09T00:00:00-04:00",
          "attachments": [],
          "url": "https://www.courtlistener.com/docket/8031037/123/blake-v-city-of-grants-pass/",
          "recap_pdf_url": null,
          "pacer_doc_id": "15107678601",
          "description": "COST BILL. Filed by All Plaintiffs. (Related document(s): Motion for Attorney Fees 118 .) (Johnson, Edward) Modified on 9/9/2020, to correct docket entry (cw). (Entered: 09/09/2020)"
        },
        {
          "row_number": 28,
          "id": 9068720,
          "entry_number": "124",
          "date_filed": "2020-09-22T00:00:00-04:00",
          "attachments": [],
          "url": "https://www.courtlistener.com/docket/8031037/124/blake-v-city-of-grants-pass/",
          "recap_pdf_url": null,
          "pacer_doc_id": "15107697763",
          "description": "Unopposed Motion for Extension of Time to File Response to Plaintiffs' Motion for Costs and Attorney Fees. Filed by City of Grants Pass. (Hisel, Aaron) (Entered: 09/22/2020)"
        },
        {
          "row_number": 29,
          "id": 9068721,
          "entry_number": "125",
          "date_filed": "2020-09-22T00:00:00-04:00",
          "attachments": [],
          "url": "https://www.courtlistener.com/docket/8031037/125/blake-v-city-of-grants-pass/",
          "recap_pdf_url": null,
          "pacer_doc_id": "15107697771",
          "description": "Declaration of Aaron P. Hisel in Support of Defendant's MOET to File Response to Plaintiffs' Motion for Costs and Attorney Fees. Filed by City of Grants Pass. (Related document(s): Motion for Extension of Time 124 .) (Hisel, Aaron) (Entered: 09/22/2020)"
        },
        {
          "row_number": 31,
          "id": 9068723,
          "entry_number": "127",
          "date_filed": "2020-09-23T00:00:00-04:00",
          "attachments": [],
          "url": "https://www.courtlistener.com/docket/8031037/127/blake-v-city-of-grants-pass/",
          "recap_pdf_url": null,
          "pacer_doc_id": null,
          "description": "ORDER: Granting Motion for Extension of Time 124 to file Response to Plaintiffs' Motion for Attorney Fees 118 . Response is due by 10/7/2020. Ordered by Magistrate Judge Mark D. Clarke. (rsm) (Entered: 09/23/2020)"
        },
        {
          "row_number": 33,
          "id": 9068726,
          "entry_number": "129",
          "date_filed": "2020-10-01T00:00:00-04:00",
          "attachments": [],
          "url": "https://www.courtlistener.com/docket/8031037/129/blake-v-city-of-grants-pass/",
          "recap_pdf_url": null,
          "pacer_doc_id": "15107710411",
          "description": "Proposed Form of Order Submitted . Filed by All Plaintiffs. (Johnson, Edward) (Entered: 10/01/2020)"
        },
        {
          "row_number": 35,
          "id": 9068727,
          "entry_number": "130",
          "date_filed": "2020-10-05T00:00:00-04:00",
          "attachments": [],
          "url": "https://www.courtlistener.com/docket/8031037/130/blake-v-city-of-grants-pass/",
          "recap_pdf_url": null,
          "pacer_doc_id": "15107714244",
          "description": "ORDER: regarding Motion for Attorney Fees 118, Bill of Costs 123 . A general judgment was signed and entered in this matter on August 26, 2020. Plaintiffs filed a motion for costs and attorney fees on September 9, 2020. After that filing, the parties reached an agreement regarding an amount of attorney fees and costs. Please access entire text by document number hyperlink. Ordered and Signed on 10/05/2020 by Magistrate Judge Mark D. Clarke. (rsm) (Entered: 10/05/2020)"
        },
        {
          "row_number": 36,
          "id": 9068728,
          "entry_number": "131",
          "date_filed": "2020-10-05T00:00:00-04:00",
          "attachments": [],
          "url": "https://www.courtlistener.com/docket/8031037/131/blake-v-city-of-grants-pass/",
          "recap_pdf_url": null,
          "pacer_doc_id": "15107714265",
          "description": "Proposed Form of Order Submitted . Filed by All Plaintiffs. (Johnson, Edward) (Entered: 10/05/2020)"
        },
        {
          "row_number": 182,
          "id": 9068730,
          "entry_number": null,
          "date_filed": "2020-10-08T00:00:00-04:00",
          "attachments": [],
          "url": "https://www.courtlistener.com",
          "recap_pdf_url": null,
          "pacer_doc_id": null,
          "description": "USCA Case Number"
        },
        {
          "row_number": 38,
          "id": 9068731,
          "entry_number": "133",
          "date_filed": "2020-10-08T00:00:00-04:00",
          "attachments": [],
          "url": "https://www.courtlistener.com/docket/8031037/133/blake-v-city-of-grants-pass/",
          "recap_pdf_url": null,
          "pacer_doc_id": "15107720564",
          "description": "Amended Notice of Appeal to the 9th Circuit Filing fee $505 collected; Receipt No. ID AORDC-7159474: . Filed by City of Grants Pass. (Warren, Gerald) (Entered: 10/08/2020)"
        },
        {
          "row_number": 185,
          "id": 9068735,
          "entry_number": null,
          "date_filed": "2020-10-21T00:00:00-04:00",
          "attachments": [],
          "url": "https://www.courtlistener.com",
          "recap_pdf_url": null,
          "pacer_doc_id": null,
          "description": "USCA Order"
        },
        {
          "row_number": 41,
          "id": 9068737,
          "entry_number": "136",
          "date_filed": "2021-08-19T00:00:00-04:00",
          "attachments": [],
          "url": "https://www.courtlistener.com/docket/8031037/136/blake-v-city-of-grants-pass/",
          "recap_pdf_url": null,
          "pacer_doc_id": "15108123982",
          "description": "Defendant's Notice of Attorney Withdrawal: Gerald L. Warren Filed by City of Grants Pass. (Hisel, Aaron) (Entered: 08/19/2021)"
        },
        {
          "row_number": 44,
          "id": 9068740,
          "entry_number": "139",
          "date_filed": "2022-10-04T00:00:00-04:00",
          "attachments": [],
          "url": "https://www.courtlistener.com/docket/8031037/139/blake-v-city-of-grants-pass/",
          "recap_pdf_url": null,
          "pacer_doc_id": null,
          "description": "Scheduling Order. Telephonic Status Conference is set for 10/12/2022 at 09:00AM in Medford by telephone before Magistrate Judge Mark D. Clarke. Teleconference information to be sent in a separate entry. Ordered by Magistrate Judge Mark D. Clarke. (rsm) (Entered: 10/04/2022)"
        },
        {
          "row_number": 187,
          "id": 9068743,
          "entry_number": null,
          "date_filed": "2022-10-12T00:00:00-04:00",
          "attachments": [],
          "url": "https://www.courtlistener.com",
          "recap_pdf_url": null,
          "pacer_doc_id": null,
          "description": "Status Conference"
        },
        {
          "row_number": 48,
          "id": 9068745,
          "entry_number": "142",
          "date_filed": "2023-02-02T00:00:00-05:00",
          "attachments": [],
          "url": "https://www.courtlistener.com/docket/8031037/142/blake-v-city-of-grants-pass/",
          "recap_pdf_url": null,
          "pacer_doc_id": null,
          "description": "Scheduling Order: The Court has received and reviewed the Joint Status Report 141 . A further Joint Status Report is due by 5/3/2023. Ordered by Magistrate Judge Mark D. Clarke. (rsm) (Entered: 02/02/2023)"
        },
        {
          "row_number": 51,
          "id": 9068749,
          "entry_number": "145",
          "date_filed": "2023-05-04T00:00:00-04:00",
          "attachments": [],
          "url": "https://www.courtlistener.com/docket/8031037/145/blake-v-city-of-grants-pass/",
          "recap_pdf_url": null,
          "pacer_doc_id": null,
          "description": "Scheduling Order regarding Joint Status Report 144 . The Court has received and reviewed the Joint Status Report 144 . A further Joint Status Report is due by 9/1/2023. Ordered by Magistrate Judge Mark D. Clarke. (rsm) (Entered: 05/04/2023)"
        },
        {
          "row_number": 189,
          "id": 9068750,
          "entry_number": null,
          "date_filed": "2023-05-04T00:00:00-04:00",
          "attachments": [],
          "url": "https://www.courtlistener.com",
          "recap_pdf_url": null,
          "pacer_doc_id": null,
          "description": "1 - Scheduling"
        },
        {
          "row_number": 57,
          "id": 9068755,
          "entry_number": "150",
          "date_filed": "2023-08-28T00:00:00-04:00",
          "attachments": [],
          "url": "https://www.courtlistener.com/docket/8031037/150/blake-v-city-of-grants-pass/",
          "recap_pdf_url": null,
          "pacer_doc_id": "15108958799",
          "description": "Notice received from the Supreme Court: petition for certiorari filed on 08/22/2023. Supreme Court Number 23-175. USCA Case Numbers 20-35752 and 20-35881. (bd) (Entered: 08/28/2023)"
        },
        {
          "row_number": 59,
          "id": 9068757,
          "entry_number": "152",
          "date_filed": "2024-01-12T00:00:00-05:00",
          "attachments": [],
          "url": "https://www.courtlistener.com/docket/8031037/152/blake-v-city-of-grants-pass/",
          "recap_pdf_url": null,
          "pacer_doc_id": "15109119551",
          "description": "The petition for writ of certiorari was granted on 1/12/2024. Supreme Court number 23-175. Related Document: Certiorari Notice Received. (jkm) (Entered: 01/17/2024)"
        },
        {
          "row_number": 63,
          "id": 9068761,
          "entry_number": "156",
          "date_filed": "2024-09-23T00:00:00-04:00",
          "attachments": [],
          "url": "https://www.courtlistener.com/docket/8031037/156/blake-v-city-of-grants-pass/",
          "recap_pdf_url": null,
          "pacer_doc_id": "15109413446",
          "description": "Order from USCA for the 9th Circuit, USCA # 20-35752, 20-35881 re Notice of Appeal 133, Notice of Appeal 115 . The matter is therefore remanded to the district court for the limited purpose of acting on the motion to approve the settlement. The parties shall file a status report with this court within seven days of the district courts ruling on the motion, along with a motion for voluntary dismissal of this appeal or other appropriate relief. (jkm) (Entered: 09/23/2024)"
        },
        {
          "row_number": 64,
          "id": 10163472,
          "entry_number": "157",
          "date_filed": "2024-10-07T00:00:00-04:00",
          "attachments": null,
          "url": "https://www.courtlistener.com/docket/8031037/157/blake-v-city-of-grants-pass/",
          "recap_pdf_url": "https://www.courtlistener.com/recap/gov.uscourts.ord.140855/gov.uscourts.ord.140855.157.0.pdf",
          "pacer_doc_id": "15109429868",
          "description": "ORDER APPROVING SETTLEMENT: This matter came before the Court on the parties' Stipulated Motion for Order Approving Settlement Agreement 154 . The Court having previously approved an indicative ruling 155 and the Court of Appeals having remanded for the purpose of approving the settlement 156, IT IS HEREBY ORDERED: 1. The parties Stipulated Motion for Order Approving Settlement Agreement 154 is GRANTED; 2. The Court's previous Judgments 114 132 are hereby VACATED; and 3. The Court having been informed by counsel for the parties that this action has been settled, IT IS ORDERED that, pursuant to LR 41-1, this action is dismissed with prejudice and without costs, and with leave, upon good cause shown within sixty (60) days, to have this order of dismissal set aside and the action reinstated if the settlement is not consummated. Signed on 10/07/2024 by Magistrate Judge Mark D. Clarke. (rsm) (Entered: 10/07/2024)"
        },
        {
          "row_number": 158,
          "id": 9068596,
          "entry_number": null,
          "date_filed": "2019-03-08T00:00:00-05:00",
          "attachments": [],
          "url": "https://www.courtlistener.com",
          "recap_pdf_url": null,
          "pacer_doc_id": null,
          "description": "Order on Motion For Leave to File AmendedComplaint/Petition"
        },
        {
          "row_number": 84,
          "id": 9068608,
          "entry_number": "33",
          "date_filed": "2019-03-27T00:00:00-04:00",
          "attachments": [],
          "url": "https://www.courtlistener.com/docket/8031037/33/blake-v-city-of-grants-pass/",
          "recap_pdf_url": null,
          "pacer_doc_id": null,
          "description": "Scheduling Order by Magistrate Judge Mark D. Clarke regarding Motion to Certify the Class 25 . Telephonic Oral Argument is set for 7/9/2019 at 02:00PM in Medford Courtroom 2 before Magistrate Judge Mark D. Clarke. Teleconference information will be provided in a separate entry. Ordered by Magistrate Judge Mark D. Clarke. (rsm) (Entered: 03/27/2019)"
        },
        {
          "row_number": 75,
          "id": 9068599,
          "entry_number": "25",
          "date_filed": "2019-03-13T00:00:00-04:00",
          "attachments": [],
          "url": "https://www.courtlistener.com/docket/8031037/25/blake-v-city-of-grants-pass/",
          "recap_pdf_url": null,
          "pacer_doc_id": "15107010018",
          "description": "Motion to Certify the Class . Oral Argument requested. Filed by All Plaintiffs. (Johnson, Edward) (Entered: 03/13/2019)"
        },
        {
          "row_number": 82,
          "id": 9068605,
          "entry_number": "31",
          "date_filed": "2019-03-13T00:00:00-04:00",
          "attachments": [],
          "url": "https://www.courtlistener.com/docket/8031037/31/blake-v-city-of-grants-pass/",
          "recap_pdf_url": null,
          "pacer_doc_id": "15107010082",
          "description": "Declaration of Ed Johnson in support of motion to certify class. Filed by All Plaintiffs. (Related document(s): Motion to certify class 25 .) (Johnson, Edward) (Entered: 03/13/2019)"
        },
        {
          "row_number": 162,
          "id": 9068617,
          "entry_number": null,
          "date_filed": "2019-06-05T00:00:00-04:00",
          "attachments": [],
          "url": "https://www.courtlistener.com",
          "recap_pdf_url": null,
          "pacer_doc_id": null,
          "description": "1 - Scheduling"
        },
        {
          "row_number": 92,
          "id": 9068618,
          "entry_number": "40",
          "date_filed": "2019-06-17T00:00:00-04:00",
          "attachments": [],
          "url": "https://www.courtlistener.com/docket/8031037/40/blake-v-city-of-grants-pass/",
          "recap_pdf_url": null,
          "pacer_doc_id": "15107126368",
          "description": "Notice of Attorney Withdrawal: Filed by All Plaintiffs. (Johnson, Edward) (Entered: 06/17/2019)"
        },
        {
          "row_number": 126,
          "id": 9068654,
          "entry_number": "71",
          "date_filed": "2020-01-17T00:00:00-05:00",
          "attachments": [],
          "url": "https://www.courtlistener.com/docket/8031037/71/blake-v-city-of-grants-pass/",
          "recap_pdf_url": null,
          "pacer_doc_id": "15107383307",
          "description": "Declaration of Melody Cacho . Filed by All Plaintiffs. (Related document(s): Motion for Summary Judgment 62 .) (Johnson, Edward) (Entered: 01/17/2020)"
        },
        {
          "row_number": 127,
          "id": 9068655,
          "entry_number": "72",
          "date_filed": "2020-01-17T00:00:00-05:00",
          "attachments": [],
          "url": "https://www.courtlistener.com/docket/8031037/72/blake-v-city-of-grants-pass/",
          "recap_pdf_url": null,
          "pacer_doc_id": "15107383310",
          "description": "Declaration of Michael Faber . Filed by All Plaintiffs. (Related document(s): Motion for Summary Judgment 62 .) (Johnson, Edward) (Entered: 01/17/2020)"
        },
        {
          "row_number": 133,
          "id": 9068661,
          "entry_number": "78",
          "date_filed": "2020-01-27T00:00:00-05:00",
          "attachments": [],
          "url": "https://www.courtlistener.com/docket/8031037/78/blake-v-city-of-grants-pass/",
          "recap_pdf_url": null,
          "pacer_doc_id": "15107393282",
          "description": "Unopposed Declaration of Gerald L. Warren in Support of Defendant's Unopposed Motion for Extension of Scheduling Deadlines. Filed by City of Grants Pass. (Related document(s): Motion for Extension of Time 77 .) (Warren, Gerald) (Entered: 01/27/2020)"
        },
        {
          "row_number": 153,
          "id": 9068681,
          "entry_number": "96",
          "date_filed": "2020-03-27T00:00:00-04:00",
          "attachments": [],
          "url": "https://www.courtlistener.com/docket/8031037/96/blake-v-city-of-grants-pass/",
          "recap_pdf_url": null,
          "pacer_doc_id": "15107467586",
          "description": "Motion for Leave to Appear Pro Hac Vice. Pro Hac Vice admission requested by attorney(s) Nicolle L. Jacoby Filing fee in the amount of $300 collected; Agency Tracking ID: AORDC-6461497. Filed by National Law Center on Homelessness & Poverty. (Jacoby, Nicolle) (Entered: 03/27/2020)"
        },
        {
          "row_number": 13,
          "id": 9068703,
          "entry_number": "110",
          "date_filed": "2020-06-02T00:00:00-04:00",
          "attachments": [],
          "url": "https://www.courtlistener.com/docket/8031037/110/blake-v-city-of-grants-pass/",
          "recap_pdf_url": null,
          "pacer_doc_id": null,
          "description": "MINUTES of Proceedings: Motion Hearing Held regarding Motion for Summary Judgment 80, Motion for Summary Judgment 62 . Motions are taken under advisement as of 6/2/2020. Edward Johnson and Walter Fonseca present as counsel for plaintiffs. Gerald Warren and Aaron Hisel present as counsel for defendants. Court Reporter: Ryan White. Ordered by Magistrate Judge Mark D. Clarke. (rsm) (Entered: 06/02/2020)"
        },
        {
          "row_number": 102,
          "id": 9068577,
          "entry_number": "5",
          "date_filed": "2018-10-29T00:00:00-04:00",
          "attachments": [],
          "url": "https://www.courtlistener.com/docket/8031037/5/blake-v-city-of-grants-pass/",
          "recap_pdf_url": "https://www.courtlistener.com/recap/gov.uscourts.ord.140855/gov.uscourts.ord.140855.5.0.pdf",
          "pacer_doc_id": "15106847273",
          "description": "Unopposed Motion for Extension of Time to File an Appearance. Filed by City of Grants Pass. (Warren, Gerald) (Entered: 10/29/2018)"
        },
        {
          "row_number": 159,
          "id": 9068607,
          "entry_number": null,
          "date_filed": "2019-03-14T00:00:00-04:00",
          "attachments": [],
          "url": "https://www.courtlistener.com",
          "recap_pdf_url": null,
          "pacer_doc_id": null,
          "description": "1 - Scheduling"
        },
        {
          "row_number": 184,
          "id": 9068734,
          "entry_number": null,
          "date_filed": "2020-10-21T00:00:00-04:00",
          "attachments": [],
          "url": "https://www.courtlistener.com",
          "recap_pdf_url": null,
          "pacer_doc_id": null,
          "description": "USCA Case Number"
        },
        {
          "row_number": 181,
          "id": 9068724,
          "entry_number": null,
          "date_filed": "2020-09-23T00:00:00-04:00",
          "attachments": [],
          "url": "https://www.courtlistener.com",
          "recap_pdf_url": null,
          "pacer_doc_id": null,
          "description": "Order on Motion for Extension of Time"
        },
        {
          "row_number": 39,
          "id": 9068733,
          "entry_number": "134",
          "date_filed": "2020-10-08T00:00:00-04:00",
          "attachments": [],
          "url": "https://www.courtlistener.com/docket/8031037/134/blake-v-city-of-grants-pass/",
          "recap_pdf_url": null,
          "pacer_doc_id": null,
          "description": "Time Schedule Order from USCA for the 9th Circuit, USCA # 20-35881 re Notice of Appeal 133 . DOCKETED CAUSE AND ENTERED APPEARANCES OF COUNSEL. SEND MQ: Yes. The schedule is set as follows: Appellant City of Grants Pass Mediation Questionnaire due on 10/15/2020. Transcript ordered by 11/09/2020. Transcript due 12/07/2020. Appellant City of Grants Pass opening brief due 01/19/2021. Appellees Debra Blake, Gloria Johnson and John Logan answering brief due 02/19/2021. Appellant's optional reply brief is due 21 days after service of the answering brief. 11853198 (Talavera, Ruben) (No Document Attached) (jkm) (Entered: 10/21/2020)"
        },
        {
          "row_number": 79,
          "id": 9068603,
          "entry_number": "29",
          "date_filed": "2019-03-13T00:00:00-04:00",
          "attachments": [],
          "url": "https://www.courtlistener.com/docket/8031037/29/blake-v-city-of-grants-pass/",
          "recap_pdf_url": null,
          "pacer_doc_id": "15107010061",
          "description": "Declaration of Kelly Wessels in support of motion to certify class. Filed by All Plaintiffs. (Related document(s): Motion to certify class 25 .) (Johnson, Edward) (Entered: 03/13/2019)"
        },
        {
          "row_number": 157,
          "id": 9068593,
          "entry_number": null,
          "date_filed": "2019-03-04T00:00:00-05:00",
          "attachments": [],
          "url": "https://www.courtlistener.com",
          "recap_pdf_url": null,
          "pacer_doc_id": null,
          "description": "Scheduling Conference"
        },
        {
          "row_number": 136,
          "id": 9068664,
          "entry_number": "80",
          "date_filed": "2020-02-28T00:00:00-05:00",
          "attachments": [],
          "url": "https://www.courtlistener.com/docket/8031037/80/blake-v-city-of-grants-pass/",
          "recap_pdf_url": null,
          "pacer_doc_id": "15107432418",
          "description": "Joint Motion for Summary Judgment and RESPONSE TO PLTFS' SUMMARY JUDGMENT. Filed by City of Grants Pass. (Hisel, Aaron) (Entered: 02/28/2020)"
        },
        {
          "row_number": 137,
          "id": 9068665,
          "entry_number": "81",
          "date_filed": "2020-02-28T00:00:00-05:00",
          "attachments": [],
          "url": "https://www.courtlistener.com/docket/8031037/81/blake-v-city-of-grants-pass/",
          "recap_pdf_url": null,
          "pacer_doc_id": "15107432421",
          "description": "Declaration of Aaron P. Hisel in support of DEFENDANT'S JOINT MSJ AND RESPONSE TO PLTFS' MSJ. Filed by City of Grants Pass. (Related document(s): Motion for Summary Judgment 80 .) (Attachments: # 1 Exhibit) (Hisel, Aaron) (Entered: 02/28/2020)"
        },
        {
          "row_number": 104,
          "id": 9068631,
          "entry_number": "51",
          "date_filed": "2019-11-14T00:00:00-05:00",
          "attachments": [],
          "url": "https://www.courtlistener.com/docket/8031037/51/blake-v-city-of-grants-pass/",
          "recap_pdf_url": "https://www.courtlistener.com/recap/gov.uscourts.ord.140855/gov.uscourts.ord.140855.51.0.pdf",
          "pacer_doc_id": "15107309196",
          "description": "Answer to 50 Amended Complaint with Jury Demand . Filed by City of Grants Pass. (Warren, Gerald) (Entered: 11/14/2019)"
        },
        {
          "row_number": 0,
          "id": 9068573,
          "entry_number": "1",
          "date_filed": "2018-10-15T00:00:00-04:00",
          "attachments": [
            {
              "recap_id": 109992838,
              "pacer_url": "https://ecf.ord.uscourts.gov/doc1/15106828119?caseid=140855",
              "description": "Civil Cover Sheet",
              "attachment_number": 1
            },
            {
              "recap_id": 109992839,
              "pacer_url": "https://ecf.ord.uscourts.gov/doc1/15106828120?caseid=140855",
              "description": "Proposed Summons",
              "attachment_number": 2
            }
          ],
          "url": "https://www.courtlistener.com/docket/8031037/1/blake-v-city-of-grants-pass/",
          "recap_pdf_url": "https://www.courtlistener.com/recap/gov.uscourts.ord.140855/gov.uscourts.ord.140855.1.0_2.pdf",
          "pacer_doc_id": "15106828118",
          "description": "Complaint. Filing fee in the amount of $400 collected. Agency Tracking ID: 0979-5594026 Jury Trial Requested: No. Filed by Debra Blake against City of Grants Pass (Attachments: # 1 Civil Cover Sheet, # 2 Proposed Summons). (Johnson, Edward) (Entered: 10/15/2018)"
        },
        {
          "row_number": 145,
          "id": 9068674,
          "entry_number": "89",
          "date_filed": "2020-03-27T00:00:00-04:00",
          "attachments": [],
          "url": "https://www.courtlistener.com/docket/8031037/89/blake-v-city-of-grants-pass/",
          "recap_pdf_url": null,
          "pacer_doc_id": "15107467176",
          "description": "Declaration of Kelly Wessels . Filed by All Plaintiffs. (Related document(s): Reply to Motion 88 .) (Attachments: # 1 Exhibit) (Johnson, Edward) (Entered: 03/27/2020)"
        },
        {
          "row_number": 150,
          "id": 9068678,
          "entry_number": "93",
          "date_filed": "2020-03-27T00:00:00-04:00",
          "attachments": [],
          "url": "https://www.courtlistener.com/docket/8031037/93/blake-v-city-of-grants-pass/",
          "recap_pdf_url": null,
          "pacer_doc_id": "15107467556",
          "description": "Motion to Appear as Amicus Curiae . Filed by National Law Center on Homelessness & Poverty. (Creighton, Beth) Corrected Docket Text on 3/30/2020 (joha). (Entered: 03/27/2020)"
        },
        {
          "row_number": 154,
          "id": 9068682,
          "entry_number": "97",
          "date_filed": "2020-03-27T00:00:00-04:00",
          "attachments": [],
          "url": "https://www.courtlistener.com/docket/8031037/97/blake-v-city-of-grants-pass/",
          "recap_pdf_url": null,
          "pacer_doc_id": "15107467589",
          "description": "Motion for Leave to Appear Pro Hac Vice. Pro Hac Vice admission requested by attorney(s) Tharuni A. Jayaraman Filing fee in the amount of $300 collected; Agency Tracking ID: AORDC-6461510. Filed by National Law Center on Homelessness & Poverty. (Jayaraman, Tharuni) (Entered: 03/27/2020)"
        },
        {
          "row_number": 155,
          "id": 9068683,
          "entry_number": "98",
          "date_filed": "2020-03-27T00:00:00-04:00",
          "attachments": [],
          "url": "https://www.courtlistener.com/docket/8031037/98/blake-v-city-of-grants-pass/",
          "recap_pdf_url": null,
          "pacer_doc_id": "15107467592",
          "description": "Motion for Leave to Appear Pro Hac Vice. Pro Hac Vice admission requested by attorney(s) Tristia M. Bauman Filing fee in the amount of $300 collected; Agency Tracking ID: AORDC-6461519. Filed by National Law Center on Homelessness & Poverty. (Bauman, Tristia) (Entered: 03/27/2020)"
        },
        {
          "row_number": 172,
          "id": 9068687,
          "entry_number": null,
          "date_filed": "2020-03-30T00:00:00-04:00",
          "attachments": [],
          "url": "https://www.courtlistener.com",
          "recap_pdf_url": null,
          "pacer_doc_id": null,
          "description": "Leave to Appear Pro Hac Vice"
        },
        {
          "row_number": 174,
          "id": 9068689,
          "entry_number": null,
          "date_filed": "2020-03-30T00:00:00-04:00",
          "attachments": [],
          "url": "https://www.courtlistener.com",
          "recap_pdf_url": null,
          "pacer_doc_id": null,
          "description": "Clerk's Review of Motion for Leave to Appear Pro Hac Vice. Pro Hac Vice admission requested by attorney(s) Tharuni A. Jayaraman Filing fee in the amount of $300 collected; Agency Tracking ID: AORDC-6461510 97 : Reviewed and Ready for Ruling. (jkm)"
        },
        {
          "row_number": 176,
          "id": 9068691,
          "entry_number": null,
          "date_filed": "2020-03-30T00:00:00-04:00",
          "attachments": [],
          "url": "https://www.courtlistener.com",
          "recap_pdf_url": null,
          "pacer_doc_id": null,
          "description": "Clerk's Review of Pro Hac Vice Motion"
        },
        {
          "row_number": 3,
          "id": 9068693,
          "entry_number": "101",
          "date_filed": "2020-03-30T00:00:00-04:00",
          "attachments": [],
          "url": "https://www.courtlistener.com/docket/8031037/101/blake-v-city-of-grants-pass/",
          "recap_pdf_url": null,
          "pacer_doc_id": null,
          "description": "ORDER: Granting Motion for Leave to Appear Pro Hac Vice 97 . Ordered by Magistrate Judge Mark D. Clarke. (jkm) (Entered: 03/30/2020)"
        },
        {
          "row_number": 6,
          "id": 9068696,
          "entry_number": "104",
          "date_filed": "2020-03-30T00:00:00-04:00",
          "attachments": [],
          "url": "https://www.courtlistener.com/docket/8031037/104/blake-v-city-of-grants-pass/",
          "recap_pdf_url": null,
          "pacer_doc_id": null,
          "description": "ORDER: Granting Motion for Leave 99 to File an Amicus Brief. Ordered by Magistrate Judge Mark D. Clarke. (rsm) (Entered: 03/30/2020)"
        },
        {
          "row_number": 9,
          "id": 9068700,
          "entry_number": "107",
          "date_filed": "2020-04-24T00:00:00-04:00",
          "attachments": [],
          "url": "https://www.courtlistener.com/docket/8031037/107/blake-v-city-of-grants-pass/",
          "recap_pdf_url": null,
          "pacer_doc_id": "15107502733",
          "description": "Reply Defendant's Reply to Plaintiff's Response to Defendant's Motion for Summary Judgment. Filed by City of Grants Pass. (Related document(s): Reply to Motion 88 .) (Hisel, Aaron) (Entered: 04/24/2020)"
        },
        {
          "row_number": 178,
          "id": 9068704,
          "entry_number": null,
          "date_filed": "2020-06-02T00:00:00-04:00",
          "attachments": [],
          "url": "https://www.courtlistener.com",
          "recap_pdf_url": null,
          "pacer_doc_id": null,
          "description": "Motion Hearing Held"
        },
        {
          "row_number": 17,
          "id": 9068708,
          "entry_number": "114",
          "date_filed": "2020-08-26T00:00:00-04:00",
          "attachments": [],
          "url": "https://www.courtlistener.com/docket/8031037/114/blake-v-city-of-grants-pass/",
          "recap_pdf_url": "https://www.courtlistener.com/recap/gov.uscourts.ord.140855/gov.uscourts.ord.140855.114.0.pdf",
          "pacer_doc_id": "15107661132",
          "description": "JUDGMENT: Pursuant to the Courts Opinion and Order 111 dated July 22, 2020. Please access entire text by document number hyperlink. Signed on 08/26/2020 by Magistrate Judge Mark D. Clarke. (rsm) (Entered: 08/26/2020)"
        },
        {
          "row_number": 179,
          "id": 9068710,
          "entry_number": null,
          "date_filed": "2020-08-27T00:00:00-04:00",
          "attachments": [],
          "url": "https://www.courtlistener.com",
          "recap_pdf_url": null,
          "pacer_doc_id": null,
          "description": "USCA Case Number"
        },
        {
          "row_number": 21,
          "id": 9068714,
          "entry_number": "118",
          "date_filed": "2020-09-09T00:00:00-04:00",
          "attachments": [],
          "url": "https://www.courtlistener.com/docket/8031037/118/blake-v-city-of-grants-pass/",
          "recap_pdf_url": null,
          "pacer_doc_id": "15107678548",
          "description": "Motion for Attorney Fees . Filed by All Plaintiffs. (Johnson, Edward) (Entered: 09/09/2020)"
        },
        {
          "row_number": 26,
          "id": 9068718,
          "entry_number": "122",
          "date_filed": "2020-09-09T00:00:00-04:00",
          "attachments": [],
          "url": "https://www.courtlistener.com/docket/8031037/122/blake-v-city-of-grants-pass/",
          "recap_pdf_url": null,
          "pacer_doc_id": "15107678590",
          "description": "Declaration of Jennifer Logan . Filed by All Plaintiffs. (Related document(s): Motion for Attorney Fees 118 .) (Attachments: # 1 Exhibit) (Johnson, Edward) (Entered: 09/09/2020)"
        },
        {
          "row_number": 30,
          "id": 9068722,
          "entry_number": "126",
          "date_filed": "2020-09-22T00:00:00-04:00",
          "attachments": [],
          "url": "https://www.courtlistener.com/docket/8031037/126/blake-v-city-of-grants-pass/",
          "recap_pdf_url": null,
          "pacer_doc_id": "15107698549",
          "description": "OFFICIAL COURT TRANSCRIPT OF PROCEEDINGS FILED Motion Hearing held on 6/2/2020 before Judge Mark D. Clarke, Court Reporter Ryan White, telephone number 503-326-8184 or ryan_white@ord.uscourts.gov. Transcript may be viewed at Court's public terminal or purchased from the Court Reporter/Transcriber before the deadline for Release of Transcript Restriction. Afterwards it may be obtained through PACER. See Policy at ord.uscourts.gov. Notice of Intent to Redact Transcript is due by 9/29/2020. Redaction Request due 10/13/2020. Redacted Transcript Deadline set for 10/23/2020. Release of Transcript Restriction set for 12/21/2020. (White, Ryan) (Entered: 09/22/2020)"
        },
        {
          "row_number": 32,
          "id": 9068725,
          "entry_number": "128",
          "date_filed": "2020-09-28T00:00:00-04:00",
          "attachments": [],
          "url": "https://www.courtlistener.com/docket/8031037/128/blake-v-city-of-grants-pass/",
          "recap_pdf_url": null,
          "pacer_doc_id": "15107705490",
          "description": "OFFICIAL COURT TRANSCRIPT OF PROCEEDINGS FILED Motion Hearing held on 07/09/2019 before Judge Magistrate Judge Mark D. Clarke, Court Reporter Deana R. Mead. Transcriber Deana R. Mead. Transcript may be viewed at Court's public terminal or purchased from the Court Reporter/Transcriber before the deadline for Release of Transcript Restriction. Afterwards it may be obtained through PACER. See Policy at ord.uscourts.gov. Notice of Intent to Redact Transcript is due by 10/5/2020. Redaction Request due 10/19/2020. Redacted Transcript Deadline set for 10/29/2020. Release of Transcript Restriction set for 12/28/2020. (rsm) (Entered: 09/28/2020)"
        },
        {
          "row_number": 37,
          "id": 9068729,
          "entry_number": "132",
          "date_filed": "2020-10-05T00:00:00-04:00",
          "attachments": [],
          "url": "https://www.courtlistener.com/docket/8031037/132/blake-v-city-of-grants-pass/",
          "recap_pdf_url": "https://www.courtlistener.com/recap/gov.uscourts.ord.140855/gov.uscourts.ord.140855.132.0.pdf",
          "pacer_doc_id": "15107714722",
          "description": "SUPPLEMENTAL JUDGMENT:. Please access entire text by document number hyperlink. Signed on 10/05/2020 by Magistrate Judge Mark D. Clarke. (rsm) (Entered: 10/05/2020)"
        },
        {
          "row_number": 183,
          "id": 9068732,
          "entry_number": null,
          "date_filed": "2020-10-08T00:00:00-04:00",
          "attachments": [],
          "url": "https://www.courtlistener.com",
          "recap_pdf_url": null,
          "pacer_doc_id": null,
          "description": "USCA Case Number and Notice confirming Docketing Record on Appeal re (Amended) Notice of Appeal 133 . Case Appealed to 9TH Circuit Court of Appeals Case Number 20-35881 assigned. (jkm) Modified on 10/21/2020 (jkm). To reflect same date as 9th Circuit Court filing. No New Nef."
        },
        {
          "row_number": 40,
          "id": 9068736,
          "entry_number": "135",
          "date_filed": "2021-07-16T00:00:00-04:00",
          "attachments": [],
          "url": "https://www.courtlistener.com/docket/8031037/135/blake-v-city-of-grants-pass/",
          "recap_pdf_url": "https://www.courtlistener.com/recap/gov.uscourts.ord.140855/gov.uscourts.ord.140855.135.0.pdf",
          "pacer_doc_id": "15108082034",
          "description": "Notice of Change of Contact Information Filed by City of Grants Pass. (Hisel, Aaron) (Entered: 07/16/2021)"
        },
        {
          "row_number": 42,
          "id": 9068738,
          "entry_number": "137",
          "date_filed": "2021-09-23T00:00:00-04:00",
          "attachments": [],
          "url": "https://www.courtlistener.com/docket/8031037/137/blake-v-city-of-grants-pass/",
          "recap_pdf_url": "https://www.courtlistener.com/recap/gov.uscourts.ord.140855/gov.uscourts.ord.140855.137.0.pdf",
          "pacer_doc_id": "15108170457",
          "description": "Notice of Attorney Withdrawal: of Tharuni A. Jayaraman Filed by National Law Center on Homelessness & Poverty. (Jayaraman, Tharuni) (Entered: 09/23/2021)"
        },
        {
          "row_number": 43,
          "id": 9068739,
          "entry_number": "138",
          "date_filed": "2022-09-28T00:00:00-04:00",
          "attachments": [],
          "url": "https://www.courtlistener.com/docket/8031037/138/blake-v-city-of-grants-pass/",
          "recap_pdf_url": "https://www.courtlistener.com/recap/gov.uscourts.ord.140855/gov.uscourts.ord.140855.138.0.pdf",
          "pacer_doc_id": "15108593514",
          "description": "USCA Opinion for the 9th Circuit, USCA #20-35752, 20-35881, re Notice of Appeal 133, Notice of Appeal 115 The decision is: AFFIRMED in part, VACATED in part, and REMANDED. (jkm) (Entered: 09/28/2022)"
        },
        {
          "row_number": 186,
          "id": 9068741,
          "entry_number": null,
          "date_filed": "2022-10-04T00:00:00-04:00",
          "attachments": [],
          "url": "https://www.courtlistener.com",
          "recap_pdf_url": null,
          "pacer_doc_id": null,
          "description": "1 - Scheduling"
        },
        {
          "row_number": 46,
          "id": 9068742,
          "entry_number": "140",
          "date_filed": "2022-10-12T00:00:00-04:00",
          "attachments": [],
          "url": "https://www.courtlistener.com/docket/8031037/140/blake-v-city-of-grants-pass/",
          "recap_pdf_url": null,
          "pacer_doc_id": null,
          "description": "MINUTES of Proceedings: Telephonic Status Conference held. A Joint Status Report is due by 1/17/2023. Edward Johnson and Walter Fonseca present as counsel for plaintiff(s). Aaron Hisel present as counsel for defendant(s). Court Reporter: Hearing was not recorded. Ordered by Magistrate Judge Mark D. Clarke. (rsm) (Entered: 10/12/2022)"
        },
        {
          "row_number": 47,
          "id": 9068744,
          "entry_number": "141",
          "date_filed": "2023-01-17T00:00:00-05:00",
          "attachments": [],
          "url": "https://www.courtlistener.com/docket/8031037/141/blake-v-city-of-grants-pass/",
          "recap_pdf_url": "https://www.courtlistener.com/recap/gov.uscourts.ord.140855/gov.uscourts.ord.140855.141.0.pdf",
          "pacer_doc_id": "15108711890",
          "description": "Joint Status Report . Filed by City of Grants Pass. (Hisel, Aaron) (Entered: 01/17/2023)"
        },
        {
          "row_number": 188,
          "id": 9068746,
          "entry_number": null,
          "date_filed": "2023-02-02T00:00:00-05:00",
          "attachments": [],
          "url": "https://www.courtlistener.com",
          "recap_pdf_url": null,
          "pacer_doc_id": null,
          "description": "1 - Scheduling"
        },
        {
          "row_number": 49,
          "id": 9068747,
          "entry_number": "143",
          "date_filed": "2023-04-12T00:00:00-04:00",
          "attachments": [],
          "url": "https://www.courtlistener.com/docket/8031037/143/blake-v-city-of-grants-pass/",
          "recap_pdf_url": "https://www.courtlistener.com/recap/gov.uscourts.ord.140855/gov.uscourts.ord.140855.143.0.pdf",
