{
  "case_id": 10517,
  "fetched_at": "2025-10-20T22:38:13.159242",
  "case_data": {
    "attorney_orgs": [],
    "available_documents": [
      "Trial Court Docket",
      "Complaint (any)",
      "Monetary Relief",
      "Any published opinion"
    ],
    "case_defendants": [
      {
        "defendant_level": null,
        "institution": "Cook County Jail",
        "institution_alt_state": null,
        "institution_city": "",
        "institution_county": "Cook",
        "name": "Cook County Department of Corrections",
        "defendant_level_other": "",
        "is_active": true
      },
      {
        "defendant_level": null,
        "institution": "",
        "institution_alt_state": null,
        "institution_city": "",
        "institution_county": "Cook",
        "name": "Cook County Sheriff",
        "defendant_level_other": "",
        "is_active": true
      }
    ],
    "case_ongoing": "No",
    "case_status": "Coding Complete",
    "case_types": [
      "Jail Conditions"
    ],
    "cause_other": "",
    "causes": [
      "42 U.S.C. ยง 1983"
    ],
    "class_action_granted": "Granted",
    "class_action_sought": "Yes",
    "closing_year": 2012,
    "constitutional_clause": [
      {
        "value": "Due Process"
      },
      {
        "value": "Unreasonable search and seizure"
      },
      {
        "value": "Equal Protection"
      }
    ],
    "content_of_injunction": [],
    "court": "Northern District of Illinois",
    "custom_issues": [],
    "defendant_payment": "3,400,000",
    "defendant_type": [],
    "docket_status": "Complete as of retrieval date",
    "facility_type": [
      {
        "value": "Government-run"
      }
    ],
    "filing_date": "2004-02-11",
    "filing_year": 2004,
    "id": 10517,
    "injunction_duration": "",
    "issues": [
      "General/Misc.: Search policies",
      "Jails, Prisons, Detention Centers, and Other Institutions: Strip search policy (facilities)",
      "Affected Sex/Gender(s): Male"
    ],
    "last_checked_date": "2016-04-07T00:00:00-04:00",
    "main_docket": {
      "id": 32508,
      "docket_entries": [
        {
          "row_number": 111,
          "id": 8879173,
          "entry_number": "2",
          "date_filed": "2004-02-23T00:00:00-05:00",
          "attachments": [],
          "url": "https://www.courtlistener.com/docket/4251255/2/bullock-v-sheahan/",
          "recap_pdf_url": "https://www.courtlistener.com/recap/gov.uscourts.ilnd.145151/gov.uscourts.ilnd.145151.2.0.pdf",
          "pacer_doc_id": "06703054839",
          "description": "AMENDED COMPLAINT [1-1] by plaintiff ; Notice (las) (Entered: 02/24/2004)"
        },
        {
          "row_number": 444,
          "id": 8879176,
          "entry_number": "5",
          "date_filed": "2004-03-10T00:00:00-05:00",
          "attachments": [],
          "url": "https://www.courtlistener.com/docket/4251255/5/bullock-v-sheahan/",
          "recap_pdf_url": null,
          "pacer_doc_id": "06703012035",
          "description": "MINUTE ORDER of 3/10/04 by Hon. Elaine E. Bucklo : Defendant, Cook County's motion for extension of time until 4/7/04 to answer or otherwise plead to amended complaint is granted [4-1]. Mailed notice (las) (Entered: 03/11/2004)"
        },
        {
          "row_number": 463,
          "id": 8879177,
          "entry_number": "6",
          "date_filed": "2004-04-07T00:00:00-04:00",
          "attachments": [],
          "url": "https://www.courtlistener.com/docket/4251255/6/bullock-v-sheahan/",
          "recap_pdf_url": null,
          "pacer_doc_id": "0670329058",
          "description": "MOTION by defendant for enlargement of time to file responsive pleading ; Notice (las) (Entered: 04/21/2004)"
        },
        {
          "row_number": 23,
          "id": 8879180,
          "entry_number": "12",
          "date_filed": "2004-05-14T00:00:00-04:00",
          "attachments": [],
          "url": "https://www.courtlistener.com/docket/4251255/12/bullock-v-sheahan/",
          "recap_pdf_url": null,
          "pacer_doc_id": "06702625959",
          "description": "MOTION by plaintiffs for referral of discovery matters to the assigned magistrate ; Notice (rmm) Modified on 8/21/2014 (ym, ). (Entered: 05/24/2004)"
        },
        {
          "row_number": 1,
          "id": 8879183,
          "entry_number": "10",
          "date_filed": "2004-05-19T00:00:00-04:00",
          "attachments": [],
          "url": "https://www.courtlistener.com/docket/4251255/10/bullock-v-sheahan/",
          "recap_pdf_url": null,
          "pacer_doc_id": "06702623651",
          "description": "MEMORANDUM by plaintiffs in support of their motion for class certification; Notice. (hp) Modified on 05/21/2004 (Entered: 05/21/2004)"
        },
        {
          "row_number": 496,
          "id": 8879185,
          "entry_number": "9",
          "date_filed": "2004-05-21T00:00:00-04:00",
          "attachments": [],
          "url": "https://www.courtlistener.com/docket/4251255/9/bullock-v-sheahan/",
          "recap_pdf_url": null,
          "pacer_doc_id": "06702625925",
          "description": "REFERRAL ORDER: Case referred to Hon. Sidney I. Schenkier for discovery supervision Mailed notice. (mpj) (Entered: 05/21/2004)"
        },
        {
          "row_number": 78,
          "id": 8879188,
          "entry_number": "17",
          "date_filed": "2004-06-17T00:00:00-04:00",
          "attachments": [],
          "url": "https://www.courtlistener.com/docket/4251255/17/bullock-v-sheahan/",
          "recap_pdf_url": null,
          "pacer_doc_id": "0670254886",
          "description": "MOTION by defendant Michael Sheahan for extension of time to respond to plaintiff's motion for class certification and plaintiff's written discovery requests ; Notice (las) (Entered: 06/23/2004)"
        },
        {
          "row_number": 67,
          "id": 8879189,
          "entry_number": "16",
          "date_filed": "2004-06-18T00:00:00-04:00",
          "attachments": [],
          "url": "https://www.courtlistener.com/docket/4251255/16/bullock-v-sheahan/",
          "recap_pdf_url": null,
          "pacer_doc_id": "06702594658",
          "description": "RESPONSE by plaintiffs to defendant's motion for enlargement of time to respond to plaintiff's written discovery requests [14-1] and motion to certify class [13-1]; Notice (las) . Modified on 8/21/2014 (ym, ). (Entered: 06/21/2004)"
        },
        {
          "row_number": 89,
          "id": 8879190,
          "entry_number": "18",
          "date_filed": "2004-06-22T00:00:00-04:00",
          "attachments": [],
          "url": "https://www.courtlistener.com/docket/4251255/18/bullock-v-sheahan/",
          "recap_pdf_url": null,
          "pacer_doc_id": "06702594504",
          "description": "MINUTE ORDER of 6/22/04 by Hon. Elaine E. Bucklo : Defendant's motion for enlargement of time until 7/6/04 [17-1] to file his response to the motion for class certification [13-1] and to file formal responses to plaintiff's written discovery requests is granted. Accordingly, reply is extended to 7/16/04. Ruling will be made by mail by 8/20/04. Mailed notice (las) (Entered: 06/23/2004)"
        },
        {
          "row_number": 510,
          "id": 8879192,
          "entry_number": null,
          "date_filed": "2004-06-25T00:00:00-04:00",
          "attachments": [],
          "url": "https://www.courtlistener.com",
          "recap_pdf_url": null,
          "pacer_doc_id": null,
          "description": "SCHEDULE set on 6/25/04 by Hon. Sidney I. Schenkier : Status hearing reset to 8:30 7/15/04 . The status hearing set for 7/1/04 is stricken. Mailed notice (mmm)"
        },
        {
          "row_number": 123,
          "id": 8879195,
          "entry_number": "21",
          "date_filed": "2004-07-01T00:00:00-04:00",
          "attachments": [],
          "url": "https://www.courtlistener.com/docket/4251255/21/bullock-v-sheahan/",
          "recap_pdf_url": null,
          "pacer_doc_id": "06702573513",
          "description": "RESPONSE by plaintiff to defendant's motion for a rule 16 pretrial conference [20-1] (las) (Entered: 07/02/2004)"
        },
        {
          "row_number": 511,
          "id": 8879202,
          "entry_number": null,
          "date_filed": "2004-07-12T00:00:00-04:00",
          "attachments": [],
          "url": "https://www.courtlistener.com",
          "recap_pdf_url": null,
          "pacer_doc_id": null,
          "description": "SCHEDULE set on 7/12/04 by Hon. Sidney I. Schenkier : Argument on motion for Rule 16 pretrial conference is reset for 9:00 7/15/04. The hearing set for 7/16/04 is stricken. Mailed notice (mmm)"
        },
        {
          "row_number": 256,
          "id": 8879208,
          "entry_number": "33",
          "date_filed": "2004-07-30T00:00:00-04:00",
          "attachments": [],
          "url": "https://www.courtlistener.com/docket/4251255/33/bullock-v-sheahan/",
          "recap_pdf_url": null,
          "pacer_doc_id": "0670245930",
          "description": "MOTION by defendant Michael Sheahan for leave to file surreply to plaintiffs' reply memorandum in support of the motion for class certification ; Notice (las) (Entered: 08/20/2004)"
        },
        {
          "row_number": 267,
          "id": 8879209,
          "entry_number": "34",
          "date_filed": "2004-07-30T00:00:00-04:00",
          "attachments": [],
          "url": "https://www.courtlistener.com/docket/4251255/34/bullock-v-sheahan/",
          "recap_pdf_url": null,
          "pacer_doc_id": "06702585984",
          "description": "SURREPLY by defendants to plaintiffs' reply memorandum on the issue of class certification (las) (Entered: 08/20/2004)"
        },
        {
          "row_number": 512,
          "id": 8879210,
          "entry_number": null,
          "date_filed": "2004-08-17T00:00:00-04:00",
          "attachments": [],
          "url": "https://www.courtlistener.com",
          "recap_pdf_url": null,
          "pacer_doc_id": null,
          "description": "SCHEDULE set on 8/17/04 by Hon. Sidney I. Schenkier : Status hearing held and continued to 9:00 9/23/04 . The plaintiff's oral motion to extend its time to respond to defendant's outstanding document request is granted without objection. The plaintiff is to respond by 8/24/04. mailed notice (mmm)"
        },
        {
          "row_number": 300,
          "id": 8879213,
          "entry_number": "37",
          "date_filed": "2004-09-23T00:00:00-04:00",
          "attachments": [],
          "url": "https://www.courtlistener.com/docket/4251255/37/bullock-v-sheahan/",
          "recap_pdf_url": null,
          "pacer_doc_id": "0670226760",
          "description": "MINUTE ORDER of 9/23/04 by Hon. Sidney I. Schenkier : Status hearing held and continued to 10/27/04 at 9:00 a.m. Plaintiff's motion to compel is denied as moot in light of the agreement of the parties that the inspection of the facilities outlined in paragraphs 1-3, and any 3 of the facilities outlines in paragraphs 4-5 of the plaintiffs' notice to inspect is to take place on 10/2/03 at a mutually agreebale time [36-1]. Mailed notice (las) (Entered: 09/27/2004)"
        },
        {
          "row_number": 345,
          "id": 8879217,
          "entry_number": "41",
          "date_filed": "2004-11-18T00:00:00-05:00",
          "attachments": [],
          "url": "https://www.courtlistener.com/docket/4251255/41/bullock-v-sheahan/",
          "recap_pdf_url": null,
          "pacer_doc_id": "06702534225",
          "description": "AGREED MOTION by defendants for enlargement of time to complete discovery and to continue trial setting ; Notice (las) Modified on 9/4/2014 (ym, ). (Entered: 12/01/2004)"
        },
        {
          "row_number": 455,
          "id": 8879230,
          "entry_number": "52",
          "date_filed": "2005-03-11T00:00:00-05:00",
          "attachments": [],
          "url": "https://www.courtlistener.com/docket/4251255/52/bullock-v-sheahan/",
          "recap_pdf_url": null,
          "pacer_doc_id": "0670468524",
          "description": "MOTION by Plaintiffs to approve notices to class (gma, ) (Entered: 03/11/2005)"
        },
        {
          "row_number": 457,
          "id": 8879232,
          "entry_number": "54",
          "date_filed": "2005-03-16T00:00:00-05:00",
          "attachments": [],
          "url": "https://www.courtlistener.com/docket/4251255/54/bullock-v-sheahan/",
          "recap_pdf_url": null,
          "pacer_doc_id": "067054105",
          "description": "ATTORNEY Appearance for Defendant Michael Sheahan by Craig Michael Sandberg; Notice. (ar, ) (Entered: 03/21/2005)"
        },
        {
          "row_number": 459,
          "id": 8879234,
          "entry_number": "56",
          "date_filed": "2005-03-22T00:00:00-05:00",
          "attachments": [],
          "url": "https://www.courtlistener.com/docket/4251255/56/bullock-v-sheahan/",
          "recap_pdf_url": null,
          "pacer_doc_id": "0670145605",
          "description": "MINUTE entry before Judge Elaine E. Bucklo : Status hearing set for 9/9/2005 at 10:00 AM. No notice. Modified on 4/27/2006 (smm, ). (Entered: 03/22/2005)"
        },
        {
          "row_number": 464,
          "id": 8879238,
          "entry_number": "60",
          "date_filed": "2005-04-14T00:00:00-04:00",
          "attachments": [],
          "url": "https://www.courtlistener.com/docket/4251255/60/bullock-v-sheahan/",
          "recap_pdf_url": null,
          "pacer_doc_id": "06701623391",
          "description": "ATTORNEY Appearance for Plaintiffs, individually and on behalf of a class, by Robert Hugh Farley, Jr. (ar, ) (Entered: 04/20/2005)"
        },
        {
          "row_number": 466,
          "id": 8879240,
          "entry_number": "62",
          "date_filed": "2005-04-22T00:00:00-04:00",
          "attachments": [],
          "url": "https://www.courtlistener.com/docket/4251255/62/bullock-v-sheahan/",
          "recap_pdf_url": null,
          "pacer_doc_id": "06701623449",
          "description": "NOTICE of Motion by Thomas Gerard Morrissey for presentment of motion for leave of court to take in excess of ten depositions 61 before Honorable Sidney I. Schenkier on 4/27/2005 at 08:30 AM. (rbf, ) (Entered: 04/22/2005)"
        },
        {
          "row_number": 467,
          "id": 8879242,
          "entry_number": "63",
          "date_filed": "2005-04-25T00:00:00-04:00",
          "attachments": [],
          "url": "https://www.courtlistener.com/docket/4251255/63/bullock-v-sheahan/",
          "recap_pdf_url": null,
          "pacer_doc_id": "06703370871",
          "description": "MINUTE entry before Judge Elaine E. Bucklo : Pursuant to plaintiffs' request. their motion to approve notices 52 is entered and continued to 5/6/2005 at 09:30 AM. No notice (mpj, ) (Entered: 04/25/2005)"
        },
        {
          "row_number": 478,
          "id": 8879250,
          "entry_number": "73",
          "date_filed": "2005-06-15T00:00:00-04:00",
          "attachments": [],
          "url": "https://www.courtlistener.com/docket/4251255/73/bullock-v-sheahan/",
          "recap_pdf_url": null,
          "pacer_doc_id": "0670853811",
          "description": "PROPOSED Notice by Michael Sheahan of class action; Notice. (lcw, ) (Entered: 06/20/2005)"
        },
        {
          "row_number": 484,
          "id": 8879257,
          "entry_number": "79",
          "date_filed": "2005-06-28T00:00:00-04:00",
          "attachments": [],
          "url": "https://www.courtlistener.com/docket/4251255/79/bullock-v-sheahan/",
          "recap_pdf_url": null,
          "pacer_doc_id": "06703532079",
          "description": "MINUTE entry before Judge Sidney I. Schenkier : Plaintiff's motion to compel defendants to respond 67 is withdrawn based on agreement of the parties. Plaintiff's motion to compel answer to deposition 76 is withdrawn based on agreement of the parties., Magistrate Judge Status hearing held and continued to 7/14/2005 at 09:00 AM. Mailed notice (mmm, ) (Entered: 06/28/2005)"
        },
        {
          "row_number": 494,
          "id": 8879264,
          "entry_number": "88",
          "date_filed": "2005-08-25T00:00:00-04:00",
          "attachments": [],
          "url": "https://www.courtlistener.com/docket/4251255/88/bullock-v-sheahan/",
          "recap_pdf_url": null,
          "pacer_doc_id": "06703550040",
          "description": "REQUEST for exclusion from class action by David Lozano. (ar, ) (Entered: 08/29/2005)"
        },
        {
          "row_number": 38,
          "id": 8879311,
          "entry_number": "133",
          "date_filed": "2006-02-03T00:00:00-05:00",
          "attachments": null,
          "url": "https://www.courtlistener.com/docket/4251255/133/bullock-v-sheahan/",
          "recap_pdf_url": null,
          "pacer_doc_id": "06703165269",
          "description": "Motion for leave to file second amended complaint;motion for preliminary injunction;motion for a referral of the preliminary injunction hearing to the assigned magistrate NOTICE of Motion by Thomas Gerard Morrissey for presentment of motion to amend/correct 130, motion for miscellaneous relief 132, motion for preliminary injunction 131 before Honorable Elaine E. Bucklo on 2/10/2006 at 09:30 AM. (Morrissey, Thomas) (Entered: 02/03/2006)"
        },
        {
          "row_number": 55,
          "id": 8879327,
          "entry_number": "149",
          "date_filed": "2006-03-09T00:00:00-05:00",
          "attachments": null,
          "url": "https://www.courtlistener.com/docket/4251255/149/bullock-v-sheahan/",
          "recap_pdf_url": null,
          "pacer_doc_id": "06702658910",
          "description": "MINUTE entry before Judge Sidney I. Schenkier : Motion hearing held. Plaintiff's motion to compel Defendant To Provide A Formal Response To Plaintiffs' Production Request 145 is denied for the reasons stated on the record in open court. The Court gives the plaintiffs leave to file a Request to Admit which is to be limited to a specific timeframe by 3/10/06. The defendants are to answer the Request to Admit by 3/17/06. Mailed notice (mmm, ) (Entered: 03/09/2006)"
        },
        {
          "row_number": 135,
          "id": 8879398,
          "entry_number": "220",
          "date_filed": "2006-10-24T00:00:00-04:00",
          "attachments": null,
          "url": "https://www.courtlistener.com/docket/4251255/220/bullock-v-sheahan/",
          "recap_pdf_url": null,
          "pacer_doc_id": "06701530971",
          "description": "MINUTE entry before Judge Sidney I. Schenkier : Motion hearing held. MOTION by Plaintiffs Quentin Bullock, Jack Reid to compel Discovery 218 is granted. Defendant is directed to produce the documents as outlined in open court by 11/3/2006. No further discovery will be permitted based on those documents. By 11/3/2006, defendants shall deliver to plaintiffs' counsel a declaration by a knowledgeable person attesting that there are no documents showing software specifications for the replacement for the CIMIS system that is currently under consideration. Status hearing date of 10/31/2006 is reset for 11/30/2006 at 09:00 AM. Advised in open court (jms, ) (Entered: 10/24/2006)"
        },
        {
          "row_number": 168,
          "id": 8879428,
          "entry_number": "250",
          "date_filed": "2007-02-06T00:00:00-05:00",
          "attachments": null,
          "url": "https://www.courtlistener.com/docket/4251255/250/bullock-v-sheahan/",
          "recap_pdf_url": null,
          "pacer_doc_id": "06701775833",
          "description": "(FILED on the incorrect docket. The case title does not match the case number.) (Quinn, Bernard). (Entered: 02/06/2007)"
        },
        {
          "row_number": 328,
          "id": 8879574,
          "entry_number": "395",
          "date_filed": "2008-10-03T00:00:00-04:00",
          "attachments": null,
          "url": "https://www.courtlistener.com/docket/4251255/395/bullock-v-sheahan/",
          "recap_pdf_url": null,
          "pacer_doc_id": "06705577661",
          "description": "NOTICE of Motion by Bernard E.J. Quinn for presentment of motion for miscellaneous relief 394 before Honorable Elaine E. Bucklo on 10/9/2008 at 09:30 AM. (Quinn, Bernard) (Entered: 10/03/2008)"
        },
        {
          "row_number": 364,
          "id": 8879605,
          "entry_number": "427",
          "date_filed": "2009-02-23T00:00:00-05:00",
          "attachments": null,
          "url": "https://www.courtlistener.com/docket/4251255/427/bullock-v-sheahan/",
          "recap_pdf_url": null,
          "pacer_doc_id": "06706113049",
          "description": "MINUTE entry before the Honorable Elaine E. Bucklo: Plaintiffs' motion for interim fees 419 is denied. Defendants' motion for leave to supplement the record with newly discovered evidence 421 is denied. This Court will issue an opinion on the motion for reconsideration by the end of this week. No appearance is necessary on 2/24/2009. Mailed notice by judge's staff. (srb,) (Entered: 02/23/2009)"
        },
        {
          "row_number": 452,
          "id": 10204015,
          "entry_number": "506",
          "date_filed": "2012-04-20T00:00:00-04:00",
          "attachments": null,
          "url": "https://www.courtlistener.com/docket/4251255/506/bullock-v-sheahan/",
          "recap_pdf_url": null,
          "pacer_doc_id": "067010836439",
          "description": "MINUTE entry before Honorable Sidney I. Schenkier: The case having been reassigned to this Court on consent (doc. # 505 ), the referral is hereby terminated. Mailed notice. (jj, ) (Entered: 04/20/2012)"
        },
        {
          "row_number": 100,
          "id": 8879194,
          "entry_number": "19",
          "date_filed": "2004-07-01T00:00:00-04:00",
          "attachments": [],
          "url": "https://www.courtlistener.com/docket/4251255/19/bullock-v-sheahan/",
          "recap_pdf_url": null,
          "pacer_doc_id": "06702573435",
          "description": "REFERRAL ORDER: Case referred to Hon. Sidney I. Schenkier for discovery motion Mailed notice. (mpj) (Entered: 07/01/2004)"
        },
        {
          "row_number": 456,
          "id": 8879231,
          "entry_number": "53",
          "date_filed": "2005-03-11T00:00:00-05:00",
          "attachments": [],
          "url": "https://www.courtlistener.com/docket/4251255/53/bullock-v-sheahan/",
          "recap_pdf_url": null,
          "pacer_doc_id": "06702470322",
          "description": "NOTICE of Motion by Thomas Gerard Morrissey for presentment of MOTION by Plaintiffs to approve notices to class 52 before Honorable Elaine E. Bucklo on 3/18/2005 at 09:30 AM. (gma, ) (Entered: 03/11/2005)"
        },
        {
          "row_number": 475,
          "id": 8879248,
          "entry_number": "70",
          "date_filed": "2005-06-10T00:00:00-04:00",
          "attachments": [],
          "url": "https://www.courtlistener.com/docket/4251255/70/bullock-v-sheahan/",
          "recap_pdf_url": null,
          "pacer_doc_id": "0670898577",
          "description": "ATTORNEY Appearance for Defendant Michael Sheahan by Bernard E.J. Quinn (ntf, ) (Entered: 06/14/2005)"
        },
        {
          "row_number": 453,
          "id": 8879171,
          "entry_number": "507",
          "date_filed": "2004-02-11T00:00:00-05:00",
          "attachments": [],
          "url": "https://www.courtlistener.com/docket/4251255/507/bullock-v-sheahan/",
          "recap_pdf_url": null,
          "pacer_doc_id": "067020891447",
          "description": "RECEIPT regarding payment of filing fee paid; on 2/11/04 in the amount of $ 150.00, receipt # 10322649. (jmm) (mma, ) (Pursuant to the March 2011 Judicial Conference Policy requiring that remote access restrictions be implemented when placing scanned versions of previously filed paper documents on the record, this document is restricted to allow public access only at the Clerk's Office public access terminals.) (Entered: 02/11/2004)"
        },
        {
          "row_number": 507,
          "id": 8879172,
          "entry_number": null,
          "date_filed": "2004-02-11T00:00:00-05:00",
          "attachments": [],
          "url": "https://www.courtlistener.com",
          "recap_pdf_url": null,
          "pacer_doc_id": null,
          "description": "RECEIPT regarding payment of filing fee paid; on 2/11/04 in the amount of $ 150.00, receipt # 10322649. (jmm)"
        },
        {
          "row_number": 222,
          "id": 8879174,
          "entry_number": "3",
          "date_filed": "2004-03-08T00:00:00-05:00",
          "attachments": [],
          "url": "https://www.courtlistener.com/docket/4251255/3/bullock-v-sheahan/",
          "recap_pdf_url": null,
          "pacer_doc_id": "0670359614",
          "description": "ATTORNEY APPEARANCE for defendant Cook Co by Patrick T. Driscoll Jr., Thomas Vincent Lyons, Patrick Malone. (vmj) (Entered: 03/09/2004)"
        },
        {
          "row_number": 333,
          "id": 8879175,
          "entry_number": "4",
          "date_filed": "2004-03-08T00:00:00-05:00",
          "attachments": [],
          "url": "https://www.courtlistener.com/docket/4251255/4/bullock-v-sheahan/",
          "recap_pdf_url": null,
          "pacer_doc_id": "06703012034",
          "description": "MOTION by defendant Cook Co to extend the time to answer, move or otherwise plea to plaintiffs' amended complaint ; Notice (las) (Entered: 03/11/2004)"
        },
        {
          "row_number": 474,
          "id": 8879178,
          "entry_number": "7",
          "date_filed": "2004-04-20T00:00:00-04:00",
          "attachments": [],
          "url": "https://www.courtlistener.com/docket/4251255/7/bullock-v-sheahan/",
          "recap_pdf_url": null,
          "pacer_doc_id": "06702921004",
          "description": "MINUTE ORDER of 4/20/04 by Hon. Elaine E. Bucklo : Defendants' motion for a 7 day extension to respond to the amended complaint is granted [6-1]. Discovery is ordered closed on 9/30/04. Pretrial order will be due by 10/29/04; and response to any motions in limine by 11/12/04. Pretrial conference set for 11/18/04 at 4:30 p.m. This case is placed on the court's January pooled trial calendar beginning 1/4/05 at 9:40 a.m. Mailed notice (las) (Entered: 04/21/2004)"
        },
        {
          "row_number": 485,
          "id": 8879179,
          "entry_number": "8",
          "date_filed": "2004-04-27T00:00:00-04:00",
          "attachments": [],
          "url": "https://www.courtlistener.com/docket/4251255/8/bullock-v-sheahan/",
          "recap_pdf_url": null,
          "pacer_doc_id": "0670345166",
          "description": "ANSWER, affirmative defenses by defendants to plaintiffs' amended complaint [2-1]; jury demand; Notice. (air) (Entered: 04/28/2004)"
        },
        {
          "row_number": 34,
          "id": 8879181,
          "entry_number": "13",
          "date_filed": "2004-05-14T00:00:00-04:00",
          "attachments": [],
          "url": "https://www.courtlistener.com/docket/4251255/13/bullock-v-sheahan/",
          "recap_pdf_url": null,
          "pacer_doc_id": "0670282167",
          "description": "MOTION by plaintiffs for class certification ; Notice (rmm) (Entered: 05/24/2004)"
        },
        {
          "row_number": 45,
          "id": 8879182,
          "entry_number": "14",
          "date_filed": "2004-05-17T00:00:00-04:00",
          "attachments": [],
          "url": "https://www.courtlistener.com/docket/4251255/14/bullock-v-sheahan/",
          "recap_pdf_url": null,
          "pacer_doc_id": "06702625954",
          "description": "MOTION by defendants for enlargement of time to respond to plaintiff's written discovery requests (Attachments); Notice (rmm) (Entered: 05/24/2004)"
        },
        {
          "row_number": 12,
          "id": 8879184,
          "entry_number": "11",
          "date_filed": "2004-05-20T00:00:00-04:00",
          "attachments": [],
          "url": "https://www.courtlistener.com/docket/4251255/11/bullock-v-sheahan/",
          "recap_pdf_url": null,
          "pacer_doc_id": "0670275868",
          "description": "RESPONSE by plaintiffs to defendant's motion for an enlargement of time to respond to plaintff's written discovery; Notice. (gma) (Entered: 05/21/2004)"
        },
        {
          "row_number": 56,
          "id": 8879186,
          "entry_number": "15",
          "date_filed": "2004-05-21T00:00:00-04:00",
          "attachments": [],
          "url": "https://www.courtlistener.com/docket/4251255/15/bullock-v-sheahan/",
          "recap_pdf_url": null,
          "pacer_doc_id": "0670282165",
          "description": "MINUTE ORDER of 5/21/04 by Hon. Elaine E. Bucklo : Plaintiffs' motion for referral of discovery matters to the assigned Magistrate is granted [12-1]. Defendant's motion for an additional 30 days to respond to plaintiffs' written discovery request is also granted [14-1]. Response to plaintiffs' motion to certify a class [13-1] is due by 6/24/2004; and any reply by 7/9/2004. Ruling on motion for class certification [13-1]will be mail by 8/6/2004. Mailed notice (rmm) (Entered: 05/24/2004)"
        },
        {
          "row_number": 112,
          "id": 8879193,
          "entry_number": "20",
          "date_filed": "2004-06-28T00:00:00-04:00",
          "attachments": [],
          "url": "https://www.courtlistener.com/docket/4251255/20/bullock-v-sheahan/",
          "recap_pdf_url": null,
          "pacer_doc_id": "0670259237",
          "description": "MOTION by defendants for a rule 16 pretrial conference ; Notice (las) (Entered: 07/02/2004)"
        },
        {
          "row_number": 134,
          "id": 8879196,
          "entry_number": "22",
          "date_filed": "2004-07-01T00:00:00-04:00",
          "attachments": [],
          "url": "https://www.courtlistener.com/docket/4251255/22/bullock-v-sheahan/",
          "recap_pdf_url": null,
          "pacer_doc_id": "0670230842",
          "description": "MINUTE ORDER of 7/1/04 by Hon. Elaine E. Bucklo : Defendants' motion for a Rule 16 pretrial conference is referred to the assigned Magistrate Judge for resolution. Mailed notice (las) (Entered: 07/02/2004)"
        },
        {
          "row_number": 145,
          "id": 8879197,
          "entry_number": "23",
          "date_filed": "2004-07-06T00:00:00-04:00",
          "attachments": [],
          "url": "https://www.courtlistener.com/docket/4251255/23/bullock-v-sheahan/",
          "recap_pdf_url": null,
          "pacer_doc_id": "06702574463",
          "description": "MEMORANDUM of law by defendants in opposition to motion for class certification [13-1]; Notice (las) Modified on 9/4/2014 (ym, ). (Entered: 07/07/2004)"
        },
        {
          "row_number": 156,
          "id": 8879198,
          "entry_number": "24",
          "date_filed": "2004-07-06T00:00:00-04:00",
          "attachments": [],
          "url": "https://www.courtlistener.com/docket/4251255/24/bullock-v-sheahan/",
          "recap_pdf_url": null,
          "pacer_doc_id": "0670233843",
          "description": "MOTION by defendant Michael Sheahan for reconsideration ; Notice (las) (Entered: 07/09/2004)"
        },
        {
          "row_number": 167,
          "id": 8879199,
          "entry_number": "25",
          "date_filed": "2004-07-08T00:00:00-04:00",
          "attachments": [],
          "url": "https://www.courtlistener.com/docket/4251255/25/bullock-v-sheahan/",
          "recap_pdf_url": null,
          "pacer_doc_id": "06702575761",
          "description": "MINUTE ORDER of 7/8/04 by Hon. Elaine E. Bucklo : Defendants' motion for reconsideration of the order dated 7/1/04 is denied [24-1]. Mailed notice (las) (Entered: 07/09/2004)"
        },
        {
          "row_number": 178,
          "id": 8879200,
          "entry_number": "26",
          "date_filed": "2004-07-08T00:00:00-04:00",
          "attachments": [],
          "url": "https://www.courtlistener.com/docket/4251255/26/bullock-v-sheahan/",
          "recap_pdf_url": null,
          "pacer_doc_id": "0670233844",
          "description": "MINUTE ORDER of 7/8/04 by Hon. Sidney I. Schenkier : Defendants' motion for a Rule 16 pre-trial conference is set for hearing on 7/16/04 at 2:30 p.m. [20-1]. The status hearing set for 7/15/04 is stricken. Mailed notice (las) (Entered: 07/09/2004)"
        },
        {
          "row_number": 189,
          "id": 8879201,
          "entry_number": "27",
          "date_filed": "2004-07-09T00:00:00-04:00",
          "attachments": [],
          "url": "https://www.courtlistener.com/docket/4251255/27/bullock-v-sheahan/",
          "recap_pdf_url": null,
          "pacer_doc_id": "0670238042",
          "description": "MOTION by plaintiffs to compel defendants to respond to plaintiffs' written discovery (Attachments); Notice. (cem) (Entered: 07/19/2004)"
        },
        {
          "row_number": 211,
          "id": 8879204,
          "entry_number": "29",
          "date_filed": "2004-07-16T00:00:00-04:00",
          "attachments": [],
          "url": "https://www.courtlistener.com/docket/4251255/29/bullock-v-sheahan/",
          "recap_pdf_url": null,
          "pacer_doc_id": "0670238041",
          "description": "REPLY memorandum by plaintiffs in support of the motion for class certification [13-1]; Notice. (cem) Modified on 9/4/2014 (ym, ). (Entered: 07/19/2004)"
        },
        {
          "row_number": 223,
          "id": 8879205,
          "entry_number": "30",
          "date_filed": "2004-07-16T00:00:00-04:00",
          "attachments": [],
          "url": "https://www.courtlistener.com/docket/4251255/30/bullock-v-sheahan/",
          "recap_pdf_url": null,
          "pacer_doc_id": "06702579215",
          "description": "NOTICE by plaintiff of filing regarding plaintiffs exhibits for reply memorandum in support of the motion for class certification (Attachments). (cem) (Entered: 07/19/2004)"
        },
        {
          "row_number": 234,
          "id": 8879206,
          "entry_number": "31",
          "date_filed": "2004-07-23T00:00:00-04:00",
          "attachments": [],
          "url": "https://www.courtlistener.com/docket/4251255/31/bullock-v-sheahan/",
          "recap_pdf_url": null,
          "pacer_doc_id": "0670242476",
          "description": "MINUTE ORDER of 7/23/04 by Hon. Sidney I. Schenkier: Status hearing held and continued to 8/17/04 at 9:00 a.m. The parties are to submit a proposed protective order to the court; pending the entry of a written protective order, all documents responsive the plaintiffs' request for records from the Cook County Prison Facility will be attorneys' eyes only. The plaintiffs' counsel is to inspect the requested document's at the Cook County Prison Facility by 7/30/04. Mailed notice (jmm) (Entered: 07/27/2004)"
        },
        {
          "row_number": 245,
          "id": 8879207,
          "entry_number": "32",
          "date_filed": "2004-07-29T00:00:00-04:00",
          "attachments": [],
          "url": "https://www.courtlistener.com/docket/4251255/32/bullock-v-sheahan/",
          "recap_pdf_url": null,
          "pacer_doc_id": "06702585983",
          "description": "AGREED MOTION by defendant Michael Sheahan to extend discovery cut-off and to continue the trial setting ; Notice (las) (Entered: 08/20/2004)"
        },
        {
          "row_number": 311,
          "id": 8879214,
          "entry_number": "38",
          "date_filed": "2004-09-27T00:00:00-04:00",
          "attachments": [],
          "url": "https://www.courtlistener.com/docket/4251255/38/bullock-v-sheahan/",
          "recap_pdf_url": null,
          "pacer_doc_id": "0670228819",
          "description": "ATTORNEY APPEARANCE for defendants by Christopher G. Markey (emd) (Entered: 09/30/2004)"
        },
        {
          "row_number": 322,
          "id": 8879215,
          "entry_number": "39",
          "date_filed": "2004-09-29T00:00:00-04:00",
          "attachments": [],
          "url": "https://www.courtlistener.com/docket/4251255/39/bullock-v-sheahan/",
          "recap_pdf_url": null,
          "pacer_doc_id": "0670230064",
          "description": "MINUTE ORDER of 9/29/04 by Hon. Sidney I. Schenkier : The court enters the agreed protective order as amended by the Court at paragraphs 6, 10, and 12 . (Entered Agreed Protective Order). Mailed notice (ntf) (Entered: 10/07/2004)"
        },
        {
          "row_number": 514,
          "id": 8879219,
          "entry_number": null,
          "date_filed": "2004-11-30T00:00:00-05:00",
          "attachments": [],
          "url": "https://www.courtlistener.com",
          "recap_pdf_url": null,
          "pacer_doc_id": null,
          "description": "SCHEDULE set on 11/30/04 by Hon. Sidney I. Schenkier : Status hearing held and continued to 9:00 12/14/04 . Mailed notice (mmm)"
        },
        {
          "row_number": 356,
          "id": 8879220,
          "entry_number": "42",
          "date_filed": "2004-11-30T00:00:00-05:00",
          "attachments": [],
          "url": "https://www.courtlistener.com/docket/4251255/42/bullock-v-sheahan/",
          "recap_pdf_url": null,
          "pacer_doc_id": "06702534226",
          "description": "MINUTE ORDER of 11/30/04 by Hon. Elaine E. Bucklo : Defendants' agreed motion for enlargement of time to complete discovery [41-1] and continue trial setting is granted [41-2]. Accordingly, fact discovery is extended to 1/31/05. For any expert discovery, parties shall submit a letter to the court before the next status hearing set for 2/4/05 at 10:00 a.m. Pretrial conference set for 2/28/05 are vacated. The date for the filing of the pretrial order is also vacated. Mailed notice (las) (Entered: 12/01/2004)"
        },
        {
          "row_number": 389,
          "id": 8879223,
          "entry_number": "45",
          "date_filed": "2005-01-04T00:00:00-05:00",
          "attachments": [],
          "url": "https://www.courtlistener.com/docket/4251255/45/bullock-v-sheahan/",
          "recap_pdf_url": null,
          "pacer_doc_id": "0670160518",
          "description": "MINUTE ORDER of 1/4/05 by Hon. Sidney I. Schenkier : Status hearing held and continued to 2/1/05 at 9:00 a.m. The plaintiff's oral motion for supplemental information concerning inmates release times from custody for the time period of 2/1/02 through 12/31/03 is granted. The defendant is to provide said information by 1/14/05. Mailed notice (las) (Entered: 01/05/2005)"
        },
        {
          "row_number": 400,
          "id": 8879224,
          "entry_number": "46",
          "date_filed": "2005-01-14T00:00:00-05:00",
          "attachments": [],
          "url": "https://www.courtlistener.com/docket/4251255/46/bullock-v-sheahan/",
          "recap_pdf_url": null,
          "pacer_doc_id": "0670164061",
          "description": "AGREED MOTION by plaintiffs for extension of time to complete discovery ; Notice (ar) (Entered: 01/14/2005)"
        },
        {
          "row_number": 411,
          "id": 8879225,
          "entry_number": "47",
          "date_filed": "2005-01-26T00:00:00-05:00",
          "attachments": [],
          "url": "https://www.courtlistener.com/docket/4251255/47/bullock-v-sheahan/",
          "recap_pdf_url": null,
          "pacer_doc_id": "06702497350",
          "description": "MINUTE entry before Judge Elaine E. Bucklo : Motion for extension of time to file 46 is granted. Accordingly, discovery is extended to 5/27/2005. Status hearing set for 2/4/05 is reset for 6/3/2005 at 10:00 AM. Mailed Notices (mpj, ) (Entered: 01/26/2005)"
        },
        {
          "row_number": 445,
          "id": 8879228,
          "entry_number": "50",
          "date_filed": "2005-02-17T00:00:00-05:00",
          "attachments": [],
          "url": "https://www.courtlistener.com/docket/4251255/50/bullock-v-sheahan/",
          "recap_pdf_url": null,
          "pacer_doc_id": "06702614348",
          "description": "ATTORNEY Appearance for Defendants Michael Sheahan, Cook County by Frank Joseph Marsico; Notice. (lcw, Lakisha) (Entered: 02/22/2005)"
        },
        {
          "row_number": 454,
          "id": 8879229,
          "entry_number": "51",
          "date_filed": "2005-02-18T00:00:00-05:00",
          "attachments": [],
          "url": "https://www.courtlistener.com/docket/4251255/51/bullock-v-sheahan/",
          "recap_pdf_url": null,
          "pacer_doc_id": "067087040",
          "description": "MINUTE entry before Judge Sidney I. Schenkier : The court extends the deadline for the parties to disclose experts and submit Rule 26(a)(2) report as follows: the plaintiffs shall disclose experts and submit Rule 26(a)(2) reports by 4/21/2005. The defendants shall disclose experts and submit Rule 26(a)(2) by 5/12/2005. No expert depositions are to be taken before all expert reports are submitted. Mailed notice (rmm, ) (Entered: 02/22/2005)"
        },
        {
          "row_number": 458,
          "id": 8879233,
          "entry_number": "55",
          "date_filed": "2005-03-18T00:00:00-05:00",
          "attachments": [],
          "url": "https://www.courtlistener.com/docket/4251255/55/bullock-v-sheahan/",
          "recap_pdf_url": null,
          "pacer_doc_id": "06703315164",
          "description": "MINUTE entry before Judge Elaine E. Bucklo : Plaintiffs' motion (52) to approve notices to class entered and continued to 4/15/2005 at 09:30 AM. If the issues are resolved before the next hearing, parties shall submit an order for entry. Discovery is extended to 9/1/05. Status hearing set for 6/3/05 is reset for 9/9/05 at 10:00 a.m. No notice (mpj, ) (Entered: 03/22/2005)"
        },
        {
          "row_number": 461,
          "id": 8879236,
          "entry_number": "58",
          "date_filed": "2005-04-12T00:00:00-04:00",
          "attachments": [],
          "url": "https://www.courtlistener.com/docket/4251255/58/bullock-v-sheahan/",
          "recap_pdf_url": null,
          "pacer_doc_id": "0670708663",
          "description": "MINUTE entry before Judge Sidney I. Schenkier : Magistrate Judge Status hearing held and continued to 6/7/2005 at 09:00 AM. Mailed notice (mmm, ) (Entered: 04/12/2005)"
        },
        {
          "row_number": 465,
          "id": 8879239,
          "entry_number": "61",
          "date_filed": "2005-04-22T00:00:00-04:00",
          "attachments": [],
          "url": "https://www.courtlistener.com/docket/4251255/61/bullock-v-sheahan/",
          "recap_pdf_url": null,
          "pacer_doc_id": "06701625164",
          "description": "MOTION by Plaintiffs Quentin Bullock, Jack Reid for leave of court to take in excess of ten depositions. (rbf, ) (Entered: 04/22/2005)"
        },
        {
          "row_number": 470,
          "id": 8879244,
          "entry_number": "66",
          "date_filed": "2005-05-04T00:00:00-04:00",
          "attachments": [],
          "url": "https://www.courtlistener.com/docket/4251255/66/bullock-v-sheahan/",
          "recap_pdf_url": null,
          "pacer_doc_id": "0670854900",
          "description": "MINUTE entry before Judge Elaine E. Bucklo : Pursuant to parties' joint request, plaintiffs' motion for approval; of notice 52 is entered and continued to 6/17/2005 at 09:30 AM. No notice (mpj, ) (Entered: 05/04/2005)"
        },
        {
          "row_number": 471,
          "id": 8879245,
          "entry_number": "67",
          "date_filed": "2005-06-06T00:00:00-04:00",
          "attachments": [],
          "url": "https://www.courtlistener.com/docket/4251255/67/bullock-v-sheahan/",
          "recap_pdf_url": null,
          "pacer_doc_id": "06703434764",
          "description": "MOTION by Plaintiffs to compel defendants to respond (gma, ) (Entered: 06/06/2005)"
        },
        {
          "row_number": 472,
          "id": 8879246,
          "entry_number": "68",
          "date_filed": "2005-06-06T00:00:00-04:00",
          "attachments": [],
          "url": "https://www.courtlistener.com/docket/4251255/68/bullock-v-sheahan/",
          "recap_pdf_url": null,
          "pacer_doc_id": "0670844876",
          "description": "NOTICE of Motion by Quentin Bullock, Jack Reid for presentment of MOTION by Plaintiffs to compel defendants to respond 67 before Honorable Sidney I. Schenkier on 6/9/2005 at 08:30 AM. (gma, ) (Entered: 06/06/2005)"
        },
        {
          "row_number": 480,
          "id": 8879252,
          "entry_number": "75",
          "date_filed": "2005-06-16T00:00:00-04:00",
          "attachments": [],
          "url": "https://www.courtlistener.com/docket/4251255/75/bullock-v-sheahan/",
          "recap_pdf_url": null,
          "pacer_doc_id": "0670859078",
          "description": "REPLY by defendants to plaintiffs' reply to defendants' objections to plaintiffs' proposed posting of notice of class action 71 . (lcw, ) (Entered: 06/20/2005)"
        },
        {
          "row_number": 477,
          "id": 8879253,
          "entry_number": "72",
          "date_filed": "2005-06-17T00:00:00-04:00",
          "attachments": [],
          "url": "https://www.courtlistener.com/docket/4251255/72/bullock-v-sheahan/",
          "recap_pdf_url": null,
          "pacer_doc_id": "0670838293",
          "description": "MINUTE entry before Judge Elaine E. Bucklo : Plaintiffs' motion to approve notices 52 heard and the motion is granted.Class notice approved as discussed in court and with the following additional change: The disputed sentence shall read: \"If the released female inmate has personal belongings in her division cell, she must return to the jail at a later date to pick them up.\" The paragraph beginning \"The defendants contend that as a result, male inmates have to be returned....\" can remain in the notice. As agreed, the class definition is amended to be \"All male inmates who, on or after February 12, 2002, have been subjected to defendant's policy and practice of strip searching a male inmate upon his return to the jail following a court appearance at which court appearance a specific case or charge against the inmate was dismissed when no other cases, charges, warrants or holds were pending against that inmate which warranted that inmate's continued detention at the jail.\" Notice will be sent first class mail based on last known addresses. Any posting of notice will await further proceedings in the case. If Judge Schenkier decides that additional time is needed for discovery he may change the schedule. Mailed notice (mpj, ) (Entered: 06/17/2005)"
        },
        {
          "row_number": 488,
          "id": 8879260,
          "entry_number": "82",
          "date_filed": "2005-07-21T00:00:00-04:00",
          "attachments": [],
          "url": "https://www.courtlistener.com/docket/4251255/82/bullock-v-sheahan/",
          "recap_pdf_url": null,
          "pacer_doc_id": "06703546066",
          "description": "MINUTE entry before Judge Sidney I. Schenkier : The minute order of 7/14/05 is corrected to strike the 7/22/05 date for the defendants to provide to the plaintiffs documentation showing which of plainitffs' request defendants contend have already been answered in discovery, and to revise it as follows: by 7/26/05, the defendants are to provide to the plaintiffs documentation showing which of plainitffs' request defendants contend have already been answered in discovery. Telephone notice (mmm, ) (Entered: 07/21/2005)"
        },
        {
          "row_number": 489,
          "id": 8879261,
          "entry_number": "83",
          "date_filed": "2005-07-22T00:00:00-04:00",
          "attachments": [],
          "url": "https://www.courtlistener.com/docket/4251255/83/bullock-v-sheahan/",
          "recap_pdf_url": null,
          "pacer_doc_id": "0670996911",
          "description": "MINUTE entry before Judge Sidney I. Schenkier : The Court strikes the status hearing set for 9/1/05, and resets the status hearing to 9/6/05 at 9:00 a.m. Mailed notice (mmm, ) (Entered: 07/22/2005)"
        },
        {
          "row_number": 491,
          "id": 8879263,
          "entry_number": "85",
          "date_filed": "2005-08-22T00:00:00-04:00",
          "attachments": [],
          "url": "https://www.courtlistener.com/docket/4251255/85/bullock-v-sheahan/",
          "recap_pdf_url": null,
          "pacer_doc_id": "0670473285",
          "description": "NOTICE by Quentin Bullock, Jack Reid of class action and of deadline to opt. (ntf, ) (Entered: 08/25/2005)"
        },
        {
          "row_number": 492,
          "id": 8879265,
          "entry_number": "86",
          "date_filed": "2005-08-26T00:00:00-04:00",
          "attachments": [],
          "url": "https://www.courtlistener.com/docket/4251255/86/bullock-v-sheahan/",
          "recap_pdf_url": null,
          "pacer_doc_id": "0670890313",
          "description": "MOTION by Defendants Michael Sheahan, Cook County for leave to substitute lead attorney (gma, ) (Entered: 08/26/2005)"
        },
        {
          "row_number": 493,
          "id": 8879266,
          "entry_number": "87",
          "date_filed": "2005-08-26T00:00:00-04:00",
          "attachments": [],
          "url": "https://www.courtlistener.com/docket/4251255/87/bullock-v-sheahan/",
          "recap_pdf_url": null,
          "pacer_doc_id": "06703534432",
          "description": "NOTICE of Motion by Bernard E.J. Quinn for presentment of MOTION by Defendants Michael Sheahan, Cook County for leave to substitute lead attorney 86 before Honorable Elaine E. Bucklo on 9/9/2005 at 09:30 AM. (gma, ) (Entered: 08/26/2005)"
        },
        {
          "row_number": 495,
          "id": 8879267,
          "entry_number": "89",
          "date_filed": "2005-08-26T00:00:00-04:00",
          "attachments": [],
          "url": "https://www.courtlistener.com/docket/4251255/89/bullock-v-sheahan/",
          "recap_pdf_url": null,
          "pacer_doc_id": "06704061758",
          "description": "AMENDED ATTORNEY Appearance for Defendant Michael Sheahan by Bernard E.J. Quinn (ar, ) (Entered: 08/30/2005)"
        },
        {
          "row_number": 497,
          "id": 8879268,
          "entry_number": "90",
          "date_filed": "2005-09-01T00:00:00-04:00",
          "attachments": [],
          "url": "https://www.courtlistener.com/docket/4251255/90/bullock-v-sheahan/",
          "recap_pdf_url": null,
          "pacer_doc_id": "06704016088",
          "description": "MOTION by Plaintiffs to compel defendants to permit inspection by plaintiffs' expert (gma, ) (Entered: 09/01/2005)"
        },
        {
          "row_number": 7,
          "id": 8879283,
          "entry_number": "105",
          "date_filed": "2005-11-02T00:00:00-05:00",
          "attachments": null,
          "url": "https://www.courtlistener.com/docket/4251255/105/bullock-v-sheahan/",
          "recap_pdf_url": null,
          "pacer_doc_id": "06701319019",
          "description": "MOTION by Defendant Michael Sheahan for discovery Motion to Limit Discovery Pursuant to F.R.C.P. 26(b)(2) (Attachments: # 1 Exhibit Exhibit A to Motion to Limit Discovery)(Marsico, Frank) (Entered: 11/02/2005)"
        },
        {
          "row_number": 11,
          "id": 8879289,
          "entry_number": "109",
          "date_filed": "2005-11-07T00:00:00-05:00",
          "attachments": null,
          "url": "https://www.courtlistener.com/docket/4251255/109/bullock-v-sheahan/",
          "recap_pdf_url": null,
          "pacer_doc_id": "06704051653",
          "description": "MOTION by Defendant Michael Sheahan for protective order Motion for Entry of Addendum to Agreed Protective Order Regarding CIMIS Information and Discovery (Attachments: # 1 Exhibit A# 2 Exhibit B# 3 Exhibit C)(Marsico, Frank) (Entered: 11/07/2005)"
        },
        {
          "row_number": 39,
          "id": 8879312,
          "entry_number": "134",
          "date_filed": "2006-02-09T00:00:00-05:00",
          "attachments": null,
          "url": "https://www.courtlistener.com/docket/4251255/134/bullock-v-sheahan/",
          "recap_pdf_url": null,
          "pacer_doc_id": "0670711168",
          "description": "OBJECTIONS to Plaintiffs' Motion for Leave to File a Second Amended Complaint (Attachments: # 1 Exhibit B)(Quinn, Bernard) (Entered: 02/09/2006)"
        },
        {
          "row_number": 152,
          "id": 8879414,
          "entry_number": "236",
          "date_filed": "2007-01-10T00:00:00-05:00",
          "attachments": null,
          "url": "https://www.courtlistener.com/docket/4251255/236/bullock-v-sheahan/",
          "recap_pdf_url": null,
          "pacer_doc_id": "06701721516",
          "description": "NOTICE of Motion by Frank Joseph Marsico for presentment of motion to strike,, 235 before Honorable Elaine E. Bucklo on 1/16/2007 at 09:15 AM. (Marsico, Frank) (Entered: 01/10/2007)"
        },
        {
          "row_number": 259,
          "id": 8879510,
          "entry_number": "332",
          "date_filed": "2008-04-03T00:00:00-04:00",
          "attachments": null,
          "url": "https://www.courtlistener.com/docket/4251255/332/bullock-v-sheahan/",
          "recap_pdf_url": null,
          "pacer_doc_id": "06704859481",
          "description": "NOTICE of Motion by Bernard E.J. Quinn for presentment of motion to amend/correct,, motion for relief, 331 before Honorable Elaine E. Bucklo on 4/9/2008 at 09:30 AM. (Quinn, Bernard) (Entered: 04/03/2008)"
        },
        {
          "row_number": 275,
          "id": 8879525,
          "entry_number": "347",
          "date_filed": "2008-05-21T00:00:00-04:00",
          "attachments": null,
          "url": "https://www.courtlistener.com/docket/4251255/347/bullock-v-sheahan/",
          "recap_pdf_url": null,
          "pacer_doc_id": "06705051327",
          "description": "MINUTE entry before the Honorable Elaine E. Bucklo: MOTION by Defendant Michael Sheahan for extension of time to file response/reply Reply Brief in Support of his Motion for Summary Judgment is granted. Reply due 6/23/2008.Mailed notice (slb, ) (Entered: 05/21/2008)"
        },
        {
          "row_number": 304,
          "id": 8879551,
          "entry_number": "373",
          "date_filed": "2008-08-29T00:00:00-04:00",
          "attachments": null,
          "url": "https://www.courtlistener.com/docket/4251255/373/bullock-v-sheahan/",
          "recap_pdf_url": null,
          "pacer_doc_id": "06705432157",
          "description": "MINUTE entry before the Honorable Elaine E. Bucklo:Plaintiffs' motion for extension of time 371 until 9/5/08 to respond to defendants' motion for reconsideration is granted.Mailed notice (mpj, ) (Entered: 08/29/2008)"
        },
        {
          "row_number": 325,
          "id": 8879569,
          "entry_number": "392",
          "date_filed": "2008-09-29T00:00:00-04:00",
          "attachments": null,
          "url": "https://www.courtlistener.com/docket/4251255/392/bullock-v-sheahan/",
          "recap_pdf_url": null,
          "pacer_doc_id": "06705560637",
          "description": "ACKNOWLEDGEMENT of receipt of short record on appeal regarding notice of appeal 385 ; USCA Case No. 08-3471. (mb, ) (Entered: 09/30/2008)"
        },
        {
          "row_number": 331,
          "id": 8879577,
          "entry_number": "398",
          "date_filed": "2008-10-07T00:00:00-04:00",
          "attachments": null,
          "url": "https://www.courtlistener.com/docket/4251255/398/bullock-v-sheahan/",
          "recap_pdf_url": null,
          "pacer_doc_id": "06705589541",
          "description": "MOTION by counsel for Defendant Cook County to withdraw as attorney (Blanchard, Patrick) (Entered: 10/07/2008)"
        },
        {
          "row_number": 358,
          "id": 8879599,
          "entry_number": "421",
          "date_filed": "2009-02-09T00:00:00-05:00",
          "attachments": null,
          "url": "https://www.courtlistener.com/docket/4251255/421/bullock-v-sheahan/",
          "recap_pdf_url": null,
          "pacer_doc_id": "06706057747",
          "description": "MOTION by Defendant Thomas Dart for leave to file Supplement Rule 54(b) Motion for Reconsideration with Newly Discovered Evidence (Attachments: # 1 Errata A, # 2 Exhibit B, # 3 Exhibit C)(Quinn, Bernard) (Entered: 02/09/2009)"
        },
        {
          "row_number": 398,
          "id": 8879636,
          "entry_number": "458",
          "date_filed": "2010-06-23T00:00:00-04:00",
          "attachments": null,
          "url": "https://www.courtlistener.com/docket/4251255/458/bullock-v-sheahan/",
          "recap_pdf_url": null,
          "pacer_doc_id": "06708034246",
          "description": "MINUTE entry before Honorable Elaine E. Bucklo:At plaintiff's request, Status hearing set for 6/24/10 is reset for 8/13/2010 at 10:00 AM.Mailed notice (mpj, ) (Entered: 06/23/2010)"
        },
        {
          "row_number": 476,
          "id": 8879249,
          "entry_number": "71",
          "date_filed": "2005-06-10T00:00:00-04:00",
          "attachments": [],
          "url": "https://www.courtlistener.com/docket/4251255/71/bullock-v-sheahan/",
          "recap_pdf_url": null,
          "pacer_doc_id": "06703506707",
          "description": "REPLY by Plaintiffs to defendants' objections to Plaintiffs' proposed posting of notice of class action 64 ; Notice. (ntf, ) (Entered: 06/14/2005)"
        },
        {
          "row_number": 295,
          "id": 8879543,
          "entry_number": "365",
          "date_filed": "2008-08-15T00:00:00-04:00",
          "attachments": null,
          "url": "https://www.courtlistener.com/docket/4251255/365/bullock-v-sheahan/",
          "recap_pdf_url": null,
          "pacer_doc_id": "06705382205",
          "description": "NOTICE of Motion by Bernard E.J. Quinn for presentment of motion for leave to file 364 before Honorable Elaine E. Bucklo on 8/20/2008 at 09:30 AM. (Quinn, Bernard) (Entered: 08/15/2008)"
        },
        {
          "row_number": 296,
          "id": 8879544,
          "entry_number": "366",
          "date_filed": "2008-08-18T00:00:00-04:00",
          "attachments": null,
          "url": "https://www.courtlistener.com/docket/4251255/366/bullock-v-sheahan/",
          "recap_pdf_url": null,
          "pacer_doc_id": "06705385365",
          "description": "MINUTE entry before the Honorable Elaine E. Bucklo:Defendants' motion for leave to file motion for reconsideration in excess of 15 pages 364 is granted. Responses to defendants' motion for reconsideration due by 9/2/2008. Target date for ruling by mail set for 9/19/08.Mailed notice (mpj, ) (Entered: 08/18/2008)"
        },
        {
          "row_number": 297,
          "id": 8879545,
          "entry_number": "367",
          "date_filed": "2008-08-18T00:00:00-04:00",
          "attachments": null,
          "url": "https://www.courtlistener.com/docket/4251255/367/bullock-v-sheahan/",
          "recap_pdf_url": "https://www.courtlistener.com/recap/gov.uscourts.ilnd.145151.367.0.pdf",
          "pacer_doc_id": "06705386142",
          "description": "MOTION by Defendants Michael Sheahan, Cook County for reconsideration - Rule 54(B) - (Quinn, Bernard) (Entered: 08/18/2008)"
        },
        {
          "row_number": 298,
          "id": 8879546,
          "entry_number": "368",
          "date_filed": "2008-08-21T00:00:00-04:00",
          "attachments": null,
          "url": "https://www.courtlistener.com/docket/4251255/368/bullock-v-sheahan/",
          "recap_pdf_url": "https://www.courtlistener.com/recap/gov.uscourts.ilnd.145151.368.0.pdf",
          "pacer_doc_id": "06705401609",
          "description": "MOTION by Defendants Michael Sheahan, Cook County for extension of time to file notice of appeal - Fed.R.App. 4(a)(5) (Quinn, Bernard) (Entered: 08/21/2008)"
        },
        {
          "row_number": 299,
          "id": 8879547,
          "entry_number": "369",
          "date_filed": "2008-08-21T00:00:00-04:00",
          "attachments": null,
          "url": "https://www.courtlistener.com/docket/4251255/369/bullock-v-sheahan/",
          "recap_pdf_url": null,
          "pacer_doc_id": "06705401634",
          "description": "NOTICE of Motion by Bernard E.J. Quinn for presentment of extension of time 368 before Honorable Elaine E. Bucklo on 8/27/2008 at 09:30 AM. (Quinn, Bernard) (Entered: 08/21/2008)"
        },
        {
          "row_number": 301,
          "id": 8879548,
          "entry_number": "370",
          "date_filed": "2008-08-22T00:00:00-04:00",
          "attachments": null,
          "url": "https://www.courtlistener.com/docket/4251255/370/bullock-v-sheahan/",
          "recap_pdf_url": "https://www.courtlistener.com/recap/gov.uscourts.ilnd.145151.370.0.pdf",
          "pacer_doc_id": "06705407660",
          "description": "MINUTE entry before the Honorable Elaine E. Bucklo:Defendants' motion for extension of time 368 until 9/29/08 to file any notice of appeal is granted.Mailed notice (mpj, ) (Entered: 08/22/2008)"
        },
        {
          "row_number": 302,
          "id": 8879549,
          "entry_number": "371",
          "date_filed": "2008-08-26T00:00:00-04:00",
          "attachments": null,
          "url": "https://www.courtlistener.com/docket/4251255/371/bullock-v-sheahan/",
          "recap_pdf_url": "https://www.courtlistener.com/recap/gov.uscourts.ilnd.145151.371.0.pdf",
          "pacer_doc_id": "06705416900",
          "description": "MOTION by Plaintiffs Quentin Bullock, Jack Reid for extension of time to file a Response To Defendants' Motion for Reconsideration (Morrissey, Thomas) (Entered: 08/26/2008)"
        },
        {
          "row_number": 316,
          "id": 8879562,
          "entry_number": "384",
          "date_filed": "2008-09-26T00:00:00-04:00",
          "attachments": null,
          "url": "https://www.courtlistener.com/docket/4251255/384/bullock-v-sheahan/",
          "recap_pdf_url": null,
          "pacer_doc_id": "06705549550",
          "description": "MINUTE entry before the Honorable Sidney I. Schenkier: Status hearing in chambers held and continued to 11/18/08 at 10 a.m. in chambers. Mailed notice (mmm, ) (Entered: 09/26/2008)"
        },
        {
          "row_number": 317,
          "id": 8879563,
          "entry_number": "385",
          "date_filed": "2008-09-29T00:00:00-04:00",
          "attachments": null,
          "url": "https://www.courtlistener.com/docket/4251255/385/bullock-v-sheahan/",
          "recap_pdf_url": null,
          "pacer_doc_id": "06705553051",
          "description": "NOTICE of appeal by Michael Sheahan regarding orders 360 Filing fee $ 455, receipt number 07520000000003145510. (Attachments: # 1 Notice of Filing)(Quinn, Bernard) (Entered: 09/29/2008)"
        },
        {
          "row_number": 318,
          "id": 8879564,
          "entry_number": "386",
          "date_filed": "2008-09-29T00:00:00-04:00",
          "attachments": null,
          "url": "https://www.courtlistener.com/docket/4251255/386/bullock-v-sheahan/",
          "recap_pdf_url": null,
          "pacer_doc_id": "06705553227",
          "description": "DOCKETING Statement by Michael Sheahan regarding notice of appeal 385 (Quinn, Bernard) (Entered: 09/29/2008)"
        },
        {
          "row_number": 319,
          "id": 8879565,
          "entry_number": "387",
          "date_filed": "2008-09-29T00:00:00-04:00",
          "attachments": null,
          "url": "https://www.courtlistener.com/docket/4251255/387/bullock-v-sheahan/",
          "recap_pdf_url": null,
          "pacer_doc_id": "06705553787",
          "description": "NOTICE of Appeal Due letter sent to counsel of record (dj, ) (Entered: 09/29/2008)"
        },
        {
          "row_number": 320,
          "id": 8879566,
          "entry_number": "388",
          "date_filed": "2008-09-29T00:00:00-04:00",
          "attachments": null,
          "url": "https://www.courtlistener.com/docket/4251255/388/bullock-v-sheahan/",
          "recap_pdf_url": null,
          "pacer_doc_id": "06705553825",
          "description": "TRANSMITTED to the 7th Circuit the short record on notice of appeal 385 . Notified counsel (dj, ) (Entered: 09/29/2008)"
        },
        {
          "row_number": 321,
          "id": 8879567,
          "entry_number": "389",
          "date_filed": "2008-09-29T00:00:00-04:00",
          "attachments": null,
          "url": "https://www.courtlistener.com/docket/4251255/389/bullock-v-sheahan/",
          "recap_pdf_url": null,
          "pacer_doc_id": "06705554148",
          "description": "Defendants' Notification to District Court of Protective Appeal by Michael Sheahan (Attachments: # 1 Exhibit A-D)(Quinn, Bernard) (Entered: 09/29/2008)"
        },
        {
          "row_number": 323,
          "id": 8879568,
          "entry_number": "390",
          "date_filed": "2008-09-29T00:00:00-04:00",
          "attachments": null,
          "url": "https://www.courtlistener.com/docket/4251255/390/bullock-v-sheahan/",
          "recap_pdf_url": null,
          "pacer_doc_id": "06705555410",
          "description": "NOTICE by Michael Sheahan, Cook County re other 389 Amended Notice of Filing of Notice of Appeal (Quinn, Bernard) (Entered: 09/29/2008)"
        },
        {
          "row_number": 324,
          "id": 8879570,
          "entry_number": "391",
          "date_filed": "2008-09-30T00:00:00-04:00",
          "attachments": null,
          "url": "https://www.courtlistener.com/docket/4251255/391/bullock-v-sheahan/",
          "recap_pdf_url": null,
          "pacer_doc_id": "06705558591",
          "description": "DESIGNATION by Michael Sheahan, Cook County of record on appeal (Quinn, Bernard) (Entered: 09/30/2008)"
        },
        {
          "row_number": 337,
          "id": 8879571,
          "entry_number": "402",
          "date_filed": "2008-09-30T00:00:00-04:00",
          "attachments": null,
          "url": "https://www.courtlistener.com/docket/4251255/402/bullock-v-sheahan/",
          "recap_pdf_url": null,
          "pacer_doc_id": "06705590714",
          "description": "SEVENTH CIRCUIT transcript information sheet (Poor Quality Original - Paper Document on File.) (mb, ) (Entered: 10/07/2008)"
        },
        {
          "row_number": 326,
          "id": 8879572,
          "entry_number": "393",
          "date_filed": "2008-10-02T00:00:00-04:00",
          "attachments": null,
          "url": "https://www.courtlistener.com/docket/4251255/393/bullock-v-sheahan/",
          "recap_pdf_url": null,
          "pacer_doc_id": "06705571603",
          "description": "ATTORNEY Appearance for Defendant Cook County by Francis J. Catania (Catania, Francis) (Entered: 10/02/2008)"
        },
        {
          "row_number": 327,
          "id": 8879573,
          "entry_number": "394",
          "date_filed": "2008-10-03T00:00:00-04:00",
          "attachments": null,
          "url": "https://www.courtlistener.com/docket/4251255/394/bullock-v-sheahan/",
          "recap_pdf_url": null,
          "pacer_doc_id": "06705577638",
          "description": "MOTION by Defendants Michael Sheahan, Cook County for a Circuit Rule 57 Finding (Quinn, Bernard) (Entered: 10/03/2008)"
        },
        {
          "row_number": 499,
          "id": 8879270,
          "entry_number": "92",
          "date_filed": "2005-09-06T00:00:00-04:00",
          "attachments": null,
          "url": "https://www.courtlistener.com/docket/4251255/92/bullock-v-sheahan/",
          "recap_pdf_url": null,
          "pacer_doc_id": "06701053456",
          "description": "MINUTE entry before Judge Sidney I. Schenkier : For the reasons stated on the record in open court, plaintiffs' motion to compel defendants to permit an inspection by plaintiffs' expert, Sheila Vaughan (doc. # 90) is GRANTED. The inspection shall be conducted during weekday hours, and shall be completed by 09/30/05. For the reasons stated on the record in open court, plaintiffs' motion for production of witness(es) to give Rule 30(b)(6) testimony (doc. # 80) is GRANTED as to Categories D, E, F, G and K(8) of plaintiffs motion; in all other respects, the motion is DENIED. The Rule 30(b)(6) depositions on these subjects shall be completed by 09/30/05. Plaintiffs' unopposed oral motion to adjust the expert discovery schedule is GRANTED, as follows: (1) plaintiffs' expert disclosures and Rule 26(a)(2) reports are due by 10/31/05; (2) defendants' expert disclosures and Rule 26(a)(2) reports are due by 11/30/05; and (3) all expert depositions are to be completed by 12/30/05. Documents currently being produced by defendants shall be made reviewed by plaintiffs at a mutually-agreeable date on or before 09/16/05. Other than the discovery required by this order, no new discovery shall be initiated. The matter is set for a status conference on 11/03/05 at 9:00 a.m. Mailed notice. (tlp, ) (Entered: 09/06/2005)"
        },
        {
          "row_number": 500,
          "id": 8879271,
          "entry_number": "93",
          "date_filed": "2005-09-09T00:00:00-04:00",
          "attachments": null,
          "url": "https://www.courtlistener.com/docket/4251255/93/bullock-v-sheahan/",
          "recap_pdf_url": null,
          "pacer_doc_id": "06701654508",
          "description": "MINUTE entry before Judge Elaine E. Bucklo : Status hearing set for 9/9/05 is reset for 12/9/2005 at 10:00 AM. Mailed notice (mpj, ) (Entered: 09/09/2005)"
        },
        {
          "row_number": 501,
          "id": 8879272,
          "entry_number": "94",
          "date_filed": "2005-09-12T00:00:00-04:00",
          "attachments": null,
          "url": "https://www.courtlistener.com/docket/4251255/94/bullock-v-sheahan/",
          "recap_pdf_url": null,
          "pacer_doc_id": "06704018462",
          "description": "MINUTE entry before Judge Elaine E. Bucklo : Defendant, Sheahan's motion for leave to substitute lead attorney 86 is granted. Accordingly, Christopher Markey is allowed to withdraw his appearance and Bernard E. Jude is given leave to file his amended appearance as lead counsel on defendant's behalf. Mailed notice (air, ) (Entered: 09/15/2005)"
        },
        {
          "row_number": 502,
          "id": 8879273,
          "entry_number": "95",
          "date_filed": "2005-09-14T00:00:00-04:00",
          "attachments": null,
          "url": "https://www.courtlistener.com/docket/4251255/95/bullock-v-sheahan/",
          "recap_pdf_url": null,
          "pacer_doc_id": "06701075191",
          "description": "MINUTE entry before Judge Elaine E. Bucklo : Defendant Sheahan's motion for leave to substitute lead attorney is granted. Accordingly, Christopher Markey is allowed to withdraw his appearance and Bernard E. Judge Quinn is given leave to file his amended appearance as lead counsel on defendant's behalf. Mailed notice (ar, ) (Entered: 09/16/2005)"
        },
        {
          "row_number": 503,
          "id": 8879274,
          "entry_number": "96",
          "date_filed": "2005-09-15T00:00:00-04:00",
          "attachments": null,
          "url": "https://www.courtlistener.com/docket/4251255/96/bullock-v-sheahan/",
          "recap_pdf_url": null,
          "pacer_doc_id": "06705737957",
          "description": "NOTICE by Nestor Ruiz: \"I, Nestor Ruiz, request for an exclusion from the class....\" (ar, ) Modified on 11/13/2008 (gmr, ). (Entered: 09/20/2005)"
        },
        {
          "row_number": 504,
          "id": 8879275,
          "entry_number": "97",
          "date_filed": "2005-09-19T00:00:00-04:00",
          "attachments": null,
          "url": "https://www.courtlistener.com/docket/4251255/97/bullock-v-sheahan/",
          "recap_pdf_url": null,
          "pacer_doc_id": "06704859753",
          "description": "ATTORNEY Appearance for Defendant Michael Sheahan by Bernard E.J. Quinn; Notice of filing (ar, ) (Text Modified by Clerk's Office on 4/3/2008) (hp, ). (Entered: 09/22/2005)"
        },
        {
          "row_number": 505,
          "id": 8879276,
          "entry_number": "98",
          "date_filed": "2005-09-19T00:00:00-04:00",
          "attachments": null,
          "url": "https://www.courtlistener.com/docket/4251255/98/bullock-v-sheahan/",
          "recap_pdf_url": null,
          "pacer_doc_id": "06703622136",
          "description": "REQUEST by Proposed Plaintiff Theron Travis to be included in the class. (ar, ) Modified on 9/4/2014 (ym, ). (Entered: 09/23/2005)"
        },
        {
          "row_number": 506,
          "id": 8879277,
          "entry_number": "99",
          "date_filed": "2005-10-07T00:00:00-04:00",
          "attachments": null,
          "url": "https://www.courtlistener.com/docket/4251255/99/bullock-v-sheahan/",
          "recap_pdf_url": null,
          "pacer_doc_id": "06703650823",
          "description": "MINUTE entry before Judge Sidney I. Schenkier : Status hearing set for 10/20/2005 at 09:00 AM. Telephone notice (mmm, ) (Entered: 10/07/2005)"
        },
        {
          "row_number": 2,
          "id": 8879278,
          "entry_number": "100",
          "date_filed": "2005-10-21T00:00:00-04:00",
          "attachments": null,
          "url": "https://www.courtlistener.com/docket/4251255/100/bullock-v-sheahan/",
          "recap_pdf_url": null,
          "pacer_doc_id": "06703678697",
          "description": "MINUTE entry before Judge Sidney I. Schenkier : Magistrate Judge Status hearing held and continued to 12/1/2005 at 09:00 AM. The status hearing set for 11/3/05 is stricken. The plaintiff's oral motion to take one additional deposition is granted as directed by the Court. The deposition is to be limited to the basis of the author's observation as stated in the 5/13/05 Howard Johnson Association RCDC report. Mailed notice (mmm, ) (Entered: 10/21/2005)"
        },
        {
          "row_number": 3,
          "id": 8879279,
          "entry_number": "101",
          "date_filed": "2005-10-21T00:00:00-04:00",
          "attachments": null,
          "url": "https://www.courtlistener.com/docket/4251255/101/bullock-v-sheahan/",
          "recap_pdf_url": null,
          "pacer_doc_id": "06703680203",
          "description": "COMBINED MOTION by Attorney Craig M. Sandberg to withdraw as counsel of record for Michael F. Sheahan and to correct the record to reflect his appearance on behalf of Cook County (gma, ) (Entered: 10/21/2005)"
        },
        {
          "row_number": 4,
          "id": 8879280,
          "entry_number": "102",
          "date_filed": "2005-10-21T00:00:00-04:00",
          "attachments": null,
          "url": "https://www.courtlistener.com/docket/4251255/102/bullock-v-sheahan/",
          "recap_pdf_url": null,
          "pacer_doc_id": "06703680072",
          "description": "NOTICE of Motion by Craig Michael Sandberg for presentment of COMBINED MOTION by Attorney Craig M. Sandberg to withdraw as counsel of record for Michael F. Sheahan and to correct the record to reflect his appearance on behalf of Cook County 101 before Honorable Elaine E. Bucklo on 10/28/2005 at 09:30 AM. (gma, ) (Entered: 10/21/2005)"
        },
        {
          "row_number": 5,
          "id": 8879281,
          "entry_number": "103",
          "date_filed": "2005-10-25T00:00:00-04:00",
          "attachments": null,
          "url": "https://www.courtlistener.com/docket/4251255/103/bullock-v-sheahan/",
          "recap_pdf_url": null,
          "pacer_doc_id": "06703636797",
          "description": "MOTION by Defendant Cook County to withdraw Thomas V. Lyons as counsel of record (gma, ) (Entered: 10/25/2005)"
        },
        {
          "row_number": 6,
          "id": 8879282,
          "entry_number": "104",
          "date_filed": "2005-10-25T00:00:00-04:00",
          "attachments": null,
          "url": "https://www.courtlistener.com/docket/4251255/104/bullock-v-sheahan/",
          "recap_pdf_url": null,
          "pacer_doc_id": "06703645397",
          "description": "NOTICE of Motion by Thomas Vincent Lyons for presentment of MOTION by Defendant Cook County to withdraw Thomas V. Lyons as counsel of record 103 before Honorable Elaine E. Bucklo on 11/4/2005 at 09:30 AM. (gma, ) (Entered: 10/25/2005)"
        },
        {
          "row_number": 8,
          "id": 8879284,
          "entry_number": "106",
          "date_filed": "2005-11-02T00:00:00-05:00",
          "attachments": null,
          "url": "https://www.courtlistener.com/docket/4251255/106/bullock-v-sheahan/",
          "recap_pdf_url": null,
          "pacer_doc_id": "06701320344",
          "description": "NOTICE of Motion by Frank Joseph Marsico for presentment of motion for discovery 105 before Honorable Sidney I. Schenkier on 11/8/2005 at 08:30 AM. (Marsico, Frank) (Entered: 11/02/2005)"
        },
        {
          "row_number": 9,
          "id": 8879285,
          "entry_number": "107",
          "date_filed": "2005-11-02T00:00:00-05:00",
          "attachments": null,
          "url": "https://www.courtlistener.com/docket/4251255/107/bullock-v-sheahan/",
          "recap_pdf_url": null,
          "pacer_doc_id": "06701319385",
          "description": "MOTION by Plaintiffs Quentin Bullock, Jack Reid to clarify (Morrissey, Thomas) (Entered: 11/02/2005)"
        },
        {
          "row_number": 10,
          "id": 8879286,
          "entry_number": "108",
          "date_filed": "2005-11-02T00:00:00-05:00",
          "attachments": null,
          "url": "https://www.courtlistener.com/docket/4251255/108/bullock-v-sheahan/",
          "recap_pdf_url": null,
          "pacer_doc_id": "06701318409",
          "description": "NOTICE of Motion by Thomas Gerard Morrissey for presentment of motion by plaintiff to clarify 107 before Honorable Sidney I. Schenkier on 11/3/2005 at 09:00 AM. (Morrissey, Thomas) (Entered: 11/02/2005)"
        },
        {
          "row_number": 14,
          "id": 8879287,
          "entry_number": "111",
          "date_filed": "2005-11-03T00:00:00-05:00",
          "attachments": null,
          "url": "https://www.courtlistener.com/docket/4251255/111/bullock-v-sheahan/",
          "recap_pdf_url": null,
          "pacer_doc_id": "06704055840",
          "description": "MINUTE entry before Judge Sidney I. Schenkier : Motion hearing held. For the reasons stated on the record in open court, plaintiff's motion to clarify 107 and defendants' motion to limit discovery 105 are granted in part, as follows: (a) by 11/10/05, defendants shall supplement their responses to Int. Nos. 1-2 to state what categories of information included in the Brown report are collected by CIMIS or any other electronic database; which of those categories of information are accessible electronically without any additional programming; which categories of information are accessible electronically only through additional programming work; and which categories of information are not collected on CIMIS or any other electronic database; (b) by 11/10/05, plaintiffs shall inform defendants in writing of no fewer than five and more than ten 5-day periods, between February, 2002, and October, 2005, for which they seek production by defendants of the categories of information set forth in the Brown report; and (c) by 11/10/05, defendants shall inform plaintiffs in writing of any categories of information stored on CIMIS or any other electronic databases which they say cannot be provided due to the burden or cost of special programming, and if defendants take that position, by 11/17/05, they shall produce any information technology witness for deposition by plaintiffs on that position. The matter is set for a status conference on 11/21/05 at 8:30 AM to discuss the timing of production by the additional information sought by plaintiffs. Except as set forth in this order, plaintiffs' motion to clarify and defendants motion to limit discovery are denied 105 107 . Mailed notice (ar, ) (Entered: 11/08/2005)"
        },
        {
          "row_number": 15,
          "id": 8879288,
          "entry_number": "112",
          "date_filed": "2005-11-04T00:00:00-05:00",
          "attachments": null,
          "url": "https://www.courtlistener.com/docket/4251255/112/bullock-v-sheahan/",
          "recap_pdf_url": null,
          "pacer_doc_id": "06701648575",
          "description": "MINUTE entry before Judge Elaine E. Bucklo : Defendant County of Cook's motion for leave to withdraw appearance of Thomas V. Lyons is granted 103 . Mailed notice (ar, ) (Entered: 11/08/2005)"
        },
        {
          "row_number": 13,
          "id": 8879290,
          "entry_number": "110",
          "date_filed": "2005-11-07T00:00:00-05:00",
          "attachments": null,
          "url": "https://www.courtlistener.com/docket/4251255/110/bullock-v-sheahan/",
          "recap_pdf_url": null,
          "pacer_doc_id": "06704052067",
          "description": "NOTICE of Motion by Frank Joseph Marsico for presentment of motion for protective order 109 before Honorable Sidney I. Schenkier on 11/10/2005 at 08:30 AM. (Marsico, Frank) (Entered: 11/07/2005)"
        },
        {
          "row_number": 16,
          "id": 8879291,
          "entry_number": "113",
          "date_filed": "2005-11-07T00:00:00-05:00",
          "attachments": null,
          "url": "https://www.courtlistener.com/docket/4251255/113/bullock-v-sheahan/",
          "recap_pdf_url": null,
          "pacer_doc_id": "06701649048",
          "description": "MINUTE entry before Judge Elaine E. Bucklo : Attorney Craig M. Sandberg's combined motion to withdraw his appearance as counsel of record for Michael F. Sheahan is granted 101 . His motion to correct the record to reflect his appearance on behalf of defendant Cook County is also granted. Attorney Craig Michael Sandberg terminated as to Defendant Michael F. Seahan. Mailed notice (ar, ) (Entered: 11/08/2005)"
        },
        {
          "row_number": 17,
          "id": 8879292,
          "entry_number": "114",
          "date_filed": "2005-11-10T00:00:00-05:00",
          "attachments": null,
          "url": "https://www.courtlistener.com/docket/4251255/114/bullock-v-sheahan/",
          "recap_pdf_url": null,
          "pacer_doc_id": "06703655426",
          "description": "MINUTE entry before Judge Sidney I. Schenkier : Motion hearing held. Defendants' Motion for Entry of Addendum to Agreed Protective Order Regarding CIMIS Information and Discovery is denied for the reasons stated on the record in open court. Mailed notice (mmm, ) (Entered: 11/14/2005)"
        },
        {
          "row_number": 18,
          "id": 8879293,
          "entry_number": "115",
          "date_filed": "2005-11-21T00:00:00-05:00",
          "attachments": null,
          "url": "https://www.courtlistener.com/docket/4251255/115/bullock-v-sheahan/",
          "recap_pdf_url": null,
          "pacer_doc_id": "06703980786",
          "description": "MINUTE entry before Judge Sidney I. Schenkier : Status hearing held and continued to 12/20/2005 at 08:30 AM.No notice, advised in open court (jms, ) (Entered: 11/21/2005)"
        },
        {
          "row_number": 19,
          "id": 8879294,
          "entry_number": "116",
          "date_filed": "2005-11-21T00:00:00-05:00",
          "attachments": null,
          "url": "https://www.courtlistener.com/docket/4251255/116/bullock-v-sheahan/",
          "recap_pdf_url": null,
          "pacer_doc_id": "06701078687",
          "description": "STIPULATION (Quinn, Bernard) (Entered: 11/21/2005)"
        },
        {
          "row_number": 20,
          "id": 8879295,
          "entry_number": "117",
          "date_filed": "2005-11-23T00:00:00-05:00",
          "attachments": null,
          "url": "https://www.courtlistener.com/docket/4251255/117/bullock-v-sheahan/",
          "recap_pdf_url": null,
          "pacer_doc_id": "06701122805",
          "description": "STIPULATION REGARDING DESIGNATION OF R.C.D.C. DIAGRAM AS \"CONFIDENTIAL MATERIAL\" (Quinn, Bernard) (Entered: 11/23/2005)"
        },
        {
          "row_number": 21,
          "id": 8879296,
          "entry_number": "118",
          "date_filed": "2005-12-08T00:00:00-05:00",
          "attachments": null,
          "url": "https://www.courtlistener.com/docket/4251255/118/bullock-v-sheahan/",
          "recap_pdf_url": null,
          "pacer_doc_id": "06703979752",
          "description": "MINUTE entry before Judge Elaine E. Bucklo : On court's own motion status hearing set for 12/9/05 is reset for for 1/13/2006 at 10:00 AM. Mailed notice (mpj, ) (Entered: 12/08/2005)"
        },
        {
          "row_number": 22,
          "id": 8879297,
          "entry_number": "119",
          "date_filed": "2005-12-20T00:00:00-05:00",
          "attachments": null,
          "url": "https://www.courtlistener.com/docket/4251255/119/bullock-v-sheahan/",
          "recap_pdf_url": null,
          "pacer_doc_id": "06701600624",
          "description": "MINUTE entry before Judge Sidney I. Schenkier : Status hearing held and continued to 01/13/2006 at 08:30 AM. By 01/10/06, supplemental briefs are to be submitted to the Court regarding what information can be retrieved through CIMIS with regards to the Brown Study. Mailed notice (ar, ) (Entered: 12/23/2005)"
        },
        {
          "row_number": 24,
          "id": 8879298,
          "entry_number": "120",
          "date_filed": "2005-12-28T00:00:00-05:00",
          "attachments": null,
          "url": "https://www.courtlistener.com/docket/4251255/120/bullock-v-sheahan/",
          "recap_pdf_url": null,
          "pacer_doc_id": "0670537949",
          "description": "TRANSCRIPT of proceedings for the following dates: 11/03/05 before the Honorable Sidney I. Schenkier (ar, ) (Entered: 12/28/2005)"
        },
        {
          "row_number": 25,
          "id": 8879299,
          "entry_number": "121",
          "date_filed": "2006-01-09T00:00:00-05:00",
          "attachments": null,
          "url": "https://www.courtlistener.com/docket/4251255/121/bullock-v-sheahan/",
          "recap_pdf_url": null,
          "pacer_doc_id": "06703465929",
          "description": "MOTION by Plaintiffs Quentin Bullock, Jack Reid for discovery Reopen Discovery (Morrissey, Thomas) (Entered: 01/09/2006)"
        },
        {
          "row_number": 26,
          "id": 8879300,
          "entry_number": "122",
          "date_filed": "2006-01-09T00:00:00-05:00",
          "attachments": null,
          "url": "https://www.courtlistener.com/docket/4251255/122/bullock-v-sheahan/",
          "recap_pdf_url": null,
          "pacer_doc_id": "06703452112",
          "description": "Reopen Discovery NOTICE of Motion by Thomas Gerard Morrissey for presentment of motion for discovery 121 before Honorable Sidney I. Schenkier on 1/13/2006 at 09:00 AM. (Morrissey, Thomas) (Entered: 01/09/2006)"
        },
        {
          "row_number": 27,
          "id": 8879301,
          "entry_number": "123",
          "date_filed": "2006-01-10T00:00:00-05:00",
          "attachments": null,
          "url": "https://www.courtlistener.com/docket/4251255/123/bullock-v-sheahan/",
          "recap_pdf_url": null,
          "pacer_doc_id": "06703534888",
          "description": "Joint Brief Regarding January 10, 2006 Teleconference Regarding CIMIS Reconstruction of Brown Report by Michael Sheahan (Marsico, Frank) (Entered: 01/10/2006)"
        },
        {
          "row_number": 28,
          "id": 8879302,
          "entry_number": "124",
          "date_filed": "2006-01-10T00:00:00-05:00",
          "attachments": null,
          "url": "https://www.courtlistener.com/docket/4251255/124/bullock-v-sheahan/",
          "recap_pdf_url": null,
          "pacer_doc_id": "0670798545",
          "description": "NOTICE by all parties (Marsico, Frank) (Entered: 01/10/2006)"
        },
        {
          "row_number": 29,
          "id": 8879303,
          "entry_number": "125",
          "date_filed": "2006-01-12T00:00:00-05:00",
          "attachments": null,
          "url": "https://www.courtlistener.com/docket/4251255/125/bullock-v-sheahan/",
          "recap_pdf_url": null,
          "pacer_doc_id": "0670782817",
          "description": "MINUTE entry before Judge Elaine E. Bucklo : On court's own motion, Status hearing set for 1/13/06 is reset for 2/3/2006 at 10:00 AM. Mailed notice (mpj, ) (Entered: 01/12/2006)"
        },
        {
          "row_number": 30,
          "id": 8879304,
          "entry_number": "126",
          "date_filed": "2006-01-13T00:00:00-05:00",
          "attachments": null,
          "url": "https://www.courtlistener.com/docket/4251255/126/bullock-v-sheahan/",
          "recap_pdf_url": null,
          "pacer_doc_id": "06701635082",
          "description": "MINUTE entry before Judge Sidney I. Schenkier : Status hearing held and continued to 02/14/06 at 9:00 AM. Plaintiffs' motion to reopen discovery 121 is granted consistent with the Court's ruling on the limitation of the discovery to be provided. By 01/31/06, the defendants are to make the incident reports from two divisions, for a six month period, available for review by plaintiff. Mailed notice (ar, ) (Entered: 01/19/2006)"
        },
        {
          "row_number": 31,
          "id": 8879305,
          "entry_number": "127",
          "date_filed": "2006-01-23T00:00:00-05:00",
          "attachments": null,
          "url": "https://www.courtlistener.com/docket/4251255/127/bullock-v-sheahan/",
          "recap_pdf_url": null,
          "pacer_doc_id": "06701636131",
          "description": "TRANSCRIPT of proceedings for the following dates: 12/20/05 before the Honorable Sidney I. Schenkier (ar, ) (Entered: 01/24/2006)"
        },
        {
          "row_number": 32,
          "id": 8879306,
          "entry_number": "128",
          "date_filed": "2006-01-27T00:00:00-05:00",
          "attachments": null,
          "url": "https://www.courtlistener.com/docket/4251255/128/bullock-v-sheahan/",
          "recap_pdf_url": null,
          "pacer_doc_id": "06703712411",
          "description": "TRANSCRIPT of proceedings for the following date: 10/20/2005; Before the Honorable Sidney I. Schenkier (mb, ) (Entered: 01/31/2006)"
        },
        {
          "row_number": 33,
          "id": 8879307,
          "entry_number": "129",
          "date_filed": "2006-02-01T00:00:00-05:00",
          "attachments": null,
          "url": "https://www.courtlistener.com/docket/4251255/129/bullock-v-sheahan/",
          "recap_pdf_url": null,
          "pacer_doc_id": "06701597396",
          "description": "MINUTE entry before Judge Elaine E. Bucklo : On court's own motion, status hearing set for 2/3/06 is reset for 3/3/2006 at 10:00 AM. Mailed notice (mpj, ) (Entered: 02/01/2006)"
        },
        {
          "row_number": 35,
          "id": 8879308,
          "entry_number": "130",
          "date_filed": "2006-02-03T00:00:00-05:00",
          "attachments": null,
          "url": "https://www.courtlistener.com/docket/4251255/130/bullock-v-sheahan/",
          "recap_pdf_url": null,
          "pacer_doc_id": "06703134176",
          "description": "MOTION by Plaintiffs Quentin Bullock, Jack Reid to amend/correct For Leave to File Second Amended Complaint (Attachments: # 1)(Morrissey, Thomas) (Entered: 02/03/2006)"
        },
        {
          "row_number": 36,
          "id": 8879309,
          "entry_number": "131",
          "date_filed": "2006-02-03T00:00:00-05:00",
          "attachments": null,
          "url": "https://www.courtlistener.com/docket/4251255/131/bullock-v-sheahan/",
          "recap_pdf_url": null,
          "pacer_doc_id": "0670959855",
          "description": "MOTION by Plaintiffs Quentin Bullock, Jack Reid for preliminary injunction (Morrissey, Thomas) (Entered: 02/03/2006)"
        },
        {
          "row_number": 40,
          "id": 8879313,
          "entry_number": "135",
          "date_filed": "2006-02-09T00:00:00-05:00",
          "attachments": null,
          "url": "https://www.courtlistener.com/docket/4251255/135/bullock-v-sheahan/",
          "recap_pdf_url": null,
          "pacer_doc_id": "0670711166",
          "description": "RESPONSE by Defendant Michael Sheahan Response to Plaintiffs' Motion for a Temporary Restraining Order (Attachments: # 1 Exhibit Exhibit A to Response# 2 Exhibit Group Exhibit 1.1 to Exhibit A to Response# 3 Exhibit Group Ex. 1.2 to Ex. A to Response# 4 Exhibit Group Ex. 1.3 to Ex. A to Response# 5 Exhibit Group Ex. 1.4 to Ex. A to Response# 6 Exhibit Group Ex. 1.5 to Ex. A to Response# 7 Exhibit Group Ex. 1.6 to Ex. A to Response# 8 Exhibit Group Ex. 1.7 to Ex. A to Response)(Puiszis, Steven) (Entered: 02/09/2006)"
        },
        {
          "row_number": 37,
          "id": 8879310,
          "entry_number": "132",
          "date_filed": "2006-02-03T00:00:00-05:00",
          "attachments": null,
          "url": "https://www.courtlistener.com/docket/4251255/132/bullock-v-sheahan/",
          "recap_pdf_url": null,
          "pacer_doc_id": "06703136444",
          "description": "MOTION by Plaintiffs Quentin Bullock, Jack ReidMotion for a referral of the preliminary injunction hearing to the assigned magistrate (Morrissey, Thomas) (Entered: 02/03/2006)"
        },
        {
          "row_number": 41,
          "id": 8879314,
          "entry_number": "136",
          "date_filed": "2006-02-09T00:00:00-05:00",
          "attachments": null,
          "url": "https://www.courtlistener.com/docket/4251255/136/bullock-v-sheahan/",
          "recap_pdf_url": null,
          "pacer_doc_id": "0670710003",
          "description": "NOTICE by Michael Sheahan Notice of Filing of Defendant Sheahan's Response (Puiszis, Steven) (Entered: 02/09/2006)"
        },
        {
          "row_number": 42,
          "id": 8879315,
          "entry_number": "137",
          "date_filed": "2006-02-13T00:00:00-05:00",
          "attachments": null,
          "url": "https://www.courtlistener.com/docket/4251255/137/bullock-v-sheahan/",
          "recap_pdf_url": null,
          "pacer_doc_id": "06704713396",
          "description": "MOTION by Plaintiff Quentin Bullock for discovery (Attachments: # 1 Exhibit Affidavits)(Farley, Robert) (Entered: 02/13/2006)"
        },
        {
          "row_number": 43,
          "id": 8879316,
          "entry_number": "138",
          "date_filed": "2006-02-13T00:00:00-05:00",
          "attachments": null,
          "url": "https://www.courtlistener.com/docket/4251255/138/bullock-v-sheahan/",
          "recap_pdf_url": null,
          "pacer_doc_id": "06702361833",
          "description": "PLAINTIFFS' NOTICE of Motion by Robert Hugh Farley, Jr for presentment of motion for discovery 137 before Honorable Sidney I. Schenkier on 2/16/2006 at 08:30 AM. (Farley, Robert) (Entered: 02/13/2006)"
        },
        {
          "row_number": 44,
          "id": 8879317,
          "entry_number": "139",
          "date_filed": "2006-02-13T00:00:00-05:00",
          "attachments": null,
          "url": "https://www.courtlistener.com/docket/4251255/139/bullock-v-sheahan/",
          "recap_pdf_url": null,
          "pacer_doc_id": "06704711363",
          "description": "MINUTE entry before Judge Elaine E. Bucklo : Plaintiffs' motion for preliminary injunction 131 heard on 2/10/06 and the motion is denied. Plaintiffs' motion 132 for a referral of that motion to the Magistrate Judge is denied as moot. Plaintiffs' reply on their motion to amend complaint 130 : will be due by by 2/27/2006. Targert date for ruling by mail set for 3/7/06. Mailed notice (mpj, ) (Entered: 02/13/2006)"
        },
        {
          "row_number": 46,
          "id": 8879318,
          "entry_number": "140",
          "date_filed": "2006-02-14T00:00:00-05:00",
          "attachments": null,
          "url": "https://www.courtlistener.com/docket/4251255/140/bullock-v-sheahan/",
          "recap_pdf_url": null,
          "pacer_doc_id": "06702366543",
          "description": "MINUTE entry before Judge Sidney I. Schenkier : Status/motion hearing held. Plaintiff's motion to reopen discovery 137 is granted pursuant to the limitations and directions given by the Court. The plaintiffs are given leave to take the deposition of Sergeant Milton and Superintendent Brown, limited to the grievances allegedly filed by Ahmed Morgan or Larry Gibson. The defendants are given leave to take the depositions of Mr. Morgan and Mr. Gibson limited solely to the issue of any grievances filed. No new other-retained expert may be initiated. The plaintiffs shall disclose experts and submit Rule 26(a)(2) reports by 04/03/06. The defendants shall disclose experts and submit Rule 26(a)(2) reports by 05/03/06. No expert depositions are to be taken before all expert reports are submitted. The depositions of all experts are to be completed by 06/09/06. By 02/02/06, the defendants are to produce their CIMIS data to the plaintiffs. Status hearing set for 04/11/2006 at 09:30 AM. Mailed notice (ar, ) (Entered: 02/16/2006)"
        },
        {
          "row_number": 47,
          "id": 8879319,
          "entry_number": "141",
          "date_filed": "2006-02-27T00:00:00-05:00",
          "attachments": null,
          "url": "https://www.courtlistener.com/docket/4251255/141/bullock-v-sheahan/",
          "recap_pdf_url": null,
          "pacer_doc_id": "06702376413",
          "description": "REPLY by Plaintiff Quentin Bullock to Defendant's Objection to Plaintiffs' Motion For Leave To File A Second Amended Complaint (Attachments: # 1 Exhibit A# 2 Exhibit B# 3 Exhibit C# 4 Exhibit D# 5 Exhibit E)(Farley, Robert) (Entered: 02/27/2006)"
        },
        {
          "row_number": 48,
          "id": 8879320,
          "entry_number": "142",
          "date_filed": "2006-03-01T00:00:00-05:00",
          "attachments": null,
          "url": "https://www.courtlistener.com/docket/4251255/142/bullock-v-sheahan/",
          "recap_pdf_url": null,
          "pacer_doc_id": "06702373177",
          "description": "MOTION by Defendant Michael Sheahan for extension of time to file response/reply as to motion to amend/correct 130 Motion for Leave to File a Response to Plaintiffs' Reply Brief Addressing Defendants' Objections to Plaintiffs' Motion for Leave to File Second Amended Complaint (Marsico, Frank) (Entered: 03/01/2006)"
        },
        {
          "row_number": 49,
          "id": 8879321,
          "entry_number": "143",
          "date_filed": "2006-03-01T00:00:00-05:00",
          "attachments": null,
          "url": "https://www.courtlistener.com/docket/4251255/143/bullock-v-sheahan/",
          "recap_pdf_url": null,
          "pacer_doc_id": "06702371623",
          "description": "Notice of Motion for Leave to File a Response to Plaintiffs' Reply Brief Addressing Defendants' Objections to Plaintiffs' Motion for Leave to FIle Second Amended Complaint NOTICE of Motion by Frank Joseph Marsico for presentment of motion to amend/correct 130, motion for extension of time to file response/reply, motion for relief,, 142 before Honorable Elaine E. Bucklo on 3/6/2006 at 09:15 AM. (Marsico, Frank) (Entered: 03/01/2006)"
        },
        {
          "row_number": 50,
          "id": 8879322,
          "entry_number": "144",
          "date_filed": "2006-03-02T00:00:00-05:00",
          "attachments": null,
          "url": "https://www.courtlistener.com/docket/4251255/144/bullock-v-sheahan/",
          "recap_pdf_url": null,
          "pacer_doc_id": "06702379799",
