{
  "case_id": 12198,
  "fetched_at": "2025-10-22T00:18:05.311734",
  "case_data": {
    "attorney_orgs": [
      "Hadsell, Stormer & Renick",
      "Prisoners Rights Union"
    ],
    "available_documents": [
      "Trial Court Docket",
      "Injunctive (or Injunctive-like) Relief",
      "Any published opinion"
    ],
    "case_defendants": [
      {
        "defendant_level": null,
        "institution": "",
        "institution_alt_state": null,
        "institution_city": "",
        "institution_county": "Sacramento",
        "name": "County of Sacramento",
        "defendant_level_other": "",
        "is_active": true
      },
      {
        "defendant_level": null,
        "institution": "",
        "institution_alt_state": null,
        "institution_city": "",
        "institution_county": "Sacramento",
        "name": "Sheriff John McGinness",
        "defendant_level_other": "",
        "is_active": true
      }
    ],
    "case_ongoing": "Yes",
    "case_status": "Coding Complete",
    "case_types": [
      "Jail Conditions",
      "Healthcare Access and Reproductive Issues"
    ],
    "cause_other": "",
    "causes": [
      "42 U.S.C. ยง 1983"
    ],
    "class_action_granted": "Granted",
    "class_action_sought": "Yes",
    "closing_year": null,
    "constitutional_clause": [
      {
        "value": "Cruel and Unusual Punishment"
      }
    ],
    "content_of_injunction": [
      {
        "value": "Preliminary relief granted"
      },
      {
        "value": "Develop anti-discrimination policy"
      }
    ],
    "court": "Eastern District of California",
    "custom_issues": [
      "Inmate cap imposed",
      "Maintain a law library and allow access",
      "Provide better health care"
    ],
    "defendant_payment": "$140,000 (atty fees)",
    "defendant_type": [
      {
        "value": "Jurisdiction-wide"
      },
      {
        "value": "Corrections"
      }
    ],
    "docket_status": "Complete as of retrieval date",
    "facility_type": [
      {
        "value": "Government-run"
      }
    ],
    "filing_date": "1991-03-12",
    "filing_year": 1991,
    "id": 12198,
    "injunction_duration": "",
    "issues": [
      "Jails, Prisons, Detention Centers, and Other Institutions: Crowding (General)",
      "General/Misc.: Staff (number, training, qualifications, wages)",
      "Jails, Prisons, Detention Centers, and Other Institutions: Recreation / Exercise",
      "Medical/Mental Health Care: Dental care",
      "Medical/Mental Health Care: Medical care, general",
      "Medical/Mental Health Care: Mental health care, general",
      "General/Misc.: Conditions of confinement",
      "Jails, Prisons, Detention Centers, and Other Institutions: Crowding: Pre-PLRA Population Cap",
      "Jails, Prisons, Detention Centers, and Other Institutions: Law library access",
      "Discrimination Basis: Sex discrimination",
      "Affected Sex/Gender(s): Male",
      "Affected Sex/Gender(s): Female",
      "General/Misc.: Unconstitutional conditions of confinement"
    ],
    "last_checked_date": "2020-02-07T00:00:00-05:00",
    "main_docket": {
      "id": 31099,
      "docket_entries": [
        {
          "row_number": 209,
          "id": 8808091,
          "entry_number": "4",
          "date_filed": "1991-03-12T00:00:00-05:00",
          "attachments": [],
          "url": "https://www.courtlistener.com/docket/5802165/4/pc-kaiser-v-sacramento-county/",
          "recap_pdf_url": null,
          "pacer_doc_id": null,
          "description": "PROOF OF SERVICE of complaint, lodged TRO, and notice of related cases. (old) (Entered: 03/14/1991)"
        },
        {
          "row_number": 220,
          "id": 8808092,
          "entry_number": "5",
          "date_filed": "1991-03-12T00:00:00-05:00",
          "attachments": [],
          "url": "https://www.courtlistener.com/docket/5802165/5/pc-kaiser-v-sacramento-county/",
          "recap_pdf_url": null,
          "pacer_doc_id": null,
          "description": "ORDER setting scheduling conference for 3:00 7/15/91 before Honorable William B. Shubb (cc: all counsel) (old) (Entered: 03/14/1991)"
        },
        {
          "row_number": 274,
          "id": 8808093,
          "entry_number": null,
          "date_filed": "1991-03-14T00:00:00-05:00",
          "attachments": [],
          "url": "https://www.courtlistener.com",
          "recap_pdf_url": null,
          "pacer_doc_id": null,
          "description": "LODGED: Temporary restraining order (old)"
        },
        {
          "row_number": 231,
          "id": 8808095,
          "entry_number": "6",
          "date_filed": "1991-04-01T00:00:00-05:00",
          "attachments": [],
          "url": "https://www.courtlistener.com/docket/5802165/6/pc-kaiser-v-sacramento-county/",
          "recap_pdf_url": null,
          "pacer_doc_id": null,
          "description": "MEMORANDUM by defendant Sacramento County, defendant Glen Craig in opposition to motion for temporary restraining order set for 3/28/91 @ 9:00 [2-1] (old) (Entered: 04/01/1991)"
        },
        {
          "row_number": 242,
          "id": 8808096,
          "entry_number": "7",
          "date_filed": "1991-04-01T00:00:00-05:00",
          "attachments": [],
          "url": "https://www.courtlistener.com/docket/5802165/7/pc-kaiser-v-sacramento-county/",
          "recap_pdf_url": null,
          "pacer_doc_id": null,
          "description": "DECLARATION of Edward Doonan (old) (Entered: 04/01/1991)"
        },
        {
          "row_number": 253,
          "id": 8808097,
          "entry_number": "8",
          "date_filed": "1991-04-02T00:00:00-05:00",
          "attachments": [],
          "url": "https://www.courtlistener.com/docket/5802165/8/pc-kaiser-v-sacramento-county/",
          "recap_pdf_url": null,
          "pacer_doc_id": null,
          "description": "REPLY by plaintiff Joseph Walter Kaiser, plaintiff Matthew Sasson, plaintiff Michael Fred Rodriguez, plaintiff Marie Helen Bellinger, plaintiff Debra A Wiese (old) (Entered: 04/03/1991)"
        },
        {
          "row_number": 264,
          "id": 8808098,
          "entry_number": "9",
          "date_filed": "1991-04-03T00:00:00-05:00",
          "attachments": [],
          "url": "https://www.courtlistener.com/docket/5802165/9/pc-kaiser-v-sacramento-county/",
          "recap_pdf_url": null,
          "pacer_doc_id": null,
          "description": "ADDITIONAL DECLARATION re motion for temporary restraining order set for 3/28/91 @ 9:00 [2-1] (old) (Entered: 04/03/1991)"
        },
        {
          "row_number": 1,
          "id": 8808099,
          "entry_number": "10",
          "date_filed": "1991-04-05T00:00:00-05:00",
          "attachments": [],
          "url": "https://www.courtlistener.com/docket/5802165/10/pc-kaiser-v-sacramento-county/",
          "recap_pdf_url": null,
          "pacer_doc_id": null,
          "description": "ORDER by Honorable William B. Shubb Case reassigned to Judge Gregory G. Hollows, and ; In-court hearing set for 4/25/91 @10:00 ; and plaintiff's request for a temporary restraining order prohibiting defendants from sleeping inmates on the floor of the Sacramento County Jail shall be granted by the court as a preliminary injunction. Defendants shall cease sleeping inmates on the floor beginning Tuesday, April 9, 1991, @ 8:00am and continue until further order of the court. (cc: all counsel) (old) (Entered: 04/05/1991)"
        },
        {
          "row_number": 12,
          "id": 8808100,
          "entry_number": "11",
          "date_filed": "1991-04-09T00:00:00-04:00",
          "attachments": [],
          "url": "https://www.courtlistener.com/docket/5802165/11/pc-kaiser-v-sacramento-county/",
          "recap_pdf_url": null,
          "pacer_doc_id": null,
          "description": "PROOF OF SERVICE (RETURN) by defendant Sacramento County, defendant Glen Craig of EMPORARY RESTRAINING ORDER (old) (Entered: 04/10/1991)"
        },
        {
          "row_number": 276,
          "id": 8808103,
          "entry_number": null,
          "date_filed": "1991-04-17T00:00:00-04:00",
          "attachments": [],
          "url": "https://www.courtlistener.com",
          "recap_pdf_url": null,
          "pacer_doc_id": null,
          "description": "EX PARTE APPLICATION by defendant Sacramento County, defendant Glen Craig for order shortening time; not to be signed (kh)"
        },
        {
          "row_number": 45,
          "id": 8808104,
          "entry_number": "14",
          "date_filed": "1991-04-17T00:00:00-04:00",
          "attachments": [],
          "url": "https://www.courtlistener.com/docket/5802165/14/pc-kaiser-v-sacramento-county/",
          "recap_pdf_url": null,
          "pacer_doc_id": null,
          "description": "ORDER by Judge Gregory G. Hollows ORDERING hearing on motion to continue hearing on the motion for preliminary injunction [12-1] at 9:00 on 4/19/91, Briefing sched for motion for prelinj is vacated, hearing date retained (cc: all counsel) (kh) (Entered: 04/17/1991)"
        },
        {
          "row_number": 56,
          "id": 8808105,
          "entry_number": "15",
          "date_filed": "1991-04-19T00:00:00-04:00",
          "attachments": [],
          "url": "https://www.courtlistener.com/docket/5802165/15/pc-kaiser-v-sacramento-county/",
          "recap_pdf_url": null,
          "pacer_doc_id": null,
          "description": "MINUTES of ; In-court hearing Retraining order set for 6/16/91 @ 1:00 Openi9ng brief by 5/2/91, opposition 5/10/91, response 5/15/91. (old) (Entered: 04/22/1991)"
        },
        {
          "row_number": 78,
          "id": 8808107,
          "entry_number": "17",
          "date_filed": "1991-04-23T00:00:00-04:00",
          "attachments": [],
          "url": "https://www.courtlistener.com/docket/5802165/17/pc-kaiser-v-sacramento-county/",
          "recap_pdf_url": null,
          "pacer_doc_id": null,
          "description": "ORDER by Magistrate Judge Gregory G. Hollows GRANTING motion to continue hearing on the motion for preliminary injunction [12-1] in part only, SETTING hearing on motion for temporary restraining [2-1] TO 1:00 pm on 5/16/91 FURTHER ORDERING plaintiff's brief in support of the prelin shall be filed and personnally served on or before 5/2/91; dfts brief in opp or stmt of non-oppo shall be file on or before 5/10/91 and served same day on pla; pla's reply if any file and served on or before 5/15/91 (cc: all counsel) (kh) (Entered: 04/23/1991)"
        },
        {
          "row_number": 89,
          "id": 8808108,
          "entry_number": "18",
          "date_filed": "1991-04-23T00:00:00-04:00",
          "attachments": [],
          "url": "https://www.courtlistener.com/docket/5802165/18/pc-kaiser-v-sacramento-county/",
          "recap_pdf_url": null,
          "pacer_doc_id": null,
          "description": "MOTION by plaintiff Joseph Walter Kaiser, plaintiff Matthew Sasson, plaintiff Michael Fred Rodriguez, plaintiff Marie Helen Bellinger, plaintiff Debra A Wiese to amend set for 5/23/91 @ 10:00 (old) (Entered: 04/23/1991)"
        },
        {
          "row_number": 278,
          "id": 8808110,
          "entry_number": null,
          "date_filed": "1991-04-23T00:00:00-04:00",
          "attachments": [],
          "url": "https://www.courtlistener.com",
          "recap_pdf_url": null,
          "pacer_doc_id": null,
          "description": "LODGED: First amended complaint (old)"
        },
        {
          "row_number": 100,
          "id": 8808111,
          "entry_number": "19",
          "date_filed": "1991-05-03T00:00:00-04:00",
          "attachments": [],
          "url": "https://www.courtlistener.com/docket/5802165/19/pc-kaiser-v-sacramento-county/",
          "recap_pdf_url": null,
          "pacer_doc_id": null,
          "description": "MOTION by plaintiff Joseph Walter Kaiser, plaintiff Matthew Sasson, plaintiff Michael Fred Rodriguez, plaintiff Marie Helen Bellinger, plaintiff Debra A Wiese for preliminary injunction set for 5/16/91 @ 9:00 (old) (Entered: 05/06/1991)"
        },
        {
          "row_number": 279,
          "id": 8808112,
          "entry_number": null,
          "date_filed": "1991-05-03T00:00:00-04:00",
          "attachments": [],
          "url": "https://www.courtlistener.com",
          "recap_pdf_url": null,
          "pacer_doc_id": null,
          "description": "LODGED: preliminary injunction (old)"
        },
        {
          "row_number": 112,
          "id": 8808113,
          "entry_number": "20",
          "date_filed": "1991-05-08T00:00:00-04:00",
          "attachments": [],
          "url": "https://www.courtlistener.com/docket/5802165/20/pc-kaiser-v-sacramento-county/",
          "recap_pdf_url": null,
          "pacer_doc_id": null,
          "description": "STATEMENT by defendant Sacramento County of non-opposition in support of motion to amend set for 5/23/91 @ 10:00 [18-1] (old) (Entered: 05/09/1991)"
        },
        {
          "row_number": 123,
          "id": 8808114,
          "entry_number": "21",
          "date_filed": "1991-05-10T00:00:00-04:00",
          "attachments": [],
          "url": "https://www.courtlistener.com/docket/5802165/21/pc-kaiser-v-sacramento-county/",
          "recap_pdf_url": null,
          "pacer_doc_id": null,
          "description": "MEMORANDUM by defendant Sacramento County in opposition to motion for preliminary injunction set for 5/16/91 @ 9:00 [19-1] (old) (Entered: 05/13/1991)"
        },
        {
          "row_number": 134,
          "id": 8808115,
          "entry_number": "22",
          "date_filed": "1991-05-10T00:00:00-04:00",
          "attachments": [],
          "url": "https://www.courtlistener.com/docket/5802165/22/pc-kaiser-v-sacramento-county/",
          "recap_pdf_url": null,
          "pacer_doc_id": null,
          "description": "DECLARATION of Jim Ackermann in opposition re motion for preliminary injunction set for 5/16/91 @ 9:00 [19-1] (old) (Entered: 05/13/1991)"
        },
        {
          "row_number": 145,
          "id": 8808116,
          "entry_number": "23",
          "date_filed": "1991-05-10T00:00:00-04:00",
          "attachments": [],
          "url": "https://www.courtlistener.com/docket/5802165/23/pc-kaiser-v-sacramento-county/",
          "recap_pdf_url": null,
          "pacer_doc_id": null,
          "description": "DECLARATION of William Powell in opposition re motion for preliminary injunction set for 5/16/91 @ 9:00 [19-1] (old) (Entered: 05/13/1991)"
        },
        {
          "row_number": 156,
          "id": 8808117,
          "entry_number": "24",
          "date_filed": "1991-05-10T00:00:00-04:00",
          "attachments": [],
          "url": "https://www.courtlistener.com/docket/5802165/24/pc-kaiser-v-sacramento-county/",
          "recap_pdf_url": null,
          "pacer_doc_id": null,
          "description": "DECLARATION of Robert E. Doran in opposition re motion for preliminary injunction set for 5/16/91 @ 9:00 [19-1] (old) (Entered: 05/13/1991)"
        },
        {
          "row_number": 167,
          "id": 8808118,
          "entry_number": "25",
          "date_filed": "1991-05-10T00:00:00-04:00",
          "attachments": [],
          "url": "https://www.courtlistener.com/docket/5802165/25/pc-kaiser-v-sacramento-county/",
          "recap_pdf_url": null,
          "pacer_doc_id": null,
          "description": "DECLARATION of Linda Giannelli in opposition re motion for preliminary injunction set for 5/16/91 @ 9:00 [19-1] (old) (Entered: 05/13/1991)"
        },
        {
          "row_number": 177,
          "id": 8808119,
          "entry_number": "26",
          "date_filed": "1991-05-10T00:00:00-04:00",
          "attachments": [],
          "url": "https://www.courtlistener.com/docket/5802165/26/pc-kaiser-v-sacramento-county/",
          "recap_pdf_url": null,
          "pacer_doc_id": null,
          "description": "DECLARATION of Ronald Usher in opposition re motion for preliminary injunction set for 5/16/91 @ 9:00 [19-1] (old) (Entered: 05/13/1991)"
        },
        {
          "row_number": 196,
          "id": 8808121,
          "entry_number": "28",
          "date_filed": "1991-05-10T00:00:00-04:00",
          "attachments": [],
          "url": "https://www.courtlistener.com/docket/5802165/28/pc-kaiser-v-sacramento-county/",
          "recap_pdf_url": null,
          "pacer_doc_id": null,
          "description": "DECLARATION of Dennis M. Cuddy in opposition re motion for preliminary injunction set for 5/16/91 @ 9:00 [19-1] (old) (Entered: 05/13/1991)"
        },
        {
          "row_number": 197,
          "id": 8808122,
          "entry_number": "29",
          "date_filed": "1991-05-10T00:00:00-04:00",
          "attachments": [],
          "url": "https://www.courtlistener.com/docket/5802165/29/pc-kaiser-v-sacramento-county/",
          "recap_pdf_url": null,
          "pacer_doc_id": null,
          "description": "DECLARATION of Lorie Rieger in opposition re motion for preliminary injunction set for 5/16/91 @ 9:00 [19-1] (old) (Entered: 05/13/1991)"
        },
        {
          "row_number": 199,
          "id": 8808123,
          "entry_number": "30",
          "date_filed": "1991-05-10T00:00:00-04:00",
          "attachments": [],
          "url": "https://www.courtlistener.com/docket/5802165/30/pc-kaiser-v-sacramento-county/",
          "recap_pdf_url": null,
          "pacer_doc_id": null,
          "description": "DECLARATION of Gail Pittack in opposition re motion for preliminary injunction set for 5/16/91 @ 9:00 [19-1] (old) (Entered: 05/13/1991)"
        },
        {
          "row_number": 200,
          "id": 8808124,
          "entry_number": "31",
          "date_filed": "1991-05-10T00:00:00-04:00",
          "attachments": [],
          "url": "https://www.courtlistener.com/docket/5802165/31/pc-kaiser-v-sacramento-county/",
          "recap_pdf_url": null,
          "pacer_doc_id": null,
          "description": "DECLARATION of Edward Doonan in opposition re motion for preliminary injunction set for 5/16/91 @ 9:00 [19-1] (old) (Entered: 05/13/1991)"
        },
        {
          "row_number": 201,
          "id": 8808125,
          "entry_number": "32",
          "date_filed": "1991-05-10T00:00:00-04:00",
          "attachments": [],
          "url": "https://www.courtlistener.com/docket/5802165/32/pc-kaiser-v-sacramento-county/",
          "recap_pdf_url": null,
          "pacer_doc_id": null,
          "description": "DECLARATION of Fred Campbell in opposition re motion for preliminary injunction set for 5/16/91 @ 9:00 [19-1] (old) (Entered: 05/13/1991)"
        },
        {
          "row_number": 202,
          "id": 8808126,
          "entry_number": "33",
          "date_filed": "1991-05-15T00:00:00-04:00",
          "attachments": [],
          "url": "https://www.courtlistener.com/docket/5802165/33/pc-kaiser-v-sacramento-county/",
          "recap_pdf_url": null,
          "pacer_doc_id": null,
          "description": "RESPONSE by plaintiff Joseph Walter Kaiser, plaintiff Matthew Sasson, plaintiff Michael Fred Rodriguez to opposition to motion for preliminary injunction. (old) (Entered: 05/15/1991)"
        },
        {
          "row_number": 203,
          "id": 8808127,
          "entry_number": "34",
          "date_filed": "1991-05-16T00:00:00-04:00",
          "attachments": [],
          "url": "https://www.courtlistener.com/docket/5802165/34/pc-kaiser-v-sacramento-county/",
          "recap_pdf_url": null,
          "pacer_doc_id": null,
          "description": "MINUTES of preliminary injunction: Plaintiff have 30 days to amend the complaint; Court to prepare order. (old) (Entered: 05/17/1991)"
        },
        {
          "row_number": 204,
          "id": 8808128,
          "entry_number": "35",
          "date_filed": "1991-05-30T00:00:00-04:00",
          "attachments": [],
          "url": "https://www.courtlistener.com/docket/5802165/35/pc-kaiser-v-sacramento-county/",
          "recap_pdf_url": null,
          "pacer_doc_id": null,
          "description": "LETTER to court from Michele Bach, counsel, County of Sacramento re submitting of quarterly reports identifing the current rated capacity of the Main Jail. (old) (Entered: 05/30/1991)"
        },
        {
          "row_number": 205,
          "id": 8808129,
          "entry_number": "36",
          "date_filed": "1991-05-31T00:00:00-04:00",
          "attachments": [],
          "url": "https://www.courtlistener.com/docket/5802165/36/pc-kaiser-v-sacramento-county/",
          "recap_pdf_url": null,
          "pacer_doc_id": null,
          "description": "DECLARATION of Edward Doonan re floor sleeping (old) (Entered: 06/03/1991)"
        },
        {
          "row_number": 207,
          "id": 8808131,
          "entry_number": "38",
          "date_filed": "1991-06-03T00:00:00-04:00",
          "attachments": [],
          "url": "https://www.courtlistener.com/docket/5802165/38/pc-kaiser-v-sacramento-county/",
          "recap_pdf_url": null,
          "pacer_doc_id": null,
          "description": "ORDER by Judge Gregory G. Hollows ; Scheduling conf set for 7/19/91 @ 10:00 Plaintiff's motion for preliminary injunction is granted in part. Either party may move to modify or dissolve this injunction at any time following proper notice to the opposing party. See order for more specific details. (cc: all counsel) (old) (Entered: 06/03/1991)"
        },
        {
          "row_number": 208,
          "id": 8808132,
          "entry_number": "39",
          "date_filed": "1991-06-03T00:00:00-04:00",
          "attachments": [],
          "url": "https://www.courtlistener.com/docket/5802165/39/pc-kaiser-v-sacramento-county/",
          "recap_pdf_url": null,
          "pacer_doc_id": null,
          "description": "SUPPLMENTAL Declaration of Edward Doonan re floor sleeping. (old) (Entered: 06/05/1991)"
        },
        {
          "row_number": 210,
          "id": 8808133,
          "entry_number": "40",
          "date_filed": "1991-06-11T00:00:00-04:00",
          "attachments": [],
          "url": "https://www.courtlistener.com/docket/5802165/40/pc-kaiser-v-sacramento-county/",
          "recap_pdf_url": null,
          "pacer_doc_id": null,
          "description": "DECLARATION of Deputy Sheriff William Powell (old) (Entered: 06/12/1991)"
        },
        {
          "row_number": 212,
          "id": 8808135,
          "entry_number": "42",
          "date_filed": "1991-06-18T00:00:00-04:00",
          "attachments": [],
          "url": "https://www.courtlistener.com/docket/5802165/42/pc-kaiser-v-sacramento-county/",
          "recap_pdf_url": null,
          "pacer_doc_id": null,
          "description": "MOTION by plaintiff Joseph Walter Kaiser to certify class action set for 7/25/91 @ 10:00 (old) (Entered: 06/21/1991)"
        },
        {
          "row_number": 214,
          "id": 8808140,
          "entry_number": "44",
          "date_filed": "1991-06-25T00:00:00-04:00",
          "attachments": [],
          "url": "https://www.courtlistener.com/docket/5802165/44/pc-kaiser-v-sacramento-county/",
          "recap_pdf_url": null,
          "pacer_doc_id": null,
          "description": "APPLICATION by plaintiff's to substitute modified second amended complaint (old) (Entered: 06/25/1991)"
        },
        {
          "row_number": 283,
          "id": 8808141,
          "entry_number": null,
          "date_filed": "1991-06-25T00:00:00-04:00",
          "attachments": [],
          "url": "https://www.courtlistener.com",
          "recap_pdf_url": null,
          "pacer_doc_id": null,
          "description": "LODGED: modified second amended complaint (old)"
        },
        {
          "row_number": 215,
          "id": 8808142,
          "entry_number": "45",
          "date_filed": "1991-06-25T00:00:00-04:00",
          "attachments": [],
          "url": "https://www.courtlistener.com/docket/5802165/45/pc-kaiser-v-sacramento-county/",
          "recap_pdf_url": null,
          "pacer_doc_id": null,
          "description": "APPLICATION by plaintiff's to continue hearing (old) (Entered: 06/25/1991)"
        },
        {
          "row_number": 284,
          "id": 8808143,
          "entry_number": null,
          "date_filed": "1991-06-25T00:00:00-04:00",
          "attachments": [],
          "url": "https://www.courtlistener.com",
          "recap_pdf_url": null,
          "pacer_doc_id": null,
          "description": "LODGED: proposed order to file medified second amended complaint. (old)"
        },
        {
          "row_number": 285,
          "id": 8808144,
          "entry_number": null,
          "date_filed": "1991-06-25T00:00:00-04:00",
          "attachments": [],
          "url": "https://www.courtlistener.com",
          "recap_pdf_url": null,
          "pacer_doc_id": null,
          "description": "LODGED: proposed order to continue status conference (old)"
        },
        {
          "row_number": 216,
          "id": 8808145,
          "entry_number": "46",
          "date_filed": "1991-07-01T00:00:00-04:00",
          "attachments": [],
          "url": "https://www.courtlistener.com/docket/5802165/46/pc-kaiser-v-sacramento-county/",
          "recap_pdf_url": null,
          "pacer_doc_id": null,
          "description": "JOINT DISCOVERY REPORT by plaintiff Joseph Walter Kaiser, plaintiff Matthew Sasson, plaintiff Michael Fred Rodriguez, plaintiff Marie Helen Bellinger, plaintiff Debra A Wiese, defendant Sacramento County, defendant Glen Craig of (old) (Entered: 07/01/1991)"
        },
        {
          "row_number": 217,
          "id": 8808146,
          "entry_number": "47",
          "date_filed": "1991-07-01T00:00:00-04:00",
          "attachments": [],
          "url": "https://www.courtlistener.com/docket/5802165/47/pc-kaiser-v-sacramento-county/",
          "recap_pdf_url": null,
          "pacer_doc_id": null,
          "description": "STATUS REPORT by defendant Sacramento County (old) (Entered: 07/01/1991)"
        },
        {
          "row_number": 218,
          "id": 8808147,
          "entry_number": "48",
          "date_filed": "1991-07-01T00:00:00-04:00",
          "attachments": [],
          "url": "https://www.courtlistener.com/docket/5802165/48/pc-kaiser-v-sacramento-county/",
          "recap_pdf_url": null,
          "pacer_doc_id": null,
          "description": "STATUS REPORT by plaintiffs' (old) (Entered: 07/01/1991)"
        },
        {
          "row_number": 219,
          "id": 8808148,
          "entry_number": "49",
          "date_filed": "1991-07-10T00:00:00-04:00",
          "attachments": [],
          "url": "https://www.courtlistener.com/docket/5802165/49/pc-kaiser-v-sacramento-county/",
          "recap_pdf_url": null,
          "pacer_doc_id": null,
          "description": "REMARK: Defendant County of Sacramento's Quarterly Report. (old) (Entered: 07/10/1991)"
        },
        {
          "row_number": 221,
          "id": 8808149,
          "entry_number": "50",
          "date_filed": "1991-07-10T00:00:00-04:00",
          "attachments": [],
          "url": "https://www.courtlistener.com/docket/5802165/50/pc-kaiser-v-sacramento-county/",
          "recap_pdf_url": null,
          "pacer_doc_id": null,
          "description": "APPLICATION by plaintiff to continue pending matters. (old) (Entered: 07/10/1991)"
        },
        {
          "row_number": 224,
          "id": 8808152,
          "entry_number": "53",
          "date_filed": "1991-07-25T00:00:00-04:00",
          "attachments": [],
          "url": "https://www.courtlistener.com/docket/5802165/53/pc-kaiser-v-sacramento-county/",
          "recap_pdf_url": null,
          "pacer_doc_id": null,
          "description": "MINUTES of plaintiff's motion to amend vacating hearing re motion for preliminary injunction set for 7/25/91 @ 10:00 [41-1], vacating hearing re motion to amend set for 7/25/91 @ 10:00 [43-1] (old) (Entered: 07/25/1991)"
        },
        {
          "row_number": 226,
          "id": 8808154,
          "entry_number": "55",
          "date_filed": "1991-08-01T00:00:00-04:00",
          "attachments": [],
          "url": "https://www.courtlistener.com/docket/5802165/55/pc-kaiser-v-sacramento-county/",
          "recap_pdf_url": null,
          "pacer_doc_id": null,
          "description": "MEMORANDUM of points and athorities by defendant Sacramento County in opposition to motion to certify class action set for 7/25/91 @ 10:00 [42-1] (old) (Entered: 08/01/1991)"
        },
        {
          "row_number": 227,
          "id": 8808155,
          "entry_number": "56",
          "date_filed": "1991-08-01T00:00:00-04:00",
          "attachments": [],
          "url": "https://www.courtlistener.com/docket/5802165/56/pc-kaiser-v-sacramento-county/",
          "recap_pdf_url": null,
          "pacer_doc_id": null,
          "description": "MEMORANDUM by defendant Sacramento County, defendant Glen Craig in opposition to motion for preliminary injunction set for 7/25/91 @ 10:00 [41-1] (old) (Entered: 08/01/1991)"
        },
        {
          "row_number": 228,
          "id": 8808156,
          "entry_number": "57",
          "date_filed": "1991-08-01T00:00:00-04:00",
          "attachments": [],
          "url": "https://www.courtlistener.com/docket/5802165/57/pc-kaiser-v-sacramento-county/",
          "recap_pdf_url": null,
          "pacer_doc_id": null,
          "description": "DECLARATION of Albert C. Locher in opposition re motion for preliminary injunction set for 7/25/91 @ 10:00 [41-1] (old) (Entered: 08/01/1991)"
        },
        {
          "row_number": 229,
          "id": 8808157,
          "entry_number": "58",
          "date_filed": "1991-08-01T00:00:00-04:00",
          "attachments": [],
          "url": "https://www.courtlistener.com/docket/5802165/58/pc-kaiser-v-sacramento-county/",
          "recap_pdf_url": null,
          "pacer_doc_id": null,
          "description": "DECLARATION of Frank Martinez in opposition re motion for preliminary injunction set for 7/25/91 @ 10:00 [41-1] (old) (Entered: 08/01/1991)"
        },
        {
          "row_number": 232,
          "id": 8808159,
          "entry_number": "60",
          "date_filed": "1991-08-02T00:00:00-04:00",
          "attachments": [],
          "url": "https://www.courtlistener.com/docket/5802165/60/pc-kaiser-v-sacramento-county/",
          "recap_pdf_url": null,
          "pacer_doc_id": null,
          "description": "NOTICE by plaintiff Joseph Walter Kaiser, plaintiff Matthew Sasson, plaintiff Michael Fred Rodriguez, plaintiff Marie Helen Bellinger, plaintiff Debra A Wiese of association of counsel of Mark Merin #043849, 2001 P Street Sacramento ca 95814 (old) (Entered: 08/02/1991)"
        },
        {
          "row_number": 233,
          "id": 8808160,
          "entry_number": "61",
          "date_filed": "1991-08-02T00:00:00-04:00",
          "attachments": [],
          "url": "https://www.courtlistener.com/docket/5802165/61/pc-kaiser-v-sacramento-county/",
          "recap_pdf_url": null,
          "pacer_doc_id": null,
          "description": "NOTICE by plaintiff Joseph Walter Kaiser, plaintiff Matthew Sasson, plaintiff Michael Fred Rodriguez, plaintiff Marie Helen Bellinger, plaintiff Debra A Wiese of change of address of Paul W Comisky to 2310 J Street, P.O. BOX 1019 Sacramento CA 95814 (old) (Entered: 08/02/1991)"
        },
        {
          "row_number": 238,
          "id": 8808165,
          "entry_number": "66",
          "date_filed": "1991-08-14T00:00:00-04:00",
          "attachments": [],
          "url": "https://www.courtlistener.com/docket/5802165/66/pc-kaiser-v-sacramento-county/",
          "recap_pdf_url": null,
          "pacer_doc_id": null,
          "description": "DECLARATION of William Powell in opposition re motion for preliminary injunction set for 8/15/91 @ 1:30 [41-1] (old) (Entered: 08/14/1991)"
        },
        {
          "row_number": 239,
          "id": 8808166,
          "entry_number": "67",
          "date_filed": "1991-08-14T00:00:00-04:00",
          "attachments": [],
          "url": "https://www.courtlistener.com/docket/5802165/67/pc-kaiser-v-sacramento-county/",
          "recap_pdf_url": null,
          "pacer_doc_id": null,
          "description": "DECLARATION of Albert C. Locher in opposition re motion for preliminary injunction set for 8/15/91 @ 1:30 [41-1] (old) (Entered: 08/14/1991)"
        },
        {
          "row_number": 240,
          "id": 8808167,
          "entry_number": "68",
          "date_filed": "1991-08-15T00:00:00-04:00",
          "attachments": [],
          "url": "https://www.courtlistener.com/docket/5802165/68/pc-kaiser-v-sacramento-county/",
          "recap_pdf_url": null,
          "pacer_doc_id": null,
          "description": "MINUTES denying motion for preliminary injunction set for 7/25/91 @ 10:00 [41-1], granting motion to amend set for 7/25/91 @ 10:00 [43-1], amended complaint is due 45 days from date of order, the motion for class certification is deferred until the court knows what the true claims are in the dispute (old) (Entered: 08/15/1991)"
        },
        {
          "row_number": 241,
          "id": 8808168,
          "entry_number": "69",
          "date_filed": "1991-08-15T00:00:00-04:00",
          "attachments": [],
          "url": "https://www.courtlistener.com/docket/5802165/69/pc-kaiser-v-sacramento-county/",
          "recap_pdf_url": null,
          "pacer_doc_id": null,
          "description": "EXHIBIT list by plaintiffs' (old) (Entered: 08/15/1991)"
        },
        {
          "row_number": 244,
          "id": 8808170,
          "entry_number": "71",
          "date_filed": "1991-08-19T00:00:00-04:00",
          "attachments": [],
          "url": "https://www.courtlistener.com/docket/5802165/71/pc-kaiser-v-sacramento-county/",
          "recap_pdf_url": null,
          "pacer_doc_id": null,
          "description": "ORDER by Judge Gregory G. Hollows that pltfs shall file and personally serve on defts a third amended complaint within 45 days; defts shall answer within 25 days after complaint is served; court wsill defer ruling on pltfs' mtn for class certification at this time; and the commencement of discovery will be deferred until after the third amended complaint is filed and answered. (cc: all counsel) (old) (Entered: 08/19/1991)"
        },
        {
          "row_number": 246,
          "id": 8808172,
          "entry_number": "73",
          "date_filed": "1991-10-07T00:00:00-04:00",
          "attachments": [],
          "url": "https://www.courtlistener.com/docket/5802165/73/pc-kaiser-v-sacramento-county/",
          "recap_pdf_url": null,
          "pacer_doc_id": null,
          "description": "NOTICE OF MOTION AND MOTION by plaintiff Joseph Walter Kaiser, plaintiff Matthew Sasson, plaintiff Michael Fred Rodriguez, plaintiff Marie Helen Bellinger, plaintiff Debra A Wiese for preliminary injunction set for 11/7/91 @ 10:00 before GGH ; points and authorities and declaration in support thereof (old) (Entered: 10/07/1991)"
        },
        {
          "row_number": 286,
          "id": 8808173,
          "entry_number": null,
          "date_filed": "1991-10-07T00:00:00-04:00",
          "attachments": [],
          "url": "https://www.courtlistener.com",
          "recap_pdf_url": null,
          "pacer_doc_id": null,
          "description": "LODGED proposed preliminary injunction re: law library access (old)"
        },
        {
          "row_number": 249,
          "id": 8808176,
          "entry_number": "76",
          "date_filed": "1991-10-18T00:00:00-04:00",
          "attachments": [],
          "url": "https://www.courtlistener.com/docket/5802165/76/pc-kaiser-v-sacramento-county/",
          "recap_pdf_url": null,
          "pacer_doc_id": null,
          "description": "NOTICE OF MOTION AND MOTION by defendant Sacramento County, defendant Glen Craig to dismiss plaintiff's third amended complaint set for 11/21/91 @ 10:00 (old) (Entered: 10/18/1991)"
        },
        {
          "row_number": 251,
          "id": 8808178,
          "entry_number": "78",
          "date_filed": "1991-10-21T00:00:00-04:00",
          "attachments": [],
          "url": "https://www.courtlistener.com/docket/5802165/78/pc-kaiser-v-sacramento-county/",
          "recap_pdf_url": null,
          "pacer_doc_id": null,
          "description": "EXHIBIT list by plaintiffs and declaration of Mark E Merin (old) (Entered: 10/21/1991)"
        },
        {
          "row_number": 252,
          "id": 8808179,
          "entry_number": "79",
          "date_filed": "1991-10-22T00:00:00-04:00",
          "attachments": [],
          "url": "https://www.courtlistener.com/docket/5802165/79/pc-kaiser-v-sacramento-county/",
          "recap_pdf_url": null,
          "pacer_doc_id": null,
          "description": "ORDER RELATING CASES by Judge John F. Moulds relating CIV S 79-666 to this case (cc: all counsel) (old) (Entered: 10/22/1991)"
        },
        {
          "row_number": 254,
          "id": 8808180,
          "entry_number": "80",
          "date_filed": "1991-10-24T00:00:00-04:00",
          "attachments": [],
          "url": "https://www.courtlistener.com/docket/5802165/80/pc-kaiser-v-sacramento-county/",
          "recap_pdf_url": null,
          "pacer_doc_id": null,
          "description": "MEMORANDUM by defendant Sacramento County, defendant Glen Craig in opposition to motion for preliminary injunction set for 11/7/91 @ 10:00 before GGH [73-1] (old) (Entered: 10/25/1991)"
        },
        {
          "row_number": 255,
          "id": 8808181,
          "entry_number": "81",
          "date_filed": "1991-10-24T00:00:00-04:00",
          "attachments": [],
          "url": "https://www.courtlistener.com/docket/5802165/81/pc-kaiser-v-sacramento-county/",
          "recap_pdf_url": null,
          "pacer_doc_id": null,
          "description": "DECLARATION of Judy Farrey in opposition re motion for preliminary injunction set for 11/7/91 @ 10:00 before GGH [73-1] (old) (Entered: 10/25/1991)"
        },
        {
          "row_number": 258,
          "id": 8808184,
          "entry_number": "84",
          "date_filed": "1991-10-24T00:00:00-04:00",
          "attachments": [],
          "url": "https://www.courtlistener.com/docket/5802165/84/pc-kaiser-v-sacramento-county/",
          "recap_pdf_url": null,
          "pacer_doc_id": null,
          "description": "PROOF OF SERVICE by defendant Sacramento County, defendant Glen Craig of declaration [83-1], declaration [82-1], declaration [81-1], memorandum [80-1] (old) (Entered: 10/25/1991)"
        },
        {
          "row_number": 260,
          "id": 8808186,
          "entry_number": "86",
          "date_filed": "1991-10-30T00:00:00-05:00",
          "attachments": [],
          "url": "https://www.courtlistener.com/docket/5802165/86/pc-kaiser-v-sacramento-county/",
          "recap_pdf_url": null,
          "pacer_doc_id": null,
          "description": "REPLY to motions by plaintiff (old) (Entered: 10/30/1991)"
        },
        {
          "row_number": 261,
          "id": 8808187,
          "entry_number": "87",
          "date_filed": "1991-10-30T00:00:00-05:00",
          "attachments": [],
          "url": "https://www.courtlistener.com/docket/5802165/87/pc-kaiser-v-sacramento-county/",
          "recap_pdf_url": null,
          "pacer_doc_id": null,
          "description": "NOTICE of association of attorney by plaintiffs. (old) (Entered: 10/30/1991)"
        },
        {
          "row_number": 262,
          "id": 8808188,
          "entry_number": "88",
          "date_filed": "1991-11-07T00:00:00-05:00",
          "attachments": null,
          "url": "https://www.courtlistener.com/docket/5802165/88/pc-kaiser-v-sacramento-county/",
          "recap_pdf_url": null,
          "pacer_doc_id": null,
          "description": "RESPONSE by plintiff to defendant's motion to dismiss third amended complaint. (old) (Entered: 11/08/1991)"
        },
        {
          "row_number": 265,
          "id": 8808190,
          "entry_number": "91",
          "date_filed": "1991-11-18T00:00:00-05:00",
          "attachments": null,
          "url": "https://www.courtlistener.com/docket/5802165/91/pc-kaiser-v-sacramento-county/",
          "recap_pdf_url": null,
          "pacer_doc_id": null,
          "description": "REQUEST by defendant Sacramento County, defendant Glen Craig for extension of time in shich to file reply memorandum. (old) (Entered: 11/19/1991)"
        },
        {
          "row_number": 267,
          "id": 8808192,
          "entry_number": "93",
          "date_filed": "1991-11-18T00:00:00-05:00",
          "attachments": null,
          "url": "https://www.courtlistener.com/docket/5802165/93/pc-kaiser-v-sacramento-county/",
          "recap_pdf_url": null,
          "pacer_doc_id": null,
          "description": "DECLARATION of Steven Kaiser in support of request for extension of time. (old) (Entered: 11/19/1991)"
        },
        {
          "row_number": 269,
          "id": 8808194,
          "entry_number": "95",
          "date_filed": "1991-11-18T00:00:00-05:00",
          "attachments": null,
          "url": "https://www.courtlistener.com/docket/5802165/95/pc-kaiser-v-sacramento-county/",
          "recap_pdf_url": null,
          "pacer_doc_id": null,
          "description": "PROOF OF SERVICE by defendant Sacramento County, defendant Glen Craig of reply memorandum in support of motion to dismiss. (old) (Entered: 11/19/1991)"
        },
        {
          "row_number": 270,
          "id": 8808195,
          "entry_number": "96",
          "date_filed": "1991-11-18T00:00:00-05:00",
          "attachments": null,
          "url": "https://www.courtlistener.com/docket/5802165/96/pc-kaiser-v-sacramento-county/",
          "recap_pdf_url": null,
          "pacer_doc_id": null,
          "description": "PROOF OF SERVICE by defendant Sacramento County, defendant Glen Craig of of rply memorandum of ppoints and authorities in support of motion to dismiss. (old) (Entered: 11/19/1991)"
        },
        {
          "row_number": 3,
          "id": 8808200,
          "entry_number": "101",
          "date_filed": "1991-12-06T00:00:00-05:00",
          "attachments": null,
          "url": "https://www.courtlistener.com/docket/5802165/101/pc-kaiser-v-sacramento-county/",
          "recap_pdf_url": null,
          "pacer_doc_id": null,
          "description": "AMENDED ORDER by Judge Gregory G. Hollows; that pltf's request for a preliminary injuction re law library access is DENYIED, with the exception that deft's are ordered to post the lists of legal reference materials as stated previously (cc: all counsel) (old) (Entered: 12/06/1991)"
        },
        {
          "row_number": 4,
          "id": 8808201,
          "entry_number": "102",
          "date_filed": "1991-12-06T00:00:00-05:00",
          "attachments": null,
          "url": "https://www.courtlistener.com/docket/5802165/102/pc-kaiser-v-sacramento-county/",
          "recap_pdf_url": null,
          "pacer_doc_id": null,
          "description": "ORDER by Judge Gregory G. Hollows Discovery ddl set 11/20/92; Mtn filing ddl set 12/18/92; Pretrial conf (final) set 1/15/93 at 11:00; Trial set 2/8/93 at 9:00 for 17 days (cc: all counsel) (old) (Entered: 12/06/1991)"
        },
        {
          "row_number": 6,
          "id": 8808204,
          "entry_number": "104",
          "date_filed": "1991-12-19T00:00:00-05:00",
          "attachments": null,
          "url": "https://www.courtlistener.com/docket/5802165/104/pc-kaiser-v-sacramento-county/",
          "recap_pdf_url": null,
          "pacer_doc_id": null,
          "description": "PROOF OF SERVICE by defendant Sacramento County, defendant Glen Craig of response [103-1] (old) (Entered: 12/19/1991)"
        },
        {
          "row_number": 8,
          "id": 8808206,
          "entry_number": "106",
          "date_filed": "1992-01-09T00:00:00-05:00",
          "attachments": null,
          "url": "https://www.courtlistener.com/docket/5802165/106/pc-kaiser-v-sacramento-county/",
          "recap_pdf_url": null,
          "pacer_doc_id": null,
          "description": "Quarterly Report by defendant Sacramento County, defendant Glen Craig in response to courts order of 5/31/91 (filed 6/3/91) requiring defts to supply court with quarterly report of average daily population. (old) (Entered: 01/09/1992)"
        },
        {
          "row_number": 10,
          "id": 8808208,
          "entry_number": "108",
          "date_filed": "1992-01-14T00:00:00-05:00",
          "attachments": null,
          "url": "https://www.courtlistener.com/docket/5802165/108/pc-kaiser-v-sacramento-county/",
          "recap_pdf_url": null,
          "pacer_doc_id": null,
          "description": "JOINT STATUS REPORT by plaintiffs & defendants (old) (Entered: 01/14/1992)"
        },
        {
          "row_number": 11,
          "id": 8808209,
          "entry_number": "109",
          "date_filed": "1992-02-04T00:00:00-05:00",
          "attachments": null,
          "url": "https://www.courtlistener.com/docket/5802165/109/pc-kaiser-v-sacramento-county/",
          "recap_pdf_url": null,
          "pacer_doc_id": null,
          "description": "EXHIBIT list by plaintiff to status conference (old) (Entered: 02/04/1992)"
        },
        {
          "row_number": 13,
          "id": 8808210,
          "entry_number": "110",
          "date_filed": "1992-02-05T00:00:00-05:00",
          "attachments": null,
          "url": "https://www.courtlistener.com/docket/5802165/110/pc-kaiser-v-sacramento-county/",
          "recap_pdf_url": null,
          "pacer_doc_id": null,
          "description": "MINUTES of joint discovery conference: Court to issue order (old) (Entered: 02/05/1992)"
        },
        {
          "row_number": 14,
          "id": 8808211,
          "entry_number": "111",
          "date_filed": "1992-02-12T00:00:00-05:00",
          "attachments": null,
          "url": "https://www.courtlistener.com/docket/5802165/111/pc-kaiser-v-sacramento-county/",
          "recap_pdf_url": null,
          "pacer_doc_id": null,
          "description": "DISCOVERY ORDER by Judge Gregory G. Hollows; see order for more details; pursuant to the 2/5/92 court-conducted discovery conference. (cc: all counsel) (old) (Entered: 02/12/1992)"
        },
        {
          "row_number": 15,
          "id": 8808213,
          "entry_number": "112",
          "date_filed": "1992-03-09T00:00:00-05:00",
          "attachments": null,
          "url": "https://www.courtlistener.com/docket/5802165/112/pc-kaiser-v-sacramento-county/",
          "recap_pdf_url": null,
          "pacer_doc_id": null,
          "description": "STIPULATION re: order filed 2/12/92 on class definition; see stipulation for modification [111-1]; IT IS SO ORDERED by Gregory G Hollows on 3/19/92 (old) Modified on 03/23/1992 (Entered: 03/10/1992)"
        },
        {
          "row_number": 16,
          "id": 8808214,
          "entry_number": "113",
          "date_filed": "1992-03-12T00:00:00-05:00",
          "attachments": null,
          "url": "https://www.courtlistener.com/docket/5802165/113/pc-kaiser-v-sacramento-county/",
          "recap_pdf_url": null,
          "pacer_doc_id": null,
          "description": "PROOF OF SERVICE by defendant of stipulation order re class definition [112-1] (old) Modified on 03/12/1992 (Entered: 03/12/1992)"
        },
        {
          "row_number": 17,
          "id": 8808215,
          "entry_number": "114",
          "date_filed": "1992-03-12T00:00:00-05:00",
          "attachments": null,
          "url": "https://www.courtlistener.com/docket/5802165/114/pc-kaiser-v-sacramento-county/",
          "recap_pdf_url": null,
          "pacer_doc_id": null,
          "description": "DECLARATION OF MAILING by defendant of stipulation order re class definition [112-1] (old) (Entered: 03/12/1992)"
        },
        {
          "row_number": 18,
          "id": 8808216,
          "entry_number": "115",
          "date_filed": "1992-03-16T00:00:00-05:00",
          "attachments": null,
          "url": "https://www.courtlistener.com/docket/5802165/115/pc-kaiser-v-sacramento-county/",
          "recap_pdf_url": null,
          "pacer_doc_id": null,
          "description": "STIPULATION and ORDER by Judge Gregory G. Hollows ORDERING: lodged stipulation GRANTED;[0-1] modification of Discovery Order is accepted; SEE STIPULATION for more details (cc: all counsel) (old) (Entered: 03/16/1992)"
        },
        {
          "row_number": 21,
          "id": 8808219,
          "entry_number": "118",
          "date_filed": "1992-04-08T00:00:00-04:00",
          "attachments": null,
          "url": "https://www.courtlistener.com/docket/5802165/118/pc-kaiser-v-sacramento-county/",
          "recap_pdf_url": null,
          "pacer_doc_id": null,
          "description": "NOTICE by plaintiff Joseph Walter Kaiser of association of attorney S. Lynne Klein (old) (Entered: 04/08/1992)"
        },
        {
          "row_number": 22,
          "id": 8808220,
          "entry_number": "119",
          "date_filed": "1992-04-10T00:00:00-04:00",
          "attachments": null,
          "url": "https://www.courtlistener.com/docket/5802165/119/pc-kaiser-v-sacramento-county/",
          "recap_pdf_url": null,
          "pacer_doc_id": null,
          "description": "NOTICE by defendants RE: Quarterly Report (old) (Entered: 04/10/1992)"
        },
        {
          "row_number": 24,
          "id": 8808221,
          "entry_number": "120",
          "date_filed": "1992-05-15T00:00:00-04:00",
          "attachments": null,
          "url": "https://www.courtlistener.com/docket/5802165/120/pc-kaiser-v-sacramento-county/",
          "recap_pdf_url": null,
          "pacer_doc_id": null,
          "description": "REQUEST by plaintiffs for entry for inspection; requesting tour to be 6/2/92 at 9:00 (old) (Entered: 05/15/1992)"
        },
        {
          "row_number": 25,
          "id": 8808222,
          "entry_number": "121",
          "date_filed": "1992-06-05T00:00:00-04:00",
          "attachments": null,
          "url": "https://www.courtlistener.com/docket/5802165/121/pc-kaiser-v-sacramento-county/",
          "recap_pdf_url": null,
          "pacer_doc_id": null,
          "description": "REQUEST by plaintiffs for a status conference (old) (Entered: 06/05/1992)"
        },
        {
          "row_number": 27,
          "id": 8808224,
          "entry_number": "123",
          "date_filed": "1992-06-16T00:00:00-04:00",
          "attachments": null,
          "url": "https://www.courtlistener.com/docket/5802165/123/pc-kaiser-v-sacramento-county/",
          "recap_pdf_url": null,
          "pacer_doc_id": null,
          "description": "PLAINTIFFS EXHIBIT REPLY to defendants status conference statement (old) (Entered: 06/16/1992)"
        },
        {
          "row_number": 28,
          "id": 8808225,
          "entry_number": "124",
          "date_filed": "1992-06-24T00:00:00-04:00",
          "attachments": null,
          "url": "https://www.courtlistener.com/docket/5802165/124/pc-kaiser-v-sacramento-county/",
          "recap_pdf_url": null,
          "pacer_doc_id": null,
          "description": "ORDER by Judge Gregory G Hollows ORDERING: status conference is set for 7/9/92 at 10:00 in courtroom 5 (cc: all counsel) (old) (Entered: 06/24/1992)"
        },
        {
          "row_number": 29,
          "id": 8808226,
          "entry_number": "125",
          "date_filed": "1992-06-25T00:00:00-04:00",
          "attachments": null,
          "url": "https://www.courtlistener.com/docket/5802165/125/pc-kaiser-v-sacramento-county/",
          "recap_pdf_url": null,
          "pacer_doc_id": null,
          "description": "SUPPLEMENTAL status conference statement by defendants [122-1] (old) (Entered: 06/26/1992)"
        },
        {
          "row_number": 30,
          "id": 8808227,
          "entry_number": "126",
          "date_filed": "1992-06-30T00:00:00-04:00",
          "attachments": null,
          "url": "https://www.courtlistener.com/docket/5802165/126/pc-kaiser-v-sacramento-county/",
          "recap_pdf_url": null,
          "pacer_doc_id": null,
          "description": "MAIL Returned [124-2] addressed to S Lynne Klein AT 2950 Portage Bay Avenue, #414, Davis, CA 95616 (old) (Entered: 07/06/1992)"
        },
        {
          "row_number": 33,
          "id": 8808228,
          "entry_number": "129",
          "date_filed": "1992-07-09T00:00:00-04:00",
          "attachments": null,
          "url": "https://www.courtlistener.com/docket/5802165/129/pc-kaiser-v-sacramento-county/",
          "recap_pdf_url": null,
          "pacer_doc_id": null,
          "description": "MINUTES of 7/9/92 status conference ; Scheduling conf held ; as to the cost of copy work - the county is ordered to turn the documents over to plaintiffs immediately, the cost of these copies will be determined at the end of these proceedings. If the plaintiffs lose on the medical issues, the court will assess cost of copies and order the plaintiffs to reimburse the county $4000. If the plaintiffs win, the court will order the plaintiffs to pay the cost of the copies off the top of whatever finacial award they receive. (old) (Entered: 07/16/1992)"
        },
        {
          "row_number": 35,
          "id": 8808231,
          "entry_number": "130",
          "date_filed": "1992-07-28T00:00:00-04:00",
          "attachments": null,
          "url": "https://www.courtlistener.com/docket/5802165/130/pc-kaiser-v-sacramento-county/",
          "recap_pdf_url": null,
          "pacer_doc_id": null,
          "description": "MAIL Returned addressed to S Lynne Klein [127-1] (old) (Entered: 07/28/1992)"
        },
        {
          "row_number": 36,
          "id": 8808232,
          "entry_number": "131",
          "date_filed": "1992-07-30T00:00:00-04:00",
          "attachments": null,
          "url": "https://www.courtlistener.com/docket/5802165/131/pc-kaiser-v-sacramento-county/",
          "recap_pdf_url": null,
          "pacer_doc_id": null,
          "description": "NOTICE OF MOTION AND MOTION by plaintiffs for interim award of attorneys' fees, costs, and expenses (old) (Entered: 07/31/1992)"
        },
        {
          "row_number": 37,
          "id": 8808233,
          "entry_number": "132",
          "date_filed": "1992-07-30T00:00:00-04:00",
          "attachments": null,
          "url": "https://www.courtlistener.com/docket/5802165/132/pc-kaiser-v-sacramento-county/",
          "recap_pdf_url": null,
          "pacer_doc_id": null,
          "description": "MEMORANDUM by plaintiffs in SUPPORT of motion for interim award of attorneys' fees, costs, and expenses [131-1] (old) (Entered: 07/31/1992)"
        },
        {
          "row_number": 38,
          "id": 8808234,
          "entry_number": "133",
          "date_filed": "1992-07-30T00:00:00-04:00",
          "attachments": null,
          "url": "https://www.courtlistener.com/docket/5802165/133/pc-kaiser-v-sacramento-county/",
          "recap_pdf_url": null,
          "pacer_doc_id": null,
          "description": "DECLARATIONS and exhibits in SUPPORTof plaintiff's motion for interim award of attorneys' fees, costs, and expenses [131-1] (old) (Entered: 07/31/1992)"
        },
        {
          "row_number": 289,
          "id": 8808235,
          "entry_number": null,
          "date_filed": "1992-07-30T00:00:00-04:00",
          "attachments": null,
          "url": "https://www.courtlistener.com",
          "recap_pdf_url": null,
          "pacer_doc_id": null,
          "description": "LODGED proposed order for award of interim attorneys' fees, costs, and expenses (old)"
        },
        {
          "row_number": 40,
          "id": 8808238,
          "entry_number": "135",
          "date_filed": "1992-07-31T00:00:00-04:00",
          "attachments": null,
          "url": "https://www.courtlistener.com/docket/5802165/135/pc-kaiser-v-sacramento-county/",
          "recap_pdf_url": null,
          "pacer_doc_id": null,
          "description": "SUPPLEMENTAL EXHIBIT list by plaintiff Joseph Walter Kaiser (old) (Entered: 08/03/1992)"
        },
        {
          "row_number": 41,
          "id": 8808239,
          "entry_number": "136",
          "date_filed": "1992-08-03T00:00:00-04:00",
          "attachments": null,
          "url": "https://www.courtlistener.com/docket/5802165/136/pc-kaiser-v-sacramento-county/",
          "recap_pdf_url": null,
          "pacer_doc_id": null,
          "description": "SUPPLEMENTAL EXHIBIT list by plaintiff Joseph Walter Kaiser in support of motion for preliminary injunction (old) (Entered: 08/03/1992)"
        },
        {
          "row_number": 43,
          "id": 8808242,
          "entry_number": "138",
          "date_filed": "1992-09-15T00:00:00-04:00",
          "attachments": null,
          "url": "https://www.courtlistener.com/docket/5802165/138/pc-kaiser-v-sacramento-county/",
          "recap_pdf_url": null,
          "pacer_doc_id": null,
          "description": "DEPOSITION of Paul W Comiskey taken on the following date(s): 8/20/92 (old) (Entered: 09/16/1992)"
        },
        {
          "row_number": 44,
          "id": 8808243,
          "entry_number": "139",
          "date_filed": "1992-09-15T00:00:00-04:00",
          "attachments": null,
          "url": "https://www.courtlistener.com/docket/5802165/139/pc-kaiser-v-sacramento-county/",
          "recap_pdf_url": null,
          "pacer_doc_id": null,
          "description": "DEPOSITION of Richard P Herman taken on the following date(s): 8/28/92 (old) (Entered: 09/16/1992)"
        },
        {
          "row_number": 47,
          "id": 8808245,
          "entry_number": "141",
          "date_filed": "1992-09-15T00:00:00-04:00",
          "attachments": null,
          "url": "https://www.courtlistener.com/docket/5802165/141/pc-kaiser-v-sacramento-county/",
          "recap_pdf_url": null,
          "pacer_doc_id": null,
          "description": "RESPONSE by defendant Sacramento County to motion for interim award of attorneys' fees, costs, and expenses [131-1] (old) (Entered: 09/16/1992)"
        },
        {
          "row_number": 48,
          "id": 8808246,
          "entry_number": "142",
          "date_filed": "1992-09-18T00:00:00-04:00",
          "attachments": null,
          "url": "https://www.courtlistener.com/docket/5802165/142/pc-kaiser-v-sacramento-county/",
          "recap_pdf_url": null,
          "pacer_doc_id": null,
          "description": "LETTER to court from defendants cnsl enclosing a faxed version of corrections to Mr. Hermans depo which was filed w/ the court 9/15/92 in conjunction w/ plfts req for interim attys fees (old) (Entered: 09/18/1992)"
        },
        {
          "row_number": 49,
          "id": 8808247,
          "entry_number": "143",
          "date_filed": "1992-09-18T00:00:00-04:00",
          "attachments": null,
          "url": "https://www.courtlistener.com/docket/5802165/143/pc-kaiser-v-sacramento-county/",
          "recap_pdf_url": null,
          "pacer_doc_id": null,
          "description": "REPLY by plaintiff to response to motion for interim award of attorneys' fees, costs, and expenses [131-1] (old) (Entered: 09/18/1992)"
        },
        {
          "row_number": 50,
          "id": 8808248,
          "entry_number": "144",
          "date_filed": "1992-09-23T00:00:00-04:00",
          "attachments": null,
          "url": "https://www.courtlistener.com/docket/5802165/144/pc-kaiser-v-sacramento-county/",
          "recap_pdf_url": null,
          "pacer_doc_id": null,
          "description": "MOTION for leave to modify discovery set for 10/22/92 at 10:00 in courtroom 6 before WBS (old) (Entered: 09/23/1992)"
        },
        {
          "row_number": 51,
          "id": 8808249,
          "entry_number": "145",
          "date_filed": "1992-09-24T00:00:00-04:00",
          "attachments": null,
          "url": "https://www.courtlistener.com/docket/5802165/145/pc-kaiser-v-sacramento-county/",
          "recap_pdf_url": null,
          "pacer_doc_id": null,
          "description": "MINUTES of motions; denying motion for preliminary injunction [134-1], that the motion for interim award of attorneys' fees, costs, and expenses [131-1] is submitted (old) (Entered: 09/25/1992)"
        },
        {
          "row_number": 52,
          "id": 8808250,
          "entry_number": "146",
          "date_filed": "1992-09-29T00:00:00-04:00",
          "attachments": null,
          "url": "https://www.courtlistener.com/docket/5802165/146/pc-kaiser-v-sacramento-county/",
          "recap_pdf_url": null,
          "pacer_doc_id": null,
          "description": "ORDER by Judge Gregory G. Hollows for attorney fees plfts are entitled to interim attys fees for all wk done in connection w/ the floor sleeping injunction, attys fees in addition to those awarded here must await a final resolution of the claims; plfts shall therefore submit a revised billing of attys fee demonstrating that the fees they seek are related to the floor sleeping issue w/i 20 days; dfts will have 10 days thereafter to oppose the amt of attys fees sought; the ct will expeditiously make a final ruling on the interim amt w/o further hearing (cc: all counsel) (old) (Entered: 09/29/1992)"
        },
        {
          "row_number": 53,
          "id": 8808251,
          "entry_number": "147",
          "date_filed": "1992-10-08T00:00:00-04:00",
          "attachments": null,
          "url": "https://www.courtlistener.com/docket/5802165/147/pc-kaiser-v-sacramento-county/",
          "recap_pdf_url": null,
          "pacer_doc_id": null,
          "description": "RESPONSE IN OPPOSITION by defendant Sacramento County, defendant Glen Craig to motion for leave to modify discovery order and request for immediate status conference [144-1] (old) (Entered: 10/09/1992)"
        },
        {
          "row_number": 55,
          "id": 8808253,
          "entry_number": "149",
          "date_filed": "1992-10-09T00:00:00-04:00",
          "attachments": null,
          "url": "https://www.courtlistener.com/docket/5802165/149/pc-kaiser-v-sacramento-county/",
          "recap_pdf_url": null,
          "pacer_doc_id": null,
          "description": "SUPPLEMENTAL MEMO RE REQUEST TO MODIFY DISCOVERY ORDER AND EXHIBITS by plaintiff Joseph Walter Kaiser, Matthew Sasson, Michael Fred Rodriguez, Marie Helen Bellinger, Debra A Wiese (old) (Entered: 10/15/1992)"
        },
        {
          "row_number": 57,
          "id": 8808254,
          "entry_number": "150",
          "date_filed": "1992-10-19T00:00:00-04:00",
          "attachments": null,
          "url": "https://www.courtlistener.com/docket/5802165/150/pc-kaiser-v-sacramento-county/",
          "recap_pdf_url": null,
          "pacer_doc_id": null,
          "description": "REVISED BILLING by plaintiff (old) (Entered: 10/21/1992)"
        },
        {
          "row_number": 59,
          "id": 8808256,
          "entry_number": "152",
          "date_filed": "1992-10-20T00:00:00-04:00",
          "attachments": null,
          "url": "https://www.courtlistener.com/docket/5802165/152/pc-kaiser-v-sacramento-county/",
          "recap_pdf_url": null,
          "pacer_doc_id": null,
          "description": "EX PARTE MOTION by plaintiff for protective order (old) (Entered: 10/21/1992)"
        },
        {
          "row_number": 61,
          "id": 8808257,
          "entry_number": "154",
          "date_filed": "1992-10-21T00:00:00-04:00",
          "attachments": null,
          "url": "https://www.courtlistener.com/docket/5802165/154/pc-kaiser-v-sacramento-county/",
          "recap_pdf_url": null,
          "pacer_doc_id": null,
          "description": "MINUTES of mtn discover order granting in part and denying in part motion for leave to modify discovery (old) (Entered: 10/27/1992)"
        },
        {
          "row_number": 60,
          "id": 8808258,
          "entry_number": "153",
          "date_filed": "1992-10-22T00:00:00-04:00",
          "attachments": null,
          "url": "https://www.courtlistener.com/docket/5802165/153/pc-kaiser-v-sacramento-county/",
          "recap_pdf_url": null,
          "pacer_doc_id": null,
          "description": "ORDER by Judge Gregory G. Hollows Discovery ddl 12/1/92 plfts shall be limited to 25 depos; dfts shall be limited to taking 15 depos; if dfts file mtn for sumjgm, mtn shall be filed not later than 12/30/92; dfts rply shall be filed no later than 1/11/93; subject to the modifications in this order, the cts scheduling order (12/6/91) and the cts disc order (2/12/92) remain in full effect (cc: all counsel) (old) (Entered: 10/22/1992)"
        },
        {
          "row_number": 62,
          "id": 8808259,
          "entry_number": "155",
          "date_filed": "1992-10-27T00:00:00-05:00",
          "attachments": null,
          "url": "https://www.courtlistener.com/docket/5802165/155/pc-kaiser-v-sacramento-county/",
          "recap_pdf_url": null,
          "pacer_doc_id": null,
          "description": "REQUEST by plaintiff for judicial notice (old) (Entered: 10/27/1992)"
        },
        {
          "row_number": 63,
          "id": 8808260,
          "entry_number": "156",
          "date_filed": "1992-10-28T00:00:00-05:00",
          "attachments": null,
          "url": "https://www.courtlistener.com/docket/5802165/156/pc-kaiser-v-sacramento-county/",
          "recap_pdf_url": null,
          "pacer_doc_id": null,
          "description": "RESPONSE IN OPPOSITION by defendant Sacramento County to motion for interim award of attorneys' fees, costs, and expenses [131-1] (old) (Entered: 10/28/1992)"
        },
        {
          "row_number": 64,
          "id": 8808261,
          "entry_number": "157",
          "date_filed": "1992-10-28T00:00:00-05:00",
          "attachments": null,
          "url": "https://www.courtlistener.com/docket/5802165/157/pc-kaiser-v-sacramento-county/",
          "recap_pdf_url": null,
          "pacer_doc_id": null,
          "description": "OBJECTIONS by defendant Sacramento County to request to take judicial notice [155-1] (old) (Entered: 10/29/1992)"
        },
        {
          "row_number": 65,
          "id": 8808262,
          "entry_number": "158",
          "date_filed": "1992-11-02T00:00:00-05:00",
          "attachments": null,
          "url": "https://www.courtlistener.com/docket/5802165/158/pc-kaiser-v-sacramento-county/",
          "recap_pdf_url": null,
          "pacer_doc_id": null,
          "description": "NTC OF MTN AND MOTION by plaintiff to compel production and to modify discovery order to be heard 12/10/92 at 10:00 (old) (Entered: 11/03/1992)"
        },
        {
          "row_number": 66,
          "id": 8808263,
          "entry_number": "159",
          "date_filed": "1992-11-17T00:00:00-05:00",
          "attachments": null,
          "url": "https://www.courtlistener.com/docket/5802165/159/pc-kaiser-v-sacramento-county/",
          "recap_pdf_url": null,
          "pacer_doc_id": null,
          "description": "STATUS MEMORANDUM AND REQUEST FOR SETTLEMENT CONFERENCE by plaintiffs (old) (Entered: 11/18/1992)"
        },
        {
          "row_number": 68,
          "id": 8808264,
          "entry_number": "160",
          "date_filed": "1992-11-23T00:00:00-05:00",
          "attachments": null,
          "url": "https://www.courtlistener.com/docket/5802165/160/pc-kaiser-v-sacramento-county/",
          "recap_pdf_url": null,
          "pacer_doc_id": null,
          "description": "NOTICE of Non-Waiver by defendant Sacramento County (old) (Entered: 11/24/1992)"
        },
        {
          "row_number": 70,
          "id": 8808266,
          "entry_number": "162",
          "date_filed": "1992-11-25T00:00:00-05:00",
          "attachments": null,
          "url": "https://www.courtlistener.com/docket/5802165/162/pc-kaiser-v-sacramento-county/",
          "recap_pdf_url": null,
          "pacer_doc_id": null,
          "description": "ORDER by Judge Gregory G Hollows granting motion for interim award of attorneys' fees, costs, and expenses: within 20 days defendants shall pay plaintiffs' counsel the amount of $4,780 [131-1] (cc: all counsel) (old) (Entered: 11/25/1992)"
        },
        {
          "row_number": 71,
          "id": 8808267,
          "entry_number": "163",
          "date_filed": "1992-12-04T00:00:00-05:00",
          "attachments": null,
          "url": "https://www.courtlistener.com/docket/5802165/163/pc-kaiser-v-sacramento-county/",
          "recap_pdf_url": null,
          "pacer_doc_id": null,
          "description": "MAIL Returned [161-1] addressed to S Lynne Klein (old) (Entered: 12/07/1992)"
        },
        {
          "row_number": 75,
          "id": 8808269,
          "entry_number": "167",
          "date_filed": "1992-12-04T00:00:00-05:00",
          "attachments": null,
          "url": "https://www.courtlistener.com/docket/5802165/167/pc-kaiser-v-sacramento-county/",
          "recap_pdf_url": null,
          "pacer_doc_id": null,
          "description": "NOTICE by plaintiffs of hearing SETTING the hearing on motion to compel production and to modify discovery order to be heard 12/10/92 at 10:00 [158-1] to 10:30 on 12/10/92 ok per courtroom deputy (old) (Entered: 12/09/1992)"
        },
        {
          "row_number": 76,
          "id": 8808270,
          "entry_number": "168",
          "date_filed": "1992-12-04T00:00:00-05:00",
          "attachments": null,
          "url": "https://www.courtlistener.com/docket/5802165/168/pc-kaiser-v-sacramento-county/",
          "recap_pdf_url": null,
          "pacer_doc_id": null,
          "description": "DECLARATION by plaintiff's lead counsel Richard Herman re unsigned stipulation re discovery dispute (old) (Entered: 12/09/1992)"
        },
        {
          "row_number": 74,
          "id": 8808272,
          "entry_number": "166",
          "date_filed": "1992-12-07T00:00:00-05:00",
          "attachments": null,
          "url": "https://www.courtlistener.com/docket/5802165/166/pc-kaiser-v-sacramento-county/",
          "recap_pdf_url": null,
          "pacer_doc_id": null,
          "description": "RESPONSE by defendants to plaintiffs stipulation re: discovery disagreements (old) (Entered: 12/08/1992)"
        },
        {
          "row_number": 79,
          "id": 8808273,
          "entry_number": "170",
          "date_filed": "1992-12-10T00:00:00-05:00",
          "attachments": null,
          "url": "https://www.courtlistener.com/docket/5802165/170/pc-kaiser-v-sacramento-county/",
          "recap_pdf_url": null,
          "pacer_doc_id": null,
          "description": "MINUTES of 12/10/92 before Magistrate Gregory Hollows; hearing on plaintiff's motion for discovery [158-1]; court gives tentative ruling on motion, stating it is leaning towards denying the motion, but will issue an order after hearing (old) (Entered: 12/11/1992)"
        },
        {
          "row_number": 77,
          "id": 8808274,
          "entry_number": "169",
          "date_filed": "1992-12-11T00:00:00-05:00",
          "attachments": null,
          "url": "https://www.courtlistener.com/docket/5802165/169/pc-kaiser-v-sacramento-county/",
          "recap_pdf_url": null,
          "pacer_doc_id": null,
          "description": "ORDER by Judge Gregory G Hollows ORDERING: as parties have indicated a settlement conference may be helpful, Magistrate John F Moulds will conduct a settlement conference; parties are DIRECTED to contact Magistrate Moulds' courtroom clerk to arrange a settlement conference date (cc: all counsel) (old) (Entered: 12/11/1992)"
        },
        {
          "row_number": 80,
          "id": 8808276,
          "entry_number": "171",
          "date_filed": "1992-12-14T00:00:00-05:00",
          "attachments": null,
          "url": "https://www.courtlistener.com/docket/5802165/171/pc-kaiser-v-sacramento-county/",
          "recap_pdf_url": null,
          "pacer_doc_id": null,
          "description": "MOTION by defendants for partial summary judgment ; NO HEARING SET; MEMORANDUM of points and authorities IN SUPPORT of motion (old) (Entered: 12/15/1992)"
        },
        {
          "row_number": 82,
          "id": 8808278,
          "entry_number": "173",
          "date_filed": "1992-12-14T00:00:00-05:00",
          "attachments": null,
          "url": "https://www.courtlistener.com/docket/5802165/173/pc-kaiser-v-sacramento-county/",
          "recap_pdf_url": null,
          "pacer_doc_id": null,
          "description": "REQUEST for Judicial notice by defendants (old) (Entered: 12/15/1992)"
        },
        {
          "row_number": 85,
          "id": 8808280,
          "entry_number": "176",
          "date_filed": "1992-12-15T00:00:00-05:00",
          "attachments": null,
          "url": "https://www.courtlistener.com/docket/5802165/176/pc-kaiser-v-sacramento-county/",
          "recap_pdf_url": null,
          "pacer_doc_id": null,
          "description": "PROOF OF SERVICE by defendant of motion for partial summary judgment [171-1] (old) (Entered: 12/16/1992)"
        },
        {
          "row_number": 86,
          "id": 8808281,
          "entry_number": "177",
          "date_filed": "1992-12-15T00:00:00-05:00",
          "attachments": null,
          "url": "https://www.courtlistener.com/docket/5802165/177/pc-kaiser-v-sacramento-county/",
          "recap_pdf_url": null,
          "pacer_doc_id": null,
          "description": "PROOF OF SERVICE by defendant of request [173-1], exhibits [172-1], motion for partial summary judgment [171-1] on counsel Paul W Comiskey (old) (Entered: 12/16/1992)"
        },
        {
          "row_number": 292,
          "id": 8808283,
          "entry_number": null,
          "date_filed": "1992-12-16T00:00:00-05:00",
          "attachments": null,
          "url": "https://www.courtlistener.com",
          "recap_pdf_url": null,
          "pacer_doc_id": null,
          "description": "LODGED deposition transcripts of Erick Brown, Fred Campbell, Barbara Cotton, Daniel Delany, Cpt Edward Doonan, Robert Doran, William Green Jr., Valerian Kobza, Howard Machida, W. Raymond Nelson and Paul Smith (old)"
        },
        {
          "row_number": 293,
          "id": 8808284,
          "entry_number": null,
          "date_filed": "1992-12-16T00:00:00-05:00",
          "attachments": null,
          "url": "https://www.courtlistener.com",
          "recap_pdf_url": null,
          "pacer_doc_id": null,
          "description": "LODGED REQUEST by defendants for order permitting filing or lodging of documents in conjunction with motion for summary judgment (old)"
        },
        {
          "row_number": 93,
          "id": 8808286,
          "entry_number": "183",
          "date_filed": "1992-12-16T00:00:00-05:00",
          "attachments": null,
          "url": "https://www.courtlistener.com/docket/5802165/183/pc-kaiser-v-sacramento-county/",
          "recap_pdf_url": null,
          "pacer_doc_id": null,
          "description": "MAIL Returned: order continuing evidentiary hearing [169-1] addressed to plaintiff Joseph Walter Kaiser (old) (Entered: 12/17/1992)"
        },
        {
          "row_number": 88,
          "id": 8808288,
          "entry_number": "179",
          "date_filed": "1992-12-17T00:00:00-05:00",
          "attachments": null,
          "url": "https://www.courtlistener.com/docket/5802165/179/pc-kaiser-v-sacramento-county/",
          "recap_pdf_url": null,
          "pacer_doc_id": null,
          "description": "ORDER AFTER HEARING by Judge Gregory G Hollows ORDERING: motion to compel production and to modify discovery order to be heard 12/10/92 at 10:00 [158-1] is GRANTED IN PART and DENIED IN PART as follows; plaintiff's request number 46 and 49 are DENIED AS MOOT; request number 52 is DENIED WITHOUT PREJUDICE to a renewal at pretrial conference; plaintiff's request re documents related to recent jail death, motion is DENIED WITHOUT PREJUDICE to a renewal at pretrial conference; plaintiff's request re death review committee reports is GRANTED; dfts shall provide plaintiffs with copies of these documents within 15 days of the date of this order; in all other respects, plaintiff's motion is DENIED (cc: all counsel) (old) (Entered: 12/17/1992)"
        },
        {
          "row_number": 294,
          "id": 8808290,
          "entry_number": null,
          "date_filed": "1992-12-17T00:00:00-05:00",
          "attachments": null,
          "url": "https://www.courtlistener.com",
          "recap_pdf_url": null,
          "pacer_doc_id": null,
          "description": "LODGED REQUEST for order permitting lodging of transcripts of Drs. Kantor, Rundle and Rosenblum under the PROTECTIVE ORDER issued by court, IN CONJUNCTION with filing of motion for summary judgment (old)"
        },
        {
          "row_number": 94,
          "id": 8808291,
          "entry_number": "184",
          "date_filed": "1992-12-17T00:00:00-05:00",
          "attachments": null,
          "url": "https://www.courtlistener.com/docket/5802165/184/pc-kaiser-v-sacramento-county/",
          "recap_pdf_url": null,
          "pacer_doc_id": null,
          "description": "NOTICE by defendant OF LODGING of depositions of Drs Kantor, Rundle and Rosenblum UNDER SEAL per COURT ORDER (old) (Entered: 12/17/1992)"
        },
        {
          "row_number": 296,
          "id": 8808293,
          "entry_number": null,
          "date_filed": "1992-12-17T00:00:00-05:00",
          "attachments": null,
          "url": "https://www.courtlistener.com",
          "recap_pdf_url": null,
          "pacer_doc_id": null,
          "description": "LODGED deposition of Dr. Runder UNDER SEAL per COURT ORDER (old)"
        },
        {
          "row_number": 95,
          "id": 8808295,
          "entry_number": "185",
          "date_filed": "1992-12-18T00:00:00-05:00",
          "attachments": null,
          "url": "https://www.courtlistener.com/docket/5802165/185/pc-kaiser-v-sacramento-county/",
          "recap_pdf_url": null,
          "pacer_doc_id": null,
          "description": "REQUEST by defendants for ORDER SHORTENING TIME for hearing on dfts' request for continuance of hearing on plaintiff's motion for attorney's fees (old) (Entered: 12/21/1992)"
        },
        {
          "row_number": 97,
          "id": 8808297,
          "entry_number": "187",
          "date_filed": "1992-12-22T00:00:00-05:00",
          "attachments": null,
          "url": "https://www.courtlistener.com/docket/5802165/187/pc-kaiser-v-sacramento-county/",
          "recap_pdf_url": null,
          "pacer_doc_id": null,
          "description": "NOTICE by defendants Sacramento County and Glen Craig OF LODGING of deposition of Dr Edmund M Bernauer in 3 volumes (old) (Entered: 12/23/1992)"
        },
        {
          "row_number": 298,
          "id": 8808298,
          "entry_number": null,
          "date_filed": "1992-12-22T00:00:00-05:00",
          "attachments": null,
          "url": "https://www.courtlistener.com",
          "recap_pdf_url": null,
          "pacer_doc_id": null,
          "description": "LODGED deposition of Dr Edmund Bernauer Volume I (old)"
        },
        {
          "row_number": 299,
          "id": 8808299,
          "entry_number": null,
          "date_filed": "1992-12-22T00:00:00-05:00",
          "attachments": null,
          "url": "https://www.courtlistener.com",
          "recap_pdf_url": null,
          "pacer_doc_id": null,
          "description": "LODGED deposition of Dr Edmund Bernauer Volume II (old)"
        },
        {
          "row_number": 300,
          "id": 8808300,
          "entry_number": null,
          "date_filed": "1992-12-22T00:00:00-05:00",
          "attachments": null,
          "url": "https://www.courtlistener.com",
          "recap_pdf_url": null,
          "pacer_doc_id": null,
          "description": "LODGED deposition of Dr Edmund Bernauer Volume III and exhibits (old)"
        },
        {
          "row_number": 98,
          "id": 8808301,
          "entry_number": "188",
          "date_filed": "1992-12-22T00:00:00-05:00",
          "attachments": null,
          "url": "https://www.courtlistener.com/docket/5802165/188/pc-kaiser-v-sacramento-county/",
          "recap_pdf_url": null,
          "pacer_doc_id": null,
          "description": "MOTION by defendant Sacramento County and Glen Craig for partial summary judgment re access to opportunity to exercise ; NO HEARING SET (old) (Entered: 12/23/1992)"
        },
        {
          "row_number": 99,
          "id": 8808302,
          "entry_number": "189",
          "date_filed": "1992-12-22T00:00:00-05:00",
          "attachments": null,
          "url": "https://www.courtlistener.com/docket/5802165/189/pc-kaiser-v-sacramento-county/",
          "recap_pdf_url": null,
          "pacer_doc_id": null,
          "description": "MEMORANDUM OF POINTS AND AUTHORITIES by dfts Sacramento County and Glen Craig IN SUPPORT of motion for partial summary judgment re access to to exercise [188-1] (old) (Entered: 12/23/1992)"
        },
        {
          "row_number": 101,
          "id": 8808303,
          "entry_number": "190",
          "date_filed": "1992-12-23T00:00:00-05:00",
          "attachments": null,
          "url": "https://www.courtlistener.com/docket/5802165/190/pc-kaiser-v-sacramento-county/",
          "recap_pdf_url": null,
          "pacer_doc_id": null,
          "description": "ORDER by Judge Gregory G Hollows ORDERING: dfts are GRANTED leave to file transcripts of Drs. Kantor, Rundle and Rosenblum UNDER SEAL pursuant to court's PROTECTIVE ORDER in conjunction with dfts' motion for summary judgment (cc: all counsel) (old) (Entered: 12/23/1992)"
        },
        {
          "row_number": 102,
          "id": 8808304,
          "entry_number": "191",
          "date_filed": "1992-12-23T00:00:00-05:00",
          "attachments": null,
          "url": "https://www.courtlistener.com/docket/5802165/191/pc-kaiser-v-sacramento-county/",
          "recap_pdf_url": null,
          "pacer_doc_id": null,
          "description": "ORDER by Judge Gregory G Hollows ORDERING: dfts are GRANTED leave to file/lodge transcripts and other documents in conjunction with the filing of their motion for summary judgment (cc: all counsel) (old) (Entered: 12/23/1992)"
        },
        {
          "row_number": 103,
          "id": 8808305,
          "entry_number": "192",
          "date_filed": "1992-12-28T00:00:00-05:00",
          "attachments": null,
          "url": "https://www.courtlistener.com/docket/5802165/192/pc-kaiser-v-sacramento-county/",
          "recap_pdf_url": null,
          "pacer_doc_id": null,
          "description": "ORDER by Judge Gregory G Hollows ORDERING: dfts' request to continue hearing [186-1] on motion for attorney fees set for 1/15/93 at 11:00 before GGH in courtroom 10 [182-1] is GRANTED; hearing is CONTINUED to 1/28/93 10:00 or as set by stipulation of both parties (cc: all counsel) (old) (Entered: 12/28/1992)"
        },
        {
          "row_number": 104,
          "id": 8808306,
          "entry_number": "193",
          "date_filed": "1992-12-29T00:00:00-05:00",
          "attachments": null,
          "url": "https://www.courtlistener.com/docket/5802165/193/pc-kaiser-v-sacramento-county/",
          "recap_pdf_url": null,
          "pacer_doc_id": null,
          "description": "MAIL Returned: order [179-1] addressed to counsel for plaintiff Joseph Walter Kaiser (S. Lynne Klein) (old) (Entered: 12/29/1992)"
        },
        {
          "row_number": 105,
          "id": 8808307,
          "entry_number": "194",
          "date_filed": "1992-12-30T00:00:00-05:00",
          "attachments": null,
          "url": "https://www.courtlistener.com/docket/5802165/194/pc-kaiser-v-sacramento-county/",
          "recap_pdf_url": null,
          "pacer_doc_id": null,
          "description": "MAIL Returned [178-2] addressed to plaintiff Joseph Walter Kaiser (old) (Entered: 12/31/1992)"
        },
        {
          "row_number": 106,
          "id": 8808308,
          "entry_number": "195",
          "date_filed": "1992-12-30T00:00:00-05:00",
          "attachments": null,
          "url": "https://www.courtlistener.com/docket/5802165/195/pc-kaiser-v-sacramento-county/",
          "recap_pdf_url": null,
          "pacer_doc_id": null,
          "description": "MAIL Returned [192-1] addressed to counsel S. Lynn Klein for plaintiff Joseph Walter Kaiser (old) (Entered: 12/31/1992)"
        },
        {
          "row_number": 107,
          "id": 8808309,
          "entry_number": "196",
          "date_filed": "1992-12-31T00:00:00-05:00",
          "attachments": null,
          "url": "https://www.courtlistener.com/docket/5802165/196/pc-kaiser-v-sacramento-county/",
          "recap_pdf_url": null,
          "pacer_doc_id": null,
          "description": "MAIL Returned [174-2] addressed to counsel S. Lynne Klein for plaintiff Joseph Walter Kaiser (old) (Entered: 12/31/1992)"
        },
        {
          "row_number": 108,
          "id": 8808310,
          "entry_number": "197",
          "date_filed": "1992-12-31T00:00:00-05:00",
          "attachments": null,
          "url": "https://www.courtlistener.com/docket/5802165/197/pc-kaiser-v-sacramento-county/",
          "recap_pdf_url": null,
          "pacer_doc_id": null,
          "description": "MAIL Returned [190-1] addressed to counsel S. Lynne Klein for plaintiff Joseph Walter Kaiser (old) (Entered: 12/31/1992)"
        },
        {
          "row_number": 109,
          "id": 8808311,
          "entry_number": "198",
          "date_filed": "1992-12-31T00:00:00-05:00",
          "attachments": null,
          "url": "https://www.courtlistener.com/docket/5802165/198/pc-kaiser-v-sacramento-county/",
          "recap_pdf_url": null,
          "pacer_doc_id": null,
          "description": "NOTICE by plaintiff OF LODGING of depositions (old) (Entered: 12/31/1992)"
        },
        {
          "row_number": 301,
          "id": 8808312,
          "entry_number": null,
          "date_filed": "1992-12-31T00:00:00-05:00",
          "attachments": null,
          "url": "https://www.courtlistener.com",
          "recap_pdf_url": null,
          "pacer_doc_id": null,
          "description": "LODGED DEPOSITIONS of Mary Chubbuck, Dr. Frank Rundle, Dr. Elizabeth Kantor, Dr. Alvin Rosenblum, Dr. Ed Bernauer, Lt. Lushbaugh, Capt. Denham, Dr. Johnson, Lt. Corbett, Lt. Dickerson, Cathy Faringer, and Paul Bailer (old)"
        },
        {
          "row_number": 110,
          "id": 8808313,
          "entry_number": "199",
          "date_filed": "1992-12-31T00:00:00-05:00",
          "attachments": null,
          "url": "https://www.courtlistener.com/docket/5802165/199/pc-kaiser-v-sacramento-county/",
          "recap_pdf_url": null,
          "pacer_doc_id": null,
          "description": "OPPOSITION by plaintiff to motions for summary judgment [188-1] and [171-1] (old) (Entered: 12/31/1992)"
        },
        {
          "row_number": 113,
          "id": 8808314,
          "entry_number": "200",
          "date_filed": "1992-12-31T00:00:00-05:00",
          "attachments": null,
          "url": "https://www.courtlistener.com/docket/5802165/200/pc-kaiser-v-sacramento-county/",
          "recap_pdf_url": null,
          "pacer_doc_id": null,
          "description": "SUPPLEMENTAL DECLARATIONS in support of OPPOSITION to dfts' motion for summary judgment [199-1] (old) (Entered: 12/31/1992)"
        },
        {
          "row_number": 114,
          "id": 8808315,
          "entry_number": "201",
          "date_filed": "1992-12-31T00:00:00-05:00",
          "attachments": null,
          "url": "https://www.courtlistener.com/docket/5802165/201/pc-kaiser-v-sacramento-county/",
          "recap_pdf_url": null,
          "pacer_doc_id": null,
          "description": "PLAINTIFFS' EXHIBITS in support of OPPOSITION to dfts' motion for summary judgment [199-1] and request to take judicial notice (old) (Entered: 12/31/1992)"
        },
        {
          "row_number": 115,
          "id": 8808316,
          "entry_number": "202",
          "date_filed": "1993-01-04T00:00:00-05:00",
          "attachments": null,
          "url": "https://www.courtlistener.com/docket/5802165/202/pc-kaiser-v-sacramento-county/",
          "recap_pdf_url": null,
          "pacer_doc_id": null,
          "description": "NOTICE by defendants OF LODGING of deposition transcripts (old) (Entered: 01/04/1993)"
        },
        {
          "row_number": 302,
          "id": 8808317,
          "entry_number": null,
          "date_filed": "1993-01-04T00:00:00-05:00",
          "attachments": null,
          "url": "https://www.courtlistener.com",
          "recap_pdf_url": null,
          "pacer_doc_id": null,
          "description": "LODGED deposition transcripts of Paul Bailey, Donald Corbett, Barbara Cotton, Robert Denham, Mark Dickerson, Catherine Faringer, Glendon Craig, Richard Johnson, Charles Lushbaugh, Robert Smith, and Dr. Richard Yarvis (old)"
        },
        {
          "row_number": 116,
          "id": 8808318,
          "entry_number": "203",
          "date_filed": "1993-01-04T00:00:00-05:00",
          "attachments": null,
          "url": "https://www.courtlistener.com/docket/5802165/203/pc-kaiser-v-sacramento-county/",
          "recap_pdf_url": null,
          "pacer_doc_id": null,
          "description": "SUPPLEMENT TO DESIGNATION OF EXPERT WITNESSES by defendants Sacramento County and Glen Craig (old) (Entered: 01/04/1993)"
        },
        {
          "row_number": 303,
          "id": 8808319,
          "entry_number": null,
          "date_filed": "1993-01-05T00:00:00-05:00",
          "attachments": null,
          "url": "https://www.courtlistener.com",
          "recap_pdf_url": null,
          "pacer_doc_id": null,
          "description": "LODGED REQUEST by dfts FOR STAY of courts order re interim attorney's fees (old)"
        },
        {
          "row_number": 117,
          "id": 8808320,
          "entry_number": "204",
          "date_filed": "1993-01-05T00:00:00-05:00",
          "attachments": null,
          "url": "https://www.courtlistener.com/docket/5802165/204/pc-kaiser-v-sacramento-county/",
          "recap_pdf_url": null,
          "pacer_doc_id": null,
          "description": "NOTICE by defendants OF LODGING of deposition transcript of Wendell Phillips (old) (Entered: 01/08/1993)"
        },
        {
          "row_number": 118,
          "id": 8808321,
          "entry_number": "205",
          "date_filed": "1993-01-05T00:00:00-05:00",
          "attachments": null,
          "url": "https://www.courtlistener.com/docket/5802165/205/pc-kaiser-v-sacramento-county/",
          "recap_pdf_url": null,
          "pacer_doc_id": null,
          "description": "OBJECTIONS by defendants to plaintiff's second motion for interim attorney fees [182-1]; REQUEST for reconsideration of courts order of 9/24/92 re interim attorney;s fees; MEMORANDUM of points and authorities in support (old) (Entered: 01/08/1993)"
        },
        {
          "row_number": 304,
          "id": 8808322,
          "entry_number": null,
          "date_filed": "1993-01-05T00:00:00-05:00",
          "attachments": null,
          "url": "https://www.courtlistener.com",
          "recap_pdf_url": null,
          "pacer_doc_id": null,
          "description": "LODGED DEPOSITION of Wendell Phillips (old)"
        },
        {
          "row_number": 128,
          "id": 8808323,
          "entry_number": "214",
          "date_filed": "1993-01-05T00:00:00-05:00",
          "attachments": null,
          "url": "https://www.courtlistener.com/docket/5802165/214/pc-kaiser-v-sacramento-county/",
          "recap_pdf_url": null,
          "pacer_doc_id": null,
          "description": "MAIL Returned: stipulation and order [137-1] addressed to counsel S. Lynne Klein (old) (Entered: 01/22/1993)"
        },
        {
          "row_number": 119,
          "id": 8808324,
          "entry_number": "206",
          "date_filed": "1993-01-07T00:00:00-05:00",
          "attachments": null,
          "url": "https://www.courtlistener.com/docket/5802165/206/pc-kaiser-v-sacramento-county/",
          "recap_pdf_url": null,
          "pacer_doc_id": null,
          "description": "OPPOSITION by plaintiffs to dfts' motion for partial summary judgment re access to opportunity to exercise [188-1] (old) (Entered: 01/08/1993)"
        },
        {
          "row_number": 120,
          "id": 8808325,
          "entry_number": "207",
          "date_filed": "1993-01-07T00:00:00-05:00",
          "attachments": null,
          "url": "https://www.courtlistener.com/docket/5802165/207/pc-kaiser-v-sacramento-county/",
          "recap_pdf_url": null,
          "pacer_doc_id": null,
          "description": "PLAINTIFFS SUPPLEMENTAL DECLARATION re OPPOSITION to motion for partial summary judgment [206-1] (old) (Entered: 01/08/1993)"
        },
        {
          "row_number": 122,
          "id": 8808326,
          "entry_number": "209",
          "date_filed": "1993-01-08T00:00:00-05:00",
          "attachments": null,
          "url": "https://www.courtlistener.com/docket/5802165/209/pc-kaiser-v-sacramento-county/",
          "recap_pdf_url": null,
          "pacer_doc_id": null,
          "description": "MINUTES of Settlement Conference of 1/8/93: further Settlement conference SET 1/14/93 2:00 in chambers (old) (Entered: 01/13/1993)"
        },
        {
          "row_number": 125,
          "id": 8808329,
          "entry_number": "211",
          "date_filed": "1993-01-15T00:00:00-05:00",
          "attachments": null,
          "url": "https://www.courtlistener.com/docket/5802165/211/pc-kaiser-v-sacramento-county/",
          "recap_pdf_url": null,
          "pacer_doc_id": null,
          "description": "LETTER to court from counsel for defendants re: alledged discrepancies in court order of 12/16/92 (old) (Entered: 01/19/1993)"
        },
        {
          "row_number": 126,
          "id": 8808330,
          "entry_number": "212",
          "date_filed": "1993-01-20T00:00:00-05:00",
          "attachments": null,
          "url": "https://www.courtlistener.com/docket/5802165/212/pc-kaiser-v-sacramento-county/",
          "recap_pdf_url": null,
          "pacer_doc_id": null,
          "description": "MINUTES of 1/20/93: Settlement Conference held 1/20/93 ; with appearances by counsel; matter is SETTLED (old) (Entered: 01/21/1993)"
        },
        {
          "row_number": 129,
          "id": 8808331,
          "entry_number": "215",
          "date_filed": "1993-01-20T00:00:00-05:00",
          "attachments": null,
          "url": "https://www.courtlistener.com/docket/5802165/215/pc-kaiser-v-sacramento-county/",
          "recap_pdf_url": null,
          "pacer_doc_id": null,
          "description": "NOTICE by counsel for plaintiffs Richard Herman of change of address to Richard P Herman, Suite 330, 24012 Calle de la Plata, Laguna Hills, California 92653 (old) (Entered: 01/25/1993)"
        },
        {
          "row_number": 127,
          "id": 8808332,
          "entry_number": "213",
          "date_filed": "1993-01-21T00:00:00-05:00",
          "attachments": null,
          "url": "https://www.courtlistener.com/docket/5802165/213/pc-kaiser-v-sacramento-county/",
          "recap_pdf_url": null,
          "pacer_doc_id": null,
          "description": "MAIL Returned: order [191-1] addressed to counsel S. Lynne Klein (old) (Entered: 01/22/1993)"
        },
        {
          "row_number": 132,
          "id": 8808335,
          "entry_number": "218",
          "date_filed": "1993-01-29T00:00:00-05:00",
          "attachments": null,
          "url": "https://www.courtlistener.com/docket/5802165/218/pc-kaiser-v-sacramento-county/",
          "recap_pdf_url": null,
          "pacer_doc_id": null,
          "description": "ORDER by Judge Gregory G Hollows ORDERING: within 5 days of the date of this order, defendants shall post copies of this order with the attached consent decree and notice on every floor level of Sac County Jail and Rio Sosumnes Correctional Center Branch Jail Facility; within 5 days of the date of this order, counsel for plaintiffs shall serve all named plaintiffs with a copy of this order and all attachments by mail at the last address of record; this matter is scheduled for hearing 3/1/93 10:00 Ctrm 10 GGH; In-court hearing SET 3/1/93 10:00 ; (cc: all counsel) (old) (Entered: 01/29/1993)"
        },
        {
          "row_number": 135,
          "id": 8808336,
          "entry_number": "220",
          "date_filed": "1993-02-01T00:00:00-05:00",
          "attachments": null,
          "url": "https://www.courtlistener.com/docket/5802165/220/pc-kaiser-v-sacramento-county/",
          "recap_pdf_url": null,
          "pacer_doc_id": null,
          "description": "MAIL Returned: order [217-1] addressed to counsel S Lynne Klein (old) (Entered: 02/02/1993)"
        },
        {
          "row_number": 136,
          "id": 8808337,
          "entry_number": "221",
          "date_filed": "1993-02-01T00:00:00-05:00",
          "attachments": null,
          "url": "https://www.courtlistener.com/docket/5802165/221/pc-kaiser-v-sacramento-county/",
          "recap_pdf_url": null,
          "pacer_doc_id": null,
          "description": "MAIL Returned: order [216-1] addressed to counsel S Lynne Klein (old) (Entered: 02/02/1993)"
        },
        {
          "row_number": 137,
          "id": 8808339,
          "entry_number": "222",
          "date_filed": "1993-02-08T00:00:00-05:00",
          "attachments": null,
          "url": "https://www.courtlistener.com/docket/5802165/222/pc-kaiser-v-sacramento-county/",
          "recap_pdf_url": null,
          "pacer_doc_id": null,
          "description": "NOTICE by plaintiffs of complaince (old) (Entered: 02/08/1993)"
        },
        {
          "row_number": 138,
          "id": 8808340,
          "entry_number": "223",
          "date_filed": "1993-02-24T00:00:00-05:00",
          "attachments": null,
          "url": "https://www.courtlistener.com/docket/5802165/223/pc-kaiser-v-sacramento-county/",
          "recap_pdf_url": null,
          "pacer_doc_id": null,
          "description": "PROOF OF POSTING by defendants OF NOTICE BY COURT (old) (Entered: 02/25/1993)"
        },
        {
          "row_number": 142,
          "id": 8808344,
          "entry_number": "227",
          "date_filed": "1993-04-22T00:00:00-04:00",
          "attachments": null,
          "url": "https://www.courtlistener.com/docket/5802165/227/pc-kaiser-v-sacramento-county/",
          "recap_pdf_url": null,
          "pacer_doc_id": null,
          "description": "NOTICE by plaintiff's counsel Richard Herman of change of address to 30 Forest Ave in Laguna Beach, CA 92651; cc atty maintenance (old) (Entered: 04/23/1993)"
        },
        {
          "row_number": 143,
          "id": 8808345,
          "entry_number": "228",
          "date_filed": "1998-07-15T00:00:00-04:00",
          "attachments": null,
